"No.","Time","Source","Destination","Protocol","Length","Info"
"30","351.879378724","192.168.2.2","192.168.1.2","TCP","74","5001  >  50846 [SYN, ACK] Seq=0 Ack=1 Win=43440 Len=0 MSS=1460 SACK_PERM=1 TSval=3517451990 TSecr=2564530322 WS=512"
"33","351.883958598","192.168.2.2","192.168.1.2","TCP","66","5001  >  50846 [ACK] Seq=1 Ack=25 Win=43520 Len=0 TSval=3517451995 TSecr=2564530327"
"35","351.884803999","192.168.2.2","192.168.1.2","TCP","66","5001  >  50846 [ACK] Seq=1 Ack=7265 Win=39936 Len=0 TSval=3517451995 TSecr=2564530327"
"37","351.909309293","192.168.2.2","192.168.1.2","TCP","66","5001  >  50846 [ACK] Seq=1 Ack=18849 Win=37376 Len=0 TSval=3517452020 TSecr=2564530328"
"39","351.957247163","192.168.2.2","192.168.1.2","TCP","66","5001  >  50846 [ACK] Seq=1 Ack=28985 Win=38400 Len=0 TSval=3517452068 TSecr=2564530328"
"41","351.999729994","192.168.2.2","192.168.1.2","TCP","66","5001  >  50846 [ACK] Seq=1 Ack=30433 Win=42496 Len=0 TSval=3517452110 TSecr=2564530342"
"43","352.006254394","192.168.2.2","192.168.1.2","TCP","66","5001  >  50846 [ACK] Seq=1 Ack=47809 Win=34816 Len=0 TSval=3517452117 TSecr=2564530352"
"45","352.078312518","192.168.2.2","192.168.1.2","TCP","66","5001  >  50846 [ACK] Seq=1 Ack=50705 Win=41984 Len=0 TSval=3517452189 TSecr=2564530352"
"47","352.090991328","192.168.2.2","192.168.1.2","TCP","66","5001  >  50846 [ACK] Seq=1 Ack=53601 Win=48128 Len=0 TSval=3517452202 TSecr=2564530371"
"49","352.102734587","192.168.2.2","192.168.1.2","TCP","66","5001  >  50846 [ACK] Seq=1 Ack=67385 Win=75776 Len=0 TSval=3517452213 TSecr=2564530400"
"51","352.160540270","192.168.2.2","192.168.1.2","TCP","66","5001  >  50846 [ACK] Seq=1 Ack=71729 Win=84480 Len=0 TSval=3517452271 TSecr=2564530442"
"53","352.178483592","192.168.2.2","192.168.1.2","TCP","66","5001  >  50846 [ACK] Seq=1 Ack=72425 Win=87552 Len=0 TSval=3517452289 TSecr=2564530443"
"55","352.182099674","192.168.2.2","192.168.1.2","TCP","66","5001  >  50846 [ACK] Seq=1 Ack=82561 Win=92672 Len=0 TSval=3517452293 TSecr=2564530449"
"57","352.224176916","192.168.2.2","192.168.1.2","TCP","66","5001  >  50846 [ACK] Seq=1 Ack=91249 Win=93184 Len=0 TSval=3517452335 TSecr=2564530521"
"59","352.260496983","192.168.2.2","192.168.1.2","TCP","66","5001  >  50846 [ACK] Seq=1 Ack=94145 Win=96256 Len=0 TSval=3517452371 TSecr=2564530534"
"61","352.273202161","192.168.2.2","192.168.1.2","TCP","66","5001  >  50846 [ACK] Seq=1 Ack=115865 Win=86528 Len=0 TSval=3517452384 TSecr=2564530545"
"63","352.363305247","192.168.2.2","192.168.1.2","TCP","66","5001  >  50846 [ACK] Seq=1 Ack=137585 Win=86528 Len=0 TSval=3517452474 TSecr=2564530546"
"65","352.454380552","192.168.2.2","192.168.1.2","TCP","66","5001  >  50846 [ACK] Seq=1 Ack=154961 Win=131072 Len=0 TSval=3517452565 TSecr=2564530603"
"67","352.526908896","192.168.2.2","192.168.1.2","TCP","66","5001  >  50846 [ACK] Seq=1 Ack=159305 Win=139776 Len=0 TSval=3517452638 TSecr=2564530621"
"69","352.545480624","192.168.2.2","192.168.1.2","TCP","66","5001  >  50846 [ACK] Seq=1 Ack=175233 Win=171520 Len=0 TSval=3517452656 TSecr=2564530625"
"71","352.612099157","192.168.2.2","192.168.1.2","TCP","66","5001  >  50846 [ACK] Seq=1 Ack=181025 Win=182784 Len=0 TSval=3517452723 TSecr=2564530667"
"73","352.636156382","192.168.2.2","192.168.1.2","TCP","66","5001  >  50846 [ACK] Seq=1 Ack=190401 Win=201728 Len=0 TSval=3517452747 TSecr=2564530703"
"75","352.675299337","192.168.2.2","192.168.1.2","TCP","66","5001  >  50846 [ACK] Seq=1 Ack=201985 Win=224768 Len=0 TSval=3517452786 TSecr=2564530716"
"77","352.723526680","192.168.2.2","192.168.1.2","TCP","66","5001  >  50846 [ACK] Seq=1 Ack=202745 Win=227840 Len=0 TSval=3517452834 TSecr=2564530806"
"79","352.727201562","192.168.2.2","192.168.1.2","TCP","66","5001  >  50846 [ACK] Seq=1 Ack=223017 Win=268288 Len=0 TSval=3517452838 TSecr=2564530806"
"81","352.811595463","192.168.2.2","192.168.1.2","TCP","66","5001  >  50846 [ACK] Seq=1 Ack=224465 Win=271360 Len=0 TSval=3517452922 TSecr=2564530897"
"83","352.818362768","192.168.2.2","192.168.1.2","TCP","66","5001  >  50846 [ACK] Seq=1 Ack=246185 Win=303616 Len=0 TSval=3517452929 TSecr=2564530897"
"85","352.908509558","192.168.2.2","192.168.1.2","TCP","66","5001  >  50846 [ACK] Seq=1 Ack=267905 Win=303616 Len=0 TSval=3517453019 TSecr=2564530897"
"87","352.999580926","192.168.2.2","192.168.1.2","TCP","66","5001  >  50846 [ACK] Seq=1 Ack=289625 Win=303616 Len=0 TSval=3517453110 TSecr=2564530970"
"89","353.090644790","192.168.2.2","192.168.1.2","TCP","66","5001  >  50846 [ACK] Seq=1 Ack=311345 Win=346624 Len=0 TSval=3517453201 TSecr=2564531079"
"91","353.181723722","192.168.2.2","192.168.1.2","TCP","66","5001  >  50846 [ACK] Seq=1 Ack=333065 Win=390144 Len=0 TSval=3517453292 TSecr=2564531118"
"93","353.272379053","192.168.2.2","192.168.1.2","TCP","66","5001  >  50846 [ACK] Seq=1 Ack=354785 Win=433664 Len=0 TSval=3517453383 TSecr=2564531170"
"95","353.363500956","192.168.2.2","192.168.1.2","TCP","66","5001  >  50846 [ACK] Seq=1 Ack=376505 Win=477184 Len=0 TSval=3517453474 TSecr=2564531261"
"97","353.453586461","192.168.2.2","192.168.1.2","TCP","66","5001  >  50846 [ACK] Seq=1 Ack=398225 Win=481280 Len=0 TSval=3517453564 TSecr=2564531351"
"99","353.544692216","192.168.2.2","192.168.1.2","TCP","66","5001  >  50846 [ACK] Seq=1 Ack=419945 Win=481280 Len=0 TSval=3517453655 TSecr=2564531442"
"101","353.635763482","192.168.2.2","192.168.1.2","TCP","66","5001  >  50846 [ACK] Seq=1 Ack=441665 Win=481280 Len=0 TSval=3517453746 TSecr=2564531533"
"103","353.726910722","192.168.2.2","192.168.1.2","TCP","66","5001  >  50846 [ACK] Seq=1 Ack=463385 Win=481280 Len=0 TSval=3517453838 TSecr=2564531624"
"105","353.817056258","192.168.2.2","192.168.1.2","TCP","66","5001  >  50846 [ACK] Seq=1 Ack=485105 Win=481280 Len=0 TSval=3517453928 TSecr=2564531715"
"107","353.907770119","192.168.2.2","192.168.1.2","TCP","66","5001  >  50846 [ACK] Seq=1 Ack=506825 Win=481280 Len=0 TSval=3517454018 TSecr=2564531806"
"109","353.998772158","192.168.2.2","192.168.1.2","TCP","66","5001  >  50846 [ACK] Seq=1 Ack=528545 Win=481280 Len=0 TSval=3517454109 TSecr=2564531896"
"111","354.089849859","192.168.2.2","192.168.1.2","TCP","66","5001  >  50846 [ACK] Seq=1 Ack=550265 Win=481280 Len=0 TSval=3517454201 TSecr=2564531987"
"113","354.180934030","192.168.2.2","192.168.1.2","TCP","66","5001  >  50846 [ACK] Seq=1 Ack=571985 Win=481280 Len=0 TSval=3517454292 TSecr=2564532078"
"115","354.271206686","192.168.2.2","192.168.1.2","TCP","66","5001  >  50846 [ACK] Seq=1 Ack=618321 Win=481280 Len=0 TSval=3517454382 TSecr=2564532170"
"117","354.464927524","192.168.2.2","192.168.1.2","TCP","66","5001  >  50846 [ACK] Seq=1 Ack=664657 Win=481280 Len=0 TSval=3517454576 TSecr=2564532350"
"119","354.659515735","192.168.2.2","192.168.1.2","TCP","66","5001  >  50846 [ACK] Seq=1 Ack=710993 Win=481280 Len=0 TSval=3517454770 TSecr=2564532533"
"121","354.852474917","192.168.2.2","192.168.1.2","TCP","66","5001  >  50846 [ACK] Seq=1 Ack=757329 Win=572928 Len=0 TSval=3517454963 TSecr=2564532714"
"123","355.047008807","192.168.2.2","192.168.1.2","TCP","66","5001  >  50846 [ACK] Seq=1 Ack=803665 Win=572928 Len=0 TSval=3517455158 TSecr=2564532908"
"125","355.240079659","192.168.2.2","192.168.1.2","TCP","66","5001  >  50846 [ACK] Seq=1 Ack=850001 Win=572928 Len=0 TSval=3517455351 TSecr=2564533102"
"127","355.433866621","192.168.2.2","192.168.1.2","TCP","66","5001  >  50846 [ACK] Seq=1 Ack=896337 Win=572928 Len=0 TSval=3517455545 TSecr=2564533295"
"129","355.627856583","192.168.2.2","192.168.1.2","TCP","66","5001  >  50846 [ACK] Seq=1 Ack=944121 Win=572928 Len=0 TSval=3517455739 TSecr=2564533490"
"131","355.828130295","192.168.2.2","192.168.1.2","TCP","66","5001  >  50846 [ACK] Seq=1 Ack=991905 Win=572928 Len=0 TSval=3517455939 TSecr=2564533683"
"133","356.027763099","192.168.2.2","192.168.1.2","TCP","66","5001  >  50846 [ACK] Seq=1 Ack=1039689 Win=572928 Len=0 TSval=3517456138 TSecr=2564533877"
"135","356.227869199","192.168.2.2","192.168.1.2","TCP","66","5001  >  50846 [ACK] Seq=1 Ack=1087473 Win=572928 Len=0 TSval=3517456339 TSecr=2564534070"
"137","356.427195350","192.168.2.2","192.168.1.2","TCP","66","5001  >  50846 [ACK] Seq=1 Ack=1135257 Win=572928 Len=0 TSval=3517456538 TSecr=2564534271"
"139","356.626930376","192.168.2.2","192.168.1.2","TCP","66","5001  >  50846 [ACK] Seq=1 Ack=1183041 Win=572928 Len=0 TSval=3517456738 TSecr=2564534470"
"141","356.826809249","192.168.2.2","192.168.1.2","TCP","66","5001  >  50846 [ACK] Seq=1 Ack=1230825 Win=572928 Len=0 TSval=3517456938 TSecr=2564534671"
"143","357.027151902","192.168.2.2","192.168.1.2","TCP","66","5001  >  50846 [ACK] Seq=1 Ack=1278609 Win=572928 Len=0 TSval=3517457138 TSecr=2564534870"
"145","357.227004130","192.168.2.2","192.168.1.2","TCP","66","5001  >  50846 [ACK] Seq=1 Ack=1326393 Win=572928 Len=0 TSval=3517457338 TSecr=2564535070"
"147","357.426251822","192.168.2.2","192.168.1.2","TCP","66","5001  >  50846 [ACK] Seq=1 Ack=1374177 Win=572928 Len=0 TSval=3517457537 TSecr=2564535269"
"149","357.626106863","192.168.2.2","192.168.1.2","TCP","66","5001  >  50846 [ACK] Seq=1 Ack=1377073 Win=578560 Len=0 TSval=3517457737 TSecr=2564535869"
"151","357.638800599","192.168.2.2","192.168.1.2","TCP","66","5001  >  50846 [ACK] Seq=1 Ack=1379969 Win=584704 Len=0 TSval=3517457749 TSecr=2564535880"
"153","357.650546764","192.168.2.2","192.168.1.2","TCP","66","5001  >  50846 [ACK] Seq=1 Ack=1382865 Win=590336 Len=0 TSval=3517457761 TSecr=2564536069"
"155","357.663309362","192.168.2.2","192.168.1.2","TCP","66","5001  >  50846 [ACK] Seq=1 Ack=1385761 Win=594944 Len=0 TSval=3517457774 TSecr=2564536082"
"157","357.675090852","192.168.2.2","192.168.1.2","TCP","66","5001  >  50846 [ACK] Seq=1 Ack=1388657 Win=594944 Len=0 TSval=3517457786 TSecr=2564536093"
"159","357.686877901","192.168.2.2","192.168.1.2","TCP","66","5001  >  50846 [ACK] Seq=1 Ack=1391553 Win=594944 Len=0 TSval=3517457798 TSecr=2564536106"
"161","357.698812711","192.168.2.2","192.168.1.2","TCP","66","5001  >  50846 [ACK] Seq=1 Ack=1394449 Win=594944 Len=0 TSval=3517457810 TSecr=2564536118"
"163","357.711338453","192.168.2.2","192.168.1.2","TCP","66","5001  >  50846 [ACK] Seq=1 Ack=1397345 Win=594944 Len=0 TSval=3517457822 TSecr=2564536130"
"165","357.723064069","192.168.2.2","192.168.1.2","TCP","66","5001  >  50846 [ACK] Seq=1 Ack=1400241 Win=594944 Len=0 TSval=3517457834 TSecr=2564536142"
"167","357.735850389","192.168.2.2","192.168.1.2","TCP","66","5001  >  50846 [ACK] Seq=1 Ack=1403137 Win=594944 Len=0 TSval=3517457847 TSecr=2564536154"
"169","357.747587558","192.168.2.2","192.168.1.2","TCP","66","5001  >  50846 [ACK] Seq=1 Ack=1406033 Win=594944 Len=0 TSval=3517457858 TSecr=2564536166"
"171","357.759393933","192.168.2.2","192.168.1.2","TCP","66","5001  >  50846 [ACK] Seq=1 Ack=1408929 Win=594944 Len=0 TSval=3517457870 TSecr=2564536179"
"173","357.772148104","192.168.2.2","192.168.1.2","TCP","66","5001  >  50846 [ACK] Seq=1 Ack=1411825 Win=594944 Len=0 TSval=3517457883 TSecr=2564536190"
"175","357.783827173","192.168.2.2","192.168.1.2","TCP","66","5001  >  50846 [ACK] Seq=1 Ack=1414721 Win=594944 Len=0 TSval=3517457895 TSecr=2564536202"
"177","357.795686621","192.168.2.2","192.168.1.2","TCP","66","5001  >  50846 [ACK] Seq=1 Ack=1417617 Win=594944 Len=0 TSval=3517457906 TSecr=2564536215"
"179","357.808339480","192.168.2.2","192.168.1.2","TCP","66","5001  >  50846 [ACK] Seq=1 Ack=1420513 Win=594944 Len=0 TSval=3517457919 TSecr=2564536227"
"181","357.820077049","192.168.2.2","192.168.1.2","TCP","66","5001  >  50846 [ACK] Seq=1 Ack=1421961 Win=595456 Len=0 TSval=3517457931 TSecr=2564536238"
"183","357.826001888","192.168.2.2","192.168.1.2","TCP","66","5001  >  50846 [ACK] Seq=1 Ack=1424857 Win=595456 Len=0 TSval=3517457937 TSecr=2564536243"
"185","357.838725861","192.168.2.2","192.168.1.2","TCP","66","5001  >  50846 [ACK] Seq=1 Ack=1427753 Win=595456 Len=0 TSval=3517457949 TSecr=2564536253"
"187","357.850460425","192.168.2.2","192.168.1.2","TCP","66","5001  >  50846 [ACK] Seq=1 Ack=1430649 Win=595456 Len=0 TSval=3517457961 TSecr=2564536269"
"189","357.862331884","192.168.2.2","192.168.1.2","TCP","66","5001  >  50846 [ACK] Seq=1 Ack=1433545 Win=595456 Len=0 TSval=3517457973 TSecr=2564536281"
"191","357.874952285","192.168.2.2","192.168.1.2","TCP","66","5001  >  50846 [ACK] Seq=1 Ack=1436441 Win=595456 Len=0 TSval=3517457986 TSecr=2564536293"
"193","357.886728885","192.168.2.2","192.168.1.2","TCP","66","5001  >  50846 [ACK] Seq=1 Ack=1439337 Win=595456 Len=0 TSval=3517457997 TSecr=2564536305"
"195","357.899489908","192.168.2.2","192.168.1.2","TCP","66","5001  >  50846 [ACK] Seq=1 Ack=1442233 Win=595456 Len=0 TSval=3517458010 TSecr=2564536318"
"197","357.910762938","192.168.2.2","192.168.1.2","TCP","66","5001  >  50846 [ACK] Seq=1 Ack=1445129 Win=595456 Len=0 TSval=3517458021 TSecr=2564536329"
"199","357.922945299","192.168.2.2","192.168.1.2","TCP","66","5001  >  50846 [ACK] Seq=1 Ack=1448025 Win=595456 Len=0 TSval=3517458034 TSecr=2564536342"
"201","357.935873696","192.168.2.2","192.168.1.2","TCP","66","5001  >  50846 [ACK] Seq=1 Ack=1450921 Win=595456 Len=0 TSval=3517458047 TSecr=2564536353"
"203","357.947464108","192.168.2.2","192.168.1.2","TCP","66","5001  >  50846 [ACK] Seq=1 Ack=1453817 Win=595456 Len=0 TSval=3517458058 TSecr=2564536366"
"205","357.959215594","192.168.2.2","192.168.1.2","TCP","66","5001  >  50846 [ACK] Seq=1 Ack=1456713 Win=595456 Len=0 TSval=3517458070 TSecr=2564536379"
"207","357.971913578","192.168.2.2","192.168.1.2","TCP","66","5001  >  50846 [ACK] Seq=1 Ack=1459609 Win=595456 Len=0 TSval=3517458083 TSecr=2564536390"
"209","357.983697663","192.168.2.2","192.168.1.2","TCP","66","5001  >  50846 [ACK] Seq=1 Ack=1462505 Win=595456 Len=0 TSval=3517458094 TSecr=2564536402"
"211","357.995580203","192.168.2.2","192.168.1.2","TCP","66","5001  >  50846 [ACK] Seq=1 Ack=1465401 Win=595456 Len=0 TSval=3517458106 TSecr=2564536415"
"213","358.008164014","192.168.2.2","192.168.1.2","TCP","66","5001  >  50846 [ACK] Seq=1 Ack=1468297 Win=595456 Len=0 TSval=3517458119 TSecr=2564536426"
"216","358.025823637","192.168.2.2","192.168.1.2","TCP","66","5001  >  50846 [ACK] Seq=1 Ack=1472641 Win=595456 Len=0 TSval=3517458137 TSecr=2564536438"
"218","358.038080517","192.168.2.2","192.168.1.2","TCP","66","5001  >  50846 [ACK] Seq=1 Ack=1475537 Win=595456 Len=0 TSval=3517458149 TSecr=2564536451"
"220","358.050832553","192.168.2.2","192.168.1.2","TCP","66","5001  >  50846 [ACK] Seq=1 Ack=1478433 Win=595456 Len=0 TSval=3517458162 TSecr=2564536469"
"222","358.062545886","192.168.2.2","192.168.1.2","TCP","66","5001  >  50846 [ACK] Seq=1 Ack=1481329 Win=595456 Len=0 TSval=3517458173 TSecr=2564536481"
"224","358.074352715","192.168.2.2","192.168.1.2","TCP","66","5001  >  50846 [ACK] Seq=1 Ack=1484225 Win=595456 Len=0 TSval=3517458185 TSecr=2564536494"
"226","358.087048875","192.168.2.2","192.168.1.2","TCP","66","5001  >  50846 [ACK] Seq=1 Ack=1487121 Win=595456 Len=0 TSval=3517458198 TSecr=2564536505"
"228","358.098828817","192.168.2.2","192.168.1.2","TCP","66","5001  >  50846 [ACK] Seq=1 Ack=1490017 Win=595456 Len=0 TSval=3517458210 TSecr=2564536517"
"230","358.110614263","192.168.2.2","192.168.1.2","TCP","66","5001  >  50846 [ACK] Seq=1 Ack=1492913 Win=595456 Len=0 TSval=3517458221 TSecr=2564536530"
"232","358.123385964","192.168.2.2","192.168.1.2","TCP","66","5001  >  50846 [ACK] Seq=1 Ack=1495809 Win=595456 Len=0 TSval=3517458234 TSecr=2564536542"
"234","358.135052522","192.168.2.2","192.168.1.2","TCP","66","5001  >  50846 [ACK] Seq=1 Ack=1498705 Win=595456 Len=0 TSval=3517458246 TSecr=2564536553"
"236","358.146980906","192.168.2.2","192.168.1.2","TCP","66","5001  >  50846 [ACK] Seq=1 Ack=1501601 Win=595456 Len=0 TSval=3517458258 TSecr=2564536566"
"238","358.159614101","192.168.2.2","192.168.1.2","TCP","66","5001  >  50846 [ACK] Seq=1 Ack=1504497 Win=595456 Len=0 TSval=3517458270 TSecr=2564536578"
"240","358.171373189","192.168.2.2","192.168.1.2","TCP","66","5001  >  50846 [ACK] Seq=1 Ack=1507393 Win=595456 Len=0 TSval=3517458282 TSecr=2564536590"
"242","358.184028305","192.168.2.2","192.168.1.2","TCP","66","5001  >  50846 [ACK] Seq=1 Ack=1510289 Win=595456 Len=0 TSval=3517458295 TSecr=2564536602"
"244","358.195787814","192.168.2.2","192.168.1.2","TCP","66","5001  >  50846 [ACK] Seq=1 Ack=1513185 Win=595456 Len=0 TSval=3517458306 TSecr=2564536614"
"246","358.207548607","192.168.2.2","192.168.1.2","TCP","66","5001  >  50846 [ACK] Seq=1 Ack=1516081 Win=595456 Len=0 TSval=3517458318 TSecr=2564536627"
"248","358.220254526","192.168.2.2","192.168.1.2","TCP","66","5001  >  50846 [ACK] Seq=1 Ack=1518977 Win=595456 Len=0 TSval=3517458331 TSecr=2564536638"
"250","358.232019927","192.168.2.2","192.168.1.2","TCP","66","5001  >  50846 [ACK] Seq=1 Ack=1521873 Win=595456 Len=0 TSval=3517458343 TSecr=2564536650"
"252","358.243871278","192.168.2.2","192.168.1.2","TCP","66","5001  >  50846 [ACK] Seq=1 Ack=1524769 Win=595456 Len=0 TSval=3517458355 TSecr=2564536663"
"254","358.256516885","192.168.2.2","192.168.1.2","TCP","66","5001  >  50846 [ACK] Seq=1 Ack=1527665 Win=595456 Len=0 TSval=3517458367 TSecr=2564536675"
"256","358.268252530","192.168.2.2","192.168.1.2","TCP","66","5001  >  50846 [ACK] Seq=1 Ack=1530561 Win=595456 Len=0 TSval=3517458379 TSecr=2564536687"
"258","358.280179242","192.168.2.2","192.168.1.2","TCP","66","5001  >  50846 [ACK] Seq=1 Ack=1533457 Win=595456 Len=0 TSval=3517458391 TSecr=2564536699"
"261","358.298670279","192.168.2.2","192.168.1.2","TCP","66","5001  >  50846 [ACK] Seq=1 Ack=1537801 Win=595456 Len=0 TSval=3517458409 TSecr=2564536711"
"263","358.310486185","192.168.2.2","192.168.1.2","TCP","66","5001  >  50846 [ACK] Seq=1 Ack=1540697 Win=595456 Len=0 TSval=3517458421 TSecr=2564536726"
"265","358.323157830","192.168.2.2","192.168.1.2","TCP","66","5001  >  50846 [ACK] Seq=1 Ack=1543593 Win=595456 Len=0 TSval=3517458434 TSecr=2564536741"
"267","358.334863270","192.168.2.2","192.168.1.2","TCP","66","5001  >  50846 [ACK] Seq=1 Ack=1546489 Win=595456 Len=0 TSval=3517458446 TSecr=2564536753"
"269","358.346833906","192.168.2.2","192.168.1.2","TCP","66","5001  >  50846 [ACK] Seq=1 Ack=1549385 Win=595456 Len=0 TSval=3517458458 TSecr=2564536766"
"271","358.359377511","192.168.2.2","192.168.1.2","TCP","66","5001  >  50846 [ACK] Seq=1 Ack=1552281 Win=595456 Len=0 TSval=3517458470 TSecr=2564536778"
"273","358.371127633","192.168.2.2","192.168.1.2","TCP","66","5001  >  50846 [ACK] Seq=1 Ack=1555177 Win=595456 Len=0 TSval=3517458482 TSecr=2564536790"
"275","358.383170753","192.168.2.2","192.168.1.2","TCP","66","5001  >  50846 [ACK] Seq=1 Ack=1558073 Win=595456 Len=0 TSval=3517458494 TSecr=2564536802"
"277","358.395656010","192.168.2.2","192.168.1.2","TCP","66","5001  >  50846 [ACK] Seq=1 Ack=1560969 Win=595456 Len=0 TSval=3517458506 TSecr=2564536814"
"279","358.408416892","192.168.2.2","192.168.1.2","TCP","66","5001  >  50846 [ACK] Seq=1 Ack=1563865 Win=595456 Len=0 TSval=3517458519 TSecr=2564536826"
"281","358.420451629","192.168.2.2","192.168.1.2","TCP","66","5001  >  50846 [ACK] Seq=1 Ack=1566761 Win=595456 Len=0 TSval=3517458531 TSecr=2564536838"
"283","358.431982561","192.168.2.2","192.168.1.2","TCP","66","5001  >  50846 [ACK] Seq=1 Ack=1569657 Win=595456 Len=0 TSval=3517458543 TSecr=2564536851"
"285","358.443709087","192.168.2.2","192.168.1.2","TCP","66","5001  >  50846 [ACK] Seq=1 Ack=1572553 Win=595456 Len=0 TSval=3517458554 TSecr=2564536863"
"287","358.456337934","192.168.2.2","192.168.1.2","TCP","66","5001  >  50846 [ACK] Seq=1 Ack=1575449 Win=595456 Len=0 TSval=3517458567 TSecr=2564536875"
"289","358.469184225","192.168.2.2","192.168.1.2","TCP","66","5001  >  50846 [ACK] Seq=1 Ack=1578345 Win=595456 Len=0 TSval=3517458580 TSecr=2564536886"
"291","358.480698748","192.168.2.2","192.168.1.2","TCP","66","5001  >  50846 [ACK] Seq=1 Ack=1581241 Win=595456 Len=0 TSval=3517458591 TSecr=2564536899"
"293","358.492571469","192.168.2.2","192.168.1.2","TCP","66","5001  >  50846 [ACK] Seq=1 Ack=1584137 Win=595456 Len=0 TSval=3517458603 TSecr=2564536912"
"295","358.504329867","192.168.2.2","192.168.1.2","TCP","66","5001  >  50846 [ACK] Seq=1 Ack=1587033 Win=595456 Len=0 TSval=3517458615 TSecr=2564536923"
"297","358.516384107","192.168.2.2","192.168.1.2","TCP","66","5001  >  50846 [ACK] Seq=1 Ack=1589929 Win=595456 Len=0 TSval=3517458627 TSecr=2564536935"
"299","358.528842243","192.168.2.2","192.168.1.2","TCP","66","5001  >  50846 [ACK] Seq=1 Ack=1592825 Win=595456 Len=0 TSval=3517458640 TSecr=2564536947"
"301","358.540606893","192.168.2.2","192.168.1.2","TCP","66","5001  >  50846 [ACK] Seq=1 Ack=1595721 Win=595456 Len=0 TSval=3517458651 TSecr=2564536959"
"303","358.553306120","192.168.2.2","192.168.1.2","TCP","66","5001  >  50846 [ACK] Seq=1 Ack=1598617 Win=595456 Len=0 TSval=3517458664 TSecr=2564536972"
"306","358.570927882","192.168.2.2","192.168.1.2","TCP","66","5001  >  50846 [ACK] Seq=1 Ack=1602961 Win=595456 Len=0 TSval=3517458682 TSecr=2564536983"
"308","358.583646776","192.168.2.2","192.168.1.2","TCP","66","5001  >  50846 [ACK] Seq=1 Ack=1605857 Win=595456 Len=0 TSval=3517458694 TSecr=2564536998"
"310","358.595441031","192.168.2.2","192.168.1.2","TCP","66","5001  >  50846 [ACK] Seq=1 Ack=1608753 Win=595456 Len=0 TSval=3517458706 TSecr=2564537014"
"312","358.607233492","192.168.2.2","192.168.1.2","TCP","66","5001  >  50846 [ACK] Seq=1 Ack=1611649 Win=595456 Len=0 TSval=3517458718 TSecr=2564537026"
"314","358.619906661","192.168.2.2","192.168.1.2","TCP","66","5001  >  50846 [ACK] Seq=1 Ack=1614545 Win=595456 Len=0 TSval=3517458731 TSecr=2564537038"
"316","358.631670948","192.168.2.2","192.168.1.2","TCP","66","5001  >  50846 [ACK] Seq=1 Ack=1617441 Win=595456 Len=0 TSval=3517458742 TSecr=2564537050"
"318","358.643963806","192.168.2.2","192.168.1.2","TCP","66","5001  >  50846 [ACK] Seq=1 Ack=1620337 Win=595456 Len=0 TSval=3517458755 TSecr=2564537063"
"320","358.655691667","192.168.2.2","192.168.1.2","TCP","66","5001  >  50846 [ACK] Seq=1 Ack=1623233 Win=595456 Len=0 TSval=3517458766 TSecr=2564537074"
"322","358.668431510","192.168.2.2","192.168.1.2","TCP","66","5001  >  50846 [ACK] Seq=1 Ack=1626129 Win=595456 Len=0 TSval=3517458779 TSecr=2564537087"
"324","358.680157097","192.168.2.2","192.168.1.2","TCP","66","5001  >  50846 [ACK] Seq=1 Ack=1629025 Win=595456 Len=0 TSval=3517458791 TSecr=2564537098"
"326","358.692011434","192.168.2.2","192.168.1.2","TCP","66","5001  >  50846 [ACK] Seq=1 Ack=1631921 Win=595456 Len=0 TSval=3517458803 TSecr=2564537111"
"328","358.704706564","192.168.2.2","192.168.1.2","TCP","66","5001  >  50846 [ACK] Seq=1 Ack=1634817 Win=595456 Len=0 TSval=3517458815 TSecr=2564537123"
"330","358.716454150","192.168.2.2","192.168.1.2","TCP","66","5001  >  50846 [ACK] Seq=1 Ack=1637713 Win=595456 Len=0 TSval=3517458827 TSecr=2564537135"
"332","358.728347481","192.168.2.2","192.168.1.2","TCP","66","5001  >  50846 [ACK] Seq=1 Ack=1640609 Win=595456 Len=0 TSval=3517458839 TSecr=2564537147"
"334","358.740933707","192.168.2.2","192.168.1.2","TCP","66","5001  >  50846 [ACK] Seq=1 Ack=1643505 Win=595456 Len=0 TSval=3517458852 TSecr=2564537159"
"336","358.752666897","192.168.2.2","192.168.1.2","TCP","66","5001  >  50846 [ACK] Seq=1 Ack=1646401 Win=595456 Len=0 TSval=3517458863 TSecr=2564537171"
"338","358.764723080","192.168.2.2","192.168.1.2","TCP","66","5001  >  50846 [ACK] Seq=1 Ack=1649297 Win=595456 Len=0 TSval=3517458875 TSecr=2564537184"
"340","358.777230540","192.168.2.2","192.168.1.2","TCP","66","5001  >  50846 [ACK] Seq=1 Ack=1652193 Win=595456 Len=0 TSval=3517458888 TSecr=2564537195"
"342","358.788951999","192.168.2.2","192.168.1.2","TCP","66","5001  >  50846 [ACK] Seq=1 Ack=1655089 Win=595456 Len=0 TSval=3517458900 TSecr=2564537207"
"344","358.801668097","192.168.2.2","192.168.1.2","TCP","66","5001  >  50846 [ACK] Seq=1 Ack=1657985 Win=595456 Len=0 TSval=3517458912 TSecr=2564537220"
"346","358.813405055","192.168.2.2","192.168.1.2","TCP","66","5001  >  50846 [ACK] Seq=1 Ack=1660881 Win=595456 Len=0 TSval=3517458924 TSecr=2564537232"
"348","358.825224677","192.168.2.2","192.168.1.2","TCP","66","5001  >  50846 [ACK] Seq=1 Ack=1663777 Win=595456 Len=0 TSval=3517458936 TSecr=2564537244"
"351","358.843780566","192.168.2.2","192.168.1.2","TCP","66","5001  >  50846 [ACK] Seq=1 Ack=1668121 Win=595456 Len=0 TSval=3517458954 TSecr=2564537256"
"353","358.855494481","192.168.2.2","192.168.1.2","TCP","66","5001  >  50846 [ACK] Seq=1 Ack=1671017 Win=595456 Len=0 TSval=3517458966 TSecr=2564537271"
"355","358.868238281","192.168.2.2","192.168.1.2","TCP","66","5001  >  50846 [ACK] Seq=1 Ack=1673913 Win=595456 Len=0 TSval=3517458979 TSecr=2564537286"
"357","358.880015784","192.168.2.2","192.168.1.2","TCP","66","5001  >  50846 [ACK] Seq=1 Ack=1676809 Win=595456 Len=0 TSval=3517458991 TSecr=2564537298"
"359","358.891844644","192.168.2.2","192.168.1.2","TCP","66","5001  >  50846 [ACK] Seq=1 Ack=1679705 Win=595456 Len=0 TSval=3517459003 TSecr=2564537311"
"361","358.904526418","192.168.2.2","192.168.1.2","TCP","66","5001  >  50846 [ACK] Seq=1 Ack=1682601 Win=595456 Len=0 TSval=3517459015 TSecr=2564537323"
"363","358.916293533","192.168.2.2","192.168.1.2","TCP","66","5001  >  50846 [ACK] Seq=1 Ack=1685497 Win=595456 Len=0 TSval=3517459027 TSecr=2564537335"
"365","358.929036742","192.168.2.2","192.168.1.2","TCP","66","5001  >  50846 [ACK] Seq=1 Ack=1688393 Win=595456 Len=0 TSval=3517459040 TSecr=2564537347"
"367","358.940808435","192.168.2.2","192.168.1.2","TCP","66","5001  >  50846 [ACK] Seq=1 Ack=1691289 Win=595456 Len=0 TSval=3517459052 TSecr=2564537359"
"369","358.952471465","192.168.2.2","192.168.1.2","TCP","66","5001  >  50846 [ACK] Seq=1 Ack=1694185 Win=595456 Len=0 TSval=3517459063 TSecr=2564537372"
"371","358.965165441","192.168.2.2","192.168.1.2","TCP","66","5001  >  50846 [ACK] Seq=1 Ack=1697081 Win=595456 Len=0 TSval=3517459076 TSecr=2564537383"
"373","358.977032094","192.168.2.2","192.168.1.2","TCP","66","5001  >  50846 [ACK] Seq=1 Ack=1699977 Win=595456 Len=0 TSval=3517459088 TSecr=2564537395"
"375","358.988777555","192.168.2.2","192.168.1.2","TCP","66","5001  >  50846 [ACK] Seq=1 Ack=1702873 Win=595456 Len=0 TSval=3517459099 TSecr=2564537408"
"377","359.001452790","192.168.2.2","192.168.1.2","TCP","66","5001  >  50846 [ACK] Seq=1 Ack=1705769 Win=595456 Len=0 TSval=3517459112 TSecr=2564537420"
"379","359.013187341","192.168.2.2","192.168.1.2","TCP","66","5001  >  50846 [ACK] Seq=1 Ack=1708665 Win=595456 Len=0 TSval=3517459124 TSecr=2564537431"
"381","359.025070543","192.168.2.2","192.168.1.2","TCP","66","5001  >  50846 [ACK] Seq=1 Ack=1711561 Win=595456 Len=0 TSval=3517459136 TSecr=2564537444"
"383","359.037713705","192.168.2.2","192.168.1.2","TCP","66","5001  >  50846 [ACK] Seq=1 Ack=1714457 Win=595456 Len=0 TSval=3517459148 TSecr=2564537456"
"385","359.049494535","192.168.2.2","192.168.1.2","TCP","66","5001  >  50846 [ACK] Seq=1 Ack=1717353 Win=595456 Len=0 TSval=3517459160 TSecr=2564537468"
"387","359.062273720","192.168.2.2","192.168.1.2","TCP","66","5001  >  50846 [ACK] Seq=1 Ack=1720249 Win=595456 Len=0 TSval=3517459173 TSecr=2564537480"
"389","359.073936200","192.168.2.2","192.168.1.2","TCP","66","5001  >  50846 [ACK] Seq=1 Ack=1723145 Win=595456 Len=0 TSval=3517459185 TSecr=2564537492"
"391","359.085701390","192.168.2.2","192.168.1.2","TCP","66","5001  >  50846 [ACK] Seq=1 Ack=1726041 Win=595456 Len=0 TSval=3517459196 TSecr=2564537505"
"393","359.098524529","192.168.2.2","192.168.1.2","TCP","66","5001  >  50846 [ACK] Seq=1 Ack=1728937 Win=595456 Len=0 TSval=3517459209 TSecr=2564537517"
"396","359.116099321","192.168.2.2","192.168.1.2","TCP","66","5001  >  50846 [ACK] Seq=1 Ack=1733281 Win=595456 Len=0 TSval=3517459227 TSecr=2564537528"
"398","359.128067403","192.168.2.2","192.168.1.2","TCP","66","5001  >  50846 [ACK] Seq=1 Ack=1736177 Win=595456 Len=0 TSval=3517459239 TSecr=2564537543"
"400","359.140700688","192.168.2.2","192.168.1.2","TCP","66","5001  >  50846 [ACK] Seq=1 Ack=1739073 Win=595456 Len=0 TSval=3517459251 TSecr=2564537559"
"402","359.152312149","192.168.2.2","192.168.1.2","TCP","66","5001  >  50846 [ACK] Seq=1 Ack=1741969 Win=595456 Len=0 TSval=3517459263 TSecr=2564537571"
"404","359.165071889","192.168.2.2","192.168.1.2","TCP","66","5001  >  50846 [ACK] Seq=1 Ack=1744865 Win=595456 Len=0 TSval=3517459276 TSecr=2564537583"
"406","359.176834014","192.168.2.2","192.168.1.2","TCP","66","5001  >  50846 [ACK] Seq=1 Ack=1747761 Win=595456 Len=0 TSval=3517459288 TSecr=2564537595"
"408","359.188592192","192.168.2.2","192.168.1.2","TCP","66","5001  >  50846 [ACK] Seq=1 Ack=1750657 Win=595456 Len=0 TSval=3517459299 TSecr=2564537608"
"410","359.201309373","192.168.2.2","192.168.1.2","TCP","66","5001  >  50846 [ACK] Seq=1 Ack=1753553 Win=595456 Len=0 TSval=3517459312 TSecr=2564537620"
"412","359.213056390","192.168.2.2","192.168.1.2","TCP","66","5001  >  50846 [ACK] Seq=1 Ack=1756449 Win=595456 Len=0 TSval=3517459324 TSecr=2564537631"
"414","359.224931335","192.168.2.2","192.168.1.2","TCP","66","5001  >  50846 [ACK] Seq=1 Ack=1759345 Win=595456 Len=0 TSval=3517459336 TSecr=2564537644"
"416","359.237097876","192.168.2.2","192.168.1.2","TCP","66","5001  >  50846 [ACK] Seq=1 Ack=1762241 Win=595456 Len=0 TSval=3517459348 TSecr=2564537656"
"418","359.249806080","192.168.2.2","192.168.1.2","TCP","66","5001  >  50846 [ACK] Seq=1 Ack=1765137 Win=595456 Len=0 TSval=3517459361 TSecr=2564537668"
"420","359.261588384","192.168.2.2","192.168.1.2","TCP","66","5001  >  50846 [ACK] Seq=1 Ack=1768033 Win=595456 Len=0 TSval=3517459372 TSecr=2564537680"
"422","359.273371236","192.168.2.2","192.168.1.2","TCP","66","5001  >  50846 [ACK] Seq=1 Ack=1770929 Win=595456 Len=0 TSval=3517459384 TSecr=2564537692"
"424","359.285819294","192.168.2.2","192.168.1.2","TCP","66","5001  >  50846 [ACK] Seq=1 Ack=1773825 Win=595456 Len=0 TSval=3517459397 TSecr=2564537704"
"426","359.297826547","192.168.2.2","192.168.1.2","TCP","66","5001  >  50846 [ACK] Seq=1 Ack=1776721 Win=595456 Len=0 TSval=3517459409 TSecr=2564537716"
"428","359.309698888","192.168.2.2","192.168.1.2","TCP","66","5001  >  50846 [ACK] Seq=1 Ack=1779617 Win=595456 Len=0 TSval=3517459420 TSecr=2564537729"
"430","359.322315119","192.168.2.2","192.168.1.2","TCP","66","5001  >  50846 [ACK] Seq=1 Ack=1782513 Win=595456 Len=0 TSval=3517459433 TSecr=2564537741"
"432","359.334062116","192.168.2.2","192.168.1.2","TCP","66","5001  >  50846 [ACK] Seq=1 Ack=1785409 Win=595456 Len=0 TSval=3517459445 TSecr=2564537752"
"434","359.346051687","192.168.2.2","192.168.1.2","TCP","66","5001  >  50846 [ACK] Seq=1 Ack=1788305 Win=595456 Len=0 TSval=3517459457 TSecr=2564537765"
"436","359.358575405","192.168.2.2","192.168.1.2","TCP","66","5001  >  50846 [ACK] Seq=1 Ack=1791201 Win=595456 Len=0 TSval=3517459469 TSecr=2564537777"
"438","359.370279452","192.168.2.2","192.168.1.2","TCP","66","5001  >  50846 [ACK] Seq=1 Ack=1794097 Win=595456 Len=0 TSval=3517459481 TSecr=2564537789"
"441","359.388915470","192.168.2.2","192.168.1.2","TCP","66","5001  >  50846 [ACK] Seq=1 Ack=1798441 Win=595456 Len=0 TSval=3517459500 TSecr=2564537801"
"443","359.400643771","192.168.2.2","192.168.1.2","TCP","66","5001  >  50846 [ACK] Seq=1 Ack=1801337 Win=595456 Len=0 TSval=3517459511 TSecr=2564537816"
"445","359.413452966","192.168.2.2","192.168.1.2","TCP","66","5001  >  50846 [ACK] Seq=1 Ack=1804233 Win=595456 Len=0 TSval=3517459524 TSecr=2564537832"
"447","359.425410834","192.168.2.2","192.168.1.2","TCP","66","5001  >  50846 [ACK] Seq=1 Ack=1807129 Win=595456 Len=0 TSval=3517459536 TSecr=2564537843"
"449","359.436942850","192.168.2.2","192.168.1.2","TCP","66","5001  >  50846 [ACK] Seq=1 Ack=1810025 Win=595456 Len=0 TSval=3517459548 TSecr=2564537856"
"451","359.449001348","192.168.2.2","192.168.1.2","TCP","66","5001  >  50846 [ACK] Seq=1 Ack=1812921 Win=595456 Len=0 TSval=3517459560 TSecr=2564537868"
"453","359.461461869","192.168.2.2","192.168.1.2","TCP","66","5001  >  50846 [ACK] Seq=1 Ack=1815817 Win=595456 Len=0 TSval=3517459572 TSecr=2564537880"
"455","359.473217631","192.168.2.2","192.168.1.2","TCP","66","5001  >  50846 [ACK] Seq=1 Ack=1818713 Win=595456 Len=0 TSval=3517459584 TSecr=2564537892"
"457","359.485908483","192.168.2.2","192.168.1.2","TCP","66","5001  >  50846 [ACK] Seq=1 Ack=1821609 Win=595456 Len=0 TSval=3517459597 TSecr=2564537904"
"459","359.497664068","192.168.2.2","192.168.1.2","TCP","66","5001  >  50846 [ACK] Seq=1 Ack=1824505 Win=595456 Len=0 TSval=3517459608 TSecr=2564537916"
"461","359.509556695","192.168.2.2","192.168.1.2","TCP","66","5001  >  50846 [ACK] Seq=1 Ack=1827401 Win=595456 Len=0 TSval=3517459620 TSecr=2564537929"
"463","359.521676648","192.168.2.2","192.168.1.2","TCP","66","5001  >  50846 [ACK] Seq=1 Ack=1830297 Win=595456 Len=0 TSval=3517459632 TSecr=2564537940"
"465","359.533899475","192.168.2.2","192.168.1.2","TCP","66","5001  >  50846 [ACK] Seq=1 Ack=1833193 Win=595456 Len=0 TSval=3517459645 TSecr=2564537952"
"467","359.545905386","192.168.2.2","192.168.1.2","TCP","66","5001  >  50846 [ACK] Seq=1 Ack=1836089 Win=595456 Len=0 TSval=3517459657 TSecr=2564537964"
"469","359.558358773","192.168.2.2","192.168.1.2","TCP","66","5001  >  50846 [ACK] Seq=1 Ack=1838985 Win=595456 Len=0 TSval=3517459669 TSecr=2564537977"
"471","359.570123092","192.168.2.2","192.168.1.2","TCP","66","5001  >  50846 [ACK] Seq=1 Ack=1841881 Win=595456 Len=0 TSval=3517459681 TSecr=2564537989"
"473","359.582888712","192.168.2.2","192.168.1.2","TCP","66","5001  >  50846 [ACK] Seq=1 Ack=1844777 Win=595456 Len=0 TSval=3517459694 TSecr=2564538001"
"475","359.594613388","192.168.2.2","192.168.1.2","TCP","66","5001  >  50846 [ACK] Seq=1 Ack=1847673 Win=595456 Len=0 TSval=3517459705 TSecr=2564538013"
"477","359.606455001","192.168.2.2","192.168.1.2","TCP","66","5001  >  50846 [ACK] Seq=1 Ack=1850569 Win=595456 Len=0 TSval=3517459717 TSecr=2564538026"
"479","359.618582940","192.168.2.2","192.168.1.2","TCP","66","5001  >  50846 [ACK] Seq=1 Ack=1853465 Win=595456 Len=0 TSval=3517459729 TSecr=2564538037"
"481","359.630841843","192.168.2.2","192.168.1.2","TCP","66","5001  >  50846 [ACK] Seq=1 Ack=1856361 Win=595456 Len=0 TSval=3517459742 TSecr=2564538049"
"483","359.642776752","192.168.2.2","192.168.1.2","TCP","66","5001  >  50846 [ACK] Seq=1 Ack=1859257 Win=595456 Len=0 TSval=3517459753 TSecr=2564538061"
"486","359.661254555","192.168.2.2","192.168.1.2","TCP","66","5001  >  50846 [ACK] Seq=1 Ack=1863601 Win=595456 Len=0 TSval=3517459772 TSecr=2564538074"
"488","359.673079216","192.168.2.2","192.168.1.2","TCP","66","5001  >  50846 [ACK] Seq=1 Ack=1866497 Win=595456 Len=0 TSval=3517459784 TSecr=2564538088"
"490","359.685693575","192.168.2.2","192.168.1.2","TCP","66","5001  >  50846 [ACK] Seq=1 Ack=1869393 Win=595456 Len=0 TSval=3517459796 TSecr=2564538104"
"492","359.697492008","192.168.2.2","192.168.1.2","TCP","66","5001  >  50846 [ACK] Seq=1 Ack=1872289 Win=595456 Len=0 TSval=3517459808 TSecr=2564538116"
"494","359.709419243","192.168.2.2","192.168.1.2","TCP","66","5001  >  50846 [ACK] Seq=1 Ack=1875185 Win=595456 Len=0 TSval=3517459820 TSecr=2564538128"
"496","359.721987894","192.168.2.2","192.168.1.2","TCP","66","5001  >  50846 [ACK] Seq=1 Ack=1878081 Win=595456 Len=0 TSval=3517459833 TSecr=2564538140"
"498","359.733736703","192.168.2.2","192.168.1.2","TCP","66","5001  >  50846 [ACK] Seq=1 Ack=1880977 Win=595456 Len=0 TSval=3517459844 TSecr=2564538152"
"500","359.745753254","192.168.2.2","192.168.1.2","TCP","66","5001  >  50846 [ACK] Seq=1 Ack=1883873 Win=595456 Len=0 TSval=3517459856 TSecr=2564538165"
"502","359.758218725","192.168.2.2","192.168.1.2","TCP","66","5001  >  50846 [ACK] Seq=1 Ack=1886769 Win=595456 Len=0 TSval=3517459869 TSecr=2564538176"
"504","359.769991780","192.168.2.2","192.168.1.2","TCP","66","5001  >  50846 [ACK] Seq=1 Ack=1889665 Win=595456 Len=0 TSval=3517459881 TSecr=2564538188"
"506","359.782706326","192.168.2.2","192.168.1.2","TCP","66","5001  >  50846 [ACK] Seq=1 Ack=1892561 Win=595456 Len=0 TSval=3517459893 TSecr=2564538201"
"508","359.794460685","192.168.2.2","192.168.1.2","TCP","66","5001  >  50846 [ACK] Seq=1 Ack=1895457 Win=595456 Len=0 TSval=3517459905 TSecr=2564538213"
"510","359.806318118","192.168.2.2","192.168.1.2","TCP","66","5001  >  50846 [ACK] Seq=1 Ack=1898353 Win=595456 Len=0 TSval=3517459917 TSecr=2564538225"
"512","359.818971892","192.168.2.2","192.168.1.2","TCP","66","5001  >  50846 [ACK] Seq=1 Ack=1901249 Win=595456 Len=0 TSval=3517459930 TSecr=2564538237"
"514","359.830672571","192.168.2.2","192.168.1.2","TCP","66","5001  >  50846 [ACK] Seq=1 Ack=1904145 Win=595456 Len=0 TSval=3517459941 TSecr=2564538249"
"516","359.842969037","192.168.2.2","192.168.1.2","TCP","66","5001  >  50846 [ACK] Seq=1 Ack=1907041 Win=595456 Len=0 TSval=3517459954 TSecr=2564538262"
"518","359.854781163","192.168.2.2","192.168.1.2","TCP","66","5001  >  50846 [ACK] Seq=1 Ack=1909937 Win=595456 Len=0 TSval=3517459965 TSecr=2564538273"
"520","359.867476332","192.168.2.2","192.168.1.2","TCP","66","5001  >  50846 [ACK] Seq=1 Ack=1912833 Win=595456 Len=0 TSval=3517459978 TSecr=2564538286"
"522","359.879227406","192.168.2.2","192.168.1.2","TCP","66","5001  >  50846 [ACK] Seq=1 Ack=1915729 Win=595456 Len=0 TSval=3517459990 TSecr=2564538297"
"524","359.891085211","192.168.2.2","192.168.1.2","TCP","66","5001  >  50846 [ACK] Seq=1 Ack=1918625 Win=595456 Len=0 TSval=3517460002 TSecr=2564538310"
"526","359.903718224","192.168.2.2","192.168.1.2","TCP","66","5001  >  50846 [ACK] Seq=1 Ack=1921521 Win=595456 Len=0 TSval=3517460014 TSecr=2564538322"
"528","359.915465250","192.168.2.2","192.168.1.2","TCP","66","5001  >  50846 [ACK] Seq=1 Ack=1924417 Win=595456 Len=0 TSval=3517460026 TSecr=2564538334"
"531","359.934041928","192.168.2.2","192.168.1.2","TCP","66","5001  >  50846 [ACK] Seq=1 Ack=1928761 Win=595456 Len=0 TSval=3517460045 TSecr=2564538346"
"533","359.945859306","192.168.2.2","192.168.1.2","TCP","66","5001  >  50846 [ACK] Seq=1 Ack=1931657 Win=595456 Len=0 TSval=3517460057 TSecr=2564538361"
"535","359.958565125","192.168.2.2","192.168.1.2","TCP","66","5001  >  50846 [ACK] Seq=1 Ack=1934553 Win=595456 Len=0 TSval=3517460069 TSecr=2564538377"
"537","359.970302206","192.168.2.2","192.168.1.2","TCP","66","5001  >  50846 [ACK] Seq=1 Ack=1937449 Win=595456 Len=0 TSval=3517460081 TSecr=2564538389"
"539","359.982072013","192.168.2.2","192.168.1.2","TCP","66","5001  >  50846 [ACK] Seq=1 Ack=1940345 Win=595456 Len=0 TSval=3517460093 TSecr=2564538401"
"541","359.994037658","192.168.2.2","192.168.1.2","TCP","66","5001  >  50846 [ACK] Seq=1 Ack=1943241 Win=595456 Len=0 TSval=3517460105 TSecr=2564538413"
"543","360.006543284","192.168.2.2","192.168.1.2","TCP","66","5001  >  50846 [ACK] Seq=1 Ack=1946137 Win=595456 Len=0 TSval=3517460117 TSecr=2564538425"
"545","360.018286604","192.168.2.2","192.168.1.2","TCP","66","5001  >  50846 [ACK] Seq=1 Ack=1949033 Win=595456 Len=0 TSval=3517460129 TSecr=2564538437"
"547","360.031033189","192.168.2.2","192.168.1.2","TCP","66","5001  >  50846 [ACK] Seq=1 Ack=1951929 Win=595456 Len=0 TSval=3517460142 TSecr=2564538449"
"549","360.042751512","192.168.2.2","192.168.1.2","TCP","66","5001  >  50846 [ACK] Seq=1 Ack=1954825 Win=595456 Len=0 TSval=3517460153 TSecr=2564538461"
"551","360.054628322","192.168.2.2","192.168.1.2","TCP","66","5001  >  50846 [ACK] Seq=1 Ack=1957721 Win=595456 Len=0 TSval=3517460165 TSecr=2564538474"
"553","360.067326486","192.168.2.2","192.168.1.2","TCP","66","5001  >  50846 [ACK] Seq=1 Ack=1960617 Win=595456 Len=0 TSval=3517460178 TSecr=2564538485"
"555","360.079054296","192.168.2.2","192.168.1.2","TCP","66","5001  >  50846 [ACK] Seq=1 Ack=1963513 Win=595456 Len=0 TSval=3517460190 TSecr=2564538497"
"557","360.091808808","192.168.2.2","192.168.1.2","TCP","66","5001  >  50846 [ACK] Seq=1 Ack=1966409 Win=595456 Len=0 TSval=3517460203 TSecr=2564538510"
"559","360.103550063","192.168.2.2","192.168.1.2","TCP","66","5001  >  50846 [ACK] Seq=1 Ack=1969305 Win=595456 Len=0 TSval=3517460214 TSecr=2564538522"
