No.,Time,Source,Destination,Protocol,Length,Calculated window size,Info
2,0.000025,192.168.2.2,192.168.1.2,TCP,74,43440,"5001  >  53148 [SYN, ACK] Seq=0 Ack=1 Win=43440 Len=0 MSS=1460 SACK_PERM=1 TSval=2325379498 TSecr=1376419421 WS=512"
5,0.000085,192.168.2.2,192.168.1.2,TCP,66,39936,5001  >  53148 [ACK] Seq=1 Ack=7241 Win=39936 Len=0 TSval=2325379498 TSecr=1376419421
12,0.049779,192.168.2.2,192.168.1.2,TCP,66,38400,5001  >  53148 [ACK] Seq=1 Ack=17377 Win=38400 Len=0 TSval=2325379548 TSecr=1376419421
15,0.134581,192.168.2.2,192.168.1.2,TCP,66,38400,5001  >  53148 [ACK] Seq=1 Ack=27513 Win=38400 Len=0 TSval=2325379632 TSecr=1376419421
19,0.219473,192.168.2.2,192.168.1.2,TCP,66,42496,5001  >  53148 [ACK] Seq=1 Ack=28961 Win=42496 Len=0 TSval=2325379717 TSecr=1376419421
21,0.231403,192.168.2.2,192.168.1.2,TCP,66,42496,5001  >  53148 [ACK] Seq=1 Ack=30409 Win=42496 Len=0 TSval=2325379729 TSecr=1376419436
24,0.243983,192.168.2.2,192.168.1.2,TCP,66,35328,5001  >  53148 [ACK] Seq=1 Ack=46337 Win=35328 Len=0 TSval=2325379742 TSecr=1376419471
29,0.377246,192.168.2.2,192.168.1.2,TCP,66,41984,5001  >  53148 [ACK] Seq=1 Ack=49233 Win=41984 Len=0 TSval=2325379875 TSecr=1376419496
31,0.400996,192.168.2.2,192.168.1.2,TCP,66,45568,5001  >  53148 [ACK] Seq=1 Ack=50681 Win=45568 Len=0 TSval=2325379899 TSecr=1376419555
33,0.413587,192.168.2.2,192.168.1.2,TCP,66,75776,5001  >  53148 [ACK] Seq=1 Ack=65913 Win=75776 Len=0 TSval=2325379911 TSecr=1376419555
38,0.540957,192.168.2.2,192.168.1.2,TCP,78,75776,[TCP Dup ACK 33#1] 5001  >  53148 [ACK] Seq=1 Ack=65913 Win=75776 Len=0 TSval=2325380038 TSecr=1376419612 SLE=65161 SRE=65913
40,0.547909,192.168.2.2,192.168.1.2,TCP,66,84480,5001  >  53148 [ACK] Seq=1 Ack=70257 Win=84480 Len=0 TSval=2325380045 TSecr=1376419640
43,0.583658,192.168.2.2,192.168.1.2,TCP,66,87552,5001  >  53148 [ACK] Seq=1 Ack=71705 Win=87552 Len=0 TSval=2325380081 TSecr=1376419652
45,0.596084,192.168.2.2,192.168.1.2,TCP,66,90112,5001  >  53148 [ACK] Seq=1 Ack=72401 Win=90112 Len=0 TSval=2325380094 TSecr=1376419652
47,0.601909,192.168.2.2,192.168.1.2,TCP,66,93184,5001  >  53148 [ACK] Seq=1 Ack=81089 Win=93184 Len=0 TSval=2325380099 TSecr=1376419665
49,0.674509,192.168.2.2,192.168.1.2,TCP,66,93184,5001  >  53148 [ACK] Seq=1 Ack=89777 Win=93184 Len=0 TSval=2325380172 TSecr=1376419798
52,0.747311,192.168.2.2,192.168.1.2,TCP,66,95232,5001  >  53148 [ACK] Seq=1 Ack=94121 Win=95232 Len=0 TSval=2325380245 TSecr=1376419822
54,0.783558,192.168.2.2,192.168.1.2,TCP,66,86528,5001  >  53148 [ACK] Seq=1 Ack=115841 Win=86528 Len=0 TSval=2325380281 TSecr=1376419834
56,0.965843,192.168.2.2,192.168.1.2,TCP,66,86528,5001  >  53148 [ACK] Seq=1 Ack=137561 Win=86528 Len=0 TSval=2325380463 TSecr=1376419834
59,1.146881,192.168.2.2,192.168.1.2,TCP,66,101376,5001  >  53148 [ACK] Seq=1 Ack=140457 Win=101376 Len=0 TSval=2325380644 TSecr=1376419962
61,1.171699,192.168.2.2,192.168.1.2,TCP,66,127488,5001  >  53148 [ACK] Seq=1 Ack=153489 Win=127488 Len=0 TSval=2325380669 TSecr=1376419968
64,1.280959,192.168.2.2,192.168.1.2,TCP,66,135680,5001  >  53148 [ACK] Seq=1 Ack=157833 Win=135680 Len=0 TSval=2325380778 TSecr=1376420004
67,1.317232,192.168.2.2,192.168.1.2,TCP,66,138752,5001  >  53148 [ACK] Seq=1 Ack=159281 Win=138752 Len=0 TSval=2325380814 TSecr=1376420017
69,1.329424,192.168.2.2,192.168.1.2,TCP,66,168960,5001  >  53148 [ACK] Seq=1 Ack=174273 Win=168960 Len=0 TSval=2325380827 TSecr=1376420022
74,1.455456,192.168.2.2,192.168.1.2,TCP,66,180224,5001  >  53148 [ACK] Seq=1 Ack=180065 Win=180224 Len=0 TSval=2325380953 TSecr=1376420095
78,1.503571,192.168.2.2,192.168.1.2,TCP,66,183296,5001  >  53148 [ACK] Seq=1 Ack=181001 Win=183296 Len=0 TSval=2325381001 TSecr=1376420095
80,1.511507,192.168.2.2,192.168.1.2,TCP,66,197632,5001  >  53148 [ACK] Seq=1 Ack=188241 Win=197632 Len=0 TSval=2325381009 TSecr=1376420168
84,1.572805,192.168.2.2,192.168.1.2,TCP,66,223744,5001  >  53148 [ACK] Seq=1 Ack=201273 Win=223744 Len=0 TSval=2325381070 TSecr=1376420204
86,1.681876,192.168.2.2,192.168.1.2,TCP,66,226816,5001  >  53148 [ACK] Seq=1 Ack=202721 Win=226816 Len=0 TSval=2325381179 TSecr=1376420386
89,1.694757,192.168.2.2,192.168.1.2,TCP,66,270336,5001  >  53148 [ACK] Seq=1 Ack=224441 Win=270336 Len=0 TSval=2325381192 TSecr=1376420567
92,1.876419,192.168.2.2,192.168.1.2,TCP,66,304640,5001  >  53148 [ACK] Seq=1 Ack=246161 Win=304640 Len=0 TSval=2325381373 TSecr=1376420592
96,2.058661,192.168.2.2,192.168.1.2,TCP,66,304640,5001  >  53148 [ACK] Seq=1 Ack=267881 Win=304640 Len=0 TSval=2325381555 TSecr=1376420592
98,2.239995,192.168.2.2,192.168.1.2,TCP,66,304640,5001  >  53148 [ACK] Seq=1 Ack=289601 Win=304640 Len=0 TSval=2325381737 TSecr=1376420701
101,2.422216,192.168.2.2,192.168.1.2,TCP,66,310784,5001  >  53148 [ACK] Seq=1 Ack=292497 Win=310784 Len=0 TSval=2325381919 TSecr=1376420719
103,2.445771,192.168.2.2,192.168.1.2,TCP,66,319488,5001  >  53148 [ACK] Seq=1 Ack=296841 Win=319488 Len=0 TSval=2325381942 TSecr=1376420737
105,2.481986,192.168.2.2,192.168.1.2,TCP,66,348160,5001  >  53148 [ACK] Seq=1 Ack=311321 Win=348160 Len=0 TSval=2325381979 TSecr=1376420750
107,2.603088,192.168.2.2,192.168.1.2,TCP,66,391680,5001  >  53148 [ACK] Seq=1 Ack=333041 Win=391680 Len=0 TSval=2325382100 TSecr=1376420750
109,2.784768,192.168.2.2,192.168.1.2,TCP,66,435200,5001  >  53148 [ACK] Seq=1 Ack=354761 Win=435200 Len=0 TSval=2325382281 TSecr=1376420876
112,2.966415,192.168.2.2,192.168.1.2,TCP,66,454144,5001  >  53148 [ACK] Seq=1 Ack=364297 Win=454144 Len=0 TSval=2325382463 TSecr=1376420924
115,3.046579,192.168.2.2,192.168.1.2,TCP,66,477184,5001  >  53148 [ACK] Seq=1 Ack=375881 Win=477184 Len=0 TSval=2325382543 TSecr=1376420932
117,3.143564,192.168.2.2,192.168.1.2,TCP,66,480256,5001  >  53148 [ACK] Seq=1 Ack=376481 Win=480256 Len=0 TSval=2325382640 TSecr=1376420932
119,3.149518,192.168.2.2,192.168.1.2,TCP,66,481280,5001  >  53148 [ACK] Seq=1 Ack=398201 Win=481280 Len=0 TSval=2325382646 TSecr=1376420993
121,3.33079,192.168.2.2,192.168.1.2,TCP,66,483840,5001  >  53148 [ACK] Seq=1 Ack=415577 Win=483840 Len=0 TSval=2325382827 TSecr=1376421102
123,3.475812,192.168.2.2,192.168.1.2,TCP,66,489984,5001  >  53148 [ACK] Seq=1 Ack=419921 Win=489984 Len=0 TSval=2325382972 TSecr=1376421115
125,3.513263,192.168.2.2,192.168.1.2,TCP,66,483840,5001  >  53148 [ACK] Seq=1 Ack=437297 Win=483840 Len=0 TSval=2325383009 TSecr=1376421232
127,3.659081,192.168.2.2,192.168.1.2,TCP,66,489984,5001  >  53148 [ACK] Seq=1 Ack=441641 Win=489984 Len=0 TSval=2325383155 TSecr=1376421296
130,3.695715,192.168.2.2,192.168.1.2,TCP,66,492032,5001  >  53148 [ACK] Seq=1 Ack=463361 Win=492032 Len=0 TSval=2325383192 TSecr=1376421478
132,3.877672,192.168.2.2,192.168.1.2,TCP,66,492032,5001  >  53148 [ACK] Seq=1 Ack=485081 Win=492032 Len=0 TSval=2325383374 TSecr=1376421660
135,4.059212,192.168.2.2,192.168.1.2,TCP,66,494080,5001  >  53148 [ACK] Seq=1 Ack=502457 Win=494080 Len=0 TSval=2325383555 TSecr=1376421743
137,4.204936,192.168.2.2,192.168.1.2,TCP,66,499712,5001  >  53148 [ACK] Seq=1 Ack=505353 Win=499712 Len=0 TSval=2325383701 TSecr=1376421842
139,4.228651,192.168.2.2,192.168.1.2,TCP,66,501760,5001  >  53148 [ACK] Seq=1 Ack=506801 Win=501760 Len=0 TSval=2325383724 TSecr=1376421865
141,4.241268,192.168.2.2,192.168.1.2,TCP,66,494080,5001  >  53148 [ACK] Seq=1 Ack=524177 Win=494080 Len=0 TSval=2325383737 TSecr=1376421902
144,4.386809,192.168.2.2,192.168.1.2,TCP,66,500736,5001  >  53148 [ACK] Seq=1 Ack=528521 Win=500736 Len=0 TSval=2325383882 TSecr=1376422023
146,4.423551,192.168.2.2,192.168.1.2,TCP,66,492032,5001  >  53148 [ACK] Seq=1 Ack=550241 Win=492032 Len=0 TSval=2325383919 TSecr=1376422204
148,4.604847,192.168.2.2,192.168.1.2,TCP,66,494080,5001  >  53148 [ACK] Seq=1 Ack=567617 Win=494080 Len=0 TSval=2325384100 TSecr=1376422255
150,4.750326,192.168.2.2,192.168.1.2,TCP,66,497664,5001  >  53148 [ACK] Seq=1 Ack=577753 Win=497664 Len=0 TSval=2325384246 TSecr=1376422386
153,4.835767,192.168.2.2,192.168.1.2,TCP,66,501760,5001  >  53148 [ACK] Seq=1 Ack=589337 Win=501760 Len=0 TSval=2325384331 TSecr=1376422466
155,4.944832,192.168.2.2,192.168.1.2,TCP,66,501760,5001  >  53148 [ACK] Seq=1 Ack=595129 Win=501760 Len=0 TSval=2325384440 TSecr=1376422563
157,4.981252,192.168.2.2,192.168.1.2,TCP,66,501760,5001  >  53148 [ACK] Seq=1 Ack=629881 Win=501760 Len=0 TSval=2325384477 TSecr=1376422750
162,5.275229,192.168.2.2,192.168.1.2,TCP,66,500736,5001  >  53148 [ACK] Seq=1 Ack=634225 Win=500736 Len=0 TSval=2325384770 TSecr=1376422895
164,5.308112,192.168.2.2,192.168.1.2,TCP,66,499712,5001  >  53148 [ACK] Seq=1 Ack=640017 Win=499712 Len=0 TSval=2325384803 TSecr=1376422932
167,5.357032,192.168.2.2,192.168.1.2,TCP,66,494592,5001  >  53148 [ACK] Seq=1 Ack=655945 Win=494592 Len=0 TSval=2325384852 TSecr=1376423078
170,5.490408,192.168.2.2,192.168.1.2,TCP,66,492032,5001  >  53148 [ACK] Seq=1 Ack=677665 Win=492032 Len=0 TSval=2325384985 TSecr=1376423115
172,5.671659,192.168.2.2,192.168.1.2,TCP,66,516608,5001  >  53148 [ACK] Seq=1 Ack=684905 Win=516608 Len=0 TSval=2325385167 TSecr=1376423297
175,5.732833,192.168.2.2,192.168.1.2,TCP,66,580096,5001  >  53148 [ACK] Seq=1 Ack=716761 Win=580096 Len=0 TSval=2325385228 TSecr=1376423478
179,5.999523,192.168.2.2,192.168.1.2,TCP,66,585728,5001  >  53148 [ACK] Seq=1 Ack=719657 Win=585728 Len=0 TSval=2325385494 TSecr=1376423624
181,6.024036,192.168.2.2,192.168.1.2,TCP,66,588800,5001  >  53148 [ACK] Seq=1 Ack=721105 Win=588800 Len=0 TSval=2325385519 TSecr=1376423647
184,6.035721,192.168.2.2,192.168.1.2,TCP,66,606208,5001  >  53148 [ACK] Seq=1 Ack=729793 Win=606208 Len=0 TSval=2325385531 TSecr=1376423660
186,6.108414,192.168.2.2,192.168.1.2,TCP,66,623616,5001  >  53148 [ACK] Seq=1 Ack=738481 Win=623616 Len=0 TSval=2325385603 TSecr=1376423790
188,6.181767,192.168.2.2,192.168.1.2,TCP,66,632320,5001  >  53148 [ACK] Seq=1 Ack=742825 Win=632320 Len=0 TSval=2325385676 TSecr=1376423805
190,6.218073,192.168.2.2,192.168.1.2,TCP,66,675840,5001  >  53148 [ACK] Seq=1 Ack=764545 Win=675840 Len=0 TSval=2325385713 TSecr=1376423842
192,6.399419,192.168.2.2,192.168.1.2,TCP,66,695808,5001  >  53148 [ACK] Seq=1 Ack=774681 Win=695808 Len=0 TSval=2325385894 TSecr=1376424023
194,6.483917,192.168.2.2,192.168.1.2,TCP,66,730624,5001  >  53148 [ACK] Seq=1 Ack=792057 Win=730624 Len=0 TSval=2325385978 TSecr=1376424169
196,6.629266,192.168.2.2,192.168.1.2,TCP,66,753664,5001  >  53148 [ACK] Seq=1 Ack=803641 Win=753664 Len=0 TSval=2325386124 TSecr=1376424254
198,6.726215,192.168.2.2,192.168.1.2,TCP,66,765440,5001  >  53148 [ACK] Seq=1 Ack=809433 Win=765440 Len=0 TSval=2325386221 TSecr=1376424363
200,6.774479,192.168.2.2,192.168.1.2,TCP,66,785920,5001  >  53148 [ACK] Seq=1 Ack=819569 Win=785920 Len=0 TSval=2325386269 TSecr=1376424400
203,6.860369,192.168.2.2,192.168.1.2,TCP,66,843776,5001  >  53148 [ACK] Seq=1 Ack=848529 Win=843776 Len=0 TSval=2325386355 TSecr=1376424693
207,7.103039,192.168.2.2,192.168.1.2,TCP,66,855040,5001  >  53148 [ACK] Seq=1 Ack=854321 Win=855040 Len=0 TSval=2325386597 TSecr=1376424726
209,7.151055,192.168.2.2,192.168.1.2,TCP,66,878592,5001  >  53148 [ACK] Seq=1 Ack=865905 Win=878592 Len=0 TSval=2325386645 TSecr=1376424775
211,7.2481,192.168.2.2,192.168.1.2,TCP,66,887296,5001  >  53148 [ACK] Seq=1 Ack=870249 Win=887296 Len=0 TSval=2325386742 TSecr=1376424813
213,7.284427,192.168.2.2,192.168.1.2,TCP,66,930816,5001  >  53148 [ACK] Seq=1 Ack=891969 Win=930816 Len=0 TSval=2325386779 TSecr=1376424909
216,7.466669,192.168.2.2,192.168.1.2,TCP,66,945152,5001  >  53148 [ACK] Seq=1 Ack=899209 Win=945152 Len=0 TSval=2325386961 TSecr=1376425090
218,7.527404,192.168.2.2,192.168.1.2,TCP,66,971264,5001  >  53148 [ACK] Seq=1 Ack=912241 Win=971264 Len=0 TSval=2325387021 TSecr=1376425151
220,7.636099,192.168.2.2,192.168.1.2,TCP,66,1005056,5001  >  53148 [ACK] Seq=1 Ack=931065 Win=1005056 Len=0 TSval=2325387130 TSecr=1376425325
222,7.793573,192.168.2.2,192.168.1.2,TCP,66,1011200,5001  >  53148 [ACK] Seq=1 Ack=933961 Win=1011200 Len=0 TSval=2325387287 TSecr=1376425417
224,7.817985,192.168.2.2,192.168.1.2,TCP,66,1013760,5001  >  53148 [ACK] Seq=1 Ack=935409 Win=1013760 Len=0 TSval=2325387312 TSecr=1376425442
227,7.83066,192.168.2.2,192.168.1.2,TCP,66,1010176,5001  >  53148 [ACK] Seq=1 Ack=944097 Win=1010176 Len=0 TSval=2325387325 TSecr=1376425454
229,7.903647,192.168.2.2,192.168.1.2,TCP,66,1010176,5001  >  53148 [ACK] Seq=1 Ack=952785 Win=1010176 Len=0 TSval=2325387398 TSecr=1376425526
231,7.976813,192.168.2.2,192.168.1.2,TCP,66,1012736,5001  >  53148 [ACK] Seq=1 Ack=957129 Win=1012736 Len=0 TSval=2325387471 TSecr=1376425600
233,8.012668,192.168.2.2,192.168.1.2,TCP,66,1013760,5001  >  53148 [ACK] Seq=1 Ack=958577 Win=1013760 Len=0 TSval=2325387506 TSecr=1376425636
235,8.024866,192.168.2.2,192.168.1.2,TCP,66,999424,5001  >  53148 [ACK] Seq=1 Ack=988985 Win=999424 Len=0 TSval=2325387519 TSecr=1376425817
238,8.279166,192.168.2.2,192.168.1.2,TCP,66,1006592,5001  >  53148 [ACK] Seq=1 Ack=1004913 Win=1006592 Len=0 TSval=2325387773 TSecr=1376425902
240,8.412408,192.168.2.2,192.168.1.2,TCP,66,1008128,5001  >  53148 [ACK] Seq=1 Ack=1017945 Win=1008128 Len=0 TSval=2325387906 TSecr=1376426047
242,8.522282,192.168.2.2,192.168.1.2,TCP,66,1011712,5001  >  53148 [ACK] Seq=1 Ack=1023737 Win=1011712 Len=0 TSval=2325388016 TSecr=1376426144
244,8.56986,192.168.2.2,192.168.1.2,TCP,66,1009664,5001  >  53148 [ACK] Seq=1 Ack=1033873 Win=1009664 Len=0 TSval=2325388063 TSecr=1376426192
246,8.655467,192.168.2.2,192.168.1.2,TCP,66,1006080,5001  >  53148 [ACK] Seq=1 Ack=1051249 Win=1006080 Len=0 TSval=2325388149 TSecr=1376426278
248,8.800496,192.168.2.2,192.168.1.2,TCP,66,1008640,5001  >  53148 [ACK] Seq=1 Ack=1062833 Win=1008640 Len=0 TSval=2325388294 TSecr=1376426348
251,8.897665,192.168.2.2,192.168.1.2,TCP,66,1011712,5001  >  53148 [ACK] Seq=1 Ack=1068625 Win=1011712 Len=0 TSval=2325388391 TSecr=1376426520
253,8.946223,192.168.2.2,192.168.1.2,TCP,66,1008640,5001  >  53148 [ACK] Seq=1 Ack=1080209 Win=1008640 Len=0 TSval=2325388440 TSecr=1376426568
256,9.043146,192.168.2.2,192.168.1.2,TCP,66,1012736,5001  >  53148 [ACK] Seq=1 Ack=1084553 Win=1012736 Len=0 TSval=2325388536 TSecr=1376426665
258,9.079395,192.168.2.2,192.168.1.2,TCP,66,1008128,5001  >  53148 [ACK] Seq=1 Ack=1097585 Win=1008128 Len=0 TSval=2325388573 TSecr=1376426702
260,9.188381,192.168.2.2,192.168.1.2,TCP,66,1010176,5001  >  53148 [ACK] Seq=1 Ack=1106273 Win=1010176 Len=0 TSval=2325388682 TSecr=1376426860
262,9.261692,192.168.2.2,192.168.1.2,TCP,66,1011200,5001  >  53148 [ACK] Seq=1 Ack=1113513 Win=1011200 Len=0 TSval=2325388755 TSecr=1376426884
264,9.321574,192.168.2.2,192.168.1.2,TCP,66,1008128,5001  >  53148 [ACK] Seq=1 Ack=1126545 Win=1008128 Len=0 TSval=2325388815 TSecr=1376426944
266,9.431268,192.168.2.2,192.168.1.2,TCP,66,1006080,5001  >  53148 [ACK] Seq=1 Ack=1143921 Win=1006080 Len=0 TSval=2325388924 TSecr=1376427053
268,9.575917,192.168.2.2,192.168.1.2,TCP,66,1012736,5001  >  53148 [ACK] Seq=1 Ack=1148265 Win=1012736 Len=0 TSval=2325389069 TSecr=1376427211
270,9.612422,192.168.2.2,192.168.1.2,TCP,66,1013760,5001  >  53148 [ACK] Seq=1 Ack=1149713 Win=1013760 Len=0 TSval=2325389105 TSecr=1376427235
272,9.624838,192.168.2.2,192.168.1.2,TCP,66,1013760,5001  >  53148 [ACK] Seq=1 Ack=1158401 Win=1013760 Len=0 TSval=2325389118 TSecr=1376427248
274,9.697116,192.168.2.2,192.168.1.2,TCP,66,1013760,5001  >  53148 [ACK] Seq=1 Ack=1167089 Win=1013760 Len=0 TSval=2325389190 TSecr=1376427321
276,9.769974,192.168.2.2,192.168.1.2,TCP,66,1013760,5001  >  53148 [ACK] Seq=1 Ack=1171433 Win=1013760 Len=0 TSval=2325389263 TSecr=1376427394
278,9.818967,192.168.2.2,192.168.1.2,TCP,66,1013760,5001  >  53148 [ACK] Seq=1 Ack=1190257 Win=1013760 Len=0 TSval=2325389312 TSecr=1376427430
281,9.964362,192.168.2.2,192.168.1.2,TCP,66,1013760,5001  >  53148 [ACK] Seq=1 Ack=1219217 Win=1013760 Len=0 TSval=2325389457 TSecr=1376427696
285,10.206594,192.168.2.2,192.168.1.2,TCP,66,1008128,5001  >  53148 [ACK] Seq=1 Ack=1232249 Win=1008128 Len=0 TSval=2325389699 TSecr=1376427829
286,10.315542,192.168.2.2,192.168.1.2,TCP,66,1012736,5001  >  53148 [ACK] Seq=1 Ack=1236593 Win=1012736 Len=0 TSval=2325389808 TSecr=1376427939
287,10.352531,192.168.2.2,192.168.1.2,TCP,66,1008640,5001  >  53148 [ACK] Seq=1 Ack=1248177 Win=1008640 Len=0 TSval=2325389845 TSecr=1376427986
288,10.449562,192.168.2.2,192.168.1.2,TCP,66,1006080,5001  >  53148 [ACK] Seq=1 Ack=1265553 Win=1006080 Len=0 TSval=2325389942 TSecr=1376428072
289,10.594152,192.168.2.2,192.168.1.2,TCP,66,1008640,5001  >  53148 [ACK] Seq=1 Ack=1277137 Win=1008640 Len=0 TSval=2325390087 TSecr=1376428217
290,10.691168,192.168.2.2,192.168.1.2,TCP,66,1011712,5001  >  53148 [ACK] Seq=1 Ack=1282929 Win=1011712 Len=0 TSval=2325390184 TSecr=1376428314
291,10.740198,192.168.2.2,192.168.1.2,TCP,66,1008640,5001  >  53148 [ACK] Seq=1 Ack=1294513 Win=1008640 Len=0 TSval=2325390233 TSecr=1376428363
293,10.83719,192.168.2.2,192.168.1.2,TCP,66,1012736,5001  >  53148 [ACK] Seq=1 Ack=1298857 Win=1012736 Len=0 TSval=2325390330 TSecr=1376428459
294,10.873512,192.168.2.2,192.168.1.2,TCP,66,1013248,5001  >  53148 [ACK] Seq=1 Ack=1301753 Win=1013248 Len=0 TSval=2325390366 TSecr=1376428496
295,10.898074,192.168.2.2,192.168.1.2,TCP,66,1005056,5001  >  53148 [ACK] Seq=1 Ack=1320577 Win=1005056 Len=0 TSval=2325390390 TSecr=1376428605
297,11.055679,192.168.2.2,192.168.1.2,TCP,66,1011200,5001  >  53148 [ACK] Seq=1 Ack=1327817 Win=1011200 Len=0 TSval=2325390548 TSecr=1376428678
298,11.116443,192.168.2.2,192.168.1.2,TCP,66,1008128,5001  >  53148 [ACK] Seq=1 Ack=1340849 Win=1008128 Len=0 TSval=2325390609 TSecr=1376428738
299,11.224699,192.168.2.2,192.168.1.2,TCP,66,1006080,5001  >  53148 [ACK] Seq=1 Ack=1358225 Win=1006080 Len=0 TSval=2325390717 TSecr=1376428847
300,11.37088,192.168.2.2,192.168.1.2,TCP,66,1012736,5001  >  53148 [ACK] Seq=1 Ack=1362569 Win=1012736 Len=0 TSval=2325390863 TSecr=1376428992
301,11.406506,192.168.2.2,192.168.1.2,TCP,66,1013760,5001  >  53148 [ACK] Seq=1 Ack=1364017 Win=1013760 Len=0 TSval=2325390899 TSecr=1376429028
302,11.418524,192.168.2.2,192.168.1.2,TCP,66,1013248,5001  >  53148 [ACK] Seq=1 Ack=1366913 Win=1013248 Len=0 TSval=2325390911 TSecr=1376429041
303,11.443352,192.168.2.2,192.168.1.2,TCP,66,1013760,5001  >  53148 [ACK] Seq=1 Ack=1381393 Win=1013760 Len=0 TSval=2325390935 TSecr=1376429113
304,11.564731,192.168.2.2,192.168.1.2,TCP,66,1013760,5001  >  53148 [ACK] Seq=1 Ack=1385737 Win=1013760 Len=0 TSval=2325391057 TSecr=1376429186
305,11.600744,192.168.2.2,192.168.1.2,TCP,66,1013760,5001  >  53148 [ACK] Seq=1 Ack=1404561 Win=1013760 Len=0 TSval=2325391093 TSecr=1376429235
306,11.757662,192.168.2.2,192.168.1.2,TCP,66,1013760,5001  >  53148 [ACK] Seq=1 Ack=1432073 Win=1013760 Len=0 TSval=2325391250 TSecr=1376429380
308,11.987924,192.168.2.2,192.168.1.2,TCP,66,1013760,5001  >  53148 [ACK] Seq=1 Ack=1433521 Win=1013760 Len=0 TSval=2325391480 TSecr=1376429419
312,12.001482,192.168.2.2,192.168.1.2,TCP,66,1013248,5001  >  53148 [ACK] Seq=1 Ack=1436417 Win=1013248 Len=0 TSval=2325391493 TSecr=1376431173
317,12.026082,192.168.2.2,192.168.1.2,TCP,66,1013248,5001  >  53148 [ACK] Seq=1 Ack=1439313 Win=1013248 Len=0 TSval=2325391518 TSecr=1376431403
320,12.050572,192.168.2.2,192.168.1.2,TCP,66,985600,5001  >  53148 [ACK] Seq=1 Ack=1497233 Win=985600 Len=0 TSval=2325391542 TSecr=1376431416
324,12.534377,192.168.2.2,192.168.1.2,TCP,66,982016,5001  >  53148 [ACK] Seq=1 Ack=1562393 Win=982016 Len=0 TSval=2325392026 TSecr=1376431417
330,13.080186,192.168.2.2,192.168.1.2,TCP,66,982016,5001  >  53148 [ACK] Seq=1 Ack=1627553 Win=982016 Len=0 TSval=2325392571 TSecr=1376431417
334,13.624493,192.168.2.2,192.168.1.2,TCP,66,1001472,5001  >  53148 [ACK] Seq=1 Ack=1653617 Win=1001472 Len=0 TSval=2325393115 TSecr=1376431417
336,13.84249,192.168.2.2,192.168.1.2,TCP,66,1011712,5001  >  53148 [ACK] Seq=1 Ack=1659409 Win=1011712 Len=0 TSval=2325393333 TSecr=1376431441
339,13.89173,192.168.2.2,192.168.1.2,TCP,66,997888,5001  >  53148 [ACK] Seq=1 Ack=1692713 Win=997888 Len=0 TSval=2325393383 TSecr=1376431465
341,14.170268,192.168.2.2,192.168.1.2,TCP,66,982016,5001  >  53148 [ACK] Seq=1 Ack=1757873 Win=982016 Len=0 TSval=2325393661 TSecr=1376431466
343,14.715514,192.168.2.2,192.168.1.2,TCP,66,1006080,5001  >  53148 [ACK] Seq=1 Ack=1775249 Win=1006080 Len=0 TSval=2325394206 TSecr=1376431466
344,14.861539,192.168.2.2,192.168.1.2,TCP,66,990720,5001  >  53148 [ACK] Seq=1 Ack=1823033 Win=990720 Len=0 TSval=2325394352 TSecr=1376431949
346,15.260358,192.168.2.2,192.168.1.2,TCP,66,982016,5001  >  53148 [ACK] Seq=1 Ack=1888193 Win=982016 Len=0 TSval=2325394751 TSecr=1376431949
347,15.805417,192.168.2.2,192.168.1.2,TCP,66,1006080,5001  >  53148 [ACK] Seq=1 Ack=1905569 Win=1006080 Len=0 TSval=2325395295 TSecr=1376431949
349,15.951538,192.168.2.2,192.168.1.2,TCP,66,990720,5001  >  53148 [ACK] Seq=1 Ack=1953353 Win=990720 Len=0 TSval=2325395441 TSecr=1376432494
351,16.351285,192.168.2.2,192.168.1.2,TCP,66,982016,5001  >  53148 [ACK] Seq=1 Ack=2018513 Win=982016 Len=0 TSval=2325395841 TSecr=1376432495
352,16.896835,192.168.2.2,192.168.1.2,TCP,66,1048576,5001  >  53148 [ACK] Seq=1 Ack=2035889 Win=1048576 Len=0 TSval=2325396386 TSecr=1376433002
353,17.042315,192.168.2.2,192.168.1.2,TCP,66,1144320,5001  >  53148 [ACK] Seq=1 Ack=2083673 Win=1144320 Len=0 TSval=2325396532 TSecr=1376433039
358,17.442167,192.168.2.2,192.168.1.2,TCP,66,1176064,5001  >  53148 [ACK] Seq=1 Ack=2099601 Win=1176064 Len=0 TSval=2325396931 TSecr=1376433256
373,17.577439,192.168.2.2,192.168.1.2,TCP,66,1179136,5001  >  53148 [ACK] Seq=1 Ack=2101049 Win=1179136 Len=0 TSval=2325397066 TSecr=1376436455
374,17.589603,192.168.2.2,192.168.1.2,TCP,66,1181696,5001  >  53148 [ACK] Seq=1 Ack=2102497 Win=1181696 Len=0 TSval=2325397079 TSecr=1376436465
375,17.601746,192.168.2.2,192.168.1.2,TCP,66,1184768,5001  >  53148 [ACK] Seq=1 Ack=2103945 Win=1184768 Len=0 TSval=2325397091 TSecr=1376436475
378,17.614556,192.168.2.2,192.168.1.2,TCP,66,1187840,5001  >  53148 [ACK] Seq=1 Ack=2105393 Win=1187840 Len=0 TSval=2325397104 TSecr=1376436854
380,17.626939,192.168.2.2,192.168.1.2,TCP,66,1190400,5001  >  53148 [ACK] Seq=1 Ack=2106841 Win=1190400 Len=0 TSval=2325397116 TSecr=1376436864
382,17.63882,192.168.2.2,192.168.1.2,TCP,66,1193472,5001  >  53148 [ACK] Seq=1 Ack=2108289 Win=1193472 Len=0 TSval=2325397128 TSecr=1376436875
384,17.650978,192.168.2.2,192.168.1.2,TCP,66,1196544,5001  >  53148 [ACK] Seq=1 Ack=2109737 Win=1196544 Len=0 TSval=2325397140 TSecr=1376436885
386,17.663148,192.168.2.2,192.168.1.2,TCP,66,1199104,5001  >  53148 [ACK] Seq=1 Ack=2111185 Win=1199104 Len=0 TSval=2325397152 TSecr=1376436895
388,17.675134,192.168.2.2,192.168.1.2,TCP,66,1202176,5001  >  53148 [ACK] Seq=1 Ack=2112633 Win=1202176 Len=0 TSval=2325397164 TSecr=1376436905
390,17.687232,192.168.2.2,192.168.1.2,TCP,66,1205248,5001  >  53148 [ACK] Seq=1 Ack=2114081 Win=1205248 Len=0 TSval=2325397176 TSecr=1376436916
392,17.699429,192.168.2.2,192.168.1.2,TCP,66,1207808,5001  >  53148 [ACK] Seq=1 Ack=2115529 Win=1207808 Len=0 TSval=2325397188 TSecr=1376436927
394,17.711476,192.168.2.2,192.168.1.2,TCP,66,1210880,5001  >  53148 [ACK] Seq=1 Ack=2116977 Win=1210880 Len=0 TSval=2325397200 TSecr=1376436937
396,17.723571,192.168.2.2,192.168.1.2,TCP,66,1213952,5001  >  53148 [ACK] Seq=1 Ack=2118425 Win=1213952 Len=0 TSval=2325397213 TSecr=1376436947
398,17.735688,192.168.2.2,192.168.1.2,TCP,66,1216512,5001  >  53148 [ACK] Seq=1 Ack=2119873 Win=1216512 Len=0 TSval=2325397225 TSecr=1376436957
400,17.747805,192.168.2.2,192.168.1.2,TCP,66,1219584,5001  >  53148 [ACK] Seq=1 Ack=2121321 Win=1219584 Len=0 TSval=2325397237 TSecr=1376437014
402,17.759917,192.168.2.2,192.168.1.2,TCP,66,1222656,5001  >  53148 [ACK] Seq=1 Ack=2122769 Win=1222656 Len=0 TSval=2325397249 TSecr=1376437027
404,17.772072,192.168.2.2,192.168.1.2,TCP,66,1225216,5001  >  53148 [ACK] Seq=1 Ack=2124217 Win=1225216 Len=0 TSval=2325397261 TSecr=1376437039
406,17.784737,192.168.2.2,192.168.1.2,TCP,66,1228288,5001  >  53148 [ACK] Seq=1 Ack=2125665 Win=1228288 Len=0 TSval=2325397274 TSecr=1376437051
408,17.796485,192.168.2.2,192.168.1.2,TCP,66,1231360,5001  >  53148 [ACK] Seq=1 Ack=2127113 Win=1231360 Len=0 TSval=2325397285 TSecr=1376437063
410,17.808357,192.168.2.2,192.168.1.2,TCP,66,1233920,5001  >  53148 [ACK] Seq=1 Ack=2128561 Win=1233920 Len=0 TSval=2325397297 TSecr=1376437075
411,17.821001,192.168.2.2,192.168.1.2,TCP,66,1236992,5001  >  53148 [ACK] Seq=1 Ack=2130009 Win=1236992 Len=0 TSval=2325397310 TSecr=1376437087
412,17.832694,192.168.2.2,192.168.1.2,TCP,66,1240064,5001  >  53148 [ACK] Seq=1 Ack=2131457 Win=1240064 Len=0 TSval=2325397322 TSecr=1376437099
413,17.845471,192.168.2.2,192.168.1.2,TCP,66,1242624,5001  >  53148 [ACK] Seq=1 Ack=2132905 Win=1242624 Len=0 TSval=2325397334 TSecr=1376437111
415,17.857228,192.168.2.2,192.168.1.2,TCP,66,1245696,5001  >  53148 [ACK] Seq=1 Ack=2134353 Win=1245696 Len=0 TSval=2325397346 TSecr=1376437123
417,17.86901,192.168.2.2,192.168.1.2,TCP,66,1248768,5001  >  53148 [ACK] Seq=1 Ack=2135801 Win=1248768 Len=0 TSval=2325397358 TSecr=1376437136
419,17.881735,192.168.2.2,192.168.1.2,TCP,66,1251328,5001  >  53148 [ACK] Seq=1 Ack=2137249 Win=1251328 Len=0 TSval=2325397371 TSecr=1376437148
421,17.893497,192.168.2.2,192.168.1.2,TCP,66,1254400,5001  >  53148 [ACK] Seq=1 Ack=2138697 Win=1254400 Len=0 TSval=2325397382 TSecr=1376437160
423,17.905273,192.168.2.2,192.168.1.2,TCP,66,1256960,5001  >  53148 [ACK] Seq=1 Ack=2140145 Win=1256960 Len=0 TSval=2325397394 TSecr=1376437172
425,17.917443,192.168.2.2,192.168.1.2,TCP,66,1263104,5001  >  53148 [ACK] Seq=1 Ack=2143041 Win=1263104 Len=0 TSval=2325397406 TSecr=1376437184
428,17.941642,192.168.2.2,192.168.1.2,TCP,66,1268736,5001  >  53148 [ACK] Seq=1 Ack=2145937 Win=1268736 Len=0 TSval=2325397430 TSecr=1376437202
431,17.96599,192.168.2.2,192.168.1.2,TCP,66,1274368,5001  >  53148 [ACK] Seq=1 Ack=2148833 Win=1274368 Len=0 TSval=2325397455 TSecr=1376437220
434,17.990549,192.168.2.2,192.168.1.2,TCP,66,1277440,5001  >  53148 [ACK] Seq=1 Ack=2150281 Win=1277440 Len=0 TSval=2325397479 TSecr=1376437257
436,18.002257,192.168.2.2,192.168.1.2,TCP,66,1280512,5001  >  53148 [ACK] Seq=1 Ack=2151729 Win=1280512 Len=0 TSval=2325397491 TSecr=1376437272
438,18.014273,192.168.2.2,192.168.1.2,TCP,66,1283072,5001  >  53148 [ACK] Seq=1 Ack=2153177 Win=1283072 Len=0 TSval=2325397503 TSecr=1376437287
440,18.026394,192.168.2.2,192.168.1.2,TCP,66,1286144,5001  >  53148 [ACK] Seq=1 Ack=2154625 Win=1286144 Len=0 TSval=2325397515 TSecr=1376437299
442,18.038485,192.168.2.2,192.168.1.2,TCP,66,1289216,5001  >  53148 [ACK] Seq=1 Ack=2156073 Win=1289216 Len=0 TSval=2325397527 TSecr=1376437310
444,18.051317,192.168.2.2,192.168.1.2,TCP,66,1291776,5001  >  53148 [ACK] Seq=1 Ack=2157521 Win=1291776 Len=0 TSval=2325397540 TSecr=1376437321
446,18.063093,192.168.2.2,192.168.1.2,TCP,66,1294848,5001  >  53148 [ACK] Seq=1 Ack=2158969 Win=1294848 Len=0 TSval=2325397552 TSecr=1376437332
448,18.074816,192.168.2.2,192.168.1.2,TCP,66,1297920,5001  >  53148 [ACK] Seq=1 Ack=2160417 Win=1297920 Len=0 TSval=2325397564 TSecr=1376437344
451,18.086931,192.168.2.2,192.168.1.2,TCP,66,1300480,5001  >  53148 [ACK] Seq=1 Ack=2161865 Win=1300480 Len=0 TSval=2325397576 TSecr=1376437355
453,18.099844,192.168.2.2,192.168.1.2,TCP,66,1303552,5001  >  53148 [ACK] Seq=1 Ack=2163313 Win=1303552 Len=0 TSval=2325397589 TSecr=1376437367
455,18.111564,192.168.2.2,192.168.1.2,TCP,66,1306624,5001  >  53148 [ACK] Seq=1 Ack=2164761 Win=1306624 Len=0 TSval=2325397600 TSecr=1376437378
457,18.123293,192.168.2.2,192.168.1.2,TCP,66,1309184,5001  >  53148 [ACK] Seq=1 Ack=2166209 Win=1309184 Len=0 TSval=2325397612 TSecr=1376437390
459,18.135477,192.168.2.2,192.168.1.2,TCP,66,1312256,5001  >  53148 [ACK] Seq=1 Ack=2167657 Win=1312256 Len=0 TSval=2325397624 TSecr=1376437402
461,18.147484,192.168.2.2,192.168.1.2,TCP,66,1315328,5001  >  53148 [ACK] Seq=1 Ack=2169105 Win=1315328 Len=0 TSval=2325397636 TSecr=1376437414
463,18.15973,192.168.2.2,192.168.1.2,TCP,66,1317888,5001  >  53148 [ACK] Seq=1 Ack=2170553 Win=1317888 Len=0 TSval=2325397648 TSecr=1376437426
465,18.172447,192.168.2.2,192.168.1.2,TCP,66,1320960,5001  >  53148 [ACK] Seq=1 Ack=2172001 Win=1320960 Len=0 TSval=2325397661 TSecr=1376437438
467,18.184092,192.168.2.2,192.168.1.2,TCP,66,1324032,5001  >  53148 [ACK] Seq=1 Ack=2173449 Win=1324032 Len=0 TSval=2325397673 TSecr=1376437450
469,18.195922,192.168.2.2,192.168.1.2,TCP,66,1326592,5001  >  53148 [ACK] Seq=1 Ack=2174897 Win=1326592 Len=0 TSval=2325397685 TSecr=1376437463
470,18.208564,192.168.2.2,192.168.1.2,TCP,66,1329664,5001  >  53148 [ACK] Seq=1 Ack=2176345 Win=1329664 Len=0 TSval=2325397697 TSecr=1376437475
471,18.220356,192.168.2.2,192.168.1.2,TCP,66,1332736,5001  >  53148 [ACK] Seq=1 Ack=2177793 Win=1332736 Len=0 TSval=2325397709 TSecr=1376437487
473,18.233054,192.168.2.2,192.168.1.2,TCP,66,1335296,5001  >  53148 [ACK] Seq=1 Ack=2179241 Win=1335296 Len=0 TSval=2325397722 TSecr=1376437499
475,18.245842,192.168.2.2,192.168.1.2,TCP,66,1338368,5001  >  53148 [ACK] Seq=1 Ack=2180689 Win=1338368 Len=0 TSval=2325397735 TSecr=1376437512
477,18.257611,192.168.2.2,192.168.1.2,TCP,66,1341440,5001  >  53148 [ACK] Seq=1 Ack=2182137 Win=1341440 Len=0 TSval=2325397746 TSecr=1376437523
479,18.269398,192.168.2.2,192.168.1.2,TCP,66,1344000,5001  >  53148 [ACK] Seq=1 Ack=2183585 Win=1344000 Len=0 TSval=2325397758 TSecr=1376437535
481,18.283638,192.168.2.2,192.168.1.2,TCP,66,1347072,5001  >  53148 [ACK] Seq=1 Ack=2185033 Win=1347072 Len=0 TSval=2325397772 TSecr=1376437547
482,18.293958,192.168.2.2,192.168.1.2,TCP,66,1349632,5001  >  53148 [ACK] Seq=1 Ack=2186481 Win=1349632 Len=0 TSval=2325397783 TSecr=1376437559
485,18.305781,192.168.2.2,192.168.1.2,TCP,66,1355776,5001  >  53148 [ACK] Seq=1 Ack=2189377 Win=1355776 Len=0 TSval=2325397794 TSecr=1376437572
488,18.329941,192.168.2.2,192.168.1.2,TCP,66,1361408,5001  >  53148 [ACK] Seq=1 Ack=2192273 Win=1361408 Len=0 TSval=2325397819 TSecr=1376437589
491,18.354666,192.168.2.2,192.168.1.2,TCP,66,1367040,5001  >  53148 [ACK] Seq=1 Ack=2195169 Win=1367040 Len=0 TSval=2325397843 TSecr=1376437607
494,18.378508,192.168.2.2,192.168.1.2,TCP,66,1370112,5001  >  53148 [ACK] Seq=1 Ack=2196617 Win=1370112 Len=0 TSval=2325397867 TSecr=1376437645
496,18.390835,192.168.2.2,192.168.1.2,TCP,66,1373184,5001  >  53148 [ACK] Seq=1 Ack=2198065 Win=1373184 Len=0 TSval=2325397879 TSecr=1376437660
498,18.402725,192.168.2.2,192.168.1.2,TCP,66,1375744,5001  >  53148 [ACK] Seq=1 Ack=2199513 Win=1375744 Len=0 TSval=2325397891 TSecr=1376437674
500,18.415399,192.168.2.2,192.168.1.2,TCP,66,1378816,5001  >  53148 [ACK] Seq=1 Ack=2200961 Win=1378816 Len=0 TSval=2325397904 TSecr=1376437695
502,18.427179,192.168.2.2,192.168.1.2,TCP,66,1381888,5001  >  53148 [ACK] Seq=1 Ack=2202409 Win=1381888 Len=0 TSval=2325397916 TSecr=1376437706
504,18.439103,192.168.2.2,192.168.1.2,TCP,66,1384448,5001  >  53148 [ACK] Seq=1 Ack=2203857 Win=1384448 Len=0 TSval=2325397928 TSecr=1376437717
506,18.451685,192.168.2.2,192.168.1.2,TCP,66,1387520,5001  >  53148 [ACK] Seq=1 Ack=2205305 Win=1387520 Len=0 TSval=2325397940 TSecr=1376437729
508,18.463181,192.168.2.2,192.168.1.2,TCP,66,1390592,5001  >  53148 [ACK] Seq=1 Ack=2206753 Win=1390592 Len=0 TSval=2325397952 TSecr=1376437741
510,18.475303,192.168.2.2,192.168.1.2,TCP,66,1393152,5001  >  53148 [ACK] Seq=1 Ack=2208201 Win=1393152 Len=0 TSval=2325397964 TSecr=1376437752
512,18.487406,192.168.2.2,192.168.1.2,TCP,66,1396224,5001  >  53148 [ACK] Seq=1 Ack=2209649 Win=1396224 Len=0 TSval=2325397976 TSecr=1376437763
514,18.499607,192.168.2.2,192.168.1.2,TCP,66,1399296,5001  >  53148 [ACK] Seq=1 Ack=2211097 Win=1399296 Len=0 TSval=2325397988 TSecr=1376437774
516,18.511631,192.168.2.2,192.168.1.2,TCP,66,1401856,5001  >  53148 [ACK] Seq=1 Ack=2212545 Win=1401856 Len=0 TSval=2325398000 TSecr=1376437786
518,18.523742,192.168.2.2,192.168.1.2,TCP,66,1404928,5001  >  53148 [ACK] Seq=1 Ack=2213993 Win=1404928 Len=0 TSval=2325398012 TSecr=1376437797
520,18.535872,192.168.2.2,192.168.1.2,TCP,66,1408000,5001  >  53148 [ACK] Seq=1 Ack=2215441 Win=1408000 Len=0 TSval=2325398024 TSecr=1376437808
522,18.548011,192.168.2.2,192.168.1.2,TCP,66,1410560,5001  >  53148 [ACK] Seq=1 Ack=2216889 Win=1410560 Len=0 TSval=2325398037 TSecr=1376437819
524,18.560455,192.168.2.2,192.168.1.2,TCP,66,1413632,5001  >  53148 [ACK] Seq=1 Ack=2218337 Win=1413632 Len=0 TSval=2325398049 TSecr=1376437831
526,18.572248,192.168.2.2,192.168.1.2,TCP,66,1416704,5001  >  53148 [ACK] Seq=1 Ack=2219785 Win=1416704 Len=0 TSval=2325398061 TSecr=1376437842
528,18.584287,192.168.2.2,192.168.1.2,TCP,66,1419264,5001  >  53148 [ACK] Seq=1 Ack=2221233 Win=1419264 Len=0 TSval=2325398073 TSecr=1376437853
529,18.596547,192.168.2.2,192.168.1.2,TCP,66,1422336,5001  >  53148 [ACK] Seq=1 Ack=2222681 Win=1422336 Len=0 TSval=2325398085 TSecr=1376437864
530,18.608546,192.168.2.2,192.168.1.2,TCP,66,1425408,5001  >  53148 [ACK] Seq=1 Ack=2224129 Win=1425408 Len=0 TSval=2325398097 TSecr=1376437876
531,18.620675,192.168.2.2,192.168.1.2,TCP,66,1427968,5001  >  53148 [ACK] Seq=1 Ack=2225577 Win=1427968 Len=0 TSval=2325398109 TSecr=1376437887
533,18.632767,192.168.2.2,192.168.1.2,TCP,66,1431040,5001  >  53148 [ACK] Seq=1 Ack=2227025 Win=1431040 Len=0 TSval=2325398121 TSecr=1376437899
535,18.645228,192.168.2.2,192.168.1.2,TCP,66,1434112,5001  >  53148 [ACK] Seq=1 Ack=2228473 Win=1434112 Len=0 TSval=2325398134 TSecr=1376437911
537,18.657105,192.168.2.2,192.168.1.2,TCP,66,1436672,5001  >  53148 [ACK] Seq=1 Ack=2229921 Win=1436672 Len=0 TSval=2325398146 TSecr=1376437923
539,18.669738,192.168.2.2,192.168.1.2,TCP,66,1439744,5001  >  53148 [ACK] Seq=1 Ack=2231369 Win=1439744 Len=0 TSval=2325398158 TSecr=1376437935
541,18.6815,192.168.2.2,192.168.1.2,TCP,66,1442304,5001  >  53148 [ACK] Seq=1 Ack=2232817 Win=1442304 Len=0 TSval=2325398170 TSecr=1376437947
543,18.693352,192.168.2.2,192.168.1.2,TCP,66,1448448,5001  >  53148 [ACK] Seq=1 Ack=2235713 Win=1448448 Len=0 TSval=2325398182 TSecr=1376437960
546,18.717779,192.168.2.2,192.168.1.2,TCP,66,1454080,5001  >  53148 [ACK] Seq=1 Ack=2238609 Win=1454080 Len=0 TSval=2325398206 TSecr=1376437978
549,18.742242,192.168.2.2,192.168.1.2,TCP,66,1459712,5001  >  53148 [ACK] Seq=1 Ack=2241505 Win=1459712 Len=0 TSval=2325398231 TSecr=1376437995
552,18.765981,192.168.2.2,192.168.1.2,TCP,66,1462784,5001  >  53148 [ACK] Seq=1 Ack=2242953 Win=1462784 Len=0 TSval=2325398254 TSecr=1376438032
554,18.778472,192.168.2.2,192.168.1.2,TCP,66,1465856,5001  >  53148 [ACK] Seq=1 Ack=2244401 Win=1465856 Len=0 TSval=2325398267 TSecr=1376438047
556,18.790296,192.168.2.2,192.168.1.2,TCP,66,1468416,5001  >  53148 [ACK] Seq=1 Ack=2245849 Win=1468416 Len=0 TSval=2325398279 TSecr=1376438062
558,18.80232,192.168.2.2,192.168.1.2,TCP,66,1471488,5001  >  53148 [ACK] Seq=1 Ack=2247297 Win=1471488 Len=0 TSval=2325398291 TSecr=1376438073
560,18.814483,192.168.2.2,192.168.1.2,TCP,66,1474560,5001  >  53148 [ACK] Seq=1 Ack=2248745 Win=1474560 Len=0 TSval=2325398303 TSecr=1376438084
562,18.826572,192.168.2.2,192.168.1.2,TCP,66,1477120,5001  >  53148 [ACK] Seq=1 Ack=2250193 Win=1477120 Len=0 TSval=2325398315 TSecr=1376438095
564,18.838693,192.168.2.2,192.168.1.2,TCP,66,1480192,5001  >  53148 [ACK] Seq=1 Ack=2251641 Win=1480192 Len=0 TSval=2325398327 TSecr=1376438106
566,18.85076,192.168.2.2,192.168.1.2,TCP,66,1483264,5001  >  53148 [ACK] Seq=1 Ack=2253089 Win=1483264 Len=0 TSval=2325398339 TSecr=1376438117
568,18.86373,192.168.2.2,192.168.1.2,TCP,66,1485824,5001  >  53148 [ACK] Seq=1 Ack=2254537 Win=1485824 Len=0 TSval=2325398352 TSecr=1376438129
570,18.8755,192.168.2.2,192.168.1.2,TCP,66,1488896,5001  >  53148 [ACK] Seq=1 Ack=2255985 Win=1488896 Len=0 TSval=2325398364 TSecr=1376438141
572,18.887112,192.168.2.2,192.168.1.2,TCP,66,1491968,5001  >  53148 [ACK] Seq=1 Ack=2257433 Win=1491968 Len=0 TSval=2325398375 TSecr=1376438154
574,18.899212,192.168.2.2,192.168.1.2,TCP,66,1494528,5001  >  53148 [ACK] Seq=1 Ack=2258881 Win=1494528 Len=0 TSval=2325398388 TSecr=1376438165
576,18.911318,192.168.2.2,192.168.1.2,TCP,66,1497600,5001  >  53148 [ACK] Seq=1 Ack=2260329 Win=1497600 Len=0 TSval=2325398400 TSecr=1376438177
578,18.923513,192.168.2.2,192.168.1.2,TCP,66,1500672,5001  >  53148 [ACK] Seq=1 Ack=2261777 Win=1500672 Len=0 TSval=2325398412 TSecr=1376438190
580,18.935561,192.168.2.2,192.168.1.2,TCP,66,1503232,5001  >  53148 [ACK] Seq=1 Ack=2263225 Win=1503232 Len=0 TSval=2325398424 TSecr=1376438202
582,18.948082,192.168.2.2,192.168.1.2,TCP,66,1506304,5001  >  53148 [ACK] Seq=1 Ack=2264673 Win=1506304 Len=0 TSval=2325398436 TSecr=1376438214
584,18.959876,192.168.2.2,192.168.1.2,TCP,66,1509376,5001  >  53148 [ACK] Seq=1 Ack=2266121 Win=1509376 Len=0 TSval=2325398448 TSecr=1376438226
586,18.971906,192.168.2.2,192.168.1.2,TCP,66,1511936,5001  >  53148 [ACK] Seq=1 Ack=2267569 Win=1511936 Len=0 TSval=2325398460 TSecr=1376438238
587,18.984377,192.168.2.2,192.168.1.2,TCP,66,1515008,5001  >  53148 [ACK] Seq=1 Ack=2269017 Win=1515008 Len=0 TSval=2325398473 TSecr=1376438250
588,18.996125,192.168.2.2,192.168.1.2,TCP,66,1518080,5001  >  53148 [ACK] Seq=1 Ack=2270465 Win=1518080 Len=0 TSval=2325398484 TSecr=1376438262
589,19.008246,192.168.2.2,192.168.1.2,TCP,66,1518592,5001  >  53148 [ACK] Seq=1 Ack=2271913 Win=1518592 Len=0 TSval=2325398497 TSecr=1376438275
591,19.020582,192.168.2.2,192.168.1.2,TCP,66,1518592,5001  >  53148 [ACK] Seq=1 Ack=2273361 Win=1518592 Len=0 TSval=2325398509 TSecr=1376438287
593,19.033317,192.168.2.2,192.168.1.2,TCP,66,1518592,5001  >  53148 [ACK] Seq=1 Ack=2274809 Win=1518592 Len=0 TSval=2325398522 TSecr=1376438299
595,19.045117,192.168.2.2,192.168.1.2,TCP,66,1518592,5001  >  53148 [ACK] Seq=1 Ack=2276257 Win=1518592 Len=0 TSval=2325398533 TSecr=1376438311
597,19.056866,192.168.2.2,192.168.1.2,TCP,66,1518592,5001  >  53148 [ACK] Seq=1 Ack=2277705 Win=1518592 Len=0 TSval=2325398545 TSecr=1376438323
599,19.068788,192.168.2.2,192.168.1.2,TCP,66,1518592,5001  >  53148 [ACK] Seq=1 Ack=2279153 Win=1518592 Len=0 TSval=2325398557 TSecr=1376438335
602,19.080935,192.168.2.2,192.168.1.2,TCP,66,1517568,5001  >  53148 [ACK] Seq=1 Ack=2282049 Win=1517568 Len=0 TSval=2325398569 TSecr=1376438347
605,19.105164,192.168.2.2,192.168.1.2,TCP,66,1517568,5001  >  53148 [ACK] Seq=1 Ack=2284945 Win=1517568 Len=0 TSval=2325398593 TSecr=1376438364
608,19.129391,192.168.2.2,192.168.1.2,TCP,66,1517568,5001  >  53148 [ACK] Seq=1 Ack=2287841 Win=1517568 Len=0 TSval=2325398618 TSecr=1376438382
611,19.15382,192.168.2.2,192.168.1.2,TCP,66,1518592,5001  >  53148 [ACK] Seq=1 Ack=2289289 Win=1518592 Len=0 TSval=2325398642 TSecr=1376438420
613,19.165689,192.168.2.2,192.168.1.2,TCP,66,1518592,5001  >  53148 [ACK] Seq=1 Ack=2290737 Win=1518592 Len=0 TSval=2325398654 TSecr=1376438435
615,19.177798,192.168.2.2,192.168.1.2,TCP,66,1518592,5001  >  53148 [ACK] Seq=1 Ack=2292185 Win=1518592 Len=0 TSval=2325398666 TSecr=1376438450
617,19.189934,192.168.2.2,192.168.1.2,TCP,66,1518592,5001  >  53148 [ACK] Seq=1 Ack=2293633 Win=1518592 Len=0 TSval=2325398678 TSecr=1376438461
619,19.202038,192.168.2.2,192.168.1.2,TCP,66,1518592,5001  >  53148 [ACK] Seq=1 Ack=2295081 Win=1518592 Len=0 TSval=2325398690 TSecr=1376438472
621,19.214174,192.168.2.2,192.168.1.2,TCP,66,1518592,5001  >  53148 [ACK] Seq=1 Ack=2296529 Win=1518592 Len=0 TSval=2325398702 TSecr=1376438484
624,19.22705,192.168.2.2,192.168.1.2,TCP,66,1518592,5001  >  53148 [ACK] Seq=1 Ack=2297977 Win=1518592 Len=0 TSval=2325398715 TSecr=1376438495
626,19.23924,192.168.2.2,192.168.1.2,TCP,66,1518592,5001  >  53148 [ACK] Seq=1 Ack=2299425 Win=1518592 Len=0 TSval=2325398727 TSecr=1376438506
628,19.263685,192.168.2.2,192.168.1.2,TCP,66,1518592,5001  >  53148 [ACK] Seq=1 Ack=2302321 Win=1518592 Len=0 TSval=2325398752 TSecr=1376438517
631,19.287599,192.168.2.2,192.168.1.2,TCP,66,1518592,5001  >  53148 [ACK] Seq=1 Ack=2305217 Win=1518592 Len=0 TSval=2325398776 TSecr=1376438541
634,19.312658,192.168.2.2,192.168.1.2,TCP,66,1518592,5001  >  53148 [ACK] Seq=1 Ack=2308113 Win=1518592 Len=0 TSval=2325398801 TSecr=1376438565
