No.,Time,Source,Destination,Protocol,Length,Calculated window size,Info
4,0.00208,192.168.2.2,192.168.1.2,TCP,74,43440,"5001  >  45128 [SYN, ACK] Seq=0 Ack=1 Win=43440 Len=0 MSS=1460 SACK_PERM=1 TSval=1024158530 TSecr=1379230802 WS=512"
7,0.002146,192.168.2.2,192.168.1.2,TCP,66,39936,5001  >  45128 [ACK] Seq=1 Ack=7241 Win=39936 Len=0 TSval=1024158530 TSecr=1379230802
12,0.051114,192.168.2.2,192.168.1.2,TCP,66,38400,5001  >  45128 [ACK] Seq=1 Ack=17377 Win=38400 Len=0 TSval=1024158579 TSecr=1379230803
16,0.136088,192.168.2.2,192.168.1.2,TCP,66,38400,5001  >  45128 [ACK] Seq=1 Ack=27513 Win=38400 Len=0 TSval=1024158664 TSecr=1379230803
20,0.220604,192.168.2.2,192.168.1.2,TCP,66,42496,5001  >  45128 [ACK] Seq=1 Ack=28961 Win=42496 Len=0 TSval=1024158749 TSecr=1379230804
22,0.232717,192.168.2.2,192.168.1.2,TCP,66,42496,5001  >  45128 [ACK] Seq=1 Ack=30409 Win=42496 Len=0 TSval=1024158761 TSecr=1379230818
25,0.244897,192.168.2.2,192.168.1.2,TCP,66,35328,5001  >  45128 [ACK] Seq=1 Ack=46337 Win=35328 Len=0 TSval=1024158773 TSecr=1379230851
27,0.378198,192.168.2.2,192.168.1.2,TCP,66,41984,5001  >  45128 [ACK] Seq=1 Ack=49233 Win=41984 Len=0 TSval=1024158906 TSecr=1379230877
29,0.402962,192.168.2.2,192.168.1.2,TCP,66,45568,5001  >  45128 [ACK] Seq=1 Ack=50681 Win=45568 Len=0 TSval=1024158931 TSecr=1379230936
31,0.41539,192.168.2.2,192.168.1.2,TCP,66,75776,5001  >  45128 [ACK] Seq=1 Ack=65913 Win=75776 Len=0 TSval=1024158943 TSecr=1379230936
35,0.542762,192.168.2.2,192.168.1.2,TCP,78,75776,[TCP Dup ACK 31#1] 5001  >  45128 [ACK] Seq=1 Ack=65913 Win=75776 Len=0 TSval=1024159071 TSecr=1379230989 SLE=65161 SRE=65913
37,0.549763,192.168.2.2,192.168.1.2,TCP,66,84480,5001  >  45128 [ACK] Seq=1 Ack=70257 Win=84480 Len=0 TSval=1024159078 TSecr=1379231021
39,0.585928,192.168.2.2,192.168.1.2,TCP,66,87552,5001  >  45128 [ACK] Seq=1 Ack=71705 Win=87552 Len=0 TSval=1024159114 TSecr=1379231033
41,0.598661,192.168.2.2,192.168.1.2,TCP,66,90112,5001  >  45128 [ACK] Seq=1 Ack=72401 Win=90112 Len=0 TSval=1024159126 TSecr=1379231033
43,0.604566,192.168.2.2,192.168.1.2,TCP,66,93184,5001  >  45128 [ACK] Seq=1 Ack=81089 Win=93184 Len=0 TSval=1024159132 TSecr=1379231045
45,0.677225,192.168.2.2,192.168.1.2,TCP,66,93184,5001  >  45128 [ACK] Seq=1 Ack=89777 Win=93184 Len=0 TSval=1024159205 TSecr=1379231178
48,0.749948,192.168.2.2,192.168.1.2,TCP,66,95232,5001  >  45128 [ACK] Seq=1 Ack=94121 Win=95232 Len=0 TSval=1024159278 TSecr=1379231203
50,0.786806,192.168.2.2,192.168.1.2,TCP,66,86528,5001  >  45128 [ACK] Seq=1 Ack=115841 Win=86528 Len=0 TSval=1024159314 TSecr=1379231215
53,0.968216,192.168.2.2,192.168.1.2,TCP,66,86528,5001  >  45128 [ACK] Seq=1 Ack=137561 Win=86528 Len=0 TSval=1024159496 TSecr=1379231215
56,1.149568,192.168.2.2,192.168.1.2,TCP,66,101376,5001  >  45128 [ACK] Seq=1 Ack=140457 Win=101376 Len=0 TSval=1024159677 TSecr=1379231343
58,1.173811,192.168.2.2,192.168.1.2,TCP,66,127488,5001  >  45128 [ACK] Seq=1 Ack=153489 Win=127488 Len=0 TSval=1024159701 TSecr=1379231350
61,1.282822,192.168.2.2,192.168.1.2,TCP,66,135680,5001  >  45128 [ACK] Seq=1 Ack=157833 Win=135680 Len=0 TSval=1024159810 TSecr=1379231386
64,1.319254,192.168.2.2,192.168.1.2,TCP,66,138752,5001  >  45128 [ACK] Seq=1 Ack=159281 Win=138752 Len=0 TSval=1024159847 TSecr=1379231398
66,1.331265,192.168.2.2,192.168.1.2,TCP,66,168960,5001  >  45128 [ACK] Seq=1 Ack=174273 Win=168960 Len=0 TSval=1024159859 TSecr=1379231404
69,1.457001,192.168.2.2,192.168.1.2,TCP,66,180224,5001  >  45128 [ACK] Seq=1 Ack=180065 Win=180224 Len=0 TSval=1024159984 TSecr=1379231477
75,1.505441,192.168.2.2,192.168.1.2,TCP,66,183296,5001  >  45128 [ACK] Seq=1 Ack=181001 Win=183296 Len=0 TSval=1024160033 TSecr=1379231477
77,1.51406,192.168.2.2,192.168.1.2,TCP,66,197632,5001  >  45128 [ACK] Seq=1 Ack=188241 Win=197632 Len=0 TSval=1024160041 TSecr=1379231550
80,1.574784,192.168.2.2,192.168.1.2,TCP,66,223744,5001  >  45128 [ACK] Seq=1 Ack=201273 Win=223744 Len=0 TSval=1024160102 TSecr=1379231586
82,1.683076,192.168.2.2,192.168.1.2,TCP,66,226816,5001  >  45128 [ACK] Seq=1 Ack=202721 Win=226816 Len=0 TSval=1024160210 TSecr=1379231768
86,1.697223,192.168.2.2,192.168.1.2,TCP,66,270336,5001  >  45128 [ACK] Seq=1 Ack=224441 Win=270336 Len=0 TSval=1024160224 TSecr=1379231949
89,1.87955,192.168.2.2,192.168.1.2,TCP,66,304640,5001  >  45128 [ACK] Seq=1 Ack=246161 Win=304640 Len=0 TSval=1024160407 TSecr=1379231973
92,2.0606,192.168.2.2,192.168.1.2,TCP,66,304640,5001  >  45128 [ACK] Seq=1 Ack=267881 Win=304640 Len=0 TSval=1024160588 TSecr=1379231973
94,2.242266,192.168.2.2,192.168.1.2,TCP,66,304640,5001  >  45128 [ACK] Seq=1 Ack=289601 Win=304640 Len=0 TSval=1024160769 TSecr=1379232082
98,2.423906,192.168.2.2,192.168.1.2,TCP,66,310784,5001  >  45128 [ACK] Seq=1 Ack=292497 Win=310784 Len=0 TSval=1024160951 TSecr=1379232101
100,2.448142,192.168.2.2,192.168.1.2,TCP,66,319488,5001  >  45128 [ACK] Seq=1 Ack=296841 Win=319488 Len=0 TSval=1024160975 TSecr=1379232119
102,2.484607,192.168.2.2,192.168.1.2,TCP,66,348160,5001  >  45128 [ACK] Seq=1 Ack=311321 Win=348160 Len=0 TSval=1024161011 TSecr=1379232131
104,2.605621,192.168.2.2,192.168.1.2,TCP,66,391680,5001  >  45128 [ACK] Seq=1 Ack=333041 Win=391680 Len=0 TSval=1024161132 TSecr=1379232131
108,2.787302,192.168.2.2,192.168.1.2,TCP,66,435200,5001  >  45128 [ACK] Seq=1 Ack=354761 Win=435200 Len=0 TSval=1024161314 TSecr=1379232256
111,2.969455,192.168.2.2,192.168.1.2,TCP,66,443904,5001  >  45128 [ACK] Seq=1 Ack=359105 Win=443904 Len=0 TSval=1024161496 TSecr=1379232256
113,3.005707,192.168.2.2,192.168.1.2,TCP,66,454144,5001  >  45128 [ACK] Seq=1 Ack=364297 Win=454144 Len=0 TSval=1024161532 TSecr=1379232305
116,3.049748,192.168.2.2,192.168.1.2,TCP,66,477184,5001  >  45128 [ACK] Seq=1 Ack=375881 Win=477184 Len=0 TSval=1024161576 TSecr=1379232313
118,3.14594,192.168.2.2,192.168.1.2,TCP,66,480256,5001  >  45128 [ACK] Seq=1 Ack=376481 Win=480256 Len=0 TSval=1024161672 TSecr=1379232314
120,3.151729,192.168.2.2,192.168.1.2,TCP,66,481280,5001  >  45128 [ACK] Seq=1 Ack=398201 Win=481280 Len=0 TSval=1024161678 TSecr=1379232374
122,3.332854,192.168.2.2,192.168.1.2,TCP,66,483840,5001  >  45128 [ACK] Seq=1 Ack=415577 Win=483840 Len=0 TSval=1024161859 TSecr=1379232482
124,3.478216,192.168.2.2,192.168.1.2,TCP,66,489984,5001  >  45128 [ACK] Seq=1 Ack=419921 Win=489984 Len=0 TSval=1024162005 TSecr=1379232496
126,3.515341,192.168.2.2,192.168.1.2,TCP,66,483840,5001  >  45128 [ACK] Seq=1 Ack=437297 Win=483840 Len=0 TSval=1024162042 TSecr=1379232613
128,3.660409,192.168.2.2,192.168.1.2,TCP,66,489984,5001  >  45128 [ACK] Seq=1 Ack=441641 Win=489984 Len=0 TSval=1024162187 TSecr=1379232679
131,3.698175,192.168.2.2,192.168.1.2,TCP,66,481280,5001  >  45128 [ACK] Seq=1 Ack=463361 Win=481280 Len=0 TSval=1024162224 TSecr=1379232860
134,3.87939,192.168.2.2,192.168.1.2,TCP,66,533504,5001  >  45128 [ACK] Seq=1 Ack=485081 Win=533504 Len=0 TSval=1024162405 TSecr=1379233041
137,4.061225,192.168.2.2,192.168.1.2,TCP,66,568320,5001  >  45128 [ACK] Seq=1 Ack=502457 Win=568320 Len=0 TSval=1024162587 TSecr=1379233124
139,4.207423,192.168.2.2,192.168.1.2,TCP,66,573952,5001  >  45128 [ACK] Seq=1 Ack=505353 Win=573952 Len=0 TSval=1024162733 TSecr=1379233223
141,4.230684,192.168.2.2,192.168.1.2,TCP,66,577024,5001  >  45128 [ACK] Seq=1 Ack=506801 Win=577024 Len=0 TSval=1024162757 TSecr=1379233247
143,4.24343,192.168.2.2,192.168.1.2,TCP,66,611840,5001  >  45128 [ACK] Seq=1 Ack=524177 Win=611840 Len=0 TSval=1024162769 TSecr=1379233283
146,4.388544,192.168.2.2,192.168.1.2,TCP,66,620544,5001  >  45128 [ACK] Seq=1 Ack=528521 Win=620544 Len=0 TSval=1024162914 TSecr=1379233404
148,4.42448,192.168.2.2,192.168.1.2,TCP,66,664064,5001  >  45128 [ACK] Seq=1 Ack=550241 Win=664064 Len=0 TSval=1024162950 TSecr=1379233586
150,4.606148,192.168.2.2,192.168.1.2,TCP,66,698880,5001  >  45128 [ACK] Seq=1 Ack=567617 Win=698880 Len=0 TSval=1024163132 TSecr=1379233636
152,4.752078,192.168.2.2,192.168.1.2,TCP,66,707584,5001  >  45128 [ACK] Seq=1 Ack=571961 Win=707584 Len=0 TSval=1024163278 TSecr=1379233768
154,4.788437,192.168.2.2,192.168.1.2,TCP,66,718848,5001  >  45128 [ACK] Seq=1 Ack=577753 Win=718848 Len=0 TSval=1024163314 TSecr=1379233804
157,4.837024,192.168.2.2,192.168.1.2,TCP,66,741888,5001  >  45128 [ACK] Seq=1 Ack=589337 Win=741888 Len=0 TSval=1024163363 TSecr=1379233848
159,4.933959,192.168.2.2,192.168.1.2,TCP,66,744960,5001  >  45128 [ACK] Seq=1 Ack=590785 Win=744960 Len=0 TSval=1024163460 TSecr=1379233944
161,4.946267,192.168.2.2,192.168.1.2,TCP,66,753664,5001  >  45128 [ACK] Seq=1 Ack=595129 Win=753664 Len=0 TSval=1024163472 TSecr=1379233950
163,4.982382,192.168.2.2,192.168.1.2,TCP,66,741888,5001  >  45128 [ACK] Seq=1 Ack=629881 Win=741888 Len=0 TSval=1024163508 TSecr=1379234131
166,5.273507,192.168.2.2,192.168.1.2,TCP,66,757248,5001  >  45128 [ACK] Seq=1 Ack=634225 Win=757248 Len=0 TSval=1024163799 TSecr=1379234277
168,5.309745,192.168.2.2,192.168.1.2,TCP,66,756736,5001  >  45128 [ACK] Seq=1 Ack=640017 Win=756736 Len=0 TSval=1024163835 TSecr=1379234314
170,5.357941,192.168.2.2,192.168.1.2,TCP,66,751616,5001  >  45128 [ACK] Seq=1 Ack=655945 Win=751616 Len=0 TSval=1024163883 TSecr=1379234459
173,5.4911,192.168.2.2,192.168.1.2,TCP,66,748544,5001  >  45128 [ACK] Seq=1 Ack=677665 Win=748544 Len=0 TSval=1024164016 TSecr=1379234496
175,5.672741,192.168.2.2,192.168.1.2,TCP,66,755712,5001  >  45128 [ACK] Seq=1 Ack=684905 Win=755712 Len=0 TSval=1024164198 TSecr=1379234678
178,5.734592,192.168.2.2,192.168.1.2,TCP,66,743424,5001  >  45128 [ACK] Seq=1 Ack=716761 Win=743424 Len=0 TSval=1024164260 TSecr=1379234859
181,6.000601,192.168.2.2,192.168.1.2,TCP,66,757760,5001  >  45128 [ACK] Seq=1 Ack=719657 Win=757760 Len=0 TSval=1024164526 TSecr=1379235005
184,6.025171,192.168.2.2,192.168.1.2,TCP,66,758784,5001  >  45128 [ACK] Seq=1 Ack=721105 Win=758784 Len=0 TSval=1024164550 TSecr=1379235029
187,6.037017,192.168.2.2,192.168.1.2,TCP,66,755200,5001  >  45128 [ACK] Seq=1 Ack=729793 Win=755200 Len=0 TSval=1024164562 TSecr=1379235041
189,6.110383,192.168.2.2,192.168.1.2,TCP,66,755200,5001  >  45128 [ACK] Seq=1 Ack=738481 Win=755200 Len=0 TSval=1024164635 TSecr=1379235172
191,6.182966,192.168.2.2,192.168.1.2,TCP,66,757248,5001  >  45128 [ACK] Seq=1 Ack=742825 Win=757248 Len=0 TSval=1024164708 TSecr=1379235186
193,6.219181,192.168.2.2,192.168.1.2,TCP,66,748544,5001  >  45128 [ACK] Seq=1 Ack=764545 Win=748544 Len=0 TSval=1024164744 TSecr=1379235222
195,6.400552,192.168.2.2,192.168.1.2,TCP,66,754176,5001  >  45128 [ACK] Seq=1 Ack=774681 Win=754176 Len=0 TSval=1024164925 TSecr=1379235404
197,6.485804,192.168.2.2,192.168.1.2,TCP,66,753664,5001  >  45128 [ACK] Seq=1 Ack=786265 Win=753664 Len=0 TSval=1024165011 TSecr=1379235550
199,6.582046,192.168.2.2,192.168.1.2,TCP,66,756736,5001  >  45128 [ACK] Seq=1 Ack=792057 Win=756736 Len=0 TSval=1024165107 TSecr=1379235586
201,6.630796,192.168.2.2,192.168.1.2,TCP,66,753664,5001  >  45128 [ACK] Seq=1 Ack=803641 Win=753664 Len=0 TSval=1024165156 TSecr=1379235635
203,6.727904,192.168.2.2,192.168.1.2,TCP,66,758784,5001  >  45128 [ACK] Seq=1 Ack=805089 Win=758784 Len=0 TSval=1024165253 TSecr=1379235732
205,6.739629,192.168.2.2,192.168.1.2,TCP,66,757248,5001  >  45128 [ACK] Seq=1 Ack=809433 Win=757248 Len=0 TSval=1024165264 TSecr=1379235744
208,6.775863,192.168.2.2,192.168.1.2,TCP,66,754176,5001  >  45128 [ACK] Seq=1 Ack=819569 Win=754176 Len=0 TSval=1024165301 TSecr=1379235780
211,6.861322,192.168.2.2,192.168.1.2,TCP,66,744960,5001  >  45128 [ACK] Seq=1 Ack=848529 Win=744960 Len=0 TSval=1024165386 TSecr=1379236071
215,7.104266,192.168.2.2,192.168.1.2,TCP,66,756736,5001  >  45128 [ACK] Seq=1 Ack=854321 Win=756736 Len=0 TSval=1024165629 TSecr=1379236107
217,7.152245,192.168.2.2,192.168.1.2,TCP,66,753664,5001  >  45128 [ACK] Seq=1 Ack=865905 Win=753664 Len=0 TSval=1024165677 TSecr=1379236155
219,7.2489,192.168.2.2,192.168.1.2,TCP,66,757248,5001  >  45128 [ACK] Seq=1 Ack=870249 Win=757248 Len=0 TSval=1024165773 TSecr=1379236195
221,7.285595,192.168.2.2,192.168.1.2,TCP,66,748544,5001  >  45128 [ACK] Seq=1 Ack=891969 Win=748544 Len=0 TSval=1024165810 TSecr=1379236288
224,7.467441,192.168.2.2,192.168.1.2,TCP,66,755712,5001  >  45128 [ACK] Seq=1 Ack=899209 Win=755712 Len=0 TSval=1024165992 TSecr=1379236470
226,7.528022,192.168.2.2,192.168.1.2,TCP,66,753152,5001  >  45128 [ACK] Seq=1 Ack=912241 Win=753152 Len=0 TSval=1024166052 TSecr=1379236532
228,7.637416,192.168.2.2,192.168.1.2,TCP,66,750080,5001  >  45128 [ACK] Seq=1 Ack=931065 Win=750080 Len=0 TSval=1024166162 TSecr=1379236707
230,7.794487,192.168.2.2,192.168.1.2,TCP,66,757760,5001  >  45128 [ACK] Seq=1 Ack=933961 Win=757760 Len=0 TSval=1024166319 TSecr=1379236798
232,7.819733,192.168.2.2,192.168.1.2,TCP,66,758784,5001  >  45128 [ACK] Seq=1 Ack=935409 Win=758784 Len=0 TSval=1024166344 TSecr=1379236822
235,7.831617,192.168.2.2,192.168.1.2,TCP,66,755200,5001  >  45128 [ACK] Seq=1 Ack=944097 Win=755200 Len=0 TSval=1024166356 TSecr=1379236834
237,7.904307,192.168.2.2,192.168.1.2,TCP,66,755200,5001  >  45128 [ACK] Seq=1 Ack=952785 Win=755200 Len=0 TSval=1024166428 TSecr=1379236907
239,7.977093,192.168.2.2,192.168.1.2,TCP,66,757248,5001  >  45128 [ACK] Seq=1 Ack=957129 Win=757248 Len=0 TSval=1024166501 TSecr=1379236980
241,8.01374,192.168.2.2,192.168.1.2,TCP,66,758784,5001  >  45128 [ACK] Seq=1 Ack=958577 Win=758784 Len=0 TSval=1024166538 TSecr=1379237016
243,8.025504,192.168.2.2,192.168.1.2,TCP,66,744448,5001  >  45128 [ACK] Seq=1 Ack=988985 Win=744448 Len=0 TSval=1024166550 TSecr=1379237197
246,8.280291,192.168.2.2,192.168.1.2,TCP,66,753664,5001  >  45128 [ACK] Seq=1 Ack=1000569 Win=753664 Len=0 TSval=1024166804 TSecr=1379237283
248,8.377302,192.168.2.2,192.168.1.2,TCP,66,757248,5001  >  45128 [ACK] Seq=1 Ack=1004913 Win=757248 Len=0 TSval=1024166901 TSecr=1379237379
250,8.412983,192.168.2.2,192.168.1.2,TCP,66,753152,5001  >  45128 [ACK] Seq=1 Ack=1017945 Win=753152 Len=0 TSval=1024166937 TSecr=1379237428
252,8.522332,192.168.2.2,192.168.1.2,TCP,66,758784,5001  >  45128 [ACK] Seq=1 Ack=1019393 Win=758784 Len=0 TSval=1024167046 TSecr=1379237525
254,8.534107,192.168.2.2,192.168.1.2,TCP,66,757248,5001  >  45128 [ACK] Seq=1 Ack=1023737 Win=757248 Len=0 TSval=1024167058 TSecr=1379237536
256,8.570471,192.168.2.2,192.168.1.2,TCP,66,754176,5001  >  45128 [ACK] Seq=1 Ack=1033873 Win=754176 Len=0 TSval=1024167094 TSecr=1379237573
258,8.655634,192.168.2.2,192.168.1.2,TCP,66,750592,5001  >  45128 [ACK] Seq=1 Ack=1051249 Win=750592 Len=0 TSval=1024167179 TSecr=1379237658
260,8.800591,192.168.2.2,192.168.1.2,TCP,66,753664,5001  >  45128 [ACK] Seq=1 Ack=1062833 Win=753664 Len=0 TSval=1024167324 TSecr=1379237730
263,8.898262,192.168.2.2,192.168.1.2,TCP,66,756736,5001  >  45128 [ACK] Seq=1 Ack=1068625 Win=756736 Len=0 TSval=1024167422 TSecr=1379237901
265,8.946875,192.168.2.2,192.168.1.2,TCP,66,753664,5001  >  45128 [ACK] Seq=1 Ack=1080209 Win=753664 Len=0 TSval=1024167470 TSecr=1379237949
268,9.043803,192.168.2.2,192.168.1.2,TCP,66,757248,5001  >  45128 [ACK] Seq=1 Ack=1084553 Win=757248 Len=0 TSval=1024167567 TSecr=1379238045
270,9.080037,192.168.2.2,192.168.1.2,TCP,66,753152,5001  >  45128 [ACK] Seq=1 Ack=1097585 Win=753152 Len=0 TSval=1024167604 TSecr=1379238082
272,9.189766,192.168.2.2,192.168.1.2,TCP,66,755200,5001  >  45128 [ACK] Seq=1 Ack=1106273 Win=755200 Len=0 TSval=1024167713 TSecr=1379238242
274,9.262281,192.168.2.2,192.168.1.2,TCP,66,755712,5001  >  45128 [ACK] Seq=1 Ack=1113513 Win=755712 Len=0 TSval=1024167786 TSecr=1379238264
276,9.32217,192.168.2.2,192.168.1.2,TCP,66,753152,5001  >  45128 [ACK] Seq=1 Ack=1126545 Win=753152 Len=0 TSval=1024167846 TSecr=1379238324
278,9.431156,192.168.2.2,192.168.1.2,TCP,66,750592,5001  >  45128 [ACK] Seq=1 Ack=1143921 Win=750592 Len=0 TSval=1024167954 TSecr=1379238434
280,9.576891,192.168.2.2,192.168.1.2,TCP,66,757248,5001  >  45128 [ACK] Seq=1 Ack=1148265 Win=757248 Len=0 TSval=1024168100 TSecr=1379238591
282,9.62507,192.168.2.2,192.168.1.2,TCP,66,758784,5001  >  45128 [ACK] Seq=1 Ack=1158401 Win=758784 Len=0 TSval=1024168148 TSecr=1379238616
285,9.69793,192.168.2.2,192.168.1.2,TCP,66,758784,5001  >  45128 [ACK] Seq=1 Ack=1167089 Win=758784 Len=0 TSval=1024168221 TSecr=1379238700
287,9.770999,192.168.2.2,192.168.1.2,TCP,66,758784,5001  >  45128 [ACK] Seq=1 Ack=1171433 Win=758784 Len=0 TSval=1024168294 TSecr=1379238773
289,9.818936,192.168.2.2,192.168.1.2,TCP,66,758784,5001  >  45128 [ACK] Seq=1 Ack=1190257 Win=758784 Len=0 TSval=1024168342 TSecr=1379238810
292,9.965058,192.168.2.2,192.168.1.2,TCP,66,758784,5001  >  45128 [ACK] Seq=1 Ack=1214873 Win=758784 Len=0 TSval=1024168488 TSecr=1379239076
295,10.170899,192.168.2.2,192.168.1.2,TCP,66,757248,5001  >  45128 [ACK] Seq=1 Ack=1219217 Win=757248 Len=0 TSval=1024168694 TSecr=1379239173
296,10.207113,192.168.2.2,192.168.1.2,TCP,66,753152,5001  >  45128 [ACK] Seq=1 Ack=1232249 Win=753152 Len=0 TSval=1024168730 TSecr=1379239209
297,10.316313,192.168.2.2,192.168.1.2,TCP,66,758784,5001  >  45128 [ACK] Seq=1 Ack=1233697 Win=758784 Len=0 TSval=1024168839 TSecr=1379239318
298,10.328655,192.168.2.2,192.168.1.2,TCP,66,757760,5001  >  45128 [ACK] Seq=1 Ack=1236593 Win=757760 Len=0 TSval=1024168852 TSecr=1379239330
299,10.352531,192.168.2.2,192.168.1.2,TCP,66,753664,5001  >  45128 [ACK] Seq=1 Ack=1248177 Win=753664 Len=0 TSval=1024168875 TSecr=1379239366
300,10.449555,192.168.2.2,192.168.1.2,TCP,66,750592,5001  >  45128 [ACK] Seq=1 Ack=1265553 Win=750592 Len=0 TSval=1024168972 TSecr=1379239451
301,10.595601,192.168.2.2,192.168.1.2,TCP,66,753664,5001  >  45128 [ACK] Seq=1 Ack=1277137 Win=753664 Len=0 TSval=1024169118 TSecr=1379239596
302,10.691728,192.168.2.2,192.168.1.2,TCP,66,756736,5001  >  45128 [ACK] Seq=1 Ack=1282929 Win=756736 Len=0 TSval=1024169214 TSecr=1379239694
303,10.74067,192.168.2.2,192.168.1.2,TCP,66,753664,5001  >  45128 [ACK] Seq=1 Ack=1294513 Win=753664 Len=0 TSval=1024169263 TSecr=1379239742
305,10.83774,192.168.2.2,192.168.1.2,TCP,66,757248,5001  >  45128 [ACK] Seq=1 Ack=1298857 Win=757248 Len=0 TSval=1024169360 TSecr=1379239839
306,10.874048,192.168.2.2,192.168.1.2,TCP,66,757760,5001  >  45128 [ACK] Seq=1 Ack=1301753 Win=757760 Len=0 TSval=1024169397 TSecr=1379239876
307,10.898923,192.168.2.2,192.168.1.2,TCP,66,750080,5001  >  45128 [ACK] Seq=1 Ack=1320577 Win=750080 Len=0 TSval=1024169422 TSecr=1379239985
309,11.056861,192.168.2.2,192.168.1.2,TCP,66,755712,5001  >  45128 [ACK] Seq=1 Ack=1327817 Win=755712 Len=0 TSval=1024169579 TSecr=1379240058
310,11.116639,192.168.2.2,192.168.1.2,TCP,66,753152,5001  >  45128 [ACK] Seq=1 Ack=1340849 Win=753152 Len=0 TSval=1024169639 TSecr=1379240118
311,11.225396,192.168.2.2,192.168.1.2,TCP,66,750592,5001  >  45128 [ACK] Seq=1 Ack=1358225 Win=750592 Len=0 TSval=1024169748 TSecr=1379240227
312,11.371359,192.168.2.2,192.168.1.2,TCP,66,757248,5001  >  45128 [ACK] Seq=1 Ack=1362569 Win=757248 Len=0 TSval=1024169894 TSecr=1379240372
313,11.407003,192.168.2.2,192.168.1.2,TCP,66,757248,5001  >  45128 [ACK] Seq=1 Ack=1366913 Win=757248 Len=0 TSval=1024169929 TSecr=1379240420
314,11.44335,192.168.2.2,192.168.1.2,TCP,66,758784,5001  >  45128 [ACK] Seq=1 Ack=1372705 Win=758784 Len=0 TSval=1024169966 TSecr=1379240420
315,11.492518,192.168.2.2,192.168.1.2,TCP,66,758784,5001  >  45128 [ACK] Seq=1 Ack=1381393 Win=758784 Len=0 TSval=1024170015 TSecr=1379240493
316,11.564479,192.168.2.2,192.168.1.2,TCP,66,758784,5001  >  45128 [ACK] Seq=1 Ack=1385737 Win=758784 Len=0 TSval=1024170087 TSecr=1379240566
317,11.601289,192.168.2.2,192.168.1.2,TCP,66,758784,5001  >  45128 [ACK] Seq=1 Ack=1404561 Win=758784 Len=0 TSval=1024170124 TSecr=1379240614
318,11.759201,192.168.2.2,192.168.1.2,TCP,66,758784,5001  >  45128 [ACK] Seq=1 Ack=1429177 Win=758784 Len=0 TSval=1024170281 TSecr=1379240760
323,11.965701,192.168.2.2,192.168.1.2,TCP,66,757760,5001  >  45128 [ACK] Seq=1 Ack=1432073 Win=757760 Len=0 TSval=1024170488 TSecr=1379242553
328,11.989962,192.168.2.2,192.168.1.2,TCP,66,757760,5001  >  45128 [ACK] Seq=1 Ack=1434969 Win=757760 Len=0 TSval=1024170512 TSecr=1379242554
330,12.014879,192.168.2.2,192.168.1.2,TCP,66,728064,5001  >  45128 [ACK] Seq=1 Ack=1497233 Win=728064 Len=0 TSval=1024170537 TSecr=1379242760
335,12.53576,192.168.2.2,192.168.1.2,TCP,66,727040,5001  >  45128 [ACK] Seq=1 Ack=1562393 Win=727040 Len=0 TSval=1024171058 TSecr=1379242760
340,13.080225,192.168.2.2,192.168.1.2,TCP,66,727040,5001  >  45128 [ACK] Seq=1 Ack=1627553 Win=727040 Len=0 TSval=1024171602 TSecr=1379242760
344,13.625999,192.168.2.2,192.168.1.2,TCP,66,748544,5001  >  45128 [ACK] Seq=1 Ack=1649273 Win=748544 Len=0 TSval=1024172147 TSecr=1379242761
346,13.806759,192.168.2.2,192.168.1.2,TCP,66,756736,5001  >  45128 [ACK] Seq=1 Ack=1655065 Win=756736 Len=0 TSval=1024172328 TSecr=1379242784
348,13.85541,192.168.2.2,192.168.1.2,TCP,66,740352,5001  >  45128 [ACK] Seq=1 Ack=1692713 Win=740352 Len=0 TSval=1024172377 TSecr=1379242809
350,14.170905,192.168.2.2,192.168.1.2,TCP,66,727040,5001  >  45128 [ACK] Seq=1 Ack=1757873 Win=727040 Len=0 TSval=1024172692 TSecr=1379242810
353,14.715154,192.168.2.2,192.168.1.2,TCP,66,748544,5001  >  45128 [ACK] Seq=1 Ack=1779593 Win=748544 Len=0 TSval=1024173236 TSecr=1379242810
355,14.897784,192.168.2.2,192.168.1.2,TCP,66,737792,5001  >  45128 [ACK] Seq=1 Ack=1823033 Win=737792 Len=0 TSval=1024173418 TSecr=1379243330
357,15.260958,192.168.2.2,192.168.1.2,TCP,66,727040,5001  >  45128 [ACK] Seq=1 Ack=1888193 Win=727040 Len=0 TSval=1024173781 TSecr=1379243330
358,15.80671,192.168.2.2,192.168.1.2,TCP,66,748544,5001  >  45128 [ACK] Seq=1 Ack=1909913 Win=748544 Len=0 TSval=1024174327 TSecr=1379243330
360,15.98845,192.168.2.2,192.168.1.2,TCP,66,737792,5001  >  45128 [ACK] Seq=1 Ack=1953353 Win=737792 Len=0 TSval=1024174509 TSecr=1379243874
362,16.352574,192.168.2.2,192.168.1.2,TCP,66,727040,5001  >  45128 [ACK] Seq=1 Ack=2018513 Win=727040 Len=0 TSval=1024174872 TSecr=1379243874
363,16.897535,192.168.2.2,192.168.1.2,TCP,66,748544,5001  >  45128 [ACK] Seq=1 Ack=2040233 Win=748544 Len=0 TSval=1024175417 TSecr=1379244383
365,17.078721,192.168.2.2,192.168.1.2,TCP,66,737792,5001  >  45128 [ACK] Seq=1 Ack=2083673 Win=737792 Len=0 TSval=1024175598 TSecr=1379244419
374,17.441922,192.168.2.2,192.168.1.2,TCP,66,753664,5001  >  45128 [ACK] Seq=1 Ack=2095257 Win=753664 Len=0 TSval=1024175961 TSecr=1379244600
387,17.54251,192.168.2.2,192.168.1.2,TCP,66,758784,5001  >  45128 [ACK] Seq=1 Ack=2096705 Win=758784 Len=0 TSval=1024176062 TSecr=1379247870
388,17.555081,192.168.2.2,192.168.1.2,TCP,66,758784,5001  >  45128 [ACK] Seq=1 Ack=2098153 Win=758784 Len=0 TSval=1024176074 TSecr=1379247880
389,17.566859,192.168.2.2,192.168.1.2,TCP,66,758784,5001  >  45128 [ACK] Seq=1 Ack=2099601 Win=758784 Len=0 TSval=1024176086 TSecr=1379247890
391,17.578892,192.168.2.2,192.168.1.2,TCP,66,758784,5001  >  45128 [ACK] Seq=1 Ack=2101049 Win=758784 Len=0 TSval=1024176098 TSecr=1379247901
393,17.590957,192.168.2.2,192.168.1.2,TCP,66,758784,5001  >  45128 [ACK] Seq=1 Ack=2102497 Win=758784 Len=0 TSval=1024176110 TSecr=1379247910
395,17.603093,192.168.2.2,192.168.1.2,TCP,66,758784,5001  >  45128 [ACK] Seq=1 Ack=2103945 Win=758784 Len=0 TSval=1024176122 TSecr=1379247920
397,17.615175,192.168.2.2,192.168.1.2,TCP,66,758784,5001  >  45128 [ACK] Seq=1 Ack=2105393 Win=758784 Len=0 TSval=1024176134 TSecr=1379247930
399,17.627276,192.168.2.2,192.168.1.2,TCP,66,758784,5001  >  45128 [ACK] Seq=1 Ack=2106841 Win=758784 Len=0 TSval=1024176147 TSecr=1379247941
401,17.63944,192.168.2.2,192.168.1.2,TCP,66,758784,5001  >  45128 [ACK] Seq=1 Ack=2108289 Win=758784 Len=0 TSval=1024176159 TSecr=1379248233
403,17.651517,192.168.2.2,192.168.1.2,TCP,66,758784,5001  >  45128 [ACK] Seq=1 Ack=2109737 Win=758784 Len=0 TSval=1024176171 TSecr=1379248243
405,17.663788,192.168.2.2,192.168.1.2,TCP,66,758784,5001  >  45128 [ACK] Seq=1 Ack=2111185 Win=758784 Len=0 TSval=1024176183 TSecr=1379248254
407,17.675737,192.168.2.2,192.168.1.2,TCP,66,758784,5001  >  45128 [ACK] Seq=1 Ack=2112633 Win=758784 Len=0 TSval=1024176195 TSecr=1379248264
409,17.687864,192.168.2.2,192.168.1.2,TCP,66,758784,5001  >  45128 [ACK] Seq=1 Ack=2114081 Win=758784 Len=0 TSval=1024176207 TSecr=1379248274
411,17.700105,192.168.2.2,192.168.1.2,TCP,66,758784,5001  >  45128 [ACK] Seq=1 Ack=2115529 Win=758784 Len=0 TSval=1024176219 TSecr=1379248285
413,17.712115,192.168.2.2,192.168.1.2,TCP,66,758784,5001  >  45128 [ACK] Seq=1 Ack=2116977 Win=758784 Len=0 TSval=1024176231 TSecr=1379248295
415,17.736372,192.168.2.2,192.168.1.2,TCP,66,758784,5001  >  45128 [ACK] Seq=1 Ack=2119873 Win=758784 Len=0 TSval=1024176256 TSecr=1379248305
418,17.760807,192.168.2.2,192.168.1.2,TCP,66,758784,5001  >  45128 [ACK] Seq=1 Ack=2122769 Win=758784 Len=0 TSval=1024176280 TSecr=1379248370
421,17.784758,192.168.2.2,192.168.1.2,TCP,66,758784,5001  >  45128 [ACK] Seq=1 Ack=2125665 Win=758784 Len=0 TSval=1024176304 TSecr=1379248394
424,17.809873,192.168.2.2,192.168.1.2,TCP,66,758784,5001  >  45128 [ACK] Seq=1 Ack=2128561 Win=758784 Len=0 TSval=1024176329 TSecr=1379248419
427,17.833427,192.168.2.2,192.168.1.2,TCP,66,758784,5001  >  45128 [ACK] Seq=1 Ack=2131457 Win=758784 Len=0 TSval=1024176353 TSecr=1379248443
429,17.857954,192.168.2.2,192.168.1.2,TCP,66,758784,5001  >  45128 [ACK] Seq=1 Ack=2134353 Win=758784 Len=0 TSval=1024176377 TSecr=1379248467
432,17.882319,192.168.2.2,192.168.1.2,TCP,66,758784,5001  >  45128 [ACK] Seq=1 Ack=2137249 Win=758784 Len=0 TSval=1024176401 TSecr=1379248491
433,17.905957,192.168.2.2,192.168.1.2,TCP,66,758784,5001  >  45128 [ACK] Seq=1 Ack=2140145 Win=758784 Len=0 TSval=1024176425 TSecr=1379248528
434,17.930442,192.168.2.2,192.168.1.2,TCP,66,758784,5001  >  45128 [ACK] Seq=1 Ack=2143041 Win=758784 Len=0 TSval=1024176450 TSecr=1379248552
437,17.954904,192.168.2.2,192.168.1.2,TCP,66,758784,5001  >  45128 [ACK] Seq=1 Ack=2145937 Win=758784 Len=0 TSval=1024176474 TSecr=1379248576
439,17.966745,192.168.2.2,192.168.1.2,TCP,66,758784,5001  >  45128 [ACK] Seq=1 Ack=2148833 Win=758784 Len=0 TSval=1024176486 TSecr=1379248601
442,17.990657,192.168.2.2,192.168.1.2,TCP,66,758784,5001  >  45128 [ACK] Seq=1 Ack=2151729 Win=758784 Len=0 TSval=1024176510 TSecr=1379248619
445,18.015685,192.168.2.2,192.168.1.2,TCP,66,758784,5001  >  45128 [ACK] Seq=1 Ack=2154625 Win=758784 Len=0 TSval=1024176535 TSecr=1379248636
449,18.039139,192.168.2.2,192.168.1.2,TCP,66,758784,5001  >  45128 [ACK] Seq=1 Ack=2157521 Win=758784 Len=0 TSval=1024176558 TSecr=1379248654
452,18.063655,192.168.2.2,192.168.1.2,TCP,66,758784,5001  >  45128 [ACK] Seq=1 Ack=2160417 Win=758784 Len=0 TSval=1024176583 TSecr=1379248671
456,18.100015,192.168.2.2,192.168.1.2,TCP,66,758784,5001  >  45128 [ACK] Seq=1 Ack=2163313 Win=758784 Len=0 TSval=1024176619 TSecr=1379248722
459,18.123882,192.168.2.2,192.168.1.2,TCP,66,758784,5001  >  45128 [ACK] Seq=1 Ack=2166209 Win=758784 Len=0 TSval=1024176643 TSecr=1379248751
462,18.148108,192.168.2.2,192.168.1.2,TCP,66,758784,5001  >  45128 [ACK] Seq=1 Ack=2169105 Win=758784 Len=0 TSval=1024176667 TSecr=1379248774
465,18.172386,192.168.2.2,192.168.1.2,TCP,66,758784,5001  >  45128 [ACK] Seq=1 Ack=2172001 Win=758784 Len=0 TSval=1024176691 TSecr=1379248796
468,18.196996,192.168.2.2,192.168.1.2,TCP,66,758784,5001  >  45128 [ACK] Seq=1 Ack=2174897 Win=758784 Len=0 TSval=1024176716 TSecr=1379248818
471,18.220802,192.168.2.2,192.168.1.2,TCP,66,758784,5001  >  45128 [ACK] Seq=1 Ack=2177793 Win=758784 Len=0 TSval=1024176740 TSecr=1379248841
475,18.245805,192.168.2.2,192.168.1.2,TCP,66,758784,5001  >  45128 [ACK] Seq=1 Ack=2180689 Win=758784 Len=0 TSval=1024176765 TSecr=1379248865
478,18.270015,192.168.2.2,192.168.1.2,TCP,66,758784,5001  >  45128 [ACK] Seq=1 Ack=2183585 Win=758784 Len=0 TSval=1024176789 TSecr=1379248891
481,18.294948,192.168.2.2,192.168.1.2,TCP,66,758784,5001  >  45128 [ACK] Seq=1 Ack=2186481 Win=758784 Len=0 TSval=1024176814 TSecr=1379248915
484,18.318467,192.168.2.2,192.168.1.2,TCP,66,758784,5001  >  45128 [ACK] Seq=1 Ack=2189377 Win=758784 Len=0 TSval=1024176837 TSecr=1379248939
487,18.343012,192.168.2.2,192.168.1.2,TCP,66,758784,5001  >  45128 [ACK] Seq=1 Ack=2192273 Win=758784 Len=0 TSval=1024176862 TSecr=1379248963
490,18.367567,192.168.2.2,192.168.1.2,TCP,66,758784,5001  >  45128 [ACK] Seq=1 Ack=2195169 Win=758784 Len=0 TSval=1024176886 TSecr=1379248988
493,18.391121,192.168.2.2,192.168.1.2,TCP,66,758784,5001  >  45128 [ACK] Seq=1 Ack=2198065 Win=758784 Len=0 TSval=1024176910 TSecr=1379249012
496,18.415463,192.168.2.2,192.168.1.2,TCP,66,758784,5001  >  45128 [ACK] Seq=1 Ack=2200961 Win=758784 Len=0 TSval=1024176934 TSecr=1379249037
498,18.44006,192.168.2.2,192.168.1.2,TCP,66,758784,5001  >  45128 [ACK] Seq=1 Ack=2203857 Win=758784 Len=0 TSval=1024176959 TSecr=1379249061
501,18.46377,192.168.2.2,192.168.1.2,TCP,66,758784,5001  >  45128 [ACK] Seq=1 Ack=2206753 Win=758784 Len=0 TSval=1024176983 TSecr=1379249086
502,18.488099,192.168.2.2,192.168.1.2,TCP,66,758784,5001  >  45128 [ACK] Seq=1 Ack=2209649 Win=758784 Len=0 TSval=1024177007 TSecr=1379249109
503,18.512585,192.168.2.2,192.168.1.2,TCP,66,758784,5001  >  45128 [ACK] Seq=1 Ack=2212545 Win=758784 Len=0 TSval=1024177031 TSecr=1379249134
506,18.536989,192.168.2.2,192.168.1.2,TCP,66,758784,5001  >  45128 [ACK] Seq=1 Ack=2215441 Win=758784 Len=0 TSval=1024177056 TSecr=1379249158
508,18.548813,192.168.2.2,192.168.1.2,TCP,66,758784,5001  >  45128 [ACK] Seq=1 Ack=2218337 Win=758784 Len=0 TSval=1024177068 TSecr=1379249182
511,18.573305,192.168.2.2,192.168.1.2,TCP,66,758784,5001  >  45128 [ACK] Seq=1 Ack=2221233 Win=758784 Len=0 TSval=1024177092 TSecr=1379249200
514,18.597299,192.168.2.2,192.168.1.2,TCP,66,758784,5001  >  45128 [ACK] Seq=1 Ack=2224129 Win=758784 Len=0 TSval=1024177116 TSecr=1379249217
517,18.621397,192.168.2.2,192.168.1.2,TCP,66,758784,5001  >  45128 [ACK] Seq=1 Ack=2227025 Win=758784 Len=0 TSval=1024177140 TSecr=1379249235
520,18.645905,192.168.2.2,192.168.1.2,TCP,66,758784,5001  >  45128 [ACK] Seq=1 Ack=2229921 Win=758784 Len=0 TSval=1024177165 TSecr=1379249253
524,18.682054,192.168.2.2,192.168.1.2,TCP,66,758784,5001  >  45128 [ACK] Seq=1 Ack=2232817 Win=758784 Len=0 TSval=1024177201 TSecr=1379249303
527,18.706039,192.168.2.2,192.168.1.2,TCP,66,758784,5001  >  45128 [ACK] Seq=1 Ack=2235713 Win=758784 Len=0 TSval=1024177225 TSecr=1379249335
530,18.730276,192.168.2.2,192.168.1.2,TCP,66,758784,5001  >  45128 [ACK] Seq=1 Ack=2238609 Win=758784 Len=0 TSval=1024177249 TSecr=1379249357
533,18.75454,192.168.2.2,192.168.1.2,TCP,66,758784,5001  >  45128 [ACK] Seq=1 Ack=2241505 Win=758784 Len=0 TSval=1024177273 TSecr=1379249380
536,18.778712,192.168.2.2,192.168.1.2,TCP,66,758784,5001  >  45128 [ACK] Seq=1 Ack=2244401 Win=758784 Len=0 TSval=1024177297 TSecr=1379249403
539,18.803594,192.168.2.2,192.168.1.2,TCP,66,758784,5001  >  45128 [ACK] Seq=1 Ack=2247297 Win=758784 Len=0 TSval=1024177322 TSecr=1379249426
542,18.827176,192.168.2.2,192.168.1.2,TCP,66,758784,5001  >  45128 [ACK] Seq=1 Ack=2250193 Win=758784 Len=0 TSval=1024177346 TSecr=1379249449
545,18.851641,192.168.2.2,192.168.1.2,TCP,66,758784,5001  >  45128 [ACK] Seq=1 Ack=2253089 Win=758784 Len=0 TSval=1024177370 TSecr=1379249473
548,18.87563,192.168.2.2,192.168.1.2,TCP,66,758784,5001  >  45128 [ACK] Seq=1 Ack=2255985 Win=758784 Len=0 TSval=1024177394 TSecr=1379249497
551,18.899866,192.168.2.2,192.168.1.2,TCP,66,758784,5001  >  45128 [ACK] Seq=1 Ack=2258881 Win=758784 Len=0 TSval=1024177418 TSecr=1379249521
554,18.924135,192.168.2.2,192.168.1.2,TCP,66,758784,5001  >  45128 [ACK] Seq=1 Ack=2261777 Win=758784 Len=0 TSval=1024177443 TSecr=1379249545
557,18.948634,192.168.2.2,192.168.1.2,TCP,66,758784,5001  >  45128 [ACK] Seq=1 Ack=2264673 Win=758784 Len=0 TSval=1024177467 TSecr=1379249569
560,18.97252,192.168.2.2,192.168.1.2,TCP,66,758784,5001  >  45128 [ACK] Seq=1 Ack=2267569 Win=758784 Len=0 TSval=1024177491 TSecr=1379249594
563,18.996748,192.168.2.2,192.168.1.2,TCP,66,758784,5001  >  45128 [ACK] Seq=1 Ack=2270465 Win=758784 Len=0 TSval=1024177515 TSecr=1379249618
565,19.02124,192.168.2.2,192.168.1.2,TCP,66,758784,5001  >  45128 [ACK] Seq=1 Ack=2273361 Win=758784 Len=0 TSval=1024177540 TSecr=1379249642
568,19.045708,192.168.2.2,192.168.1.2,TCP,66,758784,5001  >  45128 [ACK] Seq=1 Ack=2276257 Win=758784 Len=0 TSval=1024177564 TSecr=1379249666
569,19.069404,192.168.2.2,192.168.1.2,TCP,66,758784,5001  >  45128 [ACK] Seq=1 Ack=2279153 Win=758784 Len=0 TSval=1024177588 TSecr=1379249691
571,19.093682,192.168.2.2,192.168.1.2,TCP,66,758784,5001  >  45128 [ACK] Seq=1 Ack=2282049 Win=758784 Len=0 TSval=1024177612 TSecr=1379249715
574,19.117838,192.168.2.2,192.168.1.2,TCP,66,758784,5001  >  45128 [ACK] Seq=1 Ack=2284945 Win=758784 Len=0 TSval=1024177636 TSecr=1379249739
576,19.129998,192.168.2.2,192.168.1.2,TCP,66,758784,5001  >  45128 [ACK] Seq=1 Ack=2287841 Win=758784 Len=0 TSval=1024177648 TSecr=1379249763
579,19.154581,192.168.2.2,192.168.1.2,TCP,66,758784,5001  >  45128 [ACK] Seq=1 Ack=2290737 Win=758784 Len=0 TSval=1024177673 TSecr=1379249781
582,19.178659,192.168.2.2,192.168.1.2,TCP,66,758784,5001  >  45128 [ACK] Seq=1 Ack=2293633 Win=758784 Len=0 TSval=1024177697 TSecr=1379249799
585,19.202661,192.168.2.2,192.168.1.2,TCP,66,758784,5001  >  45128 [ACK] Seq=1 Ack=2296529 Win=758784 Len=0 TSval=1024177721 TSecr=1379249817
589,19.226951,192.168.2.2,192.168.1.2,TCP,66,758784,5001  >  45128 [ACK] Seq=1 Ack=2299425 Win=758784 Len=0 TSval=1024177745 TSecr=1379249834
593,19.264232,192.168.2.2,192.168.1.2,TCP,66,758784,5001  >  45128 [ACK] Seq=1 Ack=2302321 Win=758784 Len=0 TSval=1024177783 TSecr=1379249884
596,19.288749,192.168.2.2,192.168.1.2,TCP,66,758784,5001  >  45128 [ACK] Seq=1 Ack=2305217 Win=758784 Len=0 TSval=1024177807 TSecr=1379249914
599,19.312471,192.168.2.2,192.168.1.2,TCP,66,758784,5001  >  45128 [ACK] Seq=1 Ack=2308113 Win=758784 Len=0 TSval=1024177831 TSecr=1379249937
602,19.336687,192.168.2.2,192.168.1.2,TCP,66,758784,5001  >  45128 [ACK] Seq=1 Ack=2311009 Win=758784 Len=0 TSval=1024177855 TSecr=1379249959
605,19.361224,192.168.2.2,192.168.1.2,TCP,66,758784,5001  >  45128 [ACK] Seq=1 Ack=2313905 Win=758784 Len=0 TSval=1024177880 TSecr=1379249982
608,19.385106,192.168.2.2,192.168.1.2,TCP,66,758784,5001  >  45128 [ACK] Seq=1 Ack=2316801 Win=758784 Len=0 TSval=1024177903 TSecr=1379250005
611,19.409318,192.168.2.2,192.168.1.2,TCP,66,758784,5001  >  45128 [ACK] Seq=1 Ack=2319697 Win=758784 Len=0 TSval=1024177928 TSecr=1379250027
614,19.433832,192.168.2.2,192.168.1.2,TCP,66,758784,5001  >  45128 [ACK] Seq=1 Ack=2322593 Win=758784 Len=0 TSval=1024177952 TSecr=1379250055
617,19.457777,192.168.2.2,192.168.1.2,TCP,66,758784,5001  >  45128 [ACK] Seq=1 Ack=2325489 Win=758784 Len=0 TSval=1024177976 TSecr=1379250079
620,19.481985,192.168.2.2,192.168.1.2,TCP,66,758784,5001  >  45128 [ACK] Seq=1 Ack=2328385 Win=758784 Len=0 TSval=1024178000 TSecr=1379250103
623,19.506282,192.168.2.2,192.168.1.2,TCP,66,758784,5001  >  45128 [ACK] Seq=1 Ack=2331281 Win=758784 Len=0 TSval=1024178025 TSecr=1379250127
626,19.530789,192.168.2.2,192.168.1.2,TCP,66,758784,5001  >  45128 [ACK] Seq=1 Ack=2334177 Win=758784 Len=0 TSval=1024178049 TSecr=1379250152
629,19.555387,192.168.2.2,192.168.1.2,TCP,66,758784,5001  >  45128 [ACK] Seq=1 Ack=2337073 Win=758784 Len=0 TSval=1024178074 TSecr=1379250176
632,19.578904,192.168.2.2,192.168.1.2,TCP,66,758784,5001  >  45128 [ACK] Seq=1 Ack=2339969 Win=758784 Len=0 TSval=1024178097 TSecr=1379250200
634,19.603391,192.168.2.2,192.168.1.2,TCP,66,758784,5001  >  45128 [ACK] Seq=1 Ack=2342865 Win=758784 Len=0 TSval=1024178122 TSecr=1379250224
637,19.627329,192.168.2.2,192.168.1.2,TCP,66,758784,5001  >  45128 [ACK] Seq=1 Ack=2345761 Win=758784 Len=0 TSval=1024178146 TSecr=1379250248
638,19.651577,192.168.2.2,192.168.1.2,TCP,66,758784,5001  >  45128 [ACK] Seq=1 Ack=2348657 Win=758784 Len=0 TSval=1024178170 TSecr=1379250272
639,19.676,192.168.2.2,192.168.1.2,TCP,66,758784,5001  >  45128 [ACK] Seq=1 Ack=2351553 Win=758784 Len=0 TSval=1024178194 TSecr=1379250297
642,19.700024,192.168.2.2,192.168.1.2,TCP,66,758784,5001  >  45128 [ACK] Seq=1 Ack=2354449 Win=758784 Len=0 TSval=1024178218 TSecr=1379250321
644,19.712206,192.168.2.2,192.168.1.2,TCP,66,758784,5001  >  45128 [ACK] Seq=1 Ack=2357345 Win=758784 Len=0 TSval=1024178230 TSecr=1379250346
647,19.73659,192.168.2.2,192.168.1.2,TCP,66,758784,5001  >  45128 [ACK] Seq=1 Ack=2360241 Win=758784 Len=0 TSval=1024178255 TSecr=1379250364
650,19.760605,192.168.2.2,192.168.1.2,TCP,66,758784,5001  >  45128 [ACK] Seq=1 Ack=2363137 Win=758784 Len=0 TSval=1024178279 TSecr=1379250382
653,19.784814,192.168.2.2,192.168.1.2,TCP,66,758784,5001  >  45128 [ACK] Seq=1 Ack=2366033 Win=758784 Len=0 TSval=1024178303 TSecr=1379250400
656,19.809262,192.168.2.2,192.168.1.2,TCP,66,758784,5001  >  45128 [ACK] Seq=1 Ack=2368929 Win=758784 Len=0 TSval=1024178327 TSecr=1379250417
660,19.845357,192.168.2.2,192.168.1.2,TCP,66,758784,5001  >  45128 [ACK] Seq=1 Ack=2371825 Win=758784 Len=0 TSval=1024178363 TSecr=1379250466
663,19.869564,192.168.2.2,192.168.1.2,TCP,66,758784,5001  >  45128 [ACK] Seq=1 Ack=2374721 Win=758784 Len=0 TSval=1024178388 TSecr=1379250497
666,19.893806,192.168.2.2,192.168.1.2,TCP,66,758784,5001  >  45128 [ACK] Seq=1 Ack=2377617 Win=758784 Len=0 TSval=1024178412 TSecr=1379250520
669,19.918026,192.168.2.2,192.168.1.2,TCP,66,758784,5001  >  45128 [ACK] Seq=1 Ack=2380513 Win=758784 Len=0 TSval=1024178436 TSecr=1379250542
672,19.942247,192.168.2.2,192.168.1.2,TCP,66,758784,5001  >  45128 [ACK] Seq=1 Ack=2383409 Win=758784 Len=0 TSval=1024178460 TSecr=1379250566
675,19.966994,192.168.2.2,192.168.1.2,TCP,66,758784,5001  >  45128 [ACK] Seq=1 Ack=2386305 Win=758784 Len=0 TSval=1024178485 TSecr=1379250589
678,19.990716,192.168.2.2,192.168.1.2,TCP,66,758784,5001  >  45128 [ACK] Seq=1 Ack=2389201 Win=758784 Len=0 TSval=1024178509 TSecr=1379250612
681,20.015026,192.168.2.2,192.168.1.2,TCP,66,758784,5001  >  45128 [ACK] Seq=1 Ack=2392097 Win=758784 Len=0 TSval=1024178533 TSecr=1379250636
684,20.039144,192.168.2.2,192.168.1.2,TCP,66,758784,5001  >  45128 [ACK] Seq=1 Ack=2394993 Win=758784 Len=0 TSval=1024178557 TSecr=1379250660
687,20.063383,192.168.2.2,192.168.1.2,TCP,66,758784,5001  >  45128 [ACK] Seq=1 Ack=2397889 Win=758784 Len=0 TSval=1024178581 TSecr=1379250684
691,20.087617,192.168.2.2,192.168.1.2,TCP,66,758784,5001  >  45128 [ACK] Seq=1 Ack=2400785 Win=758784 Len=0 TSval=1024178606 TSecr=1379250708
694,20.111824,192.168.2.2,192.168.1.2,TCP,66,758784,5001  >  45128 [ACK] Seq=1 Ack=2403681 Win=758784 Len=0 TSval=1024178630 TSecr=1379250732
697,20.136052,192.168.2.2,192.168.1.2,TCP,66,758784,5001  >  45128 [ACK] Seq=1 Ack=2406577 Win=758784 Len=0 TSval=1024178654 TSecr=1379250757
700,20.160269,192.168.2.2,192.168.1.2,TCP,66,758784,5001  >  45128 [ACK] Seq=1 Ack=2409473 Win=758784 Len=0 TSval=1024178678 TSecr=1379250781
702,20.184548,192.168.2.2,192.168.1.2,TCP,66,758784,5001  >  45128 [ACK] Seq=1 Ack=2412369 Win=758784 Len=0 TSval=1024178702 TSecr=1379250805
705,20.208703,192.168.2.2,192.168.1.2,TCP,66,758784,5001  >  45128 [ACK] Seq=1 Ack=2415265 Win=758784 Len=0 TSval=1024178727 TSecr=1379250829
706,20.233563,192.168.2.2,192.168.1.2,TCP,66,758784,5001  >  45128 [ACK] Seq=1 Ack=2418161 Win=758784 Len=0 TSval=1024178751 TSecr=1379250853
708,20.258048,192.168.2.2,192.168.1.2,TCP,66,758784,5001  >  45128 [ACK] Seq=1 Ack=2421057 Win=758784 Len=0 TSval=1024178776 TSecr=1379250878
711,20.282483,192.168.2.2,192.168.1.2,TCP,66,758784,5001  >  45128 [ACK] Seq=1 Ack=2423953 Win=758784 Len=0 TSval=1024178800 TSecr=1379250902
714,20.294377,192.168.2.2,192.168.1.2,TCP,66,758784,5001  >  45128 [ACK] Seq=1 Ack=2426849 Win=758784 Len=0 TSval=1024178812 TSecr=1379250926
717,20.318554,192.168.2.2,192.168.1.2,TCP,66,758784,5001  >  45128 [ACK] Seq=1 Ack=2429745 Win=758784 Len=0 TSval=1024178836 TSecr=1379250944
720,20.343646,192.168.2.2,192.168.1.2,TCP,66,758784,5001  >  45128 [ACK] Seq=1 Ack=2432641 Win=758784 Len=0 TSval=1024178862 TSecr=1379250963
723,20.367076,192.168.2.2,192.168.1.2,TCP,66,758784,5001  >  45128 [ACK] Seq=1 Ack=2435537 Win=758784 Len=0 TSval=1024178885 TSecr=1379250980
