No.,Time,Source,Destination,Protocol,Length,Calculated window size,Info
4,0.001179,192.168.2.2,192.168.1.2,TCP,74,43440,"5001  >  45092 [SYN, ACK] Seq=0 Ack=1 Win=43440 Len=0 MSS=1460 SACK_PERM=1 TSval=1023633281 TSecr=1378705553 WS=512"
7,0.001257,192.168.2.2,192.168.1.2,TCP,66,39936,5001  >  45092 [ACK] Seq=1 Ack=7241 Win=39936 Len=0 TSval=1023633281 TSecr=1378705553
12,0.05067,192.168.2.2,192.168.1.2,TCP,66,38400,5001  >  45092 [ACK] Seq=1 Ack=17377 Win=38400 Len=0 TSval=1023633331 TSecr=1378705554
15,0.13496,192.168.2.2,192.168.1.2,TCP,66,38400,5001  >  45092 [ACK] Seq=1 Ack=27513 Win=38400 Len=0 TSval=1023633415 TSecr=1378705555
21,0.220362,192.168.2.2,192.168.1.2,TCP,66,42496,5001  >  45092 [ACK] Seq=1 Ack=28961 Win=42496 Len=0 TSval=1023633500 TSecr=1378705555
23,0.232085,192.168.2.2,192.168.1.2,TCP,66,42496,5001  >  45092 [ACK] Seq=1 Ack=30409 Win=42496 Len=0 TSval=1023633512 TSecr=1378705568
26,0.24388,192.168.2.2,192.168.1.2,TCP,66,35328,5001  >  45092 [ACK] Seq=1 Ack=46337 Win=35328 Len=0 TSval=1023633524 TSecr=1378705603
29,0.377156,192.168.2.2,192.168.1.2,TCP,66,41984,5001  >  45092 [ACK] Seq=1 Ack=49233 Win=41984 Len=0 TSval=1023633657 TSecr=1378705628
31,0.401358,192.168.2.2,192.168.1.2,TCP,66,45568,5001  >  45092 [ACK] Seq=1 Ack=50681 Win=45568 Len=0 TSval=1023633681 TSecr=1378705687
33,0.41388,192.168.2.2,192.168.1.2,TCP,66,75776,5001  >  45092 [ACK] Seq=1 Ack=65913 Win=75776 Len=0 TSval=1023633694 TSecr=1378705688
37,0.541122,192.168.2.2,192.168.1.2,TCP,78,75776,[TCP Dup ACK 33#1] 5001  >  45092 [ACK] Seq=1 Ack=65913 Win=75776 Len=0 TSval=1023633821 TSecr=1378705744 SLE=65161 SRE=65913
39,0.548115,192.168.2.2,192.168.1.2,TCP,66,84480,5001  >  45092 [ACK] Seq=1 Ack=70257 Win=84480 Len=0 TSval=1023633828 TSecr=1378705772
42,0.58401,192.168.2.2,192.168.1.2,TCP,66,87552,5001  >  45092 [ACK] Seq=1 Ack=71705 Win=87552 Len=0 TSval=1023633864 TSecr=1378705784
44,0.596202,192.168.2.2,192.168.1.2,TCP,66,90112,5001  >  45092 [ACK] Seq=1 Ack=72401 Win=90112 Len=0 TSval=1023633876 TSecr=1378705784
46,0.602382,192.168.2.2,192.168.1.2,TCP,66,93184,5001  >  45092 [ACK] Seq=1 Ack=81089 Win=93184 Len=0 TSval=1023633882 TSecr=1378705796
48,0.675062,192.168.2.2,192.168.1.2,TCP,66,93184,5001  >  45092 [ACK] Seq=1 Ack=89777 Win=93184 Len=0 TSval=1023633955 TSecr=1378705929
52,0.747545,192.168.2.2,192.168.1.2,TCP,66,95232,5001  >  45092 [ACK] Seq=1 Ack=94121 Win=95232 Len=0 TSval=1023634027 TSecr=1378705953
54,0.783886,192.168.2.2,192.168.1.2,TCP,66,86528,5001  >  45092 [ACK] Seq=1 Ack=115841 Win=86528 Len=0 TSval=1023634063 TSecr=1378705966
56,0.966161,192.168.2.2,192.168.1.2,TCP,66,86528,5001  >  45092 [ACK] Seq=1 Ack=137561 Win=86528 Len=0 TSval=1023634246 TSecr=1378705966
59,1.147258,192.168.2.2,192.168.1.2,TCP,66,101376,5001  >  45092 [ACK] Seq=1 Ack=140457 Win=101376 Len=0 TSval=1023634427 TSecr=1378706093
61,1.171885,192.168.2.2,192.168.1.2,TCP,66,127488,5001  >  45092 [ACK] Seq=1 Ack=153489 Win=127488 Len=0 TSval=1023634451 TSecr=1378706100
64,1.280893,192.168.2.2,192.168.1.2,TCP,66,135680,5001  >  45092 [ACK] Seq=1 Ack=157833 Win=135680 Len=0 TSval=1023634560 TSecr=1378706136
67,1.316864,192.168.2.2,192.168.1.2,TCP,66,138752,5001  >  45092 [ACK] Seq=1 Ack=159281 Win=138752 Len=0 TSval=1023634596 TSecr=1378706148
69,1.328956,192.168.2.2,192.168.1.2,TCP,66,168960,5001  >  45092 [ACK] Seq=1 Ack=174273 Win=168960 Len=0 TSval=1023634608 TSecr=1378706154
72,1.454694,192.168.2.2,192.168.1.2,TCP,66,180224,5001  >  45092 [ACK] Seq=1 Ack=180065 Win=180224 Len=0 TSval=1023634734 TSecr=1378706227
76,1.5032,192.168.2.2,192.168.1.2,TCP,66,183296,5001  >  45092 [ACK] Seq=1 Ack=181001 Win=183296 Len=0 TSval=1023634782 TSecr=1378706227
78,1.51114,192.168.2.2,192.168.1.2,TCP,66,197632,5001  >  45092 [ACK] Seq=1 Ack=188241 Win=197632 Len=0 TSval=1023634790 TSecr=1378706299
81,1.571731,192.168.2.2,192.168.1.2,TCP,66,223744,5001  >  45092 [ACK] Seq=1 Ack=201273 Win=223744 Len=0 TSval=1023634851 TSecr=1378706335
84,1.682122,192.168.2.2,192.168.1.2,TCP,66,226816,5001  >  45092 [ACK] Seq=1 Ack=202721 Win=226816 Len=0 TSval=1023634961 TSecr=1378706518
87,1.695087,192.168.2.2,192.168.1.2,TCP,66,270336,5001  >  45092 [ACK] Seq=1 Ack=224441 Win=270336 Len=0 TSval=1023634974 TSecr=1378706699
92,1.877028,192.168.2.2,192.168.1.2,TCP,66,304640,5001  >  45092 [ACK] Seq=1 Ack=246161 Win=304640 Len=0 TSval=1023635156 TSecr=1378706723
95,2.058387,192.168.2.2,192.168.1.2,TCP,66,304640,5001  >  45092 [ACK] Seq=1 Ack=267881 Win=304640 Len=0 TSval=1023635337 TSecr=1378706723
97,2.240221,192.168.2.2,192.168.1.2,TCP,66,304640,5001  >  45092 [ACK] Seq=1 Ack=289601 Win=304640 Len=0 TSval=1023635519 TSecr=1378706832
101,2.421748,192.168.2.2,192.168.1.2,TCP,66,310784,5001  >  45092 [ACK] Seq=1 Ack=292497 Win=310784 Len=0 TSval=1023635700 TSecr=1378706859
104,2.446174,192.168.2.2,192.168.1.2,TCP,66,319488,5001  >  45092 [ACK] Seq=1 Ack=296841 Win=319488 Len=0 TSval=1023635725 TSecr=1378706868
106,2.483228,192.168.2.2,192.168.1.2,TCP,66,348160,5001  >  45092 [ACK] Seq=1 Ack=311321 Win=348160 Len=0 TSval=1023635762 TSecr=1378706880
108,2.603399,192.168.2.2,192.168.1.2,TCP,66,391680,5001  >  45092 [ACK] Seq=1 Ack=333041 Win=391680 Len=0 TSval=1023635882 TSecr=1378706880
110,2.785089,192.168.2.2,192.168.1.2,TCP,66,435200,5001  >  45092 [ACK] Seq=1 Ack=354761 Win=435200 Len=0 TSval=1023636064 TSecr=1378707006
113,2.966927,192.168.2.2,192.168.1.2,TCP,66,454144,5001  >  45092 [ACK] Seq=1 Ack=364297 Win=454144 Len=0 TSval=1023636245 TSecr=1378707054
116,3.047322,192.168.2.2,192.168.1.2,TCP,66,477184,5001  >  45092 [ACK] Seq=1 Ack=375881 Win=477184 Len=0 TSval=1023636326 TSecr=1378707062
118,3.14438,192.168.2.2,192.168.1.2,TCP,66,480256,5001  >  45092 [ACK] Seq=1 Ack=376481 Win=480256 Len=0 TSval=1023636423 TSecr=1378707062
120,3.149175,192.168.2.2,192.168.1.2,TCP,66,481280,5001  >  45092 [ACK] Seq=1 Ack=398201 Win=481280 Len=0 TSval=1023636428 TSecr=1378707123
122,3.33091,192.168.2.2,192.168.1.2,TCP,66,484352,5001  >  45092 [ACK] Seq=1 Ack=414129 Win=484352 Len=0 TSval=1023636609 TSecr=1378707123
124,3.464371,192.168.2.2,192.168.1.2,TCP,66,487424,5001  >  45092 [ACK] Seq=1 Ack=415577 Win=487424 Len=0 TSval=1023636743 TSecr=1378707233
126,3.47614,192.168.2.2,192.168.1.2,TCP,66,489984,5001  >  45092 [ACK] Seq=1 Ack=419921 Win=489984 Len=0 TSval=1023636754 TSecr=1378707246
128,3.512349,192.168.2.2,192.168.1.2,TCP,66,483840,5001  >  45092 [ACK] Seq=1 Ack=437297 Win=483840 Len=0 TSval=1023636791 TSecr=1378707371
130,3.658965,192.168.2.2,192.168.1.2,TCP,66,489984,5001  >  45092 [ACK] Seq=1 Ack=441641 Win=489984 Len=0 TSval=1023636937 TSecr=1378707428
133,3.696792,192.168.2.2,192.168.1.2,TCP,66,481280,5001  >  45092 [ACK] Seq=1 Ack=463361 Win=481280 Len=0 TSval=1023636975 TSecr=1378707609
135,3.878502,192.168.2.2,192.168.1.2,TCP,66,481280,5001  >  45092 [ACK] Seq=1 Ack=485081 Win=481280 Len=0 TSval=1023637157 TSecr=1378707791
138,4.060537,192.168.2.2,192.168.1.2,TCP,66,524800,5001  >  45092 [ACK] Seq=1 Ack=502457 Win=524800 Len=0 TSval=1023637338 TSecr=1378707883
140,4.205726,192.168.2.2,192.168.1.2,TCP,66,530432,5001  >  45092 [ACK] Seq=1 Ack=505353 Win=530432 Len=0 TSval=1023637484 TSecr=1378707973
142,4.230234,192.168.2.2,192.168.1.2,TCP,66,533504,5001  >  45092 [ACK] Seq=1 Ack=506801 Win=533504 Len=0 TSval=1023637508 TSecr=1378707997
144,4.242067,192.168.2.2,192.168.1.2,TCP,66,568320,5001  >  45092 [ACK] Seq=1 Ack=524177 Win=568320 Len=0 TSval=1023637520 TSecr=1378708034
147,4.387211,192.168.2.2,192.168.1.2,TCP,66,577024,5001  >  45092 [ACK] Seq=1 Ack=528521 Win=577024 Len=0 TSval=1023637665 TSecr=1378708154
149,4.42357,192.168.2.2,192.168.1.2,TCP,66,620544,5001  >  45092 [ACK] Seq=1 Ack=550241 Win=620544 Len=0 TSval=1023637701 TSecr=1378708336
151,4.606109,192.168.2.2,192.168.1.2,TCP,66,655360,5001  >  45092 [ACK] Seq=1 Ack=567617 Win=655360 Len=0 TSval=1023637884 TSecr=1378708394
153,4.751132,192.168.2.2,192.168.1.2,TCP,66,675328,5001  >  45092 [ACK] Seq=1 Ack=577753 Win=675328 Len=0 TSval=1023638029 TSecr=1378708517
156,4.836294,192.168.2.2,192.168.1.2,TCP,66,698880,5001  >  45092 [ACK] Seq=1 Ack=589337 Win=698880 Len=0 TSval=1023638114 TSecr=1378708598
158,4.933499,192.168.2.2,192.168.1.2,TCP,66,701440,5001  >  45092 [ACK] Seq=1 Ack=590785 Win=701440 Len=0 TSval=1023638211 TSecr=1378708695
160,4.945341,192.168.2.2,192.168.1.2,TCP,66,710144,5001  >  45092 [ACK] Seq=1 Ack=595129 Win=710144 Len=0 TSval=1023638223 TSecr=1378708700
162,4.981472,192.168.2.2,192.168.1.2,TCP,66,776704,5001  >  45092 [ACK] Seq=1 Ack=628433 Win=776704 Len=0 TSval=1023638259 TSecr=1378708881
167,5.260336,192.168.2.2,192.168.1.2,TCP,66,779776,5001  >  45092 [ACK] Seq=1 Ack=629881 Win=779776 Len=0 TSval=1023638538 TSecr=1378709015
169,5.273047,192.168.2.2,192.168.1.2,TCP,66,788480,5001  >  45092 [ACK] Seq=1 Ack=634225 Win=788480 Len=0 TSval=1023638550 TSecr=1378709026
171,5.3085,192.168.2.2,192.168.1.2,TCP,66,800256,5001  >  45092 [ACK] Seq=1 Ack=640017 Win=800256 Len=0 TSval=1023638586 TSecr=1378709063
173,5.357417,192.168.2.2,192.168.1.2,TCP,66,832000,5001  >  45092 [ACK] Seq=1 Ack=655945 Win=832000 Len=0 TSval=1023638635 TSecr=1378709209
177,5.490219,192.168.2.2,192.168.1.2,TCP,66,837632,5001  >  45092 [ACK] Seq=1 Ack=677665 Win=837632 Len=0 TSval=1023638767 TSecr=1378709247
179,5.671938,192.168.2.2,192.168.1.2,TCP,66,844800,5001  >  45092 [ACK] Seq=1 Ack=684905 Win=844800 Len=0 TSval=1023638949 TSecr=1378709429
182,5.733175,192.168.2.2,192.168.1.2,TCP,66,832512,5001  >  45092 [ACK] Seq=1 Ack=716761 Win=832512 Len=0 TSval=1023639010 TSecr=1378709610
186,5.999833,192.168.2.2,192.168.1.2,TCP,66,846848,5001  >  45092 [ACK] Seq=1 Ack=719657 Win=846848 Len=0 TSval=1023639277 TSecr=1378709756
188,6.023901,192.168.2.2,192.168.1.2,TCP,66,847872,5001  >  45092 [ACK] Seq=1 Ack=721105 Win=847872 Len=0 TSval=1023639301 TSecr=1378709780
190,6.036061,192.168.2.2,192.168.1.2,TCP,66,844288,5001  >  45092 [ACK] Seq=1 Ack=729793 Win=844288 Len=0 TSval=1023639313 TSecr=1378709792
193,6.108711,192.168.2.2,192.168.1.2,TCP,66,844288,5001  >  45092 [ACK] Seq=1 Ack=738481 Win=844288 Len=0 TSval=1023639386 TSecr=1378709930
195,6.181367,192.168.2.2,192.168.1.2,TCP,66,846336,5001  >  45092 [ACK] Seq=1 Ack=742825 Win=846336 Len=0 TSval=1023639458 TSecr=1378709937
197,6.218302,192.168.2.2,192.168.1.2,TCP,66,837632,5001  >  45092 [ACK] Seq=1 Ack=764545 Win=837632 Len=0 TSval=1023639495 TSecr=1378709973
199,6.400196,192.168.2.2,192.168.1.2,TCP,66,843264,5001  >  45092 [ACK] Seq=1 Ack=774681 Win=843264 Len=0 TSval=1023639677 TSecr=1378710156
201,6.484152,192.168.2.2,192.168.1.2,TCP,66,839680,5001  >  45092 [ACK] Seq=1 Ack=792057 Win=839680 Len=0 TSval=1023639761 TSecr=1378710301
203,6.629489,192.168.2.2,192.168.1.2,TCP,66,842752,5001  >  45092 [ACK] Seq=1 Ack=803641 Win=842752 Len=0 TSval=1023639906 TSecr=1378710386
205,6.726494,192.168.2.2,192.168.1.2,TCP,66,847872,5001  >  45092 [ACK] Seq=1 Ack=805089 Win=847872 Len=0 TSval=1023640003 TSecr=1378710483
207,6.739252,192.168.2.2,192.168.1.2,TCP,66,846336,5001  >  45092 [ACK] Seq=1 Ack=809433 Win=846336 Len=0 TSval=1023640016 TSecr=1378710495
209,6.774832,192.168.2.2,192.168.1.2,TCP,66,843264,5001  >  45092 [ACK] Seq=1 Ack=819569 Win=843264 Len=0 TSval=1023640051 TSecr=1378710531
212,6.860734,192.168.2.2,192.168.1.2,TCP,66,836096,5001  >  45092 [ACK] Seq=1 Ack=844185 Win=836096 Len=0 TSval=1023640137 TSecr=1378710810
216,7.066658,192.168.2.2,192.168.1.2,TCP,66,846336,5001  >  45092 [ACK] Seq=1 Ack=848529 Win=846336 Len=0 TSval=1023640343 TSecr=1378710822
218,7.103335,192.168.2.2,192.168.1.2,TCP,66,845312,5001  >  45092 [ACK] Seq=1 Ack=854321 Win=845312 Len=0 TSval=1023640380 TSecr=1378710858
220,7.151427,192.168.2.2,192.168.1.2,TCP,66,842752,5001  >  45092 [ACK] Seq=1 Ack=865905 Win=842752 Len=0 TSval=1023640428 TSecr=1378710907
222,7.248434,192.168.2.2,192.168.1.2,TCP,66,846336,5001  >  45092 [ACK] Seq=1 Ack=870249 Win=846336 Len=0 TSval=1023640525 TSecr=1378710954
224,7.284678,192.168.2.2,192.168.1.2,TCP,66,837632,5001  >  45092 [ACK] Seq=1 Ack=891969 Win=837632 Len=0 TSval=1023640561 TSecr=1378711039
227,7.466551,192.168.2.2,192.168.1.2,TCP,66,844800,5001  >  45092 [ACK] Seq=1 Ack=899209 Win=844800 Len=0 TSval=1023640743 TSecr=1378711221
229,7.527289,192.168.2.2,192.168.1.2,TCP,66,847872,5001  >  45092 [ACK] Seq=1 Ack=912241 Win=847872 Len=0 TSval=1023640803 TSecr=1378711282
231,7.635947,192.168.2.2,192.168.1.2,TCP,66,847872,5001  >  45092 [ACK] Seq=1 Ack=931065 Win=847872 Len=0 TSval=1023640912 TSecr=1378711465
233,7.793858,192.168.2.2,192.168.1.2,TCP,66,847872,5001  >  45092 [ACK] Seq=1 Ack=933961 Win=847872 Len=0 TSval=1023641070 TSecr=1378711549
235,7.829727,192.168.2.2,192.168.1.2,TCP,66,847872,5001  >  45092 [ACK] Seq=1 Ack=944097 Win=847872 Len=0 TSval=1023641106 TSecr=1378711573
238,7.903147,192.168.2.2,192.168.1.2,TCP,66,847872,5001  >  45092 [ACK] Seq=1 Ack=952785 Win=847872 Len=0 TSval=1023641179 TSecr=1378711658
240,7.976233,192.168.2.2,192.168.1.2,TCP,66,847872,5001  >  45092 [ACK] Seq=1 Ack=957129 Win=847872 Len=0 TSval=1023641252 TSecr=1378711730
242,8.025221,192.168.2.2,192.168.1.2,TCP,66,847872,5001  >  45092 [ACK] Seq=1 Ack=988985 Win=847872 Len=0 TSval=1023641301 TSecr=1378711767
245,8.279564,192.168.2.2,192.168.1.2,TCP,66,840704,5001  >  45092 [ACK] Seq=1 Ack=1004913 Win=840704 Len=0 TSval=1023641555 TSecr=1378712033
247,8.412813,192.168.2.2,192.168.1.2,TCP,66,841728,5001  >  45092 [ACK] Seq=1 Ack=1017945 Win=841728 Len=0 TSval=1023641689 TSecr=1378712178
249,8.521785,192.168.2.2,192.168.1.2,TCP,66,847872,5001  >  45092 [ACK] Seq=1 Ack=1019393 Win=847872 Len=0 TSval=1023641797 TSecr=1378712275
251,8.534328,192.168.2.2,192.168.1.2,TCP,66,846336,5001  >  45092 [ACK] Seq=1 Ack=1023737 Win=846336 Len=0 TSval=1023641810 TSecr=1378712288
253,8.570553,192.168.2.2,192.168.1.2,TCP,66,843264,5001  >  45092 [ACK] Seq=1 Ack=1033873 Win=843264 Len=0 TSval=1023641846 TSecr=1378712323
255,8.655866,192.168.2.2,192.168.1.2,TCP,66,839680,5001  >  45092 [ACK] Seq=1 Ack=1051249 Win=839680 Len=0 TSval=1023641931 TSecr=1378712409
257,8.800437,192.168.2.2,192.168.1.2,TCP,66,844800,5001  >  45092 [ACK] Seq=1 Ack=1058489 Win=844800 Len=0 TSval=1023642076 TSecr=1378712489
260,8.861661,192.168.2.2,192.168.1.2,TCP,66,846336,5001  >  45092 [ACK] Seq=1 Ack=1062833 Win=846336 Len=0 TSval=1023642137 TSecr=1378712615
262,8.898359,192.168.2.2,192.168.1.2,TCP,66,845312,5001  >  45092 [ACK] Seq=1 Ack=1068625 Win=845312 Len=0 TSval=1023642174 TSecr=1378712652
264,8.946496,192.168.2.2,192.168.1.2,TCP,66,842752,5001  >  45092 [ACK] Seq=1 Ack=1080209 Win=842752 Len=0 TSval=1023642222 TSecr=1378712700
267,9.043401,192.168.2.2,192.168.1.2,TCP,66,846336,5001  >  45092 [ACK] Seq=1 Ack=1084553 Win=846336 Len=0 TSval=1023642319 TSecr=1378712797
269,9.080848,192.168.2.2,192.168.1.2,TCP,66,841728,5001  >  45092 [ACK] Seq=1 Ack=1097585 Win=841728 Len=0 TSval=1023642356 TSecr=1378712833
271,9.188725,192.168.2.2,192.168.1.2,TCP,66,844288,5001  >  45092 [ACK] Seq=1 Ack=1106273 Win=844288 Len=0 TSval=1023642464 TSecr=1378713001
273,9.261381,192.168.2.2,192.168.1.2,TCP,66,844800,5001  >  45092 [ACK] Seq=1 Ack=1113513 Win=844800 Len=0 TSval=1023642537 TSecr=1378713015
275,9.321993,192.168.2.2,192.168.1.2,TCP,66,841728,5001  >  45092 [ACK] Seq=1 Ack=1126545 Win=841728 Len=0 TSval=1023642597 TSecr=1378713076
277,9.431114,192.168.2.2,192.168.1.2,TCP,66,839680,5001  >  45092 [ACK] Seq=1 Ack=1143921 Win=839680 Len=0 TSval=1023642706 TSecr=1378713184
279,9.577146,192.168.2.2,192.168.1.2,TCP,66,846336,5001  >  45092 [ACK] Seq=1 Ack=1148265 Win=846336 Len=0 TSval=1023642852 TSecr=1378713342
281,9.612689,192.168.2.2,192.168.1.2,TCP,66,847872,5001  >  45092 [ACK] Seq=1 Ack=1158401 Win=847872 Len=0 TSval=1023642888 TSecr=1378713378
283,9.697698,192.168.2.2,192.168.1.2,TCP,66,847872,5001  >  45092 [ACK] Seq=1 Ack=1167089 Win=847872 Len=0 TSval=1023642973 TSecr=1378713451
285,9.770152,192.168.2.2,192.168.1.2,TCP,66,847872,5001  >  45092 [ACK] Seq=1 Ack=1171433 Win=847872 Len=0 TSval=1023643045 TSecr=1378713524
287,9.806671,192.168.2.2,192.168.1.2,TCP,66,847872,5001  >  45092 [ACK] Seq=1 Ack=1190257 Win=847872 Len=0 TSval=1023643082 TSecr=1378713573
290,9.964684,192.168.2.2,192.168.1.2,TCP,66,847872,5001  >  45092 [ACK] Seq=1 Ack=1219217 Win=847872 Len=0 TSval=1023643240 TSecr=1378713827
294,10.206906,192.168.2.2,192.168.1.2,TCP,66,841728,5001  >  45092 [ACK] Seq=1 Ack=1232249 Win=841728 Len=0 TSval=1023643482 TSecr=1378713961
295,10.315961,192.168.2.2,192.168.1.2,TCP,66,847872,5001  >  45092 [ACK] Seq=1 Ack=1233697 Win=847872 Len=0 TSval=1023643591 TSecr=1378714070
296,10.328287,192.168.2.2,192.168.1.2,TCP,66,846848,5001  >  45092 [ACK] Seq=1 Ack=1236593 Win=846848 Len=0 TSval=1023643603 TSecr=1378714082
297,10.352861,192.168.2.2,192.168.1.2,TCP,66,842752,5001  >  45092 [ACK] Seq=1 Ack=1248177 Win=842752 Len=0 TSval=1023643628 TSecr=1378714118
298,10.449143,192.168.2.2,192.168.1.2,TCP,66,839680,5001  >  45092 [ACK] Seq=1 Ack=1265553 Win=839680 Len=0 TSval=1023643724 TSecr=1378714204
299,10.594528,192.168.2.2,192.168.1.2,TCP,66,844800,5001  >  45092 [ACK] Seq=1 Ack=1272793 Win=844800 Len=0 TSval=1023643869 TSecr=1378714348
300,10.655244,192.168.2.2,192.168.1.2,TCP,66,846336,5001  >  45092 [ACK] Seq=1 Ack=1277137 Win=846336 Len=0 TSval=1023643930 TSecr=1378714409
301,10.691391,192.168.2.2,192.168.1.2,TCP,66,845312,5001  >  45092 [ACK] Seq=1 Ack=1282929 Win=845312 Len=0 TSval=1023643966 TSecr=1378714446
302,10.739844,192.168.2.2,192.168.1.2,TCP,66,842752,5001  >  45092 [ACK] Seq=1 Ack=1294513 Win=842752 Len=0 TSval=1023644014 TSecr=1378714494
304,10.837874,192.168.2.2,192.168.1.2,TCP,66,846336,5001  >  45092 [ACK] Seq=1 Ack=1298857 Win=846336 Len=0 TSval=1023644112 TSecr=1378714591
305,10.873847,192.168.2.2,192.168.1.2,TCP,66,846848,5001  >  45092 [ACK] Seq=1 Ack=1301753 Win=846848 Len=0 TSval=1023644148 TSecr=1378714628
306,10.89828,192.168.2.2,192.168.1.2,TCP,66,839168,5001  >  45092 [ACK] Seq=1 Ack=1320577 Win=839168 Len=0 TSval=1023644173 TSecr=1378714736
308,11.055566,192.168.2.2,192.168.1.2,TCP,66,844800,5001  >  45092 [ACK] Seq=1 Ack=1327817 Win=844800 Len=0 TSval=1023644330 TSecr=1378714809
309,11.11609,192.168.2.2,192.168.1.2,TCP,66,841728,5001  >  45092 [ACK] Seq=1 Ack=1340849 Win=841728 Len=0 TSval=1023644390 TSecr=1378714869
310,11.225087,192.168.2.2,192.168.1.2,TCP,66,839680,5001  >  45092 [ACK] Seq=1 Ack=1358225 Win=839680 Len=0 TSval=1023644499 TSecr=1378714978
311,11.370467,192.168.2.2,192.168.1.2,TCP,66,846336,5001  >  45092 [ACK] Seq=1 Ack=1362569 Win=846336 Len=0 TSval=1023644645 TSecr=1378715124
312,11.406779,192.168.2.2,192.168.1.2,TCP,66,846336,5001  >  45092 [ACK] Seq=1 Ack=1366913 Win=846336 Len=0 TSval=1023644681 TSecr=1378715160
313,11.443753,192.168.2.2,192.168.1.2,TCP,66,847872,5001  >  45092 [ACK] Seq=1 Ack=1381393 Win=847872 Len=0 TSval=1023644718 TSecr=1378715245
314,11.564247,192.168.2.2,192.168.1.2,TCP,66,847872,5001  >  45092 [ACK] Seq=1 Ack=1385737 Win=847872 Len=0 TSval=1023644838 TSecr=1378715317
315,11.601564,192.168.2.2,192.168.1.2,TCP,66,847872,5001  >  45092 [ACK] Seq=1 Ack=1404561 Win=847872 Len=0 TSval=1023644876 TSecr=1378715354
316,11.758035,192.168.2.2,192.168.1.2,TCP,66,847872,5001  >  45092 [ACK] Seq=1 Ack=1432073 Win=847872 Len=0 TSval=1023645032 TSecr=1378715512
318,11.988163,192.168.2.2,192.168.1.2,TCP,66,847872,5001  >  45092 [ACK] Seq=1 Ack=1433521 Win=847872 Len=0 TSval=1023645262 TSecr=1378715559
322,12.001851,192.168.2.2,192.168.1.2,TCP,66,846848,5001  >  45092 [ACK] Seq=1 Ack=1436417 Win=846848 Len=0 TSval=1023645276 TSecr=1378717304
327,12.026038,192.168.2.2,192.168.1.2,TCP,66,846848,5001  >  45092 [ACK] Seq=1 Ack=1439313 Win=846848 Len=0 TSval=1023645300 TSecr=1378717534
330,12.05083,192.168.2.2,192.168.1.2,TCP,66,819712,5001  >  45092 [ACK] Seq=1 Ack=1497233 Win=819712 Len=0 TSval=1023645325 TSecr=1378717548
334,12.535473,192.168.2.2,192.168.1.2,TCP,66,816128,5001  >  45092 [ACK] Seq=1 Ack=1562393 Win=816128 Len=0 TSval=1023645809 TSecr=1378717548
340,13.079945,192.168.2.2,192.168.1.2,TCP,66,816128,5001  >  45092 [ACK] Seq=1 Ack=1627553 Win=816128 Len=0 TSval=1023646353 TSecr=1378717548
344,13.624874,192.168.2.2,192.168.1.2,TCP,66,835584,5001  >  45092 [ACK] Seq=1 Ack=1653617 Win=835584 Len=0 TSval=1023646898 TSecr=1378717549
346,13.842937,192.168.2.2,192.168.1.2,TCP,66,845312,5001  >  45092 [ACK] Seq=1 Ack=1659409 Win=845312 Len=0 TSval=1023647116 TSecr=1378717572
349,13.892227,192.168.2.2,192.168.1.2,TCP,66,832000,5001  >  45092 [ACK] Seq=1 Ack=1692713 Win=832000 Len=0 TSval=1023647165 TSecr=1378717597
351,14.170711,192.168.2.2,192.168.1.2,TCP,66,816128,5001  >  45092 [ACK] Seq=1 Ack=1757873 Win=816128 Len=0 TSval=1023647444 TSecr=1378717597
352,14.715695,192.168.2.2,192.168.1.2,TCP,66,839680,5001  >  45092 [ACK] Seq=1 Ack=1775249 Win=839680 Len=0 TSval=1023647988 TSecr=1378717598
353,14.861163,192.168.2.2,192.168.1.2,TCP,66,824320,5001  >  45092 [ACK] Seq=1 Ack=1823033 Win=824320 Len=0 TSval=1023648134 TSecr=1378718081
356,15.261128,192.168.2.2,192.168.1.2,TCP,66,816128,5001  >  45092 [ACK] Seq=1 Ack=1888193 Win=816128 Len=0 TSval=1023648533 TSecr=1378718081
357,15.80586,192.168.2.2,192.168.1.2,TCP,66,839680,5001  >  45092 [ACK] Seq=1 Ack=1905569 Win=839680 Len=0 TSval=1023649078 TSecr=1378718082
359,15.951984,192.168.2.2,192.168.1.2,TCP,66,824320,5001  >  45092 [ACK] Seq=1 Ack=1953353 Win=824320 Len=0 TSval=1023649224 TSecr=1378718625
361,16.351623,192.168.2.2,192.168.1.2,TCP,66,816128,5001  >  45092 [ACK] Seq=1 Ack=2018513 Win=816128 Len=0 TSval=1023649623 TSecr=1378718626
362,16.896647,192.168.2.2,192.168.1.2,TCP,66,882688,5001  >  45092 [ACK] Seq=1 Ack=2035889 Win=882688 Len=0 TSval=1023650168 TSecr=1378718629
363,17.042338,192.168.2.2,192.168.1.2,TCP,66,977920,5001  >  45092 [ACK] Seq=1 Ack=2083673 Win=977920 Len=0 TSval=1023650314 TSecr=1378719170
368,17.441859,192.168.2.2,192.168.1.2,TCP,66,1009664,5001  >  45092 [ACK] Seq=1 Ack=2099601 Win=1009664 Len=0 TSval=1023650713 TSecr=1378719388
383,17.57786,192.168.2.2,192.168.1.2,TCP,66,1012736,5001  >  45092 [ACK] Seq=1 Ack=2101049 Win=1012736 Len=0 TSval=1023650849 TSecr=1378722586
384,17.590733,192.168.2.2,192.168.1.2,TCP,66,1015808,5001  >  45092 [ACK] Seq=1 Ack=2102497 Win=1015808 Len=0 TSval=1023650862 TSecr=1378722596
385,17.602069,192.168.2.2,192.168.1.2,TCP,66,1018368,5001  >  45092 [ACK] Seq=1 Ack=2103945 Win=1018368 Len=0 TSval=1023650873 TSecr=1378722606
388,17.614927,192.168.2.2,192.168.1.2,TCP,66,1021440,5001  >  45092 [ACK] Seq=1 Ack=2105393 Win=1021440 Len=0 TSval=1023650886 TSecr=1378722985
390,17.627073,192.168.2.2,192.168.1.2,TCP,66,1024512,5001  >  45092 [ACK] Seq=1 Ack=2106841 Win=1024512 Len=0 TSval=1023650898 TSecr=1378722996
392,17.639168,192.168.2.2,192.168.1.2,TCP,66,1027072,5001  >  45092 [ACK] Seq=1 Ack=2108289 Win=1027072 Len=0 TSval=1023650910 TSecr=1378723006
394,17.651501,192.168.2.2,192.168.1.2,TCP,66,1030144,5001  >  45092 [ACK] Seq=1 Ack=2109737 Win=1030144 Len=0 TSval=1023650923 TSecr=1378723016
396,17.66341,192.168.2.2,192.168.1.2,TCP,66,1033216,5001  >  45092 [ACK] Seq=1 Ack=2111185 Win=1033216 Len=0 TSval=1023650935 TSecr=1378723026
398,17.675514,192.168.2.2,192.168.1.2,TCP,66,1035776,5001  >  45092 [ACK] Seq=1 Ack=2112633 Win=1035776 Len=0 TSval=1023650947 TSecr=1378723036
400,17.687776,192.168.2.2,192.168.1.2,TCP,66,1038848,5001  >  45092 [ACK] Seq=1 Ack=2114081 Win=1038848 Len=0 TSval=1023650959 TSecr=1378723046
402,17.699743,192.168.2.2,192.168.1.2,TCP,66,1041920,5001  >  45092 [ACK] Seq=1 Ack=2115529 Win=1041920 Len=0 TSval=1023650971 TSecr=1378723056
404,17.711858,192.168.2.2,192.168.1.2,TCP,66,1044480,5001  >  45092 [ACK] Seq=1 Ack=2116977 Win=1044480 Len=0 TSval=1023650983 TSecr=1378723066
406,17.723944,192.168.2.2,192.168.1.2,TCP,66,1047552,5001  >  45092 [ACK] Seq=1 Ack=2118425 Win=1047552 Len=0 TSval=1023650995 TSecr=1378723076
408,17.73607,192.168.2.2,192.168.1.2,TCP,66,1050624,5001  >  45092 [ACK] Seq=1 Ack=2119873 Win=1050624 Len=0 TSval=1023651007 TSecr=1378723087
410,17.748179,192.168.2.2,192.168.1.2,TCP,66,1053184,5001  >  45092 [ACK] Seq=1 Ack=2121321 Win=1053184 Len=0 TSval=1023651019 TSecr=1378723145
412,17.760302,192.168.2.2,192.168.1.2,TCP,66,1056256,5001  >  45092 [ACK] Seq=1 Ack=2122769 Win=1056256 Len=0 TSval=1023651031 TSecr=1378723158
414,17.772427,192.168.2.2,192.168.1.2,TCP,66,1059328,5001  >  45092 [ACK] Seq=1 Ack=2124217 Win=1059328 Len=0 TSval=1023651043 TSecr=1378723170
416,17.785299,192.168.2.2,192.168.1.2,TCP,66,1061888,5001  >  45092 [ACK] Seq=1 Ack=2125665 Win=1061888 Len=0 TSval=1023651056 TSecr=1378723182
418,17.797062,192.168.2.2,192.168.1.2,TCP,66,1064960,5001  >  45092 [ACK] Seq=1 Ack=2127113 Win=1064960 Len=0 TSval=1023651068 TSecr=1378723195
419,17.808874,192.168.2.2,192.168.1.2,TCP,66,1068032,5001  >  45092 [ACK] Seq=1 Ack=2128561 Win=1068032 Len=0 TSval=1023651080 TSecr=1378723207
421,17.820922,192.168.2.2,192.168.1.2,TCP,66,1070592,5001  >  45092 [ACK] Seq=1 Ack=2130009 Win=1070592 Len=0 TSval=1023651092 TSecr=1378723219
422,17.833309,192.168.2.2,192.168.1.2,TCP,66,1073664,5001  >  45092 [ACK] Seq=1 Ack=2131457 Win=1073664 Len=0 TSval=1023651104 TSecr=1378723231
423,17.845129,192.168.2.2,192.168.1.2,TCP,66,1076736,5001  >  45092 [ACK] Seq=1 Ack=2132905 Win=1076736 Len=0 TSval=1023651116 TSecr=1378723243
425,17.857738,192.168.2.2,192.168.1.2,TCP,66,1079296,5001  >  45092 [ACK] Seq=1 Ack=2134353 Win=1079296 Len=0 TSval=1023651129 TSecr=1378723255
427,17.869502,192.168.2.2,192.168.1.2,TCP,66,1082368,5001  >  45092 [ACK] Seq=1 Ack=2135801 Win=1082368 Len=0 TSval=1023651141 TSecr=1378723267
429,17.882144,192.168.2.2,192.168.1.2,TCP,66,1085440,5001  >  45092 [ACK] Seq=1 Ack=2137249 Win=1085440 Len=0 TSval=1023651153 TSecr=1378723279
431,17.894035,192.168.2.2,192.168.1.2,TCP,66,1088000,5001  >  45092 [ACK] Seq=1 Ack=2138697 Win=1088000 Len=0 TSval=1023651165 TSecr=1378723291
433,17.905767,192.168.2.2,192.168.1.2,TCP,66,1091072,5001  >  45092 [ACK] Seq=1 Ack=2140145 Win=1091072 Len=0 TSval=1023651177 TSecr=1378723303
435,17.918507,192.168.2.2,192.168.1.2,TCP,66,1096704,5001  >  45092 [ACK] Seq=1 Ack=2143041 Win=1096704 Len=0 TSval=1023651189 TSecr=1378723316
438,17.94214,192.168.2.2,192.168.1.2,TCP,66,1102336,5001  >  45092 [ACK] Seq=1 Ack=2145937 Win=1102336 Len=0 TSval=1023651213 TSecr=1378723334
441,17.9662,192.168.2.2,192.168.1.2,TCP,66,1108480,5001  >  45092 [ACK] Seq=1 Ack=2148833 Win=1108480 Len=0 TSval=1023651237 TSecr=1378723352
444,17.991061,192.168.2.2,192.168.1.2,TCP,66,1111040,5001  >  45092 [ACK] Seq=1 Ack=2150281 Win=1111040 Len=0 TSval=1023651262 TSecr=1378723388
446,18.002812,192.168.2.2,192.168.1.2,TCP,66,1114112,5001  >  45092 [ACK] Seq=1 Ack=2151729 Win=1114112 Len=0 TSval=1023651274 TSecr=1378723404
448,18.014658,192.168.2.2,192.168.1.2,TCP,66,1117184,5001  >  45092 [ACK] Seq=1 Ack=2153177 Win=1117184 Len=0 TSval=1023651286 TSecr=1378723419
450,18.02676,192.168.2.2,192.168.1.2,TCP,66,1119744,5001  >  45092 [ACK] Seq=1 Ack=2154625 Win=1119744 Len=0 TSval=1023651298 TSecr=1378723431
452,18.038865,192.168.2.2,192.168.1.2,TCP,66,1122816,5001  >  45092 [ACK] Seq=1 Ack=2156073 Win=1122816 Len=0 TSval=1023651310 TSecr=1378723443
454,18.05099,192.168.2.2,192.168.1.2,TCP,66,1125888,5001  >  45092 [ACK] Seq=1 Ack=2157521 Win=1125888 Len=0 TSval=1023651322 TSecr=1378723454
456,18.06311,192.168.2.2,192.168.1.2,TCP,66,1128448,5001  >  45092 [ACK] Seq=1 Ack=2158969 Win=1128448 Len=0 TSval=1023651334 TSecr=1378723465
458,18.075403,192.168.2.2,192.168.1.2,TCP,66,1131520,5001  >  45092 [ACK] Seq=1 Ack=2160417 Win=1131520 Len=0 TSval=1023651346 TSecr=1378723477
461,18.08734,192.168.2.2,192.168.1.2,TCP,66,1134592,5001  >  45092 [ACK] Seq=1 Ack=2161865 Win=1134592 Len=0 TSval=1023651358 TSecr=1378723488
463,18.099419,192.168.2.2,192.168.1.2,TCP,66,1137152,5001  >  45092 [ACK] Seq=1 Ack=2163313 Win=1137152 Len=0 TSval=1023651370 TSecr=1378723499
465,18.11158,192.168.2.2,192.168.1.2,TCP,66,1140224,5001  >  45092 [ACK] Seq=1 Ack=2164761 Win=1140224 Len=0 TSval=1023651382 TSecr=1378723511
467,18.123658,192.168.2.2,192.168.1.2,TCP,66,1143296,5001  >  45092 [ACK] Seq=1 Ack=2166209 Win=1143296 Len=0 TSval=1023651395 TSecr=1378723522
469,18.135782,192.168.2.2,192.168.1.2,TCP,66,1145856,5001  >  45092 [ACK] Seq=1 Ack=2167657 Win=1145856 Len=0 TSval=1023651407 TSecr=1378723534
471,18.147879,192.168.2.2,192.168.1.2,TCP,66,1148928,5001  >  45092 [ACK] Seq=1 Ack=2169105 Win=1148928 Len=0 TSval=1023651419 TSecr=1378723546
473,18.160022,192.168.2.2,192.168.1.2,TCP,66,1152000,5001  >  45092 [ACK] Seq=1 Ack=2170553 Win=1152000 Len=0 TSval=1023651431 TSecr=1378723558
475,18.172469,192.168.2.2,192.168.1.2,TCP,66,1154560,5001  >  45092 [ACK] Seq=1 Ack=2172001 Win=1154560 Len=0 TSval=1023651443 TSecr=1378723570
477,18.184202,192.168.2.2,192.168.1.2,TCP,66,1157632,5001  >  45092 [ACK] Seq=1 Ack=2173449 Win=1157632 Len=0 TSval=1023651455 TSecr=1378723582
479,18.196323,192.168.2.2,192.168.1.2,TCP,66,1160704,5001  >  45092 [ACK] Seq=1 Ack=2174897 Win=1160704 Len=0 TSval=1023651467 TSecr=1378723594
480,18.208441,192.168.2.2,192.168.1.2,TCP,66,1163264,5001  >  45092 [ACK] Seq=1 Ack=2176345 Win=1163264 Len=0 TSval=1023651479 TSecr=1378723606
481,18.22056,192.168.2.2,192.168.1.2,TCP,66,1166336,5001  >  45092 [ACK] Seq=1 Ack=2177793 Win=1166336 Len=0 TSval=1023651491 TSecr=1378723618
483,18.233429,192.168.2.2,192.168.1.2,TCP,66,1169408,5001  >  45092 [ACK] Seq=1 Ack=2179241 Win=1169408 Len=0 TSval=1023651504 TSecr=1378723630
485,18.245863,192.168.2.2,192.168.1.2,TCP,66,1171968,5001  >  45092 [ACK] Seq=1 Ack=2180689 Win=1171968 Len=0 TSval=1023651517 TSecr=1378723642
487,18.257677,192.168.2.2,192.168.1.2,TCP,66,1175040,5001  >  45092 [ACK] Seq=1 Ack=2182137 Win=1175040 Len=0 TSval=1023651529 TSecr=1378723655
489,18.27033,192.168.2.2,192.168.1.2,TCP,66,1178112,5001  >  45092 [ACK] Seq=1 Ack=2183585 Win=1178112 Len=0 TSval=1023651541 TSecr=1378723667
491,18.282622,192.168.2.2,192.168.1.2,TCP,66,1180672,5001  >  45092 [ACK] Seq=1 Ack=2185033 Win=1180672 Len=0 TSval=1023651553 TSecr=1378723679
493,18.29445,192.168.2.2,192.168.1.2,TCP,66,1183744,5001  >  45092 [ACK] Seq=1 Ack=2186481 Win=1183744 Len=0 TSval=1023651565 TSecr=1378723691
495,18.306151,192.168.2.2,192.168.1.2,TCP,66,1189376,5001  >  45092 [ACK] Seq=1 Ack=2189377 Win=1189376 Len=0 TSval=1023651577 TSecr=1378723703
498,18.330344,192.168.2.2,192.168.1.2,TCP,66,1195008,5001  >  45092 [ACK] Seq=1 Ack=2192273 Win=1195008 Len=0 TSval=1023651601 TSecr=1378723720
501,18.35459,192.168.2.2,192.168.1.2,TCP,66,1201152,5001  >  45092 [ACK] Seq=1 Ack=2195169 Win=1201152 Len=0 TSval=1023651625 TSecr=1378723739
504,18.379662,192.168.2.2,192.168.1.2,TCP,66,1203712,5001  >  45092 [ACK] Seq=1 Ack=2196617 Win=1203712 Len=0 TSval=1023651650 TSecr=1378723776
506,18.391414,192.168.2.2,192.168.1.2,TCP,66,1206784,5001  >  45092 [ACK] Seq=1 Ack=2198065 Win=1206784 Len=0 TSval=1023651662 TSecr=1378723792
508,18.403199,192.168.2.2,192.168.1.2,TCP,66,1209856,5001  >  45092 [ACK] Seq=1 Ack=2199513 Win=1209856 Len=0 TSval=1023651674 TSecr=1378723806
510,18.415112,192.168.2.2,192.168.1.2,TCP,66,1212416,5001  >  45092 [ACK] Seq=1 Ack=2200961 Win=1212416 Len=0 TSval=1023651686 TSecr=1378723818
512,18.427234,192.168.2.2,192.168.1.2,TCP,66,1215488,5001  >  45092 [ACK] Seq=1 Ack=2202409 Win=1215488 Len=0 TSval=1023651698 TSecr=1378723829
514,18.439419,192.168.2.2,192.168.1.2,TCP,66,1218560,5001  >  45092 [ACK] Seq=1 Ack=2203857 Win=1218560 Len=0 TSval=1023651710 TSecr=1378723840
516,18.451463,192.168.2.2,192.168.1.2,TCP,66,1221120,5001  >  45092 [ACK] Seq=1 Ack=2205305 Win=1221120 Len=0 TSval=1023651722 TSecr=1378723851
518,18.463595,192.168.2.2,192.168.1.2,TCP,66,1224192,5001  >  45092 [ACK] Seq=1 Ack=2206753 Win=1224192 Len=0 TSval=1023651734 TSecr=1378723863
520,18.475704,192.168.2.2,192.168.1.2,TCP,66,1227264,5001  >  45092 [ACK] Seq=1 Ack=2208201 Win=1227264 Len=0 TSval=1023651746 TSecr=1378723874
522,18.487819,192.168.2.2,192.168.1.2,TCP,66,1229824,5001  >  45092 [ACK] Seq=1 Ack=2209649 Win=1229824 Len=0 TSval=1023651759 TSecr=1378723885
524,18.499921,192.168.2.2,192.168.1.2,TCP,66,1232896,5001  >  45092 [ACK] Seq=1 Ack=2211097 Win=1232896 Len=0 TSval=1023651771 TSecr=1378723897
526,18.512106,192.168.2.2,192.168.1.2,TCP,66,1235968,5001  >  45092 [ACK] Seq=1 Ack=2212545 Win=1235968 Len=0 TSval=1023651783 TSecr=1378723909
528,18.524141,192.168.2.2,192.168.1.2,TCP,66,1238528,5001  >  45092 [ACK] Seq=1 Ack=2213993 Win=1238528 Len=0 TSval=1023651795 TSecr=1378723922
530,18.53625,192.168.2.2,192.168.1.2,TCP,66,1241600,5001  >  45092 [ACK] Seq=1 Ack=2215441 Win=1241600 Len=0 TSval=1023651807 TSecr=1378723934
532,18.548372,192.168.2.2,192.168.1.2,TCP,66,1244672,5001  >  45092 [ACK] Seq=1 Ack=2216889 Win=1244672 Len=0 TSval=1023651819 TSecr=1378723946
534,18.560943,192.168.2.2,192.168.1.2,TCP,66,1247232,5001  >  45092 [ACK] Seq=1 Ack=2218337 Win=1247232 Len=0 TSval=1023651832 TSecr=1378723958
536,18.572717,192.168.2.2,192.168.1.2,TCP,66,1250304,5001  >  45092 [ACK] Seq=1 Ack=2219785 Win=1250304 Len=0 TSval=1023651843 TSecr=1378723970
538,18.584674,192.168.2.2,192.168.1.2,TCP,66,1253376,5001  >  45092 [ACK] Seq=1 Ack=2221233 Win=1253376 Len=0 TSval=1023651855 TSecr=1378723982
539,18.597289,192.168.2.2,192.168.1.2,TCP,66,1255936,5001  >  45092 [ACK] Seq=1 Ack=2222681 Win=1255936 Len=0 TSval=1023651868 TSecr=1378723994
540,18.609071,192.168.2.2,192.168.1.2,TCP,66,1259008,5001  >  45092 [ACK] Seq=1 Ack=2224129 Win=1259008 Len=0 TSval=1023651880 TSecr=1378724006
541,18.621859,192.168.2.2,192.168.1.2,TCP,66,1262080,5001  >  45092 [ACK] Seq=1 Ack=2225577 Win=1262080 Len=0 TSval=1023651892 TSecr=1378724018
543,18.633152,192.168.2.2,192.168.1.2,TCP,66,1264640,5001  >  45092 [ACK] Seq=1 Ack=2227025 Win=1264640 Len=0 TSval=1023651904 TSecr=1378724031
545,18.645331,192.168.2.2,192.168.1.2,TCP,66,1267712,5001  >  45092 [ACK] Seq=1 Ack=2228473 Win=1267712 Len=0 TSval=1023651916 TSecr=1378724043
547,18.658006,192.168.2.2,192.168.1.2,TCP,66,1270784,5001  >  45092 [ACK] Seq=1 Ack=2229921 Win=1270784 Len=0 TSval=1023651929 TSecr=1378724055
549,18.669733,192.168.2.2,192.168.1.2,TCP,66,1273344,5001  >  45092 [ACK] Seq=1 Ack=2231369 Win=1273344 Len=0 TSval=1023651940 TSecr=1378724067
551,18.682539,192.168.2.2,192.168.1.2,TCP,66,1276416,5001  >  45092 [ACK] Seq=1 Ack=2232817 Win=1276416 Len=0 TSval=1023651953 TSecr=1378724079
553,18.693699,192.168.2.2,192.168.1.2,TCP,66,1282048,5001  >  45092 [ACK] Seq=1 Ack=2235713 Win=1282048 Len=0 TSval=1023651964 TSecr=1378724091
556,18.717925,192.168.2.2,192.168.1.2,TCP,66,1287680,5001  >  45092 [ACK] Seq=1 Ack=2238609 Win=1287680 Len=0 TSval=1023651989 TSecr=1378724110
559,18.742355,192.168.2.2,192.168.1.2,TCP,66,1293824,5001  >  45092 [ACK] Seq=1 Ack=2241505 Win=1293824 Len=0 TSval=1023652013 TSecr=1378724127
562,18.766768,192.168.2.2,192.168.1.2,TCP,66,1296384,5001  >  45092 [ACK] Seq=1 Ack=2242953 Win=1296384 Len=0 TSval=1023652037 TSecr=1378724165
564,18.778513,192.168.2.2,192.168.1.2,TCP,66,1299456,5001  >  45092 [ACK] Seq=1 Ack=2244401 Win=1299456 Len=0 TSval=1023652049 TSecr=1378724179
566,18.790609,192.168.2.2,192.168.1.2,TCP,66,1302528,5001  >  45092 [ACK] Seq=1 Ack=2245849 Win=1302528 Len=0 TSval=1023652061 TSecr=1378724195
568,18.802724,192.168.2.2,192.168.1.2,TCP,66,1305088,5001  >  45092 [ACK] Seq=1 Ack=2247297 Win=1305088 Len=0 TSval=1023652073 TSecr=1378724206
570,18.814832,192.168.2.2,192.168.1.2,TCP,66,1308160,5001  >  45092 [ACK] Seq=1 Ack=2248745 Win=1308160 Len=0 TSval=1023652085 TSecr=1378724217
572,18.826949,192.168.2.2,192.168.1.2,TCP,66,1311232,5001  >  45092 [ACK] Seq=1 Ack=2250193 Win=1311232 Len=0 TSval=1023652097 TSecr=1378724229
574,18.839041,192.168.2.2,192.168.1.2,TCP,66,1313792,5001  >  45092 [ACK] Seq=1 Ack=2251641 Win=1313792 Len=0 TSval=1023652110 TSecr=1378724241
576,18.852025,192.168.2.2,192.168.1.2,TCP,66,1316864,5001  >  45092 [ACK] Seq=1 Ack=2253089 Win=1316864 Len=0 TSval=1023652123 TSecr=1378724252
578,18.863865,192.168.2.2,192.168.1.2,TCP,66,1319936,5001  >  45092 [ACK] Seq=1 Ack=2254537 Win=1319936 Len=0 TSval=1023652134 TSecr=1378724264
580,18.875394,192.168.2.2,192.168.1.2,TCP,66,1322496,5001  >  45092 [ACK] Seq=1 Ack=2255985 Win=1322496 Len=0 TSval=1023652146 TSecr=1378724275
582,18.88751,192.168.2.2,192.168.1.2,TCP,66,1325568,5001  >  45092 [ACK] Seq=1 Ack=2257433 Win=1325568 Len=0 TSval=1023652158 TSecr=1378724287
584,18.899616,192.168.2.2,192.168.1.2,TCP,66,1328640,5001  >  45092 [ACK] Seq=1 Ack=2258881 Win=1328640 Len=0 TSval=1023652170 TSecr=1378724299
586,18.911733,192.168.2.2,192.168.1.2,TCP,66,1331200,5001  >  45092 [ACK] Seq=1 Ack=2260329 Win=1331200 Len=0 TSval=1023652182 TSecr=1378724310
588,18.923838,192.168.2.2,192.168.1.2,TCP,66,1334272,5001  >  45092 [ACK] Seq=1 Ack=2261777 Win=1334272 Len=0 TSval=1023652194 TSecr=1378724321
590,18.935994,192.168.2.2,192.168.1.2,TCP,66,1337344,5001  >  45092 [ACK] Seq=1 Ack=2263225 Win=1337344 Len=0 TSval=1023652206 TSecr=1378724333
592,18.948597,192.168.2.2,192.168.1.2,TCP,66,1339904,5001  >  45092 [ACK] Seq=1 Ack=2264673 Win=1339904 Len=0 TSval=1023652219 TSecr=1378724345
594,18.960339,192.168.2.2,192.168.1.2,TCP,66,1342976,5001  >  45092 [ACK] Seq=1 Ack=2266121 Win=1342976 Len=0 TSval=1023652231 TSecr=1378724357
596,18.973091,192.168.2.2,192.168.1.2,TCP,66,1346048,5001  >  45092 [ACK] Seq=1 Ack=2267569 Win=1346048 Len=0 TSval=1023652244 TSecr=1378724370
597,18.984398,192.168.2.2,192.168.1.2,TCP,66,1348608,5001  >  45092 [ACK] Seq=1 Ack=2269017 Win=1348608 Len=0 TSval=1023652255 TSecr=1378724382
598,18.996678,192.168.2.2,192.168.1.2,TCP,66,1351680,5001  >  45092 [ACK] Seq=1 Ack=2270465 Win=1351680 Len=0 TSval=1023652267 TSecr=1378724395
599,19.008625,192.168.2.2,192.168.1.2,TCP,66,1354752,5001  >  45092 [ACK] Seq=1 Ack=2271913 Win=1354752 Len=0 TSval=1023652279 TSecr=1378724406
601,19.021152,192.168.2.2,192.168.1.2,TCP,66,1357312,5001  >  45092 [ACK] Seq=1 Ack=2273361 Win=1357312 Len=0 TSval=1023652292 TSecr=1378724418
603,19.032917,192.168.2.2,192.168.1.2,TCP,66,1360384,5001  >  45092 [ACK] Seq=1 Ack=2274809 Win=1360384 Len=0 TSval=1023652303 TSecr=1378724430
605,19.045596,192.168.2.2,192.168.1.2,TCP,66,1363456,5001  >  45092 [ACK] Seq=1 Ack=2276257 Win=1363456 Len=0 TSval=1023652316 TSecr=1378724442
607,19.057058,192.168.2.2,192.168.1.2,TCP,66,1366016,5001  >  45092 [ACK] Seq=1 Ack=2277705 Win=1366016 Len=0 TSval=1023652327 TSecr=1378724454
609,19.069187,192.168.2.2,192.168.1.2,TCP,66,1369088,5001  >  45092 [ACK] Seq=1 Ack=2279153 Win=1369088 Len=0 TSval=1023652340 TSecr=1378724466
611,19.08127,192.168.2.2,192.168.1.2,TCP,66,1374720,5001  >  45092 [ACK] Seq=1 Ack=2282049 Win=1374720 Len=0 TSval=1023652352 TSecr=1378724479
615,19.105508,192.168.2.2,192.168.1.2,TCP,66,1380352,5001  >  45092 [ACK] Seq=1 Ack=2284945 Win=1380352 Len=0 TSval=1023652376 TSecr=1378724496
618,19.129976,192.168.2.2,192.168.1.2,TCP,66,1386496,5001  >  45092 [ACK] Seq=1 Ack=2287841 Win=1386496 Len=0 TSval=1023652400 TSecr=1378724514
621,19.153978,192.168.2.2,192.168.1.2,TCP,66,1389056,5001  >  45092 [ACK] Seq=1 Ack=2289289 Win=1389056 Len=0 TSval=1023652424 TSecr=1378724551
623,19.166139,192.168.2.2,192.168.1.2,TCP,66,1392128,5001  >  45092 [ACK] Seq=1 Ack=2290737 Win=1392128 Len=0 TSval=1023652437 TSecr=1378724567
625,19.178204,192.168.2.2,192.168.1.2,TCP,66,1395200,5001  >  45092 [ACK] Seq=1 Ack=2292185 Win=1395200 Len=0 TSval=1023652449 TSecr=1378724581
627,19.190304,192.168.2.2,192.168.1.2,TCP,66,1397760,5001  >  45092 [ACK] Seq=1 Ack=2293633 Win=1397760 Len=0 TSval=1023652461 TSecr=1378724592
629,19.202418,192.168.2.2,192.168.1.2,TCP,66,1400832,5001  >  45092 [ACK] Seq=1 Ack=2295081 Win=1400832 Len=0 TSval=1023652473 TSecr=1378724604
631,19.214509,192.168.2.2,192.168.1.2,TCP,66,1403904,5001  >  45092 [ACK] Seq=1 Ack=2296529 Win=1403904 Len=0 TSval=1023652485 TSecr=1378724615
633,19.22662,192.168.2.2,192.168.1.2,TCP,66,1406464,5001  >  45092 [ACK] Seq=1 Ack=2297977 Win=1406464 Len=0 TSval=1023652497 TSecr=1378724627
