"No.","Time","Source","Destination","Protocol","Length","Calculated window size","Info"
"4","0.000451","192.168.2.2","192.168.1.2","TCP","74","28960","5001  >  48002 [SYN, ACK] Seq=0 Ack=1 Win=28960 Len=0 MSS=1460 SACK_PERM=1 TSval=551839693 TSecr=457061408 WS=512"
"7","0.000509","192.168.2.2","192.168.1.2","TCP","66","43520","5001  >  48002 [ACK] Seq=1 Ack=7241 Win=43520 Len=0 TSval=551839693 TSecr=457061408"
"12","0.050655","192.168.2.2","192.168.1.2","TCP","66","64000","5001  >  48002 [ACK] Seq=1 Ack=17377 Win=64000 Len=0 TSval=551839743 TSecr=457061408"
"15","0.134969","192.168.2.2","192.168.1.2","TCP","66","84480","5001  >  48002 [ACK] Seq=1 Ack=27513 Win=84480 Len=0 TSval=551839827 TSecr=457061409"
"19","0.219308","192.168.2.2","192.168.1.2","TCP","66","87040","5001  >  48002 [ACK] Seq=1 Ack=28961 Win=87040 Len=0 TSval=551839912 TSecr=457061410"
"21","0.232023","192.168.2.2","192.168.1.2","TCP","66","90112","5001  >  48002 [ACK] Seq=1 Ack=30409 Win=90112 Len=0 TSval=551839924 TSecr=457061424"
"23","0.243810","192.168.2.2","192.168.1.2","TCP","66","121856","5001  >  48002 [ACK] Seq=1 Ack=46337 Win=121856 Len=0 TSval=551839936 TSecr=457061458"
"28","0.376819","192.168.2.2","192.168.1.2","TCP","66","127488","5001  >  48002 [ACK] Seq=1 Ack=49233 Win=127488 Len=0 TSval=551840069 TSecr=457061484"
"30","0.401041","192.168.2.2","192.168.1.2","TCP","66","130560","5001  >  48002 [ACK] Seq=1 Ack=50681 Win=130560 Len=0 TSval=551840093 TSecr=457061542"
"32","0.413097","192.168.2.2","192.168.1.2","TCP","66","168448","5001  >  48002 [ACK] Seq=1 Ack=69505 Win=168448 Len=0 TSval=551840105 TSecr=457061542"
"35","0.571189","192.168.2.2","192.168.1.2","TCP","66","171008","5001  >  48002 [ACK] Seq=1 Ack=70953 Win=171008 Len=0 TSval=551840263 TSecr=457061599"
"37","0.582959","192.168.2.2","192.168.1.2","TCP","66","174080","5001  >  48002 [ACK] Seq=1 Ack=72401 Win=174080 Len=0 TSval=551840275 TSecr=457061627"
"39","0.594804","192.168.2.2","192.168.1.2","TCP","66","179712","5001  >  48002 [ACK] Seq=1 Ack=75297 Win=179712 Len=0 TSval=551840287 TSecr=457061639"
"41","0.619129","192.168.2.2","192.168.1.2","TCP","66","177152","5001  >  48002 [ACK] Seq=1 Ack=94121 Win=177152 Len=0 TSval=551840311 TSecr=457061651"
"44","0.777145","192.168.2.2","192.168.1.2","TCP","66","177152","5001  >  48002 [ACK] Seq=1 Ack=112945 Win=177152 Len=0 TSval=551840469 TSecr=457061784"
"46","0.934763","192.168.2.2","192.168.1.2","TCP","66","185344","5001  >  48002 [ACK] Seq=1 Ack=115841 Win=185344 Len=0 TSval=551840627 TSecr=457061808"
"48","0.958854","192.168.2.2","192.168.1.2","TCP","66","215040","5001  >  48002 [ACK] Seq=1 Ack=147697 Win=215040 Len=0 TSval=551840651 TSecr=457061820"
"52","1.225325","192.168.2.2","192.168.1.2","TCP","66","226304","5001  >  48002 [ACK] Seq=1 Ack=156385 Win=226304 Len=0 TSval=551840917 TSecr=457061978"
"54","1.298310","192.168.2.2","192.168.1.2","TCP","66","226304","5001  >  48002 [ACK] Seq=1 Ack=159281 Win=226304 Len=0 TSval=551840990 TSecr=457061990"
"56","1.322231","192.168.2.2","192.168.1.2","TCP","66","226304","5001  >  48002 [ACK] Seq=1 Ack=165073 Win=226304 Len=0 TSval=551841014 TSecr=457062002"
"58","1.371004","192.168.2.2","192.168.1.2","TCP","66","223744","5001  >  48002 [ACK] Seq=1 Ack=179553 Win=223744 Len=0 TSval=551841063 TSecr=457062026"
"62","1.492054","192.168.2.2","192.168.1.2","TCP","66","215040","5001  >  48002 [ACK] Seq=1 Ack=211409 Win=215040 Len=0 TSval=551841184 TSecr=457062184"
"66","1.758933","192.168.2.2","192.168.1.2","TCP","66","289792","5001  >  48002 [ACK] Seq=1 Ack=243265 Win=289792 Len=0 TSval=551841450 TSecr=457062342"
"70","2.024815","192.168.2.2","192.168.1.2","TCP","66","353792","5001  >  48002 [ACK] Seq=1 Ack=275121 Win=353792 Len=0 TSval=551841716 TSecr=457062366"
"76","2.292163","192.168.2.2","192.168.1.2","TCP","66","421376","5001  >  48002 [ACK] Seq=1 Ack=309873 Win=421376 Len=0 TSval=551841983 TSecr=457062543"
"78","2.583160","192.168.2.2","192.168.1.2","TCP","66","429056","5001  >  48002 [ACK] Seq=1 Ack=327249 Win=429056 Len=0 TSval=551842274 TSecr=457062632"
"80","2.729240","192.168.2.2","192.168.1.2","TCP","66","429056","5001  >  48002 [ACK] Seq=1 Ack=333041 Win=429056 Len=0 TSval=551842420 TSecr=457062705"
"82","2.778247","192.168.2.2","192.168.1.2","TCP","66","429056","5001  >  48002 [ACK] Seq=1 Ack=335937 Win=429056 Len=0 TSval=551842469 TSecr=457062729"
"84","2.802752","192.168.2.2","192.168.1.2","TCP","66","419840","5001  >  48002 [ACK] Seq=1 Ack=373585 Win=419840 Len=0 TSval=551842494 TSecr=457062778"
"87","3.117254","192.168.2.2","192.168.1.2","TCP","66","427520","5001  >  48002 [ACK] Seq=1 Ack=396753 Win=427520 Len=0 TSval=551842808 TSecr=457062899"
"90","3.311284","192.168.2.2","192.168.1.2","TCP","66","427520","5001  >  48002 [ACK] Seq=1 Ack=419921 Win=427520 Len=0 TSval=551843002 TSecr=457062899"
"92","3.505462","192.168.2.2","192.168.1.2","TCP","66","422912","5001  >  48002 [ACK] Seq=1 Ack=451777 Win=422912 Len=0 TSval=551843196 TSecr=457063165"
"95","3.770948","192.168.2.2","192.168.1.2","TCP","66","429056","5001  >  48002 [ACK] Seq=1 Ack=457569 Win=429056 Len=0 TSval=551843461 TSecr=457063431"
"98","3.820890","192.168.2.2","192.168.1.2","TCP","66","480768","5001  >  48002 [ACK] Seq=1 Ack=483633 Win=480768 Len=0 TSval=551843511 TSecr=457063567"
"101","4.039507","192.168.2.2","192.168.1.2","TCP","66","550400","5001  >  48002 [ACK] Seq=1 Ack=518385 Win=550400 Len=0 TSval=551843730 TSecr=457063698"
"104","4.329595","192.168.2.2","192.168.1.2","TCP","66","585216","5001  >  48002 [ACK] Seq=1 Ack=535761 Win=585216 Len=0 TSval=551844020 TSecr=457063989"
"106","4.475624","192.168.2.2","192.168.1.2","TCP","66","596992","5001  >  48002 [ACK] Seq=1 Ack=541553 Win=596992 Len=0 TSval=551844166 TSecr=457064135"
"108","4.523725","192.168.2.2","192.168.1.2","TCP","66","602624","5001  >  48002 [ACK] Seq=1 Ack=544449 Win=602624 Len=0 TSval=551844214 TSecr=457064184"
"110","4.547632","192.168.2.2","192.168.1.2","TCP","66","633856","5001  >  48002 [ACK] Seq=1 Ack=582097 Win=633856 Len=0 TSval=551844238 TSecr=457064209"
"114","4.863224","192.168.2.2","192.168.1.2","TCP","66","637440","5001  >  48002 [ACK] Seq=1 Ack=583545 Win=637440 Len=0 TSval=551844553 TSecr=457064523"
"116","4.875460","192.168.2.2","192.168.1.2","TCP","66","637440","5001  >  48002 [ACK] Seq=1 Ack=605265 Win=637440 Len=0 TSval=551844565 TSecr=457064591"
"121","5.057050","192.168.2.2","192.168.1.2","TCP","66","637440","5001  >  48002 [ACK] Seq=1 Ack=628433 Win=637440 Len=0 TSval=551844747 TSecr=457064717"
"123","5.250871","192.168.2.2","192.168.1.2","TCP","66","637440","5001  >  48002 [ACK] Seq=1 Ack=648705 Win=637440 Len=0 TSval=551844941 TSecr=457064911"
"125","5.421373","192.168.2.2","192.168.1.2","TCP","66","637440","5001  >  48002 [ACK] Seq=1 Ack=660289 Win=637440 Len=0 TSval=551845111 TSecr=457065102"
"127","5.517406","192.168.2.2","192.168.1.2","TCP","66","637440","5001  >  48002 [ACK] Seq=1 Ack=666081 Win=637440 Len=0 TSval=551845207 TSecr=457065176"
"129","5.565758","192.168.2.2","192.168.1.2","TCP","66","660480","5001  >  48002 [ACK] Seq=1 Ack=692145 Win=660480 Len=0 TSval=551845255 TSecr=457065226"
"133","5.784710","192.168.2.2","192.168.1.2","TCP","66","660480","5001  >  48002 [ACK] Seq=1 Ack=713865 Win=660480 Len=0 TSval=551845474 TSecr=457065445"
"135","5.966349","192.168.2.2","192.168.1.2","TCP","66","660480","5001  >  48002 [ACK] Seq=1 Ack=726897 Win=660480 Len=0 TSval=551845656 TSecr=457065613"
"138","6.076091","192.168.2.2","192.168.1.2","TCP","66","660480","5001  >  48002 [ACK] Seq=1 Ack=744273 Win=660480 Len=0 TSval=551845765 TSecr=457065735"
"140","6.220581","192.168.2.2","192.168.1.2","TCP","66","660480","5001  >  48002 [ACK] Seq=1 Ack=750065 Win=660480 Len=0 TSval=551845910 TSecr=457065881"
"142","6.269181","192.168.2.2","192.168.1.2","TCP","66","660480","5001  >  48002 [ACK] Seq=1 Ack=752961 Win=660480 Len=0 TSval=551845958 TSecr=457065929"
"145","6.293248","192.168.2.2","192.168.1.2","TCP","66","660480","5001  >  48002 [ACK] Seq=1 Ack=779025 Win=660480 Len=0 TSval=551845982 TSecr=457065953"
"147","6.512264","192.168.2.2","192.168.1.2","TCP","66","660480","5001  >  48002 [ACK] Seq=1 Ack=790609 Win=660480 Len=0 TSval=551846201 TSecr=457066126"
"149","6.608233","192.168.2.2","192.168.1.2","TCP","66","660480","5001  >  48002 [ACK] Seq=1 Ack=792057 Win=660480 Len=0 TSval=551846297 TSecr=457066268"
"151","6.620979","192.168.2.2","192.168.1.2","TCP","66","660480","5001  >  48002 [ACK] Seq=1 Ack=813777 Win=660480 Len=0 TSval=551846310 TSecr=457066280"
"154","6.803086","192.168.2.2","192.168.1.2","TCP","66","660480","5001  >  48002 [ACK] Seq=1 Ack=836945 Win=660480 Len=0 TSval=551846492 TSecr=457066462"
"156","6.997280","192.168.2.2","192.168.1.2","TCP","66","660480","5001  >  48002 [ACK] Seq=1 Ack=844185 Win=660480 Len=0 TSval=551846686 TSecr=457066656"
"159","7.057989","192.168.2.2","192.168.1.2","TCP","66","660480","5001  >  48002 [ACK] Seq=1 Ack=868801 Win=660480 Len=0 TSval=551846747 TSecr=457066826"
"161","7.263887","192.168.2.2","192.168.1.2","TCP","66","660480","5001  >  48002 [ACK] Seq=1 Ack=874593 Win=660480 Len=0 TSval=551846953 TSecr=457066922"
"163","7.312851","192.168.2.2","192.168.1.2","TCP","66","660480","5001  >  48002 [ACK] Seq=1 Ack=900657 Win=660480 Len=0 TSval=551847002 TSecr=457066970"
"165","7.530611","192.168.2.2","192.168.1.2","TCP","66","660480","5001  >  48002 [ACK] Seq=1 Ack=909345 Win=660480 Len=0 TSval=551847219 TSecr=457067189"
"167","7.603182","192.168.2.2","192.168.1.2","TCP","66","660480","5001  >  48002 [ACK] Seq=1 Ack=935409 Win=660480 Len=0 TSval=551847292 TSecr=457067371"
"170","7.822149","192.168.2.2","192.168.1.2","TCP","66","660480","5001  >  48002 [ACK] Seq=1 Ack=952785 Win=660480 Len=0 TSval=551847511 TSecr=457067480"
"172","7.967524","192.168.2.2","192.168.1.2","TCP","66","660480","5001  >  48002 [ACK] Seq=1 Ack=958577 Win=660480 Len=0 TSval=551847656 TSecr=457067625"
"174","8.016562","192.168.2.2","192.168.1.2","TCP","66","660480","5001  >  48002 [ACK] Seq=1 Ack=961473 Win=660480 Len=0 TSval=551847705 TSecr=457067673"
"176","8.041060","192.168.2.2","192.168.1.2","TCP","66","660480","5001  >  48002 [ACK] Seq=1 Ack=974505 Win=660480 Len=0 TSval=551847729 TSecr=457067698"
"179","8.149883","192.168.2.2","192.168.1.2","TCP","66","660480","5001  >  48002 [ACK] Seq=1 Ack=999121 Win=660480 Len=0 TSval=551847838 TSecr=457067916"
"181","8.355270","192.168.2.2","192.168.1.2","TCP","66","660480","5001  >  48002 [ACK] Seq=1 Ack=1000569 Win=660480 Len=0 TSval=551848043 TSecr=457068012"
"183","8.367426","192.168.2.2","192.168.1.2","TCP","66","660480","5001  >  48002 [ACK] Seq=1 Ack=1022289 Win=660480 Len=0 TSval=551848056 TSecr=457068025"
"185","8.548925","192.168.2.2","192.168.1.2","TCP","66","660480","5001  >  48002 [ACK] Seq=1 Ack=1039665 Win=660480 Len=0 TSval=551848237 TSecr=457068207"
"187","8.694694","192.168.2.2","192.168.1.2","TCP","66","660480","5001  >  48002 [ACK] Seq=1 Ack=1052697 Win=660480 Len=0 TSval=551848383 TSecr=457068401"
"190","8.804112","192.168.2.2","192.168.1.2","TCP","66","660480","5001  >  48002 [ACK] Seq=1 Ack=1077313 Win=660480 Len=0 TSval=551848492 TSecr=457068462"
"192","9.010282","192.168.2.2","192.168.1.2","TCP","66","660480","5001  >  48002 [ACK] Seq=1 Ack=1083105 Win=660480 Len=0 TSval=551848698 TSecr=457068668"
"195","9.058383","192.168.2.2","192.168.1.2","TCP","66","660480","5001  >  48002 [ACK] Seq=1 Ack=1104825 Win=660480 Len=0 TSval=551848746 TSecr=457068717"
"197","9.240064","192.168.2.2","192.168.1.2","TCP","66","660480","5001  >  48002 [ACK] Seq=1 Ack=1117857 Win=660480 Len=0 TSval=551848928 TSecr=457068934"
"199","9.349385","192.168.2.2","192.168.1.2","TCP","66","660480","5001  >  48002 [ACK] Seq=1 Ack=1143921 Win=660480 Len=0 TSval=551849037 TSecr=457069007"
"201","9.567173","192.168.2.2","192.168.1.2","TCP","66","660480","5001  >  48002 [ACK] Seq=1 Ack=1161297 Win=660480 Len=0 TSval=551849255 TSecr=457069226"
"203","9.712429","192.168.2.2","192.168.1.2","TCP","66","660480","5001  >  48002 [ACK] Seq=1 Ack=1167089 Win=660480 Len=0 TSval=551849400 TSecr=457069371"
"205","9.761012","192.168.2.2","192.168.1.2","TCP","66","660480","5001  >  48002 [ACK] Seq=1 Ack=1169985 Win=660480 Len=0 TSval=551849448 TSecr=457069420"
"207","9.785523","192.168.2.2","192.168.1.2","TCP","66","660480","5001  >  48002 [ACK] Seq=1 Ack=1183017 Win=660480 Len=0 TSval=551849473 TSecr=457069444"
"210","9.894882","192.168.2.2","192.168.1.2","TCP","66","660480","5001  >  48002 [ACK] Seq=1 Ack=1207633 Win=660480 Len=0 TSval=551849582 TSecr=457069553"
"213","10.101051","192.168.2.2","192.168.1.2","TCP","66","660480","5001  >  48002 [ACK] Seq=1 Ack=1209081 Win=660480 Len=0 TSval=551849788 TSecr=457069758"
"214","10.113858","192.168.2.2","192.168.1.2","TCP","66","660480","5001  >  48002 [ACK] Seq=1 Ack=1230801 Win=660480 Len=0 TSval=551849801 TSecr=457069771"
"215","10.294796","192.168.2.2","192.168.1.2","TCP","66","660480","5001  >  48002 [ACK] Seq=1 Ack=1235145 Win=660480 Len=0 TSval=551849982 TSecr=457069952"
"216","10.331375","192.168.2.2","192.168.1.2","TCP","66","660480","5001  >  48002 [ACK] Seq=1 Ack=1261209 Win=660480 Len=0 TSval=551850019 TSecr=457070098"
"217","10.548923","192.168.2.2","192.168.1.2","TCP","66","660480","5001  >  48002 [ACK] Seq=1 Ack=1285825 Win=660480 Len=0 TSval=551850236 TSecr=457070207"
"218","10.755357","192.168.2.2","192.168.1.2","TCP","66","660480","5001  >  48002 [ACK] Seq=1 Ack=1291617 Win=660480 Len=0 TSval=551850442 TSecr=457070413"
"220","10.804070","192.168.2.2","192.168.1.2","TCP","66","660480","5001  >  48002 [ACK] Seq=1 Ack=1300305 Win=660480 Len=0 TSval=551850491 TSecr=457070461"
"221","10.876988","192.168.2.2","192.168.1.2","TCP","66","660480","5001  >  48002 [ACK] Seq=1 Ack=1326369 Win=660480 Len=0 TSval=551850564 TSecr=457070643"
"223","11.095319","192.168.2.2","192.168.1.2","TCP","66","660480","5001  >  48002 [ACK] Seq=1 Ack=1352433 Win=660480 Len=0 TSval=551850782 TSecr=457070752"
"224","11.312780","192.168.2.2","192.168.1.2","TCP","66","660480","5001  >  48002 [ACK] Seq=1 Ack=1365465 Win=660480 Len=0 TSval=551850999 TSecr=457070970"
"225","11.422214","192.168.2.2","192.168.1.2","TCP","66","660480","5001  >  48002 [ACK] Seq=1 Ack=1375601 Win=660480 Len=0 TSval=551851109 TSecr=457071115"
"226","11.507506","192.168.2.2","192.168.1.2","TCP","66","660480","5001  >  48002 [ACK] Seq=1 Ack=1378497 Win=660480 Len=0 TSval=551851194 TSecr=457071164"
"227","11.530800","192.168.2.2","192.168.1.2","TCP","66","660480","5001  >  48002 [ACK] Seq=1 Ack=1391529 Win=660480 Len=0 TSval=551851217 TSecr=457071188"
"228","11.639842","192.168.2.2","192.168.1.2","TCP","66","660480","5001  >  48002 [ACK] Seq=1 Ack=1416145 Win=660480 Len=0 TSval=551851326 TSecr=457071297"
"233","11.847260","192.168.2.2","192.168.1.2","TCP","66","660480","5001  >  48002 [ACK] Seq=1 Ack=1419041 Win=660480 Len=0 TSval=551851534 TSecr=457073041"
"239","11.872556","192.168.2.2","192.168.1.2","TCP","66","660480","5001  >  48002 [ACK] Seq=1 Ack=1421937 Win=660480 Len=0 TSval=551851559 TSecr=457073042"
"241","11.896086","192.168.2.2","192.168.1.2","TCP","66","660480","5001  >  48002 [ACK] Seq=1 Ack=1430625 Win=660480 Len=0 TSval=551851582 TSecr=457073249"
"243","11.968738","192.168.2.2","192.168.1.2","TCP","66","643584","5001  >  48002 [ACK] Seq=1 Ack=1495785 Win=643584 Len=0 TSval=551851655 TSecr=457073249"
"248","12.514036","192.168.2.2","192.168.1.2","TCP","66","643584","5001  >  48002 [ACK] Seq=1 Ack=1560945 Win=643584 Len=0 TSval=551852200 TSecr=457073249"
"252","13.058460","192.168.2.2","192.168.1.2","TCP","66","643584","5001  >  48002 [ACK] Seq=1 Ack=1626105 Win=643584 Len=0 TSval=551852744 TSecr=457073249"
"257","13.603545","192.168.2.2","192.168.1.2","TCP","66","660480","5001  >  48002 [ACK] Seq=1 Ack=1630449 Win=660480 Len=0 TSval=551853289 TSecr=457073250"
"259","13.640193","192.168.2.2","192.168.1.2","TCP","66","660480","5001  >  48002 [ACK] Seq=1 Ack=1636241 Win=660480 Len=0 TSval=551853326 TSecr=457073274"
"261","13.688295","192.168.2.2","192.168.1.2","TCP","66","660480","5001  >  48002 [ACK] Seq=1 Ack=1653617 Win=660480 Len=0 TSval=551853374 TSecr=457073298"
"262","13.834198","192.168.2.2","192.168.1.2","TCP","66","657408","5001  >  48002 [ACK] Seq=1 Ack=1691265 Win=657408 Len=0 TSval=551853520 TSecr=457073370"
"264","14.149350","192.168.2.2","192.168.1.2","TCP","66","643584","5001  >  48002 [ACK] Seq=1 Ack=1756425 Win=643584 Len=0 TSval=551853835 TSecr=457073371"
"266","14.693800","192.168.2.2","192.168.1.2","TCP","66","660480","5001  >  48002 [ACK] Seq=1 Ack=1783937 Win=660480 Len=0 TSval=551854379 TSecr=457073371"
"268","14.924492","192.168.2.2","192.168.1.2","TCP","66","657408","5001  >  48002 [ACK] Seq=1 Ack=1821585 Win=657408 Len=0 TSval=551854609 TSecr=457073915"
"270","15.239669","192.168.2.2","192.168.1.2","TCP","66","643584","5001  >  48002 [ACK] Seq=1 Ack=1886745 Win=643584 Len=0 TSval=551854924 TSecr=457073915"
"272","15.785035","192.168.2.2","192.168.1.2","TCP","66","660480","5001  >  48002 [ACK] Seq=1 Ack=1914257 Win=660480 Len=0 TSval=551855469 TSecr=457074313"
"273","16.015010","192.168.2.2","192.168.1.2","TCP","66","657408","5001  >  48002 [ACK] Seq=1 Ack=1951905 Win=657408 Len=0 TSval=551855699 TSecr=457074459"
"275","16.329506","192.168.2.2","192.168.1.2","TCP","66","643584","5001  >  48002 [ACK] Seq=1 Ack=2017065 Win=643584 Len=0 TSval=551856014 TSecr=457074459"
"277","16.875885","192.168.2.2","192.168.1.2","TCP","66","660480","5001  >  48002 [ACK] Seq=1 Ack=2044577 Win=660480 Len=0 TSval=551856560 TSecr=457074826"
"280","17.106060","192.168.2.2","192.168.1.2","TCP","66","660480","5001  >  48002 [ACK] Seq=1 Ack=2053265 Win=660480 Len=0 TSval=551856790 TSecr=457075004"
"284","17.178674","192.168.2.2","192.168.1.2","TCP","66","660480","5001  >  48002 [ACK] Seq=1 Ack=2064849 Win=660480 Len=0 TSval=551856862 TSecr=457075041"
"294","17.277913","192.168.2.2","192.168.1.2","TCP","66","660480","5001  >  48002 [ACK] Seq=1 Ack=2067745 Win=660480 Len=0 TSval=551856962 TSecr=457078275"
"295","17.302154","192.168.2.2","192.168.1.2","TCP","66","666112","5001  >  48002 [ACK] Seq=1 Ack=2070641 Win=666112 Len=0 TSval=551856986 TSecr=457078289"
"296","17.326379","192.168.2.2","192.168.1.2","TCP","66","669184","5001  >  48002 [ACK] Seq=1 Ack=2072089 Win=669184 Len=0 TSval=551857010 TSecr=457078505"
"298","17.339250","192.168.2.2","192.168.1.2","TCP","66","672256","5001  >  48002 [ACK] Seq=1 Ack=2073537 Win=672256 Len=0 TSval=551857023 TSecr=457078517"
"299","17.351736","192.168.2.2","192.168.1.2","TCP","66","677888","5001  >  48002 [ACK] Seq=1 Ack=2076433 Win=677888 Len=0 TSval=551857035 TSecr=457078577"
"302","17.375633","192.168.2.2","192.168.1.2","TCP","66","683520","5001  >  48002 [ACK] Seq=1 Ack=2079329 Win=683520 Len=0 TSval=551857059 TSecr=457078596"
"305","17.399860","192.168.2.2","192.168.1.2","TCP","66","689664","5001  >  48002 [ACK] Seq=1 Ack=2082225 Win=689664 Len=0 TSval=551857084 TSecr=457078614"
"308","17.424047","192.168.2.2","192.168.1.2","TCP","66","695296","5001  >  48002 [ACK] Seq=1 Ack=2085121 Win=695296 Len=0 TSval=551857108 TSecr=457078632"
"311","17.448279","192.168.2.2","192.168.1.2","TCP","66","700928","5001  >  48002 [ACK] Seq=1 Ack=2088017 Win=700928 Len=0 TSval=551857132 TSecr=457078650"
"314","17.472532","192.168.2.2","192.168.1.2","TCP","66","707072","5001  >  48002 [ACK] Seq=1 Ack=2090913 Win=707072 Len=0 TSval=551857156 TSecr=457078669"
"317","17.497715","192.168.2.2","192.168.1.2","TCP","66","709632","5001  >  48002 [ACK] Seq=1 Ack=2092361 Win=709632 Len=0 TSval=551857181 TSecr=457078750"
"319","17.509496","192.168.2.2","192.168.1.2","TCP","66","712704","5001  >  48002 [ACK] Seq=1 Ack=2093809 Win=712704 Len=0 TSval=551857193 TSecr=457078762"
"321","17.520963","192.168.2.2","192.168.1.2","TCP","66","715776","5001  >  48002 [ACK] Seq=1 Ack=2095257 Win=715776 Len=0 TSval=551857205 TSecr=457078774"
"323","17.533087","192.168.2.2","192.168.1.2","TCP","66","718336","5001  >  48002 [ACK] Seq=1 Ack=2096705 Win=718336 Len=0 TSval=551857217 TSecr=457078787"
"325","17.545168","192.168.2.2","192.168.1.2","TCP","66","721408","5001  >  48002 [ACK] Seq=1 Ack=2098153 Win=721408 Len=0 TSval=551857229 TSecr=457078799"
"327","17.557579","192.168.2.2","192.168.1.2","TCP","66","724480","5001  >  48002 [ACK] Seq=1 Ack=2099601 Win=724480 Len=0 TSval=551857241 TSecr=457078810"
"329","17.569411","192.168.2.2","192.168.1.2","TCP","66","727040","5001  >  48002 [ACK] Seq=1 Ack=2101049 Win=727040 Len=0 TSval=551857253 TSecr=457078823"
"331","17.581505","192.168.2.2","192.168.1.2","TCP","66","730112","5001  >  48002 [ACK] Seq=1 Ack=2102497 Win=730112 Len=0 TSval=551857265 TSecr=457078835"
"333","17.593814","192.168.2.2","192.168.1.2","TCP","66","733184","5001  >  48002 [ACK] Seq=1 Ack=2103945 Win=733184 Len=0 TSval=551857277 TSecr=457078847"
"335","17.605939","192.168.2.2","192.168.1.2","TCP","66","735744","5001  >  48002 [ACK] Seq=1 Ack=2105393 Win=735744 Len=0 TSval=551857289 TSecr=457078858"
"337","17.618317","192.168.2.2","192.168.1.2","TCP","66","738816","5001  >  48002 [ACK] Seq=1 Ack=2106841 Win=738816 Len=0 TSval=551857302 TSecr=457078871"
"338","17.630361","192.168.2.2","192.168.1.2","TCP","66","741376","5001  >  48002 [ACK] Seq=1 Ack=2108289 Win=741376 Len=0 TSval=551857314 TSecr=457078883"
"340","17.642055","192.168.2.2","192.168.1.2","TCP","66","744448","5001  >  48002 [ACK] Seq=1 Ack=2109737 Win=744448 Len=0 TSval=551857326 TSecr=457078896"
"342","17.654489","192.168.2.2","192.168.1.2","TCP","66","747520","5001  >  48002 [ACK] Seq=1 Ack=2111185 Win=747520 Len=0 TSval=551857338 TSecr=457078908"
"343","17.666427","192.168.2.2","192.168.1.2","TCP","66","750080","5001  >  48002 [ACK] Seq=1 Ack=2112633 Win=750080 Len=0 TSval=551857350 TSecr=457078920"
"344","17.678548","192.168.2.2","192.168.1.2","TCP","66","753152","5001  >  48002 [ACK] Seq=1 Ack=2114081 Win=753152 Len=0 TSval=551857362 TSecr=457078932"
"345","17.690532","192.168.2.2","192.168.1.2","TCP","66","756224","5001  >  48002 [ACK] Seq=1 Ack=2115529 Win=756224 Len=0 TSval=551857374 TSecr=457078944"
"347","17.703181","192.168.2.2","192.168.1.2","TCP","66","758784","5001  >  48002 [ACK] Seq=1 Ack=2116977 Win=758784 Len=0 TSval=551857387 TSecr=457078956"
"349","17.715790","192.168.2.2","192.168.1.2","TCP","66","761856","5001  >  48002 [ACK] Seq=1 Ack=2118425 Win=761856 Len=0 TSval=551857399 TSecr=457078968"
"351","17.726837","192.168.2.2","192.168.1.2","TCP","66","764928","5001  >  48002 [ACK] Seq=1 Ack=2119873 Win=764928 Len=0 TSval=551857410 TSecr=457078980"
"353","17.738941","192.168.2.2","192.168.1.2","TCP","66","770560","5001  >  48002 [ACK] Seq=1 Ack=2122769 Win=770560 Len=0 TSval=551857422 TSecr=457078992"
"356","17.763823","192.168.2.2","192.168.1.2","TCP","66","776192","5001  >  48002 [ACK] Seq=1 Ack=2125665 Win=776192 Len=0 TSval=551857447 TSecr=457079011"
"359","17.787622","192.168.2.2","192.168.1.2","TCP","66","782336","5001  >  48002 [ACK] Seq=1 Ack=2128561 Win=782336 Len=0 TSval=551857471 TSecr=457079029"
"362","17.811845","192.168.2.2","192.168.1.2","TCP","66","787968","5001  >  48002 [ACK] Seq=1 Ack=2131457 Win=787968 Len=0 TSval=551857495 TSecr=457079048"
"365","17.836342","192.168.2.2","192.168.1.2","TCP","66","791040","5001  >  48002 [ACK] Seq=1 Ack=2132905 Win=791040 Len=0 TSval=551857520 TSecr=457079089"
"367","17.848104","192.168.2.2","192.168.1.2","TCP","66","793600","5001  >  48002 [ACK] Seq=1 Ack=2134353 Win=793600 Len=0 TSval=551857532 TSecr=457079104"
"369","17.860071","192.168.2.2","192.168.1.2","TCP","66","796672","5001  >  48002 [ACK] Seq=1 Ack=2135801 Win=796672 Len=0 TSval=551857544 TSecr=457079120"
"371","17.872175","192.168.2.2","192.168.1.2","TCP","66","799744","5001  >  48002 [ACK] Seq=1 Ack=2137249 Win=799744 Len=0 TSval=551857556 TSecr=457079132"
"373","17.884361","192.168.2.2","192.168.1.2","TCP","66","802304","5001  >  48002 [ACK] Seq=1 Ack=2138697 Win=802304 Len=0 TSval=551857568 TSecr=457079144"
"375","17.896422","192.168.2.2","192.168.1.2","TCP","66","805376","5001  >  48002 [ACK] Seq=1 Ack=2140145 Win=805376 Len=0 TSval=551857580 TSecr=457079155"
"377","17.908517","192.168.2.2","192.168.1.2","TCP","66","808448","5001  >  48002 [ACK] Seq=1 Ack=2141593 Win=808448 Len=0 TSval=551857592 TSecr=457079167"
"379","17.920668","192.168.2.2","192.168.1.2","TCP","66","811008","5001  >  48002 [ACK] Seq=1 Ack=2143041 Win=811008 Len=0 TSval=551857604 TSecr=457079178"
"381","17.932753","192.168.2.2","192.168.1.2","TCP","66","814080","5001  >  48002 [ACK] Seq=1 Ack=2144489 Win=814080 Len=0 TSval=551857616 TSecr=457079189"
"383","17.944846","192.168.2.2","192.168.1.2","TCP","66","817152","5001  >  48002 [ACK] Seq=1 Ack=2145937 Win=817152 Len=0 TSval=551857628 TSecr=457079200"
"385","17.959237","192.168.2.2","192.168.1.2","TCP","66","819712","5001  >  48002 [ACK] Seq=1 Ack=2147385 Win=819712 Len=0 TSval=551857643 TSecr=457079212"
"387","17.969201","192.168.2.2","192.168.1.2","TCP","66","822784","5001  >  48002 [ACK] Seq=1 Ack=2148833 Win=822784 Len=0 TSval=551857653 TSecr=457079224"
"389","17.981419","192.168.2.2","192.168.1.2","TCP","66","825856","5001  >  48002 [ACK] Seq=1 Ack=2150281 Win=825856 Len=0 TSval=551857665 TSecr=457079235"
"391","17.993292","192.168.2.2","192.168.1.2","TCP","66","828416","5001  >  48002 [ACK] Seq=1 Ack=2151729 Win=828416 Len=0 TSval=551857677 TSecr=457079247"
"393","18.005414","192.168.2.2","192.168.1.2","TCP","66","831488","5001  >  48002 [ACK] Seq=1 Ack=2153177 Win=831488 Len=0 TSval=551857689 TSecr=457079259"
"395","18.017521","192.168.2.2","192.168.1.2","TCP","66","834048","5001  >  48002 [ACK] Seq=1 Ack=2154625 Win=834048 Len=0 TSval=551857701 TSecr=457079271"
"397","18.030361","192.168.2.2","192.168.1.2","TCP","66","837120","5001  >  48002 [ACK] Seq=1 Ack=2156073 Win=837120 Len=0 TSval=551857714 TSecr=457079283"
"399","18.042098","192.168.2.2","192.168.1.2","TCP","66","840192","5001  >  48002 [ACK] Seq=1 Ack=2157521 Win=840192 Len=0 TSval=551857725 TSecr=457079295"
"401","18.053896","192.168.2.2","192.168.1.2","TCP","66","842752","5001  >  48002 [ACK] Seq=1 Ack=2158969 Win=842752 Len=0 TSval=551857737 TSecr=457079307"
"403","18.065979","192.168.2.2","192.168.1.2","TCP","66","845824","5001  >  48002 [ACK] Seq=1 Ack=2160417 Win=845824 Len=0 TSval=551857749 TSecr=457079319"
"405","18.078113","192.168.2.2","192.168.1.2","TCP","66","848896","5001  >  48002 [ACK] Seq=1 Ack=2161865 Win=848896 Len=0 TSval=551857761 TSecr=457079331"
"407","18.090574","192.168.2.2","192.168.1.2","TCP","66","851456","5001  >  48002 [ACK] Seq=1 Ack=2163313 Win=851456 Len=0 TSval=551857774 TSecr=457079343"
"409","18.102862","192.168.2.2","192.168.1.2","TCP","66","854528","5001  >  48002 [ACK] Seq=1 Ack=2164761 Win=854528 Len=0 TSval=551857786 TSecr=457079358"
"412","18.114422","192.168.2.2","192.168.1.2","TCP","66","857600","5001  >  48002 [ACK] Seq=1 Ack=2166209 Win=857600 Len=0 TSval=551857798 TSecr=457079369"
"413","18.127386","192.168.2.2","192.168.1.2","TCP","66","860160","5001  >  48002 [ACK] Seq=1 Ack=2167657 Win=860160 Len=0 TSval=551857811 TSecr=457079380"
"414","18.139191","192.168.2.2","192.168.1.2","TCP","66","863232","5001  >  48002 [ACK] Seq=1 Ack=2169105 Win=863232 Len=0 TSval=551857822 TSecr=457079392"
"415","18.151022","192.168.2.2","192.168.1.2","TCP","66","866304","5001  >  48002 [ACK] Seq=1 Ack=2170553 Win=866304 Len=0 TSval=551857834 TSecr=457079404"
"417","18.163737","192.168.2.2","192.168.1.2","TCP","66","868864","5001  >  48002 [ACK] Seq=1 Ack=2172001 Win=868864 Len=0 TSval=551857847 TSecr=457079416"
"419","18.175014","192.168.2.2","192.168.1.2","TCP","66","871936","5001  >  48002 [ACK] Seq=1 Ack=2173449 Win=871936 Len=0 TSval=551857858 TSecr=457079429"
"421","18.187297","192.168.2.2","192.168.1.2","TCP","66","875008","5001  >  48002 [ACK] Seq=1 Ack=2174897 Win=875008 Len=0 TSval=551857871 TSecr=457079440"
"423","18.199441","192.168.2.2","192.168.1.2","TCP","66","877568","5001  >  48002 [ACK] Seq=1 Ack=2176345 Win=877568 Len=0 TSval=551857883 TSecr=457079452"
"425","18.211707","192.168.2.2","192.168.1.2","TCP","66","880640","5001  >  48002 [ACK] Seq=1 Ack=2177793 Win=880640 Len=0 TSval=551857895 TSecr=457079464"
"427","18.223648","192.168.2.2","192.168.1.2","TCP","66","886272","5001  >  48002 [ACK] Seq=1 Ack=2180689 Win=886272 Len=0 TSval=551857907 TSecr=457079476"
"430","18.247681","192.168.2.2","192.168.1.2","TCP","66","886272","5001  >  48002 [ACK] Seq=1 Ack=2183585 Win=886272 Len=0 TSval=551857931 TSecr=457079494"
"433","18.271937","192.168.2.2","192.168.1.2","TCP","66","886272","5001  >  48002 [ACK] Seq=1 Ack=2186481 Win=886272 Len=0 TSval=551857955 TSecr=457079512"
"437","18.296881","192.168.2.2","192.168.1.2","TCP","66","886272","5001  >  48002 [ACK] Seq=1 Ack=2187929 Win=886272 Len=0 TSval=551857980 TSecr=457079549"
"439","18.309373","192.168.2.2","192.168.1.2","TCP","66","886272","5001  >  48002 [ACK] Seq=1 Ack=2189377 Win=886272 Len=0 TSval=551857993 TSecr=457079564"
"441","18.321121","192.168.2.2","192.168.1.2","TCP","66","886272","5001  >  48002 [ACK] Seq=1 Ack=2190825 Win=886272 Len=0 TSval=551858004 TSecr=457079579"
"443","18.333291","192.168.2.2","192.168.1.2","TCP","66","886272","5001  >  48002 [ACK] Seq=1 Ack=2192273 Win=886272 Len=0 TSval=551858016 TSecr=457079594"
"445","18.345477","192.168.2.2","192.168.1.2","TCP","66","886272","5001  >  48002 [ACK] Seq=1 Ack=2193721 Win=886272 Len=0 TSval=551858029 TSecr=457079605"
"447","18.357496","192.168.2.2","192.168.1.2","TCP","66","886272","5001  >  48002 [ACK] Seq=1 Ack=2195169 Win=886272 Len=0 TSval=551858041 TSecr=457079617"
"449","18.369581","192.168.2.2","192.168.1.2","TCP","66","886272","5001  >  48002 [ACK] Seq=1 Ack=2196617 Win=886272 Len=0 TSval=551858053 TSecr=457079629"
"451","18.381734","192.168.2.2","192.168.1.2","TCP","66","886272","5001  >  48002 [ACK] Seq=1 Ack=2198065 Win=886272 Len=0 TSval=551858065 TSecr=457079640"
"453","18.393859","192.168.2.2","192.168.1.2","TCP","66","886272","5001  >  48002 [ACK] Seq=1 Ack=2199513 Win=886272 Len=0 TSval=551858077 TSecr=457079651"
"455","18.405894","192.168.2.2","192.168.1.2","TCP","66","886272","5001  >  48002 [ACK] Seq=1 Ack=2200961 Win=886272 Len=0 TSval=551858089 TSecr=457079663"
"457","18.430775","192.168.2.2","192.168.1.2","TCP","66","886272","5001  >  48002 [ACK] Seq=1 Ack=2203857 Win=886272 Len=0 TSval=551858114 TSecr=457079674"
"460","18.454463","192.168.2.2","192.168.1.2","TCP","66","886272","5001  >  48002 [ACK] Seq=1 Ack=2206753 Win=886272 Len=0 TSval=551858138 TSecr=457079697"
"463","18.478824","192.168.2.2","192.168.1.2","TCP","66","886272","5001  >  48002 [ACK] Seq=1 Ack=2209649 Win=886272 Len=0 TSval=551858162 TSecr=457079719"
"466","18.502805","192.168.2.2","192.168.1.2","TCP","66","886272","5001  >  48002 [ACK] Seq=1 Ack=2212545 Win=886272 Len=0 TSval=551858186 TSecr=457079744"
"469","18.527082","192.168.2.2","192.168.1.2","TCP","66","886272","5001  >  48002 [ACK] Seq=1 Ack=2215441 Win=886272 Len=0 TSval=551858210 TSecr=457079768"
"472","18.551345","192.168.2.2","192.168.1.2","TCP","66","886272","5001  >  48002 [ACK] Seq=1 Ack=2218337 Win=886272 Len=0 TSval=551858234 TSecr=457079792"
"475","18.575485","192.168.2.2","192.168.1.2","TCP","66","886272","5001  >  48002 [ACK] Seq=1 Ack=2221233 Win=886272 Len=0 TSval=551858259 TSecr=457079829"
"478","18.599729","192.168.2.2","192.168.1.2","TCP","66","886272","5001  >  48002 [ACK] Seq=1 Ack=2224129 Win=886272 Len=0 TSval=551858283 TSecr=457079853"
"480","18.623929","192.168.2.2","192.168.1.2","TCP","66","886272","5001  >  48002 [ACK] Seq=1 Ack=2227025 Win=886272 Len=0 TSval=551858307 TSecr=457079877"
"483","18.648297","192.168.2.2","192.168.1.2","TCP","66","886272","5001  >  48002 [ACK] Seq=1 Ack=2229921 Win=886272 Len=0 TSval=551858331 TSecr=457079901"
"484","18.672829","192.168.2.2","192.168.1.2","TCP","66","886272","5001  >  48002 [ACK] Seq=1 Ack=2232817 Win=886272 Len=0 TSval=551858356 TSecr=457079925"
"485","18.697348","192.168.2.2","192.168.1.2","TCP","66","886272","5001  >  48002 [ACK] Seq=1 Ack=2235713 Win=886272 Len=0 TSval=551858380 TSecr=457079949"
"488","18.708693","192.168.2.2","192.168.1.2","TCP","66","886272","5001  >  48002 [ACK] Seq=1 Ack=2238609 Win=886272 Len=0 TSval=551858392 TSecr=457079974"
"491","18.733548","192.168.2.2","192.168.1.2","TCP","66","886272","5001  >  48002 [ACK] Seq=1 Ack=2241505 Win=886272 Len=0 TSval=551858417 TSecr=457079991"
"494","18.757127","192.168.2.2","192.168.1.2","TCP","66","886272","5001  >  48002 [ACK] Seq=1 Ack=2244401 Win=886272 Len=0 TSval=551858440 TSecr=457080009"
"497","18.781387","192.168.2.2","192.168.1.2","TCP","66","886272","5001  >  48002 [ACK] Seq=1 Ack=2247297 Win=886272 Len=0 TSval=551858464 TSecr=457080027"
"500","18.806132","192.168.2.2","192.168.1.2","TCP","66","886272","5001  >  48002 [ACK] Seq=1 Ack=2250193 Win=886272 Len=0 TSval=551858489 TSecr=457080044"
"503","18.842384","192.168.2.2","192.168.1.2","TCP","66","886272","5001  >  48002 [ACK] Seq=1 Ack=2253089 Win=886272 Len=0 TSval=551858525 TSecr=457080095"
"506","18.866847","192.168.2.2","192.168.1.2","TCP","66","886272","5001  >  48002 [ACK] Seq=1 Ack=2255985 Win=886272 Len=0 TSval=551858550 TSecr=457080118"
"509","18.890913","192.168.2.2","192.168.1.2","TCP","66","886272","5001  >  48002 [ACK] Seq=1 Ack=2258881 Win=886272 Len=0 TSval=551858574 TSecr=457080141"
"512","18.914627","192.168.2.2","192.168.1.2","TCP","66","886272","5001  >  48002 [ACK] Seq=1 Ack=2261777 Win=886272 Len=0 TSval=551858598 TSecr=457080165"
"515","18.938925","192.168.2.2","192.168.1.2","TCP","66","886272","5001  >  48002 [ACK] Seq=1 Ack=2264673 Win=886272 Len=0 TSval=551858622 TSecr=457080187"
"518","18.963949","192.168.2.2","192.168.1.2","TCP","66","886272","5001  >  48002 [ACK] Seq=1 Ack=2267569 Win=886272 Len=0 TSval=551858647 TSecr=457080210"
"521","18.987331","192.168.2.2","192.168.1.2","TCP","66","886272","5001  >  48002 [ACK] Seq=1 Ack=2270465 Win=886272 Len=0 TSval=551858670 TSecr=457080240"
"524","19.012434","192.168.2.2","192.168.1.2","TCP","66","886272","5001  >  48002 [ACK] Seq=1 Ack=2273361 Win=886272 Len=0 TSval=551858695 TSecr=457080265"
"527","19.035954","192.168.2.2","192.168.1.2","TCP","66","886272","5001  >  48002 [ACK] Seq=1 Ack=2276257 Win=886272 Len=0 TSval=551858719 TSecr=457080289"
"530","19.060447","192.168.2.2","192.168.1.2","TCP","66","886272","5001  >  48002 [ACK] Seq=1 Ack=2279153 Win=886272 Len=0 TSval=551858743 TSecr=457080313"
"533","19.084178","192.168.2.2","192.168.1.2","TCP","66","886272","5001  >  48002 [ACK] Seq=1 Ack=2282049 Win=886272 Len=0 TSval=551858767 TSecr=457080337"
"536","19.108457","192.168.2.2","192.168.1.2","TCP","66","886272","5001  >  48002 [ACK] Seq=1 Ack=2284945 Win=886272 Len=0 TSval=551858791 TSecr=457080362"
"539","19.133003","192.168.2.2","192.168.1.2","TCP","66","886272","5001  >  48002 [ACK] Seq=1 Ack=2287841 Win=886272 Len=0 TSval=551858816 TSecr=457080385"
"540","19.156843","192.168.2.2","192.168.1.2","TCP","66","886272","5001  >  48002 [ACK] Seq=1 Ack=2290737 Win=886272 Len=0 TSval=551858840 TSecr=457080410"
"543","19.181078","192.168.2.2","192.168.1.2","TCP","66","886272","5001  >  48002 [ACK] Seq=1 Ack=2293633 Win=886272 Len=0 TSval=551858864 TSecr=457080434"
"546","19.205284","192.168.2.2","192.168.1.2","TCP","66","886272","5001  >  48002 [ACK] Seq=1 Ack=2296529 Win=886272 Len=0 TSval=551858888 TSecr=457080458"
"548","19.217423","192.168.2.2","192.168.1.2","TCP","66","886272","5001  >  48002 [ACK] Seq=1 Ack=2299425 Win=886272 Len=0 TSval=551858900 TSecr=457080482"
"551","19.241742","192.168.2.2","192.168.1.2","TCP","66","886272","5001  >  48002 [ACK] Seq=1 Ack=2302321 Win=886272 Len=0 TSval=551858924 TSecr=457080500"
"555","19.266640","192.168.2.2","192.168.1.2","TCP","66","886272","5001  >  48002 [ACK] Seq=1 Ack=2305217 Win=886272 Len=0 TSval=551858949 TSecr=457080517"
"559","19.303460","192.168.2.2","192.168.1.2","TCP","66","886272","5001  >  48002 [ACK] Seq=1 Ack=2308113 Win=886272 Len=0 TSval=551858986 TSecr=457080555"
"562","19.327964","192.168.2.2","192.168.1.2","TCP","66","886272","5001  >  48002 [ACK] Seq=1 Ack=2311009 Win=886272 Len=0 TSval=551859011 TSecr=457080585"
"565","19.351523","192.168.2.2","192.168.1.2","TCP","66","886272","5001  >  48002 [ACK] Seq=1 Ack=2313905 Win=886272 Len=0 TSval=551859034 TSecr=457080614"
"568","19.376082","192.168.2.2","192.168.1.2","TCP","66","886272","5001  >  48002 [ACK] Seq=1 Ack=2316801 Win=886272 Len=0 TSval=551859059 TSecr=457080638"
"571","19.400500","192.168.2.2","192.168.1.2","TCP","66","886272","5001  >  48002 [ACK] Seq=1 Ack=2319697 Win=886272 Len=0 TSval=551859083 TSecr=457080661"
"574","19.425006","192.168.2.2","192.168.1.2","TCP","66","886272","5001  >  48002 [ACK] Seq=1 Ack=2322593 Win=886272 Len=0 TSval=551859108 TSecr=457080684"
"577","19.448537","192.168.2.2","192.168.1.2","TCP","66","886272","5001  >  48002 [ACK] Seq=1 Ack=2325489 Win=886272 Len=0 TSval=551859131 TSecr=457080706"
"580","19.472547","192.168.2.2","192.168.1.2","TCP","66","886272","5001  >  48002 [ACK] Seq=1 Ack=2328385 Win=886272 Len=0 TSval=551859155 TSecr=457080728"
"583","19.496781","192.168.2.2","192.168.1.2","TCP","66","886272","5001  >  48002 [ACK] Seq=1 Ack=2331281 Win=886272 Len=0 TSval=551859179 TSecr=457080751"
"586","19.521632","192.168.2.2","192.168.1.2","TCP","66","886272","5001  >  48002 [ACK] Seq=1 Ack=2334177 Win=886272 Len=0 TSval=551859204 TSecr=457080774"
"589","19.545221","192.168.2.2","192.168.1.2","TCP","66","886272","5001  >  48002 [ACK] Seq=1 Ack=2337073 Win=886272 Len=0 TSval=551859228 TSecr=457080798"
"592","19.569434","192.168.2.2","192.168.1.2","TCP","66","886272","5001  >  48002 [ACK] Seq=1 Ack=2339969 Win=886272 Len=0 TSval=551859252 TSecr=457080823"
"595","19.594148","192.168.2.2","192.168.1.2","TCP","66","886272","5001  >  48002 [ACK] Seq=1 Ack=2342865 Win=886272 Len=0 TSval=551859277 TSecr=457080846"
"598","19.618089","192.168.2.2","192.168.1.2","TCP","66","886272","5001  >  48002 [ACK] Seq=1 Ack=2345761 Win=886272 Len=0 TSval=551859301 TSecr=457080870"
"600","19.642156","192.168.2.2","192.168.1.2","TCP","66","886272","5001  >  48002 [ACK] Seq=1 Ack=2348657 Win=886272 Len=0 TSval=551859325 TSecr=457080894"
"603","19.666350","192.168.2.2","192.168.1.2","TCP","66","886272","5001  >  48002 [ACK] Seq=1 Ack=2351553 Win=886272 Len=0 TSval=551859349 TSecr=457080919"
"604","19.691151","192.168.2.2","192.168.1.2","TCP","66","886272","5001  >  48002 [ACK] Seq=1 Ack=2354449 Win=886272 Len=0 TSval=551859374 TSecr=457080943"
"605","19.715691","192.168.2.2","192.168.1.2","TCP","66","886272","5001  >  48002 [ACK] Seq=1 Ack=2357345 Win=886272 Len=0 TSval=551859398 TSecr=457080967"
"608","19.727466","192.168.2.2","192.168.1.2","TCP","66","886272","5001  >  48002 [ACK] Seq=1 Ack=2360241 Win=886272 Len=0 TSval=551859410 TSecr=457080992"
"611","19.751109","192.168.2.2","192.168.1.2","TCP","66","886272","5001  >  48002 [ACK] Seq=1 Ack=2363137 Win=886272 Len=0 TSval=551859434 TSecr=457081010"
"614","19.775423","192.168.2.2","192.168.1.2","TCP","66","886272","5001  >  48002 [ACK] Seq=1 Ack=2366033 Win=886272 Len=0 TSval=551859458 TSecr=457081028"
"617","19.799892","192.168.2.2","192.168.1.2","TCP","66","886272","5001  >  48002 [ACK] Seq=1 Ack=2368929 Win=886272 Len=0 TSval=551859482 TSecr=457081046"
"620","19.824427","192.168.2.2","192.168.1.2","TCP","66","886272","5001  >  48002 [ACK] Seq=1 Ack=2371825 Win=886272 Len=0 TSval=551859507 TSecr=457081063"
"623","19.860731","192.168.2.2","192.168.1.2","TCP","66","886272","5001  >  48002 [ACK] Seq=1 Ack=2374721 Win=886272 Len=0 TSval=551859543 TSecr=457081113"
"626","19.884363","192.168.2.2","192.168.1.2","TCP","66","886272","5001  >  48002 [ACK] Seq=1 Ack=2377617 Win=886272 Len=0 TSval=551859567 TSecr=457081136"
"629","19.908600","192.168.2.2","192.168.1.2","TCP","66","886272","5001  >  48002 [ACK] Seq=1 Ack=2380513 Win=886272 Len=0 TSval=551859591 TSecr=457081159"
"632","19.932810","192.168.2.2","192.168.1.2","TCP","66","886272","5001  >  48002 [ACK] Seq=1 Ack=2383409 Win=886272 Len=0 TSval=551859615 TSecr=457081182"
