No.,Time,Source,Destination,Protocol,Length,Calculated window size,Info
4,0.008826,192.168.2.2,192.168.1.2,TCP,74,43440,"5001  >  45098 [SYN, ACK] Seq=0 Ack=1 Win=43440 Len=0 MSS=1460 SACK_PERM=1 TSval=1023707919 TSecr=1378780191 WS=512"
7,0.008888,192.168.2.2,192.168.1.2,TCP,66,39936,5001  >  45098 [ACK] Seq=1 Ack=7241 Win=39936 Len=0 TSval=1023707919 TSecr=1378780191
12,0.057869,192.168.2.2,192.168.1.2,TCP,66,38400,5001  >  45098 [ACK] Seq=1 Ack=17377 Win=38400 Len=0 TSval=1023707968 TSecr=1378780191
15,0.143231,192.168.2.2,192.168.1.2,TCP,66,38400,5001  >  45098 [ACK] Seq=1 Ack=27513 Win=38400 Len=0 TSval=1023708053 TSecr=1378780192
19,0.228023,192.168.2.2,192.168.1.2,TCP,66,42496,5001  >  45098 [ACK] Seq=1 Ack=28961 Win=42496 Len=0 TSval=1023708138 TSecr=1378780193
21,0.239425,192.168.2.2,192.168.1.2,TCP,66,42496,5001  >  45098 [ACK] Seq=1 Ack=30409 Win=42496 Len=0 TSval=1023708149 TSecr=1378780207
25,0.251598,192.168.2.2,192.168.1.2,TCP,66,35328,5001  >  45098 [ACK] Seq=1 Ack=46337 Win=35328 Len=0 TSval=1023708162 TSecr=1378780240
27,0.384876,192.168.2.2,192.168.1.2,TCP,66,41984,5001  >  45098 [ACK] Seq=1 Ack=49233 Win=41984 Len=0 TSval=1023708295 TSecr=1378780266
29,0.409368,192.168.2.2,192.168.1.2,TCP,66,45568,5001  >  45098 [ACK] Seq=1 Ack=50681 Win=45568 Len=0 TSval=1023708319 TSecr=1378780325
32,0.421127,192.168.2.2,192.168.1.2,TCP,66,75776,5001  >  45098 [ACK] Seq=1 Ack=65913 Win=75776 Len=0 TSval=1023708331 TSecr=1378780325
35,0.549541,192.168.2.2,192.168.1.2,TCP,78,75776,[TCP Dup ACK 32#1] 5001  >  45098 [ACK] Seq=1 Ack=65913 Win=75776 Len=0 TSval=1023708459 TSecr=1378780379 SLE=65161 SRE=65913
37,0.55637,192.168.2.2,192.168.1.2,TCP,66,84480,5001  >  45098 [ACK] Seq=1 Ack=70257 Win=84480 Len=0 TSval=1023708466 TSecr=1378780410
40,0.593011,192.168.2.2,192.168.1.2,TCP,66,87552,5001  >  45098 [ACK] Seq=1 Ack=71705 Win=87552 Len=0 TSval=1023708503 TSecr=1378780421
42,0.605432,192.168.2.2,192.168.1.2,TCP,66,90112,5001  >  45098 [ACK] Seq=1 Ack=72401 Win=90112 Len=0 TSval=1023708515 TSecr=1378780421
44,0.61053,192.168.2.2,192.168.1.2,TCP,66,93184,5001  >  45098 [ACK] Seq=1 Ack=81089 Win=93184 Len=0 TSval=1023708520 TSecr=1378780434
48,0.683839,192.168.2.2,192.168.1.2,TCP,66,93184,5001  >  45098 [ACK] Seq=1 Ack=89777 Win=93184 Len=0 TSval=1023708594 TSecr=1378780567
51,0.755942,192.168.2.2,192.168.1.2,TCP,66,95232,5001  >  45098 [ACK] Seq=1 Ack=94121 Win=95232 Len=0 TSval=1023708666 TSecr=1378780591
53,0.792244,192.168.2.2,192.168.1.2,TCP,66,86528,5001  >  45098 [ACK] Seq=1 Ack=115841 Win=86528 Len=0 TSval=1023708702 TSecr=1378780603
55,0.973932,192.168.2.2,192.168.1.2,TCP,66,86528,5001  >  45098 [ACK] Seq=1 Ack=137561 Win=86528 Len=0 TSval=1023708884 TSecr=1378780603
59,1.156314,192.168.2.2,192.168.1.2,TCP,66,101376,5001  >  45098 [ACK] Seq=1 Ack=140457 Win=101376 Len=0 TSval=1023709066 TSecr=1378780731
62,1.181159,192.168.2.2,192.168.1.2,TCP,66,127488,5001  >  45098 [ACK] Seq=1 Ack=153489 Win=127488 Len=0 TSval=1023709091 TSecr=1378780738
65,1.289975,192.168.2.2,192.168.1.2,TCP,66,135680,5001  >  45098 [ACK] Seq=1 Ack=157833 Win=135680 Len=0 TSval=1023709199 TSecr=1378780775
68,1.32591,192.168.2.2,192.168.1.2,TCP,66,138752,5001  >  45098 [ACK] Seq=1 Ack=159281 Win=138752 Len=0 TSval=1023709235 TSecr=1378780787
70,1.338105,192.168.2.2,192.168.1.2,TCP,66,168960,5001  >  45098 [ACK] Seq=1 Ack=174273 Win=168960 Len=0 TSval=1023709248 TSecr=1378780792
73,1.463911,192.168.2.2,192.168.1.2,TCP,66,180224,5001  >  45098 [ACK] Seq=1 Ack=180065 Win=180224 Len=0 TSval=1023709373 TSecr=1378780866
75,1.512197,192.168.2.2,192.168.1.2,TCP,66,183296,5001  >  45098 [ACK] Seq=1 Ack=181001 Win=183296 Len=0 TSval=1023709422 TSecr=1378780866
77,1.520772,192.168.2.2,192.168.1.2,TCP,66,197632,5001  >  45098 [ACK] Seq=1 Ack=188241 Win=197632 Len=0 TSval=1023709430 TSecr=1378780938
80,1.581593,192.168.2.2,192.168.1.2,TCP,66,223744,5001  >  45098 [ACK] Seq=1 Ack=201273 Win=223744 Len=0 TSval=1023709491 TSecr=1378780974
86,1.68978,192.168.2.2,192.168.1.2,TCP,66,226816,5001  >  45098 [ACK] Seq=1 Ack=202721 Win=226816 Len=0 TSval=1023709599 TSecr=1378781156
89,1.702644,192.168.2.2,192.168.1.2,TCP,66,270336,5001  >  45098 [ACK] Seq=1 Ack=224441 Win=270336 Len=0 TSval=1023709612 TSecr=1378781338
92,1.884964,192.168.2.2,192.168.1.2,TCP,66,305152,5001  >  45098 [ACK] Seq=1 Ack=241817 Win=305152 Len=0 TSval=1023709794 TSecr=1378781338
95,2.029957,192.168.2.2,192.168.1.2,TCP,66,313344,5001  >  45098 [ACK] Seq=1 Ack=246161 Win=313344 Len=0 TSval=1023709939 TSecr=1378781363
97,2.066045,192.168.2.2,192.168.1.2,TCP,66,304640,5001  >  45098 [ACK] Seq=1 Ack=267881 Win=304640 Len=0 TSval=1023709975 TSecr=1378781363
101,2.248988,192.168.2.2,192.168.1.2,TCP,66,304640,5001  >  45098 [ACK] Seq=1 Ack=289601 Win=304640 Len=0 TSval=1023710158 TSecr=1378781471
104,2.430885,192.168.2.2,192.168.1.2,TCP,66,319488,5001  >  45098 [ACK] Seq=1 Ack=292497 Win=319488 Len=0 TSval=1023710340 TSecr=1378781478
106,2.455253,192.168.2.2,192.168.1.2,TCP,66,328192,5001  >  45098 [ACK] Seq=1 Ack=296841 Win=328192 Len=0 TSval=1023710364 TSecr=1378781507
108,2.491366,192.168.2.2,192.168.1.2,TCP,66,356864,5001  >  45098 [ACK] Seq=1 Ack=311321 Win=356864 Len=0 TSval=1023710400 TSecr=1378781520
110,2.61256,192.168.2.2,192.168.1.2,TCP,66,400384,5001  >  45098 [ACK] Seq=1 Ack=333041 Win=400384 Len=0 TSval=1023710521 TSecr=1378781520
112,2.794062,192.168.2.2,192.168.1.2,TCP,66,443904,5001  >  45098 [ACK] Seq=1 Ack=354761 Win=443904 Len=0 TSval=1023710703 TSecr=1378781645
115,2.976204,192.168.2.2,192.168.1.2,TCP,66,462848,5001  >  45098 [ACK] Seq=1 Ack=364297 Win=462848 Len=0 TSval=1023710885 TSecr=1378781694
118,3.055678,192.168.2.2,192.168.1.2,TCP,66,485888,5001  >  45098 [ACK] Seq=1 Ack=375881 Win=485888 Len=0 TSval=1023710964 TSecr=1378781702
120,3.152787,192.168.2.2,192.168.1.2,TCP,66,488960,5001  >  45098 [ACK] Seq=1 Ack=376481 Win=488960 Len=0 TSval=1023711061 TSecr=1378781702
122,3.157984,192.168.2.2,192.168.1.2,TCP,66,481280,5001  >  45098 [ACK] Seq=1 Ack=398201 Win=481280 Len=0 TSval=1023711066 TSecr=1378781763
124,3.34036,192.168.2.2,192.168.1.2,TCP,66,483840,5001  >  45098 [ACK] Seq=1 Ack=415577 Win=483840 Len=0 TSval=1023711249 TSecr=1378781871
126,3.485015,192.168.2.2,192.168.1.2,TCP,66,489984,5001  >  45098 [ACK] Seq=1 Ack=419921 Win=489984 Len=0 TSval=1023711393 TSecr=1378781884
128,3.521974,192.168.2.2,192.168.1.2,TCP,66,483840,5001  >  45098 [ACK] Seq=1 Ack=437297 Win=483840 Len=0 TSval=1023711430 TSecr=1378781990
130,3.667613,192.168.2.2,192.168.1.2,TCP,66,489984,5001  >  45098 [ACK] Seq=1 Ack=441641 Win=489984 Len=0 TSval=1023711576 TSecr=1378782066
133,3.70447,192.168.2.2,192.168.1.2,TCP,66,494080,5001  >  45098 [ACK] Seq=1 Ack=459017 Win=494080 Len=0 TSval=1023711613 TSecr=1378782211
135,3.850413,192.168.2.2,192.168.1.2,TCP,66,500736,5001  >  45098 [ACK] Seq=1 Ack=463361 Win=500736 Len=0 TSval=1023711759 TSecr=1378782247
137,3.886148,192.168.2.2,192.168.1.2,TCP,66,492032,5001  >  45098 [ACK] Seq=1 Ack=485081 Win=492032 Len=0 TSval=1023711794 TSecr=1378782430
140,4.068015,192.168.2.2,192.168.1.2,TCP,66,494080,5001  >  45098 [ACK] Seq=1 Ack=502457 Win=494080 Len=0 TSval=1023711976 TSecr=1378782502
142,4.213419,192.168.2.2,192.168.1.2,TCP,66,501248,5001  >  45098 [ACK] Seq=1 Ack=505353 Win=501248 Len=0 TSval=1023712121 TSecr=1378782612
144,4.237552,192.168.2.2,192.168.1.2,TCP,66,501760,5001  >  45098 [ACK] Seq=1 Ack=506801 Win=501760 Len=0 TSval=1023712146 TSecr=1378782636
146,4.249606,192.168.2.2,192.168.1.2,TCP,66,494080,5001  >  45098 [ACK] Seq=1 Ack=524177 Win=494080 Len=0 TSval=1023712158 TSecr=1378782672
149,4.394968,192.168.2.2,192.168.1.2,TCP,66,500736,5001  >  45098 [ACK] Seq=1 Ack=528521 Win=500736 Len=0 TSval=1023712303 TSecr=1378782793
151,4.431222,192.168.2.2,192.168.1.2,TCP,66,501760,5001  >  45098 [ACK] Seq=1 Ack=550241 Win=501760 Len=0 TSval=1023712339 TSecr=1378782975
153,4.613442,192.168.2.2,192.168.1.2,TCP,66,501760,5001  >  45098 [ACK] Seq=1 Ack=567617 Win=501760 Len=0 TSval=1023712521 TSecr=1378783014
155,4.758508,192.168.2.2,192.168.1.2,TCP,66,501760,5001  >  45098 [ACK] Seq=1 Ack=577753 Win=501760 Len=0 TSval=1023712666 TSecr=1378783157
158,4.843868,192.168.2.2,192.168.1.2,TCP,66,501760,5001  >  45098 [ACK] Seq=1 Ack=589337 Win=501760 Len=0 TSval=1023712752 TSecr=1378783236
160,4.95283,192.168.2.2,192.168.1.2,TCP,66,501760,5001  >  45098 [ACK] Seq=1 Ack=595129 Win=501760 Len=0 TSval=1023712860 TSecr=1378783333
162,4.989337,192.168.2.2,192.168.1.2,TCP,66,501760,5001  >  45098 [ACK] Seq=1 Ack=629881 Win=501760 Len=0 TSval=1023712897 TSecr=1378783521
165,5.280306,192.168.2.2,192.168.1.2,TCP,66,500736,5001  >  45098 [ACK] Seq=1 Ack=634225 Win=500736 Len=0 TSval=1023713188 TSecr=1378783665
167,5.316151,192.168.2.2,192.168.1.2,TCP,66,499712,5001  >  45098 [ACK] Seq=1 Ack=640017 Win=499712 Len=0 TSval=1023713224 TSecr=1378783702
169,5.364623,192.168.2.2,192.168.1.2,TCP,66,494592,5001  >  45098 [ACK] Seq=1 Ack=655945 Win=494592 Len=0 TSval=1023713272 TSecr=1378783848
172,5.497929,192.168.2.2,192.168.1.2,TCP,66,494080,5001  >  45098 [ACK] Seq=1 Ack=673321 Win=494080 Len=0 TSval=1023713405 TSecr=1378783885
175,5.643461,192.168.2.2,192.168.1.2,TCP,66,510464,5001  >  45098 [ACK] Seq=1 Ack=677665 Win=510464 Len=0 TSval=1023713551 TSecr=1378784031
177,5.679726,192.168.2.2,192.168.1.2,TCP,66,525312,5001  >  45098 [ACK] Seq=1 Ack=684905 Win=525312 Len=0 TSval=1023713587 TSecr=1378784066
180,5.740935,192.168.2.2,192.168.1.2,TCP,66,588800,5001  >  45098 [ACK] Seq=1 Ack=716761 Win=588800 Len=0 TSval=1023713648 TSecr=1378784248
183,6.008104,192.168.2.2,192.168.1.2,TCP,66,594432,5001  >  45098 [ACK] Seq=1 Ack=719657 Win=594432 Len=0 TSval=1023713915 TSecr=1378784393
186,6.031565,192.168.2.2,192.168.1.2,TCP,66,597504,5001  >  45098 [ACK] Seq=1 Ack=721105 Win=597504 Len=0 TSval=1023713939 TSecr=1378784418
189,6.044285,192.168.2.2,192.168.1.2,TCP,66,614912,5001  >  45098 [ACK] Seq=1 Ack=729793 Win=614912 Len=0 TSval=1023713951 TSecr=1378784430
191,6.11646,192.168.2.2,192.168.1.2,TCP,66,632320,5001  >  45098 [ACK] Seq=1 Ack=738481 Win=632320 Len=0 TSval=1023714023 TSecr=1378784549
193,6.189883,192.168.2.2,192.168.1.2,TCP,66,641024,5001  >  45098 [ACK] Seq=1 Ack=742825 Win=641024 Len=0 TSval=1023714097 TSecr=1378784575
195,6.225334,192.168.2.2,192.168.1.2,TCP,66,684544,5001  >  45098 [ACK] Seq=1 Ack=764545 Win=684544 Len=0 TSval=1023714132 TSecr=1378784611
197,6.407435,192.168.2.2,192.168.1.2,TCP,66,704512,5001  >  45098 [ACK] Seq=1 Ack=774681 Win=704512 Len=0 TSval=1023714314 TSecr=1378784793
199,6.491806,192.168.2.2,192.168.1.2,TCP,66,739328,5001  >  45098 [ACK] Seq=1 Ack=792057 Win=739328 Len=0 TSval=1023714399 TSecr=1378784938
201,6.637137,192.168.2.2,192.168.1.2,TCP,66,762368,5001  >  45098 [ACK] Seq=1 Ack=803641 Win=762368 Len=0 TSval=1023714544 TSecr=1378785024
203,6.734168,192.168.2.2,192.168.1.2,TCP,66,774144,5001  >  45098 [ACK] Seq=1 Ack=809433 Win=774144 Len=0 TSval=1023714641 TSecr=1378785132
205,6.782482,192.168.2.2,192.168.1.2,TCP,66,794624,5001  >  45098 [ACK] Seq=1 Ack=819569 Win=794624 Len=0 TSval=1023714689 TSecr=1378785169
208,6.868598,192.168.2.2,192.168.1.2,TCP,66,852480,5001  >  45098 [ACK] Seq=1 Ack=848529 Win=852480 Len=0 TSval=1023714775 TSecr=1378785460
212,7.110866,192.168.2.2,192.168.1.2,TCP,66,863744,5001  >  45098 [ACK] Seq=1 Ack=854321 Win=863744 Len=0 TSval=1023715017 TSecr=1378785496
214,7.159674,192.168.2.2,192.168.1.2,TCP,66,887296,5001  >  45098 [ACK] Seq=1 Ack=865905 Win=887296 Len=0 TSval=1023715066 TSecr=1378785544
216,7.256658,192.168.2.2,192.168.1.2,TCP,66,896000,5001  >  45098 [ACK] Seq=1 Ack=870249 Win=896000 Len=0 TSval=1023715163 TSecr=1378785572
218,7.292936,192.168.2.2,192.168.1.2,TCP,66,930816,5001  >  45098 [ACK] Seq=1 Ack=887625 Win=930816 Len=0 TSval=1023715199 TSecr=1378785677
220,7.438487,192.168.2.2,192.168.1.2,TCP,66,939008,5001  >  45098 [ACK] Seq=1 Ack=891969 Win=939008 Len=0 TSval=1023715345 TSecr=1378785823
222,7.474203,192.168.2.2,192.168.1.2,TCP,66,953856,5001  >  45098 [ACK] Seq=1 Ack=899209 Win=953856 Len=0 TSval=1023715381 TSecr=1378785859
224,7.53478,192.168.2.2,192.168.1.2,TCP,66,979968,5001  >  45098 [ACK] Seq=1 Ack=912241 Win=979968 Len=0 TSval=1023715441 TSecr=1378785920
226,7.644303,192.168.2.2,192.168.1.2,TCP,66,987648,5001  >  45098 [ACK] Seq=1 Ack=931065 Win=987648 Len=0 TSval=1023715551 TSecr=1378786084
229,7.802116,192.168.2.2,192.168.1.2,TCP,66,993280,5001  >  45098 [ACK] Seq=1 Ack=933961 Win=993280 Len=0 TSval=1023715708 TSecr=1378786187
232,7.826218,192.168.2.2,192.168.1.2,TCP,66,996352,5001  >  45098 [ACK] Seq=1 Ack=935409 Win=996352 Len=0 TSval=1023715732 TSecr=1378786211
234,7.838354,192.168.2.2,192.168.1.2,TCP,66,992768,5001  >  45098 [ACK] Seq=1 Ack=944097 Win=992768 Len=0 TSval=1023715745 TSecr=1378786223
236,7.911031,192.168.2.2,192.168.1.2,TCP,66,992768,5001  >  45098 [ACK] Seq=1 Ack=952785 Win=992768 Len=0 TSval=1023715817 TSecr=1378786296
238,7.983908,192.168.2.2,192.168.1.2,TCP,66,994816,5001  >  45098 [ACK] Seq=1 Ack=957129 Win=994816 Len=0 TSval=1023715890 TSecr=1378786369
240,8.020195,192.168.2.2,192.168.1.2,TCP,66,996352,5001  >  45098 [ACK] Seq=1 Ack=958577 Win=996352 Len=0 TSval=1023715926 TSecr=1378786404
243,8.032971,192.168.2.2,192.168.1.2,TCP,66,981504,5001  >  45098 [ACK] Seq=1 Ack=988985 Win=981504 Len=0 TSval=1023715939 TSecr=1378786586
245,8.286737,192.168.2.2,192.168.1.2,TCP,66,988672,5001  >  45098 [ACK] Seq=1 Ack=1004913 Win=988672 Len=0 TSval=1023716193 TSecr=1378786671
247,8.420065,192.168.2.2,192.168.1.2,TCP,66,990208,5001  >  45098 [ACK] Seq=1 Ack=1017945 Win=990208 Len=0 TSval=1023716326 TSecr=1378786816
249,8.528881,192.168.2.2,192.168.1.2,TCP,66,993792,5001  >  45098 [ACK] Seq=1 Ack=1023737 Win=993792 Len=0 TSval=1023716435 TSecr=1378786913
251,8.577372,192.168.2.2,192.168.1.2,TCP,66,991744,5001  >  45098 [ACK] Seq=1 Ack=1033873 Win=991744 Len=0 TSval=1023716483 TSecr=1378786961
253,8.661949,192.168.2.2,192.168.1.2,TCP,66,988160,5001  >  45098 [ACK] Seq=1 Ack=1051249 Win=988160 Len=0 TSval=1023716568 TSecr=1378787047
255,8.807662,192.168.2.2,192.168.1.2,TCP,66,991232,5001  >  45098 [ACK] Seq=1 Ack=1062833 Win=991232 Len=0 TSval=1023716713 TSecr=1378787107
258,8.905027,192.168.2.2,192.168.1.2,TCP,66,993792,5001  >  45098 [ACK] Seq=1 Ack=1068625 Win=993792 Len=0 TSval=1023716811 TSecr=1378787289
260,8.953719,192.168.2.2,192.168.1.2,TCP,66,991232,5001  >  45098 [ACK] Seq=1 Ack=1080209 Win=991232 Len=0 TSval=1023716859 TSecr=1378787338
263,9.050353,192.168.2.2,192.168.1.2,TCP,66,994816,5001  >  45098 [ACK] Seq=1 Ack=1084553 Win=994816 Len=0 TSval=1023716956 TSecr=1378787435
265,9.086655,192.168.2.2,192.168.1.2,TCP,66,990208,5001  >  45098 [ACK] Seq=1 Ack=1097585 Win=990208 Len=0 TSval=1023716992 TSecr=1378787471
267,9.195853,192.168.2.2,192.168.1.2,TCP,66,992768,5001  >  45098 [ACK] Seq=1 Ack=1106273 Win=992768 Len=0 TSval=1023717101 TSecr=1378787617
269,9.268492,192.168.2.2,192.168.1.2,TCP,66,993280,5001  >  45098 [ACK] Seq=1 Ack=1113513 Win=993280 Len=0 TSval=1023717174 TSecr=1378787653
271,9.328897,192.168.2.2,192.168.1.2,TCP,66,990208,5001  >  45098 [ACK] Seq=1 Ack=1126545 Win=990208 Len=0 TSval=1023717234 TSecr=1378787713
273,9.438464,192.168.2.2,192.168.1.2,TCP,66,988160,5001  >  45098 [ACK] Seq=1 Ack=1143921 Win=988160 Len=0 TSval=1023717344 TSecr=1378787823
275,9.583469,192.168.2.2,192.168.1.2,TCP,66,996352,5001  >  45098 [ACK] Seq=1 Ack=1145369 Win=996352 Len=0 TSval=1023717489 TSecr=1378787823
277,9.595384,192.168.2.2,192.168.1.2,TCP,66,995328,5001  >  45098 [ACK] Seq=1 Ack=1148265 Win=995328 Len=0 TSval=1023717501 TSecr=1378787980
279,9.632526,192.168.2.2,192.168.1.2,TCP,66,996352,5001  >  45098 [ACK] Seq=1 Ack=1158401 Win=996352 Len=0 TSval=1023717538 TSecr=1378788004
281,9.705071,192.168.2.2,192.168.1.2,TCP,66,996352,5001  >  45098 [ACK] Seq=1 Ack=1167089 Win=996352 Len=0 TSval=1023717610 TSecr=1378788089
283,9.777549,192.168.2.2,192.168.1.2,TCP,66,996352,5001  >  45098 [ACK] Seq=1 Ack=1171433 Win=996352 Len=0 TSval=1023717683 TSecr=1378788162
286,9.826265,192.168.2.2,192.168.1.2,TCP,66,996352,5001  >  45098 [ACK] Seq=1 Ack=1190257 Win=996352 Len=0 TSval=1023717731 TSecr=1378788198
288,9.971727,192.168.2.2,192.168.1.2,TCP,66,996352,5001  >  45098 [ACK] Seq=1 Ack=1219217 Win=996352 Len=0 TSval=1023717877 TSecr=1378788465
292,10.213888,192.168.2.2,192.168.1.2,TCP,66,990208,5001  >  45098 [ACK] Seq=1 Ack=1232249 Win=990208 Len=0 TSval=1023718119 TSecr=1378788598
293,10.322984,192.168.2.2,192.168.1.2,TCP,66,994816,5001  >  45098 [ACK] Seq=1 Ack=1236593 Win=994816 Len=0 TSval=1023718228 TSecr=1378788707
294,10.35924,192.168.2.2,192.168.1.2,TCP,66,991232,5001  >  45098 [ACK] Seq=1 Ack=1248177 Win=991232 Len=0 TSval=1023718264 TSecr=1378788755
295,10.456189,192.168.2.2,192.168.1.2,TCP,66,988160,5001  >  45098 [ACK] Seq=1 Ack=1265553 Win=988160 Len=0 TSval=1023718361 TSecr=1378788840
296,10.601756,192.168.2.2,192.168.1.2,TCP,66,991232,5001  >  45098 [ACK] Seq=1 Ack=1277137 Win=991232 Len=0 TSval=1023718507 TSecr=1378788985
297,10.698789,192.168.2.2,192.168.1.2,TCP,66,993792,5001  >  45098 [ACK] Seq=1 Ack=1282929 Win=993792 Len=0 TSval=1023718604 TSecr=1378789083
298,10.746788,192.168.2.2,192.168.1.2,TCP,66,991232,5001  >  45098 [ACK] Seq=1 Ack=1294513 Win=991232 Len=0 TSval=1023718651 TSecr=1378789131
300,10.844462,192.168.2.2,192.168.1.2,TCP,66,994816,5001  >  45098 [ACK] Seq=1 Ack=1298857 Win=994816 Len=0 TSval=1023718749 TSecr=1378789228
301,10.881076,192.168.2.2,192.168.1.2,TCP,66,995328,5001  >  45098 [ACK] Seq=1 Ack=1301753 Win=995328 Len=0 TSval=1023718786 TSecr=1378789264
302,10.905598,192.168.2.2,192.168.1.2,TCP,66,987648,5001  >  45098 [ACK] Seq=1 Ack=1320577 Win=987648 Len=0 TSval=1023718810 TSecr=1378789373
304,11.062506,192.168.2.2,192.168.1.2,TCP,66,993280,5001  >  45098 [ACK] Seq=1 Ack=1327817 Win=993280 Len=0 TSval=1023718967 TSecr=1378789446
305,11.123174,192.168.2.2,192.168.1.2,TCP,66,990208,5001  >  45098 [ACK] Seq=1 Ack=1340849 Win=990208 Len=0 TSval=1023719028 TSecr=1378789506
306,11.232487,192.168.2.2,192.168.1.2,TCP,66,988160,5001  >  45098 [ACK] Seq=1 Ack=1358225 Win=988160 Len=0 TSval=1023719137 TSecr=1378789616
307,11.37749,192.168.2.2,192.168.1.2,TCP,66,996352,5001  >  45098 [ACK] Seq=1 Ack=1359673 Win=996352 Len=0 TSval=1023719282 TSecr=1378789761
308,11.390255,192.168.2.2,192.168.1.2,TCP,66,995328,5001  >  45098 [ACK] Seq=1 Ack=1362569 Win=995328 Len=0 TSval=1023719295 TSecr=1378789773
309,11.41388,192.168.2.2,192.168.1.2,TCP,66,994816,5001  >  45098 [ACK] Seq=1 Ack=1366913 Win=994816 Len=0 TSval=1023719318 TSecr=1378789810
310,11.450107,192.168.2.2,192.168.1.2,TCP,66,996352,5001  >  45098 [ACK] Seq=1 Ack=1381393 Win=996352 Len=0 TSval=1023719354 TSecr=1378789882
311,11.571576,192.168.2.2,192.168.1.2,TCP,66,996352,5001  >  45098 [ACK] Seq=1 Ack=1385737 Win=996352 Len=0 TSval=1023719476 TSecr=1378789955
312,11.607904,192.168.2.2,192.168.1.2,TCP,66,996352,5001  >  45098 [ACK] Seq=1 Ack=1404561 Win=996352 Len=0 TSval=1023719512 TSecr=1378790003
313,11.76502,192.168.2.2,192.168.1.2,TCP,66,996352,5001  >  45098 [ACK] Seq=1 Ack=1432073 Win=996352 Len=0 TSval=1023719669 TSecr=1378790149
315,11.995444,192.168.2.2,192.168.1.2,TCP,66,996352,5001  >  45098 [ACK] Seq=1 Ack=1433521 Win=996352 Len=0 TSval=1023719900 TSecr=1378790178
319,12.008812,192.168.2.2,192.168.1.2,TCP,66,995328,5001  >  45098 [ACK] Seq=1 Ack=1436417 Win=995328 Len=0 TSval=1023719913 TSecr=1378791941
325,12.033678,192.168.2.2,192.168.1.2,TCP,66,995328,5001  >  45098 [ACK] Seq=1 Ack=1439313 Win=995328 Len=0 TSval=1023719938 TSecr=1378792172
327,12.057241,192.168.2.2,192.168.1.2,TCP,66,967680,5001  >  45098 [ACK] Seq=1 Ack=1497233 Win=967680 Len=0 TSval=1023719961 TSecr=1378792185
331,12.54184,192.168.2.2,192.168.1.2,TCP,66,964096,5001  >  45098 [ACK] Seq=1 Ack=1562393 Win=964096 Len=0 TSval=1023720446 TSecr=1378792185
336,13.087296,192.168.2.2,192.168.1.2,TCP,66,964096,5001  >  45098 [ACK] Seq=1 Ack=1627553 Win=964096 Len=0 TSval=1023720991 TSecr=1378792185
341,13.631831,192.168.2.2,192.168.1.2,TCP,66,984064,5001  >  45098 [ACK] Seq=1 Ack=1653617 Win=984064 Len=0 TSval=1023721535 TSecr=1378792186
344,13.850678,192.168.2.2,192.168.1.2,TCP,66,993792,5001  >  45098 [ACK] Seq=1 Ack=1659409 Win=993792 Len=0 TSval=1023721754 TSecr=1378792210
346,13.899309,192.168.2.2,192.168.1.2,TCP,66,979968,5001  >  45098 [ACK] Seq=1 Ack=1692713 Win=979968 Len=0 TSval=1023721802 TSecr=1378792233
348,14.178078,192.168.2.2,192.168.1.2,TCP,66,964096,5001  >  45098 [ACK] Seq=1 Ack=1757873 Win=964096 Len=0 TSval=1023722081 TSecr=1378792234
350,14.723025,192.168.2.2,192.168.1.2,TCP,66,988160,5001  >  45098 [ACK] Seq=1 Ack=1775249 Win=988160 Len=0 TSval=1023722626 TSecr=1378792234
351,14.868663,192.168.2.2,192.168.1.2,TCP,66,972800,5001  >  45098 [ACK] Seq=1 Ack=1823033 Win=972800 Len=0 TSval=1023722771 TSecr=1378792718
353,15.268506,192.168.2.2,192.168.1.2,TCP,66,964096,5001  >  45098 [ACK] Seq=1 Ack=1888193 Win=964096 Len=0 TSval=1023723171 TSecr=1378792718
354,15.813334,192.168.2.2,192.168.1.2,TCP,66,988160,5001  >  45098 [ACK] Seq=1 Ack=1905569 Win=988160 Len=0 TSval=1023723716 TSecr=1378792718
356,15.959827,192.168.2.2,192.168.1.2,TCP,66,972800,5001  >  45098 [ACK] Seq=1 Ack=1953353 Win=972800 Len=0 TSval=1023723862 TSecr=1378793263
358,16.3593,192.168.2.2,192.168.1.2,TCP,66,964096,5001  >  45098 [ACK] Seq=1 Ack=2018513 Win=964096 Len=0 TSval=1023724261 TSecr=1378793263
359,16.904754,192.168.2.2,192.168.1.2,TCP,66,1030656,5001  >  45098 [ACK] Seq=1 Ack=2035889 Win=1030656 Len=0 TSval=1023724806 TSecr=1378793760
360,17.04975,192.168.2.2,192.168.1.2,TCP,66,1126400,5001  >  45098 [ACK] Seq=1 Ack=2083673 Win=1126400 Len=0 TSval=1023724951 TSecr=1378793807
365,17.449352,192.168.2.2,192.168.1.2,TCP,66,1158144,5001  >  45098 [ACK] Seq=1 Ack=2099601 Win=1158144 Len=0 TSval=1023725351 TSecr=1378794026
380,17.584811,192.168.2.2,192.168.1.2,TCP,66,1161216,5001  >  45098 [ACK] Seq=1 Ack=2101049 Win=1161216 Len=0 TSval=1023725486 TSecr=1378797223
381,17.597134,192.168.2.2,192.168.1.2,TCP,66,1164288,5001  >  45098 [ACK] Seq=1 Ack=2102497 Win=1164288 Len=0 TSval=1023725498 TSecr=1378797233
382,17.609875,192.168.2.2,192.168.1.2,TCP,66,1166848,5001  >  45098 [ACK] Seq=1 Ack=2103945 Win=1166848 Len=0 TSval=1023725511 TSecr=1378797243
385,17.621911,192.168.2.2,192.168.1.2,TCP,66,1169920,5001  >  45098 [ACK] Seq=1 Ack=2105393 Win=1169920 Len=0 TSval=1023725523 TSecr=1378797623
387,17.63403,192.168.2.2,192.168.1.2,TCP,66,1172992,5001  >  45098 [ACK] Seq=1 Ack=2106841 Win=1172992 Len=0 TSval=1023725535 TSecr=1378797633
389,17.647043,192.168.2.2,192.168.1.2,TCP,66,1175552,5001  >  45098 [ACK] Seq=1 Ack=2108289 Win=1175552 Len=0 TSval=1023725548 TSecr=1378797643
391,17.658879,192.168.2.2,192.168.1.2,TCP,66,1178624,5001  >  45098 [ACK] Seq=1 Ack=2109737 Win=1178624 Len=0 TSval=1023725560 TSecr=1378797654
393,17.670386,192.168.2.2,192.168.1.2,TCP,66,1181696,5001  >  45098 [ACK] Seq=1 Ack=2111185 Win=1181696 Len=0 TSval=1023725572 TSecr=1378797664
395,17.683308,192.168.2.2,192.168.1.2,TCP,66,1184256,5001  >  45098 [ACK] Seq=1 Ack=2112633 Win=1184256 Len=0 TSval=1023725585 TSecr=1378797674
397,17.695241,192.168.2.2,192.168.1.2,TCP,66,1187328,5001  >  45098 [ACK] Seq=1 Ack=2114081 Win=1187328 Len=0 TSval=1023725596 TSecr=1378797684
399,17.706894,192.168.2.2,192.168.1.2,TCP,66,1190400,5001  >  45098 [ACK] Seq=1 Ack=2115529 Win=1190400 Len=0 TSval=1023725608 TSecr=1378797695
401,17.718832,192.168.2.2,192.168.1.2,TCP,66,1192960,5001  >  45098 [ACK] Seq=1 Ack=2116977 Win=1192960 Len=0 TSval=1023725620 TSecr=1378797705
403,17.730938,192.168.2.2,192.168.1.2,TCP,66,1196032,5001  >  45098 [ACK] Seq=1 Ack=2118425 Win=1196032 Len=0 TSval=1023725632 TSecr=1378797716
405,17.743108,192.168.2.2,192.168.1.2,TCP,66,1199104,5001  >  45098 [ACK] Seq=1 Ack=2119873 Win=1199104 Len=0 TSval=1023725644 TSecr=1378797726
407,17.755181,192.168.2.2,192.168.1.2,TCP,66,1201664,5001  >  45098 [ACK] Seq=1 Ack=2121321 Win=1201664 Len=0 TSval=1023725656 TSecr=1378797783
409,17.767278,192.168.2.2,192.168.1.2,TCP,66,1204736,5001  >  45098 [ACK] Seq=1 Ack=2122769 Win=1204736 Len=0 TSval=1023725668 TSecr=1378797795
411,17.779478,192.168.2.2,192.168.1.2,TCP,66,1207296,5001  >  45098 [ACK] Seq=1 Ack=2124217 Win=1207296 Len=0 TSval=1023725681 TSecr=1378797807
413,17.791488,192.168.2.2,192.168.1.2,TCP,66,1210368,5001  >  45098 [ACK] Seq=1 Ack=2125665 Win=1210368 Len=0 TSval=1023725693 TSecr=1378797820
415,17.803605,192.168.2.2,192.168.1.2,TCP,66,1213440,5001  >  45098 [ACK] Seq=1 Ack=2127113 Win=1213440 Len=0 TSval=1023725705 TSecr=1378797832
417,17.816102,192.168.2.2,192.168.1.2,TCP,66,1216000,5001  >  45098 [ACK] Seq=1 Ack=2128561 Win=1216000 Len=0 TSval=1023725717 TSecr=1378797844
418,17.827902,192.168.2.2,192.168.1.2,TCP,66,1219072,5001  >  45098 [ACK] Seq=1 Ack=2130009 Win=1219072 Len=0 TSval=1023725729 TSecr=1378797857
419,17.840716,192.168.2.2,192.168.1.2,TCP,66,1222144,5001  >  45098 [ACK] Seq=1 Ack=2131457 Win=1222144 Len=0 TSval=1023725742 TSecr=1378797869
420,17.852468,192.168.2.2,192.168.1.2,TCP,66,1224704,5001  >  45098 [ACK] Seq=1 Ack=2132905 Win=1224704 Len=0 TSval=1023725754 TSecr=1378797880
422,17.864163,192.168.2.2,192.168.1.2,TCP,66,1227776,5001  >  45098 [ACK] Seq=1 Ack=2134353 Win=1227776 Len=0 TSval=1023725765 TSecr=1378797892
424,17.876976,192.168.2.2,192.168.1.2,TCP,66,1230848,5001  >  45098 [ACK] Seq=1 Ack=2135801 Win=1230848 Len=0 TSval=1023725778 TSecr=1378797904
426,17.888713,192.168.2.2,192.168.1.2,TCP,66,1233408,5001  >  45098 [ACK] Seq=1 Ack=2137249 Win=1233408 Len=0 TSval=1023725790 TSecr=1378797916
428,17.900502,192.168.2.2,192.168.1.2,TCP,66,1236480,5001  >  45098 [ACK] Seq=1 Ack=2138697 Win=1236480 Len=0 TSval=1023725802 TSecr=1378797928
430,17.913223,192.168.2.2,192.168.1.2,TCP,66,1239552,5001  >  45098 [ACK] Seq=1 Ack=2140145 Win=1239552 Len=0 TSval=1023725814 TSecr=1378797941
432,17.924742,192.168.2.2,192.168.1.2,TCP,66,1245184,5001  >  45098 [ACK] Seq=1 Ack=2143041 Win=1245184 Len=0 TSval=1023725826 TSecr=1378797953
435,17.948953,192.168.2.2,192.168.1.2,TCP,66,1250816,5001  >  45098 [ACK] Seq=1 Ack=2145937 Win=1250816 Len=0 TSval=1023725850 TSecr=1378797970
438,17.973924,192.168.2.2,192.168.1.2,TCP,66,1256960,5001  >  45098 [ACK] Seq=1 Ack=2148833 Win=1256960 Len=0 TSval=1023725875 TSecr=1378797988
441,17.997431,192.168.2.2,192.168.1.2,TCP,66,1259520,5001  >  45098 [ACK] Seq=1 Ack=2150281 Win=1259520 Len=0 TSval=1023725899 TSecr=1378798026
443,18.009555,192.168.2.2,192.168.1.2,TCP,66,1262592,5001  >  45098 [ACK] Seq=1 Ack=2151729 Win=1262592 Len=0 TSval=1023725911 TSecr=1378798040
445,18.02162,192.168.2.2,192.168.1.2,TCP,66,1265664,5001  >  45098 [ACK] Seq=1 Ack=2153177 Win=1265664 Len=0 TSval=1023725923 TSecr=1378798055
447,18.033738,192.168.2.2,192.168.1.2,TCP,66,1268224,5001  >  45098 [ACK] Seq=1 Ack=2154625 Win=1268224 Len=0 TSval=1023725935 TSecr=1378798067
449,18.045867,192.168.2.2,192.168.1.2,TCP,66,1271296,5001  >  45098 [ACK] Seq=1 Ack=2156073 Win=1271296 Len=0 TSval=1023725947 TSecr=1378798078
451,18.057961,192.168.2.2,192.168.1.2,TCP,66,1274368,5001  >  45098 [ACK] Seq=1 Ack=2157521 Win=1274368 Len=0 TSval=1023725959 TSecr=1378798089
453,18.070074,192.168.2.2,192.168.1.2,TCP,66,1276928,5001  >  45098 [ACK] Seq=1 Ack=2158969 Win=1276928 Len=0 TSval=1023725971 TSecr=1378798100
456,18.082174,192.168.2.2,192.168.1.2,TCP,66,1280000,5001  >  45098 [ACK] Seq=1 Ack=2160417 Win=1280000 Len=0 TSval=1023725983 TSecr=1378798111
458,18.094446,192.168.2.2,192.168.1.2,TCP,66,1283072,5001  >  45098 [ACK] Seq=1 Ack=2161865 Win=1283072 Len=0 TSval=1023725995 TSecr=1378798122
460,18.106425,192.168.2.2,192.168.1.2,TCP,66,1285632,5001  >  45098 [ACK] Seq=1 Ack=2163313 Win=1285632 Len=0 TSval=1023726007 TSecr=1378798133
462,18.118526,192.168.2.2,192.168.1.2,TCP,66,1288704,5001  >  45098 [ACK] Seq=1 Ack=2164761 Win=1288704 Len=0 TSval=1023726020 TSecr=1378798147
464,18.130738,192.168.2.2,192.168.1.2,TCP,66,1291776,5001  >  45098 [ACK] Seq=1 Ack=2166209 Win=1291776 Len=0 TSval=1023726032 TSecr=1378798158
466,18.142747,192.168.2.2,192.168.1.2,TCP,66,1294336,5001  >  45098 [ACK] Seq=1 Ack=2167657 Win=1294336 Len=0 TSval=1023726044 TSecr=1378798171
468,18.154856,192.168.2.2,192.168.1.2,TCP,66,1297408,5001  >  45098 [ACK] Seq=1 Ack=2169105 Win=1297408 Len=0 TSval=1023726056 TSecr=1378798183
470,18.167019,192.168.2.2,192.168.1.2,TCP,66,1299968,5001  >  45098 [ACK] Seq=1 Ack=2170553 Win=1299968 Len=0 TSval=1023726068 TSecr=1378798195
472,18.179784,192.168.2.2,192.168.1.2,TCP,66,1303040,5001  >  45098 [ACK] Seq=1 Ack=2172001 Win=1303040 Len=0 TSval=1023726081 TSecr=1378798207
474,18.191559,192.168.2.2,192.168.1.2,TCP,66,1306112,5001  >  45098 [ACK] Seq=1 Ack=2173449 Win=1306112 Len=0 TSval=1023726093 TSecr=1378798219
476,18.203293,192.168.2.2,192.168.1.2,TCP,66,1308672,5001  >  45098 [ACK] Seq=1 Ack=2174897 Win=1308672 Len=0 TSval=1023726104 TSecr=1378798231
477,18.216094,192.168.2.2,192.168.1.2,TCP,66,1311744,5001  >  45098 [ACK] Seq=1 Ack=2176345 Win=1311744 Len=0 TSval=1023726117 TSecr=1378798243
479,18.228285,192.168.2.2,192.168.1.2,TCP,66,1314816,5001  >  45098 [ACK] Seq=1 Ack=2177793 Win=1314816 Len=0 TSval=1023726129 TSecr=1378798255
480,18.240568,192.168.2.2,192.168.1.2,TCP,66,1317376,5001  >  45098 [ACK] Seq=1 Ack=2179241 Win=1317376 Len=0 TSval=1023726142 TSecr=1378798268
482,18.253338,192.168.2.2,192.168.1.2,TCP,66,1320448,5001  >  45098 [ACK] Seq=1 Ack=2180689 Win=1320448 Len=0 TSval=1023726154 TSecr=1378798279
484,18.265059,192.168.2.2,192.168.1.2,TCP,66,1323520,5001  >  45098 [ACK] Seq=1 Ack=2182137 Win=1323520 Len=0 TSval=1023726166 TSecr=1378798292
486,18.27688,192.168.2.2,192.168.1.2,TCP,66,1326080,5001  >  45098 [ACK] Seq=1 Ack=2183585 Win=1326080 Len=0 TSval=1023726178 TSecr=1378798304
488,18.289588,192.168.2.2,192.168.1.2,TCP,66,1329152,5001  >  45098 [ACK] Seq=1 Ack=2185033 Win=1329152 Len=0 TSval=1023726191 TSecr=1378798316
490,18.300982,192.168.2.2,192.168.1.2,TCP,66,1332224,5001  >  45098 [ACK] Seq=1 Ack=2186481 Win=1332224 Len=0 TSval=1023726202 TSecr=1378798328
492,18.313156,192.168.2.2,192.168.1.2,TCP,66,1337856,5001  >  45098 [ACK] Seq=1 Ack=2189377 Win=1337856 Len=0 TSval=1023726214 TSecr=1378798340
495,18.337586,192.168.2.2,192.168.1.2,TCP,66,1343488,5001  >  45098 [ACK] Seq=1 Ack=2192273 Win=1343488 Len=0 TSval=1023726238 TSecr=1378798358
498,18.362057,192.168.2.2,192.168.1.2,TCP,66,1349632,5001  >  45098 [ACK] Seq=1 Ack=2195169 Win=1349632 Len=0 TSval=1023726263 TSecr=1378798375
501,18.385779,192.168.2.2,192.168.1.2,TCP,66,1352192,5001  >  45098 [ACK] Seq=1 Ack=2196617 Win=1352192 Len=0 TSval=1023726287 TSecr=1378798414
503,18.39788,192.168.2.2,192.168.1.2,TCP,66,1355264,5001  >  45098 [ACK] Seq=1 Ack=2198065 Win=1355264 Len=0 TSval=1023726299 TSecr=1378798428
505,18.410063,192.168.2.2,192.168.1.2,TCP,66,1358336,5001  >  45098 [ACK] Seq=1 Ack=2199513 Win=1358336 Len=0 TSval=1023726311 TSecr=1378798444
507,18.4221,192.168.2.2,192.168.1.2,TCP,66,1360896,5001  >  45098 [ACK] Seq=1 Ack=2200961 Win=1360896 Len=0 TSval=1023726323 TSecr=1378798456
509,18.434214,192.168.2.2,192.168.1.2,TCP,66,1363968,5001  >  45098 [ACK] Seq=1 Ack=2202409 Win=1363968 Len=0 TSval=1023726335 TSecr=1378798467
511,18.446306,192.168.2.2,192.168.1.2,TCP,66,1367040,5001  >  45098 [ACK] Seq=1 Ack=2203857 Win=1367040 Len=0 TSval=1023726347 TSecr=1378798478
513,18.458616,192.168.2.2,192.168.1.2,TCP,66,1369600,5001  >  45098 [ACK] Seq=1 Ack=2205305 Win=1369600 Len=0 TSval=1023726359 TSecr=1378798490
515,18.470552,192.168.2.2,192.168.1.2,TCP,66,1372672,5001  >  45098 [ACK] Seq=1 Ack=2206753 Win=1372672 Len=0 TSval=1023726371 TSecr=1378798502
517,18.482683,192.168.2.2,192.168.1.2,TCP,66,1375744,5001  >  45098 [ACK] Seq=1 Ack=2208201 Win=1375744 Len=0 TSval=1023726384 TSecr=1378798513
519,18.494818,192.168.2.2,192.168.1.2,TCP,66,1378304,5001  >  45098 [ACK] Seq=1 Ack=2209649 Win=1378304 Len=0 TSval=1023726396 TSecr=1378798524
521,18.50688,192.168.2.2,192.168.1.2,TCP,66,1381376,5001  >  45098 [ACK] Seq=1 Ack=2211097 Win=1381376 Len=0 TSval=1023726408 TSecr=1378798535
523,18.518982,192.168.2.2,192.168.1.2,TCP,66,1384448,5001  >  45098 [ACK] Seq=1 Ack=2212545 Win=1384448 Len=0 TSval=1023726420 TSecr=1378798547
525,18.531151,192.168.2.2,192.168.1.2,TCP,66,1387008,5001  >  45098 [ACK] Seq=1 Ack=2213993 Win=1387008 Len=0 TSval=1023726432 TSecr=1378798559
527,18.54321,192.168.2.2,192.168.1.2,TCP,66,1390080,5001  >  45098 [ACK] Seq=1 Ack=2215441 Win=1390080 Len=0 TSval=1023726444 TSecr=1378798571
529,18.555321,192.168.2.2,192.168.1.2,TCP,66,1392640,5001  >  45098 [ACK] Seq=1 Ack=2216889 Win=1392640 Len=0 TSval=1023726456 TSecr=1378798583
531,18.567651,192.168.2.2,192.168.1.2,TCP,66,1395712,5001  >  45098 [ACK] Seq=1 Ack=2218337 Win=1395712 Len=0 TSval=1023726468 TSecr=1378798595
533,18.579784,192.168.2.2,192.168.1.2,TCP,66,1398784,5001  >  45098 [ACK] Seq=1 Ack=2219785 Win=1398784 Len=0 TSval=1023726481 TSecr=1378798607
535,18.591722,192.168.2.2,192.168.1.2,TCP,66,1401344,5001  >  45098 [ACK] Seq=1 Ack=2221233 Win=1401344 Len=0 TSval=1023726493 TSecr=1378798619
536,18.603773,192.168.2.2,192.168.1.2,TCP,66,1404416,5001  >  45098 [ACK] Seq=1 Ack=2222681 Win=1404416 Len=0 TSval=1023726505 TSecr=1378798632
537,18.616375,192.168.2.2,192.168.1.2,TCP,66,1407488,5001  >  45098 [ACK] Seq=1 Ack=2224129 Win=1407488 Len=0 TSval=1023726517 TSecr=1378798643
538,18.62814,192.168.2.2,192.168.1.2,TCP,66,1410048,5001  >  45098 [ACK] Seq=1 Ack=2225577 Win=1410048 Len=0 TSval=1023726529 TSecr=1378798656
540,18.640101,192.168.2.2,192.168.1.2,TCP,66,1413120,5001  >  45098 [ACK] Seq=1 Ack=2227025 Win=1413120 Len=0 TSval=1023726541 TSecr=1378798668
542,18.652679,192.168.2.2,192.168.1.2,TCP,66,1416192,5001  >  45098 [ACK] Seq=1 Ack=2228473 Win=1416192 Len=0 TSval=1023726553 TSecr=1378798680
544,18.664386,192.168.2.2,192.168.1.2,TCP,66,1418752,5001  >  45098 [ACK] Seq=1 Ack=2229921 Win=1418752 Len=0 TSval=1023726565 TSecr=1378798692
546,18.67644,192.168.2.2,192.168.1.2,TCP,66,1421824,5001  >  45098 [ACK] Seq=1 Ack=2231369 Win=1421824 Len=0 TSval=1023726577 TSecr=1378798704
548,18.688877,192.168.2.2,192.168.1.2,TCP,66,1424896,5001  >  45098 [ACK] Seq=1 Ack=2232817 Win=1424896 Len=0 TSval=1023726590 TSecr=1378798716
550,18.700662,192.168.2.2,192.168.1.2,TCP,66,1430528,5001  >  45098 [ACK] Seq=1 Ack=2235713 Win=1430528 Len=0 TSval=1023726601 TSecr=1378798728
553,18.725185,192.168.2.2,192.168.1.2,TCP,66,1436160,5001  >  45098 [ACK] Seq=1 Ack=2238609 Win=1436160 Len=0 TSval=1023726626 TSecr=1378798746
556,18.749124,192.168.2.2,192.168.1.2,TCP,66,1442304,5001  >  45098 [ACK] Seq=1 Ack=2241505 Win=1442304 Len=0 TSval=1023726650 TSecr=1378798764
559,18.774138,192.168.2.2,192.168.1.2,TCP,66,1444864,5001  >  45098 [ACK] Seq=1 Ack=2242953 Win=1444864 Len=0 TSval=1023726675 TSecr=1378798801
561,18.785464,192.168.2.2,192.168.1.2,TCP,66,1447936,5001  >  45098 [ACK] Seq=1 Ack=2244401 Win=1447936 Len=0 TSval=1023726686 TSecr=1378798816
563,18.797577,192.168.2.2,192.168.1.2,TCP,66,1451008,5001  >  45098 [ACK] Seq=1 Ack=2245849 Win=1451008 Len=0 TSval=1023726698 TSecr=1378798830
565,18.809674,192.168.2.2,192.168.1.2,TCP,66,1453568,5001  >  45098 [ACK] Seq=1 Ack=2247297 Win=1453568 Len=0 TSval=1023726710 TSecr=1378798842
567,18.821775,192.168.2.2,192.168.1.2,TCP,66,1456640,5001  >  45098 [ACK] Seq=1 Ack=2248745 Win=1456640 Len=0 TSval=1023726722 TSecr=1378798853
569,18.833893,192.168.2.2,192.168.1.2,TCP,66,1459712,5001  >  45098 [ACK] Seq=1 Ack=2250193 Win=1459712 Len=0 TSval=1023726735 TSecr=1378798865
571,18.846682,192.168.2.2,192.168.1.2,TCP,66,1462272,5001  >  45098 [ACK] Seq=1 Ack=2251641 Win=1462272 Len=0 TSval=1023726747 TSecr=1378798876
573,18.858508,192.168.2.2,192.168.1.2,TCP,66,1465344,5001  >  45098 [ACK] Seq=1 Ack=2253089 Win=1465344 Len=0 TSval=1023726759 TSecr=1378798888
575,18.870232,192.168.2.2,192.168.1.2,TCP,66,1468416,5001  >  45098 [ACK] Seq=1 Ack=2254537 Win=1468416 Len=0 TSval=1023726771 TSecr=1378798899
577,18.882396,192.168.2.2,192.168.1.2,TCP,66,1470976,5001  >  45098 [ACK] Seq=1 Ack=2255985 Win=1470976 Len=0 TSval=1023726783 TSecr=1378798910
579,18.894446,192.168.2.2,192.168.1.2,TCP,66,1474048,5001  >  45098 [ACK] Seq=1 Ack=2257433 Win=1474048 Len=0 TSval=1023726795 TSecr=1378798922
581,18.90659,192.168.2.2,192.168.1.2,TCP,66,1477120,5001  >  45098 [ACK] Seq=1 Ack=2258881 Win=1477120 Len=0 TSval=1023726807 TSecr=1378798933
583,18.918686,192.168.2.2,192.168.1.2,TCP,66,1479680,5001  >  45098 [ACK] Seq=1 Ack=2260329 Win=1479680 Len=0 TSval=1023726819 TSecr=1378798947
585,18.931012,192.168.2.2,192.168.1.2,TCP,66,1482752,5001  >  45098 [ACK] Seq=1 Ack=2261777 Win=1482752 Len=0 TSval=1023726832 TSecr=1378798958
587,18.942932,192.168.2.2,192.168.1.2,TCP,66,1485312,5001  >  45098 [ACK] Seq=1 Ack=2263225 Win=1485312 Len=0 TSval=1023726844 TSecr=1378798970
589,18.955453,192.168.2.2,192.168.1.2,TCP,66,1488384,5001  >  45098 [ACK] Seq=1 Ack=2264673 Win=1488384 Len=0 TSval=1023726856 TSecr=1378798982
591,18.967263,192.168.2.2,192.168.1.2,TCP,66,1491456,5001  >  45098 [ACK] Seq=1 Ack=2266121 Win=1491456 Len=0 TSval=1023726868 TSecr=1378798994
593,18.979208,192.168.2.2,192.168.1.2,TCP,66,1494016,5001  >  45098 [ACK] Seq=1 Ack=2267569 Win=1494016 Len=0 TSval=1023726880 TSecr=1378799007
594,18.991731,192.168.2.2,192.168.1.2,TCP,66,1497088,5001  >  45098 [ACK] Seq=1 Ack=2269017 Win=1497088 Len=0 TSval=1023726892 TSecr=1378799019
595,19.003488,192.168.2.2,192.168.1.2,TCP,66,1500160,5001  >  45098 [ACK] Seq=1 Ack=2270465 Win=1500160 Len=0 TSval=1023726904 TSecr=1378799031
596,19.015687,192.168.2.2,192.168.1.2,TCP,66,1502720,5001  >  45098 [ACK] Seq=1 Ack=2271913 Win=1502720 Len=0 TSval=1023726916 TSecr=1378799043
598,19.028437,192.168.2.2,192.168.1.2,TCP,66,1505792,5001  >  45098 [ACK] Seq=1 Ack=2273361 Win=1505792 Len=0 TSval=1023726929 TSecr=1378799055
600,19.04023,192.168.2.2,192.168.1.2,TCP,66,1508864,5001  >  45098 [ACK] Seq=1 Ack=2274809 Win=1508864 Len=0 TSval=1023726941 TSecr=1378799067
602,19.052035,192.168.2.2,192.168.1.2,TCP,66,1511424,5001  >  45098 [ACK] Seq=1 Ack=2276257 Win=1511424 Len=0 TSval=1023726953 TSecr=1378799079
604,19.064752,192.168.2.2,192.168.1.2,TCP,66,1514496,5001  >  45098 [ACK] Seq=1 Ack=2277705 Win=1514496 Len=0 TSval=1023726965 TSecr=1378799091
607,19.076531,192.168.2.2,192.168.1.2,TCP,66,1517568,5001  >  45098 [ACK] Seq=1 Ack=2279153 Win=1517568 Len=0 TSval=1023726977 TSecr=1378799104
609,19.08825,192.168.2.2,192.168.1.2,TCP,66,1517568,5001  >  45098 [ACK] Seq=1 Ack=2282049 Win=1517568 Len=0 TSval=1023726989 TSecr=1378799116
612,19.112845,192.168.2.2,192.168.1.2,TCP,66,1517568,5001  >  45098 [ACK] Seq=1 Ack=2284945 Win=1517568 Len=0 TSval=1023727013 TSecr=1378799134
615,19.136709,192.168.2.2,192.168.1.2,TCP,66,1517568,5001  >  45098 [ACK] Seq=1 Ack=2287841 Win=1517568 Len=0 TSval=1023727037 TSecr=1378799152
618,19.161037,192.168.2.2,192.168.1.2,TCP,66,1518592,5001  >  45098 [ACK] Seq=1 Ack=2289289 Win=1518592 Len=0 TSval=1023727062 TSecr=1378799188
620,19.173068,192.168.2.2,192.168.1.2,TCP,66,1518592,5001  >  45098 [ACK] Seq=1 Ack=2290737 Win=1518592 Len=0 TSval=1023727074 TSecr=1378799203
622,19.185153,192.168.2.2,192.168.1.2,TCP,66,1518592,5001  >  45098 [ACK] Seq=1 Ack=2292185 Win=1518592 Len=0 TSval=1023727086 TSecr=1378799218
624,19.197306,192.168.2.2,192.168.1.2,TCP,66,1518592,5001  >  45098 [ACK] Seq=1 Ack=2293633 Win=1518592 Len=0 TSval=1023727098 TSecr=1378799229
626,19.209395,192.168.2.2,192.168.1.2,TCP,66,1518592,5001  >  45098 [ACK] Seq=1 Ack=2295081 Win=1518592 Len=0 TSval=1023727110 TSecr=1378799240
629,19.222305,192.168.2.2,192.168.1.2,TCP,66,1518592,5001  >  45098 [ACK] Seq=1 Ack=2296529 Win=1518592 Len=0 TSval=1023727123 TSecr=1378799252
631,19.234391,192.168.2.2,192.168.1.2,TCP,66,1518592,5001  >  45098 [ACK] Seq=1 Ack=2297977 Win=1518592 Len=0 TSval=1023727135 TSecr=1378799264
633,19.247023,192.168.2.2,192.168.1.2,TCP,66,1518592,5001  >  45098 [ACK] Seq=1 Ack=2299425 Win=1518592 Len=0 TSval=1023727147 TSecr=1378799275
