No.,Time,Source,Destination,Protocol,Length,Calculated window size,Info
4,0.001456,192.168.2.2,192.168.1.2,TCP,74,43440,"5001  >  45086 [SYN, ACK] Seq=0 Ack=1 Win=43440 Len=0 MSS=1460 SACK_PERM=1 TSval=1023550654 TSecr=1378622926 WS=512"
7,0.001514,192.168.2.2,192.168.1.2,TCP,66,39936,5001  >  45086 [ACK] Seq=1 Ack=7241 Win=39936 Len=0 TSval=1023550654 TSecr=1378622926
12,0.05038,192.168.2.2,192.168.1.2,TCP,66,38400,5001  >  45086 [ACK] Seq=1 Ack=17377 Win=38400 Len=0 TSval=1023550703 TSecr=1378622927
15,0.135697,192.168.2.2,192.168.1.2,TCP,66,38400,5001  >  45086 [ACK] Seq=1 Ack=27513 Win=38400 Len=0 TSval=1023550788 TSecr=1378622927
19,0.219934,192.168.2.2,192.168.1.2,TCP,66,42496,5001  >  45086 [ACK] Seq=1 Ack=28961 Win=42496 Len=0 TSval=1023550872 TSecr=1378622927
21,0.232056,192.168.2.2,192.168.1.2,TCP,66,42496,5001  >  45086 [ACK] Seq=1 Ack=30409 Win=42496 Len=0 TSval=1023550885 TSecr=1378622942
24,0.244154,192.168.2.2,192.168.1.2,TCP,66,35328,5001  >  45086 [ACK] Seq=1 Ack=46337 Win=35328 Len=0 TSval=1023550897 TSecr=1378622975
26,0.377747,192.168.2.2,192.168.1.2,TCP,66,41984,5001  >  45086 [ACK] Seq=1 Ack=49233 Win=41984 Len=0 TSval=1023551030 TSecr=1378623001
29,0.402217,192.168.2.2,192.168.1.2,TCP,66,45568,5001  >  45086 [ACK] Seq=1 Ack=50681 Win=45568 Len=0 TSval=1023551055 TSecr=1378623060
31,0.413982,192.168.2.2,192.168.1.2,TCP,66,75776,5001  >  45086 [ACK] Seq=1 Ack=65913 Win=75776 Len=0 TSval=1023551066 TSecr=1378623061
35,0.541418,192.168.2.2,192.168.1.2,TCP,78,75776,[TCP Dup ACK 31#1] 5001  >  45086 [ACK] Seq=1 Ack=65913 Win=75776 Len=0 TSval=1023551194 TSecr=1378623117 SLE=65161 SRE=65913
37,0.548257,192.168.2.2,192.168.1.2,TCP,66,84480,5001  >  45086 [ACK] Seq=1 Ack=70257 Win=84480 Len=0 TSval=1023551201 TSecr=1378623145
39,0.584546,192.168.2.2,192.168.1.2,TCP,66,87552,5001  >  45086 [ACK] Seq=1 Ack=71705 Win=87552 Len=0 TSval=1023551237 TSecr=1378623157
41,0.596384,192.168.2.2,192.168.1.2,TCP,66,90112,5001  >  45086 [ACK] Seq=1 Ack=72401 Win=90112 Len=0 TSval=1023551249 TSecr=1378623157
44,0.602483,192.168.2.2,192.168.1.2,TCP,66,93184,5001  >  45086 [ACK] Seq=1 Ack=81089 Win=93184 Len=0 TSval=1023551255 TSecr=1378623169
46,0.675669,192.168.2.2,192.168.1.2,TCP,66,93184,5001  >  45086 [ACK] Seq=1 Ack=89777 Win=93184 Len=0 TSval=1023551328 TSecr=1378623302
49,0.748188,192.168.2.2,192.168.1.2,TCP,66,95232,5001  >  45086 [ACK] Seq=1 Ack=94121 Win=95232 Len=0 TSval=1023551400 TSecr=1378623327
51,0.78447,192.168.2.2,192.168.1.2,TCP,66,86528,5001  >  45086 [ACK] Seq=1 Ack=115841 Win=86528 Len=0 TSval=1023551437 TSecr=1378623338
54,0.965994,192.168.2.2,192.168.1.2,TCP,66,86528,5001  >  45086 [ACK] Seq=1 Ack=137561 Win=86528 Len=0 TSval=1023551618 TSecr=1378623339
57,1.148223,192.168.2.2,192.168.1.2,TCP,66,101376,5001  >  45086 [ACK] Seq=1 Ack=140457 Win=101376 Len=0 TSval=1023551800 TSecr=1378623466
59,1.17245,192.168.2.2,192.168.1.2,TCP,66,127488,5001  >  45086 [ACK] Seq=1 Ack=153489 Win=127488 Len=0 TSval=1023551825 TSecr=1378623473
63,1.281481,192.168.2.2,192.168.1.2,TCP,66,135680,5001  >  45086 [ACK] Seq=1 Ack=157833 Win=135680 Len=0 TSval=1023551933 TSecr=1378623509
66,1.31784,192.168.2.2,192.168.1.2,TCP,66,138752,5001  >  45086 [ACK] Seq=1 Ack=159281 Win=138752 Len=0 TSval=1023551970 TSecr=1378623521
68,1.329906,192.168.2.2,192.168.1.2,TCP,66,144384,5001  >  45086 [ACK] Seq=1 Ack=162177 Win=144384 Len=0 TSval=1023551982 TSecr=1378623521
70,1.354873,192.168.2.2,192.168.1.2,TCP,66,168960,5001  >  45086 [ACK] Seq=1 Ack=174273 Win=168960 Len=0 TSval=1023552007 TSecr=1378623527
73,1.45578,192.168.2.2,192.168.1.2,TCP,66,180224,5001  >  45086 [ACK] Seq=1 Ack=180065 Win=180224 Len=0 TSval=1023552108 TSecr=1378623600
77,1.513274,192.168.2.2,192.168.1.2,TCP,66,183296,5001  >  45086 [ACK] Seq=1 Ack=181001 Win=183296 Len=0 TSval=1023552165 TSecr=1378623600
79,1.513276,192.168.2.2,192.168.1.2,TCP,66,197632,5001  >  45086 [ACK] Seq=1 Ack=188241 Win=197632 Len=0 TSval=1023552165 TSecr=1378623673
82,1.573391,192.168.2.2,192.168.1.2,TCP,66,223744,5001  >  45086 [ACK] Seq=1 Ack=201273 Win=223744 Len=0 TSval=1023552225 TSecr=1378623709
85,1.682178,192.168.2.2,192.168.1.2,TCP,66,226816,5001  >  45086 [ACK] Seq=1 Ack=202721 Win=226816 Len=0 TSval=1023552334 TSecr=1378623890
88,1.694552,192.168.2.2,192.168.1.2,TCP,66,270336,5001  >  45086 [ACK] Seq=1 Ack=224441 Win=270336 Len=0 TSval=1023552346 TSecr=1378624072
91,1.877226,192.168.2.2,192.168.1.2,TCP,66,304640,5001  >  45086 [ACK] Seq=1 Ack=246161 Win=304640 Len=0 TSval=1023552529 TSecr=1378624097
94,2.058938,192.168.2.2,192.168.1.2,TCP,66,304640,5001  >  45086 [ACK] Seq=1 Ack=267881 Win=304640 Len=0 TSval=1023552711 TSecr=1378624097
97,2.239816,192.168.2.2,192.168.1.2,TCP,66,304640,5001  >  45086 [ACK] Seq=1 Ack=289601 Win=304640 Len=0 TSval=1023552891 TSecr=1378624206
100,2.422137,192.168.2.2,192.168.1.2,TCP,66,310784,5001  >  45086 [ACK] Seq=1 Ack=292497 Win=310784 Len=0 TSval=1023553074 TSecr=1378624212
102,2.445616,192.168.2.2,192.168.1.2,TCP,66,313344,5001  >  45086 [ACK] Seq=1 Ack=296841 Win=313344 Len=0 TSval=1023553097 TSecr=1378624242
104,2.481937,192.168.2.2,192.168.1.2,TCP,66,311296,5001  >  45086 [ACK] Seq=1 Ack=305529 Win=311296 Len=0 TSval=1023553133 TSecr=1378624254
106,2.554534,192.168.2.2,192.168.1.2,TCP,66,312832,5001  >  45086 [ACK] Seq=1 Ack=311321 Win=312832 Len=0 TSval=1023553206 TSecr=1378624279
110,2.603419,192.168.2.2,192.168.1.2,TCP,66,304640,5001  >  45086 [ACK] Seq=1 Ack=333041 Win=304640 Len=0 TSval=1023553255 TSecr=1378624279
112,2.784738,192.168.2.2,192.168.1.2,TCP,66,304640,5001  >  45086 [ACK] Seq=1 Ack=354761 Win=304640 Len=0 TSval=1023553436 TSecr=1378624380
115,2.966368,192.168.2.2,192.168.1.2,TCP,66,310784,5001  >  45086 [ACK] Seq=1 Ack=364297 Win=310784 Len=0 TSval=1023553618 TSecr=1378624437
118,3.047596,192.168.2.2,192.168.1.2,TCP,66,309760,5001  >  45086 [ACK] Seq=1 Ack=375881 Win=309760 Len=0 TSval=1023553699 TSecr=1378624437
120,3.144497,192.168.2.2,192.168.1.2,TCP,66,315392,5001  >  45086 [ACK] Seq=1 Ack=376481 Win=315392 Len=0 TSval=1023553796 TSecr=1378624438
122,3.150266,192.168.2.2,192.168.1.2,TCP,66,304640,5001  >  45086 [ACK] Seq=1 Ack=398201 Win=304640 Len=0 TSval=1023553801 TSecr=1378624497
124,3.331722,192.168.2.2,192.168.1.2,TCP,66,307200,5001  >  45086 [ACK] Seq=1 Ack=415577 Win=307200 Len=0 TSval=1023553983 TSecr=1378624606
126,3.476904,192.168.2.2,192.168.1.2,TCP,66,313344,5001  >  45086 [ACK] Seq=1 Ack=419921 Win=313344 Len=0 TSval=1023554128 TSecr=1378624618
128,3.513942,192.168.2.2,192.168.1.2,TCP,66,315392,5001  >  45086 [ACK] Seq=1 Ack=437297 Win=315392 Len=0 TSval=1023554165 TSecr=1378624725
131,3.65993,192.168.2.2,192.168.1.2,TCP,66,315392,5001  >  45086 [ACK] Seq=1 Ack=441641 Win=315392 Len=0 TSval=1023554311 TSecr=1378624801
134,3.696378,192.168.2.2,192.168.1.2,TCP,66,315392,5001  >  45086 [ACK] Seq=1 Ack=463361 Win=315392 Len=0 TSval=1023554347 TSecr=1378624983
136,3.878477,192.168.2.2,192.168.1.2,TCP,66,315392,5001  >  45086 [ACK] Seq=1 Ack=485081 Win=315392 Len=0 TSval=1023554529 TSecr=1378625163
139,4.059756,192.168.2.2,192.168.1.2,TCP,78,315392,[TCP Dup ACK 136#1] 5001  >  45086 [ACK] Seq=1 Ack=485081 Win=315392 Len=0 TSval=1023554710 TSecr=1378625163 SLE=502457 SRE=505353
141,4.083965,192.168.2.2,192.168.1.2,TCP,78,315392,[TCP Dup ACK 136#2] 5001  >  45086 [ACK] Seq=1 Ack=485081 Win=315392 Len=0 TSval=1023554735 TSecr=1378625163 SLE=502457 SRE=506801
143,4.096082,192.168.2.2,192.168.1.2,TCP,78,315392,[TCP Dup ACK 136#3] 5001  >  45086 [ACK] Seq=1 Ack=485081 Win=315392 Len=0 TSval=1023554747 TSecr=1378625163 SLE=502457 SRE=518385
145,4.193153,192.168.2.2,192.168.1.2,TCP,78,315392,[TCP Dup ACK 136#4] 5001  >  45086 [ACK] Seq=1 Ack=485081 Win=315392 Len=0 TSval=1023554844 TSecr=1378625163 SLE=502457 SRE=524177
148,4.242072,192.168.2.2,192.168.1.2,TCP,78,315392,[TCP Dup ACK 136#5] 5001  >  45086 [ACK] Seq=1 Ack=485081 Win=315392 Len=0 TSval=1023554893 TSecr=1378625163 SLE=502457 SRE=528521
150,4.278361,192.168.2.2,192.168.1.2,TCP,78,315392,[TCP Dup ACK 136#6] 5001  >  45086 [ACK] Seq=1 Ack=485081 Win=315392 Len=0 TSval=1023554929 TSecr=1378625163 SLE=502457 SRE=550241
152,4.459638,192.168.2.2,192.168.1.2,TCP,86,315392,[TCP Dup ACK 136#7] 5001  >  45086 [ACK] Seq=1 Ack=485081 Win=315392 Len=0 TSval=1023555110 TSecr=1378625163 SLE=567617 SRE=577753 SLE=502457 SRE=550241
154,4.544219,192.168.2.2,192.168.1.2,TCP,86,315392,[TCP Dup ACK 136#8] 5001  >  45086 [ACK] Seq=1 Ack=485081 Win=315392 Len=0 TSval=1023555195 TSecr=1378625163 SLE=567617 SRE=589337 SLE=502457 SRE=550241
157,4.641921,192.168.2.2,192.168.1.2,TCP,86,315392,[TCP Dup ACK 136#9] 5001  >  45086 [ACK] Seq=1 Ack=485081 Win=315392 Len=0 TSval=1023555292 TSecr=1378625163 SLE=567617 SRE=590785 SLE=502457 SRE=550241
159,4.653254,192.168.2.2,192.168.1.2,TCP,86,315392,[TCP Dup ACK 136#10] 5001  >  45086 [ACK] Seq=1 Ack=485081 Win=315392 Len=0 TSval=1023555304 TSecr=1378625163 SLE=567617 SRE=595129 SLE=502457 SRE=550241
161,4.689936,192.168.2.2,192.168.1.2,TCP,86,315392,[TCP Dup ACK 136#11] 5001  >  45086 [ACK] Seq=1 Ack=485081 Win=315392 Len=0 TSval=1023555340 TSecr=1378625163 SLE=567617 SRE=629881 SLE=502457 SRE=550241
164,4.980264,192.168.2.2,192.168.1.2,TCP,86,315392,[TCP Dup ACK 136#12] 5001  >  45086 [ACK] Seq=1 Ack=485081 Win=315392 Len=0 TSval=1023555630 TSecr=1378625163 SLE=567617 SRE=634225 SLE=502457 SRE=550241
166,5.017278,192.168.2.2,192.168.1.2,TCP,86,315392,[TCP Dup ACK 136#13] 5001  >  45086 [ACK] Seq=1 Ack=485081 Win=315392 Len=0 TSval=1023555667 TSecr=1378625163 SLE=567617 SRE=640017 SLE=502457 SRE=550241
169,5.065697,192.168.2.2,192.168.1.2,TCP,86,315392,[TCP Dup ACK 136#14] 5001  >  45086 [ACK] Seq=1 Ack=485081 Win=315392 Len=0 TSval=1023555716 TSecr=1378625163 SLE=567617 SRE=655945 SLE=502457 SRE=550241
174,5.198575,192.168.2.2,192.168.1.2,TCP,86,315392,[TCP Dup ACK 136#15] 5001  >  45086 [ACK] Seq=1 Ack=485081 Win=315392 Len=0 TSval=1023555849 TSecr=1378625163 SLE=567617 SRE=677665 SLE=502457 SRE=550241
176,5.380891,192.168.2.2,192.168.1.2,TCP,86,315392,[TCP Dup ACK 136#16] 5001  >  45086 [ACK] Seq=1 Ack=485081 Win=315392 Len=0 TSval=1023556031 TSecr=1378625163 SLE=567617 SRE=684905 SLE=502457 SRE=550241
179,5.441271,192.168.2.2,192.168.1.2,TCP,86,312832,5001  >  45086 [ACK] Seq=1 Ack=487977 Win=312832 Len=0 TSval=1023556091 TSecr=1378626982 SLE=567617 SRE=684905 SLE=502457 SRE=550241
180,5.465709,192.168.2.2,192.168.1.2,TCP,86,319488,5001  >  45086 [ACK] Seq=1 Ack=489425 Win=319488 Len=0 TSval=1023556116 TSecr=1378627007 SLE=567617 SRE=684905 SLE=502457 SRE=550241
182,5.477914,192.168.2.2,192.168.1.2,TCP,86,342528,5001  >  45086 [ACK] Seq=1 Ack=501009 Win=342528 Len=0 TSval=1023556128 TSecr=1378627019 SLE=567617 SRE=684905 SLE=502457 SRE=550241
186,5.574949,192.168.2.2,192.168.1.2,TCP,78,345088,5001  >  45086 [ACK] Seq=1 Ack=550241 Win=345088 Len=0 TSval=1023556225 TSecr=1378627116 SLE=567617 SRE=684905
188,5.586719,192.168.2.2,192.168.1.2,TCP,78,353792,[TCP Window Update] 5001  >  45086 [ACK] Seq=1 Ack=550241 Win=353792 Len=0 TSval=1023556237 TSecr=1378627116 SLE=567617 SRE=689249
190,5.623938,192.168.2.2,192.168.1.2,TCP,78,362496,[TCP Window Update] 5001  >  45086 [ACK] Seq=1 Ack=550241 Win=362496 Len=0 TSval=1023556274 TSecr=1378627116 SLE=567617 SRE=693593
192,5.659305,192.168.2.2,192.168.1.2,TCP,78,406016,[TCP Window Update] 5001  >  45086 [ACK] Seq=1 Ack=550241 Win=406016 Len=0 TSval=1023556309 TSecr=1378627116 SLE=567617 SRE=715313
194,5.841526,192.168.2.2,192.168.1.2,TCP,78,426496,5001  >  45086 [ACK] Seq=1 Ack=560377 Win=426496 Len=0 TSval=1023556491 TSecr=1378627382 SLE=567617 SRE=715313
197,5.925913,192.168.2.2,192.168.1.2,TCP,66,440832,5001  >  45086 [ACK] Seq=1 Ack=715313 Win=440832 Len=0 TSval=1023556576 TSecr=1378627467
199,5.986548,192.168.2.2,192.168.1.2,TCP,66,449536,5001  >  45086 [ACK] Seq=1 Ack=719657 Win=449536 Len=0 TSval=1023556636 TSecr=1378627467
201,6.022839,192.168.2.2,192.168.1.2,TCP,66,452608,5001  >  45086 [ACK] Seq=1 Ack=721105 Win=452608 Len=0 TSval=1023556672 TSecr=1378627564
204,6.034752,192.168.2.2,192.168.1.2,TCP,66,461312,5001  >  45086 [ACK] Seq=1 Ack=725449 Win=461312 Len=0 TSval=1023556684 TSecr=1378627576
206,6.071112,192.168.2.2,192.168.1.2,TCP,66,470016,5001  >  45086 [ACK] Seq=1 Ack=729793 Win=470016 Len=0 TSval=1023556721 TSecr=1378627612
208,6.107475,192.168.2.2,192.168.1.2,TCP,66,530432,5001  >  45086 [ACK] Seq=1 Ack=760201 Win=530432 Len=0 TSval=1023556757 TSecr=1378627612
210,6.361903,192.168.2.2,192.168.1.2,TCP,66,539136,5001  >  45086 [ACK] Seq=1 Ack=764545 Win=539136 Len=0 TSval=1023557011 TSecr=1378627902
212,6.39822,192.168.2.2,192.168.1.2,TCP,66,550912,5001  >  45086 [ACK] Seq=1 Ack=770337 Win=550912 Len=0 TSval=1023557048 TSecr=1378627939
214,6.44716,192.168.2.2,192.168.1.2,TCP,66,559616,5001  >  45086 [ACK] Seq=1 Ack=774681 Win=559616 Len=0 TSval=1023557097 TSecr=1378627988
216,6.483436,192.168.2.2,192.168.1.2,TCP,78,587776,[TCP Window Update] 5001  >  45086 [ACK] Seq=1 Ack=774681 Win=587776 Len=0 TSval=1023557133 TSecr=1378627988 SLE=786265 SRE=800473
219,6.602427,192.168.2.2,192.168.1.2,TCP,78,602624,[TCP Window Update] 5001  >  45086 [ACK] Seq=1 Ack=774681 Win=602624 Len=0 TSval=1023557252 TSecr=1378627988 SLE=786265 SRE=807713
221,6.662987,192.168.2.2,192.168.1.2,TCP,78,625664,[TCP Window Update] 5001  >  45086 [ACK] Seq=1 Ack=774681 Win=625664 Len=0 TSval=1023557312 TSecr=1378627988 SLE=786265 SRE=819297
224,6.760133,192.168.2.2,192.168.1.2,TCP,78,628736,[TCP Window Update] 5001  >  45086 [ACK] Seq=1 Ack=774681 Win=628736 Len=0 TSval=1023557409 TSecr=1378627988 SLE=786265 SRE=819569
226,6.762567,192.168.2.2,192.168.1.2,TCP,78,674816,[TCP Window Update] 5001  >  45086 [ACK] Seq=1 Ack=774681 Win=674816 Len=0 TSval=1023557412 TSecr=1378627988 SLE=786265 SRE=842737
228,6.956804,192.168.2.2,192.168.1.2,TCP,78,686592,[TCP Window Update] 5001  >  45086 [ACK] Seq=1 Ack=774681 Win=686592 Len=0 TSval=1023557606 TSecr=1378627988 SLE=786265 SRE=848529
230,7.004817,192.168.2.2,192.168.1.2,TCP,78,704000,[TCP Window Update] 5001  >  45086 [ACK] Seq=1 Ack=774681 Win=704000 Len=0 TSval=1023557654 TSecr=1378627988 SLE=786265 SRE=857217
233,7.077515,192.168.2.2,192.168.1.2,TCP,78,721408,[TCP Window Update] 5001  >  45086 [ACK] Seq=1 Ack=774681 Win=721408 Len=0 TSval=1023557727 TSecr=1378627988 SLE=786265 SRE=865905
236,7.150236,192.168.2.2,192.168.1.2,TCP,78,786944,[TCP Window Update] 5001  >  45086 [ACK] Seq=1 Ack=774681 Win=786944 Len=0 TSval=1023557799 TSecr=1378627988 SLE=786265 SRE=909345
240,7.515065,192.168.2.2,192.168.1.2,TCP,78,786944,[TCP Dup ACK 214#1] 5001  >  45086 [ACK] Seq=1 Ack=774681 Win=786944 Len=0 TSval=1023558164 TSecr=1378627988 SLE=786265 SRE=912241
242,7.537974,192.168.2.2,192.168.1.2,TCP,86,786944,[TCP Dup ACK 214#2] 5001  >  45086 [ACK] Seq=1 Ack=774681 Win=786944 Len=0 TSval=1023558187 TSecr=1378627988 SLE=920929 SRE=928169 SLE=786265 SRE=912241
244,7.598737,192.168.2.2,192.168.1.2,TCP,86,786944,[TCP Dup ACK 214#3] 5001  >  45086 [ACK] Seq=1 Ack=774681 Win=786944 Len=0 TSval=1023558248 TSecr=1378627988 SLE=920929 SRE=932513 SLE=786265 SRE=912241
247,7.634962,192.168.2.2,192.168.1.2,TCP,86,786944,[TCP Dup ACK 214#4] 5001  >  45086 [ACK] Seq=1 Ack=774681 Win=786944 Len=0 TSval=1023558284 TSecr=1378627988 SLE=920929 SRE=933961 SLE=786265 SRE=912241
249,7.646729,192.168.2.2,192.168.1.2,TCP,86,786944,[TCP Dup ACK 214#5] 5001  >  45086 [ACK] Seq=1 Ack=774681 Win=786944 Len=0 TSval=1023558296 TSecr=1378627988 SLE=920929 SRE=938305 SLE=786265 SRE=912241
251,7.683078,192.168.2.2,192.168.1.2,TCP,86,786944,[TCP Dup ACK 214#6] 5001  >  45086 [ACK] Seq=1 Ack=774681 Win=786944 Len=0 TSval=1023558332 TSecr=1378627988 SLE=920929 SRE=942649 SLE=786265 SRE=912241
253,7.719518,192.168.2.2,192.168.1.2,TCP,86,786944,[TCP Dup ACK 214#7] 5001  >  45086 [ACK] Seq=1 Ack=774681 Win=786944 Len=0 TSval=1023558368 TSecr=1378627988 SLE=920929 SRE=958577 SLE=786265 SRE=912241
255,7.852665,192.168.2.2,192.168.1.2,TCP,86,786944,[TCP Dup ACK 214#8] 5001  >  45086 [ACK] Seq=1 Ack=774681 Win=786944 Len=0 TSval=1023558501 TSecr=1378627988 SLE=920929 SRE=977401 SLE=786265 SRE=912241
258,8.010127,192.168.2.2,192.168.1.2,TCP,86,786944,[TCP Dup ACK 214#9] 5001  >  45086 [ACK] Seq=1 Ack=774681 Win=786944 Len=0 TSval=1023558659 TSecr=1378627988 SLE=920929 SRE=983193 SLE=786265 SRE=912241
260,8.059362,192.168.2.2,192.168.1.2,TCP,86,786944,[TCP Dup ACK 214#10] 5001  >  45086 [ACK] Seq=1 Ack=774681 Win=786944 Len=0 TSval=1023558708 TSecr=1378627988 SLE=920929 SRE=987537 SLE=786265 SRE=912241
263,8.095634,192.168.2.2,192.168.1.2,TCP,78,745984,5001  >  45086 [ACK] Seq=1 Ack=912241 Win=745984 Len=0 TSval=1023558744 TSecr=1378629405 SLE=920929 SRE=987537
265,8.191835,192.168.2.2,192.168.1.2,TCP,86,801280,[TCP Window Update] 5001  >  45086 [ACK] Seq=1 Ack=912241 Win=801280 Len=0 TSval=1023558840 TSecr=1378629405 SLE=990433 SRE=997673 SLE=920929 SRE=987537
270,9.754884,192.168.2.2,192.168.1.2,TCP,86,816128,[TCP Window Update] 5001  >  45086 [ACK] Seq=1 Ack=912241 Win=816128 Len=0 TSval=1023558902 TSecr=1378629405 SLE=990433 SRE=1004913 SLE=920929 SRE=987537
272,9.754886,192.168.2.2,192.168.1.2,TCP,86,824320,[TCP Window Update] 5001  >  45086 [ACK] Seq=1 Ack=912241 Win=824320 Len=0 TSval=1023558962 TSecr=1378629405 SLE=990433 SRE=1009257 SLE=920929 SRE=987537
273,9.754888,192.168.2.2,192.168.1.2,TCP,86,827392,[TCP Window Update] 5001  >  45086 [ACK] Seq=1 Ack=912241 Win=827392 Len=0 TSval=1023558998 TSecr=1378629405 SLE=990433 SRE=1010705 SLE=920929 SRE=987537
274,9.75489,192.168.2.2,192.168.1.2,TCP,86,873984,[TCP Window Update] 5001  >  45086 [ACK] Seq=1 Ack=912241 Win=873984 Len=0 TSval=1023559011 TSecr=1378629405 SLE=990433 SRE=1033873 SLE=920929 SRE=987537
275,9.754892,192.168.2.2,192.168.1.2,TCP,86,885248,[TCP Window Update] 5001  >  45086 [ACK] Seq=1 Ack=912241 Win=885248 Len=0 TSval=1023559204 TSecr=1378629405 SLE=990433 SRE=1039665 SLE=920929 SRE=987537
276,9.754894,192.168.2.2,192.168.1.2,TCP,86,902656,[TCP Window Update] 5001  >  45086 [ACK] Seq=1 Ack=912241 Win=902656 Len=0 TSval=1023559253 TSecr=1378629405 SLE=990433 SRE=1048353 SLE=920929 SRE=987537
277,9.754896,192.168.2.2,192.168.1.2,TCP,86,908800,[TCP Window Update] 5001  >  45086 [ACK] Seq=1 Ack=912241 Win=908800 Len=0 TSval=1023559325 TSecr=1378629405 SLE=990433 SRE=1051249 SLE=920929 SRE=987537
278,9.754897,192.168.2.2,192.168.1.2,TCP,94,989696,[TCP Window Update] 5001  >  45086 [ACK] Seq=1 Ack=912241 Win=989696 Len=0 TSval=1023559350 TSecr=1378629405 SLE=1057041 SRE=1097585 SLE=990433 SRE=1051249 SLE=920929 SRE=987537
279,9.754899,192.168.2.2,192.168.1.2,TCP,94,995328,[TCP Window Update] 5001  >  45086 [ACK] Seq=1 Ack=912241 Win=995328 Len=0 TSval=1023559688 TSecr=1378629405 SLE=1100481 SRE=1103377 SLE=1057041 SRE=1097585 SLE=990433 SRE=1051249
280,9.754901,192.168.2.2,192.168.1.2,TCP,94,1009664,5001  >  45086 [ACK] Seq=1 Ack=919481 Win=1009664 Len=0 TSval=1023559712 TSecr=1378630459 SLE=1100481 SRE=1103377 SLE=1057041 SRE=1097585 SLE=990433 SRE=1051249
281,9.754903,192.168.2.2,192.168.1.2,TCP,94,1012736,5001  >  45086 [ACK] Seq=1 Ack=987537 Win=1012736 Len=0 TSval=1023559773 TSecr=1378630520 SLE=1100481 SRE=1103377 SLE=1057041 SRE=1097585 SLE=990433 SRE=1051249
282,9.754904,192.168.2.2,192.168.1.2,TCP,94,1015808,[TCP Window Update] 5001  >  45086 [ACK] Seq=1 Ack=987537 Win=1015808 Len=0 TSval=1023559785 TSecr=1378630520 SLE=1106273 SRE=1107721 SLE=1100481 SRE=1103377 SLE=1057041 SRE=1097585
283,9.754906,192.168.2.2,192.168.1.2,TCP,94,1024512,[TCP Window Update] 5001  >  45086 [ACK] Seq=1 Ack=987537 Win=1024512 Len=0 TSval=1023559797 TSecr=1378630520 SLE=1106273 SRE=1112065 SLE=1100481 SRE=1103377 SLE=1057041 SRE=1097585
284,9.754908,192.168.2.2,192.168.1.2,TCP,94,1033216,[TCP Window Update] 5001  >  45086 [ACK] Seq=1 Ack=987537 Win=1033216 Len=0 TSval=1023559833 TSecr=1378630520 SLE=1106273 SRE=1116409 SLE=1100481 SRE=1103377 SLE=1057041 SRE=1097585
285,9.754909,192.168.2.2,192.168.1.2,TCP,94,1064960,[TCP Window Update] 5001  >  45086 [ACK] Seq=1 Ack=987537 Win=1064960 Len=0 TSval=1023559870 TSecr=1378630520 SLE=1106273 SRE=1132337 SLE=1100481 SRE=1103377 SLE=1057041 SRE=1097585
286,9.754911,192.168.2.2,192.168.1.2,TCP,94,1088000,[TCP Window Update] 5001  >  45086 [ACK] Seq=1 Ack=987537 Win=1088000 Len=0 TSval=1023560003 TSecr=1378630520 SLE=1106273 SRE=1143921 SLE=1100481 SRE=1103377 SLE=1057041 SRE=1097585
287,9.754913,192.168.2.2,192.168.1.2,TCP,94,1099776,[TCP Window Update] 5001  >  45086 [ACK] Seq=1 Ack=987537 Win=1099776 Len=0 TSval=1023560099 TSecr=1378630520 SLE=1151161 SRE=1156953 SLE=1106273 SRE=1143921 SLE=1100481 SRE=1103377
288,9.754915,192.168.2.2,192.168.1.2,TCP,94,1108480,[TCP Window Update] 5001  >  45086 [ACK] Seq=1 Ack=987537 Win=1108480 Len=0 TSval=1023560161 TSecr=1378630520 SLE=1151161 SRE=1161297 SLE=1106273 SRE=1143921 SLE=1100481 SRE=1103377
289,9.755147,192.168.2.2,192.168.1.2,TCP,94,1154560,[TCP Window Update] 5001  >  45086 [ACK] Seq=1 Ack=987537 Win=1154560 Len=0 TSval=1023560185 TSecr=1378630520 SLE=1151161 SRE=1184465 SLE=1106273 SRE=1143921 SLE=1100481 SRE=1103377
291,9.755862,192.168.2.2,192.168.1.2,TCP,94,1160704,5001  >  45086 [ACK] Seq=1 Ack=1051249 Win=1160704 Len=0 TSval=1023560378 TSecr=1378631112 SLE=1151161 SRE=1184465 SLE=1106273 SRE=1143921 SLE=1100481 SRE=1103377
296,9.757425,192.168.2.2,192.168.1.2,TCP,94,1183744,[TCP Window Update] 5001  >  45086 [ACK] Seq=1 Ack=1051249 Win=1183744 Len=0 TSval=1023560404 TSecr=1378631112 SLE=1196049 SRE=1207633 SLE=1151161 SRE=1184465 SLE=1106273 SRE=1143921
305,9.853822,192.168.2.2,192.168.1.2,TCP,94,1195008,5001  >  45086 [ACK] Seq=1 Ack=1097585 Win=1195008 Len=0 TSval=1023560502 TSecr=1378632675 SLE=1196049 SRE=1207633 SLE=1151161 SRE=1184465 SLE=1106273 SRE=1143921
307,9.901822,192.168.2.2,192.168.1.2,TCP,94,1201152,5001  >  45086 [ACK] Seq=1 Ack=1103377 Win=1201152 Len=0 TSval=1023560550 TSecr=1378632675 SLE=1196049 SRE=1207633 SLE=1151161 SRE=1184465 SLE=1106273 SRE=1143921
309,9.926312,192.168.2.2,192.168.1.2,TCP,86,1206784,5001  >  45086 [ACK] Seq=1 Ack=1143921 Win=1206784 Len=0 TSval=1023560574 TSecr=1378632675 SLE=1196049 SRE=1207633 SLE=1151161 SRE=1184465
311,9.949718,192.168.2.2,192.168.1.2,TCP,78,1221120,5001  >  45086 [ACK] Seq=1 Ack=1184465 Win=1221120 Len=0 TSval=1023560597 TSecr=1378632675 SLE=1196049 SRE=1207633
313,10.010301,192.168.2.2,192.168.1.2,TCP,78,1279488,[TCP Window Update] 5001  >  45086 [ACK] Seq=1 Ack=1184465 Win=1279488 Len=0 TSval=1023560658 TSecr=1378632675 SLE=1196049 SRE=1236593
315,10.252549,192.168.2.2,192.168.1.2,TCP,78,1409536,[TCP Window Update] 5001  >  45086 [ACK] Seq=1 Ack=1184465 Win=1409536 Len=0 TSval=1023560900 TSecr=1378632675 SLE=1196049 SRE=1301753
316,10.7976,192.168.2.2,192.168.1.2,TCP,78,1540096,[TCP Window Update] 5001  >  45086 [ACK] Seq=1 Ack=1184465 Win=1540096 Len=0 TSval=1023561445 TSecr=1378632675 SLE=1196049 SRE=1366913
318,11.342674,192.168.2.2,192.168.1.2,TCP,78,1560064,[TCP Window Update] 5001  >  45086 [ACK] Seq=1 Ack=1184465 Win=1560064 Len=0 TSval=1023561990 TSecr=1378632675 SLE=1196049 SRE=1377049
319,11.427756,192.168.2.2,192.168.1.2,TCP,78,1565696,[TCP Window Update] 5001  >  45086 [ACK] Seq=1 Ack=1184465 Win=1565696 Len=0 TSval=1023562075 TSecr=1378632675 SLE=1196049 SRE=1379945
320,11.452335,192.168.2.2,192.168.1.2,TCP,78,1577472,5001  >  45086 [ACK] Seq=1 Ack=1190257 Win=1577472 Len=0 TSval=1023562099 TSecr=1378632677 SLE=1196049 SRE=1379945
321,11.500275,192.168.2.2,192.168.1.2,TCP,66,1589248,5001  >  45086 [ACK] Seq=1 Ack=1379945 Win=1589248 Len=0 TSval=1023562147 TSecr=1378632677
322,11.548624,192.168.2.2,192.168.1.2,TCP,66,1612288,5001  >  45086 [ACK] Seq=1 Ack=1391529 Win=1612288 Len=0 TSval=1023562195 TSecr=1378632677
323,11.645485,192.168.2.2,192.168.1.2,TCP,66,1624064,5001  >  45086 [ACK] Seq=1 Ack=1397321 Win=1624064 Len=0 TSval=1023562292 TSecr=1378632774
324,11.693874,192.168.2.2,192.168.1.2,TCP,66,1629696,5001  >  45086 [ACK] Seq=1 Ack=1400217 Win=1629696 Len=0 TSval=1023562341 TSecr=1378632822
325,11.718096,192.168.2.2,192.168.1.2,TCP,66,1635328,5001  >  45086 [ACK] Seq=1 Ack=1403113 Win=1635328 Len=0 TSval=1023562365 TSecr=1378632846
326,11.742341,192.168.2.2,192.168.1.2,TCP,66,1650176,5001  >  45086 [ACK] Seq=1 Ack=1410353 Win=1650176 Len=0 TSval=1023562389 TSecr=1378632869
331,11.804424,192.168.2.2,192.168.1.2,TCP,66,1655808,5001  >  45086 [ACK] Seq=1 Ack=1413249 Win=1655808 Len=0 TSval=1023562451 TSecr=1378634661
333,11.828887,192.168.2.2,192.168.1.2,TCP,66,1661440,5001  >  45086 [ACK] Seq=1 Ack=1416145 Win=1661440 Len=0 TSval=1023562476 TSecr=1378634661
335,11.852875,192.168.2.2,192.168.1.2,TCP,66,1667072,5001  >  45086 [ACK] Seq=1 Ack=1419041 Win=1667072 Len=0 TSval=1023562500 TSecr=1378634723
337,11.877117,192.168.2.2,192.168.1.2,TCP,66,1673216,5001  >  45086 [ACK] Seq=1 Ack=1421937 Win=1673216 Len=0 TSval=1023562524 TSecr=1378634748
339,11.901352,192.168.2.2,192.168.1.2,TCP,66,1678848,5001  >  45086 [ACK] Seq=1 Ack=1424833 Win=1678848 Len=0 TSval=1023562548 TSecr=1378634772
341,11.925628,192.168.2.2,192.168.1.2,TCP,66,1684480,5001  >  45086 [ACK] Seq=1 Ack=1427729 Win=1684480 Len=0 TSval=1023562572 TSecr=1378634796
344,11.950108,192.168.2.2,192.168.1.2,TCP,66,1690624,5001  >  45086 [ACK] Seq=1 Ack=1430625 Win=1690624 Len=0 TSval=1023562597 TSecr=1378634820
349,11.974055,192.168.2.2,192.168.1.2,TCP,66,1693184,5001  >  45086 [ACK] Seq=1 Ack=1432073 Win=1693184 Len=0 TSval=1023562621 TSecr=1378634844
351,11.98637,192.168.2.2,192.168.1.2,TCP,66,1696256,5001  >  45086 [ACK] Seq=1 Ack=1433521 Win=1696256 Len=0 TSval=1023562633 TSecr=1378634844
353,11.998212,192.168.2.2,192.168.1.2,TCP,66,1728000,5001  >  45086 [ACK] Seq=1 Ack=1497233 Win=1728000 Len=0 TSval=1023562645 TSecr=1378634869
358,12.531376,192.168.2.2,192.168.1.2,TCP,66,1726976,5001  >  45086 [ACK] Seq=1 Ack=1562393 Win=1726976 Len=0 TSval=1023563178 TSecr=1378634869
362,13.076211,192.168.2.2,192.168.1.2,TCP,66,1726976,5001  >  45086 [ACK] Seq=1 Ack=1627553 Win=1726976 Len=0 TSval=1023563722 TSecr=1378634869
368,13.62127,192.168.2.2,192.168.1.2,TCP,66,1749504,5001  >  45086 [ACK] Seq=1 Ack=1647825 Win=1749504 Len=0 TSval=1023564267 TSecr=1378634869
370,13.791637,192.168.2.2,192.168.1.2,TCP,66,1755136,5001  >  45086 [ACK] Seq=1 Ack=1650721 Win=1755136 Len=0 TSval=1023564437 TSecr=1378634893
372,13.815145,192.168.2.2,192.168.1.2,TCP,66,1758208,5001  >  45086 [ACK] Seq=1 Ack=1653617 Win=1758208 Len=0 TSval=1023564461 TSecr=1378634905
374,13.839256,192.168.2.2,192.168.1.2,TCP,66,1740288,5001  >  45086 [ACK] Seq=1 Ack=1692713 Win=1740288 Len=0 TSval=1023564485 TSecr=1378634917
376,14.166987,192.168.2.2,192.168.1.2,TCP,66,1726976,5001  >  45086 [ACK] Seq=1 Ack=1757873 Win=1726976 Len=0 TSval=1023564813 TSecr=1378634918
377,14.711888,192.168.2.2,192.168.1.2,TCP,66,1747968,5001  >  45086 [ACK] Seq=1 Ack=1781041 Win=1747968 Len=0 TSval=1023565357 TSecr=1378634918
379,14.905905,192.168.2.2,192.168.1.2,TCP,66,1738752,5001  >  45086 [ACK] Seq=1 Ack=1823033 Win=1738752 Len=0 TSval=1023565551 TSecr=1378635450
381,15.257779,192.168.2.2,192.168.1.2,TCP,66,1726976,5001  >  45086 [ACK] Seq=1 Ack=1888193 Win=1726976 Len=0 TSval=1023565903 TSecr=1378635450
382,15.802775,192.168.2.2,192.168.1.2,TCP,66,1747968,5001  >  45086 [ACK] Seq=1 Ack=1911361 Win=1747968 Len=0 TSval=1023566448 TSecr=1378635471
384,15.995985,192.168.2.2,192.168.1.2,TCP,66,1738752,5001  >  45086 [ACK] Seq=1 Ack=1953353 Win=1738752 Len=0 TSval=1023566641 TSecr=1378635994
386,16.347218,192.168.2.2,192.168.1.2,TCP,66,1726976,5001  >  45086 [ACK] Seq=1 Ack=2018513 Win=1726976 Len=0 TSval=1023566992 TSecr=1378635995
387,16.892503,192.168.2.2,192.168.1.2,TCP,66,1747968,5001  >  45086 [ACK] Seq=1 Ack=2041681 Win=1747968 Len=0 TSval=1023567537 TSecr=1378635995
389,17.08739,192.168.2.2,192.168.1.2,TCP,66,1739264,5001  >  45086 [ACK] Seq=1 Ack=2082225 Win=1739264 Len=0 TSval=1023567732 TSecr=1378636539
396,17.426663,192.168.2.2,192.168.1.2,TCP,66,1758720,5001  >  45086 [ACK] Seq=1 Ack=2083673 Win=1758720 Len=0 TSval=1023568071 TSecr=1378636709
397,17.439385,192.168.2.2,192.168.1.2,TCP,66,1754624,5001  >  45086 [ACK] Seq=1 Ack=2093809 Win=1754624 Len=0 TSval=1023568083 TSecr=1378636733
405,17.525777,192.168.2.2,192.168.1.2,TCP,66,1758208,5001  >  45086 [ACK] Seq=1 Ack=2096705 Win=1758208 Len=0 TSval=1023568170 TSecr=1378640004
408,17.550136,192.168.2.2,192.168.1.2,TCP,66,1758208,5001  >  45086 [ACK] Seq=1 Ack=2099601 Win=1758208 Len=0 TSval=1023568194 TSecr=1378640021
411,17.574271,192.168.2.2,192.168.1.2,TCP,66,1758208,5001  >  45086 [ACK] Seq=1 Ack=2102497 Win=1758208 Len=0 TSval=1023568218 TSecr=1378640039
414,17.598465,192.168.2.2,192.168.1.2,TCP,66,1758208,5001  >  45086 [ACK] Seq=1 Ack=2105393 Win=1758208 Len=0 TSval=1023568242 TSecr=1378640056
417,17.62269,192.168.2.2,192.168.1.2,TCP,66,1758208,5001  >  45086 [ACK] Seq=1 Ack=2108289 Win=1758208 Len=0 TSval=1023568267 TSecr=1378640073
421,17.647703,192.168.2.2,192.168.1.2,TCP,66,1758720,5001  >  45086 [ACK] Seq=1 Ack=2109737 Win=1758720 Len=0 TSval=1023568292 TSecr=1378640355
423,17.659859,192.168.2.2,192.168.1.2,TCP,66,1758720,5001  >  45086 [ACK] Seq=1 Ack=2111185 Win=1758720 Len=0 TSval=1023568304 TSecr=1378640370
425,17.671931,192.168.2.2,192.168.1.2,TCP,66,1758720,5001  >  45086 [ACK] Seq=1 Ack=2112633 Win=1758720 Len=0 TSval=1023568316 TSecr=1378640385
427,17.684487,192.168.2.2,192.168.1.2,TCP,66,1758720,5001  >  45086 [ACK] Seq=1 Ack=2114081 Win=1758720 Len=0 TSval=1023568328 TSecr=1378640399
429,17.696154,192.168.2.2,192.168.1.2,TCP,66,1758720,5001  >  45086 [ACK] Seq=1 Ack=2115529 Win=1758720 Len=0 TSval=1023568340 TSecr=1378640442
431,17.70895,192.168.2.2,192.168.1.2,TCP,66,1758720,5001  >  45086 [ACK] Seq=1 Ack=2116977 Win=1758720 Len=0 TSval=1023568353 TSecr=1378640453
433,17.720694,192.168.2.2,192.168.1.2,TCP,66,1758720,5001  >  45086 [ACK] Seq=1 Ack=2118425 Win=1758720 Len=0 TSval=1023568364 TSecr=1378640466
435,17.732508,192.168.2.2,192.168.1.2,TCP,66,1758720,5001  >  45086 [ACK] Seq=1 Ack=2119873 Win=1758720 Len=0 TSval=1023568376 TSecr=1378640478
437,17.744588,192.168.2.2,192.168.1.2,TCP,66,1758720,5001  >  45086 [ACK] Seq=1 Ack=2121321 Win=1758720 Len=0 TSval=1023568388 TSecr=1378640490
439,17.756729,192.168.2.2,192.168.1.2,TCP,66,1758720,5001  >  45086 [ACK] Seq=1 Ack=2122769 Win=1758720 Len=0 TSval=1023568401 TSecr=1378640502
441,17.781493,192.168.2.2,192.168.1.2,TCP,66,1758720,5001  >  45086 [ACK] Seq=1 Ack=2125665 Win=1758720 Len=0 TSval=1023568425 TSecr=1378640514
444,17.805195,192.168.2.2,192.168.1.2,TCP,66,1758720,5001  >  45086 [ACK] Seq=1 Ack=2128561 Win=1758720 Len=0 TSval=1023568449 TSecr=1378640539
447,17.829466,192.168.2.2,192.168.1.2,TCP,66,1758720,5001  >  45086 [ACK] Seq=1 Ack=2131457 Win=1758720 Len=0 TSval=1023568473 TSecr=1378640564
450,17.853613,192.168.2.2,192.168.1.2,TCP,66,1758720,5001  >  45086 [ACK] Seq=1 Ack=2134353 Win=1758720 Len=0 TSval=1023568497 TSecr=1378640588
453,17.878477,192.168.2.2,192.168.1.2,TCP,66,1758720,5001  >  45086 [ACK] Seq=1 Ack=2137249 Win=1758720 Len=0 TSval=1023568522 TSecr=1378640612
455,17.902111,192.168.2.2,192.168.1.2,TCP,66,1758720,5001  >  45086 [ACK] Seq=1 Ack=2140145 Win=1758720 Len=0 TSval=1023568546 TSecr=1378640637
456,17.92629,192.168.2.2,192.168.1.2,TCP,66,1758720,5001  >  45086 [ACK] Seq=1 Ack=2143041 Win=1758720 Len=0 TSval=1023568570 TSecr=1378640660
459,17.95103,192.168.2.2,192.168.1.2,TCP,66,1758720,5001  >  45086 [ACK] Seq=1 Ack=2145937 Win=1758720 Len=0 TSval=1023568595 TSecr=1378640697
462,17.974736,192.168.2.2,192.168.1.2,TCP,66,1758720,5001  >  45086 [ACK] Seq=1 Ack=2148833 Win=1758720 Len=0 TSval=1023568618 TSecr=1378640721
465,17.999023,192.168.2.2,192.168.1.2,TCP,66,1758720,5001  >  45086 [ACK] Seq=1 Ack=2151729 Win=1758720 Len=0 TSval=1023568643 TSecr=1378640745
467,18.011075,192.168.2.2,192.168.1.2,TCP,66,1758720,5001  >  45086 [ACK] Seq=1 Ack=2154625 Win=1758720 Len=0 TSval=1023568655 TSecr=1378640769
470,18.035385,192.168.2.2,192.168.1.2,TCP,66,1758720,5001  >  45086 [ACK] Seq=1 Ack=2157521 Win=1758720 Len=0 TSval=1023568679 TSecr=1378640788
473,18.059864,192.168.2.2,192.168.1.2,TCP,66,1758720,5001  >  45086 [ACK] Seq=1 Ack=2160417 Win=1758720 Len=0 TSval=1023568704 TSecr=1378640806
477,18.096036,192.168.2.2,192.168.1.2,TCP,66,1758720,5001  >  45086 [ACK] Seq=1 Ack=2163313 Win=1758720 Len=0 TSval=1023568740 TSecr=1378640842
480,18.120081,192.168.2.2,192.168.1.2,TCP,66,1758720,5001  >  45086 [ACK] Seq=1 Ack=2166209 Win=1758720 Len=0 TSval=1023568764 TSecr=1378640873
483,18.145042,192.168.2.2,192.168.1.2,TCP,66,1758720,5001  >  45086 [ACK] Seq=1 Ack=2169105 Win=1758720 Len=0 TSval=1023568789 TSecr=1378640896
487,18.16849,192.168.2.2,192.168.1.2,TCP,66,1758720,5001  >  45086 [ACK] Seq=1 Ack=2172001 Win=1758720 Len=0 TSval=1023568812 TSecr=1378640920
490,18.193086,192.168.2.2,192.168.1.2,TCP,66,1758720,5001  >  45086 [ACK] Seq=1 Ack=2174897 Win=1758720 Len=0 TSval=1023568837 TSecr=1378640943
493,18.217019,192.168.2.2,192.168.1.2,TCP,66,1758720,5001  >  45086 [ACK] Seq=1 Ack=2177793 Win=1758720 Len=0 TSval=1023568861 TSecr=1378640967
496,18.24207,192.168.2.2,192.168.1.2,TCP,66,1758720,5001  >  45086 [ACK] Seq=1 Ack=2180689 Win=1758720 Len=0 TSval=1023568886 TSecr=1378640990
499,18.265424,192.168.2.2,192.168.1.2,TCP,66,1758720,5001  >  45086 [ACK] Seq=1 Ack=2183585 Win=1758720 Len=0 TSval=1023568909 TSecr=1378641014
502,18.289653,192.168.2.2,192.168.1.2,TCP,66,1758720,5001  >  45086 [ACK] Seq=1 Ack=2186481 Win=1758720 Len=0 TSval=1023568933 TSecr=1378641036
504,18.313922,192.168.2.2,192.168.1.2,TCP,66,1758720,5001  >  45086 [ACK] Seq=1 Ack=2189377 Win=1758720 Len=0 TSval=1023568957 TSecr=1378641061
506,18.338891,192.168.2.2,192.168.1.2,TCP,66,1758720,5001  >  45086 [ACK] Seq=1 Ack=2192273 Win=1758720 Len=0 TSval=1023568982 TSecr=1378641084
509,18.363546,192.168.2.2,192.168.1.2,TCP,66,1758720,5001  >  45086 [ACK] Seq=1 Ack=2195169 Win=1758720 Len=0 TSval=1023569007 TSecr=1378641109
512,18.387308,192.168.2.2,192.168.1.2,TCP,66,1758720,5001  >  45086 [ACK] Seq=1 Ack=2198065 Win=1758720 Len=0 TSval=1023569031 TSecr=1378641133
515,18.411567,192.168.2.2,192.168.1.2,TCP,66,1758720,5001  >  45086 [ACK] Seq=1 Ack=2200961 Win=1758720 Len=0 TSval=1023569055 TSecr=1378641158
517,18.424318,192.168.2.2,192.168.1.2,TCP,66,1758720,5001  >  45086 [ACK] Seq=1 Ack=2203857 Win=1758720 Len=0 TSval=1023569068 TSecr=1378641181
520,18.44881,192.168.2.2,192.168.1.2,TCP,66,1758720,5001  >  45086 [ACK] Seq=1 Ack=2206753 Win=1758720 Len=0 TSval=1023569092 TSecr=1378641199
523,18.472348,192.168.2.2,192.168.1.2,TCP,66,1758720,5001  >  45086 [ACK] Seq=1 Ack=2209649 Win=1758720 Len=0 TSval=1023569116 TSecr=1378641217
527,18.515789,192.168.2.2,192.168.1.2,TCP,66,1758720,5001  >  45086 [ACK] Seq=1 Ack=2212545 Win=1758720 Len=0 TSval=1023569159 TSecr=1378641254
530,18.532903,192.168.2.2,192.168.1.2,TCP,66,1758720,5001  >  45086 [ACK] Seq=1 Ack=2215441 Win=1758720 Len=0 TSval=1023569176 TSecr=1378641285
533,18.55767,192.168.2.2,192.168.1.2,TCP,66,1758720,5001  >  45086 [ACK] Seq=1 Ack=2218337 Win=1758720 Len=0 TSval=1023569201 TSecr=1378641308
536,18.58115,192.168.2.2,192.168.1.2,TCP,66,1758720,5001  >  45086 [ACK] Seq=1 Ack=2221233 Win=1758720 Len=0 TSval=1023569225 TSecr=1378641331
539,18.605671,192.168.2.2,192.168.1.2,TCP,66,1758720,5001  >  45086 [ACK] Seq=1 Ack=2224129 Win=1758720 Len=0 TSval=1023569249 TSecr=1378641354
542,18.630157,192.168.2.2,192.168.1.2,TCP,66,1758720,5001  >  45086 [ACK] Seq=1 Ack=2227025 Win=1758720 Len=0 TSval=1023569274 TSecr=1378641377
545,18.654687,192.168.2.2,192.168.1.2,TCP,66,1758720,5001  >  45086 [ACK] Seq=1 Ack=2229921 Win=1758720 Len=0 TSval=1023569298 TSecr=1378641400
548,18.678189,192.168.2.2,192.168.1.2,TCP,66,1758720,5001  >  45086 [ACK] Seq=1 Ack=2232817 Win=1758720 Len=0 TSval=1023569322 TSecr=1378641431
551,18.702245,192.168.2.2,192.168.1.2,TCP,66,1758720,5001  >  45086 [ACK] Seq=1 Ack=2235713 Win=1758720 Len=0 TSval=1023569346 TSecr=1378641454
554,18.727153,192.168.2.2,192.168.1.2,TCP,66,1758720,5001  >  45086 [ACK] Seq=1 Ack=2238609 Win=1758720 Len=0 TSval=1023569370 TSecr=1378641477
557,18.751667,192.168.2.2,192.168.1.2,TCP,66,1758720,5001  >  45086 [ACK] Seq=1 Ack=2241505 Win=1758720 Len=0 TSval=1023569395 TSecr=1378641499
560,18.775189,192.168.2.2,192.168.1.2,TCP,66,1758720,5001  >  45086 [ACK] Seq=1 Ack=2244401 Win=1758720 Len=0 TSval=1023569418 TSecr=1378641522
562,18.799105,192.168.2.2,192.168.1.2,TCP,66,1758720,5001  >  45086 [ACK] Seq=1 Ack=2247297 Win=1758720 Len=0 TSval=1023569442 TSecr=1378641546
565,18.824139,192.168.2.2,192.168.1.2,TCP,66,1758720,5001  >  45086 [ACK] Seq=1 Ack=2250193 Win=1758720 Len=0 TSval=1023569467 TSecr=1378641570
566,18.847669,192.168.2.2,192.168.1.2,TCP,66,1758720,5001  >  45086 [ACK] Seq=1 Ack=2253089 Win=1758720 Len=0 TSval=1023569491 TSecr=1378641594
567,18.871827,192.168.2.2,192.168.1.2,TCP,66,1758720,5001  >  45086 [ACK] Seq=1 Ack=2255985 Win=1758720 Len=0 TSval=1023569515 TSecr=1378641618
570,18.896752,192.168.2.2,192.168.1.2,TCP,66,1758720,5001  >  45086 [ACK] Seq=1 Ack=2258881 Win=1758720 Len=0 TSval=1023569540 TSecr=1378641642
572,18.908502,192.168.2.2,192.168.1.2,TCP,66,1758720,5001  >  45086 [ACK] Seq=1 Ack=2261777 Win=1758720 Len=0 TSval=1023569552 TSecr=1378641667
575,18.933031,192.168.2.2,192.168.1.2,TCP,66,1758720,5001  >  45086 [ACK] Seq=1 Ack=2264673 Win=1758720 Len=0 TSval=1023569576 TSecr=1378641685
578,18.956601,192.168.2.2,192.168.1.2,TCP,66,1758720,5001  >  45086 [ACK] Seq=1 Ack=2267569 Win=1758720 Len=0 TSval=1023569600 TSecr=1378641703
581,18.98102,192.168.2.2,192.168.1.2,TCP,66,1758720,5001  >  45086 [ACK] Seq=1 Ack=2270465 Win=1758720 Len=0 TSval=1023569624 TSecr=1378641721
584,19.005596,192.168.2.2,192.168.1.2,TCP,66,1758720,5001  >  45086 [ACK] Seq=1 Ack=2273361 Win=1758720 Len=0 TSval=1023569649 TSecr=1378641739
588,19.041739,192.168.2.2,192.168.1.2,TCP,66,1758720,5001  >  45086 [ACK] Seq=1 Ack=2276257 Win=1758720 Len=0 TSval=1023569685 TSecr=1378641787
591,19.065558,192.168.2.2,192.168.1.2,TCP,66,1758720,5001  >  45086 [ACK] Seq=1 Ack=2279153 Win=1758720 Len=0 TSval=1023569709 TSecr=1378641817
594,19.089805,192.168.2.2,192.168.1.2,TCP,66,1758720,5001  >  45086 [ACK] Seq=1 Ack=2282049 Win=1758720 Len=0 TSval=1023569733 TSecr=1378641840
597,19.114024,192.168.2.2,192.168.1.2,TCP,66,1758720,5001  >  45086 [ACK] Seq=1 Ack=2284945 Win=1758720 Len=0 TSval=1023569757 TSecr=1378641863
600,19.138756,192.168.2.2,192.168.1.2,TCP,66,1758720,5001  >  45086 [ACK] Seq=1 Ack=2287841 Win=1758720 Len=0 TSval=1023569782 TSecr=1378641886
603,19.162488,192.168.2.2,192.168.1.2,TCP,66,1758720,5001  >  45086 [ACK] Seq=1 Ack=2290737 Win=1758720 Len=0 TSval=1023569806 TSecr=1378641910
607,19.18669,192.168.2.2,192.168.1.2,TCP,66,1758720,5001  >  45086 [ACK] Seq=1 Ack=2293633 Win=1758720 Len=0 TSval=1023569830 TSecr=1378641932
610,19.210917,192.168.2.2,192.168.1.2,TCP,66,1758720,5001  >  45086 [ACK] Seq=1 Ack=2296529 Win=1758720 Len=0 TSval=1023569854 TSecr=1378641957
613,19.235143,192.168.2.2,192.168.1.2,TCP,66,1758720,5001  >  45086 [ACK] Seq=1 Ack=2299425 Win=1758720 Len=0 TSval=1023569878 TSecr=1378641981
615,19.259443,192.168.2.2,192.168.1.2,TCP,66,1758720,5001  >  45086 [ACK] Seq=1 Ack=2302321 Win=1758720 Len=0 TSval=1023569902 TSecr=1378642005
616,19.283871,192.168.2.2,192.168.1.2,TCP,66,1758720,5001  >  45086 [ACK] Seq=1 Ack=2305217 Win=1758720 Len=0 TSval=1023569927 TSecr=1378642029
619,19.30782,192.168.2.2,192.168.1.2,TCP,66,1758720,5001  >  45086 [ACK] Seq=1 Ack=2308113 Win=1758720 Len=0 TSval=1023569951 TSecr=1378642054
623,19.33282,192.168.2.2,192.168.1.2,TCP,66,1758720,5001  >  45086 [ACK] Seq=1 Ack=2311009 Win=1758720 Len=0 TSval=1023569976 TSecr=1378642078
626,19.357302,192.168.2.2,192.168.1.2,TCP,66,1758720,5001  >  45086 [ACK] Seq=1 Ack=2313905 Win=1758720 Len=0 TSval=1023570000 TSecr=1378642102
628,19.369417,192.168.2.2,192.168.1.2,TCP,66,1758720,5001  >  45086 [ACK] Seq=1 Ack=2316801 Win=1758720 Len=0 TSval=1023570012 TSecr=1378642126
