No.,Time,Source,Destination,Protocol,Length,Calculated window size,Info
4,0.001597,192.168.2.2,192.168.1.2,TCP,74,28960,"5001  >  48012 [SYN, ACK] Seq=0 Ack=1 Win=28960 Len=0 MSS=1460 SACK_PERM=1 TSval=551972987 TSecr=457194702 WS=512"
7,0.001652,192.168.2.2,192.168.1.2,TCP,66,43520,5001  >  48012 [ACK] Seq=1 Ack=7241 Win=43520 Len=0 TSval=551972987 TSecr=457194702
12,0.05079,192.168.2.2,192.168.1.2,TCP,66,64000,5001  >  48012 [ACK] Seq=1 Ack=17377 Win=64000 Len=0 TSval=551973036 TSecr=457194703
16,0.136052,192.168.2.2,192.168.1.2,TCP,66,84480,5001  >  48012 [ACK] Seq=1 Ack=27513 Win=84480 Len=0 TSval=551973122 TSecr=457194704
20,0.22045,192.168.2.2,192.168.1.2,TCP,66,87040,5001  >  48012 [ACK] Seq=1 Ack=28961 Win=87040 Len=0 TSval=551973206 TSecr=457194705
22,0.232209,192.168.2.2,192.168.1.2,TCP,66,90112,5001  >  48012 [ACK] Seq=1 Ack=30409 Win=90112 Len=0 TSval=551973218 TSecr=457194721
24,0.24434,192.168.2.2,192.168.1.2,TCP,66,121856,5001  >  48012 [ACK] Seq=1 Ack=46337 Win=121856 Len=0 TSval=551973230 TSecr=457194751
27,0.37758,192.168.2.2,192.168.1.2,TCP,66,127488,5001  >  48012 [ACK] Seq=1 Ack=49233 Win=127488 Len=0 TSval=551973363 TSecr=457194777
30,0.402489,192.168.2.2,192.168.1.2,TCP,66,130560,5001  >  48012 [ACK] Seq=1 Ack=50681 Win=130560 Len=0 TSval=551973388 TSecr=457194837
32,0.414716,192.168.2.2,192.168.1.2,TCP,66,168448,5001  >  48012 [ACK] Seq=1 Ack=69505 Win=168448 Len=0 TSval=551973400 TSecr=457194837
35,0.572214,192.168.2.2,192.168.1.2,TCP,66,171008,5001  >  48012 [ACK] Seq=1 Ack=70953 Win=171008 Len=0 TSval=551973558 TSecr=457194889
37,0.584191,192.168.2.2,192.168.1.2,TCP,66,174080,5001  >  48012 [ACK] Seq=1 Ack=72401 Win=174080 Len=0 TSval=551973569 TSecr=457194921
39,0.596747,192.168.2.2,192.168.1.2,TCP,66,179712,5001  >  48012 [ACK] Seq=1 Ack=75297 Win=179712 Len=0 TSval=551973582 TSecr=457194933
41,0.620533,192.168.2.2,192.168.1.2,TCP,66,177152,5001  >  48012 [ACK] Seq=1 Ack=94121 Win=177152 Len=0 TSval=551973606 TSecr=457194945
43,0.778676,192.168.2.2,192.168.1.2,TCP,66,177152,5001  >  48012 [ACK] Seq=1 Ack=112945 Win=177152 Len=0 TSval=551973764 TSecr=457195078
46,0.936273,192.168.2.2,192.168.1.2,TCP,66,185344,5001  >  48012 [ACK] Seq=1 Ack=115841 Win=185344 Len=0 TSval=551973921 TSecr=457195103
48,0.961339,192.168.2.2,192.168.1.2,TCP,66,215040,5001  >  48012 [ACK] Seq=1 Ack=147697 Win=215040 Len=0 TSval=551973946 TSecr=457195115
54,1.226889,192.168.2.2,192.168.1.2,TCP,66,226304,5001  >  48012 [ACK] Seq=1 Ack=156385 Win=226304 Len=0 TSval=551974212 TSecr=457195273
56,1.299501,192.168.2.2,192.168.1.2,TCP,66,226304,5001  >  48012 [ACK] Seq=1 Ack=159281 Win=226304 Len=0 TSval=551974284 TSecr=457195285
60,1.323923,192.168.2.2,192.168.1.2,TCP,66,226304,5001  >  48012 [ACK] Seq=1 Ack=165073 Win=226304 Len=0 TSval=551974309 TSecr=457195297
62,1.372159,192.168.2.2,192.168.1.2,TCP,66,223744,5001  >  48012 [ACK] Seq=1 Ack=179553 Win=223744 Len=0 TSval=551974357 TSecr=457195321
64,1.49349,192.168.2.2,192.168.1.2,TCP,66,215040,5001  >  48012 [ACK] Seq=1 Ack=211409 Win=215040 Len=0 TSval=551974478 TSecr=457195479
67,1.760071,192.168.2.2,192.168.1.2,TCP,66,289792,5001  >  48012 [ACK] Seq=1 Ack=243265 Win=289792 Len=0 TSval=551974745 TSecr=457195636
72,2.026699,192.168.2.2,192.168.1.2,TCP,66,353792,5001  >  48012 [ACK] Seq=1 Ack=275121 Win=353792 Len=0 TSval=551975011 TSecr=457195661
76,2.293631,192.168.2.2,192.168.1.2,TCP,66,421376,5001  >  48012 [ACK] Seq=1 Ack=309873 Win=421376 Len=0 TSval=551975278 TSecr=457195852
78,2.584298,192.168.2.2,192.168.1.2,TCP,66,429056,5001  >  48012 [ACK] Seq=1 Ack=327249 Win=429056 Len=0 TSval=551975569 TSecr=457195927
80,2.730778,192.168.2.2,192.168.1.2,TCP,66,429056,5001  >  48012 [ACK] Seq=1 Ack=333041 Win=429056 Len=0 TSval=551975715 TSecr=457195999
82,2.77933,192.168.2.2,192.168.1.2,TCP,66,429056,5001  >  48012 [ACK] Seq=1 Ack=335937 Win=429056 Len=0 TSval=551975764 TSecr=457196024
84,2.803851,192.168.2.2,192.168.1.2,TCP,66,419840,5001  >  48012 [ACK] Seq=1 Ack=373585 Win=419840 Len=0 TSval=551975788 TSecr=457196072
87,3.118373,192.168.2.2,192.168.1.2,TCP,66,427520,5001  >  48012 [ACK] Seq=1 Ack=396753 Win=427520 Len=0 TSval=551976102 TSecr=457196193
89,3.312455,192.168.2.2,192.168.1.2,TCP,66,425984,5001  >  48012 [ACK] Seq=1 Ack=422817 Win=425984 Len=0 TSval=551976296 TSecr=457196365
91,3.531021,192.168.2.2,192.168.1.2,TCP,66,422912,5001  >  48012 [ACK] Seq=1 Ack=454673 Win=422912 Len=0 TSval=551976515 TSecr=457196460
95,3.798101,192.168.2.2,192.168.1.2,TCP,66,429056,5001  >  48012 [ACK] Seq=1 Ack=457569 Win=429056 Len=0 TSval=551976782 TSecr=457196726
97,3.822695,192.168.2.2,192.168.1.2,TCP,66,486912,5001  >  48012 [ACK] Seq=1 Ack=486529 Win=486912 Len=0 TSval=551976806 TSecr=457196880
100,4.065166,192.168.2.2,192.168.1.2,TCP,66,550400,5001  >  48012 [ACK] Seq=1 Ack=518385 Win=550400 Len=0 TSval=551977049 TSecr=457196993
103,4.331067,192.168.2.2,192.168.1.2,TCP,66,590848,5001  >  48012 [ACK] Seq=1 Ack=538657 Win=590848 Len=0 TSval=551977314 TSecr=457197284
105,4.501312,192.168.2.2,192.168.1.2,TCP,66,602624,5001  >  48012 [ACK] Seq=1 Ack=544449 Win=602624 Len=0 TSval=551977485 TSecr=457197430
107,4.549244,192.168.2.2,192.168.1.2,TCP,66,608256,5001  >  48012 [ACK] Seq=1 Ack=547345 Win=608256 Len=0 TSval=551977533 TSecr=457197479
109,4.573842,192.168.2.2,192.168.1.2,TCP,66,634368,5001  >  48012 [ACK] Seq=1 Ack=583545 Win=634368 Len=0 TSval=551977557 TSecr=457197503
113,4.87687,192.168.2.2,192.168.1.2,TCP,66,637440,5001  >  48012 [ACK] Seq=1 Ack=608161 Win=637440 Len=0 TSval=551977860 TSecr=457197817
119,5.083439,192.168.2.2,192.168.1.2,TCP,66,637440,5001  >  48012 [ACK] Seq=1 Ack=634225 Win=637440 Len=0 TSval=551978066 TSecr=457198011
122,5.300962,192.168.2.2,192.168.1.2,TCP,66,637440,5001  >  48012 [ACK] Seq=1 Ack=648705 Win=637440 Len=0 TSval=551978284 TSecr=457198230
124,5.422508,192.168.2.2,192.168.1.2,TCP,66,637440,5001  >  48012 [ACK] Seq=1 Ack=666081 Win=637440 Len=0 TSval=551978405 TSecr=457198411
126,5.567503,192.168.2.2,192.168.1.2,TCP,66,637440,5001  >  48012 [ACK] Seq=1 Ack=668977 Win=637440 Len=0 TSval=551978550 TSecr=457198497
128,5.592035,192.168.2.2,192.168.1.2,TCP,66,669184,5001  >  48012 [ACK] Seq=1 Ack=697937 Win=669184 Len=0 TSval=551978575 TSecr=457198521
132,5.834483,192.168.2.2,192.168.1.2,TCP,66,669184,5001  >  48012 [ACK] Seq=1 Ack=713865 Win=669184 Len=0 TSval=551978817 TSecr=457198764
134,5.968392,192.168.2.2,192.168.1.2,TCP,66,669184,5001  >  48012 [ACK] Seq=1 Ack=729793 Win=669184 Len=0 TSval=551978951 TSecr=457198923
137,6.100975,192.168.2.2,192.168.1.2,TCP,66,669184,5001  >  48012 [ACK] Seq=1 Ack=750065 Win=669184 Len=0 TSval=551979084 TSecr=457199030
139,6.27121,192.168.2.2,192.168.1.2,TCP,66,669184,5001  >  48012 [ACK] Seq=1 Ack=755857 Win=669184 Len=0 TSval=551979254 TSecr=457199200
141,6.319241,192.168.2.2,192.168.1.2,TCP,66,669184,5001  >  48012 [ACK] Seq=1 Ack=758753 Win=669184 Len=0 TSval=551979302 TSecr=457199248
143,6.343729,192.168.2.2,192.168.1.2,TCP,66,669184,5001  >  48012 [ACK] Seq=1 Ack=779025 Win=669184 Len=0 TSval=551979326 TSecr=457199272
145,6.51285,192.168.2.2,192.168.1.2,TCP,66,669184,5001  >  48012 [ACK] Seq=1 Ack=794953 Win=669184 Len=0 TSval=551979495 TSecr=457199435
147,6.646571,192.168.2.2,192.168.1.2,TCP,66,669184,5001  >  48012 [ACK] Seq=1 Ack=819569 Win=669184 Len=0 TSval=551979629 TSecr=457199575
150,6.853014,192.168.2.2,192.168.1.2,TCP,66,669184,5001  >  48012 [ACK] Seq=1 Ack=844185 Win=669184 Len=0 TSval=551979835 TSecr=457199782
153,7.059146,192.168.2.2,192.168.1.2,TCP,66,669184,5001  >  48012 [ACK] Seq=1 Ack=845633 Win=669184 Len=0 TSval=551980041 TSecr=457199947
155,7.071585,192.168.2.2,192.168.1.2,TCP,66,669184,5001  >  48012 [ACK] Seq=1 Ack=860113 Win=669184 Len=0 TSval=551980054 TSecr=457199999
157,7.193442,192.168.2.2,192.168.1.2,TCP,66,669184,5001  >  48012 [ACK] Seq=1 Ack=877489 Win=669184 Len=0 TSval=551980175 TSecr=457200120
159,7.338069,192.168.2.2,192.168.1.2,TCP,66,669184,5001  >  48012 [ACK] Seq=1 Ack=880385 Win=669184 Len=0 TSval=551980320 TSecr=457200265
161,7.362315,192.168.2.2,192.168.1.2,TCP,66,669184,5001  >  48012 [ACK] Seq=1 Ack=909345 Win=669184 Len=0 TSval=551980344 TSecr=457200290
163,7.605031,192.168.2.2,192.168.1.2,TCP,66,669184,5001  >  48012 [ACK] Seq=1 Ack=925273 Win=669184 Len=0 TSval=551980587 TSecr=457200532
165,7.737769,192.168.2.2,192.168.1.2,TCP,66,669184,5001  >  48012 [ACK] Seq=1 Ack=941201 Win=669184 Len=0 TSval=551980719 TSecr=457200666
168,7.872096,192.168.2.2,192.168.1.2,TCP,66,669184,5001  >  48012 [ACK] Seq=1 Ack=961473 Win=669184 Len=0 TSval=551980854 TSecr=457200799
172,8.042193,192.168.2.2,192.168.1.2,TCP,66,669184,5001  >  48012 [ACK] Seq=1 Ack=967265 Win=669184 Len=0 TSval=551981024 TSecr=457200969
174,8.09026,192.168.2.2,192.168.1.2,TCP,66,669184,5001  >  48012 [ACK] Seq=1 Ack=970161 Win=669184 Len=0 TSval=551981072 TSecr=457201017
176,8.114694,192.168.2.2,192.168.1.2,TCP,66,669184,5001  >  48012 [ACK] Seq=1 Ack=974505 Win=669184 Len=0 TSval=551981096 TSecr=457201041
178,8.150902,192.168.2.2,192.168.1.2,TCP,66,669184,5001  >  48012 [ACK] Seq=1 Ack=1006361 Win=669184 Len=0 TSval=551981132 TSecr=457201210
180,8.41717,192.168.2.2,192.168.1.2,TCP,66,669184,5001  >  48012 [ACK] Seq=1 Ack=1030977 Win=669184 Len=0 TSval=551981399 TSecr=457201344
182,8.623357,192.168.2.2,192.168.1.2,TCP,66,669184,5001  >  48012 [ACK] Seq=1 Ack=1039665 Win=669184 Len=0 TSval=551981605 TSecr=457201550
185,8.69652,192.168.2.2,192.168.1.2,TCP,66,669184,5001  >  48012 [ACK] Seq=1 Ack=1057041 Win=669184 Len=0 TSval=551981678 TSecr=457201756
187,8.841986,192.168.2.2,192.168.1.2,TCP,66,669184,5001  >  48012 [ACK] Seq=1 Ack=1071521 Win=669184 Len=0 TSval=551981823 TSecr=457201769
189,8.963423,192.168.2.2,192.168.1.2,TCP,66,669184,5001  >  48012 [ACK] Seq=1 Ack=1088897 Win=669184 Len=0 TSval=551981945 TSecr=457201890
192,9.108485,192.168.2.2,192.168.1.2,TCP,66,669184,5001  >  48012 [ACK] Seq=1 Ack=1091793 Win=669184 Len=0 TSval=551982090 TSecr=457202035
194,9.133026,192.168.2.2,192.168.1.2,TCP,66,669184,5001  >  48012 [ACK] Seq=1 Ack=1104825 Win=669184 Len=0 TSval=551982114 TSecr=457202059
196,9.241572,192.168.2.2,192.168.1.2,TCP,66,669184,5001  >  48012 [ACK] Seq=1 Ack=1136681 Win=669184 Len=0 TSval=551982223 TSecr=457202302
198,9.508314,192.168.2.2,192.168.1.2,TCP,66,669184,5001  >  48012 [ACK] Seq=1 Ack=1152609 Win=669184 Len=0 TSval=551982489 TSecr=457202435
200,9.641588,192.168.2.2,192.168.1.2,TCP,66,669184,5001  >  48012 [ACK] Seq=1 Ack=1169985 Win=669184 Len=0 TSval=551982622 TSecr=457202569
202,9.787627,192.168.2.2,192.168.1.2,TCP,66,669184,5001  >  48012 [ACK] Seq=1 Ack=1172881 Win=669184 Len=0 TSval=551982768 TSecr=457202569
205,9.811582,192.168.2.2,192.168.1.2,TCP,66,669184,5001  >  48012 [ACK] Seq=1 Ack=1178673 Win=669184 Len=0 TSval=551982792 TSecr=457202739
207,9.860115,192.168.2.2,192.168.1.2,TCP,66,669184,5001  >  48012 [ACK] Seq=1 Ack=1181569 Win=669184 Len=0 TSval=551982841 TSecr=457202787
209,9.884726,192.168.2.2,192.168.1.2,TCP,66,669184,5001  >  48012 [ACK] Seq=1 Ack=1185913 Win=669184 Len=0 TSval=551982865 TSecr=457202811
211,9.92094,192.168.2.2,192.168.1.2,TCP,66,669184,5001  >  48012 [ACK] Seq=1 Ack=1217769 Win=669184 Len=0 TSval=551982902 TSecr=457202847
214,10.187102,192.168.2.2,192.168.1.2,TCP,66,669184,5001  >  48012 [ACK] Seq=1 Ack=1235145 Win=669184 Len=0 TSval=551983168 TSecr=457203114
215,10.332456,192.168.2.2,192.168.1.2,TCP,66,669184,5001  >  48012 [ACK] Seq=1 Ack=1251073 Win=669184 Len=0 TSval=551983313 TSecr=457203320
216,10.466312,192.168.2.2,192.168.1.2,TCP,66,669184,5001  >  48012 [ACK] Seq=1 Ack=1268449 Win=669184 Len=0 TSval=551983447 TSecr=457203393
217,10.611324,192.168.2.2,192.168.1.2,TCP,66,669184,5001  >  48012 [ACK] Seq=1 Ack=1282929 Win=669184 Len=0 TSval=551983592 TSecr=457203538
218,10.732993,192.168.2.2,192.168.1.2,TCP,66,669184,5001  >  48012 [ACK] Seq=1 Ack=1300305 Win=669184 Len=0 TSval=551983713 TSecr=457203660
220,10.878268,192.168.2.2,192.168.1.2,TCP,66,669184,5001  >  48012 [ACK] Seq=1 Ack=1303201 Win=669184 Len=0 TSval=551983858 TSecr=457203805
221,10.902545,192.168.2.2,192.168.1.2,TCP,66,669184,5001  >  48012 [ACK] Seq=1 Ack=1316233 Win=669184 Len=0 TSval=551983883 TSecr=457203829
222,11.01217,192.168.2.2,192.168.1.2,TCP,66,669184,5001  >  48012 [ACK] Seq=1 Ack=1348089 Win=669184 Len=0 TSval=551983992 TSecr=457203938
224,11.277962,192.168.2.2,192.168.1.2,TCP,66,669184,5001  >  48012 [ACK] Seq=1 Ack=1364017 Win=669184 Len=0 TSval=551984258 TSecr=457204204
225,11.411163,192.168.2.2,192.168.1.2,TCP,66,669184,5001  >  48012 [ACK] Seq=1 Ack=1365465 Win=669184 Len=0 TSval=551984391 TSecr=457204337
226,11.423835,192.168.2.2,192.168.1.2,TCP,66,669184,5001  >  48012 [ACK] Seq=1 Ack=1384289 Win=669184 Len=0 TSval=551984404 TSecr=457204483
227,11.581179,192.168.2.2,192.168.1.2,TCP,66,669184,5001  >  48012 [ACK] Seq=1 Ack=1390081 Win=669184 Len=0 TSval=551984561 TSecr=457204507
228,11.62933,192.168.2.2,192.168.1.2,TCP,66,669184,5001  >  48012 [ACK] Seq=1 Ack=1392977 Win=669184 Len=0 TSval=551984609 TSecr=457204556
229,11.654178,192.168.2.2,192.168.1.2,TCP,66,669184,5001  >  48012 [ACK] Seq=1 Ack=1397321 Win=669184 Len=0 TSval=551984634 TSecr=457204580
230,11.690423,192.168.2.2,192.168.1.2,TCP,66,669184,5001  >  48012 [ACK] Seq=1 Ack=1429177 Win=669184 Len=0 TSval=551984670 TSecr=457204617
236,11.9578,192.168.2.2,192.168.1.2,TCP,66,669184,5001  >  48012 [ACK] Seq=1 Ack=1430625 Win=669184 Len=0 TSval=551984937 TSecr=457206385
240,11.970678,192.168.2.2,192.168.1.2,TCP,66,669184,5001  >  48012 [ACK] Seq=1 Ack=1433521 Win=669184 Len=0 TSval=551984950 TSecr=457206385
243,11.994235,192.168.2.2,192.168.1.2,TCP,66,669184,5001  >  48012 [ACK] Seq=1 Ack=1434969 Win=669184 Len=0 TSval=551984974 TSecr=457206385
245,12.006997,192.168.2.2,192.168.1.2,TCP,66,654848,5001  >  48012 [ACK] Seq=1 Ack=1495785 Win=654848 Len=0 TSval=551984987 TSecr=457206652
251,12.515158,192.168.2.2,192.168.1.2,TCP,66,652800,5001  >  48012 [ACK] Seq=1 Ack=1560945 Win=652800 Len=0 TSval=551985494 TSecr=457206653
256,13.060552,192.168.2.2,192.168.1.2,TCP,66,652800,5001  >  48012 [ACK] Seq=1 Ack=1626105 Win=652800 Len=0 TSval=551986040 TSecr=457206653
260,13.605118,192.168.2.2,192.168.1.2,TCP,66,669184,5001  >  48012 [ACK] Seq=1 Ack=1643481 Win=669184 Len=0 TSval=551986584 TSecr=457206653
262,13.750371,192.168.2.2,192.168.1.2,TCP,66,669184,5001  >  48012 [ACK] Seq=1 Ack=1649273 Win=669184 Len=0 TSval=551986729 TSecr=457206665
264,13.799015,192.168.2.2,192.168.1.2,TCP,66,669184,5001  >  48012 [ACK] Seq=1 Ack=1652169 Win=669184 Len=0 TSval=551986778 TSecr=457206689
266,13.823058,192.168.2.2,192.168.1.2,TCP,66,665600,5001  >  48012 [ACK] Seq=1 Ack=1691265 Win=665600 Len=0 TSval=551986802 TSecr=457206702
268,14.15044,192.168.2.2,192.168.1.2,TCP,66,652800,5001  >  48012 [ACK] Seq=1 Ack=1756425 Win=652800 Len=0 TSval=551987129 TSecr=457206702
269,14.69508,192.168.2.2,192.168.1.2,TCP,66,669184,5001  >  48012 [ACK] Seq=1 Ack=1773801 Win=669184 Len=0 TSval=551987673 TSecr=457206702
272,14.841248,192.168.2.2,192.168.1.2,TCP,66,661504,5001  >  48012 [ACK] Seq=1 Ack=1821585 Win=661504 Len=0 TSval=551987819 TSecr=457207210
274,15.241788,192.168.2.2,192.168.1.2,TCP,66,652800,5001  >  48012 [ACK] Seq=1 Ack=1886745 Win=652800 Len=0 TSval=551988220 TSecr=457207210
275,15.786712,192.168.2.2,192.168.1.2,TCP,66,669184,5001  >  48012 [ACK] Seq=1 Ack=1904121 Win=669184 Len=0 TSval=551988764 TSecr=457207623
277,15.93261,192.168.2.2,192.168.1.2,TCP,66,661504,5001  >  48012 [ACK] Seq=1 Ack=1951905 Win=661504 Len=0 TSval=551988910 TSecr=457207755
279,16.332927,192.168.2.2,192.168.1.2,TCP,66,652800,5001  >  48012 [ACK] Seq=1 Ack=2017065 Win=652800 Len=0 TSval=551989310 TSecr=457207755
280,16.87806,192.168.2.2,192.168.1.2,TCP,66,669184,5001  >  48012 [ACK] Seq=1 Ack=2034441 Win=669184 Len=0 TSval=551989855 TSecr=457208134
281,17.023515,192.168.2.2,192.168.1.2,TCP,66,667648,5001  >  48012 [ACK] Seq=1 Ack=2069193 Win=667648 Len=0 TSval=551990001 TSecr=457208299
288,17.313695,192.168.2.2,192.168.1.2,TCP,66,669184,5001  >  48012 [ACK] Seq=1 Ack=2080777 Win=669184 Len=0 TSval=551990291 TSecr=457208444
293,17.410479,192.168.2.2,192.168.1.2,TCP,66,669184,5001  >  48012 [ACK] Seq=1 Ack=2082225 Win=669184 Len=0 TSval=551990387 TSecr=457208493
298,17.424765,192.168.2.2,192.168.1.2,TCP,66,669184,5001  >  48012 [ACK] Seq=1 Ack=2085121 Win=669184 Len=0 TSval=551990402 TSecr=457211716
299,17.449643,192.168.2.2,192.168.1.2,TCP,66,669184,5001  >  48012 [ACK] Seq=1 Ack=2088017 Win=669184 Len=0 TSval=551990426 TSecr=457211733
301,17.474094,192.168.2.2,192.168.1.2,TCP,66,669184,5001  >  48012 [ACK] Seq=1 Ack=2090913 Win=669184 Len=0 TSval=551990451 TSecr=457211751
302,17.4988,192.168.2.2,192.168.1.2,TCP,66,669184,5001  >  48012 [ACK] Seq=1 Ack=2093809 Win=669184 Len=0 TSval=551990476 TSecr=457211769
305,17.523141,192.168.2.2,192.168.1.2,TCP,66,669184,5001  >  48012 [ACK] Seq=1 Ack=2095257 Win=669184 Len=0 TSval=551990500 TSecr=457211788
307,17.534909,192.168.2.2,192.168.1.2,TCP,66,669184,5001  >  48012 [ACK] Seq=1 Ack=2098153 Win=669184 Len=0 TSval=551990512 TSecr=457212006
310,17.558805,192.168.2.2,192.168.1.2,TCP,66,669184,5001  >  48012 [ACK] Seq=1 Ack=2101049 Win=669184 Len=0 TSval=551990536 TSecr=457212024
313,17.582992,192.168.2.2,192.168.1.2,TCP,66,669184,5001  >  48012 [ACK] Seq=1 Ack=2103945 Win=669184 Len=0 TSval=551990560 TSecr=457212042
316,17.607226,192.168.2.2,192.168.1.2,TCP,66,669184,5001  >  48012 [ACK] Seq=1 Ack=2106841 Win=669184 Len=0 TSval=551990584 TSecr=457212060
319,17.631445,192.168.2.2,192.168.1.2,TCP,66,669184,5001  >  48012 [ACK] Seq=1 Ack=2108289 Win=669184 Len=0 TSval=551990608 TSecr=457212102
321,17.64364,192.168.2.2,192.168.1.2,TCP,66,669184,5001  >  48012 [ACK] Seq=1 Ack=2109737 Win=669184 Len=0 TSval=551990620 TSecr=457212191
323,17.655665,192.168.2.2,192.168.1.2,TCP,66,669184,5001  >  48012 [ACK] Seq=1 Ack=2111185 Win=669184 Len=0 TSval=551990632 TSecr=457212202
325,17.667935,192.168.2.2,192.168.1.2,TCP,66,669184,5001  >  48012 [ACK] Seq=1 Ack=2112633 Win=669184 Len=0 TSval=551990645 TSecr=457212215
327,17.679961,192.168.2.2,192.168.1.2,TCP,66,669184,5001  >  48012 [ACK] Seq=1 Ack=2114081 Win=669184 Len=0 TSval=551990657 TSecr=457212227
329,17.704688,192.168.2.2,192.168.1.2,TCP,66,669184,5001  >  48012 [ACK] Seq=1 Ack=2116977 Win=669184 Len=0 TSval=551990681 TSecr=457212238
332,17.72894,192.168.2.2,192.168.1.2,TCP,66,669184,5001  >  48012 [ACK] Seq=1 Ack=2119873 Win=669184 Len=0 TSval=551990706 TSecr=457212263
333,17.752771,192.168.2.2,192.168.1.2,TCP,66,669184,5001  >  48012 [ACK] Seq=1 Ack=2122769 Win=669184 Len=0 TSval=551990729 TSecr=457212286
334,17.776947,192.168.2.2,192.168.1.2,TCP,66,669184,5001  >  48012 [ACK] Seq=1 Ack=2125665 Win=669184 Len=0 TSval=551990754 TSecr=457212311
337,17.801462,192.168.2.2,192.168.1.2,TCP,66,669184,5001  >  48012 [ACK] Seq=1 Ack=2128561 Win=669184 Len=0 TSval=551990778 TSecr=457212335
339,17.813163,192.168.2.2,192.168.1.2,TCP,66,669184,5001  >  48012 [ACK] Seq=1 Ack=2131457 Win=669184 Len=0 TSval=551990790 TSecr=457212360
342,17.837688,192.168.2.2,192.168.1.2,TCP,66,669184,5001  >  48012 [ACK] Seq=1 Ack=2134353 Win=669184 Len=0 TSval=551990814 TSecr=457212378
345,17.862209,192.168.2.2,192.168.1.2,TCP,66,669184,5001  >  48012 [ACK] Seq=1 Ack=2137249 Win=669184 Len=0 TSval=551990839 TSecr=457212396
348,17.886716,192.168.2.2,192.168.1.2,TCP,66,669184,5001  >  48012 [ACK] Seq=1 Ack=2140145 Win=669184 Len=0 TSval=551990863 TSecr=457212415
352,17.922124,192.168.2.2,192.168.1.2,TCP,66,669184,5001  >  48012 [ACK] Seq=1 Ack=2143041 Win=669184 Len=0 TSval=551990899 TSecr=457212469
355,17.946522,192.168.2.2,192.168.1.2,TCP,66,669184,5001  >  48012 [ACK] Seq=1 Ack=2145937 Win=669184 Len=0 TSval=551990923 TSecr=457212500
358,17.971018,192.168.2.2,192.168.1.2,TCP,66,669184,5001  >  48012 [ACK] Seq=1 Ack=2148833 Win=669184 Len=0 TSval=551990948 TSecr=457212523
361,17.994895,192.168.2.2,192.168.1.2,TCP,66,669184,5001  >  48012 [ACK] Seq=1 Ack=2151729 Win=669184 Len=0 TSval=551990971 TSecr=457212546
364,18.019083,192.168.2.2,192.168.1.2,TCP,66,669184,5001  >  48012 [ACK] Seq=1 Ack=2154625 Win=669184 Len=0 TSval=551990996 TSecr=457212568
367,18.043452,192.168.2.2,192.168.1.2,TCP,66,669184,5001  >  48012 [ACK] Seq=1 Ack=2157521 Win=669184 Len=0 TSval=551991020 TSecr=457212590
371,18.067472,192.168.2.2,192.168.1.2,TCP,66,669184,5001  >  48012 [ACK] Seq=1 Ack=2160417 Win=669184 Len=0 TSval=551991044 TSecr=457212614
374,18.091771,192.168.2.2,192.168.1.2,TCP,66,669184,5001  >  48012 [ACK] Seq=1 Ack=2163313 Win=669184 Len=0 TSval=551991068 TSecr=457212638
377,18.116003,192.168.2.2,192.168.1.2,TCP,66,669184,5001  >  48012 [ACK] Seq=1 Ack=2166209 Win=669184 Len=0 TSval=551991093 TSecr=457212663
380,18.140162,192.168.2.2,192.168.1.2,TCP,66,669184,5001  >  48012 [ACK] Seq=1 Ack=2169105 Win=669184 Len=0 TSval=551991117 TSecr=457212687
383,18.165002,192.168.2.2,192.168.1.2,TCP,66,669184,5001  >  48012 [ACK] Seq=1 Ack=2172001 Win=669184 Len=0 TSval=551991142 TSecr=457212711
386,18.188662,192.168.2.2,192.168.1.2,TCP,66,669184,5001  >  48012 [ACK] Seq=1 Ack=2174897 Win=669184 Len=0 TSval=551991165 TSecr=457212735
390,18.214064,192.168.2.2,192.168.1.2,TCP,66,669184,5001  >  48012 [ACK] Seq=1 Ack=2177793 Win=669184 Len=0 TSval=551991191 TSecr=457212759
393,18.238576,192.168.2.2,192.168.1.2,TCP,66,669184,5001  >  48012 [ACK] Seq=1 Ack=2180689 Win=669184 Len=0 TSval=551991215 TSecr=457212783
395,18.262168,192.168.2.2,192.168.1.2,TCP,66,669184,5001  >  48012 [ACK] Seq=1 Ack=2183585 Win=669184 Len=0 TSval=551991239 TSecr=457212808
398,18.286612,192.168.2.2,192.168.1.2,TCP,66,669184,5001  >  48012 [ACK] Seq=1 Ack=2186481 Win=669184 Len=0 TSval=551991263 TSecr=457212832
399,18.310759,192.168.2.2,192.168.1.2,TCP,66,669184,5001  >  48012 [ACK] Seq=1 Ack=2189377 Win=669184 Len=0 TSval=551991287 TSecr=457212857
400,18.334739,192.168.2.2,192.168.1.2,TCP,66,669184,5001  >  48012 [ACK] Seq=1 Ack=2192273 Win=669184 Len=0 TSval=551991311 TSecr=457212880
402,18.347346,192.168.2.2,192.168.1.2,TCP,66,669184,5001  >  48012 [ACK] Seq=1 Ack=2195169 Win=669184 Len=0 TSval=551991324 TSecr=457212906
405,18.371098,192.168.2.2,192.168.1.2,TCP,66,669184,5001  >  48012 [ACK] Seq=1 Ack=2198065 Win=669184 Len=0 TSval=551991347 TSecr=457212923
409,18.395461,192.168.2.2,192.168.1.2,TCP,66,669184,5001  >  48012 [ACK] Seq=1 Ack=2200961 Win=669184 Len=0 TSval=551991372 TSecr=457212941
412,18.419854,192.168.2.2,192.168.1.2,TCP,66,669184,5001  >  48012 [ACK] Seq=1 Ack=2203857 Win=669184 Len=0 TSval=551991396 TSecr=457212958
415,18.443883,192.168.2.2,192.168.1.2,TCP,66,669184,5001  >  48012 [ACK] Seq=1 Ack=2206753 Win=669184 Len=0 TSval=551991420 TSecr=457212976
418,18.480216,192.168.2.2,192.168.1.2,TCP,66,669184,5001  >  48012 [ACK] Seq=1 Ack=2209649 Win=669184 Len=0 TSval=551991457 TSecr=457213026
421,18.504628,192.168.2.2,192.168.1.2,TCP,66,669184,5001  >  48012 [ACK] Seq=1 Ack=2212545 Win=669184 Len=0 TSval=551991481 TSecr=457213053
424,18.529213,192.168.2.2,192.168.1.2,TCP,66,669184,5001  >  48012 [ACK] Seq=1 Ack=2215441 Win=669184 Len=0 TSval=551991506 TSecr=457213075
427,18.55277,192.168.2.2,192.168.1.2,TCP,66,669184,5001  >  48012 [ACK] Seq=1 Ack=2218337 Win=669184 Len=0 TSval=551991529 TSecr=457213098
430,18.57718,192.168.2.2,192.168.1.2,TCP,66,669184,5001  >  48012 [ACK] Seq=1 Ack=2221233 Win=669184 Len=0 TSval=551991553 TSecr=457213120
433,18.601661,192.168.2.2,192.168.1.2,TCP,66,669184,5001  >  48012 [ACK] Seq=1 Ack=2224129 Win=669184 Len=0 TSval=551991578 TSecr=457213143
436,18.625451,192.168.2.2,192.168.1.2,TCP,66,669184,5001  >  48012 [ACK] Seq=1 Ack=2227025 Win=669184 Len=0 TSval=551991602 TSecr=457213172
439,18.64967,192.168.2.2,192.168.1.2,TCP,66,669184,5001  >  48012 [ACK] Seq=1 Ack=2229921 Win=669184 Len=0 TSval=551991626 TSecr=457213196
442,18.674289,192.168.2.2,192.168.1.2,TCP,66,669184,5001  >  48012 [ACK] Seq=1 Ack=2232817 Win=669184 Len=0 TSval=551991651 TSecr=457213221
445,18.698704,192.168.2.2,192.168.1.2,TCP,66,669184,5001  >  48012 [ACK] Seq=1 Ack=2235713 Win=669184 Len=0 TSval=551991675 TSecr=457213244
448,18.723177,192.168.2.2,192.168.1.2,TCP,66,669184,5001  >  48012 [ACK] Seq=1 Ack=2238609 Win=669184 Len=0 TSval=551991699 TSecr=457213269
451,18.74657,192.168.2.2,192.168.1.2,TCP,66,669184,5001  >  48012 [ACK] Seq=1 Ack=2241505 Win=669184 Len=0 TSval=551991723 TSecr=457213293
454,18.77121,192.168.2.2,192.168.1.2,TCP,66,669184,5001  >  48012 [ACK] Seq=1 Ack=2244401 Win=669184 Len=0 TSval=551991747 TSecr=457213317
457,18.795008,192.168.2.2,192.168.1.2,TCP,66,669184,5001  >  48012 [ACK] Seq=1 Ack=2247297 Win=669184 Len=0 TSval=551991771 TSecr=457213341
459,18.819218,192.168.2.2,192.168.1.2,TCP,66,669184,5001  >  48012 [ACK] Seq=1 Ack=2250193 Win=669184 Len=0 TSval=551991795 TSecr=457213369
462,18.843721,192.168.2.2,192.168.1.2,TCP,66,669184,5001  >  48012 [ACK] Seq=1 Ack=2253089 Win=669184 Len=0 TSval=551991820 TSecr=457213392
463,18.868314,192.168.2.2,192.168.1.2,TCP,66,669184,5001  >  48012 [ACK] Seq=1 Ack=2255985 Win=669184 Len=0 TSval=551991844 TSecr=457213415
464,18.891883,192.168.2.2,192.168.1.2,TCP,66,669184,5001  >  48012 [ACK] Seq=1 Ack=2258881 Win=669184 Len=0 TSval=551991868 TSecr=457213438
466,18.904485,192.168.2.2,192.168.1.2,TCP,66,669184,5001  >  48012 [ACK] Seq=1 Ack=2261777 Win=669184 Len=0 TSval=551991881 TSecr=457213462
469,18.929078,192.168.2.2,192.168.1.2,TCP,66,669184,5001  >  48012 [ACK] Seq=1 Ack=2264673 Win=669184 Len=0 TSval=551991905 TSecr=457213480
472,18.952511,192.168.2.2,192.168.1.2,TCP,66,669184,5001  >  48012 [ACK] Seq=1 Ack=2267569 Win=669184 Len=0 TSval=551991929 TSecr=457213498
476,18.977021,192.168.2.2,192.168.1.2,TCP,66,669184,5001  >  48012 [ACK] Seq=1 Ack=2270465 Win=669184 Len=0 TSval=551991953 TSecr=457213515
479,19.000921,192.168.2.2,192.168.1.2,TCP,66,669184,5001  >  48012 [ACK] Seq=1 Ack=2273361 Win=669184 Len=0 TSval=551991977 TSecr=457213533
482,19.037861,192.168.2.2,192.168.1.2,TCP,66,669184,5001  >  48012 [ACK] Seq=1 Ack=2276257 Win=669184 Len=0 TSval=551992014 TSecr=457213583
486,19.061492,192.168.2.2,192.168.1.2,TCP,66,669184,5001  >  48012 [ACK] Seq=1 Ack=2279153 Win=669184 Len=0 TSval=551992038 TSecr=457213610
489,19.086906,192.168.2.2,192.168.1.2,TCP,66,669184,5001  >  48012 [ACK] Seq=1 Ack=2282049 Win=669184 Len=0 TSval=551992063 TSecr=457213633
492,19.109919,192.168.2.2,192.168.1.2,TCP,66,669184,5001  >  48012 [ACK] Seq=1 Ack=2284945 Win=669184 Len=0 TSval=551992086 TSecr=457213655
495,19.134353,192.168.2.2,192.168.1.2,TCP,66,669184,5001  >  48012 [ACK] Seq=1 Ack=2287841 Win=669184 Len=0 TSval=551992110 TSecr=457213677
498,19.158865,192.168.2.2,192.168.1.2,TCP,66,669184,5001  >  48012 [ACK] Seq=1 Ack=2290737 Win=669184 Len=0 TSval=551992135 TSecr=457213700
501,19.183375,192.168.2.2,192.168.1.2,TCP,66,669184,5001  >  48012 [ACK] Seq=1 Ack=2293633 Win=669184 Len=0 TSval=551992159 TSecr=457213729
505,19.207892,192.168.2.2,192.168.1.2,TCP,66,669184,5001  >  48012 [ACK] Seq=1 Ack=2296529 Win=669184 Len=0 TSval=551992184 TSecr=457213753
508,19.231849,192.168.2.2,192.168.1.2,TCP,66,669184,5001  >  48012 [ACK] Seq=1 Ack=2299425 Win=669184 Len=0 TSval=551992208 TSecr=457213778
511,19.25609,192.168.2.2,192.168.1.2,TCP,66,669184,5001  >  48012 [ACK] Seq=1 Ack=2302321 Win=669184 Len=0 TSval=551992232 TSecr=457213801
514,19.280254,192.168.2.2,192.168.1.2,TCP,66,669184,5001  >  48012 [ACK] Seq=1 Ack=2305217 Win=669184 Len=0 TSval=551992256 TSecr=457213825
517,19.304566,192.168.2.2,192.168.1.2,TCP,66,669184,5001  >  48012 [ACK] Seq=1 Ack=2308113 Win=669184 Len=0 TSval=551992280 TSecr=457213850
520,19.329387,192.168.2.2,192.168.1.2,TCP,66,669184,5001  >  48012 [ACK] Seq=1 Ack=2311009 Win=669184 Len=0 TSval=551992305 TSecr=457213874
523,19.353884,192.168.2.2,192.168.1.2,TCP,66,669184,5001  >  48012 [ACK] Seq=1 Ack=2313905 Win=669184 Len=0 TSval=551992330 TSecr=457213899
525,19.377372,192.168.2.2,192.168.1.2,TCP,66,669184,5001  >  48012 [ACK] Seq=1 Ack=2316801 Win=669184 Len=0 TSval=551992353 TSecr=457213923
528,19.401928,192.168.2.2,192.168.1.2,TCP,66,669184,5001  >  48012 [ACK] Seq=1 Ack=2319697 Win=669184 Len=0 TSval=551992378 TSecr=457213947
529,19.425661,192.168.2.2,192.168.1.2,TCP,66,669184,5001  >  48012 [ACK] Seq=1 Ack=2322593 Win=669184 Len=0 TSval=551992402 TSecr=457213971
530,19.449924,192.168.2.2,192.168.1.2,TCP,66,669184,5001  >  48012 [ACK] Seq=1 Ack=2325489 Win=669184 Len=0 TSval=551992426 TSecr=457213996
532,19.462709,192.168.2.2,192.168.1.2,TCP,66,669184,5001  >  48012 [ACK] Seq=1 Ack=2328385 Win=669184 Len=0 TSval=551992439 TSecr=457214020
536,19.487237,192.168.2.2,192.168.1.2,TCP,66,669184,5001  >  48012 [ACK] Seq=1 Ack=2331281 Win=669184 Len=0 TSval=551992463 TSecr=457214038
539,19.510372,192.168.2.2,192.168.1.2,TCP,66,669184,5001  >  48012 [ACK] Seq=1 Ack=2334177 Win=669184 Len=0 TSval=551992486 TSecr=457214055
542,19.535147,192.168.2.2,192.168.1.2,TCP,66,669184,5001  >  48012 [ACK] Seq=1 Ack=2337073 Win=669184 Len=0 TSval=551992511 TSecr=457214073
545,19.558873,192.168.2.2,192.168.1.2,TCP,66,669184,5001  >  48012 [ACK] Seq=1 Ack=2339969 Win=669184 Len=0 TSval=551992535 TSecr=457214091
548,19.596,192.168.2.2,192.168.1.2,TCP,66,669184,5001  >  48012 [ACK] Seq=1 Ack=2342865 Win=669184 Len=0 TSval=551992572 TSecr=457214141
551,19.619489,192.168.2.2,192.168.1.2,TCP,66,669184,5001  >  48012 [ACK] Seq=1 Ack=2345761 Win=669184 Len=0 TSval=551992595 TSecr=457214167
554,19.643977,192.168.2.2,192.168.1.2,TCP,66,669184,5001  >  48012 [ACK] Seq=1 Ack=2348657 Win=669184 Len=0 TSval=551992620 TSecr=457214190
557,19.668015,192.168.2.2,192.168.1.2,TCP,66,669184,5001  >  48012 [ACK] Seq=1 Ack=2351553 Win=669184 Len=0 TSval=551992644 TSecr=457214212
560,19.692094,192.168.2.2,192.168.1.2,TCP,66,669184,5001  >  48012 [ACK] Seq=1 Ack=2354449 Win=669184 Len=0 TSval=551992668 TSecr=457214235
563,19.716309,192.168.2.2,192.168.1.2,TCP,66,669184,5001  >  48012 [ACK] Seq=1 Ack=2357345 Win=669184 Len=0 TSval=551992692 TSecr=457214258
566,19.740621,192.168.2.2,192.168.1.2,TCP,66,669184,5001  >  48012 [ACK] Seq=1 Ack=2360241 Win=669184 Len=0 TSval=551992716 TSecr=457214287
569,19.765027,192.168.2.2,192.168.1.2,TCP,66,669184,5001  >  48012 [ACK] Seq=1 Ack=2363137 Win=669184 Len=0 TSval=551992741 TSecr=457214310
572,19.789523,192.168.2.2,192.168.1.2,TCP,66,669184,5001  >  48012 [ACK] Seq=1 Ack=2366033 Win=669184 Len=0 TSval=551992765 TSecr=457214335
575,19.813267,192.168.2.2,192.168.1.2,TCP,66,669184,5001  >  48012 [ACK] Seq=1 Ack=2368929 Win=669184 Len=0 TSval=551992789 TSecr=457214359
578,19.837423,192.168.2.2,192.168.1.2,TCP,66,669184,5001  >  48012 [ACK] Seq=1 Ack=2371825 Win=669184 Len=0 TSval=551992813 TSecr=457214383
581,19.862118,192.168.2.2,192.168.1.2,TCP,66,669184,5001  >  48012 [ACK] Seq=1 Ack=2374721 Win=669184 Len=0 TSval=551992838 TSecr=457214407
584,19.886554,192.168.2.2,192.168.1.2,TCP,66,669184,5001  >  48012 [ACK] Seq=1 Ack=2377617 Win=669184 Len=0 TSval=551992862 TSecr=457214431
587,19.910259,192.168.2.2,192.168.1.2,TCP,66,669184,5001  >  48012 [ACK] Seq=1 Ack=2380513 Win=669184 Len=0 TSval=551992886 TSecr=457214456
589,19.934632,192.168.2.2,192.168.1.2,TCP,66,669184,5001  >  48012 [ACK] Seq=1 Ack=2383409 Win=669184 Len=0 TSval=551992910 TSecr=457214480
592,19.959122,192.168.2.2,192.168.1.2,TCP,66,669184,5001  >  48012 [ACK] Seq=1 Ack=2386305 Win=669184 Len=0 TSval=551992935 TSecr=457214504
593,19.982758,192.168.2.2,192.168.1.2,TCP,66,669184,5001  >  48012 [ACK] Seq=1 Ack=2389201 Win=669184 Len=0 TSval=551992958 TSecr=457214528
594,20.008141,192.168.2.2,192.168.1.2,TCP,66,669184,5001  >  48012 [ACK] Seq=1 Ack=2392097 Win=669184 Len=0 TSval=551992984 TSecr=457214553
596,20.019892,192.168.2.2,192.168.1.2,TCP,66,669184,5001  >  48012 [ACK] Seq=1 Ack=2394993 Win=669184 Len=0 TSval=551992995 TSecr=457214577
599,20.043434,192.168.2.2,192.168.1.2,TCP,66,669184,5001  >  48012 [ACK] Seq=1 Ack=2397889 Win=669184 Len=0 TSval=551993019 TSecr=457214595
603,20.067862,192.168.2.2,192.168.1.2,TCP,66,669184,5001  >  48012 [ACK] Seq=1 Ack=2400785 Win=669184 Len=0 TSval=551993043 TSecr=457214612
606,20.091751,192.168.2.2,192.168.1.2,TCP,66,669184,5001  >  48012 [ACK] Seq=1 Ack=2403681 Win=669184 Len=0 TSval=551993067 TSecr=457214630
610,20.116901,192.168.2.2,192.168.1.2,TCP,66,669184,5001  >  48012 [ACK] Seq=1 Ack=2406577 Win=669184 Len=0 TSval=551993092 TSecr=457214648
613,20.152422,192.168.2.2,192.168.1.2,TCP,66,669184,5001  >  48012 [ACK] Seq=1 Ack=2409473 Win=669184 Len=0 TSval=551993128 TSecr=457214699
616,20.176675,192.168.2.2,192.168.1.2,TCP,66,669184,5001  >  48012 [ACK] Seq=1 Ack=2412369 Win=669184 Len=0 TSval=551993152 TSecr=457214726
620,20.201527,192.168.2.2,192.168.1.2,TCP,66,669184,5001  >  48012 [ACK] Seq=1 Ack=2415265 Win=669184 Len=0 TSval=551993177 TSecr=457214750
623,20.226693,192.168.2.2,192.168.1.2,TCP,66,669184,5001  >  48012 [ACK] Seq=1 Ack=2418161 Win=669184 Len=0 TSval=551993202 TSecr=457214772
626,20.250004,192.168.2.2,192.168.1.2,TCP,66,669184,5001  >  48012 [ACK] Seq=1 Ack=2421057 Win=669184 Len=0 TSval=551993225 TSecr=457214795
629,20.274315,192.168.2.2,192.168.1.2,TCP,66,669184,5001  >  48012 [ACK] Seq=1 Ack=2423953 Win=669184 Len=0 TSval=551993250 TSecr=457214819
632,20.298474,192.168.2.2,192.168.1.2,TCP,66,669184,5001  >  48012 [ACK] Seq=1 Ack=2426849 Win=669184 Len=0 TSval=551993274 TSecr=457214843
635,20.323188,192.168.2.2,192.168.1.2,TCP,66,669184,5001  >  48012 [ACK] Seq=1 Ack=2429745 Win=669184 Len=0 TSval=551993299 TSecr=457214867
638,20.346891,192.168.2.2,192.168.1.2,TCP,66,669184,5001  >  48012 [ACK] Seq=1 Ack=2432641 Win=669184 Len=0 TSval=551993322 TSecr=457214892
641,20.371175,192.168.2.2,192.168.1.2,TCP,66,669184,5001  >  48012 [ACK] Seq=1 Ack=2435537 Win=669184 Len=0 TSval=551993347 TSecr=457214917
644,20.395753,192.168.2.2,192.168.1.2,TCP,66,669184,5001  >  48012 [ACK] Seq=1 Ack=2438433 Win=669184 Len=0 TSval=551993371 TSecr=457214941
647,20.419554,192.168.2.2,192.168.1.2,TCP,66,669184,5001  >  48012 [ACK] Seq=1 Ack=2441329 Win=669184 Len=0 TSval=551993395 TSecr=457214965
650,20.443808,192.168.2.2,192.168.1.2,TCP,66,669184,5001  >  48012 [ACK] Seq=1 Ack=2444225 Win=669184 Len=0 TSval=551993419 TSecr=457214989
653,20.468001,192.168.2.2,192.168.1.2,TCP,66,669184,5001  >  48012 [ACK] Seq=1 Ack=2447121 Win=669184 Len=0 TSval=551993443 TSecr=457215014
655,20.492756,192.168.2.2,192.168.1.2,TCP,66,669184,5001  >  48012 [ACK] Seq=1 Ack=2450017 Win=669184 Len=0 TSval=551993468 TSecr=457215037
658,20.517237,192.168.2.2,192.168.1.2,TCP,66,669184,5001  >  48012 [ACK] Seq=1 Ack=2452913 Win=669184 Len=0 TSval=551993493 TSecr=457215062
659,20.540699,192.168.2.2,192.168.1.2,TCP,66,669184,5001  >  48012 [ACK] Seq=1 Ack=2455809 Win=669184 Len=0 TSval=551993516 TSecr=457215086
660,20.565358,192.168.2.2,192.168.1.2,TCP,66,669184,5001  >  48012 [ACK] Seq=1 Ack=2458705 Win=669184 Len=0 TSval=551993541 TSecr=457215110
662,20.577041,192.168.2.2,192.168.1.2,TCP,66,669184,5001  >  48012 [ACK] Seq=1 Ack=2461601 Win=669184 Len=0 TSval=551993552 TSecr=457215134
665,20.601523,192.168.2.2,192.168.1.2,TCP,66,669184,5001  >  48012 [ACK] Seq=1 Ack=2464497 Win=669184 Len=0 TSval=551993577 TSecr=457215152
669,20.626071,192.168.2.2,192.168.1.2,TCP,66,669184,5001  >  48012 [ACK] Seq=1 Ack=2467393 Win=669184 Len=0 TSval=551993601 TSecr=457215169
672,20.649733,192.168.2.2,192.168.1.2,TCP,66,669184,5001  >  48012 [ACK] Seq=1 Ack=2470289 Win=669184 Len=0 TSval=551993625 TSecr=457215187
675,20.674033,192.168.2.2,192.168.1.2,TCP,66,669184,5001  >  48012 [ACK] Seq=1 Ack=2473185 Win=669184 Len=0 TSval=551993649 TSecr=457215205
678,20.71037,192.168.2.2,192.168.1.2,TCP,66,669184,5001  >  48012 [ACK] Seq=1 Ack=2476081 Win=669184 Len=0 TSval=551993686 TSecr=457215256
681,20.734466,192.168.2.2,192.168.1.2,TCP,66,669184,5001  >  48012 [ACK] Seq=1 Ack=2478977 Win=669184 Len=0 TSval=551993710 TSecr=457215282
684,20.759263,192.168.2.2,192.168.1.2,TCP,66,669184,5001  >  48012 [ACK] Seq=1 Ack=2481873 Win=669184 Len=0 TSval=551993734 TSecr=457215304
687,20.782958,192.168.2.2,192.168.1.2,TCP,66,669184,5001  >  48012 [ACK] Seq=1 Ack=2484769 Win=669184 Len=0 TSval=551993758 TSecr=457215328
690,20.807291,192.168.2.2,192.168.1.2,TCP,66,669184,5001  >  48012 [ACK] Seq=1 Ack=2487665 Win=669184 Len=0 TSval=551993782 TSecr=457215351
693,20.831389,192.168.2.2,192.168.1.2,TCP,66,669184,5001  >  48012 [ACK] Seq=1 Ack=2490561 Win=669184 Len=0 TSval=551993807 TSecr=457215373
696,20.855661,192.168.2.2,192.168.1.2,TCP,66,669184,5001  >  48012 [ACK] Seq=1 Ack=2493457 Win=669184 Len=0 TSval=551993831 TSecr=457215401
699,20.879869,192.168.2.2,192.168.1.2,TCP,66,669184,5001  >  48012 [ACK] Seq=1 Ack=2496353 Win=669184 Len=0 TSval=551993855 TSecr=457215425
702,20.904033,192.168.2.2,192.168.1.2,TCP,66,669184,5001  >  48012 [ACK] Seq=1 Ack=2499249 Win=669184 Len=0 TSval=551993879 TSecr=457215450
705,20.928902,192.168.2.2,192.168.1.2,TCP,66,669184,5001  >  48012 [ACK] Seq=1 Ack=2502145 Win=669184 Len=0 TSval=551993904 TSecr=457215473
708,20.952551,192.168.2.2,192.168.1.2,TCP,66,669184,5001  >  48012 [ACK] Seq=1 Ack=2505041 Win=669184 Len=0 TSval=551993928 TSecr=457215498
711,20.977395,192.168.2.2,192.168.1.2,TCP,66,669184,5001  >  48012 [ACK] Seq=1 Ack=2507937 Win=669184 Len=0 TSval=551993952 TSecr=457215522
714,21.001048,192.168.2.2,192.168.1.2,TCP,66,669184,5001  >  48012 [ACK] Seq=1 Ack=2510833 Win=669184 Len=0 TSval=551993976 TSecr=457215546
717,21.025465,192.168.2.2,192.168.1.2,TCP,66,669184,5001  >  48012 [ACK] Seq=1 Ack=2513729 Win=669184 Len=0 TSval=551994001 TSecr=457215570
719,21.049947,192.168.2.2,192.168.1.2,TCP,66,669184,5001  >  48012 [ACK] Seq=1 Ack=2516625 Win=669184 Len=0 TSval=551994025 TSecr=457215594
723,21.074417,192.168.2.2,192.168.1.2,TCP,66,669184,5001  >  48012 [ACK] Seq=1 Ack=2519521 Win=669184 Len=0 TSval=551994049 TSecr=457215619
724,21.097951,192.168.2.2,192.168.1.2,TCP,66,669184,5001  >  48012 [ACK] Seq=1 Ack=2522417 Win=669184 Len=0 TSval=551994073 TSecr=457215643
726,21.122436,192.168.2.2,192.168.1.2,TCP,66,669184,5001  >  48012 [ACK] Seq=1 Ack=2525313 Win=669184 Len=0 TSval=551994097 TSecr=457215668
728,21.134203,192.168.2.2,192.168.1.2,TCP,66,669184,5001  >  48012 [ACK] Seq=1 Ack=2528209 Win=669184 Len=0 TSval=551994109 TSecr=457215691
731,21.158862,192.168.2.2,192.168.1.2,TCP,66,669184,5001  >  48012 [ACK] Seq=1 Ack=2531105 Win=669184 Len=0 TSval=551994134 TSecr=457215709
735,21.183096,192.168.2.2,192.168.1.2,TCP,66,669184,5001  >  48012 [ACK] Seq=1 Ack=2534001 Win=669184 Len=0 TSval=551994158 TSecr=457215726
738,21.206836,192.168.2.2,192.168.1.2,TCP,66,669184,5001  >  48012 [ACK] Seq=1 Ack=2536897 Win=669184 Len=0 TSval=551994182 TSecr=457215744
742,21.244834,192.168.2.2,192.168.1.2,TCP,66,669184,5001  >  48012 [ACK] Seq=1 Ack=2539793 Win=669184 Len=0 TSval=551994220 TSecr=457215762
745,21.268196,192.168.2.2,192.168.1.2,TCP,66,669184,5001  >  48012 [ACK] Seq=1 Ack=2542689 Win=669184 Len=0 TSval=551994243 TSecr=457215812
748,21.292459,192.168.2.2,192.168.1.2,TCP,66,669184,5001  >  48012 [ACK] Seq=1 Ack=2545585 Win=669184 Len=0 TSval=551994267 TSecr=457215838
751,21.316962,192.168.2.2,192.168.1.2,TCP,66,669184,5001  >  48012 [ACK] Seq=1 Ack=2548481 Win=669184 Len=0 TSval=551994292 TSecr=457215861
754,21.340848,192.168.2.2,192.168.1.2,TCP,66,669184,5001  >  48012 [ACK] Seq=1 Ack=2551377 Win=669184 Len=0 TSval=551994316 TSecr=457215884
757,21.365147,192.168.2.2,192.168.1.2,TCP,66,669184,5001  >  48012 [ACK] Seq=1 Ack=2554273 Win=669184 Len=0 TSval=551994340 TSecr=457215907
760,21.38945,192.168.2.2,192.168.1.2,TCP,66,669184,5001  >  48012 [ACK] Seq=1 Ack=2557169 Win=669184 Len=0 TSval=551994364 TSecr=457215935
763,21.413531,192.168.2.2,192.168.1.2,TCP,66,669184,5001  >  48012 [ACK] Seq=1 Ack=2560065 Win=669184 Len=0 TSval=551994388 TSecr=457215958
766,21.438499,192.168.2.2,192.168.1.2,TCP,66,669184,5001  >  48012 [ACK] Seq=1 Ack=2562961 Win=669184 Len=0 TSval=551994413 TSecr=457215982
