No.,Time,Source,Destination,Protocol,Length,Calculated window size,Info
2,0.034287,192.168.2.2,192.168.1.2,TCP,66,125,5001  >  58166 [ACK] Seq=1 Ack=4294955713 Win=125 Len=0 TSval=1140249938 TSecr=1525035151
5,0.118574,192.168.2.2,192.168.1.2,TCP,66,165,5001  >  58166 [ACK] Seq=1 Ack=4294965849 Win=165 Len=0 TSval=1140250022 TSecr=1525035152
9,0.203358,192.168.2.2,192.168.1.2,TCP,66,170,5001  >  58166 [ACK] Seq=1 Ack=1 Win=170 Len=0 TSval=1140250107 TSecr=1525035152
12,0.217136,192.168.2.2,192.168.1.2,TCP,66,176,5001  >  58166 [ACK] Seq=1 Ack=1449 Win=176 Len=0 TSval=1140250120 TSecr=1525035165
14,0.228831,192.168.2.2,192.168.1.2,TCP,66,238,5001  >  58166 [ACK] Seq=1 Ack=17377 Win=238 Len=0 TSval=1140250132 TSecr=1525035200
16,0.362156,192.168.2.2,192.168.1.2,TCP,66,249,5001  >  58166 [ACK] Seq=1 Ack=20273 Win=249 Len=0 TSval=1140250265 TSecr=1525035225
18,0.386339,192.168.2.2,192.168.1.2,TCP,66,255,5001  >  58166 [ACK] Seq=1 Ack=21721 Win=255 Len=0 TSval=1140250289 TSecr=1525035284
20,0.398407,192.168.2.2,192.168.1.2,TCP,66,329,5001  >  58166 [ACK] Seq=1 Ack=40545 Win=329 Len=0 TSval=1140250302 TSecr=1525035285
24,0.555785,192.168.2.2,192.168.1.2,TCP,66,334,5001  >  58166 [ACK] Seq=1 Ack=41993 Win=334 Len=0 TSval=1140250459 TSecr=1525035342
26,0.567932,192.168.2.2,192.168.1.2,TCP,66,340,5001  >  58166 [ACK] Seq=1 Ack=43441 Win=340 Len=0 TSval=1140250471 TSecr=1525035369
28,0.580013,192.168.2.2,192.168.1.2,TCP,66,351,5001  >  58166 [ACK] Seq=1 Ack=46337 Win=351 Len=0 TSval=1140250483 TSecr=1525035382
30,0.60442,192.168.2.2,192.168.1.2,TCP,66,346,5001  >  58166 [ACK] Seq=1 Ack=65161 Win=346 Len=0 TSval=1140250507 TSecr=1525035394
32,0.761898,192.168.2.2,192.168.1.2,TCP,66,346,5001  >  58166 [ACK] Seq=1 Ack=83985 Win=346 Len=0 TSval=1140250665 TSecr=1525035527
35,0.9197,192.168.2.2,192.168.1.2,TCP,66,362,5001  >  58166 [ACK] Seq=1 Ack=86881 Win=362 Len=0 TSval=1140250823 TSecr=1525035552
37,0.944249,192.168.2.2,192.168.1.2,TCP,66,420,5001  >  58166 [ACK] Seq=1 Ack=118737 Win=420 Len=0 TSval=1140250847 TSecr=1525035564
41,1.20985,192.168.2.2,192.168.1.2,TCP,66,442,5001  >  58166 [ACK] Seq=1 Ack=127425 Win=442 Len=0 TSval=1140251113 TSecr=1525035721
43,1.283486,192.168.2.2,192.168.1.2,TCP,66,442,5001  >  58166 [ACK] Seq=1 Ack=130321 Win=442 Len=0 TSval=1140251186 TSecr=1525035733
45,1.306984,192.168.2.2,192.168.1.2,TCP,66,442,5001  >  58166 [ACK] Seq=1 Ack=136113 Win=442 Len=0 TSval=1140251210 TSecr=1525035745
48,1.355916,192.168.2.2,192.168.1.2,TCP,66,437,5001  >  58166 [ACK] Seq=1 Ack=150593 Win=437 Len=0 TSval=1140251259 TSecr=1525035770
52,1.476475,192.168.2.2,192.168.1.2,TCP,66,420,5001  >  58166 [ACK] Seq=1 Ack=182449 Win=420 Len=0 TSval=1140251379 TSecr=1525035927
55,1.742965,192.168.2.2,192.168.1.2,TCP,66,566,5001  >  58166 [ACK] Seq=1 Ack=214305 Win=566 Len=0 TSval=1140251645 TSecr=1525036085
58,2.009639,192.168.2.2,192.168.1.2,TCP,66,691,5001  >  58166 [ACK] Seq=1 Ack=246161 Win=691 Len=0 TSval=1140251912 TSecr=1525036109
63,2.277784,192.168.2.2,192.168.1.2,TCP,66,823,5001  >  58166 [ACK] Seq=1 Ack=280913 Win=823 Len=0 TSval=1140252180 TSecr=1525036284
67,2.568459,192.168.2.2,192.168.1.2,TCP,66,838,5001  >  58166 [ACK] Seq=1 Ack=298289 Win=838 Len=0 TSval=1140252471 TSecr=1525036375
69,2.713821,192.168.2.2,192.168.1.2,TCP,66,838,5001  >  58166 [ACK] Seq=1 Ack=304081 Win=838 Len=0 TSval=1140252616 TSecr=1525036448
71,2.762386,192.168.2.2,192.168.1.2,TCP,66,838,5001  >  58166 [ACK] Seq=1 Ack=306977 Win=838 Len=0 TSval=1140252664 TSecr=1525036472
73,2.786807,192.168.2.2,192.168.1.2,TCP,66,820,5001  >  58166 [ACK] Seq=1 Ack=344625 Win=820 Len=0 TSval=1140252689 TSecr=1525036521
76,3.101402,192.168.2.2,192.168.1.2,TCP,66,835,5001  >  58166 [ACK] Seq=1 Ack=367793 Win=835 Len=0 TSval=1140253003 TSecr=1525036641
78,3.295465,192.168.2.2,192.168.1.2,TCP,66,832,5001  >  58166 [ACK] Seq=1 Ack=393857 Win=832 Len=0 TSval=1140253197 TSecr=1525036796
81,3.514142,192.168.2.2,192.168.1.2,TCP,66,826,5001  >  58166 [ACK] Seq=1 Ack=425713 Win=826 Len=0 TSval=1140253416 TSecr=1525036907
84,3.779808,192.168.2.2,192.168.1.2,TCP,66,838,5001  >  58166 [ACK] Seq=1 Ack=428609 Win=838 Len=0 TSval=1140253681 TSecr=1525037174
87,3.805391,192.168.2.2,192.168.1.2,TCP,66,951,5001  >  58166 [ACK] Seq=1 Ack=457569 Win=951 Len=0 TSval=1140253707 TSecr=1525037308
90,4.048131,192.168.2.2,192.168.1.2,TCP,66,1075,5001  >  58166 [ACK] Seq=1 Ack=489425 Win=1075 Len=0 TSval=1140253949 TSecr=1525037442
93,4.314186,192.168.2.2,192.168.1.2,TCP,66,1154,5001  >  58166 [ACK] Seq=1 Ack=509697 Win=1154 Len=0 TSval=1140254215 TSecr=1525037733
95,4.483624,192.168.2.2,192.168.1.2,TCP,66,1177,5001  >  58166 [ACK] Seq=1 Ack=515489 Win=1177 Len=0 TSval=1140254385 TSecr=1525037878
97,4.532162,192.168.2.2,192.168.1.2,TCP,66,1188,5001  >  58166 [ACK] Seq=1 Ack=518385 Win=1188 Len=0 TSval=1140254433 TSecr=1525037926
99,4.556823,192.168.2.2,192.168.1.2,TCP,66,1239,5001  >  58166 [ACK] Seq=1 Ack=554585 Win=1239 Len=0 TSval=1140254458 TSecr=1525037951
103,4.859886,192.168.2.2,192.168.1.2,TCP,66,1245,5001  >  58166 [ACK] Seq=1 Ack=579201 Win=1245 Len=0 TSval=1140254761 TSecr=1525038265
108,5.066368,192.168.2.2,192.168.1.2,TCP,66,1245,5001  >  58166 [ACK] Seq=1 Ack=605265 Win=1245 Len=0 TSval=1140254967 TSecr=1525038459
111,5.283968,192.168.2.2,192.168.1.2,TCP,66,1245,5001  >  58166 [ACK] Seq=1 Ack=619745 Win=1245 Len=0 TSval=1140255185 TSecr=1525038678
113,5.405443,192.168.2.2,192.168.1.2,TCP,66,1245,5001  >  58166 [ACK] Seq=1 Ack=637121 Win=1245 Len=0 TSval=1140255306 TSecr=1525038844
115,5.55052,192.168.2.2,192.168.1.2,TCP,66,1245,5001  >  58166 [ACK] Seq=1 Ack=640017 Win=1245 Len=0 TSval=1140255451 TSecr=1525038943
117,5.575021,192.168.2.2,192.168.1.2,TCP,66,1307,5001  >  58166 [ACK] Seq=1 Ack=668977 Win=1307 Len=0 TSval=1140255476 TSecr=1525038969
120,5.817709,192.168.2.2,192.168.1.2,TCP,66,1307,5001  >  58166 [ACK] Seq=1 Ack=684905 Win=1307 Len=0 TSval=1140255718 TSecr=1525039212
123,5.951327,192.168.2.2,192.168.1.2,TCP,66,1307,5001  >  58166 [ACK] Seq=1 Ack=700833 Win=1307 Len=0 TSval=1140255852 TSecr=1525039355
126,6.084685,192.168.2.2,192.168.1.2,TCP,66,1307,5001  >  58166 [ACK] Seq=1 Ack=721105 Win=1307 Len=0 TSval=1140255985 TSecr=1525039477
128,6.254151,192.168.2.2,192.168.1.2,TCP,66,1307,5001  >  58166 [ACK] Seq=1 Ack=726897 Win=1307 Len=0 TSval=1140256154 TSecr=1525039647
130,6.30226,192.168.2.2,192.168.1.2,TCP,66,1307,5001  >  58166 [ACK] Seq=1 Ack=729793 Win=1307 Len=0 TSval=1140256202 TSecr=1525039695
132,6.326266,192.168.2.2,192.168.1.2,TCP,66,1307,5001  >  58166 [ACK] Seq=1 Ack=750065 Win=1307 Len=0 TSval=1140256226 TSecr=1525039720
134,6.496314,192.168.2.2,192.168.1.2,TCP,66,1307,5001  >  58166 [ACK] Seq=1 Ack=765993 Win=1307 Len=0 TSval=1140256396 TSecr=1525039867
137,6.629567,192.168.2.2,192.168.1.2,TCP,66,1307,5001  >  58166 [ACK] Seq=1 Ack=790609 Win=1307 Len=0 TSval=1140256530 TSecr=1525040023
140,6.836037,192.168.2.2,192.168.1.2,TCP,66,1307,5001  >  58166 [ACK] Seq=1 Ack=815225 Win=1307 Len=0 TSval=1140256736 TSecr=1525040229
143,7.042131,192.168.2.2,192.168.1.2,TCP,66,1307,5001  >  58166 [ACK] Seq=1 Ack=816673 Win=1307 Len=0 TSval=1140256942 TSecr=1525040378
145,7.054899,192.168.2.2,192.168.1.2,TCP,66,1307,5001  >  58166 [ACK] Seq=1 Ack=831153 Win=1307 Len=0 TSval=1140256955 TSecr=1525040447
147,7.175412,192.168.2.2,192.168.1.2,TCP,66,1307,5001  >  58166 [ACK] Seq=1 Ack=848529 Win=1307 Len=0 TSval=1140257075 TSecr=1525040568
149,7.32057,192.168.2.2,192.168.1.2,TCP,66,1307,5001  >  58166 [ACK] Seq=1 Ack=851425 Win=1307 Len=0 TSval=1140257220 TSecr=1525040713
151,7.347953,192.168.2.2,192.168.1.2,TCP,66,1307,5001  >  58166 [ACK] Seq=1 Ack=880385 Win=1307 Len=0 TSval=1140257248 TSecr=1525040738
153,7.588018,192.168.2.2,192.168.1.2,TCP,66,1307,5001  >  58166 [ACK] Seq=1 Ack=896313 Win=1307 Len=0 TSval=1140257488 TSecr=1525040980
155,7.721263,192.168.2.2,192.168.1.2,TCP,66,1307,5001  >  58166 [ACK] Seq=1 Ack=912241 Win=1307 Len=0 TSval=1140257621 TSecr=1525041114
158,7.855152,192.168.2.2,192.168.1.2,TCP,66,1307,5001  >  58166 [ACK] Seq=1 Ack=932513 Win=1307 Len=0 TSval=1140257755 TSecr=1525041247
161,8.024809,192.168.2.2,192.168.1.2,TCP,66,1307,5001  >  58166 [ACK] Seq=1 Ack=938305 Win=1307 Len=0 TSval=1140257924 TSecr=1525041416
163,8.073356,192.168.2.2,192.168.1.2,TCP,66,1307,5001  >  58166 [ACK] Seq=1 Ack=941201 Win=1307 Len=0 TSval=1140257973 TSecr=1525041465
165,8.097663,192.168.2.2,192.168.1.2,TCP,66,1307,5001  >  58166 [ACK] Seq=1 Ack=945545 Win=1307 Len=0 TSval=1140257997 TSecr=1525041489
167,8.133948,192.168.2.2,192.168.1.2,TCP,66,1307,5001  >  58166 [ACK] Seq=1 Ack=977401 Win=1307 Len=0 TSval=1140258033 TSecr=1525041658
169,8.400175,192.168.2.2,192.168.1.2,TCP,66,1307,5001  >  58166 [ACK] Seq=1 Ack=1002017 Win=1307 Len=0 TSval=1140258299 TSecr=1525041792
171,8.606288,192.168.2.2,192.168.1.2,TCP,66,1307,5001  >  58166 [ACK] Seq=1 Ack=1010705 Win=1307 Len=0 TSval=1140258505 TSecr=1525041998
174,8.679552,192.168.2.2,192.168.1.2,TCP,66,1307,5001  >  58166 [ACK] Seq=1 Ack=1028081 Win=1307 Len=0 TSval=1140258579 TSecr=1525042204
176,8.82492,192.168.2.2,192.168.1.2,TCP,66,1307,5001  >  58166 [ACK] Seq=1 Ack=1042561 Win=1307 Len=0 TSval=1140258724 TSecr=1525042217
178,8.946005,192.168.2.2,192.168.1.2,TCP,66,1307,5001  >  58166 [ACK] Seq=1 Ack=1059937 Win=1307 Len=0 TSval=1140258845 TSecr=1525042337
181,9.091502,192.168.2.2,192.168.1.2,TCP,66,1307,5001  >  58166 [ACK] Seq=1 Ack=1062833 Win=1307 Len=0 TSval=1140258990 TSecr=1525042482
183,9.115604,192.168.2.2,192.168.1.2,TCP,66,1307,5001  >  58166 [ACK] Seq=1 Ack=1075865 Win=1307 Len=0 TSval=1140259014 TSecr=1525042510
185,9.224657,192.168.2.2,192.168.1.2,TCP,66,1307,5001  >  58166 [ACK] Seq=1 Ack=1107721 Win=1307 Len=0 TSval=1140259123 TSecr=1525042750
187,9.491318,192.168.2.2,192.168.1.2,TCP,66,1307,5001  >  58166 [ACK] Seq=1 Ack=1123649 Win=1307 Len=0 TSval=1140259390 TSecr=1525042883
189,9.62458,192.168.2.2,192.168.1.2,TCP,66,1307,5001  >  58166 [ACK] Seq=1 Ack=1141025 Win=1307 Len=0 TSval=1140259523 TSecr=1525043017
192,9.770468,192.168.2.2,192.168.1.2,TCP,66,1307,5001  >  58166 [ACK] Seq=1 Ack=1149713 Win=1307 Len=0 TSval=1140259669 TSecr=1525043186
194,9.843173,192.168.2.2,192.168.1.2,TCP,66,1307,5001  >  58166 [ACK] Seq=1 Ack=1152609 Win=1307 Len=0 TSval=1140259742 TSecr=1525043235
196,9.867623,192.168.2.2,192.168.1.2,TCP,66,1307,5001  >  58166 [ACK] Seq=1 Ack=1156953 Win=1307 Len=0 TSval=1140259766 TSecr=1525043259
198,9.903892,192.168.2.2,192.168.1.2,TCP,66,1307,5001  >  58166 [ACK] Seq=1 Ack=1188809 Win=1307 Len=0 TSval=1140259802 TSecr=1525043295
201,10.170468,192.168.2.2,192.168.1.2,TCP,66,1307,5001  >  58166 [ACK] Seq=1 Ack=1206185 Win=1307 Len=0 TSval=1140260069 TSecr=1525043561
202,10.315692,192.168.2.2,192.168.1.2,TCP,66,1307,5001  >  58166 [ACK] Seq=1 Ack=1222113 Win=1307 Len=0 TSval=1140260214 TSecr=1525043767
203,10.448747,192.168.2.2,192.168.1.2,TCP,66,1307,5001  >  58166 [ACK] Seq=1 Ack=1239489 Win=1307 Len=0 TSval=1140260347 TSecr=1525043841
204,10.594084,192.168.2.2,192.168.1.2,TCP,66,1307,5001  >  58166 [ACK] Seq=1 Ack=1253969 Win=1307 Len=0 TSval=1140260492 TSecr=1525043986
205,10.715346,192.168.2.2,192.168.1.2,TCP,66,1307,5001  >  58166 [ACK] Seq=1 Ack=1271345 Win=1307 Len=0 TSval=1140260613 TSecr=1525044107
207,10.861323,192.168.2.2,192.168.1.2,TCP,66,1307,5001  >  58166 [ACK] Seq=1 Ack=1274241 Win=1307 Len=0 TSval=1140260759 TSecr=1525044252
208,10.885921,192.168.2.2,192.168.1.2,TCP,66,1307,5001  >  58166 [ACK] Seq=1 Ack=1287273 Win=1307 Len=0 TSval=1140260784 TSecr=1525044276
209,10.994741,192.168.2.2,192.168.1.2,TCP,66,1307,5001  >  58166 [ACK] Seq=1 Ack=1319129 Win=1307 Len=0 TSval=1140260893 TSecr=1525044385
211,11.260999,192.168.2.2,192.168.1.2,TCP,66,1307,5001  >  58166 [ACK] Seq=1 Ack=1335057 Win=1307 Len=0 TSval=1140261159 TSecr=1525044652
212,11.394226,192.168.2.2,192.168.1.2,TCP,66,1307,5001  >  58166 [ACK] Seq=1 Ack=1336505 Win=1307 Len=0 TSval=1140261292 TSecr=1525044785
213,11.406779,192.168.2.2,192.168.1.2,TCP,66,1307,5001  >  58166 [ACK] Seq=1 Ack=1361121 Win=1307 Len=0 TSval=1140261304 TSecr=1525044931
214,11.612666,192.168.2.2,192.168.1.2,TCP,66,1307,5001  >  58166 [ACK] Seq=1 Ack=1364017 Win=1307 Len=0 TSval=1140261510 TSecr=1525045004
215,11.637297,192.168.2.2,192.168.1.2,TCP,66,1307,5001  >  58166 [ACK] Seq=1 Ack=1368361 Win=1307 Len=0 TSval=1140261535 TSecr=1525045028
216,11.673379,192.168.2.2,192.168.1.2,TCP,66,1307,5001  >  58166 [ACK] Seq=1 Ack=1400217 Win=1307 Len=0 TSval=1140261571 TSecr=1525045064
222,11.940787,192.168.2.2,192.168.1.2,TCP,66,1307,5001  >  58166 [ACK] Seq=1 Ack=1401665 Win=1307 Len=0 TSval=1140261838 TSecr=1525046833
226,11.952892,192.168.2.2,192.168.1.2,TCP,66,1307,5001  >  58166 [ACK] Seq=1 Ack=1404561 Win=1307 Len=0 TSval=1140261850 TSecr=1525046833
229,11.977673,192.168.2.2,192.168.1.2,TCP,66,1307,5001  >  58166 [ACK] Seq=1 Ack=1406009 Win=1307 Len=0 TSval=1140261875 TSecr=1525046833
231,11.989289,192.168.2.2,192.168.1.2,TCP,66,1279,5001  >  58166 [ACK] Seq=1 Ack=1466825 Win=1279 Len=0 TSval=1140261887 TSecr=1525047100
236,12.498631,192.168.2.2,192.168.1.2,TCP,66,1275,5001  >  58166 [ACK] Seq=1 Ack=1531985 Win=1275 Len=0 TSval=1140262396 TSecr=1525047101
241,13.043061,192.168.2.2,192.168.1.2,TCP,66,1275,5001  >  58166 [ACK] Seq=1 Ack=1597145 Win=1275 Len=0 TSval=1140262940 TSecr=1525047101
245,13.588947,192.168.2.2,192.168.1.2,TCP,66,1307,5001  >  58166 [ACK] Seq=1 Ack=1614521 Win=1307 Len=0 TSval=1140263485 TSecr=1525047101
247,13.733564,192.168.2.2,192.168.1.2,TCP,66,1307,5001  >  58166 [ACK] Seq=1 Ack=1620313 Win=1307 Len=0 TSval=1140263630 TSecr=1525047112
249,13.782519,192.168.2.2,192.168.1.2,TCP,66,1307,5001  >  58166 [ACK] Seq=1 Ack=1623209 Win=1307 Len=0 TSval=1140263679 TSecr=1525047137
251,13.813316,192.168.2.2,192.168.1.2,TCP,66,1300,5001  >  58166 [ACK] Seq=1 Ack=1662305 Win=1300 Len=0 TSval=1140263710 TSecr=1525047149
253,14.133384,192.168.2.2,192.168.1.2,TCP,66,1275,5001  >  58166 [ACK] Seq=1 Ack=1727465 Win=1275 Len=0 TSval=1140264030 TSecr=1525047149
255,14.67901,192.168.2.2,192.168.1.2,TCP,66,1307,5001  >  58166 [ACK] Seq=1 Ack=1744841 Win=1307 Len=0 TSval=1140264575 TSecr=1525047150
257,14.824261,192.168.2.2,192.168.1.2,TCP,66,1292,5001  >  58166 [ACK] Seq=1 Ack=1792625 Win=1292 Len=0 TSval=1140264720 TSecr=1525047658
260,15.224219,192.168.2.2,192.168.1.2,TCP,66,1275,5001  >  58166 [ACK] Seq=1 Ack=1857785 Win=1275 Len=0 TSval=1140265120 TSecr=1525047658
261,15.769096,192.168.2.2,192.168.1.2,TCP,66,1307,5001  >  58166 [ACK] Seq=1 Ack=1875161 Win=1307 Len=0 TSval=1140265665 TSecr=1525048055
263,15.915123,192.168.2.2,192.168.1.2,TCP,66,1292,5001  >  58166 [ACK] Seq=1 Ack=1922945 Win=1292 Len=0 TSval=1140265811 TSecr=1525048202
265,16.314801,192.168.2.2,192.168.1.2,TCP,66,1275,5001  >  58166 [ACK] Seq=1 Ack=1988105 Win=1275 Len=0 TSval=1140266210 TSecr=1525048202
266,16.859866,192.168.2.2,192.168.1.2,TCP,66,1307,5001  >  58166 [ACK] Seq=1 Ack=2005481 Win=1307 Len=0 TSval=1140266755 TSecr=1525048203
267,17.005527,192.168.2.2,192.168.1.2,TCP,66,1304,5001  >  58166 [ACK] Seq=1 Ack=2040233 Win=1304 Len=0 TSval=1140266900 TSecr=1525048748
274,17.296195,192.168.2.2,192.168.1.2,TCP,66,1307,5001  >  58166 [ACK] Seq=1 Ack=2051817 Win=1307 Len=0 TSval=1140267191 TSecr=1525048892
279,17.393156,192.168.2.2,192.168.1.2,TCP,66,1307,5001  >  58166 [ACK] Seq=1 Ack=2053265 Win=1307 Len=0 TSval=1140267288 TSecr=1525048941
284,17.407786,192.168.2.2,192.168.1.2,TCP,66,1307,5001  >  58166 [ACK] Seq=1 Ack=2056161 Win=1307 Len=0 TSval=1140267302 TSecr=1525052162
285,17.432238,192.168.2.2,192.168.1.2,TCP,66,1307,5001  >  58166 [ACK] Seq=1 Ack=2059057 Win=1307 Len=0 TSval=1140267327 TSecr=1525052181
286,17.457862,192.168.2.2,192.168.1.2,TCP,66,1307,5001  >  58166 [ACK] Seq=1 Ack=2061953 Win=1307 Len=0 TSval=1140267352 TSecr=1525052199
288,17.48126,192.168.2.2,192.168.1.2,TCP,66,1307,5001  >  58166 [ACK] Seq=1 Ack=2064849 Win=1307 Len=0 TSval=1140267376 TSecr=1525052217
291,17.50548,192.168.2.2,192.168.1.2,TCP,66,1307,5001  >  58166 [ACK] Seq=1 Ack=2066297 Win=1307 Len=0 TSval=1140267400 TSecr=1525052235
293,17.517618,192.168.2.2,192.168.1.2,TCP,66,1307,5001  >  58166 [ACK] Seq=1 Ack=2069193 Win=1307 Len=0 TSval=1140267412 TSecr=1525052453
296,17.541813,192.168.2.2,192.168.1.2,TCP,66,1307,5001  >  58166 [ACK] Seq=1 Ack=2072089 Win=1307 Len=0 TSval=1140267436 TSecr=1525052471
299,17.566178,192.168.2.2,192.168.1.2,TCP,66,1307,5001  >  58166 [ACK] Seq=1 Ack=2074985 Win=1307 Len=0 TSval=1140267461 TSecr=1525052489
302,17.590579,192.168.2.2,192.168.1.2,TCP,66,1307,5001  >  58166 [ACK] Seq=1 Ack=2077881 Win=1307 Len=0 TSval=1140267485 TSecr=1525052508
305,17.614509,192.168.2.2,192.168.1.2,TCP,66,1307,5001  >  58166 [ACK] Seq=1 Ack=2079329 Win=1307 Len=0 TSval=1140267509 TSecr=1525052550
307,17.626616,192.168.2.2,192.168.1.2,TCP,66,1307,5001  >  58166 [ACK] Seq=1 Ack=2080777 Win=1307 Len=0 TSval=1140267521 TSecr=1525052638
309,17.63916,192.168.2.2,192.168.1.2,TCP,66,1307,5001  >  58166 [ACK] Seq=1 Ack=2082225 Win=1307 Len=0 TSval=1140267534 TSecr=1525052650
311,17.650873,192.168.2.2,192.168.1.2,TCP,66,1307,5001  >  58166 [ACK] Seq=1 Ack=2083673 Win=1307 Len=0 TSval=1140267545 TSecr=1525052662
313,17.663645,192.168.2.2,192.168.1.2,TCP,66,1307,5001  >  58166 [ACK] Seq=1 Ack=2085121 Win=1307 Len=0 TSval=1140267558 TSecr=1525052674
315,17.687164,192.168.2.2,192.168.1.2,TCP,66,1307,5001  >  58166 [ACK] Seq=1 Ack=2088017 Win=1307 Len=0 TSval=1140267582 TSecr=1525052686
316,17.71162,192.168.2.2,192.168.1.2,TCP,66,1307,5001  >  58166 [ACK] Seq=1 Ack=2090913 Win=1307 Len=0 TSval=1140267606 TSecr=1525052710
317,17.736181,192.168.2.2,192.168.1.2,TCP,66,1307,5001  >  58166 [ACK] Seq=1 Ack=2093809 Win=1307 Len=0 TSval=1140267631 TSecr=1525052734
320,17.759824,192.168.2.2,192.168.1.2,TCP,66,1307,5001  >  58166 [ACK] Seq=1 Ack=2096705 Win=1307 Len=0 TSval=1140267654 TSecr=1525052759
323,17.771916,192.168.2.2,192.168.1.2,TCP,66,1307,5001  >  58166 [ACK] Seq=1 Ack=2099601 Win=1307 Len=0 TSval=1140267666 TSecr=1525052783
326,17.796305,192.168.2.2,192.168.1.2,TCP,66,1307,5001  >  58166 [ACK] Seq=1 Ack=2102497 Win=1307 Len=0 TSval=1140267691 TSecr=1525052801
329,17.820552,192.168.2.2,192.168.1.2,TCP,66,1307,5001  >  58166 [ACK] Seq=1 Ack=2105393 Win=1307 Len=0 TSval=1140267715 TSecr=1525052820
332,17.844623,192.168.2.2,192.168.1.2,TCP,66,1307,5001  >  58166 [ACK] Seq=1 Ack=2108289 Win=1307 Len=0 TSval=1140267739 TSecr=1525052839
335,17.881207,192.168.2.2,192.168.1.2,TCP,66,1307,5001  >  58166 [ACK] Seq=1 Ack=2111185 Win=1307 Len=0 TSval=1140267776 TSecr=1525052893
338,17.905666,192.168.2.2,192.168.1.2,TCP,66,1307,5001  >  58166 [ACK] Seq=1 Ack=2114081 Win=1307 Len=0 TSval=1140267800 TSecr=1525052916
341,17.929702,192.168.2.2,192.168.1.2,TCP,66,1307,5001  >  58166 [ACK] Seq=1 Ack=2116977 Win=1307 Len=0 TSval=1140267824 TSecr=1525052940
344,17.953622,192.168.2.2,192.168.1.2,TCP,66,1307,5001  >  58166 [ACK] Seq=1 Ack=2119873 Win=1307 Len=0 TSval=1140267848 TSecr=1525052962
347,17.978779,192.168.2.2,192.168.1.2,TCP,66,1307,5001  >  58166 [ACK] Seq=1 Ack=2122769 Win=1307 Len=0 TSval=1140267873 TSecr=1525052984
350,18.002077,192.168.2.2,192.168.1.2,TCP,66,1307,5001  >  58166 [ACK] Seq=1 Ack=2125665 Win=1307 Len=0 TSval=1140267896 TSecr=1525053007
353,18.026776,192.168.2.2,192.168.1.2,TCP,66,1307,5001  >  58166 [ACK] Seq=1 Ack=2128561 Win=1307 Len=0 TSval=1140267921 TSecr=1525053038
356,18.050553,192.168.2.2,192.168.1.2,TCP,66,1307,5001  >  58166 [ACK] Seq=1 Ack=2131457 Win=1307 Len=0 TSval=1140267945 TSecr=1525053062
360,18.074853,192.168.2.2,192.168.1.2,TCP,66,1307,5001  >  58166 [ACK] Seq=1 Ack=2134353 Win=1307 Len=0 TSval=1140267969 TSecr=1525053086
363,18.099301,192.168.2.2,192.168.1.2,TCP,66,1307,5001  >  58166 [ACK] Seq=1 Ack=2137249 Win=1307 Len=0 TSval=1140267994 TSecr=1525053110
366,18.123196,192.168.2.2,192.168.1.2,TCP,66,1307,5001  >  58166 [ACK] Seq=1 Ack=2140145 Win=1307 Len=0 TSval=1140268017 TSecr=1525053135
369,18.147448,192.168.2.2,192.168.1.2,TCP,66,1307,5001  >  58166 [ACK] Seq=1 Ack=2143041 Win=1307 Len=0 TSval=1140268042 TSecr=1525053159
372,18.171708,192.168.2.2,192.168.1.2,TCP,66,1307,5001  >  58166 [ACK] Seq=1 Ack=2145937 Win=1307 Len=0 TSval=1140268066 TSecr=1525053183
376,18.196658,192.168.2.2,192.168.1.2,TCP,66,1307,5001  >  58166 [ACK] Seq=1 Ack=2148833 Win=1307 Len=0 TSval=1140268091 TSecr=1525053207
378,18.221816,192.168.2.2,192.168.1.2,TCP,66,1307,5001  >  58166 [ACK] Seq=1 Ack=2151729 Win=1307 Len=0 TSval=1140268116 TSecr=1525053231
379,18.245402,192.168.2.2,192.168.1.2,TCP,66,1307,5001  >  58166 [ACK] Seq=1 Ack=2154625 Win=1307 Len=0 TSval=1140268140 TSecr=1525053256
382,18.269957,192.168.2.2,192.168.1.2,TCP,66,1307,5001  >  58166 [ACK] Seq=1 Ack=2157521 Win=1307 Len=0 TSval=1140268164 TSecr=1525053280
385,18.294321,192.168.2.2,192.168.1.2,TCP,66,1307,5001  >  58166 [ACK] Seq=1 Ack=2160417 Win=1307 Len=0 TSval=1140268189 TSecr=1525053304
387,18.305628,192.168.2.2,192.168.1.2,TCP,66,1307,5001  >  58166 [ACK] Seq=1 Ack=2163313 Win=1307 Len=0 TSval=1140268200 TSecr=1525053328
390,18.329861,192.168.2.2,192.168.1.2,TCP,66,1307,5001  >  58166 [ACK] Seq=1 Ack=2166209 Win=1307 Len=0 TSval=1140268224 TSecr=1525053346
393,18.354146,192.168.2.2,192.168.1.2,TCP,66,1307,5001  >  58166 [ACK] Seq=1 Ack=2169105 Win=1307 Len=0 TSval=1140268248 TSecr=1525053363
397,18.390448,192.168.2.2,192.168.1.2,TCP,66,1307,5001  >  58166 [ACK] Seq=1 Ack=2172001 Win=1307 Len=0 TSval=1140268285 TSecr=1525053402
400,18.414869,192.168.2.2,192.168.1.2,TCP,66,1307,5001  >  58166 [ACK] Seq=1 Ack=2174897 Win=1307 Len=0 TSval=1140268309 TSecr=1525053432
403,18.439386,192.168.2.2,192.168.1.2,TCP,66,1307,5001  >  58166 [ACK] Seq=1 Ack=2177793 Win=1307 Len=0 TSval=1140268334 TSecr=1525053461
406,18.463611,192.168.2.2,192.168.1.2,TCP,66,1307,5001  >  58166 [ACK] Seq=1 Ack=2180689 Win=1307 Len=0 TSval=1140268358 TSecr=1525053484
409,18.487407,192.168.2.2,192.168.1.2,TCP,66,1307,5001  >  58166 [ACK] Seq=1 Ack=2183585 Win=1307 Len=0 TSval=1140268382 TSecr=1525053507
412,18.511862,192.168.2.2,192.168.1.2,TCP,66,1307,5001  >  58166 [ACK] Seq=1 Ack=2186481 Win=1307 Len=0 TSval=1140268406 TSecr=1525053530
415,18.53599,192.168.2.2,192.168.1.2,TCP,66,1307,5001  >  58166 [ACK] Seq=1 Ack=2189377 Win=1307 Len=0 TSval=1140268430 TSecr=1525053553
418,18.560984,192.168.2.2,192.168.1.2,TCP,66,1307,5001  >  58166 [ACK] Seq=1 Ack=2192273 Win=1307 Len=0 TSval=1140268455 TSecr=1525053578
421,18.584622,192.168.2.2,192.168.1.2,TCP,66,1307,5001  >  58166 [ACK] Seq=1 Ack=2195169 Win=1307 Len=0 TSval=1140268479 TSecr=1525053601
424,18.609371,192.168.2.2,192.168.1.2,TCP,66,1307,5001  >  58166 [ACK] Seq=1 Ack=2198065 Win=1307 Len=0 TSval=1140268503 TSecr=1525053624
427,18.632915,192.168.2.2,192.168.1.2,TCP,66,1307,5001  >  58166 [ACK] Seq=1 Ack=2200961 Win=1307 Len=0 TSval=1140268527 TSecr=1525053647
430,18.657536,192.168.2.2,192.168.1.2,TCP,66,1307,5001  >  58166 [ACK] Seq=1 Ack=2203857 Win=1307 Len=0 TSval=1140268552 TSecr=1525053671
433,18.681203,192.168.2.2,192.168.1.2,TCP,66,1307,5001  >  58166 [ACK] Seq=1 Ack=2206753 Win=1307 Len=0 TSval=1140268575 TSecr=1525053694
435,18.705702,192.168.2.2,192.168.1.2,TCP,66,1307,5001  >  58166 [ACK] Seq=1 Ack=2209649 Win=1307 Len=0 TSval=1140268600 TSecr=1525053717
438,18.730182,192.168.2.2,192.168.1.2,TCP,66,1307,5001  >  58166 [ACK] Seq=1 Ack=2212545 Win=1307 Len=0 TSval=1140268624 TSecr=1525053741
439,18.754838,192.168.2.2,192.168.1.2,TCP,66,1307,5001  >  58166 [ACK] Seq=1 Ack=2215441 Win=1307 Len=0 TSval=1140268649 TSecr=1525053765
440,18.778252,192.168.2.2,192.168.1.2,TCP,66,1307,5001  >  58166 [ACK] Seq=1 Ack=2218337 Win=1307 Len=0 TSval=1140268672 TSecr=1525053789
442,18.790294,192.168.2.2,192.168.1.2,TCP,66,1307,5001  >  58166 [ACK] Seq=1 Ack=2221233 Win=1307 Len=0 TSval=1140268684 TSecr=1525053814
445,18.814505,192.168.2.2,192.168.1.2,TCP,66,1307,5001  >  58166 [ACK] Seq=1 Ack=2224129 Win=1307 Len=0 TSval=1140268708 TSecr=1525053831
448,18.839448,192.168.2.2,192.168.1.2,TCP,66,1307,5001  >  58166 [ACK] Seq=1 Ack=2227025 Win=1307 Len=0 TSval=1140268733 TSecr=1525053849
452,18.863269,192.168.2.2,192.168.1.2,TCP,66,1307,5001  >  58166 [ACK] Seq=1 Ack=2229921 Win=1307 Len=0 TSval=1140268757 TSecr=1525053867
455,18.887828,192.168.2.2,192.168.1.2,TCP,66,1307,5001  >  58166 [ACK] Seq=1 Ack=2232817 Win=1307 Len=0 TSval=1140268782 TSecr=1525053884
458,18.923755,192.168.2.2,192.168.1.2,TCP,66,1307,5001  >  58166 [ACK] Seq=1 Ack=2235713 Win=1307 Len=0 TSval=1140268818 TSecr=1525053934
461,18.947843,192.168.2.2,192.168.1.2,TCP,66,1307,5001  >  58166 [ACK] Seq=1 Ack=2238609 Win=1307 Len=0 TSval=1140268842 TSecr=1525053962
464,18.972383,192.168.2.2,192.168.1.2,TCP,66,1307,5001  >  58166 [ACK] Seq=1 Ack=2241505 Win=1307 Len=0 TSval=1140268866 TSecr=1525053985
467,18.99677,192.168.2.2,192.168.1.2,TCP,66,1307,5001  >  58166 [ACK] Seq=1 Ack=2244401 Win=1307 Len=0 TSval=1140268891 TSecr=1525054008
470,19.020365,192.168.2.2,192.168.1.2,TCP,66,1307,5001  >  58166 [ACK] Seq=1 Ack=2247297 Win=1307 Len=0 TSval=1140268914 TSecr=1525054030
473,19.044795,192.168.2.2,192.168.1.2,TCP,66,1307,5001  >  58166 [ACK] Seq=1 Ack=2250193 Win=1307 Len=0 TSval=1140268939 TSecr=1525054053
477,19.069287,192.168.2.2,192.168.1.2,TCP,66,1307,5001  >  58166 [ACK] Seq=1 Ack=2253089 Win=1307 Len=0 TSval=1140268963 TSecr=1525054080
480,19.093841,192.168.2.2,192.168.1.2,TCP,66,1307,5001  >  58166 [ACK] Seq=1 Ack=2255985 Win=1307 Len=0 TSval=1140268988 TSecr=1525054104
483,19.117366,192.168.2.2,192.168.1.2,TCP,66,1307,5001  >  58166 [ACK] Seq=1 Ack=2258881 Win=1307 Len=0 TSval=1140269011 TSecr=1525054130
486,19.141519,192.168.2.2,192.168.1.2,TCP,66,1307,5001  >  58166 [ACK] Seq=1 Ack=2261777 Win=1307 Len=0 TSval=1140269035 TSecr=1525054153
489,19.165858,192.168.2.2,192.168.1.2,TCP,66,1307,5001  >  58166 [ACK] Seq=1 Ack=2264673 Win=1307 Len=0 TSval=1140269060 TSecr=1525054176
492,19.190839,192.168.2.2,192.168.1.2,TCP,66,1307,5001  >  58166 [ACK] Seq=1 Ack=2267569 Win=1307 Len=0 TSval=1140269085 TSecr=1525054201
495,19.215305,192.168.2.2,192.168.1.2,TCP,66,1307,5001  >  58166 [ACK] Seq=1 Ack=2270465 Win=1307 Len=0 TSval=1140269109 TSecr=1525054225
496,19.239849,192.168.2.2,192.168.1.2,TCP,66,1307,5001  >  58166 [ACK] Seq=1 Ack=2273361 Win=1307 Len=0 TSval=1140269134 TSecr=1525054250
499,19.263328,192.168.2.2,192.168.1.2,TCP,66,1307,5001  >  58166 [ACK] Seq=1 Ack=2276257 Win=1307 Len=0 TSval=1140269157 TSecr=1525054273
502,19.287895,192.168.2.2,192.168.1.2,TCP,66,1307,5001  >  58166 [ACK] Seq=1 Ack=2279153 Win=1307 Len=0 TSval=1140269182 TSecr=1525054297
503,19.30057,192.168.2.2,192.168.1.2,TCP,66,1307,5001  >  58166 [ACK] Seq=1 Ack=2282049 Win=1307 Len=0 TSval=1140269194 TSecr=1525054322
506,19.324191,192.168.2.2,192.168.1.2,TCP,66,1307,5001  >  58166 [ACK] Seq=1 Ack=2284945 Win=1307 Len=0 TSval=1140269218 TSecr=1525054340
510,19.348616,192.168.2.2,192.168.1.2,TCP,66,1307,5001  >  58166 [ACK] Seq=1 Ack=2287841 Win=1307 Len=0 TSval=1140269242 TSecr=1525054357
514,19.384836,192.168.2.2,192.168.1.2,TCP,66,1307,5001  >  58166 [ACK] Seq=1 Ack=2290737 Win=1307 Len=0 TSval=1140269278 TSecr=1525054396
517,19.409404,192.168.2.2,192.168.1.2,TCP,66,1307,5001  >  58166 [ACK] Seq=1 Ack=2293633 Win=1307 Len=0 TSval=1140269303 TSecr=1525054427
520,19.432931,192.168.2.2,192.168.1.2,TCP,66,1307,5001  >  58166 [ACK] Seq=1 Ack=2296529 Win=1307 Len=0 TSval=1140269327 TSecr=1525054457
523,19.457446,192.168.2.2,192.168.1.2,TCP,66,1307,5001  >  58166 [ACK] Seq=1 Ack=2299425 Win=1307 Len=0 TSval=1140269351 TSecr=1525054481
526,19.48146,192.168.2.2,192.168.1.2,TCP,66,1307,5001  >  58166 [ACK] Seq=1 Ack=2302321 Win=1307 Len=0 TSval=1140269375 TSecr=1525054504
529,19.505954,192.168.2.2,192.168.1.2,TCP,66,1307,5001  >  58166 [ACK] Seq=1 Ack=2305217 Win=1307 Len=0 TSval=1140269400 TSecr=1525054528
532,19.530502,192.168.2.2,192.168.1.2,TCP,66,1307,5001  >  58166 [ACK] Seq=1 Ack=2308113 Win=1307 Len=0 TSval=1140269424 TSecr=1525054551
535,19.554027,192.168.2.2,192.168.1.2,TCP,66,1307,5001  >  58166 [ACK] Seq=1 Ack=2311009 Win=1307 Len=0 TSval=1140269448 TSecr=1525054575
538,19.578609,192.168.2.2,192.168.1.2,TCP,66,1307,5001  >  58166 [ACK] Seq=1 Ack=2313905 Win=1307 Len=0 TSval=1140269472 TSecr=1525054598
541,19.603104,192.168.2.2,192.168.1.2,TCP,66,1307,5001  >  58166 [ACK] Seq=1 Ack=2316801 Win=1307 Len=0 TSval=1140269497 TSecr=1525054622
544,19.626655,192.168.2.2,192.168.1.2,TCP,66,1307,5001  >  58166 [ACK] Seq=1 Ack=2319697 Win=1307 Len=0 TSval=1140269520 TSecr=1525054645
547,19.651176,192.168.2.2,192.168.1.2,TCP,66,1307,5001  >  58166 [ACK] Seq=1 Ack=2322593 Win=1307 Len=0 TSval=1140269545 TSecr=1525054668
550,19.675197,192.168.2.2,192.168.1.2,TCP,66,1307,5001  >  58166 [ACK] Seq=1 Ack=2325489 Win=1307 Len=0 TSval=1140269569 TSecr=1525054691
553,19.700197,192.168.2.2,192.168.1.2,TCP,66,1307,5001  >  58166 [ACK] Seq=1 Ack=2328385 Win=1307 Len=0 TSval=1140269594 TSecr=1525054714
555,19.724304,192.168.2.2,192.168.1.2,TCP,66,1307,5001  >  58166 [ACK] Seq=1 Ack=2331281 Win=1307 Len=0 TSval=1140269618 TSecr=1525054737
556,19.748349,192.168.2.2,192.168.1.2,TCP,66,1307,5001  >  58166 [ACK] Seq=1 Ack=2334177 Win=1307 Len=0 TSval=1140269642 TSecr=1525054761
559,19.77241,192.168.2.2,192.168.1.2,TCP,66,1307,5001  >  58166 [ACK] Seq=1 Ack=2337073 Win=1307 Len=0 TSval=1140269666 TSecr=1525054783
562,19.796406,192.168.2.2,192.168.1.2,TCP,66,1307,5001  >  58166 [ACK] Seq=1 Ack=2339969 Win=1307 Len=0 TSval=1140269690 TSecr=1525054807
563,19.808818,192.168.2.2,192.168.1.2,TCP,66,1307,5001  >  58166 [ACK] Seq=1 Ack=2342865 Win=1307 Len=0 TSval=1140269702 TSecr=1525054831
567,19.833141,192.168.2.2,192.168.1.2,TCP,66,1307,5001  >  58166 [ACK] Seq=1 Ack=2345761 Win=1307 Len=0 TSval=1140269727 TSecr=1525054849
570,19.857717,192.168.2.2,192.168.1.2,TCP,66,1307,5001  >  58166 [ACK] Seq=1 Ack=2348657 Win=1307 Len=0 TSval=1140269751 TSecr=1525054867
574,19.893437,192.168.2.2,192.168.1.2,TCP,66,1307,5001  >  58166 [ACK] Seq=1 Ack=2351553 Win=1307 Len=0 TSval=1140269787 TSecr=1525054904
577,19.917543,192.168.2.2,192.168.1.2,TCP,66,1307,5001  >  58166 [ACK] Seq=1 Ack=2354449 Win=1307 Len=0 TSval=1140269811 TSecr=1525054934
580,19.942479,192.168.2.2,192.168.1.2,TCP,66,1307,5001  >  58166 [ACK] Seq=1 Ack=2357345 Win=1307 Len=0 TSval=1140269836 TSecr=1525054965
583,19.966552,192.168.2.2,192.168.1.2,TCP,66,1307,5001  >  58166 [ACK] Seq=1 Ack=2360241 Win=1307 Len=0 TSval=1140269860 TSecr=1525054989
586,19.990559,192.168.2.2,192.168.1.2,TCP,66,1307,5001  >  58166 [ACK] Seq=1 Ack=2363137 Win=1307 Len=0 TSval=1140269884 TSecr=1525055012
589,20.014591,192.168.2.2,192.168.1.2,TCP,66,1307,5001  >  58166 [ACK] Seq=1 Ack=2366033 Win=1307 Len=0 TSval=1140269908 TSecr=1525055035
592,20.038671,192.168.2.2,192.168.1.2,TCP,66,1307,5001  >  58166 [ACK] Seq=1 Ack=2368929 Win=1307 Len=0 TSval=1140269932 TSecr=1525055058
596,20.062698,192.168.2.2,192.168.1.2,TCP,66,1307,5001  >  58166 [ACK] Seq=1 Ack=2371825 Win=1307 Len=0 TSval=1140269956 TSecr=1525055081
599,20.087711,192.168.2.2,192.168.1.2,TCP,66,1307,5001  >  58166 [ACK] Seq=1 Ack=2374721 Win=1307 Len=0 TSval=1140269981 TSecr=1525055104
602,20.111786,192.168.2.2,192.168.1.2,TCP,66,1307,5001  >  58166 [ACK] Seq=1 Ack=2377617 Win=1307 Len=0 TSval=1140270005 TSecr=1525055127
605,20.136253,192.168.2.2,192.168.1.2,TCP,66,1307,5001  >  58166 [ACK] Seq=1 Ack=2380513 Win=1307 Len=0 TSval=1140270030 TSecr=1525055150
608,20.160308,192.168.2.2,192.168.1.2,TCP,66,1307,5001  >  58166 [ACK] Seq=1 Ack=2383409 Win=1307 Len=0 TSval=1140270054 TSecr=1525055173
610,20.1843,192.168.2.2,192.168.1.2,TCP,66,1307,5001  >  58166 [ACK] Seq=1 Ack=2386305 Win=1307 Len=0 TSval=1140270078 TSecr=1525055196
614,20.208855,192.168.2.2,192.168.1.2,TCP,66,1307,5001  >  58166 [ACK] Seq=1 Ack=2389201 Win=1307 Len=0 TSval=1140270102 TSecr=1525055219
615,20.233346,192.168.2.2,192.168.1.2,TCP,66,1307,5001  >  58166 [ACK] Seq=1 Ack=2392097 Win=1307 Len=0 TSval=1140270127 TSecr=1525055243
616,20.257894,192.168.2.2,192.168.1.2,TCP,66,1307,5001  >  58166 [ACK] Seq=1 Ack=2394993 Win=1307 Len=0 TSval=1140270151 TSecr=1525055267
619,20.269706,192.168.2.2,192.168.1.2,TCP,66,1307,5001  >  58166 [ACK] Seq=1 Ack=2397889 Win=1307 Len=0 TSval=1140270163 TSecr=1525055292
622,20.293718,192.168.2.2,192.168.1.2,TCP,66,1307,5001  >  58166 [ACK] Seq=1 Ack=2400785 Win=1307 Len=0 TSval=1140270187 TSecr=1525055310
625,20.318712,192.168.2.2,192.168.1.2,TCP,66,1307,5001  >  58166 [ACK] Seq=1 Ack=2403681 Win=1307 Len=0 TSval=1140270212 TSecr=1525055328
628,20.342775,192.168.2.2,192.168.1.2,TCP,66,1307,5001  >  58166 [ACK] Seq=1 Ack=2406577 Win=1307 Len=0 TSval=1140270236 TSecr=1525055346
631,20.366832,192.168.2.2,192.168.1.2,TCP,66,1307,5001  >  58166 [ACK] Seq=1 Ack=2409473 Win=1307 Len=0 TSval=1140270260 TSecr=1525055364
634,20.40358,192.168.2.2,192.168.1.2,TCP,66,1307,5001  >  58166 [ACK] Seq=1 Ack=2412369 Win=1307 Len=0 TSval=1140270297 TSecr=1525055413
637,20.427593,192.168.2.2,192.168.1.2,TCP,66,1307,5001  >  58166 [ACK] Seq=1 Ack=2415265 Win=1307 Len=0 TSval=1140270321 TSecr=1525055437
640,20.451669,192.168.2.2,192.168.1.2,TCP,66,1307,5001  >  58166 [ACK] Seq=1 Ack=2418161 Win=1307 Len=0 TSval=1140270345 TSecr=1525055460
643,20.475706,192.168.2.2,192.168.1.2,TCP,66,1307,5001  >  58166 [ACK] Seq=1 Ack=2421057 Win=1307 Len=0 TSval=1140270369 TSecr=1525055483
646,20.499576,192.168.2.2,192.168.1.2,TCP,66,1307,5001  >  58166 [ACK] Seq=1 Ack=2423953 Win=1307 Len=0 TSval=1140270393 TSecr=1525055506
649,20.523821,192.168.2.2,192.168.1.2,TCP,66,1307,5001  >  58166 [ACK] Seq=1 Ack=2426849 Win=1307 Len=0 TSval=1140270417 TSecr=1525055529
652,20.547959,192.168.2.2,192.168.1.2,TCP,66,1307,5001  >  58166 [ACK] Seq=1 Ack=2429745 Win=1307 Len=0 TSval=1140270441 TSecr=1525055559
655,20.572359,192.168.2.2,192.168.1.2,TCP,66,1307,5001  >  58166 [ACK] Seq=1 Ack=2432641 Win=1307 Len=0 TSval=1140270465 TSecr=1525055583
658,20.596786,192.168.2.2,192.168.1.2,TCP,66,1307,5001  >  58166 [ACK] Seq=1 Ack=2435537 Win=1307 Len=0 TSval=1140270490 TSecr=1525055607
661,20.620741,192.168.2.2,192.168.1.2,TCP,66,1307,5001  >  58166 [ACK] Seq=1 Ack=2438433 Win=1307 Len=0 TSval=1140270514 TSecr=1525055631
664,20.64565,192.168.2.2,192.168.1.2,TCP,66,1307,5001  >  58166 [ACK] Seq=1 Ack=2441329 Win=1307 Len=0 TSval=1140270539 TSecr=1525055655
667,20.66968,192.168.2.2,192.168.1.2,TCP,66,1307,5001  >  58166 [ACK] Seq=1 Ack=2444225 Win=1307 Len=0 TSval=1140270563 TSecr=1525055679
669,20.693761,192.168.2.2,192.168.1.2,TCP,66,1307,5001  >  58166 [ACK] Seq=1 Ack=2447121 Win=1307 Len=0 TSval=1140270587 TSecr=1525055703
672,20.717797,192.168.2.2,192.168.1.2,TCP,66,1307,5001  >  58166 [ACK] Seq=1 Ack=2450017 Win=1307 Len=0 TSval=1140270611 TSecr=1525055727
673,20.742289,192.168.2.2,192.168.1.2,TCP,66,1307,5001  >  58166 [ACK] Seq=1 Ack=2452913 Win=1307 Len=0 TSval=1140270635 TSecr=1525055752
674,20.766754,192.168.2.2,192.168.1.2,TCP,66,1307,5001  >  58166 [ACK] Seq=1 Ack=2455809 Win=1307 Len=0 TSval=1140270660 TSecr=1525055776
677,20.778686,192.168.2.2,192.168.1.2,TCP,66,1307,5001  >  58166 [ACK] Seq=1 Ack=2458705 Win=1307 Len=0 TSval=1140270672 TSecr=1525055801
680,20.802995,192.168.2.2,192.168.1.2,TCP,66,1307,5001  >  58166 [ACK] Seq=1 Ack=2461601 Win=1307 Len=0 TSval=1140270696 TSecr=1525055819
683,20.826528,192.168.2.2,192.168.1.2,TCP,66,1307,5001  >  58166 [ACK] Seq=1 Ack=2464497 Win=1307 Len=0 TSval=1140270719 TSecr=1525055837
686,20.851079,192.168.2.2,192.168.1.2,TCP,66,1307,5001  >  58166 [ACK] Seq=1 Ack=2467393 Win=1307 Len=0 TSval=1140270744 TSecr=1525055855
689,20.875604,192.168.2.2,192.168.1.2,TCP,66,1307,5001  >  58166 [ACK] Seq=1 Ack=2470289 Win=1307 Len=0 TSval=1140270769 TSecr=1525055873
692,20.912015,192.168.2.2,192.168.1.2,TCP,66,1307,5001  >  58166 [ACK] Seq=1 Ack=2473185 Win=1307 Len=0 TSval=1140270805 TSecr=1525055922
695,20.935955,192.168.2.2,192.168.1.2,TCP,66,1307,5001  >  58166 [ACK] Seq=1 Ack=2476081 Win=1307 Len=0 TSval=1140270829 TSecr=1525055945
698,20.959999,192.168.2.2,192.168.1.2,TCP,66,1307,5001  >  58166 [ACK] Seq=1 Ack=2478977 Win=1307 Len=0 TSval=1140270853 TSecr=1525055969
701,20.984515,192.168.2.2,192.168.1.2,TCP,66,1307,5001  >  58166 [ACK] Seq=1 Ack=2481873 Win=1307 Len=0 TSval=1140270877 TSecr=1525055992
704,21.009059,192.168.2.2,192.168.1.2,TCP,66,1307,5001  >  58166 [ACK] Seq=1 Ack=2484769 Win=1307 Len=0 TSval=1140270902 TSecr=1525056015
707,21.032592,192.168.2.2,192.168.1.2,TCP,66,1307,5001  >  58166 [ACK] Seq=1 Ack=2487665 Win=1307 Len=0 TSval=1140270925 TSecr=1525056038
711,21.05698,192.168.2.2,192.168.1.2,TCP,66,1307,5001  >  58166 [ACK] Seq=1 Ack=2490561 Win=1307 Len=0 TSval=1140270950 TSecr=1525056067
714,21.081612,192.168.2.2,192.168.1.2,TCP,66,1307,5001  >  58166 [ACK] Seq=1 Ack=2493457 Win=1307 Len=0 TSval=1140270974 TSecr=1525056091
717,21.106053,192.168.2.2,192.168.1.2,TCP,66,1307,5001  >  58166 [ACK] Seq=1 Ack=2496353 Win=1307 Len=0 TSval=1140270999 TSecr=1525056115
720,21.129567,192.168.2.2,192.168.1.2,TCP,66,1307,5001  >  58166 [ACK] Seq=1 Ack=2499249 Win=1307 Len=0 TSval=1140271022 TSecr=1525056139
722,21.154113,192.168.2.2,192.168.1.2,TCP,66,1307,5001  >  58166 [ACK] Seq=1 Ack=2502145 Win=1307 Len=0 TSval=1140271047 TSecr=1525056164
725,21.178542,192.168.2.2,192.168.1.2,TCP,66,1307,5001  >  58166 [ACK] Seq=1 Ack=2505041 Win=1307 Len=0 TSval=1140271071 TSecr=1525056187
727,21.203092,192.168.2.2,192.168.1.2,TCP,66,1307,5001  >  58166 [ACK] Seq=1 Ack=2507937 Win=1307 Len=0 TSval=1140271096 TSecr=1525056212
728,21.227575,192.168.2.2,192.168.1.2,TCP,66,1307,5001  >  58166 [ACK] Seq=1 Ack=2510833 Win=1307 Len=0 TSval=1140271120 TSecr=1525056236
731,21.239468,192.168.2.2,192.168.1.2,TCP,66,1307,5001  >  58166 [ACK] Seq=1 Ack=2513729 Win=1307 Len=0 TSval=1140271132 TSecr=1525056261
734,21.263809,192.168.2.2,192.168.1.2,TCP,66,1307,5001  >  58166 [ACK] Seq=1 Ack=2516625 Win=1307 Len=0 TSval=1140271157 TSecr=1525056279
737,21.288319,192.168.2.2,192.168.1.2,TCP,66,1307,5001  >  58166 [ACK] Seq=1 Ack=2519521 Win=1307 Len=0 TSval=1140271181 TSecr=1525056297
740,21.311826,192.168.2.2,192.168.1.2,TCP,66,1307,5001  >  58166 [ACK] Seq=1 Ack=2522417 Win=1307 Len=0 TSval=1140271205 TSecr=1525056315
743,21.336736,192.168.2.2,192.168.1.2,TCP,66,1307,5001  >  58166 [ACK] Seq=1 Ack=2525313 Win=1307 Len=0 TSval=1140271229 TSecr=1525056332
746,21.37258,192.168.2.2,192.168.1.2,TCP,66,1307,5001  >  58166 [ACK] Seq=1 Ack=2528209 Win=1307 Len=0 TSval=1140271265 TSecr=1525056382
749,21.397177,192.168.2.2,192.168.1.2,TCP,66,1307,5001  >  58166 [ACK] Seq=1 Ack=2531105 Win=1307 Len=0 TSval=1140271290 TSecr=1525056406
752,21.421565,192.168.2.2,192.168.1.2,TCP,66,1307,5001  >  58166 [ACK] Seq=1 Ack=2534001 Win=1307 Len=0 TSval=1140271314 TSecr=1525056429
755,21.445636,192.168.2.2,192.168.1.2,TCP,66,1307,5001  >  58166 [ACK] Seq=1 Ack=2536897 Win=1307 Len=0 TSval=1140271338 TSecr=1525056453
758,21.4696,192.168.2.2,192.168.1.2,TCP,66,1307,5001  >  58166 [ACK] Seq=1 Ack=2539793 Win=1307 Len=0 TSval=1140271362 TSecr=1525056476
761,21.494104,192.168.2.2,192.168.1.2,TCP,66,1307,5001  >  58166 [ACK] Seq=1 Ack=2542689 Win=1307 Len=0 TSval=1140271387 TSecr=1525056500
764,21.518281,192.168.2.2,192.168.1.2,TCP,66,1307,5001  >  58166 [ACK] Seq=1 Ack=2545585 Win=1307 Len=0 TSval=1140271411 TSecr=1525056527
767,21.542208,192.168.2.2,192.168.1.2,TCP,66,1307,5001  >  58166 [ACK] Seq=1 Ack=2548481 Win=1307 Len=0 TSval=1140271435 TSecr=1525056552
770,21.566185,192.168.2.2,192.168.1.2,TCP,66,1307,5001  >  58166 [ACK] Seq=1 Ack=2551377 Win=1307 Len=0 TSval=1140271459 TSecr=1525056576
773,21.59121,192.168.2.2,192.168.1.2,TCP,66,1307,5001  >  58166 [ACK] Seq=1 Ack=2554273 Win=1307 Len=0 TSval=1140271484 TSecr=1525056601
776,21.615313,192.168.2.2,192.168.1.2,TCP,66,1307,5001  >  58166 [ACK] Seq=1 Ack=2557169 Win=1307 Len=0 TSval=1140271508 TSecr=1525056624
779,21.639315,192.168.2.2,192.168.1.2,TCP,66,1307,5001  >  58166 [ACK] Seq=1 Ack=2560065 Win=1307 Len=0 TSval=1140271532 TSecr=1525056649
