No.,Time,Source,Destination,Protocol,Length,Calculated window size,Info
4,0.000478,192.168.2.2,192.168.1.2,TCP,74,43440,"5001  >  53342 [SYN, ACK] Seq=0 Ack=1 Win=43440 Len=0 MSS=1460 SACK_PERM=1 TSval=2326339400 TSecr=1377379323 WS=512"
7,0.000531,192.168.2.2,192.168.1.2,TCP,66,39936,5001  >  53342 [ACK] Seq=1 Ack=7241 Win=39936 Len=0 TSval=2326339400 TSecr=1377379323
13,0.050331,192.168.2.2,192.168.1.2,TCP,66,39936,5001  >  53342 [ACK] Seq=1 Ack=14481 Win=39936 Len=0 TSval=2326339450 TSecr=1377379323
16,0.110893,192.168.2.2,192.168.1.2,TCP,66,38400,5001  >  53342 [ACK] Seq=1 Ack=24617 Win=38400 Len=0 TSval=2326339510 TSecr=1377379323
25,0.19661,192.168.2.2,192.168.1.2,TCP,66,40960,5001  >  53342 [ACK] Seq=1 Ack=28961 Win=40960 Len=0 TSval=2326339596 TSecr=1377379323
28,0.232029,192.168.2.2,192.168.1.2,TCP,66,42496,5001  >  53342 [ACK] Seq=1 Ack=30409 Win=42496 Len=0 TSval=2326339631 TSecr=1377379338
31,0.244129,192.168.2.2,192.168.1.2,TCP,66,38912,5001  >  53342 [ACK] Seq=1 Ack=39097 Win=38912 Len=0 TSval=2326339644 TSecr=1377379373
33,0.316818,192.168.2.2,192.168.1.2,TCP,66,40960,5001  >  53342 [ACK] Seq=1 Ack=43441 Win=40960 Len=0 TSval=2326339716 TSecr=1377379399
37,0.353525,192.168.2.2,192.168.1.2,TCP,66,41984,5001  >  53342 [ACK] Seq=1 Ack=46337 Win=41984 Len=0 TSval=2326339753 TSecr=1377379433
39,0.377936,192.168.2.2,192.168.1.2,TCP,66,41984,5001  >  53342 [ACK] Seq=1 Ack=49233 Win=41984 Len=0 TSval=2326339777 TSecr=1377379433
41,0.401579,192.168.2.2,192.168.1.2,TCP,66,42496,5001  >  53342 [ACK] Seq=1 Ack=50681 Win=42496 Len=0 TSval=2326339801 TSecr=1377379433
43,0.414219,192.168.2.2,192.168.1.2,TCP,66,41984,5001  >  53342 [ACK] Seq=1 Ack=53577 Win=41984 Len=0 TSval=2326339814 TSecr=1377379433
45,0.438737,192.168.2.2,192.168.1.2,TCP,66,41984,5001  >  53342 [ACK] Seq=1 Ack=56473 Win=41984 Len=0 TSval=2326339838 TSecr=1377379434
47,0.462274,192.168.2.2,192.168.1.2,TCP,66,41984,5001  >  53342 [ACK] Seq=1 Ack=59369 Win=41984 Len=0 TSval=2326339862 TSecr=1377379434
49,0.48638,192.168.2.2,192.168.1.2,TCP,66,41984,5001  >  53342 [ACK] Seq=1 Ack=62265 Win=41984 Len=0 TSval=2326339886 TSecr=1377379434
51,0.511315,192.168.2.2,192.168.1.2,TCP,78,42496,[TCP Window Update] 5001  >  53342 [ACK] Seq=1 Ack=62265 Win=42496 Len=0 TSval=2326339911 TSecr=1377379487 SLE=60817 SRE=62265
53,0.523004,192.168.2.2,192.168.1.2,TCP,66,41984,5001  >  53342 [ACK] Seq=1 Ack=65161 Win=41984 Len=0 TSval=2326339922 TSecr=1377379519
55,0.54758,192.168.2.2,192.168.1.2,TCP,66,41984,5001  >  53342 [ACK] Seq=1 Ack=68057 Win=41984 Len=0 TSval=2326339947 TSecr=1377379519
57,0.571229,192.168.2.2,192.168.1.2,TCP,66,41984,5001  >  53342 [ACK] Seq=1 Ack=70953 Win=41984 Len=0 TSval=2326339971 TSecr=1377379555
59,0.595609,192.168.2.2,192.168.1.2,TCP,66,42496,5001  >  53342 [ACK] Seq=1 Ack=72401 Win=42496 Len=0 TSval=2326339995 TSecr=1377379555
61,0.607544,192.168.2.2,192.168.1.2,TCP,66,41984,5001  >  53342 [ACK] Seq=1 Ack=75297 Win=41984 Len=0 TSval=2326340007 TSecr=1377379567
63,0.631809,192.168.2.2,192.168.1.2,TCP,66,41984,5001  >  53342 [ACK] Seq=1 Ack=78193 Win=41984 Len=0 TSval=2326340031 TSecr=1377379639
65,0.656297,192.168.2.2,192.168.1.2,TCP,66,48128,5001  >  53342 [ACK] Seq=1 Ack=81089 Win=48128 Len=0 TSval=2326340056 TSecr=1377379639
69,0.680351,192.168.2.2,192.168.1.2,TCP,66,54272,5001  >  53342 [ACK] Seq=1 Ack=83985 Win=54272 Len=0 TSval=2326340080 TSecr=1377379639
74,0.704869,192.168.2.2,192.168.1.2,TCP,66,59904,5001  >  53342 [ACK] Seq=1 Ack=86881 Win=59904 Len=0 TSval=2326340104 TSecr=1377379676
78,0.728714,192.168.2.2,192.168.1.2,TCP,66,65536,5001  >  53342 [ACK] Seq=1 Ack=89777 Win=65536 Len=0 TSval=2326340128 TSecr=1377379700
82,0.752874,192.168.2.2,192.168.1.2,TCP,66,71680,5001  >  53342 [ACK] Seq=1 Ack=92673 Win=71680 Len=0 TSval=2326340152 TSecr=1377379724
86,0.777077,192.168.2.2,192.168.1.2,TCP,66,74240,5001  >  53342 [ACK] Seq=1 Ack=94121 Win=74240 Len=0 TSval=2326340176 TSecr=1377379737
89,0.789188,192.168.2.2,192.168.1.2,TCP,66,80384,5001  >  53342 [ACK] Seq=1 Ack=97017 Win=80384 Len=0 TSval=2326340188 TSecr=1377379761
93,0.813646,192.168.2.2,192.168.1.2,TCP,66,86016,5001  >  53342 [ACK] Seq=1 Ack=99913 Win=86016 Len=0 TSval=2326340213 TSecr=1377379785
96,0.838174,192.168.2.2,192.168.1.2,TCP,66,91648,5001  >  53342 [ACK] Seq=1 Ack=102809 Win=91648 Len=0 TSval=2326340237 TSecr=1377379809
99,0.86269,192.168.2.2,192.168.1.2,TCP,66,95744,5001  >  53342 [ACK] Seq=1 Ack=104761 Win=95744 Len=0 TSval=2326340262 TSecr=1377379834
101,0.879217,192.168.2.2,192.168.1.2,TCP,66,98304,5001  >  53342 [ACK] Seq=1 Ack=106209 Win=98304 Len=0 TSval=2326340278 TSecr=1377379845
103,0.892109,192.168.2.2,192.168.1.2,TCP,66,104448,5001  >  53342 [ACK] Seq=1 Ack=109105 Win=104448 Len=0 TSval=2326340291 TSecr=1377379870
105,0.915594,192.168.2.2,192.168.1.2,TCP,66,110080,5001  >  53342 [ACK] Seq=1 Ack=112001 Win=110080 Len=0 TSval=2326340315 TSecr=1377379894
109,0.940058,192.168.2.2,192.168.1.2,TCP,66,115712,5001  >  53342 [ACK] Seq=1 Ack=114897 Win=115712 Len=0 TSval=2326340339 TSecr=1377379918
111,0.964016,192.168.2.2,192.168.1.2,TCP,66,118784,5001  >  53342 [ACK] Seq=1 Ack=115841 Win=118784 Len=0 TSval=2326340363 TSecr=1377379930
113,0.972457,192.168.2.2,192.168.1.2,TCP,66,124416,5001  >  53342 [ACK] Seq=1 Ack=118737 Win=124416 Len=0 TSval=2326340372 TSecr=1377379954
115,0.996401,192.168.2.2,192.168.1.2,TCP,66,130560,5001  >  53342 [ACK] Seq=1 Ack=121633 Win=130560 Len=0 TSval=2326340395 TSecr=1377379979
117,1.020535,192.168.2.2,192.168.1.2,TCP,66,136192,5001  >  53342 [ACK] Seq=1 Ack=124529 Win=136192 Len=0 TSval=2326340420 TSecr=1377379979
120,1.044899,192.168.2.2,192.168.1.2,TCP,66,141824,5001  >  53342 [ACK] Seq=1 Ack=127425 Win=141824 Len=0 TSval=2326340444 TSecr=1377379979
123,1.068984,192.168.2.2,192.168.1.2,TCP,66,147968,5001  >  53342 [ACK] Seq=1 Ack=130321 Win=147968 Len=0 TSval=2326340468 TSecr=1377380003
125,1.093206,192.168.2.2,192.168.1.2,TCP,66,153600,5001  >  53342 [ACK] Seq=1 Ack=133217 Win=153600 Len=0 TSval=2326340492 TSecr=1377380003
127,1.117478,192.168.2.2,192.168.1.2,TCP,66,159232,5001  >  53342 [ACK] Seq=1 Ack=136113 Win=159232 Len=0 TSval=2326340517 TSecr=1377380003
129,1.141667,192.168.2.2,192.168.1.2,TCP,66,162304,5001  >  53342 [ACK] Seq=1 Ack=137561 Win=162304 Len=0 TSval=2326340541 TSecr=1377380003
131,1.153824,192.168.2.2,192.168.1.2,TCP,66,167936,5001  >  53342 [ACK] Seq=1 Ack=140457 Win=167936 Len=0 TSval=2326340553 TSecr=1377380027
133,1.178205,192.168.2.2,192.168.1.2,TCP,66,173568,5001  >  53342 [ACK] Seq=1 Ack=143353 Win=173568 Len=0 TSval=2326340577 TSecr=1377380027
135,1.202729,192.168.2.2,192.168.1.2,TCP,66,179712,5001  >  53342 [ACK] Seq=1 Ack=146249 Win=179712 Len=0 TSval=2326340602 TSecr=1377380027
137,1.227215,192.168.2.2,192.168.1.2,TCP,66,185344,5001  >  53342 [ACK] Seq=1 Ack=149145 Win=185344 Len=0 TSval=2326340626 TSecr=1377380051
139,1.250817,192.168.2.2,192.168.1.2,TCP,66,187904,5001  >  53342 [ACK] Seq=1 Ack=152041 Win=187904 Len=0 TSval=2326340650 TSecr=1377380051
141,1.274996,192.168.2.2,192.168.1.2,TCP,66,187904,5001  >  53342 [ACK] Seq=1 Ack=154937 Win=187904 Len=0 TSval=2326340674 TSecr=1377380051
143,1.299136,192.168.2.2,192.168.1.2,TCP,66,187904,5001  >  53342 [ACK] Seq=1 Ack=157833 Win=187904 Len=0 TSval=2326340698 TSecr=1377380075
145,1.323764,192.168.2.2,192.168.1.2,TCP,66,188928,5001  >  53342 [ACK] Seq=1 Ack=159281 Win=188928 Len=0 TSval=2326340723 TSecr=1377380075
147,1.335645,192.168.2.2,192.168.1.2,TCP,66,187904,5001  >  53342 [ACK] Seq=1 Ack=162177 Win=187904 Len=0 TSval=2326340735 TSecr=1377380075
149,1.360093,192.168.2.2,192.168.1.2,TCP,66,187904,5001  >  53342 [ACK] Seq=1 Ack=165073 Win=187904 Len=0 TSval=2326340759 TSecr=1377380099
151,1.383916,192.168.2.2,192.168.1.2,TCP,66,187904,5001  >  53342 [ACK] Seq=1 Ack=167969 Win=187904 Len=0 TSval=2326340783 TSecr=1377380099
153,1.418592,192.168.2.2,192.168.1.2,TCP,66,187904,5001  >  53342 [ACK] Seq=1 Ack=170865 Win=187904 Len=0 TSval=2326340817 TSecr=1377380111
155,1.43262,192.168.2.2,192.168.1.2,TCP,66,187904,5001  >  53342 [ACK] Seq=1 Ack=173761 Win=187904 Len=0 TSval=2326340831 TSecr=1377380111
158,1.456557,192.168.2.2,192.168.1.2,TCP,66,187904,5001  >  53342 [ACK] Seq=1 Ack=176657 Win=187904 Len=0 TSval=2326340855 TSecr=1377380111
160,1.48079,192.168.2.2,192.168.1.2,TCP,66,187904,5001  >  53342 [ACK] Seq=1 Ack=179553 Win=187904 Len=0 TSval=2326340880 TSecr=1377380136
162,1.517115,192.168.2.2,192.168.1.2,TCP,66,187904,5001  >  53342 [ACK] Seq=1 Ack=183897 Win=187904 Len=0 TSval=2326340916 TSecr=1377380136
164,1.541383,192.168.2.2,192.168.1.2,TCP,66,187904,5001  >  53342 [ACK] Seq=1 Ack=186793 Win=187904 Len=0 TSval=2326340940 TSecr=1377380185
167,1.577696,192.168.2.2,192.168.1.2,TCP,66,187904,5001  >  53342 [ACK] Seq=1 Ack=191137 Win=187904 Len=0 TSval=2326340976 TSecr=1377380201
169,1.602104,192.168.2.2,192.168.1.2,TCP,66,187904,5001  >  53342 [ACK] Seq=1 Ack=194033 Win=187904 Len=0 TSval=2326341001 TSecr=1377380238
171,1.626164,192.168.2.2,192.168.1.2,TCP,66,187904,5001  >  53342 [ACK] Seq=1 Ack=196929 Win=187904 Len=0 TSval=2326341025 TSecr=1377380262
173,1.662892,192.168.2.2,192.168.1.2,TCP,66,194560,5001  >  53342 [ACK] Seq=1 Ack=201273 Win=194560 Len=0 TSval=2326341062 TSecr=1377380286
177,1.687355,192.168.2.2,192.168.1.2,TCP,66,197632,5001  >  53342 [ACK] Seq=1 Ack=202721 Win=197632 Len=0 TSval=2326341086 TSecr=1377380319
179,1.699099,192.168.2.2,192.168.1.2,TCP,66,203264,5001  >  53342 [ACK] Seq=1 Ack=205617 Win=203264 Len=0 TSval=2326341098 TSecr=1377380343
182,1.723811,192.168.2.2,192.168.1.2,TCP,66,208896,5001  >  53342 [ACK] Seq=1 Ack=208513 Win=208896 Len=0 TSval=2326341123 TSecr=1377380367
186,1.748213,192.168.2.2,192.168.1.2,TCP,66,215040,5001  >  53342 [ACK] Seq=1 Ack=211409 Win=215040 Len=0 TSval=2326341147 TSecr=1377380367
188,1.772663,192.168.2.2,192.168.1.2,TCP,66,220672,5001  >  53342 [ACK] Seq=1 Ack=214305 Win=220672 Len=0 TSval=2326341171 TSecr=1377380391
190,1.796492,192.168.2.2,192.168.1.2,TCP,66,226304,5001  >  53342 [ACK] Seq=1 Ack=217201 Win=226304 Len=0 TSval=2326341195 TSecr=1377380415
192,1.820721,192.168.2.2,192.168.1.2,TCP,66,232448,5001  >  53342 [ACK] Seq=1 Ack=220097 Win=232448 Len=0 TSval=2326341219 TSecr=1377380440
194,1.845204,192.168.2.2,192.168.1.2,TCP,66,235008,5001  >  53342 [ACK] Seq=1 Ack=221545 Win=235008 Len=0 TSval=2326341244 TSecr=1377380464
196,1.857859,192.168.2.2,192.168.1.2,TCP,66,241152,5001  >  53342 [ACK] Seq=1 Ack=224441 Win=241152 Len=0 TSval=2326341257 TSecr=1377380476
198,1.881256,192.168.2.2,192.168.1.2,TCP,66,246784,5001  >  53342 [ACK] Seq=1 Ack=227337 Win=246784 Len=0 TSval=2326341280 TSecr=1377380500
200,1.906498,192.168.2.2,192.168.1.2,TCP,66,252416,5001  >  53342 [ACK] Seq=1 Ack=230233 Win=252416 Len=0 TSval=2326341305 TSecr=1377380525
202,1.93004,192.168.2.2,192.168.1.2,TCP,66,258560,5001  >  53342 [ACK] Seq=1 Ack=233129 Win=258560 Len=0 TSval=2326341329 TSecr=1377380549
204,1.954597,192.168.2.2,192.168.1.2,TCP,66,264192,5001  >  53342 [ACK] Seq=1 Ack=236025 Win=264192 Len=0 TSval=2326341353 TSecr=1377380573
207,1.978953,192.168.2.2,192.168.1.2,TCP,66,269824,5001  >  53342 [ACK] Seq=1 Ack=238921 Win=269824 Len=0 TSval=2326341378 TSecr=1377380597
209,2.002424,192.168.2.2,192.168.1.2,TCP,66,275968,5001  >  53342 [ACK] Seq=1 Ack=241817 Win=275968 Len=0 TSval=2326341401 TSecr=1377380621
211,2.026633,192.168.2.2,192.168.1.2,TCP,66,281600,5001  >  53342 [ACK] Seq=1 Ack=244713 Win=281600 Len=0 TSval=2326341425 TSecr=1377380646
214,2.051672,192.168.2.2,192.168.1.2,TCP,66,284160,5001  >  53342 [ACK] Seq=1 Ack=246161 Win=284160 Len=0 TSval=2326341450 TSecr=1377380658
216,2.063263,192.168.2.2,192.168.1.2,TCP,66,290304,5001  >  53342 [ACK] Seq=1 Ack=249057 Win=290304 Len=0 TSval=2326341462 TSecr=1377380682
218,2.087742,192.168.2.2,192.168.1.2,TCP,66,295936,5001  >  53342 [ACK] Seq=1 Ack=251953 Win=295936 Len=0 TSval=2326341486 TSecr=1377380706
220,2.112289,192.168.2.2,192.168.1.2,TCP,66,301568,5001  >  53342 [ACK] Seq=1 Ack=254849 Win=301568 Len=0 TSval=2326341511 TSecr=1377380741
222,2.135628,192.168.2.2,192.168.1.2,TCP,66,307712,5001  >  53342 [ACK] Seq=1 Ack=257745 Win=307712 Len=0 TSval=2326341534 TSecr=1377380755
224,2.160241,192.168.2.2,192.168.1.2,TCP,66,310272,5001  >  53342 [ACK] Seq=1 Ack=259193 Win=310272 Len=0 TSval=2326341559 TSecr=1377380769
226,2.172097,192.168.2.2,192.168.1.2,TCP,66,316416,5001  >  53342 [ACK] Seq=1 Ack=262089 Win=316416 Len=0 TSval=2326341571 TSecr=1377380778
228,2.196571,192.168.2.2,192.168.1.2,TCP,66,322048,5001  >  53342 [ACK] Seq=1 Ack=264985 Win=322048 Len=0 TSval=2326341595 TSecr=1377380803
230,2.22108,192.168.2.2,192.168.1.2,TCP,66,327680,5001  >  53342 [ACK] Seq=1 Ack=267881 Win=327680 Len=0 TSval=2326341620 TSecr=1377380839
232,2.245521,192.168.2.2,192.168.1.2,TCP,66,333824,5001  >  53342 [ACK] Seq=1 Ack=270777 Win=333824 Len=0 TSval=2326341644 TSecr=1377380863
234,2.269037,192.168.2.2,192.168.1.2,TCP,66,339456,5001  >  53342 [ACK] Seq=1 Ack=273673 Win=339456 Len=0 TSval=2326341667 TSecr=1377380863
236,2.294337,192.168.2.2,192.168.1.2,TCP,66,345088,5001  >  53342 [ACK] Seq=1 Ack=276569 Win=345088 Len=0 TSval=2326341693 TSecr=1377380900
238,2.319005,192.168.2.2,192.168.1.2,TCP,66,351232,5001  >  53342 [ACK] Seq=1 Ack=279465 Win=351232 Len=0 TSval=2326341717 TSecr=1377380924
240,2.342807,192.168.2.2,192.168.1.2,TCP,66,356864,5001  >  53342 [ACK] Seq=1 Ack=282361 Win=356864 Len=0 TSval=2326341741 TSecr=1377380948
242,2.367092,192.168.2.2,192.168.1.2,TCP,66,360448,5001  >  53342 [ACK] Seq=1 Ack=285257 Win=360448 Len=0 TSval=2326341765 TSecr=1377380985
245,2.391585,192.168.2.2,192.168.1.2,TCP,66,360448,5001  >  53342 [ACK] Seq=1 Ack=288153 Win=360448 Len=0 TSval=2326341790 TSecr=1377380985
247,2.418126,192.168.2.2,192.168.1.2,TCP,66,360960,5001  >  53342 [ACK] Seq=1 Ack=289601 Win=360960 Len=0 TSval=2326341817 TSecr=1377381009
249,2.427878,192.168.2.2,192.168.1.2,TCP,66,360960,5001  >  53342 [ACK] Seq=1 Ack=292497 Win=360960 Len=0 TSval=2326341826 TSecr=1377381021
251,2.452377,192.168.2.2,192.168.1.2,TCP,66,360960,5001  >  53342 [ACK] Seq=1 Ack=295393 Win=360960 Len=0 TSval=2326341851 TSecr=1377381046
253,2.476427,192.168.2.2,192.168.1.2,TCP,66,360960,5001  >  53342 [ACK] Seq=1 Ack=298289 Win=360960 Len=0 TSval=2326341875 TSecr=1377381070
255,2.500899,192.168.2.2,192.168.1.2,TCP,66,360960,5001  >  53342 [ACK] Seq=1 Ack=301185 Win=360960 Len=0 TSval=2326341899 TSecr=1377381094
257,2.52479,192.168.2.2,192.168.1.2,TCP,66,360960,5001  >  53342 [ACK] Seq=1 Ack=304081 Win=360960 Len=0 TSval=2326341923 TSecr=1377381118
259,2.548882,192.168.2.2,192.168.1.2,TCP,66,360960,5001  >  53342 [ACK] Seq=1 Ack=306977 Win=360960 Len=0 TSval=2326341947 TSecr=1377381142
261,2.573413,192.168.2.2,192.168.1.2,TCP,66,360960,5001  >  53342 [ACK] Seq=1 Ack=309873 Win=360960 Len=0 TSval=2326341972 TSecr=1377381167
263,2.6097,192.168.2.2,192.168.1.2,TCP,66,360960,5001  >  53342 [ACK] Seq=1 Ack=314217 Win=360960 Len=0 TSval=2326342008 TSecr=1377381180
266,2.634174,192.168.2.2,192.168.1.2,TCP,66,360960,5001  >  53342 [ACK] Seq=1 Ack=317113 Win=360960 Len=0 TSval=2326342032 TSecr=1377381228
268,2.658728,192.168.2.2,192.168.1.2,TCP,66,360960,5001  >  53342 [ACK] Seq=1 Ack=320009 Win=360960 Len=0 TSval=2326342057 TSecr=1377381252
270,2.682206,192.168.2.2,192.168.1.2,TCP,66,360960,5001  >  53342 [ACK] Seq=1 Ack=322905 Win=360960 Len=0 TSval=2326342080 TSecr=1377381276
274,2.718533,192.168.2.2,192.168.1.2,TCP,66,360960,5001  >  53342 [ACK] Seq=1 Ack=327249 Win=360960 Len=0 TSval=2326342117 TSecr=1377381281
277,2.743021,192.168.2.2,192.168.1.2,TCP,66,360960,5001  >  53342 [ACK] Seq=1 Ack=330145 Win=360960 Len=0 TSval=2326342141 TSecr=1377381324
279,2.766779,192.168.2.2,192.168.1.2,TCP,66,360960,5001  >  53342 [ACK] Seq=1 Ack=333041 Win=360960 Len=0 TSval=2326342165 TSecr=1377381348
282,2.791741,192.168.2.2,192.168.1.2,TCP,66,360960,5001  >  53342 [ACK] Seq=1 Ack=335937 Win=360960 Len=0 TSval=2326342190 TSecr=1377381373
284,2.815991,192.168.2.2,192.168.1.2,TCP,66,360960,5001  >  53342 [ACK] Seq=1 Ack=338833 Win=360960 Len=0 TSval=2326342214 TSecr=1377381385
286,2.841052,192.168.2.2,192.168.1.2,TCP,66,360960,5001  >  53342 [ACK] Seq=1 Ack=341729 Win=360960 Len=0 TSval=2326342239 TSecr=1377381409
288,2.864667,192.168.2.2,192.168.1.2,TCP,66,360960,5001  >  53342 [ACK] Seq=1 Ack=344625 Win=360960 Len=0 TSval=2326342263 TSecr=1377381434
290,2.888748,192.168.2.2,192.168.1.2,TCP,66,360960,5001  >  53342 [ACK] Seq=1 Ack=347521 Win=360960 Len=0 TSval=2326342287 TSecr=1377381457
292,2.925217,192.168.2.2,192.168.1.2,TCP,66,360960,5001  >  53342 [ACK] Seq=1 Ack=351865 Win=360960 Len=0 TSval=2326342323 TSecr=1377381482
295,2.949754,192.168.2.2,192.168.1.2,TCP,66,360960,5001  >  53342 [ACK] Seq=1 Ack=354761 Win=360960 Len=0 TSval=2326342348 TSecr=1377381518
297,2.974227,192.168.2.2,192.168.1.2,TCP,66,360960,5001  >  53342 [ACK] Seq=1 Ack=357657 Win=360960 Len=0 TSval=2326342372 TSecr=1377381543
299,2.997974,192.168.2.2,192.168.1.2,TCP,66,360960,5001  >  53342 [ACK] Seq=1 Ack=360553 Win=360960 Len=0 TSval=2326342396 TSecr=1377381567
301,3.022683,192.168.2.2,192.168.1.2,TCP,66,360960,5001  >  53342 [ACK] Seq=1 Ack=363449 Win=360960 Len=0 TSval=2326342421 TSecr=1377381591
304,3.046873,192.168.2.2,192.168.1.2,TCP,66,360960,5001  >  53342 [ACK] Seq=1 Ack=366345 Win=360960 Len=0 TSval=2326342445 TSecr=1377381616
306,3.071825,192.168.2.2,192.168.1.2,TCP,66,360960,5001  >  53342 [ACK] Seq=1 Ack=369241 Win=360960 Len=0 TSval=2326342470 TSecr=1377381640
308,3.095327,192.168.2.2,192.168.1.2,TCP,66,360960,5001  >  53342 [ACK] Seq=1 Ack=372137 Win=360960 Len=0 TSval=2326342493 TSecr=1377381664
310,3.119791,192.168.2.2,192.168.1.2,TCP,66,360960,5001  >  53342 [ACK] Seq=1 Ack=375033 Win=360960 Len=0 TSval=2326342518 TSecr=1377381689
312,3.156114,192.168.2.2,192.168.1.2,TCP,66,360960,5001  >  53342 [ACK] Seq=1 Ack=379377 Win=360960 Len=0 TSval=2326342554 TSecr=1377381689
315,3.192151,192.168.2.2,192.168.1.2,TCP,66,360960,5001  >  53342 [ACK] Seq=1 Ack=383721 Win=360960 Len=0 TSval=2326342590 TSecr=1377381740
317,3.21685,192.168.2.2,192.168.1.2,TCP,66,360960,5001  >  53342 [ACK] Seq=1 Ack=386617 Win=360960 Len=0 TSval=2326342615 TSecr=1377381774
319,3.241298,192.168.2.2,192.168.1.2,TCP,66,360960,5001  >  53342 [ACK] Seq=1 Ack=389513 Win=360960 Len=0 TSval=2326342639 TSecr=1377381798
322,3.264884,192.168.2.2,192.168.1.2,TCP,66,360960,5001  >  53342 [ACK] Seq=1 Ack=392409 Win=360960 Len=0 TSval=2326342663 TSecr=1377381822
324,3.289381,192.168.2.2,192.168.1.2,TCP,66,360960,5001  >  53342 [ACK] Seq=1 Ack=395305 Win=360960 Len=0 TSval=2326342687 TSecr=1377381846
326,3.313869,192.168.2.2,192.168.1.2,TCP,66,360960,5001  >  53342 [ACK] Seq=1 Ack=398201 Win=360960 Len=0 TSval=2326342712 TSecr=1377381870
328,3.338382,192.168.2.2,192.168.1.2,TCP,66,360960,5001  >  53342 [ACK] Seq=1 Ack=401097 Win=360960 Len=0 TSval=2326342736 TSecr=1377381895
330,3.361855,192.168.2.2,192.168.1.2,TCP,66,360960,5001  >  53342 [ACK] Seq=1 Ack=403993 Win=360960 Len=0 TSval=2326342760 TSecr=1377381931
332,3.386375,192.168.2.2,192.168.1.2,TCP,66,360960,5001  >  53342 [ACK] Seq=1 Ack=406889 Win=360960 Len=0 TSval=2326342784 TSecr=1377381931
334,3.421199,192.168.2.2,192.168.1.2,TCP,66,360960,5001  >  53342 [ACK] Seq=1 Ack=409785 Win=360960 Len=0 TSval=2326342819 TSecr=1377381955
336,3.434453,192.168.2.2,192.168.1.2,TCP,66,360960,5001  >  53342 [ACK] Seq=1 Ack=412681 Win=360960 Len=0 TSval=2326342832 TSecr=1377381980
338,3.458962,192.168.2.2,192.168.1.2,TCP,66,360960,5001  >  53342 [ACK] Seq=1 Ack=415577 Win=360960 Len=0 TSval=2326342857 TSecr=1377382003
340,3.483458,192.168.2.2,192.168.1.2,TCP,66,360960,5001  >  53342 [ACK] Seq=1 Ack=418473 Win=360960 Len=0 TSval=2326342881 TSecr=1377382040
343,3.519627,192.168.2.2,192.168.1.2,TCP,66,360960,5001  >  53342 [ACK] Seq=1 Ack=422817 Win=360960 Len=0 TSval=2326342917 TSecr=1377382040
345,3.544198,192.168.2.2,192.168.1.2,TCP,66,360960,5001  >  53342 [ACK] Seq=1 Ack=425713 Win=360960 Len=0 TSval=2326342942 TSecr=1377382088
347,3.568297,192.168.2.2,192.168.1.2,TCP,66,360960,5001  >  53342 [ACK] Seq=1 Ack=428609 Win=360960 Len=0 TSval=2326342966 TSecr=1377382113
350,3.591862,192.168.2.2,192.168.1.2,TCP,66,360960,5001  >  53342 [ACK] Seq=1 Ack=431505 Win=360960 Len=0 TSval=2326342990 TSecr=1377382137
353,3.616252,192.168.2.2,192.168.1.2,TCP,66,360960,5001  >  53342 [ACK] Seq=1 Ack=434401 Win=360960 Len=0 TSval=2326343014 TSecr=1377382162
355,3.640731,192.168.2.2,192.168.1.2,TCP,66,360960,5001  >  53342 [ACK] Seq=1 Ack=437297 Win=360960 Len=0 TSval=2326343039 TSecr=1377382186
357,3.664595,192.168.2.2,192.168.1.2,TCP,66,360960,5001  >  53342 [ACK] Seq=1 Ack=440193 Win=360960 Len=0 TSval=2326343062 TSecr=1377382210
359,3.688782,192.168.2.2,192.168.1.2,TCP,66,360960,5001  >  53342 [ACK] Seq=1 Ack=443089 Win=360960 Len=0 TSval=2326343087 TSecr=1377382246
361,3.712961,192.168.2.2,192.168.1.2,TCP,66,360960,5001  >  53342 [ACK] Seq=1 Ack=445985 Win=360960 Len=0 TSval=2326343111 TSecr=1377382246
363,3.737727,192.168.2.2,192.168.1.2,TCP,66,360960,5001  >  53342 [ACK] Seq=1 Ack=448881 Win=360960 Len=0 TSval=2326343135 TSecr=1377382271
365,3.761502,192.168.2.2,192.168.1.2,TCP,66,360960,5001  >  53342 [ACK] Seq=1 Ack=451777 Win=360960 Len=0 TSval=2326343159 TSecr=1377382295
367,3.785787,192.168.2.2,192.168.1.2,TCP,66,360960,5001  >  53342 [ACK] Seq=1 Ack=454673 Win=360960 Len=0 TSval=2326343183 TSecr=1377382319
369,3.809903,192.168.2.2,192.168.1.2,TCP,66,360960,5001  >  53342 [ACK] Seq=1 Ack=457569 Win=360960 Len=0 TSval=2326343208 TSecr=1377382344
372,3.835076,192.168.2.2,192.168.1.2,TCP,66,360960,5001  >  53342 [ACK] Seq=1 Ack=460465 Win=360960 Len=0 TSval=2326343233 TSecr=1377382368
374,3.859243,192.168.2.2,192.168.1.2,TCP,66,360960,5001  >  53342 [ACK] Seq=1 Ack=463361 Win=360960 Len=0 TSval=2326343257 TSecr=1377382393
376,3.883864,192.168.2.2,192.168.1.2,TCP,66,360960,5001  >  53342 [ACK] Seq=1 Ack=466257 Win=360960 Len=0 TSval=2326343282 TSecr=1377382416
378,3.90759,192.168.2.2,192.168.1.2,TCP,66,360960,5001  >  53342 [ACK] Seq=1 Ack=469153 Win=360960 Len=0 TSval=2326343305 TSecr=1377382441
380,3.931933,192.168.2.2,192.168.1.2,TCP,66,360960,5001  >  53342 [ACK] Seq=1 Ack=472049 Win=360960 Len=0 TSval=2326343330 TSecr=1377382477
382,3.956334,192.168.2.2,192.168.1.2,TCP,66,360960,5001  >  53342 [ACK] Seq=1 Ack=474945 Win=360960 Len=0 TSval=2326343354 TSecr=1377382477
385,3.980764,192.168.2.2,192.168.1.2,TCP,66,360960,5001  >  53342 [ACK] Seq=1 Ack=477841 Win=360960 Len=0 TSval=2326343378 TSecr=1377382513
387,4.004478,192.168.2.2,192.168.1.2,TCP,66,360960,5001  >  53342 [ACK] Seq=1 Ack=480737 Win=360960 Len=0 TSval=2326343402 TSecr=1377382538
389,4.028851,192.168.2.2,192.168.1.2,TCP,66,360960,5001  >  53342 [ACK] Seq=1 Ack=483633 Win=360960 Len=0 TSval=2326343426 TSecr=1377382562
392,4.053344,192.168.2.2,192.168.1.2,TCP,66,360960,5001  >  53342 [ACK] Seq=1 Ack=486529 Win=360960 Len=0 TSval=2326343451 TSecr=1377382562
394,4.077176,192.168.2.2,192.168.1.2,TCP,66,360960,5001  >  53342 [ACK] Seq=1 Ack=489425 Win=360960 Len=0 TSval=2326343475 TSecr=1377382586
396,4.102352,192.168.2.2,192.168.1.2,TCP,66,360960,5001  >  53342 [ACK] Seq=1 Ack=492321 Win=360960 Len=0 TSval=2326343500 TSecr=1377382610
398,4.125809,192.168.2.2,192.168.1.2,TCP,66,360960,5001  >  53342 [ACK] Seq=1 Ack=495217 Win=360960 Len=0 TSval=2326343523 TSecr=1377382635
400,4.150334,192.168.2.2,192.168.1.2,TCP,66,360960,5001  >  53342 [ACK] Seq=1 Ack=498113 Win=360960 Len=0 TSval=2326343548 TSecr=1377382659
402,4.174887,192.168.2.2,192.168.1.2,TCP,66,360960,5001  >  53342 [ACK] Seq=1 Ack=501009 Win=360960 Len=0 TSval=2326343572 TSecr=1377382683
404,4.1984,192.168.2.2,192.168.1.2,TCP,66,360960,5001  >  53342 [ACK] Seq=1 Ack=503905 Win=360960 Len=0 TSval=2326343596 TSecr=1377382707
407,4.222853,192.168.2.2,192.168.1.2,TCP,66,360960,5001  >  53342 [ACK] Seq=1 Ack=506801 Win=360960 Len=0 TSval=2326343620 TSecr=1377382742
409,4.246682,192.168.2.2,192.168.1.2,TCP,66,360960,5001  >  53342 [ACK] Seq=1 Ack=509697 Win=360960 Len=0 TSval=2326343644 TSecr=1377382755
411,4.271365,192.168.2.2,192.168.1.2,TCP,66,360960,5001  >  53342 [ACK] Seq=1 Ack=512593 Win=360960 Len=0 TSval=2326343669 TSecr=1377382780
413,4.295156,192.168.2.2,192.168.1.2,TCP,66,360960,5001  >  53342 [ACK] Seq=1 Ack=515489 Win=360960 Len=0 TSval=2326343693 TSecr=1377382804
415,4.332195,192.168.2.2,192.168.1.2,TCP,66,360960,5001  >  53342 [ACK] Seq=1 Ack=519833 Win=360960 Len=0 TSval=2326343730 TSecr=1377382816
417,4.355762,192.168.2.2,192.168.1.2,TCP,66,360960,5001  >  53342 [ACK] Seq=1 Ack=522729 Win=360960 Len=0 TSval=2326343753 TSecr=1377382865
419,4.380223,192.168.2.2,192.168.1.2,TCP,66,360960,5001  >  53342 [ACK] Seq=1 Ack=525625 Win=360960 Len=0 TSval=2326343778 TSecr=1377382889
421,4.404713,192.168.2.2,192.168.1.2,TCP,66,360960,5001  >  53342 [ACK] Seq=1 Ack=528521 Win=360960 Len=0 TSval=2326343802 TSecr=1377382913
423,4.440951,192.168.2.2,192.168.1.2,TCP,66,360960,5001  >  53342 [ACK] Seq=1 Ack=532865 Win=360960 Len=0 TSval=2326343838 TSecr=1377382913
426,4.464734,192.168.2.2,192.168.1.2,TCP,66,360960,5001  >  53342 [ACK] Seq=1 Ack=535761 Win=360960 Len=0 TSval=2326343862 TSecr=1377382962
428,4.488984,192.168.2.2,192.168.1.2,TCP,66,360960,5001  >  53342 [ACK] Seq=1 Ack=538657 Win=360960 Len=0 TSval=2326343886 TSecr=1377382985
430,4.513476,192.168.2.2,192.168.1.2,TCP,66,360960,5001  >  53342 [ACK] Seq=1 Ack=541553 Win=360960 Len=0 TSval=2326343911 TSecr=1377383010
433,4.538002,192.168.2.2,192.168.1.2,TCP,66,360960,5001  >  53342 [ACK] Seq=1 Ack=544449 Win=360960 Len=0 TSval=2326343935 TSecr=1377383034
435,4.561608,192.168.2.2,192.168.1.2,TCP,66,360960,5001  >  53342 [ACK] Seq=1 Ack=547345 Win=360960 Len=0 TSval=2326343959 TSecr=1377383058
437,4.586036,192.168.2.2,192.168.1.2,TCP,66,360960,5001  >  53342 [ACK] Seq=1 Ack=550241 Win=360960 Len=0 TSval=2326343983 TSecr=1377383082
439,4.610555,192.168.2.2,192.168.1.2,TCP,66,360960,5001  >  53342 [ACK] Seq=1 Ack=553137 Win=360960 Len=0 TSval=2326344008 TSecr=1377383107
441,4.634283,192.168.2.2,192.168.1.2,TCP,66,360960,5001  >  53342 [ACK] Seq=1 Ack=556033 Win=360960 Len=0 TSval=2326344032 TSecr=1377383131
443,4.658543,192.168.2.2,192.168.1.2,TCP,66,360960,5001  >  53342 [ACK] Seq=1 Ack=558929 Win=360960 Len=0 TSval=2326344056 TSecr=1377383156
445,4.683007,192.168.2.2,192.168.1.2,TCP,66,360960,5001  >  53342 [ACK] Seq=1 Ack=561825 Win=360960 Len=0 TSval=2326344080 TSecr=1377383180
447,4.707524,192.168.2.2,192.168.1.2,TCP,66,360960,5001  >  53342 [ACK] Seq=1 Ack=564721 Win=360960 Len=0 TSval=2326344105 TSecr=1377383205
450,4.732065,192.168.2.2,192.168.1.2,TCP,66,360960,5001  >  53342 [ACK] Seq=1 Ack=567617 Win=360960 Len=0 TSval=2326344129 TSecr=1377383228
452,4.755522,192.168.2.2,192.168.1.2,TCP,66,360960,5001  >  53342 [ACK] Seq=1 Ack=570513 Win=360960 Len=0 TSval=2326344153 TSecr=1377383253
454,4.779625,192.168.2.2,192.168.1.2,TCP,66,360960,5001  >  53342 [ACK] Seq=1 Ack=573409 Win=360960 Len=0 TSval=2326344177 TSecr=1377383277
456,4.803848,192.168.2.2,192.168.1.2,TCP,66,360960,5001  >  53342 [ACK] Seq=1 Ack=576305 Win=360960 Len=0 TSval=2326344201 TSecr=1377383277
458,4.828118,192.168.2.2,192.168.1.2,TCP,66,360960,5001  >  53342 [ACK] Seq=1 Ack=579201 Win=360960 Len=0 TSval=2326344225 TSecr=1377383301
460,4.852615,192.168.2.2,192.168.1.2,TCP,66,360960,5001  >  53342 [ACK] Seq=1 Ack=582097 Win=360960 Len=0 TSval=2326344250 TSecr=1377383325
462,4.876548,192.168.2.2,192.168.1.2,TCP,66,360960,5001  >  53342 [ACK] Seq=1 Ack=584993 Win=360960 Len=0 TSval=2326344274 TSecr=1377383349
465,4.9015,192.168.2.2,192.168.1.2,TCP,66,360960,5001  >  53342 [ACK] Seq=1 Ack=587889 Win=360960 Len=0 TSval=2326344299 TSecr=1377383374
467,4.925929,192.168.2.2,192.168.1.2,TCP,66,360960,5001  >  53342 [ACK] Seq=1 Ack=590785 Win=360960 Len=0 TSval=2326344323 TSecr=1377383398
470,4.950006,192.168.2.2,192.168.1.2,TCP,66,360960,5001  >  53342 [ACK] Seq=1 Ack=593681 Win=360960 Len=0 TSval=2326344347 TSecr=1377383423
472,4.986443,192.168.2.2,192.168.1.2,TCP,66,360960,5001  >  53342 [ACK] Seq=1 Ack=598025 Win=360960 Len=0 TSval=2326344384 TSecr=1377383446
474,5.010898,192.168.2.2,192.168.1.2,TCP,66,360960,5001  >  53342 [ACK] Seq=1 Ack=600921 Win=360960 Len=0 TSval=2326344408 TSecr=1377383495
478,5.034756,192.168.2.2,192.168.1.2,TCP,66,360960,5001  >  53342 [ACK] Seq=1 Ack=603817 Win=360960 Len=0 TSval=2326344432 TSecr=1377383519
480,5.059841,192.168.2.2,192.168.1.2,TCP,66,360960,5001  >  53342 [ACK] Seq=1 Ack=606713 Win=360960 Len=0 TSval=2326344457 TSecr=1377383519
482,5.083196,192.168.2.2,192.168.1.2,TCP,66,360960,5001  >  53342 [ACK] Seq=1 Ack=609609 Win=360960 Len=0 TSval=2326344480 TSecr=1377383543
484,5.108008,192.168.2.2,192.168.1.2,TCP,66,360960,5001  >  53342 [ACK] Seq=1 Ack=612505 Win=360960 Len=0 TSval=2326344505 TSecr=1377383567
487,5.131654,192.168.2.2,192.168.1.2,TCP,66,360960,5001  >  53342 [ACK] Seq=1 Ack=615401 Win=360960 Len=0 TSval=2326344529 TSecr=1377383592
489,5.155983,192.168.2.2,192.168.1.2,TCP,66,360960,5001  >  53342 [ACK] Seq=1 Ack=618297 Win=360960 Len=0 TSval=2326344553 TSecr=1377383616
494,5.18042,192.168.2.2,192.168.1.2,TCP,66,360960,5001  >  53342 [ACK] Seq=1 Ack=621193 Win=360960 Len=0 TSval=2326344577 TSecr=1377383653
496,5.204946,192.168.2.2,192.168.1.2,TCP,66,360960,5001  >  53342 [ACK] Seq=1 Ack=624089 Win=360960 Len=0 TSval=2326344602 TSecr=1377383676
498,5.229424,192.168.2.2,192.168.1.2,TCP,66,360960,5001  >  53342 [ACK] Seq=1 Ack=626985 Win=360960 Len=0 TSval=2326344626 TSecr=1377383701
500,5.252945,192.168.2.2,192.168.1.2,TCP,66,360960,5001  >  53342 [ACK] Seq=1 Ack=629881 Win=360960 Len=0 TSval=2326344650 TSecr=1377383725
503,5.277482,192.168.2.2,192.168.1.2,TCP,66,360960,5001  >  53342 [ACK] Seq=1 Ack=632777 Win=360960 Len=0 TSval=2326344674 TSecr=1377383761
505,5.301363,192.168.2.2,192.168.1.2,TCP,66,360960,5001  >  53342 [ACK] Seq=1 Ack=635673 Win=360960 Len=0 TSval=2326344698 TSecr=1377383761
507,5.325502,192.168.2.2,192.168.1.2,TCP,66,360960,5001  >  53342 [ACK] Seq=1 Ack=638569 Win=360960 Len=0 TSval=2326344722 TSecr=1377383785
509,5.349915,192.168.2.2,192.168.1.2,TCP,66,360960,5001  >  53342 [ACK] Seq=1 Ack=641465 Win=360960 Len=0 TSval=2326344747 TSecr=1377383809
511,5.37449,192.168.2.2,192.168.1.2,TCP,66,360960,5001  >  53342 [ACK] Seq=1 Ack=644361 Win=360960 Len=0 TSval=2326344771 TSecr=1377383834
513,5.41085,192.168.2.2,192.168.1.2,TCP,66,360960,5001  >  53342 [ACK] Seq=1 Ack=648705 Win=360960 Len=0 TSval=2326344808 TSecr=1377383840
516,5.434487,192.168.2.2,192.168.1.2,TCP,66,360960,5001  >  53342 [ACK] Seq=1 Ack=651601 Win=360960 Len=0 TSval=2326344831 TSecr=1377383882
518,5.458717,192.168.2.2,192.168.1.2,TCP,66,360960,5001  >  53342 [ACK] Seq=1 Ack=654497 Win=360960 Len=0 TSval=2326344856 TSecr=1377383906
521,5.483786,192.168.2.2,192.168.1.2,TCP,66,360960,5001  >  53342 [ACK] Seq=1 Ack=657393 Win=360960 Len=0 TSval=2326344881 TSecr=1377383931
523,5.507271,192.168.2.2,192.168.1.2,TCP,66,360960,5001  >  53342 [ACK] Seq=1 Ack=660289 Win=360960 Len=0 TSval=2326344904 TSecr=1377383955
525,5.531783,192.168.2.2,192.168.1.2,TCP,66,360960,5001  >  53342 [ACK] Seq=1 Ack=663185 Win=360960 Len=0 TSval=2326344929 TSecr=1377383979
528,5.555582,192.168.2.2,192.168.1.2,TCP,66,360960,5001  >  53342 [ACK] Seq=1 Ack=666081 Win=360960 Len=0 TSval=2326344952 TSecr=1377384003
530,5.579825,192.168.2.2,192.168.1.2,TCP,66,360960,5001  >  53342 [ACK] Seq=1 Ack=668977 Win=360960 Len=0 TSval=2326344977 TSecr=1377384028
532,5.604368,192.168.2.2,192.168.1.2,TCP,66,360960,5001  >  53342 [ACK] Seq=1 Ack=671873 Win=360960 Len=0 TSval=2326345001 TSecr=1377384028
534,5.628248,192.168.2.2,192.168.1.2,TCP,66,360960,5001  >  53342 [ACK] Seq=1 Ack=674769 Win=360960 Len=0 TSval=2326345025 TSecr=1377384052
536,5.652478,192.168.2.2,192.168.1.2,TCP,66,360960,5001  >  53342 [ACK] Seq=1 Ack=677665 Win=360960 Len=0 TSval=2326345049 TSecr=1377384076
539,5.676886,192.168.2.2,192.168.1.2,TCP,66,360960,5001  >  53342 [ACK] Seq=1 Ack=680561 Win=360960 Len=0 TSval=2326345074 TSecr=1377384100
541,5.701328,192.168.2.2,192.168.1.2,TCP,66,360960,5001  >  53342 [ACK] Seq=1 Ack=683457 Win=360960 Len=0 TSval=2326345098 TSecr=1377384124
543,5.725151,192.168.2.2,192.168.1.2,TCP,66,360960,5001  >  53342 [ACK] Seq=1 Ack=686353 Win=360960 Len=0 TSval=2326345122 TSecr=1377384148
545,5.749439,192.168.2.2,192.168.1.2,TCP,66,360960,5001  >  53342 [ACK] Seq=1 Ack=689249 Win=360960 Len=0 TSval=2326345146 TSecr=1377384173
547,5.77382,192.168.2.2,192.168.1.2,TCP,66,360960,5001  >  53342 [ACK] Seq=1 Ack=692145 Win=360960 Len=0 TSval=2326345171 TSecr=1377384197
550,5.79841,192.168.2.2,192.168.1.2,TCP,66,360960,5001  >  53342 [ACK] Seq=1 Ack=695041 Win=360960 Len=0 TSval=2326345195 TSecr=1377384222
552,5.822055,192.168.2.2,192.168.1.2,TCP,66,360960,5001  >  53342 [ACK] Seq=1 Ack=697937 Win=360960 Len=0 TSval=2326345219 TSecr=1377384246
554,5.846389,192.168.2.2,192.168.1.2,TCP,66,360960,5001  >  53342 [ACK] Seq=1 Ack=700833 Win=360960 Len=0 TSval=2326345243 TSecr=1377384246
556,5.870886,192.168.2.2,192.168.1.2,TCP,66,360960,5001  >  53342 [ACK] Seq=1 Ack=703729 Win=360960 Len=0 TSval=2326345268 TSecr=1377384270
559,5.894793,192.168.2.2,192.168.1.2,TCP,66,360960,5001  >  53342 [ACK] Seq=1 Ack=706625 Win=360960 Len=0 TSval=2326345291 TSecr=1377384307
561,5.919022,192.168.2.2,192.168.1.2,TCP,66,360960,5001  >  53342 [ACK] Seq=1 Ack=709521 Win=360960 Len=0 TSval=2326345316 TSecr=1377384331
563,5.943437,192.168.2.2,192.168.1.2,TCP,66,360960,5001  >  53342 [ACK] Seq=1 Ack=712417 Win=360960 Len=0 TSval=2326345340 TSecr=1377384331
566,5.96814,192.168.2.2,192.168.1.2,TCP,66,360960,5001  >  53342 [ACK] Seq=1 Ack=715313 Win=360960 Len=0 TSval=2326345365 TSecr=1377384355
569,5.995028,192.168.2.2,192.168.1.2,TCP,66,360960,5001  >  53342 [ACK] Seq=1 Ack=718209 Win=360960 Len=0 TSval=2326345392 TSecr=1377384380
571,6.016918,192.168.2.2,192.168.1.2,TCP,66,360960,5001  >  53342 [ACK] Seq=1 Ack=721105 Win=360960 Len=0 TSval=2326345414 TSecr=1377384403
575,6.040836,192.168.2.2,192.168.1.2,TCP,66,360960,5001  >  53342 [ACK] Seq=1 Ack=724001 Win=360960 Len=0 TSval=2326345437 TSecr=1377384428
577,6.077223,192.168.2.2,192.168.1.2,TCP,66,360960,5001  >  53342 [ACK] Seq=1 Ack=728345 Win=360960 Len=0 TSval=2326345474 TSecr=1377384428
580,6.101715,192.168.2.2,192.168.1.2,TCP,66,360960,5001  >  53342 [ACK] Seq=1 Ack=731241 Win=360960 Len=0 TSval=2326345498 TSecr=1377384476
582,6.125928,192.168.2.2,192.168.1.2,TCP,66,360960,5001  >  53342 [ACK] Seq=1 Ack=734137 Win=360960 Len=0 TSval=2326345522 TSecr=1377384500
584,6.150717,192.168.2.2,192.168.1.2,TCP,66,360960,5001  >  53342 [ACK] Seq=1 Ack=737033 Win=360960 Len=0 TSval=2326345547 TSecr=1377384525
586,6.175155,192.168.2.2,192.168.1.2,TCP,66,360960,5001  >  53342 [ACK] Seq=1 Ack=739929 Win=360960 Len=0 TSval=2326345572 TSecr=1377384549
589,6.198715,192.168.2.2,192.168.1.2,TCP,66,360960,5001  >  53342 [ACK] Seq=1 Ack=742825 Win=360960 Len=0 TSval=2326345595 TSecr=1377384573
591,6.223186,192.168.2.2,192.168.1.2,TCP,66,360960,5001  >  53342 [ACK] Seq=1 Ack=745721 Win=360960 Len=0 TSval=2326345620 TSecr=1377384573
593,6.247089,192.168.2.2,192.168.1.2,TCP,66,360960,5001  >  53342 [ACK] Seq=1 Ack=748617 Win=360960 Len=0 TSval=2326345644 TSecr=1377384597
595,6.272256,192.168.2.2,192.168.1.2,TCP,66,360960,5001  >  53342 [ACK] Seq=1 Ack=751513 Win=360960 Len=0 TSval=2326345669 TSecr=1377384621
598,6.295787,192.168.2.2,192.168.1.2,TCP,66,360960,5001  >  53342 [ACK] Seq=1 Ack=754409 Win=360960 Len=0 TSval=2326345692 TSecr=1377384645
600,6.319854,192.168.2.2,192.168.1.2,TCP,66,360960,5001  >  53342 [ACK] Seq=1 Ack=757305 Win=360960 Len=0 TSval=2326345716 TSecr=1377384670
602,6.344759,192.168.2.2,192.168.1.2,TCP,66,360960,5001  >  53342 [ACK] Seq=1 Ack=760201 Win=360960 Len=0 TSval=2326345741 TSecr=1377384694
604,6.368257,192.168.2.2,192.168.1.2,TCP,66,360960,5001  >  53342 [ACK] Seq=1 Ack=763097 Win=360960 Len=0 TSval=2326345765 TSecr=1377384731
607,6.392748,192.168.2.2,192.168.1.2,TCP,66,360960,5001  >  53342 [ACK] Seq=1 Ack=765993 Win=360960 Len=0 TSval=2326345789 TSecr=1377384731
609,6.419171,192.168.2.2,192.168.1.2,TCP,66,360960,5001  >  53342 [ACK] Seq=1 Ack=768889 Win=360960 Len=0 TSval=2326345816 TSecr=1377384754
612,6.441746,192.168.2.2,192.168.1.2,TCP,66,360960,5001  >  53342 [ACK] Seq=1 Ack=771785 Win=360960 Len=0 TSval=2326345838 TSecr=1377384779
615,6.466321,192.168.2.2,192.168.1.2,TCP,66,360960,5001  >  53342 [ACK] Seq=1 Ack=774681 Win=360960 Len=0 TSval=2326345863 TSecr=1377384779
617,6.489935,192.168.2.2,192.168.1.2,TCP,66,360960,5001  >  53342 [ACK] Seq=1 Ack=777577 Win=360960 Len=0 TSval=2326345886 TSecr=1377384804
620,6.514367,192.168.2.2,192.168.1.2,TCP,66,360960,5001  >  53342 [ACK] Seq=1 Ack=780473 Win=360960 Len=0 TSval=2326345911 TSecr=1377384827
622,6.538546,192.168.2.2,192.168.1.2,TCP,66,360960,5001  >  53342 [ACK] Seq=1 Ack=783369 Win=360960 Len=0 TSval=2326345935 TSecr=1377384852
625,6.575087,192.168.2.2,192.168.1.2,TCP,66,360960,5001  >  53342 [ACK] Seq=1 Ack=787713 Win=360960 Len=0 TSval=2326345971 TSecr=1377384863
628,6.598886,192.168.2.2,192.168.1.2,TCP,66,360960,5001  >  53342 [ACK] Seq=1 Ack=790609 Win=360960 Len=0 TSval=2326345995 TSecr=1377384900
630,6.623118,192.168.2.2,192.168.1.2,TCP,66,360960,5001  >  53342 [ACK] Seq=1 Ack=793505 Win=360960 Len=0 TSval=2326346019 TSecr=1377384924
633,6.647347,192.168.2.2,192.168.1.2,TCP,66,360960,5001  >  53342 [ACK] Seq=1 Ack=796401 Win=360960 Len=0 TSval=2326346044 TSecr=1377384948
635,6.671602,192.168.2.2,192.168.1.2,TCP,66,360960,5001  >  53342 [ACK] Seq=1 Ack=799297 Win=360960 Len=0 TSval=2326346068 TSecr=1377384972
637,6.696147,192.168.2.2,192.168.1.2,TCP,66,360960,5001  >  53342 [ACK] Seq=1 Ack=802193 Win=360960 Len=0 TSval=2326346092 TSecr=1377384972
640,6.720666,192.168.2.2,192.168.1.2,TCP,66,360960,5001  >  53342 [ACK] Seq=1 Ack=805089 Win=360960 Len=0 TSval=2326346117 TSecr=1377384997
642,6.744264,192.168.2.2,192.168.1.2,TCP,66,360960,5001  >  53342 [ACK] Seq=1 Ack=807985 Win=360960 Len=0 TSval=2326346140 TSecr=1377385021
644,6.768641,192.168.2.2,192.168.1.2,TCP,66,360960,5001  >  53342 [ACK] Seq=1 Ack=810881 Win=360960 Len=0 TSval=2326346165 TSecr=1377385045
647,6.793159,192.168.2.2,192.168.1.2,TCP,66,360960,5001  >  53342 [ACK] Seq=1 Ack=813777 Win=360960 Len=0 TSval=2326346189 TSecr=1377385069
649,6.817072,192.168.2.2,192.168.1.2,TCP,66,360960,5001  >  53342 [ACK] Seq=1 Ack=816673 Win=360960 Len=0 TSval=2326346213 TSecr=1377385094
651,6.841436,192.168.2.2,192.168.1.2,TCP,66,360960,5001  >  53342 [ACK] Seq=1 Ack=819569 Win=360960 Len=0 TSval=2326346238 TSecr=1377385094
654,6.865757,192.168.2.2,192.168.1.2,TCP,66,360960,5001  >  53342 [ACK] Seq=1 Ack=822465 Win=360960 Len=0 TSval=2326346262 TSecr=1377385118
656,6.889567,192.168.2.2,192.168.1.2,TCP,66,360960,5001  >  53342 [ACK] Seq=1 Ack=825361 Win=360960 Len=0 TSval=2326346286 TSecr=1377385142
658,6.914705,192.168.2.2,192.168.1.2,TCP,66,360960,5001  >  53342 [ACK] Seq=1 Ack=828257 Win=360960 Len=0 TSval=2326346311 TSecr=1377385166
661,6.938234,192.168.2.2,192.168.1.2,TCP,66,360960,5001  >  53342 [ACK] Seq=1 Ack=831153 Win=360960 Len=0 TSval=2326346334 TSecr=1377385191
663,6.962696,192.168.2.2,192.168.1.2,TCP,66,360960,5001  >  53342 [ACK] Seq=1 Ack=834049 Win=360960 Len=0 TSval=2326346359 TSecr=1377385191
665,6.987222,192.168.2.2,192.168.1.2,TCP,66,360960,5001  >  53342 [ACK] Seq=1 Ack=836945 Win=360960 Len=0 TSval=2326346383 TSecr=1377385214
668,7.010709,192.168.2.2,192.168.1.2,TCP,66,360960,5001  >  53342 [ACK] Seq=1 Ack=839841 Win=360960 Len=0 TSval=2326346407 TSecr=1377385239
670,7.035249,192.168.2.2,192.168.1.2,TCP,66,360960,5001  >  53342 [ACK] Seq=1 Ack=842737 Win=360960 Len=0 TSval=2326346431 TSecr=1377385263
673,7.059147,192.168.2.2,192.168.1.2,TCP,66,360960,5001  >  53342 [ACK] Seq=1 Ack=845633 Win=360960 Len=0 TSval=2326346455 TSecr=1377385288
