"No.","Time","Source","Destination","Protocol","Length","Calculated window size","Info"
"4","0.000329","192.168.2.2","192.168.1.2","TCP","74","43440","5001  >  44768 [SYN, ACK] Seq=0 Ack=1 Win=43440 Len=0 MSS=1460 SACK_PERM=1 TSval=2039949759 TSecr=1376208928 WS=512"
"7","0.000393","192.168.2.2","192.168.1.2","TCP","66","39936","5001  >  44768 [ACK] Seq=1 Ack=7241 Win=39936 Len=0 TSval=2039949759 TSecr=1376208928"
"12","0.049929","192.168.2.2","192.168.1.2","TCP","66","39936","5001  >  44768 [ACK] Seq=1 Ack=14481 Win=39936 Len=0 TSval=2039949809 TSecr=1376208928"
"15","0.111149","192.168.2.2","192.168.1.2","TCP","66","38400","5001  >  44768 [ACK] Seq=1 Ack=24617 Win=38400 Len=0 TSval=2039949870 TSecr=1376208928"
"24","0.195364","192.168.2.2","192.168.1.2","TCP","66","40960","5001  >  44768 [ACK] Seq=1 Ack=28961 Win=40960 Len=0 TSval=2039949954 TSecr=1376208928"
"27","0.231622","192.168.2.2","192.168.1.2","TCP","66","42496","5001  >  44768 [ACK] Seq=1 Ack=30409 Win=42496 Len=0 TSval=2039949990 TSecr=1376208941"
"30","0.243509","192.168.2.2","192.168.1.2","TCP","66","38912","5001  >  44768 [ACK] Seq=1 Ack=39097 Win=38912 Len=0 TSval=2039950002 TSecr=1376208978"
"32","0.317198","192.168.2.2","192.168.1.2","TCP","66","40960","5001  >  44768 [ACK] Seq=1 Ack=43441 Win=40960 Len=0 TSval=2039950076 TSecr=1376209006"
"36","0.354153","192.168.2.2","192.168.1.2","TCP","66","41984","5001  >  44768 [ACK] Seq=1 Ack=46337 Win=41984 Len=0 TSval=2039950113 TSecr=1376209039"
"38","0.377457","192.168.2.2","192.168.1.2","TCP","66","41984","5001  >  44768 [ACK] Seq=1 Ack=49233 Win=41984 Len=0 TSval=2039950136 TSecr=1376209039"
"41","0.401674","192.168.2.2","192.168.1.2","TCP","66","42496","5001  >  44768 [ACK] Seq=1 Ack=50681 Win=42496 Len=0 TSval=2039950160 TSecr=1376209039"
"43","0.413838","192.168.2.2","192.168.1.2","TCP","66","41984","5001  >  44768 [ACK] Seq=1 Ack=53577 Win=41984 Len=0 TSval=2039950173 TSecr=1376209039"
"45","0.438404","192.168.2.2","192.168.1.2","TCP","66","41984","5001  >  44768 [ACK] Seq=1 Ack=56473 Win=41984 Len=0 TSval=2039950197 TSecr=1376209040"
"47","0.462435","192.168.2.2","192.168.1.2","TCP","66","41984","5001  >  44768 [ACK] Seq=1 Ack=59369 Win=41984 Len=0 TSval=2039950221 TSecr=1376209041"
"49","0.486699","192.168.2.2","192.168.1.2","TCP","66","41984","5001  >  44768 [ACK] Seq=1 Ack=62265 Win=41984 Len=0 TSval=2039950245 TSecr=1376209042"
"51","0.510696","192.168.2.2","192.168.1.2","TCP","78","42496","[TCP Window Update] 5001  >  44768 [ACK] Seq=1 Ack=62265 Win=42496 Len=0 TSval=2039950270 TSecr=1376209093 SLE=60817 SRE=62265"
"53","0.523583","192.168.2.2","192.168.1.2","TCP","66","41984","5001  >  44768 [ACK] Seq=1 Ack=65161 Win=41984 Len=0 TSval=2039950282 TSecr=1376209123"
"55","0.547096","192.168.2.2","192.168.1.2","TCP","66","41984","5001  >  44768 [ACK] Seq=1 Ack=68057 Win=41984 Len=0 TSval=2039950306 TSecr=1376209123"
"57","0.571569","192.168.2.2","192.168.1.2","TCP","66","41984","5001  >  44768 [ACK] Seq=1 Ack=70953 Win=41984 Len=0 TSval=2039950330 TSecr=1376209159"
"59","0.595500","192.168.2.2","192.168.1.2","TCP","66","42496","5001  >  44768 [ACK] Seq=1 Ack=72401 Win=42496 Len=0 TSval=2039950354 TSecr=1376209159"
"61","0.607860","192.168.2.2","192.168.1.2","TCP","66","41984","5001  >  44768 [ACK] Seq=1 Ack=75297 Win=41984 Len=0 TSval=2039950367 TSecr=1376209171"
"63","0.632302","192.168.2.2","192.168.1.2","TCP","66","41984","5001  >  44768 [ACK] Seq=1 Ack=78193 Win=41984 Len=0 TSval=2039950391 TSecr=1376209245"
"65","0.656034","192.168.2.2","192.168.1.2","TCP","66","48128","5001  >  44768 [ACK] Seq=1 Ack=81089 Win=48128 Len=0 TSval=2039950415 TSecr=1376209245"
"69","0.680284","192.168.2.2","192.168.1.2","TCP","66","54272","5001  >  44768 [ACK] Seq=1 Ack=83985 Win=54272 Len=0 TSval=2039950439 TSecr=1376209245"
"74","0.704792","192.168.2.2","192.168.1.2","TCP","66","59904","5001  >  44768 [ACK] Seq=1 Ack=86881 Win=59904 Len=0 TSval=2039950464 TSecr=1376209282"
"78","0.729363","192.168.2.2","192.168.1.2","TCP","66","65536","5001  >  44768 [ACK] Seq=1 Ack=89777 Win=65536 Len=0 TSval=2039950488 TSecr=1376209305"
"82","0.752937","192.168.2.2","192.168.1.2","TCP","66","71680","5001  >  44768 [ACK] Seq=1 Ack=92673 Win=71680 Len=0 TSval=2039950512 TSecr=1376209330"
"86","0.777279","192.168.2.2","192.168.1.2","TCP","66","74240","5001  >  44768 [ACK] Seq=1 Ack=94121 Win=74240 Len=0 TSval=2039950536 TSecr=1376209342"
"89","0.789281","192.168.2.2","192.168.1.2","TCP","66","80384","5001  >  44768 [ACK] Seq=1 Ack=97017 Win=80384 Len=0 TSval=2039950548 TSecr=1376209366"
"93","0.813649","192.168.2.2","192.168.1.2","TCP","66","86016","5001  >  44768 [ACK] Seq=1 Ack=99913 Win=86016 Len=0 TSval=2039950572 TSecr=1376209390"
"97","0.838073","192.168.2.2","192.168.1.2","TCP","66","91648","5001  >  44768 [ACK] Seq=1 Ack=102809 Win=91648 Len=0 TSval=2039950597 TSecr=1376209415"
"101","0.862511","192.168.2.2","192.168.1.2","TCP","66","95744","5001  >  44768 [ACK] Seq=1 Ack=104761 Win=95744 Len=0 TSval=2039950621 TSecr=1376209439"
"104","0.878598","192.168.2.2","192.168.1.2","TCP","66","98304","5001  >  44768 [ACK] Seq=1 Ack=106209 Win=98304 Len=0 TSval=2039950637 TSecr=1376209451"
"106","0.890910","192.168.2.2","192.168.1.2","TCP","66","104448","5001  >  44768 [ACK] Seq=1 Ack=109105 Win=104448 Len=0 TSval=2039950650 TSecr=1376209475"
"108","0.915396","192.168.2.2","192.168.1.2","TCP","66","110080","5001  >  44768 [ACK] Seq=1 Ack=112001 Win=110080 Len=0 TSval=2039950674 TSecr=1376209499"
"110","0.939189","192.168.2.2","192.168.1.2","TCP","66","115712","5001  >  44768 [ACK] Seq=1 Ack=114897 Win=115712 Len=0 TSval=2039950698 TSecr=1376209523"
"112","0.963411","192.168.2.2","192.168.1.2","TCP","66","118784","5001  >  44768 [ACK] Seq=1 Ack=115841 Win=118784 Len=0 TSval=2039950722 TSecr=1376209536"
"115","0.971461","192.168.2.2","192.168.1.2","TCP","66","124416","5001  >  44768 [ACK] Seq=1 Ack=118737 Win=124416 Len=0 TSval=2039950730 TSecr=1376209560"
"117","0.995716","192.168.2.2","192.168.1.2","TCP","66","130560","5001  >  44768 [ACK] Seq=1 Ack=121633 Win=130560 Len=0 TSval=2039950755 TSecr=1376209584"
"120","1.020207","192.168.2.2","192.168.1.2","TCP","66","136192","5001  >  44768 [ACK] Seq=1 Ack=124529 Win=136192 Len=0 TSval=2039950779 TSecr=1376209584"
"122","1.044695","192.168.2.2","192.168.1.2","TCP","66","141824","5001  >  44768 [ACK] Seq=1 Ack=127425 Win=141824 Len=0 TSval=2039950803 TSecr=1376209584"
"125","1.068368","192.168.2.2","192.168.1.2","TCP","66","147968","5001  >  44768 [ACK] Seq=1 Ack=130321 Win=147968 Len=0 TSval=2039950827 TSecr=1376209608"
"127","1.092709","192.168.2.2","192.168.1.2","TCP","66","153600","5001  >  44768 [ACK] Seq=1 Ack=133217 Win=153600 Len=0 TSval=2039950852 TSecr=1376209608"
"129","1.117039","192.168.2.2","192.168.1.2","TCP","66","159232","5001  >  44768 [ACK] Seq=1 Ack=136113 Win=159232 Len=0 TSval=2039950876 TSecr=1376209608"
"131","1.141727","192.168.2.2","192.168.1.2","TCP","66","162304","5001  >  44768 [ACK] Seq=1 Ack=137561 Win=162304 Len=0 TSval=2039950901 TSecr=1376209608"
"133","1.153145","192.168.2.2","192.168.1.2","TCP","66","167936","5001  >  44768 [ACK] Seq=1 Ack=140457 Win=167936 Len=0 TSval=2039950912 TSecr=1376209633"
"135","1.177954","192.168.2.2","192.168.1.2","TCP","66","173568","5001  >  44768 [ACK] Seq=1 Ack=143353 Win=173568 Len=0 TSval=2039950937 TSecr=1376209633"
"137","1.201614","192.168.2.2","192.168.1.2","TCP","66","179712","5001  >  44768 [ACK] Seq=1 Ack=146249 Win=179712 Len=0 TSval=2039950960 TSecr=1376209633"
"139","1.225839","192.168.2.2","192.168.1.2","TCP","66","185344","5001  >  44768 [ACK] Seq=1 Ack=149145 Win=185344 Len=0 TSval=2039950985 TSecr=1376209657"
"141","1.250799","192.168.2.2","192.168.1.2","TCP","66","187904","5001  >  44768 [ACK] Seq=1 Ack=152041 Win=187904 Len=0 TSval=2039951010 TSecr=1376209657"
"143","1.275019","192.168.2.2","192.168.1.2","TCP","66","187904","5001  >  44768 [ACK] Seq=1 Ack=154937 Win=187904 Len=0 TSval=2039951034 TSecr=1376209657"
"146","1.298485","192.168.2.2","192.168.1.2","TCP","66","187904","5001  >  44768 [ACK] Seq=1 Ack=157833 Win=187904 Len=0 TSval=2039951057 TSecr=1376209681"
"148","1.322874","192.168.2.2","192.168.1.2","TCP","66","188928","5001  >  44768 [ACK] Seq=1 Ack=159281 Win=188928 Len=0 TSval=2039951082 TSecr=1376209681"
"150","1.334840","192.168.2.2","192.168.1.2","TCP","66","187904","5001  >  44768 [ACK] Seq=1 Ack=162177 Win=187904 Len=0 TSval=2039951094 TSecr=1376209681"
"152","1.359157","192.168.2.2","192.168.1.2","TCP","66","187904","5001  >  44768 [ACK] Seq=1 Ack=165073 Win=187904 Len=0 TSval=2039951118 TSecr=1376209705"
"154","1.384024","192.168.2.2","192.168.1.2","TCP","66","187904","5001  >  44768 [ACK] Seq=1 Ack=167969 Win=187904 Len=0 TSval=2039951143 TSecr=1376209705"
"156","1.407531","192.168.2.2","192.168.1.2","TCP","66","187904","5001  >  44768 [ACK] Seq=1 Ack=170865 Win=187904 Len=0 TSval=2039951166 TSecr=1376209717"
"158","1.432577","192.168.2.2","192.168.1.2","TCP","66","187904","5001  >  44768 [ACK] Seq=1 Ack=173761 Win=187904 Len=0 TSval=2039951191 TSecr=1376209717"
"161","1.455940","192.168.2.2","192.168.1.2","TCP","66","187904","5001  >  44768 [ACK] Seq=1 Ack=176657 Win=187904 Len=0 TSval=2039951215 TSecr=1376209717"
"163","1.480896","192.168.2.2","192.168.1.2","TCP","66","187904","5001  >  44768 [ACK] Seq=1 Ack=179553 Win=187904 Len=0 TSval=2039951240 TSecr=1376209741"
"165","1.517255","192.168.2.2","192.168.1.2","TCP","66","187904","5001  >  44768 [ACK] Seq=1 Ack=183897 Win=187904 Len=0 TSval=2039951276 TSecr=1376209741"
"167","1.541485","192.168.2.2","192.168.1.2","TCP","66","187904","5001  >  44768 [ACK] Seq=1 Ack=186793 Win=187904 Len=0 TSval=2039951300 TSecr=1376209790"
"170","1.577804","192.168.2.2","192.168.1.2","TCP","66","187904","5001  >  44768 [ACK] Seq=1 Ack=191137 Win=187904 Len=0 TSval=2039951337 TSecr=1376209806"
"172","1.602052","192.168.2.2","192.168.1.2","TCP","66","187904","5001  >  44768 [ACK] Seq=1 Ack=194033 Win=187904 Len=0 TSval=2039951361 TSecr=1376209843"
"174","1.626568","192.168.2.2","192.168.1.2","TCP","66","187904","5001  >  44768 [ACK] Seq=1 Ack=196929 Win=187904 Len=0 TSval=2039951385 TSecr=1376209867"
"176","1.662577","192.168.2.2","192.168.1.2","TCP","66","194560","5001  >  44768 [ACK] Seq=1 Ack=201273 Win=194560 Len=0 TSval=2039951421 TSecr=1376209891"
"179","1.687295","192.168.2.2","192.168.1.2","TCP","66","197632","5001  >  44768 [ACK] Seq=1 Ack=202721 Win=197632 Len=0 TSval=2039951446 TSecr=1376209924"
"182","1.699670","192.168.2.2","192.168.1.2","TCP","66","203264","5001  >  44768 [ACK] Seq=1 Ack=205617 Win=203264 Len=0 TSval=2039951458 TSecr=1376209948"
"184","1.723920","192.168.2.2","192.168.1.2","TCP","66","208896","5001  >  44768 [ACK] Seq=1 Ack=208513 Win=208896 Len=0 TSval=2039951483 TSecr=1376209973"
"186","1.749007","192.168.2.2","192.168.1.2","TCP","66","215040","5001  >  44768 [ACK] Seq=1 Ack=211409 Win=215040 Len=0 TSval=2039951508 TSecr=1376209973"
"188","1.772506","192.168.2.2","192.168.1.2","TCP","66","220672","5001  >  44768 [ACK] Seq=1 Ack=214305 Win=220672 Len=0 TSval=2039951531 TSecr=1376209996"
"190","1.796615","192.168.2.2","192.168.1.2","TCP","66","226304","5001  >  44768 [ACK] Seq=1 Ack=217201 Win=226304 Len=0 TSval=2039951555 TSecr=1376210021"
"192","1.822085","192.168.2.2","192.168.1.2","TCP","66","232448","5001  >  44768 [ACK] Seq=1 Ack=220097 Win=232448 Len=0 TSval=2039951581 TSecr=1376210045"
"194","1.846354","192.168.2.2","192.168.1.2","TCP","66","235008","5001  >  44768 [ACK] Seq=1 Ack=221545 Win=235008 Len=0 TSval=2039951605 TSecr=1376210070"
"196","1.858702","192.168.2.2","192.168.1.2","TCP","66","241152","5001  >  44768 [ACK] Seq=1 Ack=224441 Win=241152 Len=0 TSval=2039951618 TSecr=1376210081"
"198","1.882681","192.168.2.2","192.168.1.2","TCP","66","246784","5001  >  44768 [ACK] Seq=1 Ack=227337 Win=246784 Len=0 TSval=2039951641 TSecr=1376210106"
"200","1.906939","192.168.2.2","192.168.1.2","TCP","66","252416","5001  >  44768 [ACK] Seq=1 Ack=230233 Win=252416 Len=0 TSval=2039951666 TSecr=1376210129"
"202","1.931271","192.168.2.2","192.168.1.2","TCP","66","258560","5001  >  44768 [ACK] Seq=1 Ack=233129 Win=258560 Len=0 TSval=2039951690 TSecr=1376210154"
"204","1.955707","192.168.2.2","192.168.1.2","TCP","66","264192","5001  >  44768 [ACK] Seq=1 Ack=236025 Win=264192 Len=0 TSval=2039951715 TSecr=1376210179"
"207","1.979594","192.168.2.2","192.168.1.2","TCP","66","269824","5001  >  44768 [ACK] Seq=1 Ack=238921 Win=269824 Len=0 TSval=2039951738 TSecr=1376210203"
"209","2.003787","192.168.2.2","192.168.1.2","TCP","66","275968","5001  >  44768 [ACK] Seq=1 Ack=241817 Win=275968 Len=0 TSval=2039951763 TSecr=1376210226"
"212","2.028192","192.168.2.2","192.168.1.2","TCP","66","281600","5001  >  44768 [ACK] Seq=1 Ack=244713 Win=281600 Len=0 TSval=2039951787 TSecr=1376210251"
"214","2.052703","192.168.2.2","192.168.1.2","TCP","66","284160","5001  >  44768 [ACK] Seq=1 Ack=246161 Win=284160 Len=0 TSval=2039951812 TSecr=1376210263"
"216","2.064389","192.168.2.2","192.168.1.2","TCP","66","290304","5001  >  44768 [ACK] Seq=1 Ack=249057 Win=290304 Len=0 TSval=2039951823 TSecr=1376210287"
"218","2.088905","192.168.2.2","192.168.1.2","TCP","66","295936","5001  >  44768 [ACK] Seq=1 Ack=251953 Win=295936 Len=0 TSval=2039951848 TSecr=1376210312"
"220","2.112791","192.168.2.2","192.168.1.2","TCP","66","301568","5001  >  44768 [ACK] Seq=1 Ack=254849 Win=301568 Len=0 TSval=2039951872 TSecr=1376210335"
"222","2.137047","192.168.2.2","192.168.1.2","TCP","66","307712","5001  >  44768 [ACK] Seq=1 Ack=257745 Win=307712 Len=0 TSval=2039951896 TSecr=1376210360"
"224","2.161383","192.168.2.2","192.168.1.2","TCP","66","310272","5001  >  44768 [ACK] Seq=1 Ack=259193 Win=310272 Len=0 TSval=2039951920 TSecr=1376210381"
"226","2.173329","192.168.2.2","192.168.1.2","TCP","66","316416","5001  >  44768 [ACK] Seq=1 Ack=262089 Win=316416 Len=0 TSval=2039951932 TSecr=1376210384"
"228","2.197626","192.168.2.2","192.168.1.2","TCP","66","322048","5001  >  44768 [ACK] Seq=1 Ack=264985 Win=322048 Len=0 TSval=2039951956 TSecr=1376210409"
"230","2.222142","192.168.2.2","192.168.1.2","TCP","66","327680","5001  >  44768 [ACK] Seq=1 Ack=267881 Win=327680 Len=0 TSval=2039951981 TSecr=1376210445"
"232","2.246029","192.168.2.2","192.168.1.2","TCP","66","333824","5001  >  44768 [ACK] Seq=1 Ack=270777 Win=333824 Len=0 TSval=2039952005 TSecr=1376210469"
"234","2.271124","192.168.2.2","192.168.1.2","TCP","66","339456","5001  >  44768 [ACK] Seq=1 Ack=273673 Win=339456 Len=0 TSval=2039952030 TSecr=1376210469"
"236","2.294581","192.168.2.2","192.168.1.2","TCP","66","345088","5001  >  44768 [ACK] Seq=1 Ack=276569 Win=345088 Len=0 TSval=2039952053 TSecr=1376210506"
"240","2.318682","192.168.2.2","192.168.1.2","TCP","66","351232","5001  >  44768 [ACK] Seq=1 Ack=279465 Win=351232 Len=0 TSval=2039952077 TSecr=1376210530"
"242","2.343621","192.168.2.2","192.168.1.2","TCP","66","356864","5001  >  44768 [ACK] Seq=1 Ack=282361 Win=356864 Len=0 TSval=2039952102 TSecr=1376210554"
"244","2.367139","192.168.2.2","192.168.1.2","TCP","66","360448","5001  >  44768 [ACK] Seq=1 Ack=285257 Win=360448 Len=0 TSval=2039952126 TSecr=1376210590"
"248","2.391549","192.168.2.2","192.168.1.2","TCP","66","360448","5001  >  44768 [ACK] Seq=1 Ack=288153 Win=360448 Len=0 TSval=2039952150 TSecr=1376210590"
"250","2.415587","192.168.2.2","192.168.1.2","TCP","66","360960","5001  >  44768 [ACK] Seq=1 Ack=289601 Win=360960 Len=0 TSval=2039952174 TSecr=1376210615"
"252","2.427888","192.168.2.2","192.168.1.2","TCP","66","360960","5001  >  44768 [ACK] Seq=1 Ack=292497 Win=360960 Len=0 TSval=2039952187 TSecr=1376210628"
"254","2.452361","192.168.2.2","192.168.1.2","TCP","66","360960","5001  >  44768 [ACK] Seq=1 Ack=295393 Win=360960 Len=0 TSval=2039952211 TSecr=1376210652"
"256","2.476900","192.168.2.2","192.168.1.2","TCP","66","360960","5001  >  44768 [ACK] Seq=1 Ack=298289 Win=360960 Len=0 TSval=2039952236 TSecr=1376210677"
"258","2.501350","192.168.2.2","192.168.1.2","TCP","66","360960","5001  >  44768 [ACK] Seq=1 Ack=301185 Win=360960 Len=0 TSval=2039952260 TSecr=1376210700"
"260","2.525321","192.168.2.2","192.168.1.2","TCP","66","360960","5001  >  44768 [ACK] Seq=1 Ack=304081 Win=360960 Len=0 TSval=2039952284 TSecr=1376210724"
"262","2.550350","192.168.2.2","192.168.1.2","TCP","66","360960","5001  >  44768 [ACK] Seq=1 Ack=306977 Win=360960 Len=0 TSval=2039952309 TSecr=1376210750"
"264","2.573909","192.168.2.2","192.168.1.2","TCP","66","360960","5001  >  44768 [ACK] Seq=1 Ack=309873 Win=360960 Len=0 TSval=2039952333 TSecr=1376210774"
"266","2.610132","192.168.2.2","192.168.1.2","TCP","66","360960","5001  >  44768 [ACK] Seq=1 Ack=314217 Win=360960 Len=0 TSval=2039952369 TSecr=1376210787"
"269","2.634559","192.168.2.2","192.168.1.2","TCP","66","360960","5001  >  44768 [ACK] Seq=1 Ack=317113 Win=360960 Len=0 TSval=2039952393 TSecr=1376210835"
"271","2.659014","192.168.2.2","192.168.1.2","TCP","66","360960","5001  >  44768 [ACK] Seq=1 Ack=320009 Win=360960 Len=0 TSval=2039952418 TSecr=1376210859"
"273","2.683490","192.168.2.2","192.168.1.2","TCP","66","360960","5001  >  44768 [ACK] Seq=1 Ack=322905 Win=360960 Len=0 TSval=2039952442 TSecr=1376210884"
"275","2.719224","192.168.2.2","192.168.1.2","TCP","66","360960","5001  >  44768 [ACK] Seq=1 Ack=327249 Win=360960 Len=0 TSval=2039952478 TSecr=1376210893"
"278","2.743367","192.168.2.2","192.168.1.2","TCP","66","360960","5001  >  44768 [ACK] Seq=1 Ack=330145 Win=360960 Len=0 TSval=2039952502 TSecr=1376210932"
"281","2.768336","192.168.2.2","192.168.1.2","TCP","66","360960","5001  >  44768 [ACK] Seq=1 Ack=333041 Win=360960 Len=0 TSval=2039952527 TSecr=1376210956"
"283","2.792586","192.168.2.2","192.168.1.2","TCP","66","360960","5001  >  44768 [ACK] Seq=1 Ack=335937 Win=360960 Len=0 TSval=2039952551 TSecr=1376210981"
"285","2.816819","192.168.2.2","192.168.1.2","TCP","66","360960","5001  >  44768 [ACK] Seq=1 Ack=338833 Win=360960 Len=0 TSval=2039952576 TSecr=1376210992"
"287","2.841274","192.168.2.2","192.168.1.2","TCP","66","360960","5001  >  44768 [ACK] Seq=1 Ack=341729 Win=360960 Len=0 TSval=2039952600 TSecr=1376211017"
"289","2.865257","192.168.2.2","192.168.1.2","TCP","66","360960","5001  >  44768 [ACK] Seq=1 Ack=344625 Win=360960 Len=0 TSval=2039952624 TSecr=1376211041"
"291","2.890210","192.168.2.2","192.168.1.2","TCP","66","360960","5001  >  44768 [ACK] Seq=1 Ack=347521 Win=360960 Len=0 TSval=2039952649 TSecr=1376211065"
"293","2.926451","192.168.2.2","192.168.1.2","TCP","66","360960","5001  >  44768 [ACK] Seq=1 Ack=351865 Win=360960 Len=0 TSval=2039952685 TSecr=1376211089"
"296","2.950038","192.168.2.2","192.168.1.2","TCP","66","360960","5001  >  44768 [ACK] Seq=1 Ack=354761 Win=360960 Len=0 TSval=2039952709 TSecr=1376211125"
"298","2.974480","192.168.2.2","192.168.1.2","TCP","66","360960","5001  >  44768 [ACK] Seq=1 Ack=357657 Win=360960 Len=0 TSval=2039952733 TSecr=1376211150"
"300","2.998947","192.168.2.2","192.168.1.2","TCP","66","360960","5001  >  44768 [ACK] Seq=1 Ack=360553 Win=360960 Len=0 TSval=2039952758 TSecr=1376211174"
"303","3.023404","192.168.2.2","192.168.1.2","TCP","66","360960","5001  >  44768 [ACK] Seq=1 Ack=363449 Win=360960 Len=0 TSval=2039952782 TSecr=1376211199"
"305","3.046937","192.168.2.2","192.168.1.2","TCP","66","360960","5001  >  44768 [ACK] Seq=1 Ack=366345 Win=360960 Len=0 TSval=2039952806 TSecr=1376211222"
"307","3.071417","192.168.2.2","192.168.1.2","TCP","66","360960","5001  >  44768 [ACK] Seq=1 Ack=369241 Win=360960 Len=0 TSval=2039952830 TSecr=1376211247"
"309","3.095870","192.168.2.2","192.168.1.2","TCP","66","360960","5001  >  44768 [ACK] Seq=1 Ack=372137 Win=360960 Len=0 TSval=2039952855 TSecr=1376211271"
"311","3.119590","192.168.2.2","192.168.1.2","TCP","66","360960","5001  >  44768 [ACK] Seq=1 Ack=375033 Win=360960 Len=0 TSval=2039952878 TSecr=1376211295"
"313","3.156716","192.168.2.2","192.168.1.2","TCP","66","360960","5001  >  44768 [ACK] Seq=1 Ack=379377 Win=360960 Len=0 TSval=2039952916 TSecr=1376211295"
"316","3.192866","192.168.2.2","192.168.1.2","TCP","66","360960","5001  >  44768 [ACK] Seq=1 Ack=383721 Win=360960 Len=0 TSval=2039952952 TSecr=1376211343"
"319","3.216500","192.168.2.2","192.168.1.2","TCP","66","360960","5001  >  44768 [ACK] Seq=1 Ack=386617 Win=360960 Len=0 TSval=2039952975 TSecr=1376211380"
"321","3.240737","192.168.2.2","192.168.1.2","TCP","66","360960","5001  >  44768 [ACK] Seq=1 Ack=389513 Win=360960 Len=0 TSval=2039953000 TSecr=1376211405"
"323","3.265363","192.168.2.2","192.168.1.2","TCP","66","360960","5001  >  44768 [ACK] Seq=1 Ack=392409 Win=360960 Len=0 TSval=2039953024 TSecr=1376211429"
"325","3.289849","192.168.2.2","192.168.1.2","TCP","66","360960","5001  >  44768 [ACK] Seq=1 Ack=395305 Win=360960 Len=0 TSval=2039953049 TSecr=1376211453"
"327","3.313395","192.168.2.2","192.168.1.2","TCP","66","360960","5001  >  44768 [ACK] Seq=1 Ack=398201 Win=360960 Len=0 TSval=2039953072 TSecr=1376211478"
"329","3.337852","192.168.2.2","192.168.1.2","TCP","66","360960","5001  >  44768 [ACK] Seq=1 Ack=401097 Win=360960 Len=0 TSval=2039953097 TSecr=1376211502"
"331","3.361851","192.168.2.2","192.168.1.2","TCP","66","360960","5001  >  44768 [ACK] Seq=1 Ack=403993 Win=360960 Len=0 TSval=2039953121 TSecr=1376211538"
"333","3.386076","192.168.2.2","192.168.1.2","TCP","66","360960","5001  >  44768 [ACK] Seq=1 Ack=406889 Win=360960 Len=0 TSval=2039953145 TSecr=1376211538"
"335","3.410338","192.168.2.2","192.168.1.2","TCP","66","360960","5001  >  44768 [ACK] Seq=1 Ack=409785 Win=360960 Len=0 TSval=2039953169 TSecr=1376211562"
"337","3.434834","192.168.2.2","192.168.1.2","TCP","66","360960","5001  >  44768 [ACK] Seq=1 Ack=412681 Win=360960 Len=0 TSval=2039953194 TSecr=1376211587"
"339","3.458742","192.168.2.2","192.168.1.2","TCP","66","360960","5001  >  44768 [ACK] Seq=1 Ack=415577 Win=360960 Len=0 TSval=2039953218 TSecr=1376211611"
"341","3.486734","192.168.2.2","192.168.1.2","TCP","66","360960","5001  >  44768 [ACK] Seq=1 Ack=418473 Win=360960 Len=0 TSval=2039953246 TSecr=1376211647"
"344","3.519347","192.168.2.2","192.168.1.2","TCP","66","360960","5001  >  44768 [ACK] Seq=1 Ack=422817 Win=360960 Len=0 TSval=2039953278 TSecr=1376211647"
"346","3.543568","192.168.2.2","192.168.1.2","TCP","66","360960","5001  >  44768 [ACK] Seq=1 Ack=425713 Win=360960 Len=0 TSval=2039953302 TSecr=1376211696"
"348","3.568075","192.168.2.2","192.168.1.2","TCP","66","360960","5001  >  44768 [ACK] Seq=1 Ack=428609 Win=360960 Len=0 TSval=2039953327 TSecr=1376211720"
"350","3.592531","192.168.2.2","192.168.1.2","TCP","66","360960","5001  >  44768 [ACK] Seq=1 Ack=431505 Win=360960 Len=0 TSval=2039953351 TSecr=1376211745"
"352","3.616185","192.168.2.2","192.168.1.2","TCP","66","360960","5001  >  44768 [ACK] Seq=1 Ack=434401 Win=360960 Len=0 TSval=2039953375 TSecr=1376211769"
"355","3.640585","192.168.2.2","192.168.1.2","TCP","66","360960","5001  >  44768 [ACK] Seq=1 Ack=437297 Win=360960 Len=0 TSval=2039953399 TSecr=1376211793"
"357","3.665005","192.168.2.2","192.168.1.2","TCP","66","360960","5001  >  44768 [ACK] Seq=1 Ack=440193 Win=360960 Len=0 TSval=2039953424 TSecr=1376211818"
"359","3.688902","192.168.2.2","192.168.1.2","TCP","66","360960","5001  >  44768 [ACK] Seq=1 Ack=443089 Win=360960 Len=0 TSval=2039953448 TSecr=1376211854"
"361","3.713148","192.168.2.2","192.168.1.2","TCP","66","360960","5001  >  44768 [ACK] Seq=1 Ack=445985 Win=360960 Len=0 TSval=2039953472 TSecr=1376211854"
"363","3.737560","192.168.2.2","192.168.1.2","TCP","66","360960","5001  >  44768 [ACK] Seq=1 Ack=448881 Win=360960 Len=0 TSval=2039953496 TSecr=1376211878"
"365","3.761991","192.168.2.2","192.168.1.2","TCP","66","360960","5001  >  44768 [ACK] Seq=1 Ack=451777 Win=360960 Len=0 TSval=2039953521 TSecr=1376211902"
"367","3.786481","192.168.2.2","192.168.1.2","TCP","66","360960","5001  >  44768 [ACK] Seq=1 Ack=454673 Win=360960 Len=0 TSval=2039953545 TSecr=1376211927"
"370","3.810747","192.168.2.2","192.168.1.2","TCP","66","360960","5001  >  44768 [ACK] Seq=1 Ack=457569 Win=360960 Len=0 TSval=2039953570 TSecr=1376211951"
"372","3.835465","192.168.2.2","192.168.1.2","TCP","66","360960","5001  >  44768 [ACK] Seq=1 Ack=460465 Win=360960 Len=0 TSval=2039953594 TSecr=1376211975"
"374","3.859987","192.168.2.2","192.168.1.2","TCP","66","360960","5001  >  44768 [ACK] Seq=1 Ack=463361 Win=360960 Len=0 TSval=2039953619 TSecr=1376211999"
"376","3.883458","192.168.2.2","192.168.1.2","TCP","66","360960","5001  >  44768 [ACK] Seq=1 Ack=466257 Win=360960 Len=0 TSval=2039953642 TSecr=1376212024"
"378","3.907944","192.168.2.2","192.168.1.2","TCP","66","360960","5001  >  44768 [ACK] Seq=1 Ack=469153 Win=360960 Len=0 TSval=2039953667 TSecr=1376212047"
"380","3.932521","192.168.2.2","192.168.1.2","TCP","66","360960","5001  >  44768 [ACK] Seq=1 Ack=472049 Win=360960 Len=0 TSval=2039953691 TSecr=1376212085"
"382","3.956118","192.168.2.2","192.168.1.2","TCP","66","360960","5001  >  44768 [ACK] Seq=1 Ack=474945 Win=360960 Len=0 TSval=2039953715 TSecr=1376212085"
"385","3.992498","192.168.2.2","192.168.1.2","TCP","66","360960","5001  >  44768 [ACK] Seq=1 Ack=479289 Win=360960 Len=0 TSval=2039953751 TSecr=1376212121"
"389","4.016666","192.168.2.2","192.168.1.2","TCP","66","360960","5001  >  44768 [ACK] Seq=1 Ack=482185 Win=360960 Len=0 TSval=2039953775 TSecr=1376212144"
"391","4.040904","192.168.2.2","192.168.1.2","TCP","66","360960","5001  >  44768 [ACK] Seq=1 Ack=485081 Win=360960 Len=0 TSval=2039953800 TSecr=1376212169"
"393","4.065698","192.168.2.2","192.168.1.2","TCP","66","360960","5001  >  44768 [ACK] Seq=1 Ack=487977 Win=360960 Len=0 TSval=2039953825 TSecr=1376212193"
"395","4.089344","192.168.2.2","192.168.1.2","TCP","66","360960","5001  >  44768 [ACK] Seq=1 Ack=490873 Win=360960 Len=0 TSval=2039953848 TSecr=1376212218"
"397","4.113671","192.168.2.2","192.168.1.2","TCP","66","360960","5001  >  44768 [ACK] Seq=1 Ack=493769 Win=360960 Len=0 TSval=2039953872 TSecr=1376212241"
"399","4.138147","192.168.2.2","192.168.1.2","TCP","66","360960","5001  >  44768 [ACK] Seq=1 Ack=496665 Win=360960 Len=0 TSval=2039953897 TSecr=1376212266"
"401","4.162015","192.168.2.2","192.168.1.2","TCP","66","360960","5001  >  44768 [ACK] Seq=1 Ack=499561 Win=360960 Len=0 TSval=2039953921 TSecr=1376212290"
"403","4.187174","192.168.2.2","192.168.1.2","TCP","66","360960","5001  >  44768 [ACK] Seq=1 Ack=502457 Win=360960 Len=0 TSval=2039953946 TSecr=1376212314"
"405","4.210633","192.168.2.2","192.168.1.2","TCP","66","360960","5001  >  44768 [ACK] Seq=1 Ack=505353 Win=360960 Len=0 TSval=2039953969 TSecr=1376212338"
"407","4.235160","192.168.2.2","192.168.1.2","TCP","66","360960","5001  >  44768 [ACK] Seq=1 Ack=508249 Win=360960 Len=0 TSval=2039953994 TSecr=1376212363"
"409","4.258928","192.168.2.2","192.168.1.2","TCP","66","360960","5001  >  44768 [ACK] Seq=1 Ack=511145 Win=360960 Len=0 TSval=2039954018 TSecr=1376212387"
"411","4.283132","192.168.2.2","192.168.1.2","TCP","66","360960","5001  >  44768 [ACK] Seq=1 Ack=514041 Win=360960 Len=0 TSval=2039954042 TSecr=1376212415"
"413","4.307605","192.168.2.2","192.168.1.2","TCP","66","360960","5001  >  44768 [ACK] Seq=1 Ack=516937 Win=360960 Len=0 TSval=2039954066 TSecr=1376212415"
"415","4.332204","192.168.2.2","192.168.1.2","TCP","66","360960","5001  >  44768 [ACK] Seq=1 Ack=519833 Win=360960 Len=0 TSval=2039954091 TSecr=1376212447"
"417","4.355829","192.168.2.2","192.168.1.2","TCP","66","360960","5001  >  44768 [ACK] Seq=1 Ack=522729 Win=360960 Len=0 TSval=2039954115 TSecr=1376212471"
"419","4.380102","192.168.2.2","192.168.1.2","TCP","66","360960","5001  >  44768 [ACK] Seq=1 Ack=525625 Win=360960 Len=0 TSval=2039954139 TSecr=1376212496"
"421","4.404582","192.168.2.2","192.168.1.2","TCP","66","360960","5001  >  44768 [ACK] Seq=1 Ack=528521 Win=360960 Len=0 TSval=2039954163 TSecr=1376212520"
"423","4.428520","192.168.2.2","192.168.1.2","TCP","66","360960","5001  >  44768 [ACK] Seq=1 Ack=531417 Win=360960 Len=0 TSval=2039954187 TSecr=1376212544"
"426","4.465318","192.168.2.2","192.168.1.2","TCP","66","360960","5001  >  44768 [ACK] Seq=1 Ack=535761 Win=360960 Len=0 TSval=2039954224 TSecr=1376212544"
"428","4.491793","192.168.2.2","192.168.1.2","TCP","66","360960","5001  >  44768 [ACK] Seq=1 Ack=538657 Win=360960 Len=0 TSval=2039954251 TSecr=1376212593"
"430","4.513283","192.168.2.2","192.168.1.2","TCP","66","360960","5001  >  44768 [ACK] Seq=1 Ack=541553 Win=360960 Len=0 TSval=2039954272 TSecr=1376212617"
"433","4.537810","192.168.2.2","192.168.1.2","TCP","66","360960","5001  >  44768 [ACK] Seq=1 Ack=544449 Win=360960 Len=0 TSval=2039954297 TSecr=1376212641"
"435","4.561783","192.168.2.2","192.168.1.2","TCP","66","360960","5001  >  44768 [ACK] Seq=1 Ack=547345 Win=360960 Len=0 TSval=2039954321 TSecr=1376212665"
"437","4.585936","192.168.2.2","192.168.1.2","TCP","66","360960","5001  >  44768 [ACK] Seq=1 Ack=550241 Win=360960 Len=0 TSval=2039954345 TSecr=1376212690"
"439","4.610311","192.168.2.2","192.168.1.2","TCP","66","360960","5001  >  44768 [ACK] Seq=1 Ack=553137 Win=360960 Len=0 TSval=2039954369 TSecr=1376212714"
"441","4.634388","192.168.2.2","192.168.1.2","TCP","66","360960","5001  >  44768 [ACK] Seq=1 Ack=556033 Win=360960 Len=0 TSval=2039954393 TSecr=1376212739"
"443","4.658611","192.168.2.2","192.168.1.2","TCP","66","360960","5001  >  44768 [ACK] Seq=1 Ack=558929 Win=360960 Len=0 TSval=2039954417 TSecr=1376212763"
"445","4.682842","192.168.2.2","192.168.1.2","TCP","66","360960","5001  >  44768 [ACK] Seq=1 Ack=561825 Win=360960 Len=0 TSval=2039954442 TSecr=1376212788"
"447","4.707306","192.168.2.2","192.168.1.2","TCP","66","360960","5001  >  44768 [ACK] Seq=1 Ack=564721 Win=360960 Len=0 TSval=2039954466 TSecr=1376212811"
"450","4.731768","192.168.2.2","192.168.1.2","TCP","66","360960","5001  >  44768 [ACK] Seq=1 Ack=567617 Win=360960 Len=0 TSval=2039954491 TSecr=1376212836"
"452","4.755502","192.168.2.2","192.168.1.2","TCP","66","360960","5001  >  44768 [ACK] Seq=1 Ack=570513 Win=360960 Len=0 TSval=2039954514 TSecr=1376212860"
"454","4.779775","192.168.2.2","192.168.1.2","TCP","66","360960","5001  >  44768 [ACK] Seq=1 Ack=573409 Win=360960 Len=0 TSval=2039954539 TSecr=1376212884"
"456","4.803954","192.168.2.2","192.168.1.2","TCP","66","360960","5001  >  44768 [ACK] Seq=1 Ack=576305 Win=360960 Len=0 TSval=2039954563 TSecr=1376212884"
"458","4.828730","192.168.2.2","192.168.1.2","TCP","66","360960","5001  >  44768 [ACK] Seq=1 Ack=579201 Win=360960 Len=0 TSval=2039954588 TSecr=1376212920"
"461","4.866042","192.168.2.2","192.168.1.2","TCP","66","360960","5001  >  44768 [ACK] Seq=1 Ack=583545 Win=360960 Len=0 TSval=2039954625 TSecr=1376212942"
"464","4.889524","192.168.2.2","192.168.1.2","TCP","66","360960","5001  >  44768 [ACK] Seq=1 Ack=586441 Win=360960 Len=0 TSval=2039954648 TSecr=1376212969"
"466","4.913987","192.168.2.2","192.168.1.2","TCP","66","360960","5001  >  44768 [ACK] Seq=1 Ack=589337 Win=360960 Len=0 TSval=2039954673 TSecr=1376212994"
"468","4.938471","192.168.2.2","192.168.1.2","TCP","66","360960","5001  >  44768 [ACK] Seq=1 Ack=592233 Win=360960 Len=0 TSval=2039954697 TSecr=1376213017"
"470","4.962914","192.168.2.2","192.168.1.2","TCP","66","360960","5001  >  44768 [ACK] Seq=1 Ack=595129 Win=360960 Len=0 TSval=2039954722 TSecr=1376213042"
"473","4.986419","192.168.2.2","192.168.1.2","TCP","66","360960","5001  >  44768 [ACK] Seq=1 Ack=598025 Win=360960 Len=0 TSval=2039954745 TSecr=1376213066"
"476","5.010626","192.168.2.2","192.168.1.2","TCP","66","360960","5001  >  44768 [ACK] Seq=1 Ack=600921 Win=360960 Len=0 TSval=2039954769 TSecr=1376213090"
"479","5.035456","192.168.2.2","192.168.1.2","TCP","66","360960","5001  >  44768 [ACK] Seq=1 Ack=603817 Win=360960 Len=0 TSval=2039954794 TSecr=1376213115"
"481","5.059080","192.168.2.2","192.168.1.2","TCP","66","360960","5001  >  44768 [ACK] Seq=1 Ack=606713 Win=360960 Len=0 TSval=2039954818 TSecr=1376213138"
"483","5.083428","192.168.2.2","192.168.1.2","TCP","66","360960","5001  >  44768 [ACK] Seq=1 Ack=609609 Win=360960 Len=0 TSval=2039954842 TSecr=1376213163"
"485","5.107942","192.168.2.2","192.168.1.2","TCP","66","360960","5001  >  44768 [ACK] Seq=1 Ack=612505 Win=360960 Len=0 TSval=2039954867 TSecr=1376213187"
"487","5.132519","192.168.2.2","192.168.1.2","TCP","66","360960","5001  >  44768 [ACK] Seq=1 Ack=615401 Win=360960 Len=0 TSval=2039954891 TSecr=1376213211"
"490","5.155989","192.168.2.2","192.168.1.2","TCP","66","360960","5001  >  44768 [ACK] Seq=1 Ack=618297 Win=360960 Len=0 TSval=2039954915 TSecr=1376213235"
"492","5.180212","192.168.2.2","192.168.1.2","TCP","66","360960","5001  >  44768 [ACK] Seq=1 Ack=621193 Win=360960 Len=0 TSval=2039954939 TSecr=1376213260"
"494","5.204862","192.168.2.2","192.168.1.2","TCP","66","360960","5001  >  44768 [ACK] Seq=1 Ack=624089 Win=360960 Len=0 TSval=2039954964 TSecr=1376213284"
"496","5.228651","192.168.2.2","192.168.1.2","TCP","66","360960","5001  >  44768 [ACK] Seq=1 Ack=626985 Win=360960 Len=0 TSval=2039954987 TSecr=1376213308"
"498","5.252983","192.168.2.2","192.168.1.2","TCP","66","360960","5001  >  44768 [ACK] Seq=1 Ack=629881 Win=360960 Len=0 TSval=2039955012 TSecr=1376213332"
"501","5.277381","192.168.2.2","192.168.1.2","TCP","66","360960","5001  >  44768 [ACK] Seq=1 Ack=632777 Win=360960 Len=0 TSval=2039955036 TSecr=1376213356"
"503","5.301894","192.168.2.2","192.168.1.2","TCP","66","360960","5001  >  44768 [ACK] Seq=1 Ack=635673 Win=360960 Len=0 TSval=2039955061 TSecr=1376213356"
"505","5.325544","192.168.2.2","192.168.1.2","TCP","66","360960","5001  >  44768 [ACK] Seq=1 Ack=638569 Win=360960 Len=0 TSval=2039955084 TSecr=1376213393"
"507","5.349861","192.168.2.2","192.168.1.2","TCP","66","360960","5001  >  44768 [ACK] Seq=1 Ack=641465 Win=360960 Len=0 TSval=2039955109 TSecr=1376213420"
"509","5.374380","192.168.2.2","192.168.1.2","TCP","66","360960","5001  >  44768 [ACK] Seq=1 Ack=644361 Win=360960 Len=0 TSval=2039955133 TSecr=1376213441"
"511","5.410339","192.168.2.2","192.168.1.2","TCP","66","360960","5001  >  44768 [ACK] Seq=1 Ack=648705 Win=360960 Len=0 TSval=2039955169 TSecr=1376213454"
"514","5.435097","192.168.2.2","192.168.1.2","TCP","66","360960","5001  >  44768 [ACK] Seq=1 Ack=651601 Win=360960 Len=0 TSval=2039955194 TSecr=1376213490"
"516","5.459559","192.168.2.2","192.168.1.2","TCP","66","360960","5001  >  44768 [ACK] Seq=1 Ack=654497 Win=360960 Len=0 TSval=2039955218 TSecr=1376213514"
"519","5.483041","192.168.2.2","192.168.1.2","TCP","66","360960","5001  >  44768 [ACK] Seq=1 Ack=657393 Win=360960 Len=0 TSval=2039955242 TSecr=1376213538"
"521","5.507645","192.168.2.2","192.168.1.2","TCP","66","360960","5001  >  44768 [ACK] Seq=1 Ack=660289 Win=360960 Len=0 TSval=2039955266 TSecr=1376213562"
"523","5.531469","192.168.2.2","192.168.1.2","TCP","66","360960","5001  >  44768 [ACK] Seq=1 Ack=663185 Win=360960 Len=0 TSval=2039955290 TSecr=1376213586"
"526","5.555736","192.168.2.2","192.168.1.2","TCP","66","360960","5001  >  44768 [ACK] Seq=1 Ack=666081 Win=360960 Len=0 TSval=2039955315 TSecr=1376213611"
"528","5.580057","192.168.2.2","192.168.1.2","TCP","66","360960","5001  >  44768 [ACK] Seq=1 Ack=668977 Win=360960 Len=0 TSval=2039955339 TSecr=1376213635"
"530","5.604551","192.168.2.2","192.168.1.2","TCP","66","360960","5001  >  44768 [ACK] Seq=1 Ack=671873 Win=360960 Len=0 TSval=2039955363 TSecr=1376213635"
"532","5.628399","192.168.2.2","192.168.1.2","TCP","66","360960","5001  >  44768 [ACK] Seq=1 Ack=674769 Win=360960 Len=0 TSval=2039955387 TSecr=1376213660"
"535","5.653620","192.168.2.2","192.168.1.2","TCP","66","360960","5001  >  44768 [ACK] Seq=1 Ack=677665 Win=360960 Len=0 TSval=2039955412 TSecr=1376213683"
"537","5.677064","192.168.2.2","192.168.1.2","TCP","66","360960","5001  >  44768 [ACK] Seq=1 Ack=680561 Win=360960 Len=0 TSval=2039955436 TSecr=1376213708"
"539","5.701586","192.168.2.2","192.168.1.2","TCP","66","360960","5001  >  44768 [ACK] Seq=1 Ack=683457 Win=360960 Len=0 TSval=2039955460 TSecr=1376213732"
"541","5.725242","192.168.2.2","192.168.1.2","TCP","66","360960","5001  >  44768 [ACK] Seq=1 Ack=686353 Win=360960 Len=0 TSval=2039955484 TSecr=1376213757"
"543","5.749521","192.168.2.2","192.168.1.2","TCP","66","360960","5001  >  44768 [ACK] Seq=1 Ack=689249 Win=360960 Len=0 TSval=2039955508 TSecr=1376213794"
"546","5.773740","192.168.2.2","192.168.1.2","TCP","66","360960","5001  >  44768 [ACK] Seq=1 Ack=692145 Win=360960 Len=0 TSval=2039955533 TSecr=1376213794"
"548","5.798486","192.168.2.2","192.168.1.2","TCP","66","360960","5001  >  44768 [ACK] Seq=1 Ack=695041 Win=360960 Len=0 TSval=2039955557 TSecr=1376213817"
"550","5.823053","192.168.2.2","192.168.1.2","TCP","66","360960","5001  >  44768 [ACK] Seq=1 Ack=697937 Win=360960 Len=0 TSval=2039955582 TSecr=1376213842"
"552","5.846574","192.168.2.2","192.168.1.2","TCP","66","360960","5001  >  44768 [ACK] Seq=1 Ack=700833 Win=360960 Len=0 TSval=2039955605 TSecr=1376213866"
"555","5.870967","192.168.2.2","192.168.1.2","TCP","66","360960","5001  >  44768 [ACK] Seq=1 Ack=703729 Win=360960 Len=0 TSval=2039955630 TSecr=1376213891"
"557","5.895496","192.168.2.2","192.168.1.2","TCP","66","360960","5001  >  44768 [ACK] Seq=1 Ack=706625 Win=360960 Len=0 TSval=2039955654 TSecr=1376213914"
"560","5.920375","192.168.2.2","192.168.1.2","TCP","66","360960","5001  >  44768 [ACK] Seq=1 Ack=709521 Win=360960 Len=0 TSval=2039955679 TSecr=1376213938"
"562","5.944639","192.168.2.2","192.168.1.2","TCP","66","360960","5001  >  44768 [ACK] Seq=1 Ack=712417 Win=360960 Len=0 TSval=2039955703 TSecr=1376213938"
"565","5.968962","192.168.2.2","192.168.1.2","TCP","66","360960","5001  >  44768 [ACK] Seq=1 Ack=715313 Win=360960 Len=0 TSval=2039955728 TSecr=1376213963"
"567","5.993404","192.168.2.2","192.168.1.2","TCP","66","360960","5001  >  44768 [ACK] Seq=1 Ack=718209 Win=360960 Len=0 TSval=2039955752 TSecr=1376213987"
"570","6.017270","192.168.2.2","192.168.1.2","TCP","66","360960","5001  >  44768 [ACK] Seq=1 Ack=721105 Win=360960 Len=0 TSval=2039955776 TSecr=1376214011"
"572","6.041529","192.168.2.2","192.168.1.2","TCP","66","360960","5001  >  44768 [ACK] Seq=1 Ack=724001 Win=360960 Len=0 TSval=2039955800 TSecr=1376214036"
"576","6.065907","192.168.2.2","192.168.1.2","TCP","66","360960","5001  >  44768 [ACK] Seq=1 Ack=726897 Win=360960 Len=0 TSval=2039955825 TSecr=1376214060"
"578","6.102140","192.168.2.2","192.168.1.2","TCP","66","360960","5001  >  44768 [ACK] Seq=1 Ack=731241 Win=360960 Len=0 TSval=2039955861 TSecr=1376214060"
"581","6.126292","192.168.2.2","192.168.1.2","TCP","66","360960","5001  >  44768 [ACK] Seq=1 Ack=734137 Win=360960 Len=0 TSval=2039955885 TSecr=1376214108"
"583","6.151144","192.168.2.2","192.168.1.2","TCP","66","360960","5001  >  44768 [ACK] Seq=1 Ack=737033 Win=360960 Len=0 TSval=2039955910 TSecr=1376214133"
"585","6.174740","192.168.2.2","192.168.1.2","TCP","66","360960","5001  >  44768 [ACK] Seq=1 Ack=739929 Win=360960 Len=0 TSval=2039955934 TSecr=1376214156"
"587","6.199140","192.168.2.2","192.168.1.2","TCP","66","360960","5001  >  44768 [ACK] Seq=1 Ack=742825 Win=360960 Len=0 TSval=2039955958 TSecr=1376214181"
"590","6.223605","192.168.2.2","192.168.1.2","TCP","66","360960","5001  >  44768 [ACK] Seq=1 Ack=745721 Win=360960 Len=0 TSval=2039955982 TSecr=1376214181"
"592","6.248154","192.168.2.2","192.168.1.2","TCP","66","360960","5001  >  44768 [ACK] Seq=1 Ack=748617 Win=360960 Len=0 TSval=2039956007 TSecr=1376214205"
"594","6.271642","192.168.2.2","192.168.1.2","TCP","66","360960","5001  >  44768 [ACK] Seq=1 Ack=751513 Win=360960 Len=0 TSval=2039956030 TSecr=1376214230"
"596","6.296104","192.168.2.2","192.168.1.2","TCP","66","360960","5001  >  44768 [ACK] Seq=1 Ack=754409 Win=360960 Len=0 TSval=2039956055 TSecr=1376214253"
"599","6.320602","192.168.2.2","192.168.1.2","TCP","66","360960","5001  >  44768 [ACK] Seq=1 Ack=757305 Win=360960 Len=0 TSval=2039956079 TSecr=1376214278"
"601","6.344322","192.168.2.2","192.168.1.2","TCP","66","360960","5001  >  44768 [ACK] Seq=1 Ack=760201 Win=360960 Len=0 TSval=2039956103 TSecr=1376214302"
