No.,Time,Source,Destination,Protocol,Length,Calculated window size,Info
4,0.000393,192.168.2.2,192.168.1.2,TCP,74,43440,"5001  >  59124 [SYN, ACK] Seq=0 Ack=1 Win=43440 Len=0 MSS=1460 SACK_PERM=1 TSval=3270165604 TSecr=2461295705 WS=512"
7,0.000439,192.168.2.2,192.168.1.2,TCP,66,39936,5001  >  59124 [ACK] Seq=1 Ack=7241 Win=39936 Len=0 TSval=3270165604 TSecr=2461295705
12,0.049721,192.168.2.2,192.168.1.2,TCP,66,39936,5001  >  59124 [ACK] Seq=1 Ack=14481 Win=39936 Len=0 TSval=3270165653 TSecr=2461295705
15,0.110676,192.168.2.2,192.168.1.2,TCP,66,38400,5001  >  59124 [ACK] Seq=1 Ack=24617 Win=38400 Len=0 TSval=3270165714 TSecr=2461295705
25,0.195064,192.168.2.2,192.168.1.2,TCP,66,40960,5001  >  59124 [ACK] Seq=1 Ack=28961 Win=40960 Len=0 TSval=3270165798 TSecr=2461295705
28,0.231441,192.168.2.2,192.168.1.2,TCP,66,42496,5001  >  59124 [ACK] Seq=1 Ack=30409 Win=42496 Len=0 TSval=3270165835 TSecr=2461295720
31,0.243878,192.168.2.2,192.168.1.2,TCP,66,38912,5001  >  59124 [ACK] Seq=1 Ack=39097 Win=38912 Len=0 TSval=3270165847 TSecr=2461295754
33,0.316444,192.168.2.2,192.168.1.2,TCP,66,40960,5001  >  59124 [ACK] Seq=1 Ack=43441 Win=40960 Len=0 TSval=3270165920 TSecr=2461295781
37,0.35263,192.168.2.2,192.168.1.2,TCP,66,41984,5001  >  59124 [ACK] Seq=1 Ack=46337 Win=41984 Len=0 TSval=3270165956 TSecr=2461295815
39,0.376751,192.168.2.2,192.168.1.2,TCP,66,41984,5001  >  59124 [ACK] Seq=1 Ack=49233 Win=41984 Len=0 TSval=3270165980 TSecr=2461295815
41,0.401598,192.168.2.2,192.168.1.2,TCP,66,42496,5001  >  59124 [ACK] Seq=1 Ack=50681 Win=42496 Len=0 TSval=3270166005 TSecr=2461295815
43,0.413372,192.168.2.2,192.168.1.2,TCP,66,41984,5001  >  59124 [ACK] Seq=1 Ack=53577 Win=41984 Len=0 TSval=3270166017 TSecr=2461295815
45,0.437871,192.168.2.2,192.168.1.2,TCP,66,41984,5001  >  59124 [ACK] Seq=1 Ack=56473 Win=41984 Len=0 TSval=3270166041 TSecr=2461295816
47,0.46156,192.168.2.2,192.168.1.2,TCP,66,41984,5001  >  59124 [ACK] Seq=1 Ack=59369 Win=41984 Len=0 TSval=3270166065 TSecr=2461295817
49,0.485867,192.168.2.2,192.168.1.2,TCP,66,41984,5001  >  59124 [ACK] Seq=1 Ack=62265 Win=41984 Len=0 TSval=3270166089 TSecr=2461295818
51,0.510337,192.168.2.2,192.168.1.2,TCP,78,42496,[TCP Window Update] 5001  >  59124 [ACK] Seq=1 Ack=62265 Win=42496 Len=0 TSval=3270166114 TSecr=2461295868 SLE=60817 SRE=62265
53,0.522137,192.168.2.2,192.168.1.2,TCP,66,41984,5001  >  59124 [ACK] Seq=1 Ack=65161 Win=41984 Len=0 TSval=3270166125 TSecr=2461295899
55,0.546586,192.168.2.2,192.168.1.2,TCP,66,41984,5001  >  59124 [ACK] Seq=1 Ack=68057 Win=41984 Len=0 TSval=3270166150 TSecr=2461295899
57,0.570567,192.168.2.2,192.168.1.2,TCP,66,41984,5001  >  59124 [ACK] Seq=1 Ack=70953 Win=41984 Len=0 TSval=3270166174 TSecr=2461295936
59,0.594775,192.168.2.2,192.168.1.2,TCP,66,42496,5001  >  59124 [ACK] Seq=1 Ack=72401 Win=42496 Len=0 TSval=3270166198 TSecr=2461295936
61,0.607288,192.168.2.2,192.168.1.2,TCP,66,41984,5001  >  59124 [ACK] Seq=1 Ack=75297 Win=41984 Len=0 TSval=3270166211 TSecr=2461295948
63,0.631875,192.168.2.2,192.168.1.2,TCP,66,41984,5001  >  59124 [ACK] Seq=1 Ack=78193 Win=41984 Len=0 TSval=3270166235 TSecr=2461296021
65,0.655335,192.168.2.2,192.168.1.2,TCP,66,48128,5001  >  59124 [ACK] Seq=1 Ack=81089 Win=48128 Len=0 TSval=3270166259 TSecr=2461296021
69,0.679787,192.168.2.2,192.168.1.2,TCP,66,54272,5001  >  59124 [ACK] Seq=1 Ack=83985 Win=54272 Len=0 TSval=3270166283 TSecr=2461296021
74,0.704274,192.168.2.2,192.168.1.2,TCP,66,59904,5001  >  59124 [ACK] Seq=1 Ack=86881 Win=59904 Len=0 TSval=3270166308 TSecr=2461296057
78,0.728007,192.168.2.2,192.168.1.2,TCP,66,65536,5001  >  59124 [ACK] Seq=1 Ack=89777 Win=65536 Len=0 TSval=3270166331 TSecr=2461296081
82,0.752273,192.168.2.2,192.168.1.2,TCP,66,71680,5001  >  59124 [ACK] Seq=1 Ack=92673 Win=71680 Len=0 TSval=3270166356 TSecr=2461296106
86,0.776456,192.168.2.2,192.168.1.2,TCP,66,74240,5001  >  59124 [ACK] Seq=1 Ack=94121 Win=74240 Len=0 TSval=3270166380 TSecr=2461296118
89,0.788549,192.168.2.2,192.168.1.2,TCP,66,80384,5001  >  59124 [ACK] Seq=1 Ack=97017 Win=80384 Len=0 TSval=3270166392 TSecr=2461296142
93,0.812795,192.168.2.2,192.168.1.2,TCP,66,86016,5001  >  59124 [ACK] Seq=1 Ack=99913 Win=86016 Len=0 TSval=3270166416 TSecr=2461296166
97,0.837504,192.168.2.2,192.168.1.2,TCP,66,91648,5001  >  59124 [ACK] Seq=1 Ack=102809 Win=91648 Len=0 TSval=3270166441 TSecr=2461296190
99,0.861272,192.168.2.2,192.168.1.2,TCP,66,95744,5001  >  59124 [ACK] Seq=1 Ack=104761 Win=95744 Len=0 TSval=3270166465 TSecr=2461296215
101,0.877951,192.168.2.2,192.168.1.2,TCP,66,98304,5001  >  59124 [ACK] Seq=1 Ack=106209 Win=98304 Len=0 TSval=3270166481 TSecr=2461296226
103,0.890386,192.168.2.2,192.168.1.2,TCP,66,104448,5001  >  59124 [ACK] Seq=1 Ack=109105 Win=104448 Len=0 TSval=3270166494 TSecr=2461296251
106,0.914253,192.168.2.2,192.168.1.2,TCP,66,110080,5001  >  59124 [ACK] Seq=1 Ack=112001 Win=110080 Len=0 TSval=3270166518 TSecr=2461296275
108,0.938475,192.168.2.2,192.168.1.2,TCP,66,115712,5001  >  59124 [ACK] Seq=1 Ack=114897 Win=115712 Len=0 TSval=3270166542 TSecr=2461296299
110,0.962724,192.168.2.2,192.168.1.2,TCP,66,118784,5001  >  59124 [ACK] Seq=1 Ack=115841 Win=118784 Len=0 TSval=3270166566 TSecr=2461296312
112,0.970798,192.168.2.2,192.168.1.2,TCP,66,124416,5001  >  59124 [ACK] Seq=1 Ack=118737 Win=124416 Len=0 TSval=3270166574 TSecr=2461296336
114,0.995215,192.168.2.2,192.168.1.2,TCP,66,130560,5001  >  59124 [ACK] Seq=1 Ack=121633 Win=130560 Len=0 TSval=3270166599 TSecr=2461296360
117,1.019703,192.168.2.2,192.168.1.2,TCP,66,136192,5001  >  59124 [ACK] Seq=1 Ack=124529 Win=136192 Len=0 TSval=3270166623 TSecr=2461296360
119,1.044198,192.168.2.2,192.168.1.2,TCP,66,141824,5001  >  59124 [ACK] Seq=1 Ack=127425 Win=141824 Len=0 TSval=3270166647 TSecr=2461296360
122,1.067739,192.168.2.2,192.168.1.2,TCP,66,147968,5001  >  59124 [ACK] Seq=1 Ack=130321 Win=147968 Len=0 TSval=3270166671 TSecr=2461296384
124,1.091915,192.168.2.2,192.168.1.2,TCP,66,153600,5001  >  59124 [ACK] Seq=1 Ack=133217 Win=153600 Len=0 TSval=3270166695 TSecr=2461296384
126,1.116697,192.168.2.2,192.168.1.2,TCP,66,159232,5001  >  59124 [ACK] Seq=1 Ack=136113 Win=159232 Len=0 TSval=3270166720 TSecr=2461296384
128,1.140351,192.168.2.2,192.168.1.2,TCP,66,162304,5001  >  59124 [ACK] Seq=1 Ack=137561 Win=162304 Len=0 TSval=3270166744 TSecr=2461296384
130,1.152452,192.168.2.2,192.168.1.2,TCP,66,167936,5001  >  59124 [ACK] Seq=1 Ack=140457 Win=167936 Len=0 TSval=3270166756 TSecr=2461296409
132,1.176686,192.168.2.2,192.168.1.2,TCP,66,173568,5001  >  59124 [ACK] Seq=1 Ack=143353 Win=173568 Len=0 TSval=3270166780 TSecr=2461296409
134,1.200917,192.168.2.2,192.168.1.2,TCP,66,179712,5001  >  59124 [ACK] Seq=1 Ack=146249 Win=179712 Len=0 TSval=3270166804 TSecr=2461296409
138,1.225149,192.168.2.2,192.168.1.2,TCP,66,185344,5001  >  59124 [ACK] Seq=1 Ack=149145 Win=185344 Len=0 TSval=3270166828 TSecr=2461296432
140,1.249911,192.168.2.2,192.168.1.2,TCP,66,187904,5001  >  59124 [ACK] Seq=1 Ack=152041 Win=187904 Len=0 TSval=3270166853 TSecr=2461296432
142,1.273589,192.168.2.2,192.168.1.2,TCP,66,187904,5001  >  59124 [ACK] Seq=1 Ack=154937 Win=187904 Len=0 TSval=3270166877 TSecr=2461296432
144,1.2979,192.168.2.2,192.168.1.2,TCP,66,187904,5001  >  59124 [ACK] Seq=1 Ack=157833 Win=187904 Len=0 TSval=3270166901 TSecr=2461296457
146,1.322398,192.168.2.2,192.168.1.2,TCP,66,188928,5001  >  59124 [ACK] Seq=1 Ack=159281 Win=188928 Len=0 TSval=3270166926 TSecr=2461296457
148,1.334143,192.168.2.2,192.168.1.2,TCP,66,187904,5001  >  59124 [ACK] Seq=1 Ack=162177 Win=187904 Len=0 TSval=3270166937 TSecr=2461296457
150,1.358622,192.168.2.2,192.168.1.2,TCP,66,187904,5001  >  59124 [ACK] Seq=1 Ack=165073 Win=187904 Len=0 TSval=3270166962 TSecr=2461296481
152,1.383151,192.168.2.2,192.168.1.2,TCP,66,187904,5001  >  59124 [ACK] Seq=1 Ack=167969 Win=187904 Len=0 TSval=3270166986 TSecr=2461296481
154,1.406815,192.168.2.2,192.168.1.2,TCP,66,187904,5001  >  59124 [ACK] Seq=1 Ack=170865 Win=187904 Len=0 TSval=3270167010 TSecr=2461296493
156,1.431122,192.168.2.2,192.168.1.2,TCP,66,187904,5001  >  59124 [ACK] Seq=1 Ack=173761 Win=187904 Len=0 TSval=3270167034 TSecr=2461296493
159,1.455623,192.168.2.2,192.168.1.2,TCP,66,187904,5001  >  59124 [ACK] Seq=1 Ack=176657 Win=187904 Len=0 TSval=3270167059 TSecr=2461296493
161,1.479505,192.168.2.2,192.168.1.2,TCP,66,187904,5001  >  59124 [ACK] Seq=1 Ack=179553 Win=187904 Len=0 TSval=3270167083 TSecr=2461296517
163,1.516526,192.168.2.2,192.168.1.2,TCP,66,187904,5001  >  59124 [ACK] Seq=1 Ack=183897 Win=187904 Len=0 TSval=3270167120 TSecr=2461296517
166,1.540784,192.168.2.2,192.168.1.2,TCP,66,187904,5001  >  59124 [ACK] Seq=1 Ack=186793 Win=187904 Len=0 TSval=3270167144 TSecr=2461296566
169,1.577165,192.168.2.2,192.168.1.2,TCP,66,187904,5001  >  59124 [ACK] Seq=1 Ack=191137 Win=187904 Len=0 TSval=3270167180 TSecr=2461296582
171,1.601549,192.168.2.2,192.168.1.2,TCP,66,187904,5001  >  59124 [ACK] Seq=1 Ack=194033 Win=187904 Len=0 TSval=3270167205 TSecr=2461296619
174,1.62556,192.168.2.2,192.168.1.2,TCP,66,187904,5001  >  59124 [ACK] Seq=1 Ack=196929 Win=187904 Len=0 TSval=3270167229 TSecr=2461296643
176,1.662282,192.168.2.2,192.168.1.2,TCP,66,194560,5001  >  59124 [ACK] Seq=1 Ack=201273 Win=194560 Len=0 TSval=3270167266 TSecr=2461296667
179,1.687389,192.168.2.2,192.168.1.2,TCP,66,197632,5001  >  59124 [ACK] Seq=1 Ack=202721 Win=197632 Len=0 TSval=3270167291 TSecr=2461296700
182,1.700251,192.168.2.2,192.168.1.2,TCP,66,203264,5001  >  59124 [ACK] Seq=1 Ack=205617 Win=203264 Len=0 TSval=3270167304 TSecr=2461296724
184,1.724971,192.168.2.2,192.168.1.2,TCP,66,208896,5001  >  59124 [ACK] Seq=1 Ack=208513 Win=208896 Len=0 TSval=3270167328 TSecr=2461296749
186,1.748712,192.168.2.2,192.168.1.2,TCP,66,215040,5001  >  59124 [ACK] Seq=1 Ack=211409 Win=215040 Len=0 TSval=3270167352 TSecr=2461296749
189,1.773663,192.168.2.2,192.168.1.2,TCP,66,220672,5001  >  59124 [ACK] Seq=1 Ack=214305 Win=220672 Len=0 TSval=3270167377 TSecr=2461296772
191,1.798451,192.168.2.2,192.168.1.2,TCP,66,226304,5001  >  59124 [ACK] Seq=1 Ack=217201 Win=226304 Len=0 TSval=3270167402 TSecr=2461296796
193,1.822122,192.168.2.2,192.168.1.2,TCP,66,232448,5001  >  59124 [ACK] Seq=1 Ack=220097 Win=232448 Len=0 TSval=3270167425 TSecr=2461296821
195,1.846429,192.168.2.2,192.168.1.2,TCP,66,235008,5001  >  59124 [ACK] Seq=1 Ack=221545 Win=235008 Len=0 TSval=3270167450 TSecr=2461296845
197,1.859165,192.168.2.2,192.168.1.2,TCP,66,241152,5001  >  59124 [ACK] Seq=1 Ack=224441 Win=241152 Len=0 TSval=3270167462 TSecr=2461296857
199,1.882697,192.168.2.2,192.168.1.2,TCP,66,246784,5001  >  59124 [ACK] Seq=1 Ack=227337 Win=246784 Len=0 TSval=3270167486 TSecr=2461296881
201,1.906902,192.168.2.2,192.168.1.2,TCP,66,252416,5001  >  59124 [ACK] Seq=1 Ack=230233 Win=252416 Len=0 TSval=3270167510 TSecr=2461296905
203,1.931708,192.168.2.2,192.168.1.2,TCP,66,258560,5001  >  59124 [ACK] Seq=1 Ack=233129 Win=258560 Len=0 TSval=3270167535 TSecr=2461296929
206,1.956173,192.168.2.2,192.168.1.2,TCP,66,264192,5001  >  59124 [ACK] Seq=1 Ack=236025 Win=264192 Len=0 TSval=3270167559 TSecr=2461296954
208,1.979623,192.168.2.2,192.168.1.2,TCP,66,269824,5001  >  59124 [ACK] Seq=1 Ack=238921 Win=269824 Len=0 TSval=3270167583 TSecr=2461296978
210,2.00383,192.168.2.2,192.168.1.2,TCP,66,275968,5001  >  59124 [ACK] Seq=1 Ack=241817 Win=275968 Len=0 TSval=3270167607 TSecr=2461297002
213,2.028029,192.168.2.2,192.168.1.2,TCP,66,281600,5001  >  59124 [ACK] Seq=1 Ack=244713 Win=281600 Len=0 TSval=3270167631 TSecr=2461297027
215,2.052481,192.168.2.2,192.168.1.2,TCP,66,284160,5001  >  59124 [ACK] Seq=1 Ack=246161 Win=284160 Len=0 TSval=3270167656 TSecr=2461297038
217,2.064362,192.168.2.2,192.168.1.2,TCP,66,290304,5001  >  59124 [ACK] Seq=1 Ack=249057 Win=290304 Len=0 TSval=3270167668 TSecr=2461297063
219,2.088591,192.168.2.2,192.168.1.2,TCP,66,295936,5001  >  59124 [ACK] Seq=1 Ack=251953 Win=295936 Len=0 TSval=3270167692 TSecr=2461297087
221,2.112838,192.168.2.2,192.168.1.2,TCP,66,301568,5001  >  59124 [ACK] Seq=1 Ack=254849 Win=301568 Len=0 TSval=3270167716 TSecr=2461297111
223,2.137049,192.168.2.2,192.168.1.2,TCP,66,307712,5001  >  59124 [ACK] Seq=1 Ack=257745 Win=307712 Len=0 TSval=3270167740 TSecr=2461297135
225,2.161743,192.168.2.2,192.168.1.2,TCP,66,310272,5001  >  59124 [ACK] Seq=1 Ack=259193 Win=310272 Len=0 TSval=3270167765 TSecr=2461297136
227,2.173372,192.168.2.2,192.168.1.2,TCP,66,316416,5001  >  59124 [ACK] Seq=1 Ack=262089 Win=316416 Len=0 TSval=3270167777 TSecr=2461297160
229,2.197585,192.168.2.2,192.168.1.2,TCP,66,322048,5001  >  59124 [ACK] Seq=1 Ack=264985 Win=322048 Len=0 TSval=3270167801 TSecr=2461297184
231,2.221802,192.168.2.2,192.168.1.2,TCP,66,327680,5001  >  59124 [ACK] Seq=1 Ack=267881 Win=327680 Len=0 TSval=3270167825 TSecr=2461297221
233,2.246102,192.168.2.2,192.168.1.2,TCP,66,333824,5001  >  59124 [ACK] Seq=1 Ack=270777 Win=333824 Len=0 TSval=3270167849 TSecr=2461297245
235,2.27025,192.168.2.2,192.168.1.2,TCP,66,339456,5001  >  59124 [ACK] Seq=1 Ack=273673 Win=339456 Len=0 TSval=3270167874 TSecr=2461297245
237,2.295112,192.168.2.2,192.168.1.2,TCP,66,345088,5001  >  59124 [ACK] Seq=1 Ack=276569 Win=345088 Len=0 TSval=3270167898 TSecr=2461297282
239,2.318711,192.168.2.2,192.168.1.2,TCP,66,351232,5001  >  59124 [ACK] Seq=1 Ack=279465 Win=351232 Len=0 TSval=3270167922 TSecr=2461297306
241,2.34312,192.168.2.2,192.168.1.2,TCP,66,356864,5001  >  59124 [ACK] Seq=1 Ack=282361 Win=356864 Len=0 TSval=3270167946 TSecr=2461297330
243,2.367649,192.168.2.2,192.168.1.2,TCP,66,360448,5001  >  59124 [ACK] Seq=1 Ack=285257 Win=360448 Len=0 TSval=3270167971 TSecr=2461297367
246,2.392091,192.168.2.2,192.168.1.2,TCP,66,360448,5001  >  59124 [ACK] Seq=1 Ack=288153 Win=360448 Len=0 TSval=3270167995 TSecr=2461297367
248,2.415594,192.168.2.2,192.168.1.2,TCP,66,360960,5001  >  59124 [ACK] Seq=1 Ack=289601 Win=360960 Len=0 TSval=3270168019 TSecr=2461297392
250,2.428409,192.168.2.2,192.168.1.2,TCP,66,360960,5001  >  59124 [ACK] Seq=1 Ack=292497 Win=360960 Len=0 TSval=3270168032 TSecr=2461297405
252,2.451956,192.168.2.2,192.168.1.2,TCP,66,360960,5001  >  59124 [ACK] Seq=1 Ack=295393 Win=360960 Len=0 TSval=3270168055 TSecr=2461297429
254,2.476352,192.168.2.2,192.168.1.2,TCP,66,360960,5001  >  59124 [ACK] Seq=1 Ack=298289 Win=360960 Len=0 TSval=3270168080 TSecr=2461297453
256,2.500842,192.168.2.2,192.168.1.2,TCP,66,360960,5001  >  59124 [ACK] Seq=1 Ack=301185 Win=360960 Len=0 TSval=3270168104 TSecr=2461297478
258,2.525364,192.168.2.2,192.168.1.2,TCP,66,360960,5001  >  59124 [ACK] Seq=1 Ack=304081 Win=360960 Len=0 TSval=3270168129 TSecr=2461297503
260,2.548881,192.168.2.2,192.168.1.2,TCP,66,360960,5001  >  59124 [ACK] Seq=1 Ack=306977 Win=360960 Len=0 TSval=3270168152 TSecr=2461297526
262,2.573435,192.168.2.2,192.168.1.2,TCP,66,360960,5001  >  59124 [ACK] Seq=1 Ack=309873 Win=360960 Len=0 TSval=3270168177 TSecr=2461297551
264,2.609638,192.168.2.2,192.168.1.2,TCP,66,360960,5001  >  59124 [ACK] Seq=1 Ack=314217 Win=360960 Len=0 TSval=3270168213 TSecr=2461297563
267,2.634058,192.168.2.2,192.168.1.2,TCP,66,360960,5001  >  59124 [ACK] Seq=1 Ack=317113 Win=360960 Len=0 TSval=3270168237 TSecr=2461297611
269,2.658609,192.168.2.2,192.168.1.2,TCP,66,360960,5001  >  59124 [ACK] Seq=1 Ack=320009 Win=360960 Len=0 TSval=3270168262 TSecr=2461297636
271,2.694827,192.168.2.2,192.168.1.2,TCP,66,360960,5001  >  59124 [ACK] Seq=1 Ack=324353 Win=360960 Len=0 TSval=3270168298 TSecr=2461297648
273,2.719309,192.168.2.2,192.168.1.2,TCP,66,360960,5001  >  59124 [ACK] Seq=1 Ack=327249 Win=360960 Len=0 TSval=3270168323 TSecr=2461297684
276,2.742817,192.168.2.2,192.168.1.2,TCP,66,360960,5001  >  59124 [ACK] Seq=1 Ack=330145 Win=360960 Len=0 TSval=3270168346 TSecr=2461297708
279,2.767632,192.168.2.2,192.168.1.2,TCP,66,360960,5001  >  59124 [ACK] Seq=1 Ack=333041 Win=360960 Len=0 TSval=3270168371 TSecr=2461297732
283,2.791869,192.168.2.2,192.168.1.2,TCP,66,360960,5001  >  59124 [ACK] Seq=1 Ack=335937 Win=360960 Len=0 TSval=3270168395 TSecr=2461297757
285,2.816355,192.168.2.2,192.168.1.2,TCP,66,360960,5001  >  59124 [ACK] Seq=1 Ack=338833 Win=360960 Len=0 TSval=3270168420 TSecr=2461297769
287,2.840735,192.168.2.2,192.168.1.2,TCP,66,360960,5001  >  59124 [ACK] Seq=1 Ack=341729 Win=360960 Len=0 TSval=3270168444 TSecr=2461297793
289,2.864572,192.168.2.2,192.168.1.2,TCP,66,360960,5001  >  59124 [ACK] Seq=1 Ack=344625 Win=360960 Len=0 TSval=3270168468 TSecr=2461297817
291,2.888848,192.168.2.2,192.168.1.2,TCP,66,360960,5001  >  59124 [ACK] Seq=1 Ack=347521 Win=360960 Len=0 TSval=3270168492 TSecr=2461297841
293,2.925093,192.168.2.2,192.168.1.2,TCP,66,360960,5001  >  59124 [ACK] Seq=1 Ack=351865 Win=360960 Len=0 TSval=3270168528 TSecr=2461297866
296,2.949341,192.168.2.2,192.168.1.2,TCP,66,360960,5001  >  59124 [ACK] Seq=1 Ack=354761 Win=360960 Len=0 TSval=3270168553 TSecr=2461297902
298,2.974039,192.168.2.2,192.168.1.2,TCP,66,360960,5001  >  59124 [ACK] Seq=1 Ack=357657 Win=360960 Len=0 TSval=3270168577 TSecr=2461297926
300,2.998527,192.168.2.2,192.168.1.2,TCP,66,360960,5001  >  59124 [ACK] Seq=1 Ack=360553 Win=360960 Len=0 TSval=3270168602 TSecr=2461297950
303,3.022012,192.168.2.2,192.168.1.2,TCP,66,360960,5001  >  59124 [ACK] Seq=1 Ack=363449 Win=360960 Len=0 TSval=3270168625 TSecr=2461297975
305,3.04641,192.168.2.2,192.168.1.2,TCP,66,360960,5001  >  59124 [ACK] Seq=1 Ack=366345 Win=360960 Len=0 TSval=3270168650 TSecr=2461297999
307,3.070504,192.168.2.2,192.168.1.2,TCP,66,360960,5001  >  59124 [ACK] Seq=1 Ack=369241 Win=360960 Len=0 TSval=3270168674 TSecr=2461298023
309,3.094836,192.168.2.2,192.168.1.2,TCP,66,360960,5001  >  59124 [ACK] Seq=1 Ack=372137 Win=360960 Len=0 TSval=3270168698 TSecr=2461298047
311,3.118934,192.168.2.2,192.168.1.2,TCP,66,360960,5001  >  59124 [ACK] Seq=1 Ack=375033 Win=360960 Len=0 TSval=3270168722 TSecr=2461298072
313,3.155236,192.168.2.2,192.168.1.2,TCP,66,360960,5001  >  59124 [ACK] Seq=1 Ack=379377 Win=360960 Len=0 TSval=3270168759 TSecr=2461298072
316,3.19166,192.168.2.2,192.168.1.2,TCP,66,360960,5001  >  59124 [ACK] Seq=1 Ack=383721 Win=360960 Len=0 TSval=3270168795 TSecr=2461298120
318,3.215998,192.168.2.2,192.168.1.2,TCP,66,360960,5001  >  59124 [ACK] Seq=1 Ack=386617 Win=360960 Len=0 TSval=3270168819 TSecr=2461298156
320,3.240415,192.168.2.2,192.168.1.2,TCP,66,360960,5001  >  59124 [ACK] Seq=1 Ack=389513 Win=360960 Len=0 TSval=3270168844 TSecr=2461298181
323,3.264873,192.168.2.2,192.168.1.2,TCP,66,360960,5001  >  59124 [ACK] Seq=1 Ack=392409 Win=360960 Len=0 TSval=3270168868 TSecr=2461298205
325,3.289374,192.168.2.2,192.168.1.2,TCP,66,360960,5001  >  59124 [ACK] Seq=1 Ack=395305 Win=360960 Len=0 TSval=3270168893 TSecr=2461298230
327,3.312877,192.168.2.2,192.168.1.2,TCP,66,360960,5001  >  59124 [ACK] Seq=1 Ack=398201 Win=360960 Len=0 TSval=3270168916 TSecr=2461298253
329,3.337337,192.168.2.2,192.168.1.2,TCP,66,360960,5001  >  59124 [ACK] Seq=1 Ack=401097 Win=360960 Len=0 TSval=3270168941 TSecr=2461298278
331,3.361841,192.168.2.2,192.168.1.2,TCP,66,360960,5001  >  59124 [ACK] Seq=1 Ack=403993 Win=360960 Len=0 TSval=3270168965 TSecr=2461298314
333,3.385376,192.168.2.2,192.168.1.2,TCP,66,360960,5001  >  59124 [ACK] Seq=1 Ack=406889 Win=360960 Len=0 TSval=3270168989 TSecr=2461298314
335,3.409846,192.168.2.2,192.168.1.2,TCP,66,360960,5001  >  59124 [ACK] Seq=1 Ack=409785 Win=360960 Len=0 TSval=3270169013 TSecr=2461298338
337,3.43432,192.168.2.2,192.168.1.2,TCP,66,360960,5001  >  59124 [ACK] Seq=1 Ack=412681 Win=360960 Len=0 TSval=3270169038 TSecr=2461298363
339,3.458825,192.168.2.2,192.168.1.2,TCP,66,360960,5001  >  59124 [ACK] Seq=1 Ack=415577 Win=360960 Len=0 TSval=3270169062 TSecr=2461298399
341,3.482345,192.168.2.2,192.168.1.2,TCP,66,360960,5001  >  59124 [ACK] Seq=1 Ack=418473 Win=360960 Len=0 TSval=3270169086 TSecr=2461298424
343,3.518646,192.168.2.2,192.168.1.2,TCP,66,360960,5001  >  59124 [ACK] Seq=1 Ack=422817 Win=360960 Len=0 TSval=3270169122 TSecr=2461298424
346,3.543262,192.168.2.2,192.168.1.2,TCP,66,360960,5001  >  59124 [ACK] Seq=1 Ack=425713 Win=360960 Len=0 TSval=3270169147 TSecr=2461298472
348,3.567547,192.168.2.2,192.168.1.2,TCP,66,360960,5001  >  59124 [ACK] Seq=1 Ack=428609 Win=360960 Len=0 TSval=3270169171 TSecr=2461298496
350,3.591264,192.168.2.2,192.168.1.2,TCP,66,360960,5001  >  59124 [ACK] Seq=1 Ack=431505 Win=360960 Len=0 TSval=3270169195 TSecr=2461298521
352,3.615598,192.168.2.2,192.168.1.2,TCP,66,360960,5001  >  59124 [ACK] Seq=1 Ack=434401 Win=360960 Len=0 TSval=3270169219 TSecr=2461298545
355,3.640114,192.168.2.2,192.168.1.2,TCP,66,360960,5001  >  59124 [ACK] Seq=1 Ack=437297 Win=360960 Len=0 TSval=3270169243 TSecr=2461298569
357,3.664564,192.168.2.2,192.168.1.2,TCP,66,360960,5001  >  59124 [ACK] Seq=1 Ack=440193 Win=360960 Len=0 TSval=3270169268 TSecr=2461298593
359,3.688186,192.168.2.2,192.168.1.2,TCP,66,360960,5001  >  59124 [ACK] Seq=1 Ack=443089 Win=360960 Len=0 TSval=3270169291 TSecr=2461298629
361,3.712556,192.168.2.2,192.168.1.2,TCP,66,360960,5001  >  59124 [ACK] Seq=1 Ack=445985 Win=360960 Len=0 TSval=3270169316 TSecr=2461298629
363,3.73706,192.168.2.2,192.168.1.2,TCP,66,360960,5001  >  59124 [ACK] Seq=1 Ack=448881 Win=360960 Len=0 TSval=3270169340 TSecr=2461298654
365,3.761588,192.168.2.2,192.168.1.2,TCP,66,360960,5001  >  59124 [ACK] Seq=1 Ack=451777 Win=360960 Len=0 TSval=3270169365 TSecr=2461298678
367,3.785162,192.168.2.2,192.168.1.2,TCP,66,360960,5001  >  59124 [ACK] Seq=1 Ack=454673 Win=360960 Len=0 TSval=3270169388 TSecr=2461298703
370,3.810055,192.168.2.2,192.168.1.2,TCP,66,360960,5001  >  59124 [ACK] Seq=1 Ack=457569 Win=360960 Len=0 TSval=3270169413 TSecr=2461298726
372,3.834323,192.168.2.2,192.168.1.2,TCP,66,360960,5001  >  59124 [ACK] Seq=1 Ack=460465 Win=360960 Len=0 TSval=3270169438 TSecr=2461298751
374,3.858519,192.168.2.2,192.168.1.2,TCP,66,360960,5001  >  59124 [ACK] Seq=1 Ack=463361 Win=360960 Len=0 TSval=3270169462 TSecr=2461298775
376,3.883022,192.168.2.2,192.168.1.2,TCP,66,360960,5001  >  59124 [ACK] Seq=1 Ack=466257 Win=360960 Len=0 TSval=3270169486 TSecr=2461298799
378,3.907545,192.168.2.2,192.168.1.2,TCP,66,360960,5001  >  59124 [ACK] Seq=1 Ack=469153 Win=360960 Len=0 TSval=3270169511 TSecr=2461298823
380,3.931175,192.168.2.2,192.168.1.2,TCP,66,360960,5001  >  59124 [ACK] Seq=1 Ack=472049 Win=360960 Len=0 TSval=3270169534 TSecr=2461298860
382,3.955484,192.168.2.2,192.168.1.2,TCP,66,360960,5001  >  59124 [ACK] Seq=1 Ack=474945 Win=360960 Len=0 TSval=3270169559 TSecr=2461298860
385,3.979979,192.168.2.2,192.168.1.2,TCP,66,360960,5001  >  59124 [ACK] Seq=1 Ack=477841 Win=360960 Len=0 TSval=3270169583 TSecr=2461298896
387,4.003871,192.168.2.2,192.168.1.2,TCP,66,360960,5001  >  59124 [ACK] Seq=1 Ack=480737 Win=360960 Len=0 TSval=3270169607 TSecr=2461298920
390,4.028078,192.168.2.2,192.168.1.2,TCP,66,360960,5001  >  59124 [ACK] Seq=1 Ack=483633 Win=360960 Len=0 TSval=3270169631 TSecr=2461298945
392,4.052611,192.168.2.2,192.168.1.2,TCP,66,360960,5001  >  59124 [ACK] Seq=1 Ack=486529 Win=360960 Len=0 TSval=3270169656 TSecr=2461298945
394,4.076973,192.168.2.2,192.168.1.2,TCP,66,360960,5001  >  59124 [ACK] Seq=1 Ack=489425 Win=360960 Len=0 TSval=3270169680 TSecr=2461298969
396,4.100745,192.168.2.2,192.168.1.2,TCP,66,360960,5001  >  59124 [ACK] Seq=1 Ack=492321 Win=360960 Len=0 TSval=3270169704 TSecr=2461298994
398,4.124982,192.168.2.2,192.168.1.2,TCP,66,360960,5001  >  59124 [ACK] Seq=1 Ack=495217 Win=360960 Len=0 TSval=3270169728 TSecr=2461299017
400,4.149376,192.168.2.2,192.168.1.2,TCP,66,360960,5001  >  59124 [ACK] Seq=1 Ack=498113 Win=360960 Len=0 TSval=3270169753 TSecr=2461299042
402,4.173877,192.168.2.2,192.168.1.2,TCP,66,360960,5001  >  59124 [ACK] Seq=1 Ack=501009 Win=360960 Len=0 TSval=3270169777 TSecr=2461299066
404,4.198428,192.168.2.2,192.168.1.2,TCP,66,360960,5001  >  59124 [ACK] Seq=1 Ack=503905 Win=360960 Len=0 TSval=3270169802 TSecr=2461299090
407,4.221905,192.168.2.2,192.168.1.2,TCP,66,360960,5001  >  59124 [ACK] Seq=1 Ack=506801 Win=360960 Len=0 TSval=3270169825 TSecr=2461299114
409,4.246102,192.168.2.2,192.168.1.2,TCP,66,360960,5001  >  59124 [ACK] Seq=1 Ack=509697 Win=360960 Len=0 TSval=3270169849 TSecr=2461299139
411,4.270853,192.168.2.2,192.168.1.2,TCP,66,360960,5001  >  59124 [ACK] Seq=1 Ack=512593 Win=360960 Len=0 TSval=3270169874 TSecr=2461299163
413,4.294586,192.168.2.2,192.168.1.2,TCP,66,360960,5001  >  59124 [ACK] Seq=1 Ack=515489 Win=360960 Len=0 TSval=3270169898 TSecr=2461299187
415,4.318944,192.168.2.2,192.168.1.2,TCP,66,360960,5001  >  59124 [ACK] Seq=1 Ack=518385 Win=360960 Len=0 TSval=3270169922 TSecr=2461299223
417,4.343415,192.168.2.2,192.168.1.2,TCP,66,360960,5001  >  59124 [ACK] Seq=1 Ack=521281 Win=360960 Len=0 TSval=3270169947 TSecr=2461299223
419,4.36731,192.168.2.2,192.168.1.2,TCP,66,360960,5001  >  59124 [ACK] Seq=1 Ack=524177 Win=360960 Len=0 TSval=3270169971 TSecr=2461299248
421,4.391491,192.168.2.2,192.168.1.2,TCP,66,360960,5001  >  59124 [ACK] Seq=1 Ack=527073 Win=360960 Len=0 TSval=3270169995 TSecr=2461299272
423,4.415955,192.168.2.2,192.168.1.2,TCP,66,360960,5001  >  59124 [ACK] Seq=1 Ack=529969 Win=360960 Len=0 TSval=3270170019 TSecr=2461299296
425,4.440409,192.168.2.2,192.168.1.2,TCP,66,360960,5001  >  59124 [ACK] Seq=1 Ack=532865 Win=360960 Len=0 TSval=3270170044 TSecr=2461299320
427,4.464124,192.168.2.2,192.168.1.2,TCP,66,360960,5001  >  59124 [ACK] Seq=1 Ack=535761 Win=360960 Len=0 TSval=3270170067 TSecr=2461299344
429,4.488419,192.168.2.2,192.168.1.2,TCP,66,360960,5001  >  59124 [ACK] Seq=1 Ack=538657 Win=360960 Len=0 TSval=3270170092 TSecr=2461299369
432,4.512842,192.168.2.2,192.168.1.2,TCP,66,360960,5001  >  59124 [ACK] Seq=1 Ack=541553 Win=360960 Len=0 TSval=3270170116 TSecr=2461299393
434,4.536802,192.168.2.2,192.168.1.2,TCP,66,360960,5001  >  59124 [ACK] Seq=1 Ack=544449 Win=360960 Len=0 TSval=3270170140 TSecr=2461299417
436,4.561893,192.168.2.2,192.168.1.2,TCP,66,360960,5001  >  59124 [ACK] Seq=1 Ack=547345 Win=360960 Len=0 TSval=3270170165 TSecr=2461299441
438,4.585278,192.168.2.2,192.168.1.2,TCP,66,360960,5001  >  59124 [ACK] Seq=1 Ack=550241 Win=360960 Len=0 TSval=3270170189 TSecr=2461299466
440,4.609476,192.168.2.2,192.168.1.2,TCP,66,360960,5001  >  59124 [ACK] Seq=1 Ack=553137 Win=360960 Len=0 TSval=3270170213 TSecr=2461299489
442,4.634322,192.168.2.2,192.168.1.2,TCP,66,360960,5001  >  59124 [ACK] Seq=1 Ack=556033 Win=360960 Len=0 TSval=3270170238 TSecr=2461299514
444,4.657952,192.168.2.2,192.168.1.2,TCP,66,360960,5001  >  59124 [ACK] Seq=1 Ack=558929 Win=360960 Len=0 TSval=3270170261 TSecr=2461299539
446,4.682446,192.168.2.2,192.168.1.2,TCP,66,360960,5001  >  59124 [ACK] Seq=1 Ack=561825 Win=360960 Len=0 TSval=3270170286 TSecr=2461299563
448,4.706866,192.168.2.2,192.168.1.2,TCP,66,360960,5001  >  59124 [ACK] Seq=1 Ack=564721 Win=360960 Len=0 TSval=3270170310 TSecr=2461299587
451,4.731374,192.168.2.2,192.168.1.2,TCP,66,360960,5001  >  59124 [ACK] Seq=1 Ack=567617 Win=360960 Len=0 TSval=3270170335 TSecr=2461299612
453,4.754883,192.168.2.2,192.168.1.2,TCP,66,360960,5001  >  59124 [ACK] Seq=1 Ack=570513 Win=360960 Len=0 TSval=3270170358 TSecr=2461299636
455,4.779331,192.168.2.2,192.168.1.2,TCP,66,360960,5001  >  59124 [ACK] Seq=1 Ack=573409 Win=360960 Len=0 TSval=3270170383 TSecr=2461299660
457,4.803835,192.168.2.2,192.168.1.2,TCP,66,360960,5001  >  59124 [ACK] Seq=1 Ack=576305 Win=360960 Len=0 TSval=3270170407 TSecr=2461299660
459,4.827507,192.168.2.2,192.168.1.2,TCP,66,360960,5001  >  59124 [ACK] Seq=1 Ack=579201 Win=360960 Len=0 TSval=3270170431 TSecr=2461299684
461,4.851762,192.168.2.2,192.168.1.2,TCP,66,360960,5001  >  59124 [ACK] Seq=1 Ack=582097 Win=360960 Len=0 TSval=3270170455 TSecr=2461299708
464,4.876686,192.168.2.2,192.168.1.2,TCP,66,360960,5001  >  59124 [ACK] Seq=1 Ack=584993 Win=360960 Len=0 TSval=3270170480 TSecr=2461299732
466,4.900981,192.168.2.2,192.168.1.2,TCP,66,360960,5001  >  59124 [ACK] Seq=1 Ack=587889 Win=360960 Len=0 TSval=3270170504 TSecr=2461299757
468,4.925282,192.168.2.2,192.168.1.2,TCP,66,360960,5001  >  59124 [ACK] Seq=1 Ack=590785 Win=360960 Len=0 TSval=3270170529 TSecr=2461299781
471,4.949392,192.168.2.2,192.168.1.2,TCP,66,360960,5001  >  59124 [ACK] Seq=1 Ack=593681 Win=360960 Len=0 TSval=3270170553 TSecr=2461299805
473,4.986202,192.168.2.2,192.168.1.2,TCP,66,360960,5001  >  59124 [ACK] Seq=1 Ack=598025 Win=360960 Len=0 TSval=3270170589 TSecr=2461299829
475,5.009997,192.168.2.2,192.168.1.2,TCP,66,360960,5001  >  59124 [ACK] Seq=1 Ack=600921 Win=360960 Len=0 TSval=3270170613 TSecr=2461299878
482,5.034987,192.168.2.2,192.168.1.2,TCP,66,360960,5001  >  59124 [ACK] Seq=1 Ack=603817 Win=360960 Len=0 TSval=3270170638 TSecr=2461299903
484,5.058504,192.168.2.2,192.168.1.2,TCP,66,360960,5001  >  59124 [ACK] Seq=1 Ack=606713 Win=360960 Len=0 TSval=3270170662 TSecr=2461299903
486,5.082929,192.168.2.2,192.168.1.2,TCP,66,360960,5001  >  59124 [ACK] Seq=1 Ack=609609 Win=360960 Len=0 TSval=3270170686 TSecr=2461299926
488,5.106821,192.168.2.2,192.168.1.2,TCP,66,360960,5001  >  59124 [ACK] Seq=1 Ack=612505 Win=360960 Len=0 TSval=3270170710 TSecr=2461299950
491,5.131082,192.168.2.2,192.168.1.2,TCP,66,360960,5001  >  59124 [ACK] Seq=1 Ack=615401 Win=360960 Len=0 TSval=3270170734 TSecr=2461299975
493,5.155431,192.168.2.2,192.168.1.2,TCP,66,360960,5001  >  59124 [ACK] Seq=1 Ack=618297 Win=360960 Len=0 TSval=3270170759 TSecr=2461299999
495,5.179938,192.168.2.2,192.168.1.2,TCP,66,360960,5001  >  59124 [ACK] Seq=1 Ack=621193 Win=360960 Len=0 TSval=3270170783 TSecr=2461300023
497,5.204412,192.168.2.2,192.168.1.2,TCP,66,360960,5001  >  59124 [ACK] Seq=1 Ack=624089 Win=360960 Len=0 TSval=3270170808 TSecr=2461300048
499,5.228039,192.168.2.2,192.168.1.2,TCP,66,360960,5001  >  59124 [ACK] Seq=1 Ack=626985 Win=360960 Len=0 TSval=3270170831 TSecr=2461300072
501,5.252387,192.168.2.2,192.168.1.2,TCP,66,360960,5001  >  59124 [ACK] Seq=1 Ack=629881 Win=360960 Len=0 TSval=3270170856 TSecr=2461300096
504,5.277013,192.168.2.2,192.168.1.2,TCP,66,360960,5001  >  59124 [ACK] Seq=1 Ack=632777 Win=360960 Len=0 TSval=3270170880 TSecr=2461300120
506,5.300684,192.168.2.2,192.168.1.2,TCP,66,360960,5001  >  59124 [ACK] Seq=1 Ack=635673 Win=360960 Len=0 TSval=3270170904 TSecr=2461300145
508,5.324936,192.168.2.2,192.168.1.2,TCP,66,360960,5001  >  59124 [ACK] Seq=1 Ack=638569 Win=360960 Len=0 TSval=3270170928 TSecr=2461300168
510,5.349468,192.168.2.2,192.168.1.2,TCP,66,360960,5001  >  59124 [ACK] Seq=1 Ack=641465 Win=360960 Len=0 TSval=3270170953 TSecr=2461300193
512,5.385688,192.168.2.2,192.168.1.2,TCP,66,360960,5001  >  59124 [ACK] Seq=1 Ack=645809 Win=360960 Len=0 TSval=3270170989 TSecr=2461300209
515,5.410101,192.168.2.2,192.168.1.2,TCP,66,360960,5001  >  59124 [ACK] Seq=1 Ack=648705 Win=360960 Len=0 TSval=3270171013 TSecr=2461300241
517,5.434705,192.168.2.2,192.168.1.2,TCP,66,360960,5001  >  59124 [ACK] Seq=1 Ack=651601 Win=360960 Len=0 TSval=3270171038 TSecr=2461300266
519,5.458205,192.168.2.2,192.168.1.2,TCP,66,360960,5001  >  59124 [ACK] Seq=1 Ack=654497 Win=360960 Len=0 TSval=3270171061 TSecr=2461300290
522,5.482687,192.168.2.2,192.168.1.2,TCP,66,360960,5001  >  59124 [ACK] Seq=1 Ack=657393 Win=360960 Len=0 TSval=3270171086 TSecr=2461300314
524,5.507206,192.168.2.2,192.168.1.2,TCP,66,360960,5001  >  59124 [ACK] Seq=1 Ack=660289 Win=360960 Len=0 TSval=3270171110 TSecr=2461300339
527,5.530782,192.168.2.2,192.168.1.2,TCP,66,360960,5001  >  59124 [ACK] Seq=1 Ack=663185 Win=360960 Len=0 TSval=3270171134 TSecr=2461300362
529,5.55508,192.168.2.2,192.168.1.2,TCP,66,360960,5001  >  59124 [ACK] Seq=1 Ack=666081 Win=360960 Len=0 TSval=3270171158 TSecr=2461300387
531,5.579649,192.168.2.2,192.168.1.2,TCP,66,360960,5001  >  59124 [ACK] Seq=1 Ack=668977 Win=360960 Len=0 TSval=3270171183 TSecr=2461300411
533,5.603484,192.168.2.2,192.168.1.2,TCP,66,360960,5001  >  59124 [ACK] Seq=1 Ack=671873 Win=360960 Len=0 TSval=3270171207 TSecr=2461300411
535,5.627737,192.168.2.2,192.168.1.2,TCP,66,360960,5001  >  59124 [ACK] Seq=1 Ack=674769 Win=360960 Len=0 TSval=3270171231 TSecr=2461300436
538,5.652116,192.168.2.2,192.168.1.2,TCP,66,360960,5001  >  59124 [ACK] Seq=1 Ack=677665 Win=360960 Len=0 TSval=3270171255 TSecr=2461300459
540,5.676597,192.168.2.2,192.168.1.2,TCP,66,360960,5001  >  59124 [ACK] Seq=1 Ack=680561 Win=360960 Len=0 TSval=3270171280 TSecr=2461300484
542,5.700367,192.168.2.2,192.168.1.2,TCP,66,360960,5001  >  59124 [ACK] Seq=1 Ack=683457 Win=360960 Len=0 TSval=3270171304 TSecr=2461300508
544,5.724703,192.168.2.2,192.168.1.2,TCP,66,360960,5001  >  59124 [ACK] Seq=1 Ack=686353 Win=360960 Len=0 TSval=3270171328 TSecr=2461300532
546,5.749128,192.168.2.2,192.168.1.2,TCP,66,360960,5001  >  59124 [ACK] Seq=1 Ack=689249 Win=360960 Len=0 TSval=3270171352 TSecr=2461300556
549,5.773046,192.168.2.2,192.168.1.2,TCP,66,360960,5001  >  59124 [ACK] Seq=1 Ack=692145 Win=360960 Len=0 TSval=3270171376 TSecr=2461300581
551,5.798094,192.168.2.2,192.168.1.2,TCP,66,360960,5001  >  59124 [ACK] Seq=1 Ack=695041 Win=360960 Len=0 TSval=3270171401 TSecr=2461300605
553,5.821569,192.168.2.2,192.168.1.2,TCP,66,360960,5001  >  59124 [ACK] Seq=1 Ack=697937 Win=360960 Len=0 TSval=3270171425 TSecr=2461300630
555,5.846081,192.168.2.2,192.168.1.2,TCP,66,360960,5001  >  59124 [ACK] Seq=1 Ack=700833 Win=360960 Len=0 TSval=3270171449 TSecr=2461300630
558,5.869983,192.168.2.2,192.168.1.2,TCP,66,360960,5001  >  59124 [ACK] Seq=1 Ack=703729 Win=360960 Len=0 TSval=3270171473 TSecr=2461300654
560,5.894125,192.168.2.2,192.168.1.2,TCP,66,360960,5001  >  59124 [ACK] Seq=1 Ack=706625 Win=360960 Len=0 TSval=3270171497 TSecr=2461300691
562,5.91857,192.168.2.2,192.168.1.2,TCP,66,360960,5001  >  59124 [ACK] Seq=1 Ack=709521 Win=360960 Len=0 TSval=3270171522 TSecr=2461300714
564,5.943022,192.168.2.2,192.168.1.2,TCP,66,360960,5001  >  59124 [ACK] Seq=1 Ack=712417 Win=360960 Len=0 TSval=3270171546 TSecr=2461300714
568,5.968771,192.168.2.2,192.168.1.2,TCP,66,360960,5001  >  59124 [ACK] Seq=1 Ack=715313 Win=360960 Len=0 TSval=3270171572 TSecr=2461300739
570,5.993,192.168.2.2,192.168.1.2,TCP,66,360960,5001  >  59124 [ACK] Seq=1 Ack=718209 Win=360960 Len=0 TSval=3270171596 TSecr=2461300763
573,6.016893,192.168.2.2,192.168.1.2,TCP,66,360960,5001  >  59124 [ACK] Seq=1 Ack=721105 Win=360960 Len=0 TSval=3270171620 TSecr=2461300787
576,6.041208,192.168.2.2,192.168.1.2,TCP,66,360960,5001  >  59124 [ACK] Seq=1 Ack=724001 Win=360960 Len=0 TSval=3270171645 TSecr=2461300811
578,6.078185,192.168.2.2,192.168.1.2,TCP,66,360960,5001  >  59124 [ACK] Seq=1 Ack=728345 Win=360960 Len=0 TSval=3270171681 TSecr=2461300811
581,6.101713,192.168.2.2,192.168.1.2,TCP,66,360960,5001  >  59124 [ACK] Seq=1 Ack=731241 Win=360960 Len=0 TSval=3270171705 TSecr=2461300860
583,6.126203,192.168.2.2,192.168.1.2,TCP,66,360960,5001  >  59124 [ACK] Seq=1 Ack=734137 Win=360960 Len=0 TSval=3270171730 TSecr=2461300884
585,6.150196,192.168.2.2,192.168.1.2,TCP,66,360960,5001  >  59124 [ACK] Seq=1 Ack=737033 Win=360960 Len=0 TSval=3270171753 TSecr=2461300909
588,6.175168,192.168.2.2,192.168.1.2,TCP,66,360960,5001  >  59124 [ACK] Seq=1 Ack=739929 Win=360960 Len=0 TSval=3270171778 TSecr=2461300932
590,6.198664,192.168.2.2,192.168.1.2,TCP,66,360960,5001  >  59124 [ACK] Seq=1 Ack=742825 Win=360960 Len=0 TSval=3270171802 TSecr=2461300957
592,6.222804,192.168.2.2,192.168.1.2,TCP,66,360960,5001  >  59124 [ACK] Seq=1 Ack=745721 Win=360960 Len=0 TSval=3270171826 TSecr=2461300957
594,6.247676,192.168.2.2,192.168.1.2,TCP,66,360960,5001  >  59124 [ACK] Seq=1 Ack=748617 Win=360960 Len=0 TSval=3270171851 TSecr=2461300981
597,6.271277,192.168.2.2,192.168.1.2,TCP,66,360960,5001  >  59124 [ACK] Seq=1 Ack=751513 Win=360960 Len=0 TSval=3270171875 TSecr=2461301005
599,6.295478,192.168.2.2,192.168.1.2,TCP,66,360960,5001  >  59124 [ACK] Seq=1 Ack=754409 Win=360960 Len=0 TSval=3270171899 TSecr=2461301029
601,6.320148,192.168.2.2,192.168.1.2,TCP,66,360960,5001  >  59124 [ACK] Seq=1 Ack=757305 Win=360960 Len=0 TSval=3270171923 TSecr=2461301054
603,6.34463,192.168.2.2,192.168.1.2,TCP,66,360960,5001  >  59124 [ACK] Seq=1 Ack=760201 Win=360960 Len=0 TSval=3270171948 TSecr=2461301090
606,6.368205,192.168.2.2,192.168.1.2,TCP,66,360960,5001  >  59124 [ACK] Seq=1 Ack=763097 Win=360960 Len=0 TSval=3270171972 TSecr=2461301090
608,6.392637,192.168.2.2,192.168.1.2,TCP,66,360960,5001  >  59124 [ACK] Seq=1 Ack=765993 Win=360960 Len=0 TSval=3270171996 TSecr=2461301114
610,6.417158,192.168.2.2,192.168.1.2,TCP,66,360960,5001  >  59124 [ACK] Seq=1 Ack=768889 Win=360960 Len=0 TSval=3270172020 TSecr=2461301139
612,6.440849,192.168.2.2,192.168.1.2,TCP,66,360960,5001  >  59124 [ACK] Seq=1 Ack=771785 Win=360960 Len=0 TSval=3270172044 TSecr=2461301163
615,6.465118,192.168.2.2,192.168.1.2,TCP,66,360960,5001  >  59124 [ACK] Seq=1 Ack=774681 Win=360960 Len=0 TSval=3270172068 TSecr=2461301163
618,6.489617,192.168.2.2,192.168.1.2,TCP,66,360960,5001  >  59124 [ACK] Seq=1 Ack=777577 Win=360960 Len=0 TSval=3270172093 TSecr=2461301187
620,6.514104,192.168.2.2,192.168.1.2,TCP,66,360960,5001  >  59124 [ACK] Seq=1 Ack=780473 Win=360960 Len=0 TSval=3270172117 TSecr=2461301212
622,6.550341,192.168.2.2,192.168.1.2,TCP,66,360960,5001  >  59124 [ACK] Seq=1 Ack=784817 Win=360960 Len=0 TSval=3270172154 TSecr=2461301232
626,6.574114,192.168.2.2,192.168.1.2,TCP,66,360960,5001  >  59124 [ACK] Seq=1 Ack=787713 Win=360960 Len=0 TSval=3270172177 TSecr=2461301259
628,6.598337,192.168.2.2,192.168.1.2,TCP,66,360960,5001  >  59124 [ACK] Seq=1 Ack=790609 Win=360960 Len=0 TSval=3270172202 TSecr=2461301284
630,6.622859,192.168.2.2,192.168.1.2,TCP,66,360960,5001  >  59124 [ACK] Seq=1 Ack=793505 Win=360960 Len=0 TSval=3270172226 TSecr=2461301308
633,6.646786,192.168.2.2,192.168.1.2,TCP,66,360960,5001  >  59124 [ACK] Seq=1 Ack=796401 Win=360960 Len=0 TSval=3270172250 TSecr=2461301332
635,6.671851,192.168.2.2,192.168.1.2,TCP,66,360960,5001  >  59124 [ACK] Seq=1 Ack=799297 Win=360960 Len=0 TSval=3270172275 TSecr=2461301332
637,6.695417,192.168.2.2,192.168.1.2,TCP,66,360960,5001  >  59124 [ACK] Seq=1 Ack=802193 Win=360960 Len=0 TSval=3270172299 TSecr=2461301356
640,6.719784,192.168.2.2,192.168.1.2,TCP,66,360960,5001  >  59124 [ACK] Seq=1 Ack=805089 Win=360960 Len=0 TSval=3270172323 TSecr=2461301381
642,6.74428,192.168.2.2,192.168.1.2,TCP,66,360960,5001  >  59124 [ACK] Seq=1 Ack=807985 Win=360960 Len=0 TSval=3270172348 TSecr=2461301405
644,6.767913,192.168.2.2,192.168.1.2,TCP,66,360960,5001  >  59124 [ACK] Seq=1 Ack=810881 Win=360960 Len=0 TSval=3270172371 TSecr=2461301429
647,6.79235,192.168.2.2,192.168.1.2,TCP,66,360960,5001  >  59124 [ACK] Seq=1 Ack=813777 Win=360960 Len=0 TSval=3270172396 TSecr=2461301453
650,6.816334,192.168.2.2,192.168.1.2,TCP,66,360960,5001  >  59124 [ACK] Seq=1 Ack=816673 Win=360960 Len=0 TSval=3270172420 TSecr=2461301453
652,6.840611,192.168.2.2,192.168.1.2,TCP,66,360960,5001  >  59124 [ACK] Seq=1 Ack=819569 Win=360960 Len=0 TSval=3270172444 TSecr=2461301477
655,6.864806,192.168.2.2,192.168.1.2,TCP,66,360960,5001  >  59124 [ACK] Seq=1 Ack=822465 Win=360960 Len=0 TSval=3270172468 TSecr=2461301502
657,6.888992,192.168.2.2,192.168.1.2,TCP,66,360960,5001  >  59124 [ACK] Seq=1 Ack=825361 Win=360960 Len=0 TSval=3270172492 TSecr=2461301526
659,6.913268,192.168.2.2,192.168.1.2,TCP,66,360960,5001  >  59124 [ACK] Seq=1 Ack=828257 Win=360960 Len=0 TSval=3270172517 TSecr=2461301550
662,6.937443,192.168.2.2,192.168.1.2,TCP,66,360960,5001  >  59124 [ACK] Seq=1 Ack=831153 Win=360960 Len=0 TSval=3270172541 TSecr=2461301550
664,6.961742,192.168.2.2,192.168.1.2,TCP,66,360960,5001  >  59124 [ACK] Seq=1 Ack=834049 Win=360960 Len=0 TSval=3270172565 TSecr=2461301574
666,6.986302,192.168.2.2,192.168.1.2,TCP,66,360960,5001  >  59124 [ACK] Seq=1 Ack=836945 Win=360960 Len=0 TSval=3270172590 TSecr=2461301598
669,7.010124,192.168.2.2,192.168.1.2,TCP,66,360960,5001  >  59124 [ACK] Seq=1 Ack=839841 Win=360960 Len=0 TSval=3270172613 TSecr=2461301623
672,7.034321,192.168.2.2,192.168.1.2,TCP,66,360960,5001  >  59124 [ACK] Seq=1 Ack=842737 Win=360960 Len=0 TSval=3270172638 TSecr=2461301647
