"No.","Time","Source","Destination","Protocol","Length","Calculated window size","Info"
"4","0.006305","192.168.2.2","192.168.1.2","TCP","74","28960","5001  >  47916 [SYN, ACK] Seq=0 Ack=1 Win=28960 Len=0 MSS=1460 SACK_PERM=1 TSval=550543284 TSecr=455764999 WS=512"
"7","0.006351","192.168.2.2","192.168.1.2","TCP","66","43520","5001  >  47916 [ACK] Seq=1 Ack=7241 Win=43520 Len=0 TSval=550543284 TSecr=455764999"
"12","0.056023","192.168.2.2","192.168.1.2","TCP","66","58368","5001  >  47916 [ACK] Seq=1 Ack=14481 Win=58368 Len=0 TSval=550543334 TSecr=455764999"
"15","0.115819","192.168.2.2","192.168.1.2","TCP","66","78336","5001  >  47916 [ACK] Seq=1 Ack=24617 Win=78336 Len=0 TSval=550543393 TSecr=455764999"
"24","0.201039","192.168.2.2","192.168.1.2","TCP","66","87040","5001  >  47916 [ACK] Seq=1 Ack=28961 Win=87040 Len=0 TSval=550543479 TSecr=455764999"
"28","0.237264","192.168.2.2","192.168.1.2","TCP","66","90112","5001  >  47916 [ACK] Seq=1 Ack=30409 Win=90112 Len=0 TSval=550543515 TSecr=455765012"
"30","0.249057","192.168.2.2","192.168.1.2","TCP","66","107520","5001  >  47916 [ACK] Seq=1 Ack=39097 Win=107520 Len=0 TSval=550543527 TSecr=455765049"
"38","0.322561","192.168.2.2","192.168.1.2","TCP","66","116224","5001  >  47916 [ACK] Seq=1 Ack=43441 Win=116224 Len=0 TSval=550543600 TSecr=455765076"
"42","0.358797","192.168.2.2","192.168.1.2","TCP","66","121856","5001  >  47916 [ACK] Seq=1 Ack=46337 Win=121856 Len=0 TSval=550543636 TSecr=455765108"
"45","0.382971","192.168.2.2","192.168.1.2","TCP","66","127488","5001  >  47916 [ACK] Seq=1 Ack=49233 Win=127488 Len=0 TSval=550543660 TSecr=455765108"
"48","0.407188","192.168.2.2","192.168.1.2","TCP","66","130560","5001  >  47916 [ACK] Seq=1 Ack=50681 Win=130560 Len=0 TSval=550543685 TSecr=455765108"
"50","0.419587","192.168.2.2","192.168.1.2","TCP","66","136192","5001  >  47916 [ACK] Seq=1 Ack=53577 Win=136192 Len=0 TSval=550543697 TSecr=455765108"
"53","0.444162","192.168.2.2","192.168.1.2","TCP","66","142336","5001  >  47916 [ACK] Seq=1 Ack=56473 Win=142336 Len=0 TSval=550543722 TSecr=455765109"
"56","0.467992","192.168.2.2","192.168.1.2","TCP","66","147968","5001  >  47916 [ACK] Seq=1 Ack=59369 Win=147968 Len=0 TSval=550543745 TSecr=455765110"
"59","0.492108","192.168.2.2","192.168.1.2","TCP","66","153600","5001  >  47916 [ACK] Seq=1 Ack=62265 Win=153600 Len=0 TSval=550543769 TSecr=455765111"
"62","0.516556","192.168.2.2","192.168.1.2","TCP","66","156672","5001  >  47916 [ACK] Seq=1 Ack=63713 Win=156672 Len=0 TSval=550543794 TSecr=455765160"
"64","0.528318","192.168.2.2","192.168.1.2","TCP","66","162304","5001  >  47916 [ACK] Seq=1 Ack=66609 Win=162304 Len=0 TSval=550543806 TSecr=455765194"
"67","0.552845","192.168.2.2","192.168.1.2","TCP","66","168448","5001  >  47916 [ACK] Seq=1 Ack=69505 Win=168448 Len=0 TSval=550543830 TSecr=455765194"
"69","0.576759","192.168.2.2","192.168.1.2","TCP","66","174080","5001  >  47916 [ACK] Seq=1 Ack=72401 Win=174080 Len=0 TSval=550543854 TSecr=455765194"
"71","0.601834","192.168.2.2","192.168.1.2","TCP","66","179712","5001  >  47916 [ACK] Seq=1 Ack=75297 Win=179712 Len=0 TSval=550543879 TSecr=455765230"
"73","0.625353","192.168.2.2","192.168.1.2","TCP","66","185344","5001  >  47916 [ACK] Seq=1 Ack=78193 Win=185344 Len=0 TSval=550543903 TSecr=455765242"
"75","0.649861","192.168.2.2","192.168.1.2","TCP","66","185344","5001  >  47916 [ACK] Seq=1 Ack=81089 Win=185344 Len=0 TSval=550543927 TSecr=455765242"
"77","0.674435","192.168.2.2","192.168.1.2","TCP","66","185344","5001  >  47916 [ACK] Seq=1 Ack=83985 Win=185344 Len=0 TSval=550543952 TSecr=455765242"
"79","0.697887","192.168.2.2","192.168.1.2","TCP","66","185344","5001  >  47916 [ACK] Seq=1 Ack=86881 Win=185344 Len=0 TSval=550543975 TSecr=455765242"
"81","0.722410","192.168.2.2","192.168.1.2","TCP","66","185344","5001  >  47916 [ACK] Seq=1 Ack=89777 Win=185344 Len=0 TSval=550544000 TSecr=455765243"
"83","0.746350","192.168.2.2","192.168.1.2","TCP","66","185344","5001  >  47916 [ACK] Seq=1 Ack=92673 Win=185344 Len=0 TSval=550544024 TSecr=455765244"
"85","0.770640","192.168.2.2","192.168.1.2","TCP","66","185344","5001  >  47916 [ACK] Seq=1 Ack=95569 Win=185344 Len=0 TSval=550544048 TSecr=455765315"
"88","0.795002","192.168.2.2","192.168.1.2","TCP","66","185344","5001  >  47916 [ACK] Seq=1 Ack=98465 Win=185344 Len=0 TSval=550544072 TSecr=455765315"
"90","0.819456","192.168.2.2","192.168.1.2","TCP","78","185344","[TCP Dup ACK 88#1] 5001  >  47916 [ACK] Seq=1 Ack=98465 Win=185344 Len=0 TSval=550544097 TSecr=455765315 SLE=101361 SRE=104257"
"94","0.843986","192.168.2.2","192.168.1.2","TCP","86","185344","[TCP Dup ACK 88#2] 5001  >  47916 [ACK] Seq=1 Ack=98465 Win=185344 Len=0 TSval=550544121 TSecr=455765315 SLE=107153 SRE=110049 SLE=101361 SRE=104257"
"96","0.867546","192.168.2.2","192.168.1.2","TCP","94","185344","[TCP Dup ACK 88#3] 5001  >  47916 [ACK] Seq=1 Ack=98465 Win=185344 Len=0 TSval=550544145 TSecr=455765315 SLE=112945 SRE=115841 SLE=107153 SRE=110049 SLE=101361 SRE=104257"
"99","0.892024","192.168.2.2","192.168.1.2","TCP","94","185344","[TCP Dup ACK 88#4] 5001  >  47916 [ACK] Seq=1 Ack=98465 Win=185344 Len=0 TSval=550544169 TSecr=455765315 SLE=112945 SRE=118737 SLE=107153 SRE=110049 SLE=101361 SRE=104257"
"101","0.916140","192.168.2.2","192.168.1.2","TCP","94","185344","[TCP Dup ACK 88#5] 5001  >  47916 [ACK] Seq=1 Ack=98465 Win=185344 Len=0 TSval=550544193 TSecr=455765315 SLE=121633 SRE=124529 SLE=112945 SRE=118737 SLE=107153 SRE=110049"
"103","0.940141","192.168.2.2","192.168.1.2","TCP","94","185344","[TCP Dup ACK 88#6] 5001  >  47916 [ACK] Seq=1 Ack=98465 Win=185344 Len=0 TSval=550544217 TSecr=455765315 SLE=127425 SRE=130321 SLE=121633 SRE=124529 SLE=112945 SRE=118737"
"106","0.964511","192.168.2.2","192.168.1.2","TCP","94","185344","[TCP Dup ACK 88#7] 5001  >  47916 [ACK] Seq=1 Ack=98465 Win=185344 Len=0 TSval=550544242 TSecr=455765315 SLE=133217 SRE=136113 SLE=127425 SRE=130321 SLE=121633 SRE=124529"
"107","0.988941","192.168.2.2","192.168.1.2","TCP","94","185344","[TCP Dup ACK 88#8] 5001  >  47916 [ACK] Seq=1 Ack=98465 Win=185344 Len=0 TSval=550544266 TSecr=455765315 SLE=139009 SRE=141905 SLE=133217 SRE=136113 SLE=127425 SRE=130321"
"111","1.012793","192.168.2.2","192.168.1.2","TCP","94","185344","[TCP Dup ACK 88#9] 5001  >  47916 [ACK] Seq=1 Ack=98465 Win=185344 Len=0 TSval=550544290 TSecr=455765315 SLE=139009 SRE=144801 SLE=133217 SRE=136113 SLE=127425 SRE=130321"
"114","1.037999","192.168.2.2","192.168.1.2","TCP","94","185344","[TCP Dup ACK 88#10] 5001  >  47916 [ACK] Seq=1 Ack=98465 Win=185344 Len=0 TSval=550544315 TSecr=455765315 SLE=147697 SRE=150593 SLE=139009 SRE=144801 SLE=133217 SRE=136113"
"117","1.061245","192.168.2.2","192.168.1.2","TCP","94","185344","[TCP Dup ACK 88#11] 5001  >  47916 [ACK] Seq=1 Ack=98465 Win=185344 Len=0 TSval=550544338 TSecr=455765315 SLE=147697 SRE=153489 SLE=139009 SRE=144801 SLE=133217 SRE=136113"
"120","1.086024","192.168.2.2","192.168.1.2","TCP","94","185344","[TCP Dup ACK 88#12] 5001  >  47916 [ACK] Seq=1 Ack=98465 Win=185344 Len=0 TSval=550544363 TSecr=455765315 SLE=147697 SRE=156385 SLE=139009 SRE=144801 SLE=133217 SRE=136113"
"122","1.109710","192.168.2.2","192.168.1.2","TCP","94","185344","[TCP Dup ACK 88#13] 5001  >  47916 [ACK] Seq=1 Ack=98465 Win=185344 Len=0 TSval=550544387 TSecr=455765315 SLE=147697 SRE=159281 SLE=139009 SRE=144801 SLE=133217 SRE=136113"
"124","1.134033","192.168.2.2","192.168.1.2","TCP","94","185344","[TCP Dup ACK 88#14] 5001  >  47916 [ACK] Seq=1 Ack=98465 Win=185344 Len=0 TSval=550544411 TSecr=455765315 SLE=147697 SRE=162177 SLE=139009 SRE=144801 SLE=133217 SRE=136113"
"127","1.158153","192.168.2.2","192.168.1.2","TCP","94","185344","[TCP Dup ACK 88#15] 5001  >  47916 [ACK] Seq=1 Ack=98465 Win=185344 Len=0 TSval=550544435 TSecr=455765315 SLE=147697 SRE=165073 SLE=139009 SRE=144801 SLE=133217 SRE=136113"
"129","1.182373","192.168.2.2","192.168.1.2","TCP","94","185344","[TCP Dup ACK 88#16] 5001  >  47916 [ACK] Seq=1 Ack=98465 Win=185344 Len=0 TSval=550544459 TSecr=455765315 SLE=147697 SRE=167969 SLE=139009 SRE=144801 SLE=133217 SRE=136113"
"131","1.207156","192.168.2.2","192.168.1.2","TCP","94","185344","[TCP Dup ACK 88#17] 5001  >  47916 [ACK] Seq=1 Ack=98465 Win=185344 Len=0 TSval=550544484 TSecr=455765315 SLE=147697 SRE=170865 SLE=139009 SRE=144801 SLE=133217 SRE=136113"
"133","1.231013","192.168.2.2","192.168.1.2","TCP","94","185344","[TCP Dup ACK 88#18] 5001  >  47916 [ACK] Seq=1 Ack=98465 Win=185344 Len=0 TSval=550544508 TSecr=455765315 SLE=147697 SRE=173761 SLE=139009 SRE=144801 SLE=133217 SRE=136113"
"135","1.255583","192.168.2.2","192.168.1.2","TCP","94","185344","[TCP Dup ACK 88#19] 5001  >  47916 [ACK] Seq=1 Ack=98465 Win=185344 Len=0 TSval=550544533 TSecr=455765315 SLE=147697 SRE=176657 SLE=139009 SRE=144801 SLE=133217 SRE=136113"
"137","1.280073","192.168.2.2","192.168.1.2","TCP","94","185344","[TCP Dup ACK 88#20] 5001  >  47916 [ACK] Seq=1 Ack=98465 Win=185344 Len=0 TSval=550544557 TSecr=455765315 SLE=147697 SRE=179553 SLE=139009 SRE=144801 SLE=133217 SRE=136113"
"139","1.303661","192.168.2.2","192.168.1.2","TCP","94","179712","5001  >  47916 [ACK] Seq=1 Ack=104257 Win=179712 Len=0 TSval=550544581 TSecr=455765812 SLE=147697 SRE=179553 SLE=139009 SRE=144801 SLE=133217 SRE=136113"
"143","1.328073","192.168.2.2","192.168.1.2","TCP","94","178688","5001  >  47916 [ACK] Seq=1 Ack=105705 Win=178688 Len=0 TSval=550544605 TSecr=455765836 SLE=147697 SRE=179553 SLE=139009 SRE=144801 SLE=133217 SRE=136113"
"145","1.339900","192.168.2.2","192.168.1.2","TCP","94","174592","5001  >  47916 [ACK] Seq=1 Ack=110049 Win=174592 Len=0 TSval=550544617 TSecr=455765860 SLE=147697 SRE=179553 SLE=139009 SRE=144801 SLE=133217 SRE=136113"
"147","1.352623","192.168.2.2","192.168.1.2","TCP","94","174592","[TCP Dup ACK 145#1] 5001  >  47916 [ACK] Seq=1 Ack=110049 Win=174592 Len=0 TSval=550544630 TSecr=455765860 SLE=111497 SRE=112945 SLE=147697 SRE=179553 SLE=139009 SRE=144801"
"149","1.364317","192.168.2.2","192.168.1.2","TCP","94","174592","[TCP Dup ACK 145#2] 5001  >  47916 [ACK] Seq=1 Ack=110049 Win=174592 Len=0 TSval=550544641 TSecr=455765860 SLE=118737 SRE=120185 SLE=111497 SRE=112945 SLE=147697 SRE=179553"
"151","1.377066","192.168.2.2","192.168.1.2","TCP","94","174592","[TCP Dup ACK 145#3] 5001  >  47916 [ACK] Seq=1 Ack=110049 Win=174592 Len=0 TSval=550544654 TSecr=455765860 SLE=118737 SRE=121633 SLE=111497 SRE=112945 SLE=147697 SRE=179553"
"153","1.388843","192.168.2.2","192.168.1.2","TCP","94","174592","[TCP Dup ACK 145#4] 5001  >  47916 [ACK] Seq=1 Ack=110049 Win=174592 Len=0 TSval=550544666 TSecr=455765860 SLE=125977 SRE=127425 SLE=118737 SRE=121633 SLE=111497 SRE=112945"
"155","1.400643","192.168.2.2","192.168.1.2","TCP","94","174592","[TCP Dup ACK 145#5] 5001  >  47916 [ACK] Seq=1 Ack=110049 Win=174592 Len=0 TSval=550544678 TSecr=455765860 SLE=130321 SRE=131769 SLE=125977 SRE=127425 SLE=118737 SRE=121633"
"157","1.412499","192.168.2.2","192.168.1.2","TCP","94","174592","[TCP Dup ACK 145#6] 5001  >  47916 [ACK] Seq=1 Ack=110049 Win=174592 Len=0 TSval=550544689 TSecr=455765860 SLE=130321 SRE=133217 SLE=125977 SRE=127425 SLE=118737 SRE=121633"
"159","1.425124","192.168.2.2","192.168.1.2","TCP","94","174592","[TCP Dup ACK 145#7] 5001  >  47916 [ACK] Seq=1 Ack=110049 Win=174592 Len=0 TSval=550544702 TSecr=455765860 SLE=137561 SRE=139009 SLE=130321 SRE=133217 SLE=125977 SRE=127425"
"161","1.436730","192.168.2.2","192.168.1.2","TCP","94","174592","[TCP Dup ACK 145#8] 5001  >  47916 [ACK] Seq=1 Ack=110049 Win=174592 Len=0 TSval=550544714 TSecr=455765860 SLE=146249 SRE=147697 SLE=137561 SRE=139009 SLE=130321 SRE=133217"
"163","1.449629","192.168.2.2","192.168.1.2","TCP","94","174592","[TCP Dup ACK 145#9] 5001  >  47916 [ACK] Seq=1 Ack=110049 Win=174592 Len=0 TSval=550544726 TSecr=455765860 SLE=181001 SRE=183897 SLE=146249 SRE=147697 SLE=137561 SRE=139009"
"166","1.473238","192.168.2.2","192.168.1.2","TCP","94","174592","[TCP Dup ACK 145#10] 5001  >  47916 [ACK] Seq=1 Ack=110049 Win=174592 Len=0 TSval=550544750 TSecr=455765860 SLE=181001 SRE=186793 SLE=146249 SRE=147697 SLE=137561 SRE=139009"
"168","1.497275","192.168.2.2","192.168.1.2","TCP","94","174592","[TCP Dup ACK 145#11] 5001  >  47916 [ACK] Seq=1 Ack=110049 Win=174592 Len=0 TSval=550544774 TSecr=455765860 SLE=181001 SRE=189689 SLE=146249 SRE=147697 SLE=137561 SRE=139009"
"170","1.521730","192.168.2.2","192.168.1.2","TCP","94","174592","[TCP Dup ACK 145#12] 5001  >  47916 [ACK] Seq=1 Ack=110049 Win=174592 Len=0 TSval=550544799 TSecr=455765860 SLE=181001 SRE=192585 SLE=146249 SRE=147697 SLE=137561 SRE=139009"
"172","1.545722","192.168.2.2","192.168.1.2","TCP","94","174592","[TCP Dup ACK 145#13] 5001  >  47916 [ACK] Seq=1 Ack=110049 Win=174592 Len=0 TSval=550544823 TSecr=455765860 SLE=181001 SRE=195481 SLE=146249 SRE=147697 SLE=137561 SRE=139009"
"174","1.570169","192.168.2.2","192.168.1.2","TCP","94","174592","[TCP Dup ACK 145#14] 5001  >  47916 [ACK] Seq=1 Ack=110049 Win=174592 Len=0 TSval=550544847 TSecr=455765860 SLE=181001 SRE=198377 SLE=146249 SRE=147697 SLE=137561 SRE=139009"
"176","1.594681","192.168.2.2","192.168.1.2","TCP","94","174592","[TCP Dup ACK 145#15] 5001  >  47916 [ACK] Seq=1 Ack=110049 Win=174592 Len=0 TSval=550544871 TSecr=455765860 SLE=181001 SRE=201273 SLE=146249 SRE=147697 SLE=137561 SRE=139009"
"178","1.618418","192.168.2.2","192.168.1.2","TCP","94","174592","[TCP Dup ACK 145#16] 5001  >  47916 [ACK] Seq=1 Ack=110049 Win=174592 Len=0 TSval=550544895 TSecr=455765860 SLE=181001 SRE=204169 SLE=146249 SRE=147697 SLE=137561 SRE=139009"
"180","1.642633","192.168.2.2","192.168.1.2","TCP","94","174592","[TCP Dup ACK 145#17] 5001  >  47916 [ACK] Seq=1 Ack=110049 Win=174592 Len=0 TSval=550544919 TSecr=455765860 SLE=181001 SRE=207065 SLE=146249 SRE=147697 SLE=137561 SRE=139009"
"182","1.667188","192.168.2.2","192.168.1.2","TCP","94","174592","[TCP Dup ACK 145#18] 5001  >  47916 [ACK] Seq=1 Ack=110049 Win=174592 Len=0 TSval=550544944 TSecr=455765860 SLE=181001 SRE=209961 SLE=146249 SRE=147697 SLE=137561 SRE=139009"
"184","1.691720","192.168.2.2","192.168.1.2","TCP","94","174592","[TCP Dup ACK 145#19] 5001  >  47916 [ACK] Seq=1 Ack=110049 Win=174592 Len=0 TSval=550544968 TSecr=455765860 SLE=215753 SRE=217201 SLE=181001 SRE=209961 SLE=146249 SRE=147697"
"186","1.703199","192.168.2.2","192.168.1.2","TCP","94","174592","[TCP Dup ACK 145#20] 5001  >  47916 [ACK] Seq=1 Ack=110049 Win=174592 Len=0 TSval=550544980 TSecr=455765860 SLE=215753 SRE=218649 SLE=181001 SRE=209961 SLE=146249 SRE=147697"
"188","1.716186","192.168.2.2","192.168.1.2","TCP","94","160256","5001  >  47916 [ACK] Seq=1 Ack=124529 Win=160256 Len=0 TSval=550544993 TSecr=455766345 SLE=215753 SRE=218649 SLE=181001 SRE=209961 SLE=146249 SRE=147697"
"191","1.727944","192.168.2.2","192.168.1.2","TCP","94","160256","[TCP Dup ACK 188#1] 5001  >  47916 [ACK] Seq=1 Ack=124529 Win=160256 Len=0 TSval=550545005 TSecr=455766345 SLE=215753 SRE=220097 SLE=181001 SRE=209961 SLE=146249 SRE=147697"
"193","1.739682","192.168.2.2","192.168.1.2","TCP","94","160256","[TCP Dup ACK 188#2] 5001  >  47916 [ACK] Seq=1 Ack=124529 Win=160256 Len=0 TSval=550545016 TSecr=455766345 SLE=215753 SRE=221545 SLE=181001 SRE=209961 SLE=146249 SRE=147697"
"195","1.752493","192.168.2.2","192.168.1.2","TCP","94","148992","5001  >  47916 [ACK] Seq=1 Ack=136113 Win=148992 Len=0 TSval=550545029 TSecr=455766381 SLE=215753 SRE=221545 SLE=181001 SRE=209961 SLE=146249 SRE=147697"
"197","1.763741","192.168.2.2","192.168.1.2","TCP","94","148992","[TCP Dup ACK 195#1] 5001  >  47916 [ACK] Seq=1 Ack=136113 Win=148992 Len=0 TSval=550545040 TSecr=455766381 SLE=215753 SRE=222993 SLE=181001 SRE=209961 SLE=146249 SRE=147697"
"199","1.776056","192.168.2.2","192.168.1.2","TCP","94","148992","[TCP Dup ACK 195#2] 5001  >  47916 [ACK] Seq=1 Ack=136113 Win=148992 Len=0 TSval=550545053 TSecr=455766381 SLE=215753 SRE=224441 SLE=181001 SRE=209961 SLE=146249 SRE=147697"
"201","1.787984","192.168.2.2","192.168.1.2","TCP","94","144384","5001  >  47916 [ACK] Seq=1 Ack=144801 Win=144384 Len=0 TSval=550545065 TSecr=455766417 SLE=215753 SRE=224441 SLE=181001 SRE=209961 SLE=146249 SRE=147697"
"203","1.800476","192.168.2.2","192.168.1.2","TCP","86","149504","5001  >  47916 [ACK] Seq=1 Ack=179553 Win=149504 Len=0 TSval=550545077 TSecr=455766429 SLE=215753 SRE=224441 SLE=181001 SRE=209961"
"205","1.813236","192.168.2.2","192.168.1.2","TCP","78","166400","5001  >  47916 [ACK] Seq=1 Ack=209961 Win=166400 Len=0 TSval=550545090 TSecr=455766442 SLE=215753 SRE=224441"
"209","1.824958","192.168.2.2","192.168.1.2","TCP","86","180224","[TCP Window Update] 5001  >  47916 [ACK] Seq=1 Ack=209961 Win=180224 Len=0 TSval=550545102 TSecr=455766442 SLE=225889 SRE=228785 SLE=215753 SRE=224441"
"213","1.849063","192.168.2.2","192.168.1.2","TCP","86","180224","[TCP Dup ACK 205#1] 5001  >  47916 [ACK] Seq=1 Ack=209961 Win=180224 Len=0 TSval=550545126 TSecr=455766442 SLE=225889 SRE=231681 SLE=215753 SRE=224441"
"215","1.873016","192.168.2.2","192.168.1.2","TCP","86","180224","[TCP Dup ACK 205#2] 5001  >  47916 [ACK] Seq=1 Ack=209961 Win=180224 Len=0 TSval=550545150 TSecr=455766442 SLE=225889 SRE=234577 SLE=215753 SRE=224441"
"217","1.897486","192.168.2.2","192.168.1.2","TCP","86","180224","[TCP Dup ACK 205#3] 5001  >  47916 [ACK] Seq=1 Ack=209961 Win=180224 Len=0 TSval=550545174 TSecr=455766442 SLE=225889 SRE=237473 SLE=215753 SRE=224441"
"219","1.921270","192.168.2.2","192.168.1.2","TCP","86","180224","[TCP Dup ACK 205#4] 5001  >  47916 [ACK] Seq=1 Ack=209961 Win=180224 Len=0 TSval=550545198 TSecr=455766442 SLE=225889 SRE=240369 SLE=215753 SRE=224441"
"221","1.945490","192.168.2.2","192.168.1.2","TCP","86","180224","[TCP Dup ACK 205#5] 5001  >  47916 [ACK] Seq=1 Ack=209961 Win=180224 Len=0 TSval=550545222 TSecr=455766442 SLE=225889 SRE=243265 SLE=215753 SRE=224441"
"223","1.970022","192.168.2.2","192.168.1.2","TCP","86","180224","[TCP Dup ACK 205#6] 5001  >  47916 [ACK] Seq=1 Ack=209961 Win=180224 Len=0 TSval=550545247 TSecr=455766442 SLE=225889 SRE=246161 SLE=215753 SRE=224441"
"224","1.994523","192.168.2.2","192.168.1.2","TCP","86","180224","[TCP Dup ACK 205#7] 5001  >  47916 [ACK] Seq=1 Ack=209961 Win=180224 Len=0 TSval=550545271 TSecr=455766442 SLE=225889 SRE=249057 SLE=215753 SRE=224441"
"227","2.018143","192.168.2.2","192.168.1.2","TCP","86","180224","[TCP Dup ACK 205#8] 5001  >  47916 [ACK] Seq=1 Ack=209961 Win=180224 Len=0 TSval=550545295 TSecr=455766442 SLE=225889 SRE=251953 SLE=215753 SRE=224441"
"229","2.042368","192.168.2.2","192.168.1.2","TCP","86","179200","5001  >  47916 [ACK] Seq=1 Ack=211409 Win=179200 Len=0 TSval=550545319 TSecr=455766683 SLE=225889 SRE=251953 SLE=215753 SRE=224441"
"231","2.055296","192.168.2.2","192.168.1.2","TCP","86","178176","5001  >  47916 [ACK] Seq=1 Ack=212857 Win=178176 Len=0 TSval=550545332 TSecr=455766695 SLE=225889 SRE=251953 SLE=215753 SRE=224441"
"233","2.067037","192.168.2.2","192.168.1.2","TCP","78","167424","5001  >  47916 [ACK] Seq=1 Ack=224441 Win=167424 Len=0 TSval=550545344 TSecr=455766708 SLE=225889 SRE=251953"
"235","2.091577","192.168.2.2","192.168.1.2","TCP","86","172544","[TCP Window Update] 5001  >  47916 [ACK] Seq=1 Ack=224441 Win=172544 Len=0 TSval=550545368 TSecr=455766708 SLE=253401 SRE=254849 SLE=225889 SRE=251953"
"237","2.102876","192.168.2.2","192.168.1.2","TCP","86","172544","[TCP Dup ACK 233#1] 5001  >  47916 [ACK] Seq=1 Ack=224441 Win=172544 Len=0 TSval=550545379 TSecr=455766708 SLE=253401 SRE=256297 SLE=225889 SRE=251953"
"239","2.115121","192.168.2.2","192.168.1.2","TCP","86","172544","[TCP Dup ACK 233#2] 5001  >  47916 [ACK] Seq=1 Ack=224441 Win=172544 Len=0 TSval=550545392 TSecr=455766708 SLE=253401 SRE=259193 SLE=225889 SRE=251953"
"242","2.139639","192.168.2.2","192.168.1.2","TCP","86","172544","[TCP Dup ACK 233#3] 5001  >  47916 [ACK] Seq=1 Ack=224441 Win=172544 Len=0 TSval=550545416 TSecr=455766708 SLE=253401 SRE=260641 SLE=225889 SRE=251953"
"244","2.151605","192.168.2.2","192.168.1.2","TCP","86","172544","[TCP Dup ACK 233#4] 5001  >  47916 [ACK] Seq=1 Ack=224441 Win=172544 Len=0 TSval=550545428 TSecr=455766708 SLE=253401 SRE=262089 SLE=225889 SRE=251953"
"246","2.164045","192.168.2.2","192.168.1.2","TCP","86","172544","[TCP Dup ACK 233#5] 5001  >  47916 [ACK] Seq=1 Ack=224441 Win=172544 Len=0 TSval=550545441 TSecr=455766708 SLE=253401 SRE=264985 SLE=225889 SRE=251953"
"248","2.187642","192.168.2.2","192.168.1.2","TCP","86","172544","[TCP Dup ACK 233#6] 5001  >  47916 [ACK] Seq=1 Ack=224441 Win=172544 Len=0 TSval=550545464 TSecr=455766708 SLE=253401 SRE=266433 SLE=225889 SRE=251953"
"250","2.200321","192.168.2.2","192.168.1.2","TCP","86","172544","[TCP Dup ACK 233#7] 5001  >  47916 [ACK] Seq=1 Ack=224441 Win=172544 Len=0 TSval=550545477 TSecr=455766708 SLE=253401 SRE=267881 SLE=225889 SRE=251953"
"252","2.211885","192.168.2.2","192.168.1.2","TCP","78","165376","5001  >  47916 [ACK] Seq=1 Ack=251953 Win=165376 Len=0 TSval=550545488 TSecr=455766817 SLE=253401 SRE=267881"
"254","2.224877","192.168.2.2","192.168.1.2","TCP","78","192000","[TCP Window Update] 5001  >  47916 [ACK] Seq=1 Ack=251953 Win=192000 Len=0 TSval=550545501 TSecr=455766817 SLE=253401 SRE=270777"
"256","2.248312","192.168.2.2","192.168.1.2","TCP","78","194560","[TCP Window Update] 5001  >  47916 [ACK] Seq=1 Ack=251953 Win=194560 Len=0 TSval=550545525 TSecr=455766817 SLE=253401 SRE=272225"
"258","2.260759","192.168.2.2","192.168.1.2","TCP","78","197632","[TCP Window Update] 5001  >  47916 [ACK] Seq=1 Ack=251953 Win=197632 Len=0 TSval=550545537 TSecr=455766817 SLE=253401 SRE=273673"
"261","2.272883","192.168.2.2","192.168.1.2","TCP","78","203264","[TCP Window Update] 5001  >  47916 [ACK] Seq=1 Ack=251953 Win=203264 Len=0 TSval=550545549 TSecr=455766817 SLE=253401 SRE=276569"
"263","2.296662","192.168.2.2","192.168.1.2","TCP","78","206336","[TCP Window Update] 5001  >  47916 [ACK] Seq=1 Ack=251953 Win=206336 Len=0 TSval=550545573 TSecr=455766817 SLE=253401 SRE=278017"
"265","2.309129","192.168.2.2","192.168.1.2","TCP","78","211968","[TCP Window Update] 5001  >  47916 [ACK] Seq=1 Ack=251953 Win=211968 Len=0 TSval=550545586 TSecr=455766817 SLE=253401 SRE=280913"
"268","2.333805","192.168.2.2","192.168.1.2","TCP","78","217600","[TCP Window Update] 5001  >  47916 [ACK] Seq=1 Ack=251953 Win=217600 Len=0 TSval=550545610 TSecr=455766817 SLE=253401 SRE=283809"
"271","2.358084","192.168.2.2","192.168.1.2","TCP","78","220672","[TCP Window Update] 5001  >  47916 [ACK] Seq=1 Ack=251953 Win=220672 Len=0 TSval=550545634 TSecr=455766817 SLE=253401 SRE=285257"
"273","2.370875","192.168.2.2","192.168.1.2","TCP","78","223744","[TCP Window Update] 5001  >  47916 [ACK] Seq=1 Ack=251953 Win=223744 Len=0 TSval=550545647 TSecr=455766817 SLE=253401 SRE=286705"
"275","2.382805","192.168.2.2","192.168.1.2","TCP","78","229376","[TCP Window Update] 5001  >  47916 [ACK] Seq=1 Ack=251953 Win=229376 Len=0 TSval=550545659 TSecr=455766817 SLE=253401 SRE=289601"
"277","2.406457","192.168.2.2","192.168.1.2","TCP","66","232448","5001  >  47916 [ACK] Seq=1 Ack=289601 Win=232448 Len=0 TSval=550545683 TSecr=455767083"
"279","2.418868","192.168.2.2","192.168.1.2","TCP","66","235008","5001  >  47916 [ACK] Seq=1 Ack=291049 Win=235008 Len=0 TSval=550545695 TSecr=455767094"
"281","2.430691","192.168.2.2","192.168.1.2","TCP","66","241152","5001  >  47916 [ACK] Seq=1 Ack=293945 Win=241152 Len=0 TSval=550545707 TSecr=455767107"
"283","2.455144","192.168.2.2","192.168.1.2","TCP","66","243712","5001  >  47916 [ACK] Seq=1 Ack=295393 Win=243712 Len=0 TSval=550545731 TSecr=455767131"
"285","2.467026","192.168.2.2","192.168.1.2","TCP","66","246784","5001  >  47916 [ACK] Seq=1 Ack=296841 Win=246784 Len=0 TSval=550545743 TSecr=455767143"
"287","2.479662","192.168.2.2","192.168.1.2","TCP","66","252416","5001  >  47916 [ACK] Seq=1 Ack=299737 Win=252416 Len=0 TSval=550545756 TSecr=455767156"
"289","2.504106","192.168.2.2","192.168.1.2","TCP","66","255488","5001  >  47916 [ACK] Seq=1 Ack=301185 Win=255488 Len=0 TSval=550545780 TSecr=455767179"
"291","2.515947","192.168.2.2","192.168.1.2","TCP","66","258560","5001  >  47916 [ACK] Seq=1 Ack=302633 Win=258560 Len=0 TSval=550545792 TSecr=455767192"
"293","2.527763","192.168.2.2","192.168.1.2","TCP","66","264192","5001  >  47916 [ACK] Seq=1 Ack=305529 Win=264192 Len=0 TSval=550545804 TSecr=455767203"
"295","2.551797","192.168.2.2","192.168.1.2","TCP","66","269824","5001  >  47916 [ACK] Seq=1 Ack=308425 Win=269824 Len=0 TSval=550545828 TSecr=455767216"
"297","2.576014","192.168.2.2","192.168.1.2","TCP","66","272896","5001  >  47916 [ACK] Seq=1 Ack=309873 Win=272896 Len=0 TSval=550545852 TSecr=455767240"
"299","2.588134","192.168.2.2","192.168.1.2","TCP","66","275968","5001  >  47916 [ACK] Seq=1 Ack=311321 Win=275968 Len=0 TSval=550545864 TSecr=455767252"
"301","2.600484","192.168.2.2","192.168.1.2","TCP","66","281600","5001  >  47916 [ACK] Seq=1 Ack=314217 Win=281600 Len=0 TSval=550545877 TSecr=455767264"
"303","2.624642","192.168.2.2","192.168.1.2","TCP","66","284672","5001  >  47916 [ACK] Seq=1 Ack=315665 Win=284672 Len=0 TSval=550545901 TSecr=455767288"
"305","2.637480","192.168.2.2","192.168.1.2","TCP","66","290304","5001  >  47916 [ACK] Seq=1 Ack=318561 Win=290304 Len=0 TSval=550545914 TSecr=455767301"
"307","2.660978","192.168.2.2","192.168.1.2","TCP","66","293376","5001  >  47916 [ACK] Seq=1 Ack=320009 Win=293376 Len=0 TSval=550545937 TSecr=455767325"
"309","2.673708","192.168.2.2","192.168.1.2","TCP","66","295936","5001  >  47916 [ACK] Seq=1 Ack=321457 Win=295936 Len=0 TSval=550545950 TSecr=455767325"
"311","2.685441","192.168.2.2","192.168.1.2","TCP","66","299008","5001  >  47916 [ACK] Seq=1 Ack=322905 Win=299008 Len=0 TSval=550545962 TSecr=455767350"
"313","2.697178","192.168.2.2","192.168.1.2","TCP","66","302080","5001  >  47916 [ACK] Seq=1 Ack=324353 Win=302080 Len=0 TSval=550545973 TSecr=455767362"
"315","2.709980","192.168.2.2","192.168.1.2","TCP","66","307712","5001  >  47916 [ACK] Seq=1 Ack=327249 Win=307712 Len=0 TSval=550545986 TSecr=455767374"
"317","2.733518","192.168.2.2","192.168.1.2","TCP","66","310272","5001  >  47916 [ACK] Seq=1 Ack=328697 Win=310272 Len=0 TSval=550546010 TSecr=455767398"
"319","2.745960","192.168.2.2","192.168.1.2","TCP","66","313344","5001  >  47916 [ACK] Seq=1 Ack=330145 Win=313344 Len=0 TSval=550546022 TSecr=455767410"
"321","2.757973","192.168.2.2","192.168.1.2","TCP","66","318976","5001  >  47916 [ACK] Seq=1 Ack=333041 Win=318976 Len=0 TSval=550546034 TSecr=455767422"
"323","2.782490","192.168.2.2","192.168.1.2","TCP","66","322048","5001  >  47916 [ACK] Seq=1 Ack=334489 Win=322048 Len=0 TSval=550546059 TSecr=455767447"
"325","2.794058","192.168.2.2","192.168.1.2","TCP","66","325120","5001  >  47916 [ACK] Seq=1 Ack=335937 Win=325120 Len=0 TSval=550546070 TSecr=455767458"
"327","2.806202","192.168.2.2","192.168.1.2","TCP","66","330752","5001  >  47916 [ACK] Seq=1 Ack=338833 Win=330752 Len=0 TSval=550546082 TSecr=455767471"
"329","2.830580","192.168.2.2","192.168.1.2","TCP","66","333824","5001  >  47916 [ACK] Seq=1 Ack=340281 Win=333824 Len=0 TSval=550546107 TSecr=455767495"
"331","2.843284","192.168.2.2","192.168.1.2","TCP","66","336384","5001  >  47916 [ACK] Seq=1 Ack=341729 Win=336384 Len=0 TSval=550546119 TSecr=455767507"
"333","2.855023","192.168.2.2","192.168.1.2","TCP","66","342528","5001  >  47916 [ACK] Seq=1 Ack=344625 Win=342528 Len=0 TSval=550546131 TSecr=455767519"
"335","2.879534","192.168.2.2","192.168.1.2","TCP","66","348160","5001  >  47916 [ACK] Seq=1 Ack=347521 Win=348160 Len=0 TSval=550546156 TSecr=455767543"
"337","2.904041","192.168.2.2","192.168.1.2","TCP","66","353792","5001  >  47916 [ACK] Seq=1 Ack=350417 Win=353792 Len=0 TSval=550546180 TSecr=455767567"
"339","2.927566","192.168.2.2","192.168.1.2","TCP","66","356864","5001  >  47916 [ACK] Seq=1 Ack=351865 Win=356864 Len=0 TSval=550546204 TSecr=455767579"
"341","2.939402","192.168.2.2","192.168.1.2","TCP","66","362496","5001  >  47916 [ACK] Seq=1 Ack=354761 Win=362496 Len=0 TSval=550546216 TSecr=455767592"
"343","2.963770","192.168.2.2","192.168.1.2","TCP","66","365568","5001  >  47916 [ACK] Seq=1 Ack=356209 Win=365568 Len=0 TSval=550546240 TSecr=455767616"
"345","2.976534","192.168.2.2","192.168.1.2","TCP","66","371200","5001  >  47916 [ACK] Seq=1 Ack=359105 Win=371200 Len=0 TSval=550546253 TSecr=455767629"
"347","3.000049","192.168.2.2","192.168.1.2","TCP","66","374272","5001  >  47916 [ACK] Seq=1 Ack=360553 Win=374272 Len=0 TSval=550546276 TSecr=455767652"
"350","3.012068","192.168.2.2","192.168.1.2","TCP","66","377344","5001  >  47916 [ACK] Seq=1 Ack=362001 Win=377344 Len=0 TSval=550546288 TSecr=455767665"
"352","3.024522","192.168.2.2","192.168.1.2","TCP","66","379904","5001  >  47916 [ACK] Seq=1 Ack=363449 Win=379904 Len=0 TSval=550546301 TSecr=455767677"
"354","3.036346","192.168.2.2","192.168.1.2","TCP","66","382976","5001  >  47916 [ACK] Seq=1 Ack=364897 Win=382976 Len=0 TSval=550546312 TSecr=455767688"
"356","3.049095","192.168.2.2","192.168.1.2","TCP","66","388608","5001  >  47916 [ACK] Seq=1 Ack=367793 Win=388608 Len=0 TSval=550546325 TSecr=455767701"
"358","3.072866","192.168.2.2","192.168.1.2","TCP","66","394752","5001  >  47916 [ACK] Seq=1 Ack=370689 Win=394752 Len=0 TSval=550546349 TSecr=455767725"
"360","3.097058","192.168.2.2","192.168.1.2","TCP","66","397312","5001  >  47916 [ACK] Seq=1 Ack=372137 Win=397312 Len=0 TSval=550546373 TSecr=455767737"
"362","3.109886","192.168.2.2","192.168.1.2","TCP","66","402944","5001  >  47916 [ACK] Seq=1 Ack=375033 Win=402944 Len=0 TSval=550546386 TSecr=455767749"
"364","3.133381","192.168.2.2","192.168.1.2","TCP","66","406016","5001  >  47916 [ACK] Seq=1 Ack=376481 Win=406016 Len=0 TSval=550546409 TSecr=455767774"
"366","3.146147","192.168.2.2","192.168.1.2","TCP","66","409088","5001  >  47916 [ACK] Seq=1 Ack=377929 Win=409088 Len=0 TSval=550546422 TSecr=455767785"
"368","3.157857","192.168.2.2","192.168.1.2","TCP","66","414720","5001  >  47916 [ACK] Seq=1 Ack=380825 Win=414720 Len=0 TSval=550546434 TSecr=455767797"
"370","3.181696","192.168.2.2","192.168.1.2","TCP","66","417792","5001  >  47916 [ACK] Seq=1 Ack=382273 Win=417792 Len=0 TSval=550546458 TSecr=455767822"
"372","3.194180","192.168.2.2","192.168.1.2","TCP","66","420352","5001  >  47916 [ACK] Seq=1 Ack=383721 Win=420352 Len=0 TSval=550546470 TSecr=455767834"
"374","3.205886","192.168.2.2","192.168.1.2","TCP","66","423424","5001  >  47916 [ACK] Seq=1 Ack=385169 Win=423424 Len=0 TSval=550546482 TSecr=455767846"
"376","3.218575","192.168.2.2","192.168.1.2","TCP","66","429056","5001  >  47916 [ACK] Seq=1 Ack=388065 Win=429056 Len=0 TSval=550546495 TSecr=455767871"
"378","3.243171","192.168.2.2","192.168.1.2","TCP","66","435200","5001  >  47916 [ACK] Seq=1 Ack=390961 Win=435200 Len=0 TSval=550546519 TSecr=455767895"
"380","3.266420","192.168.2.2","192.168.1.2","TCP","66","440832","5001  >  47916 [ACK] Seq=1 Ack=393857 Win=440832 Len=0 TSval=550546542 TSecr=455767919"
"382","3.291157","192.168.2.2","192.168.1.2","TCP","66","446464","5001  >  47916 [ACK] Seq=1 Ack=396753 Win=446464 Len=0 TSval=550546567 TSecr=455767931"
"384","3.315647","192.168.2.2","192.168.1.2","TCP","66","452608","5001  >  47916 [ACK] Seq=1 Ack=399649 Win=452608 Len=0 TSval=550546592 TSecr=455767955"
"386","3.339109","192.168.2.2","192.168.1.2","TCP","66","458240","5001  >  47916 [ACK] Seq=1 Ack=402545 Win=458240 Len=0 TSval=550546615 TSecr=455767968"
"388","3.363321","192.168.2.2","192.168.1.2","TCP","66","461312","5001  >  47916 [ACK] Seq=1 Ack=403993 Win=461312 Len=0 TSval=550546639 TSecr=455767991"
"390","3.375431","192.168.2.2","192.168.1.2","TCP","66","463872","5001  >  47916 [ACK] Seq=1 Ack=405441 Win=463872 Len=0 TSval=550546651 TSecr=455768003"
"392","3.388104","192.168.2.2","192.168.1.2","TCP","66","466944","5001  >  47916 [ACK] Seq=1 Ack=406889 Win=466944 Len=0 TSval=550546664 TSecr=455768016"
"394","3.399910","192.168.2.2","192.168.1.2","TCP","66","470016","5001  >  47916 [ACK] Seq=1 Ack=408337 Win=470016 Len=0 TSval=550546676 TSecr=455768027"
"396","3.411912","192.168.2.2","192.168.1.2","TCP","66","475648","5001  >  47916 [ACK] Seq=1 Ack=411233 Win=475648 Len=0 TSval=550546688 TSecr=455768040"
"398","3.437173","192.168.2.2","192.168.1.2","TCP","66","481280","5001  >  47916 [ACK] Seq=1 Ack=414129 Win=481280 Len=0 TSval=550546713 TSecr=455768064"
"400","3.460208","192.168.2.2","192.168.1.2","TCP","66","484352","5001  >  47916 [ACK] Seq=1 Ack=415577 Win=484352 Len=0 TSval=550546736 TSecr=455768088"
"402","3.472392","192.168.2.2","192.168.1.2","TCP","66","489984","5001  >  47916 [ACK] Seq=1 Ack=418473 Win=489984 Len=0 TSval=550546748 TSecr=455768101"
"404","3.496933","192.168.2.2","192.168.1.2","TCP","66","493056","5001  >  47916 [ACK] Seq=1 Ack=419921 Win=493056 Len=0 TSval=550546773 TSecr=455768124"
"406","3.509670","192.168.2.2","192.168.1.2","TCP","66","495616","5001  >  47916 [ACK] Seq=1 Ack=421369 Win=495616 Len=0 TSval=550546785 TSecr=455768137"
"408","3.520757","192.168.2.2","192.168.1.2","TCP","66","501760","5001  >  47916 [ACK] Seq=1 Ack=424265 Win=501760 Len=0 TSval=550546797 TSecr=455768149"
"410","3.545039","192.168.2.2","192.168.1.2","TCP","66","507392","5001  >  47916 [ACK] Seq=1 Ack=427161 Win=507392 Len=0 TSval=550546821 TSecr=455768173"
"412","3.569220","192.168.2.2","192.168.1.2","TCP","66","510464","5001  >  47916 [ACK] Seq=1 Ack=428609 Win=510464 Len=0 TSval=550546845 TSecr=455768185"
"414","3.582288","192.168.2.2","192.168.1.2","TCP","66","513024","5001  >  47916 [ACK] Seq=1 Ack=430057 Win=513024 Len=0 TSval=550546858 TSecr=455768197"
"416","3.593983","192.168.2.2","192.168.1.2","TCP","66","519168","5001  >  47916 [ACK] Seq=1 Ack=432953 Win=519168 Len=0 TSval=550546870 TSecr=455768210"
"418","3.617659","192.168.2.2","192.168.1.2","TCP","66","524800","5001  >  47916 [ACK] Seq=1 Ack=435849 Win=524800 Len=0 TSval=550546893 TSecr=455768234"
"420","3.642017","192.168.2.2","192.168.1.2","TCP","66","530432","5001  >  47916 [ACK] Seq=1 Ack=438745 Win=530432 Len=0 TSval=550546918 TSecr=455768257"
"422","3.666590","192.168.2.2","192.168.1.2","TCP","66","536576","5001  >  47916 [ACK] Seq=1 Ack=441641 Win=536576 Len=0 TSval=550546942 TSecr=455768282"
"424","3.690342","192.168.2.2","192.168.1.2","TCP","66","542208","5001  >  47916 [ACK] Seq=1 Ack=444537 Win=542208 Len=0 TSval=550546966 TSecr=455768307"
"426","3.714804","192.168.2.2","192.168.1.2","TCP","66","547840","5001  >  47916 [ACK] Seq=1 Ack=447433 Win=547840 Len=0 TSval=550546991 TSecr=455768330"
"428","3.740011","192.168.2.2","192.168.1.2","TCP","66","550912","5001  >  47916 [ACK] Seq=1 Ack=448881 Win=550912 Len=0 TSval=550547016 TSecr=455768354"
"430","3.751754","192.168.2.2","192.168.1.2","TCP","66","553984","5001  >  47916 [ACK] Seq=1 Ack=450329 Win=553984 Len=0 TSval=550547027 TSecr=455768366"
"432","3.763008","192.168.2.2","192.168.1.2","TCP","66","556032","5001  >  47916 [ACK] Seq=1 Ack=451777 Win=556032 Len=0 TSval=550547039 TSecr=455768379"
"434","3.775291","192.168.2.2","192.168.1.2","TCP","66","556032","5001  >  47916 [ACK] Seq=1 Ack=453225 Win=556032 Len=0 TSval=550547051 TSecr=455768391"
"436","3.787244","192.168.2.2","192.168.1.2","TCP","66","556032","5001  >  47916 [ACK] Seq=1 Ack=456121 Win=556032 Len=0 TSval=550547063 TSecr=455768403"
"438","3.811542","192.168.2.2","192.168.1.2","TCP","66","556032","5001  >  47916 [ACK] Seq=1 Ack=459017 Win=556032 Len=0 TSval=550547087 TSecr=455768428"
"440","3.835680","192.168.2.2","192.168.1.2","TCP","66","556032","5001  >  47916 [ACK] Seq=1 Ack=460465 Win=556032 Len=0 TSval=550547111 TSecr=455768451"
"442","3.847889","192.168.2.2","192.168.1.2","TCP","66","556032","5001  >  47916 [ACK] Seq=1 Ack=463361 Win=556032 Len=0 TSval=550547124 TSecr=455768463"
"444","3.872015","192.168.2.2","192.168.1.2","TCP","66","556032","5001  >  47916 [ACK] Seq=1 Ack=464809 Win=556032 Len=0 TSval=550547148 TSecr=455768488"
"446","3.884319","192.168.2.2","192.168.1.2","TCP","66","556032","5001  >  47916 [ACK] Seq=1 Ack=466257 Win=556032 Len=0 TSval=550547160 TSecr=455768501"
"448","3.896351","192.168.2.2","192.168.1.2","TCP","66","556032","5001  >  47916 [ACK] Seq=1 Ack=469153 Win=556032 Len=0 TSval=550547172 TSecr=455768512"
"450","3.920465","192.168.2.2","192.168.1.2","TCP","66","556032","5001  >  47916 [ACK] Seq=1 Ack=472049 Win=556032 Len=0 TSval=550547196 TSecr=455768536"
"452","3.944815","192.168.2.2","192.168.1.2","TCP","66","556032","5001  >  47916 [ACK] Seq=1 Ack=474945 Win=556032 Len=0 TSval=550547220 TSecr=455768560"
"454","3.969337","192.168.2.2","192.168.1.2","TCP","66","556032","5001  >  47916 [ACK] Seq=1 Ack=476393 Win=556032 Len=0 TSval=550547245 TSecr=455768573"
"456","3.982111","192.168.2.2","192.168.1.2","TCP","66","556032","5001  >  47916 [ACK] Seq=1 Ack=479289 Win=556032 Len=0 TSval=550547258 TSecr=455768585"
"458","4.005531","192.168.2.2","192.168.1.2","TCP","66","556032","5001  >  47916 [ACK] Seq=1 Ack=482185 Win=556032 Len=0 TSval=550547281 TSecr=455768608"
"461","4.030089","192.168.2.2","192.168.1.2","TCP","66","556032","5001  >  47916 [ACK] Seq=1 Ack=485081 Win=556032 Len=0 TSval=550547306 TSecr=455768633"
"463","4.053700","192.168.2.2","192.168.1.2","TCP","66","556032","5001  >  47916 [ACK] Seq=1 Ack=487977 Win=556032 Len=0 TSval=550547329 TSecr=455768657"
"465","4.078074","192.168.2.2","192.168.1.2","TCP","66","556032","5001  >  47916 [ACK] Seq=1 Ack=490873 Win=556032 Len=0 TSval=550547354 TSecr=455768681"
"467","4.102647","192.168.2.2","192.168.1.2","TCP","66","556032","5001  >  47916 [ACK] Seq=1 Ack=493769 Win=556032 Len=0 TSval=550547378 TSecr=455768706"
"469","4.138906","192.168.2.2","192.168.1.2","TCP","66","556032","5001  >  47916 [ACK] Seq=1 Ack=496665 Win=556032 Len=0 TSval=550547414 TSecr=455768731"
"471","4.163390","192.168.2.2","192.168.1.2","TCP","66","556032","5001  >  47916 [ACK] Seq=1 Ack=499561 Win=556032 Len=0 TSval=550547439 TSecr=455768754"
"473","4.175153","192.168.2.2","192.168.1.2","TCP","66","556032","5001  >  47916 [ACK] Seq=1 Ack=502457 Win=556032 Len=0 TSval=550547451 TSecr=455768778"
"475","4.199645","192.168.2.2","192.168.1.2","TCP","66","556032","5001  >  47916 [ACK] Seq=1 Ack=505353 Win=556032 Len=0 TSval=550547475 TSecr=455768802"
"477","4.235857","192.168.2.2","192.168.1.2","TCP","66","556032","5001  >  47916 [ACK] Seq=1 Ack=509697 Win=556032 Len=0 TSval=550547511 TSecr=455768826"
"479","4.272152","192.168.2.2","192.168.1.2","TCP","66","556032","5001  >  47916 [ACK] Seq=1 Ack=512593 Win=556032 Len=0 TSval=550547548 TSecr=455768863"
"481","4.284000","192.168.2.2","192.168.1.2","TCP","66","556032","5001  >  47916 [ACK] Seq=1 Ack=515489 Win=556032 Len=0 TSval=550547559 TSecr=455768887"
"483","4.308033","192.168.2.2","192.168.1.2","TCP","66","556032","5001  >  47916 [ACK] Seq=1 Ack=518385 Win=556032 Len=0 TSval=550547583 TSecr=455768911"
"485","4.332919","192.168.2.2","192.168.1.2","TCP","66","556032","5001  >  47916 [ACK] Seq=1 Ack=521281 Win=556032 Len=0 TSval=550547608 TSecr=455768935"
"488","4.357456","192.168.2.2","192.168.1.2","TCP","66","556032","5001  >  47916 [ACK] Seq=1 Ack=524177 Win=556032 Len=0 TSval=550547633 TSecr=455768960"
"490","4.380810","192.168.2.2","192.168.1.2","TCP","66","556032","5001  >  47916 [ACK] Seq=1 Ack=527073 Win=556032 Len=0 TSval=550547656 TSecr=455768973"
"492","4.405402","192.168.2.2","192.168.1.2","TCP","66","556032","5001  >  47916 [ACK] Seq=1 Ack=529969 Win=556032 Len=0 TSval=550547681 TSecr=455768996"
"494","4.429163","192.168.2.2","192.168.1.2","TCP","66","556032","5001  >  47916 [ACK] Seq=1 Ack=532865 Win=556032 Len=0 TSval=550547705 TSecr=455769021"
"496","4.453404","192.168.2.2","192.168.1.2","TCP","66","556032","5001  >  47916 [ACK] Seq=1 Ack=535761 Win=556032 Len=0 TSval=550547729 TSecr=455769044"
"498","4.477968","192.168.2.2","192.168.1.2","TCP","66","556032","5001  >  47916 [ACK] Seq=1 Ack=538657 Win=556032 Len=0 TSval=550547753 TSecr=455769069"
