No.,Time,Source,Destination,Protocol,Length,Calculated window size,Info
4,0.000382,192.168.2.2,192.168.1.2,TCP,74,43440,"5001  >  58524 [SYN, ACK] Seq=0 Ack=1 Win=43440 Len=0 MSS=1460 SACK_PERM=1 TSval=3266799566 TSecr=2457929667 WS=512"
7,0.000428,192.168.2.2,192.168.1.2,TCP,66,39936,5001  >  58524 [ACK] Seq=1 Ack=7241 Win=39936 Len=0 TSval=3266799566 TSecr=2457929667
12,0.049719,192.168.2.2,192.168.1.2,TCP,66,39936,5001  >  58524 [ACK] Seq=1 Ack=14481 Win=39936 Len=0 TSval=3266799615 TSecr=2457929667
15,0.110753,192.168.2.2,192.168.1.2,TCP,66,38400,5001  >  58524 [ACK] Seq=1 Ack=24617 Win=38400 Len=0 TSval=3266799676 TSecr=2457929667
24,0.195077,192.168.2.2,192.168.1.2,TCP,66,40960,5001  >  58524 [ACK] Seq=1 Ack=28961 Win=40960 Len=0 TSval=3266799760 TSecr=2457929667
28,0.231439,192.168.2.2,192.168.1.2,TCP,66,42496,5001  >  58524 [ACK] Seq=1 Ack=30409 Win=42496 Len=0 TSval=3266799797 TSecr=2457929682
31,0.244244,192.168.2.2,192.168.1.2,TCP,66,38912,5001  >  58524 [ACK] Seq=1 Ack=39097 Win=38912 Len=0 TSval=3266799809 TSecr=2457929716
34,0.316607,192.168.2.2,192.168.1.2,TCP,66,40960,5001  >  58524 [ACK] Seq=1 Ack=43441 Win=40960 Len=0 TSval=3266799882 TSecr=2457929742
38,0.352828,192.168.2.2,192.168.1.2,TCP,66,41984,5001  >  58524 [ACK] Seq=1 Ack=46337 Win=41984 Len=0 TSval=3266799918 TSecr=2457929777
40,0.376915,192.168.2.2,192.168.1.2,TCP,66,41984,5001  >  58524 [ACK] Seq=1 Ack=49233 Win=41984 Len=0 TSval=3266799942 TSecr=2457929777
42,0.401424,192.168.2.2,192.168.1.2,TCP,66,42496,5001  >  58524 [ACK] Seq=1 Ack=50681 Win=42496 Len=0 TSval=3266799967 TSecr=2457929777
44,0.413105,192.168.2.2,192.168.1.2,TCP,66,41984,5001  >  58524 [ACK] Seq=1 Ack=53577 Win=41984 Len=0 TSval=3266799978 TSecr=2457929777
46,0.437649,192.168.2.2,192.168.1.2,TCP,66,41984,5001  >  58524 [ACK] Seq=1 Ack=56473 Win=41984 Len=0 TSval=3266800003 TSecr=2457929778
49,0.462108,192.168.2.2,192.168.1.2,TCP,66,41984,5001  >  58524 [ACK] Seq=1 Ack=59369 Win=41984 Len=0 TSval=3266800027 TSecr=2457929778
52,0.48577,192.168.2.2,192.168.1.2,TCP,66,41984,5001  >  58524 [ACK] Seq=1 Ack=62265 Win=41984 Len=0 TSval=3266800051 TSecr=2457929778
54,0.510708,192.168.2.2,192.168.1.2,TCP,78,42496,[TCP Window Update] 5001  >  58524 [ACK] Seq=1 Ack=62265 Win=42496 Len=0 TSval=3266800076 TSecr=2457929829 SLE=60817 SRE=62265
56,0.52292,192.168.2.2,192.168.1.2,TCP,66,41984,5001  >  58524 [ACK] Seq=1 Ack=65161 Win=41984 Len=0 TSval=3266800088 TSecr=2457929861
58,0.547375,192.168.2.2,192.168.1.2,TCP,66,41984,5001  >  58524 [ACK] Seq=1 Ack=68057 Win=41984 Len=0 TSval=3266800112 TSecr=2457929861
60,0.571869,192.168.2.2,192.168.1.2,TCP,66,41984,5001  >  58524 [ACK] Seq=1 Ack=70953 Win=41984 Len=0 TSval=3266800137 TSecr=2457929898
62,0.595517,192.168.2.2,192.168.1.2,TCP,66,42496,5001  >  58524 [ACK] Seq=1 Ack=72401 Win=42496 Len=0 TSval=3266800161 TSecr=2457929898
64,0.608141,192.168.2.2,192.168.1.2,TCP,66,41984,5001  >  58524 [ACK] Seq=1 Ack=75297 Win=41984 Len=0 TSval=3266800173 TSecr=2457929910
66,0.631838,192.168.2.2,192.168.1.2,TCP,66,41984,5001  >  58524 [ACK] Seq=1 Ack=78193 Win=41984 Len=0 TSval=3266800197 TSecr=2457929983
68,0.656231,192.168.2.2,192.168.1.2,TCP,66,48128,5001  >  58524 [ACK] Seq=1 Ack=81089 Win=48128 Len=0 TSval=3266800221 TSecr=2457929983
72,0.680662,192.168.2.2,192.168.1.2,TCP,66,54272,5001  >  58524 [ACK] Seq=1 Ack=83985 Win=54272 Len=0 TSval=3266800246 TSecr=2457929983
77,0.705241,192.168.2.2,192.168.1.2,TCP,66,59904,5001  >  58524 [ACK] Seq=1 Ack=86881 Win=59904 Len=0 TSval=3266800270 TSecr=2457930019
81,0.728729,192.168.2.2,192.168.1.2,TCP,66,65536,5001  >  58524 [ACK] Seq=1 Ack=89777 Win=65536 Len=0 TSval=3266800294 TSecr=2457930043
85,0.753193,192.168.2.2,192.168.1.2,TCP,66,71680,5001  >  58524 [ACK] Seq=1 Ack=92673 Win=71680 Len=0 TSval=3266800318 TSecr=2457930068
89,0.777177,192.168.2.2,192.168.1.2,TCP,66,74240,5001  >  58524 [ACK] Seq=1 Ack=94121 Win=74240 Len=0 TSval=3266800342 TSecr=2457930079
92,0.789479,192.168.2.2,192.168.1.2,TCP,66,80384,5001  >  58524 [ACK] Seq=1 Ack=97017 Win=80384 Len=0 TSval=3266800354 TSecr=2457930104
96,0.813532,192.168.2.2,192.168.1.2,TCP,66,86016,5001  >  58524 [ACK] Seq=1 Ack=99913 Win=86016 Len=0 TSval=3266800378 TSecr=2457930128
99,0.837781,192.168.2.2,192.168.1.2,TCP,66,91648,5001  >  58524 [ACK] Seq=1 Ack=102809 Win=91648 Len=0 TSval=3266800403 TSecr=2457930152
101,0.861979,192.168.2.2,192.168.1.2,TCP,66,95744,5001  >  58524 [ACK] Seq=1 Ack=104761 Win=95744 Len=0 TSval=3266800427 TSecr=2457930177
103,0.878664,192.168.2.2,192.168.1.2,TCP,66,98304,5001  >  58524 [ACK] Seq=1 Ack=106209 Win=98304 Len=0 TSval=3266800444 TSecr=2457930189
105,0.891425,192.168.2.2,192.168.1.2,TCP,66,104448,5001  >  58524 [ACK] Seq=1 Ack=109105 Win=104448 Len=0 TSval=3266800456 TSecr=2457930213
107,0.915918,192.168.2.2,192.168.1.2,TCP,66,110080,5001  >  58524 [ACK] Seq=1 Ack=112001 Win=110080 Len=0 TSval=3266800481 TSecr=2457930238
109,0.93939,192.168.2.2,192.168.1.2,TCP,66,115712,5001  >  58524 [ACK] Seq=1 Ack=114897 Win=115712 Len=0 TSval=3266800504 TSecr=2457930262
111,0.963493,192.168.2.2,192.168.1.2,TCP,66,118784,5001  >  58524 [ACK] Seq=1 Ack=115841 Win=118784 Len=0 TSval=3266800528 TSecr=2457930274
113,0.971504,192.168.2.2,192.168.1.2,TCP,66,124416,5001  >  58524 [ACK] Seq=1 Ack=118737 Win=124416 Len=0 TSval=3266800536 TSecr=2457930298
115,0.995736,192.168.2.2,192.168.1.2,TCP,66,130560,5001  >  58524 [ACK] Seq=1 Ack=121633 Win=130560 Len=0 TSval=3266800561 TSecr=2457930322
118,1.019966,192.168.2.2,192.168.1.2,TCP,66,136192,5001  >  58524 [ACK] Seq=1 Ack=124529 Win=136192 Len=0 TSval=3266800585 TSecr=2457930322
120,1.044829,192.168.2.2,192.168.1.2,TCP,66,141824,5001  >  58524 [ACK] Seq=1 Ack=127425 Win=141824 Len=0 TSval=3266800610 TSecr=2457930322
123,1.068398,192.168.2.2,192.168.1.2,TCP,66,147968,5001  >  58524 [ACK] Seq=1 Ack=130321 Win=147968 Len=0 TSval=3266800633 TSecr=2457930347
126,1.092632,192.168.2.2,192.168.1.2,TCP,66,153600,5001  >  58524 [ACK] Seq=1 Ack=133217 Win=153600 Len=0 TSval=3266800657 TSecr=2457930347
128,1.116862,192.168.2.2,192.168.1.2,TCP,66,159232,5001  >  58524 [ACK] Seq=1 Ack=136113 Win=159232 Len=0 TSval=3266800682 TSecr=2457930347
130,1.141083,192.168.2.2,192.168.1.2,TCP,66,162304,5001  >  58524 [ACK] Seq=1 Ack=137561 Win=162304 Len=0 TSval=3266800706 TSecr=2457930347
132,1.153591,192.168.2.2,192.168.1.2,TCP,66,167936,5001  >  58524 [ACK] Seq=1 Ack=140457 Win=167936 Len=0 TSval=3266800718 TSecr=2457930371
134,1.178114,192.168.2.2,192.168.1.2,TCP,66,173568,5001  >  58524 [ACK] Seq=1 Ack=143353 Win=173568 Len=0 TSval=3266800743 TSecr=2457930371
136,1.201644,192.168.2.2,192.168.1.2,TCP,66,179712,5001  >  58524 [ACK] Seq=1 Ack=146249 Win=179712 Len=0 TSval=3266800766 TSecr=2457930371
138,1.226083,192.168.2.2,192.168.1.2,TCP,66,185344,5001  >  58524 [ACK] Seq=1 Ack=149145 Win=185344 Len=0 TSval=3266800791 TSecr=2457930395
142,1.250072,192.168.2.2,192.168.1.2,TCP,66,187904,5001  >  58524 [ACK] Seq=1 Ack=152041 Win=187904 Len=0 TSval=3266800815 TSecr=2457930395
146,1.275091,192.168.2.2,192.168.1.2,TCP,66,187904,5001  >  58524 [ACK] Seq=1 Ack=154937 Win=187904 Len=0 TSval=3266800840 TSecr=2457930395
148,1.298667,192.168.2.2,192.168.1.2,TCP,66,187904,5001  >  58524 [ACK] Seq=1 Ack=157833 Win=187904 Len=0 TSval=3266800863 TSecr=2457930419
150,1.322754,192.168.2.2,192.168.1.2,TCP,66,188928,5001  >  58524 [ACK] Seq=1 Ack=159281 Win=188928 Len=0 TSval=3266800887 TSecr=2457930419
152,1.334876,192.168.2.2,192.168.1.2,TCP,66,187904,5001  >  58524 [ACK] Seq=1 Ack=162177 Win=187904 Len=0 TSval=3266800900 TSecr=2457930419
154,1.359366,192.168.2.2,192.168.1.2,TCP,66,187904,5001  >  58524 [ACK] Seq=1 Ack=165073 Win=187904 Len=0 TSval=3266800924 TSecr=2457930443
156,1.383351,192.168.2.2,192.168.1.2,TCP,66,187904,5001  >  58524 [ACK] Seq=1 Ack=167969 Win=187904 Len=0 TSval=3266800948 TSecr=2457930443
158,1.408232,192.168.2.2,192.168.1.2,TCP,66,187904,5001  >  58524 [ACK] Seq=1 Ack=170865 Win=187904 Len=0 TSval=3266800973 TSecr=2457930455
160,1.431979,192.168.2.2,192.168.1.2,TCP,66,187904,5001  >  58524 [ACK] Seq=1 Ack=173761 Win=187904 Len=0 TSval=3266800997 TSecr=2457930455
162,1.456415,192.168.2.2,192.168.1.2,TCP,66,187904,5001  >  58524 [ACK] Seq=1 Ack=176657 Win=187904 Len=0 TSval=3266801021 TSecr=2457930455
164,1.480968,192.168.2.2,192.168.1.2,TCP,66,187904,5001  >  58524 [ACK] Seq=1 Ack=179553 Win=187904 Len=0 TSval=3266801046 TSecr=2457930479
166,1.516572,192.168.2.2,192.168.1.2,TCP,66,187904,5001  >  58524 [ACK] Seq=1 Ack=183897 Win=187904 Len=0 TSval=3266801081 TSecr=2457930479
169,1.540775,192.168.2.2,192.168.1.2,TCP,66,187904,5001  >  58524 [ACK] Seq=1 Ack=186793 Win=187904 Len=0 TSval=3266801105 TSecr=2457930528
172,1.577812,192.168.2.2,192.168.1.2,TCP,66,187904,5001  >  58524 [ACK] Seq=1 Ack=191137 Win=187904 Len=0 TSval=3266801142 TSecr=2457930545
174,1.602035,192.168.2.2,192.168.1.2,TCP,66,187904,5001  >  58524 [ACK] Seq=1 Ack=194033 Win=187904 Len=0 TSval=3266801167 TSecr=2457930582
176,1.62645,192.168.2.2,192.168.1.2,TCP,66,187904,5001  >  58524 [ACK] Seq=1 Ack=196929 Win=187904 Len=0 TSval=3266801191 TSecr=2457930605
178,1.662702,192.168.2.2,192.168.1.2,TCP,66,194560,5001  >  58524 [ACK] Seq=1 Ack=201273 Win=194560 Len=0 TSval=3266801227 TSecr=2457930629
181,1.6868,192.168.2.2,192.168.1.2,TCP,66,197632,5001  >  58524 [ACK] Seq=1 Ack=202721 Win=197632 Len=0 TSval=3266801251 TSecr=2457930662
184,1.699692,192.168.2.2,192.168.1.2,TCP,66,203264,5001  >  58524 [ACK] Seq=1 Ack=205617 Win=203264 Len=0 TSval=3266801264 TSecr=2457930686
186,1.723921,192.168.2.2,192.168.1.2,TCP,66,208896,5001  >  58524 [ACK] Seq=1 Ack=208513 Win=208896 Len=0 TSval=3266801288 TSecr=2457930711
188,1.748152,192.168.2.2,192.168.1.2,TCP,66,215040,5001  >  58524 [ACK] Seq=1 Ack=211409 Win=215040 Len=0 TSval=3266801313 TSecr=2457930711
190,1.77247,192.168.2.2,192.168.1.2,TCP,66,220672,5001  >  58524 [ACK] Seq=1 Ack=214305 Win=220672 Len=0 TSval=3266801337 TSecr=2457930734
192,1.797081,192.168.2.2,192.168.1.2,TCP,66,226304,5001  >  58524 [ACK] Seq=1 Ack=217201 Win=226304 Len=0 TSval=3266801361 TSecr=2457930758
194,1.820833,192.168.2.2,192.168.1.2,TCP,66,232448,5001  >  58524 [ACK] Seq=1 Ack=220097 Win=232448 Len=0 TSval=3266801385 TSecr=2457930783
196,1.845073,192.168.2.2,192.168.1.2,TCP,66,235008,5001  >  58524 [ACK] Seq=1 Ack=221545 Win=235008 Len=0 TSval=3266801409 TSecr=2457930807
198,1.857818,192.168.2.2,192.168.1.2,TCP,66,241152,5001  >  58524 [ACK] Seq=1 Ack=224441 Win=241152 Len=0 TSval=3266801422 TSecr=2457930819
200,1.881388,192.168.2.2,192.168.1.2,TCP,66,246784,5001  >  58524 [ACK] Seq=1 Ack=227337 Win=246784 Len=0 TSval=3266801446 TSecr=2457930844
202,1.905769,192.168.2.2,192.168.1.2,TCP,66,252416,5001  >  58524 [ACK] Seq=1 Ack=230233 Win=252416 Len=0 TSval=3266801470 TSecr=2457930867
204,1.93032,192.168.2.2,192.168.1.2,TCP,66,258560,5001  >  58524 [ACK] Seq=1 Ack=233129 Win=258560 Len=0 TSval=3266801495 TSecr=2457930892
207,1.954066,192.168.2.2,192.168.1.2,TCP,66,264192,5001  >  58524 [ACK] Seq=1 Ack=236025 Win=264192 Len=0 TSval=3266801518 TSecr=2457930916
210,1.978319,192.168.2.2,192.168.1.2,TCP,66,269824,5001  >  58524 [ACK] Seq=1 Ack=238921 Win=269824 Len=0 TSval=3266801543 TSecr=2457930941
212,2.002777,192.168.2.2,192.168.1.2,TCP,66,275968,5001  >  58524 [ACK] Seq=1 Ack=241817 Win=275968 Len=0 TSval=3266801567 TSecr=2457930964
216,2.02672,192.168.2.2,192.168.1.2,TCP,66,281600,5001  >  58524 [ACK] Seq=1 Ack=244713 Win=281600 Len=0 TSval=3266801591 TSecr=2457930988
218,2.050966,192.168.2.2,192.168.1.2,TCP,66,284160,5001  >  58524 [ACK] Seq=1 Ack=246161 Win=284160 Len=0 TSval=3266801615 TSecr=2457931001
220,2.063552,192.168.2.2,192.168.1.2,TCP,66,290304,5001  >  58524 [ACK] Seq=1 Ack=249057 Win=290304 Len=0 TSval=3266801628 TSecr=2457931025
222,2.08815,192.168.2.2,192.168.1.2,TCP,66,295936,5001  >  58524 [ACK] Seq=1 Ack=251953 Win=295936 Len=0 TSval=3266801652 TSecr=2457931049
224,2.111699,192.168.2.2,192.168.1.2,TCP,66,301568,5001  >  58524 [ACK] Seq=1 Ack=254849 Win=301568 Len=0 TSval=3266801676 TSecr=2457931074
226,2.136137,192.168.2.2,192.168.1.2,TCP,66,307712,5001  >  58524 [ACK] Seq=1 Ack=257745 Win=307712 Len=0 TSval=3266801700 TSecr=2457931098
228,2.160162,192.168.2.2,192.168.1.2,TCP,66,313344,5001  >  58524 [ACK] Seq=1 Ack=260641 Win=313344 Len=0 TSval=3266801724 TSecr=2457931122
230,2.1846,192.168.2.2,192.168.1.2,TCP,66,318976,5001  >  58524 [ACK] Seq=1 Ack=263537 Win=318976 Len=0 TSval=3266801749 TSecr=2457931147
232,2.208491,192.168.2.2,192.168.1.2,TCP,66,325120,5001  >  58524 [ACK] Seq=1 Ack=266433 Win=325120 Len=0 TSval=3266801773 TSecr=2457931182
234,2.23271,192.168.2.2,192.168.1.2,TCP,66,327680,5001  >  58524 [ACK] Seq=1 Ack=267881 Win=327680 Len=0 TSval=3266801797 TSecr=2457931182
236,2.2455,192.168.2.2,192.168.1.2,TCP,66,333824,5001  >  58524 [ACK] Seq=1 Ack=270777 Win=333824 Len=0 TSval=3266801810 TSecr=2457931206
238,2.269014,192.168.2.2,192.168.1.2,TCP,66,339456,5001  >  58524 [ACK] Seq=1 Ack=273673 Win=339456 Len=0 TSval=3266801833 TSecr=2457931206
240,2.293428,192.168.2.2,192.168.1.2,TCP,66,345088,5001  >  58524 [ACK] Seq=1 Ack=276569 Win=345088 Len=0 TSval=3266801858 TSecr=2457931243
242,2.317399,192.168.2.2,192.168.1.2,TCP,66,351232,5001  >  58524 [ACK] Seq=1 Ack=279465 Win=351232 Len=0 TSval=3266801882 TSecr=2457931268
244,2.342395,192.168.2.2,192.168.1.2,TCP,66,356864,5001  >  58524 [ACK] Seq=1 Ack=282361 Win=356864 Len=0 TSval=3266801907 TSecr=2457931292
246,2.366027,192.168.2.2,192.168.1.2,TCP,66,360448,5001  >  58524 [ACK] Seq=1 Ack=285257 Win=360448 Len=0 TSval=3266801930 TSecr=2457931328
249,2.390485,192.168.2.2,192.168.1.2,TCP,66,360448,5001  >  58524 [ACK] Seq=1 Ack=288153 Win=360448 Len=0 TSval=3266801955 TSecr=2457931328
251,2.414914,192.168.2.2,192.168.1.2,TCP,66,360960,5001  >  58524 [ACK] Seq=1 Ack=289601 Win=360960 Len=0 TSval=3266801979 TSecr=2457931352
253,2.426698,192.168.2.2,192.168.1.2,TCP,66,360960,5001  >  58524 [ACK] Seq=1 Ack=292497 Win=360960 Len=0 TSval=3266801991 TSecr=2457931365
255,2.451197,192.168.2.2,192.168.1.2,TCP,66,360960,5001  >  58524 [ACK] Seq=1 Ack=295393 Win=360960 Len=0 TSval=3266802015 TSecr=2457931389
257,2.474894,192.168.2.2,192.168.1.2,TCP,66,360960,5001  >  58524 [ACK] Seq=1 Ack=298289 Win=360960 Len=0 TSval=3266802039 TSecr=2457931414
259,2.499321,192.168.2.2,192.168.1.2,TCP,66,360960,5001  >  58524 [ACK] Seq=1 Ack=301185 Win=360960 Len=0 TSval=3266802063 TSecr=2457931438
261,2.523739,192.168.2.2,192.168.1.2,TCP,66,360960,5001  >  58524 [ACK] Seq=1 Ack=304081 Win=360960 Len=0 TSval=3266802088 TSecr=2457931463
263,2.547561,192.168.2.2,192.168.1.2,TCP,66,360960,5001  >  58524 [ACK] Seq=1 Ack=306977 Win=360960 Len=0 TSval=3266802112 TSecr=2457931486
265,2.571778,192.168.2.2,192.168.1.2,TCP,66,360960,5001  >  58524 [ACK] Seq=1 Ack=309873 Win=360960 Len=0 TSval=3266802136 TSecr=2457931510
267,2.609914,192.168.2.2,192.168.1.2,TCP,66,360960,5001  >  58524 [ACK] Seq=1 Ack=314217 Win=360960 Len=0 TSval=3266802174 TSecr=2457931523
270,2.632379,192.168.2.2,192.168.1.2,TCP,66,360960,5001  >  58524 [ACK] Seq=1 Ack=317113 Win=360960 Len=0 TSval=3266802196 TSecr=2457931571
272,2.657858,192.168.2.2,192.168.1.2,TCP,66,360960,5001  >  58524 [ACK] Seq=1 Ack=320009 Win=360960 Len=0 TSval=3266802222 TSecr=2457931596
274,2.694323,192.168.2.2,192.168.1.2,TCP,66,360960,5001  >  58524 [ACK] Seq=1 Ack=324353 Win=360960 Len=0 TSval=3266802258 TSecr=2457931609
276,2.718755,192.168.2.2,192.168.1.2,TCP,66,360960,5001  >  58524 [ACK] Seq=1 Ack=327249 Win=360960 Len=0 TSval=3266802283 TSecr=2457931644
279,2.742649,192.168.2.2,192.168.1.2,TCP,66,360960,5001  >  58524 [ACK] Seq=1 Ack=330145 Win=360960 Len=0 TSval=3266802307 TSecr=2457931668
282,2.767635,192.168.2.2,192.168.1.2,TCP,66,360960,5001  >  58524 [ACK] Seq=1 Ack=333041 Win=360960 Len=0 TSval=3266802332 TSecr=2457931692
284,2.791883,192.168.2.2,192.168.1.2,TCP,66,360960,5001  >  58524 [ACK] Seq=1 Ack=335937 Win=360960 Len=0 TSval=3266802356 TSecr=2457931716
286,2.81637,192.168.2.2,192.168.1.2,TCP,66,360960,5001  >  58524 [ACK] Seq=1 Ack=338833 Win=360960 Len=0 TSval=3266802380 TSecr=2457931729
288,2.840313,192.168.2.2,192.168.1.2,TCP,66,360960,5001  >  58524 [ACK] Seq=1 Ack=341729 Win=360960 Len=0 TSval=3266802404 TSecr=2457931753
290,2.864532,192.168.2.2,192.168.1.2,TCP,66,360960,5001  >  58524 [ACK] Seq=1 Ack=344625 Win=360960 Len=0 TSval=3266802428 TSecr=2457931777
292,2.888892,192.168.2.2,192.168.1.2,TCP,66,360960,5001  >  58524 [ACK] Seq=1 Ack=347521 Win=360960 Len=0 TSval=3266802453 TSecr=2457931801
294,2.913345,192.168.2.2,192.168.1.2,TCP,66,360960,5001  >  58524 [ACK] Seq=1 Ack=350417 Win=360960 Len=0 TSval=3266802477 TSecr=2457931825
296,2.937883,192.168.2.2,192.168.1.2,TCP,66,360960,5001  >  58524 [ACK] Seq=1 Ack=353313 Win=360960 Len=0 TSval=3266802502 TSecr=2457931850
299,2.974049,192.168.2.2,192.168.1.2,TCP,66,360960,5001  >  58524 [ACK] Seq=1 Ack=357657 Win=360960 Len=0 TSval=3266802538 TSecr=2457931874
301,2.997785,192.168.2.2,192.168.1.2,TCP,66,360960,5001  >  58524 [ACK] Seq=1 Ack=360553 Win=360960 Len=0 TSval=3266802562 TSecr=2457931911
305,3.022128,192.168.2.2,192.168.1.2,TCP,66,360960,5001  >  58524 [ACK] Seq=1 Ack=363449 Win=360960 Len=0 TSval=3266802586 TSecr=2457931934
307,3.046643,192.168.2.2,192.168.1.2,TCP,66,360960,5001  >  58524 [ACK] Seq=1 Ack=366345 Win=360960 Len=0 TSval=3266802610 TSecr=2457931959
309,3.070425,192.168.2.2,192.168.1.2,TCP,66,360960,5001  >  58524 [ACK] Seq=1 Ack=369241 Win=360960 Len=0 TSval=3266802634 TSecr=2457931983
311,3.094654,192.168.2.2,192.168.1.2,TCP,66,360960,5001  >  58524 [ACK] Seq=1 Ack=372137 Win=360960 Len=0 TSval=3266802658 TSecr=2457932008
313,3.119134,192.168.2.2,192.168.1.2,TCP,66,360960,5001  >  58524 [ACK] Seq=1 Ack=375033 Win=360960 Len=0 TSval=3266802683 TSecr=2457932031
315,3.155504,192.168.2.2,192.168.1.2,TCP,66,360960,5001  >  58524 [ACK] Seq=1 Ack=379377 Win=360960 Len=0 TSval=3266802719 TSecr=2457932031
318,3.191698,192.168.2.2,192.168.1.2,TCP,66,360960,5001  >  58524 [ACK] Seq=1 Ack=383721 Win=360960 Len=0 TSval=3266802755 TSecr=2457932080
320,3.215779,192.168.2.2,192.168.1.2,TCP,66,360960,5001  >  58524 [ACK] Seq=1 Ack=386617 Win=360960 Len=0 TSval=3266802779 TSecr=2457932116
322,3.24064,192.168.2.2,192.168.1.2,TCP,66,360960,5001  >  58524 [ACK] Seq=1 Ack=389513 Win=360960 Len=0 TSval=3266802804 TSecr=2457932140
325,3.264225,192.168.2.2,192.168.1.2,TCP,66,360960,5001  >  58524 [ACK] Seq=1 Ack=392409 Win=360960 Len=0 TSval=3266802828 TSecr=2457932164
327,3.288471,192.168.2.2,192.168.1.2,TCP,66,360960,5001  >  58524 [ACK] Seq=1 Ack=395305 Win=360960 Len=0 TSval=3266802852 TSecr=2457932189
329,3.313319,192.168.2.2,192.168.1.2,TCP,66,360960,5001  >  58524 [ACK] Seq=1 Ack=398201 Win=360960 Len=0 TSval=3266802877 TSecr=2457932213
331,3.337666,192.168.2.2,192.168.1.2,TCP,66,360960,5001  >  58524 [ACK] Seq=1 Ack=401097 Win=360960 Len=0 TSval=3266802901 TSecr=2457932237
333,3.361733,192.168.2.2,192.168.1.2,TCP,66,360960,5001  >  58524 [ACK] Seq=1 Ack=403993 Win=360960 Len=0 TSval=3266802925 TSecr=2457932275
335,3.385388,192.168.2.2,192.168.1.2,TCP,66,360960,5001  >  58524 [ACK] Seq=1 Ack=406889 Win=360960 Len=0 TSval=3266802949 TSecr=2457932275
337,3.409796,192.168.2.2,192.168.1.2,TCP,66,360960,5001  >  58524 [ACK] Seq=1 Ack=409785 Win=360960 Len=0 TSval=3266802973 TSecr=2457932297
339,3.433824,192.168.2.2,192.168.1.2,TCP,66,360960,5001  >  58524 [ACK] Seq=1 Ack=412681 Win=360960 Len=0 TSval=3266802997 TSecr=2457932323
341,3.458845,192.168.2.2,192.168.1.2,TCP,66,360960,5001  >  58524 [ACK] Seq=1 Ack=415577 Win=360960 Len=0 TSval=3266803022 TSecr=2457932359
343,3.482237,192.168.2.2,192.168.1.2,TCP,66,360960,5001  >  58524 [ACK] Seq=1 Ack=418473 Win=360960 Len=0 TSval=3266803046 TSecr=2457932384
345,3.518583,192.168.2.2,192.168.1.2,TCP,66,360960,5001  >  58524 [ACK] Seq=1 Ack=422817 Win=360960 Len=0 TSval=3266803082 TSecr=2457932384
348,3.542811,192.168.2.2,192.168.1.2,TCP,66,360960,5001  >  58524 [ACK] Seq=1 Ack=425713 Win=360960 Len=0 TSval=3266803106 TSecr=2457932433
350,3.567678,192.168.2.2,192.168.1.2,TCP,66,360960,5001  >  58524 [ACK] Seq=1 Ack=428609 Win=360960 Len=0 TSval=3266803131 TSecr=2457932457
352,3.592086,192.168.2.2,192.168.1.2,TCP,66,360960,5001  >  58524 [ACK] Seq=1 Ack=431505 Win=360960 Len=0 TSval=3266803156 TSecr=2457932481
354,3.615574,192.168.2.2,192.168.1.2,TCP,66,360960,5001  >  58524 [ACK] Seq=1 Ack=434401 Win=360960 Len=0 TSval=3266803179 TSecr=2457932505
356,3.640117,192.168.2.2,192.168.1.2,TCP,66,360960,5001  >  58524 [ACK] Seq=1 Ack=437297 Win=360960 Len=0 TSval=3266803204 TSecr=2457932529
358,3.664613,192.168.2.2,192.168.1.2,TCP,66,360960,5001  >  58524 [ACK] Seq=1 Ack=440193 Win=360960 Len=0 TSval=3266803228 TSecr=2457932554
360,3.688853,192.168.2.2,192.168.1.2,TCP,66,360960,5001  >  58524 [ACK] Seq=1 Ack=443089 Win=360960 Len=0 TSval=3266803252 TSecr=2457932578
362,3.713635,192.168.2.2,192.168.1.2,TCP,66,360960,5001  >  58524 [ACK] Seq=1 Ack=445985 Win=360960 Len=0 TSval=3266803277 TSecr=2457932603
364,3.749793,192.168.2.2,192.168.1.2,TCP,66,360960,5001  >  58524 [ACK] Seq=1 Ack=450329 Win=360960 Len=0 TSval=3266803313 TSecr=2457932632
367,3.773647,192.168.2.2,192.168.1.2,TCP,66,360960,5001  >  58524 [ACK] Seq=1 Ack=453225 Win=360960 Len=0 TSval=3266803337 TSecr=2457932663
369,3.79788,192.168.2.2,192.168.1.2,TCP,66,360960,5001  >  58524 [ACK] Seq=1 Ack=456121 Win=360960 Len=0 TSval=3266803361 TSecr=2457932663
372,3.822864,192.168.2.2,192.168.1.2,TCP,66,360960,5001  >  58524 [ACK] Seq=1 Ack=459017 Win=360960 Len=0 TSval=3266803386 TSecr=2457932687
374,3.847123,192.168.2.2,192.168.1.2,TCP,66,360960,5001  >  58524 [ACK] Seq=1 Ack=461913 Win=360960 Len=0 TSval=3266803410 TSecr=2457932711
376,3.871365,192.168.2.2,192.168.1.2,TCP,66,360960,5001  >  58524 [ACK] Seq=1 Ack=464809 Win=360960 Len=0 TSval=3266803435 TSecr=2457932735
378,3.895903,192.168.2.2,192.168.1.2,TCP,66,360960,5001  >  58524 [ACK] Seq=1 Ack=467705 Win=360960 Len=0 TSval=3266803459 TSecr=2457932759
380,3.920435,192.168.2.2,192.168.1.2,TCP,66,360960,5001  >  58524 [ACK] Seq=1 Ack=470601 Win=360960 Len=0 TSval=3266803484 TSecr=2457932784
382,3.94401,192.168.2.2,192.168.1.2,TCP,66,360960,5001  >  58524 [ACK] Seq=1 Ack=473497 Win=360960 Len=0 TSval=3266803507 TSecr=2457932820
384,3.980692,192.168.2.2,192.168.1.2,TCP,66,360960,5001  >  58524 [ACK] Seq=1 Ack=477841 Win=360960 Len=0 TSval=3266803544 TSecr=2457932820
387,4.005167,192.168.2.2,192.168.1.2,TCP,66,360960,5001  >  58524 [ACK] Seq=1 Ack=480737 Win=360960 Len=0 TSval=3266803568 TSecr=2457932881
390,4.028808,192.168.2.2,192.168.1.2,TCP,66,360960,5001  >  58524 [ACK] Seq=1 Ack=483633 Win=360960 Len=0 TSval=3266803592 TSecr=2457932905
392,4.053142,192.168.2.2,192.168.1.2,TCP,66,360960,5001  >  58524 [ACK] Seq=1 Ack=486529 Win=360960 Len=0 TSval=3266803616 TSecr=2457932905
394,4.077231,192.168.2.2,192.168.1.2,TCP,66,360960,5001  >  58524 [ACK] Seq=1 Ack=489425 Win=360960 Len=0 TSval=3266803640 TSecr=2457932929
396,4.102196,192.168.2.2,192.168.1.2,TCP,66,360960,5001  >  58524 [ACK] Seq=1 Ack=492321 Win=360960 Len=0 TSval=3266803665 TSecr=2457932953
398,4.125747,192.168.2.2,192.168.1.2,TCP,66,360960,5001  >  58524 [ACK] Seq=1 Ack=495217 Win=360960 Len=0 TSval=3266803689 TSecr=2457932978
400,4.150258,192.168.2.2,192.168.1.2,TCP,66,360960,5001  >  58524 [ACK] Seq=1 Ack=498113 Win=360960 Len=0 TSval=3266803713 TSecr=2457933002
402,4.174742,192.168.2.2,192.168.1.2,TCP,66,360960,5001  >  58524 [ACK] Seq=1 Ack=501009 Win=360960 Len=0 TSval=3266803738 TSecr=2457933026
404,4.198351,192.168.2.2,192.168.1.2,TCP,66,360960,5001  >  58524 [ACK] Seq=1 Ack=503905 Win=360960 Len=0 TSval=3266803762 TSecr=2457933050
407,4.222777,192.168.2.2,192.168.1.2,TCP,66,360960,5001  >  58524 [ACK] Seq=1 Ack=506801 Win=360960 Len=0 TSval=3266803786 TSecr=2457933074
409,4.247286,192.168.2.2,192.168.1.2,TCP,66,360960,5001  >  58524 [ACK] Seq=1 Ack=509697 Win=360960 Len=0 TSval=3266803810 TSecr=2457933098
411,4.271693,192.168.2.2,192.168.1.2,TCP,66,360960,5001  >  58524 [ACK] Seq=1 Ack=512593 Win=360960 Len=0 TSval=3266803835 TSecr=2457933123
413,4.2953,192.168.2.2,192.168.1.2,TCP,66,360960,5001  >  58524 [ACK] Seq=1 Ack=515489 Win=360960 Len=0 TSval=3266803858 TSecr=2457933147
415,4.319737,192.168.2.2,192.168.1.2,TCP,66,360960,5001  >  58524 [ACK] Seq=1 Ack=518385 Win=360960 Len=0 TSval=3266803883 TSecr=2457933183
417,4.343724,192.168.2.2,192.168.1.2,TCP,66,360960,5001  >  58524 [ACK] Seq=1 Ack=521281 Win=360960 Len=0 TSval=3266803907 TSecr=2457933183
419,4.368042,192.168.2.2,192.168.1.2,TCP,66,360960,5001  >  58524 [ACK] Seq=1 Ack=524177 Win=360960 Len=0 TSval=3266803931 TSecr=2457933207
421,4.392414,192.168.2.2,192.168.1.2,TCP,66,360960,5001  >  58524 [ACK] Seq=1 Ack=527073 Win=360960 Len=0 TSval=3266803956 TSecr=2457933232
423,4.416372,192.168.2.2,192.168.1.2,TCP,66,360960,5001  >  58524 [ACK] Seq=1 Ack=529969 Win=360960 Len=0 TSval=3266803979 TSecr=2457933257
425,4.440605,192.168.2.2,192.168.1.2,TCP,66,360960,5001  >  58524 [ACK] Seq=1 Ack=532865 Win=360960 Len=0 TSval=3266804004 TSecr=2457933280
427,4.464816,192.168.2.2,192.168.1.2,TCP,66,360960,5001  >  58524 [ACK] Seq=1 Ack=535761 Win=360960 Len=0 TSval=3266804028 TSecr=2457933305
429,4.489348,192.168.2.2,192.168.1.2,TCP,66,360960,5001  >  58524 [ACK] Seq=1 Ack=538657 Win=360960 Len=0 TSval=3266804052 TSecr=2457933329
432,4.513847,192.168.2.2,192.168.1.2,TCP,66,360960,5001  >  58524 [ACK] Seq=1 Ack=541553 Win=360960 Len=0 TSval=3266804077 TSecr=2457933353
434,4.537503,192.168.2.2,192.168.1.2,TCP,66,360960,5001  >  58524 [ACK] Seq=1 Ack=544449 Win=360960 Len=0 TSval=3266804101 TSecr=2457933378
436,4.562297,192.168.2.2,192.168.1.2,TCP,66,360960,5001  >  58524 [ACK] Seq=1 Ack=547345 Win=360960 Len=0 TSval=3266804125 TSecr=2457933414
438,4.585934,192.168.2.2,192.168.1.2,TCP,66,360960,5001  >  58524 [ACK] Seq=1 Ack=550241 Win=360960 Len=0 TSval=3266804149 TSecr=2457933414
440,4.610457,192.168.2.2,192.168.1.2,TCP,66,360960,5001  >  58524 [ACK] Seq=1 Ack=553137 Win=360960 Len=0 TSval=3266804173 TSecr=2457933438
442,4.634874,192.168.2.2,192.168.1.2,TCP,66,360960,5001  >  58524 [ACK] Seq=1 Ack=556033 Win=360960 Len=0 TSval=3266804198 TSecr=2457933462
444,4.659406,192.168.2.2,192.168.1.2,TCP,66,360960,5001  >  58524 [ACK] Seq=1 Ack=558929 Win=360960 Len=0 TSval=3266804222 TSecr=2457933487
446,4.682905,192.168.2.2,192.168.1.2,TCP,66,360960,5001  >  58524 [ACK] Seq=1 Ack=561825 Win=360960 Len=0 TSval=3266804246 TSecr=2457933512
448,4.707356,192.168.2.2,192.168.1.2,TCP,66,360960,5001  >  58524 [ACK] Seq=1 Ack=564721 Win=360960 Len=0 TSval=3266804270 TSecr=2457933536
451,4.731418,192.168.2.2,192.168.1.2,TCP,66,360960,5001  >  58524 [ACK] Seq=1 Ack=567617 Win=360960 Len=0 TSval=3266804294 TSecr=2457933560
453,4.756466,192.168.2.2,192.168.1.2,TCP,66,360960,5001  >  58524 [ACK] Seq=1 Ack=570513 Win=360960 Len=0 TSval=3266804319 TSecr=2457933585
455,4.779935,192.168.2.2,192.168.1.2,TCP,66,360960,5001  >  58524 [ACK] Seq=1 Ack=573409 Win=360960 Len=0 TSval=3266804343 TSecr=2457933608
457,4.80437,192.168.2.2,192.168.1.2,TCP,66,360960,5001  >  58524 [ACK] Seq=1 Ack=576305 Win=360960 Len=0 TSval=3266804367 TSecr=2457933645
459,4.828167,192.168.2.2,192.168.1.2,TCP,66,360960,5001  >  58524 [ACK] Seq=1 Ack=579201 Win=360960 Len=0 TSval=3266804391 TSecr=2457933645
461,4.852446,192.168.2.2,192.168.1.2,TCP,66,360960,5001  >  58524 [ACK] Seq=1 Ack=582097 Win=360960 Len=0 TSval=3266804415 TSecr=2457933670
464,4.877534,192.168.2.2,192.168.1.2,TCP,66,360960,5001  >  58524 [ACK] Seq=1 Ack=584993 Win=360960 Len=0 TSval=3266804440 TSecr=2457933693
466,4.902455,192.168.2.2,192.168.1.2,TCP,66,360960,5001  >  58524 [ACK] Seq=1 Ack=587889 Win=360960 Len=0 TSval=3266804465 TSecr=2457933717
468,4.925899,192.168.2.2,192.168.1.2,TCP,66,360960,5001  >  58524 [ACK] Seq=1 Ack=590785 Win=360960 Len=0 TSval=3266804489 TSecr=2457933742
471,4.950397,192.168.2.2,192.168.1.2,TCP,66,360960,5001  >  58524 [ACK] Seq=1 Ack=593681 Win=360960 Len=0 TSval=3266804513 TSecr=2457933766
473,4.986662,192.168.2.2,192.168.1.2,TCP,66,360960,5001  >  58524 [ACK] Seq=1 Ack=598025 Win=360960 Len=0 TSval=3266804549 TSecr=2457933790
475,5.011237,192.168.2.2,192.168.1.2,TCP,66,360960,5001  >  58524 [ACK] Seq=1 Ack=600921 Win=360960 Len=0 TSval=3266804574 TSecr=2457933839
479,5.034888,192.168.2.2,192.168.1.2,TCP,66,360960,5001  >  58524 [ACK] Seq=1 Ack=603817 Win=360960 Len=0 TSval=3266804598 TSecr=2457933863
481,5.059085,192.168.2.2,192.168.1.2,TCP,66,360960,5001  >  58524 [ACK] Seq=1 Ack=606713 Win=360960 Len=0 TSval=3266804622 TSecr=2457933863
483,5.083401,192.168.2.2,192.168.1.2,TCP,66,360960,5001  >  58524 [ACK] Seq=1 Ack=609609 Win=360960 Len=0 TSval=3266804646 TSecr=2457933887
485,5.107799,192.168.2.2,192.168.1.2,TCP,66,360960,5001  >  58524 [ACK] Seq=1 Ack=612505 Win=360960 Len=0 TSval=3266804671 TSecr=2457933912
490,5.132329,192.168.2.2,192.168.1.2,TCP,66,360960,5001  >  58524 [ACK] Seq=1 Ack=615401 Win=360960 Len=0 TSval=3266804695 TSecr=2457933936
492,5.156055,192.168.2.2,192.168.1.2,TCP,66,360960,5001  >  58524 [ACK] Seq=1 Ack=618297 Win=360960 Len=0 TSval=3266804719 TSecr=2457933959
494,5.180302,192.168.2.2,192.168.1.2,TCP,66,360960,5001  >  58524 [ACK] Seq=1 Ack=621193 Win=360960 Len=0 TSval=3266804743 TSecr=2457933984
496,5.204811,192.168.2.2,192.168.1.2,TCP,66,360960,5001  >  58524 [ACK] Seq=1 Ack=624089 Win=360960 Len=0 TSval=3266804768 TSecr=2457934008
498,5.229263,192.168.2.2,192.168.1.2,TCP,66,360960,5001  >  58524 [ACK] Seq=1 Ack=626985 Win=360960 Len=0 TSval=3266804792 TSecr=2457934032
500,5.25289,192.168.2.2,192.168.1.2,TCP,66,360960,5001  >  58524 [ACK] Seq=1 Ack=629881 Win=360960 Len=0 TSval=3266804816 TSecr=2457934057
503,5.277321,192.168.2.2,192.168.1.2,TCP,66,360960,5001  >  58524 [ACK] Seq=1 Ack=632777 Win=360960 Len=0 TSval=3266804840 TSecr=2457934081
505,5.301329,192.168.2.2,192.168.1.2,TCP,66,360960,5001  >  58524 [ACK] Seq=1 Ack=635673 Win=360960 Len=0 TSval=3266804864 TSecr=2457934105
507,5.32556,192.168.2.2,192.168.1.2,TCP,66,360960,5001  >  58524 [ACK] Seq=1 Ack=638569 Win=360960 Len=0 TSval=3266804888 TSecr=2457934129
509,5.34981,192.168.2.2,192.168.1.2,TCP,66,360960,5001  >  58524 [ACK] Seq=1 Ack=641465 Win=360960 Len=0 TSval=3266804912 TSecr=2457934153
512,5.386104,192.168.2.2,192.168.1.2,TCP,66,360960,5001  >  58524 [ACK] Seq=1 Ack=645809 Win=360960 Len=0 TSval=3266804949 TSecr=2457934168
515,5.410617,192.168.2.2,192.168.1.2,TCP,66,360960,5001  >  58524 [ACK] Seq=1 Ack=648705 Win=360960 Len=0 TSval=3266804973 TSecr=2457934202
517,5.435137,192.168.2.2,192.168.1.2,TCP,66,360960,5001  >  58524 [ACK] Seq=1 Ack=651601 Win=360960 Len=0 TSval=3266804998 TSecr=2457934226
519,5.458842,192.168.2.2,192.168.1.2,TCP,66,360960,5001  >  58524 [ACK] Seq=1 Ack=654497 Win=360960 Len=0 TSval=3266805021 TSecr=2457934250
522,5.483129,192.168.2.2,192.168.1.2,TCP,66,360960,5001  >  58524 [ACK] Seq=1 Ack=657393 Win=360960 Len=0 TSval=3266805046 TSecr=2457934274
524,5.507666,192.168.2.2,192.168.1.2,TCP,66,360960,5001  >  58524 [ACK] Seq=1 Ack=660289 Win=360960 Len=0 TSval=3266805070 TSecr=2457934299
527,5.532048,192.168.2.2,192.168.1.2,TCP,66,360960,5001  >  58524 [ACK] Seq=1 Ack=663185 Win=360960 Len=0 TSval=3266805095 TSecr=2457934323
529,5.555708,192.168.2.2,192.168.1.2,TCP,66,360960,5001  >  58524 [ACK] Seq=1 Ack=666081 Win=360960 Len=0 TSval=3266805118 TSecr=2457934347
531,5.580169,192.168.2.2,192.168.1.2,TCP,66,360960,5001  >  58524 [ACK] Seq=1 Ack=668977 Win=360960 Len=0 TSval=3266805143 TSecr=2457934371
533,5.604126,192.168.2.2,192.168.1.2,TCP,66,360960,5001  >  58524 [ACK] Seq=1 Ack=671873 Win=360960 Len=0 TSval=3266805167 TSecr=2457934371
536,5.629139,192.168.2.2,192.168.1.2,TCP,66,360960,5001  >  58524 [ACK] Seq=1 Ack=674769 Win=360960 Len=0 TSval=3266805192 TSecr=2457934395
539,5.652647,192.168.2.2,192.168.1.2,TCP,66,360960,5001  >  58524 [ACK] Seq=1 Ack=677665 Win=360960 Len=0 TSval=3266805215 TSecr=2457934420
541,5.676818,192.168.2.2,192.168.1.2,TCP,66,360960,5001  >  58524 [ACK] Seq=1 Ack=680561 Win=360960 Len=0 TSval=3266805239 TSecr=2457934444
543,5.701746,192.168.2.2,192.168.1.2,TCP,66,360960,5001  >  58524 [ACK] Seq=1 Ack=683457 Win=360960 Len=0 TSval=3266805264 TSecr=2457934468
545,5.725265,192.168.2.2,192.168.1.2,TCP,66,360960,5001  >  58524 [ACK] Seq=1 Ack=686353 Win=360960 Len=0 TSval=3266805288 TSecr=2457934492
547,5.749682,192.168.2.2,192.168.1.2,TCP,66,360960,5001  >  58524 [ACK] Seq=1 Ack=689249 Win=360960 Len=0 TSval=3266805312 TSecr=2457934516
550,5.773795,192.168.2.2,192.168.1.2,TCP,66,360960,5001  >  58524 [ACK] Seq=1 Ack=692145 Win=360960 Len=0 TSval=3266805336 TSecr=2457934541
552,5.798264,192.168.2.2,192.168.1.2,TCP,66,360960,5001  >  58524 [ACK] Seq=1 Ack=695041 Win=360960 Len=0 TSval=3266805361 TSecr=2457934566
554,5.822277,192.168.2.2,192.168.1.2,TCP,66,360960,5001  >  58524 [ACK] Seq=1 Ack=697937 Win=360960 Len=0 TSval=3266805385 TSecr=2457934590
556,5.847295,192.168.2.2,192.168.1.2,TCP,66,360960,5001  >  58524 [ACK] Seq=1 Ack=700833 Win=360960 Len=0 TSval=3266805410 TSecr=2457934590
559,5.870709,192.168.2.2,192.168.1.2,TCP,66,360960,5001  >  58524 [ACK] Seq=1 Ack=703729 Win=360960 Len=0 TSval=3266805433 TSecr=2457934614
561,5.894825,192.168.2.2,192.168.1.2,TCP,66,360960,5001  >  58524 [ACK] Seq=1 Ack=706625 Win=360960 Len=0 TSval=3266805457 TSecr=2457934651
563,5.919782,192.168.2.2,192.168.1.2,TCP,66,360960,5001  >  58524 [ACK] Seq=1 Ack=709521 Win=360960 Len=0 TSval=3266805482 TSecr=2457934675
565,5.943429,192.168.2.2,192.168.1.2,TCP,66,360960,5001  >  58524 [ACK] Seq=1 Ack=712417 Win=360960 Len=0 TSval=3266805506 TSecr=2457934675
569,5.968282,192.168.2.2,192.168.1.2,TCP,66,360960,5001  >  58524 [ACK] Seq=1 Ack=715313 Win=360960 Len=0 TSval=3266805531 TSecr=2457934699
571,5.992568,192.168.2.2,192.168.1.2,TCP,66,360960,5001  >  58524 [ACK] Seq=1 Ack=718209 Win=360960 Len=0 TSval=3266805555 TSecr=2457934723
574,6.016842,192.168.2.2,192.168.1.2,TCP,66,360960,5001  >  58524 [ACK] Seq=1 Ack=721105 Win=360960 Len=0 TSval=3266805579 TSecr=2457934747
577,6.041243,192.168.2.2,192.168.1.2,TCP,66,360960,5001  >  58524 [ACK] Seq=1 Ack=724001 Win=360960 Len=0 TSval=3266805604 TSecr=2457934772
579,6.077632,192.168.2.2,192.168.1.2,TCP,66,360960,5001  >  58524 [ACK] Seq=1 Ack=728345 Win=360960 Len=0 TSval=3266805640 TSecr=2457934772
582,6.102121,192.168.2.2,192.168.1.2,TCP,66,360960,5001  >  58524 [ACK] Seq=1 Ack=731241 Win=360960 Len=0 TSval=3266805664 TSecr=2457934820
584,6.126491,192.168.2.2,192.168.1.2,TCP,66,360960,5001  >  58524 [ACK] Seq=1 Ack=734137 Win=360960 Len=0 TSval=3266805689 TSecr=2457934844
586,6.151078,192.168.2.2,192.168.1.2,TCP,66,360960,5001  >  58524 [ACK] Seq=1 Ack=737033 Win=360960 Len=0 TSval=3266805713 TSecr=2457934869
589,6.174567,192.168.2.2,192.168.1.2,TCP,66,360960,5001  >  58524 [ACK] Seq=1 Ack=739929 Win=360960 Len=0 TSval=3266805737 TSecr=2457934893
591,6.199051,192.168.2.2,192.168.1.2,TCP,66,360960,5001  >  58524 [ACK] Seq=1 Ack=742825 Win=360960 Len=0 TSval=3266805761 TSecr=2457934917
593,6.222976,192.168.2.2,192.168.1.2,TCP,66,360960,5001  >  58524 [ACK] Seq=1 Ack=745721 Win=360960 Len=0 TSval=3266805785 TSecr=2457934917
595,6.247316,192.168.2.2,192.168.1.2,TCP,66,360960,5001  >  58524 [ACK] Seq=1 Ack=748617 Win=360960 Len=0 TSval=3266805809 TSecr=2457934941
598,6.272177,192.168.2.2,192.168.1.2,TCP,66,360960,5001  >  58524 [ACK] Seq=1 Ack=751513 Win=360960 Len=0 TSval=3266805834 TSecr=2457934965
600,6.296149,192.168.2.2,192.168.1.2,TCP,66,360960,5001  >  58524 [ACK] Seq=1 Ack=754409 Win=360960 Len=0 TSval=3266805858 TSecr=2457934989
602,6.320159,192.168.2.2,192.168.1.2,TCP,66,360960,5001  >  58524 [ACK] Seq=1 Ack=757305 Win=360960 Len=0 TSval=3266805882 TSecr=2457935013
604,6.344575,192.168.2.2,192.168.1.2,TCP,66,360960,5001  >  58524 [ACK] Seq=1 Ack=760201 Win=360960 Len=0 TSval=3266805907 TSecr=2457935050
607,6.368353,192.168.2.2,192.168.1.2,TCP,66,360960,5001  >  58524 [ACK] Seq=1 Ack=763097 Win=360960 Len=0 TSval=3266805930 TSecr=2457935050
609,6.39262,192.168.2.2,192.168.1.2,TCP,66,360960,5001  >  58524 [ACK] Seq=1 Ack=765993 Win=360960 Len=0 TSval=3266805955 TSecr=2457935074
611,6.417147,192.168.2.2,192.168.1.2,TCP,66,360960,5001  >  58524 [ACK] Seq=1 Ack=768889 Win=360960 Len=0 TSval=3266805979 TSecr=2457935099
613,6.44101,192.168.2.2,192.168.1.2,TCP,66,360960,5001  >  58524 [ACK] Seq=1 Ack=771785 Win=360960 Len=0 TSval=3266806003 TSecr=2457935122
616,6.465238,192.168.2.2,192.168.1.2,TCP,66,360960,5001  >  58524 [ACK] Seq=1 Ack=774681 Win=360960 Len=0 TSval=3266806027 TSecr=2457935122
619,6.489733,192.168.2.2,192.168.1.2,TCP,66,360960,5001  >  58524 [ACK] Seq=1 Ack=777577 Win=360960 Len=0 TSval=3266806052 TSecr=2457935147
621,6.514137,192.168.2.2,192.168.1.2,TCP,66,360960,5001  >  58524 [ACK] Seq=1 Ack=780473 Win=360960 Len=0 TSval=3266806076 TSecr=2457935171
623,6.550459,192.168.2.2,192.168.1.2,TCP,66,360960,5001  >  58524 [ACK] Seq=1 Ack=784817 Win=360960 Len=0 TSval=3266806112 TSecr=2457935192
627,6.574233,192.168.2.2,192.168.1.2,TCP,66,360960,5001  >  58524 [ACK] Seq=1 Ack=787713 Win=360960 Len=0 TSval=3266806136 TSecr=2457935219
629,6.598505,192.168.2.2,192.168.1.2,TCP,66,360960,5001  >  58524 [ACK] Seq=1 Ack=790609 Win=360960 Len=0 TSval=3266806161 TSecr=2457935244
631,6.623909,192.168.2.2,192.168.1.2,TCP,66,360960,5001  >  58524 [ACK] Seq=1 Ack=793505 Win=360960 Len=0 TSval=3266806186 TSecr=2457935268
634,6.64752,192.168.2.2,192.168.1.2,TCP,66,360960,5001  >  58524 [ACK] Seq=1 Ack=796401 Win=360960 Len=0 TSval=3266806209 TSecr=2457935293
636,6.671907,192.168.2.2,192.168.1.2,TCP,66,360960,5001  >  58524 [ACK] Seq=1 Ack=799297 Win=360960 Len=0 TSval=3266806234 TSecr=2457935293
638,6.695427,192.168.2.2,192.168.1.2,TCP,66,360960,5001  >  58524 [ACK] Seq=1 Ack=802193 Win=360960 Len=0 TSval=3266806257 TSecr=2457935316
641,6.71993,192.168.2.2,192.168.1.2,TCP,66,360960,5001  >  58524 [ACK] Seq=1 Ack=805089 Win=360960 Len=0 TSval=3266806282 TSecr=2457935340
643,6.743799,192.168.2.2,192.168.1.2,TCP,66,360960,5001  >  58524 [ACK] Seq=1 Ack=807985 Win=360960 Len=0 TSval=3266806306 TSecr=2457935365
645,6.768014,192.168.2.2,192.168.1.2,TCP,66,360960,5001  >  58524 [ACK] Seq=1 Ack=810881 Win=360960 Len=0 TSval=3266806330 TSecr=2457935389
648,6.792491,192.168.2.2,192.168.1.2,TCP,66,360960,5001  >  58524 [ACK] Seq=1 Ack=813777 Win=360960 Len=0 TSval=3266806354 TSecr=2457935413
650,6.816441,192.168.2.2,192.168.1.2,TCP,66,360960,5001  >  58524 [ACK] Seq=1 Ack=816673 Win=360960 Len=0 TSval=3266806378 TSecr=2457935413
652,6.840691,192.168.2.2,192.168.1.2,TCP,66,360960,5001  >  58524 [ACK] Seq=1 Ack=819569 Win=360960 Len=0 TSval=3266806403 TSecr=2457935437
655,6.865055,192.168.2.2,192.168.1.2,TCP,66,360960,5001  >  58524 [ACK] Seq=1 Ack=822465 Win=360960 Len=0 TSval=3266806427 TSecr=2457935462
657,6.889604,192.168.2.2,192.168.1.2,TCP,66,360960,5001  >  58524 [ACK] Seq=1 Ack=825361 Win=360960 Len=0 TSval=3266806451 TSecr=2457935486
659,6.913992,192.168.2.2,192.168.1.2,TCP,66,360960,5001  >  58524 [ACK] Seq=1 Ack=828257 Win=360960 Len=0 TSval=3266806476 TSecr=2457935511
662,6.937616,192.168.2.2,192.168.1.2,TCP,66,360960,5001  >  58524 [ACK] Seq=1 Ack=831153 Win=360960 Len=0 TSval=3266806499 TSecr=2457935511
664,6.961817,192.168.2.2,192.168.1.2,TCP,66,360960,5001  >  58524 [ACK] Seq=1 Ack=834049 Win=360960 Len=0 TSval=3266806524 TSecr=2457935534
666,6.986586,192.168.2.2,192.168.1.2,TCP,66,360960,5001  >  58524 [ACK] Seq=1 Ack=836945 Win=360960 Len=0 TSval=3266806548 TSecr=2457935558
669,7.010939,192.168.2.2,192.168.1.2,TCP,66,360960,5001  >  58524 [ACK] Seq=1 Ack=839841 Win=360960 Len=0 TSval=3266806573 TSecr=2457935583
672,7.035072,192.168.2.2,192.168.1.2,TCP,66,360960,5001  >  58524 [ACK] Seq=1 Ack=842737 Win=360960 Len=0 TSval=3266806597 TSecr=2457935607
674,7.05958,192.168.2.2,192.168.1.2,TCP,66,360960,5001  >  58524 [ACK] Seq=1 Ack=845633 Win=360960 Len=0 TSval=3266806621 TSecr=2457935607
