"No.","Time","Source","Destination","Protocol","Length","Calculated window size","Info"
"1","0.000000","192.168.2.2","192.168.1.2","TCP","66","8474","5001  >  58324 [ACK] Seq=1 Ack=1 Win=8474 Len=0 TSval=1144045552 TSecr=1528826878"
"3","0.024352","192.168.2.2","192.168.1.2","TCP","66","8474","5001  >  58324 [ACK] Seq=1 Ack=2897 Win=8474 Len=0 TSval=1144045576 TSecr=1528826878"
"6","0.048768","192.168.2.2","192.168.1.2","TCP","66","8474","5001  >  58324 [ACK] Seq=1 Ack=5793 Win=8474 Len=0 TSval=1144045601 TSecr=1528826902"
"8","0.073251","192.168.2.2","192.168.1.2","TCP","66","8474","5001  >  58324 [ACK] Seq=1 Ack=8689 Win=8474 Len=0 TSval=1144045625 TSecr=1528826927"
"11","0.097754","192.168.2.2","192.168.1.2","TCP","66","8474","5001  >  58324 [ACK] Seq=1 Ack=11585 Win=8474 Len=0 TSval=1144045650 TSecr=1528826927"
"14","0.121824","192.168.2.2","192.168.1.2","TCP","66","8474","5001  >  58324 [ACK] Seq=1 Ack=14481 Win=8474 Len=0 TSval=1144045674 TSecr=1528826951"
"17","0.146052","192.168.2.2","192.168.1.2","TCP","66","8474","5001  >  58324 [ACK] Seq=1 Ack=17377 Win=8474 Len=0 TSval=1144045698 TSecr=1528826975"
"19","0.170298","192.168.2.2","192.168.1.2","TCP","66","8474","5001  >  58324 [ACK] Seq=1 Ack=20273 Win=8474 Len=0 TSval=1144045722 TSecr=1528826975"
"22","0.194792","192.168.2.2","192.168.1.2","TCP","66","8474","5001  >  58324 [ACK] Seq=1 Ack=23169 Win=8474 Len=0 TSval=1144045747 TSecr=1528826999"
"25","0.231033","192.168.2.2","192.168.1.2","TCP","66","8474","5001  >  58324 [ACK] Seq=1 Ack=27513 Win=8474 Len=0 TSval=1144045783 TSecr=1528826999"
"28","0.255556","192.168.2.2","192.168.1.2","TCP","66","8474","5001  >  58324 [ACK] Seq=1 Ack=30409 Win=8474 Len=0 TSval=1144045808 TSecr=1528827048"
"30","0.279329","192.168.2.2","192.168.1.2","TCP","66","8474","5001  >  58324 [ACK] Seq=1 Ack=33305 Win=8474 Len=0 TSval=1144045831 TSecr=1528827048"
"33","0.304073","192.168.2.2","192.168.1.2","TCP","66","8474","5001  >  58324 [ACK] Seq=1 Ack=36201 Win=8474 Len=0 TSval=1144045856 TSecr=1528827072"
"35","0.340330","192.168.2.2","192.168.1.2","TCP","66","8474","5001  >  58324 [ACK] Seq=1 Ack=40545 Win=8474 Len=0 TSval=1144045892 TSecr=1528827093"
"39","0.364063","192.168.2.2","192.168.1.2","TCP","66","8474","5001  >  58324 [ACK] Seq=1 Ack=43441 Win=8474 Len=0 TSval=1144045916 TSecr=1528827121"
"41","0.388356","192.168.2.2","192.168.1.2","TCP","66","8474","5001  >  58324 [ACK] Seq=1 Ack=46337 Win=8474 Len=0 TSval=1144045940 TSecr=1528827121"
"44","0.412857","192.168.2.2","192.168.1.2","TCP","66","8474","5001  >  58324 [ACK] Seq=1 Ack=49233 Win=8474 Len=0 TSval=1144045965 TSecr=1528827144"
"46","0.437366","192.168.2.2","192.168.1.2","TCP","66","8474","5001  >  58324 [ACK] Seq=1 Ack=52129 Win=8474 Len=0 TSval=1144045989 TSecr=1528827169"
"49","0.460952","192.168.2.2","192.168.1.2","TCP","66","8474","5001  >  58324 [ACK] Seq=1 Ack=55025 Win=8474 Len=0 TSval=1144046013 TSecr=1528827169"
"51","0.485191","192.168.2.2","192.168.1.2","TCP","66","8474","5001  >  58324 [ACK] Seq=1 Ack=57921 Win=8474 Len=0 TSval=1144046037 TSecr=1528827193"
"54","0.509943","192.168.2.2","192.168.1.2","TCP","66","8474","5001  >  58324 [ACK] Seq=1 Ack=60817 Win=8474 Len=0 TSval=1144046062 TSecr=1528827230"
"56","0.534389","192.168.2.2","192.168.1.2","TCP","66","8474","5001  >  58324 [ACK] Seq=1 Ack=63713 Win=8474 Len=0 TSval=1144046086 TSecr=1528827230"
"59","0.558026","192.168.2.2","192.168.1.2","TCP","66","8474","5001  >  58324 [ACK] Seq=1 Ack=66609 Win=8474 Len=0 TSval=1144046110 TSecr=1528827230"
"62","0.582414","192.168.2.2","192.168.1.2","TCP","66","8474","5001  >  58324 [ACK] Seq=1 Ack=69505 Win=8474 Len=0 TSval=1144046134 TSecr=1528827253"
"64","0.606894","192.168.2.2","192.168.1.2","TCP","66","8474","5001  >  58324 [ACK] Seq=1 Ack=72401 Win=8474 Len=0 TSval=1144046159 TSecr=1528827278"
"67","0.631406","192.168.2.2","192.168.1.2","TCP","66","8474","5001  >  58324 [ACK] Seq=1 Ack=75297 Win=8474 Len=0 TSval=1144046183 TSecr=1528827278"
"69","0.654958","192.168.2.2","192.168.1.2","TCP","66","8474","5001  >  58324 [ACK] Seq=1 Ack=78193 Win=8474 Len=0 TSval=1144046207 TSecr=1528827302"
"72","0.679507","192.168.2.2","192.168.1.2","TCP","66","8474","5001  >  58324 [ACK] Seq=1 Ack=81089 Win=8474 Len=0 TSval=1144046231 TSecr=1528827326"
"74","0.703248","192.168.2.2","192.168.1.2","TCP","66","8474","5001  >  58324 [ACK] Seq=1 Ack=83985 Win=8474 Len=0 TSval=1144046255 TSecr=1528827326"
"77","0.728505","192.168.2.2","192.168.1.2","TCP","66","8474","5001  >  58324 [ACK] Seq=1 Ack=86881 Win=8474 Len=0 TSval=1144046280 TSecr=1528827362"
"79","0.751994","192.168.2.2","192.168.1.2","TCP","66","8474","5001  >  58324 [ACK] Seq=1 Ack=89777 Win=8474 Len=0 TSval=1144046304 TSecr=1528827362"
"82","0.776532","192.168.2.2","192.168.1.2","TCP","66","8474","5001  >  58324 [ACK] Seq=1 Ack=92673 Win=8474 Len=0 TSval=1144046328 TSecr=1528827387"
"84","0.800979","192.168.2.2","192.168.1.2","TCP","66","8474","5001  >  58324 [ACK] Seq=1 Ack=95569 Win=8474 Len=0 TSval=1144046353 TSecr=1528827411"
"87","0.824481","192.168.2.2","192.168.1.2","TCP","66","8474","5001  >  58324 [ACK] Seq=1 Ack=98465 Win=8474 Len=0 TSval=1144046376 TSecr=1528827411"
"89","0.848947","192.168.2.2","192.168.1.2","TCP","66","8474","5001  >  58324 [ACK] Seq=1 Ack=101361 Win=8474 Len=0 TSval=1144046401 TSecr=1528827435"
"92","0.872755","192.168.2.2","192.168.1.2","TCP","66","8474","5001  >  58324 [ACK] Seq=1 Ack=104257 Win=8474 Len=0 TSval=1144046424 TSecr=1528827460"
"94","0.897539","192.168.2.2","192.168.1.2","TCP","66","8474","5001  >  58324 [ACK] Seq=1 Ack=107153 Win=8474 Len=0 TSval=1144046449 TSecr=1528827460"
"97","0.921972","192.168.2.2","192.168.1.2","TCP","66","8474","5001  >  58324 [ACK] Seq=1 Ack=110049 Win=8474 Len=0 TSval=1144046474 TSecr=1528827484"
"100","0.945497","192.168.2.2","192.168.1.2","TCP","66","8474","5001  >  58324 [ACK] Seq=1 Ack=112945 Win=8474 Len=0 TSval=1144046497 TSecr=1528827508"
"102","0.970042","192.168.2.2","192.168.1.2","TCP","66","8474","5001  >  58324 [ACK] Seq=1 Ack=115841 Win=8474 Len=0 TSval=1144046522 TSecr=1528827508"
"105","0.993941","192.168.2.2","192.168.1.2","TCP","66","8474","5001  >  58324 [ACK] Seq=1 Ack=118737 Win=8474 Len=0 TSval=1144046546 TSecr=1528827533"
"107","1.018145","192.168.2.2","192.168.1.2","TCP","66","8474","5001  >  58324 [ACK] Seq=1 Ack=121633 Win=8474 Len=0 TSval=1144046570 TSecr=1528827556"
"110","1.042594","192.168.2.2","192.168.1.2","TCP","66","8474","5001  >  58324 [ACK] Seq=1 Ack=124529 Win=8474 Len=0 TSval=1144046594 TSecr=1528827556"
"112","1.066617","192.168.2.2","192.168.1.2","TCP","66","8474","5001  >  58324 [ACK] Seq=1 Ack=127425 Win=8474 Len=0 TSval=1144046618 TSecr=1528827581"
"115","1.090818","192.168.2.2","192.168.1.2","TCP","66","8474","5001  >  58324 [ACK] Seq=1 Ack=130321 Win=8474 Len=0 TSval=1144046642 TSecr=1528827604"
"117","1.115092","192.168.2.2","192.168.1.2","TCP","66","8474","5001  >  58324 [ACK] Seq=1 Ack=133217 Win=8474 Len=0 TSval=1144046667 TSecr=1528827604"
"120","1.139635","192.168.2.2","192.168.1.2","TCP","66","8474","5001  >  58324 [ACK] Seq=1 Ack=136113 Win=8474 Len=0 TSval=1144046691 TSecr=1528827629"
"122","1.163476","192.168.2.2","192.168.1.2","TCP","66","8474","5001  >  58324 [ACK] Seq=1 Ack=139009 Win=8474 Len=0 TSval=1144046715 TSecr=1528827653"
"125","1.188539","192.168.2.2","192.168.1.2","TCP","66","8474","5001  >  58324 [ACK] Seq=1 Ack=141905 Win=8474 Len=0 TSval=1144046740 TSecr=1528827653"
"127","1.212069","192.168.2.2","192.168.1.2","TCP","66","8474","5001  >  58324 [ACK] Seq=1 Ack=144801 Win=8474 Len=0 TSval=1144046764 TSecr=1528827677"
"130","1.236593","192.168.2.2","192.168.1.2","TCP","66","8474","5001  >  58324 [ACK] Seq=1 Ack=147697 Win=8474 Len=0 TSval=1144046788 TSecr=1528827701"
"132","1.261119","192.168.2.2","192.168.1.2","TCP","66","8474","5001  >  58324 [ACK] Seq=1 Ack=150593 Win=8474 Len=0 TSval=1144046813 TSecr=1528827701"
"135","1.284707","192.168.2.2","192.168.1.2","TCP","66","8474","5001  >  58324 [ACK] Seq=1 Ack=153489 Win=8474 Len=0 TSval=1144046836 TSecr=1528827726"
"138","1.321952","192.168.2.2","192.168.1.2","TCP","66","8474","5001  >  58324 [ACK] Seq=1 Ack=157833 Win=8474 Len=0 TSval=1144046873 TSecr=1528827726"
"141","1.345424","192.168.2.2","192.168.1.2","TCP","66","8474","5001  >  58324 [ACK] Seq=1 Ack=160729 Win=8474 Len=0 TSval=1144046897 TSecr=1528827775"
"143","1.369966","192.168.2.2","192.168.1.2","TCP","66","8474","5001  >  58324 [ACK] Seq=1 Ack=163625 Win=8474 Len=0 TSval=1144046921 TSecr=1528827775"
"146","1.393633","192.168.2.2","192.168.1.2","TCP","66","8474","5001  >  58324 [ACK] Seq=1 Ack=166521 Win=8474 Len=0 TSval=1144046945 TSecr=1528827798"
"148","1.417896","192.168.2.2","192.168.1.2","TCP","66","8474","5001  >  58324 [ACK] Seq=1 Ack=169417 Win=8474 Len=0 TSval=1144046969 TSecr=1528827823"
"151","1.442401","192.168.2.2","192.168.1.2","TCP","66","8474","5001  >  58324 [ACK] Seq=1 Ack=172313 Win=8474 Len=0 TSval=1144046994 TSecr=1528827823"
"153","1.466922","192.168.2.2","192.168.1.2","TCP","66","8474","5001  >  58324 [ACK] Seq=1 Ack=175209 Win=8474 Len=0 TSval=1144047018 TSecr=1528827847"
"156","1.490520","192.168.2.2","192.168.1.2","TCP","66","8474","5001  >  58324 [ACK] Seq=1 Ack=178105 Win=8474 Len=0 TSval=1144047042 TSecr=1528827871"
"158","1.515465","192.168.2.2","192.168.1.2","TCP","66","8474","5001  >  58324 [ACK] Seq=1 Ack=181001 Win=8474 Len=0 TSval=1144047067 TSecr=1528827871"
"161","1.539952","192.168.2.2","192.168.1.2","TCP","66","8474","5001  >  58324 [ACK] Seq=1 Ack=183897 Win=8474 Len=0 TSval=1144047091 TSecr=1528827895"
"163","1.563487","192.168.2.2","192.168.1.2","TCP","66","8474","5001  >  58324 [ACK] Seq=1 Ack=186793 Win=8474 Len=0 TSval=1144047115 TSecr=1528827920"
"166","1.587375","192.168.2.2","192.168.1.2","TCP","66","8474","5001  >  58324 [ACK] Seq=1 Ack=189689 Win=8474 Len=0 TSval=1144047139 TSecr=1528827920"
"168","1.612476","192.168.2.2","192.168.1.2","TCP","66","8474","5001  >  58324 [ACK] Seq=1 Ack=192585 Win=8474 Len=0 TSval=1144047164 TSecr=1528827944"
"172","1.636595","192.168.2.2","192.168.1.2","TCP","66","8474","5001  >  58324 [ACK] Seq=1 Ack=195481 Win=8474 Len=0 TSval=1144047188 TSecr=1528827969"
"175","1.661489","192.168.2.2","192.168.1.2","TCP","66","8474","5001  >  58324 [ACK] Seq=1 Ack=198377 Win=8474 Len=0 TSval=1144047213 TSecr=1528827969"
"177","1.685140","192.168.2.2","192.168.1.2","TCP","66","8474","5001  >  58324 [ACK] Seq=1 Ack=201273 Win=8474 Len=0 TSval=1144047236 TSecr=1528827993"
"180","1.709534","192.168.2.2","192.168.1.2","TCP","66","8474","5001  >  58324 [ACK] Seq=1 Ack=204169 Win=8474 Len=0 TSval=1144047261 TSecr=1528828017"
"182","1.734050","192.168.2.2","192.168.1.2","TCP","66","8474","5001  >  58324 [ACK] Seq=1 Ack=207065 Win=8474 Len=0 TSval=1144047285 TSecr=1528828017"
"185","1.758504","192.168.2.2","192.168.1.2","TCP","66","8474","5001  >  58324 [ACK] Seq=1 Ack=209961 Win=8474 Len=0 TSval=1144047310 TSecr=1528828041"
"187","1.782007","192.168.2.2","192.168.1.2","TCP","66","8474","5001  >  58324 [ACK] Seq=1 Ack=212857 Win=8474 Len=0 TSval=1144047333 TSecr=1528828066"
"190","1.806512","192.168.2.2","192.168.1.2","TCP","66","8474","5001  >  58324 [ACK] Seq=1 Ack=215753 Win=8474 Len=0 TSval=1144047358 TSecr=1528828066"
"192","1.830430","192.168.2.2","192.168.1.2","TCP","66","8474","5001  >  58324 [ACK] Seq=1 Ack=218649 Win=8474 Len=0 TSval=1144047382 TSecr=1528828090"
"195","1.867317","192.168.2.2","192.168.1.2","TCP","66","8474","5001  >  58324 [ACK] Seq=1 Ack=222993 Win=8474 Len=0 TSval=1144047418 TSecr=1528828090"
"198","1.903084","192.168.2.2","192.168.1.2","TCP","66","8474","5001  >  58324 [ACK] Seq=1 Ack=227337 Win=8474 Len=0 TSval=1144047454 TSecr=1528828118"
"201","1.928116","192.168.2.2","192.168.1.2","TCP","66","8474","5001  >  58324 [ACK] Seq=1 Ack=230233 Win=8474 Len=0 TSval=1144047479 TSecr=1528828162"
"204","1.951661","192.168.2.2","192.168.1.2","TCP","66","8474","5001  >  58324 [ACK] Seq=1 Ack=233129 Win=8474 Len=0 TSval=1144047503 TSecr=1528828162"
"206","1.976165","192.168.2.2","192.168.1.2","TCP","66","8474","5001  >  58324 [ACK] Seq=1 Ack=236025 Win=8474 Len=0 TSval=1144047527 TSecr=1528828187"
"209","1.999976","192.168.2.2","192.168.1.2","TCP","66","8474","5001  >  58324 [ACK] Seq=1 Ack=238921 Win=8474 Len=0 TSval=1144047551 TSecr=1528828211"
"212","2.025142","192.168.2.2","192.168.1.2","TCP","66","8474","5001  >  58324 [ACK] Seq=1 Ack=241817 Win=8474 Len=0 TSval=1144047576 TSecr=1528828211"
"214","2.048520","192.168.2.2","192.168.1.2","TCP","66","8474","5001  >  58324 [ACK] Seq=1 Ack=244713 Win=8474 Len=0 TSval=1144047600 TSecr=1528828235"
"217","2.073236","192.168.2.2","192.168.1.2","TCP","66","8474","5001  >  58324 [ACK] Seq=1 Ack=247609 Win=8474 Len=0 TSval=1144047624 TSecr=1528828259"
"219","2.097133","192.168.2.2","192.168.1.2","TCP","66","8474","5001  >  58324 [ACK] Seq=1 Ack=250505 Win=8474 Len=0 TSval=1144047648 TSecr=1528828259"
"222","2.121650","192.168.2.2","192.168.1.2","TCP","66","8474","5001  >  58324 [ACK] Seq=1 Ack=253401 Win=8474 Len=0 TSval=1144047673 TSecr=1528828284"
"224","2.145351","192.168.2.2","192.168.1.2","TCP","66","8474","5001  >  58324 [ACK] Seq=1 Ack=256297 Win=8474 Len=0 TSval=1144047696 TSecr=1528828319"
"227","2.169759","192.168.2.2","192.168.1.2","TCP","66","8474","5001  >  58324 [ACK] Seq=1 Ack=259193 Win=8474 Len=0 TSval=1144047721 TSecr=1528828319"
"229","2.194236","192.168.2.2","192.168.1.2","TCP","78","8474","[TCP Dup ACK 227#1] 5001  >  58324 [ACK] Seq=1 Ack=259193 Win=8474 Len=0 TSval=1144047745 TSecr=1528828319 SLE=262089 SRE=264985"
"231","2.218735","192.168.2.2","192.168.1.2","TCP","78","8474","[TCP Dup ACK 227#2] 5001  >  58324 [ACK] Seq=1 Ack=259193 Win=8474 Len=0 TSval=1144047770 TSecr=1528828319 SLE=262089 SRE=267881"
"233","2.242250","192.168.2.2","192.168.1.2","TCP","86","8474","[TCP Dup ACK 227#3] 5001  >  58324 [ACK] Seq=1 Ack=259193 Win=8474 Len=0 TSval=1144047793 TSecr=1528828319 SLE=270777 SRE=273673 SLE=262089 SRE=267881"
"235","2.266738","192.168.2.2","192.168.1.2","TCP","86","8474","[TCP Dup ACK 227#4] 5001  >  58324 [ACK] Seq=1 Ack=259193 Win=8474 Len=0 TSval=1144047818 TSecr=1528828319 SLE=270777 SRE=276569 SLE=262089 SRE=267881"
"237","2.291204","192.168.2.2","192.168.1.2","TCP","94","8474","[TCP Dup ACK 227#5] 5001  >  58324 [ACK] Seq=1 Ack=259193 Win=8474 Len=0 TSval=1144047842 TSecr=1528828319 SLE=279465 SRE=282361 SLE=270777 SRE=276569 SLE=262089 SRE=267881"
"239","2.315718","192.168.2.2","192.168.1.2","TCP","94","8474","[TCP Dup ACK 227#6] 5001  >  58324 [ACK] Seq=1 Ack=259193 Win=8474 Len=0 TSval=1144047867 TSecr=1528828319 SLE=279465 SRE=285257 SLE=270777 SRE=276569 SLE=262089 SRE=267881"
"242","2.339261","192.168.2.2","192.168.1.2","TCP","94","8474","[TCP Dup ACK 227#7] 5001  >  58324 [ACK] Seq=1 Ack=259193 Win=8474 Len=0 TSval=1144047890 TSecr=1528828319 SLE=288153 SRE=291049 SLE=279465 SRE=285257 SLE=270777 SRE=276569"
"244","2.363765","192.168.2.2","192.168.1.2","TCP","94","8474","[TCP Dup ACK 227#8] 5001  >  58324 [ACK] Seq=1 Ack=259193 Win=8474 Len=0 TSval=1144047915 TSecr=1528828319 SLE=288153 SRE=293945 SLE=279465 SRE=285257 SLE=270777 SRE=276569"
"247","2.388257","192.168.2.2","192.168.1.2","TCP","94","8474","[TCP Dup ACK 227#9] 5001  >  58324 [ACK] Seq=1 Ack=259193 Win=8474 Len=0 TSval=1144047939 TSecr=1528828319 SLE=296841 SRE=299737 SLE=288153 SRE=293945 SLE=279465 SRE=285257"
"249","2.412705","192.168.2.2","192.168.1.2","TCP","94","8474","[TCP Dup ACK 227#10] 5001  >  58324 [ACK] Seq=1 Ack=259193 Win=8474 Len=0 TSval=1144047964 TSecr=1528828319 SLE=296841 SRE=302633 SLE=288153 SRE=293945 SLE=279465 SRE=285257"
"251","2.436191","192.168.2.2","192.168.1.2","TCP","94","8474","[TCP Dup ACK 227#11] 5001  >  58324 [ACK] Seq=1 Ack=259193 Win=8474 Len=0 TSval=1144047987 TSecr=1528828319 SLE=305529 SRE=308425 SLE=296841 SRE=302633 SLE=288153 SRE=293945"
"253","2.460733","192.168.2.2","192.168.1.2","TCP","94","8474","[TCP Dup ACK 227#12] 5001  >  58324 [ACK] Seq=1 Ack=259193 Win=8474 Len=0 TSval=1144048012 TSecr=1528828319 SLE=305529 SRE=311321 SLE=296841 SRE=302633 SLE=288153 SRE=293945"
"255","2.485267","192.168.2.2","192.168.1.2","TCP","94","8474","[TCP Dup ACK 227#13] 5001  >  58324 [ACK] Seq=1 Ack=259193 Win=8474 Len=0 TSval=1144048036 TSecr=1528828319 SLE=314217 SRE=317113 SLE=305529 SRE=311321 SLE=296841 SRE=302633"
"257","2.508747","192.168.2.2","192.168.1.2","TCP","94","8474","[TCP Dup ACK 227#14] 5001  >  58324 [ACK] Seq=1 Ack=259193 Win=8474 Len=0 TSval=1144048060 TSecr=1528828319 SLE=314217 SRE=320009 SLE=305529 SRE=311321 SLE=296841 SRE=302633"
"259","2.532920","192.168.2.2","192.168.1.2","TCP","94","8474","[TCP Dup ACK 227#15] 5001  >  58324 [ACK] Seq=1 Ack=259193 Win=8474 Len=0 TSval=1144048084 TSecr=1528828319 SLE=322905 SRE=325801 SLE=314217 SRE=320009 SLE=305529 SRE=311321"
"261","2.557790","192.168.2.2","192.168.1.2","TCP","94","8474","[TCP Dup ACK 227#16] 5001  >  58324 [ACK] Seq=1 Ack=259193 Win=8474 Len=0 TSval=1144048109 TSecr=1528828319 SLE=322905 SRE=328697 SLE=314217 SRE=320009 SLE=305529 SRE=311321"
"264","2.581386","192.168.2.2","192.168.1.2","TCP","94","8474","[TCP Dup ACK 227#17] 5001  >  58324 [ACK] Seq=1 Ack=259193 Win=8474 Len=0 TSval=1144048132 TSecr=1528828319 SLE=331593 SRE=334489 SLE=322905 SRE=328697 SLE=314217 SRE=320009"
"266","2.605881","192.168.2.2","192.168.1.2","TCP","94","8474","[TCP Dup ACK 227#18] 5001  >  58324 [ACK] Seq=1 Ack=259193 Win=8474 Len=0 TSval=1144048157 TSecr=1528828319 SLE=331593 SRE=337385 SLE=322905 SRE=328697 SLE=314217 SRE=320009"
"269","2.629802","192.168.2.2","192.168.1.2","TCP","94","8474","[TCP Dup ACK 227#19] 5001  >  58324 [ACK] Seq=1 Ack=259193 Win=8474 Len=0 TSval=1144048181 TSecr=1528828319 SLE=340281 SRE=343177 SLE=331593 SRE=337385 SLE=322905 SRE=328697"
"271","2.654792","192.168.2.2","192.168.1.2","TCP","94","8474","[TCP Dup ACK 227#20] 5001  >  58324 [ACK] Seq=1 Ack=259193 Win=8474 Len=0 TSval=1144048206 TSecr=1528828319 SLE=340281 SRE=346073 SLE=331593 SRE=337385 SLE=322905 SRE=328697"
"273","2.678283","192.168.2.2","192.168.1.2","TCP","94","8474","[TCP Dup ACK 227#21] 5001  >  58324 [ACK] Seq=1 Ack=259193 Win=8474 Len=0 TSval=1144048229 TSecr=1528828319 SLE=348969 SRE=350417 SLE=340281 SRE=346073 SLE=331593 SRE=337385"
"275","2.690580","192.168.2.2","192.168.1.2","TCP","94","8474","[TCP Dup ACK 227#22] 5001  >  58324 [ACK] Seq=1 Ack=259193 Win=8474 Len=0 TSval=1144048241 TSecr=1528828319 SLE=353313 SRE=356209 SLE=348969 SRE=350417 SLE=340281 SRE=346073"
"278","2.715118","192.168.2.2","192.168.1.2","TCP","94","8474","[TCP Dup ACK 227#23] 5001  >  58324 [ACK] Seq=1 Ack=259193 Win=8474 Len=0 TSval=1144048266 TSecr=1528828319 SLE=353313 SRE=359105 SLE=348969 SRE=350417 SLE=340281 SRE=346073"
"280","2.738810","192.168.2.2","192.168.1.2","TCP","94","8474","[TCP Dup ACK 227#24] 5001  >  58324 [ACK] Seq=1 Ack=259193 Win=8474 Len=0 TSval=1144048290 TSecr=1528828319 SLE=353313 SRE=362001 SLE=348969 SRE=350417 SLE=340281 SRE=346073"
"282","2.763169","192.168.2.2","192.168.1.2","TCP","94","8474","[TCP Dup ACK 227#25] 5001  >  58324 [ACK] Seq=1 Ack=259193 Win=8474 Len=0 TSval=1144048314 TSecr=1528828319 SLE=353313 SRE=364897 SLE=348969 SRE=350417 SLE=340281 SRE=346073"
"284","2.787594","192.168.2.2","192.168.1.2","TCP","94","8474","[TCP Dup ACK 227#26] 5001  >  58324 [ACK] Seq=1 Ack=259193 Win=8474 Len=0 TSval=1144048338 TSecr=1528828319 SLE=367793 SRE=370689 SLE=353313 SRE=364897 SLE=348969 SRE=350417"
"286","2.817283","192.168.2.2","192.168.1.2","TCP","94","8474","[TCP Dup ACK 227#27] 5001  >  58324 [ACK] Seq=1 Ack=259193 Win=8474 Len=0 TSval=1144048368 TSecr=1528828319 SLE=367793 SRE=373585 SLE=353313 SRE=364897 SLE=348969 SRE=350417"
"289","2.835709","192.168.2.2","192.168.1.2","TCP","94","8474","[TCP Dup ACK 227#28] 5001  >  58324 [ACK] Seq=1 Ack=259193 Win=8474 Len=0 TSval=1144048386 TSecr=1528828319 SLE=376481 SRE=379377 SLE=367793 SRE=373585 SLE=353313 SRE=364897"
"291","2.860279","192.168.2.2","192.168.1.2","TCP","94","8474","[TCP Dup ACK 227#29] 5001  >  58324 [ACK] Seq=1 Ack=259193 Win=8474 Len=0 TSval=1144048411 TSecr=1528828319 SLE=376481 SRE=382273 SLE=367793 SRE=373585 SLE=353313 SRE=364897"
"293","2.884638","192.168.2.2","192.168.1.2","TCP","94","8474","[TCP Dup ACK 227#30] 5001  >  58324 [ACK] Seq=1 Ack=259193 Win=8474 Len=0 TSval=1144048435 TSecr=1528828319 SLE=385169 SRE=388065 SLE=376481 SRE=382273 SLE=367793 SRE=373585"
"295","2.909167","192.168.2.2","192.168.1.2","TCP","94","8474","[TCP Dup ACK 227#31] 5001  >  58324 [ACK] Seq=1 Ack=259193 Win=8474 Len=0 TSval=1144048460 TSecr=1528828319 SLE=385169 SRE=390961 SLE=376481 SRE=382273 SLE=367793 SRE=373585"
"297","2.932631","192.168.2.2","192.168.1.2","TCP","94","8474","[TCP Dup ACK 227#32] 5001  >  58324 [ACK] Seq=1 Ack=259193 Win=8474 Len=0 TSval=1144048483 TSecr=1528828319 SLE=393857 SRE=396753 SLE=385169 SRE=390961 SLE=376481 SRE=382273"
"299","2.957137","192.168.2.2","192.168.1.2","TCP","94","8474","[TCP Dup ACK 227#33] 5001  >  58324 [ACK] Seq=1 Ack=259193 Win=8474 Len=0 TSval=1144048508 TSecr=1528828319 SLE=393857 SRE=399649 SLE=385169 SRE=390961 SLE=376481 SRE=382273"
"301","2.981709","192.168.2.2","192.168.1.2","TCP","94","8474","[TCP Dup ACK 227#34] 5001  >  58324 [ACK] Seq=1 Ack=259193 Win=8474 Len=0 TSval=1144048532 TSecr=1528828319 SLE=402545 SRE=405441 SLE=393857 SRE=399649 SLE=385169 SRE=390961"
"303","3.005275","192.168.2.2","192.168.1.2","TCP","94","8474","[TCP Dup ACK 227#35] 5001  >  58324 [ACK] Seq=1 Ack=259193 Win=8474 Len=0 TSval=1144048556 TSecr=1528828319 SLE=406889 SRE=409785 SLE=402545 SRE=405441 SLE=393857 SRE=399649"
"306","3.029676","192.168.2.2","192.168.1.2","TCP","94","8474","[TCP Dup ACK 227#36] 5001  >  58324 [ACK] Seq=1 Ack=259193 Win=8474 Len=0 TSval=1144048580 TSecr=1528828319 SLE=406889 SRE=412681 SLE=402545 SRE=405441 SLE=393857 SRE=399649"
"308","3.054174","192.168.2.2","192.168.1.2","TCP","94","8474","[TCP Dup ACK 227#37] 5001  >  58324 [ACK] Seq=1 Ack=259193 Win=8474 Len=0 TSval=1144048605 TSecr=1528828319 SLE=415577 SRE=418473 SLE=406889 SRE=412681 SLE=402545 SRE=405441"
"310","3.077962","192.168.2.2","192.168.1.2","TCP","94","8474","[TCP Dup ACK 227#38] 5001  >  58324 [ACK] Seq=1 Ack=259193 Win=8474 Len=0 TSval=1144048628 TSecr=1528828319 SLE=415577 SRE=421369 SLE=406889 SRE=412681 SLE=402545 SRE=405441"
"312","3.102263","192.168.2.2","192.168.1.2","TCP","94","8474","[TCP Dup ACK 227#39] 5001  >  58324 [ACK] Seq=1 Ack=259193 Win=8474 Len=0 TSval=1144048653 TSecr=1528828319 SLE=424265 SRE=427161 SLE=415577 SRE=421369 SLE=406889 SRE=412681"
"314","3.126705","192.168.2.2","192.168.1.2","TCP","94","8474","[TCP Dup ACK 227#40] 5001  >  58324 [ACK] Seq=1 Ack=259193 Win=8474 Len=0 TSval=1144048677 TSecr=1528828319 SLE=424265 SRE=430057 SLE=415577 SRE=421369 SLE=406889 SRE=412681"
"317","3.151208","192.168.2.2","192.168.1.2","TCP","94","8474","[TCP Dup ACK 227#41] 5001  >  58324 [ACK] Seq=1 Ack=259193 Win=8474 Len=0 TSval=1144048702 TSecr=1528828319 SLE=432953 SRE=435849 SLE=424265 SRE=430057 SLE=415577 SRE=421369"
"319","3.174856","192.168.2.2","192.168.1.2","TCP","94","8474","[TCP Dup ACK 227#42] 5001  >  58324 [ACK] Seq=1 Ack=259193 Win=8474 Len=0 TSval=1144048725 TSecr=1528828319 SLE=432953 SRE=438745 SLE=424265 SRE=430057 SLE=415577 SRE=421369"
"322","3.199222","192.168.2.2","192.168.1.2","TCP","94","8474","[TCP Dup ACK 227#43] 5001  >  58324 [ACK] Seq=1 Ack=259193 Win=8474 Len=0 TSval=1144048750 TSecr=1528828319 SLE=441641 SRE=444537 SLE=432953 SRE=438745 SLE=424265 SRE=430057"
"324","3.223785","192.168.2.2","192.168.1.2","TCP","94","8474","[TCP Dup ACK 227#44] 5001  >  58324 [ACK] Seq=1 Ack=259193 Win=8474 Len=0 TSval=1144048774 TSecr=1528828319 SLE=441641 SRE=447433 SLE=432953 SRE=438745 SLE=424265 SRE=430057"
"326","3.247531","192.168.2.2","192.168.1.2","TCP","94","8474","[TCP Dup ACK 227#45] 5001  >  58324 [ACK] Seq=1 Ack=259193 Win=8474 Len=0 TSval=1144048798 TSecr=1528828319 SLE=450329 SRE=453225 SLE=441641 SRE=447433 SLE=432953 SRE=438745"
"328","3.271869","192.168.2.2","192.168.1.2","TCP","94","8474","[TCP Dup ACK 227#46] 5001  >  58324 [ACK] Seq=1 Ack=259193 Win=8474 Len=0 TSval=1144048822 TSecr=1528828319 SLE=450329 SRE=456121 SLE=441641 SRE=447433 SLE=432953 SRE=438745"
"330","3.295980","192.168.2.2","192.168.1.2","TCP","94","8474","[TCP Dup ACK 227#47] 5001  >  58324 [ACK] Seq=1 Ack=259193 Win=8474 Len=0 TSval=1144048846 TSecr=1528828319 SLE=450329 SRE=459017 SLE=441641 SRE=447433 SLE=432953 SRE=438745"
"332","3.320285","192.168.2.2","192.168.1.2","TCP","94","8474","[TCP Dup ACK 227#48] 5001  >  58324 [ACK] Seq=1 Ack=259193 Win=8474 Len=0 TSval=1144048871 TSecr=1528828319 SLE=450329 SRE=461913 SLE=441641 SRE=447433 SLE=432953 SRE=438745"
"334","3.344483","192.168.2.2","192.168.1.2","TCP","94","8474","[TCP Dup ACK 227#49] 5001  >  58324 [ACK] Seq=1 Ack=259193 Win=8474 Len=0 TSval=1144048895 TSecr=1528828319 SLE=450329 SRE=464809 SLE=441641 SRE=447433 SLE=432953 SRE=438745"
"336","3.368661","192.168.2.2","192.168.1.2","TCP","94","8474","[TCP Dup ACK 227#50] 5001  >  58324 [ACK] Seq=1 Ack=259193 Win=8474 Len=0 TSval=1144048919 TSecr=1528828319 SLE=450329 SRE=467705 SLE=441641 SRE=447433 SLE=432953 SRE=438745"
"338","3.393837","192.168.2.2","192.168.1.2","TCP","94","8474","[TCP Dup ACK 227#51] 5001  >  58324 [ACK] Seq=1 Ack=259193 Win=8474 Len=0 TSval=1144048944 TSecr=1528828319 SLE=470601 SRE=473497 SLE=450329 SRE=467705 SLE=441641 SRE=447433"
"340","3.417298","192.168.2.2","192.168.1.2","TCP","94","8474","[TCP Dup ACK 227#52] 5001  >  58324 [ACK] Seq=1 Ack=259193 Win=8474 Len=0 TSval=1144048968 TSecr=1528828319 SLE=470601 SRE=476393 SLE=450329 SRE=467705 SLE=441641 SRE=447433"
"343","3.441476","192.168.2.2","192.168.1.2","TCP","94","8474","[TCP Dup ACK 227#53] 5001  >  58324 [ACK] Seq=1 Ack=259193 Win=8474 Len=0 TSval=1144048992 TSecr=1528828319 SLE=479289 SRE=480737 SLE=470601 SRE=476393 SLE=450329 SRE=467705"
"344","3.453607","192.168.2.2","192.168.1.2","TCP","94","8474","[TCP Dup ACK 227#54] 5001  >  58324 [ACK] Seq=1 Ack=259193 Win=8474 Len=0 TSval=1144049004 TSecr=1528828319 SLE=483633 SRE=486529 SLE=479289 SRE=480737 SLE=470601 SRE=476393"
"346","3.478121","192.168.2.2","192.168.1.2","TCP","94","8474","[TCP Dup ACK 227#55] 5001  >  58324 [ACK] Seq=1 Ack=259193 Win=8474 Len=0 TSval=1144049028 TSecr=1528828319 SLE=483633 SRE=489425 SLE=479289 SRE=480737 SLE=470601 SRE=476393"
"348","3.501899","192.168.2.2","192.168.1.2","TCP","94","8474","[TCP Dup ACK 227#56] 5001  >  58324 [ACK] Seq=1 Ack=259193 Win=8474 Len=0 TSval=1144049052 TSecr=1528828319 SLE=492321 SRE=495217 SLE=483633 SRE=489425 SLE=479289 SRE=480737"
"350","3.526160","192.168.2.2","192.168.1.2","TCP","94","8474","[TCP Dup ACK 227#57] 5001  >  58324 [ACK] Seq=1 Ack=259193 Win=8474 Len=0 TSval=1144049076 TSecr=1528828319 SLE=492321 SRE=498113 SLE=483633 SRE=489425 SLE=479289 SRE=480737"
"352","3.550618","192.168.2.2","192.168.1.2","TCP","94","8474","[TCP Dup ACK 227#58] 5001  >  58324 [ACK] Seq=1 Ack=259193 Win=8474 Len=0 TSval=1144049101 TSecr=1528828319 SLE=501009 SRE=503905 SLE=492321 SRE=498113 SLE=483633 SRE=489425"
"354","3.575069","192.168.2.2","192.168.1.2","TCP","94","8474","[TCP Dup ACK 227#59] 5001  >  58324 [ACK] Seq=1 Ack=259193 Win=8474 Len=0 TSval=1144049125 TSecr=1528828319 SLE=501009 SRE=506801 SLE=492321 SRE=498113 SLE=483633 SRE=489425"
"357","3.599636","192.168.2.2","192.168.1.2","TCP","94","8474","[TCP Dup ACK 227#60] 5001  >  58324 [ACK] Seq=1 Ack=259193 Win=8474 Len=0 TSval=1144049150 TSecr=1528828319 SLE=509697 SRE=512593 SLE=501009 SRE=506801 SLE=492321 SRE=498113"
"359","3.622979","192.168.2.2","192.168.1.2","TCP","94","8474","[TCP Dup ACK 227#61] 5001  >  58324 [ACK] Seq=1 Ack=259193 Win=8474 Len=0 TSval=1144049173 TSecr=1528828319 SLE=509697 SRE=515489 SLE=501009 SRE=506801 SLE=492321 SRE=498113"
"361","3.647657","192.168.2.2","192.168.1.2","TCP","94","8474","[TCP Dup ACK 227#62] 5001  >  58324 [ACK] Seq=1 Ack=259193 Win=8474 Len=0 TSval=1144049198 TSecr=1528828319 SLE=518385 SRE=521281 SLE=509697 SRE=515489 SLE=501009 SRE=506801"
"363","3.672131","192.168.2.2","192.168.1.2","TCP","94","8474","[TCP Dup ACK 227#63] 5001  >  58324 [ACK] Seq=1 Ack=259193 Win=8474 Len=0 TSval=1144049222 TSecr=1528828319 SLE=518385 SRE=524177 SLE=509697 SRE=515489 SLE=501009 SRE=506801"
"365","3.696657","192.168.2.2","192.168.1.2","TCP","94","8474","[TCP Dup ACK 227#64] 5001  >  58324 [ACK] Seq=1 Ack=259193 Win=8474 Len=0 TSval=1144049247 TSecr=1528828319 SLE=527073 SRE=529969 SLE=518385 SRE=524177 SLE=509697 SRE=515489"
"367","3.720149","192.168.2.2","192.168.1.2","TCP","94","8474","[TCP Dup ACK 227#65] 5001  >  58324 [ACK] Seq=1 Ack=259193 Win=8474 Len=0 TSval=1144049270 TSecr=1528828319 SLE=527073 SRE=532865 SLE=518385 SRE=524177 SLE=509697 SRE=515489"
"369","3.744648","192.168.2.2","192.168.1.2","TCP","94","8474","[TCP Dup ACK 227#66] 5001  >  58324 [ACK] Seq=1 Ack=259193 Win=8474 Len=0 TSval=1144049295 TSecr=1528828319 SLE=535761 SRE=538657 SLE=527073 SRE=532865 SLE=518385 SRE=524177"
"371","3.768480","192.168.2.2","192.168.1.2","TCP","94","8474","[TCP Dup ACK 227#67] 5001  >  58324 [ACK] Seq=1 Ack=259193 Win=8474 Len=0 TSval=1144049319 TSecr=1528828319 SLE=535761 SRE=541553 SLE=527073 SRE=532865 SLE=518385 SRE=524177"
"374","3.792771","192.168.2.2","192.168.1.2","TCP","94","8474","[TCP Dup ACK 227#68] 5001  >  58324 [ACK] Seq=1 Ack=259193 Win=8474 Len=0 TSval=1144049343 TSecr=1528828319 SLE=544449 SRE=545897 SLE=535761 SRE=541553 SLE=527073 SRE=532865"
"376","3.805469","192.168.2.2","192.168.1.2","TCP","94","8474","[TCP Dup ACK 227#69] 5001  >  58324 [ACK] Seq=1 Ack=259193 Win=8474 Len=0 TSval=1144049356 TSecr=1528828319 SLE=548793 SRE=551689 SLE=544449 SRE=545897 SLE=535761 SRE=541553"
"378","3.828957","192.168.2.2","192.168.1.2","TCP","94","8474","[TCP Dup ACK 227#70] 5001  >  58324 [ACK] Seq=1 Ack=259193 Win=8474 Len=0 TSval=1144049379 TSecr=1528828319 SLE=548793 SRE=554585 SLE=544449 SRE=545897 SLE=535761 SRE=541553"
"380","3.853426","192.168.2.2","192.168.1.2","TCP","94","8474","[TCP Dup ACK 227#71] 5001  >  58324 [ACK] Seq=1 Ack=259193 Win=8474 Len=0 TSval=1144049404 TSecr=1528828319 SLE=548793 SRE=557481 SLE=544449 SRE=545897 SLE=535761 SRE=541553"
"383","3.877348","192.168.2.2","192.168.1.2","TCP","94","8474","[TCP Dup ACK 227#72] 5001  >  58324 [ACK] Seq=1 Ack=259193 Win=8474 Len=0 TSval=1144049427 TSecr=1528828319 SLE=548793 SRE=560377 SLE=544449 SRE=545897 SLE=535761 SRE=541553"
"385","3.902016","192.168.2.2","192.168.1.2","TCP","94","8474","[TCP Dup ACK 227#73] 5001  >  58324 [ACK] Seq=1 Ack=259193 Win=8474 Len=0 TSval=1144049452 TSecr=1528828319 SLE=563273 SRE=566169 SLE=548793 SRE=560377 SLE=544449 SRE=545897"
"387","3.925833","192.168.2.2","192.168.1.2","TCP","94","8474","[TCP Dup ACK 227#74] 5001  >  58324 [ACK] Seq=1 Ack=259193 Win=8474 Len=0 TSval=1144049476 TSecr=1528828319 SLE=563273 SRE=569065 SLE=548793 SRE=560377 SLE=544449 SRE=545897"
"389","3.950964","192.168.2.2","192.168.1.2","TCP","94","8474","[TCP Dup ACK 227#75] 5001  >  58324 [ACK] Seq=1 Ack=259193 Win=8474 Len=0 TSval=1144049501 TSecr=1528828319 SLE=571961 SRE=574857 SLE=563273 SRE=569065 SLE=548793 SRE=560377"
"391","3.974531","192.168.2.2","192.168.1.2","TCP","94","8474","[TCP Dup ACK 227#76] 5001  >  58324 [ACK] Seq=1 Ack=259193 Win=8474 Len=0 TSval=1144049525 TSecr=1528828319 SLE=571961 SRE=577753 SLE=563273 SRE=569065 SLE=548793 SRE=560377"
"394","3.998988","192.168.2.2","192.168.1.2","TCP","94","8474","[TCP Dup ACK 227#77] 5001  >  58324 [ACK] Seq=1 Ack=259193 Win=8474 Len=0 TSval=1144049549 TSecr=1528828319 SLE=580649 SRE=583545 SLE=571961 SRE=577753 SLE=563273 SRE=569065"
"396","4.022813","192.168.2.2","192.168.1.2","TCP","94","8474","[TCP Dup ACK 227#78] 5001  >  58324 [ACK] Seq=1 Ack=259193 Win=8474 Len=0 TSval=1144049573 TSecr=1528828319 SLE=580649 SRE=586441 SLE=571961 SRE=577753 SLE=563273 SRE=569065"
"399","4.046985","192.168.2.2","192.168.1.2","TCP","94","8474","[TCP Dup ACK 227#79] 5001  >  58324 [ACK] Seq=1 Ack=259193 Win=8474 Len=0 TSval=1144049597 TSecr=1528828319 SLE=589337 SRE=592233 SLE=580649 SRE=586441 SLE=571961 SRE=577753"
"401","4.071552","192.168.2.2","192.168.1.2","TCP","94","8474","[TCP Dup ACK 227#80] 5001  >  58324 [ACK] Seq=1 Ack=259193 Win=8474 Len=0 TSval=1144049622 TSecr=1528828319 SLE=589337 SRE=595129 SLE=580649 SRE=586441 SLE=571961 SRE=577753"
"403","4.096055","192.168.2.2","192.168.1.2","TCP","94","8474","[TCP Dup ACK 227#81] 5001  >  58324 [ACK] Seq=1 Ack=259193 Win=8474 Len=0 TSval=1144049646 TSecr=1528828319 SLE=598025 SRE=600921 SLE=589337 SRE=595129 SLE=580649 SRE=586441"
"405","4.119576","192.168.2.2","192.168.1.2","TCP","94","8474","[TCP Dup ACK 227#82] 5001  >  58324 [ACK] Seq=1 Ack=259193 Win=8474 Len=0 TSval=1144049670 TSecr=1528828319 SLE=598025 SRE=603817 SLE=589337 SRE=595129 SLE=580649 SRE=586441"
"407","4.144071","192.168.2.2","192.168.1.2","TCP","94","8474","[TCP Dup ACK 227#83] 5001  >  58324 [ACK] Seq=1 Ack=259193 Win=8474 Len=0 TSval=1144049694 TSecr=1528828319 SLE=606713 SRE=609609 SLE=598025 SRE=603817 SLE=589337 SRE=595129"
"409","4.168284","192.168.2.2","192.168.1.2","TCP","94","8474","[TCP Dup ACK 227#84] 5001  >  58324 [ACK] Seq=1 Ack=259193 Win=8474 Len=0 TSval=1144049718 TSecr=1528828319 SLE=611057 SRE=613953 SLE=606713 SRE=609609 SLE=598025 SRE=603817"
"411","4.192269","192.168.2.2","192.168.1.2","TCP","94","8474","[TCP Dup ACK 227#85] 5001  >  58324 [ACK] Seq=1 Ack=259193 Win=8474 Len=0 TSval=1144049742 TSecr=1528828319 SLE=611057 SRE=616849 SLE=606713 SRE=609609 SLE=598025 SRE=603817"
"413","4.216545","192.168.2.2","192.168.1.2","TCP","94","8474","[TCP Dup ACK 227#86] 5001  >  58324 [ACK] Seq=1 Ack=259193 Win=8474 Len=0 TSval=1144049767 TSecr=1528828319 SLE=619745 SRE=622641 SLE=611057 SRE=616849 SLE=606713 SRE=609609"
"415","4.241096","192.168.2.2","192.168.1.2","TCP","94","8474","[TCP Dup ACK 227#87] 5001  >  58324 [ACK] Seq=1 Ack=259193 Win=8474 Len=0 TSval=1144049791 TSecr=1528828319 SLE=619745 SRE=625537 SLE=611057 SRE=616849 SLE=606713 SRE=609609"
"417","4.265217","192.168.2.2","192.168.1.2","TCP","94","8474","[TCP Dup ACK 227#88] 5001  >  58324 [ACK] Seq=1 Ack=259193 Win=8474 Len=0 TSval=1144049815 TSecr=1528828319 SLE=628433 SRE=631329 SLE=619745 SRE=625537 SLE=611057 SRE=616849"
"419","4.289243","192.168.2.2","192.168.1.2","TCP","94","8474","[TCP Dup ACK 227#89] 5001  >  58324 [ACK] Seq=1 Ack=259193 Win=8474 Len=0 TSval=1144049839 TSecr=1528828319 SLE=628433 SRE=634225 SLE=619745 SRE=625537 SLE=611057 SRE=616849"
"421","4.313633","192.168.2.2","192.168.1.2","TCP","94","8474","[TCP Dup ACK 227#90] 5001  >  58324 [ACK] Seq=1 Ack=259193 Win=8474 Len=0 TSval=1144049864 TSecr=1528828319 SLE=637121 SRE=640017 SLE=628433 SRE=634225 SLE=619745 SRE=625537"
"423","4.337632","192.168.2.2","192.168.1.2","TCP","94","8474","[TCP Dup ACK 227#91] 5001  >  58324 [ACK] Seq=1 Ack=259193 Win=8474 Len=0 TSval=1144049888 TSecr=1528828319 SLE=637121 SRE=642913 SLE=628433 SRE=634225 SLE=619745 SRE=625537"
"426","4.361861","192.168.2.2","192.168.1.2","TCP","94","8474","[TCP Dup ACK 227#92] 5001  >  58324 [ACK] Seq=1 Ack=259193 Win=8474 Len=0 TSval=1144049912 TSecr=1528828319 SLE=645809 SRE=648705 SLE=637121 SRE=642913 SLE=628433 SRE=634225"
"428","4.386109","192.168.2.2","192.168.1.2","TCP","94","8474","[TCP Dup ACK 227#93] 5001  >  58324 [ACK] Seq=1 Ack=259193 Win=8474 Len=0 TSval=1144049936 TSecr=1528828319 SLE=645809 SRE=651601 SLE=637121 SRE=642913 SLE=628433 SRE=634225"
"431","4.410582","192.168.2.2","192.168.1.2","TCP","94","8474","[TCP Dup ACK 227#94] 5001  >  58324 [ACK] Seq=1 Ack=259193 Win=8474 Len=0 TSval=1144049960 TSecr=1528828319 SLE=645809 SRE=654497 SLE=637121 SRE=642913 SLE=628433 SRE=634225"
"433","4.434510","192.168.2.2","192.168.1.2","TCP","94","8474","[TCP Dup ACK 227#95] 5001  >  58324 [ACK] Seq=1 Ack=259193 Win=8474 Len=0 TSval=1144049984 TSecr=1528828319 SLE=657393 SRE=660289 SLE=645809 SRE=654497 SLE=637121 SRE=642913"
"435","4.458844","192.168.2.2","192.168.1.2","TCP","94","8474","[TCP Dup ACK 227#96] 5001  >  58324 [ACK] Seq=1 Ack=259193 Win=8474 Len=0 TSval=1144050009 TSecr=1528828319 SLE=657393 SRE=663185 SLE=645809 SRE=654497 SLE=637121 SRE=642913"
"438","4.483105","192.168.2.2","192.168.1.2","TCP","94","8474","[TCP Dup ACK 227#97] 5001  >  58324 [ACK] Seq=1 Ack=259193 Win=8474 Len=0 TSval=1144050033 TSecr=1528828319 SLE=666081 SRE=668977 SLE=657393 SRE=663185 SLE=645809 SRE=654497"
"440","4.507217","192.168.2.2","192.168.1.2","TCP","94","8474","[TCP Dup ACK 227#98] 5001  >  58324 [ACK] Seq=1 Ack=259193 Win=8474 Len=0 TSval=1144050057 TSecr=1528828319 SLE=666081 SRE=671873 SLE=657393 SRE=663185 SLE=645809 SRE=654497"
"442","4.531693","192.168.2.2","192.168.1.2","TCP","94","8474","[TCP Dup ACK 227#99] 5001  >  58324 [ACK] Seq=1 Ack=259193 Win=8474 Len=0 TSval=1144050081 TSecr=1528828319 SLE=674769 SRE=676217 SLE=666081 SRE=671873 SLE=657393 SRE=663185"
"444","4.543660","192.168.2.2","192.168.1.2","TCP","94","8474","[TCP Dup ACK 227#100] 5001  >  58324 [ACK] Seq=1 Ack=259193 Win=8474 Len=0 TSval=1144050093 TSecr=1528828319 SLE=679113 SRE=682009 SLE=674769 SRE=676217 SLE=666081 SRE=671873"
"447","4.567742","192.168.2.2","192.168.1.2","TCP","94","8474","[TCP Dup ACK 227#101] 5001  >  58324 [ACK] Seq=1 Ack=259193 Win=8474 Len=0 TSval=1144050118 TSecr=1528828319 SLE=679113 SRE=684905 SLE=674769 SRE=676217 SLE=666081 SRE=671873"
"449","4.591959","192.168.2.2","192.168.1.2","TCP","94","8474","[TCP Dup ACK 227#102] 5001  >  58324 [ACK] Seq=1 Ack=259193 Win=8474 Len=0 TSval=1144050142 TSecr=1528828319 SLE=687801 SRE=690697 SLE=679113 SRE=684905 SLE=674769 SRE=676217"
"451","4.616147","192.168.2.2","192.168.1.2","TCP","94","8474","[TCP Dup ACK 227#103] 5001  >  58324 [ACK] Seq=1 Ack=259193 Win=8474 Len=0 TSval=1144050166 TSecr=1528828319 SLE=687801 SRE=693593 SLE=679113 SRE=684905 SLE=674769 SRE=676217"
"454","4.640385","192.168.2.2","192.168.1.2","TCP","94","8474","[TCP Dup ACK 227#104] 5001  >  58324 [ACK] Seq=1 Ack=259193 Win=8474 Len=0 TSval=1144050190 TSecr=1528828319 SLE=696489 SRE=699385 SLE=687801 SRE=693593 SLE=679113 SRE=684905"
"456","4.664682","192.168.2.2","192.168.1.2","TCP","94","8474","[TCP Dup ACK 227#105] 5001  >  58324 [ACK] Seq=1 Ack=259193 Win=8474 Len=0 TSval=1144050214 TSecr=1528828319 SLE=696489 SRE=702281 SLE=687801 SRE=693593 SLE=679113 SRE=684905"
"459","4.689247","192.168.2.2","192.168.1.2","TCP","94","8474","[TCP Dup ACK 227#106] 5001  >  58324 [ACK] Seq=1 Ack=259193 Win=8474 Len=0 TSval=1144050239 TSecr=1528828319 SLE=705177 SRE=708073 SLE=696489 SRE=702281 SLE=687801 SRE=693593"
"461","4.713041","192.168.2.2","192.168.1.2","TCP","94","8474","[TCP Dup ACK 227#107] 5001  >  58324 [ACK] Seq=1 Ack=259193 Win=8474 Len=0 TSval=1144050263 TSecr=1528828319 SLE=705177 SRE=710969 SLE=696489 SRE=702281 SLE=687801 SRE=693593"
"463","4.737273","192.168.2.2","192.168.1.2","TCP","94","8474","[TCP Dup ACK 227#108] 5001  >  58324 [ACK] Seq=1 Ack=259193 Win=8474 Len=0 TSval=1144050287 TSecr=1528828319 SLE=713865 SRE=716761 SLE=705177 SRE=710969 SLE=696489 SRE=702281"
"465","4.761505","192.168.2.2","192.168.1.2","TCP","94","8474","[TCP Dup ACK 227#109] 5001  >  58324 [ACK] Seq=1 Ack=259193 Win=8474 Len=0 TSval=1144050311 TSecr=1528828319 SLE=713865 SRE=719657 SLE=705177 SRE=710969 SLE=696489 SRE=702281"
"467","4.786158","192.168.2.2","192.168.1.2","TCP","94","8474","[TCP Dup ACK 227#110] 5001  >  58324 [ACK] Seq=1 Ack=259193 Win=8474 Len=0 TSval=1144050336 TSecr=1528828319 SLE=722553 SRE=725449 SLE=713865 SRE=719657 SLE=705177 SRE=710969"
"469","4.811685","192.168.2.2","192.168.1.2","TCP","94","8474","[TCP Dup ACK 227#111] 5001  >  58324 [ACK] Seq=1 Ack=259193 Win=8474 Len=0 TSval=1144050361 TSecr=1528828319 SLE=722553 SRE=728345 SLE=713865 SRE=719657 SLE=705177 SRE=710969"
