No.,Time,Source,Destination,Protocol,Length,Calculated window size,Info
4,0.000762,192.168.2.2,192.168.1.2,TCP,74,43440,"5001  >  58474 [SYN, ACK] Seq=0 Ack=1 Win=43440 Len=0 MSS=1460 SACK_PERM=1 TSval=3266682411 TSecr=2457812512 WS=512"
7,0.000833,192.168.2.2,192.168.1.2,TCP,66,39936,5001  >  58474 [ACK] Seq=1 Ack=7241 Win=39936 Len=0 TSval=3266682411 TSecr=2457812512
12,0.04972,192.168.2.2,192.168.1.2,TCP,66,39936,5001  >  58474 [ACK] Seq=1 Ack=14481 Win=39936 Len=0 TSval=3266682459 TSecr=2457812512
15,0.110861,192.168.2.2,192.168.1.2,TCP,66,38400,5001  >  58474 [ACK] Seq=1 Ack=24617 Win=38400 Len=0 TSval=3266682521 TSecr=2457812512
24,0.195297,192.168.2.2,192.168.1.2,TCP,66,40960,5001  >  58474 [ACK] Seq=1 Ack=28961 Win=40960 Len=0 TSval=3266682605 TSecr=2457812512
27,0.231448,192.168.2.2,192.168.1.2,TCP,66,42496,5001  >  58474 [ACK] Seq=1 Ack=30409 Win=42496 Len=0 TSval=3266682641 TSecr=2457812525
30,0.243513,192.168.2.2,192.168.1.2,TCP,66,38912,5001  >  58474 [ACK] Seq=1 Ack=39097 Win=38912 Len=0 TSval=3266682653 TSecr=2457812560
32,0.316208,192.168.2.2,192.168.1.2,TCP,66,40960,5001  >  58474 [ACK] Seq=1 Ack=43441 Win=40960 Len=0 TSval=3266682726 TSecr=2457812588
36,0.35298,192.168.2.2,192.168.1.2,TCP,66,41984,5001  >  58474 [ACK] Seq=1 Ack=46337 Win=41984 Len=0 TSval=3266682763 TSecr=2457812622
38,0.377535,192.168.2.2,192.168.1.2,TCP,66,41984,5001  >  58474 [ACK] Seq=1 Ack=49233 Win=41984 Len=0 TSval=3266682787 TSecr=2457812622
40,0.401043,192.168.2.2,192.168.1.2,TCP,66,42496,5001  >  58474 [ACK] Seq=1 Ack=50681 Win=42496 Len=0 TSval=3266682811 TSecr=2457812622
42,0.413746,192.168.2.2,192.168.1.2,TCP,66,41984,5001  >  58474 [ACK] Seq=1 Ack=53577 Win=41984 Len=0 TSval=3266682823 TSecr=2457812622
44,0.437336,192.168.2.2,192.168.1.2,TCP,66,41984,5001  >  58474 [ACK] Seq=1 Ack=56473 Win=41984 Len=0 TSval=3266682847 TSecr=2457812623
46,0.46181,192.168.2.2,192.168.1.2,TCP,66,41984,5001  >  58474 [ACK] Seq=1 Ack=59369 Win=41984 Len=0 TSval=3266682871 TSecr=2457812624
48,0.486246,192.168.2.2,192.168.1.2,TCP,66,41984,5001  >  58474 [ACK] Seq=1 Ack=62265 Win=41984 Len=0 TSval=3266682896 TSecr=2457812625
50,0.510782,192.168.2.2,192.168.1.2,TCP,78,42496,[TCP Window Update] 5001  >  58474 [ACK] Seq=1 Ack=62265 Win=42496 Len=0 TSval=3266682920 TSecr=2457812676 SLE=60817 SRE=62265
52,0.522121,192.168.2.2,192.168.1.2,TCP,66,41984,5001  >  58474 [ACK] Seq=1 Ack=65161 Win=41984 Len=0 TSval=3266682932 TSecr=2457812706
54,0.546335,192.168.2.2,192.168.1.2,TCP,66,41984,5001  >  58474 [ACK] Seq=1 Ack=68057 Win=41984 Len=0 TSval=3266682956 TSecr=2457812706
57,0.570574,192.168.2.2,192.168.1.2,TCP,66,41984,5001  >  58474 [ACK] Seq=1 Ack=70953 Win=41984 Len=0 TSval=3266682980 TSecr=2457812742
59,0.594788,192.168.2.2,192.168.1.2,TCP,66,42496,5001  >  58474 [ACK] Seq=1 Ack=72401 Win=42496 Len=0 TSval=3266683004 TSecr=2457812742
61,0.606962,192.168.2.2,192.168.1.2,TCP,66,41984,5001  >  58474 [ACK] Seq=1 Ack=75297 Win=41984 Len=0 TSval=3266683016 TSecr=2457812754
63,0.631293,192.168.2.2,192.168.1.2,TCP,66,41984,5001  >  58474 [ACK] Seq=1 Ack=78193 Win=41984 Len=0 TSval=3266683041 TSecr=2457812827
65,0.655873,192.168.2.2,192.168.1.2,TCP,66,48128,5001  >  58474 [ACK] Seq=1 Ack=81089 Win=48128 Len=0 TSval=3266683065 TSecr=2457812827
69,0.680371,192.168.2.2,192.168.1.2,TCP,66,54272,5001  >  58474 [ACK] Seq=1 Ack=83985 Win=54272 Len=0 TSval=3266683090 TSecr=2457812827
74,0.703817,192.168.2.2,192.168.1.2,TCP,66,59904,5001  >  58474 [ACK] Seq=1 Ack=86881 Win=59904 Len=0 TSval=3266683113 TSecr=2457812864
78,0.728401,192.168.2.2,192.168.1.2,TCP,66,65536,5001  >  58474 [ACK] Seq=1 Ack=89777 Win=65536 Len=0 TSval=3266683138 TSecr=2457812888
82,0.752322,192.168.2.2,192.168.1.2,TCP,66,71680,5001  >  58474 [ACK] Seq=1 Ack=92673 Win=71680 Len=0 TSval=3266683162 TSecr=2457812912
86,0.776463,192.168.2.2,192.168.1.2,TCP,66,74240,5001  >  58474 [ACK] Seq=1 Ack=94121 Win=74240 Len=0 TSval=3266683186 TSecr=2457812924
89,0.789107,192.168.2.2,192.168.1.2,TCP,66,80384,5001  >  58474 [ACK] Seq=1 Ack=97017 Win=80384 Len=0 TSval=3266683198 TSecr=2457812948
93,0.812898,192.168.2.2,192.168.1.2,TCP,66,86016,5001  >  58474 [ACK] Seq=1 Ack=99913 Win=86016 Len=0 TSval=3266683222 TSecr=2457812972
96,0.837175,192.168.2.2,192.168.1.2,TCP,66,91648,5001  >  58474 [ACK] Seq=1 Ack=102809 Win=91648 Len=0 TSval=3266683246 TSecr=2457812997
98,0.861601,192.168.2.2,192.168.1.2,TCP,66,95744,5001  >  58474 [ACK] Seq=1 Ack=104761 Win=95744 Len=0 TSval=3266683271 TSecr=2457813021
100,0.878343,192.168.2.2,192.168.1.2,TCP,66,98304,5001  >  58474 [ACK] Seq=1 Ack=106209 Win=98304 Len=0 TSval=3266683288 TSecr=2457813033
103,0.890755,192.168.2.2,192.168.1.2,TCP,66,104448,5001  >  58474 [ACK] Seq=1 Ack=109105 Win=104448 Len=0 TSval=3266683300 TSecr=2457813057
106,0.915555,192.168.2.2,192.168.1.2,TCP,66,110080,5001  >  58474 [ACK] Seq=1 Ack=112001 Win=110080 Len=0 TSval=3266683325 TSecr=2457813081
108,0.939995,192.168.2.2,192.168.1.2,TCP,66,115712,5001  >  58474 [ACK] Seq=1 Ack=114897 Win=115712 Len=0 TSval=3266683349 TSecr=2457813105
110,0.963573,192.168.2.2,192.168.1.2,TCP,66,118784,5001  >  58474 [ACK] Seq=1 Ack=115841 Win=118784 Len=0 TSval=3266683373 TSecr=2457813117
112,0.971501,192.168.2.2,192.168.1.2,TCP,66,124416,5001  >  58474 [ACK] Seq=1 Ack=118737 Win=124416 Len=0 TSval=3266683381 TSecr=2457813142
114,0.995729,192.168.2.2,192.168.1.2,TCP,66,130560,5001  >  58474 [ACK] Seq=1 Ack=121633 Win=130560 Len=0 TSval=3266683405 TSecr=2457813166
117,1.020377,192.168.2.2,192.168.1.2,TCP,66,136192,5001  >  58474 [ACK] Seq=1 Ack=124529 Win=136192 Len=0 TSval=3266683430 TSecr=2457813166
119,1.044222,192.168.2.2,192.168.1.2,TCP,66,141824,5001  >  58474 [ACK] Seq=1 Ack=127425 Win=141824 Len=0 TSval=3266683453 TSecr=2457813166
122,1.068463,192.168.2.2,192.168.1.2,TCP,66,147968,5001  >  58474 [ACK] Seq=1 Ack=130321 Win=147968 Len=0 TSval=3266683478 TSecr=2457813191
124,1.092908,192.168.2.2,192.168.1.2,TCP,66,153600,5001  >  58474 [ACK] Seq=1 Ack=133217 Win=153600 Len=0 TSval=3266683502 TSecr=2457813191
126,1.116859,192.168.2.2,192.168.1.2,TCP,78,159232,[TCP Window Update] 5001  >  58474 [ACK] Seq=1 Ack=133217 Win=159232 Len=0 TSval=3266683526 TSecr=2457813191 SLE=137561 SRE=140457
128,1.141092,192.168.2.2,192.168.1.2,TCP,86,165376,[TCP Window Update] 5001  >  58474 [ACK] Seq=1 Ack=133217 Win=165376 Len=0 TSval=3266683550 TSecr=2457813191 SLE=146249 SRE=149145 SLE=137561 SRE=140457
130,1.165416,192.168.2.2,192.168.1.2,TCP,94,171008,[TCP Window Update] 5001  >  58474 [ACK] Seq=1 Ack=133217 Win=171008 Len=0 TSval=3266683575 TSecr=2457813191 SLE=154937 SRE=157833 SLE=146249 SRE=149145 SLE=137561 SRE=140457
132,1.189527,192.168.2.2,192.168.1.2,TCP,94,176640,[TCP Window Update] 5001  >  58474 [ACK] Seq=1 Ack=133217 Win=176640 Len=0 TSval=3266683599 TSecr=2457813191 SLE=162177 SRE=165073 SLE=154937 SRE=157833 SLE=146249 SRE=149145
134,1.213754,192.168.2.2,192.168.1.2,TCP,94,179712,[TCP Window Update] 5001  >  58474 [ACK] Seq=1 Ack=133217 Win=179712 Len=0 TSval=3266683623 TSecr=2457813191 SLE=167969 SRE=170865 SLE=162177 SRE=165073 SLE=154937 SRE=157833
137,1.238044,192.168.2.2,192.168.1.2,TCP,94,179712,[TCP Dup ACK 124#1] 5001  >  58474 [ACK] Seq=1 Ack=133217 Win=179712 Len=0 TSval=3266683647 TSecr=2457813191 SLE=176657 SRE=179553 SLE=167969 SRE=170865 SLE=162177 SRE=165073
140,1.262509,192.168.2.2,192.168.1.2,TCP,94,179712,[TCP Dup ACK 124#2] 5001  >  58474 [ACK] Seq=1 Ack=133217 Win=179712 Len=0 TSval=3266683672 TSecr=2457813191 SLE=181001 SRE=183897 SLE=176657 SRE=179553 SLE=167969 SRE=170865
143,1.286964,192.168.2.2,192.168.1.2,TCP,94,179712,[TCP Dup ACK 124#3] 5001  >  58474 [ACK] Seq=1 Ack=133217 Win=179712 Len=0 TSval=3266683696 TSecr=2457813191 SLE=181001 SRE=186793 SLE=176657 SRE=179553 SLE=167969 SRE=170865
145,1.311493,192.168.2.2,192.168.1.2,TCP,94,179712,[TCP Dup ACK 124#4] 5001  >  58474 [ACK] Seq=1 Ack=133217 Win=179712 Len=0 TSval=3266683721 TSecr=2457813191 SLE=181001 SRE=188241 SLE=176657 SRE=179553 SLE=167969 SRE=170865
147,1.323229,192.168.2.2,192.168.1.2,TCP,94,179712,[TCP Dup ACK 124#5] 5001  >  58474 [ACK] Seq=1 Ack=133217 Win=179712 Len=0 TSval=3266683732 TSecr=2457813191 SLE=181001 SRE=191137 SLE=176657 SRE=179553 SLE=167969 SRE=170865
150,1.346967,192.168.2.2,192.168.1.2,TCP,94,179712,[TCP Dup ACK 124#6] 5001  >  58474 [ACK] Seq=1 Ack=133217 Win=179712 Len=0 TSval=3266683756 TSecr=2457813191 SLE=181001 SRE=194033 SLE=176657 SRE=179553 SLE=167969 SRE=170865
154,1.371245,192.168.2.2,192.168.1.2,TCP,94,179712,[TCP Dup ACK 124#7] 5001  >  58474 [ACK] Seq=1 Ack=133217 Win=179712 Len=0 TSval=3266683780 TSecr=2457813191 SLE=181001 SRE=196929 SLE=176657 SRE=179553 SLE=167969 SRE=170865
157,1.395768,192.168.2.2,192.168.1.2,TCP,94,179712,[TCP Dup ACK 124#8] 5001  >  58474 [ACK] Seq=1 Ack=133217 Win=179712 Len=0 TSval=3266683805 TSecr=2457813191 SLE=181001 SRE=198377 SLE=176657 SRE=179553 SLE=167969 SRE=170865
159,1.407566,192.168.2.2,192.168.1.2,TCP,94,179712,[TCP Dup ACK 124#9] 5001  >  58474 [ACK] Seq=1 Ack=133217 Win=179712 Len=0 TSval=3266683817 TSecr=2457813191 SLE=181001 SRE=201273 SLE=176657 SRE=179553 SLE=167969 SRE=170865
161,1.432005,192.168.2.2,192.168.1.2,TCP,94,179712,[TCP Dup ACK 124#10] 5001  >  58474 [ACK] Seq=1 Ack=133217 Win=179712 Len=0 TSval=3266683841 TSecr=2457813191 SLE=181001 SRE=202721 SLE=176657 SRE=179553 SLE=167969 SRE=170865
164,1.44468,192.168.2.2,192.168.1.2,TCP,94,179712,[TCP Dup ACK 124#11] 5001  >  58474 [ACK] Seq=1 Ack=133217 Win=179712 Len=0 TSval=3266683854 TSecr=2457813191 SLE=181001 SRE=205617 SLE=176657 SRE=179553 SLE=167969 SRE=170865
167,1.469277,192.168.2.2,192.168.1.2,TCP,94,179712,[TCP Dup ACK 124#12] 5001  >  58474 [ACK] Seq=1 Ack=133217 Win=179712 Len=0 TSval=3266683878 TSecr=2457813191 SLE=181001 SRE=208513 SLE=176657 SRE=179553 SLE=167969 SRE=170865
169,1.493821,192.168.2.2,192.168.1.2,TCP,94,179712,[TCP Dup ACK 124#13] 5001  >  58474 [ACK] Seq=1 Ack=133217 Win=179712 Len=0 TSval=3266683903 TSecr=2457813191 SLE=211409 SRE=214305 SLE=181001 SRE=208513 SLE=176657 SRE=179553
171,1.517344,192.168.2.2,192.168.1.2,TCP,94,179712,[TCP Dup ACK 124#14] 5001  >  58474 [ACK] Seq=1 Ack=133217 Win=179712 Len=0 TSval=3266683926 TSecr=2457813191 SLE=211409 SRE=217201 SLE=181001 SRE=208513 SLE=176657 SRE=179553
173,1.541797,192.168.2.2,192.168.1.2,TCP,94,177152,5001  >  58474 [ACK] Seq=1 Ack=136113 Win=177152 Len=0 TSval=3266683951 TSecr=2457813627 SLE=211409 SRE=217201 SLE=181001 SRE=208513 SLE=176657 SRE=179553
177,1.566277,192.168.2.2,192.168.1.2,TCP,94,173056,5001  >  58474 [ACK] Seq=1 Ack=140457 Win=173056 Len=0 TSval=3266683975 TSecr=2457813651 SLE=211409 SRE=217201 SLE=181001 SRE=208513 SLE=176657 SRE=179553
179,1.577908,192.168.2.2,192.168.1.2,TCP,94,170496,5001  >  58474 [ACK] Seq=1 Ack=143353 Win=170496 Len=0 TSval=3266683987 TSecr=2457813676 SLE=211409 SRE=217201 SLE=181001 SRE=208513 SLE=176657 SRE=179553
182,1.602513,192.168.2.2,192.168.1.2,TCP,94,169472,5001  >  58474 [ACK] Seq=1 Ack=144801 Win=169472 Len=0 TSval=3266684011 TSecr=2457813700 SLE=211409 SRE=217201 SLE=181001 SRE=208513 SLE=176657 SRE=179553
184,1.614355,192.168.2.2,192.168.1.2,TCP,94,165376,5001  >  58474 [ACK] Seq=1 Ack=149145 Win=165376 Len=0 TSval=3266684023 TSecr=2457813724 SLE=211409 SRE=217201 SLE=181001 SRE=208513 SLE=176657 SRE=179553
186,1.626343,192.168.2.2,192.168.1.2,TCP,94,165376,[TCP Dup ACK 184#1] 5001  >  58474 [ACK] Seq=1 Ack=149145 Win=165376 Len=0 TSval=3266684035 TSecr=2457813724 SLE=150593 SRE=152041 SLE=211409 SRE=217201 SLE=181001 SRE=208513
188,1.638849,192.168.2.2,192.168.1.2,TCP,94,165376,[TCP Dup ACK 184#2] 5001  >  58474 [ACK] Seq=1 Ack=149145 Win=165376 Len=0 TSval=3266684048 TSecr=2457813724 SLE=153489 SRE=154937 SLE=150593 SRE=152041 SLE=211409 SRE=217201
190,1.650609,192.168.2.2,192.168.1.2,TCP,94,165376,[TCP Dup ACK 184#3] 5001  >  58474 [ACK] Seq=1 Ack=149145 Win=165376 Len=0 TSval=3266684060 TSecr=2457813724 SLE=159281 SRE=162177 SLE=153489 SRE=154937 SLE=150593 SRE=152041
193,1.675109,192.168.2.2,192.168.1.2,TCP,94,165376,[TCP Dup ACK 184#4] 5001  >  58474 [ACK] Seq=1 Ack=149145 Win=165376 Len=0 TSval=3266684084 TSecr=2457813724 SLE=165073 SRE=166521 SLE=159281 SRE=162177 SLE=153489 SRE=154937
195,1.686892,192.168.2.2,192.168.1.2,TCP,94,165376,[TCP Dup ACK 184#5] 5001  >  58474 [ACK] Seq=1 Ack=149145 Win=165376 Len=0 TSval=3266684096 TSecr=2457813724 SLE=165073 SRE=167969 SLE=159281 SRE=162177 SLE=153489 SRE=154937
197,1.699015,192.168.2.2,192.168.1.2,TCP,94,165376,[TCP Dup ACK 184#6] 5001  >  58474 [ACK] Seq=1 Ack=149145 Win=165376 Len=0 TSval=3266684108 TSecr=2457813724 SLE=172313 SRE=173761 SLE=165073 SRE=167969 SLE=159281 SRE=162177
199,1.711135,192.168.2.2,192.168.1.2,TCP,94,165376,[TCP Dup ACK 184#7] 5001  >  58474 [ACK] Seq=1 Ack=149145 Win=165376 Len=0 TSval=3266684120 TSecr=2457813724 SLE=175209 SRE=176657 SLE=172313 SRE=173761 SLE=165073 SRE=167969
202,1.724061,192.168.2.2,192.168.1.2,TCP,94,165376,[TCP Dup ACK 184#8] 5001  >  58474 [ACK] Seq=1 Ack=149145 Win=165376 Len=0 TSval=3266684133 TSecr=2457813724 SLE=217201 SRE=218649 SLE=175209 SRE=176657 SLE=172313 SRE=173761
204,1.735814,192.168.2.2,192.168.1.2,TCP,94,165376,[TCP Dup ACK 184#9] 5001  >  58474 [ACK] Seq=1 Ack=149145 Win=165376 Len=0 TSval=3266684145 TSecr=2457813724 SLE=217201 SRE=221545 SLE=175209 SRE=176657 SLE=172313 SRE=173761
206,1.760372,192.168.2.2,192.168.1.2,TCP,94,165376,[TCP Dup ACK 184#10] 5001  >  58474 [ACK] Seq=1 Ack=149145 Win=165376 Len=0 TSval=3266684169 TSecr=2457813724 SLE=217201 SRE=222993 SLE=175209 SRE=176657 SLE=172313 SRE=173761
208,1.772145,192.168.2.2,192.168.1.2,TCP,94,165376,[TCP Dup ACK 184#11] 5001  >  58474 [ACK] Seq=1 Ack=149145 Win=165376 Len=0 TSval=3266684181 TSecr=2457813724 SLE=217201 SRE=224441 SLE=175209 SRE=176657 SLE=172313 SRE=173761
210,1.78388,192.168.2.2,192.168.1.2,TCP,94,165376,[TCP Dup ACK 184#12] 5001  >  58474 [ACK] Seq=1 Ack=149145 Win=165376 Len=0 TSval=3266684193 TSecr=2457813724 SLE=217201 SRE=225889 SLE=175209 SRE=176657 SLE=172313 SRE=173761
212,1.796597,192.168.2.2,192.168.1.2,TCP,94,165376,[TCP Dup ACK 184#13] 5001  >  58474 [ACK] Seq=1 Ack=149145 Win=165376 Len=0 TSval=3266684205 TSecr=2457813724 SLE=217201 SRE=228785 SLE=175209 SRE=176657 SLE=172313 SRE=173761
214,1.82016,192.168.2.2,192.168.1.2,TCP,94,165376,[TCP Dup ACK 184#14] 5001  >  58474 [ACK] Seq=1 Ack=149145 Win=165376 Len=0 TSval=3266684229 TSecr=2457813724 SLE=208513 SRE=211409 SLE=217201 SRE=228785 SLE=175209 SRE=176657
217,1.84466,192.168.2.2,192.168.1.2,TCP,94,165376,[TCP Dup ACK 184#15] 5001  >  58474 [ACK] Seq=1 Ack=149145 Win=165376 Len=0 TSval=3266684253 TSecr=2457813724 SLE=217201 SRE=231681 SLE=208513 SRE=211409 SLE=175209 SRE=176657
219,1.868598,192.168.2.2,192.168.1.2,TCP,94,165376,[TCP Dup ACK 184#16] 5001  >  58474 [ACK] Seq=1 Ack=149145 Win=165376 Len=0 TSval=3266684277 TSecr=2457813724 SLE=217201 SRE=234577 SLE=208513 SRE=211409 SLE=175209 SRE=176657
221,1.892826,192.168.2.2,192.168.1.2,TCP,94,165376,[TCP Dup ACK 184#17] 5001  >  58474 [ACK] Seq=1 Ack=149145 Win=165376 Len=0 TSval=3266684302 TSecr=2457813724 SLE=238921 SRE=241817 SLE=217201 SRE=234577 SLE=208513 SRE=211409
225,1.917143,192.168.2.2,192.168.1.2,TCP,94,165376,[TCP Dup ACK 184#18] 5001  >  58474 [ACK] Seq=1 Ack=149145 Win=165376 Len=0 TSval=3266684326 TSecr=2457813724 SLE=238921 SRE=244713 SLE=217201 SRE=234577 SLE=208513 SRE=211409
228,1.941255,192.168.2.2,192.168.1.2,TCP,94,165376,[TCP Dup ACK 184#19] 5001  >  58474 [ACK] Seq=1 Ack=149145 Win=165376 Len=0 TSval=3266684350 TSecr=2457813724 SLE=246161 SRE=249057 SLE=238921 SRE=244713 SLE=217201 SRE=234577
231,1.966109,192.168.2.2,192.168.1.2,TCP,94,165376,[TCP Dup ACK 184#20] 5001  >  58474 [ACK] Seq=1 Ack=149145 Win=165376 Len=0 TSval=3266684375 TSecr=2457813724 SLE=246161 SRE=251953 SLE=238921 SRE=244713 SLE=217201 SRE=234577
233,1.989759,192.168.2.2,192.168.1.2,TCP,94,162816,5001  >  58474 [ACK] Seq=1 Ack=152041 Win=162816 Len=0 TSval=3266684399 TSecr=2457814136 SLE=246161 SRE=251953 SLE=238921 SRE=244713 SLE=217201 SRE=234577
235,2.001877,192.168.2.2,192.168.1.2,TCP,94,157184,5001  >  58474 [ACK] Seq=1 Ack=157833 Win=157184 Len=0 TSval=3266684411 TSecr=2457814149 SLE=246161 SRE=251953 SLE=238921 SRE=244713 SLE=217201 SRE=234577
237,2.014148,192.168.2.2,192.168.1.2,TCP,94,144384,5001  >  58474 [ACK] Seq=1 Ack=170865 Win=144384 Len=0 TSval=3266684423 TSecr=2457814161 SLE=246161 SRE=251953 SLE=238921 SRE=244713 SLE=217201 SRE=234577
240,2.026051,192.168.2.2,192.168.1.2,TCP,94,148992,[TCP Window Update] 5001  >  58474 [ACK] Seq=1 Ack=170865 Win=148992 Len=0 TSval=3266684435 TSecr=2457814161 SLE=253401 SRE=254849 SLE=246161 SRE=251953 SLE=238921 SRE=244713
242,2.038719,192.168.2.2,192.168.1.2,TCP,94,148992,[TCP Dup ACK 237#1] 5001  >  58474 [ACK] Seq=1 Ack=170865 Win=148992 Len=0 TSval=3266684447 TSecr=2457814161 SLE=253401 SRE=256297 SLE=246161 SRE=251953 SLE=238921 SRE=244713
244,2.050268,192.168.2.2,192.168.1.2,TCP,94,147456,5001  >  58474 [ACK] Seq=1 Ack=173761 Win=147456 Len=0 TSval=3266684459 TSecr=2457814209 SLE=253401 SRE=256297 SLE=246161 SRE=251953 SLE=238921 SRE=244713
246,2.063259,192.168.2.2,192.168.1.2,TCP,94,149504,5001  >  58474 [ACK] Seq=1 Ack=179553 Win=149504 Len=0 TSval=3266684472 TSecr=2457814221 SLE=253401 SRE=256297 SLE=246161 SRE=251953 SLE=238921 SRE=244713
248,2.074484,192.168.2.2,192.168.1.2,TCP,94,152064,5001  >  58474 [ACK] Seq=1 Ack=234577 Win=152064 Len=0 TSval=3266684483 TSecr=2457814234 SLE=253401 SRE=256297 SLE=246161 SRE=251953 SLE=238921 SRE=244713
250,2.086658,192.168.2.2,192.168.1.2,TCP,94,179712,[TCP Window Update] 5001  >  58474 [ACK] Seq=1 Ack=234577 Win=179712 Len=0 TSval=3266684495 TSecr=2457814234 SLE=253401 SRE=259193 SLE=246161 SRE=251953 SLE=238921 SRE=244713
252,2.11212,192.168.2.2,192.168.1.2,TCP,94,179712,[TCP Dup ACK 248#1] 5001  >  58474 [ACK] Seq=1 Ack=234577 Win=179712 Len=0 TSval=3266684521 TSecr=2457814234 SLE=253401 SRE=260641 SLE=246161 SRE=251953 SLE=238921 SRE=244713
253,2.122978,192.168.2.2,192.168.1.2,TCP,94,179712,[TCP Dup ACK 248#2] 5001  >  58474 [ACK] Seq=1 Ack=234577 Win=179712 Len=0 TSval=3266684532 TSecr=2457814234 SLE=253401 SRE=262089 SLE=246161 SRE=251953 SLE=238921 SRE=244713
255,2.135056,192.168.2.2,192.168.1.2,TCP,94,179712,[TCP Dup ACK 248#3] 5001  >  58474 [ACK] Seq=1 Ack=234577 Win=179712 Len=0 TSval=3266684544 TSecr=2457814234 SLE=253401 SRE=263537 SLE=246161 SRE=251953 SLE=238921 SRE=244713
257,2.14752,192.168.2.2,192.168.1.2,TCP,94,179712,[TCP Dup ACK 248#4] 5001  >  58474 [ACK] Seq=1 Ack=234577 Win=179712 Len=0 TSval=3266684556 TSecr=2457814234 SLE=253401 SRE=266433 SLE=246161 SRE=251953 SLE=238921 SRE=244713
259,2.172014,192.168.2.2,192.168.1.2,TCP,94,179712,[TCP Dup ACK 248#5] 5001  >  58474 [ACK] Seq=1 Ack=234577 Win=179712 Len=0 TSval=3266684581 TSecr=2457814234 SLE=253401 SRE=267881 SLE=246161 SRE=251953 SLE=238921 SRE=244713
261,2.18374,192.168.2.2,192.168.1.2,TCP,94,179712,[TCP Dup ACK 248#6] 5001  >  58474 [ACK] Seq=1 Ack=234577 Win=179712 Len=0 TSval=3266684592 TSecr=2457814234 SLE=269329 SRE=272225 SLE=253401 SRE=267881 SLE=246161 SRE=251953
263,2.208191,192.168.2.2,192.168.1.2,TCP,94,179712,[TCP Dup ACK 248#7] 5001  >  58474 [ACK] Seq=1 Ack=234577 Win=179712 Len=0 TSval=3266684617 TSecr=2457814234 SLE=269329 SRE=275121 SLE=253401 SRE=267881 SLE=246161 SRE=251953
264,2.231964,192.168.2.2,192.168.1.2,TCP,94,177152,5001  >  58474 [ACK] Seq=1 Ack=237473 Win=177152 Len=0 TSval=3266684641 TSecr=2457814403 SLE=269329 SRE=275121 SLE=253401 SRE=267881 SLE=246161 SRE=251953
266,2.256258,192.168.2.2,192.168.1.2,TCP,94,171008,5001  >  58474 [ACK] Seq=1 Ack=244713 Win=171008 Len=0 TSval=3266684665 TSecr=2457814427 SLE=269329 SRE=275121 SLE=253401 SRE=267881 SLE=246161 SRE=251953
268,2.268301,192.168.2.2,192.168.1.2,TCP,86,174592,5001  >  58474 [ACK] Seq=1 Ack=251953 Win=174592 Len=0 TSval=3266684677 TSecr=2457814451 SLE=269329 SRE=275121 SLE=253401 SRE=267881
271,2.280775,192.168.2.2,192.168.1.2,TCP,94,176640,[TCP Window Update] 5001  >  58474 [ACK] Seq=1 Ack=251953 Win=176640 Len=0 TSval=3266684689 TSecr=2457814451 SLE=278017 SRE=280913 SLE=269329 SRE=275121 SLE=253401 SRE=267881
274,2.304627,192.168.2.2,192.168.1.2,TCP,94,176640,[TCP Dup ACK 268#1] 5001  >  58474 [ACK] Seq=1 Ack=251953 Win=176640 Len=0 TSval=3266684713 TSecr=2457814451 SLE=278017 SRE=283809 SLE=269329 SRE=275121 SLE=253401 SRE=267881
276,2.328844,192.168.2.2,192.168.1.2,TCP,94,176640,[TCP Dup ACK 268#2] 5001  >  58474 [ACK] Seq=1 Ack=251953 Win=176640 Len=0 TSval=3266684737 TSecr=2457814451 SLE=278017 SRE=286705 SLE=269329 SRE=275121 SLE=253401 SRE=267881
278,2.353295,192.168.2.2,192.168.1.2,TCP,94,176640,[TCP Dup ACK 268#3] 5001  >  58474 [ACK] Seq=1 Ack=251953 Win=176640 Len=0 TSval=3266684762 TSecr=2457814451 SLE=278017 SRE=289601 SLE=269329 SRE=275121 SLE=253401 SRE=267881
280,2.377298,192.168.2.2,192.168.1.2,TCP,86,171520,5001  >  58474 [ACK] Seq=1 Ack=267881 Win=171520 Len=0 TSval=3266684786 TSecr=2457814536 SLE=278017 SRE=289601 SLE=269329 SRE=275121
284,2.389641,192.168.2.2,192.168.1.2,TCP,86,184832,[TCP Window Update] 5001  >  58474 [ACK] Seq=1 Ack=267881 Win=184832 Len=0 TSval=3266684798 TSecr=2457814536 SLE=278017 SRE=291049 SLE=269329 SRE=275121
286,2.401498,192.168.2.2,192.168.1.2,TCP,86,190464,[TCP Window Update] 5001  >  58474 [ACK] Seq=1 Ack=267881 Win=190464 Len=0 TSval=3266684810 TSecr=2457814536 SLE=278017 SRE=293945 SLE=269329 SRE=275121
288,2.425831,192.168.2.2,192.168.1.2,TCP,86,196096,[TCP Window Update] 5001  >  58474 [ACK] Seq=1 Ack=267881 Win=196096 Len=0 TSval=3266684834 TSecr=2457814536 SLE=278017 SRE=296841 SLE=269329 SRE=275121
290,2.450374,192.168.2.2,192.168.1.2,TCP,86,199168,[TCP Window Update] 5001  >  58474 [ACK] Seq=1 Ack=267881 Win=199168 Len=0 TSval=3266684859 TSecr=2457814536 SLE=278017 SRE=298289 SLE=269329 SRE=275121
292,2.462061,192.168.2.2,192.168.1.2,TCP,86,204800,[TCP Window Update] 5001  >  58474 [ACK] Seq=1 Ack=267881 Win=204800 Len=0 TSval=3266684871 TSecr=2457814536 SLE=278017 SRE=301185 SLE=269329 SRE=275121
294,2.486519,192.168.2.2,192.168.1.2,TCP,86,207872,[TCP Window Update] 5001  >  58474 [ACK] Seq=1 Ack=267881 Win=207872 Len=0 TSval=3266684895 TSecr=2457814536 SLE=278017 SRE=302633 SLE=269329 SRE=275121
296,2.499283,192.168.2.2,192.168.1.2,TCP,86,210944,[TCP Window Update] 5001  >  58474 [ACK] Seq=1 Ack=267881 Win=210944 Len=0 TSval=3266684908 TSecr=2457814536 SLE=278017 SRE=304081 SLE=269329 SRE=275121
298,2.510507,192.168.2.2,192.168.1.2,TCP,86,213504,[TCP Window Update] 5001  >  58474 [ACK] Seq=1 Ack=267881 Win=213504 Len=0 TSval=3266684919 TSecr=2457814536 SLE=278017 SRE=305529 SLE=269329 SRE=275121
300,2.522874,192.168.2.2,192.168.1.2,TCP,86,216576,[TCP Window Update] 5001  >  58474 [ACK] Seq=1 Ack=267881 Win=216576 Len=0 TSval=3266684931 TSecr=2457814536 SLE=278017 SRE=306977 SLE=269329 SRE=275121
302,2.535523,192.168.2.2,192.168.1.2,TCP,78,219648,5001  >  58474 [ACK] Seq=1 Ack=275121 Win=219648 Len=0 TSval=3266684944 TSecr=2457814693 SLE=278017 SRE=306977
304,2.54729,192.168.2.2,192.168.1.2,TCP,78,225280,[TCP Window Update] 5001  >  58474 [ACK] Seq=1 Ack=275121 Win=225280 Len=0 TSval=3266684956 TSecr=2457814693 SLE=278017 SRE=309873
306,2.57112,192.168.2.2,192.168.1.2,TCP,78,228352,[TCP Window Update] 5001  >  58474 [ACK] Seq=1 Ack=275121 Win=228352 Len=0 TSval=3266684980 TSecr=2457814693 SLE=278017 SRE=311321
308,2.583574,192.168.2.2,192.168.1.2,TCP,78,230912,5001  >  58474 [ACK] Seq=1 Ack=276569 Win=230912 Len=0 TSval=3266684992 TSecr=2457814778 SLE=278017 SRE=311321
310,2.595305,192.168.2.2,192.168.1.2,TCP,78,233984,[TCP Window Update] 5001  >  58474 [ACK] Seq=1 Ack=276569 Win=233984 Len=0 TSval=3266685004 TSecr=2457814778 SLE=278017 SRE=312769
312,2.607417,192.168.2.2,192.168.1.2,TCP,66,237056,5001  >  58474 [ACK] Seq=1 Ack=312769 Win=237056 Len=0 TSval=3266685016 TSecr=2457814790
314,2.619903,192.168.2.2,192.168.1.2,TCP,66,239616,5001  >  58474 [ACK] Seq=1 Ack=314217 Win=239616 Len=0 TSval=3266685028 TSecr=2457814790
316,2.631637,192.168.2.2,192.168.1.2,TCP,66,245760,5001  >  58474 [ACK] Seq=1 Ack=317113 Win=245760 Len=0 TSval=3266685040 TSecr=2457814814
318,2.656078,192.168.2.2,192.168.1.2,TCP,66,251392,5001  >  58474 [ACK] Seq=1 Ack=320009 Win=251392 Len=0 TSval=3266685064 TSecr=2457814838
320,2.680598,192.168.2.2,192.168.1.2,TCP,66,257024,5001  >  58474 [ACK] Seq=1 Ack=322905 Win=257024 Len=0 TSval=3266685089 TSecr=2457814863
322,2.704307,192.168.2.2,192.168.1.2,TCP,66,263168,5001  >  58474 [ACK] Seq=1 Ack=325801 Win=263168 Len=0 TSval=3266685113 TSecr=2457814887
324,2.728668,192.168.2.2,192.168.1.2,TCP,66,265728,5001  >  58474 [ACK] Seq=1 Ack=327249 Win=265728 Len=0 TSval=3266685137 TSecr=2457814899
326,2.741356,192.168.2.2,192.168.1.2,TCP,66,271872,5001  >  58474 [ACK] Seq=1 Ack=330145 Win=271872 Len=0 TSval=3266685150 TSecr=2457814911
328,2.764931,192.168.2.2,192.168.1.2,TCP,66,277504,5001  >  58474 [ACK] Seq=1 Ack=333041 Win=277504 Len=0 TSval=3266685173 TSecr=2457814935
330,2.789095,192.168.2.2,192.168.1.2,TCP,66,280064,5001  >  58474 [ACK] Seq=1 Ack=334489 Win=280064 Len=0 TSval=3266685197 TSecr=2457814960
332,2.801219,192.168.2.2,192.168.1.2,TCP,66,286208,5001  >  58474 [ACK] Seq=1 Ack=337385 Win=286208 Len=0 TSval=3266685210 TSecr=2457814972
334,2.825692,192.168.2.2,192.168.1.2,TCP,66,288768,5001  >  58474 [ACK] Seq=1 Ack=338833 Win=288768 Len=0 TSval=3266685234 TSecr=2457814996
337,2.837574,192.168.2.2,192.168.1.2,TCP,66,291840,5001  >  58474 [ACK] Seq=1 Ack=340281 Win=291840 Len=0 TSval=3266685246 TSecr=2457815009
339,2.85032,192.168.2.2,192.168.1.2,TCP,66,294912,5001  >  58474 [ACK] Seq=1 Ack=341729 Win=294912 Len=0 TSval=3266685259 TSecr=2457815020
341,2.861779,192.168.2.2,192.168.1.2,TCP,66,297472,5001  >  58474 [ACK] Seq=1 Ack=343177 Win=297472 Len=0 TSval=3266685270 TSecr=2457815032
343,2.873872,192.168.2.2,192.168.1.2,TCP,66,300544,5001  >  58474 [ACK] Seq=1 Ack=344625 Win=300544 Len=0 TSval=3266685282 TSecr=2457815045
345,2.886372,192.168.2.2,192.168.1.2,TCP,66,306176,5001  >  58474 [ACK] Seq=1 Ack=347521 Win=306176 Len=0 TSval=3266685295 TSecr=2457815057
347,2.910271,192.168.2.2,192.168.1.2,TCP,66,309248,5001  >  58474 [ACK] Seq=1 Ack=348969 Win=309248 Len=0 TSval=3266685319 TSecr=2457815081
349,2.922709,192.168.2.2,192.168.1.2,TCP,66,312320,5001  >  58474 [ACK] Seq=1 Ack=350417 Win=312320 Len=0 TSval=3266685331 TSecr=2457815093
351,2.934463,192.168.2.2,192.168.1.2,TCP,66,314880,5001  >  58474 [ACK] Seq=1 Ack=351865 Win=314880 Len=0 TSval=3266685343 TSecr=2457815105
353,2.947213,192.168.2.2,192.168.1.2,TCP,66,317952,5001  >  58474 [ACK] Seq=1 Ack=353313 Win=317952 Len=0 TSval=3266685355 TSecr=2457815117
355,2.958982,192.168.2.2,192.168.1.2,TCP,66,321024,5001  >  58474 [ACK] Seq=1 Ack=354761 Win=321024 Len=0 TSval=3266685367 TSecr=2457815129
357,2.970795,192.168.2.2,192.168.1.2,TCP,66,326656,5001  >  58474 [ACK] Seq=1 Ack=357657 Win=326656 Len=0 TSval=3266685379 TSecr=2457815141
359,2.995232,192.168.2.2,192.168.1.2,TCP,66,332288,5001  >  58474 [ACK] Seq=1 Ack=360553 Win=332288 Len=0 TSval=3266685403 TSecr=2457815166
361,3.019691,192.168.2.2,192.168.1.2,TCP,66,338432,5001  >  58474 [ACK] Seq=1 Ack=363449 Win=338432 Len=0 TSval=3266685428 TSecr=2457815190
364,3.043486,192.168.2.2,192.168.1.2,TCP,66,344064,5001  >  58474 [ACK] Seq=1 Ack=366345 Win=344064 Len=0 TSval=3266685452 TSecr=2457815214
367,3.067708,192.168.2.2,192.168.1.2,TCP,66,347136,5001  >  58474 [ACK] Seq=1 Ack=367793 Win=347136 Len=0 TSval=3266685476 TSecr=2457815238
369,3.079849,192.168.2.2,192.168.1.2,TCP,66,352768,5001  >  58474 [ACK] Seq=1 Ack=370689 Win=352768 Len=0 TSval=3266685488 TSecr=2457815251
371,3.104025,192.168.2.2,192.168.1.2,TCP,66,358400,5001  >  58474 [ACK] Seq=1 Ack=373585 Win=358400 Len=0 TSval=3266685512 TSecr=2457815274
373,3.128477,192.168.2.2,192.168.1.2,TCP,66,364544,5001  >  58474 [ACK] Seq=1 Ack=376481 Win=364544 Len=0 TSval=3266685537 TSecr=2457815298
375,3.15247,192.168.2.2,192.168.1.2,TCP,66,370176,5001  >  58474 [ACK] Seq=1 Ack=379377 Win=370176 Len=0 TSval=3266685561 TSecr=2457815311
377,3.177139,192.168.2.2,192.168.1.2,TCP,66,372736,5001  >  58474 [ACK] Seq=1 Ack=380825 Win=372736 Len=0 TSval=3266685585 TSecr=2457815335
379,3.189275,192.168.2.2,192.168.1.2,TCP,66,375808,5001  >  58474 [ACK] Seq=1 Ack=382273 Win=375808 Len=0 TSval=3266685597 TSecr=2457815347
381,3.201057,192.168.2.2,192.168.1.2,TCP,66,378880,5001  >  58474 [ACK] Seq=1 Ack=383721 Win=378880 Len=0 TSval=3266685609 TSecr=2457815360
383,3.213774,192.168.2.2,192.168.1.2,TCP,66,381440,5001  >  58474 [ACK] Seq=1 Ack=385169 Win=381440 Len=0 TSval=3266685622 TSecr=2457815371
385,3.225645,192.168.2.2,192.168.1.2,TCP,66,384512,5001  >  58474 [ACK] Seq=1 Ack=386617 Win=384512 Len=0 TSval=3266685634 TSecr=2457815383
387,3.238048,192.168.2.2,192.168.1.2,TCP,66,390144,5001  >  58474 [ACK] Seq=1 Ack=389513 Win=390144 Len=0 TSval=3266685646 TSecr=2457815396
389,3.26178,192.168.2.2,192.168.1.2,TCP,66,393216,5001  >  58474 [ACK] Seq=1 Ack=390961 Win=393216 Len=0 TSval=3266685670 TSecr=2457815420
391,3.273842,192.168.2.2,192.168.1.2,TCP,66,396288,5001  >  58474 [ACK] Seq=1 Ack=392409 Win=396288 Len=0 TSval=3266685682 TSecr=2457815432
393,3.285691,192.168.2.2,192.168.1.2,TCP,66,398848,5001  >  58474 [ACK] Seq=1 Ack=393857 Win=398848 Len=0 TSval=3266685694 TSecr=2457815444
395,3.297978,192.168.2.2,192.168.1.2,TCP,66,404992,5001  >  58474 [ACK] Seq=1 Ack=396753 Win=404992 Len=0 TSval=3266685706 TSecr=2457815457
397,3.322494,192.168.2.2,192.168.1.2,TCP,66,407552,5001  >  58474 [ACK] Seq=1 Ack=398201 Win=407552 Len=0 TSval=3266685731 TSecr=2457815468
399,3.3341,192.168.2.2,192.168.1.2,TCP,66,413696,5001  >  58474 [ACK] Seq=1 Ack=401097 Win=413696 Len=0 TSval=3266685742 TSecr=2457815480
401,3.358806,192.168.2.2,192.168.1.2,TCP,66,419328,5001  >  58474 [ACK] Seq=1 Ack=403993 Win=419328 Len=0 TSval=3266685767 TSecr=2457815505
403,3.383265,192.168.2.2,192.168.1.2,TCP,66,424960,5001  >  58474 [ACK] Seq=1 Ack=406889 Win=424960 Len=0 TSval=3266685791 TSecr=2457815529
405,3.406839,192.168.2.2,192.168.1.2,TCP,66,431104,5001  >  58474 [ACK] Seq=1 Ack=409785 Win=431104 Len=0 TSval=3266685815 TSecr=2457815553
407,3.431329,192.168.2.2,192.168.1.2,TCP,66,433664,5001  >  58474 [ACK] Seq=1 Ack=411233 Win=433664 Len=0 TSval=3266685839 TSecr=2457815577
409,3.443129,192.168.2.2,192.168.1.2,TCP,66,439808,5001  >  58474 [ACK] Seq=1 Ack=414129 Win=439808 Len=0 TSval=3266685851 TSecr=2457815589
411,3.467611,192.168.2.2,192.168.1.2,TCP,66,445440,5001  >  58474 [ACK] Seq=1 Ack=417025 Win=445440 Len=0 TSval=3266685876 TSecr=2457815613
413,3.492244,192.168.2.2,192.168.1.2,TCP,66,451072,5001  >  58474 [ACK] Seq=1 Ack=419921 Win=451072 Len=0 TSval=3266685900 TSecr=2457815638
415,3.515805,192.168.2.2,192.168.1.2,TCP,66,457216,5001  >  58474 [ACK] Seq=1 Ack=422817 Win=457216 Len=0 TSval=3266685924 TSecr=2457815662
417,3.540035,192.168.2.2,192.168.1.2,TCP,66,462848,5001  >  58474 [ACK] Seq=1 Ack=425713 Win=462848 Len=0 TSval=3266685948 TSecr=2457815686
419,3.564541,192.168.2.2,192.168.1.2,TCP,66,465408,5001  >  58474 [ACK] Seq=1 Ack=427161 Win=465408 Len=0 TSval=3266685973 TSecr=2457815698
421,3.576361,192.168.2.2,192.168.1.2,TCP,66,468480,5001  >  58474 [ACK] Seq=1 Ack=428609 Win=468480 Len=0 TSval=3266685984 TSecr=2457815710
423,3.588459,192.168.2.2,192.168.1.2,TCP,66,471552,5001  >  58474 [ACK] Seq=1 Ack=430057 Win=471552 Len=0 TSval=3266685996 TSecr=2457815723
425,3.600568,192.168.2.2,192.168.1.2,TCP,66,474112,5001  >  58474 [ACK] Seq=1 Ack=431505 Win=474112 Len=0 TSval=3266686009 TSecr=2457815735
427,3.612693,192.168.2.2,192.168.1.2,TCP,66,480256,5001  >  58474 [ACK] Seq=1 Ack=434401 Win=480256 Len=0 TSval=3266686021 TSecr=2457815747
429,3.636908,192.168.2.2,192.168.1.2,TCP,66,482816,5001  >  58474 [ACK] Seq=1 Ack=435849 Win=482816 Len=0 TSval=3266686045 TSecr=2457815771
431,3.649032,192.168.2.2,192.168.1.2,TCP,66,485888,5001  >  58474 [ACK] Seq=1 Ack=437297 Win=485888 Len=0 TSval=3266686057 TSecr=2457815783
433,3.661385,192.168.2.2,192.168.1.2,TCP,66,488960,5001  >  58474 [ACK] Seq=1 Ack=438745 Win=488960 Len=0 TSval=3266686069 TSecr=2457815795
435,3.673397,192.168.2.2,192.168.1.2,TCP,66,494592,5001  >  58474 [ACK] Seq=1 Ack=441641 Win=494592 Len=0 TSval=3266686081 TSecr=2457815807
437,3.697825,192.168.2.2,192.168.1.2,TCP,66,497664,5001  >  58474 [ACK] Seq=1 Ack=443089 Win=497664 Len=0 TSval=3266686106 TSecr=2457815832
439,3.709585,192.168.2.2,192.168.1.2,TCP,66,503296,5001  >  58474 [ACK] Seq=1 Ack=445985 Win=503296 Len=0 TSval=3266686117 TSecr=2457815843
441,3.733977,192.168.2.2,192.168.1.2,TCP,66,508928,5001  >  58474 [ACK] Seq=1 Ack=448881 Win=508928 Len=0 TSval=3266686142 TSecr=2457815868
443,3.758257,192.168.2.2,192.168.1.2,TCP,66,515072,5001  >  58474 [ACK] Seq=1 Ack=451777 Win=515072 Len=0 TSval=3266686166 TSecr=2457815892
445,3.782268,192.168.2.2,192.168.1.2,TCP,66,520704,5001  >  58474 [ACK] Seq=1 Ack=454673 Win=520704 Len=0 TSval=3266686190 TSecr=2457815916
447,3.806747,192.168.2.2,192.168.1.2,TCP,66,520704,5001  >  58474 [ACK] Seq=1 Ack=457569 Win=520704 Len=0 TSval=3266686215 TSecr=2457815940
449,3.831103,192.168.2.2,192.168.1.2,TCP,66,520704,5001  >  58474 [ACK] Seq=1 Ack=460465 Win=520704 Len=0 TSval=3266686239 TSecr=2457815952
451,3.854938,192.168.2.2,192.168.1.2,TCP,66,520704,5001  >  58474 [ACK] Seq=1 Ack=463361 Win=520704 Len=0 TSval=3266686263 TSecr=2457815977
453,3.879262,192.168.2.2,192.168.1.2,TCP,66,520704,5001  >  58474 [ACK] Seq=1 Ack=466257 Win=520704 Len=0 TSval=3266686287 TSecr=2457816001
455,3.903673,192.168.2.2,192.168.1.2,TCP,66,520704,5001  >  58474 [ACK] Seq=1 Ack=469153 Win=520704 Len=0 TSval=3266686311 TSecr=2457816025
457,3.928147,192.168.2.2,192.168.1.2,TCP,66,520704,5001  >  58474 [ACK] Seq=1 Ack=472049 Win=520704 Len=0 TSval=3266686336 TSecr=2457816049
459,3.952448,192.168.2.2,192.168.1.2,TCP,66,521216,5001  >  58474 [ACK] Seq=1 Ack=473497 Win=521216 Len=0 TSval=3266686360 TSecr=2457816074
461,3.976246,192.168.2.2,192.168.1.2,TCP,66,521216,5001  >  58474 [ACK] Seq=1 Ack=476393 Win=521216 Len=0 TSval=3266686384 TSecr=2457816085
463,4.000717,192.168.2.2,192.168.1.2,TCP,66,521216,5001  >  58474 [ACK] Seq=1 Ack=480737 Win=521216 Len=0 TSval=3266686408 TSecr=2457816110
465,4.036598,192.168.2.2,192.168.1.2,TCP,66,521216,5001  >  58474 [ACK] Seq=1 Ack=483633 Win=521216 Len=0 TSval=3266686444 TSecr=2457816146
468,4.06147,192.168.2.2,192.168.1.2,TCP,66,521216,5001  >  58474 [ACK] Seq=1 Ack=487977 Win=521216 Len=0 TSval=3266686469 TSecr=2457816170
471,4.097691,192.168.2.2,192.168.1.2,TCP,66,521216,5001  >  58474 [ACK] Seq=1 Ack=492321 Win=521216 Len=0 TSval=3266686505 TSecr=2457816207
473,4.12225,192.168.2.2,192.168.1.2,TCP,66,521216,5001  >  58474 [ACK] Seq=1 Ack=495217 Win=521216 Len=0 TSval=3266686530 TSecr=2457816243
476,4.145765,192.168.2.2,192.168.1.2,TCP,66,521216,5001  >  58474 [ACK] Seq=1 Ack=498113 Win=521216 Len=0 TSval=3266686553 TSecr=2457816267
478,4.170299,192.168.2.2,192.168.1.2,TCP,66,521216,5001  >  58474 [ACK] Seq=1 Ack=501009 Win=521216 Len=0 TSval=3266686578 TSecr=2457816291
480,4.194753,192.168.2.2,192.168.1.2,TCP,66,521216,5001  >  58474 [ACK] Seq=1 Ack=503905 Win=521216 Len=0 TSval=3266686602 TSecr=2457816316
482,4.218297,192.168.2.2,192.168.1.2,TCP,66,521216,5001  >  58474 [ACK] Seq=1 Ack=506801 Win=521216 Len=0 TSval=3266686626 TSecr=2457816340
484,4.242739,192.168.2.2,192.168.1.2,TCP,66,521216,5001  >  58474 [ACK] Seq=1 Ack=509697 Win=521216 Len=0 TSval=3266686650 TSecr=2457816364
486,4.267275,192.168.2.2,192.168.1.2,TCP,66,521216,5001  >  58474 [ACK] Seq=1 Ack=512593 Win=521216 Len=0 TSval=3266686675 TSecr=2457816388
488,4.291782,192.168.2.2,192.168.1.2,TCP,66,521216,5001  >  58474 [ACK] Seq=1 Ack=515489 Win=521216 Len=0 TSval=3266686699 TSecr=2457816413
490,4.315293,192.168.2.2,192.168.1.2,TCP,66,521216,5001  >  58474 [ACK] Seq=1 Ack=518385 Win=521216 Len=0 TSval=3266686723 TSecr=2457816437
492,4.339767,192.168.2.2,192.168.1.2,TCP,66,521216,5001  >  58474 [ACK] Seq=1 Ack=521281 Win=521216 Len=0 TSval=3266686747 TSecr=2457816461
494,4.364264,192.168.2.2,192.168.1.2,TCP,66,521216,5001  >  58474 [ACK] Seq=1 Ack=524177 Win=521216 Len=0 TSval=3266686772 TSecr=2457816485
496,4.388844,192.168.2.2,192.168.1.2,TCP,66,521216,5001  >  58474 [ACK] Seq=1 Ack=527073 Win=521216 Len=0 TSval=3266686796 TSecr=2457816509
498,4.412346,192.168.2.2,192.168.1.2,TCP,66,521216,5001  >  58474 [ACK] Seq=1 Ack=529969 Win=521216 Len=0 TSval=3266686820 TSecr=2457816545
501,4.437089,192.168.2.2,192.168.1.2,TCP,66,521216,5001  >  58474 [ACK] Seq=1 Ack=532865 Win=521216 Len=0 TSval=3266686845 TSecr=2457816570
503,4.461438,192.168.2.2,192.168.1.2,TCP,66,521216,5001  >  58474 [ACK] Seq=1 Ack=535761 Win=521216 Len=0 TSval=3266686869 TSecr=2457816570
505,4.485894,192.168.2.2,192.168.1.2,TCP,66,521216,5001  >  58474 [ACK] Seq=1 Ack=538657 Win=521216 Len=0 TSval=3266686893 TSecr=2457816606
507,4.5103,192.168.2.2,192.168.1.2,TCP,66,521216,5001  >  58474 [ACK] Seq=1 Ack=541553 Win=521216 Len=0 TSval=3266686918 TSecr=2457816631
509,4.534013,192.168.2.2,192.168.1.2,TCP,66,521216,5001  >  58474 [ACK] Seq=1 Ack=544449 Win=521216 Len=0 TSval=3266686941 TSecr=2457816631
511,4.558378,192.168.2.2,192.168.1.2,TCP,66,521216,5001  >  58474 [ACK] Seq=1 Ack=547345 Win=521216 Len=0 TSval=3266686966 TSecr=2457816654
513,4.582545,192.168.2.2,192.168.1.2,TCP,66,521216,5001  >  58474 [ACK] Seq=1 Ack=550241 Win=521216 Len=0 TSval=3266686990 TSecr=2457816679
515,4.606717,192.168.2.2,192.168.1.2,TCP,66,521216,5001  >  58474 [ACK] Seq=1 Ack=553137 Win=521216 Len=0 TSval=3266687014 TSecr=2457816703
517,4.630916,192.168.2.2,192.168.1.2,TCP,66,521216,5001  >  58474 [ACK] Seq=1 Ack=556033 Win=521216 Len=0 TSval=3266687038 TSecr=2457816727
519,4.655142,192.168.2.2,192.168.1.2,TCP,66,521216,5001  >  58474 [ACK] Seq=1 Ack=558929 Win=521216 Len=0 TSval=3266687063 TSecr=2457816751
521,4.679357,192.168.2.2,192.168.1.2,TCP,66,521216,5001  >  58474 [ACK] Seq=1 Ack=561825 Win=521216 Len=0 TSval=3266687087 TSecr=2457816776
523,4.704177,192.168.2.2,192.168.1.2,TCP,66,521216,5001  >  58474 [ACK] Seq=1 Ack=564721 Win=521216 Len=0 TSval=3266687112 TSecr=2457816800
525,4.727897,192.168.2.2,192.168.1.2,TCP,66,521216,5001  >  58474 [ACK] Seq=1 Ack=567617 Win=521216 Len=0 TSval=3266687135 TSecr=2457816824
527,4.752417,192.168.2.2,192.168.1.2,TCP,66,521216,5001  >  58474 [ACK] Seq=1 Ack=570513 Win=521216 Len=0 TSval=3266687160 TSecr=2457816848
529,4.776254,192.168.2.2,192.168.1.2,TCP,66,521216,5001  >  58474 [ACK] Seq=1 Ack=573409 Win=521216 Len=0 TSval=3266687184 TSecr=2457816873
531,4.800485,192.168.2.2,192.168.1.2,TCP,66,521216,5001  >  58474 [ACK] Seq=1 Ack=576305 Win=521216 Len=0 TSval=3266687208 TSecr=2457816897
533,4.824925,192.168.2.2,192.168.1.2,TCP,66,521216,5001  >  58474 [ACK] Seq=1 Ack=579201 Win=521216 Len=0 TSval=3266687232 TSecr=2457816921
535,4.84896,192.168.2.2,192.168.1.2,TCP,66,521216,5001  >  58474 [ACK] Seq=1 Ack=582097 Win=521216 Len=0 TSval=3266687256 TSecr=2457816946
537,4.874044,192.168.2.2,192.168.1.2,TCP,66,521216,5001  >  58474 [ACK] Seq=1 Ack=584993 Win=521216 Len=0 TSval=3266687281 TSecr=2457816970
539,4.897449,192.168.2.2,192.168.1.2,TCP,66,521216,5001  >  58474 [ACK] Seq=1 Ack=587889 Win=521216 Len=0 TSval=3266687305 TSecr=2457816994
541,4.921954,192.168.2.2,192.168.1.2,TCP,66,521216,5001  >  58474 [ACK] Seq=1 Ack=590785 Win=521216 Len=0 TSval=3266687329 TSecr=2457817019
543,4.945906,192.168.2.2,192.168.1.2,TCP,66,521216,5001  >  58474 [ACK] Seq=1 Ack=593681 Win=521216 Len=0 TSval=3266687353 TSecr=2457817043
545,4.982157,192.168.2.2,192.168.1.2,TCP,66,521216,5001  >  58474 [ACK] Seq=1 Ack=598025 Win=521216 Len=0 TSval=3266687389 TSecr=2457817067
548,5.006523,192.168.2.2,192.168.1.2,TCP,66,521216,5001  >  58474 [ACK] Seq=1 Ack=600921 Win=521216 Len=0 TSval=3266687414 TSecr=2457817115
550,5.03073,192.168.2.2,192.168.1.2,TCP,66,521216,5001  >  58474 [ACK] Seq=1 Ack=603817 Win=521216 Len=0 TSval=3266687438 TSecr=2457817139
