No.,Time,Source,Destination,Protocol,Length,Calculated window size,Info
4,0.003995,192.168.2.2,192.168.1.2,TCP,74,28960,"5001  >  48006 [SYN, ACK] Seq=0 Ack=1 Win=28960 Len=0 MSS=1460 SACK_PERM=1 TSval=551906192 TSecr=457127907 WS=512"
7,0.004049,192.168.2.2,192.168.1.2,TCP,66,43520,5001  >  48006 [ACK] Seq=1 Ack=7241 Win=43520 Len=0 TSval=551906192 TSecr=457127907
11,0.052909,192.168.2.2,192.168.1.2,TCP,66,58368,5001  >  48006 [ACK] Seq=1 Ack=14481 Win=58368 Len=0 TSval=551906241 TSecr=457127907
13,0.113542,192.168.2.2,192.168.1.2,TCP,66,72704,5001  >  48006 [ACK] Seq=1 Ack=21721 Win=72704 Len=0 TSval=551906301 TSecr=457127907
15,0.174316,192.168.2.2,192.168.1.2,TCP,66,75776,5001  >  48006 [ACK] Seq=1 Ack=23169 Win=75776 Len=0 TSval=551906362 TSecr=457127923
16,0.186265,192.168.2.2,192.168.1.2,TCP,66,78336,5001  >  48006 [ACK] Seq=1 Ack=24617 Win=78336 Len=0 TSval=551906374 TSecr=457127982
18,0.19897,192.168.2.2,192.168.1.2,TCP,66,81408,5001  >  48006 [ACK] Seq=1 Ack=26065 Win=81408 Len=0 TSval=551906387 TSecr=457128066
20,0.211608,192.168.2.2,192.168.1.2,TCP,66,84480,5001  >  48006 [ACK] Seq=1 Ack=27513 Win=84480 Len=0 TSval=551906399 TSecr=457128089
23,0.22437,192.168.2.2,192.168.1.2,TCP,66,87040,5001  >  48006 [ACK] Seq=1 Ack=28961 Win=87040 Len=0 TSval=551906412 TSecr=457128102
25,0.235374,192.168.2.2,192.168.1.2,TCP,66,90112,5001  >  48006 [ACK] Seq=1 Ack=30409 Win=90112 Len=0 TSval=551906423 TSecr=457128114
27,0.24788,192.168.2.2,192.168.1.2,TCP,66,92672,5001  >  48006 [ACK] Seq=1 Ack=31857 Win=92672 Len=0 TSval=551906436 TSecr=457128114
29,0.259709,192.168.2.2,192.168.1.2,TCP,66,95744,5001  >  48006 [ACK] Seq=1 Ack=33305 Win=95744 Len=0 TSval=551906447 TSecr=457128127
31,0.271675,192.168.2.2,192.168.1.2,TCP,66,98816,5001  >  48006 [ACK] Seq=1 Ack=34753 Win=98816 Len=0 TSval=551906459 TSecr=457128138
33,0.283787,192.168.2.2,192.168.1.2,TCP,66,101376,5001  >  48006 [ACK] Seq=1 Ack=36201 Win=101376 Len=0 TSval=551906472 TSecr=457128151
35,0.29591,192.168.2.2,192.168.1.2,TCP,66,107520,5001  >  48006 [ACK] Seq=1 Ack=39097 Win=107520 Len=0 TSval=551906484 TSecr=457128163
37,0.320402,192.168.2.2,192.168.1.2,TCP,66,110080,5001  >  48006 [ACK] Seq=1 Ack=40545 Win=110080 Len=0 TSval=551906508 TSecr=457128174
39,0.33222,192.168.2.2,192.168.1.2,TCP,66,113152,5001  >  48006 [ACK] Seq=1 Ack=41993 Win=113152 Len=0 TSval=551906520 TSecr=457128187
41,0.344337,192.168.2.2,192.168.1.2,TCP,66,116224,5001  >  48006 [ACK] Seq=1 Ack=43441 Win=116224 Len=0 TSval=551906532 TSecr=457128199
44,0.356453,192.168.2.2,192.168.1.2,TCP,66,121856,5001  >  48006 [ACK] Seq=1 Ack=46337 Win=121856 Len=0 TSval=551906544 TSecr=457128223
47,0.381215,192.168.2.2,192.168.1.2,TCP,66,127488,5001  >  48006 [ACK] Seq=1 Ack=49233 Win=127488 Len=0 TSval=551906569 TSecr=457128235
49,0.405699,192.168.2.2,192.168.1.2,TCP,66,130560,5001  >  48006 [ACK] Seq=1 Ack=50681 Win=130560 Len=0 TSval=551906593 TSecr=457128247
51,0.417016,192.168.2.2,192.168.1.2,TCP,66,136192,5001  >  48006 [ACK] Seq=1 Ack=53577 Win=136192 Len=0 TSval=551906605 TSecr=457128259
53,0.441899,192.168.2.2,192.168.1.2,TCP,66,142336,5001  >  48006 [ACK] Seq=1 Ack=56473 Win=142336 Len=0 TSval=551906630 TSecr=457128284
56,0.465578,192.168.2.2,192.168.1.2,TCP,66,144896,5001  >  48006 [ACK] Seq=1 Ack=57921 Win=144896 Len=0 TSval=551906653 TSecr=457128308
58,0.478194,192.168.2.2,192.168.1.2,TCP,66,151040,5001  >  48006 [ACK] Seq=1 Ack=60817 Win=151040 Len=0 TSval=551906666 TSecr=457128320
61,0.502463,192.168.2.2,192.168.1.2,TCP,66,156672,5001  >  48006 [ACK] Seq=1 Ack=63713 Win=156672 Len=0 TSval=551906690 TSecr=457128345
63,0.527207,192.168.2.2,192.168.1.2,TCP,66,159744,5001  >  48006 [ACK] Seq=1 Ack=65161 Win=159744 Len=0 TSval=551906715 TSecr=457128368
65,0.539021,192.168.2.2,192.168.1.2,TCP,66,165376,5001  >  48006 [ACK] Seq=1 Ack=68057 Win=165376 Len=0 TSval=551906727 TSecr=457128381
67,0.563035,192.168.2.2,192.168.1.2,TCP,66,171008,5001  >  48006 [ACK] Seq=1 Ack=70953 Win=171008 Len=0 TSval=551906751 TSecr=457128405
69,0.587266,192.168.2.2,192.168.1.2,TCP,66,177152,5001  >  48006 [ACK] Seq=1 Ack=73849 Win=177152 Len=0 TSval=551906775 TSecr=457128430
71,0.611469,192.168.2.2,192.168.1.2,TCP,66,182784,5001  >  48006 [ACK] Seq=1 Ack=76745 Win=182784 Len=0 TSval=551906799 TSecr=457128442
73,0.635748,192.168.2.2,192.168.1.2,TCP,66,185344,5001  >  48006 [ACK] Seq=1 Ack=79641 Win=185344 Len=0 TSval=551906823 TSecr=457128466
75,0.659956,192.168.2.2,192.168.1.2,TCP,66,185344,5001  >  48006 [ACK] Seq=1 Ack=82537 Win=185344 Len=0 TSval=551906847 TSecr=457128490
78,0.684192,192.168.2.2,192.168.1.2,TCP,66,185344,5001  >  48006 [ACK] Seq=1 Ack=85433 Win=185344 Len=0 TSval=551906872 TSecr=457128514
80,0.708414,192.168.2.2,192.168.1.2,TCP,66,185856,5001  >  48006 [ACK] Seq=1 Ack=86881 Win=185856 Len=0 TSval=551906896 TSecr=457128538
82,0.720529,192.168.2.2,192.168.1.2,TCP,66,185344,5001  >  48006 [ACK] Seq=1 Ack=89777 Win=185344 Len=0 TSval=551906908 TSecr=457128563
84,0.744742,192.168.2.2,192.168.1.2,TCP,66,185344,5001  >  48006 [ACK] Seq=1 Ack=92673 Win=185344 Len=0 TSval=551906932 TSecr=457128563
86,0.769238,192.168.2.2,192.168.1.2,TCP,66,185344,5001  >  48006 [ACK] Seq=1 Ack=95569 Win=185344 Len=0 TSval=551906957 TSecr=457128587
88,0.793204,192.168.2.2,192.168.1.2,TCP,66,185856,5001  >  48006 [ACK] Seq=1 Ack=97017 Win=185856 Len=0 TSval=551906981 TSecr=457128611
90,0.805577,192.168.2.2,192.168.1.2,TCP,66,185344,5001  >  48006 [ACK] Seq=1 Ack=99913 Win=185344 Len=0 TSval=551906993 TSecr=457128623
92,0.82971,192.168.2.2,192.168.1.2,TCP,66,185344,5001  >  48006 [ACK] Seq=1 Ack=102809 Win=185344 Len=0 TSval=551907017 TSecr=457128647
94,0.85371,192.168.2.2,192.168.1.2,TCP,66,185344,5001  >  48006 [ACK] Seq=1 Ack=105705 Win=185344 Len=0 TSval=551907041 TSecr=457128672
96,0.890062,192.168.2.2,192.168.1.2,TCP,66,185344,5001  >  48006 [ACK] Seq=1 Ack=110049 Win=185344 Len=0 TSval=551907077 TSecr=457128696
98,0.91429,192.168.2.2,192.168.1.2,TCP,66,185344,5001  >  48006 [ACK] Seq=1 Ack=112945 Win=185344 Len=0 TSval=551907102 TSecr=457128732
100,0.938886,192.168.2.2,192.168.1.2,TCP,66,185344,5001  >  48006 [ACK] Seq=1 Ack=115841 Win=185344 Len=0 TSval=551907126 TSecr=457128756
103,0.96331,192.168.2.2,192.168.1.2,TCP,66,185344,5001  >  48006 [ACK] Seq=1 Ack=118737 Win=185344 Len=0 TSval=551907151 TSecr=457128793
105,0.986962,192.168.2.2,192.168.1.2,TCP,66,185344,5001  >  48006 [ACK] Seq=1 Ack=121633 Win=185344 Len=0 TSval=551907174 TSecr=457128817
108,1.011295,192.168.2.2,192.168.1.2,TCP,66,185344,5001  >  48006 [ACK] Seq=1 Ack=124529 Win=185344 Len=0 TSval=551907199 TSecr=457128841
110,1.035855,192.168.2.2,192.168.1.2,TCP,66,185344,5001  >  48006 [ACK] Seq=1 Ack=127425 Win=185344 Len=0 TSval=551907223 TSecr=457128841
113,1.060442,192.168.2.2,192.168.1.2,TCP,66,185344,5001  >  48006 [ACK] Seq=1 Ack=130321 Win=185344 Len=0 TSval=551907248 TSecr=457128866
115,1.08386,192.168.2.2,192.168.1.2,TCP,66,185344,5001  >  48006 [ACK] Seq=1 Ack=133217 Win=185344 Len=0 TSval=551907271 TSecr=457128890
118,1.108849,192.168.2.2,192.168.1.2,TCP,66,185344,5001  >  48006 [ACK] Seq=1 Ack=136113 Win=185344 Len=0 TSval=551907296 TSecr=457128914
120,1.133123,192.168.2.2,192.168.1.2,TCP,66,185344,5001  >  48006 [ACK] Seq=1 Ack=139009 Win=185344 Len=0 TSval=551907320 TSecr=457128938
122,1.157365,192.168.2.2,192.168.1.2,TCP,66,185344,5001  >  48006 [ACK] Seq=1 Ack=141905 Win=185344 Len=0 TSval=551907345 TSecr=457128963
124,1.181911,192.168.2.2,192.168.1.2,TCP,66,185344,5001  >  48006 [ACK] Seq=1 Ack=144801 Win=185344 Len=0 TSval=551907369 TSecr=457128986
126,1.206435,192.168.2.2,192.168.1.2,TCP,66,185344,5001  >  48006 [ACK] Seq=1 Ack=147697 Win=185344 Len=0 TSval=551907394 TSecr=457129011
128,1.230012,192.168.2.2,192.168.1.2,TCP,66,185344,5001  >  48006 [ACK] Seq=1 Ack=150593 Win=185344 Len=0 TSval=551907417 TSecr=457129036
130,1.254361,192.168.2.2,192.168.1.2,TCP,66,185344,5001  >  48006 [ACK] Seq=1 Ack=153489 Win=185344 Len=0 TSval=551907442 TSecr=457129060
132,1.279033,192.168.2.2,192.168.1.2,TCP,66,185344,5001  >  48006 [ACK] Seq=1 Ack=156385 Win=185344 Len=0 TSval=551907466 TSecr=457129084
134,1.303357,192.168.2.2,192.168.1.2,TCP,66,185344,5001  >  48006 [ACK] Seq=1 Ack=159281 Win=185344 Len=0 TSval=551907491 TSecr=457129109
136,1.326982,192.168.2.2,192.168.1.2,TCP,66,185344,5001  >  48006 [ACK] Seq=1 Ack=162177 Win=185344 Len=0 TSval=551907514 TSecr=457129132
138,1.351397,192.168.2.2,192.168.1.2,TCP,66,185344,5001  >  48006 [ACK] Seq=1 Ack=165073 Win=185344 Len=0 TSval=551907539 TSecr=457129157
141,1.375886,192.168.2.2,192.168.1.2,TCP,66,185344,5001  >  48006 [ACK] Seq=1 Ack=167969 Win=185344 Len=0 TSval=551907563 TSecr=457129181
143,1.399562,192.168.2.2,192.168.1.2,TCP,66,185344,5001  >  48006 [ACK] Seq=1 Ack=170865 Win=185344 Len=0 TSval=551907587 TSecr=457129206
145,1.423995,192.168.2.2,192.168.1.2,TCP,66,185344,5001  >  48006 [ACK] Seq=1 Ack=173761 Win=185344 Len=0 TSval=551907611 TSecr=457129229
147,1.448445,192.168.2.2,192.168.1.2,TCP,66,185344,5001  >  48006 [ACK] Seq=1 Ack=176657 Win=185344 Len=0 TSval=551907636 TSecr=457129254
149,1.484723,192.168.2.2,192.168.1.2,TCP,66,185344,5001  >  48006 [ACK] Seq=1 Ack=181001 Win=185344 Len=0 TSval=551907672 TSecr=457129254
154,1.509248,192.168.2.2,192.168.1.2,TCP,66,185344,5001  >  48006 [ACK] Seq=1 Ack=183897 Win=185344 Len=0 TSval=551907696 TSecr=457129302
158,1.532802,192.168.2.2,192.168.1.2,TCP,66,185344,5001  >  48006 [ACK] Seq=1 Ack=186793 Win=185344 Len=0 TSval=551907720 TSecr=457129326
160,1.557268,192.168.2.2,192.168.1.2,TCP,66,185344,5001  >  48006 [ACK] Seq=1 Ack=189689 Win=185344 Len=0 TSval=551907744 TSecr=457129351
162,1.582512,192.168.2.2,192.168.1.2,TCP,66,185344,5001  >  48006 [ACK] Seq=1 Ack=192585 Win=185344 Len=0 TSval=551907770 TSecr=457129387
164,1.618892,192.168.2.2,192.168.1.2,TCP,66,185344,5001  >  48006 [ACK] Seq=1 Ack=196929 Win=185344 Len=0 TSval=551907806 TSecr=457129390
166,1.643068,192.168.2.2,192.168.1.2,TCP,66,185344,5001  >  48006 [ACK] Seq=1 Ack=199825 Win=185344 Len=0 TSval=551907830 TSecr=457129435
168,1.667306,192.168.2.2,192.168.1.2,TCP,66,185344,5001  >  48006 [ACK] Seq=1 Ack=202721 Win=185344 Len=0 TSval=551907854 TSecr=457129459
170,1.69154,192.168.2.2,192.168.1.2,TCP,66,185344,5001  >  48006 [ACK] Seq=1 Ack=205617 Win=185344 Len=0 TSval=551907879 TSecr=457129485
172,1.716011,192.168.2.2,192.168.1.2,TCP,66,185344,5001  >  48006 [ACK] Seq=1 Ack=208513 Win=185344 Len=0 TSval=551907903 TSecr=457129521
175,1.740532,192.168.2.2,192.168.1.2,TCP,66,185344,5001  >  48006 [ACK] Seq=1 Ack=211409 Win=185344 Len=0 TSval=551907928 TSecr=457129545
178,1.765055,192.168.2.2,192.168.1.2,TCP,66,185344,5001  >  48006 [ACK] Seq=1 Ack=214305 Win=185344 Len=0 TSval=551907952 TSecr=457129570
180,1.788475,192.168.2.2,192.168.1.2,TCP,66,185344,5001  >  48006 [ACK] Seq=1 Ack=217201 Win=185344 Len=0 TSval=551907975 TSecr=457129594
182,1.812636,192.168.2.2,192.168.1.2,TCP,66,185344,5001  >  48006 [ACK] Seq=1 Ack=220097 Win=185344 Len=0 TSval=551908000 TSecr=457129618
184,1.837619,192.168.2.2,192.168.1.2,TCP,66,185344,5001  >  48006 [ACK] Seq=1 Ack=222993 Win=185344 Len=0 TSval=551908025 TSecr=457129643
186,1.862096,192.168.2.2,192.168.1.2,TCP,66,185344,5001  >  48006 [ACK] Seq=1 Ack=225889 Win=185344 Len=0 TSval=551908049 TSecr=457129643
188,1.885533,192.168.2.2,192.168.1.2,TCP,66,185344,5001  >  48006 [ACK] Seq=1 Ack=228785 Win=185344 Len=0 TSval=551908072 TSecr=457129667
190,1.920325,192.168.2.2,192.168.1.2,TCP,66,185344,5001  >  48006 [ACK] Seq=1 Ack=231681 Win=185344 Len=0 TSval=551908107 TSecr=457129691
192,1.933814,192.168.2.2,192.168.1.2,TCP,66,185344,5001  >  48006 [ACK] Seq=1 Ack=234577 Win=185344 Len=0 TSval=551908121 TSecr=457129715
194,1.958073,192.168.2.2,192.168.1.2,TCP,66,185344,5001  >  48006 [ACK] Seq=1 Ack=237473 Win=185344 Len=0 TSval=551908145 TSecr=457129740
196,1.982931,192.168.2.2,192.168.1.2,TCP,66,185344,5001  >  48006 [ACK] Seq=1 Ack=240369 Win=185344 Len=0 TSval=551908170 TSecr=457129764
199,2.006441,192.168.2.2,192.168.1.2,TCP,66,185344,5001  >  48006 [ACK] Seq=1 Ack=243265 Win=185344 Len=0 TSval=551908193 TSecr=457129788
201,2.030877,192.168.2.2,192.168.1.2,TCP,66,185344,5001  >  48006 [ACK] Seq=1 Ack=246161 Win=185344 Len=0 TSval=551908218 TSecr=457129822
203,2.055057,192.168.2.2,192.168.1.2,TCP,66,185344,5001  >  48006 [ACK] Seq=1 Ack=249057 Win=185344 Len=0 TSval=551908242 TSecr=457129836
205,2.079563,192.168.2.2,192.168.1.2,TCP,66,185344,5001  >  48006 [ACK] Seq=1 Ack=251953 Win=185344 Len=0 TSval=551908266 TSecr=457129860
207,2.104143,192.168.2.2,192.168.1.2,TCP,66,185344,5001  >  48006 [ACK] Seq=1 Ack=254849 Win=185344 Len=0 TSval=551908291 TSecr=457129885
211,2.129037,192.168.2.2,192.168.1.2,TCP,66,185344,5001  >  48006 [ACK] Seq=1 Ack=257745 Win=185344 Len=0 TSval=551908316 TSecr=457129908
213,2.165839,192.168.2.2,192.168.1.2,TCP,66,185344,5001  >  48006 [ACK] Seq=1 Ack=262089 Win=185344 Len=0 TSval=551908353 TSecr=457129933
216,2.190339,192.168.2.2,192.168.1.2,TCP,66,185344,5001  >  48006 [ACK] Seq=1 Ack=264985 Win=185344 Len=0 TSval=551908377 TSecr=457129982
218,2.213861,192.168.2.2,192.168.1.2,TCP,66,185344,5001  >  48006 [ACK] Seq=1 Ack=267881 Win=185344 Len=0 TSval=551908401 TSecr=457130006
220,2.238352,192.168.2.2,192.168.1.2,TCP,66,185344,5001  >  48006 [ACK] Seq=1 Ack=270777 Win=185344 Len=0 TSval=551908425 TSecr=457130031
222,2.2629,192.168.2.2,192.168.1.2,TCP,66,185344,5001  >  48006 [ACK] Seq=1 Ack=273673 Win=185344 Len=0 TSval=551908450 TSecr=457130068
224,2.286513,192.168.2.2,192.168.1.2,TCP,66,185344,5001  >  48006 [ACK] Seq=1 Ack=276569 Win=185344 Len=0 TSval=551908473 TSecr=457130068
227,2.310867,192.168.2.2,192.168.1.2,TCP,66,185344,5001  >  48006 [ACK] Seq=1 Ack=279465 Win=185344 Len=0 TSval=551908498 TSecr=457130092
229,2.335355,192.168.2.2,192.168.1.2,TCP,66,185344,5001  >  48006 [ACK] Seq=1 Ack=282361 Win=185344 Len=0 TSval=551908522 TSecr=457130116
231,2.359856,192.168.2.2,192.168.1.2,TCP,66,185344,5001  >  48006 [ACK] Seq=1 Ack=285257 Win=185344 Len=0 TSval=551908547 TSecr=457130140
233,2.383404,192.168.2.2,192.168.1.2,TCP,66,185344,5001  >  48006 [ACK] Seq=1 Ack=288153 Win=185344 Len=0 TSval=551908570 TSecr=457130165
235,2.407948,192.168.2.2,192.168.1.2,TCP,66,185344,5001  >  48006 [ACK] Seq=1 Ack=291049 Win=185344 Len=0 TSval=551908595 TSecr=457130188
237,2.444123,192.168.2.2,192.168.1.2,TCP,66,185344,5001  >  48006 [ACK] Seq=1 Ack=295393 Win=185344 Len=0 TSval=551908631 TSecr=457130188
239,2.468246,192.168.2.2,192.168.1.2,TCP,66,185344,5001  >  48006 [ACK] Seq=1 Ack=298289 Win=185344 Len=0 TSval=551908655 TSecr=457130237
241,2.492413,192.168.2.2,192.168.1.2,TCP,66,185344,5001  >  48006 [ACK] Seq=1 Ack=301185 Win=185344 Len=0 TSval=551908679 TSecr=457130262
244,2.517665,192.168.2.2,192.168.1.2,TCP,66,185344,5001  >  48006 [ACK] Seq=1 Ack=304081 Win=185344 Len=0 TSval=551908704 TSecr=457130285
246,2.541251,192.168.2.2,192.168.1.2,TCP,66,185344,5001  >  48006 [ACK] Seq=1 Ack=306977 Win=185344 Len=0 TSval=551908728 TSecr=457130310
248,2.565103,192.168.2.2,192.168.1.2,TCP,66,185344,5001  >  48006 [ACK] Seq=1 Ack=309873 Win=185344 Len=0 TSval=551908752 TSecr=457130346
250,2.589379,192.168.2.2,192.168.1.2,TCP,66,185344,5001  >  48006 [ACK] Seq=1 Ack=312769 Win=185344 Len=0 TSval=551908776 TSecr=457130370
252,2.613709,192.168.2.2,192.168.1.2,TCP,66,185344,5001  >  48006 [ACK] Seq=1 Ack=315665 Win=185344 Len=0 TSval=551908800 TSecr=457130394
254,2.649888,192.168.2.2,192.168.1.2,TCP,66,185344,5001  >  48006 [ACK] Seq=1 Ack=320009 Win=185344 Len=0 TSval=551908836 TSecr=457130405
256,2.674204,192.168.2.2,192.168.1.2,TCP,66,185344,5001  >  48006 [ACK] Seq=1 Ack=322905 Win=185344 Len=0 TSval=551908861 TSecr=457130443
258,2.698987,192.168.2.2,192.168.1.2,TCP,66,185344,5001  >  48006 [ACK] Seq=1 Ack=325801 Win=185344 Len=0 TSval=551908886 TSecr=457130467
260,2.722592,192.168.2.2,192.168.1.2,TCP,66,185344,5001  >  48006 [ACK] Seq=1 Ack=328697 Win=185344 Len=0 TSval=551908909 TSecr=457130491
262,2.747022,192.168.2.2,192.168.1.2,TCP,66,185344,5001  >  48006 [ACK] Seq=1 Ack=331593 Win=185344 Len=0 TSval=551908934 TSecr=457130515
264,2.771497,192.168.2.2,192.168.1.2,TCP,66,185344,5001  >  48006 [ACK] Seq=1 Ack=334489 Win=185344 Len=0 TSval=551908958 TSecr=457130552
266,2.795965,192.168.2.2,192.168.1.2,TCP,66,185344,5001  >  48006 [ACK] Seq=1 Ack=337385 Win=185344 Len=0 TSval=551908982 TSecr=457130576
268,2.819873,192.168.2.2,192.168.1.2,TCP,66,185344,5001  >  48006 [ACK] Seq=1 Ack=340281 Win=185344 Len=0 TSval=551909006 TSecr=457130601
270,2.844041,192.168.2.2,192.168.1.2,TCP,66,185344,5001  >  48006 [ACK] Seq=1 Ack=343177 Win=185344 Len=0 TSval=551909030 TSecr=457130624
272,2.868515,192.168.2.2,192.168.1.2,TCP,66,185344,5001  >  48006 [ACK] Seq=1 Ack=346073 Win=185344 Len=0 TSval=551909055 TSecr=457130649
274,2.892998,192.168.2.2,192.168.1.2,TCP,66,185344,5001  >  48006 [ACK] Seq=1 Ack=348969 Win=185344 Len=0 TSval=551909079 TSecr=457130673
276,2.916439,192.168.2.2,192.168.1.2,TCP,66,185344,5001  >  48006 [ACK] Seq=1 Ack=351865 Win=185344 Len=0 TSval=551909103 TSecr=457130698
278,2.940562,192.168.2.2,192.168.1.2,TCP,66,185344,5001  >  48006 [ACK] Seq=1 Ack=354761 Win=185344 Len=0 TSval=551909127 TSecr=457130721
280,2.965553,192.168.2.2,192.168.1.2,TCP,66,185344,5001  >  48006 [ACK] Seq=1 Ack=357657 Win=185344 Len=0 TSval=551909152 TSecr=457130746
282,2.989184,192.168.2.2,192.168.1.2,TCP,66,185344,5001  >  48006 [ACK] Seq=1 Ack=360553 Win=185344 Len=0 TSval=551909176 TSecr=457130770
286,3.01357,192.168.2.2,192.168.1.2,TCP,66,185344,5001  >  48006 [ACK] Seq=1 Ack=363449 Win=185344 Len=0 TSval=551909200 TSecr=457130795
288,3.037566,192.168.2.2,192.168.1.2,TCP,66,185344,5001  >  48006 [ACK] Seq=1 Ack=366345 Win=185344 Len=0 TSval=551909224 TSecr=457130818
290,3.061708,192.168.2.2,192.168.1.2,TCP,66,185344,5001  >  48006 [ACK] Seq=1 Ack=369241 Win=185344 Len=0 TSval=551909248 TSecr=457130842
292,3.086069,192.168.2.2,192.168.1.2,TCP,66,185344,5001  >  48006 [ACK] Seq=1 Ack=372137 Win=185344 Len=0 TSval=551909272 TSecr=457130867
294,3.110557,192.168.2.2,192.168.1.2,TCP,66,185344,5001  >  48006 [ACK] Seq=1 Ack=375033 Win=185344 Len=0 TSval=551909297 TSecr=457130891
296,3.134363,192.168.2.2,192.168.1.2,TCP,66,185344,5001  >  48006 [ACK] Seq=1 Ack=377929 Win=185344 Len=0 TSval=551909321 TSecr=457130891
299,3.159709,192.168.2.2,192.168.1.2,TCP,66,185344,5001  >  48006 [ACK] Seq=1 Ack=380825 Win=185344 Len=0 TSval=551909346 TSecr=457130915
301,3.183598,192.168.2.2,192.168.1.2,TCP,66,185344,5001  >  48006 [ACK] Seq=1 Ack=383721 Win=185344 Len=0 TSval=551909370 TSecr=457130939
303,3.207827,192.168.2.2,192.168.1.2,TCP,66,185344,5001  >  48006 [ACK] Seq=1 Ack=386617 Win=185344 Len=0 TSval=551909394 TSecr=457130963
305,3.232245,192.168.2.2,192.168.1.2,TCP,66,185344,5001  >  48006 [ACK] Seq=1 Ack=389513 Win=185344 Len=0 TSval=551909419 TSecr=457130988
307,3.256585,192.168.2.2,192.168.1.2,TCP,66,185344,5001  >  48006 [ACK] Seq=1 Ack=392409 Win=185344 Len=0 TSval=551909443 TSecr=457131012
309,3.280507,192.168.2.2,192.168.1.2,TCP,66,185344,5001  >  48006 [ACK] Seq=1 Ack=395305 Win=185344 Len=0 TSval=551909467 TSecr=457131036
311,3.304731,192.168.2.2,192.168.1.2,TCP,66,185344,5001  >  48006 [ACK] Seq=1 Ack=398201 Win=185344 Len=0 TSval=551909491 TSecr=457131061
313,3.32915,192.168.2.2,192.168.1.2,TCP,66,185344,5001  >  48006 [ACK] Seq=1 Ack=401097 Win=185344 Len=0 TSval=551909515 TSecr=457131085
315,3.353647,192.168.2.2,192.168.1.2,TCP,66,185344,5001  >  48006 [ACK] Seq=1 Ack=403993 Win=185344 Len=0 TSval=551909540 TSecr=457131109
317,3.37738,192.168.2.2,192.168.1.2,TCP,66,185344,5001  >  48006 [ACK] Seq=1 Ack=406889 Win=185344 Len=0 TSval=551909564 TSecr=457131134
319,3.401632,192.168.2.2,192.168.1.2,TCP,66,185344,5001  >  48006 [ACK] Seq=1 Ack=409785 Win=185344 Len=0 TSval=551909588 TSecr=457131158
321,3.426171,192.168.2.2,192.168.1.2,TCP,66,185344,5001  >  48006 [ACK] Seq=1 Ack=412681 Win=185344 Len=0 TSval=551909612 TSecr=457131182
323,3.455438,192.168.2.2,192.168.1.2,TCP,66,185344,5001  >  48006 [ACK] Seq=1 Ack=415577 Win=185344 Len=0 TSval=551909642 TSecr=457131206
325,3.474293,192.168.2.2,192.168.1.2,TCP,66,185344,5001  >  48006 [ACK] Seq=1 Ack=418473 Win=185344 Len=0 TSval=551909660 TSecr=457131231
327,3.498657,192.168.2.2,192.168.1.2,TCP,66,185344,5001  >  48006 [ACK] Seq=1 Ack=421369 Win=185344 Len=0 TSval=551909685 TSecr=457131255
329,3.52321,192.168.2.2,192.168.1.2,TCP,66,185344,5001  >  48006 [ACK] Seq=1 Ack=424265 Win=185344 Len=0 TSval=551909709 TSecr=457131279
331,3.547016,192.168.2.2,192.168.1.2,TCP,66,185344,5001  >  48006 [ACK] Seq=1 Ack=427161 Win=185344 Len=0 TSval=551909733 TSecr=457131303
333,3.57122,192.168.2.2,192.168.1.2,TCP,66,185344,5001  >  48006 [ACK] Seq=1 Ack=430057 Win=185344 Len=0 TSval=551909757 TSecr=457131327
335,3.595724,192.168.2.2,192.168.1.2,TCP,66,185344,5001  >  48006 [ACK] Seq=1 Ack=432953 Win=185344 Len=0 TSval=551909782 TSecr=457131357
337,3.620244,192.168.2.2,192.168.1.2,TCP,66,185344,5001  >  48006 [ACK] Seq=1 Ack=435849 Win=185344 Len=0 TSval=551909806 TSecr=457131376
339,3.643852,192.168.2.2,192.168.1.2,TCP,66,185344,5001  >  48006 [ACK] Seq=1 Ack=438745 Win=185344 Len=0 TSval=551909830 TSecr=457131400
341,3.668253,192.168.2.2,192.168.1.2,TCP,66,185344,5001  >  48006 [ACK] Seq=1 Ack=441641 Win=185344 Len=0 TSval=551909854 TSecr=457131424
343,3.692791,192.168.2.2,192.168.1.2,TCP,66,185344,5001  >  48006 [ACK] Seq=1 Ack=444537 Win=185344 Len=0 TSval=551909879 TSecr=457131448
345,3.728675,192.168.2.2,192.168.1.2,TCP,66,185344,5001  >  48006 [ACK] Seq=1 Ack=448881 Win=185344 Len=0 TSval=551909915 TSecr=457131472
348,3.753487,192.168.2.2,192.168.1.2,TCP,66,185344,5001  >  48006 [ACK] Seq=1 Ack=451777 Win=185344 Len=0 TSval=551909939 TSecr=457131521
350,3.777068,192.168.2.2,192.168.1.2,TCP,66,185344,5001  >  48006 [ACK] Seq=1 Ack=454673 Win=185344 Len=0 TSval=551909963 TSecr=457131545
352,3.801535,192.168.2.2,192.168.1.2,TCP,66,185344,5001  >  48006 [ACK] Seq=1 Ack=457569 Win=185344 Len=0 TSval=551909988 TSecr=457131569
354,3.826076,192.168.2.2,192.168.1.2,TCP,66,185344,5001  >  48006 [ACK] Seq=1 Ack=460465 Win=185344 Len=0 TSval=551910012 TSecr=457131594
356,3.850498,192.168.2.2,192.168.1.2,TCP,66,185344,5001  >  48006 [ACK] Seq=1 Ack=463361 Win=185344 Len=0 TSval=551910036 TSecr=457131630
358,3.874043,192.168.2.2,192.168.1.2,TCP,66,185344,5001  >  48006 [ACK] Seq=1 Ack=466257 Win=185344 Len=0 TSval=551910060 TSecr=457131630
360,3.898542,192.168.2.2,192.168.1.2,TCP,66,185344,5001  >  48006 [ACK] Seq=1 Ack=469153 Win=185344 Len=0 TSval=551910084 TSecr=457131655
362,3.92313,192.168.2.2,192.168.1.2,TCP,66,185344,5001  >  48006 [ACK] Seq=1 Ack=472049 Win=185344 Len=0 TSval=551910109 TSecr=457131678
364,3.947548,192.168.2.2,192.168.1.2,TCP,66,185344,5001  >  48006 [ACK] Seq=1 Ack=474945 Win=185344 Len=0 TSval=551910133 TSecr=457131703
366,3.971048,192.168.2.2,192.168.1.2,TCP,66,185344,5001  >  48006 [ACK] Seq=1 Ack=477841 Win=185344 Len=0 TSval=551910157 TSecr=457131727
368,3.995101,192.168.2.2,192.168.1.2,TCP,66,185344,5001  >  48006 [ACK] Seq=1 Ack=480737 Win=185344 Len=0 TSval=551910181 TSecr=457131752
371,4.020052,192.168.2.2,192.168.1.2,TCP,66,185344,5001  >  48006 [ACK] Seq=1 Ack=483633 Win=185344 Len=0 TSval=551910206 TSecr=457131775
373,4.04373,192.168.2.2,192.168.1.2,TCP,66,185344,5001  >  48006 [ACK] Seq=1 Ack=486529 Win=185344 Len=0 TSval=551910230 TSecr=457131800
376,4.068156,192.168.2.2,192.168.1.2,TCP,66,185344,5001  >  48006 [ACK] Seq=1 Ack=489425 Win=185344 Len=0 TSval=551910254 TSecr=457131824
378,4.092576,192.168.2.2,192.168.1.2,TCP,66,185344,5001  >  48006 [ACK] Seq=1 Ack=492321 Win=185344 Len=0 TSval=551910278 TSecr=457131849
380,4.116218,192.168.2.2,192.168.1.2,TCP,66,185344,5001  >  48006 [ACK] Seq=1 Ack=495217 Win=185344 Len=0 TSval=551910302 TSecr=457131872
382,4.140671,192.168.2.2,192.168.1.2,TCP,66,185344,5001  >  48006 [ACK] Seq=1 Ack=498113 Win=185344 Len=0 TSval=551910326 TSecr=457131896
385,4.165501,192.168.2.2,192.168.1.2,TCP,66,185344,5001  >  48006 [ACK] Seq=1 Ack=501009 Win=185344 Len=0 TSval=551910351 TSecr=457131921
387,4.18985,192.168.2.2,192.168.1.2,TCP,66,185344,5001  >  48006 [ACK] Seq=1 Ack=503905 Win=185344 Len=0 TSval=551910376 TSecr=457131945
389,4.226019,192.168.2.2,192.168.1.2,TCP,66,185344,5001  >  48006 [ACK] Seq=1 Ack=508249 Win=185344 Len=0 TSval=551910412 TSecr=457131948
391,4.250435,192.168.2.2,192.168.1.2,TCP,66,185344,5001  >  48006 [ACK] Seq=1 Ack=511145 Win=185344 Len=0 TSval=551910436 TSecr=457131994
393,4.274898,192.168.2.2,192.168.1.2,TCP,66,185344,5001  >  48006 [ACK] Seq=1 Ack=514041 Win=185344 Len=0 TSval=551910461 TSecr=457132017
395,4.299393,192.168.2.2,192.168.1.2,TCP,66,185344,5001  >  48006 [ACK] Seq=1 Ack=516937 Win=185344 Len=0 TSval=551910485 TSecr=457132042
397,4.322889,192.168.2.2,192.168.1.2,TCP,66,185344,5001  >  48006 [ACK] Seq=1 Ack=519833 Win=185344 Len=0 TSval=551910509 TSecr=457132066
399,4.347382,192.168.2.2,192.168.1.2,TCP,66,185344,5001  >  48006 [ACK] Seq=1 Ack=522729 Win=185344 Len=0 TSval=551910533 TSecr=457132091
401,4.371881,192.168.2.2,192.168.1.2,TCP,66,185344,5001  >  48006 [ACK] Seq=1 Ack=525625 Win=185344 Len=0 TSval=551910558 TSecr=457132127
403,4.395573,192.168.2.2,192.168.1.2,TCP,66,185344,5001  >  48006 [ACK] Seq=1 Ack=528521 Win=185344 Len=0 TSval=551910581 TSecr=457132151
405,4.41996,192.168.2.2,192.168.1.2,TCP,66,185344,5001  >  48006 [ACK] Seq=1 Ack=531417 Win=185344 Len=0 TSval=551910606 TSecr=457132176
407,4.444438,192.168.2.2,192.168.1.2,TCP,66,185344,5001  >  48006 [ACK] Seq=1 Ack=534313 Win=185344 Len=0 TSval=551910630 TSecr=457132200
410,4.468254,192.168.2.2,192.168.1.2,TCP,66,185344,5001  >  48006 [ACK] Seq=1 Ack=537209 Win=185344 Len=0 TSval=551910654 TSecr=457132224
412,4.49247,192.168.2.2,192.168.1.2,TCP,66,185344,5001  >  48006 [ACK] Seq=1 Ack=540105 Win=185344 Len=0 TSval=551910678 TSecr=457132248
414,4.516932,192.168.2.2,192.168.1.2,TCP,66,185344,5001  >  48006 [ACK] Seq=1 Ack=543001 Win=185344 Len=0 TSval=551910703 TSecr=457132273
416,4.541434,192.168.2.2,192.168.1.2,TCP,66,185344,5001  >  48006 [ACK] Seq=1 Ack=545897 Win=185344 Len=0 TSval=551910727 TSecr=457132296
418,4.565896,192.168.2.2,192.168.1.2,TCP,66,185344,5001  >  48006 [ACK] Seq=1 Ack=548793 Win=185344 Len=0 TSval=551910752 TSecr=457132321
420,4.589525,192.168.2.2,192.168.1.2,TCP,66,185344,5001  >  48006 [ACK] Seq=1 Ack=551689 Win=185344 Len=0 TSval=551910775 TSecr=457132345
422,4.625683,192.168.2.2,192.168.1.2,TCP,66,185344,5001  >  48006 [ACK] Seq=1 Ack=556033 Win=185344 Len=0 TSval=551910811 TSecr=457132346
424,4.649931,192.168.2.2,192.168.1.2,TCP,66,185344,5001  >  48006 [ACK] Seq=1 Ack=558929 Win=185344 Len=0 TSval=551910835 TSecr=457132393
426,4.674745,192.168.2.2,192.168.1.2,TCP,66,185344,5001  >  48006 [ACK] Seq=1 Ack=561825 Win=185344 Len=0 TSval=551910860 TSecr=457132418
428,4.699241,192.168.2.2,192.168.1.2,TCP,66,185344,5001  >  48006 [ACK] Seq=1 Ack=564721 Win=185344 Len=0 TSval=551910885 TSecr=457132442
430,4.72278,192.168.2.2,192.168.1.2,TCP,66,185344,5001  >  48006 [ACK] Seq=1 Ack=567617 Win=185344 Len=0 TSval=551910908 TSecr=457132467
432,4.747244,192.168.2.2,192.168.1.2,TCP,66,185344,5001  >  48006 [ACK] Seq=1 Ack=570513 Win=185344 Len=0 TSval=551910933 TSecr=457132490
434,4.771734,192.168.2.2,192.168.1.2,TCP,66,185344,5001  >  48006 [ACK] Seq=1 Ack=573409 Win=185344 Len=0 TSval=551910957 TSecr=457132526
436,4.795279,192.168.2.2,192.168.1.2,TCP,66,185344,5001  >  48006 [ACK] Seq=1 Ack=576305 Win=185344 Len=0 TSval=551910981 TSecr=457132551
438,4.819891,192.168.2.2,192.168.1.2,TCP,66,185344,5001  >  48006 [ACK] Seq=1 Ack=579201 Win=185344 Len=0 TSval=551911005 TSecr=457132575
440,4.844336,192.168.2.2,192.168.1.2,TCP,66,185344,5001  >  48006 [ACK] Seq=1 Ack=582097 Win=185344 Len=0 TSval=551911030 TSecr=457132600
442,4.868817,192.168.2.2,192.168.1.2,TCP,66,185344,5001  >  48006 [ACK] Seq=1 Ack=584993 Win=185344 Len=0 TSval=551911054 TSecr=457132623
444,4.892282,192.168.2.2,192.168.1.2,TCP,66,185344,5001  >  48006 [ACK] Seq=1 Ack=587889 Win=185344 Len=0 TSval=551911078 TSecr=457132648
446,4.916845,192.168.2.2,192.168.1.2,TCP,66,185344,5001  >  48006 [ACK] Seq=1 Ack=590785 Win=185344 Len=0 TSval=551911102 TSecr=457132672
448,4.940627,192.168.2.2,192.168.1.2,TCP,66,185344,5001  >  48006 [ACK] Seq=1 Ack=593681 Win=185344 Len=0 TSval=551911126 TSecr=457132696
450,4.964844,192.168.2.2,192.168.1.2,TCP,66,185344,5001  >  48006 [ACK] Seq=1 Ack=596577 Win=185344 Len=0 TSval=551911150 TSecr=457132721
452,4.989328,192.168.2.2,192.168.1.2,TCP,66,185344,5001  >  48006 [ACK] Seq=1 Ack=599473 Win=185344 Len=0 TSval=551911175 TSecr=457132745
456,5.013265,192.168.2.2,192.168.1.2,TCP,66,185344,5001  >  48006 [ACK] Seq=1 Ack=602369 Win=185344 Len=0 TSval=551911199 TSecr=457132769
458,5.037513,192.168.2.2,192.168.1.2,TCP,66,185344,5001  >  48006 [ACK] Seq=1 Ack=605265 Win=185344 Len=0 TSval=551911223 TSecr=457132793
462,5.061874,192.168.2.2,192.168.1.2,TCP,66,185344,5001  >  48006 [ACK] Seq=1 Ack=608161 Win=185344 Len=0 TSval=551911247 TSecr=457132817
464,5.086388,192.168.2.2,192.168.1.2,TCP,66,185344,5001  >  48006 [ACK] Seq=1 Ack=611057 Win=185344 Len=0 TSval=551911272 TSecr=457132841
466,5.110862,192.168.2.2,192.168.1.2,TCP,66,185344,5001  >  48006 [ACK] Seq=1 Ack=613953 Win=185344 Len=0 TSval=551911296 TSecr=457132865
468,5.134409,192.168.2.2,192.168.1.2,TCP,66,185344,5001  >  48006 [ACK] Seq=1 Ack=616849 Win=185344 Len=0 TSval=551911320 TSecr=457132890
471,5.171612,192.168.2.2,192.168.1.2,TCP,66,185344,5001  >  48006 [ACK] Seq=1 Ack=621193 Win=185344 Len=0 TSval=551911357 TSecr=457132890
474,5.196124,192.168.2.2,192.168.1.2,TCP,66,185344,5001  >  48006 [ACK] Seq=1 Ack=624089 Win=185344 Len=0 TSval=551911381 TSecr=457132938
476,5.220301,192.168.2.2,192.168.1.2,TCP,66,185344,5001  >  48006 [ACK] Seq=1 Ack=626985 Win=185344 Len=0 TSval=551911406 TSecr=457132962
478,5.245097,192.168.2.2,192.168.1.2,TCP,66,185344,5001  >  48006 [ACK] Seq=1 Ack=629881 Win=185344 Len=0 TSval=551911430 TSecr=457132987
480,5.268772,192.168.2.2,192.168.1.2,TCP,66,185344,5001  >  48006 [ACK] Seq=1 Ack=632777 Win=185344 Len=0 TSval=551911454 TSecr=457133011
482,5.2932,192.168.2.2,192.168.1.2,TCP,66,185344,5001  >  48006 [ACK] Seq=1 Ack=635673 Win=185344 Len=0 TSval=551911478 TSecr=457133035
485,5.31721,192.168.2.2,192.168.1.2,TCP,66,185344,5001  >  48006 [ACK] Seq=1 Ack=638569 Win=185344 Len=0 TSval=551911502 TSecr=457133072
487,5.342167,192.168.2.2,192.168.1.2,TCP,66,185344,5001  >  48006 [ACK] Seq=1 Ack=641465 Win=185344 Len=0 TSval=551911527 TSecr=457133072
489,5.366639,192.168.2.2,192.168.1.2,TCP,66,185344,5001  >  48006 [ACK] Seq=1 Ack=644361 Win=185344 Len=0 TSval=551911552 TSecr=457133097
491,5.390168,192.168.2.2,192.168.1.2,TCP,66,185344,5001  >  48006 [ACK] Seq=1 Ack=647257 Win=185344 Len=0 TSval=551911575 TSecr=457133121
493,5.414643,192.168.2.2,192.168.1.2,TCP,66,185344,5001  >  48006 [ACK] Seq=1 Ack=650153 Win=185344 Len=0 TSval=551911600 TSecr=457133146
495,5.438324,192.168.2.2,192.168.1.2,TCP,66,185344,5001  >  48006 [ACK] Seq=1 Ack=653049 Win=185344 Len=0 TSval=551911623 TSecr=457133169
497,5.46276,192.168.2.2,192.168.1.2,TCP,66,185344,5001  >  48006 [ACK] Seq=1 Ack=655945 Win=185344 Len=0 TSval=551911648 TSecr=457133194
499,5.487175,192.168.2.2,192.168.1.2,TCP,66,185344,5001  >  48006 [ACK] Seq=1 Ack=658841 Win=185344 Len=0 TSval=551911672 TSecr=457133218
501,5.511698,192.168.2.2,192.168.1.2,TCP,66,185344,5001  >  48006 [ACK] Seq=1 Ack=661737 Win=185344 Len=0 TSval=551911697 TSecr=457133243
503,5.535267,192.168.2.2,192.168.1.2,TCP,66,185344,5001  >  48006 [ACK] Seq=1 Ack=664633 Win=185344 Len=0 TSval=551911720 TSecr=457133267
505,5.559731,192.168.2.2,192.168.1.2,TCP,66,185344,5001  >  48006 [ACK] Seq=1 Ack=667529 Win=185344 Len=0 TSval=551911745 TSecr=457133290
507,5.5843,192.168.2.2,192.168.1.2,TCP,66,185344,5001  >  48006 [ACK] Seq=1 Ack=670425 Win=185344 Len=0 TSval=551911769 TSecr=457133315
509,5.607905,192.168.2.2,192.168.1.2,TCP,66,185344,5001  >  48006 [ACK] Seq=1 Ack=673321 Win=185344 Len=0 TSval=551911793 TSecr=457133339
511,5.63222,192.168.2.2,192.168.1.2,TCP,66,185344,5001  >  48006 [ACK] Seq=1 Ack=676217 Win=185344 Len=0 TSval=551911817 TSecr=457133363
513,5.656345,192.168.2.2,192.168.1.2,TCP,66,185344,5001  >  48006 [ACK] Seq=1 Ack=679113 Win=185344 Len=0 TSval=551911841 TSecr=457133387
515,5.680566,192.168.2.2,192.168.1.2,TCP,66,185344,5001  >  48006 [ACK] Seq=1 Ack=682009 Win=185344 Len=0 TSval=551911866 TSecr=457133412
517,5.704948,192.168.2.2,192.168.1.2,TCP,66,185344,5001  >  48006 [ACK] Seq=1 Ack=684905 Win=185344 Len=0 TSval=551911890 TSecr=457133436
519,5.729555,192.168.2.2,192.168.1.2,TCP,66,185344,5001  >  48006 [ACK] Seq=1 Ack=687801 Win=185344 Len=0 TSval=551911915 TSecr=457133460
521,5.753823,192.168.2.2,192.168.1.2,TCP,66,185344,5001  >  48006 [ACK] Seq=1 Ack=690697 Win=185344 Len=0 TSval=551911939 TSecr=457133484
523,5.79014,192.168.2.2,192.168.1.2,TCP,66,185344,5001  >  48006 [ACK] Seq=1 Ack=695041 Win=185344 Len=0 TSval=551911975 TSecr=457133508
527,5.814496,192.168.2.2,192.168.1.2,TCP,66,185344,5001  >  48006 [ACK] Seq=1 Ack=697937 Win=185344 Len=0 TSval=551911999 TSecr=457133556
529,5.838582,192.168.2.2,192.168.1.2,TCP,66,185344,5001  >  48006 [ACK] Seq=1 Ack=700833 Win=185344 Len=0 TSval=551912024 TSecr=457133581
531,5.863622,192.168.2.2,192.168.1.2,TCP,66,185344,5001  >  48006 [ACK] Seq=1 Ack=703729 Win=185344 Len=0 TSval=551912049 TSecr=457133605
533,5.887081,192.168.2.2,192.168.1.2,TCP,66,185344,5001  >  48006 [ACK] Seq=1 Ack=706625 Win=185344 Len=0 TSval=551912072 TSecr=457133630
535,5.911258,192.168.2.2,192.168.1.2,TCP,66,185344,5001  >  48006 [ACK] Seq=1 Ack=709521 Win=185344 Len=0 TSval=551912096 TSecr=457133654
537,5.936037,192.168.2.2,192.168.1.2,TCP,66,185344,5001  >  48006 [ACK] Seq=1 Ack=712417 Win=185344 Len=0 TSval=551912121 TSecr=457133690
539,5.960564,192.168.2.2,192.168.1.2,TCP,66,185344,5001  >  48006 [ACK] Seq=1 Ack=715313 Win=185344 Len=0 TSval=551912145 TSecr=457133690
541,5.983931,192.168.2.2,192.168.1.2,TCP,66,185344,5001  >  48006 [ACK] Seq=1 Ack=718209 Win=185344 Len=0 TSval=551912169 TSecr=457133715
543,6.008585,192.168.2.2,192.168.1.2,TCP,66,185344,5001  >  48006 [ACK] Seq=1 Ack=721105 Win=185344 Len=0 TSval=551912193 TSecr=457133739
546,6.03236,192.168.2.2,192.168.1.2,TCP,66,185344,5001  >  48006 [ACK] Seq=1 Ack=724001 Win=185344 Len=0 TSval=551912217 TSecr=457133764
548,6.056675,192.168.2.2,192.168.1.2,TCP,66,185344,5001  >  48006 [ACK] Seq=1 Ack=726897 Win=185344 Len=0 TSval=551912242 TSecr=457133787
550,6.081102,192.168.2.2,192.168.1.2,TCP,66,185344,5001  >  48006 [ACK] Seq=1 Ack=729793 Win=185344 Len=0 TSval=551912266 TSecr=457133811
552,6.105064,192.168.2.2,192.168.1.2,TCP,66,185344,5001  >  48006 [ACK] Seq=1 Ack=732689 Win=185344 Len=0 TSval=551912290 TSecr=457133836
554,6.129277,192.168.2.2,192.168.1.2,TCP,66,185344,5001  >  48006 [ACK] Seq=1 Ack=735585 Win=185344 Len=0 TSval=551912314 TSecr=457133861
556,6.153647,192.168.2.2,192.168.1.2,TCP,66,185344,5001  >  48006 [ACK] Seq=1 Ack=738481 Win=185344 Len=0 TSval=551912338 TSecr=457133884
558,6.178111,192.168.2.2,192.168.1.2,TCP,66,185344,5001  >  48006 [ACK] Seq=1 Ack=741377 Win=185344 Len=0 TSval=551912363 TSecr=457133909
561,6.203041,192.168.2.2,192.168.1.2,TCP,66,185344,5001  >  48006 [ACK] Seq=1 Ack=744273 Win=185344 Len=0 TSval=551912388 TSecr=457133932
563,6.227103,192.168.2.2,192.168.1.2,TCP,66,185344,5001  >  48006 [ACK] Seq=1 Ack=747169 Win=185344 Len=0 TSval=551912412 TSecr=457133957
565,6.251689,192.168.2.2,192.168.1.2,TCP,66,185344,5001  >  48006 [ACK] Seq=1 Ack=750065 Win=185344 Len=0 TSval=551912436 TSecr=457133981
567,6.276183,192.168.2.2,192.168.1.2,TCP,66,185344,5001  >  48006 [ACK] Seq=1 Ack=752961 Win=185344 Len=0 TSval=551912461 TSecr=457134005
569,6.299658,192.168.2.2,192.168.1.2,TCP,66,185344,5001  >  48006 [ACK] Seq=1 Ack=755857 Win=185344 Len=0 TSval=551912484 TSecr=457134029
571,6.336941,192.168.2.2,192.168.1.2,TCP,66,185344,5001  >  48006 [ACK] Seq=1 Ack=760201 Win=185344 Len=0 TSval=551912522 TSecr=457134054
574,6.360419,192.168.2.2,192.168.1.2,TCP,66,185344,5001  >  48006 [ACK] Seq=1 Ack=763097 Win=185344 Len=0 TSval=551912545 TSecr=457134103
576,6.384406,192.168.2.2,192.168.1.2,TCP,66,185344,5001  >  48006 [ACK] Seq=1 Ack=765993 Win=185344 Len=0 TSval=551912569 TSecr=457134127
578,6.40944,192.168.2.2,192.168.1.2,TCP,66,185344,5001  >  48006 [ACK] Seq=1 Ack=768889 Win=185344 Len=0 TSval=551912594 TSecr=457134152
580,6.433162,192.168.2.2,192.168.1.2,TCP,66,185344,5001  >  48006 [ACK] Seq=1 Ack=771785 Win=185344 Len=0 TSval=551912618 TSecr=457134176
582,6.457416,192.168.2.2,192.168.1.2,TCP,66,185344,5001  >  48006 [ACK] Seq=1 Ack=774681 Win=185344 Len=0 TSval=551912642 TSecr=457134200
584,6.481919,192.168.2.2,192.168.1.2,TCP,66,185344,5001  >  48006 [ACK] Seq=1 Ack=777577 Win=185344 Len=0 TSval=551912667 TSecr=457134237
586,6.506497,192.168.2.2,192.168.1.2,TCP,66,185344,5001  >  48006 [ACK] Seq=1 Ack=780473 Win=185344 Len=0 TSval=551912691 TSecr=457134237
588,6.529755,192.168.2.2,192.168.1.2,TCP,66,185344,5001  >  48006 [ACK] Seq=1 Ack=783369 Win=185344 Len=0 TSval=551912714 TSecr=457134260
590,6.554456,192.168.2.2,192.168.1.2,TCP,66,185344,5001  >  48006 [ACK] Seq=1 Ack=786265 Win=185344 Len=0 TSval=551912739 TSecr=457134284
592,6.578387,192.168.2.2,192.168.1.2,TCP,66,185344,5001  >  48006 [ACK] Seq=1 Ack=789161 Win=185344 Len=0 TSval=551912763 TSecr=457134309
594,6.602522,192.168.2.2,192.168.1.2,TCP,66,185344,5001  >  48006 [ACK] Seq=1 Ack=792057 Win=185344 Len=0 TSval=551912787 TSecr=457134333
596,6.626959,192.168.2.2,192.168.1.2,TCP,66,185344,5001  >  48006 [ACK] Seq=1 Ack=794953 Win=185344 Len=0 TSval=551912812 TSecr=457134357
598,6.651541,192.168.2.2,192.168.1.2,TCP,66,185344,5001  >  48006 [ACK] Seq=1 Ack=797849 Win=185344 Len=0 TSval=551912836 TSecr=457134382
600,6.675098,192.168.2.2,192.168.1.2,TCP,66,185344,5001  >  48006 [ACK] Seq=1 Ack=800745 Win=185344 Len=0 TSval=551912860 TSecr=457134406
602,6.699511,192.168.2.2,192.168.1.2,TCP,66,185344,5001  >  48006 [ACK] Seq=1 Ack=803641 Win=185344 Len=0 TSval=551912884 TSecr=457134430
604,6.723984,192.168.2.2,192.168.1.2,TCP,66,185344,5001  >  48006 [ACK] Seq=1 Ack=806537 Win=185344 Len=0 TSval=551912909 TSecr=457134454
606,6.747759,192.168.2.2,192.168.1.2,TCP,66,185344,5001  >  48006 [ACK] Seq=1 Ack=809433 Win=185344 Len=0 TSval=551912932 TSecr=457134478
608,6.772086,192.168.2.2,192.168.1.2,TCP,66,185344,5001  >  48006 [ACK] Seq=1 Ack=812329 Win=185344 Len=0 TSval=551912957 TSecr=457134502
610,6.796611,192.168.2.2,192.168.1.2,TCP,66,185344,5001  >  48006 [ACK] Seq=1 Ack=815225 Win=185344 Len=0 TSval=551912981 TSecr=457134527
612,6.820457,192.168.2.2,192.168.1.2,TCP,66,185344,5001  >  48006 [ACK] Seq=1 Ack=818121 Win=185344 Len=0 TSval=551913005 TSecr=457134551
615,6.844762,192.168.2.2,192.168.1.2,TCP,66,185344,5001  >  48006 [ACK] Seq=1 Ack=821017 Win=185344 Len=0 TSval=551913029 TSecr=457134575
617,6.881842,192.168.2.2,192.168.1.2,TCP,66,185344,5001  >  48006 [ACK] Seq=1 Ack=825361 Win=185344 Len=0 TSval=551913066 TSecr=457134599
619,6.905251,192.168.2.2,192.168.1.2,TCP,66,185344,5001  >  48006 [ACK] Seq=1 Ack=828257 Win=185344 Len=0 TSval=551913090 TSecr=457134647
621,6.929833,192.168.2.2,192.168.1.2,TCP,66,185344,5001  >  48006 [ACK] Seq=1 Ack=831153 Win=185344 Len=0 TSval=551913114 TSecr=457134672
623,6.95432,192.168.2.2,192.168.1.2,TCP,66,185344,5001  >  48006 [ACK] Seq=1 Ack=834049 Win=185344 Len=0 TSval=551913139 TSecr=457134696
625,6.97789,192.168.2.2,192.168.1.2,TCP,66,185344,5001  >  48006 [ACK] Seq=1 Ack=836945 Win=185344 Len=0 TSval=551913162 TSecr=457134720
627,7.002324,192.168.2.2,192.168.1.2,TCP,66,185344,5001  >  48006 [ACK] Seq=1 Ack=839841 Win=185344 Len=0 TSval=551913187 TSecr=457134720
630,7.026382,192.168.2.2,192.168.1.2,TCP,66,185344,5001  >  48006 [ACK] Seq=1 Ack=842737 Win=185344 Len=0 TSval=551913211 TSecr=457134744
