"No.","Time","Source","Destination","Protocol","Length","Calculated window size","Info"
"4","0.001273","192.168.2.2","192.168.1.2","TCP","74","28960","5001  >  48034 [SYN, ACK] Seq=0 Ack=1 Win=28960 Len=0 MSS=1460 SACK_PERM=1 TSval=552313579 TSecr=457535294 WS=512"
"7","0.001366","192.168.2.2","192.168.1.2","TCP","66","43520","5001  >  48034 [ACK] Seq=1 Ack=7241 Win=43520 Len=0 TSval=552313580 TSecr=457535295"
"11","0.050472","192.168.2.2","192.168.1.2","TCP","66","58368","5001  >  48034 [ACK] Seq=1 Ack=14481 Win=58368 Len=0 TSval=552313629 TSecr=457535295"
"13","0.111259","192.168.2.2","192.168.1.2","TCP","66","72704","5001  >  48034 [ACK] Seq=1 Ack=21721 Win=72704 Len=0 TSval=552313689 TSecr=457535295"
"17","0.171442","192.168.2.2","192.168.1.2","TCP","66","75776","5001  >  48034 [ACK] Seq=1 Ack=23169 Win=75776 Len=0 TSval=552313750 TSecr=457535307"
"18","0.183847","192.168.2.2","192.168.1.2","TCP","66","78336","5001  >  48034 [ACK] Seq=1 Ack=24617 Win=78336 Len=0 TSval=552313762 TSecr=457535377"
"20","0.195622","192.168.2.2","192.168.1.2","TCP","66","81408","5001  >  48034 [ACK] Seq=1 Ack=26065 Win=81408 Len=0 TSval=552313774 TSecr=457535454"
"22","0.208306","192.168.2.2","192.168.1.2","TCP","66","84480","5001  >  48034 [ACK] Seq=1 Ack=27513 Win=84480 Len=0 TSval=552313786 TSecr=457535477"
"25","0.220085","192.168.2.2","192.168.1.2","TCP","66","87040","5001  >  48034 [ACK] Seq=1 Ack=28961 Win=87040 Len=0 TSval=552313798 TSecr=457535489"
"27","0.231939","192.168.2.2","192.168.1.2","TCP","66","90112","5001  >  48034 [ACK] Seq=1 Ack=30409 Win=90112 Len=0 TSval=552313810 TSecr=457535501"
"29","0.244202","192.168.2.2","192.168.1.2","TCP","66","92672","5001  >  48034 [ACK] Seq=1 Ack=31857 Win=92672 Len=0 TSval=552313822 TSecr=457535501"
"31","0.256347","192.168.2.2","192.168.1.2","TCP","66","95744","5001  >  48034 [ACK] Seq=1 Ack=33305 Win=95744 Len=0 TSval=552313834 TSecr=457535513"
"33","0.268264","192.168.2.2","192.168.1.2","TCP","66","98816","5001  >  48034 [ACK] Seq=1 Ack=34753 Win=98816 Len=0 TSval=552313846 TSecr=457535525"
"35","0.280396","192.168.2.2","192.168.1.2","TCP","66","101376","5001  >  48034 [ACK] Seq=1 Ack=36201 Win=101376 Len=0 TSval=552313858 TSecr=457535537"
"37","0.292601","192.168.2.2","192.168.1.2","TCP","66","107520","5001  >  48034 [ACK] Seq=1 Ack=39097 Win=107520 Len=0 TSval=552313871 TSecr=457535549"
"39","0.317354","192.168.2.2","192.168.1.2","TCP","66","110080","5001  >  48034 [ACK] Seq=1 Ack=40545 Win=110080 Len=0 TSval=552313895 TSecr=457535561"
"41","0.329804","192.168.2.2","192.168.1.2","TCP","66","113152","5001  >  48034 [ACK] Seq=1 Ack=41993 Win=113152 Len=0 TSval=552313908 TSecr=457535573"
"43","0.341643","192.168.2.2","192.168.1.2","TCP","66","116224","5001  >  48034 [ACK] Seq=1 Ack=43441 Win=116224 Len=0 TSval=552313920 TSecr=457535586"
"45","0.354337","192.168.2.2","192.168.1.2","TCP","66","121856","5001  >  48034 [ACK] Seq=1 Ack=46337 Win=121856 Len=0 TSval=552313932 TSecr=457535611"
"47","0.377923","192.168.2.2","192.168.1.2","TCP","66","127488","5001  >  48034 [ACK] Seq=1 Ack=49233 Win=127488 Len=0 TSval=552313956 TSecr=457535623"
"49","0.402346","192.168.2.2","192.168.1.2","TCP","66","130560","5001  >  48034 [ACK] Seq=1 Ack=50681 Win=130560 Len=0 TSval=552313980 TSecr=457535635"
"51","0.414271","192.168.2.2","192.168.1.2","TCP","66","136192","5001  >  48034 [ACK] Seq=1 Ack=53577 Win=136192 Len=0 TSval=552313992 TSecr=457535647"
"53","0.438753","192.168.2.2","192.168.1.2","TCP","66","142336","5001  >  48034 [ACK] Seq=1 Ack=56473 Win=142336 Len=0 TSval=552314017 TSecr=457535671"
"55","0.462710","192.168.2.2","192.168.1.2","TCP","66","144896","5001  >  48034 [ACK] Seq=1 Ack=57921 Win=144896 Len=0 TSval=552314041 TSecr=457535696"
"57","0.474823","192.168.2.2","192.168.1.2","TCP","66","151040","5001  >  48034 [ACK] Seq=1 Ack=60817 Win=151040 Len=0 TSval=552314053 TSecr=457535707"
"59","0.499390","192.168.2.2","192.168.1.2","TCP","66","156672","5001  >  48034 [ACK] Seq=1 Ack=63713 Win=156672 Len=0 TSval=552314077 TSecr=457535732"
"61","0.523903","192.168.2.2","192.168.1.2","TCP","66","159744","5001  >  48034 [ACK] Seq=1 Ack=65161 Win=159744 Len=0 TSval=552314102 TSecr=457535756"
"63","0.535372","192.168.2.2","192.168.1.2","TCP","66","165376","5001  >  48034 [ACK] Seq=1 Ack=68057 Win=165376 Len=0 TSval=552314113 TSecr=457535768"
"65","0.560086","192.168.2.2","192.168.1.2","TCP","66","171008","5001  >  48034 [ACK] Seq=1 Ack=70953 Win=171008 Len=0 TSval=552314138 TSecr=457535792"
"67","0.583829","192.168.2.2","192.168.1.2","TCP","66","177152","5001  >  48034 [ACK] Seq=1 Ack=73849 Win=177152 Len=0 TSval=552314162 TSecr=457535817"
"70","0.608075","192.168.2.2","192.168.1.2","TCP","66","182784","5001  >  48034 [ACK] Seq=1 Ack=76745 Win=182784 Len=0 TSval=552314186 TSecr=457535828"
"72","0.633157","192.168.2.2","192.168.1.2","TCP","66","185344","5001  >  48034 [ACK] Seq=1 Ack=79641 Win=185344 Len=0 TSval=552314211 TSecr=457535853"
"74","0.656568","192.168.2.2","192.168.1.2","TCP","66","185344","5001  >  48034 [ACK] Seq=1 Ack=82537 Win=185344 Len=0 TSval=552314234 TSecr=457535877"
"77","0.680731","192.168.2.2","192.168.1.2","TCP","66","185344","5001  >  48034 [ACK] Seq=1 Ack=85433 Win=185344 Len=0 TSval=552314259 TSecr=457535901"
"79","0.705692","192.168.2.2","192.168.1.2","TCP","66","185856","5001  >  48034 [ACK] Seq=1 Ack=86881 Win=185856 Len=0 TSval=552314283 TSecr=457535926"
"81","0.717394","192.168.2.2","192.168.1.2","TCP","66","185344","5001  >  48034 [ACK] Seq=1 Ack=89777 Win=185344 Len=0 TSval=552314295 TSecr=457535950"
"83","0.741283","192.168.2.2","192.168.1.2","TCP","66","185344","5001  >  48034 [ACK] Seq=1 Ack=92673 Win=185344 Len=0 TSval=552314319 TSecr=457535950"
"85","0.766418","192.168.2.2","192.168.1.2","TCP","66","185344","5001  >  48034 [ACK] Seq=1 Ack=95569 Win=185344 Len=0 TSval=552314344 TSecr=457535974"
"87","0.789960","192.168.2.2","192.168.1.2","TCP","66","185856","5001  >  48034 [ACK] Seq=1 Ack=97017 Win=185856 Len=0 TSval=552314368 TSecr=457535999"
"89","0.801848","192.168.2.2","192.168.1.2","TCP","66","185344","5001  >  48034 [ACK] Seq=1 Ack=99913 Win=185344 Len=0 TSval=552314380 TSecr=457536010"
"91","0.826225","192.168.2.2","192.168.1.2","TCP","66","185344","5001  >  48034 [ACK] Seq=1 Ack=102809 Win=185344 Len=0 TSval=552314404 TSecr=457536034"
"93","0.850722","192.168.2.2","192.168.1.2","TCP","66","185344","5001  >  48034 [ACK] Seq=1 Ack=105705 Win=185344 Len=0 TSval=552314428 TSecr=457536059"
"95","0.886634","192.168.2.2","192.168.1.2","TCP","66","185344","5001  >  48034 [ACK] Seq=1 Ack=110049 Win=185344 Len=0 TSval=552314464 TSecr=457536083"
"97","0.910937","192.168.2.2","192.168.1.2","TCP","66","185344","5001  >  48034 [ACK] Seq=1 Ack=112945 Win=185344 Len=0 TSval=552314489 TSecr=457536119"
"99","0.935944","192.168.2.2","192.168.1.2","TCP","66","185344","5001  >  48034 [ACK] Seq=1 Ack=115841 Win=185344 Len=0 TSval=552314514 TSecr=457536144"
"102","0.959492","192.168.2.2","192.168.1.2","TCP","66","185344","5001  >  48034 [ACK] Seq=1 Ack=118737 Win=185344 Len=0 TSval=552314537 TSecr=457536180"
"104","0.983969","192.168.2.2","192.168.1.2","TCP","66","185344","5001  >  48034 [ACK] Seq=1 Ack=121633 Win=185344 Len=0 TSval=552314562 TSecr=457536204"
"106","1.008456","192.168.2.2","192.168.1.2","TCP","66","185344","5001  >  48034 [ACK] Seq=1 Ack=124529 Win=185344 Len=0 TSval=552314586 TSecr=457536229"
"109","1.031956","192.168.2.2","192.168.1.2","TCP","66","185344","5001  >  48034 [ACK] Seq=1 Ack=127425 Win=185344 Len=0 TSval=552314610 TSecr=457536229"
"111","1.056548","192.168.2.2","192.168.1.2","TCP","66","185344","5001  >  48034 [ACK] Seq=1 Ack=130321 Win=185344 Len=0 TSval=552314634 TSecr=457536252"
"113","1.084044","192.168.2.2","192.168.1.2","TCP","66","185344","5001  >  48034 [ACK] Seq=1 Ack=133217 Win=185344 Len=0 TSval=552314662 TSecr=457536277"
"115","1.105591","192.168.2.2","192.168.1.2","TCP","66","185344","5001  >  48034 [ACK] Seq=1 Ack=136113 Win=185344 Len=0 TSval=552314683 TSecr=457536301"
"118","1.129628","192.168.2.2","192.168.1.2","TCP","66","185344","5001  >  48034 [ACK] Seq=1 Ack=139009 Win=185344 Len=0 TSval=552314707 TSecr=457536325"
"120","1.154510","192.168.2.2","192.168.1.2","TCP","66","185344","5001  >  48034 [ACK] Seq=1 Ack=141905 Win=185344 Len=0 TSval=552314732 TSecr=457536349"
"122","1.178136","192.168.2.2","192.168.1.2","TCP","66","185344","5001  >  48034 [ACK] Seq=1 Ack=144801 Win=185344 Len=0 TSval=552314756 TSecr=457536377"
"126","1.202557","192.168.2.2","192.168.1.2","TCP","66","185344","5001  >  48034 [ACK] Seq=1 Ack=147697 Win=185344 Len=0 TSval=552314780 TSecr=457536398"
"128","1.226636","192.168.2.2","192.168.1.2","TCP","66","185344","5001  >  48034 [ACK] Seq=1 Ack=150593 Win=185344 Len=0 TSval=552314804 TSecr=457536422"
"130","1.251143","192.168.2.2","192.168.1.2","TCP","66","185344","5001  >  48034 [ACK] Seq=1 Ack=153489 Win=185344 Len=0 TSval=552314829 TSecr=457536447"
"132","1.275058","192.168.2.2","192.168.1.2","TCP","66","185344","5001  >  48034 [ACK] Seq=1 Ack=156385 Win=185344 Len=0 TSval=552314853 TSecr=457536471"
"134","1.299268","192.168.2.2","192.168.1.2","TCP","66","185344","5001  >  48034 [ACK] Seq=1 Ack=159281 Win=185344 Len=0 TSval=552314877 TSecr=457536495"
"136","1.323664","192.168.2.2","192.168.1.2","TCP","66","185344","5001  >  48034 [ACK] Seq=1 Ack=162177 Win=185344 Len=0 TSval=552314901 TSecr=457536519"
"138","1.348098","192.168.2.2","192.168.1.2","TCP","66","185344","5001  >  48034 [ACK] Seq=1 Ack=165073 Win=185344 Len=0 TSval=552314926 TSecr=457536544"
"141","1.372030","192.168.2.2","192.168.1.2","TCP","66","185344","5001  >  48034 [ACK] Seq=1 Ack=167969 Win=185344 Len=0 TSval=552314950 TSecr=457536568"
"144","1.397414","192.168.2.2","192.168.1.2","TCP","66","185344","5001  >  48034 [ACK] Seq=1 Ack=170865 Win=185344 Len=0 TSval=552314975 TSecr=457536592"
"146","1.421694","192.168.2.2","192.168.1.2","TCP","66","185344","5001  >  48034 [ACK] Seq=1 Ack=173761 Win=185344 Len=0 TSval=552314999 TSecr=457536616"
"149","1.445854","192.168.2.2","192.168.1.2","TCP","66","185344","5001  >  48034 [ACK] Seq=1 Ack=176657 Win=185344 Len=0 TSval=552315023 TSecr=457536641"
"151","1.482466","192.168.2.2","192.168.1.2","TCP","66","185344","5001  >  48034 [ACK] Seq=1 Ack=181001 Win=185344 Len=0 TSval=552315060 TSecr=457536641"
"153","1.506934","192.168.2.2","192.168.1.2","TCP","66","185344","5001  >  48034 [ACK] Seq=1 Ack=183897 Win=185344 Len=0 TSval=552315084 TSecr=457536690"
"155","1.531373","192.168.2.2","192.168.1.2","TCP","66","185344","5001  >  48034 [ACK] Seq=1 Ack=186793 Win=185344 Len=0 TSval=552315109 TSecr=457536714"
"157","1.554932","192.168.2.2","192.168.1.2","TCP","66","185344","5001  >  48034 [ACK] Seq=1 Ack=189689 Win=185344 Len=0 TSval=552315132 TSecr=457536738"
"159","1.579087","192.168.2.2","192.168.1.2","TCP","66","185344","5001  >  48034 [ACK] Seq=1 Ack=192585 Win=185344 Len=0 TSval=552315156 TSecr=457536775"
"161","1.603485","192.168.2.2","192.168.1.2","TCP","66","185344","5001  >  48034 [ACK] Seq=1 Ack=195481 Win=185344 Len=0 TSval=552315181 TSecr=457536800"
"163","1.627526","192.168.2.2","192.168.1.2","TCP","66","185344","5001  >  48034 [ACK] Seq=1 Ack=198377 Win=185344 Len=0 TSval=552315205 TSecr=457536824"
"165","1.651889","192.168.2.2","192.168.1.2","TCP","66","185344","5001  >  48034 [ACK] Seq=1 Ack=201273 Win=185344 Len=0 TSval=552315229 TSecr=457536847"
"167","1.676901","192.168.2.2","192.168.1.2","TCP","66","185344","5001  >  48034 [ACK] Seq=1 Ack=204169 Win=185344 Len=0 TSval=552315254 TSecr=457536872"
"169","1.700210","192.168.2.2","192.168.1.2","TCP","66","185344","5001  >  48034 [ACK] Seq=1 Ack=207065 Win=185344 Len=0 TSval=552315278 TSecr=457536896"
"171","1.724610","192.168.2.2","192.168.1.2","TCP","66","185344","5001  >  48034 [ACK] Seq=1 Ack=209961 Win=185344 Len=0 TSval=552315302 TSecr=457536920"
"174","1.748961","192.168.2.2","192.168.1.2","TCP","66","185344","5001  >  48034 [ACK] Seq=1 Ack=212857 Win=185344 Len=0 TSval=552315326 TSecr=457536944"
"176","1.772869","192.168.2.2","192.168.1.2","TCP","66","185344","5001  >  48034 [ACK] Seq=1 Ack=215753 Win=185344 Len=0 TSval=552315350 TSecr=457536969"
"178","1.797143","192.168.2.2","192.168.1.2","TCP","66","185344","5001  >  48034 [ACK] Seq=1 Ack=218649 Win=185344 Len=0 TSval=552315374 TSecr=457536993"
"180","1.821985","192.168.2.2","192.168.1.2","TCP","66","185344","5001  >  48034 [ACK] Seq=1 Ack=221545 Win=185344 Len=0 TSval=552315399 TSecr=457537017"
"182","1.845565","192.168.2.2","192.168.1.2","TCP","66","185344","5001  >  48034 [ACK] Seq=1 Ack=224441 Win=185344 Len=0 TSval=552315423 TSecr=457537017"
"184","1.869972","192.168.2.2","192.168.1.2","TCP","66","185344","5001  >  48034 [ACK] Seq=1 Ack=227337 Win=185344 Len=0 TSval=552315447 TSecr=457537041"
"186","1.893974","192.168.2.2","192.168.1.2","TCP","66","185344","5001  >  48034 [ACK] Seq=1 Ack=230233 Win=185344 Len=0 TSval=552315471 TSecr=457537065"
"188","1.919280","192.168.2.2","192.168.1.2","TCP","66","185344","5001  >  48034 [ACK] Seq=1 Ack=233129 Win=185344 Len=0 TSval=552315496 TSecr=457537089"
"190","1.942557","192.168.2.2","192.168.1.2","TCP","66","185344","5001  >  48034 [ACK] Seq=1 Ack=236025 Win=185344 Len=0 TSval=552315520 TSecr=457537114"
"192","1.967373","192.168.2.2","192.168.1.2","TCP","66","185344","5001  >  48034 [ACK] Seq=1 Ack=238921 Win=185344 Len=0 TSval=552315545 TSecr=457537138"
"194","1.991663","192.168.2.2","192.168.1.2","TCP","66","185344","5001  >  48034 [ACK] Seq=1 Ack=241817 Win=185344 Len=0 TSval=552315569 TSecr=457537162"
"196","2.015842","192.168.2.2","192.168.1.2","TCP","66","185344","5001  >  48034 [ACK] Seq=1 Ack=244713 Win=185344 Len=0 TSval=552315593 TSecr=457537186"
"199","2.040575","192.168.2.2","192.168.1.2","TCP","66","185344","5001  >  48034 [ACK] Seq=1 Ack=247609 Win=185344 Len=0 TSval=552315618 TSecr=457537212"
"201","2.064288","192.168.2.2","192.168.1.2","TCP","66","185344","5001  >  48034 [ACK] Seq=1 Ack=250505 Win=185344 Len=0 TSval=552315641 TSecr=457537235"
"204","2.088627","192.168.2.2","192.168.1.2","TCP","66","185344","5001  >  48034 [ACK] Seq=1 Ack=253401 Win=185344 Len=0 TSval=552315666 TSecr=457537260"
"206","2.124872","192.168.2.2","192.168.1.2","TCP","66","185344","5001  >  48034 [ACK] Seq=1 Ack=257745 Win=185344 Len=0 TSval=552315702 TSecr=457537284"
"210","2.149862","192.168.2.2","192.168.1.2","TCP","66","185344","5001  >  48034 [ACK] Seq=1 Ack=260641 Win=185344 Len=0 TSval=552315727 TSecr=457537333"
"212","2.174135","192.168.2.2","192.168.1.2","TCP","66","185344","5001  >  48034 [ACK] Seq=1 Ack=263537 Win=185344 Len=0 TSval=552315751 TSecr=457537357"
"214","2.198383","192.168.2.2","192.168.1.2","TCP","66","185344","5001  >  48034 [ACK] Seq=1 Ack=266433 Win=185344 Len=0 TSval=552315775 TSecr=457537381"
"216","2.222902","192.168.2.2","192.168.1.2","TCP","66","185344","5001  >  48034 [ACK] Seq=1 Ack=269329 Win=185344 Len=0 TSval=552315800 TSecr=457537417"
"218","2.247377","192.168.2.2","192.168.1.2","TCP","66","185344","5001  >  48034 [ACK] Seq=1 Ack=272225 Win=185344 Len=0 TSval=552315824 TSecr=457537417"
"220","2.271867","192.168.2.2","192.168.1.2","TCP","66","185344","5001  >  48034 [ACK] Seq=1 Ack=275121 Win=185344 Len=0 TSval=552315849 TSecr=457537442"
"222","2.295416","192.168.2.2","192.168.1.2","TCP","66","185344","5001  >  48034 [ACK] Seq=1 Ack=278017 Win=185344 Len=0 TSval=552315872 TSecr=457537466"
"224","2.319933","192.168.2.2","192.168.1.2","TCP","66","185344","5001  >  48034 [ACK] Seq=1 Ack=280913 Win=185344 Len=0 TSval=552315897 TSecr=457537491"
"226","2.343712","192.168.2.2","192.168.1.2","TCP","66","185344","5001  >  48034 [ACK] Seq=1 Ack=283809 Win=185344 Len=0 TSval=552315921 TSecr=457537515"
"228","2.367942","192.168.2.2","192.168.1.2","TCP","66","185344","5001  >  48034 [ACK] Seq=1 Ack=286705 Win=185344 Len=0 TSval=552315945 TSecr=457537540"
"230","2.392430","192.168.2.2","192.168.1.2","TCP","66","185344","5001  >  48034 [ACK] Seq=1 Ack=289601 Win=185344 Len=0 TSval=552315969 TSecr=457537564"
"234","2.416414","192.168.2.2","192.168.1.2","TCP","66","185344","5001  >  48034 [ACK] Seq=1 Ack=292497 Win=185344 Len=0 TSval=552315993 TSecr=457537588"
"236","2.440975","192.168.2.2","192.168.1.2","TCP","66","185344","5001  >  48034 [ACK] Seq=1 Ack=295393 Win=185344 Len=0 TSval=552316018 TSecr=457537612"
"238","2.464748","192.168.2.2","192.168.1.2","TCP","66","185344","5001  >  48034 [ACK] Seq=1 Ack=298289 Win=185344 Len=0 TSval=552316042 TSecr=457537636"
"241","2.489082","192.168.2.2","192.168.1.2","TCP","66","185344","5001  >  48034 [ACK] Seq=1 Ack=301185 Win=185344 Len=0 TSval=552316066 TSecr=457537660"
"244","2.513489","192.168.2.2","192.168.1.2","TCP","66","185344","5001  >  48034 [ACK] Seq=1 Ack=304081 Win=185344 Len=0 TSval=552316090 TSecr=457537684"
"246","2.537978","192.168.2.2","192.168.1.2","TCP","66","185344","5001  >  48034 [ACK] Seq=1 Ack=306977 Win=185344 Len=0 TSval=552316115 TSecr=457537709"
"248","2.562439","192.168.2.2","192.168.1.2","TCP","66","185344","5001  >  48034 [ACK] Seq=1 Ack=309873 Win=185344 Len=0 TSval=552316139 TSecr=457537733"
"250","2.585889","192.168.2.2","192.168.1.2","TCP","66","185344","5001  >  48034 [ACK] Seq=1 Ack=312769 Win=185344 Len=0 TSval=552316163 TSecr=457537757"
"252","2.610089","192.168.2.2","192.168.1.2","TCP","66","185344","5001  >  48034 [ACK] Seq=1 Ack=315665 Win=185344 Len=0 TSval=552316187 TSecr=457537781"
"254","2.646812","192.168.2.2","192.168.1.2","TCP","66","185344","5001  >  48034 [ACK] Seq=1 Ack=320009 Win=185344 Len=0 TSval=552316224 TSecr=457537786"
"256","2.671423","192.168.2.2","192.168.1.2","TCP","66","185344","5001  >  48034 [ACK] Seq=1 Ack=322905 Win=185344 Len=0 TSval=552316248 TSecr=457537830"
"258","2.695738","192.168.2.2","192.168.1.2","TCP","66","185344","5001  >  48034 [ACK] Seq=1 Ack=325801 Win=185344 Len=0 TSval=552316273 TSecr=457537854"
"260","2.719274","192.168.2.2","192.168.1.2","TCP","66","185344","5001  >  48034 [ACK] Seq=1 Ack=328697 Win=185344 Len=0 TSval=552316296 TSecr=457537878"
"262","2.743808","192.168.2.2","192.168.1.2","TCP","66","185344","5001  >  48034 [ACK] Seq=1 Ack=331593 Win=185344 Len=0 TSval=552316321 TSecr=457537902"
"264","2.767596","192.168.2.2","192.168.1.2","TCP","66","185344","5001  >  48034 [ACK] Seq=1 Ack=334489 Win=185344 Len=0 TSval=552316344 TSecr=457537939"
"266","2.791839","192.168.2.2","192.168.1.2","TCP","66","185344","5001  >  48034 [ACK] Seq=1 Ack=337385 Win=185344 Len=0 TSval=552316369 TSecr=457537963"
"268","2.816355","192.168.2.2","192.168.1.2","TCP","66","185344","5001  >  48034 [ACK] Seq=1 Ack=340281 Win=185344 Len=0 TSval=552316393 TSecr=457537988"
"270","2.840790","192.168.2.2","192.168.1.2","TCP","66","185344","5001  >  48034 [ACK] Seq=1 Ack=343177 Win=185344 Len=0 TSval=552316418 TSecr=457538011"
"272","2.865335","192.168.2.2","192.168.1.2","TCP","66","185344","5001  >  48034 [ACK] Seq=1 Ack=346073 Win=185344 Len=0 TSval=552316442 TSecr=457538036"
"274","2.888724","192.168.2.2","192.168.1.2","TCP","66","185344","5001  >  48034 [ACK] Seq=1 Ack=348969 Win=185344 Len=0 TSval=552316465 TSecr=457538060"
"276","2.913341","192.168.2.2","192.168.1.2","TCP","66","185344","5001  >  48034 [ACK] Seq=1 Ack=351865 Win=185344 Len=0 TSval=552316490 TSecr=457538084"
"278","2.937154","192.168.2.2","192.168.1.2","TCP","66","185344","5001  >  48034 [ACK] Seq=1 Ack=354761 Win=185344 Len=0 TSval=552316514 TSecr=457538108"
"280","2.961397","192.168.2.2","192.168.1.2","TCP","66","185344","5001  >  48034 [ACK] Seq=1 Ack=357657 Win=185344 Len=0 TSval=552316538 TSecr=457538133"
"283","2.985860","192.168.2.2","192.168.1.2","TCP","66","185344","5001  >  48034 [ACK] Seq=1 Ack=360553 Win=185344 Len=0 TSval=552316563 TSecr=457538157"
"285","3.009813","192.168.2.2","192.168.1.2","TCP","66","185344","5001  >  48034 [ACK] Seq=1 Ack=363449 Win=185344 Len=0 TSval=552316586 TSecr=457538181"
"288","3.034001","192.168.2.2","192.168.1.2","TCP","66","185344","5001  >  48034 [ACK] Seq=1 Ack=366345 Win=185344 Len=0 TSval=552316611 TSecr=457538205"
"290","3.058887","192.168.2.2","192.168.1.2","TCP","66","185344","5001  >  48034 [ACK] Seq=1 Ack=369241 Win=185344 Len=0 TSval=552316636 TSecr=457538229"
"292","3.085793","192.168.2.2","192.168.1.2","TCP","66","185344","5001  >  48034 [ACK] Seq=1 Ack=372137 Win=185344 Len=0 TSval=552316662 TSecr=457538253"
"294","3.106676","192.168.2.2","192.168.1.2","TCP","66","185344","5001  >  48034 [ACK] Seq=1 Ack=375033 Win=185344 Len=0 TSval=552316683 TSecr=457538253"
"296","3.131313","192.168.2.2","192.168.1.2","TCP","66","185344","5001  >  48034 [ACK] Seq=1 Ack=377929 Win=185344 Len=0 TSval=552316708 TSecr=457538278"
"298","3.155147","192.168.2.2","192.168.1.2","TCP","66","185344","5001  >  48034 [ACK] Seq=1 Ack=380825 Win=185344 Len=0 TSval=552316732 TSecr=457538302"
"301","3.180136","192.168.2.2","192.168.1.2","TCP","66","185344","5001  >  48034 [ACK] Seq=1 Ack=383721 Win=185344 Len=0 TSval=552316757 TSecr=457538326"
"303","3.205040","192.168.2.2","192.168.1.2","TCP","66","185344","5001  >  48034 [ACK] Seq=1 Ack=386617 Win=185344 Len=0 TSval=552316782 TSecr=457538351"
"305","3.228722","192.168.2.2","192.168.1.2","TCP","66","185344","5001  >  48034 [ACK] Seq=1 Ack=389513 Win=185344 Len=0 TSval=552316805 TSecr=457538377"
"307","3.252958","192.168.2.2","192.168.1.2","TCP","66","185344","5001  >  48034 [ACK] Seq=1 Ack=392409 Win=185344 Len=0 TSval=552316829 TSecr=457538398"
"309","3.277455","192.168.2.2","192.168.1.2","TCP","66","185344","5001  >  48034 [ACK] Seq=1 Ack=395305 Win=185344 Len=0 TSval=552316854 TSecr=457538423"
"311","3.301996","192.168.2.2","192.168.1.2","TCP","66","185344","5001  >  48034 [ACK] Seq=1 Ack=398201 Win=185344 Len=0 TSval=552316878 TSecr=457538447"
"313","3.325653","192.168.2.2","192.168.1.2","TCP","66","185344","5001  >  48034 [ACK] Seq=1 Ack=401097 Win=185344 Len=0 TSval=552316902 TSecr=457538472"
"315","3.349833","192.168.2.2","192.168.1.2","TCP","66","185344","5001  >  48034 [ACK] Seq=1 Ack=403993 Win=185344 Len=0 TSval=552316926 TSecr=457538497"
"317","3.374532","192.168.2.2","192.168.1.2","TCP","66","185344","5001  >  48034 [ACK] Seq=1 Ack=406889 Win=185344 Len=0 TSval=552316951 TSecr=457538521"
"319","3.398952","192.168.2.2","192.168.1.2","TCP","66","185344","5001  >  48034 [ACK] Seq=1 Ack=409785 Win=185344 Len=0 TSval=552316975 TSecr=457538545"
"321","3.422489","192.168.2.2","192.168.1.2","TCP","66","185344","5001  >  48034 [ACK] Seq=1 Ack=412681 Win=185344 Len=0 TSval=552316999 TSecr=457538569"
"323","3.447001","192.168.2.2","192.168.1.2","TCP","66","185344","5001  >  48034 [ACK] Seq=1 Ack=415577 Win=185344 Len=0 TSval=552317023 TSecr=457538594"
"325","3.471017","192.168.2.2","192.168.1.2","TCP","66","185344","5001  >  48034 [ACK] Seq=1 Ack=418473 Win=185344 Len=0 TSval=552317047 TSecr=457538617"
"327","3.495068","192.168.2.2","192.168.1.2","TCP","66","185344","5001  >  48034 [ACK] Seq=1 Ack=421369 Win=185344 Len=0 TSval=552317071 TSecr=457538641"
"329","3.519500","192.168.2.2","192.168.1.2","TCP","66","185344","5001  >  48034 [ACK] Seq=1 Ack=424265 Win=185344 Len=0 TSval=552317096 TSecr=457538666"
"331","3.543926","192.168.2.2","192.168.1.2","TCP","66","185344","5001  >  48034 [ACK] Seq=1 Ack=427161 Win=185344 Len=0 TSval=552317120 TSecr=457538691"
"333","3.567731","192.168.2.2","192.168.1.2","TCP","66","185344","5001  >  48034 [ACK] Seq=1 Ack=430057 Win=185344 Len=0 TSval=552317144 TSecr=457538714"
"335","3.592024","192.168.2.2","192.168.1.2","TCP","66","185344","5001  >  48034 [ACK] Seq=1 Ack=432953 Win=185344 Len=0 TSval=552317168 TSecr=457538739"
"337","3.616250","192.168.2.2","192.168.1.2","TCP","66","185344","5001  >  48034 [ACK] Seq=1 Ack=435849 Win=185344 Len=0 TSval=552317193 TSecr=457538763"
"339","3.640465","192.168.2.2","192.168.1.2","TCP","66","185344","5001  >  48034 [ACK] Seq=1 Ack=438745 Win=185344 Len=0 TSval=552317217 TSecr=457538787"
"341","3.664634","192.168.2.2","192.168.1.2","TCP","66","185344","5001  >  48034 [ACK] Seq=1 Ack=441641 Win=185344 Len=0 TSval=552317241 TSecr=457538811"
"343","3.688864","192.168.2.2","192.168.1.2","TCP","66","185344","5001  >  48034 [ACK] Seq=1 Ack=444537 Win=185344 Len=0 TSval=552317265 TSecr=457538835"
"345","3.725294","192.168.2.2","192.168.1.2","TCP","66","185344","5001  >  48034 [ACK] Seq=1 Ack=448881 Win=185344 Len=0 TSval=552317302 TSecr=457538859"
"348","3.749456","192.168.2.2","192.168.1.2","TCP","66","185344","5001  >  48034 [ACK] Seq=1 Ack=451777 Win=185344 Len=0 TSval=552317326 TSecr=457538908"
"350","3.773951","192.168.2.2","192.168.1.2","TCP","66","185344","5001  >  48034 [ACK] Seq=1 Ack=454673 Win=185344 Len=0 TSval=552317350 TSecr=457538932"
"352","3.798315","192.168.2.2","192.168.1.2","TCP","66","185344","5001  >  48034 [ACK] Seq=1 Ack=457569 Win=185344 Len=0 TSval=552317375 TSecr=457538956"
"354","3.822093","192.168.2.2","192.168.1.2","TCP","66","185344","5001  >  48034 [ACK] Seq=1 Ack=460465 Win=185344 Len=0 TSval=552317398 TSecr=457538980"
"356","3.847418","192.168.2.2","192.168.1.2","TCP","66","185344","5001  >  48034 [ACK] Seq=1 Ack=463361 Win=185344 Len=0 TSval=552317424 TSecr=457539017"
"358","3.870889","192.168.2.2","192.168.1.2","TCP","66","185344","5001  >  48034 [ACK] Seq=1 Ack=466257 Win=185344 Len=0 TSval=552317447 TSecr=457539017"
"360","3.894745","192.168.2.2","192.168.1.2","TCP","66","185344","5001  >  48034 [ACK] Seq=1 Ack=469153 Win=185344 Len=0 TSval=552317471 TSecr=457539041"
"362","3.919018","192.168.2.2","192.168.1.2","TCP","66","185344","5001  >  48034 [ACK] Seq=1 Ack=472049 Win=185344 Len=0 TSval=552317495 TSecr=457539065"
"364","3.943355","192.168.2.2","192.168.1.2","TCP","66","185344","5001  >  48034 [ACK] Seq=1 Ack=474945 Win=185344 Len=0 TSval=552317520 TSecr=457539090"
"366","3.967884","192.168.2.2","192.168.1.2","TCP","66","185344","5001  >  48034 [ACK] Seq=1 Ack=477841 Win=185344 Len=0 TSval=552317544 TSecr=457539114"
"368","3.992411","192.168.2.2","192.168.1.2","TCP","66","185344","5001  >  48034 [ACK] Seq=1 Ack=480737 Win=185344 Len=0 TSval=552317569 TSecr=457539139"
"370","4.015966","192.168.2.2","192.168.1.2","TCP","66","185344","5001  >  48034 [ACK] Seq=1 Ack=483633 Win=185344 Len=0 TSval=552317592 TSecr=457539162"
"374","4.040401","192.168.2.2","192.168.1.2","TCP","66","185344","5001  >  48034 [ACK] Seq=1 Ack=486529 Win=185344 Len=0 TSval=552317617 TSecr=457539186"
"376","4.065003","192.168.2.2","192.168.1.2","TCP","66","185344","5001  >  48034 [ACK] Seq=1 Ack=489425 Win=185344 Len=0 TSval=552317641 TSecr=457539210"
"378","4.088581","192.168.2.2","192.168.1.2","TCP","66","185344","5001  >  48034 [ACK] Seq=1 Ack=492321 Win=185344 Len=0 TSval=552317665 TSecr=457539235"
"380","4.112817","192.168.2.2","192.168.1.2","TCP","66","185344","5001  >  48034 [ACK] Seq=1 Ack=495217 Win=185344 Len=0 TSval=552317689 TSecr=457539259"
"382","4.137385","192.168.2.2","192.168.1.2","TCP","66","185344","5001  >  48034 [ACK] Seq=1 Ack=498113 Win=185344 Len=0 TSval=552317713 TSecr=457539284"
"384","4.161889","192.168.2.2","192.168.1.2","TCP","66","185344","5001  >  48034 [ACK] Seq=1 Ack=501009 Win=185344 Len=0 TSval=552317738 TSecr=457539307"
"387","4.198545","192.168.2.2","192.168.1.2","TCP","66","185344","5001  >  48034 [ACK] Seq=1 Ack=505353 Win=185344 Len=0 TSval=552317775 TSecr=457539329"
"389","4.223204","192.168.2.2","192.168.1.2","TCP","66","185344","5001  >  48034 [ACK] Seq=1 Ack=508249 Win=185344 Len=0 TSval=552317799 TSecr=457539356"
"391","4.246890","192.168.2.2","192.168.1.2","TCP","66","185344","5001  >  48034 [ACK] Seq=1 Ack=511145 Win=185344 Len=0 TSval=552317823 TSecr=457539380"
"393","4.271234","192.168.2.2","192.168.1.2","TCP","66","185344","5001  >  48034 [ACK] Seq=1 Ack=514041 Win=185344 Len=0 TSval=552317847 TSecr=457539404"
"395","4.295669","192.168.2.2","192.168.1.2","TCP","66","185344","5001  >  48034 [ACK] Seq=1 Ack=516937 Win=185344 Len=0 TSval=552317872 TSecr=457539429"
"397","4.319468","192.168.2.2","192.168.1.2","TCP","66","185344","5001  >  48034 [ACK] Seq=1 Ack=519833 Win=185344 Len=0 TSval=552317895 TSecr=457539453"
"399","4.343755","192.168.2.2","192.168.1.2","TCP","66","185344","5001  >  48034 [ACK] Seq=1 Ack=522729 Win=185344 Len=0 TSval=552317920 TSecr=457539490"
"401","4.367906","192.168.2.2","192.168.1.2","TCP","66","185344","5001  >  48034 [ACK] Seq=1 Ack=525625 Win=185344 Len=0 TSval=552317944 TSecr=457539514"
"403","4.392115","192.168.2.2","192.168.1.2","TCP","66","185344","5001  >  48034 [ACK] Seq=1 Ack=528521 Win=185344 Len=0 TSval=552317968 TSecr=457539538"
"405","4.416371","192.168.2.2","192.168.1.2","TCP","66","185344","5001  >  48034 [ACK] Seq=1 Ack=531417 Win=185344 Len=0 TSval=552317992 TSecr=457539562"
"407","4.440749","192.168.2.2","192.168.1.2","TCP","66","185344","5001  >  48034 [ACK] Seq=1 Ack=534313 Win=185344 Len=0 TSval=552318017 TSecr=457539587"
"410","4.464809","192.168.2.2","192.168.1.2","TCP","66","185344","5001  >  48034 [ACK] Seq=1 Ack=537209 Win=185344 Len=0 TSval=552318041 TSecr=457539611"
"412","4.489814","192.168.2.2","192.168.1.2","TCP","66","185344","5001  >  48034 [ACK] Seq=1 Ack=540105 Win=185344 Len=0 TSval=552318066 TSecr=457539635"
"414","4.514316","192.168.2.2","192.168.1.2","TCP","66","185344","5001  >  48034 [ACK] Seq=1 Ack=543001 Win=185344 Len=0 TSval=552318090 TSecr=457539659"
"416","4.537831","192.168.2.2","192.168.1.2","TCP","66","185344","5001  >  48034 [ACK] Seq=1 Ack=545897 Win=185344 Len=0 TSval=552318114 TSecr=457539683"
"418","4.562301","192.168.2.2","192.168.1.2","TCP","66","185344","5001  >  48034 [ACK] Seq=1 Ack=548793 Win=185344 Len=0 TSval=552318138 TSecr=457539707"
"420","4.585936","192.168.2.2","192.168.1.2","TCP","66","185344","5001  >  48034 [ACK] Seq=1 Ack=551689 Win=185344 Len=0 TSval=552318162 TSecr=457539732"
"422","4.622282","192.168.2.2","192.168.1.2","TCP","66","185344","5001  >  48034 [ACK] Seq=1 Ack=556033 Win=185344 Len=0 TSval=552318198 TSecr=457539732"
"424","4.646506","192.168.2.2","192.168.1.2","TCP","66","185344","5001  >  48034 [ACK] Seq=1 Ack=558929 Win=185344 Len=0 TSval=552318222 TSecr=457539781"
"426","4.671174","192.168.2.2","192.168.1.2","TCP","66","185344","5001  >  48034 [ACK] Seq=1 Ack=561825 Win=185344 Len=0 TSval=552318247 TSecr=457539805"
"428","4.695652","192.168.2.2","192.168.1.2","TCP","66","185344","5001  >  48034 [ACK] Seq=1 Ack=564721 Win=185344 Len=0 TSval=552318271 TSecr=457539829"
"430","4.719158","192.168.2.2","192.168.1.2","TCP","66","185344","5001  >  48034 [ACK] Seq=1 Ack=567617 Win=185344 Len=0 TSval=552318295 TSecr=457539853"
"432","4.743610","192.168.2.2","192.168.1.2","TCP","66","185344","5001  >  48034 [ACK] Seq=1 Ack=570513 Win=185344 Len=0 TSval=552318319 TSecr=457539877"
"434","4.768131","192.168.2.2","192.168.1.2","TCP","66","185344","5001  >  48034 [ACK] Seq=1 Ack=573409 Win=185344 Len=0 TSval=552318344 TSecr=457539913"
"436","4.792578","192.168.2.2","192.168.1.2","TCP","66","185344","5001  >  48034 [ACK] Seq=1 Ack=576305 Win=185344 Len=0 TSval=552318368 TSecr=457539938"
"438","4.816849","192.168.2.2","192.168.1.2","TCP","66","185344","5001  >  48034 [ACK] Seq=1 Ack=579201 Win=185344 Len=0 TSval=552318393 TSecr=457539962"
"440","4.840480","192.168.2.2","192.168.1.2","TCP","66","185344","5001  >  48034 [ACK] Seq=1 Ack=582097 Win=185344 Len=0 TSval=552318416 TSecr=457539987"
"442","4.864664","192.168.2.2","192.168.1.2","TCP","66","185344","5001  >  48034 [ACK] Seq=1 Ack=584993 Win=185344 Len=0 TSval=552318440 TSecr=457540010"
"444","4.889178","192.168.2.2","192.168.1.2","TCP","66","185344","5001  >  48034 [ACK] Seq=1 Ack=587889 Win=185344 Len=0 TSval=552318465 TSecr=457540035"
"446","4.913665","192.168.2.2","192.168.1.2","TCP","66","185344","5001  >  48034 [ACK] Seq=1 Ack=590785 Win=185344 Len=0 TSval=552318489 TSecr=457540059"
"448","4.937186","192.168.2.2","192.168.1.2","TCP","66","185344","5001  >  48034 [ACK] Seq=1 Ack=593681 Win=185344 Len=0 TSval=552318513 TSecr=457540084"
"450","4.961729","192.168.2.2","192.168.1.2","TCP","66","185344","5001  >  48034 [ACK] Seq=1 Ack=596577 Win=185344 Len=0 TSval=552318537 TSecr=457540108"
"452","4.985663","192.168.2.2","192.168.1.2","TCP","66","185344","5001  >  48034 [ACK] Seq=1 Ack=599473 Win=185344 Len=0 TSval=552318561 TSecr=457540131"
"456","5.009848","192.168.2.2","192.168.1.2","TCP","66","185344","5001  >  48034 [ACK] Seq=1 Ack=602369 Win=185344 Len=0 TSval=552318586 TSecr=457540156"
"458","5.034265","192.168.2.2","192.168.1.2","TCP","66","185344","5001  >  48034 [ACK] Seq=1 Ack=605265 Win=185344 Len=0 TSval=552318610 TSecr=457540180"
"461","5.058742","192.168.2.2","192.168.1.2","TCP","66","185344","5001  >  48034 [ACK] Seq=1 Ack=608161 Win=185344 Len=0 TSval=552318634 TSecr=457540205"
"463","5.087289","192.168.2.2","192.168.1.2","TCP","66","185344","5001  >  48034 [ACK] Seq=1 Ack=611057 Win=185344 Len=0 TSval=552318663 TSecr=457540228"
"465","5.106954","192.168.2.2","192.168.1.2","TCP","66","185344","5001  >  48034 [ACK] Seq=1 Ack=613953 Win=185344 Len=0 TSval=552318683 TSecr=457540253"
"467","5.131222","192.168.2.2","192.168.1.2","TCP","66","185344","5001  >  48034 [ACK] Seq=1 Ack=616849 Win=185344 Len=0 TSval=552318707 TSecr=457540277"
"469","5.167538","192.168.2.2","192.168.1.2","TCP","66","185344","5001  >  48034 [ACK] Seq=1 Ack=621193 Win=185344 Len=0 TSval=552318743 TSecr=457540277"
"472","5.192029","192.168.2.2","192.168.1.2","TCP","66","185344","5001  >  48034 [ACK] Seq=1 Ack=624089 Win=185344 Len=0 TSval=552318768 TSecr=457540325"
"475","5.216543","192.168.2.2","192.168.1.2","TCP","66","185344","5001  >  48034 [ACK] Seq=1 Ack=626985 Win=185344 Len=0 TSval=552318792 TSecr=457540349"
"477","5.240771","192.168.2.2","192.168.1.2","TCP","66","185344","5001  >  48034 [ACK] Seq=1 Ack=629881 Win=185344 Len=0 TSval=552318816 TSecr=457540378"
"479","5.265557","192.168.2.2","192.168.1.2","TCP","66","185344","5001  >  48034 [ACK] Seq=1 Ack=632777 Win=185344 Len=0 TSval=552318841 TSecr=457540398"
"481","5.290025","192.168.2.2","192.168.1.2","TCP","66","185344","5001  >  48034 [ACK] Seq=1 Ack=635673 Win=185344 Len=0 TSval=552318866 TSecr=457540422"
"483","5.313529","192.168.2.2","192.168.1.2","TCP","66","185344","5001  >  48034 [ACK] Seq=1 Ack=638569 Win=185344 Len=0 TSval=552318889 TSecr=457540458"
"485","5.338099","192.168.2.2","192.168.1.2","TCP","66","185344","5001  >  48034 [ACK] Seq=1 Ack=641465 Win=185344 Len=0 TSval=552318914 TSecr=457540458"
"487","5.362564","192.168.2.2","192.168.1.2","TCP","66","185344","5001  >  48034 [ACK] Seq=1 Ack=644361 Win=185344 Len=0 TSval=552318938 TSecr=457540483"
"489","5.386179","192.168.2.2","192.168.1.2","TCP","66","185344","5001  >  48034 [ACK] Seq=1 Ack=647257 Win=185344 Len=0 TSval=552318962 TSecr=457540507"
"491","5.410325","192.168.2.2","192.168.1.2","TCP","66","185344","5001  >  48034 [ACK] Seq=1 Ack=650153 Win=185344 Len=0 TSval=552318986 TSecr=457540532"
"493","5.434627","192.168.2.2","192.168.1.2","TCP","66","185344","5001  >  48034 [ACK] Seq=1 Ack=653049 Win=185344 Len=0 TSval=552319010 TSecr=457540556"
"495","5.458754","192.168.2.2","192.168.1.2","TCP","66","185344","5001  >  48034 [ACK] Seq=1 Ack=655945 Win=185344 Len=0 TSval=552319034 TSecr=457540581"
"497","5.483648","192.168.2.2","192.168.1.2","TCP","66","185344","5001  >  48034 [ACK] Seq=1 Ack=658841 Win=185344 Len=0 TSval=552319059 TSecr=457540604"
"499","5.507256","192.168.2.2","192.168.1.2","TCP","66","185344","5001  >  48034 [ACK] Seq=1 Ack=661737 Win=185344 Len=0 TSval=552319083 TSecr=457540629"
"501","5.531625","192.168.2.2","192.168.1.2","TCP","66","185344","5001  >  48034 [ACK] Seq=1 Ack=664633 Win=185344 Len=0 TSval=552319107 TSecr=457540653"
"503","5.555675","192.168.2.2","192.168.1.2","TCP","66","185344","5001  >  48034 [ACK] Seq=1 Ack=667529 Win=185344 Len=0 TSval=552319131 TSecr=457540677"
"505","5.579904","192.168.2.2","192.168.1.2","TCP","66","185344","5001  >  48034 [ACK] Seq=1 Ack=670425 Win=185344 Len=0 TSval=552319155 TSecr=457540701"
"507","5.604156","192.168.2.2","192.168.1.2","TCP","66","185344","5001  >  48034 [ACK] Seq=1 Ack=673321 Win=185344 Len=0 TSval=552319180 TSecr=457540725"
"509","5.628647","192.168.2.2","192.168.1.2","TCP","66","185344","5001  >  48034 [ACK] Seq=1 Ack=676217 Win=185344 Len=0 TSval=552319204 TSecr=457540749"
"511","5.653135","192.168.2.2","192.168.1.2","TCP","66","185344","5001  >  48034 [ACK] Seq=1 Ack=679113 Win=185344 Len=0 TSval=552319228 TSecr=457540774"
"513","5.676831","192.168.2.2","192.168.1.2","TCP","66","185344","5001  >  48034 [ACK] Seq=1 Ack=682009 Win=185344 Len=0 TSval=552319252 TSecr=457540798"
"515","5.701592","192.168.2.2","192.168.1.2","TCP","66","185344","5001  >  48034 [ACK] Seq=1 Ack=684905 Win=185344 Len=0 TSval=552319277 TSecr=457540822"
"517","5.726126","192.168.2.2","192.168.1.2","TCP","66","185344","5001  >  48034 [ACK] Seq=1 Ack=687801 Win=185344 Len=0 TSval=552319301 TSecr=457540846"
"519","5.750186","192.168.2.2","192.168.1.2","TCP","66","185344","5001  >  48034 [ACK] Seq=1 Ack=690697 Win=185344 Len=0 TSval=552319325 TSecr=457540871"
"521","5.786448","192.168.2.2","192.168.1.2","TCP","66","185344","5001  >  48034 [ACK] Seq=1 Ack=695041 Win=185344 Len=0 TSval=552319362 TSecr=457540895"
"524","5.810937","192.168.2.2","192.168.1.2","TCP","66","185344","5001  >  48034 [ACK] Seq=1 Ack=697937 Win=185344 Len=0 TSval=552319386 TSecr=457540944"
"526","5.834849","192.168.2.2","192.168.1.2","TCP","66","185344","5001  >  48034 [ACK] Seq=1 Ack=700833 Win=185344 Len=0 TSval=552319410 TSecr=457540967"
"528","5.859026","192.168.2.2","192.168.1.2","TCP","66","185344","5001  >  48034 [ACK] Seq=1 Ack=703729 Win=185344 Len=0 TSval=552319434 TSecr=457540992"
"530","5.883380","192.168.2.2","192.168.1.2","TCP","66","185344","5001  >  48034 [ACK] Seq=1 Ack=706625 Win=185344 Len=0 TSval=552319459 TSecr=457541017"
"532","5.908067","192.168.2.2","192.168.1.2","TCP","66","185344","5001  >  48034 [ACK] Seq=1 Ack=709521 Win=185344 Len=0 TSval=552319483 TSecr=457541041"
"534","5.931702","192.168.2.2","192.168.1.2","TCP","66","185344","5001  >  48034 [ACK] Seq=1 Ack=712417 Win=185344 Len=0 TSval=552319507 TSecr=457541077"
"536","5.956998","192.168.2.2","192.168.1.2","TCP","66","185344","5001  >  48034 [ACK] Seq=1 Ack=715313 Win=185344 Len=0 TSval=552319532 TSecr=457541077"
"538","5.980576","192.168.2.2","192.168.1.2","TCP","66","185344","5001  >  48034 [ACK] Seq=1 Ack=718209 Win=185344 Len=0 TSval=552319556 TSecr=457541101"
"540","6.004926","192.168.2.2","192.168.1.2","TCP","66","185344","5001  >  48034 [ACK] Seq=1 Ack=721105 Win=185344 Len=0 TSval=552319580 TSecr=457541125"
"542","6.029030","192.168.2.2","192.168.1.2","TCP","66","185344","5001  >  48034 [ACK] Seq=1 Ack=724001 Win=185344 Len=0 TSval=552319604 TSecr=457541149"
"545","6.052830","192.168.2.2","192.168.1.2","TCP","66","185344","5001  >  48034 [ACK] Seq=1 Ack=726897 Win=185344 Len=0 TSval=552319628 TSecr=457541174"
"547","6.082375","192.168.2.2","192.168.1.2","TCP","66","185344","5001  >  48034 [ACK] Seq=1 Ack=729793 Win=185344 Len=0 TSval=552319657 TSecr=457541198"
"549","6.101474","192.168.2.2","192.168.1.2","TCP","66","185344","5001  >  48034 [ACK] Seq=1 Ack=732689 Win=185344 Len=0 TSval=552319677 TSecr=457541222"
"551","6.125486","192.168.2.2","192.168.1.2","TCP","66","185344","5001  >  48034 [ACK] Seq=1 Ack=735585 Win=185344 Len=0 TSval=552319701 TSecr=457541247"
"553","6.149720","192.168.2.2","192.168.1.2","TCP","66","185344","5001  >  48034 [ACK] Seq=1 Ack=738481 Win=185344 Len=0 TSval=552319725 TSecr=457541271"
"555","6.174330","192.168.2.2","192.168.1.2","TCP","66","185344","5001  >  48034 [ACK] Seq=1 Ack=741377 Win=185344 Len=0 TSval=552319749 TSecr=457541295"
"557","6.198169","192.168.2.2","192.168.1.2","TCP","66","185344","5001  >  48034 [ACK] Seq=1 Ack=744273 Win=185344 Len=0 TSval=552319773 TSecr=457541319"
"560","6.223220","192.168.2.2","192.168.1.2","TCP","66","185344","5001  >  48034 [ACK] Seq=1 Ack=747169 Win=185344 Len=0 TSval=552319798 TSecr=457541343"
