No.,Time,Source,Destination,Protocol,Length,Calculated window size,Info
4,0.000336,192.168.2.2,192.168.1.2,TCP,74,43440,"5001  >  53142 [SYN, ACK] Seq=0 Ack=1 Win=43440 Len=0 MSS=1460 SACK_PERM=1 TSval=2325275067 TSecr=1376314990 WS=512"
7,0.000383,192.168.2.2,192.168.1.2,TCP,66,39936,5001  >  53142 [ACK] Seq=1 Ack=7241 Win=39936 Len=0 TSval=2325275067 TSecr=1376314990
11,0.050071,192.168.2.2,192.168.1.2,TCP,66,39936,5001  >  53142 [ACK] Seq=1 Ack=14481 Win=39936 Len=0 TSval=2325275117 TSecr=1376314990
13,0.110301,192.168.2.2,192.168.1.2,TCP,66,39936,5001  >  53142 [ACK] Seq=1 Ack=21721 Win=39936 Len=0 TSval=2325275177 TSecr=1376314990
15,0.17149,192.168.2.2,192.168.1.2,TCP,66,42496,5001  >  53142 [ACK] Seq=1 Ack=23169 Win=42496 Len=0 TSval=2325275238 TSecr=1376315004
16,0.182991,192.168.2.2,192.168.1.2,TCP,66,42496,5001  >  53142 [ACK] Seq=1 Ack=24617 Win=42496 Len=0 TSval=2325275250 TSecr=1376315064
18,0.195113,192.168.2.2,192.168.1.2,TCP,66,42496,5001  >  53142 [ACK] Seq=1 Ack=26065 Win=42496 Len=0 TSval=2325275262 TSecr=1376315152
20,0.207228,192.168.2.2,192.168.1.2,TCP,66,42496,5001  >  53142 [ACK] Seq=1 Ack=27513 Win=42496 Len=0 TSval=2325275274 TSecr=1376315173
23,0.219305,192.168.2.2,192.168.1.2,TCP,66,42496,5001  >  53142 [ACK] Seq=1 Ack=28961 Win=42496 Len=0 TSval=2325275286 TSecr=1376315185
25,0.231414,192.168.2.2,192.168.1.2,TCP,66,42496,5001  >  53142 [ACK] Seq=1 Ack=30409 Win=42496 Len=0 TSval=2325275298 TSecr=1376315197
27,0.244105,192.168.2.2,192.168.1.2,TCP,66,42496,5001  >  53142 [ACK] Seq=1 Ack=31857 Win=42496 Len=0 TSval=2325275311 TSecr=1376315197
29,0.255866,192.168.2.2,192.168.1.2,TCP,66,42496,5001  >  53142 [ACK] Seq=1 Ack=33305 Win=42496 Len=0 TSval=2325275323 TSecr=1376315209
31,0.267773,192.168.2.2,192.168.1.2,TCP,66,42496,5001  >  53142 [ACK] Seq=1 Ack=34753 Win=42496 Len=0 TSval=2325275334 TSecr=1376315221
33,0.279845,192.168.2.2,192.168.1.2,TCP,66,42496,5001  >  53142 [ACK] Seq=1 Ack=36201 Win=42496 Len=0 TSval=2325275347 TSecr=1376315234
35,0.292077,192.168.2.2,192.168.1.2,TCP,66,41984,5001  >  53142 [ACK] Seq=1 Ack=39097 Win=41984 Len=0 TSval=2325275359 TSecr=1376315246
37,0.316633,192.168.2.2,192.168.1.2,TCP,66,42496,5001  >  53142 [ACK] Seq=1 Ack=40545 Win=42496 Len=0 TSval=2325275383 TSecr=1376315258
39,0.340572,192.168.2.2,192.168.1.2,TCP,66,42496,5001  >  53142 [ACK] Seq=1 Ack=43441 Win=42496 Len=0 TSval=2325275407 TSecr=1376315270
41,0.353342,192.168.2.2,192.168.1.2,TCP,66,42496,5001  >  53142 [ACK] Seq=1 Ack=46337 Win=42496 Len=0 TSval=2325275420 TSecr=1376315306
45,0.376864,192.168.2.2,192.168.1.2,TCP,66,42496,5001  >  53142 [ACK] Seq=1 Ack=49233 Win=42496 Len=0 TSval=2325275443 TSecr=1376315330
47,0.401373,192.168.2.2,192.168.1.2,TCP,66,42496,5001  >  53142 [ACK] Seq=1 Ack=52129 Win=42496 Len=0 TSval=2325275468 TSecr=1376315343
49,0.438158,192.168.2.2,192.168.1.2,TCP,66,42496,5001  >  53142 [ACK] Seq=1 Ack=56473 Win=42496 Len=0 TSval=2325275505 TSecr=1376315343
51,0.46229,192.168.2.2,192.168.1.2,TCP,66,42496,5001  >  53142 [ACK] Seq=1 Ack=59369 Win=42496 Len=0 TSval=2325275529 TSecr=1376315391
54,0.486632,192.168.2.2,192.168.1.2,TCP,66,42496,5001  >  53142 [ACK] Seq=1 Ack=62265 Win=42496 Len=0 TSval=2325275553 TSecr=1376315428
56,0.511113,192.168.2.2,192.168.1.2,TCP,66,42496,5001  >  53142 [ACK] Seq=1 Ack=65161 Win=42496 Len=0 TSval=2325275578 TSecr=1376315452
58,0.547028,192.168.2.2,192.168.1.2,TCP,66,42496,5001  >  53142 [ACK] Seq=1 Ack=69505 Win=42496 Len=0 TSval=2325275614 TSecr=1376315452
61,0.571263,192.168.2.2,192.168.1.2,TCP,66,42496,5001  >  53142 [ACK] Seq=1 Ack=72401 Win=42496 Len=0 TSval=2325275638 TSecr=1376315501
63,0.596327,192.168.2.2,192.168.1.2,TCP,66,42496,5001  >  53142 [ACK] Seq=1 Ack=75297 Win=42496 Len=0 TSval=2325275663 TSecr=1376315537
65,0.619969,192.168.2.2,192.168.1.2,TCP,66,42496,5001  >  53142 [ACK] Seq=1 Ack=78193 Win=42496 Len=0 TSval=2325275686 TSecr=1376315537
67,0.644401,192.168.2.2,192.168.1.2,TCP,66,42496,5001  >  53142 [ACK] Seq=1 Ack=81089 Win=42496 Len=0 TSval=2325275711 TSecr=1376315561
69,0.668277,192.168.2.2,192.168.1.2,TCP,66,42496,5001  >  53142 [ACK] Seq=1 Ack=83985 Win=42496 Len=0 TSval=2325275735 TSecr=1376315586
71,0.694647,192.168.2.2,192.168.1.2,TCP,66,42496,5001  >  53142 [ACK] Seq=1 Ack=86881 Win=42496 Len=0 TSval=2325275761 TSecr=1376315610
73,0.717308,192.168.2.2,192.168.1.2,TCP,66,42496,5001  >  53142 [ACK] Seq=1 Ack=89777 Win=42496 Len=0 TSval=2325275784 TSecr=1376315634
75,0.742419,192.168.2.2,192.168.1.2,TCP,66,42496,5001  >  53142 [ACK] Seq=1 Ack=92673 Win=42496 Len=0 TSval=2325275809 TSecr=1376315658
77,0.765938,192.168.2.2,192.168.1.2,TCP,66,42496,5001  >  53142 [ACK] Seq=1 Ack=95569 Win=42496 Len=0 TSval=2325275832 TSecr=1376315684
79,0.790563,192.168.2.2,192.168.1.2,TCP,66,42496,5001  >  53142 [ACK] Seq=1 Ack=98465 Win=42496 Len=0 TSval=2325275857 TSecr=1376315707
82,0.814208,192.168.2.2,192.168.1.2,TCP,66,42496,5001  >  53142 [ACK] Seq=1 Ack=101361 Win=42496 Len=0 TSval=2325275881 TSecr=1376315732
85,0.838461,192.168.2.2,192.168.1.2,TCP,66,42496,5001  >  53142 [ACK] Seq=1 Ack=104257 Win=42496 Len=0 TSval=2325275905 TSecr=1376315755
87,0.862945,192.168.2.2,192.168.1.2,TCP,66,42496,5001  >  53142 [ACK] Seq=1 Ack=107153 Win=42496 Len=0 TSval=2325275929 TSecr=1376315780
90,0.898968,192.168.2.2,192.168.1.2,TCP,66,42496,5001  >  53142 [ACK] Seq=1 Ack=111497 Win=42496 Len=0 TSval=2325275965 TSecr=1376315780
92,0.923223,192.168.2.2,192.168.1.2,TCP,66,42496,5001  >  53142 [ACK] Seq=1 Ack=114393 Win=42496 Len=0 TSval=2325275990 TSecr=1376315828
94,0.947842,192.168.2.2,192.168.1.2,TCP,66,42496,5001  >  53142 [ACK] Seq=1 Ack=117289 Win=42496 Len=0 TSval=2325276014 TSecr=1376315852
97,0.971708,192.168.2.2,192.168.1.2,TCP,66,42496,5001  >  53142 [ACK] Seq=1 Ack=120185 Win=42496 Len=0 TSval=2325276038 TSecr=1376315888
99,0.995929,192.168.2.2,192.168.1.2,TCP,66,42496,5001  >  53142 [ACK] Seq=1 Ack=123081 Win=42496 Len=0 TSval=2325276062 TSecr=1376315913
103,1.020313,192.168.2.2,192.168.1.2,TCP,66,42496,5001  >  53142 [ACK] Seq=1 Ack=125977 Win=42496 Len=0 TSval=2325276087 TSecr=1376315937
105,1.05658,192.168.2.2,192.168.1.2,TCP,66,42496,5001  >  53142 [ACK] Seq=1 Ack=130321 Win=42496 Len=0 TSval=2325276123 TSecr=1376315956
108,1.081027,192.168.2.2,192.168.1.2,TCP,66,42496,5001  >  53142 [ACK] Seq=1 Ack=133217 Win=42496 Len=0 TSval=2325276147 TSecr=1376315985
111,1.105643,192.168.2.2,192.168.1.2,TCP,66,42496,5001  >  53142 [ACK] Seq=1 Ack=136113 Win=42496 Len=0 TSval=2325276172 TSecr=1376316010
113,1.129977,192.168.2.2,192.168.1.2,TCP,66,42496,5001  >  53142 [ACK] Seq=1 Ack=139009 Win=42496 Len=0 TSval=2325276196 TSecr=1376316046
115,1.154178,192.168.2.2,192.168.1.2,TCP,66,42496,5001  >  53142 [ACK] Seq=1 Ack=141905 Win=42496 Len=0 TSval=2325276220 TSecr=1376316046
117,1.179056,192.168.2.2,192.168.1.2,TCP,66,42496,5001  >  53142 [ACK] Seq=1 Ack=144801 Win=42496 Len=0 TSval=2325276245 TSecr=1376316070
119,1.202588,192.168.2.2,192.168.1.2,TCP,66,42496,5001  >  53142 [ACK] Seq=1 Ack=147697 Win=42496 Len=0 TSval=2325276269 TSecr=1376316095
121,1.226786,192.168.2.2,192.168.1.2,TCP,66,42496,5001  >  53142 [ACK] Seq=1 Ack=150593 Win=42496 Len=0 TSval=2325276293 TSecr=1376316119
123,1.263323,192.168.2.2,192.168.1.2,TCP,66,42496,5001  >  53142 [ACK] Seq=1 Ack=154937 Win=42496 Len=0 TSval=2325276330 TSecr=1376316143
126,1.287831,192.168.2.2,192.168.1.2,TCP,66,42496,5001  >  53142 [ACK] Seq=1 Ack=157833 Win=42496 Len=0 TSval=2325276354 TSecr=1376316192
128,1.311585,192.168.2.2,192.168.1.2,TCP,66,42496,5001  >  53142 [ACK] Seq=1 Ack=160729 Win=42496 Len=0 TSval=2325276378 TSecr=1376316216
130,1.335882,192.168.2.2,192.168.1.2,TCP,66,42496,5001  >  53142 [ACK] Seq=1 Ack=163625 Win=42496 Len=0 TSval=2325276402 TSecr=1376316253
132,1.36039,192.168.2.2,192.168.1.2,TCP,66,42496,5001  >  53142 [ACK] Seq=1 Ack=166521 Win=42496 Len=0 TSval=2325276427 TSecr=1376316253
135,1.384805,192.168.2.2,192.168.1.2,TCP,66,42496,5001  >  53142 [ACK] Seq=1 Ack=169417 Win=42496 Len=0 TSval=2325276451 TSecr=1376316277
139,1.409345,192.168.2.2,192.168.1.2,TCP,66,42496,5001  >  53142 [ACK] Seq=1 Ack=172313 Win=42496 Len=0 TSval=2325276475 TSecr=1376316301
141,1.44561,192.168.2.2,192.168.1.2,TCP,66,42496,5001  >  53142 [ACK] Seq=1 Ack=176657 Win=42496 Len=0 TSval=2325276512 TSecr=1376316325
143,1.469063,192.168.2.2,192.168.1.2,TCP,66,42496,5001  >  53142 [ACK] Seq=1 Ack=179553 Win=42496 Len=0 TSval=2325276535 TSecr=1376316350
145,1.493652,192.168.2.2,192.168.1.2,TCP,66,42496,5001  >  53142 [ACK] Seq=1 Ack=182449 Win=42496 Len=0 TSval=2325276560 TSecr=1376316374
149,1.518144,192.168.2.2,192.168.1.2,TCP,66,42496,5001  >  53142 [ACK] Seq=1 Ack=185345 Win=42496 Len=0 TSval=2325276584 TSecr=1376316398
151,1.542168,192.168.2.2,192.168.1.2,TCP,66,42496,5001  >  53142 [ACK] Seq=1 Ack=188241 Win=42496 Len=0 TSval=2325276608 TSecr=1376316435
153,1.566458,192.168.2.2,192.168.1.2,TCP,66,42496,5001  >  53142 [ACK] Seq=1 Ack=191137 Win=42496 Len=0 TSval=2325276632 TSecr=1376316458
155,1.590199,192.168.2.2,192.168.1.2,TCP,66,42496,5001  >  53142 [ACK] Seq=1 Ack=194033 Win=42496 Len=0 TSval=2325276656 TSecr=1376316483
157,1.626504,192.168.2.2,192.168.1.2,TCP,66,42496,5001  >  53142 [ACK] Seq=1 Ack=198377 Win=42496 Len=0 TSval=2325276693 TSecr=1376316483
159,1.650707,192.168.2.2,192.168.1.2,TCP,66,42496,5001  >  53142 [ACK] Seq=1 Ack=201273 Win=42496 Len=0 TSval=2325276717 TSecr=1376316531
161,1.675505,192.168.2.2,192.168.1.2,TCP,66,42496,5001  >  53142 [ACK] Seq=1 Ack=204169 Win=42496 Len=0 TSval=2325276741 TSecr=1376316556
164,1.699165,192.168.2.2,192.168.1.2,TCP,66,42496,5001  >  53142 [ACK] Seq=1 Ack=207065 Win=42496 Len=0 TSval=2325276765 TSecr=1376316579
166,1.723419,192.168.2.2,192.168.1.2,TCP,66,42496,5001  >  53142 [ACK] Seq=1 Ack=209961 Win=42496 Len=0 TSval=2325276789 TSecr=1376316616
168,1.747938,192.168.2.2,192.168.1.2,TCP,66,42496,5001  >  53142 [ACK] Seq=1 Ack=212857 Win=42496 Len=0 TSval=2325276814 TSecr=1376316640
170,1.773113,192.168.2.2,192.168.1.2,TCP,66,42496,5001  >  53142 [ACK] Seq=1 Ack=215753 Win=42496 Len=0 TSval=2325276839 TSecr=1376316665
172,1.809713,192.168.2.2,192.168.1.2,TCP,66,42496,5001  >  53142 [ACK] Seq=1 Ack=220097 Win=42496 Len=0 TSval=2325276876 TSecr=1376316665
175,1.834292,192.168.2.2,192.168.1.2,TCP,66,42496,5001  >  53142 [ACK] Seq=1 Ack=222993 Win=42496 Len=0 TSval=2325276900 TSecr=1376316712
177,1.857974,192.168.2.2,192.168.1.2,TCP,66,42496,5001  >  53142 [ACK] Seq=1 Ack=225889 Win=42496 Len=0 TSval=2325276924 TSecr=1376316737
179,1.882229,192.168.2.2,192.168.1.2,TCP,66,42496,5001  >  53142 [ACK] Seq=1 Ack=228785 Win=42496 Len=0 TSval=2325276948 TSecr=1376316762
181,1.906754,192.168.2.2,192.168.1.2,TCP,66,42496,5001  >  53142 [ACK] Seq=1 Ack=231681 Win=42496 Len=0 TSval=2325276973 TSecr=1376316799
183,1.93056,192.168.2.2,192.168.1.2,TCP,66,42496,5001  >  53142 [ACK] Seq=1 Ack=234577 Win=42496 Len=0 TSval=2325276996 TSecr=1376316799
185,1.954795,192.168.2.2,192.168.1.2,TCP,66,42496,5001  >  53142 [ACK] Seq=1 Ack=237473 Win=42496 Len=0 TSval=2325277021 TSecr=1376316823
187,1.991178,192.168.2.2,192.168.1.2,TCP,66,42496,5001  >  53142 [ACK] Seq=1 Ack=241817 Win=42496 Len=0 TSval=2325277057 TSecr=1376316847
190,2.015507,192.168.2.2,192.168.1.2,TCP,66,42496,5001  >  53142 [ACK] Seq=1 Ack=244713 Win=42496 Len=0 TSval=2325277081 TSecr=1376316896
193,2.039602,192.168.2.2,192.168.1.2,TCP,66,42496,5001  >  53142 [ACK] Seq=1 Ack=247609 Win=42496 Len=0 TSval=2325277105 TSecr=1376316919
195,2.064553,192.168.2.2,192.168.1.2,TCP,66,42496,5001  >  53142 [ACK] Seq=1 Ack=250505 Win=42496 Len=0 TSval=2325277130 TSecr=1376316944
197,2.088115,192.168.2.2,192.168.1.2,TCP,66,42496,5001  >  53142 [ACK] Seq=1 Ack=253401 Win=42496 Len=0 TSval=2325277154 TSecr=1376316980
199,2.112627,192.168.2.2,192.168.1.2,TCP,66,42496,5001  >  53142 [ACK] Seq=1 Ack=256297 Win=42496 Len=0 TSval=2325277178 TSecr=1376316980
201,2.136746,192.168.2.2,192.168.1.2,TCP,66,42496,5001  >  53142 [ACK] Seq=1 Ack=259193 Win=42496 Len=0 TSval=2325277202 TSecr=1376317004
204,2.173836,192.168.2.2,192.168.1.2,TCP,66,42496,5001  >  53142 [ACK] Seq=1 Ack=263537 Win=42496 Len=0 TSval=2325277240 TSecr=1376317028
207,2.198393,192.168.2.2,192.168.1.2,TCP,66,42496,5001  >  53142 [ACK] Seq=1 Ack=266433 Win=42496 Len=0 TSval=2325277264 TSecr=1376317077
209,2.222069,192.168.2.2,192.168.1.2,TCP,66,42496,5001  >  53142 [ACK] Seq=1 Ack=269329 Win=42496 Len=0 TSval=2325277288 TSecr=1376317101
211,2.24634,192.168.2.2,192.168.1.2,TCP,66,48128,5001  >  53142 [ACK] Seq=1 Ack=272225 Win=48128 Len=0 TSval=2325277312 TSecr=1376317126
213,2.270517,192.168.2.2,192.168.1.2,TCP,66,54272,5001  >  53142 [ACK] Seq=1 Ack=275121 Win=54272 Len=0 TSval=2325277336 TSecr=1376317163
216,2.294958,192.168.2.2,192.168.1.2,TCP,66,54784,5001  >  53142 [ACK] Seq=1 Ack=278017 Win=54784 Len=0 TSval=2325277361 TSecr=1376317163
218,2.318932,192.168.2.2,192.168.1.2,TCP,66,54784,5001  >  53142 [ACK] Seq=1 Ack=280913 Win=54784 Len=0 TSval=2325277385 TSecr=1376317187
220,2.343165,192.168.2.2,192.168.1.2,TCP,66,55296,5001  >  53142 [ACK] Seq=1 Ack=282361 Win=55296 Len=0 TSval=2325277409 TSecr=1376317211
222,2.355267,192.168.2.2,192.168.1.2,TCP,66,55296,5001  >  53142 [ACK] Seq=1 Ack=285257 Win=55296 Len=0 TSval=2325277421 TSecr=1376317235
224,2.380222,192.168.2.2,192.168.1.2,TCP,66,55296,5001  >  53142 [ACK] Seq=1 Ack=288153 Win=55296 Len=0 TSval=2325277446 TSecr=1376317259
227,2.405179,192.168.2.2,192.168.1.2,TCP,66,55296,5001  >  53142 [ACK] Seq=1 Ack=291049 Win=55296 Len=0 TSval=2325277471 TSecr=1376317284
229,2.428695,192.168.2.2,192.168.1.2,TCP,66,55296,5001  >  53142 [ACK] Seq=1 Ack=293945 Win=55296 Len=0 TSval=2325277494 TSecr=1376317308
231,2.45317,192.168.2.2,192.168.1.2,TCP,66,55296,5001  >  53142 [ACK] Seq=1 Ack=296841 Win=55296 Len=0 TSval=2325277519 TSecr=1376317332
233,2.477122,192.168.2.2,192.168.1.2,TCP,66,55296,5001  >  53142 [ACK] Seq=1 Ack=299737 Win=55296 Len=0 TSval=2325277543 TSecr=1376317344
235,2.502178,192.168.2.2,192.168.1.2,TCP,66,57344,5001  >  53142 [ACK] Seq=1 Ack=302633 Win=57344 Len=0 TSval=2325277568 TSecr=1376317369
239,2.525722,192.168.2.2,192.168.1.2,TCP,66,58368,5001  >  53142 [ACK] Seq=1 Ack=304081 Win=58368 Len=0 TSval=2325277591 TSecr=1376317369
241,2.538544,192.168.2.2,192.168.1.2,TCP,66,58368,5001  >  53142 [ACK] Seq=1 Ack=306977 Win=58368 Len=0 TSval=2325277604 TSecr=1376317394
243,2.561939,192.168.2.2,192.168.1.2,TCP,66,58368,5001  >  53142 [ACK] Seq=1 Ack=309873 Win=58368 Len=0 TSval=2325277627 TSecr=1376317417
245,2.586151,192.168.2.2,192.168.1.2,TCP,66,58368,5001  >  53142 [ACK] Seq=1 Ack=312769 Win=58368 Len=0 TSval=2325277652 TSecr=1376317442
247,2.610375,192.168.2.2,192.168.1.2,TCP,66,58368,5001  >  53142 [ACK] Seq=1 Ack=315665 Win=58368 Len=0 TSval=2325277676 TSecr=1376317466
249,2.634632,192.168.2.2,192.168.1.2,TCP,66,58368,5001  >  53142 [ACK] Seq=1 Ack=318561 Win=58368 Len=0 TSval=2325277700 TSecr=1376317491
251,2.671824,192.168.2.2,192.168.1.2,TCP,66,58368,5001  >  53142 [ACK] Seq=1 Ack=322905 Win=58368 Len=0 TSval=2325277737 TSecr=1376317514
254,2.7052,192.168.2.2,192.168.1.2,TCP,66,58368,5001  >  53142 [ACK] Seq=1 Ack=325801 Win=58368 Len=0 TSval=2325277771 TSecr=1376317551
256,2.719404,192.168.2.2,192.168.1.2,TCP,66,58368,5001  >  53142 [ACK] Seq=1 Ack=328697 Win=58368 Len=0 TSval=2325277785 TSecr=1376317575
258,2.755678,192.168.2.2,192.168.1.2,TCP,66,58368,5001  >  53142 [ACK] Seq=1 Ack=333041 Win=58368 Len=0 TSval=2325277821 TSecr=1376317599
260,2.780101,192.168.2.2,192.168.1.2,TCP,66,58368,5001  >  53142 [ACK] Seq=1 Ack=335937 Win=58368 Len=0 TSval=2325277846 TSecr=1376317660
262,2.804573,192.168.2.2,192.168.1.2,TCP,66,58368,5001  >  53142 [ACK] Seq=1 Ack=338833 Win=58368 Len=0 TSval=2325277870 TSecr=1376317660
264,2.82905,192.168.2.2,192.168.1.2,TCP,66,58368,5001  >  53142 [ACK] Seq=1 Ack=341729 Win=58368 Len=0 TSval=2325277894 TSecr=1376317694
267,2.852595,192.168.2.2,192.168.1.2,TCP,66,58368,5001  >  53142 [ACK] Seq=1 Ack=344625 Win=58368 Len=0 TSval=2325277918 TSecr=1376317708
269,2.877057,192.168.2.2,192.168.1.2,TCP,66,58368,5001  >  53142 [ACK] Seq=1 Ack=347521 Win=58368 Len=0 TSval=2325277942 TSecr=1376317744
271,2.901041,192.168.2.2,192.168.1.2,TCP,66,58368,5001  >  53142 [ACK] Seq=1 Ack=350417 Win=58368 Len=0 TSval=2325277966 TSecr=1376317769
273,2.926079,192.168.2.2,192.168.1.2,TCP,66,58368,5001  >  53142 [ACK] Seq=1 Ack=353313 Win=58368 Len=0 TSval=2325277991 TSecr=1376317793
275,2.949598,192.168.2.2,192.168.1.2,TCP,66,58368,5001  >  53142 [ACK] Seq=1 Ack=356209 Win=58368 Len=0 TSval=2325278015 TSecr=1376317817
277,2.98595,192.168.2.2,192.168.1.2,TCP,66,58368,5001  >  53142 [ACK] Seq=1 Ack=360553 Win=58368 Len=0 TSval=2325278051 TSecr=1376317817
279,3.010308,192.168.2.2,192.168.1.2,TCP,66,58368,5001  >  53142 [ACK] Seq=1 Ack=363449 Win=58368 Len=0 TSval=2325278076 TSecr=1376317865
283,3.034256,192.168.2.2,192.168.1.2,TCP,66,58368,5001  >  53142 [ACK] Seq=1 Ack=366345 Win=58368 Len=0 TSval=2325278100 TSecr=1376317889
285,3.058493,192.168.2.2,192.168.1.2,TCP,66,58368,5001  >  53142 [ACK] Seq=1 Ack=369241 Win=58368 Len=0 TSval=2325278124 TSecr=1376317914
287,3.082832,192.168.2.2,192.168.1.2,TCP,66,58368,5001  >  53142 [ACK] Seq=1 Ack=372137 Win=58368 Len=0 TSval=2325278148 TSecr=1376317938
289,3.106929,192.168.2.2,192.168.1.2,TCP,66,58368,5001  >  53142 [ACK] Seq=1 Ack=375033 Win=58368 Len=0 TSval=2325278172 TSecr=1376317974
291,3.131877,192.168.2.2,192.168.1.2,TCP,66,58368,5001  >  53142 [ACK] Seq=1 Ack=377929 Win=58368 Len=0 TSval=2325278197 TSecr=1376317999
293,3.155437,192.168.2.2,192.168.1.2,TCP,66,58368,5001  >  53142 [ACK] Seq=1 Ack=380825 Win=58368 Len=0 TSval=2325278221 TSecr=1376317999
296,3.180387,192.168.2.2,192.168.1.2,TCP,66,58368,5001  >  53142 [ACK] Seq=1 Ack=383721 Win=58368 Len=0 TSval=2325278246 TSecr=1376318023
298,3.217292,192.168.2.2,192.168.1.2,TCP,66,58368,5001  >  53142 [ACK] Seq=1 Ack=388065 Win=58368 Len=0 TSval=2325278282 TSecr=1376318047
301,3.241007,192.168.2.2,192.168.1.2,TCP,66,58368,5001  >  53142 [ACK] Seq=1 Ack=390961 Win=58368 Len=0 TSval=2325278306 TSecr=1376318095
303,3.265219,192.168.2.2,192.168.1.2,TCP,66,58368,5001  >  53142 [ACK] Seq=1 Ack=393857 Win=58368 Len=0 TSval=2325278330 TSecr=1376318120
305,3.289689,192.168.2.2,192.168.1.2,TCP,66,58368,5001  >  53142 [ACK] Seq=1 Ack=396753 Win=58368 Len=0 TSval=2325278355 TSecr=1376318144
307,3.313686,192.168.2.2,192.168.1.2,TCP,66,58368,5001  >  53142 [ACK] Seq=1 Ack=399649 Win=58368 Len=0 TSval=2325278379 TSecr=1376318169
309,3.338223,192.168.2.2,192.168.1.2,TCP,66,58368,5001  >  53142 [ACK] Seq=1 Ack=402545 Win=58368 Len=0 TSval=2325278403 TSecr=1376318206
311,3.362728,192.168.2.2,192.168.1.2,TCP,66,58368,5001  >  53142 [ACK] Seq=1 Ack=405441 Win=58368 Len=0 TSval=2325278428 TSecr=1376318206
313,3.386327,192.168.2.2,192.168.1.2,TCP,66,58368,5001  >  53142 [ACK] Seq=1 Ack=408337 Win=58368 Len=0 TSval=2325278451 TSecr=1376318229
315,3.410705,192.168.2.2,192.168.1.2,TCP,66,58368,5001  >  53142 [ACK] Seq=1 Ack=411233 Win=58368 Len=0 TSval=2325278476 TSecr=1376318253
317,3.435269,192.168.2.2,192.168.1.2,TCP,66,58368,5001  >  53142 [ACK] Seq=1 Ack=414129 Win=58368 Len=0 TSval=2325278500 TSecr=1376318278
319,3.459007,192.168.2.2,192.168.1.2,TCP,66,58368,5001  >  53142 [ACK] Seq=1 Ack=417025 Win=58368 Len=0 TSval=2325278524 TSecr=1376318302
321,3.483243,192.168.2.2,192.168.1.2,TCP,66,58368,5001  >  53142 [ACK] Seq=1 Ack=419921 Win=58368 Len=0 TSval=2325278548 TSecr=1376318326
323,3.507792,192.168.2.2,192.168.1.2,TCP,66,58368,5001  >  53142 [ACK] Seq=1 Ack=422817 Win=58368 Len=0 TSval=2325278573 TSecr=1376318351
326,3.531729,192.168.2.2,192.168.1.2,TCP,66,58368,5001  >  53142 [ACK] Seq=1 Ack=425713 Win=58368 Len=0 TSval=2325278597 TSecr=1376318375
328,3.556815,192.168.2.2,192.168.1.2,TCP,66,58368,5001  >  53142 [ACK] Seq=1 Ack=428609 Win=58368 Len=0 TSval=2325278622 TSecr=1376318399
330,3.580324,192.168.2.2,192.168.1.2,TCP,66,58368,5001  >  53142 [ACK] Seq=1 Ack=431505 Win=58368 Len=0 TSval=2325278645 TSecr=1376318423
332,3.604812,192.168.2.2,192.168.1.2,TCP,66,58368,5001  >  53142 [ACK] Seq=1 Ack=434401 Win=58368 Len=0 TSval=2325278670 TSecr=1376318447
334,3.629276,192.168.2.2,192.168.1.2,TCP,66,58368,5001  >  53142 [ACK] Seq=1 Ack=437297 Win=58368 Len=0 TSval=2325278694 TSecr=1376318471
336,3.65281,192.168.2.2,192.168.1.2,TCP,66,58368,5001  >  53142 [ACK] Seq=1 Ack=440193 Win=58368 Len=0 TSval=2325278718 TSecr=1376318496
338,3.677005,192.168.2.2,192.168.1.2,TCP,66,58368,5001  >  53142 [ACK] Seq=1 Ack=443089 Win=58368 Len=0 TSval=2325278742 TSecr=1376318520
340,3.708354,192.168.2.2,192.168.1.2,TCP,66,58368,5001  >  53142 [ACK] Seq=1 Ack=445985 Win=58368 Len=0 TSval=2325278773 TSecr=1376318545
342,3.725512,192.168.2.2,192.168.1.2,TCP,66,58368,5001  >  53142 [ACK] Seq=1 Ack=448881 Win=58368 Len=0 TSval=2325278790 TSecr=1376318568
344,3.74971,192.168.2.2,192.168.1.2,TCP,66,58368,5001  >  53142 [ACK] Seq=1 Ack=451777 Win=58368 Len=0 TSval=2325278815 TSecr=1376318593
346,3.774282,192.168.2.2,192.168.1.2,TCP,66,58368,5001  >  53142 [ACK] Seq=1 Ack=454673 Win=58368 Len=0 TSval=2325278839 TSecr=1376318617
348,3.798135,192.168.2.2,192.168.1.2,TCP,66,58368,5001  >  53142 [ACK] Seq=1 Ack=457569 Win=58368 Len=0 TSval=2325278863 TSecr=1376318641
350,3.822376,192.168.2.2,192.168.1.2,TCP,66,58368,5001  >  53142 [ACK] Seq=1 Ack=460465 Win=58368 Len=0 TSval=2325278887 TSecr=1376318665
352,3.846868,192.168.2.2,192.168.1.2,TCP,66,58368,5001  >  53142 [ACK] Seq=1 Ack=463361 Win=58368 Len=0 TSval=2325278912 TSecr=1376318696
354,3.870814,192.168.2.2,192.168.1.2,TCP,66,58368,5001  >  53142 [ACK] Seq=1 Ack=466257 Win=58368 Len=0 TSval=2325278936 TSecr=1376318714
356,3.895015,192.168.2.2,192.168.1.2,TCP,66,58368,5001  >  53142 [ACK] Seq=1 Ack=469153 Win=58368 Len=0 TSval=2325278960 TSecr=1376318738
358,3.919425,192.168.2.2,192.168.1.2,TCP,66,58368,5001  >  53142 [ACK] Seq=1 Ack=472049 Win=58368 Len=0 TSval=2325278984 TSecr=1376318762
360,3.943533,192.168.2.2,192.168.1.2,TCP,66,58368,5001  >  53142 [ACK] Seq=1 Ack=474945 Win=58368 Len=0 TSval=2325279008 TSecr=1376318786
362,3.967959,192.168.2.2,192.168.1.2,TCP,66,58368,5001  >  53142 [ACK] Seq=1 Ack=477841 Win=58368 Len=0 TSval=2325279033 TSecr=1376318810
364,3.992426,192.168.2.2,192.168.1.2,TCP,66,58368,5001  >  53142 [ACK] Seq=1 Ack=480737 Win=58368 Len=0 TSval=2325279057 TSecr=1376318835
366,4.016307,192.168.2.2,192.168.1.2,TCP,66,58368,5001  >  53142 [ACK] Seq=1 Ack=483633 Win=58368 Len=0 TSval=2325279081 TSecr=1376318859
370,4.040392,192.168.2.2,192.168.1.2,TCP,66,58368,5001  >  53142 [ACK] Seq=1 Ack=486529 Win=58368 Len=0 TSval=2325279105 TSecr=1376318883
372,4.06494,192.168.2.2,192.168.1.2,TCP,66,58368,5001  >  53142 [ACK] Seq=1 Ack=489425 Win=58368 Len=0 TSval=2325279130 TSecr=1376318907
374,4.089485,192.168.2.2,192.168.1.2,TCP,66,58368,5001  >  53142 [ACK] Seq=1 Ack=492321 Win=58368 Len=0 TSval=2325279154 TSecr=1376318931
376,4.113057,192.168.2.2,192.168.1.2,TCP,66,58368,5001  >  53142 [ACK] Seq=1 Ack=495217 Win=58368 Len=0 TSval=2325279178 TSecr=1376318956
378,4.13749,192.168.2.2,192.168.1.2,TCP,66,58368,5001  >  53142 [ACK] Seq=1 Ack=498113 Win=58368 Len=0 TSval=2325279202 TSecr=1376318980
380,4.16199,192.168.2.2,192.168.1.2,TCP,66,58368,5001  >  53142 [ACK] Seq=1 Ack=501009 Win=58368 Len=0 TSval=2325279227 TSecr=1376319004
383,4.199225,192.168.2.2,192.168.1.2,TCP,66,58368,5001  >  53142 [ACK] Seq=1 Ack=505353 Win=58368 Len=0 TSval=2325279264 TSecr=1376319010
385,4.222853,192.168.2.2,192.168.1.2,TCP,66,58368,5001  >  53142 [ACK] Seq=1 Ack=508249 Win=58368 Len=0 TSval=2325279288 TSecr=1376319053
387,4.247327,192.168.2.2,192.168.1.2,TCP,66,58368,5001  >  53142 [ACK] Seq=1 Ack=511145 Win=58368 Len=0 TSval=2325279312 TSecr=1376319077
390,4.271796,192.168.2.2,192.168.1.2,TCP,66,58368,5001  >  53142 [ACK] Seq=1 Ack=514041 Win=58368 Len=0 TSval=2325279336 TSecr=1376319101
392,4.295695,192.168.2.2,192.168.1.2,TCP,66,58368,5001  >  53142 [ACK] Seq=1 Ack=516937 Win=58368 Len=0 TSval=2325279360 TSecr=1376319125
394,4.319773,192.168.2.2,192.168.1.2,TCP,66,58368,5001  >  53142 [ACK] Seq=1 Ack=519833 Win=58368 Len=0 TSval=2325279384 TSecr=1376319150
396,4.344244,192.168.2.2,192.168.1.2,TCP,66,60416,5001  >  53142 [ACK] Seq=1 Ack=522729 Win=60416 Len=0 TSval=2325279409 TSecr=1376319187
398,4.368773,192.168.2.2,192.168.1.2,TCP,66,60416,5001  >  53142 [ACK] Seq=1 Ack=525625 Win=60416 Len=0 TSval=2325279433 TSecr=1376319211
400,4.393224,192.168.2.2,192.168.1.2,TCP,66,60416,5001  >  53142 [ACK] Seq=1 Ack=528521 Win=60416 Len=0 TSval=2325279458 TSecr=1376319235
402,4.416751,192.168.2.2,192.168.1.2,TCP,66,61440,5001  >  53142 [ACK] Seq=1 Ack=529969 Win=61440 Len=0 TSval=2325279481 TSecr=1376319235
404,4.429595,192.168.2.2,192.168.1.2,TCP,66,61440,5001  >  53142 [ACK] Seq=1 Ack=532865 Win=61440 Len=0 TSval=2325279494 TSecr=1376319260
406,4.453006,192.168.2.2,192.168.1.2,TCP,66,61440,5001  >  53142 [ACK] Seq=1 Ack=535761 Win=61440 Len=0 TSval=2325279518 TSecr=1376319283
408,4.477165,192.168.2.2,192.168.1.2,TCP,66,61440,5001  >  53142 [ACK] Seq=1 Ack=538657 Win=61440 Len=0 TSval=2325279542 TSecr=1376319307
410,4.502048,192.168.2.2,192.168.1.2,TCP,66,61440,5001  >  53142 [ACK] Seq=1 Ack=541553 Win=61440 Len=0 TSval=2325279567 TSecr=1376319332
412,4.525683,192.168.2.2,192.168.1.2,TCP,66,61440,5001  >  53142 [ACK] Seq=1 Ack=544449 Win=61440 Len=0 TSval=2325279590 TSecr=1376319357
415,4.550521,192.168.2.2,192.168.1.2,TCP,66,61440,5001  >  53142 [ACK] Seq=1 Ack=547345 Win=61440 Len=0 TSval=2325279615 TSecr=1376319381
417,4.586159,192.168.2.2,192.168.1.2,TCP,66,61440,5001  >  53142 [ACK] Seq=1 Ack=551689 Win=61440 Len=0 TSval=2325279651 TSecr=1376319405
419,4.610404,192.168.2.2,192.168.1.2,TCP,66,61440,5001  >  53142 [ACK] Seq=1 Ack=554585 Win=61440 Len=0 TSval=2325279675 TSecr=1376319441
421,4.634876,192.168.2.2,192.168.1.2,TCP,66,61440,5001  >  53142 [ACK] Seq=1 Ack=557481 Win=61440 Len=0 TSval=2325279699 TSecr=1376319465
423,4.671085,192.168.2.2,192.168.1.2,TCP,66,61440,5001  >  53142 [ACK] Seq=1 Ack=561825 Win=61440 Len=0 TSval=2325279736 TSecr=1376319490
426,4.710234,192.168.2.2,192.168.1.2,TCP,66,61440,5001  >  53142 [ACK] Seq=1 Ack=566169 Win=61440 Len=0 TSval=2325279775 TSecr=1376319514
428,4.731523,192.168.2.2,192.168.1.2,TCP,66,61440,5001  >  53142 [ACK] Seq=1 Ack=569065 Win=61440 Len=0 TSval=2325279796 TSecr=1376319574
431,4.756399,192.168.2.2,192.168.1.2,TCP,66,61440,5001  >  53142 [ACK] Seq=1 Ack=571961 Win=61440 Len=0 TSval=2325279821 TSecr=1376319598
433,4.780006,192.168.2.2,192.168.1.2,TCP,66,61440,5001  >  53142 [ACK] Seq=1 Ack=574857 Win=61440 Len=0 TSval=2325279844 TSecr=1376319622
435,4.804401,192.168.2.2,192.168.1.2,TCP,66,61440,5001  >  53142 [ACK] Seq=1 Ack=577753 Win=61440 Len=0 TSval=2325279869 TSecr=1376319659
437,4.828858,192.168.2.2,192.168.1.2,TCP,66,63488,5001  >  53142 [ACK] Seq=1 Ack=580649 Win=63488 Len=0 TSval=2325279893 TSecr=1376319659
439,4.85266,192.168.2.2,192.168.1.2,TCP,66,63488,5001  >  53142 [ACK] Seq=1 Ack=583545 Win=63488 Len=0 TSval=2325279917 TSecr=1376319698
441,4.877957,192.168.2.2,192.168.1.2,TCP,66,63488,5001  >  53142 [ACK] Seq=1 Ack=586441 Win=63488 Len=0 TSval=2325279942 TSecr=1376319719
443,4.901425,192.168.2.2,192.168.1.2,TCP,66,64000,5001  >  53142 [ACK] Seq=1 Ack=587889 Win=64000 Len=0 TSval=2325279966 TSecr=1376319719
445,4.913254,192.168.2.2,192.168.1.2,TCP,66,64000,5001  >  53142 [ACK] Seq=1 Ack=590785 Win=64000 Len=0 TSval=2325279978 TSecr=1376319744
447,4.937436,192.168.2.2,192.168.1.2,TCP,66,64000,5001  >  53142 [ACK] Seq=1 Ack=593681 Win=64000 Len=0 TSval=2325280002 TSecr=1376319767
449,4.961679,192.168.2.2,192.168.1.2,TCP,66,64000,5001  >  53142 [ACK] Seq=1 Ack=596577 Win=64000 Len=0 TSval=2325280026 TSecr=1376319792
451,4.98735,192.168.2.2,192.168.1.2,TCP,66,64000,5001  >  53142 [ACK] Seq=1 Ack=599473 Win=64000 Len=0 TSval=2325280052 TSecr=1376319816
453,5.010259,192.168.2.2,192.168.1.2,TCP,66,64000,5001  >  53142 [ACK] Seq=1 Ack=602369 Win=64000 Len=0 TSval=2325280075 TSecr=1376319840
457,5.034353,192.168.2.2,192.168.1.2,TCP,66,64000,5001  >  53142 [ACK] Seq=1 Ack=605265 Win=64000 Len=0 TSval=2325280099 TSecr=1376319865
459,5.070995,192.168.2.2,192.168.1.2,TCP,66,64000,5001  >  53142 [ACK] Seq=1 Ack=609609 Win=64000 Len=0 TSval=2325280135 TSecr=1376319889
461,5.094909,192.168.2.2,192.168.1.2,TCP,66,64000,5001  >  53142 [ACK] Seq=1 Ack=612505 Win=64000 Len=0 TSval=2325280159 TSecr=1376319925
466,5.11915,192.168.2.2,192.168.1.2,TCP,66,64000,5001  >  53142 [ACK] Seq=1 Ack=615401 Win=64000 Len=0 TSval=2325280183 TSecr=1376319949
468,5.155456,192.168.2.2,192.168.1.2,TCP,66,64000,5001  >  53142 [ACK] Seq=1 Ack=619745 Win=64000 Len=0 TSval=2325280220 TSecr=1376319975
472,5.193069,192.168.2.2,192.168.1.2,TCP,66,64000,5001  >  53142 [ACK] Seq=1 Ack=624089 Win=64000 Len=0 TSval=2325280257 TSecr=1376320018
475,5.216796,192.168.2.2,192.168.1.2,TCP,66,64000,5001  >  53142 [ACK] Seq=1 Ack=626985 Win=64000 Len=0 TSval=2325280281 TSecr=1376320058
477,5.241264,192.168.2.2,192.168.1.2,TCP,66,64000,5001  >  53142 [ACK] Seq=1 Ack=629881 Win=64000 Len=0 TSval=2325280305 TSecr=1376320082
479,5.265577,192.168.2.2,192.168.1.2,TCP,66,64000,5001  >  53142 [ACK] Seq=1 Ack=632777 Win=64000 Len=0 TSval=2325280330 TSecr=1376320106
481,5.290068,192.168.2.2,192.168.1.2,TCP,66,64000,5001  >  53142 [ACK] Seq=1 Ack=635673 Win=64000 Len=0 TSval=2325280354 TSecr=1376320143
483,5.314041,192.168.2.2,192.168.1.2,TCP,66,64000,5001  >  53142 [ACK] Seq=1 Ack=638569 Win=64000 Len=0 TSval=2325280378 TSecr=1376320143
485,5.339061,192.168.2.2,192.168.1.2,TCP,66,64000,5001  >  53142 [ACK] Seq=1 Ack=641465 Win=64000 Len=0 TSval=2325280403 TSecr=1376320180
487,5.362606,192.168.2.2,192.168.1.2,TCP,66,64000,5001  >  53142 [ACK] Seq=1 Ack=644361 Win=64000 Len=0 TSval=2325280427 TSecr=1376320180
489,5.386715,192.168.2.2,192.168.1.2,TCP,66,64000,5001  >  53142 [ACK] Seq=1 Ack=647257 Win=64000 Len=0 TSval=2325280451 TSecr=1376320204
491,5.411592,192.168.2.2,192.168.1.2,TCP,66,64000,5001  >  53142 [ACK] Seq=1 Ack=650153 Win=64000 Len=0 TSval=2325280476 TSecr=1376320229
493,5.436105,192.168.2.2,192.168.1.2,TCP,66,64000,5001  >  53142 [ACK] Seq=1 Ack=653049 Win=64000 Len=0 TSval=2325280500 TSecr=1376320253
495,5.459377,192.168.2.2,192.168.1.2,TCP,66,64000,5001  >  53142 [ACK] Seq=1 Ack=655945 Win=64000 Len=0 TSval=2325280523 TSecr=1376320277
497,5.484099,192.168.2.2,192.168.1.2,TCP,66,64000,5001  >  53142 [ACK] Seq=1 Ack=658841 Win=64000 Len=0 TSval=2325280548 TSecr=1376320301
499,5.507883,192.168.2.2,192.168.1.2,TCP,66,64000,5001  >  53142 [ACK] Seq=1 Ack=661737 Win=64000 Len=0 TSval=2325280572 TSecr=1376320326
501,5.53208,192.168.2.2,192.168.1.2,TCP,66,64000,5001  >  53142 [ACK] Seq=1 Ack=664633 Win=64000 Len=0 TSval=2325280596 TSecr=1376320350
504,5.556615,192.168.2.2,192.168.1.2,TCP,66,64000,5001  >  53142 [ACK] Seq=1 Ack=667529 Win=64000 Len=0 TSval=2325280621 TSecr=1376320374
506,5.581236,192.168.2.2,192.168.1.2,TCP,66,64000,5001  >  53142 [ACK] Seq=1 Ack=670425 Win=64000 Len=0 TSval=2325280645 TSecr=1376320399
508,5.604769,192.168.2.2,192.168.1.2,TCP,66,64000,5001  >  53142 [ACK] Seq=1 Ack=673321 Win=64000 Len=0 TSval=2325280669 TSecr=1376320423
510,5.629231,192.168.2.2,192.168.1.2,TCP,66,64000,5001  >  53142 [ACK] Seq=1 Ack=676217 Win=64000 Len=0 TSval=2325280693 TSecr=1376320447
512,5.665411,192.168.2.2,192.168.1.2,TCP,66,64000,5001  >  53142 [ACK] Seq=1 Ack=680561 Win=64000 Len=0 TSval=2325280729 TSecr=1376320471
514,5.689489,192.168.2.2,192.168.1.2,TCP,66,64000,5001  >  53142 [ACK] Seq=1 Ack=683457 Win=64000 Len=0 TSval=2325280753 TSecr=1376320519
516,5.725848,192.168.2.2,192.168.1.2,TCP,66,64000,5001  >  53142 [ACK] Seq=1 Ack=687801 Win=64000 Len=0 TSval=2325280790 TSecr=1376320522
519,5.750151,192.168.2.2,192.168.1.2,TCP,66,64000,5001  >  53142 [ACK] Seq=1 Ack=690697 Win=64000 Len=0 TSval=2325280814 TSecr=1376320568
521,5.774734,192.168.2.2,192.168.1.2,TCP,66,64000,5001  >  53142 [ACK] Seq=1 Ack=693593 Win=64000 Len=0 TSval=2325280839 TSecr=1376320592
523,5.799223,192.168.2.2,192.168.1.2,TCP,66,64000,5001  >  53142 [ACK] Seq=1 Ack=696489 Win=64000 Len=0 TSval=2325280863 TSecr=1376320616
525,5.823713,192.168.2.2,192.168.1.2,TCP,66,64000,5001  >  53142 [ACK] Seq=1 Ack=699385 Win=64000 Len=0 TSval=2325280888 TSecr=1376320652
527,5.847292,192.168.2.2,192.168.1.2,TCP,66,64000,5001  >  53142 [ACK] Seq=1 Ack=702281 Win=64000 Len=0 TSval=2325280911 TSecr=1376320677
529,5.871721,192.168.2.2,192.168.1.2,TCP,66,64000,5001  >  53142 [ACK] Seq=1 Ack=705177 Win=64000 Len=0 TSval=2325280936 TSecr=1376320713
531,5.89543,192.168.2.2,192.168.1.2,TCP,66,64000,5001  >  53142 [ACK] Seq=1 Ack=708073 Win=64000 Len=0 TSval=2325280959 TSecr=1376320713
533,5.932561,192.168.2.2,192.168.1.2,TCP,66,64000,5001  >  53142 [ACK] Seq=1 Ack=712417 Win=64000 Len=0 TSval=2325280996 TSecr=1376320737
536,5.956061,192.168.2.2,192.168.1.2,TCP,66,64000,5001  >  53142 [ACK] Seq=1 Ack=715313 Win=64000 Len=0 TSval=2325281020 TSecr=1376320786
538,5.980538,192.168.2.2,192.168.1.2,TCP,66,64000,5001  >  53142 [ACK] Seq=1 Ack=718209 Win=64000 Len=0 TSval=2325281044 TSecr=1376320811
540,6.004942,192.168.2.2,192.168.1.2,TCP,66,66560,5001  >  53142 [ACK] Seq=1 Ack=721105 Win=66560 Len=0 TSval=2325281069 TSecr=1376320834
543,6.028618,192.168.2.2,192.168.1.2,TCP,66,66560,5001  >  53142 [ACK] Seq=1 Ack=724001 Win=66560 Len=0 TSval=2325281092 TSecr=1376320859
545,6.053386,192.168.2.2,192.168.1.2,TCP,66,66560,5001  >  53142 [ACK] Seq=1 Ack=726897 Win=66560 Len=0 TSval=2325281117 TSecr=1376320882
547,6.077638,192.168.2.2,192.168.1.2,TCP,66,66560,5001  >  53142 [ACK] Seq=1 Ack=729793 Win=66560 Len=0 TSval=2325281141 TSecr=1376320919
549,6.102071,192.168.2.2,192.168.1.2,TCP,66,66560,5001  >  53142 [ACK] Seq=1 Ack=732689 Win=66560 Len=0 TSval=2325281166 TSecr=1376320919
551,6.126539,192.168.2.2,192.168.1.2,TCP,66,66560,5001  >  53142 [ACK] Seq=1 Ack=735585 Win=66560 Len=0 TSval=2325281190 TSecr=1376320943
553,6.150311,192.168.2.2,192.168.1.2,TCP,66,66560,5001  >  53142 [ACK] Seq=1 Ack=738481 Win=66560 Len=0 TSval=2325281214 TSecr=1376320967
555,6.174553,192.168.2.2,192.168.1.2,TCP,66,66560,5001  >  53142 [ACK] Seq=1 Ack=741377 Win=66560 Len=0 TSval=2325281238 TSecr=1376320992
558,6.199523,192.168.2.2,192.168.1.2,TCP,66,66560,5001  >  53142 [ACK] Seq=1 Ack=744273 Win=66560 Len=0 TSval=2325281263 TSecr=1376321016
560,6.22376,192.168.2.2,192.168.1.2,TCP,66,66560,5001  >  53142 [ACK] Seq=1 Ack=747169 Win=66560 Len=0 TSval=2325281287 TSecr=1376321040
562,6.248087,192.168.2.2,192.168.1.2,TCP,66,66560,5001  >  53142 [ACK] Seq=1 Ack=750065 Win=66560 Len=0 TSval=2325281312 TSecr=1376321065
564,6.272205,192.168.2.2,192.168.1.2,TCP,66,66560,5001  >  53142 [ACK] Seq=1 Ack=752961 Win=66560 Len=0 TSval=2325281336 TSecr=1376321089
566,6.297018,192.168.2.2,192.168.1.2,TCP,66,66560,5001  >  53142 [ACK] Seq=1 Ack=755857 Win=66560 Len=0 TSval=2325281361 TSecr=1376321114
568,6.321576,192.168.2.2,192.168.1.2,TCP,66,66560,5001  >  53142 [ACK] Seq=1 Ack=758753 Win=66560 Len=0 TSval=2325281385 TSecr=1376321137
570,6.344949,192.168.2.2,192.168.1.2,TCP,66,66560,5001  >  53142 [ACK] Seq=1 Ack=761649 Win=66560 Len=0 TSval=2325281409 TSecr=1376321161
572,6.369128,192.168.2.2,192.168.1.2,TCP,66,66560,5001  >  53142 [ACK] Seq=1 Ack=764545 Win=66560 Len=0 TSval=2325281433 TSecr=1376321186
574,6.393645,192.168.2.2,192.168.1.2,TCP,66,66560,5001  >  53142 [ACK] Seq=1 Ack=767441 Win=66560 Len=0 TSval=2325281457 TSecr=1376321211
576,6.418082,192.168.2.2,192.168.1.2,TCP,66,66560,5001  >  53142 [ACK] Seq=1 Ack=770337 Win=66560 Len=0 TSval=2325281482 TSecr=1376321235
578,6.442611,192.168.2.2,192.168.1.2,TCP,66,66560,5001  >  53142 [ACK] Seq=1 Ack=773233 Win=66560 Len=0 TSval=2325281506 TSecr=1376321259
580,6.466129,192.168.2.2,192.168.1.2,TCP,66,66560,5001  >  53142 [ACK] Seq=1 Ack=776129 Win=66560 Len=0 TSval=2325281530 TSecr=1376321284
582,6.49062,192.168.2.2,192.168.1.2,TCP,66,66560,5001  >  53142 [ACK] Seq=1 Ack=779025 Win=66560 Len=0 TSval=2325281554 TSecr=1376321308
584,6.515189,192.168.2.2,192.168.1.2,TCP,66,66560,5001  >  53142 [ACK] Seq=1 Ack=781921 Win=66560 Len=0 TSval=2325281579 TSecr=1376321332
586,6.538677,192.168.2.2,192.168.1.2,TCP,66,66560,5001  >  53142 [ACK] Seq=1 Ack=784817 Win=66560 Len=0 TSval=2325281602 TSecr=1376321356
588,6.563334,192.168.2.2,192.168.1.2,TCP,66,66560,5001  >  53142 [ACK] Seq=1 Ack=787713 Win=66560 Len=0 TSval=2325281627 TSecr=1376321381
590,6.587625,192.168.2.2,192.168.1.2,TCP,66,66560,5001  >  53142 [ACK] Seq=1 Ack=790609 Win=66560 Len=0 TSval=2325281651 TSecr=1376321405
592,6.611437,192.168.2.2,192.168.1.2,TCP,66,66560,5001  >  53142 [ACK] Seq=1 Ack=793505 Win=66560 Len=0 TSval=2325281675 TSecr=1376321429
594,6.635867,192.168.2.2,192.168.1.2,TCP,66,66560,5001  >  53142 [ACK] Seq=1 Ack=796401 Win=66560 Len=0 TSval=2325281699 TSecr=1376321453
596,6.660229,192.168.2.2,192.168.1.2,TCP,66,66560,5001  >  53142 [ACK] Seq=1 Ack=799297 Win=66560 Len=0 TSval=2325281724 TSecr=1376321477
598,6.684634,192.168.2.2,192.168.1.2,TCP,66,66560,5001  >  53142 [ACK] Seq=1 Ack=802193 Win=66560 Len=0 TSval=2325281748 TSecr=1376321502
600,6.708639,192.168.2.2,192.168.1.2,TCP,66,66560,5001  >  53142 [ACK] Seq=1 Ack=805089 Win=66560 Len=0 TSval=2325281772 TSecr=1376321525
602,6.732721,192.168.2.2,192.168.1.2,TCP,66,66560,5001  >  53142 [ACK] Seq=1 Ack=807985 Win=66560 Len=0 TSval=2325281796 TSecr=1376321550
604,6.757213,192.168.2.2,192.168.1.2,TCP,66,66560,5001  >  53142 [ACK] Seq=1 Ack=810881 Win=66560 Len=0 TSval=2325281821 TSecr=1376321574
606,6.780918,192.168.2.2,192.168.1.2,TCP,66,66560,5001  >  53142 [ACK] Seq=1 Ack=813777 Win=66560 Len=0 TSval=2325281844 TSecr=1376321598
608,6.8052,192.168.2.2,192.168.1.2,TCP,66,66560,5001  >  53142 [ACK] Seq=1 Ack=816673 Win=66560 Len=0 TSval=2325281869 TSecr=1376321623
610,6.829719,192.168.2.2,192.168.1.2,TCP,66,66560,5001  >  53142 [ACK] Seq=1 Ack=819569 Win=66560 Len=0 TSval=2325281893 TSecr=1376321647
612,6.854275,192.168.2.2,192.168.1.2,TCP,66,66560,5001  >  53142 [ACK] Seq=1 Ack=822465 Win=66560 Len=0 TSval=2325281918 TSecr=1376321671
614,6.877815,192.168.2.2,192.168.1.2,TCP,66,69632,5001  >  53142 [ACK] Seq=1 Ack=825361 Win=69632 Len=0 TSval=2325281941 TSecr=1376321695
617,6.902359,192.168.2.2,192.168.1.2,TCP,66,69632,5001  >  53142 [ACK] Seq=1 Ack=828257 Win=69632 Len=0 TSval=2325281966 TSecr=1376321719
619,6.926314,192.168.2.2,192.168.1.2,TCP,66,69632,5001  >  53142 [ACK] Seq=1 Ack=831153 Win=69632 Len=0 TSval=2325281990 TSecr=1376321744
621,6.950837,192.168.2.2,192.168.1.2,TCP,66,69632,5001  >  53142 [ACK] Seq=1 Ack=834049 Win=69632 Len=0 TSval=2325282014 TSecr=1376321768
623,6.974723,192.168.2.2,192.168.1.2,TCP,66,69632,5001  >  53142 [ACK] Seq=1 Ack=836945 Win=69632 Len=0 TSval=2325282038 TSecr=1376321792
625,6.998924,192.168.2.2,192.168.1.2,TCP,66,69632,5001  >  53142 [ACK] Seq=1 Ack=839841 Win=69632 Len=0 TSval=2325282062 TSecr=1376321816
627,7.023278,192.168.2.2,192.168.1.2,TCP,66,69632,5001  >  53142 [ACK] Seq=1 Ack=842737 Win=69632 Len=0 TSval=2325282087 TSecr=1376321841
631,7.04738,192.168.2.2,192.168.1.2,TCP,66,69632,5001  >  53142 [ACK] Seq=1 Ack=845633 Win=69632 Len=0 TSval=2325282111 TSecr=1376321864
633,7.072246,192.168.2.2,192.168.1.2,TCP,66,69632,5001  >  53142 [ACK] Seq=1 Ack=848529 Win=69632 Len=0 TSval=2325282136 TSecr=1376321889
635,7.095826,192.168.2.2,192.168.1.2,TCP,66,69632,5001  >  53142 [ACK] Seq=1 Ack=851425 Win=69632 Len=0 TSval=2325282159 TSecr=1376321913
637,7.120354,192.168.2.2,192.168.1.2,TCP,66,69632,5001  >  53142 [ACK] Seq=1 Ack=854321 Win=69632 Len=0 TSval=2325282184 TSecr=1376321937
639,7.14485,192.168.2.2,192.168.1.2,TCP,66,69632,5001  >  53142 [ACK] Seq=1 Ack=857217 Win=69632 Len=0 TSval=2325282208 TSecr=1376321961
641,7.168489,192.168.2.2,192.168.1.2,TCP,66,69632,5001  >  53142 [ACK] Seq=1 Ack=860113 Win=69632 Len=0 TSval=2325282232 TSecr=1376321985
