No.,Time,Source,Destination,Protocol,Length,Calculated window size,Info
4,0.000386,192.168.2.2,192.168.1.2,TCP,74,28960,"5001  >  47996 [SYN, ACK] Seq=0 Ack=1 Win=28960 Len=0 MSS=1460 SACK_PERM=1 TSval=551772869 TSecr=456994584 WS=512"
7,0.000432,192.168.2.2,192.168.1.2,TCP,66,43520,5001  >  47996 [ACK] Seq=1 Ack=7241 Win=43520 Len=0 TSval=551772869 TSecr=456994584
11,0.049803,192.168.2.2,192.168.1.2,TCP,66,58368,5001  >  47996 [ACK] Seq=1 Ack=14481 Win=58368 Len=0 TSval=551772918 TSecr=456994584
13,0.110536,192.168.2.2,192.168.1.2,TCP,66,72704,5001  >  47996 [ACK] Seq=1 Ack=21721 Win=72704 Len=0 TSval=551772979 TSecr=456994584
15,0.171367,192.168.2.2,192.168.1.2,TCP,66,75776,5001  >  47996 [ACK] Seq=1 Ack=23169 Win=75776 Len=0 TSval=551773039 TSecr=456994598
16,0.18314,192.168.2.2,192.168.1.2,TCP,66,78336,5001  >  47996 [ACK] Seq=1 Ack=24617 Win=78336 Len=0 TSval=551773051 TSecr=456994661
18,0.195924,192.168.2.2,192.168.1.2,TCP,66,81408,5001  >  47996 [ACK] Seq=1 Ack=26065 Win=81408 Len=0 TSval=551773064 TSecr=456994745
20,0.207587,192.168.2.2,192.168.1.2,TCP,66,84480,5001  >  47996 [ACK] Seq=1 Ack=27513 Win=84480 Len=0 TSval=551773076 TSecr=456994766
23,0.219337,192.168.2.2,192.168.1.2,TCP,66,87040,5001  >  47996 [ACK] Seq=1 Ack=28961 Win=87040 Len=0 TSval=551773087 TSecr=456994779
25,0.231416,192.168.2.2,192.168.1.2,TCP,66,90112,5001  >  47996 [ACK] Seq=1 Ack=30409 Win=90112 Len=0 TSval=551773099 TSecr=456994791
27,0.243903,192.168.2.2,192.168.1.2,TCP,66,92672,5001  >  47996 [ACK] Seq=1 Ack=31857 Win=92672 Len=0 TSval=551773112 TSecr=456994791
29,0.255647,192.168.2.2,192.168.1.2,TCP,66,95744,5001  >  47996 [ACK] Seq=1 Ack=33305 Win=95744 Len=0 TSval=551773124 TSecr=456994802
31,0.268378,192.168.2.2,192.168.1.2,TCP,66,98816,5001  >  47996 [ACK] Seq=1 Ack=34753 Win=98816 Len=0 TSval=551773136 TSecr=456994815
33,0.280138,192.168.2.2,192.168.1.2,TCP,66,101376,5001  >  47996 [ACK] Seq=1 Ack=36201 Win=101376 Len=0 TSval=551773148 TSecr=456994827
35,0.292039,192.168.2.2,192.168.1.2,TCP,66,107520,5001  >  47996 [ACK] Seq=1 Ack=39097 Win=107520 Len=0 TSval=551773160 TSecr=456994839
37,0.316497,192.168.2.2,192.168.1.2,TCP,66,110080,5001  >  47996 [ACK] Seq=1 Ack=40545 Win=110080 Len=0 TSval=551773184 TSecr=456994851
39,0.328458,192.168.2.2,192.168.1.2,TCP,66,113152,5001  >  47996 [ACK] Seq=1 Ack=41993 Win=113152 Len=0 TSval=551773196 TSecr=456994863
41,0.340469,192.168.2.2,192.168.1.2,TCP,66,116224,5001  >  47996 [ACK] Seq=1 Ack=43441 Win=116224 Len=0 TSval=551773208 TSecr=456994875
43,0.352725,192.168.2.2,192.168.1.2,TCP,66,121856,5001  >  47996 [ACK] Seq=1 Ack=46337 Win=121856 Len=0 TSval=551773221 TSecr=456994900
45,0.377241,192.168.2.2,192.168.1.2,TCP,66,127488,5001  >  47996 [ACK] Seq=1 Ack=49233 Win=127488 Len=0 TSval=551773245 TSecr=456994912
47,0.401021,192.168.2.2,192.168.1.2,TCP,66,130560,5001  >  47996 [ACK] Seq=1 Ack=50681 Win=130560 Len=0 TSval=551773269 TSecr=456994924
49,0.413465,192.168.2.2,192.168.1.2,TCP,66,136192,5001  >  47996 [ACK] Seq=1 Ack=53577 Win=136192 Len=0 TSval=551773281 TSecr=456994936
51,0.437949,192.168.2.2,192.168.1.2,TCP,66,142336,5001  >  47996 [ACK] Seq=1 Ack=56473 Win=142336 Len=0 TSval=551773306 TSecr=456994960
53,0.462484,192.168.2.2,192.168.1.2,TCP,66,144896,5001  >  47996 [ACK] Seq=1 Ack=57921 Win=144896 Len=0 TSval=551773330 TSecr=456994984
55,0.474367,192.168.2.2,192.168.1.2,TCP,66,151040,5001  >  47996 [ACK] Seq=1 Ack=60817 Win=151040 Len=0 TSval=551773342 TSecr=456994996
57,0.498709,192.168.2.2,192.168.1.2,TCP,66,156672,5001  >  47996 [ACK] Seq=1 Ack=63713 Win=156672 Len=0 TSval=551773367 TSecr=456995021
59,0.523213,192.168.2.2,192.168.1.2,TCP,66,159744,5001  >  47996 [ACK] Seq=1 Ack=65161 Win=159744 Len=0 TSval=551773391 TSecr=456995046
61,0.534929,192.168.2.2,192.168.1.2,TCP,66,165376,5001  >  47996 [ACK] Seq=1 Ack=68057 Win=165376 Len=0 TSval=551773403 TSecr=456995057
63,0.559978,192.168.2.2,192.168.1.2,TCP,66,171008,5001  >  47996 [ACK] Seq=1 Ack=70953 Win=171008 Len=0 TSval=551773428 TSecr=456995082
65,0.584494,192.168.2.2,192.168.1.2,TCP,66,177152,5001  >  47996 [ACK] Seq=1 Ack=73849 Win=177152 Len=0 TSval=551773452 TSecr=456995106
67,0.607597,192.168.2.2,192.168.1.2,TCP,66,182784,5001  >  47996 [ACK] Seq=1 Ack=76745 Win=182784 Len=0 TSval=551773475 TSecr=456995118
69,0.632464,192.168.2.2,192.168.1.2,TCP,66,185344,5001  >  47996 [ACK] Seq=1 Ack=79641 Win=185344 Len=0 TSval=551773500 TSecr=456995143
71,0.656146,192.168.2.2,192.168.1.2,TCP,66,185344,5001  >  47996 [ACK] Seq=1 Ack=82537 Win=185344 Len=0 TSval=551773524 TSecr=456995167
74,0.680543,192.168.2.2,192.168.1.2,TCP,66,185344,5001  >  47996 [ACK] Seq=1 Ack=85433 Win=185344 Len=0 TSval=551773548 TSecr=456995191
76,0.705046,192.168.2.2,192.168.1.2,TCP,66,185856,5001  >  47996 [ACK] Seq=1 Ack=86881 Win=185856 Len=0 TSval=551773573 TSecr=456995215
78,0.716876,192.168.2.2,192.168.1.2,TCP,66,185344,5001  >  47996 [ACK] Seq=1 Ack=89777 Win=185344 Len=0 TSval=551773585 TSecr=456995239
81,0.741274,192.168.2.2,192.168.1.2,TCP,66,185344,5001  >  47996 [ACK] Seq=1 Ack=92673 Win=185344 Len=0 TSval=551773609 TSecr=456995239
84,0.76505,192.168.2.2,192.168.1.2,TCP,66,185344,5001  >  47996 [ACK] Seq=1 Ack=95569 Win=185344 Len=0 TSval=551773633 TSecr=456995263
86,0.789386,192.168.2.2,192.168.1.2,TCP,66,185856,5001  >  47996 [ACK] Seq=1 Ack=97017 Win=185856 Len=0 TSval=551773657 TSecr=456995288
88,0.802156,192.168.2.2,192.168.1.2,TCP,66,185344,5001  >  47996 [ACK] Seq=1 Ack=99913 Win=185344 Len=0 TSval=551773670 TSecr=456995300
90,0.826686,192.168.2.2,192.168.1.2,TCP,66,185344,5001  >  47996 [ACK] Seq=1 Ack=102809 Win=185344 Len=0 TSval=551773694 TSecr=456995324
93,0.850075,192.168.2.2,192.168.1.2,TCP,66,185344,5001  >  47996 [ACK] Seq=1 Ack=105705 Win=185344 Len=0 TSval=551773718 TSecr=456995348
95,0.886343,192.168.2.2,192.168.1.2,TCP,66,185344,5001  >  47996 [ACK] Seq=1 Ack=110049 Win=185344 Len=0 TSval=551773754 TSecr=456995372
97,0.910893,192.168.2.2,192.168.1.2,TCP,66,185344,5001  >  47996 [ACK] Seq=1 Ack=112945 Win=185344 Len=0 TSval=551773779 TSecr=456995409
100,0.934636,192.168.2.2,192.168.1.2,TCP,66,185344,5001  >  47996 [ACK] Seq=1 Ack=115841 Win=185344 Len=0 TSval=551773802 TSecr=456995433
102,0.958912,192.168.2.2,192.168.1.2,TCP,66,185344,5001  >  47996 [ACK] Seq=1 Ack=118737 Win=185344 Len=0 TSval=551773827 TSecr=456995469
104,0.983372,192.168.2.2,192.168.1.2,TCP,66,185344,5001  >  47996 [ACK] Seq=1 Ack=121633 Win=185344 Len=0 TSval=551773851 TSecr=456995494
106,1.0073,192.168.2.2,192.168.1.2,TCP,66,185344,5001  >  47996 [ACK] Seq=1 Ack=124529 Win=185344 Len=0 TSval=551773875 TSecr=456995494
109,1.031526,192.168.2.2,192.168.1.2,TCP,66,185344,5001  >  47996 [ACK] Seq=1 Ack=127425 Win=185344 Len=0 TSval=551773899 TSecr=456995517
111,1.057019,192.168.2.2,192.168.1.2,TCP,66,185344,5001  >  47996 [ACK] Seq=1 Ack=130321 Win=185344 Len=0 TSval=551773925 TSecr=456995542
113,1.081323,192.168.2.2,192.168.1.2,TCP,66,185344,5001  >  47996 [ACK] Seq=1 Ack=133217 Win=185344 Len=0 TSval=551773949 TSecr=456995566
115,1.105862,192.168.2.2,192.168.1.2,TCP,66,185344,5001  >  47996 [ACK] Seq=1 Ack=136113 Win=185344 Len=0 TSval=551773973 TSecr=456995590
118,1.130659,192.168.2.2,192.168.1.2,TCP,66,185344,5001  >  47996 [ACK] Seq=1 Ack=139009 Win=185344 Len=0 TSval=551773998 TSecr=456995614
120,1.154705,192.168.2.2,192.168.1.2,TCP,66,185344,5001  >  47996 [ACK] Seq=1 Ack=141905 Win=185344 Len=0 TSval=551774022 TSecr=456995640
122,1.179857,192.168.2.2,192.168.1.2,TCP,66,185344,5001  >  47996 [ACK] Seq=1 Ack=144801 Win=185344 Len=0 TSval=551774047 TSecr=456995664
124,1.203393,192.168.2.2,192.168.1.2,TCP,66,185344,5001  >  47996 [ACK] Seq=1 Ack=147697 Win=185344 Len=0 TSval=551774071 TSecr=456995689
126,1.227936,192.168.2.2,192.168.1.2,TCP,66,185344,5001  >  47996 [ACK] Seq=1 Ack=150593 Win=185344 Len=0 TSval=551774095 TSecr=456995713
128,1.252387,192.168.2.2,192.168.1.2,TCP,66,185344,5001  >  47996 [ACK] Seq=1 Ack=153489 Win=185344 Len=0 TSval=551774120 TSecr=456995737
130,1.275991,192.168.2.2,192.168.1.2,TCP,66,185344,5001  >  47996 [ACK] Seq=1 Ack=156385 Win=185344 Len=0 TSval=551774144 TSecr=456995763
132,1.300061,192.168.2.2,192.168.1.2,TCP,66,185344,5001  >  47996 [ACK] Seq=1 Ack=159281 Win=185344 Len=0 TSval=551774168 TSecr=456995786
134,1.324881,192.168.2.2,192.168.1.2,TCP,66,185344,5001  >  47996 [ACK] Seq=1 Ack=162177 Win=185344 Len=0 TSval=551774192 TSecr=456995811
136,1.348504,192.168.2.2,192.168.1.2,TCP,66,185344,5001  >  47996 [ACK] Seq=1 Ack=165073 Win=185344 Len=0 TSval=551774216 TSecr=456995835
139,1.372943,192.168.2.2,192.168.1.2,TCP,66,185344,5001  >  47996 [ACK] Seq=1 Ack=167969 Win=185344 Len=0 TSval=551774240 TSecr=456995859
141,1.396945,192.168.2.2,192.168.1.2,TCP,66,185344,5001  >  47996 [ACK] Seq=1 Ack=170865 Win=185344 Len=0 TSval=551774264 TSecr=456995883
143,1.421923,192.168.2.2,192.168.1.2,TCP,66,185344,5001  >  47996 [ACK] Seq=1 Ack=173761 Win=185344 Len=0 TSval=551774289 TSecr=456995907
145,1.445456,192.168.2.2,192.168.1.2,TCP,66,185344,5001  >  47996 [ACK] Seq=1 Ack=176657 Win=185344 Len=0 TSval=551774313 TSecr=456995931
147,1.481811,192.168.2.2,192.168.1.2,TCP,66,185344,5001  >  47996 [ACK] Seq=1 Ack=181001 Win=185344 Len=0 TSval=551774349 TSecr=456995931
150,1.506223,192.168.2.2,192.168.1.2,TCP,66,185344,5001  >  47996 [ACK] Seq=1 Ack=183897 Win=185344 Len=0 TSval=551774374 TSecr=456995980
152,1.530741,192.168.2.2,192.168.1.2,TCP,66,185344,5001  >  47996 [ACK] Seq=1 Ack=186793 Win=185344 Len=0 TSval=551774398 TSecr=456996004
154,1.555221,192.168.2.2,192.168.1.2,TCP,66,185344,5001  >  47996 [ACK] Seq=1 Ack=189689 Win=185344 Len=0 TSval=551774423 TSecr=456996028
156,1.578685,192.168.2.2,192.168.1.2,TCP,66,185344,5001  >  47996 [ACK] Seq=1 Ack=192585 Win=185344 Len=0 TSval=551774446 TSecr=456996064
158,1.61504,192.168.2.2,192.168.1.2,TCP,66,185344,5001  >  47996 [ACK] Seq=1 Ack=196929 Win=185344 Len=0 TSval=551774482 TSecr=456996081
160,1.639549,192.168.2.2,192.168.1.2,TCP,66,185344,5001  >  47996 [ACK] Seq=1 Ack=199825 Win=185344 Len=0 TSval=551774507 TSecr=456996113
163,1.663431,192.168.2.2,192.168.1.2,TCP,66,185344,5001  >  47996 [ACK] Seq=1 Ack=202721 Win=185344 Len=0 TSval=551774531 TSecr=456996138
165,1.68791,192.168.2.2,192.168.1.2,TCP,66,185344,5001  >  47996 [ACK] Seq=1 Ack=205617 Win=185344 Len=0 TSval=551774555 TSecr=456996161
167,1.711888,192.168.2.2,192.168.1.2,TCP,66,185344,5001  >  47996 [ACK] Seq=1 Ack=208513 Win=185344 Len=0 TSval=551774579 TSecr=456996197
169,1.736123,192.168.2.2,192.168.1.2,TCP,66,185344,5001  >  47996 [ACK] Seq=1 Ack=211409 Win=185344 Len=0 TSval=551774603 TSecr=456996222
174,1.760559,192.168.2.2,192.168.1.2,TCP,66,185344,5001  >  47996 [ACK] Seq=1 Ack=214305 Win=185344 Len=0 TSval=551774628 TSecr=456996246
176,1.785068,192.168.2.2,192.168.1.2,TCP,66,185344,5001  >  47996 [ACK] Seq=1 Ack=217201 Win=185344 Len=0 TSval=551774652 TSecr=456996270
178,1.808756,192.168.2.2,192.168.1.2,TCP,66,185344,5001  >  47996 [ACK] Seq=1 Ack=220097 Win=185344 Len=0 TSval=551774676 TSecr=456996294
181,1.833696,192.168.2.2,192.168.1.2,TCP,66,185344,5001  >  47996 [ACK] Seq=1 Ack=222993 Win=185344 Len=0 TSval=551774701 TSecr=456996319
183,1.85859,192.168.2.2,192.168.1.2,TCP,66,185344,5001  >  47996 [ACK] Seq=1 Ack=225889 Win=185344 Len=0 TSval=551774726 TSecr=456996319
185,1.8823,192.168.2.2,192.168.1.2,TCP,66,185344,5001  >  47996 [ACK] Seq=1 Ack=228785 Win=185344 Len=0 TSval=551774750 TSecr=456996343
187,1.906658,192.168.2.2,192.168.1.2,TCP,66,185344,5001  >  47996 [ACK] Seq=1 Ack=231681 Win=185344 Len=0 TSval=551774774 TSecr=456996367
189,1.930609,192.168.2.2,192.168.1.2,TCP,66,185344,5001  >  47996 [ACK] Seq=1 Ack=234577 Win=185344 Len=0 TSval=551774798 TSecr=456996391
191,1.954806,192.168.2.2,192.168.1.2,TCP,66,185344,5001  >  47996 [ACK] Seq=1 Ack=237473 Win=185344 Len=0 TSval=551774822 TSecr=456996416
194,1.980094,192.168.2.2,192.168.1.2,TCP,66,185344,5001  >  47996 [ACK] Seq=1 Ack=240369 Win=185344 Len=0 TSval=551774847 TSecr=456996441
196,2.003268,192.168.2.2,192.168.1.2,TCP,66,185344,5001  >  47996 [ACK] Seq=1 Ack=243265 Win=185344 Len=0 TSval=551774870 TSecr=456996465
199,2.028106,192.168.2.2,192.168.1.2,TCP,66,185344,5001  >  47996 [ACK] Seq=1 Ack=246161 Win=185344 Len=0 TSval=551774895 TSecr=456996489
201,2.052592,192.168.2.2,192.168.1.2,TCP,66,185344,5001  >  47996 [ACK] Seq=1 Ack=249057 Win=185344 Len=0 TSval=551774920 TSecr=456996513
203,2.076135,192.168.2.2,192.168.1.2,TCP,66,185344,5001  >  47996 [ACK] Seq=1 Ack=251953 Win=185344 Len=0 TSval=551774943 TSecr=456996537
205,2.100596,192.168.2.2,192.168.1.2,TCP,66,185344,5001  >  47996 [ACK] Seq=1 Ack=254849 Win=185344 Len=0 TSval=551774968 TSecr=456996562
207,2.125125,192.168.2.2,192.168.1.2,TCP,66,185344,5001  >  47996 [ACK] Seq=1 Ack=257745 Win=185344 Len=0 TSval=551774992 TSecr=456996586
210,2.161508,192.168.2.2,192.168.1.2,TCP,66,185344,5001  >  47996 [ACK] Seq=1 Ack=262089 Win=185344 Len=0 TSval=551775029 TSecr=456996610
213,2.185934,192.168.2.2,192.168.1.2,TCP,66,185344,5001  >  47996 [ACK] Seq=1 Ack=264985 Win=185344 Len=0 TSval=551775053 TSecr=456996658
215,2.210412,192.168.2.2,192.168.1.2,TCP,66,185344,5001  >  47996 [ACK] Seq=1 Ack=267881 Win=185344 Len=0 TSval=551775077 TSecr=456996683
217,2.234264,192.168.2.2,192.168.1.2,TCP,66,185344,5001  >  47996 [ACK] Seq=1 Ack=270777 Win=185344 Len=0 TSval=551775101 TSecr=456996707
219,2.258446,192.168.2.2,192.168.1.2,TCP,66,185344,5001  >  47996 [ACK] Seq=1 Ack=273673 Win=185344 Len=0 TSval=551775125 TSecr=456996744
221,2.282947,192.168.2.2,192.168.1.2,TCP,66,185344,5001  >  47996 [ACK] Seq=1 Ack=276569 Win=185344 Len=0 TSval=551775150 TSecr=456996744
224,2.306862,192.168.2.2,192.168.1.2,TCP,66,185344,5001  >  47996 [ACK] Seq=1 Ack=279465 Win=185344 Len=0 TSval=551775174 TSecr=456996768
226,2.33199,192.168.2.2,192.168.1.2,TCP,66,185344,5001  >  47996 [ACK] Seq=1 Ack=282361 Win=185344 Len=0 TSval=551775199 TSecr=456996793
228,2.356019,192.168.2.2,192.168.1.2,TCP,66,185344,5001  >  47996 [ACK] Seq=1 Ack=285257 Win=185344 Len=0 TSval=551775223 TSecr=456996816
230,2.379682,192.168.2.2,192.168.1.2,TCP,66,185344,5001  >  47996 [ACK] Seq=1 Ack=288153 Win=185344 Len=0 TSval=551775247 TSecr=456996841
232,2.403992,192.168.2.2,192.168.1.2,TCP,66,185344,5001  >  47996 [ACK] Seq=1 Ack=291049 Win=185344 Len=0 TSval=551775271 TSecr=456996865
234,2.440328,192.168.2.2,192.168.1.2,TCP,66,185344,5001  >  47996 [ACK] Seq=1 Ack=295393 Win=185344 Len=0 TSval=551775307 TSecr=456996865
236,2.464804,192.168.2.2,192.168.1.2,TCP,66,185344,5001  >  47996 [ACK] Seq=1 Ack=298289 Win=185344 Len=0 TSval=551775332 TSecr=456996914
238,2.489304,192.168.2.2,192.168.1.2,TCP,66,185344,5001  >  47996 [ACK] Seq=1 Ack=301185 Win=185344 Len=0 TSval=551775356 TSecr=456996938
240,2.512856,192.168.2.2,192.168.1.2,TCP,66,185344,5001  >  47996 [ACK] Seq=1 Ack=304081 Win=185344 Len=0 TSval=551775380 TSecr=456996962
243,2.537312,192.168.2.2,192.168.1.2,TCP,66,185344,5001  >  47996 [ACK] Seq=1 Ack=306977 Win=185344 Len=0 TSval=551775404 TSecr=456996986
245,2.561851,192.168.2.2,192.168.1.2,TCP,66,185344,5001  >  47996 [ACK] Seq=1 Ack=309873 Win=185344 Len=0 TSval=551775429 TSecr=456997022
247,2.586328,192.168.2.2,192.168.1.2,TCP,66,185344,5001  >  47996 [ACK] Seq=1 Ack=312769 Win=185344 Len=0 TSval=551775453 TSecr=456997047
249,2.609867,192.168.2.2,192.168.1.2,TCP,66,185344,5001  >  47996 [ACK] Seq=1 Ack=315665 Win=185344 Len=0 TSval=551775477 TSecr=456997071
251,2.634304,192.168.2.2,192.168.1.2,TCP,66,185344,5001  >  47996 [ACK] Seq=1 Ack=318561 Win=185344 Len=0 TSval=551775501 TSecr=456997095
253,2.670624,192.168.2.2,192.168.1.2,TCP,66,185344,5001  >  47996 [ACK] Seq=1 Ack=322905 Win=185344 Len=0 TSval=551775537 TSecr=456997096
257,2.695065,192.168.2.2,192.168.1.2,TCP,66,185344,5001  >  47996 [ACK] Seq=1 Ack=325801 Win=185344 Len=0 TSval=551775562 TSecr=456997144
259,2.718711,192.168.2.2,192.168.1.2,TCP,66,185344,5001  >  47996 [ACK] Seq=1 Ack=328697 Win=185344 Len=0 TSval=551775586 TSecr=456997168
261,2.743084,192.168.2.2,192.168.1.2,TCP,66,185344,5001  >  47996 [ACK] Seq=1 Ack=331593 Win=185344 Len=0 TSval=551775610 TSecr=456997192
263,2.767662,192.168.2.2,192.168.1.2,TCP,66,185344,5001  >  47996 [ACK] Seq=1 Ack=334489 Win=185344 Len=0 TSval=551775634 TSecr=456997216
265,2.791368,192.168.2.2,192.168.1.2,TCP,66,185344,5001  >  47996 [ACK] Seq=1 Ack=337385 Win=185344 Len=0 TSval=551775658 TSecr=456997253
267,2.816675,192.168.2.2,192.168.1.2,TCP,66,185344,5001  >  47996 [ACK] Seq=1 Ack=340281 Win=185344 Len=0 TSval=551775683 TSecr=456997277
269,2.840181,192.168.2.2,192.168.1.2,TCP,66,185344,5001  >  47996 [ACK] Seq=1 Ack=343177 Win=185344 Len=0 TSval=551775707 TSecr=456997301
271,2.864675,192.168.2.2,192.168.1.2,TCP,66,185344,5001  >  47996 [ACK] Seq=1 Ack=346073 Win=185344 Len=0 TSval=551775731 TSecr=456997325
273,2.889169,192.168.2.2,192.168.1.2,TCP,66,185344,5001  >  47996 [ACK] Seq=1 Ack=348969 Win=185344 Len=0 TSval=551775756 TSecr=456997350
275,2.9127,192.168.2.2,192.168.1.2,TCP,66,185344,5001  >  47996 [ACK] Seq=1 Ack=351865 Win=185344 Len=0 TSval=551775779 TSecr=456997373
277,2.936809,192.168.2.2,192.168.1.2,TCP,66,185344,5001  >  47996 [ACK] Seq=1 Ack=354761 Win=185344 Len=0 TSval=551775803 TSecr=456997399
279,2.96122,192.168.2.2,192.168.1.2,TCP,66,185344,5001  >  47996 [ACK] Seq=1 Ack=357657 Win=185344 Len=0 TSval=551775828 TSecr=456997422
281,2.98516,192.168.2.2,192.168.1.2,TCP,66,185344,5001  >  47996 [ACK] Seq=1 Ack=360553 Win=185344 Len=0 TSval=551775852 TSecr=456997447
284,3.009404,192.168.2.2,192.168.1.2,TCP,66,185344,5001  >  47996 [ACK] Seq=1 Ack=363449 Win=185344 Len=0 TSval=551775876 TSecr=456997471
288,3.033875,192.168.2.2,192.168.1.2,TCP,66,185344,5001  >  47996 [ACK] Seq=1 Ack=366345 Win=185344 Len=0 TSval=551775901 TSecr=456997494
290,3.057811,192.168.2.2,192.168.1.2,TCP,66,185344,5001  >  47996 [ACK] Seq=1 Ack=369241 Win=185344 Len=0 TSval=551775924 TSecr=456997519
292,3.082733,192.168.2.2,192.168.1.2,TCP,66,185344,5001  >  47996 [ACK] Seq=1 Ack=372137 Win=185344 Len=0 TSval=551775949 TSecr=456997543
294,3.106297,192.168.2.2,192.168.1.2,TCP,66,185344,5001  >  47996 [ACK] Seq=1 Ack=375033 Win=185344 Len=0 TSval=551775973 TSecr=456997567
296,3.130741,192.168.2.2,192.168.1.2,TCP,66,185344,5001  >  47996 [ACK] Seq=1 Ack=377929 Win=185344 Len=0 TSval=551775997 TSecr=456997567
298,3.154707,192.168.2.2,192.168.1.2,TCP,66,185344,5001  >  47996 [ACK] Seq=1 Ack=380825 Win=185344 Len=0 TSval=551776021 TSecr=456997591
301,3.179708,192.168.2.2,192.168.1.2,TCP,66,185344,5001  >  47996 [ACK] Seq=1 Ack=383721 Win=185344 Len=0 TSval=551776046 TSecr=456997616
303,3.203939,192.168.2.2,192.168.1.2,TCP,66,185344,5001  >  47996 [ACK] Seq=1 Ack=386617 Win=185344 Len=0 TSval=551776070 TSecr=456997640
305,3.228759,192.168.2.2,192.168.1.2,TCP,66,185344,5001  >  47996 [ACK] Seq=1 Ack=389513 Win=185344 Len=0 TSval=551776095 TSecr=456997665
307,3.253268,192.168.2.2,192.168.1.2,TCP,66,185344,5001  >  47996 [ACK] Seq=1 Ack=392409 Win=185344 Len=0 TSval=551776120 TSecr=456997688
309,3.276655,192.168.2.2,192.168.1.2,TCP,66,185344,5001  >  47996 [ACK] Seq=1 Ack=395305 Win=185344 Len=0 TSval=551776143 TSecr=456997712
311,3.301243,192.168.2.2,192.168.1.2,TCP,66,185344,5001  >  47996 [ACK] Seq=1 Ack=398201 Win=185344 Len=0 TSval=551776168 TSecr=456997736
313,3.325742,192.168.2.2,192.168.1.2,TCP,66,185344,5001  >  47996 [ACK] Seq=1 Ack=401097 Win=185344 Len=0 TSval=551776192 TSecr=456997761
315,3.349592,192.168.2.2,192.168.1.2,TCP,66,185344,5001  >  47996 [ACK] Seq=1 Ack=403993 Win=185344 Len=0 TSval=551776216 TSecr=456997786
317,3.373828,192.168.2.2,192.168.1.2,TCP,66,185344,5001  >  47996 [ACK] Seq=1 Ack=406889 Win=185344 Len=0 TSval=551776240 TSecr=456997810
319,3.398316,192.168.2.2,192.168.1.2,TCP,66,185344,5001  >  47996 [ACK] Seq=1 Ack=409785 Win=185344 Len=0 TSval=551776265 TSecr=456997835
321,3.42277,192.168.2.2,192.168.1.2,TCP,66,185344,5001  >  47996 [ACK] Seq=1 Ack=412681 Win=185344 Len=0 TSval=551776289 TSecr=456997858
323,3.446837,192.168.2.2,192.168.1.2,TCP,66,185344,5001  >  47996 [ACK] Seq=1 Ack=415577 Win=185344 Len=0 TSval=551776313 TSecr=456997883
325,3.470518,192.168.2.2,192.168.1.2,TCP,66,185344,5001  >  47996 [ACK] Seq=1 Ack=418473 Win=185344 Len=0 TSval=551776337 TSecr=456997907
327,3.494879,192.168.2.2,192.168.1.2,TCP,66,185344,5001  >  47996 [ACK] Seq=1 Ack=421369 Win=185344 Len=0 TSval=551776361 TSecr=456997931
329,3.519411,192.168.2.2,192.168.1.2,TCP,66,185344,5001  >  47996 [ACK] Seq=1 Ack=424265 Win=185344 Len=0 TSval=551776386 TSecr=456997955
331,3.543182,192.168.2.2,192.168.1.2,TCP,66,185344,5001  >  47996 [ACK] Seq=1 Ack=427161 Win=185344 Len=0 TSval=551776410 TSecr=456997980
333,3.567502,192.168.2.2,192.168.1.2,TCP,66,185344,5001  >  47996 [ACK] Seq=1 Ack=430057 Win=185344 Len=0 TSval=551776434 TSecr=456998004
335,3.591546,192.168.2.2,192.168.1.2,TCP,66,185344,5001  >  47996 [ACK] Seq=1 Ack=432953 Win=185344 Len=0 TSval=551776458 TSecr=456998028
337,3.615809,192.168.2.2,192.168.1.2,TCP,66,185344,5001  >  47996 [ACK] Seq=1 Ack=435849 Win=185344 Len=0 TSval=551776482 TSecr=456998052
339,3.640086,192.168.2.2,192.168.1.2,TCP,66,185344,5001  >  47996 [ACK] Seq=1 Ack=438745 Win=185344 Len=0 TSval=551776506 TSecr=456998076
341,3.664216,192.168.2.2,192.168.1.2,TCP,66,185344,5001  >  47996 [ACK] Seq=1 Ack=441641 Win=185344 Len=0 TSval=551776531 TSecr=456998101
343,3.68887,192.168.2.2,192.168.1.2,TCP,66,185344,5001  >  47996 [ACK] Seq=1 Ack=444537 Win=185344 Len=0 TSval=551776555 TSecr=456998125
345,3.712651,192.168.2.2,192.168.1.2,TCP,66,185344,5001  >  47996 [ACK] Seq=1 Ack=447433 Win=185344 Len=0 TSval=551776579 TSecr=456998149
347,3.749667,192.168.2.2,192.168.1.2,TCP,66,185344,5001  >  47996 [ACK] Seq=1 Ack=451777 Win=185344 Len=0 TSval=551776616 TSecr=456998173
350,3.776525,192.168.2.2,192.168.1.2,TCP,66,185344,5001  >  47996 [ACK] Seq=1 Ack=454673 Win=185344 Len=0 TSval=551776643 TSecr=456998221
352,3.797654,192.168.2.2,192.168.1.2,TCP,66,185344,5001  >  47996 [ACK] Seq=1 Ack=457569 Win=185344 Len=0 TSval=551776664 TSecr=456998246
354,3.822239,192.168.2.2,192.168.1.2,TCP,66,185344,5001  >  47996 [ACK] Seq=1 Ack=460465 Win=185344 Len=0 TSval=551776688 TSecr=456998270
356,3.845886,192.168.2.2,192.168.1.2,TCP,66,185344,5001  >  47996 [ACK] Seq=1 Ack=463361 Win=185344 Len=0 TSval=551776712 TSecr=456998294
358,3.871256,192.168.2.2,192.168.1.2,TCP,66,185344,5001  >  47996 [ACK] Seq=1 Ack=466257 Win=185344 Len=0 TSval=551776737 TSecr=456998331
360,3.894745,192.168.2.2,192.168.1.2,TCP,66,185344,5001  >  47996 [ACK] Seq=1 Ack=469153 Win=185344 Len=0 TSval=551776761 TSecr=456998331
362,3.919226,192.168.2.2,192.168.1.2,TCP,66,185344,5001  >  47996 [ACK] Seq=1 Ack=472049 Win=185344 Len=0 TSval=551776785 TSecr=456998358
364,3.942776,192.168.2.2,192.168.1.2,TCP,66,185344,5001  >  47996 [ACK] Seq=1 Ack=474945 Win=185344 Len=0 TSval=551776809 TSecr=456998379
366,3.967199,192.168.2.2,192.168.1.2,TCP,66,185344,5001  >  47996 [ACK] Seq=1 Ack=477841 Win=185344 Len=0 TSval=551776833 TSecr=456998404
368,3.991683,192.168.2.2,192.168.1.2,TCP,66,185344,5001  >  47996 [ACK] Seq=1 Ack=480737 Win=185344 Len=0 TSval=551776858 TSecr=456998427
370,4.015539,192.168.2.2,192.168.1.2,TCP,66,185344,5001  >  47996 [ACK] Seq=1 Ack=483633 Win=185344 Len=0 TSval=551776882 TSecr=456998453
373,4.0398,192.168.2.2,192.168.1.2,TCP,66,185344,5001  >  47996 [ACK] Seq=1 Ack=486529 Win=185344 Len=0 TSval=551776906 TSecr=456998476
376,4.064716,192.168.2.2,192.168.1.2,TCP,66,185344,5001  >  47996 [ACK] Seq=1 Ack=489425 Win=185344 Len=0 TSval=551776931 TSecr=456998501
378,4.088245,192.168.2.2,192.168.1.2,TCP,66,185344,5001  >  47996 [ACK] Seq=1 Ack=492321 Win=185344 Len=0 TSval=551776954 TSecr=456998524
380,4.112908,192.168.2.2,192.168.1.2,TCP,66,185344,5001  >  47996 [ACK] Seq=1 Ack=495217 Win=185344 Len=0 TSval=551776979 TSecr=456998549
382,4.136583,192.168.2.2,192.168.1.2,TCP,66,185344,5001  >  47996 [ACK] Seq=1 Ack=498113 Win=185344 Len=0 TSval=551777003 TSecr=456998573
384,4.161921,192.168.2.2,192.168.1.2,TCP,66,185344,5001  >  47996 [ACK] Seq=1 Ack=501009 Win=185344 Len=0 TSval=551777028 TSecr=456998597
387,4.185789,192.168.2.2,192.168.1.2,TCP,66,185344,5001  >  47996 [ACK] Seq=1 Ack=503905 Win=185344 Len=0 TSval=551777052 TSecr=456998621
389,4.222567,192.168.2.2,192.168.1.2,TCP,66,185344,5001  >  47996 [ACK] Seq=1 Ack=508249 Win=185344 Len=0 TSval=551777089 TSecr=456998640
391,4.247006,192.168.2.2,192.168.1.2,TCP,66,185344,5001  >  47996 [ACK] Seq=1 Ack=511145 Win=185344 Len=0 TSval=551777113 TSecr=456998669
393,4.270609,192.168.2.2,192.168.1.2,TCP,66,185344,5001  >  47996 [ACK] Seq=1 Ack=514041 Win=185344 Len=0 TSval=551777137 TSecr=456998694
395,4.295093,192.168.2.2,192.168.1.2,TCP,66,185344,5001  >  47996 [ACK] Seq=1 Ack=516937 Win=185344 Len=0 TSval=551777161 TSecr=456998718
397,4.319599,192.168.2.2,192.168.1.2,TCP,66,185344,5001  >  47996 [ACK] Seq=1 Ack=519833 Win=185344 Len=0 TSval=551777186 TSecr=456998743
399,4.343265,192.168.2.2,192.168.1.2,TCP,66,185344,5001  >  47996 [ACK] Seq=1 Ack=522729 Win=185344 Len=0 TSval=551777209 TSecr=456998767
401,4.367542,192.168.2.2,192.168.1.2,TCP,66,185344,5001  >  47996 [ACK] Seq=1 Ack=525625 Win=185344 Len=0 TSval=551777234 TSecr=456998804
403,4.391703,192.168.2.2,192.168.1.2,TCP,66,185344,5001  >  47996 [ACK] Seq=1 Ack=528521 Win=185344 Len=0 TSval=551777258 TSecr=456998828
405,4.416645,192.168.2.2,192.168.1.2,TCP,66,185344,5001  >  47996 [ACK] Seq=1 Ack=531417 Win=185344 Len=0 TSval=551777283 TSecr=456998852
407,4.440214,192.168.2.2,192.168.1.2,TCP,66,185344,5001  >  47996 [ACK] Seq=1 Ack=534313 Win=185344 Len=0 TSval=551777306 TSecr=456998876
409,4.464599,192.168.2.2,192.168.1.2,TCP,66,185344,5001  >  47996 [ACK] Seq=1 Ack=537209 Win=185344 Len=0 TSval=551777331 TSecr=456998901
412,4.48914,192.168.2.2,192.168.1.2,TCP,66,185344,5001  >  47996 [ACK] Seq=1 Ack=540105 Win=185344 Len=0 TSval=551777355 TSecr=456998924
414,4.513565,192.168.2.2,192.168.1.2,TCP,66,185344,5001  >  47996 [ACK] Seq=1 Ack=543001 Win=185344 Len=0 TSval=551777379 TSecr=456998949
416,4.537181,192.168.2.2,192.168.1.2,TCP,66,185344,5001  >  47996 [ACK] Seq=1 Ack=545897 Win=185344 Len=0 TSval=551777403 TSecr=456998973
418,4.561298,192.168.2.2,192.168.1.2,TCP,66,185344,5001  >  47996 [ACK] Seq=1 Ack=548793 Win=185344 Len=0 TSval=551777427 TSecr=456998998
420,4.585518,192.168.2.2,192.168.1.2,TCP,66,185344,5001  >  47996 [ACK] Seq=1 Ack=551689 Win=185344 Len=0 TSval=551777451 TSecr=456999021
422,4.609909,192.168.2.2,192.168.1.2,TCP,66,185344,5001  >  47996 [ACK] Seq=1 Ack=554585 Win=185344 Len=0 TSval=551777476 TSecr=456999046
424,4.646057,192.168.2.2,192.168.1.2,TCP,66,185344,5001  >  47996 [ACK] Seq=1 Ack=558929 Win=185344 Len=0 TSval=551777512 TSecr=456999046
426,4.670297,192.168.2.2,192.168.1.2,TCP,66,185344,5001  >  47996 [ACK] Seq=1 Ack=561825 Win=185344 Len=0 TSval=551777536 TSecr=456999095
428,4.695554,192.168.2.2,192.168.1.2,TCP,66,185344,5001  >  47996 [ACK] Seq=1 Ack=564721 Win=185344 Len=0 TSval=551777561 TSecr=456999118
430,4.718939,192.168.2.2,192.168.1.2,TCP,66,185344,5001  >  47996 [ACK] Seq=1 Ack=567617 Win=185344 Len=0 TSval=551777585 TSecr=456999142
432,4.743432,192.168.2.2,192.168.1.2,TCP,66,185344,5001  >  47996 [ACK] Seq=1 Ack=570513 Win=185344 Len=0 TSval=551777609 TSecr=456999167
434,4.767183,192.168.2.2,192.168.1.2,TCP,66,185344,5001  >  47996 [ACK] Seq=1 Ack=573409 Win=185344 Len=0 TSval=551777633 TSecr=456999191
436,4.791562,192.168.2.2,192.168.1.2,TCP,66,185344,5001  >  47996 [ACK] Seq=1 Ack=576305 Win=185344 Len=0 TSval=551777657 TSecr=456999227
438,4.816018,192.168.2.2,192.168.1.2,TCP,66,185344,5001  >  47996 [ACK] Seq=1 Ack=579201 Win=185344 Len=0 TSval=551777682 TSecr=456999251
440,4.83998,192.168.2.2,192.168.1.2,TCP,66,185344,5001  >  47996 [ACK] Seq=1 Ack=582097 Win=185344 Len=0 TSval=551777706 TSecr=456999276
442,4.864949,192.168.2.2,192.168.1.2,TCP,66,185344,5001  >  47996 [ACK] Seq=1 Ack=584993 Win=185344 Len=0 TSval=551777731 TSecr=456999300
444,4.888538,192.168.2.2,192.168.1.2,TCP,66,185344,5001  >  47996 [ACK] Seq=1 Ack=587889 Win=185344 Len=0 TSval=551777754 TSecr=456999324
446,4.912966,192.168.2.2,192.168.1.2,TCP,66,185344,5001  >  47996 [ACK] Seq=1 Ack=590785 Win=185344 Len=0 TSval=551777779 TSecr=456999348
448,4.937475,192.168.2.2,192.168.1.2,TCP,66,185344,5001  >  47996 [ACK] Seq=1 Ack=593681 Win=185344 Len=0 TSval=551777803 TSecr=456999373
450,4.961157,192.168.2.2,192.168.1.2,TCP,66,185344,5001  >  47996 [ACK] Seq=1 Ack=596577 Win=185344 Len=0 TSval=551777827 TSecr=456999397
452,4.985477,192.168.2.2,192.168.1.2,TCP,66,185344,5001  >  47996 [ACK] Seq=1 Ack=599473 Win=185344 Len=0 TSval=551777851 TSecr=456999421
454,5.00942,192.168.2.2,192.168.1.2,TCP,66,185344,5001  >  47996 [ACK] Seq=1 Ack=602369 Win=185344 Len=0 TSval=551777875 TSecr=456999446
458,5.03366,192.168.2.2,192.168.1.2,TCP,66,185344,5001  >  47996 [ACK] Seq=1 Ack=605265 Win=185344 Len=0 TSval=551777899 TSecr=456999469
462,5.057876,192.168.2.2,192.168.1.2,TCP,66,185344,5001  >  47996 [ACK] Seq=1 Ack=608161 Win=185344 Len=0 TSval=551777924 TSecr=456999494
464,5.082081,192.168.2.2,192.168.1.2,TCP,66,185344,5001  >  47996 [ACK] Seq=1 Ack=611057 Win=185344 Len=0 TSval=551777948 TSecr=456999518
466,5.107168,192.168.2.2,192.168.1.2,TCP,66,185344,5001  >  47996 [ACK] Seq=1 Ack=613953 Win=185344 Len=0 TSval=551777973 TSecr=456999542
468,5.130606,192.168.2.2,192.168.1.2,TCP,66,185344,5001  >  47996 [ACK] Seq=1 Ack=616849 Win=185344 Len=0 TSval=551777996 TSecr=456999566
470,5.154749,192.168.2.2,192.168.1.2,TCP,66,185344,5001  >  47996 [ACK] Seq=1 Ack=619745 Win=185344 Len=0 TSval=551778020 TSecr=456999590
473,5.191851,192.168.2.2,192.168.1.2,TCP,66,185344,5001  >  47996 [ACK] Seq=1 Ack=624089 Win=185344 Len=0 TSval=551778057 TSecr=456999590
476,5.216828,192.168.2.2,192.168.1.2,TCP,66,185344,5001  >  47996 [ACK] Seq=1 Ack=626985 Win=185344 Len=0 TSval=551778082 TSecr=456999639
478,5.241003,192.168.2.2,192.168.1.2,TCP,66,185344,5001  >  47996 [ACK] Seq=1 Ack=629881 Win=185344 Len=0 TSval=551778107 TSecr=456999663
480,5.265356,192.168.2.2,192.168.1.2,TCP,66,185344,5001  >  47996 [ACK] Seq=1 Ack=632777 Win=185344 Len=0 TSval=551778131 TSecr=456999688
482,5.289877,192.168.2.2,192.168.1.2,TCP,66,185344,5001  >  47996 [ACK] Seq=1 Ack=635673 Win=185344 Len=0 TSval=551778155 TSecr=456999711
484,5.313446,192.168.2.2,192.168.1.2,TCP,66,185344,5001  >  47996 [ACK] Seq=1 Ack=638569 Win=185344 Len=0 TSval=551778179 TSecr=456999735
486,5.337921,192.168.2.2,192.168.1.2,TCP,66,185344,5001  >  47996 [ACK] Seq=1 Ack=641465 Win=185344 Len=0 TSval=551778203 TSecr=456999773
488,5.362429,192.168.2.2,192.168.1.2,TCP,66,185344,5001  >  47996 [ACK] Seq=1 Ack=644361 Win=185344 Len=0 TSval=551778228 TSecr=456999773
490,5.386059,192.168.2.2,192.168.1.2,TCP,66,185344,5001  >  47996 [ACK] Seq=1 Ack=647257 Win=185344 Len=0 TSval=551778252 TSecr=456999798
492,5.410423,192.168.2.2,192.168.1.2,TCP,66,185344,5001  >  47996 [ACK] Seq=1 Ack=650153 Win=185344 Len=0 TSval=551778276 TSecr=456999822
494,5.434938,192.168.2.2,192.168.1.2,TCP,66,185344,5001  >  47996 [ACK] Seq=1 Ack=653049 Win=185344 Len=0 TSval=551778300 TSecr=456999846
496,5.459415,192.168.2.2,192.168.1.2,TCP,66,185344,5001  >  47996 [ACK] Seq=1 Ack=655945 Win=185344 Len=0 TSval=551778325 TSecr=456999871
498,5.483942,192.168.2.2,192.168.1.2,TCP,66,185344,5001  >  47996 [ACK] Seq=1 Ack=658841 Win=185344 Len=0 TSval=551778349 TSecr=456999894
500,5.507718,192.168.2.2,192.168.1.2,TCP,66,185344,5001  >  47996 [ACK] Seq=1 Ack=661737 Win=185344 Len=0 TSval=551778373 TSecr=456999919
502,5.532919,192.168.2.2,192.168.1.2,TCP,66,185344,5001  >  47996 [ACK] Seq=1 Ack=664633 Win=185344 Len=0 TSval=551778398 TSecr=456999943
504,5.556784,192.168.2.2,192.168.1.2,TCP,66,185344,5001  >  47996 [ACK] Seq=1 Ack=667529 Win=185344 Len=0 TSval=551778422 TSecr=456999967
506,5.580376,192.168.2.2,192.168.1.2,TCP,66,185344,5001  >  47996 [ACK] Seq=1 Ack=670425 Win=185344 Len=0 TSval=551778446 TSecr=456999991
508,5.604706,192.168.2.2,192.168.1.2,TCP,66,185344,5001  >  47996 [ACK] Seq=1 Ack=673321 Win=185344 Len=0 TSval=551778470 TSecr=457000015
510,5.628979,192.168.2.2,192.168.1.2,TCP,66,185344,5001  >  47996 [ACK] Seq=1 Ack=676217 Win=185344 Len=0 TSval=551778494 TSecr=457000040
512,5.653451,192.168.2.2,192.168.1.2,TCP,66,185344,5001  >  47996 [ACK] Seq=1 Ack=679113 Win=185344 Len=0 TSval=551778519 TSecr=457000065
514,5.677302,192.168.2.2,192.168.1.2,TCP,66,185344,5001  >  47996 [ACK] Seq=1 Ack=682009 Win=185344 Len=0 TSval=551778543 TSecr=457000088
516,5.702478,192.168.2.2,192.168.1.2,TCP,66,185344,5001  >  47996 [ACK] Seq=1 Ack=684905 Win=185344 Len=0 TSval=551778568 TSecr=457000113
518,5.725707,192.168.2.2,192.168.1.2,TCP,66,185344,5001  >  47996 [ACK] Seq=1 Ack=687801 Win=185344 Len=0 TSval=551778591 TSecr=457000137
520,5.75049,192.168.2.2,192.168.1.2,TCP,66,185344,5001  >  47996 [ACK] Seq=1 Ack=690697 Win=185344 Len=0 TSval=551778616 TSecr=457000161
522,5.78627,192.168.2.2,192.168.1.2,TCP,66,185344,5001  >  47996 [ACK] Seq=1 Ack=695041 Win=185344 Len=0 TSval=551778652 TSecr=457000185
525,5.810501,192.168.2.2,192.168.1.2,TCP,66,185344,5001  >  47996 [ACK] Seq=1 Ack=697937 Win=185344 Len=0 TSval=551778676 TSecr=457000234
527,5.834821,192.168.2.2,192.168.1.2,TCP,66,185344,5001  >  47996 [ACK] Seq=1 Ack=700833 Win=185344 Len=0 TSval=551778700 TSecr=457000258
529,5.859115,192.168.2.2,192.168.1.2,TCP,66,185344,5001  >  47996 [ACK] Seq=1 Ack=703729 Win=185344 Len=0 TSval=551778724 TSecr=457000283
531,5.884303,192.168.2.2,192.168.1.2,TCP,66,185344,5001  >  47996 [ACK] Seq=1 Ack=706625 Win=185344 Len=0 TSval=551778750 TSecr=457000306
533,5.907379,192.168.2.2,192.168.1.2,TCP,66,185344,5001  >  47996 [ACK] Seq=1 Ack=709521 Win=185344 Len=0 TSval=551778773 TSecr=457000331
535,5.93169,192.168.2.2,192.168.1.2,TCP,66,185344,5001  >  47996 [ACK] Seq=1 Ack=712417 Win=185344 Len=0 TSval=551778797 TSecr=457000367
537,5.955875,192.168.2.2,192.168.1.2,TCP,66,185344,5001  >  47996 [ACK] Seq=1 Ack=715313 Win=185344 Len=0 TSval=551778821 TSecr=457000367
539,5.980381,192.168.2.2,192.168.1.2,TCP,66,185344,5001  >  47996 [ACK] Seq=1 Ack=718209 Win=185344 Len=0 TSval=551778846 TSecr=457000391
541,6.004298,192.168.2.2,192.168.1.2,TCP,66,185344,5001  >  47996 [ACK] Seq=1 Ack=721105 Win=185344 Len=0 TSval=551778869 TSecr=457000415
544,6.028529,192.168.2.2,192.168.1.2,TCP,66,185344,5001  >  47996 [ACK] Seq=1 Ack=724001 Win=185344 Len=0 TSval=551778894 TSecr=457000440
546,6.052792,192.168.2.2,192.168.1.2,TCP,66,185344,5001  >  47996 [ACK] Seq=1 Ack=726897 Win=185344 Len=0 TSval=551778918 TSecr=457000465
548,6.076954,192.168.2.2,192.168.1.2,TCP,66,185344,5001  >  47996 [ACK] Seq=1 Ack=729793 Win=185344 Len=0 TSval=551778942 TSecr=457000488
550,6.101884,192.168.2.2,192.168.1.2,TCP,66,185344,5001  >  47996 [ACK] Seq=1 Ack=732689 Win=185344 Len=0 TSval=551778967 TSecr=457000512
552,6.12545,192.168.2.2,192.168.1.2,TCP,66,185344,5001  >  47996 [ACK] Seq=1 Ack=735585 Win=185344 Len=0 TSval=551778991 TSecr=457000536
554,6.149919,192.168.2.2,192.168.1.2,TCP,66,185344,5001  >  47996 [ACK] Seq=1 Ack=738481 Win=185344 Len=0 TSval=551779015 TSecr=457000561
556,6.174423,192.168.2.2,192.168.1.2,TCP,66,185344,5001  >  47996 [ACK] Seq=1 Ack=741377 Win=185344 Len=0 TSval=551779039 TSecr=457000585
559,6.198844,192.168.2.2,192.168.1.2,TCP,66,185344,5001  >  47996 [ACK] Seq=1 Ack=744273 Win=185344 Len=0 TSval=551779064 TSecr=457000609
561,6.223358,192.168.2.2,192.168.1.2,TCP,66,185344,5001  >  47996 [ACK] Seq=1 Ack=747169 Win=185344 Len=0 TSval=551779088 TSecr=457000633
563,6.247993,192.168.2.2,192.168.1.2,TCP,66,185344,5001  >  47996 [ACK] Seq=1 Ack=750065 Win=185344 Len=0 TSval=551779113 TSecr=457000657
565,6.27154,192.168.2.2,192.168.1.2,TCP,66,185344,5001  >  47996 [ACK] Seq=1 Ack=752961 Win=185344 Len=0 TSval=551779137 TSecr=457000682
567,6.295929,192.168.2.2,192.168.1.2,TCP,66,185344,5001  >  47996 [ACK] Seq=1 Ack=755857 Win=185344 Len=0 TSval=551779161 TSecr=457000706
570,6.332087,192.168.2.2,192.168.1.2,TCP,66,185344,5001  >  47996 [ACK] Seq=1 Ack=760201 Win=185344 Len=0 TSval=551779197 TSecr=457000730
573,6.356624,192.168.2.2,192.168.1.2,TCP,66,185344,5001  >  47996 [ACK] Seq=1 Ack=763097 Win=185344 Len=0 TSval=551779222 TSecr=457000779
575,6.381137,192.168.2.2,192.168.1.2,TCP,66,185344,5001  >  47996 [ACK] Seq=1 Ack=765993 Win=185344 Len=0 TSval=551779246 TSecr=457000803
577,6.40489,192.168.2.2,192.168.1.2,TCP,66,185344,5001  >  47996 [ACK] Seq=1 Ack=768889 Win=185344 Len=0 TSval=551779270 TSecr=457000828
579,6.428973,192.168.2.2,192.168.1.2,TCP,66,185344,5001  >  47996 [ACK] Seq=1 Ack=771785 Win=185344 Len=0 TSval=551779294 TSecr=457000852
581,6.453228,192.168.2.2,192.168.1.2,TCP,66,185344,5001  >  47996 [ACK] Seq=1 Ack=774681 Win=185344 Len=0 TSval=551779318 TSecr=457000876
583,6.47743,192.168.2.2,192.168.1.2,TCP,66,185344,5001  >  47996 [ACK] Seq=1 Ack=777577 Win=185344 Len=0 TSval=551779342 TSecr=457000912
585,6.501643,192.168.2.2,192.168.1.2,TCP,66,185344,5001  >  47996 [ACK] Seq=1 Ack=780473 Win=185344 Len=0 TSval=551779367 TSecr=457000912
587,6.526072,192.168.2.2,192.168.1.2,TCP,66,185344,5001  >  47996 [ACK] Seq=1 Ack=783369 Win=185344 Len=0 TSval=551779391 TSecr=457000937
589,6.550271,192.168.2.2,192.168.1.2,TCP,66,185344,5001  >  47996 [ACK] Seq=1 Ack=786265 Win=185344 Len=0 TSval=551779415 TSecr=457000961
591,6.574377,192.168.2.2,192.168.1.2,TCP,66,185344,5001  >  47996 [ACK] Seq=1 Ack=789161 Win=185344 Len=0 TSval=551779439 TSecr=457000985
594,6.598558,192.168.2.2,192.168.1.2,TCP,66,185344,5001  >  47996 [ACK] Seq=1 Ack=792057 Win=185344 Len=0 TSval=551779463 TSecr=457001009
596,6.623767,192.168.2.2,192.168.1.2,TCP,66,185344,5001  >  47996 [ACK] Seq=1 Ack=794953 Win=185344 Len=0 TSval=551779489 TSecr=457001033
598,6.647205,192.168.2.2,192.168.1.2,TCP,66,185344,5001  >  47996 [ACK] Seq=1 Ack=797849 Win=185344 Len=0 TSval=551779512 TSecr=457001058
600,6.671783,192.168.2.2,192.168.1.2,TCP,66,185344,5001  >  47996 [ACK] Seq=1 Ack=800745 Win=185344 Len=0 TSval=551779537 TSecr=457001082
602,6.696297,192.168.2.2,192.168.1.2,TCP,66,185344,5001  >  47996 [ACK] Seq=1 Ack=803641 Win=185344 Len=0 TSval=551779561 TSecr=457001106
604,6.719681,192.168.2.2,192.168.1.2,TCP,66,185344,5001  >  47996 [ACK] Seq=1 Ack=806537 Win=185344 Len=0 TSval=551779584 TSecr=457001130
606,6.743885,192.168.2.2,192.168.1.2,TCP,66,185344,5001  >  47996 [ACK] Seq=1 Ack=809433 Win=185344 Len=0 TSval=551779609 TSecr=457001154
608,6.768778,192.168.2.2,192.168.1.2,TCP,66,185344,5001  >  47996 [ACK] Seq=1 Ack=812329 Win=185344 Len=0 TSval=551779634 TSecr=457001179
610,6.792533,192.168.2.2,192.168.1.2,TCP,66,185344,5001  >  47996 [ACK] Seq=1 Ack=815225 Win=185344 Len=0 TSval=551779657 TSecr=457001204
612,6.816819,192.168.2.2,192.168.1.2,TCP,66,185344,5001  >  47996 [ACK] Seq=1 Ack=818121 Win=185344 Len=0 TSval=551779682 TSecr=457001227
614,6.841339,192.168.2.2,192.168.1.2,TCP,66,185344,5001  >  47996 [ACK] Seq=1 Ack=821017 Win=185344 Len=0 TSval=551779706 TSecr=457001252
617,6.877531,192.168.2.2,192.168.1.2,TCP,66,185344,5001  >  47996 [ACK] Seq=1 Ack=825361 Win=185344 Len=0 TSval=551779742 TSecr=457001276
619,6.902096,192.168.2.2,192.168.1.2,TCP,66,185344,5001  >  47996 [ACK] Seq=1 Ack=828257 Win=185344 Len=0 TSval=551779767 TSecr=457001324
621,6.925579,192.168.2.2,192.168.1.2,TCP,66,185344,5001  >  47996 [ACK] Seq=1 Ack=831153 Win=185344 Len=0 TSval=551779790 TSecr=457001349
623,6.950165,192.168.2.2,192.168.1.2,TCP,66,185344,5001  >  47996 [ACK] Seq=1 Ack=834049 Win=185344 Len=0 TSval=551779815 TSecr=457001372
625,6.974633,192.168.2.2,192.168.1.2,TCP,66,185344,5001  >  47996 [ACK] Seq=1 Ack=836945 Win=185344 Len=0 TSval=551779839 TSecr=457001397
627,6.998244,192.168.2.2,192.168.1.2,TCP,66,185344,5001  >  47996 [ACK] Seq=1 Ack=839841 Win=185344 Len=0 TSval=551779863 TSecr=457001421
629,7.022626,192.168.2.2,192.168.1.2,TCP,66,185344,5001  >  47996 [ACK] Seq=1 Ack=842737 Win=185344 Len=0 TSval=551779887 TSecr=457001421
