No.,Time,Source,Destination,Protocol,Length,Calculated window size,Info
4,0.002076,192.168.2.2,192.168.1.2,TCP,74,28960,"5001  >  48026 [SYN, ACK] Seq=0 Ack=1 Win=28960 Len=0 MSS=1460 SACK_PERM=1 TSval=552176871 TSecr=457398586 WS=512"
7,0.002167,192.168.2.2,192.168.1.2,TCP,66,43520,5001  >  48026 [ACK] Seq=1 Ack=7241 Win=43520 Len=0 TSval=552176871 TSecr=457398586
11,0.051954,192.168.2.2,192.168.1.2,TCP,66,58368,5001  >  48026 [ACK] Seq=1 Ack=14481 Win=58368 Len=0 TSval=552176920 TSecr=457398586
13,0.111743,192.168.2.2,192.168.1.2,TCP,66,72704,5001  >  48026 [ACK] Seq=1 Ack=21721 Win=72704 Len=0 TSval=552176980 TSecr=457398586
15,0.172553,192.168.2.2,192.168.1.2,TCP,66,75776,5001  >  48026 [ACK] Seq=1 Ack=23169 Win=75776 Len=0 TSval=552177041 TSecr=457398599
16,0.184963,192.168.2.2,192.168.1.2,TCP,66,78336,5001  >  48026 [ACK] Seq=1 Ack=24617 Win=78336 Len=0 TSval=552177053 TSecr=457398663
18,0.197059,192.168.2.2,192.168.1.2,TCP,66,81408,5001  >  48026 [ACK] Seq=1 Ack=26065 Win=81408 Len=0 TSval=552177065 TSecr=457398747
20,0.209741,192.168.2.2,192.168.1.2,TCP,66,84480,5001  >  48026 [ACK] Seq=1 Ack=27513 Win=84480 Len=0 TSval=552177078 TSecr=457398768
23,0.221454,192.168.2.2,192.168.1.2,TCP,66,87040,5001  >  48026 [ACK] Seq=1 Ack=28961 Win=87040 Len=0 TSval=552177090 TSecr=457398781
25,0.233478,192.168.2.2,192.168.1.2,TCP,66,90112,5001  >  48026 [ACK] Seq=1 Ack=30409 Win=90112 Len=0 TSval=552177102 TSecr=457398793
27,0.24556,192.168.2.2,192.168.1.2,TCP,66,92672,5001  >  48026 [ACK] Seq=1 Ack=31857 Win=92672 Len=0 TSval=552177114 TSecr=457398793
29,0.257702,192.168.2.2,192.168.1.2,TCP,66,95744,5001  >  48026 [ACK] Seq=1 Ack=33305 Win=95744 Len=0 TSval=552177126 TSecr=457398805
31,0.269759,192.168.2.2,192.168.1.2,TCP,66,98816,5001  >  48026 [ACK] Seq=1 Ack=34753 Win=98816 Len=0 TSval=552177138 TSecr=457398817
33,0.282224,192.168.2.2,192.168.1.2,TCP,66,101376,5001  >  48026 [ACK] Seq=1 Ack=36201 Win=101376 Len=0 TSval=552177151 TSecr=457398829
35,0.293976,192.168.2.2,192.168.1.2,TCP,66,107520,5001  >  48026 [ACK] Seq=1 Ack=39097 Win=107520 Len=0 TSval=552177162 TSecr=457398841
37,0.318571,192.168.2.2,192.168.1.2,TCP,66,110080,5001  >  48026 [ACK] Seq=1 Ack=40545 Win=110080 Len=0 TSval=552177187 TSecr=457398853
39,0.330355,192.168.2.2,192.168.1.2,TCP,66,113152,5001  >  48026 [ACK] Seq=1 Ack=41993 Win=113152 Len=0 TSval=552177199 TSecr=457398866
42,0.342408,192.168.2.2,192.168.1.2,TCP,66,116224,5001  >  48026 [ACK] Seq=1 Ack=43441 Win=116224 Len=0 TSval=552177211 TSecr=457398877
44,0.355495,192.168.2.2,192.168.1.2,TCP,66,121856,5001  >  48026 [ACK] Seq=1 Ack=46337 Win=121856 Len=0 TSval=552177224 TSecr=457398902
46,0.378767,192.168.2.2,192.168.1.2,TCP,66,127488,5001  >  48026 [ACK] Seq=1 Ack=49233 Win=127488 Len=0 TSval=552177247 TSecr=457398914
48,0.40326,192.168.2.2,192.168.1.2,TCP,66,130560,5001  >  48026 [ACK] Seq=1 Ack=50681 Win=130560 Len=0 TSval=552177272 TSecr=457398926
50,0.415083,192.168.2.2,192.168.1.2,TCP,66,136192,5001  >  48026 [ACK] Seq=1 Ack=53577 Win=136192 Len=0 TSval=552177283 TSecr=457398939
52,0.439572,192.168.2.2,192.168.1.2,TCP,66,142336,5001  >  48026 [ACK] Seq=1 Ack=56473 Win=142336 Len=0 TSval=552177308 TSecr=457398962
54,0.463546,192.168.2.2,192.168.1.2,TCP,66,144896,5001  >  48026 [ACK] Seq=1 Ack=57921 Win=144896 Len=0 TSval=552177332 TSecr=457398987
56,0.475667,192.168.2.2,192.168.1.2,TCP,66,151040,5001  >  48026 [ACK] Seq=1 Ack=60817 Win=151040 Len=0 TSval=552177344 TSecr=457398998
58,0.499874,192.168.2.2,192.168.1.2,TCP,66,156672,5001  >  48026 [ACK] Seq=1 Ack=63713 Win=156672 Len=0 TSval=552177368 TSecr=457399023
60,0.524844,192.168.2.2,192.168.1.2,TCP,66,159744,5001  >  48026 [ACK] Seq=1 Ack=65161 Win=159744 Len=0 TSval=552177393 TSecr=457399047
62,0.536551,192.168.2.2,192.168.1.2,TCP,66,165376,5001  >  48026 [ACK] Seq=1 Ack=68057 Win=165376 Len=0 TSval=552177405 TSecr=457399059
64,0.560461,192.168.2.2,192.168.1.2,TCP,66,171008,5001  >  48026 [ACK] Seq=1 Ack=70953 Win=171008 Len=0 TSval=552177429 TSecr=457399083
66,0.584696,192.168.2.2,192.168.1.2,TCP,66,177152,5001  >  48026 [ACK] Seq=1 Ack=73849 Win=177152 Len=0 TSval=552177453 TSecr=457399108
68,0.60917,192.168.2.2,192.168.1.2,TCP,66,182784,5001  >  48026 [ACK] Seq=1 Ack=76745 Win=182784 Len=0 TSval=552177477 TSecr=457399120
70,0.633586,192.168.2.2,192.168.1.2,TCP,66,185344,5001  >  48026 [ACK] Seq=1 Ack=79641 Win=185344 Len=0 TSval=552177502 TSecr=457399144
72,0.657359,192.168.2.2,192.168.1.2,TCP,66,185344,5001  >  48026 [ACK] Seq=1 Ack=82537 Win=185344 Len=0 TSval=552177526 TSecr=457399168
76,0.681562,192.168.2.2,192.168.1.2,TCP,66,185344,5001  >  48026 [ACK] Seq=1 Ack=85433 Win=185344 Len=0 TSval=552177550 TSecr=457399192
78,0.706123,192.168.2.2,192.168.1.2,TCP,66,185856,5001  >  48026 [ACK] Seq=1 Ack=86881 Win=185856 Len=0 TSval=552177574 TSecr=457399217
80,0.717955,192.168.2.2,192.168.1.2,TCP,66,185344,5001  >  48026 [ACK] Seq=1 Ack=89777 Win=185344 Len=0 TSval=552177586 TSecr=457399241
84,0.74212,192.168.2.2,192.168.1.2,TCP,66,185344,5001  >  48026 [ACK] Seq=1 Ack=92673 Win=185344 Len=0 TSval=552177610 TSecr=457399241
86,0.766327,192.168.2.2,192.168.1.2,TCP,66,185344,5001  >  48026 [ACK] Seq=1 Ack=95569 Win=185344 Len=0 TSval=552177634 TSecr=457399265
89,0.793488,192.168.2.2,192.168.1.2,TCP,66,185856,5001  >  48026 [ACK] Seq=1 Ack=97017 Win=185856 Len=0 TSval=552177662 TSecr=457399289
91,0.802668,192.168.2.2,192.168.1.2,TCP,66,185344,5001  >  48026 [ACK] Seq=1 Ack=99913 Win=185344 Len=0 TSval=552177671 TSecr=457399301
93,0.826881,192.168.2.2,192.168.1.2,TCP,66,185344,5001  >  48026 [ACK] Seq=1 Ack=102809 Win=185344 Len=0 TSval=552177695 TSecr=457399325
95,0.851254,192.168.2.2,192.168.1.2,TCP,66,185344,5001  >  48026 [ACK] Seq=1 Ack=105705 Win=185344 Len=0 TSval=552177719 TSecr=457399350
97,0.887449,192.168.2.2,192.168.1.2,TCP,66,185344,5001  >  48026 [ACK] Seq=1 Ack=110049 Win=185344 Len=0 TSval=552177755 TSecr=457399377
99,0.911851,192.168.2.2,192.168.1.2,TCP,66,185344,5001  >  48026 [ACK] Seq=1 Ack=112945 Win=185344 Len=0 TSval=552177780 TSecr=457399410
101,0.937197,192.168.2.2,192.168.1.2,TCP,66,185344,5001  >  48026 [ACK] Seq=1 Ack=115841 Win=185344 Len=0 TSval=552177805 TSecr=457399434
104,0.961509,192.168.2.2,192.168.1.2,TCP,66,185344,5001  >  48026 [ACK] Seq=1 Ack=118737 Win=185344 Len=0 TSval=552177830 TSecr=457399471
106,0.985947,192.168.2.2,192.168.1.2,TCP,66,185344,5001  >  48026 [ACK] Seq=1 Ack=121633 Win=185344 Len=0 TSval=552177854 TSecr=457399495
109,1.010525,192.168.2.2,192.168.1.2,TCP,66,185344,5001  >  48026 [ACK] Seq=1 Ack=124529 Win=185344 Len=0 TSval=552177878 TSecr=457399520
111,1.034078,192.168.2.2,192.168.1.2,TCP,66,185344,5001  >  48026 [ACK] Seq=1 Ack=127425 Win=185344 Len=0 TSval=552177902 TSecr=457399520
113,1.058296,192.168.2.2,192.168.1.2,TCP,66,185344,5001  >  48026 [ACK] Seq=1 Ack=130321 Win=185344 Len=0 TSval=552177926 TSecr=457399545
115,1.082603,192.168.2.2,192.168.1.2,TCP,66,185344,5001  >  48026 [ACK] Seq=1 Ack=133217 Win=185344 Len=0 TSval=552177951 TSecr=457399569
118,1.107509,192.168.2.2,192.168.1.2,TCP,66,185344,5001  >  48026 [ACK] Seq=1 Ack=136113 Win=185344 Len=0 TSval=552177975 TSecr=457399594
120,1.132043,192.168.2.2,192.168.1.2,TCP,66,185344,5001  >  48026 [ACK] Seq=1 Ack=139009 Win=185344 Len=0 TSval=552178000 TSecr=457399617
122,1.155979,192.168.2.2,192.168.1.2,TCP,66,185344,5001  >  48026 [ACK] Seq=1 Ack=141905 Win=185344 Len=0 TSval=552178024 TSecr=457399641
124,1.180232,192.168.2.2,192.168.1.2,TCP,66,185344,5001  >  48026 [ACK] Seq=1 Ack=144801 Win=185344 Len=0 TSval=552178048 TSecr=457399666
126,1.204482,192.168.2.2,192.168.1.2,TCP,66,185344,5001  >  48026 [ACK] Seq=1 Ack=147697 Win=185344 Len=0 TSval=552178072 TSecr=457399691
128,1.229027,192.168.2.2,192.168.1.2,TCP,66,185344,5001  >  48026 [ACK] Seq=1 Ack=150593 Win=185344 Len=0 TSval=552178097 TSecr=457399715
130,1.253555,192.168.2.2,192.168.1.2,TCP,66,185344,5001  >  48026 [ACK] Seq=1 Ack=153489 Win=185344 Len=0 TSval=552178121 TSecr=457399739
132,1.27715,192.168.2.2,192.168.1.2,TCP,66,185344,5001  >  48026 [ACK] Seq=1 Ack=156385 Win=185344 Len=0 TSval=552178145 TSecr=457399763
134,1.30154,192.168.2.2,192.168.1.2,TCP,66,185344,5001  >  48026 [ACK] Seq=1 Ack=159281 Win=185344 Len=0 TSval=552178169 TSecr=457399788
136,1.326019,192.168.2.2,192.168.1.2,TCP,66,185344,5001  >  48026 [ACK] Seq=1 Ack=162177 Win=185344 Len=0 TSval=552178194 TSecr=457399812
138,1.350531,192.168.2.2,192.168.1.2,TCP,66,185344,5001  >  48026 [ACK] Seq=1 Ack=165073 Win=185344 Len=0 TSval=552178218 TSecr=457399837
141,1.375192,192.168.2.2,192.168.1.2,TCP,66,185344,5001  >  48026 [ACK] Seq=1 Ack=167969 Win=185344 Len=0 TSval=552178243 TSecr=457399860
145,1.398953,192.168.2.2,192.168.1.2,TCP,66,185344,5001  >  48026 [ACK] Seq=1 Ack=170865 Win=185344 Len=0 TSval=552178267 TSecr=457399884
147,1.423375,192.168.2.2,192.168.1.2,TCP,66,185344,5001  >  48026 [ACK] Seq=1 Ack=173761 Win=185344 Len=0 TSval=552178291 TSecr=457399909
149,1.447555,192.168.2.2,192.168.1.2,TCP,66,185344,5001  >  48026 [ACK] Seq=1 Ack=176657 Win=185344 Len=0 TSval=552178315 TSecr=457399933
151,1.483743,192.168.2.2,192.168.1.2,TCP,66,185344,5001  >  48026 [ACK] Seq=1 Ack=181001 Win=185344 Len=0 TSval=552178351 TSecr=457399933
154,1.508338,192.168.2.2,192.168.1.2,TCP,66,185344,5001  >  48026 [ACK] Seq=1 Ack=183897 Win=185344 Len=0 TSval=552178376 TSecr=457399982
156,1.532198,192.168.2.2,192.168.1.2,TCP,66,185344,5001  >  48026 [ACK] Seq=1 Ack=186793 Win=185344 Len=0 TSval=552178400 TSecr=457400006
158,1.556441,192.168.2.2,192.168.1.2,TCP,66,185344,5001  >  48026 [ACK] Seq=1 Ack=189689 Win=185344 Len=0 TSval=552178424 TSecr=457400030
160,1.58063,192.168.2.2,192.168.1.2,TCP,66,185344,5001  >  48026 [ACK] Seq=1 Ack=192585 Win=185344 Len=0 TSval=552178448 TSecr=457400067
162,1.616958,192.168.2.2,192.168.1.2,TCP,66,185344,5001  >  48026 [ACK] Seq=1 Ack=196929 Win=185344 Len=0 TSval=552178485 TSecr=457400070
164,1.642084,192.168.2.2,192.168.1.2,TCP,66,185344,5001  >  48026 [ACK] Seq=1 Ack=199825 Win=185344 Len=0 TSval=552178510 TSecr=457400115
166,1.665423,192.168.2.2,192.168.1.2,TCP,66,185344,5001  >  48026 [ACK] Seq=1 Ack=202721 Win=185344 Len=0 TSval=552178533 TSecr=457400139
168,1.690232,192.168.2.2,192.168.1.2,TCP,66,185344,5001  >  48026 [ACK] Seq=1 Ack=205617 Win=185344 Len=0 TSval=552178558 TSecr=457400163
170,1.713844,192.168.2.2,192.168.1.2,TCP,66,185344,5001  >  48026 [ACK] Seq=1 Ack=208513 Win=185344 Len=0 TSval=552178581 TSecr=457400200
172,1.738151,192.168.2.2,192.168.1.2,TCP,66,185344,5001  >  48026 [ACK] Seq=1 Ack=211409 Win=185344 Len=0 TSval=552178606 TSecr=457400225
175,1.762672,192.168.2.2,192.168.1.2,TCP,66,185344,5001  >  48026 [ACK] Seq=1 Ack=214305 Win=185344 Len=0 TSval=552178630 TSecr=457400248
177,1.791172,192.168.2.2,192.168.1.2,TCP,66,185344,5001  >  48026 [ACK] Seq=1 Ack=217201 Win=185344 Len=0 TSval=552178659 TSecr=457400273
179,1.812143,192.168.2.2,192.168.1.2,TCP,66,185344,5001  >  48026 [ACK] Seq=1 Ack=220097 Win=185344 Len=0 TSval=552178680 TSecr=457400297
181,1.834978,192.168.2.2,192.168.1.2,TCP,66,185344,5001  >  48026 [ACK] Seq=1 Ack=222993 Win=185344 Len=0 TSval=552178703 TSecr=457400321
183,1.859694,192.168.2.2,192.168.1.2,TCP,66,185344,5001  >  48026 [ACK] Seq=1 Ack=225889 Win=185344 Len=0 TSval=552178727 TSecr=457400321
185,1.883425,192.168.2.2,192.168.1.2,TCP,66,185344,5001  >  48026 [ACK] Seq=1 Ack=228785 Win=185344 Len=0 TSval=552178751 TSecr=457400345
187,1.907669,192.168.2.2,192.168.1.2,TCP,66,185344,5001  >  48026 [ACK] Seq=1 Ack=231681 Win=185344 Len=0 TSval=552178775 TSecr=457400374
189,1.932278,192.168.2.2,192.168.1.2,TCP,66,185344,5001  >  48026 [ACK] Seq=1 Ack=234577 Win=185344 Len=0 TSval=552178800 TSecr=457400395
191,1.956749,192.168.2.2,192.168.1.2,TCP,66,185344,5001  >  48026 [ACK] Seq=1 Ack=237473 Win=185344 Len=0 TSval=552178824 TSecr=457400418
193,1.980324,192.168.2.2,192.168.1.2,TCP,66,185344,5001  >  48026 [ACK] Seq=1 Ack=240369 Win=185344 Len=0 TSval=552178848 TSecr=457400442
196,2.004712,192.168.2.2,192.168.1.2,TCP,66,185344,5001  >  48026 [ACK] Seq=1 Ack=243265 Win=185344 Len=0 TSval=552178872 TSecr=457400466
198,2.029276,192.168.2.2,192.168.1.2,TCP,66,185344,5001  >  48026 [ACK] Seq=1 Ack=246161 Win=185344 Len=0 TSval=552178897 TSecr=457400490
200,2.053771,192.168.2.2,192.168.1.2,TCP,66,185344,5001  >  48026 [ACK] Seq=1 Ack=249057 Win=185344 Len=0 TSval=552178921 TSecr=457400515
202,2.077796,192.168.2.2,192.168.1.2,TCP,66,185344,5001  >  48026 [ACK] Seq=1 Ack=251953 Win=185344 Len=0 TSval=552178945 TSecr=457400539
204,2.101742,192.168.2.2,192.168.1.2,TCP,66,185344,5001  >  48026 [ACK] Seq=1 Ack=254849 Win=185344 Len=0 TSval=552178969 TSecr=457400563
207,2.126456,192.168.2.2,192.168.1.2,TCP,66,185344,5001  >  48026 [ACK] Seq=1 Ack=257745 Win=185344 Len=0 TSval=552178994 TSecr=457400587
209,2.162781,192.168.2.2,192.168.1.2,TCP,66,185344,5001  >  48026 [ACK] Seq=1 Ack=262089 Win=185344 Len=0 TSval=552179030 TSecr=457400612
212,2.187522,192.168.2.2,192.168.1.2,TCP,66,185344,5001  >  48026 [ACK] Seq=1 Ack=264985 Win=185344 Len=0 TSval=552179055 TSecr=457400660
214,2.211333,192.168.2.2,192.168.1.2,TCP,66,185344,5001  >  48026 [ACK] Seq=1 Ack=267881 Win=185344 Len=0 TSval=552179079 TSecr=457400684
216,2.235561,192.168.2.2,192.168.1.2,TCP,66,185344,5001  >  48026 [ACK] Seq=1 Ack=270777 Win=185344 Len=0 TSval=552179103 TSecr=457400709
218,2.260023,192.168.2.2,192.168.1.2,TCP,66,185344,5001  >  48026 [ACK] Seq=1 Ack=273673 Win=185344 Len=0 TSval=552179127 TSecr=457400745
220,2.284546,192.168.2.2,192.168.1.2,TCP,66,185344,5001  >  48026 [ACK] Seq=1 Ack=276569 Win=185344 Len=0 TSval=552179152 TSecr=457400745
223,2.308124,192.168.2.2,192.168.1.2,TCP,66,185344,5001  >  48026 [ACK] Seq=1 Ack=279465 Win=185344 Len=0 TSval=552179175 TSecr=457400770
225,2.332585,192.168.2.2,192.168.1.2,TCP,66,185344,5001  >  48026 [ACK] Seq=1 Ack=282361 Win=185344 Len=0 TSval=552179200 TSecr=457400794
227,2.357081,192.168.2.2,192.168.1.2,TCP,66,185344,5001  >  48026 [ACK] Seq=1 Ack=285257 Win=185344 Len=0 TSval=552179224 TSecr=457400818
229,2.380805,192.168.2.2,192.168.1.2,TCP,66,185344,5001  >  48026 [ACK] Seq=1 Ack=288153 Win=185344 Len=0 TSval=552179248 TSecr=457400843
231,2.405114,192.168.2.2,192.168.1.2,TCP,66,185344,5001  >  48026 [ACK] Seq=1 Ack=291049 Win=185344 Len=0 TSval=552179272 TSecr=457400867
235,2.441396,192.168.2.2,192.168.1.2,TCP,66,185344,5001  >  48026 [ACK] Seq=1 Ack=295393 Win=185344 Len=0 TSval=552179309 TSecr=457400867
237,2.465942,192.168.2.2,192.168.1.2,TCP,66,185344,5001  >  48026 [ACK] Seq=1 Ack=298289 Win=185344 Len=0 TSval=552179333 TSecr=457400915
239,2.490368,192.168.2.2,192.168.1.2,TCP,66,185344,5001  >  48026 [ACK] Seq=1 Ack=301185 Win=185344 Len=0 TSval=552179358 TSecr=457400939
242,2.514875,192.168.2.2,192.168.1.2,TCP,66,185344,5001  >  48026 [ACK] Seq=1 Ack=304081 Win=185344 Len=0 TSval=552179382 TSecr=457400963
244,2.538383,192.168.2.2,192.168.1.2,TCP,66,185344,5001  >  48026 [ACK] Seq=1 Ack=306977 Win=185344 Len=0 TSval=552179406 TSecr=457400988
246,2.562869,192.168.2.2,192.168.1.2,TCP,66,185344,5001  >  48026 [ACK] Seq=1 Ack=309873 Win=185344 Len=0 TSval=552179430 TSecr=457401024
248,2.587398,192.168.2.2,192.168.1.2,TCP,66,185344,5001  >  48026 [ACK] Seq=1 Ack=312769 Win=185344 Len=0 TSval=552179455 TSecr=457401048
250,2.610926,192.168.2.2,192.168.1.2,TCP,66,185344,5001  >  48026 [ACK] Seq=1 Ack=315665 Win=185344 Len=0 TSval=552179478 TSecr=457401073
252,2.647263,192.168.2.2,192.168.1.2,TCP,66,185344,5001  >  48026 [ACK] Seq=1 Ack=320009 Win=185344 Len=0 TSval=552179514 TSecr=457401086
254,2.67149,192.168.2.2,192.168.1.2,TCP,66,185344,5001  >  48026 [ACK] Seq=1 Ack=322905 Win=185344 Len=0 TSval=552179539 TSecr=457401121
256,2.695751,192.168.2.2,192.168.1.2,TCP,66,185344,5001  >  48026 [ACK] Seq=1 Ack=325801 Win=185344 Len=0 TSval=552179563 TSecr=457401145
258,2.720706,192.168.2.2,192.168.1.2,TCP,66,185344,5001  >  48026 [ACK] Seq=1 Ack=328697 Win=185344 Len=0 TSval=552179588 TSecr=457401170
260,2.744191,192.168.2.2,192.168.1.2,TCP,66,185344,5001  >  48026 [ACK] Seq=1 Ack=331593 Win=185344 Len=0 TSval=552179611 TSecr=457401193
262,2.768392,192.168.2.2,192.168.1.2,TCP,66,185344,5001  >  48026 [ACK] Seq=1 Ack=334489 Win=185344 Len=0 TSval=552179635 TSecr=457401230
264,2.792741,192.168.2.2,192.168.1.2,TCP,66,185344,5001  >  48026 [ACK] Seq=1 Ack=337385 Win=185344 Len=0 TSval=552179660 TSecr=457401254
266,2.817245,192.168.2.2,192.168.1.2,TCP,66,185344,5001  >  48026 [ACK] Seq=1 Ack=340281 Win=185344 Len=0 TSval=552179684 TSecr=457401278
269,2.841711,192.168.2.2,192.168.1.2,TCP,66,185344,5001  >  48026 [ACK] Seq=1 Ack=343177 Win=185344 Len=0 TSval=552179709 TSecr=457401303
271,2.865427,192.168.2.2,192.168.1.2,TCP,66,185344,5001  >  48026 [ACK] Seq=1 Ack=346073 Win=185344 Len=0 TSval=552179732 TSecr=457401326
273,2.889856,192.168.2.2,192.168.1.2,TCP,66,185344,5001  >  48026 [ACK] Seq=1 Ack=348969 Win=185344 Len=0 TSval=552179757 TSecr=457401351
275,2.913725,192.168.2.2,192.168.1.2,TCP,66,185344,5001  >  48026 [ACK] Seq=1 Ack=351865 Win=185344 Len=0 TSval=552179781 TSecr=457401375
277,2.938783,192.168.2.2,192.168.1.2,TCP,66,185344,5001  >  48026 [ACK] Seq=1 Ack=354761 Win=185344 Len=0 TSval=552179806 TSecr=457401399
279,2.962241,192.168.2.2,192.168.1.2,TCP,66,185344,5001  >  48026 [ACK] Seq=1 Ack=357657 Win=185344 Len=0 TSval=552179829 TSecr=457401424
281,2.98639,192.168.2.2,192.168.1.2,TCP,66,185344,5001  >  48026 [ACK] Seq=1 Ack=360553 Win=185344 Len=0 TSval=552179853 TSecr=457401448
285,3.011297,192.168.2.2,192.168.1.2,TCP,66,185344,5001  >  48026 [ACK] Seq=1 Ack=363449 Win=185344 Len=0 TSval=552179878 TSecr=457401472
287,3.035787,192.168.2.2,192.168.1.2,TCP,66,185344,5001  >  48026 [ACK] Seq=1 Ack=366345 Win=185344 Len=0 TSval=552179903 TSecr=457401496
289,3.059285,192.168.2.2,192.168.1.2,TCP,66,185344,5001  >  48026 [ACK] Seq=1 Ack=369241 Win=185344 Len=0 TSval=552179926 TSecr=457401521
291,3.083777,192.168.2.2,192.168.1.2,TCP,66,185344,5001  >  48026 [ACK] Seq=1 Ack=372137 Win=185344 Len=0 TSval=552179951 TSecr=457401544
293,3.10833,192.168.2.2,192.168.1.2,TCP,66,185344,5001  >  48026 [ACK] Seq=1 Ack=375033 Win=185344 Len=0 TSval=552179975 TSecr=457401569
295,3.131885,192.168.2.2,192.168.1.2,TCP,66,185344,5001  >  48026 [ACK] Seq=1 Ack=377929 Win=185344 Len=0 TSval=552179999 TSecr=457401569
298,3.15674,192.168.2.2,192.168.1.2,TCP,66,185344,5001  >  48026 [ACK] Seq=1 Ack=380825 Win=185344 Len=0 TSval=552180024 TSecr=457401593
300,3.18097,192.168.2.2,192.168.1.2,TCP,66,185344,5001  >  48026 [ACK] Seq=1 Ack=383721 Win=185344 Len=0 TSval=552180048 TSecr=457401618
302,3.205236,192.168.2.2,192.168.1.2,TCP,66,185344,5001  >  48026 [ACK] Seq=1 Ack=386617 Win=185344 Len=0 TSval=552180072 TSecr=457401641
304,3.229522,192.168.2.2,192.168.1.2,TCP,66,185344,5001  >  48026 [ACK] Seq=1 Ack=389513 Win=185344 Len=0 TSval=552180096 TSecr=457401666
306,3.254347,192.168.2.2,192.168.1.2,TCP,66,185344,5001  >  48026 [ACK] Seq=1 Ack=392409 Win=185344 Len=0 TSval=552180121 TSecr=457401690
308,3.277887,192.168.2.2,192.168.1.2,TCP,66,185344,5001  >  48026 [ACK] Seq=1 Ack=395305 Win=185344 Len=0 TSval=552180145 TSecr=457401714
310,3.302341,192.168.2.2,192.168.1.2,TCP,66,185344,5001  >  48026 [ACK] Seq=1 Ack=398201 Win=185344 Len=0 TSval=552180169 TSecr=457401739
312,3.326315,192.168.2.2,192.168.1.2,TCP,66,185344,5001  >  48026 [ACK] Seq=1 Ack=401097 Win=185344 Len=0 TSval=552180193 TSecr=457401763
314,3.350551,192.168.2.2,192.168.1.2,TCP,66,185344,5001  >  48026 [ACK] Seq=1 Ack=403993 Win=185344 Len=0 TSval=552180217 TSecr=457401787
316,3.37549,192.168.2.2,192.168.1.2,TCP,66,185344,5001  >  48026 [ACK] Seq=1 Ack=406889 Win=185344 Len=0 TSval=552180242 TSecr=457401812
318,3.40019,192.168.2.2,192.168.1.2,TCP,66,185344,5001  >  48026 [ACK] Seq=1 Ack=409785 Win=185344 Len=0 TSval=552180267 TSecr=457401836
320,3.423376,192.168.2.2,192.168.1.2,TCP,66,185344,5001  >  48026 [ACK] Seq=1 Ack=412681 Win=185344 Len=0 TSval=552180290 TSecr=457401860
322,3.447944,192.168.2.2,192.168.1.2,TCP,66,185344,5001  >  48026 [ACK] Seq=1 Ack=415577 Win=185344 Len=0 TSval=552180315 TSecr=457401884
324,3.47238,192.168.2.2,192.168.1.2,TCP,66,185344,5001  >  48026 [ACK] Seq=1 Ack=418473 Win=185344 Len=0 TSval=552180339 TSecr=457401908
326,3.495903,192.168.2.2,192.168.1.2,TCP,66,185344,5001  >  48026 [ACK] Seq=1 Ack=421369 Win=185344 Len=0 TSval=552180363 TSecr=457401933
328,3.520146,192.168.2.2,192.168.1.2,TCP,66,185344,5001  >  48026 [ACK] Seq=1 Ack=424265 Win=185344 Len=0 TSval=552180387 TSecr=457401957
330,3.545021,192.168.2.2,192.168.1.2,TCP,66,185344,5001  >  48026 [ACK] Seq=1 Ack=427161 Win=185344 Len=0 TSval=552180412 TSecr=457401982
332,3.569425,192.168.2.2,192.168.1.2,TCP,66,185344,5001  >  48026 [ACK] Seq=1 Ack=430057 Win=185344 Len=0 TSval=552180436 TSecr=457402005
334,3.592943,192.168.2.2,192.168.1.2,TCP,66,185344,5001  >  48026 [ACK] Seq=1 Ack=432953 Win=185344 Len=0 TSval=552180460 TSecr=457402030
336,3.617458,192.168.2.2,192.168.1.2,TCP,66,185344,5001  >  48026 [ACK] Seq=1 Ack=435849 Win=185344 Len=0 TSval=552180484 TSecr=457402054
338,3.641237,192.168.2.2,192.168.1.2,TCP,66,185344,5001  >  48026 [ACK] Seq=1 Ack=438745 Win=185344 Len=0 TSval=552180508 TSecr=457402078
340,3.665481,192.168.2.2,192.168.1.2,TCP,66,185344,5001  >  48026 [ACK] Seq=1 Ack=441641 Win=185344 Len=0 TSval=552180532 TSecr=457402102
342,3.689695,192.168.2.2,192.168.1.2,TCP,66,185344,5001  >  48026 [ACK] Seq=1 Ack=444537 Win=185344 Len=0 TSval=552180556 TSecr=457402127
344,3.726247,192.168.2.2,192.168.1.2,TCP,66,185344,5001  >  48026 [ACK] Seq=1 Ack=448881 Win=185344 Len=0 TSval=552180593 TSecr=457402151
347,3.750733,192.168.2.2,192.168.1.2,TCP,66,185344,5001  >  48026 [ACK] Seq=1 Ack=451777 Win=185344 Len=0 TSval=552180617 TSecr=457402199
349,3.774464,192.168.2.2,192.168.1.2,TCP,66,185344,5001  >  48026 [ACK] Seq=1 Ack=454673 Win=185344 Len=0 TSval=552180641 TSecr=457402223
351,3.798761,192.168.2.2,192.168.1.2,TCP,66,185344,5001  >  48026 [ACK] Seq=1 Ack=457569 Win=185344 Len=0 TSval=552180665 TSecr=457402247
353,3.823232,192.168.2.2,192.168.1.2,TCP,66,185344,5001  >  48026 [ACK] Seq=1 Ack=460465 Win=185344 Len=0 TSval=552180690 TSecr=457402271
355,3.847133,192.168.2.2,192.168.1.2,TCP,66,185344,5001  >  48026 [ACK] Seq=1 Ack=463361 Win=185344 Len=0 TSval=552180714 TSecr=457402308
357,3.871374,192.168.2.2,192.168.1.2,TCP,66,185344,5001  >  48026 [ACK] Seq=1 Ack=466257 Win=185344 Len=0 TSval=552180738 TSecr=457402308
359,3.89559,192.168.2.2,192.168.1.2,TCP,66,185344,5001  >  48026 [ACK] Seq=1 Ack=469153 Win=185344 Len=0 TSval=552180762 TSecr=457402332
361,3.92037,192.168.2.2,192.168.1.2,TCP,66,185344,5001  >  48026 [ACK] Seq=1 Ack=472049 Win=185344 Len=0 TSval=552180787 TSecr=457402356
363,3.944096,192.168.2.2,192.168.1.2,TCP,66,185344,5001  >  48026 [ACK] Seq=1 Ack=474945 Win=185344 Len=0 TSval=552180811 TSecr=457402381
365,3.968266,192.168.2.2,192.168.1.2,TCP,66,185344,5001  >  48026 [ACK] Seq=1 Ack=477841 Win=185344 Len=0 TSval=552180835 TSecr=457402405
367,3.992482,192.168.2.2,192.168.1.2,TCP,66,185344,5001  >  48026 [ACK] Seq=1 Ack=480737 Win=185344 Len=0 TSval=552180859 TSecr=457402429
370,4.016851,192.168.2.2,192.168.1.2,TCP,66,185344,5001  >  48026 [ACK] Seq=1 Ack=483633 Win=185344 Len=0 TSval=552180883 TSecr=457402453
372,4.040933,192.168.2.2,192.168.1.2,TCP,66,185344,5001  >  48026 [ACK] Seq=1 Ack=486529 Win=185344 Len=0 TSval=552180907 TSecr=457402477
375,4.065944,192.168.2.2,192.168.1.2,TCP,66,185344,5001  >  48026 [ACK] Seq=1 Ack=489425 Win=185344 Len=0 TSval=552180932 TSecr=457402502
377,4.089367,192.168.2.2,192.168.1.2,TCP,66,185344,5001  >  48026 [ACK] Seq=1 Ack=492321 Win=185344 Len=0 TSval=552180956 TSecr=457402526
379,4.113832,192.168.2.2,192.168.1.2,TCP,66,185344,5001  >  48026 [ACK] Seq=1 Ack=495217 Win=185344 Len=0 TSval=552180980 TSecr=457402550
381,4.138399,192.168.2.2,192.168.1.2,TCP,66,185344,5001  >  48026 [ACK] Seq=1 Ack=498113 Win=185344 Len=0 TSval=552181005 TSecr=457402574
384,4.162827,192.168.2.2,192.168.1.2,TCP,66,185344,5001  >  48026 [ACK] Seq=1 Ack=501009 Win=185344 Len=0 TSval=552181029 TSecr=457402598
386,4.187381,192.168.2.2,192.168.1.2,TCP,66,185344,5001  >  48026 [ACK] Seq=1 Ack=503905 Win=185344 Len=0 TSval=552181054 TSecr=457402623
388,4.22339,192.168.2.2,192.168.1.2,TCP,66,185344,5001  >  48026 [ACK] Seq=1 Ack=508249 Win=185344 Len=0 TSval=552181090 TSecr=457402629
390,4.247613,192.168.2.2,192.168.1.2,TCP,66,185344,5001  >  48026 [ACK] Seq=1 Ack=511145 Win=185344 Len=0 TSval=552181114 TSecr=457402671
392,4.272654,192.168.2.2,192.168.1.2,TCP,66,185344,5001  >  48026 [ACK] Seq=1 Ack=514041 Win=185344 Len=0 TSval=552181139 TSecr=457402695
394,4.296137,192.168.2.2,192.168.1.2,TCP,66,185344,5001  >  48026 [ACK] Seq=1 Ack=516937 Win=185344 Len=0 TSval=552181162 TSecr=457402720
396,4.320643,192.168.2.2,192.168.1.2,TCP,66,185344,5001  >  48026 [ACK] Seq=1 Ack=519833 Win=185344 Len=0 TSval=552181187 TSecr=457402744
398,4.344524,192.168.2.2,192.168.1.2,TCP,66,185344,5001  >  48026 [ACK] Seq=1 Ack=522729 Win=185344 Len=0 TSval=552181211 TSecr=457402769
400,4.368743,192.168.2.2,192.168.1.2,TCP,66,185344,5001  >  48026 [ACK] Seq=1 Ack=525625 Win=185344 Len=0 TSval=552181235 TSecr=457402805
402,4.393161,192.168.2.2,192.168.1.2,TCP,66,185344,5001  >  48026 [ACK] Seq=1 Ack=528521 Win=185344 Len=0 TSval=552181259 TSecr=457402829
404,4.417692,192.168.2.2,192.168.1.2,TCP,66,185344,5001  >  48026 [ACK] Seq=1 Ack=531417 Win=185344 Len=0 TSval=552181284 TSecr=457402854
406,4.441444,192.168.2.2,192.168.1.2,TCP,66,185344,5001  >  48026 [ACK] Seq=1 Ack=534313 Win=185344 Len=0 TSval=552181308 TSecr=457402878
409,4.465669,192.168.2.2,192.168.1.2,TCP,66,185344,5001  >  48026 [ACK] Seq=1 Ack=537209 Win=185344 Len=0 TSval=552181332 TSecr=457402902
411,4.490301,192.168.2.2,192.168.1.2,TCP,66,185344,5001  >  48026 [ACK] Seq=1 Ack=540105 Win=185344 Len=0 TSval=552181357 TSecr=457402926
413,4.514695,192.168.2.2,192.168.1.2,TCP,66,185344,5001  >  48026 [ACK] Seq=1 Ack=543001 Win=185344 Len=0 TSval=552181381 TSecr=457402950
415,4.539217,192.168.2.2,192.168.1.2,TCP,66,185344,5001  >  48026 [ACK] Seq=1 Ack=545897 Win=185344 Len=0 TSval=552181405 TSecr=457402975
418,4.563298,192.168.2.2,192.168.1.2,TCP,66,185344,5001  >  48026 [ACK] Seq=1 Ack=548793 Win=185344 Len=0 TSval=552181429 TSecr=457402999
420,4.586784,192.168.2.2,192.168.1.2,TCP,66,185344,5001  >  48026 [ACK] Seq=1 Ack=551689 Win=185344 Len=0 TSval=552181453 TSecr=457403023
422,4.623991,192.168.2.2,192.168.1.2,TCP,66,185344,5001  >  48026 [ACK] Seq=1 Ack=556033 Win=185344 Len=0 TSval=552181490 TSecr=457403023
424,4.647576,192.168.2.2,192.168.1.2,TCP,66,185344,5001  >  48026 [ACK] Seq=1 Ack=558929 Win=185344 Len=0 TSval=552181514 TSecr=457403072
426,4.671581,192.168.2.2,192.168.1.2,TCP,66,185344,5001  >  48026 [ACK] Seq=1 Ack=561825 Win=185344 Len=0 TSval=552181538 TSecr=457403096
428,4.696517,192.168.2.2,192.168.1.2,TCP,66,185344,5001  >  48026 [ACK] Seq=1 Ack=564721 Win=185344 Len=0 TSval=552181563 TSecr=457403121
430,4.720075,192.168.2.2,192.168.1.2,TCP,66,185344,5001  >  48026 [ACK] Seq=1 Ack=567617 Win=185344 Len=0 TSval=552181586 TSecr=457403145
432,4.744536,192.168.2.2,192.168.1.2,TCP,66,185344,5001  >  48026 [ACK] Seq=1 Ack=570513 Win=185344 Len=0 TSval=552181611 TSecr=457403168
434,4.769044,192.168.2.2,192.168.1.2,TCP,66,185344,5001  >  48026 [ACK] Seq=1 Ack=573409 Win=185344 Len=0 TSval=552181635 TSecr=457403205
436,4.792666,192.168.2.2,192.168.1.2,TCP,66,185344,5001  >  48026 [ACK] Seq=1 Ack=576305 Win=185344 Len=0 TSval=552181659 TSecr=457403229
438,4.81709,192.168.2.2,192.168.1.2,TCP,66,185344,5001  >  48026 [ACK] Seq=1 Ack=579201 Win=185344 Len=0 TSval=552181683 TSecr=457403253
440,4.841742,192.168.2.2,192.168.1.2,TCP,66,185344,5001  >  48026 [ACK] Seq=1 Ack=582097 Win=185344 Len=0 TSval=552181708 TSecr=457403278
442,4.865982,192.168.2.2,192.168.1.2,TCP,66,185344,5001  >  48026 [ACK] Seq=1 Ack=584993 Win=185344 Len=0 TSval=552181732 TSecr=457403301
444,4.88966,192.168.2.2,192.168.1.2,TCP,66,185344,5001  >  48026 [ACK] Seq=1 Ack=587889 Win=185344 Len=0 TSval=552181756 TSecr=457403326
446,4.914069,192.168.2.2,192.168.1.2,TCP,66,185344,5001  >  48026 [ACK] Seq=1 Ack=590785 Win=185344 Len=0 TSval=552181780 TSecr=457403350
448,4.93802,192.168.2.2,192.168.1.2,TCP,66,185344,5001  >  48026 [ACK] Seq=1 Ack=593681 Win=185344 Len=0 TSval=552181804 TSecr=457403374
450,4.96311,192.168.2.2,192.168.1.2,TCP,66,185344,5001  >  48026 [ACK] Seq=1 Ack=596577 Win=185344 Len=0 TSval=552181829 TSecr=457403398
452,4.987008,192.168.2.2,192.168.1.2,TCP,66,185344,5001  >  48026 [ACK] Seq=1 Ack=599473 Win=185344 Len=0 TSval=552181853 TSecr=457403423
456,5.012115,192.168.2.2,192.168.1.2,TCP,66,185344,5001  >  48026 [ACK] Seq=1 Ack=602369 Win=185344 Len=0 TSval=552181878 TSecr=457403447
458,5.035598,192.168.2.2,192.168.1.2,TCP,66,185344,5001  >  48026 [ACK] Seq=1 Ack=605265 Win=185344 Len=0 TSval=552181902 TSecr=457403471
460,5.059682,192.168.2.2,192.168.1.2,TCP,66,185344,5001  >  48026 [ACK] Seq=1 Ack=608161 Win=185344 Len=0 TSval=552181926 TSecr=457403495
464,5.084111,192.168.2.2,192.168.1.2,TCP,66,185344,5001  >  48026 [ACK] Seq=1 Ack=611057 Win=185344 Len=0 TSval=552181950 TSecr=457403519
466,5.108271,192.168.2.2,192.168.1.2,TCP,66,185344,5001  >  48026 [ACK] Seq=1 Ack=613953 Win=185344 Len=0 TSval=552181974 TSecr=457403544
468,5.132616,192.168.2.2,192.168.1.2,TCP,66,185344,5001  >  48026 [ACK] Seq=1 Ack=616849 Win=185344 Len=0 TSval=552181999 TSecr=457403568
471,5.169459,192.168.2.2,192.168.1.2,TCP,66,185344,5001  >  48026 [ACK] Seq=1 Ack=621193 Win=185344 Len=0 TSval=552182035 TSecr=457403568
474,5.193895,192.168.2.2,192.168.1.2,TCP,66,185344,5001  >  48026 [ACK] Seq=1 Ack=624089 Win=185344 Len=0 TSval=552182060 TSecr=457403617
476,5.217955,192.168.2.2,192.168.1.2,TCP,66,185344,5001  >  48026 [ACK] Seq=1 Ack=626985 Win=185344 Len=0 TSval=552182084 TSecr=457403641
478,5.243017,192.168.2.2,192.168.1.2,TCP,66,185344,5001  >  48026 [ACK] Seq=1 Ack=629881 Win=185344 Len=0 TSval=552182109 TSecr=457403665
480,5.266753,192.168.2.2,192.168.1.2,TCP,66,185344,5001  >  48026 [ACK] Seq=1 Ack=632777 Win=185344 Len=0 TSval=552182133 TSecr=457403689
482,5.290947,192.168.2.2,192.168.1.2,TCP,66,185344,5001  >  48026 [ACK] Seq=1 Ack=635673 Win=185344 Len=0 TSval=552182157 TSecr=457403714
484,5.315416,192.168.2.2,192.168.1.2,TCP,66,185344,5001  >  48026 [ACK] Seq=1 Ack=638569 Win=185344 Len=0 TSval=552182181 TSecr=457403751
486,5.339937,192.168.2.2,192.168.1.2,TCP,66,185344,5001  >  48026 [ACK] Seq=1 Ack=641465 Win=185344 Len=0 TSval=552182206 TSecr=457403751
488,5.363593,192.168.2.2,192.168.1.2,TCP,66,185344,5001  >  48026 [ACK] Seq=1 Ack=644361 Win=185344 Len=0 TSval=552182229 TSecr=457403775
490,5.387986,192.168.2.2,192.168.1.2,TCP,66,185344,5001  >  48026 [ACK] Seq=1 Ack=647257 Win=185344 Len=0 TSval=552182254 TSecr=457403799
492,5.412502,192.168.2.2,192.168.1.2,TCP,66,185344,5001  >  48026 [ACK] Seq=1 Ack=650153 Win=185344 Len=0 TSval=552182278 TSecr=457403824
494,5.436974,192.168.2.2,192.168.1.2,TCP,66,185344,5001  >  48026 [ACK] Seq=1 Ack=653049 Win=185344 Len=0 TSval=552182303 TSecr=457403848
496,5.460547,192.168.2.2,192.168.1.2,TCP,66,185344,5001  >  48026 [ACK] Seq=1 Ack=655945 Win=185344 Len=0 TSval=552182326 TSecr=457403872
498,5.485017,192.168.2.2,192.168.1.2,TCP,66,185344,5001  >  48026 [ACK] Seq=1 Ack=658841 Win=185344 Len=0 TSval=552182351 TSecr=457403896
500,5.509538,192.168.2.2,192.168.1.2,TCP,66,185344,5001  >  48026 [ACK] Seq=1 Ack=661737 Win=185344 Len=0 TSval=552182375 TSecr=457403921
502,5.533198,192.168.2.2,192.168.1.2,TCP,66,185344,5001  >  48026 [ACK] Seq=1 Ack=664633 Win=185344 Len=0 TSval=552182399 TSecr=457403945
504,5.558516,192.168.2.2,192.168.1.2,TCP,66,185344,5001  >  48026 [ACK] Seq=1 Ack=667529 Win=185344 Len=0 TSval=552182424 TSecr=457403969
506,5.581619,192.168.2.2,192.168.1.2,TCP,66,185344,5001  >  48026 [ACK] Seq=1 Ack=670425 Win=185344 Len=0 TSval=552182447 TSecr=457403993
508,5.606547,192.168.2.2,192.168.1.2,TCP,66,185344,5001  >  48026 [ACK] Seq=1 Ack=673321 Win=185344 Len=0 TSval=552182472 TSecr=457404018
510,5.630081,192.168.2.2,192.168.1.2,TCP,66,185344,5001  >  48026 [ACK] Seq=1 Ack=676217 Win=185344 Len=0 TSval=552182496 TSecr=457404041
512,5.654289,192.168.2.2,192.168.1.2,TCP,66,185344,5001  >  48026 [ACK] Seq=1 Ack=679113 Win=185344 Len=0 TSval=552182520 TSecr=457404066
514,5.679059,192.168.2.2,192.168.1.2,TCP,66,185344,5001  >  48026 [ACK] Seq=1 Ack=682009 Win=185344 Len=0 TSval=552182545 TSecr=457404090
516,5.703544,192.168.2.2,192.168.1.2,TCP,66,185344,5001  >  48026 [ACK] Seq=1 Ack=684905 Win=185344 Len=0 TSval=552182569 TSecr=457404114
518,5.727061,192.168.2.2,192.168.1.2,TCP,66,185344,5001  >  48026 [ACK] Seq=1 Ack=687801 Win=185344 Len=0 TSval=552182593 TSecr=457404139
520,5.751637,192.168.2.2,192.168.1.2,TCP,66,185344,5001  >  48026 [ACK] Seq=1 Ack=690697 Win=185344 Len=0 TSval=552182617 TSecr=457404162
522,5.791612,192.168.2.2,192.168.1.2,TCP,66,185344,5001  >  48026 [ACK] Seq=1 Ack=695041 Win=185344 Len=0 TSval=552182657 TSecr=457404187
525,5.811861,192.168.2.2,192.168.1.2,TCP,66,185344,5001  >  48026 [ACK] Seq=1 Ack=697937 Win=185344 Len=0 TSval=552182677 TSecr=457404235
527,5.836335,192.168.2.2,192.168.1.2,TCP,66,185344,5001  >  48026 [ACK] Seq=1 Ack=700833 Win=185344 Len=0 TSval=552182702 TSecr=457404260
529,5.860195,192.168.2.2,192.168.1.2,TCP,66,185344,5001  >  48026 [ACK] Seq=1 Ack=703729 Win=185344 Len=0 TSval=552182726 TSecr=457404284
531,5.884427,192.168.2.2,192.168.1.2,TCP,66,185344,5001  >  48026 [ACK] Seq=1 Ack=706625 Win=185344 Len=0 TSval=552182750 TSecr=457404308
533,5.908934,192.168.2.2,192.168.1.2,TCP,66,185344,5001  >  48026 [ACK] Seq=1 Ack=709521 Win=185344 Len=0 TSval=552182774 TSecr=457404332
535,5.933074,192.168.2.2,192.168.1.2,TCP,66,185344,5001  >  48026 [ACK] Seq=1 Ack=712417 Win=185344 Len=0 TSval=552182799 TSecr=457404372
537,5.957141,192.168.2.2,192.168.1.2,TCP,66,185344,5001  >  48026 [ACK] Seq=1 Ack=715313 Win=185344 Len=0 TSval=552182823 TSecr=457404372
539,5.981433,192.168.2.2,192.168.1.2,TCP,66,185344,5001  >  48026 [ACK] Seq=1 Ack=718209 Win=185344 Len=0 TSval=552182847 TSecr=457404393
541,6.005881,192.168.2.2,192.168.1.2,TCP,66,185344,5001  >  48026 [ACK] Seq=1 Ack=721105 Win=185344 Len=0 TSval=552182871 TSecr=457404417
544,6.029791,192.168.2.2,192.168.1.2,TCP,66,185344,5001  >  48026 [ACK] Seq=1 Ack=724001 Win=185344 Len=0 TSval=552182895 TSecr=457404441
546,6.054037,192.168.2.2,192.168.1.2,TCP,66,185344,5001  >  48026 [ACK] Seq=1 Ack=726897 Win=185344 Len=0 TSval=552182919 TSecr=457404465
548,6.078442,192.168.2.2,192.168.1.2,TCP,66,185344,5001  >  48026 [ACK] Seq=1 Ack=729793 Win=185344 Len=0 TSval=552182944 TSecr=457404490
551,6.102423,192.168.2.2,192.168.1.2,TCP,66,185344,5001  >  48026 [ACK] Seq=1 Ack=732689 Win=185344 Len=0 TSval=552182968 TSecr=457404514
553,6.126652,192.168.2.2,192.168.1.2,TCP,66,185344,5001  >  48026 [ACK] Seq=1 Ack=735585 Win=185344 Len=0 TSval=552182992 TSecr=457404538
555,6.151031,192.168.2.2,192.168.1.2,TCP,66,185344,5001  >  48026 [ACK] Seq=1 Ack=738481 Win=185344 Len=0 TSval=552183016 TSecr=457404562
557,6.175128,192.168.2.2,192.168.1.2,TCP,66,185344,5001  >  48026 [ACK] Seq=1 Ack=741377 Win=185344 Len=0 TSval=552183041 TSecr=457404587
560,6.200334,192.168.2.2,192.168.1.2,TCP,66,185344,5001  >  48026 [ACK] Seq=1 Ack=744273 Win=185344 Len=0 TSval=552183066 TSecr=457404610
562,6.224434,192.168.2.2,192.168.1.2,TCP,66,185344,5001  >  48026 [ACK] Seq=1 Ack=747169 Win=185344 Len=0 TSval=552183090 TSecr=457404635
564,6.248558,192.168.2.2,192.168.1.2,TCP,66,185344,5001  >  48026 [ACK] Seq=1 Ack=750065 Win=185344 Len=0 TSval=552183114 TSecr=457404659
566,6.27285,192.168.2.2,192.168.1.2,TCP,66,185344,5001  >  48026 [ACK] Seq=1 Ack=752961 Win=185344 Len=0 TSval=552183138 TSecr=457404683
568,6.297032,192.168.2.2,192.168.1.2,TCP,66,185344,5001  >  48026 [ACK] Seq=1 Ack=755857 Win=185344 Len=0 TSval=552183162 TSecr=457404707
570,6.333353,192.168.2.2,192.168.1.2,TCP,66,185344,5001  >  48026 [ACK] Seq=1 Ack=760201 Win=185344 Len=0 TSval=552183199 TSecr=457404732
573,6.357575,192.168.2.2,192.168.1.2,TCP,66,185344,5001  >  48026 [ACK] Seq=1 Ack=763097 Win=185344 Len=0 TSval=552183223 TSecr=457404781
575,6.382738,192.168.2.2,192.168.1.2,TCP,66,185344,5001  >  48026 [ACK] Seq=1 Ack=765993 Win=185344 Len=0 TSval=552183248 TSecr=457404805
577,6.40626,192.168.2.2,192.168.1.2,TCP,66,185344,5001  >  48026 [ACK] Seq=1 Ack=768889 Win=185344 Len=0 TSval=552183272 TSecr=457404829
579,6.430475,192.168.2.2,192.168.1.2,TCP,66,185344,5001  >  48026 [ACK] Seq=1 Ack=771785 Win=185344 Len=0 TSval=552183296 TSecr=457404853
581,6.454499,192.168.2.2,192.168.1.2,TCP,66,185344,5001  >  48026 [ACK] Seq=1 Ack=774681 Win=185344 Len=0 TSval=552183320 TSecr=457404878
583,6.478793,192.168.2.2,192.168.1.2,TCP,66,185344,5001  >  48026 [ACK] Seq=1 Ack=777577 Win=185344 Len=0 TSval=552183344 TSecr=457404914
585,6.50327,192.168.2.2,192.168.1.2,TCP,66,185344,5001  >  48026 [ACK] Seq=1 Ack=780473 Win=185344 Len=0 TSval=552183369 TSecr=457404914
587,6.527803,192.168.2.2,192.168.1.2,TCP,66,185344,5001  >  48026 [ACK] Seq=1 Ack=783369 Win=185344 Len=0 TSval=552183393 TSecr=457404938
589,6.551473,192.168.2.2,192.168.1.2,TCP,66,185344,5001  >  48026 [ACK] Seq=1 Ack=786265 Win=185344 Len=0 TSval=552183417 TSecr=457404963
591,6.575834,192.168.2.2,192.168.1.2,TCP,66,185344,5001  >  48026 [ACK] Seq=1 Ack=789161 Win=185344 Len=0 TSval=552183441 TSecr=457404987
593,6.599816,192.168.2.2,192.168.1.2,TCP,66,185344,5001  >  48026 [ACK] Seq=1 Ack=792057 Win=185344 Len=0 TSval=552183465 TSecr=457405011
595,6.624796,192.168.2.2,192.168.1.2,TCP,66,185344,5001  >  48026 [ACK] Seq=1 Ack=794953 Win=185344 Len=0 TSval=552183490 TSecr=457405035
597,6.648355,192.168.2.2,192.168.1.2,TCP,66,185344,5001  >  48026 [ACK] Seq=1 Ack=797849 Win=185344 Len=0 TSval=552183514 TSecr=457405059
599,6.672489,192.168.2.2,192.168.1.2,TCP,66,185344,5001  >  48026 [ACK] Seq=1 Ack=800745 Win=185344 Len=0 TSval=552183538 TSecr=457405084
601,6.696714,192.168.2.2,192.168.1.2,TCP,66,185344,5001  >  48026 [ACK] Seq=1 Ack=803641 Win=185344 Len=0 TSval=552183562 TSecr=457405108
603,6.722394,192.168.2.2,192.168.1.2,TCP,66,185344,5001  >  48026 [ACK] Seq=1 Ack=806537 Win=185344 Len=0 TSval=552183588 TSecr=457405132
605,6.74536,192.168.2.2,192.168.1.2,TCP,66,185344,5001  >  48026 [ACK] Seq=1 Ack=809433 Win=185344 Len=0 TSval=552183610 TSecr=457405156
607,6.769867,192.168.2.2,192.168.1.2,TCP,66,185344,5001  >  48026 [ACK] Seq=1 Ack=812329 Win=185344 Len=0 TSval=552183635 TSecr=457405180
609,6.793872,192.168.2.2,192.168.1.2,TCP,66,185344,5001  >  48026 [ACK] Seq=1 Ack=815225 Win=185344 Len=0 TSval=552183659 TSecr=457405205
611,6.817857,192.168.2.2,192.168.1.2,TCP,66,185344,5001  >  48026 [ACK] Seq=1 Ack=818121 Win=185344 Len=0 TSval=552183683 TSecr=457405229
613,6.842458,192.168.2.2,192.168.1.2,TCP,66,185344,5001  >  48026 [ACK] Seq=1 Ack=821017 Win=185344 Len=0 TSval=552183708 TSecr=457405253
616,6.878732,192.168.2.2,192.168.1.2,TCP,66,185344,5001  >  48026 [ACK] Seq=1 Ack=825361 Win=185344 Len=0 TSval=552183744 TSecr=457405277
618,6.903157,192.168.2.2,192.168.1.2,TCP,66,185344,5001  >  48026 [ACK] Seq=1 Ack=828257 Win=185344 Len=0 TSval=552183768 TSecr=457405326
620,6.926916,192.168.2.2,192.168.1.2,TCP,66,185344,5001  >  48026 [ACK] Seq=1 Ack=831153 Win=185344 Len=0 TSval=552183792 TSecr=457405350
622,6.951252,192.168.2.2,192.168.1.2,TCP,66,185344,5001  >  48026 [ACK] Seq=1 Ack=834049 Win=185344 Len=0 TSval=552183816 TSecr=457405374
624,6.975291,192.168.2.2,192.168.1.2,TCP,66,185344,5001  >  48026 [ACK] Seq=1 Ack=836945 Win=185344 Len=0 TSval=552183840 TSecr=457405398
626,6.999729,192.168.2.2,192.168.1.2,TCP,66,185344,5001  >  48026 [ACK] Seq=1 Ack=839841 Win=185344 Len=0 TSval=552183865 TSecr=457405423
629,7.023739,192.168.2.2,192.168.1.2,TCP,66,185344,5001  >  48026 [ACK] Seq=1 Ack=842737 Win=185344 Len=0 TSval=552183889 TSecr=457405423
