"No.","Time","Source","Destination","Protocol","Length","Calculated window size","Info"
"4","0.002532","192.168.2.2","192.168.1.2","TCP","74","43440","5001  >  45658 [SYN, ACK] Seq=0 Ack=1 Win=43440 Len=0 MSS=1460 SACK_PERM=1 TSval=2321244874 TSecr=787873046 WS=512"
"7","0.002590","192.168.2.2","192.168.1.2","TCP","66","39936","5001  >  45658 [ACK] Seq=1 Ack=7241 Win=39936 Len=0 TSval=2321244874 TSecr=787873046"
"12","0.051585","192.168.2.2","192.168.1.2","TCP","66","38400","5001  >  45658 [ACK] Seq=1 Ack=17377 Win=38400 Len=0 TSval=2321244923 TSecr=787873047"
"15","0.136845","192.168.2.2","192.168.1.2","TCP","66","38400","5001  >  45658 [ACK] Seq=1 Ack=27513 Win=38400 Len=0 TSval=2321245009 TSecr=787873048"
"19","0.221079","192.168.2.2","192.168.1.2","TCP","66","42496","5001  >  45658 [ACK] Seq=1 Ack=28961 Win=42496 Len=0 TSval=2321245093 TSecr=787873049"
"21","0.233122","192.168.2.2","192.168.1.2","TCP","66","42496","5001  >  45658 [ACK] Seq=1 Ack=30409 Win=42496 Len=0 TSval=2321245105 TSecr=787873062"
"24","0.245574","192.168.2.2","192.168.1.2","TCP","66","35328","5001  >  45658 [ACK] Seq=1 Ack=46337 Win=35328 Len=0 TSval=2321245117 TSecr=787873095"
"28","0.378851","192.168.2.2","192.168.1.2","TCP","66","41984","5001  >  45658 [ACK] Seq=1 Ack=49233 Win=41984 Len=0 TSval=2321245251 TSecr=787873122"
"30","0.403426","192.168.2.2","192.168.1.2","TCP","66","45568","5001  >  45658 [ACK] Seq=1 Ack=50681 Win=45568 Len=0 TSval=2321245275 TSecr=787873181"
"32","0.415542","192.168.2.2","192.168.1.2","TCP","66","75776","5001  >  45658 [ACK] Seq=1 Ack=65913 Win=75776 Len=0 TSval=2321245287 TSecr=787873181"
"35","0.543391","192.168.2.2","192.168.1.2","TCP","78","75776","[TCP Dup ACK 32#1] 5001  >  45658 [ACK] Seq=1 Ack=65913 Win=75776 Len=0 TSval=2321245415 TSecr=787873234 SLE=65161 SRE=65913"
"37","0.550249","192.168.2.2","192.168.1.2","TCP","66","84480","5001  >  45658 [ACK] Seq=1 Ack=70257 Win=84480 Len=0 TSval=2321245422 TSecr=787873265"
"39","0.586504","192.168.2.2","192.168.1.2","TCP","66","87552","5001  >  45658 [ACK] Seq=1 Ack=71705 Win=87552 Len=0 TSval=2321245458 TSecr=787873277"
"41","0.598303","192.168.2.2","192.168.1.2","TCP","66","90112","5001  >  45658 [ACK] Seq=1 Ack=72401 Win=90112 Len=0 TSval=2321245470 TSecr=787873277"
"43","0.604304","192.168.2.2","192.168.1.2","TCP","66","93184","5001  >  45658 [ACK] Seq=1 Ack=81089 Win=93184 Len=0 TSval=2321245476 TSecr=787873289"
"45","0.676988","192.168.2.2","192.168.1.2","TCP","66","93184","5001  >  45658 [ACK] Seq=1 Ack=89777 Win=93184 Len=0 TSval=2321245549 TSecr=787873423"
"49","0.750079","192.168.2.2","192.168.1.2","TCP","66","95232","5001  >  45658 [ACK] Seq=1 Ack=94121 Win=95232 Len=0 TSval=2321245622 TSecr=787873447"
"51","0.786351","192.168.2.2","192.168.1.2","TCP","66","86528","5001  >  45658 [ACK] Seq=1 Ack=115841 Win=86528 Len=0 TSval=2321245658 TSecr=787873459"
"55","0.967816","192.168.2.2","192.168.1.2","TCP","66","86528","5001  >  45658 [ACK] Seq=1 Ack=137561 Win=86528 Len=0 TSval=2321245839 TSecr=787873459"
"58","1.149759","192.168.2.2","192.168.1.2","TCP","66","101376","5001  >  45658 [ACK] Seq=1 Ack=140457 Win=101376 Len=0 TSval=2321246021 TSecr=787873587"
"60","1.174226","192.168.2.2","192.168.1.2","TCP","66","127488","5001  >  45658 [ACK] Seq=1 Ack=153489 Win=127488 Len=0 TSval=2321246046 TSecr=787873594"
"63","1.282967","192.168.2.2","192.168.1.2","TCP","66","135680","5001  >  45658 [ACK] Seq=1 Ack=157833 Win=135680 Len=0 TSval=2321246155 TSecr=787873630"
"68","1.318905","192.168.2.2","192.168.1.2","TCP","66","138752","5001  >  45658 [ACK] Seq=1 Ack=159281 Win=138752 Len=0 TSval=2321246191 TSecr=787873642"
"70","1.331012","192.168.2.2","192.168.1.2","TCP","66","168960","5001  >  45658 [ACK] Seq=1 Ack=174273 Win=168960 Len=0 TSval=2321246203 TSecr=787873648"
"73","1.457332","192.168.2.2","192.168.1.2","TCP","66","180224","5001  >  45658 [ACK] Seq=1 Ack=180065 Win=180224 Len=0 TSval=2321246329 TSecr=787873721"
"75","1.505402","192.168.2.2","192.168.1.2","TCP","66","183296","5001  >  45658 [ACK] Seq=1 Ack=181001 Win=183296 Len=0 TSval=2321246377 TSecr=787873721"
"77","1.513333","192.168.2.2","192.168.1.2","TCP","66","197632","5001  >  45658 [ACK] Seq=1 Ack=188241 Win=197632 Len=0 TSval=2321246385 TSecr=787873794"
"80","1.573880","192.168.2.2","192.168.1.2","TCP","66","223744","5001  >  45658 [ACK] Seq=1 Ack=201273 Win=223744 Len=0 TSval=2321246446 TSecr=787873830"
"82","1.682996","192.168.2.2","192.168.1.2","TCP","66","226816","5001  >  45658 [ACK] Seq=1 Ack=202721 Win=226816 Len=0 TSval=2321246555 TSecr=787874012"
"86","1.696971","192.168.2.2","192.168.1.2","TCP","66","270336","5001  >  45658 [ACK] Seq=1 Ack=224441 Win=270336 Len=0 TSval=2321246569 TSecr=787874193"
"91","1.878654","192.168.2.2","192.168.1.2","TCP","66","304640","5001  >  45658 [ACK] Seq=1 Ack=246161 Win=304640 Len=0 TSval=2321246750 TSecr=787874218"
"95","2.060729","192.168.2.2","192.168.1.2","TCP","66","304640","5001  >  45658 [ACK] Seq=1 Ack=267881 Win=304640 Len=0 TSval=2321246932 TSecr=787874218"
"97","2.242963","192.168.2.2","192.168.1.2","TCP","66","304640","5001  >  45658 [ACK] Seq=1 Ack=289601 Win=304640 Len=0 TSval=2321247115 TSecr=787874327"
"100","2.424167","192.168.2.2","192.168.1.2","TCP","66","310784","5001  >  45658 [ACK] Seq=1 Ack=292497 Win=310784 Len=0 TSval=2321247296 TSecr=787874350"
"102","2.447923","192.168.2.2","192.168.1.2","TCP","66","319488","5001  >  45658 [ACK] Seq=1 Ack=296841 Win=319488 Len=0 TSval=2321247320 TSecr=787874363"
"104","2.484933","192.168.2.2","192.168.1.2","TCP","66","348160","5001  >  45658 [ACK] Seq=1 Ack=311321 Win=348160 Len=0 TSval=2321247357 TSecr=787874375"
"106","2.605411","192.168.2.2","192.168.1.2","TCP","66","391680","5001  >  45658 [ACK] Seq=1 Ack=333041 Win=391680 Len=0 TSval=2321247477 TSecr=787874375"
"108","2.787583","192.168.2.2","192.168.1.2","TCP","66","435200","5001  >  45658 [ACK] Seq=1 Ack=354761 Win=435200 Len=0 TSval=2321247659 TSecr=787874501"
"111","2.969799","192.168.2.2","192.168.1.2","TCP","66","454144","5001  >  45658 [ACK] Seq=1 Ack=364297 Win=454144 Len=0 TSval=2321247841 TSecr=787874549"
"114","3.049091","192.168.2.2","192.168.1.2","TCP","66","477184","5001  >  45658 [ACK] Seq=1 Ack=375881 Win=477184 Len=0 TSval=2321247921 TSecr=787874557"
"116","3.145614","192.168.2.2","192.168.1.2","TCP","66","480256","5001  >  45658 [ACK] Seq=1 Ack=376481 Win=480256 Len=0 TSval=2321248017 TSecr=787874557"
"118","3.150954","192.168.2.2","192.168.1.2","TCP","66","481280","5001  >  45658 [ACK] Seq=1 Ack=398201 Win=481280 Len=0 TSval=2321248023 TSecr=787874618"
"120","3.333153","192.168.2.2","192.168.1.2","TCP","66","483840","5001  >  45658 [ACK] Seq=1 Ack=415577 Win=483840 Len=0 TSval=2321248205 TSecr=787874727"
"122","3.478148","192.168.2.2","192.168.1.2","TCP","66","489984","5001  >  45658 [ACK] Seq=1 Ack=419921 Win=489984 Len=0 TSval=2321248350 TSecr=787874741"
"124","3.514414","192.168.2.2","192.168.1.2","TCP","66","483840","5001  >  45658 [ACK] Seq=1 Ack=437297 Win=483840 Len=0 TSval=2321248386 TSecr=787874863"
"126","3.659704","192.168.2.2","192.168.1.2","TCP","66","489984","5001  >  45658 [ACK] Seq=1 Ack=441641 Win=489984 Len=0 TSval=2321248531 TSecr=787874922"
"129","3.697498","192.168.2.2","192.168.1.2","TCP","66","492032","5001  >  45658 [ACK] Seq=1 Ack=463361 Win=492032 Len=0 TSval=2321248569 TSecr=787875104"
"131","3.879795","192.168.2.2","192.168.1.2","TCP","66","492032","5001  >  45658 [ACK] Seq=1 Ack=485081 Win=492032 Len=0 TSval=2321248751 TSecr=787875287"
"134","4.060980","192.168.2.2","192.168.1.2","TCP","66","494080","5001  >  45658 [ACK] Seq=1 Ack=502457 Win=494080 Len=0 TSval=2321248933 TSecr=787875375"
"136","4.206925","192.168.2.2","192.168.1.2","TCP","66","499712","5001  >  45658 [ACK] Seq=1 Ack=505353 Win=499712 Len=0 TSval=2321249079 TSecr=787875468"
"138","4.230415","192.168.2.2","192.168.1.2","TCP","66","501760","5001  >  45658 [ACK] Seq=1 Ack=506801 Win=501760 Len=0 TSval=2321249102 TSecr=787875492"
"140","4.243171","192.168.2.2","192.168.1.2","TCP","66","494080","5001  >  45658 [ACK] Seq=1 Ack=524177 Win=494080 Len=0 TSval=2321249115 TSecr=787875529"
"143","4.388169","192.168.2.2","192.168.1.2","TCP","66","500736","5001  >  45658 [ACK] Seq=1 Ack=528521 Win=500736 Len=0 TSval=2321249260 TSecr=787875649"
"145","4.424199","192.168.2.2","192.168.1.2","TCP","66","492032","5001  >  45658 [ACK] Seq=1 Ack=550241 Win=492032 Len=0 TSval=2321249296 TSecr=787875831"
"147","4.606607","192.168.2.2","192.168.1.2","TCP","66","494080","5001  >  45658 [ACK] Seq=1 Ack=567617 Win=494080 Len=0 TSval=2321249478 TSecr=787875886"
"149","4.751217","192.168.2.2","192.168.1.2","TCP","66","497664","5001  >  45658 [ACK] Seq=1 Ack=577753 Win=497664 Len=0 TSval=2321249623 TSecr=787876014"
"152","4.836828","192.168.2.2","192.168.1.2","TCP","66","501760","5001  >  45658 [ACK] Seq=1 Ack=589337 Win=501760 Len=0 TSval=2321249709 TSecr=787876093"
"154","4.946526","192.168.2.2","192.168.1.2","TCP","66","501760","5001  >  45658 [ACK] Seq=1 Ack=595129 Win=501760 Len=0 TSval=2321249818 TSecr=787876189"
"156","4.982795","192.168.2.2","192.168.1.2","TCP","66","501760","5001  >  45658 [ACK] Seq=1 Ack=629881 Win=501760 Len=0 TSval=2321249854 TSecr=787876377"
"161","5.272916","192.168.2.2","192.168.1.2","TCP","66","500736","5001  >  45658 [ACK] Seq=1 Ack=634225 Win=500736 Len=0 TSval=2321250145 TSecr=787876522"
"163","5.309913","192.168.2.2","192.168.1.2","TCP","66","499712","5001  >  45658 [ACK] Seq=1 Ack=640017 Win=499712 Len=0 TSval=2321250182 TSecr=787876558"
"165","5.357644","192.168.2.2","192.168.1.2","TCP","66","494592","5001  >  45658 [ACK] Seq=1 Ack=655945 Win=494592 Len=0 TSval=2321250229 TSecr=787876703"
"169","5.491133","192.168.2.2","192.168.1.2","TCP","66","492032","5001  >  45658 [ACK] Seq=1 Ack=677665 Win=492032 Len=0 TSval=2321250363 TSecr=787876741"
"171","5.672539","192.168.2.2","192.168.1.2","TCP","66","516608","5001  >  45658 [ACK] Seq=1 Ack=684905 Win=516608 Len=0 TSval=2321250544 TSecr=787876924"
"174","5.733851","192.168.2.2","192.168.1.2","TCP","66","580096","5001  >  45658 [ACK] Seq=1 Ack=716761 Win=580096 Len=0 TSval=2321250606 TSecr=787877105"
"178","6.000549","192.168.2.2","192.168.1.2","TCP","66","585728","5001  >  45658 [ACK] Seq=1 Ack=719657 Win=585728 Len=0 TSval=2321250872 TSecr=787877251"
"181","6.025010","192.168.2.2","192.168.1.2","TCP","66","588800","5001  >  45658 [ACK] Seq=1 Ack=721105 Win=588800 Len=0 TSval=2321250897 TSecr=787877274"
"183","6.036711","192.168.2.2","192.168.1.2","TCP","66","606208","5001  >  45658 [ACK] Seq=1 Ack=729793 Win=606208 Len=0 TSval=2321250908 TSecr=787877287"
"185","6.109333","192.168.2.2","192.168.1.2","TCP","66","623616","5001  >  45658 [ACK] Seq=1 Ack=738481 Win=623616 Len=0 TSval=2321250981 TSecr=787877422"
"187","6.182016","192.168.2.2","192.168.1.2","TCP","66","632320","5001  >  45658 [ACK] Seq=1 Ack=742825 Win=632320 Len=0 TSval=2321251054 TSecr=787877432"
"189","6.218954","192.168.2.2","192.168.1.2","TCP","66","675840","5001  >  45658 [ACK] Seq=1 Ack=764545 Win=675840 Len=0 TSval=2321251091 TSecr=787877468"
"191","6.400190","192.168.2.2","192.168.1.2","TCP","66","695808","5001  >  45658 [ACK] Seq=1 Ack=774681 Win=695808 Len=0 TSval=2321251272 TSecr=787877650"
"193","6.484806","192.168.2.2","192.168.1.2","TCP","66","730624","5001  >  45658 [ACK] Seq=1 Ack=792057 Win=730624 Len=0 TSval=2321251356 TSecr=787877795"
"195","6.630421","192.168.2.2","192.168.1.2","TCP","66","753664","5001  >  45658 [ACK] Seq=1 Ack=803641 Win=753664 Len=0 TSval=2321251502 TSecr=787877881"
"197","6.727616","192.168.2.2","192.168.1.2","TCP","66","765440","5001  >  45658 [ACK] Seq=1 Ack=809433 Win=765440 Len=0 TSval=2321251599 TSecr=787877990"
"199","6.776337","192.168.2.2","192.168.1.2","TCP","66","785920","5001  >  45658 [ACK] Seq=1 Ack=819569 Win=785920 Len=0 TSval=2321251648 TSecr=787878027"
"202","6.861940","192.168.2.2","192.168.1.2","TCP","66","843776","5001  >  45658 [ACK] Seq=1 Ack=848529 Win=843776 Len=0 TSval=2321251734 TSecr=787878317"
"206","7.104502","192.168.2.2","192.168.1.2","TCP","66","855040","5001  >  45658 [ACK] Seq=1 Ack=854321 Win=855040 Len=0 TSval=2321251976 TSecr=787878354"
"208","7.153447","192.168.2.2","192.168.1.2","TCP","66","878592","5001  >  45658 [ACK] Seq=1 Ack=865905 Win=878592 Len=0 TSval=2321252025 TSecr=787878401"
"210","7.250399","192.168.2.2","192.168.1.2","TCP","66","887296","5001  >  45658 [ACK] Seq=1 Ack=870249 Win=887296 Len=0 TSval=2321252122 TSecr=787878455"
"212","7.285887","192.168.2.2","192.168.1.2","TCP","66","930816","5001  >  45658 [ACK] Seq=1 Ack=891969 Win=930816 Len=0 TSval=2321252158 TSecr=787878535"
"215","7.467863","192.168.2.2","192.168.1.2","TCP","66","945152","5001  >  45658 [ACK] Seq=1 Ack=899209 Win=945152 Len=0 TSval=2321252340 TSecr=787878716"
"217","7.528780","192.168.2.2","192.168.1.2","TCP","66","971264","5001  >  45658 [ACK] Seq=1 Ack=912241 Win=971264 Len=0 TSval=2321252400 TSecr=787878778"
"219","7.637365","192.168.2.2","192.168.1.2","TCP","66","1005056","5001  >  45658 [ACK] Seq=1 Ack=931065 Win=1005056 Len=0 TSval=2321252509 TSecr=787878958"
"221","7.795057","192.168.2.2","192.168.1.2","TCP","66","1011200","5001  >  45658 [ACK] Seq=1 Ack=933961 Win=1011200 Len=0 TSval=2321252667 TSecr=787879044"
"224","7.819610","192.168.2.2","192.168.1.2","TCP","66","1013760","5001  >  45658 [ACK] Seq=1 Ack=935409 Win=1013760 Len=0 TSval=2321252691 TSecr=787879069"
"226","7.831711","192.168.2.2","192.168.1.2","TCP","66","1010176","5001  >  45658 [ACK] Seq=1 Ack=944097 Win=1010176 Len=0 TSval=2321252703 TSecr=787879080"
"228","7.904392","192.168.2.2","192.168.1.2","TCP","66","1010176","5001  >  45658 [ACK] Seq=1 Ack=952785 Win=1010176 Len=0 TSval=2321252776 TSecr=787879153"
"230","7.982342","192.168.2.2","192.168.1.2","TCP","66","1012736","5001  >  45658 [ACK] Seq=1 Ack=957129 Win=1012736 Len=0 TSval=2321252854 TSecr=787879226"
"233","8.013786","192.168.2.2","192.168.1.2","TCP","66","1013760","5001  >  45658 [ACK] Seq=1 Ack=958577 Win=1013760 Len=0 TSval=2321252885 TSecr=787879263"
"235","8.026247","192.168.2.2","192.168.1.2","TCP","66","999424","5001  >  45658 [ACK] Seq=1 Ack=988985 Win=999424 Len=0 TSval=2321252898 TSecr=787879444"
"237","8.280289","192.168.2.2","192.168.1.2","TCP","66","1006592","5001  >  45658 [ACK] Seq=1 Ack=1004913 Win=1006592 Len=0 TSval=2321253152 TSecr=787879529"
"239","8.414131","192.168.2.2","192.168.1.2","TCP","66","1008128","5001  >  45658 [ACK] Seq=1 Ack=1017945 Win=1008128 Len=0 TSval=2321253286 TSecr=787879674"
"241","8.522865","192.168.2.2","192.168.1.2","TCP","66","1011712","5001  >  45658 [ACK] Seq=1 Ack=1023737 Win=1011712 Len=0 TSval=2321253395 TSecr=787879771"
"243","8.570890","192.168.2.2","192.168.1.2","TCP","66","1009664","5001  >  45658 [ACK] Seq=1 Ack=1033873 Win=1009664 Len=0 TSval=2321253443 TSecr=787879820"
"245","8.656084","192.168.2.2","192.168.1.2","TCP","66","1006080","5001  >  45658 [ACK] Seq=1 Ack=1051249 Win=1006080 Len=0 TSval=2321253528 TSecr=787879906"
"247","8.801044","192.168.2.2","192.168.1.2","TCP","66","1008640","5001  >  45658 [ACK] Seq=1 Ack=1062833 Win=1008640 Len=0 TSval=2321253673 TSecr=787879983"
"250","8.898706","192.168.2.2","192.168.1.2","TCP","66","1011712","5001  >  45658 [ACK] Seq=1 Ack=1068625 Win=1011712 Len=0 TSval=2321253770 TSecr=787880148"
"252","8.947972","192.168.2.2","192.168.1.2","TCP","66","1008640","5001  >  45658 [ACK] Seq=1 Ack=1080209 Win=1008640 Len=0 TSval=2321253820 TSecr=787880197"
"255","9.044990","192.168.2.2","192.168.1.2","TCP","66","1012736","5001  >  45658 [ACK] Seq=1 Ack=1084553 Win=1012736 Len=0 TSval=2321253917 TSecr=787880294"
"257","9.081189","192.168.2.2","192.168.1.2","TCP","66","1008128","5001  >  45658 [ACK] Seq=1 Ack=1097585 Win=1008128 Len=0 TSval=2321253953 TSecr=787880330"
"259","9.189920","192.168.2.2","192.168.1.2","TCP","66","1010176","5001  >  45658 [ACK] Seq=1 Ack=1106273 Win=1010176 Len=0 TSval=2321254062 TSecr=787880494"
"261","9.262389","192.168.2.2","192.168.1.2","TCP","66","1011200","5001  >  45658 [ACK] Seq=1 Ack=1113513 Win=1011200 Len=0 TSval=2321254134 TSecr=787880512"
"263","9.322619","192.168.2.2","192.168.1.2","TCP","66","1008128","5001  >  45658 [ACK] Seq=1 Ack=1126545 Win=1008128 Len=0 TSval=2321254194 TSecr=787880572"
"265","9.431874","192.168.2.2","192.168.1.2","TCP","66","1006080","5001  >  45658 [ACK] Seq=1 Ack=1143921 Win=1006080 Len=0 TSval=2321254304 TSecr=787880681"
"267","9.576945","192.168.2.2","192.168.1.2","TCP","66","1012736","5001  >  45658 [ACK] Seq=1 Ack=1148265 Win=1012736 Len=0 TSval=2321254449 TSecr=787880839"
"269","9.613426","192.168.2.2","192.168.1.2","TCP","66","1013760","5001  >  45658 [ACK] Seq=1 Ack=1149713 Win=1013760 Len=0 TSval=2321254485 TSecr=787880863"
"271","9.625857","192.168.2.2","192.168.1.2","TCP","66","1013760","5001  >  45658 [ACK] Seq=1 Ack=1158401 Win=1013760 Len=0 TSval=2321254498 TSecr=787880875"
"273","9.698316","192.168.2.2","192.168.1.2","TCP","66","1013760","5001  >  45658 [ACK] Seq=1 Ack=1167089 Win=1013760 Len=0 TSval=2321254570 TSecr=787880948"
"275","9.770802","192.168.2.2","192.168.1.2","TCP","66","1013760","5001  >  45658 [ACK] Seq=1 Ack=1171433 Win=1013760 Len=0 TSval=2321254642 TSecr=787881026"
"278","9.820038","192.168.2.2","192.168.1.2","TCP","66","1013760","5001  >  45658 [ACK] Seq=1 Ack=1190257 Win=1013760 Len=0 TSval=2321254692 TSecr=787881057"
"280","9.965780","192.168.2.2","192.168.1.2","TCP","66","1013760","5001  >  45658 [ACK] Seq=1 Ack=1219217 Win=1013760 Len=0 TSval=2321254837 TSecr=787881324"
"285","10.207688","192.168.2.2","192.168.1.2","TCP","66","1008128","5001  >  45658 [ACK] Seq=1 Ack=1232249 Win=1008128 Len=0 TSval=2321255079 TSecr=787881458"
"286","10.316569","192.168.2.2","192.168.1.2","TCP","66","1012736","5001  >  45658 [ACK] Seq=1 Ack=1236593 Win=1012736 Len=0 TSval=2321255188 TSecr=787881567"
"287","10.353680","192.168.2.2","192.168.1.2","TCP","66","1008640","5001  >  45658 [ACK] Seq=1 Ack=1248177 Win=1008640 Len=0 TSval=2321255225 TSecr=787881615"
"288","10.449792","192.168.2.2","192.168.1.2","TCP","66","1006080","5001  >  45658 [ACK] Seq=1 Ack=1265553 Win=1006080 Len=0 TSval=2321255321 TSecr=787881700"
"289","10.595591","192.168.2.2","192.168.1.2","TCP","66","1008640","5001  >  45658 [ACK] Seq=1 Ack=1277137 Win=1008640 Len=0 TSval=2321255467 TSecr=787881845"
"290","10.692068","192.168.2.2","192.168.1.2","TCP","66","1011712","5001  >  45658 [ACK] Seq=1 Ack=1282929 Win=1011712 Len=0 TSval=2321255564 TSecr=787881942"
"291","10.740557","192.168.2.2","192.168.1.2","TCP","66","1008640","5001  >  45658 [ACK] Seq=1 Ack=1294513 Win=1008640 Len=0 TSval=2321255612 TSecr=787881992"
"293","10.838150","192.168.2.2","192.168.1.2","TCP","66","1012736","5001  >  45658 [ACK] Seq=1 Ack=1298857 Win=1012736 Len=0 TSval=2321255710 TSecr=787882089"
"294","10.874763","192.168.2.2","192.168.1.2","TCP","66","1013248","5001  >  45658 [ACK] Seq=1 Ack=1301753 Win=1013248 Len=0 TSval=2321255746 TSecr=787882125"
"295","10.898723","192.168.2.2","192.168.1.2","TCP","66","1005056","5001  >  45658 [ACK] Seq=1 Ack=1320577 Win=1005056 Len=0 TSval=2321255770 TSecr=787882234"
"298","11.056937","192.168.2.2","192.168.1.2","TCP","66","1011200","5001  >  45658 [ACK] Seq=1 Ack=1327817 Win=1011200 Len=0 TSval=2321255929 TSecr=787882306"
"299","11.117711","192.168.2.2","192.168.1.2","TCP","66","1008128","5001  >  45658 [ACK] Seq=1 Ack=1340849 Win=1008128 Len=0 TSval=2321255989 TSecr=787882366"
"300","11.225747","192.168.2.2","192.168.1.2","TCP","66","1006080","5001  >  45658 [ACK] Seq=1 Ack=1358225 Win=1006080 Len=0 TSval=2321256097 TSecr=787882476"
"301","11.371424","192.168.2.2","192.168.1.2","TCP","66","1012736","5001  >  45658 [ACK] Seq=1 Ack=1362569 Win=1012736 Len=0 TSval=2321256243 TSecr=787882621"
"302","11.407696","192.168.2.2","192.168.1.2","TCP","66","1013760","5001  >  45658 [ACK] Seq=1 Ack=1364017 Win=1013760 Len=0 TSval=2321256279 TSecr=787882657"
"303","11.419657","192.168.2.2","192.168.1.2","TCP","66","1013248","5001  >  45658 [ACK] Seq=1 Ack=1366913 Win=1013248 Len=0 TSval=2321256291 TSecr=787882670"
"304","11.443978","192.168.2.2","192.168.1.2","TCP","66","1013760","5001  >  45658 [ACK] Seq=1 Ack=1381393 Win=1013760 Len=0 TSval=2321256316 TSecr=787882742"
"305","11.565423","192.168.2.2","192.168.1.2","TCP","66","1013760","5001  >  45658 [ACK] Seq=1 Ack=1385737 Win=1013760 Len=0 TSval=2321256437 TSecr=787882815"
"306","11.601671","192.168.2.2","192.168.1.2","TCP","66","1013760","5001  >  45658 [ACK] Seq=1 Ack=1404561 Win=1013760 Len=0 TSval=2321256473 TSecr=787882864"
"307","11.759326","192.168.2.2","192.168.1.2","TCP","66","1013760","5001  >  45658 [ACK] Seq=1 Ack=1432073 Win=1013760 Len=0 TSval=2321256631 TSecr=787883009"
"310","11.989979","192.168.2.2","192.168.1.2","TCP","66","1013760","5001  >  45658 [ACK] Seq=1 Ack=1433521 Win=1013760 Len=0 TSval=2321256862 TSecr=787883054"
"312","12.002251","192.168.2.2","192.168.1.2","TCP","74","43440","8000  >  59260 [SYN, ACK] Seq=0 Ack=1 Win=43440 Len=0 MSS=1460 SACK_PERM=1 TSval=2321256874 TSecr=787883056 WS=512"
"315","12.003177","192.168.2.2","192.168.1.2","TCP","74","43440","[TCP Out-Of-Order] 8000  >  59260 [SYN, ACK] Seq=0 Ack=1 Win=43440 Len=0 MSS=1460 SACK_PERM=1 TSval=2321256875 TSecr=787883056 WS=512"
"317","12.004172","192.168.2.2","192.168.1.2","TCP","66","1013248","5001  >  45658 [ACK] Seq=1 Ack=1436417 Win=1013248 Len=0 TSval=2321256876 TSecr=787884803"
"324","12.028680","192.168.2.2","192.168.1.2","TCP","66","1013248","5001  >  45658 [ACK] Seq=1 Ack=1439313 Win=1013248 Len=0 TSval=2321256900 TSecr=787885034"
"326","12.054322","192.168.2.2","192.168.1.2","TCP","66","985600","5001  >  45658 [ACK] Seq=1 Ack=1497233 Win=985600 Len=0 TSval=2321256926 TSecr=787885048"
"330","12.538058","192.168.2.2","192.168.1.2","TCP","66","43520","8000  >  59260 [ACK] Seq=1 Ack=144 Win=43520 Len=0 TSval=2321257410 TSecr=787885048"
"331","12.538549","192.168.2.2","192.168.1.2","TCP","83","43520","8000  >  59260 [PSH, ACK] Seq=1 Ack=144 Win=43520 Len=17 TSval=2321257410 TSecr=787885048 [TCP segment of a reassembled PDU]"
"333","12.539002","192.168.2.2","192.168.1.2","TCP","2962","43520","8000  >  59260 [ACK] Seq=18 Ack=144 Win=43520 Len=2896 TSval=2321257411 TSecr=787885048 [TCP segment of a reassembled PDU]"
"335","12.550757","192.168.2.2","192.168.1.2","TCP","66","982016","5001  >  45658 [ACK] Seq=1 Ack=1562393 Win=982016 Len=0 TSval=2321257412 TSecr=787885049"
"337","12.551730","192.168.2.2","192.168.1.2","TCP","2962","43520","8000  >  59260 [ACK] Seq=2914 Ack=144 Win=43520 Len=2896 TSval=2321257414 TSecr=787885048 [TCP segment of a reassembled PDU]"
"341","12.576209","192.168.2.2","192.168.1.2","TCP","2962","43520","8000  >  59260 [ACK] Seq=5810 Ack=144 Win=43520 Len=2896 TSval=2321257418 TSecr=787885048 [TCP segment of a reassembled PDU]"
"343","12.599693","192.168.2.2","192.168.1.2","TCP","2962","43520","8000  >  59260 [ACK] Seq=8706 Ack=144 Win=43520 Len=2896 TSval=2321257423 TSecr=787885048 [TCP segment of a reassembled PDU]"
"345","12.623897","192.168.2.2","192.168.1.2","TCP","1514","43520","8000  >  59260 [ACK] Seq=11602 Ack=144 Win=43520 Len=1448 TSval=2321257448 TSecr=787885048 [TCP segment of a reassembled PDU]"
"347","12.686279","192.168.2.2","192.168.1.2","TCP","1514","43520","8000  >  59260 [ACK] Seq=13050 Ack=144 Win=43520 Len=1448 TSval=2321257558 TSecr=787885048 [TCP segment of a reassembled PDU]"
"349","12.942622","192.168.2.2","192.168.1.2","TCP","83","43520","[TCP Out-Of-Order] 8000  >  59260 [PSH, ACK] Seq=1 Ack=144 Win=43520 Len=17 TSval=2321257814 TSecr=787885048"
"354","13.085202","192.168.2.2","192.168.1.2","TCP","66","982016","5001  >  45658 [ACK] Seq=1 Ack=1627553 Win=982016 Len=0 TSval=2321257957 TSecr=787885050"
"357","13.466710","192.168.2.2","192.168.1.2","TCP","83","43520","[TCP Out-Of-Order] 8000  >  59260 [PSH, ACK] Seq=1 Ack=144 Win=43520 Len=17 TSval=2321258338 TSecr=787885048"
"360","13.630294","192.168.2.2","192.168.1.2","TCP","66","1001472","5001  >  45658 [ACK] Seq=1 Ack=1653617 Win=1001472 Len=0 TSval=2321258502 TSecr=787885050"
"362","13.848759","192.168.2.2","192.168.1.2","TCP","66","1011712","5001  >  45658 [ACK] Seq=1 Ack=1659409 Win=1011712 Len=0 TSval=2321258720 TSecr=787885072"
"364","13.896774","192.168.2.2","192.168.1.2","TCP","66","997888","5001  >  45658 [ACK] Seq=1 Ack=1692713 Win=997888 Len=0 TSval=2321258768 TSecr=787885098"
"367","14.175374","192.168.2.2","192.168.1.2","TCP","66","982016","5001  >  45658 [ACK] Seq=1 Ack=1757873 Win=982016 Len=0 TSval=2321259047 TSecr=787885099"
"368","14.490149","192.168.2.2","192.168.1.2","TCP","83","43520","[TCP Spurious Retransmission] 8000  >  59260 [PSH, ACK] Seq=1 Ack=144 Win=43520 Len=17 TSval=2321259362 TSecr=787885048"
"370","14.720467","192.168.2.2","192.168.1.2","TCP","66","1006080","5001  >  45658 [ACK] Seq=1 Ack=1775249 Win=1006080 Len=0 TSval=2321259592 TSecr=787885100"
"371","14.865655","192.168.2.2","192.168.1.2","TCP","1514","43520","8000  >  59260 [ACK] Seq=14498 Ack=144 Win=43520 Len=1448 TSval=2321259737 TSecr=787885582 [TCP segment of a reassembled PDU]"
"373","14.866664","192.168.2.2","192.168.1.2","TCP","66","990720","5001  >  45658 [ACK] Seq=1 Ack=1823033 Win=990720 Len=0 TSval=2321259738 TSecr=787885594"
"374","14.867392","192.168.2.2","192.168.1.2","TCP","2962","43520","8000  >  59260 [ACK] Seq=15946 Ack=144 Win=43520 Len=2896 TSval=2321259739 TSecr=787885583 [TCP segment of a reassembled PDU]"
"376","14.889934","192.168.2.2","192.168.1.2","TCP","1514","43520","8000  >  59260 [ACK] Seq=18842 Ack=144 Win=43520 Len=1448 TSval=2321259743 TSecr=787885583 [TCP segment of a reassembled PDU]"
"379","15.267098","192.168.2.2","192.168.1.2","TCP","66","982016","5001  >  45658 [ACK] Seq=1 Ack=1888193 Win=982016 Len=0 TSval=2321260139 TSecr=787885595"
"380","15.811755","192.168.2.2","192.168.1.2","TCP","2962","43520","8000  >  59260 [ACK] Seq=20290 Ack=144 Win=43520 Len=2896 TSval=2321260683 TSecr=787885595 [TCP segment of a reassembled PDU]"
"382","15.823202","192.168.2.2","192.168.1.2","TCP","66","1006080","5001  >  45658 [ACK] Seq=1 Ack=1905569 Win=1006080 Len=0 TSval=2321260684 TSecr=787885596"
"383","15.823736","192.168.2.2","192.168.1.2","TCP","2962","43520","8000  >  59260 [ACK] Seq=23186 Ack=144 Win=43520 Len=2896 TSval=2321260687 TSecr=787885595 [TCP segment of a reassembled PDU]"
"385","15.847963","192.168.2.2","192.168.1.2","TCP","1514","43520","8000  >  59260 [ACK] Seq=26082 Ack=144 Win=43520 Len=1448 TSval=2321260690 TSecr=787885595 [TCP segment of a reassembled PDU]"
"387","15.957845","192.168.2.2","192.168.1.2","TCP","2962","43520","8000  >  59260 [ACK] Seq=27530 Ack=144 Win=43520 Len=2896 TSval=2321260830 TSecr=787885620 [TCP segment of a reassembled PDU]"
"390","15.970056","192.168.2.2","192.168.1.2","TCP","2962","43520","8000  >  59260 [ACK] Seq=30426 Ack=144 Win=43520 Len=2896 TSval=2321260833 TSecr=787885986 [TCP segment of a reassembled PDU]"
"392","15.994365","192.168.2.2","192.168.1.2","TCP","66","990720","5001  >  45658 [ACK] Seq=1 Ack=1953353 Win=990720 Len=0 TSval=2321260833 TSecr=787886129"
"393","15.994837","192.168.2.2","192.168.1.2","TCP","2962","43520","8000  >  59260 [ACK] Seq=33322 Ack=144 Win=43520 Len=2896 TSval=2321260837 TSecr=787885986 [TCP segment of a reassembled PDU]"
"395","16.019398","192.168.2.2","192.168.1.2","TCP","2962","43520","8000  >  59260 [ACK] Seq=36218 Ack=144 Win=43520 Len=2896 TSval=2321260842 TSecr=787885986 [TCP segment of a reassembled PDU]"
"398","16.043855","192.168.2.2","192.168.1.2","TCP","1514","43520","8000  >  59260 [ACK] Seq=39114 Ack=144 Win=43520 Len=1448 TSval=2321260867 TSecr=787885986 [TCP segment of a reassembled PDU]"
"400","16.361254","192.168.2.2","192.168.1.2","TCP","66","982016","5001  >  45658 [ACK] Seq=1 Ack=2018513 Win=982016 Len=0 TSval=2321261233 TSecr=787886129"
"401","16.906910","192.168.2.2","192.168.1.2","TCP","1514","43520","8000  >  59260 [ACK] Seq=40562 Ack=144 Win=43520 Len=1448 TSval=2321261779 TSecr=787886510 [TCP segment of a reassembled PDU]"
"403","16.906913","192.168.2.2","192.168.1.2","TCP","66","1048576","5001  >  45658 [ACK] Seq=1 Ack=2035889 Win=1048576 Len=0 TSval=2321261779 TSecr=787886638"
"405","17.052810","192.168.2.2","192.168.1.2","TCP","66","1144320","5001  >  45658 [ACK] Seq=1 Ack=2083673 Win=1144320 Len=0 TSval=2321261924 TSecr=787886674"
"409","17.451777","192.168.2.2","192.168.1.2","TCP","66","1176064","5001  >  45658 [ACK] Seq=1 Ack=2099601 Win=1176064 Len=0 TSval=2321262323 TSecr=787886892"
"422","17.586399","192.168.2.2","192.168.1.2","TCP","1514","43520","8000  >  59260 [ACK] Seq=42010 Ack=144 Win=43520 Len=1448 TSval=2321262458 TSecr=787887909 [TCP segment of a reassembled PDU]"
"425","17.588173","192.168.2.2","192.168.1.2","TCP","2962","43520","8000  >  59260 [ACK] Seq=43458 Ack=144 Win=43520 Len=2896 TSval=2321262460 TSecr=787887934 [TCP segment of a reassembled PDU]"
"427","17.611132","192.168.2.2","192.168.1.2","TCP","2962","43520","8000  >  59260 [ACK] Seq=46354 Ack=144 Win=43520 Len=2896 TSval=2321262463 TSecr=787889039 [TCP segment of a reassembled PDU]"
"431","17.636617","192.168.2.2","192.168.1.2","TCP","2962","43520","8000  >  59260 [ACK] Seq=49250 Ack=144 Win=43520 Len=2896 TSval=2321262467 TSecr=787889951 [TCP segment of a reassembled PDU]"
"433","17.661134","192.168.2.2","192.168.1.2","TCP","66","1179136","5001  >  45658 [ACK] Seq=1 Ack=2101049 Win=1179136 Len=0 TSval=2321262467 TSecr=787890097"
"434","17.661372","192.168.2.2","192.168.1.2","TCP","66","1181696","5001  >  45658 [ACK] Seq=1 Ack=2102497 Win=1181696 Len=0 TSval=2321262480 TSecr=787890107"
"435","17.661879","192.168.2.2","192.168.1.2","TCP","2962","43520","8000  >  59260 [ACK] Seq=52146 Ack=144 Win=43520 Len=2896 TSval=2321262483 TSecr=787889951 [TCP segment of a reassembled PDU]"
"437","17.686561","192.168.2.2","192.168.1.2","TCP","66","1184768","5001  >  45658 [ACK] Seq=1 Ack=2103945 Win=1184768 Len=0 TSval=2321262491 TSecr=787890117"
"439","17.686654","192.168.2.2","192.168.1.2","TCP","66","1187840","5001  >  45658 [ACK] Seq=1 Ack=2105393 Win=1187840 Len=0 TSval=2321262503 TSecr=787890495"
"440","17.687151","192.168.2.2","192.168.1.2","TCP","2962","43520","8000  >  59260 [ACK] Seq=55042 Ack=144 Win=43520 Len=2896 TSval=2321262508 TSecr=787889951 [TCP segment of a reassembled PDU]"
"443","17.711401","192.168.2.2","192.168.1.2","TCP","66","1190400","5001  >  45658 [ACK] Seq=1 Ack=2106841 Win=1190400 Len=0 TSval=2321262515 TSecr=787890506"
"445","17.711917","192.168.2.2","192.168.1.2","TCP","66","1193472","5001  >  45658 [ACK] Seq=1 Ack=2108289 Win=1193472 Len=0 TSval=2321262528 TSecr=787890516"
"446","17.712459","192.168.2.2","192.168.1.2","TCP","2962","43520","8000  >  59260 [ACK] Seq=57938 Ack=144 Win=43520 Len=2896 TSval=2321262534 TSecr=787889951 [TCP segment of a reassembled PDU]"
"449","17.736749","192.168.2.2","192.168.1.2","TCP","66","1196544","5001  >  45658 [ACK] Seq=1 Ack=2109737 Win=1196544 Len=0 TSval=2321262540 TSecr=787890526"
"451","17.737214","192.168.2.2","192.168.1.2","TCP","66","1199104","5001  >  45658 [ACK] Seq=1 Ack=2111185 Win=1199104 Len=0 TSval=2321262552 TSecr=787890537"
"452","17.737740","192.168.2.2","192.168.1.2","TCP","2962","43520","8000  >  59260 [ACK] Seq=60834 Ack=144 Win=43520 Len=2896 TSval=2321262559 TSecr=787889951 [TCP segment of a reassembled PDU]"
"455","17.761972","192.168.2.2","192.168.1.2","TCP","66","1202176","5001  >  45658 [ACK] Seq=1 Ack=2112633 Win=1202176 Len=0 TSval=2321262564 TSecr=787890548"
"457","17.762473","192.168.2.2","192.168.1.2","TCP","66","1205248","5001  >  45658 [ACK] Seq=1 Ack=2114081 Win=1205248 Len=0 TSval=2321262576 TSecr=787890559"
"458","17.763020","192.168.2.2","192.168.1.2","TCP","2962","43520","8000  >  59260 [ACK] Seq=63730 Ack=144 Win=43520 Len=2896 TSval=2321262584 TSecr=787889951 [TCP segment of a reassembled PDU]"
"461","17.787442","192.168.2.2","192.168.1.2","TCP","66","1207808","5001  >  45658 [ACK] Seq=1 Ack=2115529 Win=1207808 Len=0 TSval=2321262588 TSecr=787890569"
"463","17.787752","192.168.2.2","192.168.1.2","TCP","66","1210880","5001  >  45658 [ACK] Seq=1 Ack=2116977 Win=1210880 Len=0 TSval=2321262600 TSecr=787890579"
"464","17.788298","192.168.2.2","192.168.1.2","TCP","2962","43520","8000  >  59260 [ACK] Seq=66626 Ack=144 Win=43520 Len=2896 TSval=2321262609 TSecr=787889951 [TCP segment of a reassembled PDU]"
"467","17.812896","192.168.2.2","192.168.1.2","TCP","66","1213952","5001  >  45658 [ACK] Seq=1 Ack=2118425 Win=1213952 Len=0 TSval=2321262612 TSecr=787890590"
"469","17.813042","192.168.2.2","192.168.1.2","TCP","66","1216512","5001  >  45658 [ACK] Seq=1 Ack=2119873 Win=1216512 Len=0 TSval=2321262624 TSecr=787890600"
"470","17.813567","192.168.2.2","192.168.1.2","TCP","1514","43520","8000  >  59260 [ACK] Seq=69522 Ack=144 Win=43520 Len=1448 TSval=2321262637 TSecr=787890630 [TCP segment of a reassembled PDU]"
"473","17.825743","192.168.2.2","192.168.1.2","TCP","2962","43520","8000  >  59260 [ACK] Seq=70970 Ack=144 Win=43520 Len=2896 TSval=2321262638 TSecr=787890680 [TCP segment of a reassembled PDU]"
"475","17.850153","192.168.2.2","192.168.1.2","TCP","66","1219584","5001  >  45658 [ACK] Seq=1 Ack=2121321 Win=1219584 Len=0 TSval=2321262639 TSecr=787890730"
"477","17.850431","192.168.2.2","192.168.1.2","TCP","66","1222656","5001  >  45658 [ACK] Seq=1 Ack=2122769 Win=1222656 Len=0 TSval=2321262652 TSecr=787890741"
"478","17.850947","192.168.2.2","192.168.1.2","TCP","2962","43520","8000  >  59260 [ACK] Seq=73866 Ack=144 Win=43520 Len=2896 TSval=2321262660 TSecr=787890731 [TCP segment of a reassembled PDU]"
"481","17.875632","192.168.2.2","192.168.1.2","TCP","66","1225216","5001  >  45658 [ACK] Seq=1 Ack=2124217 Win=1225216 Len=0 TSval=2321262664 TSecr=787890755"
"483","17.875853","192.168.2.2","192.168.1.2","TCP","66","1228288","5001  >  45658 [ACK] Seq=1 Ack=2125665 Win=1228288 Len=0 TSval=2321262677 TSecr=787890766"
"484","17.876240","192.168.2.2","192.168.1.2","TCP","66","1231360","5001  >  45658 [ACK] Seq=1 Ack=2127113 Win=1231360 Len=0 TSval=2321262689 TSecr=787890780"
"485","17.876765","192.168.2.2","192.168.1.2","TCP","2962","43520","8000  >  59260 [ACK] Seq=76762 Ack=144 Win=43520 Len=2896 TSval=2321262697 TSecr=787890756 [TCP segment of a reassembled PDU]"
"488","17.901053","192.168.2.2","192.168.1.2","TCP","66","1233920","5001  >  45658 [ACK] Seq=1 Ack=2128561 Win=1233920 Len=0 TSval=2321262701 TSecr=787890792"
"489","17.901523","192.168.2.2","192.168.1.2","TCP","66","1236992","5001  >  45658 [ACK] Seq=1 Ack=2130009 Win=1236992 Len=0 TSval=2321262714 TSecr=787890806"
"490","17.902049","192.168.2.2","192.168.1.2","TCP","1514","43520","8000  >  59260 [ACK] Seq=79658 Ack=144 Win=43520 Len=1448 TSval=2321262723 TSecr=787890781 [TCP segment of a reassembled PDU]"
"493","17.914223","192.168.2.2","192.168.1.2","TCP","2962","43520","8000  >  59260 [ACK] Seq=81106 Ack=144 Win=43520 Len=2896 TSval=2321262725 TSecr=787890781 [TCP segment of a reassembled PDU]"
"496","17.939323","192.168.2.2","192.168.1.2","TCP","66","1240064","5001  >  45658 [ACK] Seq=1 Ack=2131457 Win=1240064 Len=0 TSval=2321262726 TSecr=787890817"
"497","17.939326","192.168.2.2","192.168.1.2","TCP","66","1242624","5001  >  45658 [ACK] Seq=1 Ack=2132905 Win=1242624 Len=0 TSval=2321262738 TSecr=787890831"
"498","17.939424","192.168.2.2","192.168.1.2","TCP","2962","43520","8000  >  59260 [ACK] Seq=84002 Ack=144 Win=43520 Len=2896 TSval=2321262748 TSecr=787890807 [TCP segment of a reassembled PDU]"
"500","17.963769","192.168.2.2","192.168.1.2","TCP","66","1245696","5001  >  45658 [ACK] Seq=1 Ack=2134353 Win=1245696 Len=0 TSval=2321262751 TSecr=787890842"
"501","17.964193","192.168.2.2","192.168.1.2","TCP","66","1248768","5001  >  45658 [ACK] Seq=1 Ack=2135801 Win=1248768 Len=0 TSval=2321262763 TSecr=787890857"
"503","17.964750","192.168.2.2","192.168.1.2","TCP","66","1251328","5001  >  45658 [ACK] Seq=1 Ack=2137249 Win=1251328 Len=0 TSval=2321262775 TSecr=787890868"
"504","17.965264","192.168.2.2","192.168.1.2","TCP","2962","43520","8000  >  59260 [ACK] Seq=86898 Ack=144 Win=43520 Len=2896 TSval=2321262786 TSecr=787890857 [TCP segment of a reassembled PDU]"
"507","17.990232","192.168.2.2","192.168.1.2","TCP","66","1254400","5001  >  45658 [ACK] Seq=1 Ack=2138697 Win=1254400 Len=0 TSval=2321262788 TSecr=787890894"
"508","17.990235","192.168.2.2","192.168.1.2","TCP","66","1256960","5001  >  45658 [ACK] Seq=1 Ack=2140145 Win=1256960 Len=0 TSval=2321262801 TSecr=787890905"
"509","17.990542","192.168.2.2","192.168.1.2","TCP","2962","43520","8000  >  59260 [ACK] Seq=89794 Ack=144 Win=43520 Len=2896 TSval=2321262811 TSecr=787890895 [TCP segment of a reassembled PDU]"
"513","18.014760","192.168.2.2","192.168.1.2","TCP","66","1263104","5001  >  45658 [ACK] Seq=1 Ack=2143041 Win=1263104 Len=0 TSval=2321262813 TSecr=787890919"
"514","18.015266","192.168.2.2","192.168.1.2","TCP","2962","43520","8000  >  59260 [ACK] Seq=92690 Ack=144 Win=43520 Len=2896 TSval=2321262837 TSecr=787890920 [TCP segment of a reassembled PDU]"
"518","18.040204","192.168.2.2","192.168.1.2","TCP","66","1268736","5001  >  45658 [ACK] Seq=1 Ack=2145937 Win=1268736 Len=0 TSval=2321262838 TSecr=787890937"
"520","18.040224","192.168.2.2","192.168.1.2","TCP","66","1274368","5001  >  45658 [ACK] Seq=1 Ack=2148833 Win=1274368 Len=0 TSval=2321262862 TSecr=787890955"
"521","18.040566","192.168.2.2","192.168.1.2","TCP","2962","43520","8000  >  59260 [ACK] Seq=95586 Ack=144 Win=43520 Len=2896 TSval=2321262862 TSecr=787890946 [TCP segment of a reassembled PDU]"
"526","18.064797","192.168.2.2","192.168.1.2","TCP","66","1280512","5001  >  45658 [ACK] Seq=1 Ack=2151729 Win=1280512 Len=0 TSval=2321262887 TSecr=787890972"
"527","18.065313","192.168.2.2","192.168.1.2","TCP","2962","43520","8000  >  59260 [ACK] Seq=98482 Ack=144 Win=43520 Len=2896 TSval=2321262887 TSecr=787890958 [TCP segment of a reassembled PDU]"
"531","18.090143","192.168.2.2","192.168.1.2","TCP","66","1283072","5001  >  45658 [ACK] Seq=1 Ack=2153177 Win=1283072 Len=0 TSval=2321262912 TSecr=787891008"
"532","18.090148","192.168.2.2","192.168.1.2","TCP","2962","43520","8000  >  59260 [ACK] Seq=101378 Ack=144 Win=43520 Len=2896 TSval=2321262912 TSecr=787890983 [TCP segment of a reassembled PDU]"
"536","18.114282","192.168.2.2","192.168.1.2","TCP","66","1286144","5001  >  45658 [ACK] Seq=1 Ack=2154625 Win=1286144 Len=0 TSval=2321262924 TSecr=787891023"
"537","18.114815","192.168.2.2","192.168.1.2","TCP","66","1289216","5001  >  45658 [ACK] Seq=1 Ack=2156073 Win=1289216 Len=0 TSval=2321262937 TSecr=787891038"
"538","18.115355","192.168.2.2","192.168.1.2","TCP","2962","43520","8000  >  59260 [ACK] Seq=104274 Ack=144 Win=43520 Len=2896 TSval=2321262937 TSecr=787891034 [TCP segment of a reassembled PDU]"
"542","18.140093","192.168.2.2","192.168.1.2","TCP","66","1291776","5001  >  45658 [ACK] Seq=1 Ack=2157521 Win=1291776 Len=0 TSval=2321262950 TSecr=787891049"
"543","18.140098","192.168.2.2","192.168.1.2","TCP","2962","43520","8000  >  59260 [ACK] Seq=107170 Ack=144 Win=43520 Len=2896 TSval=2321262962 TSecr=787891059 [TCP segment of a reassembled PDU]"
"546","18.164318","192.168.2.2","192.168.1.2","TCP","66","1294848","5001  >  45658 [ACK] Seq=1 Ack=2158969 Win=1294848 Len=0 TSval=2321262962 TSecr=787891060"
"548","18.164868","192.168.2.2","192.168.1.2","TCP","66","1297920","5001  >  45658 [ACK] Seq=1 Ack=2160417 Win=1297920 Len=0 TSval=2321262974 TSecr=787891071"
"549","18.165387","192.168.2.2","192.168.1.2","TCP","66","1300480","5001  >  45658 [ACK] Seq=1 Ack=2161865 Win=1300480 Len=0 TSval=2321262986 TSecr=787891084"
"550","18.165915","192.168.2.2","192.168.1.2","TCP","2962","43520","8000  >  59260 [ACK] Seq=110066 Ack=144 Win=43520 Len=2896 TSval=2321262987 TSecr=787891059 [TCP segment of a reassembled PDU]"
"555","18.190903","192.168.2.2","192.168.1.2","TCP","66","1303552","5001  >  45658 [ACK] Seq=1 Ack=2163313 Win=1303552 Len=0 TSval=2321262999 TSecr=787891095"
