"No.","Time","Source","Destination","Protocol","Length","Calculated window size","Info"
"4","0.000464","192.168.2.2","192.168.1.2","TCP","74","43440","5001  >  45806 [SYN, ACK] Seq=0 Ack=1 Win=43440 Len=0 MSS=1460 SACK_PERM=1 TSval=2324449132 TSecr=791077304 WS=512"
"7","0.000529","192.168.2.2","192.168.1.2","TCP","66","39936","5001  >  45806 [ACK] Seq=1 Ack=7241 Win=39936 Len=0 TSval=2324449132 TSecr=791077304"
"12","0.049934","192.168.2.2","192.168.1.2","TCP","66","38400","5001  >  45806 [ACK] Seq=1 Ack=17377 Win=38400 Len=0 TSval=2324449182 TSecr=791077305"
"16","0.135194","192.168.2.2","192.168.1.2","TCP","66","38400","5001  >  45806 [ACK] Seq=1 Ack=27513 Win=38400 Len=0 TSval=2324449267 TSecr=791077308"
"21","0.219513","192.168.2.2","192.168.1.2","TCP","66","42496","5001  >  45806 [ACK] Seq=1 Ack=28961 Win=42496 Len=0 TSval=2324449351 TSecr=791077309"
"23","0.231429","192.168.2.2","192.168.1.2","TCP","66","42496","5001  >  45806 [ACK] Seq=1 Ack=30409 Win=42496 Len=0 TSval=2324449363 TSecr=791077322"
"26","0.244005","192.168.2.2","192.168.1.2","TCP","66","35328","5001  >  45806 [ACK] Seq=1 Ack=46337 Win=35328 Len=0 TSval=2324449376 TSecr=791077354"
"29","0.376771","192.168.2.2","192.168.1.2","TCP","66","41984","5001  >  45806 [ACK] Seq=1 Ack=49233 Win=41984 Len=0 TSval=2324449508 TSecr=791077378"
"31","0.401060","192.168.2.2","192.168.1.2","TCP","66","45568","5001  >  45806 [ACK] Seq=1 Ack=50681 Win=45568 Len=0 TSval=2324449533 TSecr=791077439"
"33","0.413544","192.168.2.2","192.168.1.2","TCP","66","75776","5001  >  45806 [ACK] Seq=1 Ack=65913 Win=75776 Len=0 TSval=2324449545 TSecr=791077439"
"37","0.540933","192.168.2.2","192.168.1.2","TCP","78","75776","[TCP Dup ACK 33#1] 5001  >  45806 [ACK] Seq=1 Ack=65913 Win=75776 Len=0 TSval=2324449672 TSecr=791077494 SLE=65161 SRE=65913"
"39","0.547785","192.168.2.2","192.168.1.2","TCP","66","84480","5001  >  45806 [ACK] Seq=1 Ack=70257 Win=84480 Len=0 TSval=2324449679 TSecr=791077523"
"41","0.584064","192.168.2.2","192.168.1.2","TCP","66","87552","5001  >  45806 [ACK] Seq=1 Ack=71705 Win=87552 Len=0 TSval=2324449716 TSecr=791077535"
"43","0.595824","192.168.2.2","192.168.1.2","TCP","66","90112","5001  >  45806 [ACK] Seq=1 Ack=72401 Win=90112 Len=0 TSval=2324449727 TSecr=791077535"
"45","0.601842","192.168.2.2","192.168.1.2","TCP","66","93184","5001  >  45806 [ACK] Seq=1 Ack=81089 Win=93184 Len=0 TSval=2324449733 TSecr=791077548"
"47","0.675236","192.168.2.2","192.168.1.2","TCP","66","93184","5001  >  45806 [ACK] Seq=1 Ack=89777 Win=93184 Len=0 TSval=2324449807 TSecr=791077680"
"51","0.748762","192.168.2.2","192.168.1.2","TCP","66","95232","5001  >  45806 [ACK] Seq=1 Ack=94121 Win=95232 Len=0 TSval=2324449880 TSecr=791077705"
"53","0.784998","192.168.2.2","192.168.1.2","TCP","66","86528","5001  >  45806 [ACK] Seq=1 Ack=115841 Win=86528 Len=0 TSval=2324449916 TSecr=791077717"
"55","0.966311","192.168.2.2","192.168.1.2","TCP","66","86528","5001  >  45806 [ACK] Seq=1 Ack=137561 Win=86528 Len=0 TSval=2324450098 TSecr=791077717"
"60","1.147605","192.168.2.2","192.168.1.2","TCP","66","101376","5001  >  45806 [ACK] Seq=1 Ack=140457 Win=101376 Len=0 TSval=2324450279 TSecr=791077844"
"62","1.172117","192.168.2.2","192.168.1.2","TCP","66","127488","5001  >  45806 [ACK] Seq=1 Ack=153489 Win=127488 Len=0 TSval=2324450303 TSecr=791077851"
"66","1.281558","192.168.2.2","192.168.1.2","TCP","66","135680","5001  >  45806 [ACK] Seq=1 Ack=157833 Win=135680 Len=0 TSval=2324450413 TSecr=791077888"
"69","1.318161","192.168.2.2","192.168.1.2","TCP","66","138752","5001  >  45806 [ACK] Seq=1 Ack=159281 Win=138752 Len=0 TSval=2324450449 TSecr=791077899"
"71","1.330065","192.168.2.2","192.168.1.2","TCP","66","168960","5001  >  45806 [ACK] Seq=1 Ack=174273 Win=168960 Len=0 TSval=2324450461 TSecr=791077905"
"74","1.456320","192.168.2.2","192.168.1.2","TCP","66","180224","5001  >  45806 [ACK] Seq=1 Ack=180065 Win=180224 Len=0 TSval=2324450587 TSecr=791077979"
"76","1.504369","192.168.2.2","192.168.1.2","TCP","66","183296","5001  >  45806 [ACK] Seq=1 Ack=181001 Win=183296 Len=0 TSval=2324450635 TSecr=791077979"
"78","1.512165","192.168.2.2","192.168.1.2","TCP","66","197632","5001  >  45806 [ACK] Seq=1 Ack=188241 Win=197632 Len=0 TSval=2324450643 TSecr=791078052"
"81","1.573044","192.168.2.2","192.168.1.2","TCP","66","223744","5001  >  45806 [ACK] Seq=1 Ack=201273 Win=223744 Len=0 TSval=2324450704 TSecr=791078088"
"84","1.681796","192.168.2.2","192.168.1.2","TCP","66","226816","5001  >  45806 [ACK] Seq=1 Ack=202721 Win=226816 Len=0 TSval=2324450813 TSecr=791078270"
"87","1.694707","192.168.2.2","192.168.1.2","TCP","66","270336","5001  >  45806 [ACK] Seq=1 Ack=224441 Win=270336 Len=0 TSval=2324450826 TSecr=791078451"
"93","1.876773","192.168.2.2","192.168.1.2","TCP","66","304640","5001  >  45806 [ACK] Seq=1 Ack=246161 Win=304640 Len=0 TSval=2324451008 TSecr=791078475"
"96","2.058069","192.168.2.2","192.168.1.2","TCP","66","304640","5001  >  45806 [ACK] Seq=1 Ack=267881 Win=304640 Len=0 TSval=2324451189 TSecr=791078475"
"99","2.240371","192.168.2.2","192.168.1.2","TCP","66","304640","5001  >  45806 [ACK] Seq=1 Ack=289601 Win=304640 Len=0 TSval=2324451371 TSecr=791078585"
"102","2.421669","192.168.2.2","192.168.1.2","TCP","66","310784","5001  >  45806 [ACK] Seq=1 Ack=292497 Win=310784 Len=0 TSval=2324451552 TSecr=791078598"
"104","2.445621","192.168.2.2","192.168.1.2","TCP","66","319488","5001  >  45806 [ACK] Seq=1 Ack=296841 Win=319488 Len=0 TSval=2324451576 TSecr=791078621"
"106","2.483229","192.168.2.2","192.168.1.2","TCP","66","348160","5001  >  45806 [ACK] Seq=1 Ack=311321 Win=348160 Len=0 TSval=2324451614 TSecr=791078633"
"108","2.604359","192.168.2.2","192.168.1.2","TCP","66","391680","5001  >  45806 [ACK] Seq=1 Ack=333041 Win=391680 Len=0 TSval=2324451735 TSecr=791078633"
"110","2.786241","192.168.2.2","192.168.1.2","TCP","66","435200","5001  >  45806 [ACK] Seq=1 Ack=354761 Win=435200 Len=0 TSval=2324451917 TSecr=791078759"
"113","2.968530","192.168.2.2","192.168.1.2","TCP","66","454144","5001  >  45806 [ACK] Seq=1 Ack=364297 Win=454144 Len=0 TSval=2324452099 TSecr=791078807"
"116","3.047907","192.168.2.2","192.168.1.2","TCP","66","477184","5001  >  45806 [ACK] Seq=1 Ack=375881 Win=477184 Len=0 TSval=2324452178 TSecr=791078815"
"118","3.144935","192.168.2.2","192.168.1.2","TCP","66","480256","5001  >  45806 [ACK] Seq=1 Ack=376481 Win=480256 Len=0 TSval=2324452275 TSecr=791078815"
"120","3.149876","192.168.2.2","192.168.1.2","TCP","66","481280","5001  >  45806 [ACK] Seq=1 Ack=398201 Win=481280 Len=0 TSval=2324452280 TSecr=791078876"
"122","3.332302","192.168.2.2","192.168.1.2","TCP","66","484864","5001  >  45806 [ACK] Seq=1 Ack=412681 Win=484864 Len=0 TSval=2324452462 TSecr=791078985"
"124","3.453694","192.168.2.2","192.168.1.2","TCP","66","488448","5001  >  45806 [ACK] Seq=1 Ack=419921 Win=488448 Len=0 TSval=2324452584 TSecr=791078998"
"126","3.514431","192.168.2.2","192.168.1.2","TCP","66","484864","5001  >  45806 [ACK] Seq=1 Ack=434401 Win=484864 Len=0 TSval=2324452644 TSecr=791079109"
"128","3.635112","192.168.2.2","192.168.1.2","TCP","66","488448","5001  >  45806 [ACK] Seq=1 Ack=441641 Win=488448 Len=0 TSval=2324452765 TSecr=791079180"
"131","3.696440","192.168.2.2","192.168.1.2","TCP","66","492032","5001  >  45806 [ACK] Seq=1 Ack=463361 Win=492032 Len=0 TSval=2324452826 TSecr=791079361"
"133","3.878129","192.168.2.2","192.168.1.2","TCP","66","495616","5001  >  45806 [ACK] Seq=1 Ack=477841 Win=495616 Len=0 TSval=2324453008 TSecr=791079361"
"135","3.999545","192.168.2.2","192.168.1.2","TCP","66","499200","5001  >  45806 [ACK] Seq=1 Ack=485081 Win=499200 Len=0 TSval=2324453129 TSecr=791079543"
"138","4.059901","192.168.2.2","192.168.1.2","TCP","78","501248","[TCP Window Update] 5001  >  45806 [ACK] Seq=1 Ack=485081 Win=501248 Len=0 TSval=2324453190 TSecr=791079543 SLE=499561 SRE=502457"
"140","4.084780","192.168.2.2","192.168.1.2","TCP","78","501248","[TCP Dup ACK 135#1] 5001  >  45806 [ACK] Seq=1 Ack=485081 Win=501248 Len=0 TSval=2324453214 TSecr=791079543 SLE=499561 SRE=506801"
"142","4.121025","192.168.2.2","192.168.1.2","TCP","78","501248","[TCP Dup ACK 135#2] 5001  >  45806 [ACK] Seq=1 Ack=485081 Win=501248 Len=0 TSval=2324453251 TSecr=791079543 SLE=499561 SRE=521281"
"145","4.241615","192.168.2.2","192.168.1.2","TCP","78","501248","[TCP Dup ACK 135#3] 5001  >  45806 [ACK] Seq=1 Ack=485081 Win=501248 Len=0 TSval=2324453371 TSecr=791079543 SLE=499561 SRE=528521"
"147","4.302381","192.168.2.2","192.168.1.2","TCP","78","501248","[TCP Dup ACK 135#4] 5001  >  45806 [ACK] Seq=1 Ack=485081 Win=501248 Len=0 TSval=2324453432 TSecr=791079543 SLE=499561 SRE=550241"
"150","4.483879","192.168.2.2","192.168.1.2","TCP","78","501248","[TCP Dup ACK 135#5] 5001  >  45806 [ACK] Seq=1 Ack=485081 Win=501248 Len=0 TSval=2324453613 TSecr=791079543 SLE=499561 SRE=564721"
"152","4.604859","192.168.2.2","192.168.1.2","TCP","78","501248","[TCP Dup ACK 135#6] 5001  >  45806 [ACK] Seq=1 Ack=485081 Win=501248 Len=0 TSval=2324453734 TSecr=791079543 SLE=499561 SRE=574857"
"155","4.690506","192.168.2.2","192.168.1.2","TCP","78","501248","[TCP Dup ACK 135#7] 5001  >  45806 [ACK] Seq=1 Ack=485081 Win=501248 Len=0 TSval=2324453820 TSecr=791079543 SLE=499561 SRE=586441"
"157","4.787489","192.168.2.2","192.168.1.2","TCP","78","501248","[TCP Dup ACK 135#8] 5001  >  45806 [ACK] Seq=1 Ack=485081 Win=501248 Len=0 TSval=2324453917 TSecr=791079543 SLE=499561 SRE=587889"
"159","4.800219","192.168.2.2","192.168.1.2","TCP","78","501248","[TCP Dup ACK 135#9] 5001  >  45806 [ACK] Seq=1 Ack=485081 Win=501248 Len=0 TSval=2324453930 TSecr=791079543 SLE=499561 SRE=595129"
"162","4.860024","192.168.2.2","192.168.1.2","TCP","78","501248","[TCP Dup ACK 135#10] 5001  >  45806 [ACK] Seq=1 Ack=485081 Win=501248 Len=0 TSval=2324453989 TSecr=791079543 SLE=499561 SRE=624089"
"168","5.102419","192.168.2.2","192.168.1.2","TCP","78","501248","[TCP Dup ACK 135#11] 5001  >  45806 [ACK] Seq=1 Ack=485081 Win=501248 Len=0 TSval=2324454232 TSecr=791079543 SLE=499561 SRE=631329"
"170","5.162934","192.168.2.2","192.168.1.2","TCP","78","501248","[TCP Dup ACK 135#12] 5001  >  45806 [ACK] Seq=1 Ack=485081 Win=501248 Len=0 TSval=2324454292 TSecr=791079543 SLE=499561 SRE=640017"
"173","5.235589","192.168.2.2","192.168.1.2","TCP","78","501248","[TCP Dup ACK 135#13] 5001  >  45806 [ACK] Seq=1 Ack=485081 Win=501248 Len=0 TSval=2324454365 TSecr=791079543 SLE=499561 SRE=653049"
"175","5.345119","192.168.2.2","192.168.1.2","TCP","78","501248","[TCP Dup ACK 135#14] 5001  >  45806 [ACK] Seq=1 Ack=485081 Win=501248 Len=0 TSval=2324454474 TSecr=791079543 SLE=499561 SRE=674769"
"177","5.526505","192.168.2.2","192.168.1.2","TCP","78","501248","[TCP Dup ACK 135#15] 5001  >  45806 [ACK] Seq=1 Ack=485081 Win=501248 Len=0 TSval=2324454655 TSecr=791079543 SLE=499561 SRE=684905"
"181","5.611699","192.168.2.2","192.168.1.2","TCP","78","501248","[TCP Dup ACK 135#16] 5001  >  45806 [ACK] Seq=1 Ack=485081 Win=501248 Len=0 TSval=2324454741 TSecr=791079543 SLE=499561 SRE=696489"
"184","5.708594","192.168.2.2","192.168.1.2","TCP","78","498688","5001  >  45806 [ACK] Seq=1 Ack=487977 Win=498688 Len=0 TSval=2324454837 TSecr=791081362 SLE=499561 SRE=696489"
"186","5.733308","192.168.2.2","192.168.1.2","TCP","78","494592","5001  >  45806 [ACK] Seq=1 Ack=492321 Win=494592 Len=0 TSval=2324454862 TSecr=791081387 SLE=499561 SRE=696489"
"188","5.769504","192.168.2.2","192.168.1.2","TCP","66","399360","5001  >  45806 [ACK] Seq=1 Ack=696489 Win=399360 Len=0 TSval=2324454898 TSecr=791081423"
"190","5.830250","192.168.2.2","192.168.1.2","TCP","66","499200","5001  >  45806 [ACK] Seq=1 Ack=703729 Win=499200 Len=0 TSval=2324454959 TSecr=791081423"
"192","5.890451","192.168.2.2","192.168.1.2","TCP","66","499200","5001  >  45806 [ACK] Seq=1 Ack=710969 Win=499200 Len=0 TSval=2324455019 TSecr=791081543"
"194","5.951787","192.168.2.2","192.168.1.2","TCP","66","493056","5001  >  45806 [ACK] Seq=1 Ack=729793 Win=493056 Len=0 TSval=2324455081 TSecr=791081604"
"197","6.108591","192.168.2.2","192.168.1.2","TCP","78","495616","[TCP Window Update] 5001  >  45806 [ACK] Seq=1 Ack=729793 Win=495616 Len=0 TSval=2324455237 TSecr=791081604 SLE=732689 SRE=747169"
"200","6.229446","192.168.2.2","192.168.1.2","TCP","78","495616","[TCP Dup ACK 194#1] 5001  >  45806 [ACK] Seq=1 Ack=729793 Win=495616 Len=0 TSval=2324455358 TSecr=791081604 SLE=732689 SRE=757305"
"203","6.314242","192.168.2.2","192.168.1.2","TCP","78","495616","[TCP Dup ACK 194#2] 5001  >  45806 [ACK] Seq=1 Ack=729793 Win=495616 Len=0 TSval=2324455443 TSecr=791081604 SLE=732689 SRE=768889"
"205","6.411428","192.168.2.2","192.168.1.2","TCP","78","495616","[TCP Dup ACK 194#3] 5001  >  45806 [ACK] Seq=1 Ack=729793 Win=495616 Len=0 TSval=2324455540 TSecr=791081604 SLE=732689 SRE=770337"
"207","6.424175","192.168.2.2","192.168.1.2","TCP","78","495616","[TCP Dup ACK 194#4] 5001  >  45806 [ACK] Seq=1 Ack=729793 Win=495616 Len=0 TSval=2324455553 TSecr=791081604 SLE=732689 SRE=774681"
"209","6.459572","192.168.2.2","192.168.1.2","TCP","78","495616","[TCP Dup ACK 194#5] 5001  >  45806 [ACK] Seq=1 Ack=729793 Win=495616 Len=0 TSval=2324455588 TSecr=791081604 SLE=732689 SRE=777577"
"211","6.483969","192.168.2.2","192.168.1.2","TCP","78","495616","[TCP Dup ACK 194#6] 5001  >  45806 [ACK] Seq=1 Ack=729793 Win=495616 Len=0 TSval=2324455612 TSecr=791081604 SLE=732689 SRE=806537"
"214","6.726053","192.168.2.2","192.168.1.2","TCP","78","495616","[TCP Dup ACK 194#7] 5001  >  45806 [ACK] Seq=1 Ack=729793 Win=495616 Len=0 TSval=2324455854 TSecr=791081604 SLE=732689 SRE=813777"
"216","6.786767","192.168.2.2","192.168.1.2","TCP","78","495616","[TCP Dup ACK 194#8] 5001  >  45806 [ACK] Seq=1 Ack=729793 Win=495616 Len=0 TSval=2324455915 TSecr=791081604 SLE=732689 SRE=819569"
"218","6.835034","192.168.2.2","192.168.1.2","TCP","86","495616","[TCP Dup ACK 194#9] 5001  >  45806 [ACK] Seq=1 Ack=729793 Win=495616 Len=0 TSval=2324455963 TSecr=791081604 SLE=822465 SRE=835497 SLE=732689 SRE=819569"
"221","6.944579","192.168.2.2","192.168.1.2","TCP","86","495616","[TCP Dup ACK 194#10] 5001  >  45806 [ACK] Seq=1 Ack=729793 Win=495616 Len=0 TSval=2324456073 TSecr=791081604 SLE=822465 SRE=857217 SLE=732689 SRE=819569"
"225","7.125885","192.168.2.2","192.168.1.2","TCP","86","495616","[TCP Dup ACK 194#11] 5001  >  45806 [ACK] Seq=1 Ack=729793 Win=495616 Len=0 TSval=2324456254 TSecr=791081604 SLE=822465 SRE=865905 SLE=732689 SRE=819569"
"227","7.198382","192.168.2.2","192.168.1.2","TCP","94","495616","[TCP Dup ACK 194#12] 5001  >  45806 [ACK] Seq=1 Ack=729793 Win=495616 Len=0 TSval=2324456327 TSecr=791081604 SLE=867353 SRE=878937 SLE=822465 SRE=865905 SLE=732689 SRE=819569"
"230","7.295476","192.168.2.2","192.168.1.2","TCP","94","495616","[TCP Dup ACK 194#13] 5001  >  45806 [ACK] Seq=1 Ack=729793 Win=495616 Len=0 TSval=2324456424 TSecr=791081604 SLE=867353 SRE=884729 SLE=822465 SRE=865905 SLE=732689 SRE=819569"
"232","7.343749","192.168.2.2","192.168.1.2","TCP","94","495616","[TCP Dup ACK 194#14] 5001  >  45806 [ACK] Seq=1 Ack=729793 Win=495616 Len=0 TSval=2324456472 TSecr=791081604 SLE=867353 SRE=893417 SLE=822465 SRE=865905 SLE=732689 SRE=819569"
"234","7.416958","192.168.2.2","192.168.1.2","TCP","94","495616","[TCP Dup ACK 194#15] 5001  >  45806 [ACK] Seq=1 Ack=729793 Win=495616 Len=0 TSval=2324456545 TSecr=791081604 SLE=867353 SRE=907897 SLE=822465 SRE=865905 SLE=732689 SRE=819569"
"237","7.537537","192.168.2.2","192.168.1.2","TCP","94","495616","[TCP Dup ACK 194#16] 5001  >  45806 [ACK] Seq=1 Ack=729793 Win=495616 Len=0 TSval=2324456666 TSecr=791081604 SLE=867353 SRE=912241 SLE=822465 SRE=865905 SLE=732689 SRE=819569"
"239","7.574715","192.168.2.2","192.168.1.2","TCP","94","495616","[TCP Dup ACK 194#17] 5001  >  45806 [ACK] Seq=1 Ack=729793 Win=495616 Len=0 TSval=2324456703 TSecr=791081604 SLE=867353 SRE=922377 SLE=822465 SRE=865905 SLE=732689 SRE=819569"
"241","7.659013","192.168.2.2","192.168.1.2","TCP","94","495616","[TCP Dup ACK 194#18] 5001  >  45806 [ACK] Seq=1 Ack=729793 Win=495616 Len=0 TSval=2324456787 TSecr=791081604 SLE=867353 SRE=941201 SLE=822465 SRE=865905 SLE=732689 SRE=819569"
"244","7.817040","192.168.2.2","192.168.1.2","TCP","86","406016","5001  >  45806 [ACK] Seq=1 Ack=819569 Win=406016 Len=0 TSval=2324456945 TSecr=791083409 SLE=867353 SRE=941201 SLE=822465 SRE=865905"
"246","7.841293","192.168.2.2","192.168.1.2","TCP","94","515072","[TCP Window Update] 5001  >  45806 [ACK] Seq=1 Ack=819569 Win=515072 Len=0 TSval=2324456969 TSecr=791083409 SLE=952785 SRE=958577 SLE=867353 SRE=941201 SLE=822465 SRE=865905"
"248","7.889558","192.168.2.2","192.168.1.2","TCP","94","538112","[TCP Window Update] 5001  >  45806 [ACK] Seq=1 Ack=819569 Win=538112 Len=0 TSval=2324457017 TSecr=791083409 SLE=962921 SRE=974505 SLE=952785 SRE=958577 SLE=867353 SRE=941201"
"251","7.987346","192.168.2.2","192.168.1.2","TCP","94","541184","[TCP Window Update] 5001  >  45806 [ACK] Seq=1 Ack=819569 Win=541184 Len=0 TSval=2324457115 TSecr=791083409 SLE=962921 SRE=975953 SLE=952785 SRE=958577 SLE=867353 SRE=941201"
"253","7.999106","192.168.2.2","192.168.1.2","TCP","94","549888","[TCP Window Update] 5001  >  45806 [ACK] Seq=1 Ack=819569 Win=549888 Len=0 TSval=2324457127 TSecr=791083409 SLE=962921 SRE=980297 SLE=952785 SRE=958577 SLE=867353 SRE=941201"
"255","8.035381","192.168.2.2","192.168.1.2","TCP","94","555520","[TCP Window Update] 5001  >  45806 [ACK] Seq=1 Ack=819569 Win=555520 Len=0 TSval=2324457163 TSecr=791083409 SLE=962921 SRE=983193 SLE=952785 SRE=958577 SLE=867353 SRE=941201"
"258","8.059841","192.168.2.2","192.168.1.2","TCP","94","599040","[TCP Window Update] 5001  >  45806 [ACK] Seq=1 Ack=819569 Win=599040 Len=0 TSval=2324457188 TSecr=791083409 SLE=962921 SRE=1004913 SLE=952785 SRE=958577 SLE=867353 SRE=941201"
"262","9.621618","192.168.2.2","192.168.1.2","TCP","94","613376","[TCP Window Update] 5001  >  45806 [ACK] Seq=1 Ack=819569 Win=613376 Len=0 TSval=2324457369 TSecr=791083409 SLE=1012153 SRE=1019393 SLE=962921 SRE=1004913 SLE=952785 SRE=958577"
"264","9.621620","192.168.2.2","192.168.1.2","TCP","94","625152","[TCP Window Update] 5001  >  45806 [ACK] Seq=1 Ack=819569 Win=625152 Len=0 TSval=2324457430 TSecr=791083409 SLE=1012153 SRE=1025185 SLE=962921 SRE=1004913 SLE=952785 SRE=958577"
"265","9.621622","192.168.2.2","192.168.1.2","TCP","94","630784","5001  >  45806 [ACK] Seq=1 Ack=865905 Win=630784 Len=0 TSval=2324457478 TSecr=791084135 SLE=1012153 SRE=1025185 SLE=962921 SRE=1004913 SLE=952785 SRE=958577"
"266","9.621624","192.168.2.2","192.168.1.2","TCP","94","662528","[TCP Window Update] 5001  >  45806 [ACK] Seq=1 Ack=865905 Win=662528 Len=0 TSval=2324457502 TSecr=791084135 SLE=1035321 SRE=1051249 SLE=1012153 SRE=1025185 SLE=962921 SRE=1004913"
"267","9.621626","192.168.2.2","192.168.1.2","TCP","94","679936","[TCP Window Update] 5001  >  45806 [ACK] Seq=1 Ack=865905 Win=679936 Len=0 TSval=2324457635 TSecr=791084135 SLE=1057041 SRE=1065729 SLE=1035321 SRE=1051249 SLE=1012153 SRE=1025185"
"268","9.621628","192.168.2.2","192.168.1.2","TCP","94","683008","5001  >  45806 [ACK] Seq=1 Ack=941201 Win=683008 Len=0 TSval=2324457708 TSecr=791084499 SLE=1057041 SRE=1065729 SLE=1035321 SRE=1051249 SLE=1012153 SRE=1025185"
"269","9.621629","192.168.2.2","192.168.1.2","TCP","94","694272","[TCP Window Update] 5001  >  45806 [ACK] Seq=1 Ack=941201 Win=694272 Len=0 TSval=2324457719 TSecr=791084499 SLE=1075865 SRE=1081657 SLE=1057041 SRE=1065729 SLE=1035321 SRE=1051249"
"270","9.621631","192.168.2.2","192.168.1.2","TCP","94","711680","[TCP Window Update] 5001  >  45806 [ACK] Seq=1 Ack=941201 Win=711680 Len=0 TSval=2324457768 TSecr=791084499 SLE=1075865 SRE=1090345 SLE=1057041 SRE=1065729 SLE=1035321 SRE=1051249"
"271","9.621633","192.168.2.2","192.168.1.2","TCP","94","726528","[TCP Window Update] 5001  >  45806 [ACK] Seq=1 Ack=941201 Win=726528 Len=0 TSval=2324457841 TSecr=791084499 SLE=1075865 SRE=1097585 SLE=1057041 SRE=1065729 SLE=1035321 SRE=1051249"
"272","9.621635","192.168.2.2","192.168.1.2","TCP","94","735232","[TCP Window Update] 5001  >  45806 [ACK] Seq=1 Ack=941201 Win=735232 Len=0 TSval=2324457901 TSecr=791084499 SLE=1104825 SRE=1109169 SLE=1075865 SRE=1097585 SLE=1057041 SRE=1065729"
"273","9.621636","192.168.2.2","192.168.1.2","TCP","94","755200","[TCP Window Update] 5001  >  45806 [ACK] Seq=1 Ack=941201 Win=755200 Len=0 TSval=2324457938 TSecr=791084499 SLE=1104825 SRE=1119305 SLE=1075865 SRE=1097585 SLE=1057041 SRE=1065729"
"274","9.621638","192.168.2.2","192.168.1.2","TCP","94","793088","[TCP Window Update] 5001  >  45806 [ACK] Seq=1 Ack=941201 Win=793088 Len=0 TSval=2324458022 TSecr=791084499 SLE=1104825 SRE=1138129 SLE=1075865 SRE=1097585 SLE=1057041 SRE=1065729"
"275","9.621640","192.168.2.2","192.168.1.2","TCP","94","804352","[TCP Window Update] 5001  >  45806 [ACK] Seq=1 Ack=941201 Win=804352 Len=0 TSval=2324458180 TSecr=791084499 SLE=1104825 SRE=1143921 SLE=1075865 SRE=1097585 SLE=1057041 SRE=1065729"
"276","9.621641","192.168.2.2","192.168.1.2","TCP","94","827904","5001  >  45806 [ACK] Seq=1 Ack=958577 Win=827904 Len=0 TSval=2324458228 TSecr=791085141 SLE=1104825 SRE=1143921 SLE=1075865 SRE=1097585 SLE=1057041 SRE=1065729"
"277","9.621643","192.168.2.2","192.168.1.2","TCP","94","836608","5001  >  45806 [ACK] Seq=1 Ack=1004913 Win=836608 Len=0 TSval=2324458326 TSecr=791085189 SLE=1104825 SRE=1143921 SLE=1075865 SRE=1097585 SLE=1057041 SRE=1065729"
"278","9.621645","192.168.2.2","192.168.1.2","TCP","94","873984","[TCP Window Update] 5001  >  45806 [ACK] Seq=1 Ack=1004913 Win=873984 Len=0 TSval=2324458361 TSecr=791085189 SLE=1104825 SRE=1162745 SLE=1075865 SRE=1097585 SLE=1057041 SRE=1065729"
"279","9.621647","192.168.2.2","192.168.1.2","TCP","94","879616","[TCP Window Update] 5001  >  45806 [ACK] Seq=1 Ack=1004913 Win=879616 Len=0 TSval=2324458519 TSecr=791085189 SLE=1104825 SRE=1165641 SLE=1075865 SRE=1097585 SLE=1057041 SRE=1065729"
"280","9.621648","192.168.2.2","192.168.1.2","TCP","94","891392","[TCP Window Update] 5001  >  45806 [ACK] Seq=1 Ack=1004913 Win=891392 Len=0 TSval=2324458543 TSecr=791085189 SLE=1104825 SRE=1171433 SLE=1075865 SRE=1097585 SLE=1057041 SRE=1065729"
"282","9.622325","192.168.2.2","192.168.1.2","TCP","94","897024","[TCP Window Update] 5001  >  45806 [ACK] Seq=1 Ack=1004913 Win=897024 Len=0 TSval=2324458591 TSecr=791085189 SLE=1104825 SRE=1174329 SLE=1075865 SRE=1097585 SLE=1057041 SRE=1065729"
"284","9.623103","192.168.2.2","192.168.1.2","TCP","94","929280","[TCP Window Update] 5001  >  45806 [ACK] Seq=1 Ack=1004913 Win=929280 Len=0 TSval=2324458616 TSecr=791085189 SLE=1104825 SRE=1190257 SLE=1075865 SRE=1097585 SLE=1057041 SRE=1065729"
"288","9.624618","192.168.2.2","192.168.1.2","TCP","94","943616","5001  >  45806 [ACK] Seq=1 Ack=1025185 Win=943616 Len=0 TSval=2324458750 TSecr=791086921 SLE=1104825 SRE=1190257 SLE=1075865 SRE=1097585 SLE=1057041 SRE=1065729"
"296","9.683856","192.168.2.2","192.168.1.2","TCP","94","963584","5001  >  45806 [ACK] Seq=1 Ack=1051249 Win=963584 Len=0 TSval=2324458811 TSecr=791086921 SLE=1104825 SRE=1190257 SLE=1075865 SRE=1097585 SLE=1057041 SRE=1065729"
"298","9.769112","192.168.2.2","192.168.1.2","TCP","86","975360","5001  >  45806 [ACK] Seq=1 Ack=1065729 Win=975360 Len=0 TSval=2324458896 TSecr=791086921 SLE=1104825 SRE=1190257 SLE=1075865 SRE=1097585"
"300","9.817124","192.168.2.2","192.168.1.2","TCP","78","995840","5001  >  45806 [ACK] Seq=1 Ack=1097585 Win=995840 Len=0 TSval=2324458944 TSecr=791086921 SLE=1104825 SRE=1190257"
"302","9.902369","192.168.2.2","192.168.1.2","TCP","66","1010176","5001  >  45806 [ACK] Seq=1 Ack=1190257 Win=1010176 Len=0 TSval=2324459029 TSecr=791086921"
"304","9.963111","192.168.2.2","192.168.1.2","TCP","78","1091072","[TCP Window Update] 5001  >  45806 [ACK] Seq=1 Ack=1190257 Win=1091072 Len=0 TSval=2324459090 TSecr=791086921 SLE=1196049 SRE=1236593"
"309","10.301506","192.168.2.2","192.168.1.2","TCP","78","1221632","[TCP Window Update] 5001  >  45806 [ACK] Seq=1 Ack=1190257 Win=1221632 Len=0 TSval=2324459428 TSecr=791086921 SLE=1196049 SRE=1301753"
"310","10.847111","192.168.2.2","192.168.1.2","TCP","78","1308672","[TCP Window Update] 5001  >  45806 [ACK] Seq=1 Ack=1190257 Win=1308672 Len=0 TSval=2324459973 TSecr=791086921 SLE=1196049 SRE=1345193"
"313","11.209769","192.168.2.2","192.168.1.2","TCP","78","1324032","[TCP Window Update] 5001  >  45806 [ACK] Seq=1 Ack=1190257 Win=1324032 Len=0 TSval=2324460336 TSecr=791086921 SLE=1196049 SRE=1361121"
"314","11.343135","192.168.2.2","192.168.1.2","TCP","66","1320960","5001  >  45806 [ACK] Seq=1 Ack=1361121 Win=1320960 Len=0 TSval=2324460469 TSecr=791086924"
"315","11.391435","192.168.2.2","192.168.1.2","TCP","66","1335296","5001  >  45806 [ACK] Seq=1 Ack=1366913 Win=1335296 Len=0 TSval=2324460517 TSecr=791086924"
"316","11.440096","192.168.2.2","192.168.1.2","TCP","66","1338368","5001  >  45806 [ACK] Seq=1 Ack=1368361 Win=1338368 Len=0 TSval=2324460566 TSecr=791086924"
"317","11.451941","192.168.2.2","192.168.1.2","TCP","66","1358848","5001  >  45806 [ACK] Seq=1 Ack=1378497 Win=1358848 Len=0 TSval=2324460578 TSecr=791086983"
"318","11.537108","192.168.2.2","192.168.1.2","TCP","66","1370112","5001  >  45806 [ACK] Seq=1 Ack=1384289 Win=1370112 Len=0 TSval=2324460663 TSecr=791087068"
"319","11.585335","192.168.2.2","192.168.1.2","TCP","66","1390592","5001  >  45806 [ACK] Seq=1 Ack=1394425 Win=1390592 Len=0 TSval=2324460711 TSecr=791087116"
"320","11.670354","192.168.2.2","192.168.1.2","TCP","66","1402880","5001  >  45806 [ACK] Seq=1 Ack=1401665 Win=1402880 Len=0 TSval=2324460796 TSecr=791087201"
"321","11.731120","192.168.2.2","192.168.1.2","TCP","66","1391104","5001  >  45806 [ACK] Seq=1 Ack=1432073 Win=1391104 Len=0 TSval=2324460857 TSecr=791087262"
"322","11.984946","192.168.2.2","192.168.1.2","TCP","66","1401344","5001  >  45806 [ACK] Seq=1 Ack=1442209 Win=1401344 Len=0 TSval=2324461111 TSecr=791087262"
"325","12.069655","192.168.2.2","192.168.1.2","TCP","74","43440","8000  >  59408 [SYN, ACK] Seq=0 Ack=1 Win=43440 Len=0 MSS=1460 SACK_PERM=1 TSval=2324461195 TSecr=791087301 WS=512"
"329","12.070992","192.168.2.2","192.168.1.2","TCP","74","43440","[TCP Out-Of-Order] 8000  >  59408 [SYN, ACK] Seq=0 Ack=1 Win=43440 Len=0 MSS=1460 SACK_PERM=1 TSval=2324461197 TSecr=791087301 WS=512"
"332","12.072379","192.168.2.2","192.168.1.2","TCP","66","1404928","5001  >  45806 [ACK] Seq=1 Ack=1445105 Win=1404928 Len=0 TSval=2324461198 TSecr=791089283"
"335","12.096679","192.168.2.2","192.168.1.2","TCP","66","1404928","5001  >  45806 [ACK] Seq=1 Ack=1448001 Win=1404928 Len=0 TSval=2324461222 TSecr=791089283"
"337","12.122131","192.168.2.2","192.168.1.2","TCP","66","43520","8000  >  59408 [ACK] Seq=1 Ack=144 Win=43520 Len=0 TSval=2324461248 TSecr=791089367"
"338","12.122565","192.168.2.2","192.168.1.2","TCP","83","43520","8000  >  59408 [PSH, ACK] Seq=1 Ack=144 Win=43520 Len=17 TSval=2324461248 TSecr=791089367 [TCP segment of a reassembled PDU]"
"340","12.123095","192.168.2.2","192.168.1.2","TCP","2962","43520","8000  >  59408 [ACK] Seq=18 Ack=144 Win=43520 Len=2896 TSval=2324461249 TSecr=791089367 [TCP segment of a reassembled PDU]"
"342","12.134876","192.168.2.2","192.168.1.2","TCP","66","1404928","5001  >  45806 [ACK] Seq=1 Ack=1450897 Win=1404928 Len=0 TSval=2324461250 TSecr=791089370"
"344","12.135794","192.168.2.2","192.168.1.2","TCP","2962","43520","8000  >  59408 [ACK] Seq=2914 Ack=144 Win=43520 Len=2896 TSval=2324461253 TSecr=791089369 [TCP segment of a reassembled PDU]"
"346","12.160329","192.168.2.2","192.168.1.2","TCP","2962","43520","8000  >  59408 [ACK] Seq=5810 Ack=144 Win=43520 Len=2896 TSval=2324461257 TSecr=791089369 [TCP segment of a reassembled PDU]"
"348","12.183817","192.168.2.2","192.168.1.2","TCP","2962","43520","8000  >  59408 [ACK] Seq=8706 Ack=144 Win=43520 Len=2896 TSval=2324461262 TSecr=791089369 [TCP segment of a reassembled PDU]"
"351","12.208735","192.168.2.2","192.168.1.2","TCP","66","1404928","5001  >  45806 [ACK] Seq=1 Ack=1453793 Win=1404928 Len=0 TSval=2324461274 TSecr=791089394"
"353","12.209272","192.168.2.2","192.168.1.2","TCP","1514","43520","8000  >  59408 [ACK] Seq=11602 Ack=144 Win=43520 Len=1448 TSval=2324461286 TSecr=791089369 [TCP segment of a reassembled PDU]"
"356","12.221486","192.168.2.2","192.168.1.2","TCP","2962","43520","8000  >  59408 [ACK] Seq=13050 Ack=144 Win=43520 Len=2896 TSval=2324461301 TSecr=791089420 [TCP segment of a reassembled PDU]"
"360","12.246335","192.168.2.2","192.168.1.2","TCP","66","1404928","5001  >  45806 [ACK] Seq=1 Ack=1456689 Win=1404928 Len=0 TSval=2324461301 TSecr=791089433"
"362","12.246337","192.168.2.2","192.168.1.2","TCP","2962","43520","8000  >  59408 [ACK] Seq=15946 Ack=144 Win=43520 Len=2896 TSval=2324461310 TSecr=791089421 [TCP segment of a reassembled PDU]"
"364","12.271106","192.168.2.2","192.168.1.2","TCP","66","1385984","5001  >  45806 [ACK] Seq=1 Ack=1497233 Win=1385984 Len=0 TSval=2324461334 TSecr=791089506"
"366","12.271109","192.168.2.2","192.168.1.2","TCP","1514","43520","8000  >  59408 [ACK] Seq=18842 Ack=144 Win=43520 Len=1448 TSval=2324461347 TSecr=791089482 [TCP segment of a reassembled PDU]"
"369","12.283777","192.168.2.2","192.168.1.2","TCP","2962","43520","8000  >  59408 [ACK] Seq=20290 Ack=144 Win=43520 Len=2896 TSval=2324461349 TSecr=791089482 [TCP segment of a reassembled PDU]"
"371","12.307303","192.168.2.2","192.168.1.2","TCP","2962","43520","8000  >  59408 [ACK] Seq=23186 Ack=144 Win=43520 Len=2896 TSval=2324461372 TSecr=791089482 [TCP segment of a reassembled PDU]"
"373","12.331457","192.168.2.2","192.168.1.2","TCP","2962","43520","8000  >  59408 [ACK] Seq=26082 Ack=144 Win=43520 Len=2896 TSval=2324461409 TSecr=791089482 [TCP segment of a reassembled PDU]"
"375","12.355677","192.168.2.2","192.168.1.2","TCP","2962","43520","8000  >  59408 [ACK] Seq=28978 Ack=144 Win=43520 Len=2896 TSval=2324461433 TSecr=791089482 [TCP segment of a reassembled PDU]"
"377","12.379903","192.168.2.2","192.168.1.2","TCP","2962","43520","8000  >  59408 [ACK] Seq=31874 Ack=144 Win=43520 Len=2896 TSval=2324461457 TSecr=791089482 [TCP segment of a reassembled PDU]"
"379","12.404348","192.168.2.2","192.168.1.2","TCP","2962","43520","8000  >  59408 [ACK] Seq=34770 Ack=144 Win=43520 Len=2896 TSval=2324461481 TSecr=791089482 [TCP segment of a reassembled PDU]"
"381","12.428849","192.168.2.2","192.168.1.2","TCP","1514","43520","8000  >  59408 [ACK] Seq=37666 Ack=144 Win=43520 Len=1448 TSval=2324461506 TSecr=791089482 [TCP segment of a reassembled PDU]"
"383","12.440653","192.168.2.2","192.168.1.2","TCP","1514","43520","8000  >  59408 [ACK] Seq=39114 Ack=144 Win=43520 Len=1448 TSval=2324461552 TSecr=791089482 [TCP segment of a reassembled PDU]"
"386","12.538805","192.168.2.2","192.168.1.2","TCP","66","1373696","5001  >  45806 [ACK] Seq=1 Ack=1562393 Win=1373696 Len=0 TSval=2324461664 TSecr=791089507"
"390","12.718250","192.168.2.2","192.168.1.2","TCP","1514","43520","[TCP Out-Of-Order] 8000  >  59408 [ACK] Seq=11602 Ack=144 Win=43520 Len=1448 TSval=2324461844 TSecr=791089482 [TCP segment of a reassembled PDU]"
"392","13.083898","192.168.2.2","192.168.1.2","TCP","66","1373696","5001  >  45806 [ACK] Seq=1 Ack=1627553 Win=1373696 Len=0 TSval=2324462209 TSecr=791089507"
"396","13.262165","192.168.2.2","192.168.1.2","TCP","1514","43520","[TCP Out-Of-Order] 8000  >  59408 [ACK] Seq=11602 Ack=144 Win=43520 Len=1448 TSval=2324462387 TSecr=791089482 [TCP segment of a reassembled PDU]"
"400","13.629482","192.168.2.2","192.168.1.2","TCP","1514","43520","8000  >  59408 [ACK] Seq=40562 Ack=144 Win=43520 Len=1448 TSval=2324462754 TSecr=791089507 [TCP segment of a reassembled PDU]"
"402","13.629485","192.168.2.2","192.168.1.2","TCP","66","1385984","5001  >  45806 [ACK] Seq=1 Ack=1668097 Win=1385984 Len=0 TSval=2324462754 TSecr=791089507"
"405","13.866656","192.168.2.2","192.168.1.2","TCP","1514","43520","8000  >  59408 [ACK] Seq=42010 Ack=144 Win=43520 Len=1448 TSval=2324462991 TSecr=791089507 [TCP segment of a reassembled PDU]"
"407","13.968776","192.168.2.2","192.168.1.2","TCP","2962","43520","8000  >  59408 [ACK] Seq=43458 Ack=144 Win=43520 Len=2896 TSval=2324463094 TSecr=791089519 [TCP segment of a reassembled PDU]"
"409","13.981292","192.168.2.2","192.168.1.2","TCP","66","1403392","5001  >  45806 [ACK] Seq=1 Ack=1673889 Win=1403392 Len=0 TSval=2324463094 TSecr=791089544"
"411","13.981297","192.168.2.2","192.168.1.2","TCP","1514","43520","8000  >  59408 [ACK] Seq=46354 Ack=144 Win=43520 Len=1448 TSval=2324463097 TSecr=791089519 [TCP segment of a reassembled PDU]"
"413","14.017607","192.168.2.2","192.168.1.2","TCP","2962","43520","8000  >  59408 [ACK] Seq=47802 Ack=144 Win=43520 Len=2896 TSval=2324463142 TSecr=791089544 [TCP segment of a reassembled PDU]"
"415","14.029282","192.168.2.2","192.168.1.2","TCP","66","1397248","5001  >  45806 [ACK] Seq=1 Ack=1692713 Win=1397248 Len=0 TSval=2324463143 TSecr=791089569"
"416","14.029576","192.168.2.2","192.168.1.2","TCP","2962","43520","8000  >  59408 [ACK] Seq=50698 Ack=144 Win=43520 Len=2896 TSval=2324463146 TSecr=791089544 [TCP segment of a reassembled PDU]"
"419","14.176359","192.168.2.2","192.168.1.2","TCP","1514","43520","8000  >  59408 [ACK] Seq=53594 Ack=144 Win=43520 Len=1448 TSval=2324463301 TSecr=791089569 [TCP segment of a reassembled PDU]"
"421","14.176362","192.168.2.2","192.168.1.2","TCP","66","1375232","5001  >  45806 [ACK] Seq=1 Ack=1754977 Win=1375232 Len=0 TSval=2324463301 TSecr=791089570"
"422","14.696892","192.168.2.2","192.168.1.2","TCP","2962","43520","8000  >  59408 [ACK] Seq=55042 Ack=144 Win=43520 Len=2896 TSval=2324463821 TSecr=791089581 [TCP segment of a reassembled PDU]"
"424","14.708347","192.168.2.2","192.168.1.2","TCP","2962","43520","8000  >  59408 [ACK] Seq=57938 Ack=144 Win=43520 Len=2896 TSval=2324463825 TSecr=791089726 [TCP segment of a reassembled PDU]"
"426","14.732976","192.168.2.2","192.168.1.2","TCP","66","1404928","5001  >  45806 [ACK] Seq=1 Ack=1757873 Win=1404928 Len=0 TSval=2324463825 TSecr=791089836"
"427","14.733179","192.168.2.2","192.168.1.2","TCP","2962","43520","8000  >  59408 [ACK] Seq=60834 Ack=144 Win=43520 Len=2896 TSval=2324463828 TSecr=791089780 [TCP segment of a reassembled PDU]"
"429","14.757490","192.168.2.2","192.168.1.2","TCP","2962","43520","8000  >  59408 [ACK] Seq=63730 Ack=144 Win=43520 Len=2896 TSval=2324463833 TSecr=791089780 [TCP segment of a reassembled PDU]"
"431","14.781983","192.168.2.2","192.168.1.2","TCP","66","1373696","5001  >  45806 [ACK] Seq=1 Ack=1823033 Win=1373696 Len=0 TSval=2324463855 TSecr=791089837"
"432","14.782065","192.168.2.2","192.168.1.2","TCP","2962","43520","8000  >  59408 [ACK] Seq=66626 Ack=144 Win=43520 Len=2896 TSval=2324463858 TSecr=791089780 [TCP segment of a reassembled PDU]"
"434","14.806470","192.168.2.2","192.168.1.2","TCP","2962","43520","8000  >  59408 [ACK] Seq=69522 Ack=144 Win=43520 Len=2896 TSval=2324463882 TSecr=791089780 [TCP segment of a reassembled PDU]"
"436","14.830990","192.168.2.2","192.168.1.2","TCP","2962","43520","8000  >  59408 [ACK] Seq=72418 Ack=144 Win=43520 Len=2896 TSval=2324463906 TSecr=791089780 [TCP segment of a reassembled PDU]"
"439","15.271016","192.168.2.2","192.168.1.2","TCP","66","1375232","5001  >  45806 [ACK] Seq=1 Ack=1885297 Win=1375232 Len=0 TSval=2324464395 TSecr=791089837"
"440","15.791180","192.168.2.2","192.168.1.2","TCP","66","1404928","5001  >  45806 [ACK] Seq=1 Ack=1888193 Win=1404928 Len=0 TSval=2324464915 TSecr=791090381"
"441","15.815962","192.168.2.2","192.168.1.2","TCP","1514","43520","8000  >  59408 [ACK] Seq=75314 Ack=144 Win=43520 Len=1448 TSval=2324464940 TSecr=791090926 [TCP segment of a reassembled PDU]"
"442","15.815964","192.168.2.2","192.168.1.2","TCP","78","1404928","[TCP Dup ACK 440#1] 5001  >  45806 [ACK] Seq=1 Ack=1888193 Win=1404928 Len=0 TSval=2324464940 TSecr=791090381 SLE=2015617 SRE=2018513"
"445","15.840144","192.168.2.2","192.168.1.2","TCP","2962","43520","8000  >  59408 [ACK] Seq=76762 Ack=144 Win=43520 Len=2896 TSval=2324464964 TSecr=791091266 [TCP segment of a reassembled PDU]"
"447","15.852187","192.168.2.2","192.168.1.2","TCP","86","1404928","[TCP Dup ACK 440#2] 5001  >  45806 [ACK] Seq=1 Ack=1888193 Win=1404928 Len=0 TSval=2324464964 TSecr=791090381 SLE=2083673 SRE=2108289 SLE=2015617 SRE=2018513"
"449","15.852279","192.168.2.2","192.168.1.2","TCP","1514","43520","8000  >  59408 [ACK] Seq=79658 Ack=144 Win=43520 Len=1448 TSval=2324464968 TSecr=791091266 [TCP segment of a reassembled PDU]"
"467","16.046602","192.168.2.2","192.168.1.2","TCP","2962","43520","8000  >  59408 [ACK] Seq=81106 Ack=144 Win=43520 Len=2896 TSval=2324465170 TSecr=791091314 [TCP segment of a reassembled PDU]"
"469","16.058406","192.168.2.2","192.168.1.2","TCP","2962","43520","8000  >  59408 [ACK] Seq=84002 Ack=144 Win=43520 Len=2896 TSval=2324465174 TSecr=791092054 [TCP segment of a reassembled PDU]"
"472","16.083119","192.168.2.2","192.168.1.2","TCP","86","1403904","5001  >  45806 [ACK] Seq=1 Ack=1889641 Win=1403904 Len=0 TSval=2324465176 TSecr=791093112 SLE=2083673 SRE=2108289 SLE=2015617 SRE=2018513"
"473","16.083762","192.168.2.2","192.168.1.2","TCP","2962","43520","8000  >  59408 [ACK] Seq=86898 Ack=144 Win=43520 Len=2896 TSval=2324465178 TSecr=791092127 [TCP segment of a reassembled PDU]"
"475","16.107968","192.168.2.2","192.168.1.2","TCP","2962","43520","8000  >  59408 [ACK] Seq=89794 Ack=144 Win=43520 Len=2896 TSval=2324465182 TSecr=791092127 [TCP segment of a reassembled PDU]"
"478","16.133575","192.168.2.2","192.168.1.2","TCP","86","1402880","5001  >  45806 [ACK] Seq=1 Ack=1891089 Win=1402880 Len=0 TSval=2324465189 TSecr=791093123 SLE=2083673 SRE=2108289 SLE=2015617 SRE=2018513"
"480","16.133578","192.168.2.2","192.168.1.2","TCP","86","1401856","5001  >  45806 [ACK] Seq=1 Ack=1892537 Win=1401856 Len=0 TSval=2324465201 TSecr=791093148 SLE=2083673 SRE=2108289 SLE=2015617 SRE=2018513"
"481","16.133582","192.168.2.2","192.168.1.2","TCP","2962","43520","8000  >  59408 [ACK] Seq=92690 Ack=144 Win=43520 Len=2896 TSval=2324465208 TSecr=791093136 [TCP segment of a reassembled PDU]"
"484","16.157944","192.168.2.2","192.168.1.2","TCP","86","1400832","5001  >  45806 [ACK] Seq=1 Ack=1893985 Win=1400832 Len=0 TSval=2324465214 TSecr=791093159 SLE=2083673 SRE=2108289 SLE=2015617 SRE=2018513"
"486","16.158457","192.168.2.2","192.168.1.2","TCP","86","1399808","5001  >  45806 [ACK] Seq=1 Ack=1895433 Win=1399808 Len=0 TSval=2324465226 TSecr=791093170 SLE=2083673 SRE=2108289 SLE=2015617 SRE=2018513"
"487","16.159182","192.168.2.2","192.168.1.2","TCP","2962","43520","8000  >  59408 [ACK] Seq=95586 Ack=144 Win=43520 Len=2896 TSval=2324465232 TSecr=791093148 [TCP segment of a reassembled PDU]"
"490","16.183449","192.168.2.2","192.168.1.2","TCP","86","1398784","5001  >  45806 [ACK] Seq=1 Ack=1896881 Win=1398784 Len=0 TSval=2324465238 TSecr=791093180 SLE=2083673 SRE=2108289 SLE=2015617 SRE=2018513"
"492","16.184087","192.168.2.2","192.168.1.2","TCP","86","1397760","5001  >  45806 [ACK] Seq=1 Ack=1898329 Win=1397760 Len=0 TSval=2324465250 TSecr=791093191 SLE=2083673 SRE=2108289 SLE=2015617 SRE=2018513"
"493","16.184783","192.168.2.2","192.168.1.2","TCP","2962","43520","8000  >  59408 [ACK] Seq=98482 Ack=144 Win=43520 Len=2896 TSval=2324465262 TSecr=791093342 [TCP segment of a reassembled PDU]"
"497","16.209768","192.168.2.2","192.168.1.2","TCP","94","1397760","[TCP Dup ACK 492#1] 5001  >  45806 [ACK] Seq=1 Ack=1898329 Win=1397760 Len=0 TSval=2324465265 TSecr=791093191 SLE=1915705 SRE=1917153 SLE=2083673 SRE=2108289 SLE=2015617 SRE=2018513"
"499","16.210511","192.168.2.2","192.168.1.2","TCP","94","1397760","[TCP Dup ACK 492#2] 5001  >  45806 [ACK] Seq=1 Ack=1898329 Win=1397760 Len=0 TSval=2324465278 TSecr=791093191 SLE=1915705 SRE=1918601 SLE=2083673 SRE=2108289 SLE=2015617 SRE=2018513"
"500","16.211282","192.168.2.2","192.168.1.2","TCP","2962","43520","8000  >  59408 [ACK] Seq=101378 Ack=144 Win=43520 Len=2896 TSval=2324465283 TSecr=791093429 [TCP segment of a reassembled PDU]"
