"No.","Time","Source","Destination","Protocol","Length","Calculated window size","Info"
"4","0.002952","192.168.2.2","192.168.1.2","TCP","74","43440","5001  >  45854 [SYN, ACK] Seq=0 Ack=1 Win=43440 Len=0 MSS=1460 SACK_PERM=1 TSval=2325772435 TSecr=792400607 WS=512"
"7","0.003010","192.168.2.2","192.168.1.2","TCP","66","39936","5001  >  45854 [ACK] Seq=1 Ack=7241 Win=39936 Len=0 TSval=2325772435 TSecr=792400607"
"12","0.052149","192.168.2.2","192.168.1.2","TCP","66","38400","5001  >  45854 [ACK] Seq=1 Ack=17377 Win=38400 Len=0 TSval=2325772484 TSecr=792400608"
"15","0.137332","192.168.2.2","192.168.1.2","TCP","66","38400","5001  >  45854 [ACK] Seq=1 Ack=27513 Win=38400 Len=0 TSval=2325772570 TSecr=792400609"
"19","0.221599","192.168.2.2","192.168.1.2","TCP","66","42496","5001  >  45854 [ACK] Seq=1 Ack=28961 Win=42496 Len=0 TSval=2325772654 TSecr=792400610"
"21","0.233571","192.168.2.2","192.168.1.2","TCP","66","42496","5001  >  45854 [ACK] Seq=1 Ack=30409 Win=42496 Len=0 TSval=2325772666 TSecr=792400623"
"25","0.245690","192.168.2.2","192.168.1.2","TCP","66","35328","5001  >  45854 [ACK] Seq=1 Ack=46337 Win=35328 Len=0 TSval=2325772678 TSecr=792400656"
"28","0.379334","192.168.2.2","192.168.1.2","TCP","66","41984","5001  >  45854 [ACK] Seq=1 Ack=49233 Win=41984 Len=0 TSval=2325772812 TSecr=792400683"
"30","0.403137","192.168.2.2","192.168.1.2","TCP","66","45568","5001  >  45854 [ACK] Seq=1 Ack=50681 Win=45568 Len=0 TSval=2325772835 TSecr=792400742"
"32","0.415559","192.168.2.2","192.168.1.2","TCP","66","75776","5001  >  45854 [ACK] Seq=1 Ack=65913 Win=75776 Len=0 TSval=2325772848 TSecr=792400742"
"35","0.542917","192.168.2.2","192.168.1.2","TCP","78","75776","[TCP Dup ACK 32#1] 5001  >  45854 [ACK] Seq=1 Ack=65913 Win=75776 Len=0 TSval=2325772975 TSecr=792400795 SLE=65161 SRE=65913"
"37","0.549448","192.168.2.2","192.168.1.2","TCP","66","84480","5001  >  45854 [ACK] Seq=1 Ack=70257 Win=84480 Len=0 TSval=2325772982 TSecr=792400826"
"39","0.586009","192.168.2.2","192.168.1.2","TCP","66","87552","5001  >  45854 [ACK] Seq=1 Ack=71705 Win=87552 Len=0 TSval=2325773018 TSecr=792400838"
"41","0.597918","192.168.2.2","192.168.1.2","TCP","66","90112","5001  >  45854 [ACK] Seq=1 Ack=72401 Win=90112 Len=0 TSval=2325773030 TSecr=792400838"
"43","0.604676","192.168.2.2","192.168.1.2","TCP","66","93184","5001  >  45854 [ACK] Seq=1 Ack=81089 Win=93184 Len=0 TSval=2325773037 TSecr=792400850"
"46","0.677629","192.168.2.2","192.168.1.2","TCP","66","93184","5001  >  45854 [ACK] Seq=1 Ack=89777 Win=93184 Len=0 TSval=2325773110 TSecr=792400984"
"50","0.750125","192.168.2.2","192.168.1.2","TCP","66","95232","5001  >  45854 [ACK] Seq=1 Ack=94121 Win=95232 Len=0 TSval=2325773182 TSecr=792401007"
"52","0.786379","192.168.2.2","192.168.1.2","TCP","66","86528","5001  >  45854 [ACK] Seq=1 Ack=115841 Win=86528 Len=0 TSval=2325773219 TSecr=792401020"
"55","0.967561","192.168.2.2","192.168.1.2","TCP","66","86528","5001  >  45854 [ACK] Seq=1 Ack=137561 Win=86528 Len=0 TSval=2325773400 TSecr=792401020"
"58","1.149045","192.168.2.2","192.168.1.2","TCP","66","101376","5001  >  45854 [ACK] Seq=1 Ack=140457 Win=101376 Len=0 TSval=2325773581 TSecr=792401147"
"60","1.173294","192.168.2.2","192.168.1.2","TCP","66","127488","5001  >  45854 [ACK] Seq=1 Ack=153489 Win=127488 Len=0 TSval=2325773606 TSecr=792401154"
"63","1.282528","192.168.2.2","192.168.1.2","TCP","66","135680","5001  >  45854 [ACK] Seq=1 Ack=157833 Win=135680 Len=0 TSval=2325773715 TSecr=792401190"
"66","1.318618","192.168.2.2","192.168.1.2","TCP","66","138752","5001  >  45854 [ACK] Seq=1 Ack=159281 Win=138752 Len=0 TSval=2325773751 TSecr=792401202"
"68","1.330719","192.168.2.2","192.168.1.2","TCP","66","168960","5001  >  45854 [ACK] Seq=1 Ack=174273 Win=168960 Len=0 TSval=2325773763 TSecr=792401209"
"74","1.457190","192.168.2.2","192.168.1.2","TCP","66","180224","5001  >  45854 [ACK] Seq=1 Ack=180065 Win=180224 Len=0 TSval=2325773889 TSecr=792401282"
"76","1.505938","192.168.2.2","192.168.1.2","TCP","66","183296","5001  >  45854 [ACK] Seq=1 Ack=181001 Win=183296 Len=0 TSval=2325773938 TSecr=792401282"
"78","1.514328","192.168.2.2","192.168.1.2","TCP","66","197632","5001  >  45854 [ACK] Seq=1 Ack=188241 Win=197632 Len=0 TSval=2325773947 TSecr=792401354"
"81","1.574897","192.168.2.2","192.168.1.2","TCP","66","223744","5001  >  45854 [ACK] Seq=1 Ack=201273 Win=223744 Len=0 TSval=2325774007 TSecr=792401391"
"83","1.684139","192.168.2.2","192.168.1.2","TCP","66","226816","5001  >  45854 [ACK] Seq=1 Ack=202721 Win=226816 Len=0 TSval=2325774116 TSecr=792401572"
"88","1.696777","192.168.2.2","192.168.1.2","TCP","66","270336","5001  >  45854 [ACK] Seq=1 Ack=224441 Win=270336 Len=0 TSval=2325774129 TSecr=792401753"
"91","1.878592","192.168.2.2","192.168.1.2","TCP","66","304640","5001  >  45854 [ACK] Seq=1 Ack=246161 Win=304640 Len=0 TSval=2325774311 TSecr=792401778"
"94","2.060211","192.168.2.2","192.168.1.2","TCP","66","304640","5001  >  45854 [ACK] Seq=1 Ack=267881 Win=304640 Len=0 TSval=2325774492 TSecr=792401778"
"96","2.242007","192.168.2.2","192.168.1.2","TCP","66","304640","5001  >  45854 [ACK] Seq=1 Ack=289601 Win=304640 Len=0 TSval=2325774674 TSecr=792401887"
"100","2.423790","192.168.2.2","192.168.1.2","TCP","66","310784","5001  >  45854 [ACK] Seq=1 Ack=292497 Win=310784 Len=0 TSval=2325774856 TSecr=792401915"
"102","2.448257","192.168.2.2","192.168.1.2","TCP","66","319488","5001  >  45854 [ACK] Seq=1 Ack=296841 Win=319488 Len=0 TSval=2325774880 TSecr=792401923"
"104","2.484473","192.168.2.2","192.168.1.2","TCP","66","348160","5001  >  45854 [ACK] Seq=1 Ack=311321 Win=348160 Len=0 TSval=2325774917 TSecr=792401935"
"106","2.605987","192.168.2.2","192.168.1.2","TCP","66","391680","5001  >  45854 [ACK] Seq=1 Ack=333041 Win=391680 Len=0 TSval=2325775038 TSecr=792401935"
"108","2.787162","192.168.2.2","192.168.1.2","TCP","66","435200","5001  >  45854 [ACK] Seq=1 Ack=354761 Win=435200 Len=0 TSval=2325775219 TSecr=792402061"
"111","2.969356","192.168.2.2","192.168.1.2","TCP","66","454144","5001  >  45854 [ACK] Seq=1 Ack=364297 Win=454144 Len=0 TSval=2325775402 TSecr=792402110"
"114","3.049194","192.168.2.2","192.168.1.2","TCP","66","477184","5001  >  45854 [ACK] Seq=1 Ack=375881 Win=477184 Len=0 TSval=2325775481 TSecr=792402119"
"116","3.146189","192.168.2.2","192.168.1.2","TCP","66","480256","5001  >  45854 [ACK] Seq=1 Ack=376481 Win=480256 Len=0 TSval=2325775578 TSecr=792402119"
"118","3.150893","192.168.2.2","192.168.1.2","TCP","66","481280","5001  >  45854 [ACK] Seq=1 Ack=398201 Win=481280 Len=0 TSval=2325775583 TSecr=792402179"
"120","3.332482","192.168.2.2","192.168.1.2","TCP","66","483840","5001  >  45854 [ACK] Seq=1 Ack=415577 Win=483840 Len=0 TSval=2325775765 TSecr=792402288"
"122","3.477809","192.168.2.2","192.168.1.2","TCP","66","489984","5001  >  45854 [ACK] Seq=1 Ack=419921 Win=489984 Len=0 TSval=2325775910 TSecr=792402301"
"124","3.515411","192.168.2.2","192.168.1.2","TCP","66","483840","5001  >  45854 [ACK] Seq=1 Ack=437297 Win=483840 Len=0 TSval=2325775948 TSecr=792402428"
"126","3.660972","192.168.2.2","192.168.1.2","TCP","66","489984","5001  >  45854 [ACK] Seq=1 Ack=441641 Win=489984 Len=0 TSval=2325776093 TSecr=792402483"
"129","3.697853","192.168.2.2","192.168.1.2","TCP","66","492032","5001  >  45854 [ACK] Seq=1 Ack=463361 Win=492032 Len=0 TSval=2325776130 TSecr=792402664"
"131","3.880393","192.168.2.2","192.168.1.2","TCP","66","492032","5001  >  45854 [ACK] Seq=1 Ack=485081 Win=492032 Len=0 TSval=2325776313 TSecr=792402846"
"134","4.061954","192.168.2.2","192.168.1.2","TCP","66","494080","5001  >  45854 [ACK] Seq=1 Ack=502457 Win=494080 Len=0 TSval=2325776494 TSecr=792402939"
"136","4.207286","192.168.2.2","192.168.1.2","TCP","66","499712","5001  >  45854 [ACK] Seq=1 Ack=505353 Win=499712 Len=0 TSval=2325776640 TSecr=792403028"
"138","4.232027","192.168.2.2","192.168.1.2","TCP","66","501760","5001  >  45854 [ACK] Seq=1 Ack=506801 Win=501760 Len=0 TSval=2325776664 TSecr=792403053"
"140","4.243800","192.168.2.2","192.168.1.2","TCP","66","494080","5001  >  45854 [ACK] Seq=1 Ack=524177 Win=494080 Len=0 TSval=2325776676 TSecr=792403089"
"143","4.389300","192.168.2.2","192.168.1.2","TCP","66","500736","5001  >  45854 [ACK] Seq=1 Ack=528521 Win=500736 Len=0 TSval=2325776822 TSecr=792403210"
"145","4.425571","192.168.2.2","192.168.1.2","TCP","66","492032","5001  >  45854 [ACK] Seq=1 Ack=550241 Win=492032 Len=0 TSval=2325776858 TSecr=792403391"
"147","4.606996","192.168.2.2","192.168.1.2","TCP","66","494080","5001  >  45854 [ACK] Seq=1 Ack=567617 Win=494080 Len=0 TSval=2325777039 TSecr=792403451"
"149","4.752708","192.168.2.2","192.168.1.2","TCP","66","497664","5001  >  45854 [ACK] Seq=1 Ack=577753 Win=497664 Len=0 TSval=2325777185 TSecr=792403574"
"152","4.838304","192.168.2.2","192.168.1.2","TCP","66","501760","5001  >  45854 [ACK] Seq=1 Ack=589337 Win=501760 Len=0 TSval=2325777271 TSecr=792403653"
"154","4.947219","192.168.2.2","192.168.1.2","TCP","66","501760","5001  >  45854 [ACK] Seq=1 Ack=595129 Win=501760 Len=0 TSval=2325777379 TSecr=792403750"
"156","4.983453","192.168.2.2","192.168.1.2","TCP","66","501760","5001  >  45854 [ACK] Seq=1 Ack=629881 Win=501760 Len=0 TSval=2325777416 TSecr=792403937"
"162","5.274309","192.168.2.2","192.168.1.2","TCP","66","500736","5001  >  45854 [ACK] Seq=1 Ack=634225 Win=500736 Len=0 TSval=2325777707 TSecr=792404082"
"164","5.310536","192.168.2.2","192.168.1.2","TCP","66","499712","5001  >  45854 [ACK] Seq=1 Ack=640017 Win=499712 Len=0 TSval=2325777743 TSecr=792404120"
"166","5.358735","192.168.2.2","192.168.1.2","TCP","66","494592","5001  >  45854 [ACK] Seq=1 Ack=655945 Win=494592 Len=0 TSval=2325777791 TSecr=792404265"
"169","5.492291","192.168.2.2","192.168.1.2","TCP","66","492032","5001  >  45854 [ACK] Seq=1 Ack=677665 Win=492032 Len=0 TSval=2325777925 TSecr=792404302"
"171","5.674480","192.168.2.2","192.168.1.2","TCP","66","516608","5001  >  45854 [ACK] Seq=1 Ack=684905 Win=516608 Len=0 TSval=2325778107 TSecr=792404485"
"174","5.734965","192.168.2.2","192.168.1.2","TCP","66","580096","5001  >  45854 [ACK] Seq=1 Ack=716761 Win=580096 Len=0 TSval=2325778167 TSecr=792404666"
"178","6.001669","192.168.2.2","192.168.1.2","TCP","66","585728","5001  >  45854 [ACK] Seq=1 Ack=719657 Win=585728 Len=0 TSval=2325778434 TSecr=792404812"
"180","6.025692","192.168.2.2","192.168.1.2","TCP","66","588800","5001  >  45854 [ACK] Seq=1 Ack=721105 Win=588800 Len=0 TSval=2325778458 TSecr=792404836"
"182","6.037898","192.168.2.2","192.168.1.2","TCP","66","606208","5001  >  45854 [ACK] Seq=1 Ack=729793 Win=606208 Len=0 TSval=2325778470 TSecr=792404848"
"185","6.110904","192.168.2.2","192.168.1.2","TCP","66","623616","5001  >  45854 [ACK] Seq=1 Ack=738481 Win=623616 Len=0 TSval=2325778543 TSecr=792404987"
"187","6.183386","192.168.2.2","192.168.1.2","TCP","66","632320","5001  >  45854 [ACK] Seq=1 Ack=742825 Win=632320 Len=0 TSval=2325778616 TSecr=792404994"
"189","6.219626","192.168.2.2","192.168.1.2","TCP","66","675840","5001  >  45854 [ACK] Seq=1 Ack=764545 Win=675840 Len=0 TSval=2325778652 TSecr=792405030"
"191","6.401823","192.168.2.2","192.168.1.2","TCP","66","695808","5001  >  45854 [ACK] Seq=1 Ack=774681 Win=695808 Len=0 TSval=2325778834 TSecr=792405211"
"193","6.486121","192.168.2.2","192.168.1.2","TCP","66","730624","5001  >  45854 [ACK] Seq=1 Ack=792057 Win=730624 Len=0 TSval=2325778918 TSecr=792405357"
"195","6.631269","192.168.2.2","192.168.1.2","TCP","66","753664","5001  >  45854 [ACK] Seq=1 Ack=803641 Win=753664 Len=0 TSval=2325779064 TSecr=792405443"
"197","6.728567","192.168.2.2","192.168.1.2","TCP","66","765440","5001  >  45854 [ACK] Seq=1 Ack=809433 Win=765440 Len=0 TSval=2325779161 TSecr=792405552"
"199","6.776604","192.168.2.2","192.168.1.2","TCP","66","785920","5001  >  45854 [ACK] Seq=1 Ack=819569 Win=785920 Len=0 TSval=2325779209 TSecr=792405588"
"202","6.862502","192.168.2.2","192.168.1.2","TCP","66","843776","5001  >  45854 [ACK] Seq=1 Ack=848529 Win=843776 Len=0 TSval=2325779295 TSecr=792405879"
"206","7.104813","192.168.2.2","192.168.1.2","TCP","66","855040","5001  >  45854 [ACK] Seq=1 Ack=854321 Win=855040 Len=0 TSval=2325779537 TSecr=792405915"
"208","7.153654","192.168.2.2","192.168.1.2","TCP","66","878592","5001  >  45854 [ACK] Seq=1 Ack=865905 Win=878592 Len=0 TSval=2325779586 TSecr=792405963"
"210","7.250274","192.168.2.2","192.168.1.2","TCP","66","887296","5001  >  45854 [ACK] Seq=1 Ack=870249 Win=887296 Len=0 TSval=2325779683 TSecr=792406011"
"212","7.286435","192.168.2.2","192.168.1.2","TCP","66","930816","5001  >  45854 [ACK] Seq=1 Ack=891969 Win=930816 Len=0 TSval=2325779719 TSecr=792406097"
"215","7.468248","192.168.2.2","192.168.1.2","TCP","66","945152","5001  >  45854 [ACK] Seq=1 Ack=899209 Win=945152 Len=0 TSval=2325779900 TSecr=792406279"
"217","7.529384","192.168.2.2","192.168.1.2","TCP","66","971264","5001  >  45854 [ACK] Seq=1 Ack=912241 Win=971264 Len=0 TSval=2325779962 TSecr=792406339"
"219","7.638244","192.168.2.2","192.168.1.2","TCP","66","1005056","5001  >  45854 [ACK] Seq=1 Ack=931065 Win=1005056 Len=0 TSval=2325780070 TSecr=792406524"
"222","7.796313","192.168.2.2","192.168.1.2","TCP","66","1011200","5001  >  45854 [ACK] Seq=1 Ack=933961 Win=1011200 Len=0 TSval=2325780229 TSecr=792406606"
"224","7.820781","192.168.2.2","192.168.1.2","TCP","66","1013760","5001  >  45854 [ACK] Seq=1 Ack=935409 Win=1013760 Len=0 TSval=2325780253 TSecr=792406630"
"226","7.832519","192.168.2.2","192.168.1.2","TCP","66","1010176","5001  >  45854 [ACK] Seq=1 Ack=944097 Win=1010176 Len=0 TSval=2325780265 TSecr=792406642"
"229","7.905455","192.168.2.2","192.168.1.2","TCP","66","1010176","5001  >  45854 [ACK] Seq=1 Ack=952785 Win=1010176 Len=0 TSval=2325780338 TSecr=792406715"
"231","7.978476","192.168.2.2","192.168.1.2","TCP","66","1012736","5001  >  45854 [ACK] Seq=1 Ack=957129 Win=1012736 Len=0 TSval=2325780411 TSecr=792406788"
"233","8.014723","192.168.2.2","192.168.1.2","TCP","66","1013760","5001  >  45854 [ACK] Seq=1 Ack=958577 Win=1013760 Len=0 TSval=2325780447 TSecr=792406824"
"235","8.027493","192.168.2.2","192.168.1.2","TCP","66","999424","5001  >  45854 [ACK] Seq=1 Ack=988985 Win=999424 Len=0 TSval=2325780460 TSecr=792407006"
"238","8.281306","192.168.2.2","192.168.1.2","TCP","66","1006592","5001  >  45854 [ACK] Seq=1 Ack=1004913 Win=1006592 Len=0 TSval=2325780714 TSecr=792407090"
"240","8.415406","192.168.2.2","192.168.1.2","TCP","66","1008128","5001  >  45854 [ACK] Seq=1 Ack=1017945 Win=1008128 Len=0 TSval=2325780848 TSecr=792407236"
"242","8.523688","192.168.2.2","192.168.1.2","TCP","66","1011712","5001  >  45854 [ACK] Seq=1 Ack=1023737 Win=1011712 Len=0 TSval=2325780956 TSecr=792407333"
"244","8.572098","192.168.2.2","192.168.1.2","TCP","66","1009664","5001  >  45854 [ACK] Seq=1 Ack=1033873 Win=1009664 Len=0 TSval=2325781004 TSecr=792407381"
"246","8.656846","192.168.2.2","192.168.1.2","TCP","66","1006080","5001  >  45854 [ACK] Seq=1 Ack=1051249 Win=1006080 Len=0 TSval=2325781089 TSecr=792407467"
"248","8.802320","192.168.2.2","192.168.1.2","TCP","66","1008640","5001  >  45854 [ACK] Seq=1 Ack=1062833 Win=1008640 Len=0 TSval=2325781235 TSecr=792407547"
"251","8.899831","192.168.2.2","192.168.1.2","TCP","66","1011712","5001  >  45854 [ACK] Seq=1 Ack=1068625 Win=1011712 Len=0 TSval=2325781332 TSecr=792407709"
"253","8.948779","192.168.2.2","192.168.1.2","TCP","66","1008640","5001  >  45854 [ACK] Seq=1 Ack=1080209 Win=1008640 Len=0 TSval=2325781381 TSecr=792407758"
"256","9.045270","192.168.2.2","192.168.1.2","TCP","66","1012736","5001  >  45854 [ACK] Seq=1 Ack=1084553 Win=1012736 Len=0 TSval=2325781478 TSecr=792407855"
"258","9.081587","192.168.2.2","192.168.1.2","TCP","66","1008128","5001  >  45854 [ACK] Seq=1 Ack=1097585 Win=1008128 Len=0 TSval=2325781514 TSecr=792407891"
"260","9.191210","192.168.2.2","192.168.1.2","TCP","66","1010176","5001  >  45854 [ACK] Seq=1 Ack=1106273 Win=1010176 Len=0 TSval=2325781623 TSecr=792408059"
"262","9.263715","192.168.2.2","192.168.1.2","TCP","66","1011200","5001  >  45854 [ACK] Seq=1 Ack=1113513 Win=1011200 Len=0 TSval=2325781696 TSecr=792408073"
"264","9.324440","192.168.2.2","192.168.1.2","TCP","66","1008128","5001  >  45854 [ACK] Seq=1 Ack=1126545 Win=1008128 Len=0 TSval=2325781757 TSecr=792408134"
"266","9.433194","192.168.2.2","192.168.1.2","TCP","66","1006080","5001  >  45854 [ACK] Seq=1 Ack=1143921 Win=1006080 Len=0 TSval=2325781865 TSecr=792408243"
"268","9.578148","192.168.2.2","192.168.1.2","TCP","66","1013760","5001  >  45854 [ACK] Seq=1 Ack=1145369 Win=1013760 Len=0 TSval=2325782010 TSecr=792408243"
"270","9.590856","192.168.2.2","192.168.1.2","TCP","66","1013248","5001  >  45854 [ACK] Seq=1 Ack=1148265 Win=1013248 Len=0 TSval=2325782023 TSecr=792408401"
"272","9.627128","192.168.2.2","192.168.1.2","TCP","66","1013760","5001  >  45854 [ACK] Seq=1 Ack=1158401 Win=1013760 Len=0 TSval=2325782059 TSecr=792408425"
"274","9.699226","192.168.2.2","192.168.1.2","TCP","66","1013760","5001  >  45854 [ACK] Seq=1 Ack=1167089 Win=1013760 Len=0 TSval=2325782131 TSecr=792408510"
"276","9.771935","192.168.2.2","192.168.1.2","TCP","66","1013760","5001  >  45854 [ACK] Seq=1 Ack=1171433 Win=1013760 Len=0 TSval=2325782204 TSecr=792408583"
"278","9.820619","192.168.2.2","192.168.1.2","TCP","66","1013760","5001  >  45854 [ACK] Seq=1 Ack=1190257 Win=1013760 Len=0 TSval=2325782253 TSecr=792408619"
"281","9.966473","192.168.2.2","192.168.1.2","TCP","66","1013760","5001  >  45854 [ACK] Seq=1 Ack=1219217 Win=1013760 Len=0 TSval=2325782399 TSecr=792408886"
"286","10.209483","192.168.2.2","192.168.1.2","TCP","66","1008128","5001  >  45854 [ACK] Seq=1 Ack=1232249 Win=1008128 Len=0 TSval=2325782642 TSecr=792409020"
"287","10.317863","192.168.2.2","192.168.1.2","TCP","66","1012736","5001  >  45854 [ACK] Seq=1 Ack=1236593 Win=1012736 Len=0 TSval=2325782750 TSecr=792409128"
"288","10.354059","192.168.2.2","192.168.1.2","TCP","66","1008640","5001  >  45854 [ACK] Seq=1 Ack=1248177 Win=1008640 Len=0 TSval=2325782786 TSecr=792409176"
"289","10.450979","192.168.2.2","192.168.1.2","TCP","66","1006080","5001  >  45854 [ACK] Seq=1 Ack=1265553 Win=1006080 Len=0 TSval=2325782883 TSecr=792409261"
"290","10.596930","192.168.2.2","192.168.1.2","TCP","66","1008640","5001  >  45854 [ACK] Seq=1 Ack=1277137 Win=1008640 Len=0 TSval=2325783029 TSecr=792409407"
"291","10.693908","192.168.2.2","192.168.1.2","TCP","66","1011712","5001  >  45854 [ACK] Seq=1 Ack=1282929 Win=1011712 Len=0 TSval=2325783126 TSecr=792409504"
"292","10.741903","192.168.2.2","192.168.1.2","TCP","66","1008640","5001  >  45854 [ACK] Seq=1 Ack=1294513 Win=1008640 Len=0 TSval=2325783174 TSecr=792409553"
"294","10.839273","192.168.2.2","192.168.1.2","TCP","66","1012736","5001  >  45854 [ACK] Seq=1 Ack=1298857 Win=1012736 Len=0 TSval=2325783272 TSecr=792409650"
"295","10.875632","192.168.2.2","192.168.1.2","TCP","66","1013248","5001  >  45854 [ACK] Seq=1 Ack=1301753 Win=1013248 Len=0 TSval=2325783308 TSecr=792409686"
"296","10.900108","192.168.2.2","192.168.1.2","TCP","66","1005056","5001  >  45854 [ACK] Seq=1 Ack=1320577 Win=1005056 Len=0 TSval=2325783332 TSecr=792409795"
"299","11.057822","192.168.2.2","192.168.1.2","TCP","66","1011200","5001  >  45854 [ACK] Seq=1 Ack=1327817 Win=1011200 Len=0 TSval=2325783490 TSecr=792409868"
"300","11.118582","192.168.2.2","192.168.1.2","TCP","66","1008128","5001  >  45854 [ACK] Seq=1 Ack=1340849 Win=1008128 Len=0 TSval=2325783551 TSecr=792409929"
"301","11.226876","192.168.2.2","192.168.1.2","TCP","66","1006080","5001  >  45854 [ACK] Seq=1 Ack=1358225 Win=1006080 Len=0 TSval=2325783659 TSecr=792410037"
"302","11.372217","192.168.2.2","192.168.1.2","TCP","66","1013760","5001  >  45854 [ACK] Seq=1 Ack=1359673 Win=1013760 Len=0 TSval=2325783804 TSecr=792410182"
"303","11.384511","192.168.2.2","192.168.1.2","TCP","66","1013248","5001  >  45854 [ACK] Seq=1 Ack=1362569 Win=1013248 Len=0 TSval=2325783817 TSecr=792410195"
"304","11.409015","192.168.2.2","192.168.1.2","TCP","66","1012736","5001  >  45854 [ACK] Seq=1 Ack=1366913 Win=1012736 Len=0 TSval=2325783841 TSecr=792410231"
"305","11.445334","192.168.2.2","192.168.1.2","TCP","66","1013760","5001  >  45854 [ACK] Seq=1 Ack=1381393 Win=1013760 Len=0 TSval=2325783878 TSecr=792410304"
"306","11.566045","192.168.2.2","192.168.1.2","TCP","66","1013760","5001  >  45854 [ACK] Seq=1 Ack=1385737 Win=1013760 Len=0 TSval=2325783998 TSecr=792410376"
"307","11.602980","192.168.2.2","192.168.1.2","TCP","66","1013760","5001  >  45854 [ACK] Seq=1 Ack=1404561 Win=1013760 Len=0 TSval=2325784035 TSecr=792410425"
"308","11.760694","192.168.2.2","192.168.1.2","TCP","66","1013760","5001  >  45854 [ACK] Seq=1 Ack=1432073 Win=1013760 Len=0 TSval=2325784193 TSecr=792410571"
"310","11.989995","192.168.2.2","192.168.1.2","TCP","74","43440","8000  >  59456 [SYN, ACK] Seq=0 Ack=1 Win=43440 Len=0 MSS=1460 SACK_PERM=1 TSval=2325784422 TSecr=792410616 WS=512"
"313","11.990580","192.168.2.2","192.168.1.2","TCP","66","1013760","5001  >  45854 [ACK] Seq=1 Ack=1433521 Win=1013760 Len=0 TSval=2325784423 TSecr=792410619"
"316","12.003614","192.168.2.2","192.168.1.2","TCP","74","43440","[TCP Out-Of-Order] 8000  >  59456 [SYN, ACK] Seq=0 Ack=1 Win=43440 Len=0 MSS=1460 SACK_PERM=1 TSval=2325784436 TSecr=792410616 WS=512"
"319","12.004979","192.168.2.2","192.168.1.2","TCP","66","1013248","5001  >  45854 [ACK] Seq=1 Ack=1436417 Win=1013248 Len=0 TSval=2325784437 TSecr=792412365"
"324","12.030111","192.168.2.2","192.168.1.2","TCP","66","43520","8000  >  59456 [ACK] Seq=1 Ack=144 Win=43520 Len=0 TSval=2325784462 TSecr=792412594"
"325","12.031295","192.168.2.2","192.168.1.2","TCP","83","43520","8000  >  59456 [PSH, ACK] Seq=1 Ack=144 Win=43520 Len=17 TSval=2325784464 TSecr=792412594 [TCP segment of a reassembled PDU]"
"327","12.031384","192.168.2.2","192.168.1.2","TCP","66","1013248","5001  >  45854 [ACK] Seq=1 Ack=1439313 Win=1013248 Len=0 TSval=2325784464 TSecr=792412595"
"329","12.031597","192.168.2.2","192.168.1.2","TCP","2962","43520","8000  >  59456 [ACK] Seq=18 Ack=144 Win=43520 Len=2896 TSval=2325784464 TSecr=792412594 [TCP segment of a reassembled PDU]"
"332","12.044213","192.168.2.2","192.168.1.2","TCP","2962","43520","8000  >  59456 [ACK] Seq=2914 Ack=144 Win=43520 Len=2896 TSval=2325784467 TSecr=792412594 [TCP segment of a reassembled PDU]"
"334","12.068719","192.168.2.2","192.168.1.2","TCP","2962","43520","8000  >  59456 [ACK] Seq=5810 Ack=144 Win=43520 Len=2896 TSval=2325784470 TSecr=792412594 [TCP segment of a reassembled PDU]"
"336","12.093207","192.168.2.2","192.168.1.2","TCP","2962","43520","8000  >  59456 [ACK] Seq=8706 Ack=144 Win=43520 Len=2896 TSval=2325784477 TSecr=792412594 [TCP segment of a reassembled PDU]"
"338","12.116750","192.168.2.2","192.168.1.2","TCP","66","985600","5001  >  45854 [ACK] Seq=1 Ack=1497233 Win=985600 Len=0 TSval=2325784488 TSecr=792412609"
"340","12.117117","192.168.2.2","192.168.1.2","TCP","1514","43520","8000  >  59456 [ACK] Seq=11602 Ack=144 Win=43520 Len=1448 TSval=2325784501 TSecr=792412608 [TCP segment of a reassembled PDU]"
"344","12.158839","192.168.2.2","192.168.1.2","TCP","1514","43520","8000  >  59456 [ACK] Seq=13050 Ack=144 Win=43520 Len=1448 TSval=2325784591 TSecr=792412608 [TCP segment of a reassembled PDU]"
"346","12.402776","192.168.2.2","192.168.1.2","TCP","83","43520","[TCP Out-Of-Order] 8000  >  59456 [PSH, ACK] Seq=1 Ack=144 Win=43520 Len=17 TSval=2325784835 TSecr=792412608"
"348","12.540914","192.168.2.2","192.168.1.2","TCP","66","982016","5001  >  45854 [ACK] Seq=1 Ack=1562393 Win=982016 Len=0 TSval=2325784973 TSecr=792412610"
"352","12.895039","192.168.2.2","192.168.1.2","TCP","83","43520","[TCP Out-Of-Order] 8000  >  59456 [PSH, ACK] Seq=1 Ack=144 Win=43520 Len=17 TSval=2325785327 TSecr=792412608"
"355","13.085562","192.168.2.2","192.168.1.2","TCP","66","982016","5001  >  45854 [ACK] Seq=1 Ack=1627553 Win=982016 Len=0 TSval=2325785518 TSecr=792412611"
"360","13.630571","192.168.2.2","192.168.1.2","TCP","66","1001472","5001  >  45854 [ACK] Seq=1 Ack=1653617 Win=1001472 Len=0 TSval=2325786063 TSecr=792412612"
"362","13.849203","192.168.2.2","192.168.1.2","TCP","1514","43520","8000  >  59456 [ACK] Seq=14498 Ack=144 Win=43520 Len=1448 TSval=2325786281 TSecr=792412636 [TCP segment of a reassembled PDU]"
"364","13.849206","192.168.2.2","192.168.1.2","TCP","66","1011712","5001  >  45854 [ACK] Seq=1 Ack=1659409 Win=1011712 Len=0 TSval=2325786281 TSecr=792412636"
"366","13.898169","192.168.2.2","192.168.1.2","TCP","2962","43520","8000  >  59456 [ACK] Seq=15946 Ack=144 Win=43520 Len=2896 TSval=2325786330 TSecr=792412636 [TCP segment of a reassembled PDU]"
"369","13.910396","192.168.2.2","192.168.1.2","TCP","66","997888","5001  >  45854 [ACK] Seq=1 Ack=1692713 Win=997888 Len=0 TSval=2325786333 TSecr=792412721"
"370","13.910902","192.168.2.2","192.168.1.2","TCP","2962","43520","8000  >  59456 [ACK] Seq=18842 Ack=144 Win=43520 Len=2896 TSval=2325786333 TSecr=792412697 [TCP segment of a reassembled PDU]"
"372","13.935341","192.168.2.2","192.168.1.2","TCP","1514","43520","8000  >  59456 [ACK] Seq=21738 Ack=144 Win=43520 Len=1448 TSval=2325786336 TSecr=792412697 [TCP segment of a reassembled PDU]"
"374","13.948048","192.168.2.2","192.168.1.2","TCP","2962","43520","8000  >  59456 [ACK] Seq=23186 Ack=144 Win=43520 Len=2896 TSval=2325786338 TSecr=792412697 [TCP segment of a reassembled PDU]"
"376","13.971639","192.168.2.2","192.168.1.2","TCP","2962","43520","8000  >  59456 [ACK] Seq=26082 Ack=144 Win=43520 Len=2896 TSval=2325786343 TSecr=792412697 [TCP segment of a reassembled PDU]"
"378","13.996094","192.168.2.2","192.168.1.2","TCP","2962","43520","8000  >  59456 [ACK] Seq=28978 Ack=144 Win=43520 Len=2896 TSval=2325786380 TSecr=792412697 [TCP segment of a reassembled PDU]"
"380","14.020584","192.168.2.2","192.168.1.2","TCP","2962","43520","8000  >  59456 [ACK] Seq=31874 Ack=144 Win=43520 Len=2896 TSval=2325786404 TSecr=792412697 [TCP segment of a reassembled PDU]"
"382","14.045093","192.168.2.2","192.168.1.2","TCP","2962","43520","8000  >  59456 [ACK] Seq=34770 Ack=144 Win=43520 Len=2896 TSval=2325786428 TSecr=792412697 [TCP segment of a reassembled PDU]"
"385","14.068566","192.168.2.2","192.168.1.2","TCP","1514","43520","8000  >  59456 [ACK] Seq=37666 Ack=144 Win=43520 Len=1448 TSval=2325786453 TSecr=792412697 [TCP segment of a reassembled PDU]"
"387","14.179340","192.168.2.2","192.168.1.2","TCP","66","982016","5001  >  45854 [ACK] Seq=1 Ack=1757873 Win=982016 Len=0 TSval=2325786612 TSecr=792412721"
"388","14.724438","192.168.2.2","192.168.1.2","TCP","1514","43520","8000  >  59456 [ACK] Seq=39114 Ack=144 Win=43520 Len=1448 TSval=2325787157 TSecr=792412721 [TCP segment of a reassembled PDU]"
"390","14.725093","192.168.2.2","192.168.1.2","TCP","66","1006080","5001  >  45854 [ACK] Seq=1 Ack=1775249 Win=1006080 Len=0 TSval=2325787157 TSecr=792412721"
"391","14.870383","192.168.2.2","192.168.1.2","TCP","1514","43520","8000  >  59456 [ACK] Seq=40562 Ack=144 Win=43520 Len=1448 TSval=2325787303 TSecr=792412763 [TCP segment of a reassembled PDU]"
"393","14.871012","192.168.2.2","192.168.1.2","TCP","66","990720","5001  >  45854 [ACK] Seq=1 Ack=1823033 Win=990720 Len=0 TSval=2325787303 TSecr=792413145"
"396","15.271544","192.168.2.2","192.168.1.2","TCP","66","982016","5001  >  45854 [ACK] Seq=1 Ack=1888193 Win=982016 Len=0 TSval=2325787704 TSecr=792413146"
"397","15.815786","192.168.2.2","192.168.1.2","TCP","66","1006080","5001  >  45854 [ACK] Seq=1 Ack=1905569 Win=1006080 Len=0 TSval=2325788248 TSecr=792413146"
"399","15.962544","192.168.2.2","192.168.1.2","TCP","66","990720","5001  >  45854 [ACK] Seq=1 Ack=1953353 Win=990720 Len=0 TSval=2325788395 TSecr=792413690"
"401","16.362813","192.168.2.2","192.168.1.2","TCP","66","982016","5001  >  45854 [ACK] Seq=1 Ack=2018513 Win=982016 Len=0 TSval=2325788795 TSecr=792413690"
"402","16.907851","192.168.2.2","192.168.1.2","TCP","66","1048576","5001  >  45854 [ACK] Seq=1 Ack=2035889 Win=1048576 Len=0 TSval=2325789340 TSecr=792414171"
"403","17.053180","192.168.2.2","192.168.1.2","TCP","66","1144320","5001  >  45854 [ACK] Seq=1 Ack=2083673 Win=1144320 Len=0 TSval=2325789485 TSecr=792414235"
"408","17.454254","192.168.2.2","192.168.1.2","TCP","1514","43520","8000  >  59456 [ACK] Seq=42010 Ack=144 Win=43520 Len=1448 TSval=2325789886 TSecr=792414453 [TCP segment of a reassembled PDU]"
"410","17.454257","192.168.2.2","192.168.1.2","TCP","66","1176064","5001  >  45854 [ACK] Seq=1 Ack=2099601 Win=1176064 Len=0 TSval=2325789887 TSecr=792414453"
"422","17.587311","192.168.2.2","192.168.1.2","TCP","2962","43520","8000  >  59456 [ACK] Seq=43458 Ack=144 Win=43520 Len=2896 TSval=2325790020 TSecr=792414502 [TCP segment of a reassembled PDU]"
"424","17.599004","192.168.2.2","192.168.1.2","TCP","2962","43520","8000  >  59456 [ACK] Seq=46354 Ack=144 Win=43520 Len=2896 TSval=2325790022 TSecr=792414625 [TCP segment of a reassembled PDU]"
"427","17.623744","192.168.2.2","192.168.1.2","TCP","2962","43520","8000  >  59456 [ACK] Seq=49250 Ack=144 Win=43520 Len=2896 TSval=2325790025 TSecr=792415329 [TCP segment of a reassembled PDU]"
"431","17.649537","192.168.2.2","192.168.1.2","TCP","66","1179136","5001  >  45854 [ACK] Seq=1 Ack=2101049 Win=1179136 Len=0 TSval=2325790027 TSecr=792417657"
"433","17.650096","192.168.2.2","192.168.1.2","TCP","2962","43520","8000  >  59456 [ACK] Seq=52146 Ack=144 Win=43520 Len=2896 TSval=2325790031 TSecr=792415475 [TCP segment of a reassembled PDU]"
"435","17.674420","192.168.2.2","192.168.1.2","TCP","66","1181696","5001  >  45854 [ACK] Seq=1 Ack=2102497 Win=1181696 Len=0 TSval=2325790040 TSecr=792417671"
"437","17.674832","192.168.2.2","192.168.1.2","TCP","66","1184768","5001  >  45854 [ACK] Seq=1 Ack=2103945 Win=1184768 Len=0 TSval=2325790051 TSecr=792417685"
"438","17.675375","192.168.2.2","192.168.1.2","TCP","2962","43520","8000  >  59456 [ACK] Seq=55042 Ack=144 Win=43520 Len=2896 TSval=2325790056 TSecr=792415475 [TCP segment of a reassembled PDU]"
"442","17.700371","192.168.2.2","192.168.1.2","TCP","66","1187840","5001  >  45854 [ACK] Seq=1 Ack=2105393 Win=1187840 Len=0 TSval=2325790065 TSecr=792418059"
"444","17.700881","192.168.2.2","192.168.1.2","TCP","66","1190400","5001  >  45854 [ACK] Seq=1 Ack=2106841 Win=1190400 Len=0 TSval=2325790077 TSecr=792418069"
"445","17.701427","192.168.2.2","192.168.1.2","TCP","2962","43520","8000  >  59456 [ACK] Seq=57938 Ack=144 Win=43520 Len=2896 TSval=2325790082 TSecr=792418059 [TCP segment of a reassembled PDU]"
"448","17.726330","192.168.2.2","192.168.1.2","TCP","66","1193472","5001  >  45854 [ACK] Seq=1 Ack=2108289 Win=1193472 Len=0 TSval=2325790089 TSecr=792418079"
"450","17.726332","192.168.2.2","192.168.1.2","TCP","66","1196544","5001  >  45854 [ACK] Seq=1 Ack=2109737 Win=1196544 Len=0 TSval=2325790101 TSecr=792418090"
"451","17.727225","192.168.2.2","192.168.1.2","TCP","2962","43520","8000  >  59456 [ACK] Seq=60834 Ack=144 Win=43520 Len=2896 TSval=2325790108 TSecr=792418059 [TCP segment of a reassembled PDU]"
"454","17.750964","192.168.2.2","192.168.1.2","TCP","66","1199104","5001  >  45854 [ACK] Seq=1 Ack=2111185 Win=1199104 Len=0 TSval=2325790114 TSecr=792418100"
"456","17.751449","192.168.2.2","192.168.1.2","TCP","66","1202176","5001  >  45854 [ACK] Seq=1 Ack=2112633 Win=1202176 Len=0 TSval=2325790125 TSecr=792418110"
"457","17.751982","192.168.2.2","192.168.1.2","TCP","2962","43520","8000  >  59456 [ACK] Seq=63730 Ack=144 Win=43520 Len=2896 TSval=2325790134 TSecr=792418059 [TCP segment of a reassembled PDU]"
"460","17.776308","192.168.2.2","192.168.1.2","TCP","66","1205248","5001  >  45854 [ACK] Seq=1 Ack=2114081 Win=1205248 Len=0 TSval=2325790138 TSecr=792418120"
"462","17.776736","192.168.2.2","192.168.1.2","TCP","66","1207808","5001  >  45854 [ACK] Seq=1 Ack=2115529 Win=1207808 Len=0 TSval=2325790150 TSecr=792418130"
"463","17.777277","192.168.2.2","192.168.1.2","TCP","2962","43520","8000  >  59456 [ACK] Seq=66626 Ack=144 Win=43520 Len=2896 TSval=2325790160 TSecr=792418059 [TCP segment of a reassembled PDU]"
"466","17.801525","192.168.2.2","192.168.1.2","TCP","66","1210880","5001  >  45854 [ACK] Seq=1 Ack=2116977 Win=1210880 Len=0 TSval=2325790162 TSecr=792418140"
"468","17.802036","192.168.2.2","192.168.1.2","TCP","66","1213952","5001  >  45854 [ACK] Seq=1 Ack=2118425 Win=1213952 Len=0 TSval=2325790174 TSecr=792418150"
"469","17.802560","192.168.2.2","192.168.1.2","TCP","1514","43520","8000  >  59456 [ACK] Seq=69522 Ack=144 Win=43520 Len=1448 TSval=2325790184 TSecr=792418059 [TCP segment of a reassembled PDU]"
"472","17.815490","192.168.2.2","192.168.1.2","TCP","66","1216512","5001  >  45854 [ACK] Seq=1 Ack=2119873 Win=1216512 Len=0 TSval=2325790186 TSecr=792418161"
"473","17.815495","192.168.2.2","192.168.1.2","TCP","2962","43520","8000  >  59456 [ACK] Seq=70970 Ack=144 Win=43520 Len=2896 TSval=2325790199 TSecr=792418192 [TCP segment of a reassembled PDU]"
"476","17.839987","192.168.2.2","192.168.1.2","TCP","66","1219584","5001  >  45854 [ACK] Seq=1 Ack=2121321 Win=1219584 Len=0 TSval=2325790199 TSecr=792418254"
"478","17.839992","192.168.2.2","192.168.1.2","TCP","2962","43520","8000  >  59456 [ACK] Seq=73866 Ack=144 Win=43520 Len=2896 TSval=2325790210 TSecr=792418228 [TCP segment of a reassembled PDU]"
"480","17.864460","192.168.2.2","192.168.1.2","TCP","66","1222656","5001  >  45854 [ACK] Seq=1 Ack=2122769 Win=1222656 Len=0 TSval=2325790212 TSecr=792418279"
"482","17.864694","192.168.2.2","192.168.1.2","TCP","66","1225216","5001  >  45854 [ACK] Seq=1 Ack=2124217 Win=1225216 Len=0 TSval=2325790225 TSecr=792418290"
"483","17.865229","192.168.2.2","192.168.1.2","TCP","66","1228288","5001  >  45854 [ACK] Seq=1 Ack=2125665 Win=1228288 Len=0 TSval=2325790237 TSecr=792418305"
"484","17.865724","192.168.2.2","192.168.1.2","TCP","2962","43520","8000  >  59456 [ACK] Seq=76762 Ack=144 Win=43520 Len=2896 TSval=2325790248 TSecr=792418280 [TCP segment of a reassembled PDU]"
"488","17.889973","192.168.2.2","192.168.1.2","TCP","66","1231360","5001  >  45854 [ACK] Seq=1 Ack=2127113 Win=1231360 Len=0 TSval=2325790250 TSecr=792418316"
"489","17.890473","192.168.2.2","192.168.1.2","TCP","66","1233920","5001  >  45854 [ACK] Seq=1 Ack=2128561 Win=1233920 Len=0 TSval=2325790262 TSecr=792418331"
"490","17.891049","192.168.2.2","192.168.1.2","TCP","2962","43520","8000  >  59456 [ACK] Seq=79658 Ack=144 Win=43520 Len=2896 TSval=2325790272 TSecr=792418306 [TCP segment of a reassembled PDU]"
"494","17.915394","192.168.2.2","192.168.1.2","TCP","66","1236992","5001  >  45854 [ACK] Seq=1 Ack=2130009 Win=1236992 Len=0 TSval=2325790274 TSecr=792418342"
"495","17.915778","192.168.2.2","192.168.1.2","TCP","66","1240064","5001  >  45854 [ACK] Seq=1 Ack=2131457 Win=1240064 Len=0 TSval=2325790287 TSecr=792418355"
"496","17.916317","192.168.2.2","192.168.1.2","TCP","1514","43520","8000  >  59456 [ACK] Seq=82554 Ack=144 Win=43520 Len=1448 TSval=2325790298 TSecr=792418332 [TCP segment of a reassembled PDU]"
"499","17.929129","192.168.2.2","192.168.1.2","TCP","66","1242624","5001  >  45854 [ACK] Seq=1 Ack=2132905 Win=1242624 Len=0 TSval=2325790299 TSecr=792418367"
"500","17.929132","192.168.2.2","192.168.1.2","TCP","2962","43520","8000  >  59456 [ACK] Seq=84002 Ack=144 Win=43520 Len=2896 TSval=2325790299 TSecr=792418356 [TCP segment of a reassembled PDU]"
"503","17.953194","192.168.2.2","192.168.1.2","TCP","66","1245696","5001  >  45854 [ACK] Seq=1 Ack=2134353 Win=1245696 Len=0 TSval=2325790311 TSecr=792418381"
"504","17.953685","192.168.2.2","192.168.1.2","TCP","2962","43520","8000  >  59456 [ACK] Seq=86898 Ack=144 Win=43520 Len=2896 TSval=2325790323 TSecr=792418382 [TCP segment of a reassembled PDU]"
"507","17.978591","192.168.2.2","192.168.1.2","TCP","66","1248768","5001  >  45854 [ACK] Seq=1 Ack=2135801 Win=1248768 Len=0 TSval=2325790324 TSecr=792418392"
"508","17.978593","192.168.2.2","192.168.1.2","TCP","66","1251328","5001  >  45854 [ACK] Seq=1 Ack=2137249 Win=1251328 Len=0 TSval=2325790336 TSecr=792418406"
"509","17.978959","192.168.2.2","192.168.1.2","TCP","66","1254400","5001  >  45854 [ACK] Seq=1 Ack=2138697 Win=1254400 Len=0 TSval=2325790349 TSecr=792418418"
"511","17.979527","192.168.2.2","192.168.1.2","TCP","2962","43520","8000  >  59456 [ACK] Seq=89794 Ack=144 Win=43520 Len=2896 TSval=2325790361 TSecr=792418420 [TCP segment of a reassembled PDU]"
"513","18.003744","192.168.2.2","192.168.1.2","TCP","66","1256960","5001  >  45854 [ACK] Seq=1 Ack=2140145 Win=1256960 Len=0 TSval=2325790361 TSecr=792418429"
"515","18.004271","192.168.2.2","192.168.1.2","TCP","66","1260032","5001  >  45854 [ACK] Seq=1 Ack=2141593 Win=1260032 Len=0 TSval=2325790374 TSecr=792418444"
"516","18.004794","192.168.2.2","192.168.1.2","TCP","66","1263104","5001  >  45854 [ACK] Seq=1 Ack=2143041 Win=1263104 Len=0 TSval=2325790386 TSecr=792418469"
"517","18.005320","192.168.2.2","192.168.1.2","TCP","2962","43520","8000  >  59456 [ACK] Seq=92690 Ack=144 Win=43520 Len=2896 TSval=2325790386 TSecr=792418444 [TCP segment of a reassembled PDU]"
"520","18.029600","192.168.2.2","192.168.1.2","TCP","66","1265664","5001  >  45854 [ACK] Seq=1 Ack=2144489 Win=1265664 Len=0 TSval=2325790399 TSecr=792418480"
"521","18.030069","192.168.2.2","192.168.1.2","TCP","66","1268736","5001  >  45854 [ACK] Seq=1 Ack=2145937 Win=1268736 Len=0 TSval=2325790411 TSecr=792418491"
"522","18.030586","192.168.2.2","192.168.1.2","TCP","2962","43520","8000  >  59456 [ACK] Seq=95586 Ack=144 Win=43520 Len=2896 TSval=2325790412 TSecr=792418470 [TCP segment of a reassembled PDU]"
"526","18.055063","192.168.2.2","192.168.1.2","TCP","66","1271808","5001  >  45854 [ACK] Seq=1 Ack=2147385 Win=1271808 Len=0 TSval=2325790423 TSecr=792418503"
"527","18.055353","192.168.2.2","192.168.1.2","TCP","66","1274368","5001  >  45854 [ACK] Seq=1 Ack=2148833 Win=1274368 Len=0 TSval=2325790435 TSecr=792418515"
"529","18.055876","192.168.2.2","192.168.1.2","TCP","2962","43520","8000  >  59456 [ACK] Seq=98482 Ack=144 Win=43520 Len=2896 TSval=2325790438 TSecr=792418495 [TCP segment of a reassembled PDU]"
"533","18.080466","192.168.2.2","192.168.1.2","TCP","66","1280512","5001  >  45854 [ACK] Seq=1 Ack=2151729 Win=1280512 Len=0 TSval=2325790448 TSecr=792418526"
"534","18.080627","192.168.2.2","192.168.1.2","TCP","2962","43520","8000  >  59456 [ACK] Seq=101378 Ack=144 Win=43520 Len=2896 TSval=2325790463 TSecr=792418521 [TCP segment of a reassembled PDU]"
"539","18.104998","192.168.2.2","192.168.1.2","TCP","66","1286144","5001  >  45854 [ACK] Seq=1 Ack=2154625 Win=1286144 Len=0 TSval=2325790473 TSecr=792418544"
"540","18.105373","192.168.2.2","192.168.1.2","TCP","2962","43520","8000  >  59456 [ACK] Seq=104274 Ack=144 Win=43520 Len=2896 TSval=2325790488 TSecr=792418533 [TCP segment of a reassembled PDU]"
"544","18.129627","192.168.2.2","192.168.1.2","TCP","66","1291776","5001  >  45854 [ACK] Seq=1 Ack=2157521 Win=1291776 Len=0 TSval=2325790498 TSecr=792418562"
"545","18.130129","192.168.2.2","192.168.1.2","TCP","2962","43520","8000  >  59456 [ACK] Seq=107170 Ack=144 Win=43520 Len=2896 TSval=2325790513 TSecr=792418558 [TCP segment of a reassembled PDU]"
"549","18.154889","192.168.2.2","192.168.1.2","TCP","66","1294848","5001  >  45854 [ACK] Seq=1 Ack=2158969 Win=1294848 Len=0 TSval=2325790522 TSecr=792418583"
"550","18.154891","192.168.2.2","192.168.1.2","TCP","66","1297920","5001  >  45854 [ACK] Seq=1 Ack=2160417 Win=1297920 Len=0 TSval=2325790534 TSecr=792418608"
"551","18.155855","192.168.2.2","192.168.1.2","TCP","2962","43520","8000  >  59456 [ACK] Seq=110066 Ack=144 Win=43520 Len=2896 TSval=2325790538 TSecr=792418584 [TCP segment of a reassembled PDU]"
"555","18.180433","192.168.2.2","192.168.1.2","TCP","66","1300480","5001  >  45854 [ACK] Seq=1 Ack=2161865 Win=1300480 Len=0 TSval=2325790547 TSecr=792418623"
"556","18.180436","192.168.2.2","192.168.1.2","TCP","66","1303552","5001  >  45854 [ACK] Seq=1 Ack=2163313 Win=1303552 Len=0 TSval=2325790560 TSecr=792418638"
