"No.","Time","Source","Destination","Protocol","Length","Calculated window size","Info"
"4","0.000371","192.168.2.2","192.168.1.2","TCP","74","43440","5001  >  45842 [SYN, ACK] Seq=0 Ack=1 Win=43440 Len=0 MSS=1460 SACK_PERM=1 TSval=2325361384 TSecr=791989556 WS=512"
"7","0.000425","192.168.2.2","192.168.1.2","TCP","66","39936","5001  >  45842 [ACK] Seq=1 Ack=7241 Win=39936 Len=0 TSval=2325361384 TSecr=791989556"
"13","0.051042","192.168.2.2","192.168.1.2","TCP","66","38400","5001  >  45842 [ACK] Seq=1 Ack=17377 Win=38400 Len=0 TSval=2325361435 TSecr=791989556"
"17","0.134613","192.168.2.2","192.168.1.2","TCP","66","38400","5001  >  45842 [ACK] Seq=1 Ack=27513 Win=38400 Len=0 TSval=2325361518 TSecr=791989557"
"20","0.219322","192.168.2.2","192.168.1.2","TCP","66","42496","5001  >  45842 [ACK] Seq=1 Ack=28961 Win=42496 Len=0 TSval=2325361603 TSecr=791989558"
"22","0.231622","192.168.2.2","192.168.1.2","TCP","66","42496","5001  >  45842 [ACK] Seq=1 Ack=30409 Win=42496 Len=0 TSval=2325361615 TSecr=791989571"
"25","0.244234","192.168.2.2","192.168.1.2","TCP","66","35328","5001  >  45842 [ACK] Seq=1 Ack=46337 Win=35328 Len=0 TSval=2325361628 TSecr=791989607"
"29","0.377569","192.168.2.2","192.168.1.2","TCP","66","41984","5001  >  45842 [ACK] Seq=1 Ack=49233 Win=41984 Len=0 TSval=2325361761 TSecr=791989607"
"31","0.402074","192.168.2.2","192.168.1.2","TCP","66","45568","5001  >  45842 [ACK] Seq=1 Ack=50681 Win=45568 Len=0 TSval=2325361786 TSecr=791989635"
"33","0.413836","192.168.2.2","192.168.1.2","TCP","66","75776","5001  >  45842 [ACK] Seq=1 Ack=65913 Win=75776 Len=0 TSval=2325361797 TSecr=791989690"
"37","0.542164","192.168.2.2","192.168.1.2","TCP","78","75776","[TCP Dup ACK 33#1] 5001  >  45842 [ACK] Seq=1 Ack=65913 Win=75776 Len=0 TSval=2325361926 TSecr=791989747 SLE=65161 SRE=65913"
"39","0.548023","192.168.2.2","192.168.1.2","TCP","66","84480","5001  >  45842 [ACK] Seq=1 Ack=70257 Win=84480 Len=0 TSval=2325361932 TSecr=791989775"
"41","0.584380","192.168.2.2","192.168.1.2","TCP","66","87552","5001  >  45842 [ACK] Seq=1 Ack=71705 Win=87552 Len=0 TSval=2325361968 TSecr=791989787"
"43","0.596454","192.168.2.2","192.168.1.2","TCP","66","90112","5001  >  45842 [ACK] Seq=1 Ack=72401 Win=90112 Len=0 TSval=2325361980 TSecr=791989787"
"45","0.602883","192.168.2.2","192.168.1.2","TCP","66","93184","5001  >  45842 [ACK] Seq=1 Ack=81089 Win=93184 Len=0 TSval=2325361986 TSecr=791989800"
"47","0.675379","192.168.2.2","192.168.1.2","TCP","66","93184","5001  >  45842 [ACK] Seq=1 Ack=89777 Win=93184 Len=0 TSval=2325362059 TSecr=791989933"
"50","0.747961","192.168.2.2","192.168.1.2","TCP","66","95232","5001  >  45842 [ACK] Seq=1 Ack=94121 Win=95232 Len=0 TSval=2325362131 TSecr=791989958"
"52","0.785087","192.168.2.2","192.168.1.2","TCP","66","86528","5001  >  45842 [ACK] Seq=1 Ack=115841 Win=86528 Len=0 TSval=2325362169 TSecr=791989969"
"54","0.966289","192.168.2.2","192.168.1.2","TCP","66","86528","5001  >  45842 [ACK] Seq=1 Ack=137561 Win=86528 Len=0 TSval=2325362350 TSecr=791989969"
"60","1.148316","192.168.2.2","192.168.1.2","TCP","66","101376","5001  >  45842 [ACK] Seq=1 Ack=140457 Win=101376 Len=0 TSval=2325362532 TSecr=791990098"
"62","1.172998","192.168.2.2","192.168.1.2","TCP","66","127488","5001  >  45842 [ACK] Seq=1 Ack=153489 Win=127488 Len=0 TSval=2325362556 TSecr=791990104"
"65","1.281730","192.168.2.2","192.168.1.2","TCP","66","135680","5001  >  45842 [ACK] Seq=1 Ack=157833 Win=135680 Len=0 TSval=2325362665 TSecr=791990140"
"68","1.317961","192.168.2.2","192.168.1.2","TCP","66","138752","5001  >  45842 [ACK] Seq=1 Ack=159281 Win=138752 Len=0 TSval=2325362701 TSecr=791990152"
"70","1.330696","192.168.2.2","192.168.1.2","TCP","66","168960","5001  >  45842 [ACK] Seq=1 Ack=174273 Win=168960 Len=0 TSval=2325362714 TSecr=791990158"
"76","1.455734","192.168.2.2","192.168.1.2","TCP","66","180224","5001  >  45842 [ACK] Seq=1 Ack=180065 Win=180224 Len=0 TSval=2325362839 TSecr=791990231"
"78","1.505112","192.168.2.2","192.168.1.2","TCP","66","183296","5001  >  45842 [ACK] Seq=1 Ack=181001 Win=183296 Len=0 TSval=2325362889 TSecr=791990231"
"80","1.512185","192.168.2.2","192.168.1.2","TCP","66","197632","5001  >  45842 [ACK] Seq=1 Ack=188241 Win=197632 Len=0 TSval=2325362896 TSecr=791990303"
"83","1.572758","192.168.2.2","192.168.1.2","TCP","66","223744","5001  >  45842 [ACK] Seq=1 Ack=201273 Win=223744 Len=0 TSval=2325362956 TSecr=791990341"
"85","1.681758","192.168.2.2","192.168.1.2","TCP","66","226816","5001  >  45842 [ACK] Seq=1 Ack=202721 Win=226816 Len=0 TSval=2325363065 TSecr=791990522"
"88","1.695917","192.168.2.2","192.168.1.2","TCP","66","270336","5001  >  45842 [ACK] Seq=1 Ack=224441 Win=270336 Len=0 TSval=2325363079 TSecr=791990704"
"91","1.877652","192.168.2.2","192.168.1.2","TCP","66","304640","5001  >  45842 [ACK] Seq=1 Ack=246161 Win=304640 Len=0 TSval=2325363261 TSecr=791990729"
"94","2.059502","192.168.2.2","192.168.1.2","TCP","66","304640","5001  >  45842 [ACK] Seq=1 Ack=267881 Win=304640 Len=0 TSval=2325363443 TSecr=791990729"
"96","2.241729","192.168.2.2","192.168.1.2","TCP","66","304640","5001  >  45842 [ACK] Seq=1 Ack=289601 Win=304640 Len=0 TSval=2325363625 TSecr=791990837"
"100","2.423389","192.168.2.2","192.168.1.2","TCP","66","310784","5001  >  45842 [ACK] Seq=1 Ack=292497 Win=310784 Len=0 TSval=2325363807 TSecr=791990843"
"102","2.448375","192.168.2.2","192.168.1.2","TCP","66","319488","5001  >  45842 [ACK] Seq=1 Ack=296841 Win=319488 Len=0 TSval=2325363832 TSecr=791990873"
"104","2.484669","192.168.2.2","192.168.1.2","TCP","66","348160","5001  >  45842 [ACK] Seq=1 Ack=311321 Win=348160 Len=0 TSval=2325363868 TSecr=791990886"
"106","2.605119","192.168.2.2","192.168.1.2","TCP","66","391680","5001  >  45842 [ACK] Seq=1 Ack=333041 Win=391680 Len=0 TSval=2325363989 TSecr=791990886"
"108","2.787294","192.168.2.2","192.168.1.2","TCP","66","435200","5001  >  45842 [ACK] Seq=1 Ack=354761 Win=435200 Len=0 TSval=2325364171 TSecr=791991011"
"111","2.968696","192.168.2.2","192.168.1.2","TCP","66","454144","5001  >  45842 [ACK] Seq=1 Ack=364297 Win=454144 Len=0 TSval=2325364352 TSecr=791991061"
"114","3.048387","192.168.2.2","192.168.1.2","TCP","66","477184","5001  >  45842 [ACK] Seq=1 Ack=375881 Win=477184 Len=0 TSval=2325364432 TSecr=791991068"
"116","3.145821","192.168.2.2","192.168.1.2","TCP","66","480256","5001  >  45842 [ACK] Seq=1 Ack=376481 Win=480256 Len=0 TSval=2325364529 TSecr=791991068"
"118","3.150691","192.168.2.2","192.168.1.2","TCP","66","481280","5001  >  45842 [ACK] Seq=1 Ack=398201 Win=481280 Len=0 TSval=2325364534 TSecr=791991128"
"120","3.332409","192.168.2.2","192.168.1.2","TCP","66","483840","5001  >  45842 [ACK] Seq=1 Ack=415577 Win=483840 Len=0 TSval=2325364716 TSecr=791991237"
"122","3.477940","192.168.2.2","192.168.1.2","TCP","66","489984","5001  >  45842 [ACK] Seq=1 Ack=419921 Win=489984 Len=0 TSval=2325364861 TSecr=791991251"
"124","3.514131","192.168.2.2","192.168.1.2","TCP","66","483840","5001  >  45842 [ACK] Seq=1 Ack=437297 Win=483840 Len=0 TSval=2325364898 TSecr=791991355"
"126","3.660101","192.168.2.2","192.168.1.2","TCP","66","489984","5001  >  45842 [ACK] Seq=1 Ack=441641 Win=489984 Len=0 TSval=2325365044 TSecr=791991433"
"129","3.696423","192.168.2.2","192.168.1.2","TCP","66","492032","5001  >  45842 [ACK] Seq=1 Ack=463361 Win=492032 Len=0 TSval=2325365080 TSecr=791991615"
"131","3.878521","192.168.2.2","192.168.1.2","TCP","66","492032","5001  >  45842 [ACK] Seq=1 Ack=485081 Win=492032 Len=0 TSval=2325365262 TSecr=791991797"
"134","4.060710","192.168.2.2","192.168.1.2","TCP","66","494080","5001  >  45842 [ACK] Seq=1 Ack=502457 Win=494080 Len=0 TSval=2325365444 TSecr=791991867"
"136","4.205672","192.168.2.2","192.168.1.2","TCP","66","499712","5001  >  45842 [ACK] Seq=1 Ack=505353 Win=499712 Len=0 TSval=2325365589 TSecr=791991979"
"138","4.230191","192.168.2.2","192.168.1.2","TCP","66","501760","5001  >  45842 [ACK] Seq=1 Ack=506801 Win=501760 Len=0 TSval=2325365614 TSecr=791992004"
"140","4.241962","192.168.2.2","192.168.1.2","TCP","66","494080","5001  >  45842 [ACK] Seq=1 Ack=524177 Win=494080 Len=0 TSval=2325365625 TSecr=791992040"
"143","4.386950","192.168.2.2","192.168.1.2","TCP","66","500736","5001  >  45842 [ACK] Seq=1 Ack=528521 Win=500736 Len=0 TSval=2325365770 TSecr=791992161"
"145","4.423277","192.168.2.2","192.168.1.2","TCP","66","492032","5001  >  45842 [ACK] Seq=1 Ack=550241 Win=492032 Len=0 TSval=2325365807 TSecr=791992343"
"147","4.605403","192.168.2.2","192.168.1.2","TCP","66","494080","5001  >  45842 [ACK] Seq=1 Ack=567617 Win=494080 Len=0 TSval=2325365989 TSecr=791992379"
"149","4.750234","192.168.2.2","192.168.1.2","TCP","66","497664","5001  >  45842 [ACK] Seq=1 Ack=577753 Win=497664 Len=0 TSval=2325366134 TSecr=791992524"
"152","4.835763","192.168.2.2","192.168.1.2","TCP","66","501760","5001  >  45842 [ACK] Seq=1 Ack=589337 Win=501760 Len=0 TSval=2325366219 TSecr=791992604"
"154","4.944788","192.168.2.2","192.168.1.2","TCP","66","501760","5001  >  45842 [ACK] Seq=1 Ack=595129 Win=501760 Len=0 TSval=2325366328 TSecr=791992701"
"156","4.981161","192.168.2.2","192.168.1.2","TCP","66","501760","5001  >  45842 [ACK] Seq=1 Ack=629881 Win=501760 Len=0 TSval=2325366365 TSecr=791992888"
"163","5.271847","192.168.2.2","192.168.1.2","TCP","66","500736","5001  >  45842 [ACK] Seq=1 Ack=634225 Win=500736 Len=0 TSval=2325366655 TSecr=791993033"
"165","5.308668","192.168.2.2","192.168.1.2","TCP","66","499712","5001  >  45842 [ACK] Seq=1 Ack=640017 Win=499712 Len=0 TSval=2325366692 TSecr=791993070"
"167","5.356705","192.168.2.2","192.168.1.2","TCP","66","494592","5001  >  45842 [ACK] Seq=1 Ack=655945 Win=494592 Len=0 TSval=2325366740 TSecr=791993216"
"170","5.489913","192.168.2.2","192.168.1.2","TCP","66","492032","5001  >  45842 [ACK] Seq=1 Ack=677665 Win=492032 Len=0 TSval=2325366873 TSecr=791993252"
"172","5.671485","192.168.2.2","192.168.1.2","TCP","66","516608","5001  >  45842 [ACK] Seq=1 Ack=684905 Win=516608 Len=0 TSval=2325367055 TSecr=791993434"
"175","5.732845","192.168.2.2","192.168.1.2","TCP","66","580096","5001  >  45842 [ACK] Seq=1 Ack=716761 Win=580096 Len=0 TSval=2325367116 TSecr=791993616"
"178","6.000250","192.168.2.2","192.168.1.2","TCP","66","585728","5001  >  45842 [ACK] Seq=1 Ack=719657 Win=585728 Len=0 TSval=2325367384 TSecr=791993761"
"180","6.023531","192.168.2.2","192.168.1.2","TCP","66","588800","5001  >  45842 [ACK] Seq=1 Ack=721105 Win=588800 Len=0 TSval=2325367407 TSecr=791993786"
"182","6.035645","192.168.2.2","192.168.1.2","TCP","66","606208","5001  >  45842 [ACK] Seq=1 Ack=729793 Win=606208 Len=0 TSval=2325367419 TSecr=791993797"
"185","6.108329","192.168.2.2","192.168.1.2","TCP","66","623616","5001  >  45842 [ACK] Seq=1 Ack=738481 Win=623616 Len=0 TSval=2325367492 TSecr=791993915"
"187","6.180980","192.168.2.2","192.168.1.2","TCP","66","632320","5001  >  45842 [ACK] Seq=1 Ack=742825 Win=632320 Len=0 TSval=2325367564 TSecr=791993942"
"189","6.217738","192.168.2.2","192.168.1.2","TCP","66","675840","5001  >  45842 [ACK] Seq=1 Ack=764545 Win=675840 Len=0 TSval=2325367601 TSecr=791993979"
"191","6.399073","192.168.2.2","192.168.1.2","TCP","66","695808","5001  >  45842 [ACK] Seq=1 Ack=774681 Win=695808 Len=0 TSval=2325367783 TSecr=791994161"
"193","6.484199","192.168.2.2","192.168.1.2","TCP","66","730624","5001  >  45842 [ACK] Seq=1 Ack=792057 Win=730624 Len=0 TSval=2325367868 TSecr=791994306"
"195","6.629119","192.168.2.2","192.168.1.2","TCP","66","753664","5001  >  45842 [ACK] Seq=1 Ack=803641 Win=753664 Len=0 TSval=2325368013 TSecr=791994391"
"197","6.726081","192.168.2.2","192.168.1.2","TCP","66","765440","5001  >  45842 [ACK] Seq=1 Ack=809433 Win=765440 Len=0 TSval=2325368110 TSecr=791994500"
"199","6.774518","192.168.2.2","192.168.1.2","TCP","66","785920","5001  >  45842 [ACK] Seq=1 Ack=819569 Win=785920 Len=0 TSval=2325368158 TSecr=791994537"
"202","6.860917","192.168.2.2","192.168.1.2","TCP","66","843776","5001  >  45842 [ACK] Seq=1 Ack=848529 Win=843776 Len=0 TSval=2325368244 TSecr=791994827"
"206","7.103234","192.168.2.2","192.168.1.2","TCP","66","855040","5001  >  45842 [ACK] Seq=1 Ack=854321 Win=855040 Len=0 TSval=2325368487 TSecr=791994864"
"208","7.151625","192.168.2.2","192.168.1.2","TCP","66","878592","5001  >  45842 [ACK] Seq=1 Ack=865905 Win=878592 Len=0 TSval=2325368535 TSecr=791994912"
"210","7.248780","192.168.2.2","192.168.1.2","TCP","66","887296","5001  >  45842 [ACK] Seq=1 Ack=870249 Win=887296 Len=0 TSval=2325368632 TSecr=791994939"
"212","7.285408","192.168.2.2","192.168.1.2","TCP","66","930816","5001  >  45842 [ACK] Seq=1 Ack=891969 Win=930816 Len=0 TSval=2325368669 TSecr=791995045"
"215","7.467969","192.168.2.2","192.168.1.2","TCP","66","945152","5001  >  45842 [ACK] Seq=1 Ack=899209 Win=945152 Len=0 TSval=2325368851 TSecr=791995227"
"217","7.527389","192.168.2.2","192.168.1.2","TCP","66","971264","5001  >  45842 [ACK] Seq=1 Ack=912241 Win=971264 Len=0 TSval=2325368911 TSecr=791995288"
"219","7.636108","192.168.2.2","192.168.1.2","TCP","66","1005056","5001  >  45842 [ACK] Seq=1 Ack=931065 Win=1005056 Len=0 TSval=2325369020 TSecr=791995451"
"221","7.793810","192.168.2.2","192.168.1.2","TCP","66","1011200","5001  >  45842 [ACK] Seq=1 Ack=933961 Win=1011200 Len=0 TSval=2325369177 TSecr=791995556"
"223","7.818314","192.168.2.2","192.168.1.2","TCP","66","1013760","5001  >  45842 [ACK] Seq=1 Ack=935409 Win=1013760 Len=0 TSval=2325369202 TSecr=791995579"
"225","7.829873","192.168.2.2","192.168.1.2","TCP","66","1010176","5001  >  45842 [ACK] Seq=1 Ack=944097 Win=1010176 Len=0 TSval=2325369213 TSecr=791995591"
"228","7.903311","192.168.2.2","192.168.1.2","TCP","66","1010176","5001  >  45842 [ACK] Seq=1 Ack=952785 Win=1010176 Len=0 TSval=2325369287 TSecr=791995664"
"230","7.977060","192.168.2.2","192.168.1.2","TCP","66","1012736","5001  >  45842 [ACK] Seq=1 Ack=957129 Win=1012736 Len=0 TSval=2325369361 TSecr=791995737"
"232","8.013227","192.168.2.2","192.168.1.2","TCP","66","1013760","5001  >  45842 [ACK] Seq=1 Ack=958577 Win=1013760 Len=0 TSval=2325369397 TSecr=791995773"
"234","8.025011","192.168.2.2","192.168.1.2","TCP","66","999424","5001  >  45842 [ACK] Seq=1 Ack=988985 Win=999424 Len=0 TSval=2325369408 TSecr=791995955"
"237","8.279160","192.168.2.2","192.168.1.2","TCP","66","1006592","5001  >  45842 [ACK] Seq=1 Ack=1004913 Win=1006592 Len=0 TSval=2325369663 TSecr=791996040"
"239","8.412907","192.168.2.2","192.168.1.2","TCP","66","1008128","5001  >  45842 [ACK] Seq=1 Ack=1017945 Win=1008128 Len=0 TSval=2325369796 TSecr=791996185"
"241","8.521603","192.168.2.2","192.168.1.2","TCP","66","1011712","5001  >  45842 [ACK] Seq=1 Ack=1023737 Win=1011712 Len=0 TSval=2325369905 TSecr=791996282"
"243","8.570585","192.168.2.2","192.168.1.2","TCP","66","1009664","5001  >  45842 [ACK] Seq=1 Ack=1033873 Win=1009664 Len=0 TSval=2325369954 TSecr=791996330"
"245","8.654840","192.168.2.2","192.168.1.2","TCP","66","1006080","5001  >  45842 [ACK] Seq=1 Ack=1051249 Win=1006080 Len=0 TSval=2325370038 TSecr=791996416"
"247","8.800792","192.168.2.2","192.168.1.2","TCP","66","1008640","5001  >  45842 [ACK] Seq=1 Ack=1062833 Win=1008640 Len=0 TSval=2325370184 TSecr=791996476"
"250","8.897626","192.168.2.2","192.168.1.2","TCP","66","1011712","5001  >  45842 [ACK] Seq=1 Ack=1068625 Win=1011712 Len=0 TSval=2325370281 TSecr=791996659"
"252","8.946808","192.168.2.2","192.168.1.2","TCP","66","1008640","5001  >  45842 [ACK] Seq=1 Ack=1080209 Win=1008640 Len=0 TSval=2325370330 TSecr=791996707"
"254","9.043752","192.168.2.2","192.168.1.2","TCP","66","1012736","5001  >  45842 [ACK] Seq=1 Ack=1084553 Win=1012736 Len=0 TSval=2325370427 TSecr=791996804"
"257","9.079318","192.168.2.2","192.168.1.2","TCP","66","1008128","5001  >  45842 [ACK] Seq=1 Ack=1097585 Win=1008128 Len=0 TSval=2325370463 TSecr=791996841"
"259","9.188687","192.168.2.2","192.168.1.2","TCP","66","1010176","5001  >  45842 [ACK] Seq=1 Ack=1106273 Win=1010176 Len=0 TSval=2325370572 TSecr=791996987"
"261","9.261174","192.168.2.2","192.168.1.2","TCP","66","1011200","5001  >  45842 [ACK] Seq=1 Ack=1113513 Win=1011200 Len=0 TSval=2325370645 TSecr=791997024"
"263","9.321937","192.168.2.2","192.168.1.2","TCP","66","1008128","5001  >  45842 [ACK] Seq=1 Ack=1126545 Win=1008128 Len=0 TSval=2325370705 TSecr=791997083"
"265","9.430635","192.168.2.2","192.168.1.2","TCP","66","1006080","5001  >  45842 [ACK] Seq=1 Ack=1143921 Win=1006080 Len=0 TSval=2325370814 TSecr=791997192"
"267","9.576605","192.168.2.2","192.168.1.2","TCP","66","1012736","5001  >  45842 [ACK] Seq=1 Ack=1148265 Win=1012736 Len=0 TSval=2325370960 TSecr=791997349"
"269","9.612854","192.168.2.2","192.168.1.2","TCP","66","1013760","5001  >  45842 [ACK] Seq=1 Ack=1149713 Win=1013760 Len=0 TSval=2325370996 TSecr=791997374"
"271","9.624389","192.168.2.2","192.168.1.2","TCP","66","1013760","5001  >  45842 [ACK] Seq=1 Ack=1158401 Win=1013760 Len=0 TSval=2325371008 TSecr=791997385"
"273","9.697081","192.168.2.2","192.168.1.2","TCP","66","1013760","5001  >  45842 [ACK] Seq=1 Ack=1167089 Win=1013760 Len=0 TSval=2325371081 TSecr=791997459"
"275","9.769731","192.168.2.2","192.168.1.2","TCP","66","1013760","5001  >  45842 [ACK] Seq=1 Ack=1171433 Win=1013760 Len=0 TSval=2325371153 TSecr=791997533"
"277","9.818579","192.168.2.2","192.168.1.2","TCP","66","1013760","5001  >  45842 [ACK] Seq=1 Ack=1190257 Win=1013760 Len=0 TSval=2325371202 TSecr=791997569"
"280","9.964280","192.168.2.2","192.168.1.2","TCP","66","1013760","5001  >  45842 [ACK] Seq=1 Ack=1219217 Win=1013760 Len=0 TSval=2325371348 TSecr=791997835"
"285","10.206576","192.168.2.2","192.168.1.2","TCP","66","1008128","5001  >  45842 [ACK] Seq=1 Ack=1232249 Win=1008128 Len=0 TSval=2325371590 TSecr=791997968"
"286","10.315544","192.168.2.2","192.168.1.2","TCP","66","1012736","5001  >  45842 [ACK] Seq=1 Ack=1236593 Win=1012736 Len=0 TSval=2325371699 TSecr=791998077"
"287","10.352463","192.168.2.2","192.168.1.2","TCP","66","1008640","5001  >  45842 [ACK] Seq=1 Ack=1248177 Win=1008640 Len=0 TSval=2325371736 TSecr=791998126"
"288","10.448765","192.168.2.2","192.168.1.2","TCP","66","1006080","5001  >  45842 [ACK] Seq=1 Ack=1265553 Win=1006080 Len=0 TSval=2325371832 TSecr=791998210"
"289","10.594325","192.168.2.2","192.168.1.2","TCP","66","1008640","5001  >  45842 [ACK] Seq=1 Ack=1277137 Win=1008640 Len=0 TSval=2325371978 TSecr=791998356"
"290","10.691054","192.168.2.2","192.168.1.2","TCP","66","1011712","5001  >  45842 [ACK] Seq=1 Ack=1282929 Win=1011712 Len=0 TSval=2325372075 TSecr=791998453"
"291","10.739806","192.168.2.2","192.168.1.2","TCP","66","1008640","5001  >  45842 [ACK] Seq=1 Ack=1294513 Win=1008640 Len=0 TSval=2325372123 TSecr=791998502"
"292","10.836832","192.168.2.2","192.168.1.2","TCP","66","1012736","5001  >  45842 [ACK] Seq=1 Ack=1298857 Win=1012736 Len=0 TSval=2325372220 TSecr=791998599"
"294","10.873452","192.168.2.2","192.168.1.2","TCP","66","1013248","5001  >  45842 [ACK] Seq=1 Ack=1301753 Win=1013248 Len=0 TSval=2325372257 TSecr=791998635"
"295","10.897712","192.168.2.2","192.168.1.2","TCP","66","1005056","5001  >  45842 [ACK] Seq=1 Ack=1320577 Win=1005056 Len=0 TSval=2325372281 TSecr=791998744"
"298","11.055318","192.168.2.2","192.168.1.2","TCP","66","1011200","5001  >  45842 [ACK] Seq=1 Ack=1327817 Win=1011200 Len=0 TSval=2325372439 TSecr=791998817"
"299","11.116021","192.168.2.2","192.168.1.2","TCP","66","1008128","5001  >  45842 [ACK] Seq=1 Ack=1340849 Win=1008128 Len=0 TSval=2325372500 TSecr=791998877"
"300","11.225236","192.168.2.2","192.168.1.2","TCP","66","1006080","5001  >  45842 [ACK] Seq=1 Ack=1358225 Win=1006080 Len=0 TSval=2325372609 TSecr=791998986"
"301","11.370201","192.168.2.2","192.168.1.2","TCP","66","1012736","5001  >  45842 [ACK] Seq=1 Ack=1362569 Win=1012736 Len=0 TSval=2325372754 TSecr=791999132"
"302","11.406414","192.168.2.2","192.168.1.2","TCP","66","1013760","5001  >  45842 [ACK] Seq=1 Ack=1364017 Win=1013760 Len=0 TSval=2325372790 TSecr=791999168"
"303","11.418516","192.168.2.2","192.168.1.2","TCP","66","1013248","5001  >  45842 [ACK] Seq=1 Ack=1366913 Win=1013248 Len=0 TSval=2325372802 TSecr=791999180"
"304","11.443673","192.168.2.2","192.168.1.2","TCP","66","1013760","5001  >  45842 [ACK] Seq=1 Ack=1381393 Win=1013760 Len=0 TSval=2325372827 TSecr=791999253"
"305","11.563870","192.168.2.2","192.168.1.2","TCP","66","1013760","5001  >  45842 [ACK] Seq=1 Ack=1385737 Win=1013760 Len=0 TSval=2325372947 TSecr=791999325"
"306","11.600411","192.168.2.2","192.168.1.2","TCP","66","1013760","5001  >  45842 [ACK] Seq=1 Ack=1404561 Win=1013760 Len=0 TSval=2325372984 TSecr=791999374"
"307","11.757698","192.168.2.2","192.168.1.2","TCP","66","1013760","5001  >  45842 [ACK] Seq=1 Ack=1432073 Win=1013760 Len=0 TSval=2325373141 TSecr=791999520"
"309","11.987876","192.168.2.2","192.168.1.2","TCP","66","1013760","5001  >  45842 [ACK] Seq=1 Ack=1433521 Win=1013760 Len=0 TSval=2325373371 TSecr=791999547"
"311","11.999917","192.168.2.2","192.168.1.2","TCP","74","43440","8000  >  59444 [SYN, ACK] Seq=0 Ack=1 Win=43440 Len=0 MSS=1460 SACK_PERM=1 TSval=2325373383 TSecr=791999563 WS=512"
"315","12.001246","192.168.2.2","192.168.1.2","TCP","74","43440","[TCP Out-Of-Order] 8000  >  59444 [SYN, ACK] Seq=0 Ack=1 Win=43440 Len=0 MSS=1460 SACK_PERM=1 TSval=2325373385 TSecr=791999563 WS=512"
"318","12.002649","192.168.2.2","192.168.1.2","TCP","66","1013248","5001  >  45842 [ACK] Seq=1 Ack=1436417 Win=1013248 Len=0 TSval=2325373386 TSecr=792001313"
"323","12.026871","192.168.2.2","192.168.1.2","TCP","66","1013248","5001  >  45842 [ACK] Seq=1 Ack=1439313 Win=1013248 Len=0 TSval=2325373410 TSecr=792001543"
"326","12.052428","192.168.2.2","192.168.1.2","TCP","66","43520","8000  >  59444 [ACK] Seq=1 Ack=144 Win=43520 Len=0 TSval=2325373436 TSecr=792001556"
"327","12.052787","192.168.2.2","192.168.1.2","TCP","83","43520","8000  >  59444 [PSH, ACK] Seq=1 Ack=144 Win=43520 Len=17 TSval=2325373436 TSecr=792001556 [TCP segment of a reassembled PDU]"
"329","12.053412","192.168.2.2","192.168.1.2","TCP","2962","43520","8000  >  59444 [ACK] Seq=18 Ack=144 Win=43520 Len=2896 TSval=2325373437 TSecr=792001556 [TCP segment of a reassembled PDU]"
"331","12.065180","192.168.2.2","192.168.1.2","TCP","66","985600","5001  >  45842 [ACK] Seq=1 Ack=1497233 Win=985600 Len=0 TSval=2325373438 TSecr=792001558"
"333","12.066131","192.168.2.2","192.168.1.2","TCP","2962","43520","8000  >  59444 [ACK] Seq=2914 Ack=144 Win=43520 Len=2896 TSval=2325373441 TSecr=792001557 [TCP segment of a reassembled PDU]"
"337","12.090618","192.168.2.2","192.168.1.2","TCP","2962","43520","8000  >  59444 [ACK] Seq=5810 Ack=144 Win=43520 Len=2896 TSval=2325373445 TSecr=792001557 [TCP segment of a reassembled PDU]"
"339","12.114117","192.168.2.2","192.168.1.2","TCP","2962","43520","8000  >  59444 [ACK] Seq=8706 Ack=144 Win=43520 Len=2896 TSval=2325373450 TSecr=792001557 [TCP segment of a reassembled PDU]"
"341","12.138604","192.168.2.2","192.168.1.2","TCP","1514","43520","8000  >  59444 [ACK] Seq=11602 Ack=144 Win=43520 Len=1448 TSval=2325373474 TSecr=792001557 [TCP segment of a reassembled PDU]"
"343","12.203323","192.168.2.2","192.168.1.2","TCP","1514","43520","8000  >  59444 [ACK] Seq=13050 Ack=144 Win=43520 Len=1448 TSval=2325373587 TSecr=792001557 [TCP segment of a reassembled PDU]"
"345","12.463692","192.168.2.2","192.168.1.2","TCP","83","43520","[TCP Out-Of-Order] 8000  >  59444 [PSH, ACK] Seq=1 Ack=144 Win=43520 Len=17 TSval=2325373847 TSecr=792001557"
"347","12.538845","192.168.2.2","192.168.1.2","TCP","66","982016","5001  >  45842 [ACK] Seq=1 Ack=1562393 Win=982016 Len=0 TSval=2325373922 TSecr=792001558"
"352","12.999293","192.168.2.2","192.168.1.2","TCP","83","43520","[TCP Out-Of-Order] 8000  >  59444 [PSH, ACK] Seq=1 Ack=144 Win=43520 Len=17 TSval=2325374383 TSecr=792001557"
"356","13.083990","192.168.2.2","192.168.1.2","TCP","66","982016","5001  >  45842 [ACK] Seq=1 Ack=1627553 Win=982016 Len=0 TSval=2325374467 TSecr=792001559"
"360","13.629136","192.168.2.2","192.168.1.2","TCP","66","1001472","5001  >  45842 [ACK] Seq=1 Ack=1653617 Win=1001472 Len=0 TSval=2325375013 TSecr=792001559"
"362","13.846588","192.168.2.2","192.168.1.2","TCP","66","1011712","5001  >  45842 [ACK] Seq=1 Ack=1659409 Win=1011712 Len=0 TSval=2325375230 TSecr=792001582"
"365","13.895635","192.168.2.2","192.168.1.2","TCP","1514","43520","8000  >  59444 [ACK] Seq=14498 Ack=144 Win=43520 Len=1448 TSval=2325375279 TSecr=792001608 [TCP segment of a reassembled PDU]"
"367","13.896662","192.168.2.2","192.168.1.2","TCP","66","997888","5001  >  45842 [ACK] Seq=1 Ack=1692713 Win=997888 Len=0 TSval=2325375280 TSecr=792001621"
"368","13.897526","192.168.2.2","192.168.1.2","TCP","2962","43520","8000  >  59444 [ACK] Seq=15946 Ack=144 Win=43520 Len=2896 TSval=2325375281 TSecr=792001609 [TCP segment of a reassembled PDU]"
"370","13.920021","192.168.2.2","192.168.1.2","TCP","1514","43520","8000  >  59444 [ACK] Seq=18842 Ack=144 Win=43520 Len=1448 TSval=2325375285 TSecr=792001609 [TCP segment of a reassembled PDU]"
"372","13.932747","192.168.2.2","192.168.1.2","TCP","1514","43520","8000  >  59444 [ACK] Seq=20290 Ack=144 Win=43520 Len=1448 TSval=2325375287 TSecr=792001609 [TCP segment of a reassembled PDU]"
"375","14.175742","192.168.2.2","192.168.1.2","TCP","66","982016","5001  >  45842 [ACK] Seq=1 Ack=1757873 Win=982016 Len=0 TSval=2325375559 TSecr=792001622"
"376","14.720308","192.168.2.2","192.168.1.2","TCP","2962","43520","8000  >  59444 [ACK] Seq=21738 Ack=144 Win=43520 Len=2896 TSval=2325376104 TSecr=792001622 [TCP segment of a reassembled PDU]"
"378","14.732233","192.168.2.2","192.168.1.2","TCP","66","1006080","5001  >  45842 [ACK] Seq=1 Ack=1775249 Win=1006080 Len=0 TSval=2325376104 TSecr=792001623"
"379","14.732307","192.168.2.2","192.168.1.2","TCP","2962","43520","8000  >  59444 [ACK] Seq=24634 Ack=144 Win=43520 Len=2896 TSval=2325376107 TSecr=792001622 [TCP segment of a reassembled PDU]"
"381","14.866391","192.168.2.2","192.168.1.2","TCP","2962","43520","8000  >  59444 [ACK] Seq=27530 Ack=144 Win=43520 Len=2896 TSval=2325376250 TSecr=792001646 [TCP segment of a reassembled PDU]"
"383","14.878103","192.168.2.2","192.168.1.2","TCP","66","990720","5001  >  45842 [ACK] Seq=1 Ack=1823033 Win=990720 Len=0 TSval=2325376252 TSecr=792002094"
"384","14.878355","192.168.2.2","192.168.1.2","TCP","2962","43520","8000  >  59444 [ACK] Seq=30426 Ack=144 Win=43520 Len=2896 TSval=2325376253 TSecr=792002019 [TCP segment of a reassembled PDU]"
"386","14.902609","192.168.2.2","192.168.1.2","TCP","2962","43520","8000  >  59444 [ACK] Seq=33322 Ack=144 Win=43520 Len=2896 TSval=2325376258 TSecr=792002019 [TCP segment of a reassembled PDU]"
"388","14.927061","192.168.2.2","192.168.1.2","TCP","2962","43520","8000  >  59444 [ACK] Seq=36218 Ack=144 Win=43520 Len=2896 TSval=2325376262 TSecr=792002019 [TCP segment of a reassembled PDU]"
"390","14.951530","192.168.2.2","192.168.1.2","TCP","1514","43520","8000  >  59444 [ACK] Seq=39114 Ack=144 Win=43520 Len=1448 TSval=2325376286 TSecr=792002019 [TCP segment of a reassembled PDU]"
"392","14.963281","192.168.2.2","192.168.1.2","TCP","1514","43520","8000  >  59444 [ACK] Seq=40562 Ack=144 Win=43520 Len=1448 TSval=2325376311 TSecr=792002019 [TCP segment of a reassembled PDU]"
"395","15.268680","192.168.2.2","192.168.1.2","TCP","66","982016","5001  >  45842 [ACK] Seq=1 Ack=1888193 Win=982016 Len=0 TSval=2325376652 TSecr=792002095"
"396","15.813639","192.168.2.2","192.168.1.2","TCP","66","1006080","5001  >  45842 [ACK] Seq=1 Ack=1905569 Win=1006080 Len=0 TSval=2325377197 TSecr=792002095"
"398","15.960577","192.168.2.2","192.168.1.2","TCP","66","990720","5001  >  45842 [ACK] Seq=1 Ack=1953353 Win=990720 Len=0 TSval=2325377344 TSecr=792002640"
"400","16.360210","192.168.2.2","192.168.1.2","TCP","66","982016","5001  >  45842 [ACK] Seq=1 Ack=2018513 Win=982016 Len=0 TSval=2325377744 TSecr=792002640"
"401","16.906292","192.168.2.2","192.168.1.2","TCP","66","1048576","5001  >  45842 [ACK] Seq=1 Ack=2035889 Win=1048576 Len=0 TSval=2325378290 TSecr=792003131"
"402","17.051351","192.168.2.2","192.168.1.2","TCP","66","1144320","5001  >  45842 [ACK] Seq=1 Ack=2083673 Win=1144320 Len=0 TSval=2325378435 TSecr=792003185"
"407","17.450717","192.168.2.2","192.168.1.2","TCP","66","1176064","5001  >  45842 [ACK] Seq=1 Ack=2099601 Win=1176064 Len=0 TSval=2325378834 TSecr=792003402"
"419","17.583980","192.168.2.2","192.168.1.2","TCP","1514","43520","8000  >  59444 [ACK] Seq=42010 Ack=144 Win=43520 Len=1448 TSval=2325378967 TSecr=792003451 [TCP segment of a reassembled PDU]"
"421","17.585783","192.168.2.2","192.168.1.2","TCP","2962","43520","8000  >  59444 [ACK] Seq=43458 Ack=144 Win=43520 Len=2896 TSval=2325378969 TSecr=792003488 [TCP segment of a reassembled PDU]"
"424","17.609146","192.168.2.2","192.168.1.2","TCP","2962","43520","8000  >  59444 [ACK] Seq=46354 Ack=144 Win=43520 Len=2896 TSval=2325378973 TSecr=792004458 [TCP segment of a reassembled PDU]"
"428","17.634589","192.168.2.2","192.168.1.2","TCP","66","1179136","5001  >  45842 [ACK] Seq=1 Ack=2101049 Win=1179136 Len=0 TSval=2325378976 TSecr=792006607"
"430","17.635596","192.168.2.2","192.168.1.2","TCP","2962","43520","8000  >  59444 [ACK] Seq=49250 Ack=144 Win=43520 Len=2896 TSval=2325378976 TSecr=792004519 [TCP segment of a reassembled PDU]"
"432","17.659141","192.168.2.2","192.168.1.2","TCP","66","1181696","5001  >  45842 [ACK] Seq=1 Ack=2102497 Win=1181696 Len=0 TSval=2325378989 TSecr=792006618"
"434","17.659401","192.168.2.2","192.168.1.2","TCP","2962","43520","8000  >  59444 [ACK] Seq=52146 Ack=144 Win=43520 Len=2896 TSval=2325378993 TSecr=792004519 [TCP segment of a reassembled PDU]"
"436","17.683761","192.168.2.2","192.168.1.2","TCP","66","1184768","5001  >  45842 [ACK] Seq=1 Ack=2103945 Win=1184768 Len=0 TSval=2325379001 TSecr=792006628"
"439","17.684955","192.168.2.2","192.168.1.2","TCP","66","1187840","5001  >  45842 [ACK] Seq=1 Ack=2105393 Win=1187840 Len=0 TSval=2325379013 TSecr=792007006"
"440","17.685460","192.168.2.2","192.168.1.2","TCP","2962","43520","8000  >  59444 [ACK] Seq=55042 Ack=144 Win=43520 Len=2896 TSval=2325379019 TSecr=792004519 [TCP segment of a reassembled PDU]"
"443","17.709676","192.168.2.2","192.168.1.2","TCP","66","1190400","5001  >  45842 [ACK] Seq=1 Ack=2106841 Win=1190400 Len=0 TSval=2325379028 TSecr=792007016"
"445","17.710212","192.168.2.2","192.168.1.2","TCP","66","1193472","5001  >  45842 [ACK] Seq=1 Ack=2108289 Win=1193472 Len=0 TSval=2325379038 TSecr=792007027"
"446","17.710750","192.168.2.2","192.168.1.2","TCP","2962","43520","8000  >  59444 [ACK] Seq=57938 Ack=144 Win=43520 Len=2896 TSval=2325379043 TSecr=792004519 [TCP segment of a reassembled PDU]"
"449","17.735586","192.168.2.2","192.168.1.2","TCP","66","1196544","5001  >  45842 [ACK] Seq=1 Ack=2109737 Win=1196544 Len=0 TSval=2325379050 TSecr=792007037"
"451","17.735589","192.168.2.2","192.168.1.2","TCP","66","1199104","5001  >  45842 [ACK] Seq=1 Ack=2111185 Win=1199104 Len=0 TSval=2325379062 TSecr=792007047"
"452","17.736012","192.168.2.2","192.168.1.2","TCP","2962","43520","8000  >  59444 [ACK] Seq=60834 Ack=144 Win=43520 Len=2896 TSval=2325379069 TSecr=792004519 [TCP segment of a reassembled PDU]"
"455","17.760250","192.168.2.2","192.168.1.2","TCP","66","1202176","5001  >  45842 [ACK] Seq=1 Ack=2112633 Win=1202176 Len=0 TSval=2325379074 TSecr=792007058"
"457","17.760763","192.168.2.2","192.168.1.2","TCP","66","1205248","5001  >  45842 [ACK] Seq=1 Ack=2114081 Win=1205248 Len=0 TSval=2325379087 TSecr=792007069"
"458","17.761307","192.168.2.2","192.168.1.2","TCP","2962","43520","8000  >  59444 [ACK] Seq=63730 Ack=144 Win=43520 Len=2896 TSval=2325379094 TSecr=792004519 [TCP segment of a reassembled PDU]"
"461","17.785675","192.168.2.2","192.168.1.2","TCP","66","1207808","5001  >  45842 [ACK] Seq=1 Ack=2115529 Win=1207808 Len=0 TSval=2325379098 TSecr=792007079"
"463","17.786058","192.168.2.2","192.168.1.2","TCP","66","1210880","5001  >  45842 [ACK] Seq=1 Ack=2116977 Win=1210880 Len=0 TSval=2325379110 TSecr=792007090"
"464","17.786586","192.168.2.2","192.168.1.2","TCP","2962","43520","8000  >  59444 [ACK] Seq=66626 Ack=144 Win=43520 Len=2896 TSval=2325379120 TSecr=792004519 [TCP segment of a reassembled PDU]"
"467","17.811444","192.168.2.2","192.168.1.2","TCP","66","1213952","5001  >  45842 [ACK] Seq=1 Ack=2118425 Win=1213952 Len=0 TSval=2325379122 TSecr=792007100"
"469","17.811447","192.168.2.2","192.168.1.2","TCP","66","1216512","5001  >  45842 [ACK] Seq=1 Ack=2119873 Win=1216512 Len=0 TSval=2325379135 TSecr=792007111"
"470","17.811859","192.168.2.2","192.168.1.2","TCP","1514","43520","8000  >  59444 [ACK] Seq=69522 Ack=144 Win=43520 Len=1448 TSval=2325379147 TSecr=792007140 [TCP segment of a reassembled PDU]"
"473","17.824212","192.168.2.2","192.168.1.2","TCP","66","1219584","5001  >  45842 [ACK] Seq=1 Ack=2121321 Win=1219584 Len=0 TSval=2325379148 TSecr=792007190"
"474","17.825158","192.168.2.2","192.168.1.2","TCP","2962","43520","8000  >  59444 [ACK] Seq=70970 Ack=144 Win=43520 Len=2896 TSval=2325379148 TSecr=792007165 [TCP segment of a reassembled PDU]"
"476","17.848714","192.168.2.2","192.168.1.2","TCP","66","1222656","5001  >  45842 [ACK] Seq=1 Ack=2122769 Win=1222656 Len=0 TSval=2325379161 TSecr=792007215"
"478","17.849267","192.168.2.2","192.168.1.2","TCP","2962","43520","8000  >  59444 [ACK] Seq=73866 Ack=144 Win=43520 Len=2896 TSval=2325379170 TSecr=792007191 [TCP segment of a reassembled PDU]"
"480","17.874214","192.168.2.2","192.168.1.2","TCP","66","1225216","5001  >  45842 [ACK] Seq=1 Ack=2124217 Win=1225216 Len=0 TSval=2325379173 TSecr=792007239"
"482","17.874216","192.168.2.2","192.168.1.2","TCP","66","1228288","5001  >  45842 [ACK] Seq=1 Ack=2125665 Win=1228288 Len=0 TSval=2325379186 TSecr=792007250"
"483","17.874530","192.168.2.2","192.168.1.2","TCP","66","1231360","5001  >  45842 [ACK] Seq=1 Ack=2127113 Win=1231360 Len=0 TSval=2325379199 TSecr=792007265"
"484","17.875034","192.168.2.2","192.168.1.2","TCP","2962","43520","8000  >  59444 [ACK] Seq=76762 Ack=144 Win=43520 Len=2896 TSval=2325379209 TSecr=792007241 [TCP segment of a reassembled PDU]"
"487","17.899670","192.168.2.2","192.168.1.2","TCP","66","1233920","5001  >  45842 [ACK] Seq=1 Ack=2128561 Win=1233920 Len=0 TSval=2325379212 TSecr=792007275"
"488","17.899792","192.168.2.2","192.168.1.2","TCP","66","1236992","5001  >  45842 [ACK] Seq=1 Ack=2130009 Win=1236992 Len=0 TSval=2325379223 TSecr=792007291"
"489","17.900343","192.168.2.2","192.168.1.2","TCP","1514","43520","8000  >  59444 [ACK] Seq=79658 Ack=144 Win=43520 Len=1448 TSval=2325379233 TSecr=792007266 [TCP segment of a reassembled PDU]"
"491","17.912468","192.168.2.2","192.168.1.2","TCP","2962","43520","8000  >  59444 [ACK] Seq=81106 Ack=144 Win=43520 Len=2896 TSval=2325379235 TSecr=792007266 [TCP segment of a reassembled PDU]"
"493","17.936687","192.168.2.2","192.168.1.2","TCP","66","1240064","5001  >  45842 [ACK] Seq=1 Ack=2131457 Win=1240064 Len=0 TSval=2325379235 TSecr=792007302"
"495","17.937205","192.168.2.2","192.168.1.2","TCP","66","1242624","5001  >  45842 [ACK] Seq=1 Ack=2132905 Win=1242624 Len=0 TSval=2325379248 TSecr=792007316"
"496","17.937722","192.168.2.2","192.168.1.2","TCP","2962","43520","8000  >  59444 [ACK] Seq=84002 Ack=144 Win=43520 Len=2896 TSval=2325379259 TSecr=792007292 [TCP segment of a reassembled PDU]"
"499","17.961974","192.168.2.2","192.168.1.2","TCP","66","1245696","5001  >  45842 [ACK] Seq=1 Ack=2134353 Win=1245696 Len=0 TSval=2325379261 TSecr=792007326"
"500","17.962499","192.168.2.2","192.168.1.2","TCP","66","1248768","5001  >  45842 [ACK] Seq=1 Ack=2135801 Win=1248768 Len=0 TSval=2325379272 TSecr=792007341"
"501","17.963020","192.168.2.2","192.168.1.2","TCP","66","1251328","5001  >  45842 [ACK] Seq=1 Ack=2137249 Win=1251328 Len=0 TSval=2325379285 TSecr=792007352"
"502","17.963554","192.168.2.2","192.168.1.2","TCP","2962","43520","8000  >  59444 [ACK] Seq=86898 Ack=144 Win=43520 Len=2896 TSval=2325379296 TSecr=792007342 [TCP segment of a reassembled PDU]"
"506","17.987765","192.168.2.2","192.168.1.2","TCP","66","1254400","5001  >  45842 [ACK] Seq=1 Ack=2138697 Win=1254400 Len=0 TSval=2325379297 TSecr=792007367"
"508","17.988282","192.168.2.2","192.168.1.2","TCP","66","1256960","5001  >  45842 [ACK] Seq=1 Ack=2140145 Win=1256960 Len=0 TSval=2325379310 TSecr=792007378"
"509","17.988822","192.168.2.2","192.168.1.2","TCP","2962","43520","8000  >  59444 [ACK] Seq=89794 Ack=144 Win=43520 Len=2896 TSval=2325379321 TSecr=792007367 [TCP segment of a reassembled PDU]"
"513","18.013215","192.168.2.2","192.168.1.2","TCP","66","1260032","5001  >  45842 [ACK] Seq=1 Ack=2141593 Win=1260032 Len=0 TSval=2325379322 TSecr=792007404"
"514","18.013546","192.168.2.2","192.168.1.2","TCP","66","1265664","5001  >  45842 [ACK] Seq=1 Ack=2144489 Win=1265664 Len=0 TSval=2325379335 TSecr=792007430"
"515","18.014103","192.168.2.2","192.168.1.2","TCP","2962","43520","8000  >  59444 [ACK] Seq=92690 Ack=144 Win=43520 Len=2896 TSval=2325379347 TSecr=792007405 [TCP segment of a reassembled PDU]"
"519","18.038814","192.168.2.2","192.168.1.2","TCP","66","1271808","5001  >  45842 [ACK] Seq=1 Ack=2147385 Win=1271808 Len=0 TSval=2325379360 TSecr=792007447"
"520","18.039094","192.168.2.2","192.168.1.2","TCP","2962","43520","8000  >  59444 [ACK] Seq=95586 Ack=144 Win=43520 Len=2896 TSval=2325379372 TSecr=792007431 [TCP segment of a reassembled PDU]"
"524","18.063206","192.168.2.2","192.168.1.2","TCP","66","1274368","5001  >  45842 [ACK] Seq=1 Ack=2148833 Win=1274368 Len=0 TSval=2325379385 TSecr=792007492"
"525","18.063596","192.168.2.2","192.168.1.2","TCP","2962","43520","8000  >  59444 [ACK] Seq=98482 Ack=144 Win=43520 Len=2896 TSval=2325379398 TSecr=792007493 [TCP segment of a reassembled PDU]"
"529","18.087833","192.168.2.2","192.168.1.2","TCP","66","1277440","5001  >  45842 [ACK] Seq=1 Ack=2150281 Win=1277440 Len=0 TSval=2325379398 TSecr=792007507"
"530","18.088344","192.168.2.2","192.168.1.2","TCP","66","1280512","5001  >  45842 [ACK] Seq=1 Ack=2151729 Win=1280512 Len=0 TSval=2325379410 TSecr=792007522"
"531","18.088883","192.168.2.2","192.168.1.2","TCP","66","1283072","5001  >  45842 [ACK] Seq=1 Ack=2153177 Win=1283072 Len=0 TSval=2325379423 TSecr=792007533"
"532","18.089415","192.168.2.2","192.168.1.2","TCP","2962","43520","8000  >  59444 [ACK] Seq=101378 Ack=144 Win=43520 Len=2896 TSval=2325379423 TSecr=792007519 [TCP segment of a reassembled PDU]"
"538","18.113635","192.168.2.2","192.168.1.2","TCP","66","1286144","5001  >  45842 [ACK] Seq=1 Ack=2154625 Win=1286144 Len=0 TSval=2325379435 TSecr=792007544"
"539","18.114284","192.168.2.2","192.168.1.2","TCP","2962","43520","8000  >  59444 [ACK] Seq=104274 Ack=144 Win=43520 Len=2896 TSval=2325379447 TSecr=792007544 [TCP segment of a reassembled PDU]"
"542","18.138398","192.168.2.2","192.168.1.2","TCP","66","1289216","5001  >  45842 [ACK] Seq=1 Ack=2156073 Win=1289216 Len=0 TSval=2325379447 TSecr=792007555"
"544","18.138920","192.168.2.2","192.168.1.2","TCP","66","1291776","5001  >  45842 [ACK] Seq=1 Ack=2157521 Win=1291776 Len=0 TSval=2325379459 TSecr=792007566"
"545","18.139446","192.168.2.2","192.168.1.2","TCP","66","1294848","5001  >  45842 [ACK] Seq=1 Ack=2158969 Win=1294848 Len=0 TSval=2325379472 TSecr=792007578"
"546","18.139971","192.168.2.2","192.168.1.2","TCP","2962","43520","8000  >  59444 [ACK] Seq=107170 Ack=144 Win=43520 Len=2896 TSval=2325379473 TSecr=792007570 [TCP segment of a reassembled PDU]"
"550","18.165088","192.168.2.2","192.168.1.2","TCP","66","1297920","5001  >  45842 [ACK] Seq=1 Ack=2160417 Win=1297920 Len=0 TSval=2325379484 TSecr=792007589"
"551","18.165090","192.168.2.2","192.168.1.2","TCP","66","1300480","5001  >  45842 [ACK] Seq=1 Ack=2161865 Win=1300480 Len=0 TSval=2325379497 TSecr=792007600"
"552","18.165250","192.168.2.2","192.168.1.2","TCP","2962","43520","8000  >  59444 [ACK] Seq=110066 Ack=144 Win=43520 Len=2896 TSval=2325379498 TSecr=792007595 [TCP segment of a reassembled PDU]"
