"No.","Time","Source","Destination","Protocol","Length","Calculated window size","Info"
"4","0.000427","192.168.2.2","192.168.1.2","TCP","74","43440","5001  >  45818 [SYN, ACK] Seq=0 Ack=1 Win=43440 Len=0 MSS=1460 SACK_PERM=1 TSval=2324715625 TSecr=791343797 WS=512"
"7","0.000487","192.168.2.2","192.168.1.2","TCP","66","39936","5001  >  45818 [ACK] Seq=1 Ack=7241 Win=39936 Len=0 TSval=2324715625 TSecr=791343797"
"12","0.050228","192.168.2.2","192.168.1.2","TCP","66","38400","5001  >  45818 [ACK] Seq=1 Ack=17377 Win=38400 Len=0 TSval=2324715675 TSecr=791343798"
"15","0.134631","192.168.2.2","192.168.1.2","TCP","66","38400","5001  >  45818 [ACK] Seq=1 Ack=27513 Win=38400 Len=0 TSval=2324715759 TSecr=791343798"
"21","0.219695","192.168.2.2","192.168.1.2","TCP","66","42496","5001  >  45818 [ACK] Seq=1 Ack=28961 Win=42496 Len=0 TSval=2324715844 TSecr=791343798"
"23","0.231416","192.168.2.2","192.168.1.2","TCP","66","42496","5001  >  45818 [ACK] Seq=1 Ack=30409 Win=42496 Len=0 TSval=2324715856 TSecr=791343813"
"26","0.244337","192.168.2.2","192.168.1.2","TCP","66","35328","5001  >  45818 [ACK] Seq=1 Ack=46337 Win=35328 Len=0 TSval=2324715869 TSecr=791343847"
"29","0.377649","192.168.2.2","192.168.1.2","TCP","66","41984","5001  >  45818 [ACK] Seq=1 Ack=49233 Win=41984 Len=0 TSval=2324716002 TSecr=791343873"
"31","0.401145","192.168.2.2","192.168.1.2","TCP","66","45568","5001  >  45818 [ACK] Seq=1 Ack=50681 Win=45568 Len=0 TSval=2324716026 TSecr=791343931"
"33","0.413859","192.168.2.2","192.168.1.2","TCP","66","75776","5001  >  45818 [ACK] Seq=1 Ack=65913 Win=75776 Len=0 TSval=2324716038 TSecr=791343931"
"37","0.541322","192.168.2.2","192.168.1.2","TCP","78","75776","[TCP Dup ACK 33#1] 5001  >  45818 [ACK] Seq=1 Ack=65913 Win=75776 Len=0 TSval=2324716166 TSecr=791343989 SLE=65161 SRE=65913"
"39","0.547308","192.168.2.2","192.168.1.2","TCP","66","84480","5001  >  45818 [ACK] Seq=1 Ack=70257 Win=84480 Len=0 TSval=2324716172 TSecr=791344016"
"41","0.583678","192.168.2.2","192.168.1.2","TCP","66","87552","5001  >  45818 [ACK] Seq=1 Ack=71705 Win=87552 Len=0 TSval=2324716208 TSecr=791344028"
"43","0.596207","192.168.2.2","192.168.1.2","TCP","66","90112","5001  >  45818 [ACK] Seq=1 Ack=72401 Win=90112 Len=0 TSval=2324716221 TSecr=791344028"
"45","0.602048","192.168.2.2","192.168.1.2","TCP","66","93184","5001  >  45818 [ACK] Seq=1 Ack=81089 Win=93184 Len=0 TSval=2324716227 TSecr=791344041"
"47","0.674555","192.168.2.2","192.168.1.2","TCP","66","93184","5001  >  45818 [ACK] Seq=1 Ack=89777 Win=93184 Len=0 TSval=2324716299 TSecr=791344174"
"51","0.747382","192.168.2.2","192.168.1.2","TCP","66","95232","5001  >  45818 [ACK] Seq=1 Ack=94121 Win=95232 Len=0 TSval=2324716372 TSecr=791344198"
"53","0.783557","192.168.2.2","192.168.1.2","TCP","66","86528","5001  >  45818 [ACK] Seq=1 Ack=115841 Win=86528 Len=0 TSval=2324716408 TSecr=791344210"
"55","0.965331","192.168.2.2","192.168.1.2","TCP","66","86528","5001  >  45818 [ACK] Seq=1 Ack=137561 Win=86528 Len=0 TSval=2324716590 TSecr=791344211"
"58","1.147063","192.168.2.2","192.168.1.2","TCP","66","101376","5001  >  45818 [ACK] Seq=1 Ack=140457 Win=101376 Len=0 TSval=2324716771 TSecr=791344338"
"60","1.171496","192.168.2.2","192.168.1.2","TCP","66","127488","5001  >  45818 [ACK] Seq=1 Ack=153489 Win=127488 Len=0 TSval=2324716796 TSecr=791344344"
"63","1.280174","192.168.2.2","192.168.1.2","TCP","66","135680","5001  >  45818 [ACK] Seq=1 Ack=157833 Win=135680 Len=0 TSval=2324716904 TSecr=791344380"
"66","1.317466","192.168.2.2","192.168.1.2","TCP","66","138752","5001  >  45818 [ACK] Seq=1 Ack=159281 Win=138752 Len=0 TSval=2324716942 TSecr=791344393"
"68","1.329266","192.168.2.2","192.168.1.2","TCP","66","168960","5001  >  45818 [ACK] Seq=1 Ack=174273 Win=168960 Len=0 TSval=2324716953 TSecr=791344399"
"73","1.454684","192.168.2.2","192.168.1.2","TCP","66","180224","5001  >  45818 [ACK] Seq=1 Ack=180065 Win=180224 Len=0 TSval=2324717079 TSecr=791344471"
"75","1.502762","192.168.2.2","192.168.1.2","TCP","66","183296","5001  >  45818 [ACK] Seq=1 Ack=181001 Win=183296 Len=0 TSval=2324717127 TSecr=791344471"
"77","1.510756","192.168.2.2","192.168.1.2","TCP","66","197632","5001  >  45818 [ACK] Seq=1 Ack=188241 Win=197632 Len=0 TSval=2324717135 TSecr=791344544"
"80","1.572037","192.168.2.2","192.168.1.2","TCP","66","223744","5001  >  45818 [ACK] Seq=1 Ack=201273 Win=223744 Len=0 TSval=2324717196 TSecr=791344580"
"82","1.682336","192.168.2.2","192.168.1.2","TCP","66","226816","5001  >  45818 [ACK] Seq=1 Ack=202721 Win=226816 Len=0 TSval=2324717306 TSecr=791344762"
"85","1.695224","192.168.2.2","192.168.1.2","TCP","66","270336","5001  >  45818 [ACK] Seq=1 Ack=224441 Win=270336 Len=0 TSval=2324717319 TSecr=791344943"
"90","1.876942","192.168.2.2","192.168.1.2","TCP","66","304640","5001  >  45818 [ACK] Seq=1 Ack=246161 Win=304640 Len=0 TSval=2324717501 TSecr=791344968"
"93","2.059387","192.168.2.2","192.168.1.2","TCP","66","304640","5001  >  45818 [ACK] Seq=1 Ack=267881 Win=304640 Len=0 TSval=2324717683 TSecr=791344968"
"97","2.240331","192.168.2.2","192.168.1.2","TCP","66","304640","5001  >  45818 [ACK] Seq=1 Ack=289601 Win=304640 Len=0 TSval=2324717864 TSecr=791345076"
"100","2.422701","192.168.2.2","192.168.1.2","TCP","66","310784","5001  >  45818 [ACK] Seq=1 Ack=292497 Win=310784 Len=0 TSval=2324718046 TSecr=791345088"
"102","2.447492","192.168.2.2","192.168.1.2","TCP","66","319488","5001  >  45818 [ACK] Seq=1 Ack=296841 Win=319488 Len=0 TSval=2324718071 TSecr=791345114"
"104","2.483730","192.168.2.2","192.168.1.2","TCP","66","348160","5001  >  45818 [ACK] Seq=1 Ack=311321 Win=348160 Len=0 TSval=2324718107 TSecr=791345125"
"106","2.605270","192.168.2.2","192.168.1.2","TCP","66","391680","5001  >  45818 [ACK] Seq=1 Ack=333041 Win=391680 Len=0 TSval=2324718229 TSecr=791345126"
"108","2.786571","192.168.2.2","192.168.1.2","TCP","66","435200","5001  >  45818 [ACK] Seq=1 Ack=354761 Win=435200 Len=0 TSval=2324718410 TSecr=791345251"
"111","2.967898","192.168.2.2","192.168.1.2","TCP","66","454144","5001  >  45818 [ACK] Seq=1 Ack=364297 Win=454144 Len=0 TSval=2324718591 TSecr=791345299"
"114","3.047843","192.168.2.2","192.168.1.2","TCP","66","477184","5001  >  45818 [ACK] Seq=1 Ack=375881 Win=477184 Len=0 TSval=2324718671 TSecr=791345307"
"116","3.145323","192.168.2.2","192.168.1.2","TCP","66","480256","5001  >  45818 [ACK] Seq=1 Ack=376481 Win=480256 Len=0 TSval=2324718768 TSecr=791345307"
"118","3.150229","192.168.2.2","192.168.1.2","TCP","66","481280","5001  >  45818 [ACK] Seq=1 Ack=398201 Win=481280 Len=0 TSval=2324718773 TSecr=791345368"
"120","3.331628","192.168.2.2","192.168.1.2","TCP","66","483840","5001  >  45818 [ACK] Seq=1 Ack=415577 Win=483840 Len=0 TSval=2324718955 TSecr=791345478"
"122","3.477539","192.168.2.2","192.168.1.2","TCP","66","489984","5001  >  45818 [ACK] Seq=1 Ack=419921 Win=489984 Len=0 TSval=2324719101 TSecr=791345491"
"124","3.513767","192.168.2.2","192.168.1.2","TCP","66","483840","5001  >  45818 [ACK] Seq=1 Ack=437297 Win=483840 Len=0 TSval=2324719137 TSecr=791345600"
"126","3.658868","192.168.2.2","192.168.1.2","TCP","66","489984","5001  >  45818 [ACK] Seq=1 Ack=441641 Win=489984 Len=0 TSval=2324719282 TSecr=791345673"
"129","3.695769","192.168.2.2","192.168.1.2","TCP","66","492032","5001  >  45818 [ACK] Seq=1 Ack=463361 Win=492032 Len=0 TSval=2324719319 TSecr=791345855"
"131","3.877451","192.168.2.2","192.168.1.2","TCP","66","492032","5001  >  45818 [ACK] Seq=1 Ack=485081 Win=492032 Len=0 TSval=2324719500 TSecr=791346036"
"134","4.059640","192.168.2.2","192.168.1.2","TCP","66","494080","5001  >  45818 [ACK] Seq=1 Ack=502457 Win=494080 Len=0 TSval=2324719682 TSecr=791346112"
"136","4.204690","192.168.2.2","192.168.1.2","TCP","66","499712","5001  >  45818 [ACK] Seq=1 Ack=505353 Win=499712 Len=0 TSval=2324719827 TSecr=791346218"
"138","4.229671","192.168.2.2","192.168.1.2","TCP","66","501760","5001  >  45818 [ACK] Seq=1 Ack=506801 Win=501760 Len=0 TSval=2324719852 TSecr=791346243"
"140","4.240826","192.168.2.2","192.168.1.2","TCP","66","494080","5001  >  45818 [ACK] Seq=1 Ack=524177 Win=494080 Len=0 TSval=2324719863 TSecr=791346279"
"143","4.387009","192.168.2.2","192.168.1.2","TCP","66","500736","5001  >  45818 [ACK] Seq=1 Ack=528521 Win=500736 Len=0 TSval=2324720010 TSecr=791346401"
"145","4.422497","192.168.2.2","192.168.1.2","TCP","66","492032","5001  >  45818 [ACK] Seq=1 Ack=550241 Win=492032 Len=0 TSval=2324720045 TSecr=791346582"
"147","4.604591","192.168.2.2","192.168.1.2","TCP","66","494080","5001  >  45818 [ACK] Seq=1 Ack=567617 Win=494080 Len=0 TSval=2324720227 TSecr=791346624"
"149","4.749593","192.168.2.2","192.168.1.2","TCP","66","497664","5001  >  45818 [ACK] Seq=1 Ack=577753 Win=497664 Len=0 TSval=2324720372 TSecr=791346763"
"152","4.835342","192.168.2.2","192.168.1.2","TCP","66","501760","5001  >  45818 [ACK] Seq=1 Ack=589337 Win=501760 Len=0 TSval=2324720458 TSecr=791346843"
"154","4.944107","192.168.2.2","192.168.1.2","TCP","66","501760","5001  >  45818 [ACK] Seq=1 Ack=595129 Win=501760 Len=0 TSval=2324720566 TSecr=791346941"
"156","4.980487","192.168.2.2","192.168.1.2","TCP","66","501760","5001  >  45818 [ACK] Seq=1 Ack=629881 Win=501760 Len=0 TSval=2324720603 TSecr=791347127"
"161","5.272027","192.168.2.2","192.168.1.2","TCP","66","500736","5001  >  45818 [ACK] Seq=1 Ack=634225 Win=500736 Len=0 TSval=2324720894 TSecr=791347273"
"163","5.307509","192.168.2.2","192.168.1.2","TCP","66","499712","5001  >  45818 [ACK] Seq=1 Ack=640017 Win=499712 Len=0 TSval=2324720930 TSecr=791347309"
"165","5.356271","192.168.2.2","192.168.1.2","TCP","66","494592","5001  >  45818 [ACK] Seq=1 Ack=655945 Win=494592 Len=0 TSval=2324720978 TSecr=791347454"
"168","5.489540","192.168.2.2","192.168.1.2","TCP","66","492032","5001  >  45818 [ACK] Seq=1 Ack=677665 Win=492032 Len=0 TSval=2324721112 TSecr=791347491"
"170","5.670833","192.168.2.2","192.168.1.2","TCP","66","516608","5001  >  45818 [ACK] Seq=1 Ack=684905 Win=516608 Len=0 TSval=2324721293 TSecr=791347672"
"174","5.732127","192.168.2.2","192.168.1.2","TCP","66","580096","5001  >  45818 [ACK] Seq=1 Ack=716761 Win=580096 Len=0 TSval=2324721354 TSecr=791347854"
"177","5.999201","192.168.2.2","192.168.1.2","TCP","66","585728","5001  >  45818 [ACK] Seq=1 Ack=719657 Win=585728 Len=0 TSval=2324721621 TSecr=791347999"
"180","6.022868","192.168.2.2","192.168.1.2","TCP","66","588800","5001  >  45818 [ACK] Seq=1 Ack=721105 Win=588800 Len=0 TSval=2324721645 TSecr=791348024"
"182","6.035431","192.168.2.2","192.168.1.2","TCP","66","606208","5001  >  45818 [ACK] Seq=1 Ack=729793 Win=606208 Len=0 TSval=2324721657 TSecr=791348036"
"184","6.107608","192.168.2.2","192.168.1.2","TCP","66","623616","5001  >  45818 [ACK] Seq=1 Ack=738481 Win=623616 Len=0 TSval=2324721729 TSecr=791348159"
"186","6.180520","192.168.2.2","192.168.1.2","TCP","66","632320","5001  >  45818 [ACK] Seq=1 Ack=742825 Win=632320 Len=0 TSval=2324721802 TSecr=791348182"
"189","6.216840","192.168.2.2","192.168.1.2","TCP","66","675840","5001  >  45818 [ACK] Seq=1 Ack=764545 Win=675840 Len=0 TSval=2324721838 TSecr=791348217"
"191","6.399090","192.168.2.2","192.168.1.2","TCP","66","695808","5001  >  45818 [ACK] Seq=1 Ack=774681 Win=695808 Len=0 TSval=2324722021 TSecr=791348399"
"193","6.483330","192.168.2.2","192.168.1.2","TCP","66","730624","5001  >  45818 [ACK] Seq=1 Ack=792057 Win=730624 Len=0 TSval=2324722105 TSecr=791348544"
"195","6.628436","192.168.2.2","192.168.1.2","TCP","66","753664","5001  >  45818 [ACK] Seq=1 Ack=803641 Win=753664 Len=0 TSval=2324722250 TSecr=791348630"
"197","6.725903","192.168.2.2","192.168.1.2","TCP","66","765440","5001  >  45818 [ACK] Seq=1 Ack=809433 Win=765440 Len=0 TSval=2324722347 TSecr=791348738"
"199","6.774426","192.168.2.2","192.168.1.2","TCP","66","785920","5001  >  45818 [ACK] Seq=1 Ack=819569 Win=785920 Len=0 TSval=2324722396 TSecr=791348775"
"202","6.860224","192.168.2.2","192.168.1.2","TCP","66","843776","5001  >  45818 [ACK] Seq=1 Ack=848529 Win=843776 Len=0 TSval=2324722482 TSecr=791349066"
"206","7.102500","192.168.2.2","192.168.1.2","TCP","66","855040","5001  >  45818 [ACK] Seq=1 Ack=854321 Win=855040 Len=0 TSval=2324722724 TSecr=791349102"
"208","7.150935","192.168.2.2","192.168.1.2","TCP","66","878592","5001  >  45818 [ACK] Seq=1 Ack=865905 Win=878592 Len=0 TSval=2324722772 TSecr=791349150"
"210","7.247845","192.168.2.2","192.168.1.2","TCP","66","887296","5001  >  45818 [ACK] Seq=1 Ack=870249 Win=887296 Len=0 TSval=2324722869 TSecr=791349183"
"212","7.284996","192.168.2.2","192.168.1.2","TCP","66","930816","5001  >  45818 [ACK] Seq=1 Ack=891969 Win=930816 Len=0 TSval=2324722906 TSecr=791349284"
"215","7.466309","192.168.2.2","192.168.1.2","TCP","66","945152","5001  >  45818 [ACK] Seq=1 Ack=899209 Win=945152 Len=0 TSval=2324723087 TSecr=791349465"
"217","7.527035","192.168.2.2","192.168.1.2","TCP","66","971264","5001  >  45818 [ACK] Seq=1 Ack=912241 Win=971264 Len=0 TSval=2324723148 TSecr=791349526"
"219","7.635890","192.168.2.2","192.168.1.2","TCP","66","1005056","5001  >  45818 [ACK] Seq=1 Ack=931065 Win=1005056 Len=0 TSval=2324723257 TSecr=791349694"
"222","7.793042","192.168.2.2","192.168.1.2","TCP","66","1011200","5001  >  45818 [ACK] Seq=1 Ack=933961 Win=1011200 Len=0 TSval=2324723414 TSecr=791349793"
"225","7.817859","192.168.2.2","192.168.1.2","TCP","66","1013760","5001  >  45818 [ACK] Seq=1 Ack=935409 Win=1013760 Len=0 TSval=2324723439 TSecr=791349817"
"227","7.830017","192.168.2.2","192.168.1.2","TCP","66","1010176","5001  >  45818 [ACK] Seq=1 Ack=944097 Win=1010176 Len=0 TSval=2324723451 TSecr=791349829"
"229","7.903378","192.168.2.2","192.168.1.2","TCP","66","1010176","5001  >  45818 [ACK] Seq=1 Ack=952785 Win=1010176 Len=0 TSval=2324723524 TSecr=791349901"
"231","7.975947","192.168.2.2","192.168.1.2","TCP","66","1012736","5001  >  45818 [ACK] Seq=1 Ack=957129 Win=1012736 Len=0 TSval=2324723597 TSecr=791349974"
"233","8.012197","192.168.2.2","192.168.1.2","TCP","66","1013760","5001  >  45818 [ACK] Seq=1 Ack=958577 Win=1013760 Len=0 TSval=2324723633 TSecr=791350011"
"236","8.024128","192.168.2.2","192.168.1.2","TCP","66","999424","5001  >  45818 [ACK] Seq=1 Ack=988985 Win=999424 Len=0 TSval=2324723645 TSecr=791350193"
"238","8.278491","192.168.2.2","192.168.1.2","TCP","66","1006592","5001  >  45818 [ACK] Seq=1 Ack=1004913 Win=1006592 Len=0 TSval=2324723899 TSecr=791350277"
"240","8.412074","192.168.2.2","192.168.1.2","TCP","66","1008128","5001  >  45818 [ACK] Seq=1 Ack=1017945 Win=1008128 Len=0 TSval=2324724033 TSecr=791350422"
"242","8.520725","192.168.2.2","192.168.1.2","TCP","66","1011712","5001  >  45818 [ACK] Seq=1 Ack=1023737 Win=1011712 Len=0 TSval=2324724141 TSecr=791350519"
"244","8.569836","192.168.2.2","192.168.1.2","TCP","66","1009664","5001  >  45818 [ACK] Seq=1 Ack=1033873 Win=1009664 Len=0 TSval=2324724190 TSecr=791350568"
"246","8.654218","192.168.2.2","192.168.1.2","TCP","66","1006080","5001  >  45818 [ACK] Seq=1 Ack=1051249 Win=1006080 Len=0 TSval=2324724275 TSecr=791350654"
"248","8.800134","192.168.2.2","192.168.1.2","TCP","66","1008640","5001  >  45818 [ACK] Seq=1 Ack=1062833 Win=1008640 Len=0 TSval=2324724420 TSecr=791350717"
"251","8.896948","192.168.2.2","192.168.1.2","TCP","66","1011712","5001  >  45818 [ACK] Seq=1 Ack=1068625 Win=1011712 Len=0 TSval=2324724517 TSecr=791350896"
"253","8.945567","192.168.2.2","192.168.1.2","TCP","66","1008640","5001  >  45818 [ACK] Seq=1 Ack=1080209 Win=1008640 Len=0 TSval=2324724566 TSecr=791350944"
"256","9.042568","192.168.2.2","192.168.1.2","TCP","66","1012736","5001  >  45818 [ACK] Seq=1 Ack=1084553 Win=1012736 Len=0 TSval=2324724663 TSecr=791351041"
"258","9.078779","192.168.2.2","192.168.1.2","TCP","66","1008128","5001  >  45818 [ACK] Seq=1 Ack=1097585 Win=1008128 Len=0 TSval=2324724699 TSecr=791351078"
"260","9.187657","192.168.2.2","192.168.1.2","TCP","66","1010176","5001  >  45818 [ACK] Seq=1 Ack=1106273 Win=1010176 Len=0 TSval=2324724808 TSecr=791351229"
"262","9.260853","192.168.2.2","192.168.1.2","TCP","66","1011200","5001  >  45818 [ACK] Seq=1 Ack=1113513 Win=1011200 Len=0 TSval=2324724881 TSecr=791351259"
"264","9.321532","192.168.2.2","192.168.1.2","TCP","66","1008128","5001  >  45818 [ACK] Seq=1 Ack=1126545 Win=1008128 Len=0 TSval=2324724942 TSecr=791351320"
"266","9.430343","192.168.2.2","192.168.1.2","TCP","66","1006080","5001  >  45818 [ACK] Seq=1 Ack=1143921 Win=1006080 Len=0 TSval=2324725050 TSecr=791351429"
"268","9.575281","192.168.2.2","192.168.1.2","TCP","66","1013760","5001  >  45818 [ACK] Seq=1 Ack=1145369 Win=1013760 Len=0 TSval=2324725195 TSecr=791351429"
"270","9.588139","192.168.2.2","192.168.1.2","TCP","66","1013248","5001  >  45818 [ACK] Seq=1 Ack=1148265 Win=1013248 Len=0 TSval=2324725208 TSecr=791351586"
"272","9.623922","192.168.2.2","192.168.1.2","TCP","66","1013760","5001  >  45818 [ACK] Seq=1 Ack=1158401 Win=1013760 Len=0 TSval=2324725244 TSecr=791351611"
"274","9.696958","192.168.2.2","192.168.1.2","TCP","66","1013760","5001  >  45818 [ACK] Seq=1 Ack=1167089 Win=1013760 Len=0 TSval=2324725317 TSecr=791351696"
"276","9.769410","192.168.2.2","192.168.1.2","TCP","66","1013760","5001  >  45818 [ACK] Seq=1 Ack=1171433 Win=1013760 Len=0 TSval=2324725389 TSecr=791351769"
"279","9.818310","192.168.2.2","192.168.1.2","TCP","66","1013760","5001  >  45818 [ACK] Seq=1 Ack=1190257 Win=1013760 Len=0 TSval=2324725438 TSecr=791351805"
"281","9.963756","192.168.2.2","192.168.1.2","TCP","66","1013760","5001  >  45818 [ACK] Seq=1 Ack=1219217 Win=1013760 Len=0 TSval=2324725584 TSecr=791352071"
"286","10.205888","192.168.2.2","192.168.1.2","TCP","66","1008128","5001  >  45818 [ACK] Seq=1 Ack=1232249 Win=1008128 Len=0 TSval=2324725826 TSecr=791352205"
"287","10.315334","192.168.2.2","192.168.1.2","TCP","66","1012736","5001  >  45818 [ACK] Seq=1 Ack=1236593 Win=1012736 Len=0 TSval=2324725935 TSecr=791352313"
"288","10.351191","192.168.2.2","192.168.1.2","TCP","66","1008640","5001  >  45818 [ACK] Seq=1 Ack=1248177 Win=1008640 Len=0 TSval=2324725971 TSecr=791352362"
"289","10.448716","192.168.2.2","192.168.1.2","TCP","66","1006080","5001  >  45818 [ACK] Seq=1 Ack=1265553 Win=1006080 Len=0 TSval=2324726068 TSecr=791352447"
"290","10.593574","192.168.2.2","192.168.1.2","TCP","66","1008640","5001  >  45818 [ACK] Seq=1 Ack=1277137 Win=1008640 Len=0 TSval=2324726213 TSecr=791352593"
"291","10.690658","192.168.2.2","192.168.1.2","TCP","66","1011712","5001  >  45818 [ACK] Seq=1 Ack=1282929 Win=1011712 Len=0 TSval=2324726310 TSecr=791352689"
"292","10.739715","192.168.2.2","192.168.1.2","TCP","66","1008640","5001  >  45818 [ACK] Seq=1 Ack=1294513 Win=1008640 Len=0 TSval=2324726359 TSecr=791352738"
"294","10.836420","192.168.2.2","192.168.1.2","TCP","66","1012736","5001  >  45818 [ACK] Seq=1 Ack=1298857 Win=1012736 Len=0 TSval=2324726456 TSecr=791352835"
"295","10.872966","192.168.2.2","192.168.1.2","TCP","66","1013248","5001  >  45818 [ACK] Seq=1 Ack=1301753 Win=1013248 Len=0 TSval=2324726492 TSecr=791352871"
"296","10.897500","192.168.2.2","192.168.1.2","TCP","66","1005056","5001  >  45818 [ACK] Seq=1 Ack=1320577 Win=1005056 Len=0 TSval=2324726517 TSecr=791352980"
"299","11.055260","192.168.2.2","192.168.1.2","TCP","66","1011200","5001  >  45818 [ACK] Seq=1 Ack=1327817 Win=1011200 Len=0 TSval=2324726674 TSecr=791353053"
"300","11.115055","192.168.2.2","192.168.1.2","TCP","66","1008128","5001  >  45818 [ACK] Seq=1 Ack=1340849 Win=1008128 Len=0 TSval=2324726734 TSecr=791353114"
"301","11.224365","192.168.2.2","192.168.1.2","TCP","66","1006080","5001  >  45818 [ACK] Seq=1 Ack=1358225 Win=1006080 Len=0 TSval=2324726844 TSecr=791353222"
"302","11.369386","192.168.2.2","192.168.1.2","TCP","66","1013760","5001  >  45818 [ACK] Seq=1 Ack=1359673 Win=1013760 Len=0 TSval=2324726988 TSecr=791353367"
"303","11.382096","192.168.2.2","192.168.1.2","TCP","66","1013248","5001  >  45818 [ACK] Seq=1 Ack=1362569 Win=1013248 Len=0 TSval=2324727001 TSecr=791353380"
"304","11.405783","192.168.2.2","192.168.1.2","TCP","66","1012736","5001  >  45818 [ACK] Seq=1 Ack=1366913 Win=1012736 Len=0 TSval=2324727025 TSecr=791353416"
"305","11.442366","192.168.2.2","192.168.1.2","TCP","66","1013760","5001  >  45818 [ACK] Seq=1 Ack=1381393 Win=1013760 Len=0 TSval=2324727061 TSecr=791353489"
"306","11.563511","192.168.2.2","192.168.1.2","TCP","66","1013760","5001  >  45818 [ACK] Seq=1 Ack=1385737 Win=1013760 Len=0 TSval=2324727182 TSecr=791353561"
"307","11.599670","192.168.2.2","192.168.1.2","TCP","66","1013760","5001  >  45818 [ACK] Seq=1 Ack=1404561 Win=1013760 Len=0 TSval=2324727219 TSecr=791353610"
"308","11.757009","192.168.2.2","192.168.1.2","TCP","66","1013760","5001  >  45818 [ACK] Seq=1 Ack=1432073 Win=1013760 Len=0 TSval=2324727376 TSecr=791353756"
"310","11.987238","192.168.2.2","192.168.1.2","TCP","66","1013760","5001  >  45818 [ACK] Seq=1 Ack=1433521 Win=1013760 Len=0 TSval=2324727606 TSecr=791353756"
"312","12.000099","192.168.2.2","192.168.1.2","TCP","74","43440","8000  >  59420 [SYN, ACK] Seq=0 Ack=1 Win=43440 Len=0 MSS=1460 SACK_PERM=1 TSval=2324727619 TSecr=791353795 WS=512"
"316","12.000841","192.168.2.2","192.168.1.2","TCP","74","43440","[TCP Out-Of-Order] 8000  >  59420 [SYN, ACK] Seq=0 Ack=1 Win=43440 Len=0 MSS=1460 SACK_PERM=1 TSval=2324727620 TSecr=791353795 WS=512"
"319","12.002008","192.168.2.2","192.168.1.2","TCP","66","1013248","5001  >  45818 [ACK] Seq=1 Ack=1436417 Win=1013248 Len=0 TSval=2324727621 TSecr=791355548"
"325","12.026538","192.168.2.2","192.168.1.2","TCP","66","1013248","5001  >  45818 [ACK] Seq=1 Ack=1439313 Win=1013248 Len=0 TSval=2324727645 TSecr=791355778"
"327","12.050984","192.168.2.2","192.168.1.2","TCP","66","43520","8000  >  59420 [ACK] Seq=1 Ack=144 Win=43520 Len=0 TSval=2324727670 TSecr=791355791"
"328","12.051635","192.168.2.2","192.168.1.2","TCP","83","43520","8000  >  59420 [PSH, ACK] Seq=1 Ack=144 Win=43520 Len=17 TSval=2324727670 TSecr=791355791 [TCP segment of a reassembled PDU]"
"330","12.051947","192.168.2.2","192.168.1.2","TCP","2962","43520","8000  >  59420 [ACK] Seq=18 Ack=144 Win=43520 Len=2896 TSval=2324727671 TSecr=791355791 [TCP segment of a reassembled PDU]"
"332","12.064658","192.168.2.2","192.168.1.2","TCP","66","985600","5001  >  45818 [ACK] Seq=1 Ack=1497233 Win=985600 Len=0 TSval=2324727672 TSecr=791355793"
"334","12.064661","192.168.2.2","192.168.1.2","TCP","2962","43520","8000  >  59420 [ACK] Seq=2914 Ack=144 Win=43520 Len=2896 TSval=2324727675 TSecr=791355792 [TCP segment of a reassembled PDU]"
"338","12.089132","192.168.2.2","192.168.1.2","TCP","2962","43520","8000  >  59420 [ACK] Seq=5810 Ack=144 Win=43520 Len=2896 TSval=2324727678 TSecr=791355792 [TCP segment of a reassembled PDU]"
"340","12.113226","192.168.2.2","192.168.1.2","TCP","2962","43520","8000  >  59420 [ACK] Seq=8706 Ack=144 Win=43520 Len=2896 TSval=2324727683 TSecr=791355792 [TCP segment of a reassembled PDU]"
"342","12.137506","192.168.2.2","192.168.1.2","TCP","1514","43520","8000  >  59420 [ACK] Seq=11602 Ack=144 Win=43520 Len=1448 TSval=2324727708 TSecr=791355792 [TCP segment of a reassembled PDU]"
"344","12.204400","192.168.2.2","192.168.1.2","TCP","1514","43520","8000  >  59420 [ACK] Seq=13050 Ack=144 Win=43520 Len=1448 TSval=2324727823 TSecr=791355792 [TCP segment of a reassembled PDU]"
"346","12.459906","192.168.2.2","192.168.1.2","TCP","83","43520","[TCP Out-Of-Order] 8000  >  59420 [PSH, ACK] Seq=1 Ack=144 Win=43520 Len=17 TSval=2324728078 TSecr=791355792"
"348","12.537652","192.168.2.2","192.168.1.2","TCP","66","982016","5001  >  45818 [ACK] Seq=1 Ack=1562393 Win=982016 Len=0 TSval=2324728156 TSecr=791355793"
"352","12.972264","192.168.2.2","192.168.1.2","TCP","83","43520","[TCP Out-Of-Order] 8000  >  59420 [PSH, ACK] Seq=1 Ack=144 Win=43520 Len=17 TSval=2324728591 TSecr=791355792"
"355","13.083074","192.168.2.2","192.168.1.2","TCP","66","982016","5001  >  45818 [ACK] Seq=1 Ack=1627553 Win=982016 Len=0 TSval=2324728701 TSecr=791355793"
"359","13.627724","192.168.2.2","192.168.1.2","TCP","66","1001472","5001  >  45818 [ACK] Seq=1 Ack=1653617 Win=1001472 Len=0 TSval=2324729246 TSecr=791355794"
"363","13.846483","192.168.2.2","192.168.1.2","TCP","66","1011712","5001  >  45818 [ACK] Seq=1 Ack=1659409 Win=1011712 Len=0 TSval=2324729464 TSecr=791355817"
"365","13.895075","192.168.2.2","192.168.1.2","TCP","1514","43520","8000  >  59420 [ACK] Seq=14498 Ack=144 Win=43520 Len=1448 TSval=2324729513 TSecr=791355842 [TCP segment of a reassembled PDU]"
"367","13.898045","192.168.2.2","192.168.1.2","TCP","2962","43520","8000  >  59420 [ACK] Seq=15946 Ack=144 Win=43520 Len=2896 TSval=2324729516 TSecr=791355843 [TCP segment of a reassembled PDU]"
"369","13.919518","192.168.2.2","192.168.1.2","TCP","66","997888","5001  >  45818 [ACK] Seq=1 Ack=1692713 Win=997888 Len=0 TSval=2324729516 TSecr=791355855"
"370","13.919523","192.168.2.2","192.168.1.2","TCP","2962","43520","8000  >  59420 [ACK] Seq=18842 Ack=144 Win=43520 Len=2896 TSval=2324729520 TSecr=791355843 [TCP segment of a reassembled PDU]"
"374","14.174835","192.168.2.2","192.168.1.2","TCP","1514","43520","8000  >  59420 [ACK] Seq=21738 Ack=144 Win=43520 Len=1448 TSval=2324729793 TSecr=791355855 [TCP segment of a reassembled PDU]"
"376","14.175457","192.168.2.2","192.168.1.2","TCP","66","982016","5001  >  45818 [ACK] Seq=1 Ack=1757873 Win=982016 Len=0 TSval=2324729793 TSecr=791355856"
"377","14.176782","192.168.2.2","192.168.1.2","TCP","2962","43520","8000  >  59420 [ACK] Seq=23186 Ack=144 Win=43520 Len=2896 TSval=2324729794 TSecr=791355855 [TCP segment of a reassembled PDU]"
"379","14.198945","192.168.2.2","192.168.1.2","TCP","1514","43520","8000  >  59420 [ACK] Seq=26082 Ack=144 Win=43520 Len=1448 TSval=2324729798 TSecr=791355855 [TCP segment of a reassembled PDU]"
"381","14.720424","192.168.2.2","192.168.1.2","TCP","66","1006080","5001  >  45818 [ACK] Seq=1 Ack=1775249 Win=1006080 Len=0 TSval=2324730338 TSecr=791355857"
"382","14.866356","192.168.2.2","192.168.1.2","TCP","2962","43520","8000  >  59420 [ACK] Seq=27530 Ack=144 Win=43520 Len=2896 TSval=2324730484 TSecr=791355880 [TCP segment of a reassembled PDU]"
"384","14.877800","192.168.2.2","192.168.1.2","TCP","66","990720","5001  >  45818 [ACK] Seq=1 Ack=1823033 Win=990720 Len=0 TSval=2324730486 TSecr=791356328"
"385","14.878319","192.168.2.2","192.168.1.2","TCP","2962","43520","8000  >  59420 [ACK] Seq=30426 Ack=144 Win=43520 Len=2896 TSval=2324730487 TSecr=791356250 [TCP segment of a reassembled PDU]"
"388","14.902603","192.168.2.2","192.168.1.2","TCP","2962","43520","8000  >  59420 [ACK] Seq=33322 Ack=144 Win=43520 Len=2896 TSval=2324730491 TSecr=791356250 [TCP segment of a reassembled PDU]"
"390","14.927066","192.168.2.2","192.168.1.2","TCP","2962","43520","8000  >  59420 [ACK] Seq=36218 Ack=144 Win=43520 Len=2896 TSval=2324730496 TSecr=791356250 [TCP segment of a reassembled PDU]"
"392","14.951072","192.168.2.2","192.168.1.2","TCP","2962","43520","8000  >  59420 [ACK] Seq=39114 Ack=144 Win=43520 Len=2896 TSval=2324730520 TSecr=791356250 [TCP segment of a reassembled PDU]"
"395","15.268135","192.168.2.2","192.168.1.2","TCP","66","982016","5001  >  45818 [ACK] Seq=1 Ack=1888193 Win=982016 Len=0 TSval=2324730885 TSecr=791356329"
"396","15.813023","192.168.2.2","192.168.1.2","TCP","66","1006080","5001  >  45818 [ACK] Seq=1 Ack=1905569 Win=1006080 Len=0 TSval=2324731430 TSecr=791356329"
"398","15.960285","192.168.2.2","192.168.1.2","TCP","66","990720","5001  >  45818 [ACK] Seq=1 Ack=1953353 Win=990720 Len=0 TSval=2324731577 TSecr=791356873"
"400","16.360893","192.168.2.2","192.168.1.2","TCP","66","982016","5001  >  45818 [ACK] Seq=1 Ack=2018513 Win=982016 Len=0 TSval=2324731977 TSecr=791356874"
"401","16.905359","192.168.2.2","192.168.1.2","TCP","66","1048576","5001  >  45818 [ACK] Seq=1 Ack=2035889 Win=1048576 Len=0 TSval=2324732522 TSecr=791357370"
"402","17.050906","192.168.2.2","192.168.1.2","TCP","66","1144320","5001  >  45818 [ACK] Seq=1 Ack=2083673 Win=1144320 Len=0 TSval=2324732667 TSecr=791357418"
"407","17.450054","192.168.2.2","192.168.1.2","TCP","66","1153024","5001  >  45818 [ACK] Seq=1 Ack=2088017 Win=1153024 Len=0 TSval=2324733066 TSecr=791357418"
"411","17.486997","192.168.2.2","192.168.1.2","TCP","66","1176064","5001  >  45818 [ACK] Seq=1 Ack=2099601 Win=1176064 Len=0 TSval=2324733103 TSecr=791357636"
"420","17.584045","192.168.2.2","192.168.1.2","TCP","1514","43520","8000  >  59420 [ACK] Seq=42010 Ack=144 Win=43520 Len=1448 TSval=2324733200 TSecr=791357685 [TCP segment of a reassembled PDU]"
"423","17.585794","192.168.2.2","192.168.1.2","TCP","2962","43520","8000  >  59420 [ACK] Seq=43458 Ack=144 Win=43520 Len=2896 TSval=2324733202 TSecr=791357965 [TCP segment of a reassembled PDU]"
"425","17.608498","192.168.2.2","192.168.1.2","TCP","2962","43520","8000  >  59420 [ACK] Seq=46354 Ack=144 Win=43520 Len=2896 TSval=2324733205 TSecr=791358716 [TCP segment of a reassembled PDU]"
"429","17.634193","192.168.2.2","192.168.1.2","TCP","66","1179136","5001  >  45818 [ACK] Seq=1 Ack=2101049 Win=1179136 Len=0 TSval=2324733207 TSecr=791360839"
"431","17.634704","192.168.2.2","192.168.1.2","TCP","2962","43520","8000  >  59420 [ACK] Seq=49250 Ack=144 Win=43520 Len=2896 TSval=2324733209 TSecr=791358740 [TCP segment of a reassembled PDU]"
"433","17.659445","192.168.2.2","192.168.1.2","TCP","66","1181696","5001  >  45818 [ACK] Seq=1 Ack=2102497 Win=1181696 Len=0 TSval=2324733220 TSecr=791360853"
"435","17.659449","192.168.2.2","192.168.1.2","TCP","2962","43520","8000  >  59420 [ACK] Seq=52146 Ack=144 Win=43520 Len=2896 TSval=2324733225 TSecr=791358740 [TCP segment of a reassembled PDU]"
"438","17.684455","192.168.2.2","192.168.1.2","TCP","66","1184768","5001  >  45818 [ACK] Seq=1 Ack=2103945 Win=1184768 Len=0 TSval=2324733233 TSecr=791360866"
"440","17.685003","192.168.2.2","192.168.1.2","TCP","66","1187840","5001  >  45818 [ACK] Seq=1 Ack=2105393 Win=1187840 Len=0 TSval=2324733244 TSecr=791361238"
"441","17.685528","192.168.2.2","192.168.1.2","TCP","2962","43520","8000  >  59420 [ACK] Seq=55042 Ack=144 Win=43520 Len=2896 TSval=2324733251 TSecr=791358740 [TCP segment of a reassembled PDU]"
"444","17.709946","192.168.2.2","192.168.1.2","TCP","66","1190400","5001  >  45818 [ACK] Seq=1 Ack=2106841 Win=1190400 Len=0 TSval=2324733257 TSecr=791361249"
"446","17.711014","192.168.2.2","192.168.1.2","TCP","66","1193472","5001  >  45818 [ACK] Seq=1 Ack=2108289 Win=1193472 Len=0 TSval=2324733269 TSecr=791361259"
"447","17.711016","192.168.2.2","192.168.1.2","TCP","66","1196544","5001  >  45818 [ACK] Seq=1 Ack=2109737 Win=1196544 Len=0 TSval=2324733281 TSecr=791361275"
"448","17.711686","192.168.2.2","192.168.1.2","TCP","66","1199104","5001  >  45818 [ACK] Seq=1 Ack=2111185 Win=1199104 Len=0 TSval=2324733293 TSecr=791361286"
"449","17.711846","192.168.2.2","192.168.1.2","TCP","2962","43520","8000  >  59420 [ACK] Seq=57938 Ack=144 Win=43520 Len=2896 TSval=2324733301 TSecr=791358740 [TCP segment of a reassembled PDU]"
"453","17.736479","192.168.2.2","192.168.1.2","TCP","2962","43520","8000  >  59420 [ACK] Seq=60834 Ack=144 Win=43520 Len=2896 TSval=2324733305 TSecr=791358740 [TCP segment of a reassembled PDU]"
"456","17.761013","192.168.2.2","192.168.1.2","TCP","66","1202176","5001  >  45818 [ACK] Seq=1 Ack=2112633 Win=1202176 Len=0 TSval=2324733305 TSecr=791361296"
"458","17.761016","192.168.2.2","192.168.1.2","TCP","66","1205248","5001  >  45818 [ACK] Seq=1 Ack=2114081 Win=1205248 Len=0 TSval=2324733318 TSecr=791361306"
"459","17.761359","192.168.2.2","192.168.1.2","TCP","2962","43520","8000  >  59420 [ACK] Seq=63730 Ack=144 Win=43520 Len=2896 TSval=2324733328 TSecr=791358740 [TCP segment of a reassembled PDU]"
"462","17.785657","192.168.2.2","192.168.1.2","TCP","66","1207808","5001  >  45818 [ACK] Seq=1 Ack=2115529 Win=1207808 Len=0 TSval=2324733330 TSecr=791361316"
"464","17.786127","192.168.2.2","192.168.1.2","TCP","66","1210880","5001  >  45818 [ACK] Seq=1 Ack=2116977 Win=1210880 Len=0 TSval=2324733341 TSecr=791361327"
"465","17.786652","192.168.2.2","192.168.1.2","TCP","2962","43520","8000  >  59420 [ACK] Seq=66626 Ack=144 Win=43520 Len=2896 TSval=2324733352 TSecr=791358740 [TCP segment of a reassembled PDU]"
"468","17.810907","192.168.2.2","192.168.1.2","TCP","66","1213952","5001  >  45818 [ACK] Seq=1 Ack=2118425 Win=1213952 Len=0 TSval=2324733353 TSecr=791361337"
"470","17.811925","192.168.2.2","192.168.1.2","TCP","66","1216512","5001  >  45818 [ACK] Seq=1 Ack=2119873 Win=1216512 Len=0 TSval=2324733366 TSecr=791361347"
"471","17.811929","192.168.2.2","192.168.1.2","TCP","1514","43520","8000  >  59420 [ACK] Seq=69522 Ack=144 Win=43520 Len=1448 TSval=2324733378 TSecr=791361372 [TCP segment of a reassembled PDU]"
"474","17.824031","192.168.2.2","192.168.1.2","TCP","66","1219584","5001  >  45818 [ACK] Seq=1 Ack=2121321 Win=1219584 Len=0 TSval=2324733379 TSecr=791361422"
"475","17.824582","192.168.2.2","192.168.1.2","TCP","2962","43520","8000  >  59420 [ACK] Seq=70970 Ack=144 Win=43520 Len=2896 TSval=2324733379 TSecr=791361396 [TCP segment of a reassembled PDU]"
"478","17.848802","192.168.2.2","192.168.1.2","TCP","66","1222656","5001  >  45818 [ACK] Seq=1 Ack=2122769 Win=1222656 Len=0 TSval=2324733392 TSecr=791361447"
"480","17.849307","192.168.2.2","192.168.1.2","TCP","2962","43520","8000  >  59420 [ACK] Seq=73866 Ack=144 Win=43520 Len=2896 TSval=2324733403 TSecr=791361423 [TCP segment of a reassembled PDU]"
"482","17.873687","192.168.2.2","192.168.1.2","TCP","66","1225216","5001  >  45818 [ACK] Seq=1 Ack=2124217 Win=1225216 Len=0 TSval=2324733405 TSecr=791361472"
"484","17.874075","192.168.2.2","192.168.1.2","TCP","66","1228288","5001  >  45818 [ACK] Seq=1 Ack=2125665 Win=1228288 Len=0 TSval=2324733417 TSecr=791361484"
"485","17.874604","192.168.2.2","192.168.1.2","TCP","66","1231360","5001  >  45818 [ACK] Seq=1 Ack=2127113 Win=1231360 Len=0 TSval=2324733430 TSecr=791361498"
"486","17.875121","192.168.2.2","192.168.1.2","TCP","2962","43520","8000  >  59420 [ACK] Seq=76762 Ack=144 Win=43520 Len=2896 TSval=2324733440 TSecr=791361473 [TCP segment of a reassembled PDU]"
"490","17.900209","192.168.2.2","192.168.1.2","TCP","66","1233920","5001  >  45818 [ACK] Seq=1 Ack=2128561 Win=1233920 Len=0 TSval=2324733442 TSecr=791361509"
"491","17.900241","192.168.2.2","192.168.1.2","TCP","66","1236992","5001  >  45818 [ACK] Seq=1 Ack=2130009 Win=1236992 Len=0 TSval=2324733454 TSecr=791361520"
"492","17.900490","192.168.2.2","192.168.1.2","TCP","2962","43520","8000  >  59420 [ACK] Seq=79658 Ack=144 Win=43520 Len=2896 TSval=2324733465 TSecr=791361500 [TCP segment of a reassembled PDU]"
"496","17.924670","192.168.2.2","192.168.1.2","TCP","66","1240064","5001  >  45818 [ACK] Seq=1 Ack=2131457 Win=1240064 Len=0 TSval=2324733467 TSecr=791361531"
"497","17.925164","192.168.2.2","192.168.1.2","TCP","66","1242624","5001  >  45818 [ACK] Seq=1 Ack=2132905 Win=1242624 Len=0 TSval=2324733479 TSecr=791361549"
"498","17.925697","192.168.2.2","192.168.1.2","TCP","1514","43520","8000  >  59420 [ACK] Seq=82554 Ack=144 Win=43520 Len=1448 TSval=2324733491 TSecr=791361549 [TCP segment of a reassembled PDU]"
"501","17.937821","192.168.2.2","192.168.1.2","TCP","66","1245696","5001  >  45818 [ACK] Seq=1 Ack=2134353 Win=1245696 Len=0 TSval=2324733491 TSecr=791361561"
"502","17.938316","192.168.2.2","192.168.1.2","TCP","2962","43520","8000  >  59420 [ACK] Seq=84002 Ack=144 Win=43520 Len=2896 TSval=2324733493 TSecr=791361549 [TCP segment of a reassembled PDU]"
"505","17.962557","192.168.2.2","192.168.1.2","TCP","66","1248768","5001  >  45818 [ACK] Seq=1 Ack=2135801 Win=1248768 Len=0 TSval=2324733504 TSecr=791361574"
"506","17.963077","192.168.2.2","192.168.1.2","TCP","66","1251328","5001  >  45818 [ACK] Seq=1 Ack=2137249 Win=1251328 Len=0 TSval=2324733516 TSecr=791361585"
"507","17.963616","192.168.2.2","192.168.1.2","TCP","2962","43520","8000  >  59420 [ACK] Seq=86898 Ack=144 Win=43520 Len=2896 TSval=2324733516 TSecr=791361575 [TCP segment of a reassembled PDU]"
"511","17.987815","192.168.2.2","192.168.1.2","TCP","66","1254400","5001  >  45818 [ACK] Seq=1 Ack=2138697 Win=1254400 Len=0 TSval=2324733528 TSecr=791361599"
"512","17.988350","192.168.2.2","192.168.1.2","TCP","66","1256960","5001  >  45818 [ACK] Seq=1 Ack=2140145 Win=1256960 Len=0 TSval=2324733541 TSecr=791361610"
"513","17.988892","192.168.2.2","192.168.1.2","TCP","66","1260032","5001  >  45818 [ACK] Seq=1 Ack=2141593 Win=1260032 Len=0 TSval=2324733554 TSecr=791361621"
"514","17.989422","192.168.2.2","192.168.1.2","TCP","2962","43520","8000  >  59420 [ACK] Seq=89794 Ack=144 Win=43520 Len=2896 TSval=2324733554 TSecr=791361612 [TCP segment of a reassembled PDU]"
"517","18.013691","192.168.2.2","192.168.1.2","TCP","66","1263104","5001  >  45818 [ACK] Seq=1 Ack=2143041 Win=1263104 Len=0 TSval=2324733566 TSecr=791361637"
"519","18.014176","192.168.2.2","192.168.1.2","TCP","66","1265664","5001  >  45818 [ACK] Seq=1 Ack=2144489 Win=1265664 Len=0 TSval=2324733578 TSecr=791361662"
"520","18.014706","192.168.2.2","192.168.1.2","TCP","2962","43520","8000  >  59420 [ACK] Seq=92690 Ack=144 Win=43520 Len=2896 TSval=2324733579 TSecr=791361637 [TCP segment of a reassembled PDU]"
"523","18.039299","192.168.2.2","192.168.1.2","TCP","66","1268736","5001  >  45818 [ACK] Seq=1 Ack=2145937 Win=1268736 Len=0 TSval=2324733591 TSecr=791361673"
"524","18.039434","192.168.2.2","192.168.1.2","TCP","66","1271808","5001  >  45818 [ACK] Seq=1 Ack=2147385 Win=1271808 Len=0 TSval=2324733603 TSecr=791361684"
"525","18.039959","192.168.2.2","192.168.1.2","TCP","2962","43520","8000  >  59420 [ACK] Seq=95586 Ack=144 Win=43520 Len=2896 TSval=2324733605 TSecr=791361663 [TCP segment of a reassembled PDU]"
"529","18.064758","192.168.2.2","192.168.1.2","TCP","66","1274368","5001  >  45818 [ACK] Seq=1 Ack=2148833 Win=1274368 Len=0 TSval=2324733616 TSecr=791361696"
"530","18.064760","192.168.2.2","192.168.1.2","TCP","66","1277440","5001  >  45818 [ACK] Seq=1 Ack=2150281 Win=1277440 Len=0 TSval=2324733629 TSecr=791361707"
"531","18.065245","192.168.2.2","192.168.1.2","TCP","2962","43520","8000  >  59420 [ACK] Seq=98482 Ack=144 Win=43520 Len=2896 TSval=2324733631 TSecr=791361688 [TCP segment of a reassembled PDU]"
"536","18.089492","192.168.2.2","192.168.1.2","TCP","66","1283072","5001  >  45818 [ACK] Seq=1 Ack=2153177 Win=1283072 Len=0 TSval=2324733640 TSecr=791361718"
"538","18.090003","192.168.2.2","192.168.1.2","TCP","2962","43520","8000  >  59420 [ACK] Seq=101378 Ack=144 Win=43520 Len=2896 TSval=2324733656 TSecr=791361714 [TCP segment of a reassembled PDU]"
"541","18.114766","192.168.2.2","192.168.1.2","TCP","66","1289216","5001  >  45818 [ACK] Seq=1 Ack=2156073 Win=1289216 Len=0 TSval=2324733665 TSecr=791361736"
"543","18.114775","192.168.2.2","192.168.1.2","TCP","2962","43520","8000  >  59420 [ACK] Seq=104274 Ack=144 Win=43520 Len=2896 TSval=2324733681 TSecr=791361726 [TCP segment of a reassembled PDU]"
"546","18.139170","192.168.2.2","192.168.1.2","TCP","66","1294848","5001  >  45818 [ACK] Seq=1 Ack=2158969 Win=1294848 Len=0 TSval=2324733690 TSecr=791361754"
"548","18.139498","192.168.2.2","192.168.1.2","TCP","2962","43520","8000  >  59420 [ACK] Seq=107170 Ack=144 Win=43520 Len=2896 TSval=2324733706 TSecr=791361751 [TCP segment of a reassembled PDU]"
"551","18.163813","192.168.2.2","192.168.1.2","TCP","66","1297920","5001  >  45818 [ACK] Seq=1 Ack=2160417 Win=1297920 Len=0 TSval=2324733714 TSecr=791361771"
"553","18.164271","192.168.2.2","192.168.1.2","TCP","66","1300480","5001  >  45818 [ACK] Seq=1 Ack=2161865 Win=1300480 Len=0 TSval=2324733727 TSecr=791361780"
"554","18.164795","192.168.2.2","192.168.1.2","TCP","2962","43520","8000  >  59420 [ACK] Seq=110066 Ack=144 Win=43520 Len=2896 TSval=2324733731 TSecr=791361777 [TCP segment of a reassembled PDU]"
"556","18.189035","192.168.2.2","192.168.1.2","TCP","66","1303552","5001  >  45818 [ACK] Seq=1 Ack=2163313 Win=1303552 Len=0 TSval=2324733739 TSecr=791361801"
"557","18.189557","192.168.2.2","192.168.1.2","TCP","66","1306624","5001  >  45818 [ACK] Seq=1 Ack=2164761 Win=1306624 Len=0 TSval=2324733751 TSecr=791361816"
