"No.","Time","Source","Destination","Protocol","Length","Calculated window size","Info"
"4","0.000372","192.168.2.2","192.168.1.2","TCP","74","43440","5001  >  44744 [SYN, ACK] Seq=0 Ack=1 Win=43440 Len=0 MSS=1460 SACK_PERM=1 TSval=2039389993 TSecr=1375649162 WS=512"
"7","0.000419","192.168.2.2","192.168.1.2","TCP","66","39936","5001  >  44744 [ACK] Seq=1 Ack=7241 Win=39936 Len=0 TSval=2039389993 TSecr=1375649162"
"12","0.049989","192.168.2.2","192.168.1.2","TCP","66","39936","5001  >  44744 [ACK] Seq=1 Ack=14481 Win=39936 Len=0 TSval=2039390043 TSecr=1375649162"
"17","0.110707","192.168.2.2","192.168.1.2","TCP","66","38400","5001  >  44744 [ACK] Seq=1 Ack=24617 Win=38400 Len=0 TSval=2039390103 TSecr=1375649162"
"26","0.195987","192.168.2.2","192.168.1.2","TCP","66","40960","5001  >  44744 [ACK] Seq=1 Ack=28961 Win=40960 Len=0 TSval=2039390189 TSecr=1375649162"
"29","0.231423","192.168.2.2","192.168.1.2","TCP","66","42496","5001  >  44744 [ACK] Seq=1 Ack=30409 Win=42496 Len=0 TSval=2039390224 TSecr=1375649177"
"32","0.243898","192.168.2.2","192.168.1.2","TCP","66","38912","5001  >  44744 [ACK] Seq=1 Ack=39097 Win=38912 Len=0 TSval=2039390237 TSecr=1375649212"
"34","0.316529","192.168.2.2","192.168.1.2","TCP","66","40960","5001  >  44744 [ACK] Seq=1 Ack=43441 Win=40960 Len=0 TSval=2039390309 TSecr=1375649237"
"38","0.352620","192.168.2.2","192.168.1.2","TCP","66","41984","5001  >  44744 [ACK] Seq=1 Ack=46337 Win=41984 Len=0 TSval=2039390345 TSecr=1375649272"
"40","0.377134","192.168.2.2","192.168.1.2","TCP","66","41984","5001  >  44744 [ACK] Seq=1 Ack=49233 Win=41984 Len=0 TSval=2039390370 TSecr=1375649272"
"42","0.401617","192.168.2.2","192.168.1.2","TCP","66","42496","5001  >  44744 [ACK] Seq=1 Ack=50681 Win=42496 Len=0 TSval=2039390394 TSecr=1375649272"
"44","0.413438","192.168.2.2","192.168.1.2","TCP","66","41984","5001  >  44744 [ACK] Seq=1 Ack=53577 Win=41984 Len=0 TSval=2039390406 TSecr=1375649272"
"46","0.437377","192.168.2.2","192.168.1.2","TCP","66","41984","5001  >  44744 [ACK] Seq=1 Ack=56473 Win=41984 Len=0 TSval=2039390430 TSecr=1375649273"
"48","0.461601","192.168.2.2","192.168.1.2","TCP","66","41984","5001  >  44744 [ACK] Seq=1 Ack=59369 Win=41984 Len=0 TSval=2039390454 TSecr=1375649274"
"50","0.485833","192.168.2.2","192.168.1.2","TCP","66","41984","5001  >  44744 [ACK] Seq=1 Ack=62265 Win=41984 Len=0 TSval=2039390479 TSecr=1375649274"
"52","0.510351","192.168.2.2","192.168.1.2","TCP","78","42496","[TCP Window Update] 5001  >  44744 [ACK] Seq=1 Ack=62265 Win=42496 Len=0 TSval=2039390503 TSecr=1375649325 SLE=60817 SRE=62265"
"54","0.522107","192.168.2.2","192.168.1.2","TCP","66","41984","5001  >  44744 [ACK] Seq=1 Ack=65161 Win=41984 Len=0 TSval=2039390515 TSecr=1375649358"
"56","0.546359","192.168.2.2","192.168.1.2","TCP","66","41984","5001  >  44744 [ACK] Seq=1 Ack=68057 Win=41984 Len=0 TSval=2039390539 TSecr=1375649358"
"58","0.571126","192.168.2.2","192.168.1.2","TCP","66","41984","5001  >  44744 [ACK] Seq=1 Ack=70953 Win=41984 Len=0 TSval=2039390564 TSecr=1375649393"
"60","0.594787","192.168.2.2","192.168.1.2","TCP","66","42496","5001  >  44744 [ACK] Seq=1 Ack=72401 Win=42496 Len=0 TSval=2039390588 TSecr=1375649393"
"62","0.607301","192.168.2.2","192.168.1.2","TCP","66","41984","5001  >  44744 [ACK] Seq=1 Ack=75297 Win=41984 Len=0 TSval=2039390600 TSecr=1375649406"
"64","0.631827","192.168.2.2","192.168.1.2","TCP","66","41984","5001  >  44744 [ACK] Seq=1 Ack=78193 Win=41984 Len=0 TSval=2039390625 TSecr=1375649478"
"66","0.655355","192.168.2.2","192.168.1.2","TCP","66","48128","5001  >  44744 [ACK] Seq=1 Ack=81089 Win=48128 Len=0 TSval=2039390648 TSecr=1375649478"
"70","0.679940","192.168.2.2","192.168.1.2","TCP","66","54272","5001  >  44744 [ACK] Seq=1 Ack=83985 Win=54272 Len=0 TSval=2039390673 TSecr=1375649478"
"75","0.704706","192.168.2.2","192.168.1.2","TCP","66","59904","5001  >  44744 [ACK] Seq=1 Ack=86881 Win=59904 Len=0 TSval=2039390697 TSecr=1375649514"
"79","0.728879","192.168.2.2","192.168.1.2","TCP","66","65536","5001  >  44744 [ACK] Seq=1 Ack=89777 Win=65536 Len=0 TSval=2039390722 TSecr=1375649539"
"83","0.752299","192.168.2.2","192.168.1.2","TCP","66","71680","5001  >  44744 [ACK] Seq=1 Ack=92673 Win=71680 Len=0 TSval=2039390745 TSecr=1375649563"
"87","0.776842","192.168.2.2","192.168.1.2","TCP","66","74240","5001  >  44744 [ACK] Seq=1 Ack=94121 Win=74240 Len=0 TSval=2039390770 TSecr=1375649575"
"90","0.788585","192.168.2.2","192.168.1.2","TCP","66","80384","5001  >  44744 [ACK] Seq=1 Ack=97017 Win=80384 Len=0 TSval=2039390781 TSecr=1375649599"
"94","0.812798","192.168.2.2","192.168.1.2","TCP","66","86016","5001  >  44744 [ACK] Seq=1 Ack=99913 Win=86016 Len=0 TSval=2039390806 TSecr=1375649623"
"97","0.838456","192.168.2.2","192.168.1.2","TCP","66","91648","5001  >  44744 [ACK] Seq=1 Ack=102809 Win=91648 Len=0 TSval=2039390831 TSecr=1375649648"
"99","0.863085","192.168.2.2","192.168.1.2","TCP","66","95744","5001  >  44744 [ACK] Seq=1 Ack=104761 Win=95744 Len=0 TSval=2039390856 TSecr=1375649672"
"101","0.879688","192.168.2.2","192.168.1.2","TCP","66","98304","5001  >  44744 [ACK] Seq=1 Ack=106209 Win=98304 Len=0 TSval=2039390872 TSecr=1375649684"
"103","0.891467","192.168.2.2","192.168.1.2","TCP","66","104448","5001  >  44744 [ACK] Seq=1 Ack=109105 Win=104448 Len=0 TSval=2039390884 TSecr=1375649708"
"106","0.915669","192.168.2.2","192.168.1.2","TCP","66","110080","5001  >  44744 [ACK] Seq=1 Ack=112001 Win=110080 Len=0 TSval=2039390908 TSecr=1375649733"
"108","0.940514","192.168.2.2","192.168.1.2","TCP","66","115712","5001  >  44744 [ACK] Seq=1 Ack=114897 Win=115712 Len=0 TSval=2039390933 TSecr=1375649757"
"110","0.964911","192.168.2.2","192.168.1.2","TCP","66","118784","5001  >  44744 [ACK] Seq=1 Ack=115841 Win=118784 Len=0 TSval=2039390958 TSecr=1375649769"
"112","0.972727","192.168.2.2","192.168.1.2","TCP","66","124416","5001  >  44744 [ACK] Seq=1 Ack=118737 Win=124416 Len=0 TSval=2039390965 TSecr=1375649794"
"114","0.996398","192.168.2.2","192.168.1.2","TCP","66","130560","5001  >  44744 [ACK] Seq=1 Ack=121633 Win=130560 Len=0 TSval=2039390989 TSecr=1375649817"
"116","1.020737","192.168.2.2","192.168.1.2","TCP","66","136192","5001  >  44744 [ACK] Seq=1 Ack=124529 Win=136192 Len=0 TSval=2039391013 TSecr=1375649817"
"119","1.045131","192.168.2.2","192.168.1.2","TCP","66","141824","5001  >  44744 [ACK] Seq=1 Ack=127425 Win=141824 Len=0 TSval=2039391038 TSecr=1375649817"
"122","1.069085","192.168.2.2","192.168.1.2","TCP","66","147968","5001  >  44744 [ACK] Seq=1 Ack=130321 Win=147968 Len=0 TSval=2039391062 TSecr=1375649842"
"126","1.093298","192.168.2.2","192.168.1.2","TCP","78","153600","[TCP Window Update] 5001  >  44744 [ACK] Seq=1 Ack=130321 Win=153600 Len=0 TSval=2039391086 TSecr=1375649842 SLE=137561 SRE=140457"
"128","1.117716","192.168.2.2","192.168.1.2","TCP","86","159232","[TCP Window Update] 5001  >  44744 [ACK] Seq=1 Ack=130321 Win=159232 Len=0 TSval=2039391110 TSecr=1375649842 SLE=146249 SRE=149145 SLE=137561 SRE=140457"
"130","1.142249","192.168.2.2","192.168.1.2","TCP","94","165376","[TCP Window Update] 5001  >  44744 [ACK] Seq=1 Ack=130321 Win=165376 Len=0 TSval=2039391135 TSecr=1375649842 SLE=154937 SRE=157833 SLE=146249 SRE=149145 SLE=137561 SRE=140457"
"133","1.166653","192.168.2.2","192.168.1.2","TCP","94","171008","[TCP Window Update] 5001  >  44744 [ACK] Seq=1 Ack=130321 Win=171008 Len=0 TSval=2039391159 TSecr=1375649842 SLE=162177 SRE=165073 SLE=154937 SRE=157833 SLE=146249 SRE=149145"
"135","1.190226","192.168.2.2","192.168.1.2","TCP","94","176640","[TCP Window Update] 5001  >  44744 [ACK] Seq=1 Ack=130321 Win=176640 Len=0 TSval=2039391183 TSecr=1375649842 SLE=167969 SRE=170865 SLE=162177 SRE=165073 SLE=154937 SRE=157833"
"138","1.214640","192.168.2.2","192.168.1.2","TCP","94","177664","[TCP Window Update] 5001  >  44744 [ACK] Seq=1 Ack=130321 Win=177664 Len=0 TSval=2039391207 TSecr=1375649842 SLE=176657 SRE=179553 SLE=167969 SRE=170865 SLE=162177 SRE=165073"
"141","1.238662","192.168.2.2","192.168.1.2","TCP","94","177664","[TCP Dup ACK 122#1] 5001  >  44744 [ACK] Seq=1 Ack=130321 Win=177664 Len=0 TSval=2039391231 TSecr=1375649842 SLE=181001 SRE=183897 SLE=176657 SRE=179553 SLE=167969 SRE=170865"
"144","1.262889","192.168.2.2","192.168.1.2","TCP","94","177664","[TCP Dup ACK 122#2] 5001  >  44744 [ACK] Seq=1 Ack=130321 Win=177664 Len=0 TSval=2039391256 TSecr=1375649842 SLE=181001 SRE=186793 SLE=176657 SRE=179553 SLE=167969 SRE=170865"
"147","1.287156","192.168.2.2","192.168.1.2","TCP","94","177664","[TCP Dup ACK 122#3] 5001  >  44744 [ACK] Seq=1 Ack=130321 Win=177664 Len=0 TSval=2039391280 TSecr=1375649842 SLE=181001 SRE=188241 SLE=176657 SRE=179553 SLE=167969 SRE=170865"
"149","1.299272","192.168.2.2","192.168.1.2","TCP","94","177664","[TCP Dup ACK 122#4] 5001  >  44744 [ACK] Seq=1 Ack=130321 Win=177664 Len=0 TSval=2039391292 TSecr=1375649842 SLE=181001 SRE=191137 SLE=176657 SRE=179553 SLE=167969 SRE=170865"
"152","1.323474","192.168.2.2","192.168.1.2","TCP","94","177664","[TCP Dup ACK 122#5] 5001  >  44744 [ACK] Seq=1 Ack=130321 Win=177664 Len=0 TSval=2039391316 TSecr=1375649842 SLE=181001 SRE=194033 SLE=176657 SRE=179553 SLE=167969 SRE=170865"
"155","1.347855","192.168.2.2","192.168.1.2","TCP","94","177664","[TCP Dup ACK 122#6] 5001  >  44744 [ACK] Seq=1 Ack=130321 Win=177664 Len=0 TSval=2039391341 TSecr=1375649842 SLE=181001 SRE=196929 SLE=176657 SRE=179553 SLE=167969 SRE=170865"
"158","1.372400","192.168.2.2","192.168.1.2","TCP","94","177664","[TCP Dup ACK 122#7] 5001  >  44744 [ACK] Seq=1 Ack=130321 Win=177664 Len=0 TSval=2039391365 TSecr=1375649842 SLE=181001 SRE=198377 SLE=176657 SRE=179553 SLE=167969 SRE=170865"
"160","1.384154","192.168.2.2","192.168.1.2","TCP","94","177664","[TCP Dup ACK 122#8] 5001  >  44744 [ACK] Seq=1 Ack=130321 Win=177664 Len=0 TSval=2039391377 TSecr=1375649842 SLE=181001 SRE=201273 SLE=176657 SRE=179553 SLE=167969 SRE=170865"
"163","1.408678","192.168.2.2","192.168.1.2","TCP","94","177664","[TCP Dup ACK 122#9] 5001  >  44744 [ACK] Seq=1 Ack=130321 Win=177664 Len=0 TSval=2039391401 TSecr=1375649842 SLE=181001 SRE=202721 SLE=176657 SRE=179553 SLE=167969 SRE=170865"
"165","1.420366","192.168.2.2","192.168.1.2","TCP","94","177664","[TCP Dup ACK 122#10] 5001  >  44744 [ACK] Seq=1 Ack=130321 Win=177664 Len=0 TSval=2039391413 TSecr=1375649842 SLE=181001 SRE=205617 SLE=176657 SRE=179553 SLE=167969 SRE=170865"
"168","1.445332","192.168.2.2","192.168.1.2","TCP","94","177664","[TCP Dup ACK 122#11] 5001  >  44744 [ACK] Seq=1 Ack=130321 Win=177664 Len=0 TSval=2039391438 TSecr=1375649842 SLE=181001 SRE=208513 SLE=176657 SRE=179553 SLE=167969 SRE=170865"
"170","1.470320","192.168.2.2","192.168.1.2","TCP","94","177664","[TCP Dup ACK 122#12] 5001  >  44744 [ACK] Seq=1 Ack=130321 Win=177664 Len=0 TSval=2039391463 TSecr=1375649842 SLE=181001 SRE=211409 SLE=176657 SRE=179553 SLE=167969 SRE=170865"
"173","1.493816","192.168.2.2","192.168.1.2","TCP","94","177664","[TCP Dup ACK 122#13] 5001  >  44744 [ACK] Seq=1 Ack=130321 Win=177664 Len=0 TSval=2039391487 TSecr=1375649842 SLE=181001 SRE=214305 SLE=176657 SRE=179553 SLE=167969 SRE=170865"
"175","1.518029","192.168.2.2","192.168.1.2","TCP","94","175104","5001  >  44744 [ACK] Seq=1 Ack=133217 Win=175104 Len=0 TSval=2039391511 TSecr=1375650255 SLE=181001 SRE=214305 SLE=176657 SRE=179553 SLE=167969 SRE=170865"
"179","1.542867","192.168.2.2","192.168.1.2","TCP","94","174080","5001  >  44744 [ACK] Seq=1 Ack=134665 Win=174080 Len=0 TSval=2039391536 TSecr=1375650279 SLE=181001 SRE=214305 SLE=176657 SRE=179553 SLE=167969 SRE=170865"
"181","1.554357","192.168.2.2","192.168.1.2","TCP","94","173056","5001  >  44744 [ACK] Seq=1 Ack=136113 Win=173056 Len=0 TSval=2039391547 TSecr=1375650304 SLE=181001 SRE=214305 SLE=176657 SRE=179553 SLE=167969 SRE=170865"
"183","1.566473","192.168.2.2","192.168.1.2","TCP","94","173056","[TCP Dup ACK 181#1] 5001  >  44744 [ACK] Seq=1 Ack=136113 Win=173056 Len=0 TSval=2039391559 TSecr=1375650304 SLE=140457 SRE=141905 SLE=181001 SRE=214305 SLE=176657 SRE=179553"
"186","1.578565","192.168.2.2","192.168.1.2","TCP","94","173056","[TCP Dup ACK 181#2] 5001  >  44744 [ACK] Seq=1 Ack=136113 Win=173056 Len=0 TSval=2039391571 TSecr=1375650304 SLE=140457 SRE=143353 SLE=181001 SRE=214305 SLE=176657 SRE=179553"
"188","1.590792","192.168.2.2","192.168.1.2","TCP","94","173056","[TCP Dup ACK 181#3] 5001  >  44744 [ACK] Seq=1 Ack=136113 Win=173056 Len=0 TSval=2039391584 TSecr=1375650304 SLE=144801 SRE=146249 SLE=140457 SRE=143353 SLE=181001 SRE=214305"
"190","1.602806","192.168.2.2","192.168.1.2","TCP","94","173056","[TCP Dup ACK 181#4] 5001  >  44744 [ACK] Seq=1 Ack=136113 Win=173056 Len=0 TSval=2039391596 TSecr=1375650304 SLE=150593 SRE=152041 SLE=144801 SRE=146249 SLE=140457 SRE=143353"
"192","1.615328","192.168.2.2","192.168.1.2","TCP","94","173056","[TCP Dup ACK 181#5] 5001  >  44744 [ACK] Seq=1 Ack=136113 Win=173056 Len=0 TSval=2039391608 TSecr=1375650304 SLE=153489 SRE=154937 SLE=150593 SRE=152041 SLE=144801 SRE=146249"
"194","1.627081","192.168.2.2","192.168.1.2","TCP","94","173056","[TCP Dup ACK 181#6] 5001  >  44744 [ACK] Seq=1 Ack=136113 Win=173056 Len=0 TSval=2039391620 TSecr=1375650304 SLE=159281 SRE=160729 SLE=153489 SRE=154937 SLE=150593 SRE=152041"
"196","1.639151","192.168.2.2","192.168.1.2","TCP","94","173056","[TCP Dup ACK 181#7] 5001  >  44744 [ACK] Seq=1 Ack=136113 Win=173056 Len=0 TSval=2039391632 TSecr=1375650304 SLE=159281 SRE=162177 SLE=153489 SRE=154937 SLE=150593 SRE=152041"
"198","1.651599","192.168.2.2","192.168.1.2","TCP","94","173056","[TCP Dup ACK 181#8] 5001  >  44744 [ACK] Seq=1 Ack=136113 Win=173056 Len=0 TSval=2039391644 TSecr=1375650304 SLE=166521 SRE=167969 SLE=159281 SRE=162177 SLE=153489 SRE=154937"
"200","1.663439","192.168.2.2","192.168.1.2","TCP","94","173056","[TCP Dup ACK 181#9] 5001  >  44744 [ACK] Seq=1 Ack=136113 Win=173056 Len=0 TSval=2039391656 TSecr=1375650304 SLE=172313 SRE=173761 SLE=166521 SRE=167969 SLE=159281 SRE=162177"
"202","1.676232","192.168.2.2","192.168.1.2","TCP","94","173056","[TCP Dup ACK 181#10] 5001  >  44744 [ACK] Seq=1 Ack=136113 Win=173056 Len=0 TSval=2039391669 TSecr=1375650304 SLE=175209 SRE=176657 SLE=172313 SRE=173761 SLE=166521 SRE=167969"
"204","1.687774","192.168.2.2","192.168.1.2","TCP","94","173056","[TCP Dup ACK 181#11] 5001  >  44744 [ACK] Seq=1 Ack=136113 Win=173056 Len=0 TSval=2039391681 TSecr=1375650304 SLE=179553 SRE=181001 SLE=175209 SRE=176657 SLE=172313 SRE=173761"
"207","1.699698","192.168.2.2","192.168.1.2","TCP","94","173056","[TCP Dup ACK 181#12] 5001  >  44744 [ACK] Seq=1 Ack=136113 Win=173056 Len=0 TSval=2039391692 TSecr=1375650304 SLE=215753 SRE=217201 SLE=179553 SRE=181001 SLE=175209 SRE=176657"
"209","1.712298","192.168.2.2","192.168.1.2","TCP","94","173056","[TCP Dup ACK 181#13] 5001  >  44744 [ACK] Seq=1 Ack=136113 Win=173056 Len=0 TSval=2039391705 TSecr=1375650304 SLE=215753 SRE=220097 SLE=179553 SRE=181001 SLE=175209 SRE=176657"
"211","1.736069","192.168.2.2","192.168.1.2","TCP","94","173056","[TCP Dup ACK 181#14] 5001  >  44744 [ACK] Seq=1 Ack=136113 Win=173056 Len=0 TSval=2039391729 TSecr=1375650304 SLE=215753 SRE=222993 SLE=179553 SRE=181001 SLE=175209 SRE=176657"
"213","1.760263","192.168.2.2","192.168.1.2","TCP","94","173056","[TCP Dup ACK 181#15] 5001  >  44744 [ACK] Seq=1 Ack=136113 Win=173056 Len=0 TSval=2039391753 TSecr=1375650304 SLE=215753 SRE=224441 SLE=179553 SRE=181001 SLE=175209 SRE=176657"
"215","1.772375","192.168.2.2","192.168.1.2","TCP","94","173056","[TCP Dup ACK 181#16] 5001  >  44744 [ACK] Seq=1 Ack=136113 Win=173056 Len=0 TSval=2039391765 TSecr=1375650304 SLE=215753 SRE=225889 SLE=179553 SRE=181001 SLE=175209 SRE=176657"
"217","1.784498","192.168.2.2","192.168.1.2","TCP","94","173056","[TCP Dup ACK 181#17] 5001  >  44744 [ACK] Seq=1 Ack=136113 Win=173056 Len=0 TSval=2039391777 TSecr=1375650304 SLE=215753 SRE=228785 SLE=179553 SRE=181001 SLE=175209 SRE=176657"
"220","1.808725","192.168.2.2","192.168.1.2","TCP","94","173056","[TCP Dup ACK 181#18] 5001  >  44744 [ACK] Seq=1 Ack=136113 Win=173056 Len=0 TSval=2039391801 TSecr=1375650304 SLE=215753 SRE=231681 SLE=179553 SRE=181001 SLE=175209 SRE=176657"
"222","1.832932","192.168.2.2","192.168.1.2","TCP","94","173056","[TCP Dup ACK 181#19] 5001  >  44744 [ACK] Seq=1 Ack=136113 Win=173056 Len=0 TSval=2039391826 TSecr=1375650304 SLE=236025 SRE=238921 SLE=215753 SRE=231681 SLE=179553 SRE=181001"
"224","1.857259","192.168.2.2","192.168.1.2","TCP","94","173056","[TCP Dup ACK 181#20] 5001  >  44744 [ACK] Seq=1 Ack=136113 Win=173056 Len=0 TSval=2039391850 TSecr=1375650304 SLE=236025 SRE=241817 SLE=215753 SRE=231681 SLE=179553 SRE=181001"
"227","1.881884","192.168.2.2","192.168.1.2","TCP","94","165888","5001  >  44744 [ACK] Seq=1 Ack=143353 Win=165888 Len=0 TSval=2039391875 TSecr=1375650728 SLE=236025 SRE=241817 SLE=215753 SRE=231681 SLE=179553 SRE=181001"
"229","1.893511","192.168.2.2","192.168.1.2","TCP","94","165888","[TCP Dup ACK 227#1] 5001  >  44744 [ACK] Seq=1 Ack=143353 Win=165888 Len=0 TSval=2039391886 TSecr=1375650728 SLE=236025 SRE=243265 SLE=215753 SRE=231681 SLE=179553 SRE=181001"
"231","1.905623","192.168.2.2","192.168.1.2","TCP","94","160256","5001  >  44744 [ACK] Seq=1 Ack=149145 Win=160256 Len=0 TSval=2039391898 TSecr=1375650753 SLE=236025 SRE=243265 SLE=215753 SRE=231681 SLE=179553 SRE=181001"
"234","1.917736","192.168.2.2","192.168.1.2","TCP","94","157696","5001  >  44744 [ACK] Seq=1 Ack=152041 Win=157696 Len=0 TSval=2039391910 TSecr=1375650765 SLE=236025 SRE=243265 SLE=215753 SRE=231681 SLE=179553 SRE=181001"
"236","1.929915","192.168.2.2","192.168.1.2","TCP","94","152064","5001  >  44744 [ACK] Seq=1 Ack=157833 Win=152064 Len=0 TSval=2039391923 TSecr=1375650777 SLE=236025 SRE=243265 SLE=215753 SRE=231681 SLE=179553 SRE=181001"
"238","1.942611","192.168.2.2","192.168.1.2","TCP","94","146944","5001  >  44744 [ACK] Seq=1 Ack=165073 Win=146944 Len=0 TSval=2039391935 TSecr=1375650789 SLE=236025 SRE=243265 SLE=215753 SRE=231681 SLE=179553 SRE=181001"
"240","1.954229","192.168.2.2","192.168.1.2","TCP","94","150528","[TCP Window Update] 5001  >  44744 [ACK] Seq=1 Ack=165073 Win=150528 Len=0 TSval=2039391947 TSecr=1375650789 SLE=236025 SRE=244713 SLE=215753 SRE=231681 SLE=179553 SRE=181001"
"242","1.966201","192.168.2.2","192.168.1.2","TCP","94","150016","5001  >  44744 [ACK] Seq=1 Ack=170865 Win=150016 Len=0 TSval=2039391959 TSecr=1375650813 SLE=236025 SRE=244713 SLE=215753 SRE=231681 SLE=179553 SRE=181001"
"244","1.978702","192.168.2.2","192.168.1.2","TCP","94","153088","5001  >  44744 [ACK] Seq=1 Ack=173761 Win=153088 Len=0 TSval=2039391971 TSecr=1375650825 SLE=236025 SRE=244713 SLE=215753 SRE=231681 SLE=179553 SRE=181001"
"246","1.990490","192.168.2.2","192.168.1.2","TCP","86","155136","5001  >  44744 [ACK] Seq=1 Ack=214305 Win=155136 Len=0 TSval=2039391983 TSecr=1375650838 SLE=236025 SRE=244713 SLE=215753 SRE=231681"
"248","2.003216","192.168.2.2","192.168.1.2","TCP","86","176128","[TCP Window Update] 5001  >  44744 [ACK] Seq=1 Ack=214305 Win=176128 Len=0 TSval=2039391996 TSecr=1375650838 SLE=236025 SRE=246161 SLE=215753 SRE=231681"
"250","2.014924","192.168.2.2","192.168.1.2","TCP","78","175104","5001  >  44744 [ACK] Seq=1 Ack=231681 Win=175104 Len=0 TSval=2039392008 TSecr=1375650861 SLE=236025 SRE=246161"
"252","2.026736","192.168.2.2","192.168.1.2","TCP","78","183296","[TCP Window Update] 5001  >  44744 [ACK] Seq=1 Ack=231681 Win=183296 Len=0 TSval=2039392019 TSecr=1375650861 SLE=236025 SRE=249057"
"255","2.051232","192.168.2.2","192.168.1.2","TCP","78","183296","[TCP Dup ACK 250#1] 5001  >  44744 [ACK] Seq=1 Ack=231681 Win=183296 Len=0 TSval=2039392044 TSecr=1375650861 SLE=236025 SRE=251953"
"257","2.075192","192.168.2.2","192.168.1.2","TCP","78","183296","[TCP Dup ACK 250#2] 5001  >  44744 [ACK] Seq=1 Ack=231681 Win=183296 Len=0 TSval=2039392068 TSecr=1375650861 SLE=236025 SRE=253401"
"259","2.087404","192.168.2.2","192.168.1.2","TCP","78","183296","[TCP Dup ACK 250#3] 5001  >  44744 [ACK] Seq=1 Ack=231681 Win=183296 Len=0 TSval=2039392080 TSecr=1375650861 SLE=236025 SRE=254849"
"261","2.100228","192.168.2.2","192.168.1.2","TCP","78","183296","[TCP Dup ACK 250#4] 5001  >  44744 [ACK] Seq=1 Ack=231681 Win=183296 Len=0 TSval=2039392093 TSecr=1375650861 SLE=236025 SRE=257745"
"263","2.123733","192.168.2.2","192.168.1.2","TCP","78","183296","[TCP Dup ACK 250#5] 5001  >  44744 [ACK] Seq=1 Ack=231681 Win=183296 Len=0 TSval=2039392116 TSecr=1375650861 SLE=236025 SRE=260641"
"264","2.147849","192.168.2.2","192.168.1.2","TCP","78","180736","5001  >  44744 [ACK] Seq=1 Ack=234577 Win=180736 Len=0 TSval=2039392141 TSecr=1375650995 SLE=236025 SRE=260641"
"266","2.172726","192.168.2.2","192.168.1.2","TCP","66","183296","5001  >  44744 [ACK] Seq=1 Ack=260641 Win=183296 Len=0 TSval=2039392165 TSecr=1375651019"
"268","2.184444","192.168.2.2","192.168.1.2","TCP","78","187904","[TCP Window Update] 5001  >  44744 [ACK] Seq=1 Ack=260641 Win=187904 Len=0 TSval=2039392177 TSecr=1375651019 SLE=262089 SRE=264985"
"271","2.208970","192.168.2.2","192.168.1.2","TCP","78","187904","[TCP Dup ACK 266#1] 5001  >  44744 [ACK] Seq=1 Ack=260641 Win=187904 Len=0 TSval=2039392202 TSecr=1375651019 SLE=262089 SRE=266433"
"273","2.220710","192.168.2.2","192.168.1.2","TCP","78","187904","[TCP Dup ACK 266#2] 5001  >  44744 [ACK] Seq=1 Ack=260641 Win=187904 Len=0 TSval=2039392213 TSecr=1375651019 SLE=262089 SRE=267881"
"275","2.232638","192.168.2.2","192.168.1.2","TCP","86","187904","[TCP Dup ACK 266#3] 5001  >  44744 [ACK] Seq=1 Ack=260641 Win=187904 Len=0 TSval=2039392225 TSecr=1375651019 SLE=269329 SRE=272225 SLE=262089 SRE=267881"
"278","2.256889","192.168.2.2","192.168.1.2","TCP","86","187904","[TCP Dup ACK 266#4] 5001  >  44744 [ACK] Seq=1 Ack=260641 Win=187904 Len=0 TSval=2039392250 TSecr=1375651019 SLE=269329 SRE=275121 SLE=262089 SRE=267881"
"280","2.281466","192.168.2.2","192.168.1.2","TCP","86","187904","[TCP Dup ACK 266#5] 5001  >  44744 [ACK] Seq=1 Ack=260641 Win=187904 Len=0 TSval=2039392274 TSecr=1375651019 SLE=269329 SRE=278017 SLE=262089 SRE=267881"
"283","2.305303","192.168.2.2","192.168.1.2","TCP","86","187904","[TCP Dup ACK 266#6] 5001  >  44744 [ACK] Seq=1 Ack=260641 Win=187904 Len=0 TSval=2039392298 TSecr=1375651019 SLE=269329 SRE=279465 SLE=262089 SRE=267881"
"285","2.317696","192.168.2.2","192.168.1.2","TCP","86","187904","[TCP Dup ACK 266#7] 5001  >  44744 [ACK] Seq=1 Ack=260641 Win=187904 Len=0 TSval=2039392310 TSecr=1375651019 SLE=269329 SRE=282361 SLE=262089 SRE=267881"
"287","2.342259","192.168.2.2","192.168.1.2","TCP","86","187904","[TCP Dup ACK 266#8] 5001  >  44744 [ACK] Seq=1 Ack=260641 Win=187904 Len=0 TSval=2039392335 TSecr=1375651019 SLE=269329 SRE=285257 SLE=262089 SRE=267881"
"289","2.365906","192.168.2.2","192.168.1.2","TCP","86","187904","[TCP Dup ACK 266#9] 5001  >  44744 [ACK] Seq=1 Ack=260641 Win=187904 Len=0 TSval=2039392359 TSecr=1375651019 SLE=269329 SRE=286705 SLE=262089 SRE=267881"
"291","2.377980","192.168.2.2","192.168.1.2","TCP","86","187904","[TCP Dup ACK 266#10] 5001  >  44744 [ACK] Seq=1 Ack=260641 Win=187904 Len=0 TSval=2039392371 TSecr=1375651019 SLE=269329 SRE=288153 SLE=262089 SRE=267881"
"293","2.390103","192.168.2.2","192.168.1.2","TCP","86","187904","[TCP Dup ACK 266#11] 5001  >  44744 [ACK] Seq=1 Ack=260641 Win=187904 Len=0 TSval=2039392383 TSecr=1375651019 SLE=269329 SRE=289601 SLE=262089 SRE=267881"
"295","2.402909","192.168.2.2","192.168.1.2","TCP","86","187904","[TCP Dup ACK 266#12] 5001  >  44744 [ACK] Seq=1 Ack=260641 Win=187904 Len=0 TSval=2039392396 TSecr=1375651019 SLE=269329 SRE=291049 SLE=262089 SRE=267881"
"297","2.414647","192.168.2.2","192.168.1.2","TCP","86","187904","[TCP Dup ACK 266#13] 5001  >  44744 [ACK] Seq=1 Ack=260641 Win=187904 Len=0 TSval=2039392407 TSecr=1375651019 SLE=269329 SRE=292497 SLE=262089 SRE=267881"
"299","2.426419","192.168.2.2","192.168.1.2","TCP","86","187904","[TCP Dup ACK 266#14] 5001  >  44744 [ACK] Seq=1 Ack=260641 Win=187904 Len=0 TSval=2039392419 TSecr=1375651019 SLE=269329 SRE=293945 SLE=262089 SRE=267881"
"301","2.439138","192.168.2.2","192.168.1.2","TCP","86","187904","[TCP Dup ACK 266#15] 5001  >  44744 [ACK] Seq=1 Ack=260641 Win=187904 Len=0 TSval=2039392432 TSecr=1375651019 SLE=269329 SRE=295393 SLE=262089 SRE=267881"
"303","2.450659","192.168.2.2","192.168.1.2","TCP","86","187904","[TCP Dup ACK 266#16] 5001  >  44744 [ACK] Seq=1 Ack=260641 Win=187904 Len=0 TSval=2039392443 TSecr=1375651019 SLE=269329 SRE=296841 SLE=262089 SRE=267881"
"305","2.462751","192.168.2.2","192.168.1.2","TCP","86","187904","[TCP Dup ACK 266#17] 5001  >  44744 [ACK] Seq=1 Ack=260641 Win=187904 Len=0 TSval=2039392455 TSecr=1375651019 SLE=269329 SRE=299737 SLE=262089 SRE=267881"
"308","2.487066","192.168.2.2","192.168.1.2","TCP","86","187904","[TCP Dup ACK 266#18] 5001  >  44744 [ACK] Seq=1 Ack=260641 Win=187904 Len=0 TSval=2039392480 TSecr=1375651019 SLE=269329 SRE=301185 SLE=262089 SRE=267881"
"310","2.499086","192.168.2.2","192.168.1.2","TCP","78","180736","5001  >  44744 [ACK] Seq=1 Ack=267881 Win=180736 Len=0 TSval=2039392492 TSecr=1375651346 SLE=269329 SRE=301185"
"313","2.511578","192.168.2.2","192.168.1.2","TCP","78","191488","[TCP Window Update] 5001  >  44744 [ACK] Seq=1 Ack=267881 Win=191488 Len=0 TSval=2039392504 TSecr=1375651346 SLE=269329 SRE=302633"
"315","2.523336","192.168.2.2","192.168.1.2","TCP","78","194560","[TCP Window Update] 5001  >  44744 [ACK] Seq=1 Ack=267881 Win=194560 Len=0 TSval=2039392516 TSecr=1375651346 SLE=269329 SRE=304081"
"317","2.535442","192.168.2.2","192.168.1.2","TCP","78","197632","[TCP Window Update] 5001  >  44744 [ACK] Seq=1 Ack=267881 Win=197632 Len=0 TSval=2039392528 TSecr=1375651346 SLE=269329 SRE=305529"
"319","2.547837","192.168.2.2","192.168.1.2","TCP","66","200192","5001  >  44744 [ACK] Seq=1 Ack=305529 Win=200192 Len=0 TSval=2039392541 TSecr=1375651394"
"321","2.559667","192.168.2.2","192.168.1.2","TCP","78","206336","[TCP Window Update] 5001  >  44744 [ACK] Seq=1 Ack=305529 Win=206336 Len=0 TSval=2039392552 TSecr=1375651394 SLE=306977 SRE=309873"
"324","2.584105","192.168.2.2","192.168.1.2","TCP","78","208896","[TCP Window Update] 5001  >  44744 [ACK] Seq=1 Ack=305529 Win=208896 Len=0 TSval=2039392577 TSecr=1375651394 SLE=306977 SRE=311321"
"326","2.596810","192.168.2.2","192.168.1.2","TCP","86","211968","[TCP Window Update] 5001  >  44744 [ACK] Seq=1 Ack=305529 Win=211968 Len=0 TSval=2039392590 TSecr=1375651394 SLE=312769 SRE=314217 SLE=306977 SRE=311321"
"327","2.608557","192.168.2.2","192.168.1.2","TCP","86","217600","[TCP Window Update] 5001  >  44744 [ACK] Seq=1 Ack=305529 Win=217600 Len=0 TSval=2039392601 TSecr=1375651394 SLE=312769 SRE=317113 SLE=306977 SRE=311321"
"330","2.632334","192.168.2.2","192.168.1.2","TCP","86","223744","[TCP Window Update] 5001  >  44744 [ACK] Seq=1 Ack=305529 Win=223744 Len=0 TSval=2039392625 TSecr=1375651394 SLE=312769 SRE=320009 SLE=306977 SRE=311321"
"332","2.656631","192.168.2.2","192.168.1.2","TCP","86","226304","[TCP Window Update] 5001  >  44744 [ACK] Seq=1 Ack=305529 Win=226304 Len=0 TSval=2039392649 TSecr=1375651394 SLE=312769 SRE=321457 SLE=306977 SRE=311321"
"334","2.669266","192.168.2.2","192.168.1.2","TCP","86","229376","[TCP Window Update] 5001  >  44744 [ACK] Seq=1 Ack=305529 Win=229376 Len=0 TSval=2039392662 TSecr=1375651394 SLE=312769 SRE=322905 SLE=306977 SRE=311321"
"335","2.681031","192.168.2.2","192.168.1.2","TCP","86","232448","[TCP Window Update] 5001  >  44744 [ACK] Seq=1 Ack=305529 Win=232448 Len=0 TSval=2039392674 TSecr=1375651394 SLE=312769 SRE=324353 SLE=306977 SRE=311321"
"337","2.692886","192.168.2.2","192.168.1.2","TCP","86","235008","[TCP Window Update] 5001  >  44744 [ACK] Seq=1 Ack=305529 Win=235008 Len=0 TSval=2039392686 TSecr=1375651394 SLE=312769 SRE=325801 SLE=306977 SRE=311321"
"339","2.705589","192.168.2.2","192.168.1.2","TCP","86","238080","[TCP Window Update] 5001  >  44744 [ACK] Seq=1 Ack=305529 Win=238080 Len=0 TSval=2039392698 TSecr=1375651394 SLE=312769 SRE=327249 SLE=306977 SRE=311321"
"340","2.717314","192.168.2.2","192.168.1.2","TCP","86","241152","[TCP Window Update] 5001  >  44744 [ACK] Seq=1 Ack=305529 Win=241152 Len=0 TSval=2039392710 TSecr=1375651394 SLE=312769 SRE=328697 SLE=306977 SRE=311321"
"342","2.729222","192.168.2.2","192.168.1.2","TCP","86","243712","[TCP Window Update] 5001  >  44744 [ACK] Seq=1 Ack=305529 Win=243712 Len=0 TSval=2039392722 TSecr=1375651394 SLE=312769 SRE=330145 SLE=306977 SRE=311321"
"344","2.741778","192.168.2.2","192.168.1.2","TCP","86","246784","[TCP Window Update] 5001  >  44744 [ACK] Seq=1 Ack=305529 Win=246784 Len=0 TSval=2039392735 TSecr=1375651394 SLE=312769 SRE=331593 SLE=306977 SRE=311321"
"345","2.753536","192.168.2.2","192.168.1.2","TCP","86","249856","[TCP Window Update] 5001  >  44744 [ACK] Seq=1 Ack=305529 Win=249856 Len=0 TSval=2039392746 TSecr=1375651394 SLE=312769 SRE=333041 SLE=306977 SRE=311321"
"347","2.766265","192.168.2.2","192.168.1.2","TCP","94","252416","[TCP Window Update] 5001  >  44744 [ACK] Seq=1 Ack=305529 Win=252416 Len=0 TSval=2039392759 TSecr=1375651394 SLE=334489 SRE=335937 SLE=312769 SRE=333041 SLE=306977 SRE=311321"
"348","2.778018","192.168.2.2","192.168.1.2","TCP","94","258560","[TCP Window Update] 5001  >  44744 [ACK] Seq=1 Ack=305529 Win=258560 Len=0 TSval=2039392771 TSecr=1375651394 SLE=334489 SRE=338833 SLE=312769 SRE=333041 SLE=306977 SRE=311321"
"351","2.801907","192.168.2.2","192.168.1.2","TCP","94","261120","[TCP Window Update] 5001  >  44744 [ACK] Seq=1 Ack=305529 Win=261120 Len=0 TSval=2039392795 TSecr=1375651394 SLE=340281 SRE=341729 SLE=334489 SRE=338833 SLE=312769 SRE=333041"
"353","2.814261","192.168.2.2","192.168.1.2","TCP","94","264192","[TCP Window Update] 5001  >  44744 [ACK] Seq=1 Ack=305529 Win=264192 Len=0 TSval=2039392807 TSecr=1375651394 SLE=340281 SRE=343177 SLE=334489 SRE=338833 SLE=312769 SRE=333041"
"357","2.826122","192.168.2.2","192.168.1.2","TCP","94","267264","[TCP Window Update] 5001  >  44744 [ACK] Seq=1 Ack=305529 Win=267264 Len=0 TSval=2039392819 TSecr=1375651394 SLE=340281 SRE=344625 SLE=334489 SRE=338833 SLE=312769 SRE=333041"
"359","2.838771","192.168.2.2","192.168.1.2","TCP","94","269824","[TCP Window Update] 5001  >  44744 [ACK] Seq=1 Ack=305529 Win=269824 Len=0 TSval=2039392832 TSecr=1375651394 SLE=340281 SRE=346073 SLE=334489 SRE=338833 SLE=312769 SRE=333041"
"361","2.850557","192.168.2.2","192.168.1.2","TCP","94","272896","5001  >  44744 [ACK] Seq=1 Ack=311321 Win=272896 Len=0 TSval=2039392843 TSecr=1375651721 SLE=340281 SRE=346073 SLE=334489 SRE=338833 SLE=312769 SRE=333041"
"363","2.863289","192.168.2.2","192.168.1.2","TCP","94","275968","[TCP Window Update] 5001  >  44744 [ACK] Seq=1 Ack=311321 Win=275968 Len=0 TSval=2039392856 TSecr=1375651721 SLE=347521 SRE=348969 SLE=340281 SRE=346073 SLE=334489 SRE=338833"
"365","2.874580","192.168.2.2","192.168.1.2","TCP","94","278528","5001  >  44744 [ACK] Seq=1 Ack=333041 Win=278528 Len=0 TSval=2039392867 TSecr=1375651770 SLE=347521 SRE=348969 SLE=340281 SRE=346073 SLE=334489 SRE=338833"
"367","2.886724","192.168.2.2","192.168.1.2","TCP","94","281600","[TCP Window Update] 5001  >  44744 [ACK] Seq=1 Ack=333041 Win=281600 Len=0 TSval=2039392879 TSecr=1375651770 SLE=347521 SRE=350417 SLE=340281 SRE=346073 SLE=334489 SRE=338833"
"369","2.898810","192.168.2.2","192.168.1.2","TCP","94","284160","[TCP Window Update] 5001  >  44744 [ACK] Seq=1 Ack=333041 Win=284160 Len=0 TSval=2039392892 TSecr=1375651770 SLE=347521 SRE=351865 SLE=340281 SRE=346073 SLE=334489 SRE=338833"
"371","2.911237","192.168.2.2","192.168.1.2","TCP","94","287232","[TCP Window Update] 5001  >  44744 [ACK] Seq=1 Ack=333041 Win=287232 Len=0 TSval=2039392904 TSecr=1375651770 SLE=347521 SRE=353313 SLE=340281 SRE=346073 SLE=334489 SRE=338833"
"373","2.923166","192.168.2.2","192.168.1.2","TCP","94","290304","[TCP Window Update] 5001  >  44744 [ACK] Seq=1 Ack=333041 Win=290304 Len=0 TSval=2039392916 TSecr=1375651770 SLE=347521 SRE=354761 SLE=340281 SRE=346073 SLE=334489 SRE=338833"
"375","2.935137","192.168.2.2","192.168.1.2","TCP","94","292864","[TCP Window Update] 5001  >  44744 [ACK] Seq=1 Ack=333041 Win=292864 Len=0 TSval=2039392928 TSecr=1375651770 SLE=347521 SRE=356209 SLE=340281 SRE=346073 SLE=334489 SRE=338833"
"377","2.947588","192.168.2.2","192.168.1.2","TCP","94","295936","[TCP Window Update] 5001  >  44744 [ACK] Seq=1 Ack=333041 Win=295936 Len=0 TSval=2039392940 TSecr=1375651770 SLE=347521 SRE=357657 SLE=340281 SRE=346073 SLE=334489 SRE=338833"
"379","2.959359","192.168.2.2","192.168.1.2","TCP","94","299008","[TCP Window Update] 5001  >  44744 [ACK] Seq=1 Ack=333041 Win=299008 Len=0 TSval=2039392952 TSecr=1375651770 SLE=347521 SRE=359105 SLE=340281 SRE=346073 SLE=334489 SRE=338833"
"381","2.971981","192.168.2.2","192.168.1.2","TCP","94","301568","[TCP Window Update] 5001  >  44744 [ACK] Seq=1 Ack=333041 Win=301568 Len=0 TSval=2039392965 TSecr=1375651770 SLE=347521 SRE=360553 SLE=340281 SRE=346073 SLE=334489 SRE=338833"
"383","2.983783","192.168.2.2","192.168.1.2","TCP","86","304640","5001  >  44744 [ACK] Seq=1 Ack=338833 Win=304640 Len=0 TSval=2039392976 TSecr=1375651940 SLE=347521 SRE=360553 SLE=340281 SRE=346073"
"385","2.996497","192.168.2.2","192.168.1.2","TCP","86","307712","[TCP Window Update] 5001  >  44744 [ACK] Seq=1 Ack=338833 Win=307712 Len=0 TSval=2039392989 TSecr=1375651940 SLE=347521 SRE=362001 SLE=340281 SRE=346073"
"387","3.008224","192.168.2.2","192.168.1.2","TCP","78","310272","5001  >  44744 [ACK] Seq=1 Ack=346073 Win=310272 Len=0 TSval=2039393001 TSecr=1375651964 SLE=347521 SRE=362001"
"389","3.019946","192.168.2.2","192.168.1.2","TCP","78","313344","[TCP Window Update] 5001  >  44744 [ACK] Seq=1 Ack=346073 Win=313344 Len=0 TSval=2039393013 TSecr=1375651964 SLE=347521 SRE=363449"
"391","3.032048","192.168.2.2","192.168.1.2","TCP","78","316416","[TCP Window Update] 5001  >  44744 [ACK] Seq=1 Ack=346073 Win=316416 Len=0 TSval=2039393025 TSecr=1375651964 SLE=347521 SRE=364897"
"394","3.044127","192.168.2.2","192.168.1.2","TCP","78","318976","[TCP Window Update] 5001  >  44744 [ACK] Seq=1 Ack=346073 Win=318976 Len=0 TSval=2039393037 TSecr=1375651964 SLE=347521 SRE=366345"
"395","3.056268","192.168.2.2","192.168.1.2","TCP","78","325120","[TCP Window Update] 5001  >  44744 [ACK] Seq=1 Ack=346073 Win=325120 Len=0 TSval=2039393049 TSecr=1375651964 SLE=347521 SRE=369241"
"397","3.080688","192.168.2.2","192.168.1.2","TCP","66","327680","5001  >  44744 [ACK] Seq=1 Ack=369241 Win=327680 Len=0 TSval=2039393073 TSecr=1375652025"
"398","3.092575","192.168.2.2","192.168.1.2","TCP","66","333824","5001  >  44744 [ACK] Seq=1 Ack=372137 Win=333824 Len=0 TSval=2039393085 TSecr=1375652036"
"400","3.116999","192.168.2.2","192.168.1.2","TCP","66","336384","5001  >  44744 [ACK] Seq=1 Ack=373585 Win=336384 Len=0 TSval=2039393110 TSecr=1375652049"
"401","3.129840","192.168.2.2","192.168.1.2","TCP","66","339456","5001  >  44744 [ACK] Seq=1 Ack=375033 Win=339456 Len=0 TSval=2039393123 TSecr=1375652061"
"403","3.141440","192.168.2.2","192.168.1.2","TCP","66","342528","5001  >  44744 [ACK] Seq=1 Ack=376481 Win=342528 Len=0 TSval=2039393134 TSecr=1375652073"
"405","3.153267","192.168.2.2","192.168.1.2","TCP","66","345088","5001  >  44744 [ACK] Seq=1 Ack=377929 Win=345088 Len=0 TSval=2039393146 TSecr=1375652085"
"406","3.165275","192.168.2.2","192.168.1.2","TCP","66","348160","5001  >  44744 [ACK] Seq=1 Ack=379377 Win=348160 Len=0 TSval=2039393158 TSecr=1375652097"
"408","3.177713","192.168.2.2","192.168.1.2","TCP","66","351232","5001  >  44744 [ACK] Seq=1 Ack=380825 Win=351232 Len=0 TSval=2039393170 TSecr=1375652109"
"410","3.189484","192.168.2.2","192.168.1.2","TCP","66","353792","5001  >  44744 [ACK] Seq=1 Ack=382273 Win=353792 Len=0 TSval=2039393182 TSecr=1375652121"
"411","3.202200","192.168.2.2","192.168.1.2","TCP","66","356864","5001  >  44744 [ACK] Seq=1 Ack=383721 Win=356864 Len=0 TSval=2039393195 TSecr=1375652134"
"413","3.213907","192.168.2.2","192.168.1.2","TCP","66","359936","5001  >  44744 [ACK] Seq=1 Ack=385169 Win=359936 Len=0 TSval=2039393207 TSecr=1375652146"
"415","3.225825","192.168.2.2","192.168.1.2","TCP","66","362496","5001  >  44744 [ACK] Seq=1 Ack=386617 Win=362496 Len=0 TSval=2039393219 TSecr=1375652158"
"417","3.237954","192.168.2.2","192.168.1.2","TCP","66","365568","5001  >  44744 [ACK] Seq=1 Ack=388065 Win=365568 Len=0 TSval=2039393231 TSecr=1375652170"
"419","3.250216","192.168.2.2","192.168.1.2","TCP","66","368640","5001  >  44744 [ACK] Seq=1 Ack=389513 Win=368640 Len=0 TSval=2039393243 TSecr=1375652182"
"421","3.262159","192.168.2.2","192.168.1.2","TCP","66","371200","5001  >  44744 [ACK] Seq=1 Ack=390961 Win=371200 Len=0 TSval=2039393255 TSecr=1375652194"
"424","3.275017","192.168.2.2","192.168.1.2","TCP","66","376832","5001  >  44744 [ACK] Seq=1 Ack=393857 Win=376832 Len=0 TSval=2039393268 TSecr=1375652218"
"426","3.300167","192.168.2.2","192.168.1.2","TCP","66","382976","5001  >  44744 [ACK] Seq=1 Ack=396753 Win=382976 Len=0 TSval=2039393293 TSecr=1375652254"
"428","3.323488","192.168.2.2","192.168.1.2","TCP","66","385536","5001  >  44744 [ACK] Seq=1 Ack=398201 Win=385536 Len=0 TSval=2039393316 TSecr=1375652292"
"430","3.336361","192.168.2.2","192.168.1.2","TCP","66","388608","5001  >  44744 [ACK] Seq=1 Ack=399649 Win=388608 Len=0 TSval=2039393329 TSecr=1375652303"
"432","3.348153","192.168.2.2","192.168.1.2","TCP","66","391680","5001  >  44744 [ACK] Seq=1 Ack=401097 Win=391680 Len=0 TSval=2039393341 TSecr=1375652327"
"434","3.359928","192.168.2.2","192.168.1.2","TCP","66","394240","5001  >  44744 [ACK] Seq=1 Ack=402545 Win=394240 Len=0 TSval=2039393353 TSecr=1375652339"
"436","3.372651","192.168.2.2","192.168.1.2","TCP","66","397312","5001  >  44744 [ACK] Seq=1 Ack=403993 Win=397312 Len=0 TSval=2039393365 TSecr=1375652376"
"438","3.384411","192.168.2.2","192.168.1.2","TCP","66","400384","5001  >  44744 [ACK] Seq=1 Ack=405441 Win=400384 Len=0 TSval=2039393377 TSecr=1375652388"
"440","3.396181","192.168.2.2","192.168.1.2","TCP","66","402944","5001  >  44744 [ACK] Seq=1 Ack=406889 Win=402944 Len=0 TSval=2039393389 TSecr=1375652400"
"442","3.408866","192.168.2.2","192.168.1.2","TCP","66","406016","5001  >  44744 [ACK] Seq=1 Ack=408337 Win=406016 Len=0 TSval=2039393402 TSecr=1375652412"
"444","3.420615","192.168.2.2","192.168.1.2","TCP","66","409088","5001  >  44744 [ACK] Seq=1 Ack=409785 Win=409088 Len=0 TSval=2039393413 TSecr=1375652424"
"446","3.432504","192.168.2.2","192.168.1.2","TCP","66","414720","5001  >  44744 [ACK] Seq=1 Ack=412681 Win=414720 Len=0 TSval=2039393425 TSecr=1375652437"
"448","3.456892","192.168.2.2","192.168.1.2","TCP","66","420352","5001  >  44744 [ACK] Seq=1 Ack=415577 Win=420352 Len=0 TSval=2039393450 TSecr=1375652462"
"450","3.481373","192.168.2.2","192.168.1.2","TCP","66","423424","5001  >  44744 [ACK] Seq=1 Ack=417025 Win=423424 Len=0 TSval=2039393474 TSecr=1375652485"
"452","3.493072","192.168.2.2","192.168.1.2","TCP","66","426496","5001  >  44744 [ACK] Seq=1 Ack=418473 Win=426496 Len=0 TSval=2039393486 TSecr=1375652498"
"454","3.505181","192.168.2.2","192.168.1.2","TCP","66","429056","5001  >  44744 [ACK] Seq=1 Ack=419921 Win=429056 Len=0 TSval=2039393498 TSecr=1375652510"
"456","3.517643","192.168.2.2","192.168.1.2","TCP","66","432128","5001  >  44744 [ACK] Seq=1 Ack=421369 Win=432128 Len=0 TSval=2039393510 TSecr=1375652522"
"458","3.529440","192.168.2.2","192.168.1.2","TCP","66","437760","5001  >  44744 [ACK] Seq=1 Ack=424265 Win=437760 Len=0 TSval=2039393522 TSecr=1375652534"
"460","3.553825","192.168.2.2","192.168.1.2","TCP","66","440832","5001  >  44744 [ACK] Seq=1 Ack=425713 Win=440832 Len=0 TSval=2039393547 TSecr=1375652546"
"462","3.566557","192.168.2.2","192.168.1.2","TCP","66","443904","5001  >  44744 [ACK] Seq=1 Ack=427161 Win=443904 Len=0 TSval=2039393559 TSecr=1375652558"
"464","3.578313","192.168.2.2","192.168.1.2","TCP","66","446464","5001  >  44744 [ACK] Seq=1 Ack=428609 Win=446464 Len=0 TSval=2039393571 TSecr=1375652571"
