"No.","Time","Source","Destination","Protocol","Length","Window size scaling factor","Calculated window size","Info"
"4","0.000379","192.168.2.2","192.168.1.2","TCP","74","","43440","5001  >  43962 [SYN, ACK] Seq=0 Ack=1 Win=43440 Len=0 MSS=1460 SACK_PERM=1 TSval=3824096322 TSecr=3459206020 WS=512"
"7","0.000474","192.168.2.2","192.168.1.2","TCP","66","512","39936","5001  >  43962 [ACK] Seq=1 Ack=7241 Win=39936 Len=0 TSval=3824096322 TSecr=3459206020"
"10","0.001989","192.168.2.2","192.168.1.2","TCP","66","512","36352","5001  >  43962 [ACK] Seq=1 Ack=14481 Win=36352 Len=0 TSval=3824096323 TSecr=3459206020"
"12","0.003406","192.168.2.2","192.168.1.2","TCP","66","512","31232","5001  >  43962 [ACK] Seq=1 Ack=24617 Win=31232 Len=0 TSval=3824096325 TSecr=3459206020"
"14","0.004445","192.168.2.2","192.168.1.2","TCP","66","512","29184","5001  >  43962 [ACK] Seq=1 Ack=28961 Win=29184 Len=0 TSval=3824096326 TSecr=3459206020"
"15","0.005355","192.168.2.2","192.168.1.2","TCP","66","512","22016","5001  >  43962 [ACK] Seq=1 Ack=43441 Win=22016 Len=0 TSval=3824096327 TSecr=3459206021"
"18","0.011894","192.168.2.2","192.168.1.2","TCP","66","512","42496","5001  >  43962 [ACK] Seq=1 Ack=58145 Win=42496 Len=0 TSval=3824096333 TSecr=3459206023"
"20","0.011924","192.168.2.2","192.168.1.2","TCP","66","512","71168","5001  >  43962 [ACK] Seq=1 Ack=72401 Win=71168 Len=0 TSval=3824096333 TSecr=3459206031"
"22","0.013726","192.168.2.2","192.168.1.2","TCP","66","512","108544","5001  >  43962 [ACK] Seq=1 Ack=91225 Win=108544 Len=0 TSval=3824096335 TSecr=3459206031"
"24","0.015691","192.168.2.2","192.168.1.2","TCP","66","512","114688","5001  >  43962 [ACK] Seq=1 Ack=94121 Win=114688 Len=0 TSval=3824096337 TSecr=3459206031"
"26","0.016647","192.168.2.2","192.168.1.2","TCP","66","512","120320","5001  >  43962 [ACK] Seq=1 Ack=97017 Win=120320 Len=0 TSval=3824096338 TSecr=3459206033"
"28","0.017609","192.168.2.2","192.168.1.2","TCP","66","512","157696","5001  >  43962 [ACK] Seq=1 Ack=115841 Win=157696 Len=0 TSval=3824096339 TSecr=3459206033"
"30","0.019659","192.168.2.2","192.168.1.2","TCP","66","512","186880","5001  >  43962 [ACK] Seq=1 Ack=130321 Win=186880 Len=0 TSval=3824096341 TSecr=3459206033"
"32","0.021568","192.168.2.2","192.168.1.2","TCP","66","512","198656","5001  >  43962 [ACK] Seq=1 Ack=136113 Win=198656 Len=0 TSval=3824096343 TSecr=3459206037"
"35","0.022548","192.168.2.2","192.168.1.2","TCP","66","512","201216","5001  >  43962 [ACK] Seq=1 Ack=137561 Win=201216 Len=0 TSval=3824096344 TSecr=3459206039"
"36","0.022549","192.168.2.2","192.168.1.2","TCP","66","512","232960","5001  >  43962 [ACK] Seq=1 Ack=153489 Win=232960 Len=0 TSval=3824096344 TSecr=3459206039"
"38","0.024523","192.168.2.2","192.168.1.2","TCP","66","512","244736","5001  >  43962 [ACK] Seq=1 Ack=159281 Win=244736 Len=0 TSval=3824096346 TSecr=3459206042"
"40","0.025467","192.168.2.2","192.168.1.2","TCP","66","512","273920","5001  >  43962 [ACK] Seq=1 Ack=173761 Win=273920 Len=0 TSval=3824096347 TSecr=3459206042"
"42","0.027452","192.168.2.2","192.168.1.2","TCP","66","512","281088","5001  >  43962 [ACK] Seq=1 Ack=181001 Win=281088 Len=0 TSval=3824096349 TSecr=3459206044"
"45","0.030390","192.168.2.2","192.168.1.2","TCP","66","512","281088","5001  >  43962 [ACK] Seq=1 Ack=202721 Win=281088 Len=0 TSval=3824096352 TSecr=3459206044"
"47","0.031413","192.168.2.2","192.168.1.2","TCP","66","512","281088","5001  >  43962 [ACK] Seq=1 Ack=220097 Win=281088 Len=0 TSval=3824096353 TSecr=3459206047"
"49","0.033309","192.168.2.2","192.168.1.2","TCP","66","512","282624","5001  >  43962 [ACK] Seq=1 Ack=224441 Win=282624 Len=0 TSval=3824096355 TSecr=3459206051"
"51","0.034277","192.168.2.2","192.168.1.2","TCP","66","512","282624","5001  >  43962 [ACK] Seq=1 Ack=238921 Win=282624 Len=0 TSval=3824096356 TSecr=3459206051"
"54","0.038415","192.168.2.2","192.168.1.2","TCP","66","512","282624","5001  >  43962 [ACK] Seq=1 Ack=263537 Win=282624 Len=0 TSval=3824096360 TSecr=3459206051"
"56","0.039217","192.168.2.2","192.168.1.2","TCP","66","512","282624","5001  >  43962 [ACK] Seq=1 Ack=279465 Win=282624 Len=0 TSval=3824096360 TSecr=3459206054"
"60","0.044094","192.168.2.2","192.168.1.2","TCP","66","512","282624","5001  >  43962 [ACK] Seq=1 Ack=317113 Win=282624 Len=0 TSval=3824096365 TSecr=3459206058"
"62","0.045060","192.168.2.2","192.168.1.2","TCP","66","512","282624","5001  >  43962 [ACK] Seq=1 Ack=324353 Win=282624 Len=0 TSval=3824096366 TSecr=3459206061"
"64","0.046031","192.168.2.2","192.168.1.2","TCP","66","512","282624","5001  >  43962 [ACK] Seq=1 Ack=337385 Win=282624 Len=0 TSval=3824096367 TSecr=3459206063"
"66","0.047004","192.168.2.2","192.168.1.2","TCP","66","512","282624","5001  >  43962 [ACK] Seq=1 Ack=350417 Win=282624 Len=0 TSval=3824096368 TSecr=3459206063"
"68","0.048833","192.168.2.2","192.168.1.2","TCP","66","512","282624","5001  >  43962 [ACK] Seq=1 Ack=354761 Win=282624 Len=0 TSval=3824096370 TSecr=3459206065"
"70","0.049066","192.168.2.2","192.168.1.2","TCP","66","512","282624","5001  >  43962 [ACK] Seq=1 Ack=367793 Win=282624 Len=0 TSval=3824096370 TSecr=3459206065"
"72","0.050162","192.168.2.2","192.168.1.2","TCP","66","512","282624","5001  >  43962 [ACK] Seq=1 Ack=372137 Win=282624 Len=0 TSval=3824096371 TSecr=3459206068"
"74","0.050523","192.168.2.2","192.168.1.2","TCP","66","512","282624","5001  >  43962 [ACK] Seq=1 Ack=388065 Win=282624 Len=0 TSval=3824096372 TSecr=3459206068"
"76","0.051925","192.168.2.2","192.168.1.2","TCP","66","512","282624","5001  >  43962 [ACK] Seq=1 Ack=403993 Win=282624 Len=0 TSval=3824096373 TSecr=3459206068"
"78","0.053902","192.168.2.2","192.168.1.2","TCP","66","512","282624","5001  >  43962 [ACK] Seq=1 Ack=415577 Win=282624 Len=0 TSval=3824096375 TSecr=3459206070"
"80","0.054742","192.168.2.2","192.168.1.2","TCP","66","512","282624","5001  >  43962 [ACK] Seq=1 Ack=419921 Win=282624 Len=0 TSval=3824096376 TSecr=3459206071"
"82","0.055111","192.168.2.2","192.168.1.2","TCP","66","512","282624","5001  >  43962 [ACK] Seq=1 Ack=435849 Win=282624 Len=0 TSval=3824096376 TSecr=3459206071"
"84","0.056437","192.168.2.2","192.168.1.2","TCP","66","512","282624","5001  >  43962 [ACK] Seq=1 Ack=453225 Win=282624 Len=0 TSval=3824096378 TSecr=3459206071"
"86","0.057889","192.168.2.2","192.168.1.2","TCP","66","512","282624","5001  >  43962 [ACK] Seq=1 Ack=472049 Win=282624 Len=0 TSval=3824096379 TSecr=3459206074"
"88","0.059762","192.168.2.2","192.168.1.2","TCP","66","512","282624","5001  >  43962 [ACK] Seq=1 Ack=485081 Win=282624 Len=0 TSval=3824096381 TSecr=3459206076"
"90","0.060716","192.168.2.2","192.168.1.2","TCP","66","512","282624","5001  >  43962 [ACK] Seq=1 Ack=502457 Win=282624 Len=0 TSval=3824096382 TSecr=3459206076"
"93","0.062680","192.168.2.2","192.168.1.2","TCP","66","512","283648","5001  >  43962 [ACK] Seq=1 Ack=503905 Win=283648 Len=0 TSval=3824096384 TSecr=3459206079"
"94","0.062883","192.168.2.2","192.168.1.2","TCP","66","512","283648","5001  >  43962 [ACK] Seq=1 Ack=522729 Win=283648 Len=0 TSval=3824096384 TSecr=3459206079"
"96","0.064647","192.168.2.2","192.168.1.2","TCP","66","512","283648","5001  >  43962 [ACK] Seq=1 Ack=540105 Win=283648 Len=0 TSval=3824096386 TSecr=3459206080"
"98","0.066629","192.168.2.2","192.168.1.2","TCP","66","512","283648","5001  >  43962 [ACK] Seq=1 Ack=550241 Win=283648 Len=0 TSval=3824096388 TSecr=3459206082"
"100","0.067343","192.168.2.2","192.168.1.2","TCP","66","512","283648","5001  >  43962 [ACK] Seq=1 Ack=569065 Win=283648 Len=0 TSval=3824096389 TSecr=3459206082"
"102","0.068924","192.168.2.2","192.168.1.2","TCP","66","512","283648","5001  >  43962 [ACK] Seq=1 Ack=587889 Win=283648 Len=0 TSval=3824096390 TSecr=3459206084"
"104","0.070506","192.168.2.2","192.168.1.2","TCP","66","512","283648","5001  >  43962 [ACK] Seq=1 Ack=605265 Win=283648 Len=0 TSval=3824096392 TSecr=3459206087"
"106","0.072471","192.168.2.2","192.168.1.2","TCP","66","512","283648","5001  >  43962 [ACK] Seq=1 Ack=615401 Win=283648 Len=0 TSval=3824096394 TSecr=3459206088"
"108","0.073194","192.168.2.2","192.168.1.2","TCP","66","512","283648","5001  >  43962 [ACK] Seq=1 Ack=632777 Win=283648 Len=0 TSval=3824096394 TSecr=3459206088"
"110","0.074650","192.168.2.2","192.168.1.2","TCP","66","512","283648","5001  >  43962 [ACK] Seq=1 Ack=644361 Win=283648 Len=0 TSval=3824096396 TSecr=3459206092"
"112","0.075627","192.168.2.2","192.168.1.2","TCP","66","512","283648","5001  >  43962 [ACK] Seq=1 Ack=661737 Win=283648 Len=0 TSval=3824096397 TSecr=3459206092"
"114","0.077370","192.168.2.2","192.168.1.2","TCP","66","512","283648","5001  >  43962 [ACK] Seq=1 Ack=679113 Win=283648 Len=0 TSval=3824096399 TSecr=3459206092"
"117","0.079430","192.168.2.2","192.168.1.2","TCP","66","512","283648","5001  >  43962 [ACK] Seq=1 Ack=699385 Win=283648 Len=0 TSval=3824096401 TSecr=3459206095"
"119","0.081047","192.168.2.2","192.168.1.2","TCP","66","512","283648","5001  >  43962 [ACK] Seq=1 Ack=718209 Win=283648 Len=0 TSval=3824096402 TSecr=3459206097"
"121","0.084898","192.168.2.2","192.168.1.2","TCP","66","512","283648","5001  >  43962 [ACK] Seq=1 Ack=737033 Win=283648 Len=0 TSval=3824096406 TSecr=3459206099"
"123","0.085235","192.168.2.2","192.168.1.2","TCP","66","512","283648","5001  >  43962 [ACK] Seq=1 Ack=745721 Win=283648 Len=0 TSval=3824096407 TSecr=3459206100"
"125","0.086432","192.168.2.2","192.168.1.2","TCP","66","512","283648","5001  >  43962 [ACK] Seq=1 Ack=765993 Win=283648 Len=0 TSval=3824096408 TSecr=3459206100"
"127","0.088234","192.168.2.2","192.168.1.2","TCP","66","512","283648","5001  >  43962 [ACK] Seq=1 Ack=780473 Win=283648 Len=0 TSval=3824096410 TSecr=3459206105"
"129","0.090164","192.168.2.2","192.168.1.2","TCP","66","512","283648","5001  >  43962 [ACK] Seq=1 Ack=799297 Win=283648 Len=0 TSval=3824096411 TSecr=3459206105"
"131","0.092165","192.168.2.2","192.168.1.2","TCP","66","512","283648","5001  >  43962 [ACK] Seq=1 Ack=810881 Win=283648 Len=0 TSval=3824096413 TSecr=3459206108"
"133","0.093083","192.168.2.2","192.168.1.2","TCP","66","512","283648","5001  >  43962 [ACK] Seq=1 Ack=829705 Win=283648 Len=0 TSval=3824096414 TSecr=3459206108"
"135","0.095045","192.168.2.2","192.168.1.2","TCP","66","512","283648","5001  >  43962 [ACK] Seq=1 Ack=848529 Win=283648 Len=0 TSval=3824096416 TSecr=3459206109"
"137","0.096998","192.168.2.2","192.168.1.2","TCP","66","512","283648","5001  >  43962 [ACK] Seq=1 Ack=865905 Win=283648 Len=0 TSval=3824096418 TSecr=3459206112"
"139","0.098969","192.168.2.2","192.168.1.2","TCP","66","512","283648","5001  >  43962 [ACK] Seq=1 Ack=876041 Win=283648 Len=0 TSval=3824096420 TSecr=3459206114"
"141","0.099996","192.168.2.2","192.168.1.2","TCP","66","512","283648","5001  >  43962 [ACK] Seq=1 Ack=894865 Win=283648 Len=0 TSval=3824096421 TSecr=3459206114"
"143","0.102867","192.168.2.2","192.168.1.2","TCP","66","512","283648","5001  >  43962 [ACK] Seq=1 Ack=913689 Win=283648 Len=0 TSval=3824096424 TSecr=3459206116"
"145","0.104815","192.168.2.2","192.168.1.2","TCP","66","512","283648","5001  >  43962 [ACK] Seq=1 Ack=932513 Win=283648 Len=0 TSval=3824096426 TSecr=3459206119"
"148","0.106826","192.168.2.2","192.168.1.2","TCP","66","512","283648","5001  >  43962 [ACK] Seq=1 Ack=941201 Win=283648 Len=0 TSval=3824096428 TSecr=3459206123"
"149","0.107819","192.168.2.2","192.168.1.2","TCP","66","512","283648","5001  >  43962 [ACK] Seq=1 Ack=960025 Win=283648 Len=0 TSval=3824096429 TSecr=3459206123"
"151","0.109237","192.168.2.2","192.168.1.2","TCP","66","512","283648","5001  >  43962 [ACK] Seq=1 Ack=978849 Win=283648 Len=0 TSval=3824096431 TSecr=3459206123"
"154","0.111679","192.168.2.2","192.168.1.2","TCP","66","512","283648","5001  >  43962 [ACK] Seq=1 Ack=997673 Win=283648 Len=0 TSval=3824096433 TSecr=3459206126"
"156","0.113118","192.168.2.2","192.168.1.2","TCP","66","512","283648","5001  >  43962 [ACK] Seq=1 Ack=1006361 Win=283648 Len=0 TSval=3824096434 TSecr=3459206128"
"158","0.113859","192.168.2.2","192.168.1.2","TCP","66","512","283648","5001  >  43962 [ACK] Seq=1 Ack=1025185 Win=283648 Len=0 TSval=3824096435 TSecr=3459206128"
"160","0.115578","192.168.2.2","192.168.1.2","TCP","66","512","283648","5001  >  43962 [ACK] Seq=1 Ack=1044009 Win=283648 Len=0 TSval=3824096437 TSecr=3459206129"
"162","0.117532","192.168.2.2","192.168.1.2","TCP","66","512","283648","5001  >  43962 [ACK] Seq=1 Ack=1062833 Win=283648 Len=0 TSval=3824096439 TSecr=3459206132"
"164","0.119574","192.168.2.2","192.168.1.2","TCP","66","512","283648","5001  >  43962 [ACK] Seq=1 Ack=1071521 Win=283648 Len=0 TSval=3824096441 TSecr=3459206135"
"166","0.120683","192.168.2.2","192.168.1.2","TCP","66","512","283648","5001  >  43962 [ACK] Seq=1 Ack=1090345 Win=283648 Len=0 TSval=3824096442 TSecr=3459206135"
"168","0.122442","192.168.2.2","192.168.1.2","TCP","66","512","283648","5001  >  43962 [ACK] Seq=1 Ack=1109169 Win=283648 Len=0 TSval=3824096444 TSecr=3459206135"
"170","0.124386","192.168.2.2","192.168.1.2","TCP","66","512","283648","5001  >  43962 [ACK] Seq=1 Ack=1127993 Win=283648 Len=0 TSval=3824096446 TSecr=3459206138"
"172","0.126333","192.168.2.2","192.168.1.2","TCP","66","512","283648","5001  >  43962 [ACK] Seq=1 Ack=1136681 Win=283648 Len=0 TSval=3824096448 TSecr=3459206142"
"174","0.127326","192.168.2.2","192.168.1.2","TCP","66","512","283648","5001  >  43962 [ACK] Seq=1 Ack=1155505 Win=283648 Len=0 TSval=3824096449 TSecr=3459206142"
"176","0.129315","192.168.2.2","192.168.1.2","TCP","66","512","283648","5001  >  43962 [ACK] Seq=1 Ack=1174329 Win=283648 Len=0 TSval=3824096451 TSecr=3459206142"
"178","0.131236","192.168.2.2","192.168.1.2","TCP","66","512","283648","5001  >  43962 [ACK] Seq=1 Ack=1191705 Win=283648 Len=0 TSval=3824096453 TSecr=3459206145"
"180","0.132586","192.168.2.2","192.168.1.2","TCP","66","512","283648","5001  >  43962 [ACK] Seq=1 Ack=1201841 Win=283648 Len=0 TSval=3824096454 TSecr=3459206147"
"181","0.133424","192.168.2.2","192.168.1.2","TCP","66","512","283648","5001  >  43962 [ACK] Seq=1 Ack=1220665 Win=283648 Len=0 TSval=3824096455 TSecr=3459206147"
"183","0.135215","192.168.2.2","192.168.1.2","TCP","66","512","283648","5001  >  43962 [ACK] Seq=1 Ack=1239489 Win=283648 Len=0 TSval=3824096456 TSecr=3459206149"
"185","0.136644","192.168.2.2","192.168.1.2","TCP","66","512","283648","5001  >  43962 [ACK] Seq=1 Ack=1258313 Win=283648 Len=0 TSval=3824096458 TSecr=3459206152"
"188","0.138218","192.168.2.2","192.168.1.2","TCP","66","512","283648","5001  >  43962 [ACK] Seq=1 Ack=1267001 Win=283648 Len=0 TSval=3824096459 TSecr=3459206155"
"189","0.138943","192.168.2.2","192.168.1.2","TCP","66","512","283648","5001  >  43962 [ACK] Seq=1 Ack=1285825 Win=283648 Len=0 TSval=3824096460 TSecr=3459206155"
"191","0.140519","192.168.2.2","192.168.1.2","TCP","66","512","283648","5001  >  43962 [ACK] Seq=1 Ack=1304649 Win=283648 Len=0 TSval=3824096462 TSecr=3459206155"
"193","0.142096","192.168.2.2","192.168.1.2","TCP","66","512","283648","5001  >  43962 [ACK] Seq=1 Ack=1323473 Win=283648 Len=0 TSval=3824096463 TSecr=3459206157"
"196","0.143666","192.168.2.2","192.168.1.2","TCP","66","512","283648","5001  >  43962 [ACK] Seq=1 Ack=1332161 Win=283648 Len=0 TSval=3824096465 TSecr=3459206158"
"197","0.144395","192.168.2.2","192.168.1.2","TCP","66","512","283648","5001  >  43962 [ACK] Seq=1 Ack=1352433 Win=283648 Len=0 TSval=3824096466 TSecr=3459206158"
"199","0.146098","192.168.2.2","192.168.1.2","TCP","66","512","283648","5001  >  43962 [ACK] Seq=1 Ack=1372705 Win=283648 Len=0 TSval=3824096467 TSecr=3459206160"
"201","0.147892","192.168.2.2","192.168.1.2","TCP","66","512","283648","5001  >  43962 [ACK] Seq=1 Ack=1392977 Win=283648 Len=0 TSval=3824096469 TSecr=3459206162"
"204","0.149486","192.168.2.2","192.168.1.2","TCP","66","512","283648","5001  >  43962 [ACK] Seq=1 Ack=1397321 Win=283648 Len=0 TSval=3824096471 TSecr=3459206166"
"205","0.149842","192.168.2.2","192.168.1.2","TCP","66","512","283648","5001  >  43962 [ACK] Seq=1 Ack=1417593 Win=283648 Len=0 TSval=3824096471 TSecr=3459206166"
"207","0.151808","192.168.2.2","192.168.1.2","TCP","66","512","283648","5001  >  43962 [ACK] Seq=1 Ack=1437865 Win=283648 Len=0 TSval=3824096473 TSecr=3459206166"
"209","0.153391","192.168.2.2","192.168.1.2","TCP","66","512","283648","5001  >  43962 [ACK] Seq=1 Ack=1458137 Win=283648 Len=0 TSval=3824096475 TSecr=3459206168"
"212","0.155724","192.168.2.2","192.168.1.2","TCP","66","512","283648","5001  >  43962 [ACK] Seq=1 Ack=1462481 Win=283648 Len=0 TSval=3824096477 TSecr=3459206169"
"214","0.156007","192.168.2.2","192.168.1.2","TCP","66","512","283648","5001  >  43962 [ACK] Seq=1 Ack=1484201 Win=283648 Len=0 TSval=3824096477 TSecr=3459206169"
"216","0.157788","192.168.2.2","192.168.1.2","TCP","66","512","283648","5001  >  43962 [ACK] Seq=1 Ack=1505921 Win=283648 Len=0 TSval=3824096479 TSecr=3459206171"
"218","0.159746","192.168.2.2","192.168.1.2","TCP","66","512","283648","5001  >  43962 [ACK] Seq=1 Ack=1527641 Win=283648 Len=0 TSval=3824096481 TSecr=3459206173"
"220","0.161619","192.168.2.2","192.168.1.2","TCP","66","512","283648","5001  >  43962 [ACK] Seq=1 Ack=1549361 Win=283648 Len=0 TSval=3824096483 TSecr=3459206175"
"222","0.163324","192.168.2.2","192.168.1.2","TCP","66","512","283648","5001  >  43962 [ACK] Seq=1 Ack=1571081 Win=283648 Len=0 TSval=3824096485 TSecr=3459206177"
"225","0.165132","192.168.2.2","192.168.1.2","TCP","66","512","283648","5001  >  43962 [ACK] Seq=1 Ack=1591353 Win=283648 Len=0 TSval=3824096486 TSecr=3459206179"
"227","0.166947","192.168.2.2","192.168.1.2","TCP","66","512","283648","5001  >  43962 [ACK] Seq=1 Ack=1613073 Win=283648 Len=0 TSval=3824096488 TSecr=3459206183"
"229","0.168655","192.168.2.2","192.168.1.2","TCP","66","512","283648","5001  >  43962 [ACK] Seq=1 Ack=1633345 Win=283648 Len=0 TSval=3824096490 TSecr=3459206183"
"231","0.170440","192.168.2.2","192.168.1.2","TCP","66","512","283648","5001  >  43962 [ACK] Seq=1 Ack=1653617 Win=283648 Len=0 TSval=3824096492 TSecr=3459206184"
"233","0.172383","192.168.2.2","192.168.1.2","TCP","66","512","283648","5001  >  43962 [ACK] Seq=1 Ack=1657961 Win=283648 Len=0 TSval=3824096494 TSecr=3459206186"
"235","0.172633","192.168.2.2","192.168.1.2","TCP","66","512","283648","5001  >  43962 [ACK] Seq=1 Ack=1679681 Win=283648 Len=0 TSval=3824096494 TSecr=3459206186"
"237","0.174446","192.168.2.2","192.168.1.2","TCP","66","512","283648","5001  >  43962 [ACK] Seq=1 Ack=1701401 Win=283648 Len=0 TSval=3824096496 TSecr=3459206188"
"239","0.176308","192.168.2.2","192.168.1.2","TCP","66","512","283648","5001  >  43962 [ACK] Seq=1 Ack=1723121 Win=283648 Len=0 TSval=3824096498 TSecr=3459206190"
"241","0.178269","192.168.2.2","192.168.1.2","TCP","66","512","283648","5001  >  43962 [ACK] Seq=1 Ack=1744841 Win=283648 Len=0 TSval=3824096500 TSecr=3459206192"
"243","0.180237","192.168.2.2","192.168.1.2","TCP","66","512","283648","5001  >  43962 [ACK] Seq=1 Ack=1766561 Win=283648 Len=0 TSval=3824096502 TSecr=3459206194"
"245","0.181934","192.168.2.2","192.168.1.2","TCP","66","512","283648","5001  >  43962 [ACK] Seq=1 Ack=1788281 Win=283648 Len=0 TSval=3824096503 TSecr=3459206196"
"247","0.183752","192.168.2.2","192.168.1.2","TCP","66","512","283648","5001  >  43962 [ACK] Seq=1 Ack=1810001 Win=283648 Len=0 TSval=3824096505 TSecr=3459206198"
"249","0.185574","192.168.2.2","192.168.1.2","TCP","66","512","283648","5001  >  43962 [ACK] Seq=1 Ack=1831721 Win=283648 Len=0 TSval=3824096507 TSecr=3459206200"
"251","0.187388","192.168.2.2","192.168.1.2","TCP","66","512","283648","5001  >  43962 [ACK] Seq=1 Ack=1853441 Win=283648 Len=0 TSval=3824096509 TSecr=3459206201"
"253","0.189201","192.168.2.2","192.168.1.2","TCP","66","512","283648","5001  >  43962 [ACK] Seq=1 Ack=1875161 Win=283648 Len=0 TSval=3824096510 TSecr=3459206203"
"255","0.191021","192.168.2.2","192.168.1.2","TCP","66","512","283648","5001  >  43962 [ACK] Seq=1 Ack=1896881 Win=283648 Len=0 TSval=3824096512 TSecr=3459206205"
"257","0.193064","192.168.2.2","192.168.1.2","TCP","66","512","283648","5001  >  43962 [ACK] Seq=1 Ack=1918601 Win=283648 Len=0 TSval=3824096514 TSecr=3459206207"
"259","0.194921","192.168.2.2","192.168.1.2","TCP","66","512","283648","5001  >  43962 [ACK] Seq=1 Ack=1941769 Win=283648 Len=0 TSval=3824096516 TSecr=3459206207"
"261","0.196877","192.168.2.2","192.168.1.2","TCP","66","512","283648","5001  >  43962 [ACK] Seq=1 Ack=1964937 Win=283648 Len=0 TSval=3824096518 TSecr=3459206208"
"263","0.198850","192.168.2.2","192.168.1.2","TCP","66","512","283648","5001  >  43962 [ACK] Seq=1 Ack=1983761 Win=283648 Len=0 TSval=3824096520 TSecr=3459206212"
"265","0.200804","192.168.2.2","192.168.1.2","TCP","66","512","283648","5001  >  43962 [ACK] Seq=1 Ack=2006929 Win=283648 Len=0 TSval=3824096522 TSecr=3459206212"
"267","0.202748","192.168.2.2","192.168.1.2","TCP","66","512","283648","5001  >  43962 [ACK] Seq=1 Ack=2030097 Win=283648 Len=0 TSval=3824096524 TSecr=3459206214"
"269","0.204709","192.168.2.2","192.168.1.2","TCP","66","512","283648","5001  >  43962 [ACK] Seq=1 Ack=2048921 Win=283648 Len=0 TSval=3824096526 TSecr=3459206218"
"271","0.206730","192.168.2.2","192.168.1.2","TCP","66","512","283648","5001  >  43962 [ACK] Seq=1 Ack=2070641 Win=283648 Len=0 TSval=3824096528 TSecr=3459206218"
"273","0.208369","192.168.2.2","192.168.1.2","TCP","66","512","283648","5001  >  43962 [ACK] Seq=1 Ack=2092361 Win=283648 Len=0 TSval=3824096530 TSecr=3459206220"
"276","0.210189","192.168.2.2","192.168.1.2","TCP","66","512","283648","5001  >  43962 [ACK] Seq=1 Ack=2112633 Win=283648 Len=0 TSval=3824096531 TSecr=3459206224"
"278","0.211995","192.168.2.2","192.168.1.2","TCP","66","512","283648","5001  >  43962 [ACK] Seq=1 Ack=2134353 Win=283648 Len=0 TSval=3824096533 TSecr=3459206226"
"280","0.213685","192.168.2.2","192.168.1.2","TCP","66","512","283648","5001  >  43962 [ACK] Seq=1 Ack=2154625 Win=283648 Len=0 TSval=3824096535 TSecr=3459206228"
"282","0.215535","192.168.2.2","192.168.1.2","TCP","66","512","283648","5001  >  43962 [ACK] Seq=1 Ack=2174897 Win=283648 Len=0 TSval=3824096537 TSecr=3459206229"
"285","0.217447","192.168.2.2","192.168.1.2","TCP","66","512","283648","5001  >  43962 [ACK] Seq=1 Ack=2179241 Win=283648 Len=0 TSval=3824096539 TSecr=3459206231"
"286","0.217677","192.168.2.2","192.168.1.2","TCP","66","512","283648","5001  >  43962 [ACK] Seq=1 Ack=2199513 Win=283648 Len=0 TSval=3824096539 TSecr=3459206231"
"288","0.219430","192.168.2.2","192.168.1.2","TCP","66","512","283648","5001  >  43962 [ACK] Seq=1 Ack=2219785 Win=283648 Len=0 TSval=3824096541 TSecr=3459206233"
"290","0.221365","192.168.2.2","192.168.1.2","TCP","66","512","283648","5001  >  43962 [ACK] Seq=1 Ack=2240057 Win=283648 Len=0 TSval=3824096543 TSecr=3459206235"
"292","0.222947","192.168.2.2","192.168.1.2","TCP","66","512","283648","5001  >  43962 [ACK] Seq=1 Ack=2244401 Win=283648 Len=0 TSval=3824096544 TSecr=3459206237"
"293","0.223333","192.168.2.2","192.168.1.2","TCP","66","512","283648","5001  >  43962 [ACK] Seq=1 Ack=2266121 Win=283648 Len=0 TSval=3824096545 TSecr=3459206237"
"296","0.225284","192.168.2.2","192.168.1.2","TCP","66","512","283648","5001  >  43962 [ACK] Seq=1 Ack=2287841 Win=283648 Len=0 TSval=3824096547 TSecr=3459206239"
"298","0.227247","192.168.2.2","192.168.1.2","TCP","66","512","283648","5001  >  43962 [ACK] Seq=1 Ack=2309561 Win=283648 Len=0 TSval=3824096549 TSecr=3459206241"
"300","0.229199","192.168.2.2","192.168.1.2","TCP","66","512","283648","5001  >  43962 [ACK] Seq=1 Ack=2331281 Win=283648 Len=0 TSval=3824096550 TSecr=3459206243"
"302","0.231160","192.168.2.2","192.168.1.2","TCP","66","512","283648","5001  >  43962 [ACK] Seq=1 Ack=2354449 Win=283648 Len=0 TSval=3824096552 TSecr=3459206243"
"304","0.232973","192.168.2.2","192.168.1.2","TCP","66","512","283648","5001  >  43962 [ACK] Seq=1 Ack=2374721 Win=283648 Len=0 TSval=3824096554 TSecr=3459206247"
"306","0.235079","192.168.2.2","192.168.1.2","TCP","66","512","283648","5001  >  43962 [ACK] Seq=1 Ack=2397889 Win=283648 Len=0 TSval=3824096556 TSecr=3459206247"
"308","0.237034","192.168.2.2","192.168.1.2","TCP","66","512","283648","5001  >  43962 [ACK] Seq=1 Ack=2421057 Win=283648 Len=0 TSval=3824096558 TSecr=3459206248"
"310","0.238999","192.168.2.2","192.168.1.2","TCP","66","512","283648","5001  >  43962 [ACK] Seq=1 Ack=2439881 Win=283648 Len=0 TSval=3824096560 TSecr=3459206252"
"311","0.240455","192.168.2.2","192.168.1.2","TCP","66","512","283648","5001  >  43962 [ACK] Seq=1 Ack=2461601 Win=283648 Len=0 TSval=3824096562 TSecr=3459206252"
"313","0.242280","192.168.2.2","192.168.1.2","TCP","66","512","283648","5001  >  43962 [ACK] Seq=1 Ack=2484769 Win=283648 Len=0 TSval=3824096564 TSecr=3459206254"
"315","0.244205","192.168.2.2","192.168.1.2","TCP","66","512","283648","5001  >  43962 [ACK] Seq=1 Ack=2505041 Win=283648 Len=0 TSval=3824096565 TSecr=3459206258"
"317","0.245909","192.168.2.2","192.168.1.2","TCP","66","512","283648","5001  >  43962 [ACK] Seq=1 Ack=2526761 Win=283648 Len=0 TSval=3824096567 TSecr=3459206260"
"320","0.248132","192.168.2.2","192.168.1.2","TCP","66","512","283648","5001  >  43962 [ACK] Seq=1 Ack=2548481 Win=283648 Len=0 TSval=3824096569 TSecr=3459206260"
"322","0.249790","192.168.2.2","192.168.1.2","TCP","66","512","283648","5001  >  43962 [ACK] Seq=1 Ack=2568753 Win=283648 Len=0 TSval=3824096571 TSecr=3459206264"
"325","0.251878","192.168.2.2","192.168.1.2","TCP","66","512","283648","5001  >  43962 [ACK] Seq=1 Ack=2591921 Win=283648 Len=0 TSval=3824096573 TSecr=3459206265"
"327","0.253738","192.168.2.2","192.168.1.2","TCP","66","512","283648","5001  >  43962 [ACK] Seq=1 Ack=2613641 Win=283648 Len=0 TSval=3824096575 TSecr=3459206267"
"329","0.255661","192.168.2.2","192.168.1.2","TCP","66","512","283648","5001  >  43962 [ACK] Seq=1 Ack=2635361 Win=283648 Len=0 TSval=3824096577 TSecr=3459206269"
"331","0.257612","192.168.2.2","192.168.1.2","TCP","66","512","283648","5001  >  43962 [ACK] Seq=1 Ack=2657081 Win=283648 Len=0 TSval=3824096579 TSecr=3459206271"
"333","0.259592","192.168.2.2","192.168.1.2","TCP","66","512","283648","5001  >  43962 [ACK] Seq=1 Ack=2678801 Win=283648 Len=0 TSval=3824096581 TSecr=3459206273"
"335","0.261542","192.168.2.2","192.168.1.2","TCP","66","512","283648","5001  >  43962 [ACK] Seq=1 Ack=2700521 Win=283648 Len=0 TSval=3824096583 TSecr=3459206275"
"337","0.263493","192.168.2.2","192.168.1.2","TCP","66","512","283648","5001  >  43962 [ACK] Seq=1 Ack=2723689 Win=283648 Len=0 TSval=3824096585 TSecr=3459206275"
"339","0.265449","192.168.2.2","192.168.1.2","TCP","66","512","283648","5001  >  43962 [ACK] Seq=1 Ack=2746857 Win=283648 Len=0 TSval=3824096587 TSecr=3459206277"
"341","0.267419","192.168.2.2","192.168.1.2","TCP","66","512","283648","5001  >  43962 [ACK] Seq=1 Ack=2765681 Win=283648 Len=0 TSval=3824096589 TSecr=3459206281"
"343","0.269385","192.168.2.2","192.168.1.2","TCP","66","512","283648","5001  >  43962 [ACK] Seq=1 Ack=2788849 Win=283648 Len=0 TSval=3824096591 TSecr=3459206281"
"345","0.271331","192.168.2.2","192.168.1.2","TCP","66","512","283648","5001  >  43962 [ACK] Seq=1 Ack=2813465 Win=283648 Len=0 TSval=3824096593 TSecr=3459206283"
"347","0.273292","192.168.2.2","192.168.1.2","TCP","66","512","283648","5001  >  43962 [ACK] Seq=1 Ack=2830841 Win=283648 Len=0 TSval=3824096595 TSecr=3459206287"
"348","0.274708","192.168.2.2","192.168.1.2","TCP","66","512","283648","5001  >  43962 [ACK] Seq=1 Ack=2854009 Win=283648 Len=0 TSval=3824096596 TSecr=3459206287"
"350","0.276661","192.168.2.2","192.168.1.2","TCP","66","512","283648","5001  >  43962 [ACK] Seq=1 Ack=2877177 Win=283648 Len=0 TSval=3824096598 TSecr=3459206289"
"352","0.278596","192.168.2.2","192.168.1.2","TCP","66","512","283648","5001  >  43962 [ACK] Seq=1 Ack=2896001 Win=283648 Len=0 TSval=3824096600 TSecr=3459206293"
"354","0.280264","192.168.2.2","192.168.1.2","TCP","66","512","283648","5001  >  43962 [ACK] Seq=1 Ack=2917721 Win=283648 Len=0 TSval=3824096602 TSecr=3459206293"
"356","0.282094","192.168.2.2","192.168.1.2","TCP","66","512","283648","5001  >  43962 [ACK] Seq=1 Ack=2939441 Win=283648 Len=0 TSval=3824096603 TSecr=3459206294"
"358","0.283809","192.168.2.2","192.168.1.2","TCP","66","512","283648","5001  >  43962 [ACK] Seq=1 Ack=2961161 Win=283648 Len=0 TSval=3824096605 TSecr=3459206298"
"361","0.286026","192.168.2.2","192.168.1.2","TCP","66","512","283648","5001  >  43962 [ACK] Seq=1 Ack=2984329 Win=283648 Len=0 TSval=3824096607 TSecr=3459206298"
"363","0.287982","192.168.2.2","192.168.1.2","TCP","66","512","283648","5001  >  43962 [ACK] Seq=1 Ack=3007497 Win=283648 Len=0 TSval=3824096609 TSecr=3459206300"
"365","0.289942","192.168.2.2","192.168.1.2","TCP","66","512","283648","5001  >  43962 [ACK] Seq=1 Ack=3026321 Win=283648 Len=0 TSval=3824096611 TSecr=3459206303"
"367","0.291912","192.168.2.2","192.168.1.2","TCP","66","512","283648","5001  >  43962 [ACK] Seq=1 Ack=3049489 Win=283648 Len=0 TSval=3824096613 TSecr=3459206303"
"369","0.293863","192.168.2.2","192.168.1.2","TCP","66","512","283648","5001  >  43962 [ACK] Seq=1 Ack=3072657 Win=283648 Len=0 TSval=3824096615 TSecr=3459206305"
"371","0.295824","192.168.2.2","192.168.1.2","TCP","66","512","283648","5001  >  43962 [ACK] Seq=1 Ack=3091481 Win=283648 Len=0 TSval=3824096617 TSecr=3459206309"
"373","0.297786","192.168.2.2","192.168.1.2","TCP","66","512","283648","5001  >  43962 [ACK] Seq=1 Ack=3114649 Win=283648 Len=0 TSval=3824096619 TSecr=3459206309"
"375","0.299755","192.168.2.2","192.168.1.2","TCP","66","512","283648","5001  >  43962 [ACK] Seq=1 Ack=3137817 Win=283648 Len=0 TSval=3824096621 TSecr=3459206311"
"377","0.301562","192.168.2.2","192.168.1.2","TCP","66","512","283648","5001  >  43962 [ACK] Seq=1 Ack=3156641 Win=283648 Len=0 TSval=3824096623 TSecr=3459206315"
"379","0.303314","192.168.2.2","192.168.1.2","TCP","66","512","283648","5001  >  43962 [ACK] Seq=1 Ack=3178361 Win=283648 Len=0 TSval=3824096625 TSecr=3459206315"
"381","0.305011","192.168.2.2","192.168.1.2","TCP","66","512","283648","5001  >  43962 [ACK] Seq=1 Ack=3200081 Win=283648 Len=0 TSval=3824096626 TSecr=3459206317"
"383","0.306830","192.168.2.2","192.168.1.2","TCP","66","512","283648","5001  >  43962 [ACK] Seq=1 Ack=3221801 Win=283648 Len=0 TSval=3824096628 TSecr=3459206320"
"385","0.308644","192.168.2.2","192.168.1.2","TCP","66","512","283648","5001  >  43962 [ACK] Seq=1 Ack=3243521 Win=283648 Len=0 TSval=3824096630 TSecr=3459206322"
"387","0.310528","192.168.2.2","192.168.1.2","TCP","66","512","283648","5001  >  43962 [ACK] Seq=1 Ack=3265241 Win=283648 Len=0 TSval=3824096632 TSecr=3459206324"
"389","0.312485","192.168.2.2","192.168.1.2","TCP","66","512","283648","5001  >  43962 [ACK] Seq=1 Ack=3286961 Win=283648 Len=0 TSval=3824096634 TSecr=3459206326"
"391","0.314447","192.168.2.2","192.168.1.2","TCP","66","512","283648","5001  >  43962 [ACK] Seq=1 Ack=3308681 Win=283648 Len=0 TSval=3824096636 TSecr=3459206328"
"393","0.316396","192.168.2.2","192.168.1.2","TCP","66","512","283648","5001  >  43962 [ACK] Seq=1 Ack=3330401 Win=283648 Len=0 TSval=3824096638 TSecr=3459206330"
"395","0.318382","192.168.2.2","192.168.1.2","TCP","66","512","283648","5001  >  43962 [ACK] Seq=1 Ack=3352121 Win=283648 Len=0 TSval=3824096640 TSecr=3459206332"
"397","0.320343","192.168.2.2","192.168.1.2","TCP","66","512","283648","5001  >  43962 [ACK] Seq=1 Ack=3375289 Win=283648 Len=0 TSval=3824096642 TSecr=3459206332"
"399","0.322275","192.168.2.2","192.168.1.2","TCP","66","512","283648","5001  >  43962 [ACK] Seq=1 Ack=3398457 Win=283648 Len=0 TSval=3824096644 TSecr=3459206334"
"401","0.324247","192.168.2.2","192.168.1.2","TCP","66","512","283648","5001  >  43962 [ACK] Seq=1 Ack=3417281 Win=283648 Len=0 TSval=3824096646 TSecr=3459206338"
"403","0.326203","192.168.2.2","192.168.1.2","TCP","66","512","283648","5001  >  43962 [ACK] Seq=1 Ack=3441897 Win=283648 Len=0 TSval=3824096647 TSecr=3459206338"
"404","0.328149","192.168.2.2","192.168.1.2","TCP","66","512","283648","5001  >  43962 [ACK] Seq=1 Ack=3466513 Win=283648 Len=0 TSval=3824096649 TSecr=3459206340"
"407","0.330180","192.168.2.2","192.168.1.2","TCP","66","512","283648","5001  >  43962 [ACK] Seq=1 Ack=3482441 Win=283648 Len=0 TSval=3824096651 TSecr=3459206344"
"408","0.331522","192.168.2.2","192.168.1.2","TCP","66","512","283648","5001  >  43962 [ACK] Seq=1 Ack=3505609 Win=283648 Len=0 TSval=3824096653 TSecr=3459206344"
"410","0.333461","192.168.2.2","192.168.1.2","TCP","66","512","283648","5001  >  43962 [ACK] Seq=1 Ack=3528777 Win=283648 Len=0 TSval=3824096655 TSecr=3459206345"
"412","0.335400","192.168.2.2","192.168.1.2","TCP","66","512","283648","5001  >  43962 [ACK] Seq=1 Ack=3547601 Win=283648 Len=0 TSval=3824096657 TSecr=3459206349"
"414","0.336962","192.168.2.2","192.168.1.2","TCP","66","512","283648","5001  >  43962 [ACK] Seq=1 Ack=3569321 Win=283648 Len=0 TSval=3824096658 TSecr=3459206349"
"416","0.338919","192.168.2.2","192.168.1.2","TCP","66","512","283648","5001  >  43962 [ACK] Seq=1 Ack=3591041 Win=283648 Len=0 TSval=3824096660 TSecr=3459206351"
"419","0.340927","192.168.2.2","192.168.1.2","TCP","66","512","283648","5001  >  43962 [ACK] Seq=1 Ack=3612761 Win=283648 Len=0 TSval=3824096662 TSecr=3459206355"
"421","0.342865","192.168.2.2","192.168.1.2","TCP","66","512","283648","5001  >  43962 [ACK] Seq=1 Ack=3635929 Win=283648 Len=0 TSval=3824096664 TSecr=3459206355"
"423","0.344829","192.168.2.2","192.168.1.2","TCP","66","512","283648","5001  >  43962 [ACK] Seq=1 Ack=3659097 Win=283648 Len=0 TSval=3824096666 TSecr=3459206357"
"425","0.346794","192.168.2.2","192.168.1.2","TCP","66","512","283648","5001  >  43962 [ACK] Seq=1 Ack=3677921 Win=283648 Len=0 TSval=3824096668 TSecr=3459206360"
"427","0.352145","192.168.2.2","192.168.1.2","TCP","66","512","283648","5001  >  43962 [ACK] Seq=1 Ack=3701089 Win=283648 Len=0 TSval=3824096673 TSecr=3459206360"
"429","0.353926","192.168.2.2","192.168.1.2","TCP","66","512","283648","5001  >  43962 [ACK] Seq=1 Ack=3724257 Win=283648 Len=0 TSval=3824096675 TSecr=3459206362"
"431","0.355845","192.168.2.2","192.168.1.2","TCP","66","512","283648","5001  >  43962 [ACK] Seq=1 Ack=3743081 Win=283648 Len=0 TSval=3824096677 TSecr=3459206366"
"433","0.357547","192.168.2.2","192.168.1.2","TCP","66","512","283648","5001  >  43962 [ACK] Seq=1 Ack=3764801 Win=283648 Len=0 TSval=3824096679 TSecr=3459206366"
"435","0.359634","192.168.2.2","192.168.1.2","TCP","66","512","283648","5001  >  43962 [ACK] Seq=1 Ack=3786521 Win=283648 Len=0 TSval=3824096681 TSecr=3459206371"
"438","0.361493","192.168.2.2","192.168.1.2","TCP","66","512","283648","5001  >  43962 [ACK] Seq=1 Ack=3805345 Win=283648 Len=0 TSval=3824096683 TSecr=3459206375"
"440","0.363068","192.168.2.2","192.168.1.2","TCP","66","512","283648","5001  >  43962 [ACK] Seq=1 Ack=3808241 Win=283648 Len=0 TSval=3824096684 TSecr=3459206379"
"442","0.363198","192.168.2.2","192.168.1.2","TCP","66","512","283648","5001  >  43962 [ACK] Seq=1 Ack=3827065 Win=283648 Len=0 TSval=3824096684 TSecr=3459206379"
"444","0.364777","192.168.2.2","192.168.1.2","TCP","66","512","283648","5001  >  43962 [ACK] Seq=1 Ack=3845889 Win=283648 Len=0 TSval=3824096686 TSecr=3459206379"
"446","0.366368","192.168.2.2","192.168.1.2","TCP","66","512","283648","5001  >  43962 [ACK] Seq=1 Ack=3864713 Win=283648 Len=0 TSval=3824096688 TSecr=3459206381"
"448","0.367927","192.168.2.2","192.168.1.2","TCP","66","512","283648","5001  >  43962 [ACK] Seq=1 Ack=3873401 Win=283648 Len=0 TSval=3824096689 TSecr=3459206382"
"449","0.368658","192.168.2.2","192.168.1.2","TCP","66","512","283648","5001  >  43962 [ACK] Seq=1 Ack=3893673 Win=283648 Len=0 TSval=3824096690 TSecr=3459206382"
"451","0.370387","192.168.2.2","192.168.1.2","TCP","66","512","283648","5001  >  43962 [ACK] Seq=1 Ack=3913945 Win=283648 Len=0 TSval=3824096692 TSecr=3459206384"
"454","0.372329","192.168.2.2","192.168.1.2","TCP","66","512","283648","5001  >  43962 [ACK] Seq=1 Ack=3935665 Win=283648 Len=0 TSval=3824096694 TSecr=3459206386"
"456","0.374210","192.168.2.2","192.168.1.2","TCP","66","512","283648","5001  >  43962 [ACK] Seq=1 Ack=3938561 Win=283648 Len=0 TSval=3824096695 TSecr=3459206388"
"457","0.374321","192.168.2.2","192.168.1.2","TCP","66","512","283648","5001  >  43962 [ACK] Seq=1 Ack=3963177 Win=283648 Len=0 TSval=3824096696 TSecr=3459206388"
"459","0.376395","192.168.2.2","192.168.1.2","TCP","66","512","283648","5001  >  43962 [ACK] Seq=1 Ack=3987793 Win=283648 Len=0 TSval=3824096698 TSecr=3459206390"
"462","0.378453","192.168.2.2","192.168.1.2","TCP","66","512","283648","5001  >  43962 [ACK] Seq=1 Ack=4003721 Win=283648 Len=0 TSval=3824096700 TSecr=3459206392"
"464","0.380126","192.168.2.2","192.168.1.2","TCP","66","512","283648","5001  >  43962 [ACK] Seq=1 Ack=4028337 Win=283648 Len=0 TSval=3824096701 TSecr=3459206392"
"465","0.382032","192.168.2.2","192.168.1.2","TCP","66","512","283648","5001  >  43962 [ACK] Seq=1 Ack=4052953 Win=283648 Len=0 TSval=3824096703 TSecr=3459206394"
"468","0.384091","192.168.2.2","192.168.1.2","TCP","66","512","283648","5001  >  43962 [ACK] Seq=1 Ack=4068881 Win=283648 Len=0 TSval=3824096705 TSecr=3459206397"
"469","0.385431","192.168.2.2","192.168.1.2","TCP","66","512","283648","5001  >  43962 [ACK] Seq=1 Ack=4094945 Win=283648 Len=0 TSval=3824096707 TSecr=3459206397"
"471","0.387926","192.168.2.2","192.168.1.2","TCP","66","512","283648","5001  >  43962 [ACK] Seq=1 Ack=4121009 Win=283648 Len=0 TSval=3824096709 TSecr=3459206399"
"474","0.389997","192.168.2.2","192.168.1.2","TCP","66","512","283648","5001  >  43962 [ACK] Seq=1 Ack=4134041 Win=283648 Len=0 TSval=3824096711 TSecr=3459206403"
"476","0.392172","192.168.2.2","192.168.1.2","TCP","66","512","283648","5001  >  43962 [ACK] Seq=1 Ack=4158657 Win=283648 Len=0 TSval=3824096713 TSecr=3459206403"
"478","0.393803","192.168.2.2","192.168.1.2","TCP","66","512","283648","5001  >  43962 [ACK] Seq=1 Ack=4181825 Win=283648 Len=0 TSval=3824096715 TSecr=3459206405"
"481","0.395850","192.168.2.2","192.168.1.2","TCP","66","512","283648","5001  >  43962 [ACK] Seq=1 Ack=4199201 Win=283648 Len=0 TSval=3824096717 TSecr=3459206411"
"483","0.397730","192.168.2.2","192.168.1.2","TCP","66","512","283648","5001  >  43962 [ACK] Seq=1 Ack=4222369 Win=283648 Len=0 TSval=3824096719 TSecr=3459206411"
"485","0.399865","192.168.2.2","192.168.1.2","TCP","66","512","283648","5001  >  43962 [ACK] Seq=1 Ack=4245537 Win=283648 Len=0 TSval=3824096721 TSecr=3459206411"
"487","0.401653","192.168.2.2","192.168.1.2","TCP","66","512","283648","5001  >  43962 [ACK] Seq=1 Ack=4264361 Win=283648 Len=0 TSval=3824096723 TSecr=3459206415"
"488","0.403108","192.168.2.2","192.168.1.2","TCP","66","512","283648","5001  >  43962 [ACK] Seq=1 Ack=4286081 Win=283648 Len=0 TSval=3824096724 TSecr=3459206415"
"490","0.404944","192.168.2.2","192.168.1.2","TCP","66","512","283648","5001  >  43962 [ACK] Seq=1 Ack=4307801 Win=283648 Len=0 TSval=3824096726 TSecr=3459206417"
"492","0.406753","192.168.2.2","192.168.1.2","TCP","66","512","283648","5001  >  43962 [ACK] Seq=1 Ack=4329521 Win=283648 Len=0 TSval=3824096728 TSecr=3459206421"
"494","0.408570","192.168.2.2","192.168.1.2","TCP","66","512","283648","5001  >  43962 [ACK] Seq=1 Ack=4352689 Win=283648 Len=0 TSval=3824096730 TSecr=3459206421"
"496","0.410518","192.168.2.2","192.168.1.2","TCP","66","512","283648","5001  >  43962 [ACK] Seq=1 Ack=4375857 Win=283648 Len=0 TSval=3824096732 TSecr=3459206423"
"499","0.412797","192.168.2.2","192.168.1.2","TCP","66","512","283648","5001  >  43962 [ACK] Seq=1 Ack=4394681 Win=283648 Len=0 TSval=3824096734 TSecr=3459206426"
"501","0.414383","192.168.2.2","192.168.1.2","TCP","66","512","283648","5001  >  43962 [ACK] Seq=1 Ack=4417849 Win=283648 Len=0 TSval=3824096736 TSecr=3459206426"
"503","0.416394","192.168.2.2","192.168.1.2","TCP","66","512","283648","5001  >  43962 [ACK] Seq=1 Ack=4441017 Win=283648 Len=0 TSval=3824096738 TSecr=3459206428"
"505","0.418334","192.168.2.2","192.168.1.2","TCP","66","512","283648","5001  >  43962 [ACK] Seq=1 Ack=4459841 Win=283648 Len=0 TSval=3824096740 TSecr=3459206432"
