"No.","Time","Source","Destination","Protocol","Length","Calculated window size","Info"
"4","0.000336","192.168.2.2","192.168.1.2","TCP","74","43440","5001  >  44720 [SYN, ACK] Seq=0 Ack=1 Win=43440 Len=0 MSS=1460 SACK_PERM=1 TSval=2038960922 TSecr=1375220091 WS=512"
"7","0.000382","192.168.2.2","192.168.1.2","TCP","66","39936","5001  >  44720 [ACK] Seq=1 Ack=7241 Win=39936 Len=0 TSval=2038960922 TSecr=1375220091"
"12","0.049761","192.168.2.2","192.168.1.2","TCP","66","39936","5001  >  44720 [ACK] Seq=1 Ack=14481 Win=39936 Len=0 TSval=2038960971 TSecr=1375220091"
"15","0.110561","192.168.2.2","192.168.1.2","TCP","66","38400","5001  >  44720 [ACK] Seq=1 Ack=24617 Win=38400 Len=0 TSval=2038961032 TSecr=1375220091"
"25","0.195742","192.168.2.2","192.168.1.2","TCP","66","40960","5001  >  44720 [ACK] Seq=1 Ack=28961 Win=40960 Len=0 TSval=2038961117 TSecr=1375220091"
"28","0.232022","192.168.2.2","192.168.1.2","TCP","66","42496","5001  >  44720 [ACK] Seq=1 Ack=30409 Win=42496 Len=0 TSval=2038961153 TSecr=1375220105"
"31","0.243737","192.168.2.2","192.168.1.2","TCP","66","38912","5001  >  44720 [ACK] Seq=1 Ack=39097 Win=38912 Len=0 TSval=2038961165 TSecr=1375220140"
"34","0.316272","192.168.2.2","192.168.1.2","TCP","66","40960","5001  >  44720 [ACK] Seq=1 Ack=43441 Win=40960 Len=0 TSval=2038961238 TSecr=1375220165"
"38","0.352565","192.168.2.2","192.168.1.2","TCP","66","41984","5001  >  44720 [ACK] Seq=1 Ack=46337 Win=41984 Len=0 TSval=2038961274 TSecr=1375220201"
"40","0.377025","192.168.2.2","192.168.1.2","TCP","66","41984","5001  >  44720 [ACK] Seq=1 Ack=49233 Win=41984 Len=0 TSval=2038961298 TSecr=1375220201"
"42","0.401557","192.168.2.2","192.168.1.2","TCP","66","42496","5001  >  44720 [ACK] Seq=1 Ack=50681 Win=42496 Len=0 TSval=2038961323 TSecr=1375220201"
"44","0.413463","192.168.2.2","192.168.1.2","TCP","66","41984","5001  >  44720 [ACK] Seq=1 Ack=53577 Win=41984 Len=0 TSval=2038961335 TSecr=1375220201"
"46","0.437318","192.168.2.2","192.168.1.2","TCP","66","41984","5001  >  44720 [ACK] Seq=1 Ack=56473 Win=41984 Len=0 TSval=2038961359 TSecr=1375220201"
"49","0.462335","192.168.2.2","192.168.1.2","TCP","66","41984","5001  >  44720 [ACK] Seq=1 Ack=59369 Win=41984 Len=0 TSval=2038961384 TSecr=1375220202"
"51","0.485809","192.168.2.2","192.168.1.2","TCP","66","41984","5001  >  44720 [ACK] Seq=1 Ack=62265 Win=41984 Len=0 TSval=2038961407 TSecr=1375220203"
"53","0.510009","192.168.2.2","192.168.1.2","TCP","78","42496","[TCP Window Update] 5001  >  44720 [ACK] Seq=1 Ack=62265 Win=42496 Len=0 TSval=2038961431 TSecr=1375220253 SLE=60817 SRE=62265"
"56","0.522117","192.168.2.2","192.168.1.2","TCP","66","41984","5001  >  44720 [ACK] Seq=1 Ack=65161 Win=41984 Len=0 TSval=2038961443 TSecr=1375220286"
"58","0.546577","192.168.2.2","192.168.1.2","TCP","66","41984","5001  >  44720 [ACK] Seq=1 Ack=68057 Win=41984 Len=0 TSval=2038961468 TSecr=1375220286"
"60","0.571065","192.168.2.2","192.168.1.2","TCP","66","41984","5001  >  44720 [ACK] Seq=1 Ack=70953 Win=41984 Len=0 TSval=2038961492 TSecr=1375220322"
"62","0.595219","192.168.2.2","192.168.1.2","TCP","66","42496","5001  >  44720 [ACK] Seq=1 Ack=72401 Win=42496 Len=0 TSval=2038961516 TSecr=1375220322"
"64","0.606899","192.168.2.2","192.168.1.2","TCP","66","41984","5001  >  44720 [ACK] Seq=1 Ack=75297 Win=41984 Len=0 TSval=2038961528 TSecr=1375220334"
"66","0.631129","192.168.2.2","192.168.1.2","TCP","66","41984","5001  >  44720 [ACK] Seq=1 Ack=78193 Win=41984 Len=0 TSval=2038961552 TSecr=1375220407"
"68","0.655357","192.168.2.2","192.168.1.2","TCP","66","48128","5001  >  44720 [ACK] Seq=1 Ack=81089 Win=48128 Len=0 TSval=2038961577 TSecr=1375220407"
"72","0.679558","192.168.2.2","192.168.1.2","TCP","66","54272","5001  >  44720 [ACK] Seq=1 Ack=83985 Win=54272 Len=0 TSval=2038961601 TSecr=1375220407"
"77","0.704402","192.168.2.2","192.168.1.2","TCP","66","59904","5001  >  44720 [ACK] Seq=1 Ack=86881 Win=59904 Len=0 TSval=2038961626 TSecr=1375220443"
"81","0.728026","192.168.2.2","192.168.1.2","TCP","66","65536","5001  >  44720 [ACK] Seq=1 Ack=89777 Win=65536 Len=0 TSval=2038961649 TSecr=1375220467"
"86","0.752385","192.168.2.2","192.168.1.2","TCP","66","71680","5001  >  44720 [ACK] Seq=1 Ack=92673 Win=71680 Len=0 TSval=2038961674 TSecr=1375220492"
"91","0.776885","192.168.2.2","192.168.1.2","TCP","66","74240","5001  >  44720 [ACK] Seq=1 Ack=94121 Win=74240 Len=0 TSval=2038961698 TSecr=1375220504"
"94","0.788642","192.168.2.2","192.168.1.2","TCP","66","80384","5001  >  44720 [ACK] Seq=1 Ack=97017 Win=80384 Len=0 TSval=2038961710 TSecr=1375220528"
"98","0.813134","192.168.2.2","192.168.1.2","TCP","66","86016","5001  >  44720 [ACK] Seq=1 Ack=99913 Win=86016 Len=0 TSval=2038961734 TSecr=1375220553"
"101","0.837652","192.168.2.2","192.168.1.2","TCP","66","91648","5001  >  44720 [ACK] Seq=1 Ack=102809 Win=91648 Len=0 TSval=2038961759 TSecr=1375220576"
"103","0.861254","192.168.2.2","192.168.1.2","TCP","66","95744","5001  >  44720 [ACK] Seq=1 Ack=104761 Win=95744 Len=0 TSval=2038961782 TSecr=1375220600"
"105","0.878849","192.168.2.2","192.168.1.2","TCP","66","98304","5001  >  44720 [ACK] Seq=1 Ack=106209 Win=98304 Len=0 TSval=2038961800 TSecr=1375220612"
"107","0.890591","192.168.2.2","192.168.1.2","TCP","66","104448","5001  >  44720 [ACK] Seq=1 Ack=109105 Win=104448 Len=0 TSval=2038961812 TSecr=1375220637"
"109","0.914253","192.168.2.2","192.168.1.2","TCP","66","110080","5001  >  44720 [ACK] Seq=1 Ack=112001 Win=110080 Len=0 TSval=2038961835 TSecr=1375220661"
"111","0.938600","192.168.2.2","192.168.1.2","TCP","66","115712","5001  >  44720 [ACK] Seq=1 Ack=114897 Win=115712 Len=0 TSval=2038961860 TSecr=1375220685"
"113","0.962692","192.168.2.2","192.168.1.2","TCP","66","118784","5001  >  44720 [ACK] Seq=1 Ack=115841 Win=118784 Len=0 TSval=2038961884 TSecr=1375220697"
"115","0.970921","192.168.2.2","192.168.1.2","TCP","66","124416","5001  >  44720 [ACK] Seq=1 Ack=118737 Win=124416 Len=0 TSval=2038961892 TSecr=1375220721"
"117","0.995729","192.168.2.2","192.168.1.2","TCP","66","130560","5001  >  44720 [ACK] Seq=1 Ack=121633 Win=130560 Len=0 TSval=2038961917 TSecr=1375220746"
"119","1.019968","192.168.2.2","192.168.1.2","TCP","66","136192","5001  >  44720 [ACK] Seq=1 Ack=124529 Win=136192 Len=0 TSval=2038961941 TSecr=1375220746"
"122","1.044175","192.168.2.2","192.168.1.2","TCP","66","141824","5001  >  44720 [ACK] Seq=1 Ack=127425 Win=141824 Len=0 TSval=2038961965 TSecr=1375220746"
"125","1.068955","192.168.2.2","192.168.1.2","TCP","66","147968","5001  >  44720 [ACK] Seq=1 Ack=130321 Win=147968 Len=0 TSval=2038961990 TSecr=1375220770"
"127","1.093485","192.168.2.2","192.168.1.2","TCP","66","153600","5001  >  44720 [ACK] Seq=1 Ack=133217 Win=153600 Len=0 TSval=2038962014 TSecr=1375220770"
"129","1.116973","192.168.2.2","192.168.1.2","TCP","66","159232","5001  >  44720 [ACK] Seq=1 Ack=136113 Win=159232 Len=0 TSval=2038962038 TSecr=1375220770"
"131","1.141139","192.168.2.2","192.168.1.2","TCP","66","162304","5001  >  44720 [ACK] Seq=1 Ack=137561 Win=162304 Len=0 TSval=2038962062 TSecr=1375220770"
"133","1.153206","192.168.2.2","192.168.1.2","TCP","66","167936","5001  >  44720 [ACK] Seq=1 Ack=140457 Win=167936 Len=0 TSval=2038962074 TSecr=1375220795"
"135","1.177410","192.168.2.2","192.168.1.2","TCP","66","173568","5001  >  44720 [ACK] Seq=1 Ack=143353 Win=173568 Len=0 TSval=2038962098 TSecr=1375220795"
"139","1.202244","192.168.2.2","192.168.1.2","TCP","66","179712","5001  >  44720 [ACK] Seq=1 Ack=146249 Win=179712 Len=0 TSval=2038962123 TSecr=1375220795"
"141","1.226544","192.168.2.2","192.168.1.2","TCP","66","185344","5001  >  44720 [ACK] Seq=1 Ack=149145 Win=185344 Len=0 TSval=2038962147 TSecr=1375220818"
"143","1.250769","192.168.2.2","192.168.1.2","TCP","66","187904","5001  >  44720 [ACK] Seq=1 Ack=152041 Win=187904 Len=0 TSval=2038962172 TSecr=1375220818"
"145","1.275754","192.168.2.2","192.168.1.2","TCP","66","187904","5001  >  44720 [ACK] Seq=1 Ack=154937 Win=187904 Len=0 TSval=2038962197 TSecr=1375220818"
"147","1.299234","192.168.2.2","192.168.1.2","TCP","66","187904","5001  >  44720 [ACK] Seq=1 Ack=157833 Win=187904 Len=0 TSval=2038962220 TSecr=1375220843"
"149","1.323445","192.168.2.2","192.168.1.2","TCP","66","188928","5001  >  44720 [ACK] Seq=1 Ack=159281 Win=188928 Len=0 TSval=2038962244 TSecr=1375220843"
"151","1.335595","192.168.2.2","192.168.1.2","TCP","66","187904","5001  >  44720 [ACK] Seq=1 Ack=162177 Win=187904 Len=0 TSval=2038962256 TSecr=1375220843"
"153","1.359780","192.168.2.2","192.168.1.2","TCP","66","187904","5001  >  44720 [ACK] Seq=1 Ack=165073 Win=187904 Len=0 TSval=2038962281 TSecr=1375220867"
"155","1.384537","192.168.2.2","192.168.1.2","TCP","66","187904","5001  >  44720 [ACK] Seq=1 Ack=167969 Win=187904 Len=0 TSval=2038962305 TSecr=1375220867"
"157","1.408251","192.168.2.2","192.168.1.2","TCP","66","187904","5001  >  44720 [ACK] Seq=1 Ack=170865 Win=187904 Len=0 TSval=2038962329 TSecr=1375220879"
"159","1.432555","192.168.2.2","192.168.1.2","TCP","66","187904","5001  >  44720 [ACK] Seq=1 Ack=173761 Win=187904 Len=0 TSval=2038962353 TSecr=1375220879"
"162","1.456671","192.168.2.2","192.168.1.2","TCP","66","187904","5001  >  44720 [ACK] Seq=1 Ack=176657 Win=187904 Len=0 TSval=2038962377 TSecr=1375220879"
"164","1.481583","192.168.2.2","192.168.1.2","TCP","66","187904","5001  >  44720 [ACK] Seq=1 Ack=179553 Win=187904 Len=0 TSval=2038962402 TSecr=1375220903"
"166","1.517783","192.168.2.2","192.168.1.2","TCP","66","187904","5001  >  44720 [ACK] Seq=1 Ack=183897 Win=187904 Len=0 TSval=2038962439 TSecr=1375220903"
"168","1.541451","192.168.2.2","192.168.1.2","TCP","66","187904","5001  >  44720 [ACK] Seq=1 Ack=186793 Win=187904 Len=0 TSval=2038962462 TSecr=1375220951"
"171","1.577803","192.168.2.2","192.168.1.2","TCP","66","187904","5001  >  44720 [ACK] Seq=1 Ack=191137 Win=187904 Len=0 TSval=2038962499 TSecr=1375220969"
"173","1.602129","192.168.2.2","192.168.1.2","TCP","66","187904","5001  >  44720 [ACK] Seq=1 Ack=194033 Win=187904 Len=0 TSval=2038962523 TSecr=1375221004"
"175","1.626596","192.168.2.2","192.168.1.2","TCP","66","187904","5001  >  44720 [ACK] Seq=1 Ack=196929 Win=187904 Len=0 TSval=2038962547 TSecr=1375221029"
"177","1.662869","192.168.2.2","192.168.1.2","TCP","66","194560","5001  >  44720 [ACK] Seq=1 Ack=201273 Win=194560 Len=0 TSval=2038962584 TSecr=1375221053"
"180","1.686791","192.168.2.2","192.168.1.2","TCP","66","197632","5001  >  44720 [ACK] Seq=1 Ack=202721 Win=197632 Len=0 TSval=2038962607 TSecr=1375221086"
"182","1.699095","192.168.2.2","192.168.1.2","TCP","66","203264","5001  >  44720 [ACK] Seq=1 Ack=205617 Win=203264 Len=0 TSval=2038962620 TSecr=1375221110"
"185","1.723902","192.168.2.2","192.168.1.2","TCP","66","208896","5001  >  44720 [ACK] Seq=1 Ack=208513 Win=208896 Len=0 TSval=2038962645 TSecr=1375221134"
"187","1.748176","192.168.2.2","192.168.1.2","TCP","66","215040","5001  >  44720 [ACK] Seq=1 Ack=211409 Win=215040 Len=0 TSval=2038962669 TSecr=1375221134"
"189","1.772620","192.168.2.2","192.168.1.2","TCP","66","220672","5001  >  44720 [ACK] Seq=1 Ack=214305 Win=220672 Len=0 TSval=2038962693 TSecr=1375221159"
"193","1.797117","192.168.2.2","192.168.1.2","TCP","66","226304","5001  >  44720 [ACK] Seq=1 Ack=217201 Win=226304 Len=0 TSval=2038962718 TSecr=1375221184"
"195","1.820809","192.168.2.2","192.168.1.2","TCP","66","232448","5001  >  44720 [ACK] Seq=1 Ack=220097 Win=232448 Len=0 TSval=2038962741 TSecr=1375221207"
"197","1.845123","192.168.2.2","192.168.1.2","TCP","66","235008","5001  >  44720 [ACK] Seq=1 Ack=221545 Win=235008 Len=0 TSval=2038962766 TSecr=1375221231"
"199","1.857151","192.168.2.2","192.168.1.2","TCP","66","241152","5001  >  44720 [ACK] Seq=1 Ack=224441 Win=241152 Len=0 TSval=2038962778 TSecr=1375221243"
"201","1.881417","192.168.2.2","192.168.1.2","TCP","66","246784","5001  >  44720 [ACK] Seq=1 Ack=227337 Win=246784 Len=0 TSval=2038962802 TSecr=1375221267"
"203","1.905614","192.168.2.2","192.168.1.2","TCP","66","252416","5001  >  44720 [ACK] Seq=1 Ack=230233 Win=252416 Len=0 TSval=2038962826 TSecr=1375221292"
"206","1.930416","192.168.2.2","192.168.1.2","TCP","66","258560","5001  >  44720 [ACK] Seq=1 Ack=233129 Win=258560 Len=0 TSval=2038962851 TSecr=1375221316"
"208","1.954072","192.168.2.2","192.168.1.2","TCP","66","264192","5001  >  44720 [ACK] Seq=1 Ack=236025 Win=264192 Len=0 TSval=2038962875 TSecr=1375221341"
"211","1.978457","192.168.2.2","192.168.1.2","TCP","66","269824","5001  >  44720 [ACK] Seq=1 Ack=238921 Win=269824 Len=0 TSval=2038962899 TSecr=1375221366"
"213","2.002939","192.168.2.2","192.168.1.2","TCP","66","275968","5001  >  44720 [ACK] Seq=1 Ack=241817 Win=275968 Len=0 TSval=2038962923 TSecr=1375221389"
"215","2.026725","192.168.2.2","192.168.1.2","TCP","66","281600","5001  >  44720 [ACK] Seq=1 Ack=244713 Win=281600 Len=0 TSval=2038962947 TSecr=1375221413"
"218","2.050930","192.168.2.2","192.168.1.2","TCP","66","284160","5001  >  44720 [ACK] Seq=1 Ack=246161 Win=284160 Len=0 TSval=2038962971 TSecr=1375221425"
"220","2.063057","192.168.2.2","192.168.1.2","TCP","66","290304","5001  >  44720 [ACK] Seq=1 Ack=249057 Win=290304 Len=0 TSval=2038962984 TSecr=1375221450"
"222","2.088197","192.168.2.2","192.168.1.2","TCP","66","295936","5001  >  44720 [ACK] Seq=1 Ack=251953 Win=295936 Len=0 TSval=2038963009 TSecr=1375221474"
"224","2.111800","192.168.2.2","192.168.1.2","TCP","66","301568","5001  >  44720 [ACK] Seq=1 Ack=254849 Win=301568 Len=0 TSval=2038963032 TSecr=1375221498"
"226","2.136198","192.168.2.2","192.168.1.2","TCP","66","307712","5001  >  44720 [ACK] Seq=1 Ack=257745 Win=307712 Len=0 TSval=2038963057 TSecr=1375221522"
"228","2.159950","192.168.2.2","192.168.1.2","TCP","66","310272","5001  >  44720 [ACK] Seq=1 Ack=259193 Win=310272 Len=0 TSval=2038963080 TSecr=1375221532"
"230","2.172489","192.168.2.2","192.168.1.2","TCP","66","316416","5001  >  44720 [ACK] Seq=1 Ack=262089 Win=316416 Len=0 TSval=2038963093 TSecr=1375221547"
"232","2.196293","192.168.2.2","192.168.1.2","TCP","66","322048","5001  >  44720 [ACK] Seq=1 Ack=264985 Win=322048 Len=0 TSval=2038963117 TSecr=1375221571"
"234","2.220541","192.168.2.2","192.168.1.2","TCP","66","327680","5001  >  44720 [ACK] Seq=1 Ack=267881 Win=327680 Len=0 TSval=2038963141 TSecr=1375221608"
"236","2.244741","192.168.2.2","192.168.1.2","TCP","66","333824","5001  >  44720 [ACK] Seq=1 Ack=270777 Win=333824 Len=0 TSval=2038963165 TSecr=1375221631"
"238","2.269534","192.168.2.2","192.168.1.2","TCP","66","339456","5001  >  44720 [ACK] Seq=1 Ack=273673 Win=339456 Len=0 TSval=2038963190 TSecr=1375221631"
"240","2.293205","192.168.2.2","192.168.1.2","TCP","66","345088","5001  >  44720 [ACK] Seq=1 Ack=276569 Win=345088 Len=0 TSval=2038963214 TSecr=1375221668"
"242","2.317527","192.168.2.2","192.168.1.2","TCP","66","351232","5001  >  44720 [ACK] Seq=1 Ack=279465 Win=351232 Len=0 TSval=2038963238 TSecr=1375221692"
"244","2.341638","192.168.2.2","192.168.1.2","TCP","66","356864","5001  >  44720 [ACK] Seq=1 Ack=282361 Win=356864 Len=0 TSval=2038963262 TSecr=1375221716"
"246","2.365856","192.168.2.2","192.168.1.2","TCP","66","360448","5001  >  44720 [ACK] Seq=1 Ack=285257 Win=360448 Len=0 TSval=2038963286 TSecr=1375221753"
"249","2.390073","192.168.2.2","192.168.1.2","TCP","66","360448","5001  >  44720 [ACK] Seq=1 Ack=288153 Win=360448 Len=0 TSval=2038963310 TSecr=1375221753"
"251","2.414557","192.168.2.2","192.168.1.2","TCP","66","360960","5001  >  44720 [ACK] Seq=1 Ack=289601 Win=360960 Len=0 TSval=2038963335 TSecr=1375221777"
"253","2.426478","192.168.2.2","192.168.1.2","TCP","66","360960","5001  >  44720 [ACK] Seq=1 Ack=292497 Win=360960 Len=0 TSval=2038963347 TSecr=1375221789"
"255","2.450831","192.168.2.2","192.168.1.2","TCP","66","360960","5001  >  44720 [ACK] Seq=1 Ack=295393 Win=360960 Len=0 TSval=2038963371 TSecr=1375221814"
"257","2.476165","192.168.2.2","192.168.1.2","TCP","66","360960","5001  >  44720 [ACK] Seq=1 Ack=298289 Win=360960 Len=0 TSval=2038963396 TSecr=1375221838"
"260","2.500796","192.168.2.2","192.168.1.2","TCP","66","360960","5001  >  44720 [ACK] Seq=1 Ack=301185 Win=360960 Len=0 TSval=2038963421 TSecr=1375221862"
"262","2.524624","192.168.2.2","192.168.1.2","TCP","66","360960","5001  >  44720 [ACK] Seq=1 Ack=304081 Win=360960 Len=0 TSval=2038963445 TSecr=1375221887"
"264","2.548852","192.168.2.2","192.168.1.2","TCP","66","360960","5001  >  44720 [ACK] Seq=1 Ack=306977 Win=360960 Len=0 TSval=2038963469 TSecr=1375221910"
"266","2.573390","192.168.2.2","192.168.1.2","TCP","66","360960","5001  >  44720 [ACK] Seq=1 Ack=309873 Win=360960 Len=0 TSval=2038963494 TSecr=1375221935"
"268","2.609405","192.168.2.2","192.168.1.2","TCP","66","360960","5001  >  44720 [ACK] Seq=1 Ack=314217 Win=360960 Len=0 TSval=2038963530 TSecr=1375221947"
"271","2.634148","192.168.2.2","192.168.1.2","TCP","66","360960","5001  >  44720 [ACK] Seq=1 Ack=317113 Win=360960 Len=0 TSval=2038963554 TSecr=1375221995"
"273","2.657838","192.168.2.2","192.168.1.2","TCP","66","360960","5001  >  44720 [ACK] Seq=1 Ack=320009 Win=360960 Len=0 TSval=2038963578 TSecr=1375222020"
"275","2.682121","192.168.2.2","192.168.1.2","TCP","66","360960","5001  >  44720 [ACK] Seq=1 Ack=322905 Win=360960 Len=0 TSval=2038963602 TSecr=1375222044"
"277","2.718417","192.168.2.2","192.168.1.2","TCP","66","360960","5001  >  44720 [ACK] Seq=1 Ack=327249 Win=360960 Len=0 TSval=2038963639 TSecr=1375222044"
"280","2.742941","192.168.2.2","192.168.1.2","TCP","66","360960","5001  >  44720 [ACK] Seq=1 Ack=330145 Win=360960 Len=0 TSval=2038963663 TSecr=1375222093"
"282","2.767433","192.168.2.2","192.168.1.2","TCP","66","360960","5001  >  44720 [ACK] Seq=1 Ack=333041 Win=360960 Len=0 TSval=2038963688 TSecr=1375222116"
"285","2.791844","192.168.2.2","192.168.1.2","TCP","66","360960","5001  >  44720 [ACK] Seq=1 Ack=335937 Win=360960 Len=0 TSval=2038963712 TSecr=1375222140"
"287","2.816391","192.168.2.2","192.168.1.2","TCP","66","360960","5001  >  44720 [ACK] Seq=1 Ack=338833 Win=360960 Len=0 TSval=2038963737 TSecr=1375222153"
"289","2.840315","192.168.2.2","192.168.1.2","TCP","66","360960","5001  >  44720 [ACK] Seq=1 Ack=341729 Win=360960 Len=0 TSval=2038963760 TSecr=1375222178"
"291","2.864654","192.168.2.2","192.168.1.2","TCP","66","360960","5001  >  44720 [ACK] Seq=1 Ack=344625 Win=360960 Len=0 TSval=2038963785 TSecr=1375222201"
"293","2.888907","192.168.2.2","192.168.1.2","TCP","66","360960","5001  >  44720 [ACK] Seq=1 Ack=347521 Win=360960 Len=0 TSval=2038963809 TSecr=1375222226"
"295","2.925198","192.168.2.2","192.168.1.2","TCP","66","360960","5001  >  44720 [ACK] Seq=1 Ack=351865 Win=360960 Len=0 TSval=2038963845 TSecr=1375222249"
"298","2.949676","192.168.2.2","192.168.1.2","TCP","66","360960","5001  >  44720 [ACK] Seq=1 Ack=354761 Win=360960 Len=0 TSval=2038963870 TSecr=1375222286"
"300","2.973545","192.168.2.2","192.168.1.2","TCP","66","360960","5001  >  44720 [ACK] Seq=1 Ack=357657 Win=360960 Len=0 TSval=2038963894 TSecr=1375222310"
"302","2.998679","192.168.2.2","192.168.1.2","TCP","66","360960","5001  >  44720 [ACK] Seq=1 Ack=360553 Win=360960 Len=0 TSval=2038963919 TSecr=1375222334"
"304","3.022173","192.168.2.2","192.168.1.2","TCP","66","360960","5001  >  44720 [ACK] Seq=1 Ack=363449 Win=360960 Len=0 TSval=2038963942 TSecr=1375222359"
"307","3.046211","192.168.2.2","192.168.1.2","TCP","66","360960","5001  >  44720 [ACK] Seq=1 Ack=366345 Win=360960 Len=0 TSval=2038963966 TSecr=1375222383"
"309","3.071210","192.168.2.2","192.168.1.2","TCP","66","360960","5001  >  44720 [ACK] Seq=1 Ack=369241 Win=360960 Len=0 TSval=2038963991 TSecr=1375222407"
"311","3.094665","192.168.2.2","192.168.1.2","TCP","66","360960","5001  >  44720 [ACK] Seq=1 Ack=372137 Win=360960 Len=0 TSval=2038964015 TSecr=1375222431"
"313","3.118880","192.168.2.2","192.168.1.2","TCP","66","360960","5001  >  44720 [ACK] Seq=1 Ack=375033 Win=360960 Len=0 TSval=2038964039 TSecr=1375222455"
"315","3.155214","192.168.2.2","192.168.1.2","TCP","66","360960","5001  >  44720 [ACK] Seq=1 Ack=379377 Win=360960 Len=0 TSval=2038964075 TSecr=1375222455"
"318","3.191745","192.168.2.2","192.168.1.2","TCP","66","360960","5001  >  44720 [ACK] Seq=1 Ack=383721 Win=360960 Len=0 TSval=2038964112 TSecr=1375222504"
"320","3.216321","192.168.2.2","192.168.1.2","TCP","66","360960","5001  >  44720 [ACK] Seq=1 Ack=386617 Win=360960 Len=0 TSval=2038964136 TSecr=1375222540"
"322","3.240013","192.168.2.2","192.168.1.2","TCP","66","360960","5001  >  44720 [ACK] Seq=1 Ack=389513 Win=360960 Len=0 TSval=2038964160 TSecr=1375222566"
"325","3.264291","192.168.2.2","192.168.1.2","TCP","66","360960","5001  >  44720 [ACK] Seq=1 Ack=392409 Win=360960 Len=0 TSval=2038964184 TSecr=1375222590"
"327","3.288537","192.168.2.2","192.168.1.2","TCP","66","360960","5001  >  44720 [ACK] Seq=1 Ack=395305 Win=360960 Len=0 TSval=2038964208 TSecr=1375222614"
"329","3.313333","192.168.2.2","192.168.1.2","TCP","66","360960","5001  >  44720 [ACK] Seq=1 Ack=398201 Win=360960 Len=0 TSval=2038964233 TSecr=1375222638"
"331","3.337629","192.168.2.2","192.168.1.2","TCP","66","360960","5001  >  44720 [ACK] Seq=1 Ack=401097 Win=360960 Len=0 TSval=2038964257 TSecr=1375222663"
"333","3.362303","192.168.2.2","192.168.1.2","TCP","66","360960","5001  >  44720 [ACK] Seq=1 Ack=403993 Win=360960 Len=0 TSval=2038964282 TSecr=1375222699"
"335","3.386788","192.168.2.2","192.168.1.2","TCP","66","360960","5001  >  44720 [ACK] Seq=1 Ack=406889 Win=360960 Len=0 TSval=2038964307 TSecr=1375222699"
"337","3.410319","192.168.2.2","192.168.1.2","TCP","66","360960","5001  >  44720 [ACK] Seq=1 Ack=409785 Win=360960 Len=0 TSval=2038964330 TSecr=1375222723"
"339","3.434781","192.168.2.2","192.168.1.2","TCP","66","360960","5001  >  44720 [ACK] Seq=1 Ack=412681 Win=360960 Len=0 TSval=2038964355 TSecr=1375222747"
"341","3.458744","192.168.2.2","192.168.1.2","TCP","66","360960","5001  >  44720 [ACK] Seq=1 Ack=415577 Win=360960 Len=0 TSval=2038964379 TSecr=1375222771"
"343","3.483873","192.168.2.2","192.168.1.2","TCP","66","360960","5001  >  44720 [ACK] Seq=1 Ack=418473 Win=360960 Len=0 TSval=2038964404 TSecr=1375222808"
"346","3.519286","192.168.2.2","192.168.1.2","TCP","66","360960","5001  >  44720 [ACK] Seq=1 Ack=422817 Win=360960 Len=0 TSval=2038964439 TSecr=1375222808"
"348","3.543528","192.168.2.2","192.168.1.2","TCP","66","360960","5001  >  44720 [ACK] Seq=1 Ack=425713 Win=360960 Len=0 TSval=2038964463 TSecr=1375222857"
"350","3.568084","192.168.2.2","192.168.1.2","TCP","66","360960","5001  >  44720 [ACK] Seq=1 Ack=428609 Win=360960 Len=0 TSval=2038964488 TSecr=1375222881"
"352","3.592617","192.168.2.2","192.168.1.2","TCP","66","360960","5001  >  44720 [ACK] Seq=1 Ack=431505 Win=360960 Len=0 TSval=2038964512 TSecr=1375222906"
"355","3.616180","192.168.2.2","192.168.1.2","TCP","66","360960","5001  >  44720 [ACK] Seq=1 Ack=434401 Win=360960 Len=0 TSval=2038964536 TSecr=1375222929"
"357","3.640615","192.168.2.2","192.168.1.2","TCP","66","360960","5001  >  44720 [ACK] Seq=1 Ack=437297 Win=360960 Len=0 TSval=2038964560 TSecr=1375222954"
"359","3.665100","192.168.2.2","192.168.1.2","TCP","66","360960","5001  >  44720 [ACK] Seq=1 Ack=440193 Win=360960 Len=0 TSval=2038964585 TSecr=1375222978"
"361","3.688869","192.168.2.2","192.168.1.2","TCP","66","360960","5001  >  44720 [ACK] Seq=1 Ack=443089 Win=360960 Len=0 TSval=2038964609 TSecr=1375223014"
"363","3.713136","192.168.2.2","192.168.1.2","TCP","66","360960","5001  >  44720 [ACK] Seq=1 Ack=445985 Win=360960 Len=0 TSval=2038964633 TSecr=1375223014"
"365","3.737322","192.168.2.2","192.168.1.2","TCP","66","360960","5001  >  44720 [ACK] Seq=1 Ack=448881 Win=360960 Len=0 TSval=2038964657 TSecr=1375223039"
"367","3.762150","192.168.2.2","192.168.1.2","TCP","66","360960","5001  >  44720 [ACK] Seq=1 Ack=451777 Win=360960 Len=0 TSval=2038964682 TSecr=1375223063"
"369","3.785782","192.168.2.2","192.168.1.2","TCP","66","360960","5001  >  44720 [ACK] Seq=1 Ack=454673 Win=360960 Len=0 TSval=2038964705 TSecr=1375223088"
"371","3.810163","192.168.2.2","192.168.1.2","TCP","66","360960","5001  >  44720 [ACK] Seq=1 Ack=457569 Win=360960 Len=0 TSval=2038964730 TSecr=1375223111"
"374","3.834974","192.168.2.2","192.168.1.2","TCP","66","360960","5001  >  44720 [ACK] Seq=1 Ack=460465 Win=360960 Len=0 TSval=2038964755 TSecr=1375223135"
"376","3.859227","192.168.2.2","192.168.1.2","TCP","66","360960","5001  >  44720 [ACK] Seq=1 Ack=463361 Win=360960 Len=0 TSval=2038964779 TSecr=1375223160"
"378","3.883687","192.168.2.2","192.168.1.2","TCP","66","360960","5001  >  44720 [ACK] Seq=1 Ack=466257 Win=360960 Len=0 TSval=2038964803 TSecr=1375223184"
"380","3.908164","192.168.2.2","192.168.1.2","TCP","66","360960","5001  >  44720 [ACK] Seq=1 Ack=469153 Win=360960 Len=0 TSval=2038964828 TSecr=1375223208"
"382","3.931896","192.168.2.2","192.168.1.2","TCP","66","360960","5001  >  44720 [ACK] Seq=1 Ack=472049 Win=360960 Len=0 TSval=2038964851 TSecr=1375223244"
"384","3.956195","192.168.2.2","192.168.1.2","TCP","66","360960","5001  >  44720 [ACK] Seq=1 Ack=474945 Win=360960 Len=0 TSval=2038964876 TSecr=1375223244"
"387","3.980330","192.168.2.2","192.168.1.2","TCP","66","360960","5001  >  44720 [ACK] Seq=1 Ack=477841 Win=360960 Len=0 TSval=2038964900 TSecr=1375223281"
"389","4.004557","192.168.2.2","192.168.1.2","TCP","66","360960","5001  >  44720 [ACK] Seq=1 Ack=480737 Win=360960 Len=0 TSval=2038964924 TSecr=1375223305"
"392","4.028772","192.168.2.2","192.168.1.2","TCP","66","360960","5001  >  44720 [ACK] Seq=1 Ack=483633 Win=360960 Len=0 TSval=2038964948 TSecr=1375223329"
"394","4.053013","192.168.2.2","192.168.1.2","TCP","66","360960","5001  >  44720 [ACK] Seq=1 Ack=486529 Win=360960 Len=0 TSval=2038964973 TSecr=1375223329"
"396","4.077734","192.168.2.2","192.168.1.2","TCP","66","360960","5001  >  44720 [ACK] Seq=1 Ack=489425 Win=360960 Len=0 TSval=2038964997 TSecr=1375223353"
"398","4.101450","192.168.2.2","192.168.1.2","TCP","66","360960","5001  >  44720 [ACK] Seq=1 Ack=492321 Win=360960 Len=0 TSval=2038965021 TSecr=1375223377"
"400","4.125709","192.168.2.2","192.168.1.2","TCP","66","360960","5001  >  44720 [ACK] Seq=1 Ack=495217 Win=360960 Len=0 TSval=2038965045 TSecr=1375223402"
"402","4.150227","192.168.2.2","192.168.1.2","TCP","66","360960","5001  >  44720 [ACK] Seq=1 Ack=498113 Win=360960 Len=0 TSval=2038965070 TSecr=1375223427"
"404","4.174732","192.168.2.2","192.168.1.2","TCP","66","360960","5001  >  44720 [ACK] Seq=1 Ack=501009 Win=360960 Len=0 TSval=2038965094 TSecr=1375223451"
"406","4.198365","192.168.2.2","192.168.1.2","TCP","66","360960","5001  >  44720 [ACK] Seq=1 Ack=503905 Win=360960 Len=0 TSval=2038965118 TSecr=1375223476"
"409","4.222733","192.168.2.2","192.168.1.2","TCP","66","360960","5001  >  44720 [ACK] Seq=1 Ack=506801 Win=360960 Len=0 TSval=2038965142 TSecr=1375223499"
"411","4.246810","192.168.2.2","192.168.1.2","TCP","66","360960","5001  >  44720 [ACK] Seq=1 Ack=509697 Win=360960 Len=0 TSval=2038965166 TSecr=1375223524"
"413","4.271027","192.168.2.2","192.168.1.2","TCP","66","360960","5001  >  44720 [ACK] Seq=1 Ack=512593 Win=360960 Len=0 TSval=2038965190 TSecr=1375223548"
"415","4.295263","192.168.2.2","192.168.1.2","TCP","66","360960","5001  >  44720 [ACK] Seq=1 Ack=515489 Win=360960 Len=0 TSval=2038965215 TSecr=1375223573"
"417","4.331606","192.168.2.2","192.168.1.2","TCP","66","360960","5001  >  44720 [ACK] Seq=1 Ack=519833 Win=360960 Len=0 TSval=2038965251 TSecr=1375223579"
"419","4.356067","192.168.2.2","192.168.1.2","TCP","66","360960","5001  >  44720 [ACK] Seq=1 Ack=522729 Win=360960 Len=0 TSval=2038965275 TSecr=1375223632"
"421","4.380034","192.168.2.2","192.168.1.2","TCP","66","360960","5001  >  44720 [ACK] Seq=1 Ack=525625 Win=360960 Len=0 TSval=2038965299 TSecr=1375223657"
"423","4.404258","192.168.2.2","192.168.1.2","TCP","66","360960","5001  >  44720 [ACK] Seq=1 Ack=528521 Win=360960 Len=0 TSval=2038965324 TSecr=1375223681"
"425","4.441282","192.168.2.2","192.168.1.2","TCP","66","360960","5001  >  44720 [ACK] Seq=1 Ack=532865 Win=360960 Len=0 TSval=2038965361 TSecr=1375223681"
"428","4.464811","192.168.2.2","192.168.1.2","TCP","66","360960","5001  >  44720 [ACK] Seq=1 Ack=535761 Win=360960 Len=0 TSval=2038965384 TSecr=1375223729"
"430","4.489390","192.168.2.2","192.168.1.2","TCP","66","360960","5001  >  44720 [ACK] Seq=1 Ack=538657 Win=360960 Len=0 TSval=2038965409 TSecr=1375223754"
"432","4.513831","192.168.2.2","192.168.1.2","TCP","66","360960","5001  >  44720 [ACK] Seq=1 Ack=541553 Win=360960 Len=0 TSval=2038965433 TSecr=1375223778"
"435","4.537494","192.168.2.2","192.168.1.2","TCP","66","360960","5001  >  44720 [ACK] Seq=1 Ack=544449 Win=360960 Len=0 TSval=2038965457 TSecr=1375223802"
"437","4.561849","192.168.2.2","192.168.1.2","TCP","66","360960","5001  >  44720 [ACK] Seq=1 Ack=547345 Win=360960 Len=0 TSval=2038965481 TSecr=1375223826"
"439","4.586398","192.168.2.2","192.168.1.2","TCP","66","360960","5001  >  44720 [ACK] Seq=1 Ack=550241 Win=360960 Len=0 TSval=2038965506 TSecr=1375223851"
"441","4.610161","192.168.2.2","192.168.1.2","TCP","66","360960","5001  >  44720 [ACK] Seq=1 Ack=553137 Win=360960 Len=0 TSval=2038965529 TSecr=1375223874"
"443","4.634403","192.168.2.2","192.168.1.2","TCP","66","360960","5001  >  44720 [ACK] Seq=1 Ack=556033 Win=360960 Len=0 TSval=2038965554 TSecr=1375223899"
"445","4.658897","192.168.2.2","192.168.1.2","TCP","66","360960","5001  >  44720 [ACK] Seq=1 Ack=558929 Win=360960 Len=0 TSval=2038965578 TSecr=1375223924"
"447","4.682847","192.168.2.2","192.168.1.2","TCP","66","360960","5001  >  44720 [ACK] Seq=1 Ack=561825 Win=360960 Len=0 TSval=2038965602 TSecr=1375223948"
"449","4.707072","192.168.2.2","192.168.1.2","TCP","66","360960","5001  >  44720 [ACK] Seq=1 Ack=564721 Win=360960 Len=0 TSval=2038965626 TSecr=1375223972"
"452","4.731369","192.168.2.2","192.168.1.2","TCP","66","360960","5001  >  44720 [ACK] Seq=1 Ack=567617 Win=360960 Len=0 TSval=2038965651 TSecr=1375223997"
"454","4.755913","192.168.2.2","192.168.1.2","TCP","66","360960","5001  >  44720 [ACK] Seq=1 Ack=570513 Win=360960 Len=0 TSval=2038965675 TSecr=1375224020"
"456","4.779784","192.168.2.2","192.168.1.2","TCP","66","360960","5001  >  44720 [ACK] Seq=1 Ack=573409 Win=360960 Len=0 TSval=2038965699 TSecr=1375224045"
"458","4.803968","192.168.2.2","192.168.1.2","TCP","66","360960","5001  >  44720 [ACK] Seq=1 Ack=576305 Win=360960 Len=0 TSval=2038965723 TSecr=1375224045"
"460","4.828413","192.168.2.2","192.168.1.2","TCP","66","360960","5001  >  44720 [ACK] Seq=1 Ack=579201 Win=360960 Len=0 TSval=2038965748 TSecr=1375224069"
"462","4.852983","192.168.2.2","192.168.1.2","TCP","66","360960","5001  >  44720 [ACK] Seq=1 Ack=582097 Win=360960 Len=0 TSval=2038965772 TSecr=1375224093"
"465","4.877406","192.168.2.2","192.168.1.2","TCP","66","360960","5001  >  44720 [ACK] Seq=1 Ack=584993 Win=360960 Len=0 TSval=2038965797 TSecr=1375224117"
"467","4.901929","192.168.2.2","192.168.1.2","TCP","66","360960","5001  >  44720 [ACK] Seq=1 Ack=587889 Win=360960 Len=0 TSval=2038965821 TSecr=1375224142"
"469","4.925930","192.168.2.2","192.168.1.2","TCP","66","360960","5001  >  44720 [ACK] Seq=1 Ack=590785 Win=360960 Len=0 TSval=2038965845 TSecr=1375224166"
"472","4.950100","192.168.2.2","192.168.1.2","TCP","66","360960","5001  >  44720 [ACK] Seq=1 Ack=593681 Win=360960 Len=0 TSval=2038965869 TSecr=1375224190"
"474","4.986416","192.168.2.2","192.168.1.2","TCP","66","360960","5001  >  44720 [ACK] Seq=1 Ack=598025 Win=360960 Len=0 TSval=2038965905 TSecr=1375224214"
"476","5.010752","192.168.2.2","192.168.1.2","TCP","66","360960","5001  >  44720 [ACK] Seq=1 Ack=600921 Win=360960 Len=0 TSval=2038965930 TSecr=1375224263"
"480","5.035181","192.168.2.2","192.168.1.2","TCP","66","360960","5001  >  44720 [ACK] Seq=1 Ack=603817 Win=360960 Len=0 TSval=2038965954 TSecr=1375224287"
"484","5.059080","192.168.2.2","192.168.1.2","TCP","66","360960","5001  >  44720 [ACK] Seq=1 Ack=606713 Win=360960 Len=0 TSval=2038965978 TSecr=1375224287"
"486","5.083303","192.168.2.2","192.168.1.2","TCP","66","360960","5001  >  44720 [ACK] Seq=1 Ack=609609 Win=360960 Len=0 TSval=2038966002 TSecr=1375224311"
"488","5.107531","192.168.2.2","192.168.1.2","TCP","66","360960","5001  >  44720 [ACK] Seq=1 Ack=612505 Win=360960 Len=0 TSval=2038966027 TSecr=1375224335"
"491","5.132211","192.168.2.2","192.168.1.2","TCP","66","360960","5001  >  44720 [ACK] Seq=1 Ack=615401 Win=360960 Len=0 TSval=2038966051 TSecr=1375224359"
"493","5.155984","192.168.2.2","192.168.1.2","TCP","66","360960","5001  >  44720 [ACK] Seq=1 Ack=618297 Win=360960 Len=0 TSval=2038966075 TSecr=1375224384"
"495","5.180237","192.168.2.2","192.168.1.2","TCP","66","360960","5001  >  44720 [ACK] Seq=1 Ack=621193 Win=360960 Len=0 TSval=2038966099 TSecr=1375224420"
"497","5.204774","192.168.2.2","192.168.1.2","TCP","66","360960","5001  >  44720 [ACK] Seq=1 Ack=624089 Win=360960 Len=0 TSval=2038966124 TSecr=1375224444"
"499","5.229309","192.168.2.2","192.168.1.2","TCP","66","360960","5001  >  44720 [ACK] Seq=1 Ack=626985 Win=360960 Len=0 TSval=2038966148 TSecr=1375224468"
"501","5.252879","192.168.2.2","192.168.1.2","TCP","66","360960","5001  >  44720 [ACK] Seq=1 Ack=629881 Win=360960 Len=0 TSval=2038966172 TSecr=1375224493"
"504","5.277290","192.168.2.2","192.168.1.2","TCP","66","360960","5001  >  44720 [ACK] Seq=1 Ack=632777 Win=360960 Len=0 TSval=2038966196 TSecr=1375224530"
"506","5.301786","192.168.2.2","192.168.1.2","TCP","66","360960","5001  >  44720 [ACK] Seq=1 Ack=635673 Win=360960 Len=0 TSval=2038966221 TSecr=1375224530"
"508","5.330223","192.168.2.2","192.168.1.2","TCP","66","360960","5001  >  44720 [ACK] Seq=1 Ack=638569 Win=360960 Len=0 TSval=2038966249 TSecr=1375224553"
"510","5.349869","192.168.2.2","192.168.1.2","TCP","66","360960","5001  >  44720 [ACK] Seq=1 Ack=641465 Win=360960 Len=0 TSval=2038966269 TSecr=1375224578"
"512","5.374386","192.168.2.2","192.168.1.2","TCP","66","360960","5001  >  44720 [ACK] Seq=1 Ack=644361 Win=360960 Len=0 TSval=2038966293 TSecr=1375224602"
"514","5.410559","192.168.2.2","192.168.1.2","TCP","66","360960","5001  >  44720 [ACK] Seq=1 Ack=648705 Win=360960 Len=0 TSval=2038966329 TSecr=1375224603"
"517","5.435101","192.168.2.2","192.168.1.2","TCP","66","360960","5001  >  44720 [ACK] Seq=1 Ack=651601 Win=360960 Len=0 TSval=2038966354 TSecr=1375224650"
"519","5.458787","192.168.2.2","192.168.1.2","TCP","66","360960","5001  >  44720 [ACK] Seq=1 Ack=654497 Win=360960 Len=0 TSval=2038966378 TSecr=1375224675"
"522","5.483124","192.168.2.2","192.168.1.2","TCP","66","360960","5001  >  44720 [ACK] Seq=1 Ack=657393 Win=360960 Len=0 TSval=2038966402 TSecr=1375224698"
"524","5.507221","192.168.2.2","192.168.1.2","TCP","66","360960","5001  >  44720 [ACK] Seq=1 Ack=660289 Win=360960 Len=0 TSval=2038966426 TSecr=1375224723"
"526","5.531462","192.168.2.2","192.168.1.2","TCP","66","360960","5001  >  44720 [ACK] Seq=1 Ack=663185 Win=360960 Len=0 TSval=2038966450 TSecr=1375224747"
"529","5.555687","192.168.2.2","192.168.1.2","TCP","66","360960","5001  >  44720 [ACK] Seq=1 Ack=666081 Win=360960 Len=0 TSval=2038966474 TSecr=1375224771"
"533","5.579898","192.168.2.2","192.168.1.2","TCP","66","360960","5001  >  44720 [ACK] Seq=1 Ack=668977 Win=360960 Len=0 TSval=2038966499 TSecr=1375224795"
"535","5.604604","192.168.2.2","192.168.1.2","TCP","66","360960","5001  >  44720 [ACK] Seq=1 Ack=671873 Win=360960 Len=0 TSval=2038966523 TSecr=1375224795"
"537","5.628356","192.168.2.2","192.168.1.2","TCP","66","360960","5001  >  44720 [ACK] Seq=1 Ack=674769 Win=360960 Len=0 TSval=2038966547 TSecr=1375224820"
"539","5.652582","192.168.2.2","192.168.1.2","TCP","66","360960","5001  >  44720 [ACK] Seq=1 Ack=677665 Win=360960 Len=0 TSval=2038966571 TSecr=1375224844"
"542","5.677183","192.168.2.2","192.168.1.2","TCP","66","360960","5001  >  44720 [ACK] Seq=1 Ack=680561 Win=360960 Len=0 TSval=2038966596 TSecr=1375224868"
"544","5.701654","192.168.2.2","192.168.1.2","TCP","66","360960","5001  >  44720 [ACK] Seq=1 Ack=683457 Win=360960 Len=0 TSval=2038966620 TSecr=1375224892"
"546","5.725260","192.168.2.2","192.168.1.2","TCP","66","360960","5001  >  44720 [ACK] Seq=1 Ack=686353 Win=360960 Len=0 TSval=2038966644 TSecr=1375224917"
"548","5.749671","192.168.2.2","192.168.1.2","TCP","66","360960","5001  >  44720 [ACK] Seq=1 Ack=689249 Win=360960 Len=0 TSval=2038966668 TSecr=1375224941"
"550","5.774199","192.168.2.2","192.168.1.2","TCP","66","360960","5001  >  44720 [ACK] Seq=1 Ack=692145 Win=360960 Len=0 TSval=2038966693 TSecr=1375224966"
"553","5.797919","192.168.2.2","192.168.1.2","TCP","66","360960","5001  >  44720 [ACK] Seq=1 Ack=695041 Win=360960 Len=0 TSval=2038966717 TSecr=1375224990"
"555","5.822212","192.168.2.2","192.168.1.2","TCP","66","360960","5001  >  44720 [ACK] Seq=1 Ack=697937 Win=360960 Len=0 TSval=2038966741 TSecr=1375225014"
"557","5.846723","192.168.2.2","192.168.1.2","TCP","66","360960","5001  >  44720 [ACK] Seq=1 Ack=700833 Win=360960 Len=0 TSval=2038966765 TSecr=1375225014"
"559","5.871205","192.168.2.2","192.168.1.2","TCP","66","360960","5001  >  44720 [ACK] Seq=1 Ack=703729 Win=360960 Len=0 TSval=2038966790 TSecr=1375225038"
"562","5.894832","192.168.2.2","192.168.1.2","TCP","66","360960","5001  >  44720 [ACK] Seq=1 Ack=706625 Win=360960 Len=0 TSval=2038966813 TSecr=1375225074"
"564","5.919222","192.168.2.2","192.168.1.2","TCP","66","360960","5001  >  44720 [ACK] Seq=1 Ack=709521 Win=360960 Len=0 TSval=2038966838 TSecr=1375225099"
"566","5.943280","192.168.2.2","192.168.1.2","TCP","66","360960","5001  >  44720 [ACK] Seq=1 Ack=712417 Win=360960 Len=0 TSval=2038966862 TSecr=1375225099"
"569","5.968270","192.168.2.2","192.168.1.2","TCP","66","360960","5001  >  44720 [ACK] Seq=1 Ack=715313 Win=360960 Len=0 TSval=2038966887 TSecr=1375225123"
"572","5.992837","192.168.2.2","192.168.1.2","TCP","66","360960","5001  >  44720 [ACK] Seq=1 Ack=718209 Win=360960 Len=0 TSval=2038966911 TSecr=1375225147"
"574","6.017246","192.168.2.2","192.168.1.2","TCP","66","360960","5001  >  44720 [ACK] Seq=1 Ack=721105 Win=360960 Len=0 TSval=2038966936 TSecr=1375225171"
"578","6.041709","192.168.2.2","192.168.1.2","TCP","66","360960","5001  >  44720 [ACK] Seq=1 Ack=724001 Win=360960 Len=0 TSval=2038966960 TSecr=1375225196"
"580","6.077987","192.168.2.2","192.168.1.2","TCP","66","360960","5001  >  44720 [ACK] Seq=1 Ack=728345 Win=360960 Len=0 TSval=2038966996 TSecr=1375225196"
"583","6.102517","192.168.2.2","192.168.1.2","TCP","66","360960","5001  >  44720 [ACK] Seq=1 Ack=731241 Win=360960 Len=0 TSval=2038967021 TSecr=1375225244"
"585","6.126071","192.168.2.2","192.168.1.2","TCP","66","360960","5001  >  44720 [ACK] Seq=1 Ack=734137 Win=360960 Len=0 TSval=2038967045 TSecr=1375225268"
"587","6.150513","192.168.2.2","192.168.1.2","TCP","66","360960","5001  >  44720 [ACK] Seq=1 Ack=737033 Win=360960 Len=0 TSval=2038967069 TSecr=1375225293"
"589","6.175047","192.168.2.2","192.168.1.2","TCP","66","360960","5001  >  44720 [ACK] Seq=1 Ack=739929 Win=360960 Len=0 TSval=2038967093 TSecr=1375225317"
"592","6.199484","192.168.2.2","192.168.1.2","TCP","66","360960","5001  >  44720 [ACK] Seq=1 Ack=742825 Win=360960 Len=0 TSval=2038967118 TSecr=1375225341"
"594","6.223026","192.168.2.2","192.168.1.2","TCP","66","360960","5001  >  44720 [ACK] Seq=1 Ack=745721 Win=360960 Len=0 TSval=2038967141 TSecr=1375225341"
"596","6.247555","192.168.2.2","192.168.1.2","TCP","66","360960","5001  >  44720 [ACK] Seq=1 Ack=748617 Win=360960 Len=0 TSval=2038967166 TSecr=1375225365"
"598","6.272030","192.168.2.2","192.168.1.2","TCP","66","360960","5001  >  44720 [ACK] Seq=1 Ack=751513 Win=360960 Len=0 TSval=2038967190 TSecr=1375225390"
"601","6.295620","192.168.2.2","192.168.1.2","TCP","66","360960","5001  >  44720 [ACK] Seq=1 Ack=754409 Win=360960 Len=0 TSval=2038967214 TSecr=1375225418"
"603","6.320050","192.168.2.2","192.168.1.2","TCP","66","360960","5001  >  44720 [ACK] Seq=1 Ack=757305 Win=360960 Len=0 TSval=2038967238 TSecr=1375225438"
"605","6.344594","192.168.2.2","192.168.1.2","TCP","66","360960","5001  >  44720 [ACK] Seq=1 Ack=760201 Win=360960 Len=0 TSval=2038967263 TSecr=1375225462"
