"No.","Time","Source","Destination","Protocol","Length","Calculated window size","Info"
"4","0.000641","192.168.2.2","192.168.1.2","TCP","74","43440","5001  >  44754 [SYN, ACK] Seq=0 Ack=1 Win=43440 Len=0 MSS=1460 SACK_PERM=1 TSval=2039467856 TSecr=1375727025 WS=512"
"7","0.000754","192.168.2.2","192.168.1.2","TCP","66","39936","5001  >  44754 [ACK] Seq=1 Ack=7241 Win=39936 Len=0 TSval=2039467856 TSecr=1375727025"
"12","0.050194","192.168.2.2","192.168.1.2","TCP","66","39936","5001  >  44754 [ACK] Seq=1 Ack=14481 Win=39936 Len=0 TSval=2039467905 TSecr=1375727025"
"15","0.110344","192.168.2.2","192.168.1.2","TCP","66","38400","5001  >  44754 [ACK] Seq=1 Ack=24617 Win=38400 Len=0 TSval=2039467965 TSecr=1375727025"
"24","0.195166","192.168.2.2","192.168.1.2","TCP","66","40960","5001  >  44754 [ACK] Seq=1 Ack=28961 Win=40960 Len=0 TSval=2039468050 TSecr=1375727025"
"27","0.231884","192.168.2.2","192.168.1.2","TCP","66","42496","5001  >  44754 [ACK] Seq=1 Ack=30409 Win=42496 Len=0 TSval=2039468087 TSecr=1375727038"
"30","0.243704","192.168.2.2","192.168.1.2","TCP","66","38912","5001  >  44754 [ACK] Seq=1 Ack=39097 Win=38912 Len=0 TSval=2039468099 TSecr=1375727074"
"33","0.316248","192.168.2.2","192.168.1.2","TCP","66","40960","5001  >  44754 [ACK] Seq=1 Ack=43441 Win=40960 Len=0 TSval=2039468171 TSecr=1375727102"
"39","0.353423","192.168.2.2","192.168.1.2","TCP","66","41984","5001  >  44754 [ACK] Seq=1 Ack=46337 Win=41984 Len=0 TSval=2039468208 TSecr=1375727134"
"41","0.376761","192.168.2.2","192.168.1.2","TCP","66","41984","5001  >  44754 [ACK] Seq=1 Ack=49233 Win=41984 Len=0 TSval=2039468232 TSecr=1375727134"
"43","0.401025","192.168.2.2","192.168.1.2","TCP","66","42496","5001  >  44754 [ACK] Seq=1 Ack=50681 Win=42496 Len=0 TSval=2039468256 TSecr=1375727134"
"45","0.413154","192.168.2.2","192.168.1.2","TCP","66","41984","5001  >  44754 [ACK] Seq=1 Ack=53577 Win=41984 Len=0 TSval=2039468268 TSecr=1375727134"
"47","0.437656","192.168.2.2","192.168.1.2","TCP","66","41984","5001  >  44754 [ACK] Seq=1 Ack=56473 Win=41984 Len=0 TSval=2039468293 TSecr=1375727135"
"49","0.461556","192.168.2.2","192.168.1.2","TCP","66","41984","5001  >  44754 [ACK] Seq=1 Ack=59369 Win=41984 Len=0 TSval=2039468316 TSecr=1375727135"
"52","0.485806","192.168.2.2","192.168.1.2","TCP","66","41984","5001  >  44754 [ACK] Seq=1 Ack=62265 Win=41984 Len=0 TSval=2039468341 TSecr=1375727135"
"55","0.509995","192.168.2.2","192.168.1.2","TCP","78","42496","[TCP Window Update] 5001  >  44754 [ACK] Seq=1 Ack=62265 Win=42496 Len=0 TSval=2039468365 TSecr=1375727186 SLE=60817 SRE=62265"
"57","0.522196","192.168.2.2","192.168.1.2","TCP","66","41984","5001  >  44754 [ACK] Seq=1 Ack=65161 Win=41984 Len=0 TSval=2039468377 TSecr=1375727219"
"59","0.546465","192.168.2.2","192.168.1.2","TCP","66","41984","5001  >  44754 [ACK] Seq=1 Ack=68057 Win=41984 Len=0 TSval=2039468401 TSecr=1375727219"
"61","0.570896","192.168.2.2","192.168.1.2","TCP","66","41984","5001  >  44754 [ACK] Seq=1 Ack=70953 Win=41984 Len=0 TSval=2039468426 TSecr=1375727256"
"63","0.594779","192.168.2.2","192.168.1.2","TCP","66","42496","5001  >  44754 [ACK] Seq=1 Ack=72401 Win=42496 Len=0 TSval=2039468450 TSecr=1375727256"
"65","0.607115","192.168.2.2","192.168.1.2","TCP","66","41984","5001  >  44754 [ACK] Seq=1 Ack=75297 Win=41984 Len=0 TSval=2039468462 TSecr=1375727268"
"67","0.631122","192.168.2.2","192.168.1.2","TCP","66","41984","5001  >  44754 [ACK] Seq=1 Ack=78193 Win=41984 Len=0 TSval=2039468486 TSecr=1375727340"
"69","0.656118","192.168.2.2","192.168.1.2","TCP","66","48128","5001  >  44754 [ACK] Seq=1 Ack=81089 Win=48128 Len=0 TSval=2039468511 TSecr=1375727340"
"73","0.679623","192.168.2.2","192.168.1.2","TCP","66","54272","5001  >  44754 [ACK] Seq=1 Ack=83985 Win=54272 Len=0 TSval=2039468535 TSecr=1375727340"
"78","0.703794","192.168.2.2","192.168.1.2","TCP","66","59904","5001  >  44754 [ACK] Seq=1 Ack=86881 Win=59904 Len=0 TSval=2039468559 TSecr=1375727377"
"82","0.728608","192.168.2.2","192.168.1.2","TCP","66","65536","5001  >  44754 [ACK] Seq=1 Ack=89777 Win=65536 Len=0 TSval=2039468584 TSecr=1375727401"
"86","0.752237","192.168.2.2","192.168.1.2","TCP","66","71680","5001  >  44754 [ACK] Seq=1 Ack=92673 Win=71680 Len=0 TSval=2039468607 TSecr=1375727425"
"90","0.776642","192.168.2.2","192.168.1.2","TCP","66","74240","5001  >  44754 [ACK] Seq=1 Ack=94121 Win=74240 Len=0 TSval=2039468632 TSecr=1375727437"
"93","0.789334","192.168.2.2","192.168.1.2","TCP","66","80384","5001  >  44754 [ACK] Seq=1 Ack=97017 Win=80384 Len=0 TSval=2039468644 TSecr=1375727462"
"97","0.813338","192.168.2.2","192.168.1.2","TCP","66","86016","5001  >  44754 [ACK] Seq=1 Ack=99913 Win=86016 Len=0 TSval=2039468668 TSecr=1375727486"
"100","0.837786","192.168.2.2","192.168.1.2","TCP","66","91648","5001  >  44754 [ACK] Seq=1 Ack=102809 Win=91648 Len=0 TSval=2039468693 TSecr=1375727510"
"102","0.861257","192.168.2.2","192.168.1.2","TCP","66","95744","5001  >  44754 [ACK] Seq=1 Ack=104761 Win=95744 Len=0 TSval=2039468716 TSecr=1375727534"
"104","0.877929","192.168.2.2","192.168.1.2","TCP","66","98304","5001  >  44754 [ACK] Seq=1 Ack=106209 Win=98304 Len=0 TSval=2039468733 TSecr=1375727546"
"106","0.890739","192.168.2.2","192.168.1.2","TCP","66","104448","5001  >  44754 [ACK] Seq=1 Ack=109105 Win=104448 Len=0 TSval=2039468746 TSecr=1375727570"
"108","0.914275","192.168.2.2","192.168.1.2","TCP","66","110080","5001  >  44754 [ACK] Seq=1 Ack=112001 Win=110080 Len=0 TSval=2039468769 TSecr=1375727595"
"110","0.939158","192.168.2.2","192.168.1.2","TCP","66","115712","5001  >  44754 [ACK] Seq=1 Ack=114897 Win=115712 Len=0 TSval=2039468794 TSecr=1375727619"
"112","0.964237","192.168.2.2","192.168.1.2","TCP","66","118784","5001  >  44754 [ACK] Seq=1 Ack=115841 Win=118784 Len=0 TSval=2039468819 TSecr=1375727631"
"114","0.972028","192.168.2.2","192.168.1.2","TCP","66","124416","5001  >  44754 [ACK] Seq=1 Ack=118737 Win=124416 Len=0 TSval=2039468827 TSecr=1375727655"
"116","0.995708","192.168.2.2","192.168.1.2","TCP","66","130560","5001  >  44754 [ACK] Seq=1 Ack=121633 Win=130560 Len=0 TSval=2039468851 TSecr=1375727680"
"118","1.020035","192.168.2.2","192.168.1.2","TCP","66","136192","5001  >  44754 [ACK] Seq=1 Ack=124529 Win=136192 Len=0 TSval=2039468875 TSecr=1375727680"
"121","1.044537","192.168.2.2","192.168.1.2","TCP","66","141824","5001  >  44754 [ACK] Seq=1 Ack=127425 Win=141824 Len=0 TSval=2039468899 TSecr=1375727680"
"124","1.069092","192.168.2.2","192.168.1.2","TCP","66","147968","5001  >  44754 [ACK] Seq=1 Ack=130321 Win=147968 Len=0 TSval=2039468924 TSecr=1375727704"
"126","1.092588","192.168.2.2","192.168.1.2","TCP","66","153600","5001  >  44754 [ACK] Seq=1 Ack=133217 Win=153600 Len=0 TSval=2039468948 TSecr=1375727704"
"128","1.116965","192.168.2.2","192.168.1.2","TCP","66","159232","5001  >  44754 [ACK] Seq=1 Ack=136113 Win=159232 Len=0 TSval=2039468972 TSecr=1375727704"
"131","1.141525","192.168.2.2","192.168.1.2","TCP","66","162304","5001  >  44754 [ACK] Seq=1 Ack=137561 Win=162304 Len=0 TSval=2039468996 TSecr=1375727704"
"133","1.153205","192.168.2.2","192.168.1.2","TCP","66","167936","5001  >  44754 [ACK] Seq=1 Ack=140457 Win=167936 Len=0 TSval=2039469008 TSecr=1375727728"
"135","1.177773","192.168.2.2","192.168.1.2","TCP","66","173568","5001  >  44754 [ACK] Seq=1 Ack=143353 Win=173568 Len=0 TSval=2039469033 TSecr=1375727728"
"137","1.202284","192.168.2.2","192.168.1.2","TCP","66","179712","5001  >  44754 [ACK] Seq=1 Ack=146249 Win=179712 Len=0 TSval=2039469057 TSecr=1375727728"
"139","1.225818","192.168.2.2","192.168.1.2","TCP","66","185344","5001  >  44754 [ACK] Seq=1 Ack=149145 Win=185344 Len=0 TSval=2039469081 TSecr=1375727753"
"141","1.250178","192.168.2.2","192.168.1.2","TCP","66","187904","5001  >  44754 [ACK] Seq=1 Ack=152041 Win=187904 Len=0 TSval=2039469105 TSecr=1375727753"
"143","1.274726","192.168.2.2","192.168.1.2","TCP","66","187904","5001  >  44754 [ACK] Seq=1 Ack=154937 Win=187904 Len=0 TSval=2039469130 TSecr=1375727753"
"145","1.299266","192.168.2.2","192.168.1.2","TCP","66","187904","5001  >  44754 [ACK] Seq=1 Ack=157833 Win=187904 Len=0 TSval=2039469154 TSecr=1375727776"
"147","1.323739","192.168.2.2","192.168.1.2","TCP","66","188928","5001  >  44754 [ACK] Seq=1 Ack=159281 Win=188928 Len=0 TSval=2039469179 TSecr=1375727776"
"149","1.336484","192.168.2.2","192.168.1.2","TCP","66","187904","5001  >  44754 [ACK] Seq=1 Ack=162177 Win=187904 Len=0 TSval=2039469191 TSecr=1375727776"
"153","1.359975","192.168.2.2","192.168.1.2","TCP","66","187904","5001  >  44754 [ACK] Seq=1 Ack=165073 Win=187904 Len=0 TSval=2039469215 TSecr=1375727801"
"155","1.384386","192.168.2.2","192.168.1.2","TCP","66","187904","5001  >  44754 [ACK] Seq=1 Ack=167969 Win=187904 Len=0 TSval=2039469239 TSecr=1375727801"
"157","1.408549","192.168.2.2","192.168.1.2","TCP","66","187904","5001  >  44754 [ACK] Seq=1 Ack=170865 Win=187904 Len=0 TSval=2039469263 TSecr=1375727813"
"159","1.432477","192.168.2.2","192.168.1.2","TCP","66","187904","5001  >  44754 [ACK] Seq=1 Ack=173761 Win=187904 Len=0 TSval=2039469287 TSecr=1375727813"
"162","1.456681","192.168.2.2","192.168.1.2","TCP","66","187904","5001  >  44754 [ACK] Seq=1 Ack=176657 Win=187904 Len=0 TSval=2039469312 TSecr=1375727813"
"164","1.480906","192.168.2.2","192.168.1.2","TCP","66","187904","5001  >  44754 [ACK] Seq=1 Ack=179553 Win=187904 Len=0 TSval=2039469336 TSecr=1375727837"
"168","1.517218","192.168.2.2","192.168.1.2","TCP","66","187904","5001  >  44754 [ACK] Seq=1 Ack=183897 Win=187904 Len=0 TSval=2039469372 TSecr=1375727837"
"170","1.541437","192.168.2.2","192.168.1.2","TCP","66","187904","5001  >  44754 [ACK] Seq=1 Ack=186793 Win=187904 Len=0 TSval=2039469396 TSecr=1375727885"
"173","1.577917","192.168.2.2","192.168.1.2","TCP","66","187904","5001  >  44754 [ACK] Seq=1 Ack=191137 Win=187904 Len=0 TSval=2039469433 TSecr=1375727902"
"175","1.602016","192.168.2.2","192.168.1.2","TCP","66","187904","5001  >  44754 [ACK] Seq=1 Ack=194033 Win=187904 Len=0 TSval=2039469457 TSecr=1375727938"
"177","1.626870","192.168.2.2","192.168.1.2","TCP","66","187904","5001  >  44754 [ACK] Seq=1 Ack=196929 Win=187904 Len=0 TSval=2039469482 TSecr=1375727963"
"179","1.663096","192.168.2.2","192.168.1.2","TCP","66","194560","5001  >  44754 [ACK] Seq=1 Ack=201273 Win=194560 Len=0 TSval=2039469518 TSecr=1375727988"
"182","1.686792","192.168.2.2","192.168.1.2","TCP","66","197632","5001  >  44754 [ACK] Seq=1 Ack=202721 Win=197632 Len=0 TSval=2039469542 TSecr=1375728020"
"184","1.699302","192.168.2.2","192.168.1.2","TCP","66","203264","5001  >  44754 [ACK] Seq=1 Ack=205617 Win=203264 Len=0 TSval=2039469554 TSecr=1375728044"
"187","1.723950","192.168.2.2","192.168.1.2","TCP","66","208896","5001  >  44754 [ACK] Seq=1 Ack=208513 Win=208896 Len=0 TSval=2039469579 TSecr=1375728069"
"189","1.748358","192.168.2.2","192.168.1.2","TCP","66","215040","5001  >  44754 [ACK] Seq=1 Ack=211409 Win=215040 Len=0 TSval=2039469603 TSecr=1375728069"
"191","1.772775","192.168.2.2","192.168.1.2","TCP","66","220672","5001  >  44754 [ACK] Seq=1 Ack=214305 Win=220672 Len=0 TSval=2039469628 TSecr=1375728093"
"193","1.797293","192.168.2.2","192.168.1.2","TCP","66","226304","5001  >  44754 [ACK] Seq=1 Ack=217201 Win=226304 Len=0 TSval=2039469652 TSecr=1375728117"
"195","1.820810","192.168.2.2","192.168.1.2","TCP","66","232448","5001  >  44754 [ACK] Seq=1 Ack=220097 Win=232448 Len=0 TSval=2039469676 TSecr=1375728141"
"197","1.845274","192.168.2.2","192.168.1.2","TCP","66","235008","5001  >  44754 [ACK] Seq=1 Ack=221545 Win=235008 Len=0 TSval=2039469700 TSecr=1375728166"
"199","1.857157","192.168.2.2","192.168.1.2","TCP","66","241152","5001  >  44754 [ACK] Seq=1 Ack=224441 Win=241152 Len=0 TSval=2039469712 TSecr=1375728177"
"201","1.881580","192.168.2.2","192.168.1.2","TCP","66","246784","5001  >  44754 [ACK] Seq=1 Ack=227337 Win=246784 Len=0 TSval=2039469737 TSecr=1375728202"
"203","1.906041","192.168.2.2","192.168.1.2","TCP","66","252416","5001  >  44754 [ACK] Seq=1 Ack=230233 Win=252416 Len=0 TSval=2039469761 TSecr=1375728226"
"205","1.930534","192.168.2.2","192.168.1.2","TCP","66","258560","5001  >  44754 [ACK] Seq=1 Ack=233129 Win=258560 Len=0 TSval=2039469785 TSecr=1375728250"
"208","1.954039","192.168.2.2","192.168.1.2","TCP","66","264192","5001  >  44754 [ACK] Seq=1 Ack=236025 Win=264192 Len=0 TSval=2039469809 TSecr=1375728274"
"210","1.978569","192.168.2.2","192.168.1.2","TCP","66","269824","5001  >  44754 [ACK] Seq=1 Ack=238921 Win=269824 Len=0 TSval=2039469834 TSecr=1375728299"
"213","2.002590","192.168.2.2","192.168.1.2","TCP","66","275968","5001  >  44754 [ACK] Seq=1 Ack=241817 Win=275968 Len=0 TSval=2039469858 TSecr=1375728323"
"216","2.027019","192.168.2.2","192.168.1.2","TCP","66","281600","5001  >  44754 [ACK] Seq=1 Ack=244713 Win=281600 Len=0 TSval=2039469882 TSecr=1375728348"
"218","2.051492","192.168.2.2","192.168.1.2","TCP","66","284160","5001  >  44754 [ACK] Seq=1 Ack=246161 Win=284160 Len=0 TSval=2039469906 TSecr=1375728360"
"220","2.063235","192.168.2.2","192.168.1.2","TCP","66","290304","5001  >  44754 [ACK] Seq=1 Ack=249057 Win=290304 Len=0 TSval=2039469918 TSecr=1375728384"
"222","2.087277","192.168.2.2","192.168.1.2","TCP","66","295936","5001  >  44754 [ACK] Seq=1 Ack=251953 Win=295936 Len=0 TSval=2039469942 TSecr=1375728408"
"224","2.112270","192.168.2.2","192.168.1.2","TCP","66","301568","5001  >  44754 [ACK] Seq=1 Ack=254849 Win=301568 Len=0 TSval=2039469967 TSecr=1375728433"
"226","2.135802","192.168.2.2","192.168.1.2","TCP","66","307712","5001  >  44754 [ACK] Seq=1 Ack=257745 Win=307712 Len=0 TSval=2039469991 TSecr=1375728456"
"228","2.160237","192.168.2.2","192.168.1.2","TCP","66","310272","5001  >  44754 [ACK] Seq=1 Ack=259193 Win=310272 Len=0 TSval=2039470015 TSecr=1375728462"
"230","2.172967","192.168.2.2","192.168.1.2","TCP","66","316416","5001  >  44754 [ACK] Seq=1 Ack=262089 Win=316416 Len=0 TSval=2039470028 TSecr=1375728481"
"232","2.196500","192.168.2.2","192.168.1.2","TCP","66","322048","5001  >  44754 [ACK] Seq=1 Ack=264985 Win=322048 Len=0 TSval=2039470051 TSecr=1375728505"
"234","2.220992","192.168.2.2","192.168.1.2","TCP","66","327680","5001  >  44754 [ACK] Seq=1 Ack=267881 Win=327680 Len=0 TSval=2039470076 TSecr=1375728541"
"237","2.244745","192.168.2.2","192.168.1.2","TCP","66","333824","5001  >  44754 [ACK] Seq=1 Ack=270777 Win=333824 Len=0 TSval=2039470100 TSecr=1375728565"
"239","2.269084","192.168.2.2","192.168.1.2","TCP","66","339456","5001  >  44754 [ACK] Seq=1 Ack=273673 Win=339456 Len=0 TSval=2039470124 TSecr=1375728565"
"241","2.293418","192.168.2.2","192.168.1.2","TCP","66","345088","5001  >  44754 [ACK] Seq=1 Ack=276569 Win=345088 Len=0 TSval=2039470148 TSecr=1375728602"
"243","2.318664","192.168.2.2","192.168.1.2","TCP","66","351232","5001  >  44754 [ACK] Seq=1 Ack=279465 Win=351232 Len=0 TSval=2039470174 TSecr=1375728626"
"245","2.343386","192.168.2.2","192.168.1.2","TCP","66","356864","5001  >  44754 [ACK] Seq=1 Ack=282361 Win=356864 Len=0 TSval=2039470198 TSecr=1375728651"
"247","2.367157","192.168.2.2","192.168.1.2","TCP","66","360448","5001  >  44754 [ACK] Seq=1 Ack=285257 Win=360448 Len=0 TSval=2039470222 TSecr=1375728687"
"250","2.392223","192.168.2.2","192.168.1.2","TCP","66","360448","5001  >  44754 [ACK] Seq=1 Ack=288153 Win=360448 Len=0 TSval=2039470247 TSecr=1375728687"
"252","2.415584","192.168.2.2","192.168.1.2","TCP","66","360960","5001  >  44754 [ACK] Seq=1 Ack=289601 Win=360960 Len=0 TSval=2039470271 TSecr=1375728711"
"254","2.427697","192.168.2.2","192.168.1.2","TCP","66","360960","5001  >  44754 [ACK] Seq=1 Ack=292497 Win=360960 Len=0 TSval=2039470283 TSecr=1375728723"
"256","2.452204","192.168.2.2","192.168.1.2","TCP","66","360960","5001  >  44754 [ACK] Seq=1 Ack=295393 Win=360960 Len=0 TSval=2039470307 TSecr=1375728748"
"258","2.476202","192.168.2.2","192.168.1.2","TCP","66","360960","5001  >  44754 [ACK] Seq=1 Ack=298289 Win=360960 Len=0 TSval=2039470331 TSecr=1375728772"
"260","2.501233","192.168.2.2","192.168.1.2","TCP","66","360960","5001  >  44754 [ACK] Seq=1 Ack=301185 Win=360960 Len=0 TSval=2039470356 TSecr=1375728797"
"262","2.524720","192.168.2.2","192.168.1.2","TCP","66","360960","5001  >  44754 [ACK] Seq=1 Ack=304081 Win=360960 Len=0 TSval=2039470380 TSecr=1375728821"
"264","2.549174","192.168.2.2","192.168.1.2","TCP","66","360960","5001  >  44754 [ACK] Seq=1 Ack=306977 Win=360960 Len=0 TSval=2039470404 TSecr=1375728845"
"266","2.573720","192.168.2.2","192.168.1.2","TCP","66","360960","5001  >  44754 [ACK] Seq=1 Ack=309873 Win=360960 Len=0 TSval=2039470429 TSecr=1375728869"
"268","2.609396","192.168.2.2","192.168.1.2","TCP","66","360960","5001  >  44754 [ACK] Seq=1 Ack=314217 Win=360960 Len=0 TSval=2039470464 TSecr=1375728881"
"271","2.633947","192.168.2.2","192.168.1.2","TCP","66","360960","5001  >  44754 [ACK] Seq=1 Ack=317113 Win=360960 Len=0 TSval=2039470489 TSecr=1375728930"
"273","2.657878","192.168.2.2","192.168.1.2","TCP","66","360960","5001  >  44754 [ACK] Seq=1 Ack=320009 Win=360960 Len=0 TSval=2039470513 TSecr=1375728955"
"275","2.694673","192.168.2.2","192.168.1.2","TCP","66","360960","5001  >  44754 [ACK] Seq=1 Ack=324353 Win=360960 Len=0 TSval=2039470550 TSecr=1375728973"
"277","2.719185","192.168.2.2","192.168.1.2","TCP","66","360960","5001  >  44754 [ACK] Seq=1 Ack=327249 Win=360960 Len=0 TSval=2039470574 TSecr=1375729003"
"280","2.742697","192.168.2.2","192.168.1.2","TCP","66","360960","5001  >  44754 [ACK] Seq=1 Ack=330145 Win=360960 Len=0 TSval=2039470598 TSecr=1375729027"
"283","2.767611","192.168.2.2","192.168.1.2","TCP","66","360960","5001  >  44754 [ACK] Seq=1 Ack=333041 Win=360960 Len=0 TSval=2039470623 TSecr=1375729051"
"285","2.791856","192.168.2.2","192.168.1.2","TCP","66","360960","5001  >  44754 [ACK] Seq=1 Ack=335937 Win=360960 Len=0 TSval=2039470647 TSecr=1375729075"
"287","2.816161","192.168.2.2","192.168.1.2","TCP","66","360960","5001  >  44754 [ACK] Seq=1 Ack=338833 Win=360960 Len=0 TSval=2039470671 TSecr=1375729087"
"289","2.841038","192.168.2.2","192.168.1.2","TCP","66","360960","5001  >  44754 [ACK] Seq=1 Ack=341729 Win=360960 Len=0 TSval=2039470696 TSecr=1375729111"
"291","2.865302","192.168.2.2","192.168.1.2","TCP","66","360960","5001  >  44754 [ACK] Seq=1 Ack=344625 Win=360960 Len=0 TSval=2039470720 TSecr=1375729136"
"293","2.889570","192.168.2.2","192.168.1.2","TCP","66","360960","5001  >  44754 [ACK] Seq=1 Ack=347521 Win=360960 Len=0 TSval=2039470745 TSecr=1375729160"
"295","2.925907","192.168.2.2","192.168.1.2","TCP","66","360960","5001  >  44754 [ACK] Seq=1 Ack=351865 Win=360960 Len=0 TSval=2039470781 TSecr=1375729184"
"298","2.950050","192.168.2.2","192.168.1.2","TCP","66","360960","5001  >  44754 [ACK] Seq=1 Ack=354761 Win=360960 Len=0 TSval=2039470805 TSecr=1375729220"
"300","2.974257","192.168.2.2","192.168.1.2","TCP","66","360960","5001  >  44754 [ACK] Seq=1 Ack=357657 Win=360960 Len=0 TSval=2039470829 TSecr=1375729245"
"302","2.999370","192.168.2.2","192.168.1.2","TCP","66","360960","5001  >  44754 [ACK] Seq=1 Ack=360553 Win=360960 Len=0 TSval=2039470854 TSecr=1375729269"
"305","3.022808","192.168.2.2","192.168.1.2","TCP","66","360960","5001  >  44754 [ACK] Seq=1 Ack=363449 Win=360960 Len=0 TSval=2039470878 TSecr=1375729293"
"307","3.047338","192.168.2.2","192.168.1.2","TCP","66","360960","5001  >  44754 [ACK] Seq=1 Ack=366345 Win=360960 Len=0 TSval=2039470902 TSecr=1375729317"
"309","3.071728","192.168.2.2","192.168.1.2","TCP","66","360960","5001  >  44754 [ACK] Seq=1 Ack=369241 Win=360960 Len=0 TSval=2039470927 TSecr=1375729343"
"311","3.095710","192.168.2.2","192.168.1.2","TCP","66","360960","5001  >  44754 [ACK] Seq=1 Ack=372137 Win=360960 Len=0 TSval=2039470951 TSecr=1375729367"
"313","3.119764","192.168.2.2","192.168.1.2","TCP","66","360960","5001  >  44754 [ACK] Seq=1 Ack=375033 Win=360960 Len=0 TSval=2039470975 TSecr=1375729391"
"315","3.155956","192.168.2.2","192.168.1.2","TCP","66","360960","5001  >  44754 [ACK] Seq=1 Ack=379377 Win=360960 Len=0 TSval=2039471011 TSecr=1375729391"
"318","3.192296","192.168.2.2","192.168.1.2","TCP","66","360960","5001  >  44754 [ACK] Seq=1 Ack=383721 Win=360960 Len=0 TSval=2039471047 TSecr=1375729440"
"320","3.217346","192.168.2.2","192.168.1.2","TCP","66","360960","5001  >  44754 [ACK] Seq=1 Ack=386617 Win=360960 Len=0 TSval=2039471072 TSecr=1375729476"
"322","3.240796","192.168.2.2","192.168.1.2","TCP","66","360960","5001  >  44754 [ACK] Seq=1 Ack=389513 Win=360960 Len=0 TSval=2039471096 TSecr=1375729500"
"325","3.265243","192.168.2.2","192.168.1.2","TCP","66","360960","5001  >  44754 [ACK] Seq=1 Ack=392409 Win=360960 Len=0 TSval=2039471120 TSecr=1375729525"
"327","3.289773","192.168.2.2","192.168.1.2","TCP","66","360960","5001  >  44754 [ACK] Seq=1 Ack=395305 Win=360960 Len=0 TSval=2039471145 TSecr=1375729549"
"329","3.314236","192.168.2.2","192.168.1.2","TCP","66","360960","5001  >  44754 [ACK] Seq=1 Ack=398201 Win=360960 Len=0 TSval=2039471169 TSecr=1375729573"
"331","3.337794","192.168.2.2","192.168.1.2","TCP","66","360960","5001  >  44754 [ACK] Seq=1 Ack=401097 Win=360960 Len=0 TSval=2039471193 TSecr=1375729598"
"333","3.362238","192.168.2.2","192.168.1.2","TCP","66","360960","5001  >  44754 [ACK] Seq=1 Ack=403993 Win=360960 Len=0 TSval=2039471217 TSecr=1375729633"
"335","3.386708","192.168.2.2","192.168.1.2","TCP","66","360960","5001  >  44754 [ACK] Seq=1 Ack=406889 Win=360960 Len=0 TSval=2039471242 TSecr=1375729633"
"337","3.410360","192.168.2.2","192.168.1.2","TCP","66","360960","5001  >  44754 [ACK] Seq=1 Ack=409785 Win=360960 Len=0 TSval=2039471265 TSecr=1375729658"
"339","3.434677","192.168.2.2","192.168.1.2","TCP","66","360960","5001  >  44754 [ACK] Seq=1 Ack=412681 Win=360960 Len=0 TSval=2039471290 TSecr=1375729682"
"341","3.458791","192.168.2.2","192.168.1.2","TCP","66","360960","5001  >  44754 [ACK] Seq=1 Ack=415577 Win=360960 Len=0 TSval=2039471314 TSecr=1375729719"
"343","3.482959","192.168.2.2","192.168.1.2","TCP","66","360960","5001  >  44754 [ACK] Seq=1 Ack=418473 Win=360960 Len=0 TSval=2039471338 TSecr=1375729743"
"346","3.519349","192.168.2.2","192.168.1.2","TCP","66","360960","5001  >  44754 [ACK] Seq=1 Ack=422817 Win=360960 Len=0 TSval=2039471374 TSecr=1375729743"
"348","3.543517","192.168.2.2","192.168.1.2","TCP","66","360960","5001  >  44754 [ACK] Seq=1 Ack=425713 Win=360960 Len=0 TSval=2039471398 TSecr=1375729792"
"350","3.568015","192.168.2.2","192.168.1.2","TCP","66","360960","5001  >  44754 [ACK] Seq=1 Ack=428609 Win=360960 Len=0 TSval=2039471423 TSecr=1375729816"
"352","3.592433","192.168.2.2","192.168.1.2","TCP","66","360960","5001  >  44754 [ACK] Seq=1 Ack=431505 Win=360960 Len=0 TSval=2039471447 TSecr=1375729840"
"355","3.616204","192.168.2.2","192.168.1.2","TCP","66","360960","5001  >  44754 [ACK] Seq=1 Ack=434401 Win=360960 Len=0 TSval=2039471471 TSecr=1375729865"
"357","3.640487","192.168.2.2","192.168.1.2","TCP","66","360960","5001  >  44754 [ACK] Seq=1 Ack=437297 Win=360960 Len=0 TSval=2039471495 TSecr=1375729889"
"359","3.665607","192.168.2.2","192.168.1.2","TCP","66","360960","5001  >  44754 [ACK] Seq=1 Ack=440193 Win=360960 Len=0 TSval=2039471521 TSecr=1375729914"
"361","3.689353","192.168.2.2","192.168.1.2","TCP","66","360960","5001  >  44754 [ACK] Seq=1 Ack=443089 Win=360960 Len=0 TSval=2039471544 TSecr=1375729950"
"363","3.713103","192.168.2.2","192.168.1.2","TCP","66","360960","5001  >  44754 [ACK] Seq=1 Ack=445985 Win=360960 Len=0 TSval=2039471568 TSecr=1375729950"
"365","3.737331","192.168.2.2","192.168.1.2","TCP","66","360960","5001  >  44754 [ACK] Seq=1 Ack=448881 Win=360960 Len=0 TSval=2039471592 TSecr=1375729974"
"367","3.761932","192.168.2.2","192.168.1.2","TCP","66","360960","5001  >  44754 [ACK] Seq=1 Ack=451777 Win=360960 Len=0 TSval=2039471617 TSecr=1375729998"
"369","3.786402","192.168.2.2","192.168.1.2","TCP","66","360960","5001  >  44754 [ACK] Seq=1 Ack=454673 Win=360960 Len=0 TSval=2039471641 TSecr=1375730023"
"372","3.810758","192.168.2.2","192.168.1.2","TCP","66","360960","5001  >  44754 [ACK] Seq=1 Ack=457569 Win=360960 Len=0 TSval=2039471666 TSecr=1375730047"
"374","3.835008","192.168.2.2","192.168.1.2","TCP","66","360960","5001  >  44754 [ACK] Seq=1 Ack=460465 Win=360960 Len=0 TSval=2039471690 TSecr=1375730071"
"376","3.859432","192.168.2.2","192.168.1.2","TCP","66","360960","5001  >  44754 [ACK] Seq=1 Ack=463361 Win=360960 Len=0 TSval=2039471714 TSecr=1375730096"
"378","3.883455","192.168.2.2","192.168.1.2","TCP","66","360960","5001  >  44754 [ACK] Seq=1 Ack=466257 Win=360960 Len=0 TSval=2039471738 TSecr=1375730120"
"380","3.908462","192.168.2.2","192.168.1.2","TCP","66","360960","5001  >  44754 [ACK] Seq=1 Ack=469153 Win=360960 Len=0 TSval=2039471763 TSecr=1375730144"
"382","3.931946","192.168.2.2","192.168.1.2","TCP","66","360960","5001  >  44754 [ACK] Seq=1 Ack=472049 Win=360960 Len=0 TSval=2039471787 TSecr=1375730180"
"384","3.956453","192.168.2.2","192.168.1.2","TCP","66","360960","5001  >  44754 [ACK] Seq=1 Ack=474945 Win=360960 Len=0 TSval=2039471811 TSecr=1375730180"
"387","3.980876","192.168.2.2","192.168.1.2","TCP","66","360960","5001  >  44754 [ACK] Seq=1 Ack=477841 Win=360960 Len=0 TSval=2039471836 TSecr=1375730216"
"389","4.005293","192.168.2.2","192.168.1.2","TCP","66","360960","5001  >  44754 [ACK] Seq=1 Ack=480737 Win=360960 Len=0 TSval=2039471860 TSecr=1375730241"
"392","4.028913","192.168.2.2","192.168.1.2","TCP","66","360960","5001  >  44754 [ACK] Seq=1 Ack=483633 Win=360960 Len=0 TSval=2039471884 TSecr=1375730265"
"394","4.053378","192.168.2.2","192.168.1.2","TCP","66","360960","5001  >  44754 [ACK] Seq=1 Ack=486529 Win=360960 Len=0 TSval=2039471908 TSecr=1375730265"
"396","4.077254","192.168.2.2","192.168.1.2","TCP","66","360960","5001  >  44754 [ACK] Seq=1 Ack=489425 Win=360960 Len=0 TSval=2039471932 TSecr=1375730289"
"398","4.101535","192.168.2.2","192.168.1.2","TCP","66","360960","5001  >  44754 [ACK] Seq=1 Ack=492321 Win=360960 Len=0 TSval=2039471956 TSecr=1375730314"
"400","4.125847","192.168.2.2","192.168.1.2","TCP","66","360960","5001  >  44754 [ACK] Seq=1 Ack=495217 Win=360960 Len=0 TSval=2039471981 TSecr=1375730338"
"402","4.150314","192.168.2.2","192.168.1.2","TCP","66","360960","5001  >  44754 [ACK] Seq=1 Ack=498113 Win=360960 Len=0 TSval=2039472005 TSecr=1375730362"
"404","4.174142","192.168.2.2","192.168.1.2","TCP","66","360960","5001  >  44754 [ACK] Seq=1 Ack=501009 Win=360960 Len=0 TSval=2039472029 TSecr=1375730386"
"406","4.198375","192.168.2.2","192.168.1.2","TCP","66","360960","5001  >  44754 [ACK] Seq=1 Ack=503905 Win=360960 Len=0 TSval=2039472053 TSecr=1375730411"
"409","4.222840","192.168.2.2","192.168.1.2","TCP","66","360960","5001  >  44754 [ACK] Seq=1 Ack=506801 Win=360960 Len=0 TSval=2039472078 TSecr=1375730434"
"411","4.247304","192.168.2.2","192.168.1.2","TCP","66","360960","5001  >  44754 [ACK] Seq=1 Ack=509697 Win=360960 Len=0 TSval=2039472102 TSecr=1375730459"
"413","4.271102","192.168.2.2","192.168.1.2","TCP","66","360960","5001  >  44754 [ACK] Seq=1 Ack=512593 Win=360960 Len=0 TSval=2039472126 TSecr=1375730483"
"415","4.295541","192.168.2.2","192.168.1.2","TCP","66","360960","5001  >  44754 [ACK] Seq=1 Ack=515489 Win=360960 Len=0 TSval=2039472150 TSecr=1375730507"
"417","4.331657","192.168.2.2","192.168.1.2","TCP","66","360960","5001  >  44754 [ACK] Seq=1 Ack=519833 Win=360960 Len=0 TSval=2039472187 TSecr=1375730510"
"419","4.356073","192.168.2.2","192.168.1.2","TCP","66","360960","5001  >  44754 [ACK] Seq=1 Ack=522729 Win=360960 Len=0 TSval=2039472211 TSecr=1375730568"
"421","4.380570","192.168.2.2","192.168.1.2","TCP","66","360960","5001  >  44754 [ACK] Seq=1 Ack=525625 Win=360960 Len=0 TSval=2039472236 TSecr=1375730592"
"423","4.404601","192.168.2.2","192.168.1.2","TCP","66","360960","5001  >  44754 [ACK] Seq=1 Ack=528521 Win=360960 Len=0 TSval=2039472260 TSecr=1375730616"
"425","4.440776","192.168.2.2","192.168.1.2","TCP","66","360960","5001  >  44754 [ACK] Seq=1 Ack=532865 Win=360960 Len=0 TSval=2039472296 TSecr=1375730616"
"428","4.465243","192.168.2.2","192.168.1.2","TCP","66","360960","5001  >  44754 [ACK] Seq=1 Ack=535761 Win=360960 Len=0 TSval=2039472320 TSecr=1375730664"
"430","4.489026","192.168.2.2","192.168.1.2","TCP","66","360960","5001  >  44754 [ACK] Seq=1 Ack=538657 Win=360960 Len=0 TSval=2039472344 TSecr=1375730690"
"433","4.513336","192.168.2.2","192.168.1.2","TCP","66","360960","5001  >  44754 [ACK] Seq=1 Ack=541553 Win=360960 Len=0 TSval=2039472368 TSecr=1375730713"
"435","4.537787","192.168.2.2","192.168.1.2","TCP","66","360960","5001  >  44754 [ACK] Seq=1 Ack=544449 Win=360960 Len=0 TSval=2039472393 TSecr=1375730737"
"437","4.561717","192.168.2.2","192.168.1.2","TCP","66","360960","5001  >  44754 [ACK] Seq=1 Ack=547345 Win=360960 Len=0 TSval=2039472417 TSecr=1375730761"
"439","4.585940","192.168.2.2","192.168.1.2","TCP","66","360960","5001  >  44754 [ACK] Seq=1 Ack=550241 Win=360960 Len=0 TSval=2039472441 TSecr=1375730786"
"441","4.610160","192.168.2.2","192.168.1.2","TCP","66","360960","5001  >  44754 [ACK] Seq=1 Ack=553137 Win=360960 Len=0 TSval=2039472465 TSecr=1375730810"
"443","4.634726","192.168.2.2","192.168.1.2","TCP","66","360960","5001  >  44754 [ACK] Seq=1 Ack=556033 Win=360960 Len=0 TSval=2039472490 TSecr=1375730835"
"445","4.659246","192.168.2.2","192.168.1.2","TCP","66","360960","5001  >  44754 [ACK] Seq=1 Ack=558929 Win=360960 Len=0 TSval=2039472514 TSecr=1375730859"
"447","4.682825","192.168.2.2","192.168.1.2","TCP","66","360960","5001  >  44754 [ACK] Seq=1 Ack=561825 Win=360960 Len=0 TSval=2039472538 TSecr=1375730883"
"449","4.707206","192.168.2.2","192.168.1.2","TCP","66","360960","5001  >  44754 [ACK] Seq=1 Ack=564721 Win=360960 Len=0 TSval=2039472562 TSecr=1375730907"
"452","4.731669","192.168.2.2","192.168.1.2","TCP","66","360960","5001  >  44754 [ACK] Seq=1 Ack=567617 Win=360960 Len=0 TSval=2039472587 TSecr=1375730932"
"454","4.756231","192.168.2.2","192.168.1.2","TCP","66","360960","5001  >  44754 [ACK] Seq=1 Ack=570513 Win=360960 Len=0 TSval=2039472611 TSecr=1375730956"
"456","4.779762","192.168.2.2","192.168.1.2","TCP","66","360960","5001  >  44754 [ACK] Seq=1 Ack=573409 Win=360960 Len=0 TSval=2039472635 TSecr=1375730980"
"458","4.803981","192.168.2.2","192.168.1.2","TCP","66","360960","5001  >  44754 [ACK] Seq=1 Ack=576305 Win=360960 Len=0 TSval=2039472659 TSecr=1375730980"
"460","4.828820","192.168.2.2","192.168.1.2","TCP","66","360960","5001  >  44754 [ACK] Seq=1 Ack=579201 Win=360960 Len=0 TSval=2039472684 TSecr=1375731005"
"462","4.852412","192.168.2.2","192.168.1.2","TCP","66","360960","5001  >  44754 [ACK] Seq=1 Ack=582097 Win=360960 Len=0 TSval=2039472707 TSecr=1375731029"
"465","4.877370","192.168.2.2","192.168.1.2","TCP","66","360960","5001  >  44754 [ACK] Seq=1 Ack=584993 Win=360960 Len=0 TSval=2039472732 TSecr=1375731053"
"467","4.902138","192.168.2.2","192.168.1.2","TCP","66","360960","5001  >  44754 [ACK] Seq=1 Ack=587889 Win=360960 Len=0 TSval=2039472757 TSecr=1375731077"
"469","4.925844","192.168.2.2","192.168.1.2","TCP","66","360960","5001  >  44754 [ACK] Seq=1 Ack=590785 Win=360960 Len=0 TSval=2039472781 TSecr=1375731101"
"472","4.950167","192.168.2.2","192.168.1.2","TCP","66","360960","5001  >  44754 [ACK] Seq=1 Ack=593681 Win=360960 Len=0 TSval=2039472805 TSecr=1375731126"
"474","4.986409","192.168.2.2","192.168.1.2","TCP","66","360960","5001  >  44754 [ACK] Seq=1 Ack=598025 Win=360960 Len=0 TSval=2039472841 TSecr=1375731150"
"476","5.010658","192.168.2.2","192.168.1.2","TCP","66","360960","5001  >  44754 [ACK] Seq=1 Ack=600921 Win=360960 Len=0 TSval=2039472866 TSecr=1375731198"
"480","5.034898","192.168.2.2","192.168.1.2","TCP","66","360960","5001  >  44754 [ACK] Seq=1 Ack=603817 Win=360960 Len=0 TSval=2039472890 TSecr=1375731222"
"482","5.059443","192.168.2.2","192.168.1.2","TCP","66","360960","5001  >  44754 [ACK] Seq=1 Ack=606713 Win=360960 Len=0 TSval=2039472914 TSecr=1375731222"
"484","5.083917","192.168.2.2","192.168.1.2","TCP","66","360960","5001  >  44754 [ACK] Seq=1 Ack=609609 Win=360960 Len=0 TSval=2039472939 TSecr=1375731247"
"488","5.107541","192.168.2.2","192.168.1.2","TCP","66","360960","5001  >  44754 [ACK] Seq=1 Ack=612505 Win=360960 Len=0 TSval=2039472962 TSecr=1375731271"
"491","5.131850","192.168.2.2","192.168.1.2","TCP","66","360960","5001  >  44754 [ACK] Seq=1 Ack=615401 Win=360960 Len=0 TSval=2039472987 TSecr=1375731295"
"493","5.156338","192.168.2.2","192.168.1.2","TCP","66","360960","5001  >  44754 [ACK] Seq=1 Ack=618297 Win=360960 Len=0 TSval=2039473011 TSecr=1375731320"
"495","5.180885","192.168.2.2","192.168.1.2","TCP","66","360960","5001  >  44754 [ACK] Seq=1 Ack=621193 Win=360960 Len=0 TSval=2039473036 TSecr=1375731356"
"497","5.204456","192.168.2.2","192.168.1.2","TCP","66","360960","5001  >  44754 [ACK] Seq=1 Ack=624089 Win=360960 Len=0 TSval=2039473059 TSecr=1375731380"
"499","5.228665","192.168.2.2","192.168.1.2","TCP","66","360960","5001  >  44754 [ACK] Seq=1 Ack=626985 Win=360960 Len=0 TSval=2039473084 TSecr=1375731405"
"501","5.253358","192.168.2.2","192.168.1.2","TCP","66","360960","5001  >  44754 [ACK] Seq=1 Ack=629881 Win=360960 Len=0 TSval=2039473108 TSecr=1375731429"
"504","5.277173","192.168.2.2","192.168.1.2","TCP","66","360960","5001  >  44754 [ACK] Seq=1 Ack=632777 Win=360960 Len=0 TSval=2039473132 TSecr=1375731465"
"506","5.301418","192.168.2.2","192.168.1.2","TCP","66","360960","5001  >  44754 [ACK] Seq=1 Ack=635673 Win=360960 Len=0 TSval=2039473156 TSecr=1375731465"
"508","5.325885","192.168.2.2","192.168.1.2","TCP","66","360960","5001  >  44754 [ACK] Seq=1 Ack=638569 Win=360960 Len=0 TSval=2039473181 TSecr=1375731489"
"512","5.349780","192.168.2.2","192.168.1.2","TCP","66","360960","5001  >  44754 [ACK] Seq=1 Ack=641465 Win=360960 Len=0 TSval=2039473205 TSecr=1375731513"
"514","5.386543","192.168.2.2","192.168.1.2","TCP","66","360960","5001  >  44754 [ACK] Seq=1 Ack=645809 Win=360960 Len=0 TSval=2039473241 TSecr=1375731533"
"517","5.411099","192.168.2.2","192.168.1.2","TCP","66","360960","5001  >  44754 [ACK] Seq=1 Ack=648705 Win=360960 Len=0 TSval=2039473266 TSecr=1375731562"
"519","5.434606","192.168.2.2","192.168.1.2","TCP","66","360960","5001  >  44754 [ACK] Seq=1 Ack=651601 Win=360960 Len=0 TSval=2039473290 TSecr=1375731586"
"521","5.458796","192.168.2.2","192.168.1.2","TCP","66","360960","5001  >  44754 [ACK] Seq=1 Ack=654497 Win=360960 Len=0 TSval=2039473314 TSecr=1375731610"
"523","5.483589","192.168.2.2","192.168.1.2","TCP","66","360960","5001  >  44754 [ACK] Seq=1 Ack=657393 Win=360960 Len=0 TSval=2039473339 TSecr=1375731634"
"526","5.507235","192.168.2.2","192.168.1.2","TCP","66","360960","5001  >  44754 [ACK] Seq=1 Ack=660289 Win=360960 Len=0 TSval=2039473362 TSecr=1375731659"
"528","5.531492","192.168.2.2","192.168.1.2","TCP","66","360960","5001  >  44754 [ACK] Seq=1 Ack=663185 Win=360960 Len=0 TSval=2039473386 TSecr=1375731683"
"531","5.555988","192.168.2.2","192.168.1.2","TCP","66","360960","5001  >  44754 [ACK] Seq=1 Ack=666081 Win=360960 Len=0 TSval=2039473411 TSecr=1375731707"
"533","5.579932","192.168.2.2","192.168.1.2","TCP","66","360960","5001  >  44754 [ACK] Seq=1 Ack=668977 Win=360960 Len=0 TSval=2039473435 TSecr=1375731731"
"535","5.604151","192.168.2.2","192.168.1.2","TCP","66","360960","5001  >  44754 [ACK] Seq=1 Ack=671873 Win=360960 Len=0 TSval=2039473459 TSecr=1375731731"
"537","5.629033","192.168.2.2","192.168.1.2","TCP","66","360960","5001  >  44754 [ACK] Seq=1 Ack=674769 Win=360960 Len=0 TSval=2039473484 TSecr=1375731756"
"539","5.653550","192.168.2.2","192.168.1.2","TCP","66","360960","5001  >  44754 [ACK] Seq=1 Ack=677665 Win=360960 Len=0 TSval=2039473509 TSecr=1375731780"
"542","5.677015","192.168.2.2","192.168.1.2","TCP","66","360960","5001  >  44754 [ACK] Seq=1 Ack=680561 Win=360960 Len=0 TSval=2039473532 TSecr=1375731804"
"544","5.701545","192.168.2.2","192.168.1.2","TCP","66","360960","5001  >  44754 [ACK] Seq=1 Ack=683457 Win=360960 Len=0 TSval=2039473556 TSecr=1375731828"
"546","5.726018","192.168.2.2","192.168.1.2","TCP","66","360960","5001  >  44754 [ACK] Seq=1 Ack=686353 Win=360960 Len=0 TSval=2039473581 TSecr=1375731853"
"548","5.749579","192.168.2.2","192.168.1.2","TCP","66","360960","5001  >  44754 [ACK] Seq=1 Ack=689249 Win=360960 Len=0 TSval=2039473605 TSecr=1375731876"
"550","5.773779","192.168.2.2","192.168.1.2","TCP","66","360960","5001  >  44754 [ACK] Seq=1 Ack=692145 Win=360960 Len=0 TSval=2039473629 TSecr=1375731901"
"553","5.798497","192.168.2.2","192.168.1.2","TCP","66","360960","5001  >  44754 [ACK] Seq=1 Ack=695041 Win=360960 Len=0 TSval=2039473653 TSecr=1375731926"
"555","5.822155","192.168.2.2","192.168.1.2","TCP","66","360960","5001  >  44754 [ACK] Seq=1 Ack=697937 Win=360960 Len=0 TSval=2039473677 TSecr=1375731950"
"557","5.846478","192.168.2.2","192.168.1.2","TCP","66","360960","5001  >  44754 [ACK] Seq=1 Ack=700833 Win=360960 Len=0 TSval=2039473701 TSecr=1375731950"
"559","5.870589","192.168.2.2","192.168.1.2","TCP","66","360960","5001  >  44754 [ACK] Seq=1 Ack=703729 Win=360960 Len=0 TSval=2039473726 TSecr=1375731974"
"562","5.895598","192.168.2.2","192.168.1.2","TCP","66","360960","5001  >  44754 [ACK] Seq=1 Ack=706625 Win=360960 Len=0 TSval=2039473751 TSecr=1375732010"
"564","5.919101","192.168.2.2","192.168.1.2","TCP","66","360960","5001  >  44754 [ACK] Seq=1 Ack=709521 Win=360960 Len=0 TSval=2039473774 TSecr=1375732035"
"566","5.943496","192.168.2.2","192.168.1.2","TCP","66","360960","5001  >  44754 [ACK] Seq=1 Ack=712417 Win=360960 Len=0 TSval=2039473798 TSecr=1375732035"
"569","5.968260","192.168.2.2","192.168.1.2","TCP","66","360960","5001  >  44754 [ACK] Seq=1 Ack=715313 Win=360960 Len=0 TSval=2039473823 TSecr=1375732059"
"572","5.992498","192.168.2.2","192.168.1.2","TCP","66","360960","5001  >  44754 [ACK] Seq=1 Ack=718209 Win=360960 Len=0 TSval=2039473847 TSecr=1375732083"
"574","6.016963","192.168.2.2","192.168.1.2","TCP","66","360960","5001  >  44754 [ACK] Seq=1 Ack=721105 Win=360960 Len=0 TSval=2039473872 TSecr=1375732108"
"578","6.041287","192.168.2.2","192.168.1.2","TCP","66","360960","5001  >  44754 [ACK] Seq=1 Ack=724001 Win=360960 Len=0 TSval=2039473896 TSecr=1375732132"
"580","6.077669","192.168.2.2","192.168.1.2","TCP","66","360960","5001  >  44754 [ACK] Seq=1 Ack=728345 Win=360960 Len=0 TSval=2039473933 TSecr=1375732132"
"583","6.101839","192.168.2.2","192.168.1.2","TCP","66","360960","5001  >  44754 [ACK] Seq=1 Ack=731241 Win=360960 Len=0 TSval=2039473957 TSecr=1375732180"
"585","6.126067","192.168.2.2","192.168.1.2","TCP","66","360960","5001  >  44754 [ACK] Seq=1 Ack=734137 Win=360960 Len=0 TSval=2039473981 TSecr=1375732205"
"587","6.150332","192.168.2.2","192.168.1.2","TCP","66","360960","5001  >  44754 [ACK] Seq=1 Ack=737033 Win=360960 Len=0 TSval=2039474005 TSecr=1375732228"
"589","6.174671","192.168.2.2","192.168.1.2","TCP","66","360960","5001  >  44754 [ACK] Seq=1 Ack=739929 Win=360960 Len=0 TSval=2039474030 TSecr=1375732253"
"592","6.199731","192.168.2.2","192.168.1.2","TCP","66","360960","5001  >  44754 [ACK] Seq=1 Ack=742825 Win=360960 Len=0 TSval=2039474055 TSecr=1375732277"
"594","6.223140","192.168.2.2","192.168.1.2","TCP","66","360960","5001  >  44754 [ACK] Seq=1 Ack=745721 Win=360960 Len=0 TSval=2039474078 TSecr=1375732277"
"596","6.247751","192.168.2.2","192.168.1.2","TCP","66","360960","5001  >  44754 [ACK] Seq=1 Ack=748617 Win=360960 Len=0 TSval=2039474103 TSecr=1375732301"
"598","6.271473","192.168.2.2","192.168.1.2","TCP","66","360960","5001  >  44754 [ACK] Seq=1 Ack=751513 Win=360960 Len=0 TSval=2039474126 TSecr=1375732325"
"601","6.295714","192.168.2.2","192.168.1.2","TCP","66","360960","5001  >  44754 [ACK] Seq=1 Ack=754409 Win=360960 Len=0 TSval=2039474151 TSecr=1375732350"
"603","6.320151","192.168.2.2","192.168.1.2","TCP","66","360960","5001  >  44754 [ACK] Seq=1 Ack=757305 Win=360960 Len=0 TSval=2039474175 TSecr=1375732374"
"605","6.344602","192.168.2.2","192.168.1.2","TCP","66","360960","5001  >  44754 [ACK] Seq=1 Ack=760201 Win=360960 Len=0 TSval=2039474200 TSecr=1375732411"
