"No.","Time","Source","Destination","Protocol","Length","Calculated window size","Info"
"4","0.000678","192.168.2.2","192.168.1.2","TCP","74","43440","5001  >  45814 [SYN, ACK] Seq=0 Ack=1 Win=43440 Len=0 MSS=1460 SACK_PERM=1 TSval=2324607456 TSecr=791235628 WS=512"
"7","0.000729","192.168.2.2","192.168.1.2","TCP","66","39936","5001  >  45814 [ACK] Seq=1 Ack=7241 Win=39936 Len=0 TSval=2324607456 TSecr=791235628"
"12","0.049922","192.168.2.2","192.168.1.2","TCP","66","39936","5001  >  45814 [ACK] Seq=1 Ack=14481 Win=39936 Len=0 TSval=2324607506 TSecr=791235628"
"15","0.110692","192.168.2.2","192.168.1.2","TCP","66","38400","5001  >  45814 [ACK] Seq=1 Ack=24617 Win=38400 Len=0 TSval=2324607566 TSecr=791235628"
"24","0.195088","192.168.2.2","192.168.1.2","TCP","66","40960","5001  >  45814 [ACK] Seq=1 Ack=28961 Win=40960 Len=0 TSval=2324607651 TSecr=791235628"
"28","0.231489","192.168.2.2","192.168.1.2","TCP","66","42496","5001  >  45814 [ACK] Seq=1 Ack=30409 Win=42496 Len=0 TSval=2324607687 TSecr=791235643"
"31","0.243529","192.168.2.2","192.168.1.2","TCP","66","38912","5001  >  45814 [ACK] Seq=1 Ack=39097 Win=38912 Len=0 TSval=2324607699 TSecr=791235678"
"34","0.316210","192.168.2.2","192.168.1.2","TCP","66","40960","5001  >  45814 [ACK] Seq=1 Ack=43441 Win=40960 Len=0 TSval=2324607772 TSecr=791235703"
"38","0.352824","192.168.2.2","192.168.1.2","TCP","66","41984","5001  >  45814 [ACK] Seq=1 Ack=46337 Win=41984 Len=0 TSval=2324607808 TSecr=791235738"
"40","0.377275","192.168.2.2","192.168.1.2","TCP","66","41984","5001  >  45814 [ACK] Seq=1 Ack=49233 Win=41984 Len=0 TSval=2324607833 TSecr=791235738"
"42","0.401015","192.168.2.2","192.168.1.2","TCP","66","42496","5001  >  45814 [ACK] Seq=1 Ack=50681 Win=42496 Len=0 TSval=2324607856 TSecr=791235738"
"44","0.413635","192.168.2.2","192.168.1.2","TCP","66","41984","5001  >  45814 [ACK] Seq=1 Ack=53577 Win=41984 Len=0 TSval=2324607869 TSecr=791235738"
"46","0.438063","192.168.2.2","192.168.1.2","TCP","66","41984","5001  >  45814 [ACK] Seq=1 Ack=56473 Win=41984 Len=0 TSval=2324607894 TSecr=791235738"
"49","0.461625","192.168.2.2","192.168.1.2","TCP","66","41984","5001  >  45814 [ACK] Seq=1 Ack=59369 Win=41984 Len=0 TSval=2324607917 TSecr=791235739"
"51","0.486082","192.168.2.2","192.168.1.2","TCP","66","41984","5001  >  45814 [ACK] Seq=1 Ack=62265 Win=41984 Len=0 TSval=2324607942 TSecr=791235739"
"53","0.510599","192.168.2.2","192.168.1.2","TCP","78","42496","[TCP Window Update] 5001  >  45814 [ACK] Seq=1 Ack=62265 Win=42496 Len=0 TSval=2324607966 TSecr=791235791 SLE=60817 SRE=62265"
"55","0.522361","192.168.2.2","192.168.1.2","TCP","66","41984","5001  >  45814 [ACK] Seq=1 Ack=65161 Win=41984 Len=0 TSval=2324607978 TSecr=791235823"
"57","0.546856","192.168.2.2","192.168.1.2","TCP","66","41984","5001  >  45814 [ACK] Seq=1 Ack=68057 Win=41984 Len=0 TSval=2324608002 TSecr=791235823"
"60","0.571332","192.168.2.2","192.168.1.2","TCP","66","41984","5001  >  45814 [ACK] Seq=1 Ack=70953 Win=41984 Len=0 TSval=2324608027 TSecr=791235859"
"62","0.594876","192.168.2.2","192.168.1.2","TCP","66","42496","5001  >  45814 [ACK] Seq=1 Ack=72401 Win=42496 Len=0 TSval=2324608050 TSecr=791235859"
"64","0.606998","192.168.2.2","192.168.1.2","TCP","66","41984","5001  >  45814 [ACK] Seq=1 Ack=75297 Win=41984 Len=0 TSval=2324608062 TSecr=791235871"
"66","0.631156","192.168.2.2","192.168.1.2","TCP","66","41984","5001  >  45814 [ACK] Seq=1 Ack=78193 Win=41984 Len=0 TSval=2324608087 TSecr=791235944"
"68","0.655628","192.168.2.2","192.168.1.2","TCP","66","48128","5001  >  45814 [ACK] Seq=1 Ack=81089 Win=48128 Len=0 TSval=2324608111 TSecr=791235944"
"72","0.680154","192.168.2.2","192.168.1.2","TCP","66","54272","5001  >  45814 [ACK] Seq=1 Ack=83985 Win=54272 Len=0 TSval=2324608135 TSecr=791235944"
"77","0.704518","192.168.2.2","192.168.1.2","TCP","66","59904","5001  >  45814 [ACK] Seq=1 Ack=86881 Win=59904 Len=0 TSval=2324608160 TSecr=791235980"
"81","0.728730","192.168.2.2","192.168.1.2","TCP","66","65536","5001  >  45814 [ACK] Seq=1 Ack=89777 Win=65536 Len=0 TSval=2324608184 TSecr=791236005"
"85","0.753661","192.168.2.2","192.168.1.2","TCP","66","71680","5001  >  45814 [ACK] Seq=1 Ack=92673 Win=71680 Len=0 TSval=2324608209 TSecr=791236029"
"89","0.778148","192.168.2.2","192.168.1.2","TCP","66","74240","5001  >  45814 [ACK] Seq=1 Ack=94121 Win=74240 Len=0 TSval=2324608233 TSecr=791236041"
"92","0.789278","192.168.2.2","192.168.1.2","TCP","66","80384","5001  >  45814 [ACK] Seq=1 Ack=97017 Win=80384 Len=0 TSval=2324608245 TSecr=791236066"
"96","0.814404","192.168.2.2","192.168.1.2","TCP","66","86016","5001  >  45814 [ACK] Seq=1 Ack=99913 Win=86016 Len=0 TSval=2324608270 TSecr=791236089"
"99","0.837907","192.168.2.2","192.168.1.2","TCP","66","91648","5001  >  45814 [ACK] Seq=1 Ack=102809 Win=91648 Len=0 TSval=2324608293 TSecr=791236114"
"101","0.862662","192.168.2.2","192.168.1.2","TCP","66","95744","5001  >  45814 [ACK] Seq=1 Ack=104761 Win=95744 Len=0 TSval=2324608318 TSecr=791236138"
"105","0.879331","192.168.2.2","192.168.1.2","TCP","66","98304","5001  >  45814 [ACK] Seq=1 Ack=106209 Win=98304 Len=0 TSval=2324608335 TSecr=791236150"
"107","0.891808","192.168.2.2","192.168.1.2","TCP","66","104448","5001  >  45814 [ACK] Seq=1 Ack=109105 Win=104448 Len=0 TSval=2324608347 TSecr=791236174"
"109","0.916352","192.168.2.2","192.168.1.2","TCP","66","110080","5001  >  45814 [ACK] Seq=1 Ack=112001 Win=110080 Len=0 TSval=2324608372 TSecr=791236199"
"111","0.939890","192.168.2.2","192.168.1.2","TCP","66","115712","5001  >  45814 [ACK] Seq=1 Ack=114897 Win=115712 Len=0 TSval=2324608395 TSecr=791236222"
"113","0.964348","192.168.2.2","192.168.1.2","TCP","66","118784","5001  >  45814 [ACK] Seq=1 Ack=115841 Win=118784 Len=0 TSval=2324608420 TSecr=791236234"
"115","0.972181","192.168.2.2","192.168.1.2","TCP","66","124416","5001  >  45814 [ACK] Seq=1 Ack=118737 Win=124416 Len=0 TSval=2324608427 TSecr=791236259"
"117","0.996696","192.168.2.2","192.168.1.2","TCP","66","130560","5001  >  45814 [ACK] Seq=1 Ack=121633 Win=130560 Len=0 TSval=2324608452 TSecr=791236283"
"120","1.021215","192.168.2.2","192.168.1.2","TCP","66","136192","5001  >  45814 [ACK] Seq=1 Ack=124529 Win=136192 Len=0 TSval=2324608476 TSecr=791236283"
"122","1.044853","192.168.2.2","192.168.1.2","TCP","66","141824","5001  >  45814 [ACK] Seq=1 Ack=127425 Win=141824 Len=0 TSval=2324608500 TSecr=791236283"
"125","1.069191","192.168.2.2","192.168.1.2","TCP","66","147968","5001  >  45814 [ACK] Seq=1 Ack=130321 Win=147968 Len=0 TSval=2324608524 TSecr=791236308"
"127","1.093722","192.168.2.2","192.168.1.2","TCP","66","153600","5001  >  45814 [ACK] Seq=1 Ack=133217 Win=153600 Len=0 TSval=2324608549 TSecr=791236308"
"129","1.118215","192.168.2.2","192.168.1.2","TCP","66","159232","5001  >  45814 [ACK] Seq=1 Ack=136113 Win=159232 Len=0 TSval=2324608573 TSecr=791236308"
"131","1.141752","192.168.2.2","192.168.1.2","TCP","66","162304","5001  >  45814 [ACK] Seq=1 Ack=137561 Win=162304 Len=0 TSval=2324608597 TSecr=791236308"
"133","1.153888","192.168.2.2","192.168.1.2","TCP","66","167936","5001  >  45814 [ACK] Seq=1 Ack=140457 Win=167936 Len=0 TSval=2324608609 TSecr=791236332"
"135","1.178106","192.168.2.2","192.168.1.2","TCP","66","173568","5001  >  45814 [ACK] Seq=1 Ack=143353 Win=173568 Len=0 TSval=2324608633 TSecr=791236332"
"137","1.202571","192.168.2.2","192.168.1.2","TCP","66","179712","5001  >  45814 [ACK] Seq=1 Ack=146249 Win=179712 Len=0 TSval=2324608658 TSecr=791236332"
"139","1.226986","192.168.2.2","192.168.1.2","TCP","66","185344","5001  >  45814 [ACK] Seq=1 Ack=149145 Win=185344 Len=0 TSval=2324608682 TSecr=791236356"
"141","1.250756","192.168.2.2","192.168.1.2","TCP","66","187904","5001  >  45814 [ACK] Seq=1 Ack=152041 Win=187904 Len=0 TSval=2324608706 TSecr=791236356"
"143","1.275029","192.168.2.2","192.168.1.2","TCP","66","187904","5001  >  45814 [ACK] Seq=1 Ack=154937 Win=187904 Len=0 TSval=2324608730 TSecr=791236356"
"146","1.299532","192.168.2.2","192.168.1.2","TCP","66","187904","5001  >  45814 [ACK] Seq=1 Ack=157833 Win=187904 Len=0 TSval=2324608755 TSecr=791236381"
"150","1.323413","192.168.2.2","192.168.1.2","TCP","66","188928","5001  >  45814 [ACK] Seq=1 Ack=159281 Win=188928 Len=0 TSval=2324608778 TSecr=791236381"
"152","1.335560","192.168.2.2","192.168.1.2","TCP","66","187904","5001  >  45814 [ACK] Seq=1 Ack=162177 Win=187904 Len=0 TSval=2324608791 TSecr=791236381"
"154","1.360299","192.168.2.2","192.168.1.2","TCP","66","187904","5001  >  45814 [ACK] Seq=1 Ack=165073 Win=187904 Len=0 TSval=2324608815 TSecr=791236405"
"156","1.383978","192.168.2.2","192.168.1.2","TCP","66","187904","5001  >  45814 [ACK] Seq=1 Ack=167969 Win=187904 Len=0 TSval=2324608839 TSecr=791236405"
"158","1.408381","192.168.2.2","192.168.1.2","TCP","66","187904","5001  >  45814 [ACK] Seq=1 Ack=170865 Win=187904 Len=0 TSval=2324608863 TSecr=791236417"
"160","1.432856","192.168.2.2","192.168.1.2","TCP","66","187904","5001  >  45814 [ACK] Seq=1 Ack=173761 Win=187904 Len=0 TSval=2324608888 TSecr=791236417"
"163","1.456683","192.168.2.2","192.168.1.2","TCP","66","187904","5001  >  45814 [ACK] Seq=1 Ack=176657 Win=187904 Len=0 TSval=2324608912 TSecr=791236417"
"165","1.480911","192.168.2.2","192.168.1.2","TCP","66","187904","5001  >  45814 [ACK] Seq=1 Ack=179553 Win=187904 Len=0 TSval=2324608936 TSecr=791236442"
"167","1.517217","192.168.2.2","192.168.1.2","TCP","66","187904","5001  >  45814 [ACK] Seq=1 Ack=183897 Win=187904 Len=0 TSval=2324608972 TSecr=791236442"
"169","1.541574","192.168.2.2","192.168.1.2","TCP","66","187904","5001  >  45814 [ACK] Seq=1 Ack=186793 Win=187904 Len=0 TSval=2324608996 TSecr=791236490"
"172","1.577861","192.168.2.2","192.168.1.2","TCP","66","187904","5001  >  45814 [ACK] Seq=1 Ack=191137 Win=187904 Len=0 TSval=2324609033 TSecr=791236507"
"174","1.602017","192.168.2.2","192.168.1.2","TCP","66","187904","5001  >  45814 [ACK] Seq=1 Ack=194033 Win=187904 Len=0 TSval=2324609057 TSecr=791236544"
"176","1.626840","192.168.2.2","192.168.1.2","TCP","66","187904","5001  >  45814 [ACK] Seq=1 Ack=196929 Win=187904 Len=0 TSval=2324609082 TSecr=791236567"
"178","1.663138","192.168.2.2","192.168.1.2","TCP","66","194560","5001  >  45814 [ACK] Seq=1 Ack=201273 Win=194560 Len=0 TSval=2324609118 TSecr=791236592"
"181","1.687640","192.168.2.2","192.168.1.2","TCP","66","197632","5001  >  45814 [ACK] Seq=1 Ack=202721 Win=197632 Len=0 TSval=2324609142 TSecr=791236624"
"184","1.699670","192.168.2.2","192.168.1.2","TCP","66","203264","5001  >  45814 [ACK] Seq=1 Ack=205617 Win=203264 Len=0 TSval=2324609155 TSecr=791236648"
"186","1.723949","192.168.2.2","192.168.1.2","TCP","66","208896","5001  >  45814 [ACK] Seq=1 Ack=208513 Win=208896 Len=0 TSval=2324609179 TSecr=791236672"
"188","1.748388","192.168.2.2","192.168.1.2","TCP","66","215040","5001  >  45814 [ACK] Seq=1 Ack=211409 Win=215040 Len=0 TSval=2324609203 TSecr=791236672"
"190","1.772515","192.168.2.2","192.168.1.2","TCP","66","220672","5001  >  45814 [ACK] Seq=1 Ack=214305 Win=220672 Len=0 TSval=2324609227 TSecr=791236696"
"192","1.797379","192.168.2.2","192.168.1.2","TCP","66","226304","5001  >  45814 [ACK] Seq=1 Ack=217201 Win=226304 Len=0 TSval=2324609252 TSecr=791236721"
"194","1.820932","192.168.2.2","192.168.1.2","TCP","66","232448","5001  >  45814 [ACK] Seq=1 Ack=220097 Win=232448 Len=0 TSval=2324609276 TSecr=791236745"
"196","1.845425","192.168.2.2","192.168.1.2","TCP","66","235008","5001  >  45814 [ACK] Seq=1 Ack=221545 Win=235008 Len=0 TSval=2324609300 TSecr=791236769"
"198","1.857212","192.168.2.2","192.168.1.2","TCP","66","241152","5001  >  45814 [ACK] Seq=1 Ack=224441 Win=241152 Len=0 TSval=2324609312 TSecr=791236781"
"200","1.881717","192.168.2.2","192.168.1.2","TCP","66","246784","5001  >  45814 [ACK] Seq=1 Ack=227337 Win=246784 Len=0 TSval=2324609336 TSecr=791236805"
"202","1.905606","192.168.2.2","192.168.1.2","TCP","66","252416","5001  >  45814 [ACK] Seq=1 Ack=230233 Win=252416 Len=0 TSval=2324609360 TSecr=791236830"
"204","1.930677","192.168.2.2","192.168.1.2","TCP","66","258560","5001  >  45814 [ACK] Seq=1 Ack=233129 Win=258560 Len=0 TSval=2324609385 TSecr=791236854"
"206","1.954048","192.168.2.2","192.168.1.2","TCP","66","264192","5001  >  45814 [ACK] Seq=1 Ack=236025 Win=264192 Len=0 TSval=2324609409 TSecr=791236878"
"209","1.978254","192.168.2.2","192.168.1.2","TCP","66","269824","5001  >  45814 [ACK] Seq=1 Ack=238921 Win=269824 Len=0 TSval=2324609433 TSecr=791236902"
"211","2.002490","192.168.2.2","192.168.1.2","TCP","66","275968","5001  >  45814 [ACK] Seq=1 Ack=241817 Win=275968 Len=0 TSval=2324609457 TSecr=791236927"
"214","2.026730","192.168.2.2","192.168.1.2","TCP","66","281600","5001  >  45814 [ACK] Seq=1 Ack=244713 Win=281600 Len=0 TSval=2324609481 TSecr=791236950"
"216","2.051226","192.168.2.2","192.168.1.2","TCP","66","284160","5001  >  45814 [ACK] Seq=1 Ack=246161 Win=284160 Len=0 TSval=2324609506 TSecr=791236963"
"218","2.063054","192.168.2.2","192.168.1.2","TCP","66","290304","5001  >  45814 [ACK] Seq=1 Ack=249057 Win=290304 Len=0 TSval=2324609518 TSecr=791236987"
"220","2.087512","192.168.2.2","192.168.1.2","TCP","66","295936","5001  >  45814 [ACK] Seq=1 Ack=251953 Win=295936 Len=0 TSval=2324609542 TSecr=791237011"
"222","2.111493","192.168.2.2","192.168.1.2","TCP","66","301568","5001  >  45814 [ACK] Seq=1 Ack=254849 Win=301568 Len=0 TSval=2324609566 TSecr=791237035"
"224","2.135712","192.168.2.2","192.168.1.2","TCP","66","307712","5001  >  45814 [ACK] Seq=1 Ack=257745 Win=307712 Len=0 TSval=2324609590 TSecr=791237060"
"226","2.160016","192.168.2.2","192.168.1.2","TCP","66","310272","5001  >  45814 [ACK] Seq=1 Ack=259193 Win=310272 Len=0 TSval=2324609615 TSecr=791237078"
"228","2.172757","192.168.2.2","192.168.1.2","TCP","66","316416","5001  >  45814 [ACK] Seq=1 Ack=262089 Win=316416 Len=0 TSval=2324609627 TSecr=791237084"
"230","2.196318","192.168.2.2","192.168.1.2","TCP","66","322048","5001  >  45814 [ACK] Seq=1 Ack=264985 Win=322048 Len=0 TSval=2324609651 TSecr=791237108"
"232","2.221775","192.168.2.2","192.168.1.2","TCP","66","327680","5001  >  45814 [ACK] Seq=1 Ack=267881 Win=327680 Len=0 TSval=2324609676 TSecr=791237144"
"234","2.246729","192.168.2.2","192.168.1.2","TCP","66","333824","5001  >  45814 [ACK] Seq=1 Ack=270777 Win=333824 Len=0 TSval=2324609701 TSecr=791237169"
"236","2.270981","192.168.2.2","192.168.1.2","TCP","66","339456","5001  >  45814 [ACK] Seq=1 Ack=273673 Win=339456 Len=0 TSval=2324609726 TSecr=791237169"
"239","2.295243","192.168.2.2","192.168.1.2","TCP","66","345088","5001  >  45814 [ACK] Seq=1 Ack=276569 Win=345088 Len=0 TSval=2324609750 TSecr=791237205"
"241","2.319725","192.168.2.2","192.168.1.2","TCP","66","351232","5001  >  45814 [ACK] Seq=1 Ack=279465 Win=351232 Len=0 TSval=2324609774 TSecr=791237229"
"243","2.344293","192.168.2.2","192.168.1.2","TCP","66","356864","5001  >  45814 [ACK] Seq=1 Ack=282361 Win=356864 Len=0 TSval=2324609799 TSecr=791237254"
"245","2.367858","192.168.2.2","192.168.1.2","TCP","66","360448","5001  >  45814 [ACK] Seq=1 Ack=285257 Win=360448 Len=0 TSval=2324609822 TSecr=791237290"
"248","2.393455","192.168.2.2","192.168.1.2","TCP","66","360448","5001  >  45814 [ACK] Seq=1 Ack=288153 Win=360448 Len=0 TSval=2324609848 TSecr=791237290"
"250","2.416862","192.168.2.2","192.168.1.2","TCP","66","360960","5001  >  45814 [ACK] Seq=1 Ack=289601 Win=360960 Len=0 TSval=2324609871 TSecr=791237315"
"252","2.428422","192.168.2.2","192.168.1.2","TCP","66","360960","5001  >  45814 [ACK] Seq=1 Ack=292497 Win=360960 Len=0 TSval=2324609883 TSecr=791237327"
"254","2.452677","192.168.2.2","192.168.1.2","TCP","66","360960","5001  >  45814 [ACK] Seq=1 Ack=295393 Win=360960 Len=0 TSval=2324609907 TSecr=791237351"
"256","2.477537","192.168.2.2","192.168.1.2","TCP","66","360960","5001  >  45814 [ACK] Seq=1 Ack=298289 Win=360960 Len=0 TSval=2324609932 TSecr=791237375"
"258","2.502094","192.168.2.2","192.168.1.2","TCP","66","360960","5001  >  45814 [ACK] Seq=1 Ack=301185 Win=360960 Len=0 TSval=2324609957 TSecr=791237399"
"260","2.525568","192.168.2.2","192.168.1.2","TCP","66","360960","5001  >  45814 [ACK] Seq=1 Ack=304081 Win=360960 Len=0 TSval=2324609980 TSecr=791237424"
"262","2.550083","192.168.2.2","192.168.1.2","TCP","66","360960","5001  >  45814 [ACK] Seq=1 Ack=306977 Win=360960 Len=0 TSval=2324610004 TSecr=791237448"
"264","2.574613","192.168.2.2","192.168.1.2","TCP","66","360960","5001  >  45814 [ACK] Seq=1 Ack=309873 Win=360960 Len=0 TSval=2324610029 TSecr=791237472"
"266","2.610859","192.168.2.2","192.168.1.2","TCP","66","360960","5001  >  45814 [ACK] Seq=1 Ack=314217 Win=360960 Len=0 TSval=2324610065 TSecr=791237484"
"269","2.634372","192.168.2.2","192.168.1.2","TCP","66","360960","5001  >  45814 [ACK] Seq=1 Ack=317113 Win=360960 Len=0 TSval=2324610089 TSecr=791237532"
"271","2.658868","192.168.2.2","192.168.1.2","TCP","66","360960","5001  >  45814 [ACK] Seq=1 Ack=320009 Win=360960 Len=0 TSval=2324610113 TSecr=791237557"
"273","2.683380","192.168.2.2","192.168.1.2","TCP","66","360960","5001  >  45814 [ACK] Seq=1 Ack=322905 Win=360960 Len=0 TSval=2324610138 TSecr=791237581"
"275","2.719109","192.168.2.2","192.168.1.2","TCP","66","360960","5001  >  45814 [ACK] Seq=1 Ack=327249 Win=360960 Len=0 TSval=2324610173 TSecr=791237590"
"278","2.743368","192.168.2.2","192.168.1.2","TCP","66","360960","5001  >  45814 [ACK] Seq=1 Ack=330145 Win=360960 Len=0 TSval=2324610198 TSecr=791237629"
"281","2.768314","192.168.2.2","192.168.1.2","TCP","66","360960","5001  >  45814 [ACK] Seq=1 Ack=333041 Win=360960 Len=0 TSval=2324610223 TSecr=791237653"
"283","2.792584","192.168.2.2","192.168.1.2","TCP","66","360960","5001  >  45814 [ACK] Seq=1 Ack=335937 Win=360960 Len=0 TSval=2324610247 TSecr=791237678"
"285","2.817634","192.168.2.2","192.168.1.2","TCP","66","360960","5001  >  45814 [ACK] Seq=1 Ack=338833 Win=360960 Len=0 TSval=2324610272 TSecr=791237690"
"287","2.841000","192.168.2.2","192.168.1.2","TCP","66","360960","5001  >  45814 [ACK] Seq=1 Ack=341729 Win=360960 Len=0 TSval=2324610295 TSecr=791237714"
"289","2.865687","192.168.2.2","192.168.1.2","TCP","66","360960","5001  >  45814 [ACK] Seq=1 Ack=344625 Win=360960 Len=0 TSval=2324610320 TSecr=791237738"
"291","2.890174","192.168.2.2","192.168.1.2","TCP","66","360960","5001  >  45814 [ACK] Seq=1 Ack=347521 Win=360960 Len=0 TSval=2324610344 TSecr=791237762"
"293","2.925810","192.168.2.2","192.168.1.2","TCP","66","360960","5001  >  45814 [ACK] Seq=1 Ack=351865 Win=360960 Len=0 TSval=2324610380 TSecr=791237787"
"296","2.950006","192.168.2.2","192.168.1.2","TCP","66","360960","5001  >  45814 [ACK] Seq=1 Ack=354761 Win=360960 Len=0 TSval=2324610404 TSecr=791237823"
"298","2.974424","192.168.2.2","192.168.1.2","TCP","66","360960","5001  >  45814 [ACK] Seq=1 Ack=357657 Win=360960 Len=0 TSval=2324610429 TSecr=791237848"
"300","2.998957","192.168.2.2","192.168.1.2","TCP","66","360960","5001  >  45814 [ACK] Seq=1 Ack=360553 Win=360960 Len=0 TSval=2324610453 TSecr=791237873"
"303","3.022769","192.168.2.2","192.168.1.2","TCP","66","360960","5001  >  45814 [ACK] Seq=1 Ack=363449 Win=360960 Len=0 TSval=2324610477 TSecr=791237898"
"305","3.047034","192.168.2.2","192.168.1.2","TCP","66","360960","5001  >  45814 [ACK] Seq=1 Ack=366345 Win=360960 Len=0 TSval=2324610501 TSecr=791237922"
"307","3.071457","192.168.2.2","192.168.1.2","TCP","66","360960","5001  >  45814 [ACK] Seq=1 Ack=369241 Win=360960 Len=0 TSval=2324610526 TSecr=791237946"
"309","3.095380","192.168.2.2","192.168.1.2","TCP","66","360960","5001  >  45814 [ACK] Seq=1 Ack=372137 Win=360960 Len=0 TSval=2324610550 TSecr=791237971"
"311","3.119757","192.168.2.2","192.168.1.2","TCP","66","360960","5001  >  45814 [ACK] Seq=1 Ack=375033 Win=360960 Len=0 TSval=2324610574 TSecr=791237994"
"313","3.155932","192.168.2.2","192.168.1.2","TCP","66","360960","5001  >  45814 [ACK] Seq=1 Ack=379377 Win=360960 Len=0 TSval=2324610610 TSecr=791237994"
"316","3.192273","192.168.2.2","192.168.1.2","TCP","66","360960","5001  >  45814 [ACK] Seq=1 Ack=383721 Win=360960 Len=0 TSval=2324610646 TSecr=791238043"
"318","3.216519","192.168.2.2","192.168.1.2","TCP","66","360960","5001  >  45814 [ACK] Seq=1 Ack=386617 Win=360960 Len=0 TSval=2324610671 TSecr=791238079"
"320","3.240985","192.168.2.2","192.168.1.2","TCP","66","360960","5001  >  45814 [ACK] Seq=1 Ack=389513 Win=360960 Len=0 TSval=2324610695 TSecr=791238104"
"323","3.265519","192.168.2.2","192.168.1.2","TCP","66","360960","5001  >  45814 [ACK] Seq=1 Ack=392409 Win=360960 Len=0 TSval=2324610720 TSecr=791238129"
"325","3.289159","192.168.2.2","192.168.1.2","TCP","66","360960","5001  >  45814 [ACK] Seq=1 Ack=395305 Win=360960 Len=0 TSval=2324610743 TSecr=791238152"
"327","3.313402","192.168.2.2","192.168.1.2","TCP","66","360960","5001  >  45814 [ACK] Seq=1 Ack=398201 Win=360960 Len=0 TSval=2324610767 TSecr=791238177"
"329","3.338040","192.168.2.2","192.168.1.2","TCP","66","360960","5001  >  45814 [ACK] Seq=1 Ack=401097 Win=360960 Len=0 TSval=2324610792 TSecr=791238201"
"331","3.361846","192.168.2.2","192.168.1.2","TCP","66","360960","5001  >  45814 [ACK] Seq=1 Ack=403993 Win=360960 Len=0 TSval=2324610816 TSecr=791238237"
"333","3.386061","192.168.2.2","192.168.1.2","TCP","66","360960","5001  >  45814 [ACK] Seq=1 Ack=406889 Win=360960 Len=0 TSval=2324610840 TSecr=791238237"
"335","3.410307","192.168.2.2","192.168.1.2","TCP","66","360960","5001  >  45814 [ACK] Seq=1 Ack=409785 Win=360960 Len=0 TSval=2324610864 TSecr=791238261"
"337","3.435102","192.168.2.2","192.168.1.2","TCP","66","360960","5001  >  45814 [ACK] Seq=1 Ack=412681 Win=360960 Len=0 TSval=2324610889 TSecr=791238285"
"339","3.458748","192.168.2.2","192.168.1.2","TCP","66","360960","5001  >  45814 [ACK] Seq=1 Ack=415577 Win=360960 Len=0 TSval=2324610913 TSecr=791238310"
"341","3.483092","192.168.2.2","192.168.1.2","TCP","66","360960","5001  >  45814 [ACK] Seq=1 Ack=418473 Win=360960 Len=0 TSval=2324610937 TSecr=791238345"
"344","3.519379","192.168.2.2","192.168.1.2","TCP","66","360960","5001  >  45814 [ACK] Seq=1 Ack=422817 Win=360960 Len=0 TSval=2324610973 TSecr=791238345"
"346","3.543853","192.168.2.2","192.168.1.2","TCP","66","360960","5001  >  45814 [ACK] Seq=1 Ack=425713 Win=360960 Len=0 TSval=2324610998 TSecr=791238395"
"348","3.568378","192.168.2.2","192.168.1.2","TCP","66","360960","5001  >  45814 [ACK] Seq=1 Ack=428609 Win=360960 Len=0 TSval=2324611022 TSecr=791238419"
"350","3.591972","192.168.2.2","192.168.1.2","TCP","66","360960","5001  >  45814 [ACK] Seq=1 Ack=431505 Win=360960 Len=0 TSval=2324611046 TSecr=791238444"
"353","3.616198","192.168.2.2","192.168.1.2","TCP","66","360960","5001  >  45814 [ACK] Seq=1 Ack=434401 Win=360960 Len=0 TSval=2324611070 TSecr=791238467"
"355","3.640884","192.168.2.2","192.168.1.2","TCP","66","360960","5001  >  45814 [ACK] Seq=1 Ack=437297 Win=360960 Len=0 TSval=2324611095 TSecr=791238492"
"357","3.664625","192.168.2.2","192.168.1.2","TCP","66","360960","5001  >  45814 [ACK] Seq=1 Ack=440193 Win=360960 Len=0 TSval=2324611118 TSecr=791238516"
"359","3.688905","192.168.2.2","192.168.1.2","TCP","66","360960","5001  >  45814 [ACK] Seq=1 Ack=443089 Win=360960 Len=0 TSval=2324611143 TSecr=791238552"
"361","3.713398","192.168.2.2","192.168.1.2","TCP","66","360960","5001  >  45814 [ACK] Seq=1 Ack=445985 Win=360960 Len=0 TSval=2324611167 TSecr=791238552"
"363","3.737872","192.168.2.2","192.168.1.2","TCP","66","360960","5001  >  45814 [ACK] Seq=1 Ack=448881 Win=360960 Len=0 TSval=2324611192 TSecr=791238576"
"365","3.761519","192.168.2.2","192.168.1.2","TCP","66","360960","5001  >  45814 [ACK] Seq=1 Ack=451777 Win=360960 Len=0 TSval=2324611215 TSecr=791238601"
"367","3.785918","192.168.2.2","192.168.1.2","TCP","66","360960","5001  >  45814 [ACK] Seq=1 Ack=454673 Win=360960 Len=0 TSval=2324611240 TSecr=791238625"
"370","3.810775","192.168.2.2","192.168.1.2","TCP","66","360960","5001  >  45814 [ACK] Seq=1 Ack=457569 Win=360960 Len=0 TSval=2324611265 TSecr=791238649"
"372","3.834998","192.168.2.2","192.168.1.2","TCP","66","360960","5001  >  45814 [ACK] Seq=1 Ack=460465 Win=360960 Len=0 TSval=2324611289 TSecr=791238673"
"374","3.859429","192.168.2.2","192.168.1.2","TCP","66","360960","5001  >  45814 [ACK] Seq=1 Ack=463361 Win=360960 Len=0 TSval=2324611313 TSecr=791238698"
"376","3.883998","192.168.2.2","192.168.1.2","TCP","66","360960","5001  >  45814 [ACK] Seq=1 Ack=466257 Win=360960 Len=0 TSval=2324611338 TSecr=791238722"
"378","3.907674","192.168.2.2","192.168.1.2","TCP","66","360960","5001  >  45814 [ACK] Seq=1 Ack=469153 Win=360960 Len=0 TSval=2324611361 TSecr=791238746"
"380","3.931992","192.168.2.2","192.168.1.2","TCP","66","360960","5001  >  45814 [ACK] Seq=1 Ack=472049 Win=360960 Len=0 TSval=2324611386 TSecr=791238782"
"382","3.956440","192.168.2.2","192.168.1.2","TCP","66","360960","5001  >  45814 [ACK] Seq=1 Ack=474945 Win=360960 Len=0 TSval=2324611410 TSecr=791238782"
"385","3.980934","192.168.2.2","192.168.1.2","TCP","66","360960","5001  >  45814 [ACK] Seq=1 Ack=477841 Win=360960 Len=0 TSval=2324611435 TSecr=791238818"
"388","4.004525","192.168.2.2","192.168.1.2","TCP","66","360960","5001  >  45814 [ACK] Seq=1 Ack=480737 Win=360960 Len=0 TSval=2324611458 TSecr=791238843"
"390","4.028968","192.168.2.2","192.168.1.2","TCP","66","360960","5001  >  45814 [ACK] Seq=1 Ack=483633 Win=360960 Len=0 TSval=2324611483 TSecr=791238867"
"392","4.053480","192.168.2.2","192.168.1.2","TCP","66","360960","5001  >  45814 [ACK] Seq=1 Ack=486529 Win=360960 Len=0 TSval=2324611507 TSecr=791238867"
"394","4.077998","192.168.2.2","192.168.1.2","TCP","66","360960","5001  >  45814 [ACK] Seq=1 Ack=489425 Win=360960 Len=0 TSval=2324611532 TSecr=791238892"
"396","4.101594","192.168.2.2","192.168.1.2","TCP","66","360960","5001  >  45814 [ACK] Seq=1 Ack=492321 Win=360960 Len=0 TSval=2324611555 TSecr=791238915"
"398","4.126001","192.168.2.2","192.168.1.2","TCP","66","360960","5001  >  45814 [ACK] Seq=1 Ack=495217 Win=360960 Len=0 TSval=2324611580 TSecr=791238939"
"400","4.150506","192.168.2.2","192.168.1.2","TCP","66","360960","5001  >  45814 [ACK] Seq=1 Ack=498113 Win=360960 Len=0 TSval=2324611604 TSecr=791238964"
"402","4.174122","192.168.2.2","192.168.1.2","TCP","66","360960","5001  >  45814 [ACK] Seq=1 Ack=501009 Win=360960 Len=0 TSval=2324611628 TSecr=791238988"
"404","4.198515","192.168.2.2","192.168.1.2","TCP","66","360960","5001  >  45814 [ACK] Seq=1 Ack=503905 Win=360960 Len=0 TSval=2324611652 TSecr=791239012"
"407","4.223033","192.168.2.2","192.168.1.2","TCP","66","360960","5001  >  45814 [ACK] Seq=1 Ack=506801 Win=360960 Len=0 TSval=2324611677 TSecr=791239036"
"409","4.247538","192.168.2.2","192.168.1.2","TCP","66","360960","5001  >  45814 [ACK] Seq=1 Ack=509697 Win=360960 Len=0 TSval=2324611701 TSecr=791239061"
"411","4.271059","192.168.2.2","192.168.1.2","TCP","66","360960","5001  >  45814 [ACK] Seq=1 Ack=512593 Win=360960 Len=0 TSval=2324611725 TSecr=791239085"
"413","4.295528","192.168.2.2","192.168.1.2","TCP","66","360960","5001  >  45814 [ACK] Seq=1 Ack=515489 Win=360960 Len=0 TSval=2324611749 TSecr=791239109"
"415","4.331585","192.168.2.2","192.168.1.2","TCP","66","360960","5001  >  45814 [ACK] Seq=1 Ack=519833 Win=360960 Len=0 TSval=2324611785 TSecr=791239125"
"417","4.356314","192.168.2.2","192.168.1.2","TCP","66","360960","5001  >  45814 [ACK] Seq=1 Ack=522729 Win=360960 Len=0 TSval=2324611810 TSecr=791239170"
"419","4.380014","192.168.2.2","192.168.1.2","TCP","66","360960","5001  >  45814 [ACK] Seq=1 Ack=525625 Win=360960 Len=0 TSval=2324611834 TSecr=791239194"
"421","4.404293","192.168.2.2","192.168.1.2","TCP","66","360960","5001  >  45814 [ACK] Seq=1 Ack=528521 Win=360960 Len=0 TSval=2324611858 TSecr=791239218"
"423","4.440638","192.168.2.2","192.168.1.2","TCP","66","360960","5001  >  45814 [ACK] Seq=1 Ack=532865 Win=360960 Len=0 TSval=2324611894 TSecr=791239218"
"426","4.465068","192.168.2.2","192.168.1.2","TCP","66","360960","5001  >  45814 [ACK] Seq=1 Ack=535761 Win=360960 Len=0 TSval=2324611919 TSecr=791239267"
"428","4.489582","192.168.2.2","192.168.1.2","TCP","66","360960","5001  >  45814 [ACK] Seq=1 Ack=538657 Win=360960 Len=0 TSval=2324611943 TSecr=791239291"
"430","4.514091","192.168.2.2","192.168.1.2","TCP","66","360960","5001  >  45814 [ACK] Seq=1 Ack=541553 Win=360960 Len=0 TSval=2324611968 TSecr=791239315"
"433","4.537619","192.168.2.2","192.168.1.2","TCP","66","360960","5001  >  45814 [ACK] Seq=1 Ack=544449 Win=360960 Len=0 TSval=2324611991 TSecr=791239339"
"435","4.562090","192.168.2.2","192.168.1.2","TCP","66","360960","5001  >  45814 [ACK] Seq=1 Ack=547345 Win=360960 Len=0 TSval=2324612015 TSecr=791239364"
"437","4.585936","192.168.2.2","192.168.1.2","TCP","66","360960","5001  >  45814 [ACK] Seq=1 Ack=550241 Win=360960 Len=0 TSval=2324612039 TSecr=791239387"
"439","4.610160","192.168.2.2","192.168.1.2","TCP","66","360960","5001  >  45814 [ACK] Seq=1 Ack=553137 Win=360960 Len=0 TSval=2324612064 TSecr=791239412"
"441","4.634655","192.168.2.2","192.168.1.2","TCP","66","360960","5001  >  45814 [ACK] Seq=1 Ack=556033 Win=360960 Len=0 TSval=2324612088 TSecr=791239437"
"443","4.658733","192.168.2.2","192.168.1.2","TCP","66","360960","5001  >  45814 [ACK] Seq=1 Ack=558929 Win=360960 Len=0 TSval=2324612112 TSecr=791239461"
"445","4.682906","192.168.2.2","192.168.1.2","TCP","66","360960","5001  >  45814 [ACK] Seq=1 Ack=561825 Win=360960 Len=0 TSval=2324612136 TSecr=791239485"
"447","4.707168","192.168.2.2","192.168.1.2","TCP","66","360960","5001  >  45814 [ACK] Seq=1 Ack=564721 Win=360960 Len=0 TSval=2324612160 TSecr=791239510"
"450","4.731625","192.168.2.2","192.168.1.2","TCP","66","360960","5001  >  45814 [ACK] Seq=1 Ack=567617 Win=360960 Len=0 TSval=2324612185 TSecr=791239533"
"452","4.756180","192.168.2.2","192.168.1.2","TCP","66","360960","5001  >  45814 [ACK] Seq=1 Ack=570513 Win=360960 Len=0 TSval=2324612209 TSecr=791239558"
"454","4.779711","192.168.2.2","192.168.1.2","TCP","66","360960","5001  >  45814 [ACK] Seq=1 Ack=573409 Win=360960 Len=0 TSval=2324612233 TSecr=791239582"
"456","4.804187","192.168.2.2","192.168.1.2","TCP","66","360960","5001  >  45814 [ACK] Seq=1 Ack=576305 Win=360960 Len=0 TSval=2324612257 TSecr=791239582"
"458","4.828309","192.168.2.2","192.168.1.2","TCP","66","360960","5001  >  45814 [ACK] Seq=1 Ack=579201 Win=360960 Len=0 TSval=2324612282 TSecr=791239607"
"462","4.853421","192.168.2.2","192.168.1.2","TCP","66","360960","5001  >  45814 [ACK] Seq=1 Ack=582097 Win=360960 Len=0 TSval=2324612307 TSecr=791239630"
"464","4.877705","192.168.2.2","192.168.1.2","TCP","66","360960","5001  >  45814 [ACK] Seq=1 Ack=584993 Win=360960 Len=0 TSval=2324612331 TSecr=791239655"
"466","4.901716","192.168.2.2","192.168.1.2","TCP","66","360960","5001  >  45814 [ACK] Seq=1 Ack=587889 Win=360960 Len=0 TSval=2324612355 TSecr=791239679"
"468","4.926268","192.168.2.2","192.168.1.2","TCP","66","360960","5001  >  45814 [ACK] Seq=1 Ack=590785 Win=360960 Len=0 TSval=2324612379 TSecr=791239704"
"471","4.950199","192.168.2.2","192.168.1.2","TCP","66","360960","5001  >  45814 [ACK] Seq=1 Ack=593681 Win=360960 Len=0 TSval=2324612403 TSecr=791239727"
"473","4.986462","192.168.2.2","192.168.1.2","TCP","66","360960","5001  >  45814 [ACK] Seq=1 Ack=598025 Win=360960 Len=0 TSval=2324612440 TSecr=791239752"
"476","5.010988","192.168.2.2","192.168.1.2","TCP","66","360960","5001  >  45814 [ACK] Seq=1 Ack=600921 Win=360960 Len=0 TSval=2324612464 TSecr=791239800"
"479","5.035510","192.168.2.2","192.168.1.2","TCP","66","360960","5001  >  45814 [ACK] Seq=1 Ack=603817 Win=360960 Len=0 TSval=2324612489 TSecr=791239824"
"481","5.059999","192.168.2.2","192.168.1.2","TCP","66","360960","5001  >  45814 [ACK] Seq=1 Ack=606713 Win=360960 Len=0 TSval=2324612513 TSecr=791239824"
"483","5.083568","192.168.2.2","192.168.1.2","TCP","66","360960","5001  >  45814 [ACK] Seq=1 Ack=609609 Win=360960 Len=0 TSval=2324612537 TSecr=791239849"
"487","5.107536","192.168.2.2","192.168.1.2","TCP","66","360960","5001  >  45814 [ACK] Seq=1 Ack=612505 Win=360960 Len=0 TSval=2324612561 TSecr=791239873"
"490","5.131742","192.168.2.2","192.168.1.2","TCP","66","360960","5001  >  45814 [ACK] Seq=1 Ack=615401 Win=360960 Len=0 TSval=2324612585 TSecr=791239897"
"492","5.156033","192.168.2.2","192.168.1.2","TCP","66","360960","5001  >  45814 [ACK] Seq=1 Ack=618297 Win=360960 Len=0 TSval=2324612609 TSecr=791239921"
"494","5.180540","192.168.2.2","192.168.1.2","TCP","66","360960","5001  >  45814 [ACK] Seq=1 Ack=621193 Win=360960 Len=0 TSval=2324612634 TSecr=791239957"
"496","5.205016","192.168.2.2","192.168.1.2","TCP","66","360960","5001  >  45814 [ACK] Seq=1 Ack=624089 Win=360960 Len=0 TSval=2324612658 TSecr=791239982"
"498","5.229527","192.168.2.2","192.168.1.2","TCP","66","360960","5001  >  45814 [ACK] Seq=1 Ack=626985 Win=360960 Len=0 TSval=2324612683 TSecr=791240006"
"500","5.253014","192.168.2.2","192.168.1.2","TCP","66","360960","5001  >  45814 [ACK] Seq=1 Ack=629881 Win=360960 Len=0 TSval=2324612706 TSecr=791240030"
"503","5.277084","192.168.2.2","192.168.1.2","TCP","66","360960","5001  >  45814 [ACK] Seq=1 Ack=632777 Win=360960 Len=0 TSval=2324612730 TSecr=791240066"
"505","5.302153","192.168.2.2","192.168.1.2","TCP","66","360960","5001  >  45814 [ACK] Seq=1 Ack=635673 Win=360960 Len=0 TSval=2324612755 TSecr=791240066"
"507","5.325562","192.168.2.2","192.168.1.2","TCP","66","360960","5001  >  45814 [ACK] Seq=1 Ack=638569 Win=360960 Len=0 TSval=2324612779 TSecr=791240091"
"509","5.350090","192.168.2.2","192.168.1.2","TCP","66","360960","5001  >  45814 [ACK] Seq=1 Ack=641465 Win=360960 Len=0 TSval=2324612803 TSecr=791240115"
"512","5.373999","192.168.2.2","192.168.1.2","TCP","66","360960","5001  >  45814 [ACK] Seq=1 Ack=644361 Win=360960 Len=0 TSval=2324612827 TSecr=791240140"
"514","5.410894","192.168.2.2","192.168.1.2","TCP","66","360960","5001  >  45814 [ACK] Seq=1 Ack=648705 Win=360960 Len=0 TSval=2324612864 TSecr=791240148"
"517","5.435347","192.168.2.2","192.168.1.2","TCP","66","360960","5001  >  45814 [ACK] Seq=1 Ack=651601 Win=360960 Len=0 TSval=2324612888 TSecr=791240188"
"519","5.458864","192.168.2.2","192.168.1.2","TCP","66","360960","5001  >  45814 [ACK] Seq=1 Ack=654497 Win=360960 Len=0 TSval=2324612912 TSecr=791240211"
"522","5.483360","192.168.2.2","192.168.1.2","TCP","66","360960","5001  >  45814 [ACK] Seq=1 Ack=657393 Win=360960 Len=0 TSval=2324612936 TSecr=791240236"
"524","5.507227","192.168.2.2","192.168.1.2","TCP","66","360960","5001  >  45814 [ACK] Seq=1 Ack=660289 Win=360960 Len=0 TSval=2324612960 TSecr=791240260"
"526","5.531442","192.168.2.2","192.168.1.2","TCP","66","360960","5001  >  45814 [ACK] Seq=1 Ack=663185 Win=360960 Len=0 TSval=2324612984 TSecr=791240284"
"529","5.555907","192.168.2.2","192.168.1.2","TCP","66","360960","5001  >  45814 [ACK] Seq=1 Ack=666081 Win=360960 Len=0 TSval=2324613009 TSecr=791240308"
"531","5.579888","192.168.2.2","192.168.1.2","TCP","66","360960","5001  >  45814 [ACK] Seq=1 Ack=668977 Win=360960 Len=0 TSval=2324613033 TSecr=791240333"
"533","5.604150","192.168.2.2","192.168.1.2","TCP","66","360960","5001  >  45814 [ACK] Seq=1 Ack=671873 Win=360960 Len=0 TSval=2324613057 TSecr=791240333"
"535","5.628449","192.168.2.2","192.168.1.2","TCP","66","360960","5001  >  45814 [ACK] Seq=1 Ack=674769 Win=360960 Len=0 TSval=2324613081 TSecr=791240357"
"537","5.652595","192.168.2.2","192.168.1.2","TCP","66","360960","5001  >  45814 [ACK] Seq=1 Ack=677665 Win=360960 Len=0 TSval=2324613105 TSecr=791240382"
"540","5.677416","192.168.2.2","192.168.1.2","TCP","66","360960","5001  >  45814 [ACK] Seq=1 Ack=680561 Win=360960 Len=0 TSval=2324613130 TSecr=791240405"
"542","5.701039","192.168.2.2","192.168.1.2","TCP","66","360960","5001  >  45814 [ACK] Seq=1 Ack=683457 Win=360960 Len=0 TSval=2324613154 TSecr=791240429"
"544","5.725252","192.168.2.2","192.168.1.2","TCP","66","360960","5001  >  45814 [ACK] Seq=1 Ack=686353 Win=360960 Len=0 TSval=2324613178 TSecr=791240454"
"546","5.749914","192.168.2.2","192.168.1.2","TCP","66","360960","5001  >  45814 [ACK] Seq=1 Ack=689249 Win=360960 Len=0 TSval=2324613203 TSecr=791240479"
"548","5.773698","192.168.2.2","192.168.1.2","TCP","66","360960","5001  >  45814 [ACK] Seq=1 Ack=692145 Win=360960 Len=0 TSval=2324613226 TSecr=791240503"
"551","5.797972","192.168.2.2","192.168.1.2","TCP","66","360960","5001  >  45814 [ACK] Seq=1 Ack=695041 Win=360960 Len=0 TSval=2324613251 TSecr=791240527"
"553","5.822436","192.168.2.2","192.168.1.2","TCP","66","360960","5001  >  45814 [ACK] Seq=1 Ack=697937 Win=360960 Len=0 TSval=2324613275 TSecr=791240552"
"555","5.846957","192.168.2.2","192.168.1.2","TCP","66","360960","5001  >  45814 [ACK] Seq=1 Ack=700833 Win=360960 Len=0 TSval=2324613300 TSecr=791240552"
"557","5.870571","192.168.2.2","192.168.1.2","TCP","66","360960","5001  >  45814 [ACK] Seq=1 Ack=703729 Win=360960 Len=0 TSval=2324613323 TSecr=791240575"
"560","5.894985","192.168.2.2","192.168.1.2","TCP","66","360960","5001  >  45814 [ACK] Seq=1 Ack=706625 Win=360960 Len=0 TSval=2324613348 TSecr=791240612"
"563","5.919793","192.168.2.2","192.168.1.2","TCP","66","360960","5001  >  45814 [ACK] Seq=1 Ack=709521 Win=360960 Len=0 TSval=2324613373 TSecr=791240636"
"565","5.944020","192.168.2.2","192.168.1.2","TCP","66","360960","5001  >  45814 [ACK] Seq=1 Ack=712417 Win=360960 Len=0 TSval=2324613397 TSecr=791240636"
"567","5.968481","192.168.2.2","192.168.1.2","TCP","66","360960","5001  >  45814 [ACK] Seq=1 Ack=715313 Win=360960 Len=0 TSval=2324613421 TSecr=791240661"
"570","5.993382","192.168.2.2","192.168.1.2","TCP","66","360960","5001  >  45814 [ACK] Seq=1 Ack=718209 Win=360960 Len=0 TSval=2324613446 TSecr=791240685"
"573","6.016714","192.168.2.2","192.168.1.2","TCP","66","360960","5001  >  45814 [ACK] Seq=1 Ack=721105 Win=360960 Len=0 TSval=2324613469 TSecr=791240709"
"576","6.041280","192.168.2.2","192.168.1.2","TCP","66","360960","5001  >  45814 [ACK] Seq=1 Ack=724001 Win=360960 Len=0 TSval=2324613494 TSecr=791240733"
"578","6.077635","192.168.2.2","192.168.1.2","TCP","66","360960","5001  >  45814 [ACK] Seq=1 Ack=728345 Win=360960 Len=0 TSval=2324613530 TSecr=791240733"
"581","6.101876","192.168.2.2","192.168.1.2","TCP","66","360960","5001  >  45814 [ACK] Seq=1 Ack=731241 Win=360960 Len=0 TSval=2324613554 TSecr=791240781"
"583","6.126059","192.168.2.2","192.168.1.2","TCP","66","360960","5001  >  45814 [ACK] Seq=1 Ack=734137 Win=360960 Len=0 TSval=2324613579 TSecr=791240806"
"585","6.150347","192.168.2.2","192.168.1.2","TCP","66","360960","5001  >  45814 [ACK] Seq=1 Ack=737033 Win=360960 Len=0 TSval=2324613603 TSecr=791240830"
"587","6.174585","192.168.2.2","192.168.1.2","TCP","66","360960","5001  >  45814 [ACK] Seq=1 Ack=739929 Win=360960 Len=0 TSval=2324613627 TSecr=791240855"
"590","6.199742","192.168.2.2","192.168.1.2","TCP","66","360960","5001  >  45814 [ACK] Seq=1 Ack=742825 Win=360960 Len=0 TSval=2324613652 TSecr=791240878"
"592","6.223289","192.168.2.2","192.168.1.2","TCP","66","360960","5001  >  45814 [ACK] Seq=1 Ack=745721 Win=360960 Len=0 TSval=2324613676 TSecr=791240878"
"594","6.247166","192.168.2.2","192.168.1.2","TCP","66","360960","5001  >  45814 [ACK] Seq=1 Ack=748617 Win=360960 Len=0 TSval=2324613700 TSecr=791240902"
"596","6.271406","192.168.2.2","192.168.1.2","TCP","66","360960","5001  >  45814 [ACK] Seq=1 Ack=751513 Win=360960 Len=0 TSval=2324613724 TSecr=791240927"
"599","6.295779","192.168.2.2","192.168.1.2","TCP","66","360960","5001  >  45814 [ACK] Seq=1 Ack=754409 Win=360960 Len=0 TSval=2324613748 TSecr=791240951"
"601","6.319876","192.168.2.2","192.168.1.2","TCP","66","360960","5001  >  45814 [ACK] Seq=1 Ack=757305 Win=360960 Len=0 TSval=2324613772 TSecr=791240975"
"603","6.344871","192.168.2.2","192.168.1.2","TCP","66","360960","5001  >  45814 [ACK] Seq=1 Ack=760201 Win=360960 Len=0 TSval=2324613797 TSecr=791240999"
"605","6.369381","192.168.2.2","192.168.1.2","TCP","66","360960","5001  >  45814 [ACK] Seq=1 Ack=763097 Win=360960 Len=0 TSval=2324613822 TSecr=791241036"
