"No.","Time","Source","Destination","Protocol","Length","Calculated window size","Info"
"4","0.000342","192.168.2.2","192.168.1.2","TCP","74","43440","5001  >  45662 [SYN, ACK] Seq=0 Ack=1 Win=43440 Len=0 MSS=1460 SACK_PERM=1 TSval=2321328122 TSecr=787956294 WS=512"
"7","0.000383","192.168.2.2","192.168.1.2","TCP","66","39936","5001  >  45662 [ACK] Seq=1 Ack=7241 Win=39936 Len=0 TSval=2321328122 TSecr=787956294"
"12","0.049909","192.168.2.2","192.168.1.2","TCP","66","39936","5001  >  45662 [ACK] Seq=1 Ack=14481 Win=39936 Len=0 TSval=2321328172 TSecr=787956294"
"14","0.110282","192.168.2.2","192.168.1.2","TCP","66","39936","5001  >  45662 [ACK] Seq=1 Ack=21721 Win=39936 Len=0 TSval=2321328232 TSecr=787956294"
"16","0.171321","192.168.2.2","192.168.1.2","TCP","66","42496","5001  >  45662 [ACK] Seq=1 Ack=23169 Win=42496 Len=0 TSval=2321328293 TSecr=787956306"
"17","0.182963","192.168.2.2","192.168.1.2","TCP","66","42496","5001  >  45662 [ACK] Seq=1 Ack=24617 Win=42496 Len=0 TSval=2321328305 TSecr=787956370"
"19","0.195871","192.168.2.2","192.168.1.2","TCP","66","42496","5001  >  45662 [ACK] Seq=1 Ack=26065 Win=42496 Len=0 TSval=2321328318 TSecr=787956454"
"21","0.207578","192.168.2.2","192.168.1.2","TCP","66","42496","5001  >  45662 [ACK] Seq=1 Ack=27513 Win=42496 Len=0 TSval=2321328329 TSecr=787956477"
"24","0.219412","192.168.2.2","192.168.1.2","TCP","66","42496","5001  >  45662 [ACK] Seq=1 Ack=28961 Win=42496 Len=0 TSval=2321328341 TSecr=787956490"
"26","0.232111","192.168.2.2","192.168.1.2","TCP","66","42496","5001  >  45662 [ACK] Seq=1 Ack=30409 Win=42496 Len=0 TSval=2321328354 TSecr=787956501"
"28","0.243503","192.168.2.2","192.168.1.2","TCP","66","42496","5001  >  45662 [ACK] Seq=1 Ack=31857 Win=42496 Len=0 TSval=2321328365 TSecr=787956501"
"30","0.255619","192.168.2.2","192.168.1.2","TCP","66","42496","5001  >  45662 [ACK] Seq=1 Ack=33305 Win=42496 Len=0 TSval=2321328377 TSecr=787956513"
"32","0.268315","192.168.2.2","192.168.1.2","TCP","66","42496","5001  >  45662 [ACK] Seq=1 Ack=34753 Win=42496 Len=0 TSval=2321328390 TSecr=787956526"
"34","0.280096","192.168.2.2","192.168.1.2","TCP","66","42496","5001  >  45662 [ACK] Seq=1 Ack=36201 Win=42496 Len=0 TSval=2321328402 TSecr=787956537"
"36","0.292811","192.168.2.2","192.168.1.2","TCP","66","41984","5001  >  45662 [ACK] Seq=1 Ack=39097 Win=41984 Len=0 TSval=2321328415 TSecr=787956549"
"38","0.316213","192.168.2.2","192.168.1.2","TCP","66","42496","5001  >  45662 [ACK] Seq=1 Ack=40545 Win=42496 Len=0 TSval=2321328438 TSecr=787956562"
"40","0.340841","192.168.2.2","192.168.1.2","TCP","66","42496","5001  >  45662 [ACK] Seq=1 Ack=43441 Win=42496 Len=0 TSval=2321328463 TSecr=787956574"
"42","0.352578","192.168.2.2","192.168.1.2","TCP","66","42496","5001  >  45662 [ACK] Seq=1 Ack=46337 Win=42496 Len=0 TSval=2321328474 TSecr=787956610"
"46","0.376765","192.168.2.2","192.168.1.2","TCP","66","42496","5001  >  45662 [ACK] Seq=1 Ack=49233 Win=42496 Len=0 TSval=2321328499 TSecr=787956635"
"48","0.401007","192.168.2.2","192.168.1.2","TCP","66","42496","5001  >  45662 [ACK] Seq=1 Ack=52129 Win=42496 Len=0 TSval=2321328523 TSecr=787956646"
"50","0.437830","192.168.2.2","192.168.1.2","TCP","66","42496","5001  >  45662 [ACK] Seq=1 Ack=56473 Win=42496 Len=0 TSval=2321328560 TSecr=787956646"
"52","0.462296","192.168.2.2","192.168.1.2","TCP","66","42496","5001  >  45662 [ACK] Seq=1 Ack=59369 Win=42496 Len=0 TSval=2321328584 TSecr=787956695"
"54","0.486512","192.168.2.2","192.168.1.2","TCP","66","42496","5001  >  45662 [ACK] Seq=1 Ack=62265 Win=42496 Len=0 TSval=2321328608 TSecr=787956732"
"56","0.511295","192.168.2.2","192.168.1.2","TCP","66","42496","5001  >  45662 [ACK] Seq=1 Ack=65161 Win=42496 Len=0 TSval=2321328633 TSecr=787956756"
"59","0.534948","192.168.2.2","192.168.1.2","TCP","66","42496","5001  >  45662 [ACK] Seq=1 Ack=68057 Win=42496 Len=0 TSval=2321328657 TSecr=787956780"
"63","0.559284","192.168.2.2","192.168.1.2","TCP","66","42496","5001  >  45662 [ACK] Seq=1 Ack=70953 Win=42496 Len=0 TSval=2321328681 TSecr=787956805"
"65","0.583427","192.168.2.2","192.168.1.2","TCP","66","42496","5001  >  45662 [ACK] Seq=1 Ack=73849 Win=42496 Len=0 TSval=2321328705 TSecr=787956805"
"68","0.607640","192.168.2.2","192.168.1.2","TCP","66","42496","5001  >  45662 [ACK] Seq=1 Ack=76745 Win=42496 Len=0 TSval=2321328729 TSecr=787956829"
"70","0.631847","192.168.2.2","192.168.1.2","TCP","66","42496","5001  >  45662 [ACK] Seq=1 Ack=79641 Win=42496 Len=0 TSval=2321328754 TSecr=787956853"
"72","0.656271","192.168.2.2","192.168.1.2","TCP","66","42496","5001  >  45662 [ACK] Seq=1 Ack=82537 Win=42496 Len=0 TSval=2321328778 TSecr=787956877"
"74","0.680741","192.168.2.2","192.168.1.2","TCP","66","42496","5001  >  45662 [ACK] Seq=1 Ack=85433 Win=42496 Len=0 TSval=2321328802 TSecr=787956901"
"76","0.717013","192.168.2.2","192.168.1.2","TCP","66","42496","5001  >  45662 [ACK] Seq=1 Ack=89777 Win=42496 Len=0 TSval=2321328839 TSecr=787956926"
"79","0.741525","192.168.2.2","192.168.1.2","TCP","66","42496","5001  >  45662 [ACK] Seq=1 Ack=92673 Win=42496 Len=0 TSval=2321328863 TSecr=787956975"
"82","0.765184","192.168.2.2","192.168.1.2","TCP","66","42496","5001  >  45662 [ACK] Seq=1 Ack=95569 Win=42496 Len=0 TSval=2321328887 TSecr=787957011"
"84","0.789500","192.168.2.2","192.168.1.2","TCP","66","42496","5001  >  45662 [ACK] Seq=1 Ack=98465 Win=42496 Len=0 TSval=2321328911 TSecr=787957011"
"86","0.813986","192.168.2.2","192.168.1.2","TCP","66","42496","5001  >  45662 [ACK] Seq=1 Ack=101361 Win=42496 Len=0 TSval=2321328936 TSecr=787957035"
"88","0.850222","192.168.2.2","192.168.1.2","TCP","66","42496","5001  >  45662 [ACK] Seq=1 Ack=105705 Win=42496 Len=0 TSval=2321328972 TSecr=787957035"
"90","0.874709","192.168.2.2","192.168.1.2","TCP","66","42496","5001  >  45662 [ACK] Seq=1 Ack=108601 Win=42496 Len=0 TSval=2321328996 TSecr=787957083"
"92","0.898402","192.168.2.2","192.168.1.2","TCP","66","42496","5001  >  45662 [ACK] Seq=1 Ack=111497 Win=42496 Len=0 TSval=2321329020 TSecr=787957108"
"94","0.922554","192.168.2.2","192.168.1.2","TCP","66","42496","5001  >  45662 [ACK] Seq=1 Ack=114393 Win=42496 Len=0 TSval=2321329044 TSecr=787957144"
"96","0.947211","192.168.2.2","192.168.1.2","TCP","66","42496","5001  >  45662 [ACK] Seq=1 Ack=117289 Win=42496 Len=0 TSval=2321329069 TSecr=787957169"
"99","0.971069","192.168.2.2","192.168.1.2","TCP","66","42496","5001  >  45662 [ACK] Seq=1 Ack=120185 Win=42496 Len=0 TSval=2321329093 TSecr=787957192"
"101","0.995205","192.168.2.2","192.168.1.2","TCP","66","42496","5001  >  45662 [ACK] Seq=1 Ack=123081 Win=42496 Len=0 TSval=2321329117 TSecr=787957216"
"104","1.020724","192.168.2.2","192.168.1.2","TCP","66","42496","5001  >  45662 [ACK] Seq=1 Ack=125977 Win=42496 Len=0 TSval=2321329142 TSecr=787957241"
"106","1.057038","192.168.2.2","192.168.1.2","TCP","66","42496","5001  >  45662 [ACK] Seq=1 Ack=130321 Win=42496 Len=0 TSval=2321329179 TSecr=787957258"
"111","1.081395","192.168.2.2","192.168.1.2","TCP","66","42496","5001  >  45662 [ACK] Seq=1 Ack=133217 Win=42496 Len=0 TSval=2321329203 TSecr=787957289"
"114","1.106281","192.168.2.2","192.168.1.2","TCP","66","42496","5001  >  45662 [ACK] Seq=1 Ack=136113 Win=42496 Len=0 TSval=2321329228 TSecr=787957315"
"116","1.131360","192.168.2.2","192.168.1.2","TCP","66","42496","5001  >  45662 [ACK] Seq=1 Ack=139009 Win=42496 Len=0 TSval=2321329253 TSecr=787957351"
"118","1.154841","192.168.2.2","192.168.1.2","TCP","66","42496","5001  >  45662 [ACK] Seq=1 Ack=141905 Win=42496 Len=0 TSval=2321329277 TSecr=787957351"
"120","1.179394","192.168.2.2","192.168.1.2","TCP","66","42496","5001  >  45662 [ACK] Seq=1 Ack=144801 Win=42496 Len=0 TSval=2321329301 TSecr=787957375"
"122","1.203862","192.168.2.2","192.168.1.2","TCP","66","42496","5001  >  45662 [ACK] Seq=1 Ack=147697 Win=42496 Len=0 TSval=2321329326 TSecr=787957400"
"124","1.227417","192.168.2.2","192.168.1.2","TCP","66","42496","5001  >  45662 [ACK] Seq=1 Ack=150593 Win=42496 Len=0 TSval=2321329349 TSecr=787957425"
"126","1.263731","192.168.2.2","192.168.1.2","TCP","66","42496","5001  >  45662 [ACK] Seq=1 Ack=154937 Win=42496 Len=0 TSval=2321329385 TSecr=787957449"
"129","1.288013","192.168.2.2","192.168.1.2","TCP","66","42496","5001  >  45662 [ACK] Seq=1 Ack=157833 Win=42496 Len=0 TSval=2321329410 TSecr=787957498"
"131","1.312203","192.168.2.2","192.168.1.2","TCP","66","42496","5001  >  45662 [ACK] Seq=1 Ack=160729 Win=42496 Len=0 TSval=2321329434 TSecr=787957521"
"133","1.337067","192.168.2.2","192.168.1.2","TCP","66","42496","5001  >  45662 [ACK] Seq=1 Ack=163625 Win=42496 Len=0 TSval=2321329459 TSecr=787957558"
"135","1.360651","192.168.2.2","192.168.1.2","TCP","66","42496","5001  >  45662 [ACK] Seq=1 Ack=166521 Win=42496 Len=0 TSval=2321329482 TSecr=787957558"
"137","1.384871","192.168.2.2","192.168.1.2","TCP","66","42496","5001  >  45662 [ACK] Seq=1 Ack=169417 Win=42496 Len=0 TSval=2321329507 TSecr=787957582"
"140","1.409094","192.168.2.2","192.168.1.2","TCP","66","42496","5001  >  45662 [ACK] Seq=1 Ack=172313 Win=42496 Len=0 TSval=2321329531 TSecr=787957606"
"142","1.445777","192.168.2.2","192.168.1.2","TCP","66","42496","5001  >  45662 [ACK] Seq=1 Ack=176657 Win=42496 Len=0 TSval=2321329568 TSecr=787957631"
"144","1.470261","192.168.2.2","192.168.1.2","TCP","66","42496","5001  >  45662 [ACK] Seq=1 Ack=179553 Win=42496 Len=0 TSval=2321329592 TSecr=787957679"
"147","1.493894","192.168.2.2","192.168.1.2","TCP","66","42496","5001  >  45662 [ACK] Seq=1 Ack=182449 Win=42496 Len=0 TSval=2321329616 TSecr=787957679"
"149","1.518298","192.168.2.2","192.168.1.2","TCP","66","42496","5001  >  45662 [ACK] Seq=1 Ack=185345 Win=42496 Len=0 TSval=2321329640 TSecr=787957703"
"151","1.542814","192.168.2.2","192.168.1.2","TCP","66","42496","5001  >  45662 [ACK] Seq=1 Ack=188241 Win=42496 Len=0 TSval=2321329665 TSecr=787957740"
"153","1.567260","192.168.2.2","192.168.1.2","TCP","66","42496","5001  >  45662 [ACK] Seq=1 Ack=191137 Win=42496 Len=0 TSval=2321329689 TSecr=787957764"
"158","1.602924","192.168.2.2","192.168.1.2","TCP","66","42496","5001  >  45662 [ACK] Seq=1 Ack=195481 Win=42496 Len=0 TSval=2321329725 TSecr=787957774"
"160","1.627974","192.168.2.2","192.168.1.2","TCP","66","42496","5001  >  45662 [ACK] Seq=1 Ack=198377 Win=42496 Len=0 TSval=2321329750 TSecr=787957812"
"163","1.651484","192.168.2.2","192.168.1.2","TCP","66","42496","5001  >  45662 [ACK] Seq=1 Ack=201273 Win=42496 Len=0 TSval=2321329773 TSecr=787957837"
"165","1.676005","192.168.2.2","192.168.1.2","TCP","66","42496","5001  >  45662 [ACK] Seq=1 Ack=204169 Win=42496 Len=0 TSval=2321329798 TSecr=787957861"
"168","1.700507","192.168.2.2","192.168.1.2","TCP","66","42496","5001  >  45662 [ACK] Seq=1 Ack=207065 Win=42496 Len=0 TSval=2321329822 TSecr=787957897"
"170","1.724969","192.168.2.2","192.168.1.2","TCP","66","42496","5001  >  45662 [ACK] Seq=1 Ack=209961 Win=42496 Len=0 TSval=2321329847 TSecr=787957922"
"172","1.749000","192.168.2.2","192.168.1.2","TCP","66","42496","5001  >  45662 [ACK] Seq=1 Ack=212857 Win=42496 Len=0 TSval=2321329871 TSecr=787957945"
"174","1.773957","192.168.2.2","192.168.1.2","TCP","66","42496","5001  >  45662 [ACK] Seq=1 Ack=215753 Win=42496 Len=0 TSval=2321329896 TSecr=787957970"
"176","1.810176","192.168.2.2","192.168.1.2","TCP","66","42496","5001  >  45662 [ACK] Seq=1 Ack=220097 Win=42496 Len=0 TSval=2321329932 TSecr=787957970"
"178","1.833912","192.168.2.2","192.168.1.2","TCP","66","42496","5001  >  45662 [ACK] Seq=1 Ack=222993 Win=42496 Len=0 TSval=2321329956 TSecr=787958019"
"181","1.858178","192.168.2.2","192.168.1.2","TCP","66","42496","5001  >  45662 [ACK] Seq=1 Ack=225889 Win=42496 Len=0 TSval=2321329980 TSecr=787958043"
"183","1.882702","192.168.2.2","192.168.1.2","TCP","66","42496","5001  >  45662 [ACK] Seq=1 Ack=228785 Win=42496 Len=0 TSval=2321330004 TSecr=787958068"
"185","1.907164","192.168.2.2","192.168.1.2","TCP","66","42496","5001  >  45662 [ACK] Seq=1 Ack=231681 Win=42496 Len=0 TSval=2321330029 TSecr=787958104"
"187","1.930648","192.168.2.2","192.168.1.2","TCP","66","42496","5001  >  45662 [ACK] Seq=1 Ack=234577 Win=42496 Len=0 TSval=2321330052 TSecr=787958128"
"189","1.955216","192.168.2.2","192.168.1.2","TCP","66","42496","5001  >  45662 [ACK] Seq=1 Ack=237473 Win=42496 Len=0 TSval=2321330077 TSecr=787958128"
"192","1.991499","192.168.2.2","192.168.1.2","TCP","66","42496","5001  >  45662 [ACK] Seq=1 Ack=241817 Win=42496 Len=0 TSval=2321330113 TSecr=787958152"
"195","2.015888","192.168.2.2","192.168.1.2","TCP","66","42496","5001  >  45662 [ACK] Seq=1 Ack=244713 Win=42496 Len=0 TSval=2321330138 TSecr=787958201"
"197","2.039642","192.168.2.2","192.168.1.2","TCP","66","42496","5001  >  45662 [ACK] Seq=1 Ack=247609 Win=42496 Len=0 TSval=2321330161 TSecr=787958224"
"199","2.063890","192.168.2.2","192.168.1.2","TCP","66","42496","5001  >  45662 [ACK] Seq=1 Ack=250505 Win=42496 Len=0 TSval=2321330186 TSecr=787958249"
"201","2.100188","192.168.2.2","192.168.1.2","TCP","66","42496","5001  >  45662 [ACK] Seq=1 Ack=254849 Win=42496 Len=0 TSval=2321330222 TSecr=787958278"
"205","2.125578","192.168.2.2","192.168.1.2","TCP","66","48128","5001  >  45662 [ACK] Seq=1 Ack=257745 Win=48128 Len=0 TSval=2321330247 TSecr=787958310"
"207","2.149399","192.168.2.2","192.168.1.2","TCP","66","54272","5001  >  45662 [ACK] Seq=1 Ack=260641 Win=54272 Len=0 TSval=2321330271 TSecr=787958333"
"209","2.173630","192.168.2.2","192.168.1.2","TCP","66","54784","5001  >  45662 [ACK] Seq=1 Ack=263537 Win=54784 Len=0 TSval=2321330295 TSecr=787958358"
"211","2.198080","192.168.2.2","192.168.1.2","TCP","66","54784","5001  >  45662 [ACK] Seq=1 Ack=266433 Win=54784 Len=0 TSval=2321330320 TSecr=787958394"
"213","2.222587","192.168.2.2","192.168.1.2","TCP","66","54784","5001  >  45662 [ACK] Seq=1 Ack=269329 Win=54784 Len=0 TSval=2321330344 TSecr=787958394"
"215","2.247090","192.168.2.2","192.168.1.2","TCP","66","54784","5001  >  45662 [ACK] Seq=1 Ack=272225 Win=54784 Len=0 TSval=2321330369 TSecr=787958419"
"217","2.270569","192.168.2.2","192.168.1.2","TCP","66","54784","5001  >  45662 [ACK] Seq=1 Ack=275121 Win=54784 Len=0 TSval=2321330392 TSecr=787958443"
"219","2.295052","192.168.2.2","192.168.1.2","TCP","66","54784","5001  >  45662 [ACK] Seq=1 Ack=278017 Win=54784 Len=0 TSval=2321330417 TSecr=787958468"
"221","2.319544","192.168.2.2","192.168.1.2","TCP","66","54784","5001  >  45662 [ACK] Seq=1 Ack=280913 Win=54784 Len=0 TSval=2321330441 TSecr=787958492"
"223","2.343296","192.168.2.2","192.168.1.2","TCP","66","55296","5001  >  45662 [ACK] Seq=1 Ack=282361 Win=55296 Len=0 TSval=2321330465 TSecr=787958517"
"225","2.355825","192.168.2.2","192.168.1.2","TCP","66","55296","5001  >  45662 [ACK] Seq=1 Ack=285257 Win=55296 Len=0 TSval=2321330478 TSecr=787958541"
"227","2.379577","192.168.2.2","192.168.1.2","TCP","66","55296","5001  >  45662 [ACK] Seq=1 Ack=288153 Win=55296 Len=0 TSval=2321330501 TSecr=787958565"
"230","2.403814","192.168.2.2","192.168.1.2","TCP","66","55296","5001  >  45662 [ACK] Seq=1 Ack=291049 Win=55296 Len=0 TSval=2321330526 TSecr=787958589"
"232","2.428012","192.168.2.2","192.168.1.2","TCP","66","55296","5001  >  45662 [ACK] Seq=1 Ack=293945 Win=55296 Len=0 TSval=2321330550 TSecr=787958614"
"234","2.452829","192.168.2.2","192.168.1.2","TCP","66","55296","5001  >  45662 [ACK] Seq=1 Ack=296841 Win=55296 Len=0 TSval=2321330575 TSecr=787958637"
"236","2.476533","192.168.2.2","192.168.1.2","TCP","66","55296","5001  >  45662 [ACK] Seq=1 Ack=299737 Win=55296 Len=0 TSval=2321330598 TSecr=787958650"
"238","2.500763","192.168.2.2","192.168.1.2","TCP","66","57344","5001  >  45662 [ACK] Seq=1 Ack=302633 Win=57344 Len=0 TSval=2321330623 TSecr=787958673"
"240","2.525253","192.168.2.2","192.168.1.2","TCP","66","58368","5001  >  45662 [ACK] Seq=1 Ack=304081 Win=58368 Len=0 TSval=2321330647 TSecr=787958673"
"242","2.537039","192.168.2.2","192.168.1.2","TCP","66","58368","5001  >  45662 [ACK] Seq=1 Ack=306977 Win=58368 Len=0 TSval=2321330659 TSecr=787958698"
"244","2.561579","192.168.2.2","192.168.1.2","TCP","66","58368","5001  >  45662 [ACK] Seq=1 Ack=309873 Win=58368 Len=0 TSval=2321330683 TSecr=787958722"
"246","2.586033","192.168.2.2","192.168.1.2","TCP","66","58368","5001  >  45662 [ACK] Seq=1 Ack=312769 Win=58368 Len=0 TSval=2321330708 TSecr=787958747"
"248","2.610488","192.168.2.2","192.168.1.2","TCP","66","58368","5001  >  45662 [ACK] Seq=1 Ack=315665 Win=58368 Len=0 TSval=2321330732 TSecr=787958770"
"250","2.634028","192.168.2.2","192.168.1.2","TCP","66","58368","5001  >  45662 [ACK] Seq=1 Ack=318561 Win=58368 Len=0 TSval=2321330756 TSecr=787958795"
"252","2.670217","192.168.2.2","192.168.1.2","TCP","66","58368","5001  >  45662 [ACK] Seq=1 Ack=322905 Win=58368 Len=0 TSval=2321330792 TSecr=787958819"
"255","2.694734","192.168.2.2","192.168.1.2","TCP","66","58368","5001  >  45662 [ACK] Seq=1 Ack=325801 Win=58368 Len=0 TSval=2321330816 TSecr=787958855"
"257","2.719226","192.168.2.2","192.168.1.2","TCP","66","58368","5001  >  45662 [ACK] Seq=1 Ack=328697 Win=58368 Len=0 TSval=2321330841 TSecr=787958880"
"259","2.755477","192.168.2.2","192.168.1.2","TCP","66","58368","5001  >  45662 [ACK] Seq=1 Ack=333041 Win=58368 Len=0 TSval=2321330877 TSecr=787958904"
"261","2.780019","192.168.2.2","192.168.1.2","TCP","66","58368","5001  >  45662 [ACK] Seq=1 Ack=335937 Win=58368 Len=0 TSval=2321330902 TSecr=787958964"
"263","2.803486","192.168.2.2","192.168.1.2","TCP","66","58368","5001  >  45662 [ACK] Seq=1 Ack=338833 Win=58368 Len=0 TSval=2321330925 TSecr=787958964"
"265","2.827699","192.168.2.2","192.168.1.2","TCP","66","58368","5001  >  45662 [ACK] Seq=1 Ack=341729 Win=58368 Len=0 TSval=2321330949 TSecr=787958989"
"268","2.852454","192.168.2.2","192.168.1.2","TCP","66","58368","5001  >  45662 [ACK] Seq=1 Ack=344625 Win=58368 Len=0 TSval=2321330974 TSecr=787959013"
"270","2.876941","192.168.2.2","192.168.1.2","TCP","66","58368","5001  >  45662 [ACK] Seq=1 Ack=347521 Win=58368 Len=0 TSval=2321330999 TSecr=787959049"
"272","2.901457","192.168.2.2","192.168.1.2","TCP","66","58368","5001  >  45662 [ACK] Seq=1 Ack=350417 Win=58368 Len=0 TSval=2321331023 TSecr=787959074"
"274","2.924589","192.168.2.2","192.168.1.2","TCP","66","58368","5001  >  45662 [ACK] Seq=1 Ack=353313 Win=58368 Len=0 TSval=2321331046 TSecr=787959097"
"276","2.949421","192.168.2.2","192.168.1.2","TCP","66","58368","5001  >  45662 [ACK] Seq=1 Ack=356209 Win=58368 Len=0 TSval=2321331071 TSecr=787959122"
"278","2.985668","192.168.2.2","192.168.1.2","TCP","66","58368","5001  >  45662 [ACK] Seq=1 Ack=360553 Win=58368 Len=0 TSval=2321331107 TSecr=787959122"
"282","3.009356","192.168.2.2","192.168.1.2","TCP","66","58368","5001  >  45662 [ACK] Seq=1 Ack=363449 Win=58368 Len=0 TSval=2321331131 TSecr=787959171"
"284","3.033613","192.168.2.2","192.168.1.2","TCP","66","58368","5001  >  45662 [ACK] Seq=1 Ack=366345 Win=58368 Len=0 TSval=2321331155 TSecr=787959195"
"286","3.057819","192.168.2.2","192.168.1.2","TCP","66","58368","5001  >  45662 [ACK] Seq=1 Ack=369241 Win=58368 Len=0 TSval=2321331180 TSecr=787959218"
"289","3.082048","192.168.2.2","192.168.1.2","TCP","66","58368","5001  >  45662 [ACK] Seq=1 Ack=372137 Win=58368 Len=0 TSval=2321331204 TSecr=787959243"
"291","3.107097","192.168.2.2","192.168.1.2","TCP","66","58368","5001  >  45662 [ACK] Seq=1 Ack=375033 Win=58368 Len=0 TSval=2321331229 TSecr=787959279"
"294","3.143783","192.168.2.2","192.168.1.2","TCP","66","58368","5001  >  45662 [ACK] Seq=1 Ack=379377 Win=58368 Len=0 TSval=2321331266 TSecr=787959286"
"296","3.167885","192.168.2.2","192.168.1.2","TCP","66","58368","5001  >  45662 [ACK] Seq=1 Ack=382273 Win=58368 Len=0 TSval=2321331290 TSecr=787959327"
"298","3.192390","192.168.2.2","192.168.1.2","TCP","66","58368","5001  >  45662 [ACK] Seq=1 Ack=385169 Win=58368 Len=0 TSval=2321331314 TSecr=787959352"
"300","3.228575","192.168.2.2","192.168.1.2","TCP","66","58368","5001  >  45662 [ACK] Seq=1 Ack=389513 Win=58368 Len=0 TSval=2321331350 TSecr=787959352"
"303","3.252432","192.168.2.2","192.168.1.2","TCP","66","58368","5001  >  45662 [ACK] Seq=1 Ack=392409 Win=58368 Len=0 TSval=2321331374 TSecr=787959401"
"305","3.277576","192.168.2.2","192.168.1.2","TCP","66","58368","5001  >  45662 [ACK] Seq=1 Ack=395305 Win=58368 Len=0 TSval=2321331399 TSecr=787959438"
"307","3.300864","192.168.2.2","192.168.1.2","TCP","66","58368","5001  >  45662 [ACK] Seq=1 Ack=398201 Win=58368 Len=0 TSval=2321331423 TSecr=787959462"
"309","3.325541","192.168.2.2","192.168.1.2","TCP","66","60416","5001  >  45662 [ACK] Seq=1 Ack=401097 Win=60416 Len=0 TSval=2321331447 TSecr=787959486"
"311","3.350043","192.168.2.2","192.168.1.2","TCP","66","60416","5001  >  45662 [ACK] Seq=1 Ack=403993 Win=60416 Len=0 TSval=2321331472 TSecr=787959522"
"313","3.373543","192.168.2.2","192.168.1.2","TCP","66","60416","5001  >  45662 [ACK] Seq=1 Ack=406889 Win=60416 Len=0 TSval=2321331495 TSecr=787959522"
"315","3.397737","192.168.2.2","192.168.1.2","TCP","66","60416","5001  >  45662 [ACK] Seq=1 Ack=409785 Win=60416 Len=0 TSval=2321331519 TSecr=787959546"
"317","3.421962","192.168.2.2","192.168.1.2","TCP","66","60416","5001  >  45662 [ACK] Seq=1 Ack=412681 Win=60416 Len=0 TSval=2321331544 TSecr=787959571"
"319","3.446229","192.168.2.2","192.168.1.2","TCP","66","60416","5001  >  45662 [ACK] Seq=1 Ack=415577 Win=60416 Len=0 TSval=2321331568 TSecr=787959595"
"321","3.470514","192.168.2.2","192.168.1.2","TCP","66","60416","5001  >  45662 [ACK] Seq=1 Ack=418473 Win=60416 Len=0 TSval=2321331592 TSecr=787959620"
"323","3.494622","192.168.2.2","192.168.1.2","TCP","66","60416","5001  >  45662 [ACK] Seq=1 Ack=421369 Win=60416 Len=0 TSval=2321331616 TSecr=787959644"
"325","3.519541","192.168.2.2","192.168.1.2","TCP","66","60416","5001  >  45662 [ACK] Seq=1 Ack=424265 Win=60416 Len=0 TSval=2321331641 TSecr=787959668"
"327","3.543069","192.168.2.2","192.168.1.2","TCP","66","60416","5001  >  45662 [ACK] Seq=1 Ack=427161 Win=60416 Len=0 TSval=2321331665 TSecr=787959692"
"329","3.567472","192.168.2.2","192.168.1.2","TCP","66","60416","5001  >  45662 [ACK] Seq=1 Ack=430057 Win=60416 Len=0 TSval=2321331689 TSecr=787959716"
"331","3.592008","192.168.2.2","192.168.1.2","TCP","66","60416","5001  >  45662 [ACK] Seq=1 Ack=432953 Win=60416 Len=0 TSval=2321331714 TSecr=787959740"
"333","3.615767","192.168.2.2","192.168.1.2","TCP","66","60416","5001  >  45662 [ACK] Seq=1 Ack=435849 Win=60416 Len=0 TSval=2321331738 TSecr=787959764"
"335","3.640008","192.168.2.2","192.168.1.2","TCP","66","60416","5001  >  45662 [ACK] Seq=1 Ack=438745 Win=60416 Len=0 TSval=2321331762 TSecr=787959788"
"337","3.664470","192.168.2.2","192.168.1.2","TCP","66","60416","5001  >  45662 [ACK] Seq=1 Ack=441641 Win=60416 Len=0 TSval=2321331786 TSecr=787959813"
"339","3.688416","192.168.2.2","192.168.1.2","TCP","66","60416","5001  >  45662 [ACK] Seq=1 Ack=444537 Win=60416 Len=0 TSval=2321331810 TSecr=787959837"
"341","3.712641","192.168.2.2","192.168.1.2","TCP","66","60416","5001  >  45662 [ACK] Seq=1 Ack=447433 Win=60416 Len=0 TSval=2321331834 TSecr=787959861"
"343","3.736990","192.168.2.2","192.168.1.2","TCP","66","60416","5001  >  45662 [ACK] Seq=1 Ack=450329 Win=60416 Len=0 TSval=2321331859 TSecr=787959886"
"345","3.761098","192.168.2.2","192.168.1.2","TCP","66","60416","5001  >  45662 [ACK] Seq=1 Ack=453225 Win=60416 Len=0 TSval=2321331883 TSecr=787959910"
"347","3.785329","192.168.2.2","192.168.1.2","TCP","66","60416","5001  >  45662 [ACK] Seq=1 Ack=456121 Win=60416 Len=0 TSval=2321331907 TSecr=787959934"
"349","3.809535","192.168.2.2","192.168.1.2","TCP","66","60416","5001  >  45662 [ACK] Seq=1 Ack=459017 Win=60416 Len=0 TSval=2321331931 TSecr=787959958"
"351","3.833947","192.168.2.2","192.168.1.2","TCP","66","60416","5001  >  45662 [ACK] Seq=1 Ack=461913 Win=60416 Len=0 TSval=2321331956 TSecr=787959982"
"353","3.858420","192.168.2.2","192.168.1.2","TCP","66","60416","5001  >  45662 [ACK] Seq=1 Ack=464809 Win=60416 Len=0 TSval=2321331980 TSecr=787960007"
"355","3.882966","192.168.2.2","192.168.1.2","TCP","66","60416","5001  >  45662 [ACK] Seq=1 Ack=467705 Win=60416 Len=0 TSval=2321332005 TSecr=787960031"
"357","3.906436","192.168.2.2","192.168.1.2","TCP","66","60416","5001  >  45662 [ACK] Seq=1 Ack=470601 Win=60416 Len=0 TSval=2321332028 TSecr=787960055"
"359","3.930908","192.168.2.2","192.168.1.2","TCP","66","60416","5001  >  45662 [ACK] Seq=1 Ack=473497 Win=60416 Len=0 TSval=2321332053 TSecr=787960079"
"361","3.955409","192.168.2.2","192.168.1.2","TCP","66","60416","5001  >  45662 [ACK] Seq=1 Ack=476393 Win=60416 Len=0 TSval=2321332077 TSecr=787960104"
"363","3.979906","192.168.2.2","192.168.1.2","TCP","66","60416","5001  >  45662 [ACK] Seq=1 Ack=479289 Win=60416 Len=0 TSval=2321332102 TSecr=787960128"
"366","4.003340","192.168.2.2","192.168.1.2","TCP","66","60416","5001  >  45662 [ACK] Seq=1 Ack=482185 Win=60416 Len=0 TSval=2321332125 TSecr=787960152"
"369","4.027899","192.168.2.2","192.168.1.2","TCP","66","60416","5001  >  45662 [ACK] Seq=1 Ack=485081 Win=60416 Len=0 TSval=2321332150 TSecr=787960177"
"371","4.051779","192.168.2.2","192.168.1.2","TCP","66","60416","5001  >  45662 [ACK] Seq=1 Ack=487977 Win=60416 Len=0 TSval=2321332174 TSecr=787960200"
"373","4.076024","192.168.2.2","192.168.1.2","TCP","66","60416","5001  >  45662 [ACK] Seq=1 Ack=490873 Win=60416 Len=0 TSval=2321332198 TSecr=787960225"
"375","4.100387","192.168.2.2","192.168.1.2","TCP","66","60416","5001  >  45662 [ACK] Seq=1 Ack=493769 Win=60416 Len=0 TSval=2321332222 TSecr=787960249"
"377","4.124857","192.168.2.2","192.168.1.2","TCP","66","60416","5001  >  45662 [ACK] Seq=1 Ack=496665 Win=60416 Len=0 TSval=2321332247 TSecr=787960274"
"379","4.149366","192.168.2.2","192.168.1.2","TCP","66","61440","5001  >  45662 [ACK] Seq=1 Ack=498113 Win=61440 Len=0 TSval=2321332271 TSecr=787960294"
"381","4.160780","192.168.2.2","192.168.1.2","TCP","66","61440","5001  >  45662 [ACK] Seq=1 Ack=501009 Win=61440 Len=0 TSval=2321332283 TSecr=787960297"
"384","4.198321","192.168.2.2","192.168.1.2","TCP","66","61440","5001  >  45662 [ACK] Seq=1 Ack=505353 Win=61440 Len=0 TSval=2321332320 TSecr=787960322"
"386","4.222161","192.168.2.2","192.168.1.2","TCP","66","61440","5001  >  45662 [ACK] Seq=1 Ack=508249 Win=61440 Len=0 TSval=2321332344 TSecr=787960370"
"388","4.246382","192.168.2.2","192.168.1.2","TCP","66","61440","5001  >  45662 [ACK] Seq=1 Ack=511145 Win=61440 Len=0 TSval=2321332368 TSecr=787960394"
"390","4.270590","192.168.2.2","192.168.1.2","TCP","66","61440","5001  >  45662 [ACK] Seq=1 Ack=514041 Win=61440 Len=0 TSval=2321332392 TSecr=787960419"
"392","4.294819","192.168.2.2","192.168.1.2","TCP","66","61440","5001  >  45662 [ACK] Seq=1 Ack=516937 Win=61440 Len=0 TSval=2321332417 TSecr=787960443"
"394","4.319046","192.168.2.2","192.168.1.2","TCP","66","61440","5001  >  45662 [ACK] Seq=1 Ack=519833 Win=61440 Len=0 TSval=2321332441 TSecr=787960455"
"396","4.343298","192.168.2.2","192.168.1.2","TCP","66","61440","5001  >  45662 [ACK] Seq=1 Ack=522729 Win=61440 Len=0 TSval=2321332465 TSecr=787960492"
"398","4.367842","192.168.2.2","192.168.1.2","TCP","66","63488","5001  >  45662 [ACK] Seq=1 Ack=525625 Win=63488 Len=0 TSval=2321332490 TSecr=787960516"
"401","4.392307","192.168.2.2","192.168.1.2","TCP","66","63488","5001  >  45662 [ACK] Seq=1 Ack=528521 Win=63488 Len=0 TSval=2321332514 TSecr=787960540"
"403","4.415915","192.168.2.2","192.168.1.2","TCP","66","63488","5001  >  45662 [ACK] Seq=1 Ack=531417 Win=63488 Len=0 TSval=2321332538 TSecr=787960564"
"405","4.440134","192.168.2.2","192.168.1.2","TCP","66","63488","5001  >  45662 [ACK] Seq=1 Ack=534313 Win=63488 Len=0 TSval=2321332562 TSecr=787960589"
"407","4.464777","192.168.2.2","192.168.1.2","TCP","66","63488","5001  >  45662 [ACK] Seq=1 Ack=537209 Win=63488 Len=0 TSval=2321332587 TSecr=787960613"
"409","4.488579","192.168.2.2","192.168.1.2","TCP","66","63488","5001  >  45662 [ACK] Seq=1 Ack=540105 Win=63488 Len=0 TSval=2321332610 TSecr=787960637"
"411","4.512954","192.168.2.2","192.168.1.2","TCP","66","63488","5001  >  45662 [ACK] Seq=1 Ack=543001 Win=63488 Len=0 TSval=2321332635 TSecr=787960662"
"413","4.537279","192.168.2.2","192.168.1.2","TCP","66","64000","5001  >  45662 [ACK] Seq=1 Ack=544449 Win=64000 Len=0 TSval=2321332659 TSecr=787960662"
"415","4.549156","192.168.2.2","192.168.1.2","TCP","66","64000","5001  >  45662 [ACK] Seq=1 Ack=547345 Win=64000 Len=0 TSval=2321332671 TSecr=787960686"
"417","4.573481","192.168.2.2","192.168.1.2","TCP","66","64000","5001  >  45662 [ACK] Seq=1 Ack=550241 Win=64000 Len=0 TSval=2321332695 TSecr=787960710"
"419","4.598010","192.168.2.2","192.168.1.2","TCP","66","64000","5001  >  45662 [ACK] Seq=1 Ack=553137 Win=64000 Len=0 TSval=2321332720 TSecr=787960734"
"421","4.621853","192.168.2.2","192.168.1.2","TCP","66","64000","5001  >  45662 [ACK] Seq=1 Ack=556033 Win=64000 Len=0 TSval=2321332744 TSecr=787960759"
"423","4.646072","192.168.2.2","192.168.1.2","TCP","66","64000","5001  >  45662 [ACK] Seq=1 Ack=558929 Win=64000 Len=0 TSval=2321332768 TSecr=787960783"
"425","4.682391","192.168.2.2","192.168.1.2","TCP","66","64000","5001  >  45662 [ACK] Seq=1 Ack=563273 Win=64000 Len=0 TSval=2321332804 TSecr=787960807"
"427","4.706655","192.168.2.2","192.168.1.2","TCP","66","64000","5001  >  45662 [ACK] Seq=1 Ack=566169 Win=64000 Len=0 TSval=2321332828 TSecr=787960843"
"429","4.731245","192.168.2.2","192.168.1.2","TCP","66","64000","5001  >  45662 [ACK] Seq=1 Ack=569065 Win=64000 Len=0 TSval=2321332853 TSecr=787960867"
"431","4.755731","192.168.2.2","192.168.1.2","TCP","66","64000","5001  >  45662 [ACK] Seq=1 Ack=571961 Win=64000 Len=0 TSval=2321332877 TSecr=787960892"
"434","4.779326","192.168.2.2","192.168.1.2","TCP","66","64000","5001  >  45662 [ACK] Seq=1 Ack=574857 Win=64000 Len=0 TSval=2321332901 TSecr=787960916"
"436","4.803733","192.168.2.2","192.168.1.2","TCP","66","64000","5001  >  45662 [ACK] Seq=1 Ack=577753 Win=64000 Len=0 TSval=2321332925 TSecr=787960940"
"438","4.828205","192.168.2.2","192.168.1.2","TCP","66","64000","5001  >  45662 [ACK] Seq=1 Ack=580649 Win=64000 Len=0 TSval=2321332950 TSecr=787960976"
"440","4.851970","192.168.2.2","192.168.1.2","TCP","66","64000","5001  >  45662 [ACK] Seq=1 Ack=583545 Win=64000 Len=0 TSval=2321332974 TSecr=787961000"
"442","4.876216","192.168.2.2","192.168.1.2","TCP","66","64000","5001  >  45662 [ACK] Seq=1 Ack=586441 Win=64000 Len=0 TSval=2321332998 TSecr=787961025"
"444","4.900679","192.168.2.2","192.168.1.2","TCP","66","64000","5001  >  45662 [ACK] Seq=1 Ack=589337 Win=64000 Len=0 TSval=2321333022 TSecr=787961050"
"446","4.936968","192.168.2.2","192.168.1.2","TCP","66","64000","5001  >  45662 [ACK] Seq=1 Ack=593681 Win=64000 Len=0 TSval=2321333059 TSecr=787961050"
"448","4.960983","192.168.2.2","192.168.1.2","TCP","66","64000","5001  >  45662 [ACK] Seq=1 Ack=596577 Win=64000 Len=0 TSval=2321333083 TSecr=787961098"
"450","4.985998","192.168.2.2","192.168.1.2","TCP","66","64000","5001  >  45662 [ACK] Seq=1 Ack=599473 Win=64000 Len=0 TSval=2321333108 TSecr=787961122"
"454","5.009413","192.168.2.2","192.168.1.2","TCP","66","64000","5001  >  45662 [ACK] Seq=1 Ack=602369 Win=64000 Len=0 TSval=2321333131 TSecr=787961146"
"456","5.033913","192.168.2.2","192.168.1.2","TCP","66","64000","5001  >  45662 [ACK] Seq=1 Ack=605265 Win=64000 Len=0 TSval=2321333156 TSecr=787961170"
"458","5.058395","192.168.2.2","192.168.1.2","TCP","66","64000","5001  >  45662 [ACK] Seq=1 Ack=608161 Win=64000 Len=0 TSval=2321333180 TSecr=787961194"
"460","5.082097","192.168.2.2","192.168.1.2","TCP","66","64000","5001  >  45662 [ACK] Seq=1 Ack=611057 Win=64000 Len=0 TSval=2321333204 TSecr=787961231"
"464","5.106390","192.168.2.2","192.168.1.2","TCP","66","64000","5001  >  45662 [ACK] Seq=1 Ack=613953 Win=64000 Len=0 TSval=2321333228 TSecr=787961255"
"466","5.130864","192.168.2.2","192.168.1.2","TCP","66","64000","5001  >  45662 [ACK] Seq=1 Ack=616849 Win=64000 Len=0 TSval=2321333253 TSecr=787961280"
"469","5.167744","192.168.2.2","192.168.1.2","TCP","66","64000","5001  >  45662 [ACK] Seq=1 Ack=621193 Win=64000 Len=0 TSval=2321333290 TSecr=787961302"
"471","5.191874","192.168.2.2","192.168.1.2","TCP","66","64000","5001  >  45662 [ACK] Seq=1 Ack=624089 Win=64000 Len=0 TSval=2321333314 TSecr=787961328"
"474","5.216099","192.168.2.2","192.168.1.2","TCP","66","64000","5001  >  45662 [ACK] Seq=1 Ack=626985 Win=64000 Len=0 TSval=2321333338 TSecr=787961352"
"476","5.240643","192.168.2.2","192.168.1.2","TCP","66","64000","5001  >  45662 [ACK] Seq=1 Ack=629881 Win=64000 Len=0 TSval=2321333362 TSecr=787961376"
"478","5.265449","192.168.2.2","192.168.1.2","TCP","66","64000","5001  >  45662 [ACK] Seq=1 Ack=632777 Win=64000 Len=0 TSval=2321333387 TSecr=787961400"
"480","5.289723","192.168.2.2","192.168.1.2","TCP","66","64000","5001  >  45662 [ACK] Seq=1 Ack=635673 Win=64000 Len=0 TSval=2321333411 TSecr=787961425"
"482","5.314050","192.168.2.2","192.168.1.2","TCP","66","64000","5001  >  45662 [ACK] Seq=1 Ack=638569 Win=64000 Len=0 TSval=2321333436 TSecr=787961462"
"484","5.338538","192.168.2.2","192.168.1.2","TCP","66","64000","5001  >  45662 [ACK] Seq=1 Ack=641465 Win=64000 Len=0 TSval=2321333460 TSecr=787961486"
"487","5.363051","192.168.2.2","192.168.1.2","TCP","66","64000","5001  >  45662 [ACK] Seq=1 Ack=644361 Win=64000 Len=0 TSval=2321333485 TSecr=787961486"
"489","5.386590","192.168.2.2","192.168.1.2","TCP","66","64000","5001  >  45662 [ACK] Seq=1 Ack=647257 Win=64000 Len=0 TSval=2321333508 TSecr=787961510"
"491","5.411049","192.168.2.2","192.168.1.2","TCP","66","64000","5001  >  45662 [ACK] Seq=1 Ack=650153 Win=64000 Len=0 TSval=2321333533 TSecr=787961534"
"493","5.435548","192.168.2.2","192.168.1.2","TCP","66","64000","5001  >  45662 [ACK] Seq=1 Ack=653049 Win=64000 Len=0 TSval=2321333557 TSecr=787961559"
"495","5.459240","192.168.2.2","192.168.1.2","TCP","66","64000","5001  >  45662 [ACK] Seq=1 Ack=655945 Win=64000 Len=0 TSval=2321333581 TSecr=787961584"
"497","5.483549","192.168.2.2","192.168.1.2","TCP","66","64000","5001  >  45662 [ACK] Seq=1 Ack=658841 Win=64000 Len=0 TSval=2321333605 TSecr=787961608"
"499","5.508038","192.168.2.2","192.168.1.2","TCP","66","64000","5001  >  45662 [ACK] Seq=1 Ack=661737 Win=64000 Len=0 TSval=2321333630 TSecr=787961632"
"501","5.531928","192.168.2.2","192.168.1.2","TCP","66","64000","5001  >  45662 [ACK] Seq=1 Ack=664633 Win=64000 Len=0 TSval=2321333654 TSecr=787961657"
"503","5.556127","192.168.2.2","192.168.1.2","TCP","66","64000","5001  >  45662 [ACK] Seq=1 Ack=667529 Win=64000 Len=0 TSval=2321333678 TSecr=787961680"
"505","5.580543","192.168.2.2","192.168.1.2","TCP","66","64000","5001  >  45662 [ACK] Seq=1 Ack=670425 Win=64000 Len=0 TSval=2321333702 TSecr=787961705"
"507","5.604980","192.168.2.2","192.168.1.2","TCP","66","64000","5001  >  45662 [ACK] Seq=1 Ack=673321 Win=64000 Len=0 TSval=2321333727 TSecr=787961729"
"510","5.629480","192.168.2.2","192.168.1.2","TCP","66","64000","5001  >  45662 [ACK] Seq=1 Ack=676217 Win=64000 Len=0 TSval=2321333751 TSecr=787961753"
"512","5.653032","192.168.2.2","192.168.1.2","TCP","66","64000","5001  >  45662 [ACK] Seq=1 Ack=679113 Win=64000 Len=0 TSval=2321333775 TSecr=787961777"
"514","5.677505","192.168.2.2","192.168.1.2","TCP","66","64000","5001  >  45662 [ACK] Seq=1 Ack=682009 Win=64000 Len=0 TSval=2321333799 TSecr=787961802"
"516","5.701955","192.168.2.2","192.168.1.2","TCP","66","64000","5001  >  45662 [ACK] Seq=1 Ack=684905 Win=64000 Len=0 TSval=2321333824 TSecr=787961826"
"518","5.726569","192.168.2.2","192.168.1.2","TCP","66","64000","5001  >  45662 [ACK] Seq=1 Ack=687801 Win=64000 Len=0 TSval=2321333848 TSecr=787961850"
"520","5.749942","192.168.2.2","192.168.1.2","TCP","66","64000","5001  >  45662 [ACK] Seq=1 Ack=690697 Win=64000 Len=0 TSval=2321333872 TSecr=787961874"
"522","5.774449","192.168.2.2","192.168.1.2","TCP","66","64000","5001  >  45662 [ACK] Seq=1 Ack=693593 Win=64000 Len=0 TSval=2321333896 TSecr=787961899"
"524","5.798925","192.168.2.2","192.168.1.2","TCP","66","64000","5001  >  45662 [ACK] Seq=1 Ack=696489 Win=64000 Len=0 TSval=2321333921 TSecr=787961923"
"526","5.822623","192.168.2.2","192.168.1.2","TCP","66","64000","5001  >  45662 [ACK] Seq=1 Ack=699385 Win=64000 Len=0 TSval=2321333944 TSecr=787961947"
"528","5.846929","192.168.2.2","192.168.1.2","TCP","66","64000","5001  >  45662 [ACK] Seq=1 Ack=702281 Win=64000 Len=0 TSval=2321333969 TSecr=787961971"
"530","5.871432","192.168.2.2","192.168.1.2","TCP","66","64000","5001  >  45662 [ACK] Seq=1 Ack=705177 Win=64000 Len=0 TSval=2321333993 TSecr=787961996"
"532","5.895920","192.168.2.2","192.168.1.2","TCP","66","64000","5001  >  45662 [ACK] Seq=1 Ack=708073 Win=64000 Len=0 TSval=2321334018 TSecr=787962020"
"534","5.919640","192.168.2.2","192.168.1.2","TCP","66","64000","5001  >  45662 [ACK] Seq=1 Ack=710969 Win=64000 Len=0 TSval=2321334041 TSecr=787962044"
"536","5.943935","192.168.2.2","192.168.1.2","TCP","66","64000","5001  >  45662 [ACK] Seq=1 Ack=713865 Win=64000 Len=0 TSval=2321334066 TSecr=787962068"
"538","5.968406","192.168.2.2","192.168.1.2","TCP","66","64000","5001  >  45662 [ACK] Seq=1 Ack=716761 Win=64000 Len=0 TSval=2321334090 TSecr=787962093"
"540","5.992933","192.168.2.2","192.168.1.2","TCP","66","64000","5001  >  45662 [ACK] Seq=1 Ack=719657 Win=64000 Len=0 TSval=2321334115 TSecr=787962116"
"543","6.016400","192.168.2.2","192.168.1.2","TCP","66","64000","5001  >  45662 [ACK] Seq=1 Ack=722553 Win=64000 Len=0 TSval=2321334138 TSecr=787962141"
"545","6.041507","192.168.2.2","192.168.1.2","TCP","66","64000","5001  >  45662 [ACK] Seq=1 Ack=725449 Win=64000 Len=0 TSval=2321334163 TSecr=787962165"
"547","6.064899","192.168.2.2","192.168.1.2","TCP","66","64000","5001  >  45662 [ACK] Seq=1 Ack=728345 Win=64000 Len=0 TSval=2321334187 TSecr=787962190"
"549","6.089299","192.168.2.2","192.168.1.2","TCP","66","64000","5001  >  45662 [ACK] Seq=1 Ack=731241 Win=64000 Len=0 TSval=2321334211 TSecr=787962213"
"551","6.113407","192.168.2.2","192.168.1.2","TCP","66","64000","5001  >  45662 [ACK] Seq=1 Ack=734137 Win=64000 Len=0 TSval=2321334235 TSecr=787962238"
"553","6.138851","192.168.2.2","192.168.1.2","TCP","66","64000","5001  >  45662 [ACK] Seq=1 Ack=737033 Win=64000 Len=0 TSval=2321334261 TSecr=787962262"
"555","6.161747","192.168.2.2","192.168.1.2","TCP","66","64000","5001  >  45662 [ACK] Seq=1 Ack=739929 Win=64000 Len=0 TSval=2321334283 TSecr=787962287"
"558","6.186754","192.168.2.2","192.168.1.2","TCP","66","64000","5001  >  45662 [ACK] Seq=1 Ack=742825 Win=64000 Len=0 TSval=2321334308 TSecr=787962310"
"560","6.211350","192.168.2.2","192.168.1.2","TCP","66","69632","5001  >  45662 [ACK] Seq=1 Ack=745721 Win=69632 Len=0 TSval=2321334333 TSecr=787962335"
"562","6.235179","192.168.2.2","192.168.1.2","TCP","66","69632","5001  >  45662 [ACK] Seq=1 Ack=748617 Win=69632 Len=0 TSval=2321334357 TSecr=787962359"
"564","6.259406","192.168.2.2","192.168.1.2","TCP","66","69632","5001  >  45662 [ACK] Seq=1 Ack=751513 Win=69632 Len=0 TSval=2321334381 TSecr=787962383"
"566","6.283812","192.168.2.2","192.168.1.2","TCP","66","69632","5001  >  45662 [ACK] Seq=1 Ack=754409 Win=69632 Len=0 TSval=2321334406 TSecr=787962407"
"568","6.307862","192.168.2.2","192.168.1.2","TCP","66","69632","5001  >  45662 [ACK] Seq=1 Ack=757305 Win=69632 Len=0 TSval=2321334430 TSecr=787962433"
"570","6.332078","192.168.2.2","192.168.1.2","TCP","66","69632","5001  >  45662 [ACK] Seq=1 Ack=760201 Win=69632 Len=0 TSval=2321334454 TSecr=787962456"
"572","6.356295","192.168.2.2","192.168.1.2","TCP","66","69632","5001  >  45662 [ACK] Seq=1 Ack=763097 Win=69632 Len=0 TSval=2321334478 TSecr=787962481"
"574","6.380865","192.168.2.2","192.168.1.2","TCP","66","69632","5001  >  45662 [ACK] Seq=1 Ack=765993 Win=69632 Len=0 TSval=2321334503 TSecr=787962505"
"576","6.404839","192.168.2.2","192.168.1.2","TCP","66","69632","5001  >  45662 [ACK] Seq=1 Ack=768889 Win=69632 Len=0 TSval=2321334527 TSecr=787962529"
"578","6.428962","192.168.2.2","192.168.1.2","TCP","66","69632","5001  >  45662 [ACK] Seq=1 Ack=771785 Win=69632 Len=0 TSval=2321334551 TSecr=787962553"
