"No.","Time","Source","Destination","Protocol","Length","Calculated window size","Info"
"4","0.000314","192.168.2.2","192.168.1.2","TCP","74","43440","5001  >  44590 [SYN, ACK] Seq=0 Ack=1 Win=43440 Len=0 MSS=1460 SACK_PERM=1 TSval=2037699418 TSecr=1373958587 WS=512"
"7","0.000355","192.168.2.2","192.168.1.2","TCP","66","39936","5001  >  44590 [ACK] Seq=1 Ack=7241 Win=39936 Len=0 TSval=2037699418 TSecr=1373958587"
"12","0.049751","192.168.2.2","192.168.1.2","TCP","66","39936","5001  >  44590 [ACK] Seq=1 Ack=14481 Win=39936 Len=0 TSval=2037699467 TSecr=1373958587"
"14","0.110317","192.168.2.2","192.168.1.2","TCP","66","39936","5001  >  44590 [ACK] Seq=1 Ack=21721 Win=39936 Len=0 TSval=2037699528 TSecr=1373958587"
"16","0.170905","192.168.2.2","192.168.1.2","TCP","66","42496","5001  >  44590 [ACK] Seq=1 Ack=23169 Win=42496 Len=0 TSval=2037699588 TSecr=1373958600"
"17","0.183402","192.168.2.2","192.168.1.2","TCP","66","42496","5001  >  44590 [ACK] Seq=1 Ack=24617 Win=42496 Len=0 TSval=2037699601 TSecr=1373958664"
"19","0.195172","192.168.2.2","192.168.1.2","TCP","66","42496","5001  >  44590 [ACK] Seq=1 Ack=26065 Win=42496 Len=0 TSval=2037699613 TSecr=1373958747"
"21","0.207922","192.168.2.2","192.168.1.2","TCP","66","42496","5001  >  44590 [ACK] Seq=1 Ack=27513 Win=42496 Len=0 TSval=2037699625 TSecr=1373958770"
"24","0.219685","192.168.2.2","192.168.1.2","TCP","66","42496","5001  >  44590 [ACK] Seq=1 Ack=28961 Win=42496 Len=0 TSval=2037699637 TSecr=1373958782"
"26","0.231495","192.168.2.2","192.168.1.2","TCP","66","42496","5001  >  44590 [ACK] Seq=1 Ack=30409 Win=42496 Len=0 TSval=2037699649 TSecr=1373958794"
"28","0.243564","192.168.2.2","192.168.1.2","TCP","66","42496","5001  >  44590 [ACK] Seq=1 Ack=31857 Win=42496 Len=0 TSval=2037699661 TSecr=1373958794"
"30","0.255950","192.168.2.2","192.168.1.2","TCP","66","42496","5001  >  44590 [ACK] Seq=1 Ack=33305 Win=42496 Len=0 TSval=2037699673 TSecr=1373958806"
"32","0.267798","192.168.2.2","192.168.1.2","TCP","66","42496","5001  >  44590 [ACK] Seq=1 Ack=34753 Win=42496 Len=0 TSval=2037699685 TSecr=1373958818"
"34","0.280431","192.168.2.2","192.168.1.2","TCP","66","42496","5001  >  44590 [ACK] Seq=1 Ack=36201 Win=42496 Len=0 TSval=2037699698 TSecr=1373958830"
"36","0.292213","192.168.2.2","192.168.1.2","TCP","66","41984","5001  >  44590 [ACK] Seq=1 Ack=39097 Win=41984 Len=0 TSval=2037699710 TSecr=1373958842"
"38","0.316707","192.168.2.2","192.168.1.2","TCP","66","42496","5001  >  44590 [ACK] Seq=1 Ack=40545 Win=42496 Len=0 TSval=2037699734 TSecr=1373958854"
"40","0.341253","192.168.2.2","192.168.1.2","TCP","66","42496","5001  >  44590 [ACK] Seq=1 Ack=43441 Win=42496 Len=0 TSval=2037699759 TSecr=1373958867"
"42","0.352959","192.168.2.2","192.168.1.2","TCP","66","42496","5001  >  44590 [ACK] Seq=1 Ack=46337 Win=42496 Len=0 TSval=2037699770 TSecr=1373958903"
"45","0.376825","192.168.2.2","192.168.1.2","TCP","66","42496","5001  >  44590 [ACK] Seq=1 Ack=49233 Win=42496 Len=0 TSval=2037699794 TSecr=1373958928"
"48","0.401041","192.168.2.2","192.168.1.2","TCP","66","42496","5001  >  44590 [ACK] Seq=1 Ack=52129 Win=42496 Len=0 TSval=2037699818 TSecr=1373958939"
"51","0.438282","192.168.2.2","192.168.1.2","TCP","66","42496","5001  >  44590 [ACK] Seq=1 Ack=56473 Win=42496 Len=0 TSval=2037699856 TSecr=1373958939"
"53","0.461750","192.168.2.2","192.168.1.2","TCP","66","42496","5001  >  44590 [ACK] Seq=1 Ack=59369 Win=42496 Len=0 TSval=2037699879 TSecr=1373958987"
"57","0.485821","192.168.2.2","192.168.1.2","TCP","66","42496","5001  >  44590 [ACK] Seq=1 Ack=62265 Win=42496 Len=0 TSval=2037699903 TSecr=1373959025"
"59","0.510055","192.168.2.2","192.168.1.2","TCP","66","42496","5001  >  44590 [ACK] Seq=1 Ack=65161 Win=42496 Len=0 TSval=2037699927 TSecr=1373959048"
"61","0.546404","192.168.2.2","192.168.1.2","TCP","66","42496","5001  >  44590 [ACK] Seq=1 Ack=69505 Win=42496 Len=0 TSval=2037699964 TSecr=1373959048"
"64","0.570599","192.168.2.2","192.168.1.2","TCP","66","42496","5001  >  44590 [ACK] Seq=1 Ack=72401 Win=42496 Len=0 TSval=2037699988 TSecr=1373959096"
"66","0.595049","192.168.2.2","192.168.1.2","TCP","66","42496","5001  >  44590 [ACK] Seq=1 Ack=75297 Win=42496 Len=0 TSval=2037700012 TSecr=1373959133"
"68","0.619573","192.168.2.2","192.168.1.2","TCP","66","42496","5001  >  44590 [ACK] Seq=1 Ack=78193 Win=42496 Len=0 TSval=2037700037 TSecr=1373959133"
"70","0.644026","192.168.2.2","192.168.1.2","TCP","66","42496","5001  >  44590 [ACK] Seq=1 Ack=81089 Win=42496 Len=0 TSval=2037700061 TSecr=1373959157"
"72","0.668565","192.168.2.2","192.168.1.2","TCP","66","42496","5001  >  44590 [ACK] Seq=1 Ack=83985 Win=42496 Len=0 TSval=2037700086 TSecr=1373959181"
"74","0.693062","192.168.2.2","192.168.1.2","TCP","66","42496","5001  >  44590 [ACK] Seq=1 Ack=86881 Win=42496 Len=0 TSval=2037700110 TSecr=1373959206"
"76","0.716680","192.168.2.2","192.168.1.2","TCP","66","42496","5001  >  44590 [ACK] Seq=1 Ack=89777 Win=42496 Len=0 TSval=2037700134 TSecr=1373959230"
"78","0.741102","192.168.2.2","192.168.1.2","TCP","66","42496","5001  >  44590 [ACK] Seq=1 Ack=92673 Win=42496 Len=0 TSval=2037700158 TSecr=1373959255"
"80","0.765612","192.168.2.2","192.168.1.2","TCP","66","42496","5001  >  44590 [ACK] Seq=1 Ack=95569 Win=42496 Len=0 TSval=2037700183 TSecr=1373959279"
"82","0.790092","192.168.2.2","192.168.1.2","TCP","66","42496","5001  >  44590 [ACK] Seq=1 Ack=98465 Win=42496 Len=0 TSval=2037700207 TSecr=1373959303"
"85","0.817541","192.168.2.2","192.168.1.2","TCP","66","42496","5001  >  44590 [ACK] Seq=1 Ack=101361 Win=42496 Len=0 TSval=2037700235 TSecr=1373959327"
"87","0.837800","192.168.2.2","192.168.1.2","TCP","66","42496","5001  >  44590 [ACK] Seq=1 Ack=104257 Win=42496 Len=0 TSval=2037700255 TSecr=1373959352"
"89","0.862659","192.168.2.2","192.168.1.2","TCP","66","42496","5001  >  44590 [ACK] Seq=1 Ack=107153 Win=42496 Len=0 TSval=2037700280 TSecr=1373959376"
"91","0.898894","192.168.2.2","192.168.1.2","TCP","66","42496","5001  >  44590 [ACK] Seq=1 Ack=111497 Win=42496 Len=0 TSval=2037700316 TSecr=1373959376"
"93","0.922589","192.168.2.2","192.168.1.2","TCP","66","42496","5001  >  44590 [ACK] Seq=1 Ack=114393 Win=42496 Len=0 TSval=2037700340 TSecr=1373959424"
"95","0.946891","192.168.2.2","192.168.1.2","TCP","66","42496","5001  >  44590 [ACK] Seq=1 Ack=117289 Win=42496 Len=0 TSval=2037700364 TSecr=1373959449"
"98","0.971377","192.168.2.2","192.168.1.2","TCP","66","42496","5001  >  44590 [ACK] Seq=1 Ack=120185 Win=42496 Len=0 TSval=2037700388 TSecr=1373959485"
"100","0.995259","192.168.2.2","192.168.1.2","TCP","66","42496","5001  >  44590 [ACK] Seq=1 Ack=123081 Win=42496 Len=0 TSval=2037700412 TSecr=1373959509"
"103","1.019466","192.168.2.2","192.168.1.2","TCP","66","42496","5001  >  44590 [ACK] Seq=1 Ack=125977 Win=42496 Len=0 TSval=2037700437 TSecr=1373959533"
"105","1.055807","192.168.2.2","192.168.1.2","TCP","66","42496","5001  >  44590 [ACK] Seq=1 Ack=130321 Win=42496 Len=0 TSval=2037700473 TSecr=1373959552"
"108","1.081307","192.168.2.2","192.168.1.2","TCP","66","42496","5001  >  44590 [ACK] Seq=1 Ack=133217 Win=42496 Len=0 TSval=2037700498 TSecr=1373959581"
"111","1.106306","192.168.2.2","192.168.1.2","TCP","66","42496","5001  >  44590 [ACK] Seq=1 Ack=136113 Win=42496 Len=0 TSval=2037700523 TSecr=1373959606"
"113","1.131183","192.168.2.2","192.168.1.2","TCP","66","42496","5001  >  44590 [ACK] Seq=1 Ack=139009 Win=42496 Len=0 TSval=2037700548 TSecr=1373959642"
"116","1.154761","192.168.2.2","192.168.1.2","TCP","66","42496","5001  >  44590 [ACK] Seq=1 Ack=141905 Win=42496 Len=0 TSval=2037700572 TSecr=1373959642"
"118","1.179157","192.168.2.2","192.168.1.2","TCP","66","42496","5001  >  44590 [ACK] Seq=1 Ack=144801 Win=42496 Len=0 TSval=2037700596 TSecr=1373959667"
"120","1.203670","192.168.2.2","192.168.1.2","TCP","66","42496","5001  >  44590 [ACK] Seq=1 Ack=147697 Win=42496 Len=0 TSval=2037700621 TSecr=1373959692"
"122","1.228182","192.168.2.2","192.168.1.2","TCP","66","42496","5001  >  44590 [ACK] Seq=1 Ack=150593 Win=42496 Len=0 TSval=2037700645 TSecr=1373959717"
"124","1.264409","192.168.2.2","192.168.1.2","TCP","66","42496","5001  >  44590 [ACK] Seq=1 Ack=154937 Win=42496 Len=0 TSval=2037700681 TSecr=1373959741"
"127","1.288027","192.168.2.2","192.168.1.2","TCP","66","42496","5001  >  44590 [ACK] Seq=1 Ack=157833 Win=42496 Len=0 TSval=2037700705 TSecr=1373959790"
"129","1.312224","192.168.2.2","192.168.1.2","TCP","66","42496","5001  >  44590 [ACK] Seq=1 Ack=160729 Win=42496 Len=0 TSval=2037700729 TSecr=1373959814"
"131","1.336450","192.168.2.2","192.168.1.2","TCP","66","42496","5001  >  44590 [ACK] Seq=1 Ack=163625 Win=42496 Len=0 TSval=2037700753 TSecr=1373959850"
"133","1.361441","192.168.2.2","192.168.1.2","TCP","66","42496","5001  >  44590 [ACK] Seq=1 Ack=166521 Win=42496 Len=0 TSval=2037700778 TSecr=1373959850"
"136","1.385029","192.168.2.2","192.168.1.2","TCP","66","42496","5001  >  44590 [ACK] Seq=1 Ack=169417 Win=42496 Len=0 TSval=2037700802 TSecr=1373959874"
"140","1.409120","192.168.2.2","192.168.1.2","TCP","66","42496","5001  >  44590 [ACK] Seq=1 Ack=172313 Win=42496 Len=0 TSval=2037700826 TSecr=1373959898"
"144","1.445774","192.168.2.2","192.168.1.2","TCP","66","42496","5001  >  44590 [ACK] Seq=1 Ack=176657 Win=42496 Len=0 TSval=2037700863 TSecr=1373959922"
"146","1.469700","192.168.2.2","192.168.1.2","TCP","66","42496","5001  >  44590 [ACK] Seq=1 Ack=179553 Win=42496 Len=0 TSval=2037700887 TSecr=1373959947"
"148","1.494761","192.168.2.2","192.168.1.2","TCP","66","42496","5001  >  44590 [ACK] Seq=1 Ack=182449 Win=42496 Len=0 TSval=2037700912 TSecr=1373959971"
"151","1.518268","192.168.2.2","192.168.1.2","TCP","66","42496","5001  >  44590 [ACK] Seq=1 Ack=185345 Win=42496 Len=0 TSval=2037700935 TSecr=1373959995"
"153","1.542400","192.168.2.2","192.168.1.2","TCP","66","42496","5001  >  44590 [ACK] Seq=1 Ack=188241 Win=42496 Len=0 TSval=2037700959 TSecr=1373960032"
"155","1.566595","192.168.2.2","192.168.1.2","TCP","66","42496","5001  >  44590 [ACK] Seq=1 Ack=191137 Win=42496 Len=0 TSval=2037700983 TSecr=1373960056"
"157","1.590839","192.168.2.2","192.168.1.2","TCP","66","42496","5001  >  44590 [ACK] Seq=1 Ack=194033 Win=42496 Len=0 TSval=2037701008 TSecr=1373960081"
"159","1.627152","192.168.2.2","192.168.1.2","TCP","66","42496","5001  >  44590 [ACK] Seq=1 Ack=198377 Win=42496 Len=0 TSval=2037701044 TSecr=1373960081"
"161","1.652091","192.168.2.2","192.168.1.2","TCP","66","42496","5001  >  44590 [ACK] Seq=1 Ack=201273 Win=42496 Len=0 TSval=2037701069 TSecr=1373960128"
"163","1.676324","192.168.2.2","192.168.1.2","TCP","66","42496","5001  >  44590 [ACK] Seq=1 Ack=204169 Win=42496 Len=0 TSval=2037701093 TSecr=1373960152"
"166","1.700538","192.168.2.2","192.168.1.2","TCP","66","42496","5001  >  44590 [ACK] Seq=1 Ack=207065 Win=42496 Len=0 TSval=2037701117 TSecr=1373960177"
"169","1.725066","192.168.2.2","192.168.1.2","TCP","66","42496","5001  >  44590 [ACK] Seq=1 Ack=209961 Win=42496 Len=0 TSval=2037701142 TSecr=1373960213"
"171","1.749003","192.168.2.2","192.168.1.2","TCP","66","42496","5001  >  44590 [ACK] Seq=1 Ack=212857 Win=42496 Len=0 TSval=2037701166 TSecr=1373960238"
"173","1.774060","192.168.2.2","192.168.1.2","TCP","66","42496","5001  >  44590 [ACK] Seq=1 Ack=215753 Win=42496 Len=0 TSval=2037701191 TSecr=1373960262"
"175","1.811308","192.168.2.2","192.168.1.2","TCP","66","42496","5001  >  44590 [ACK] Seq=1 Ack=220097 Win=42496 Len=0 TSval=2037701228 TSecr=1373960262"
"178","1.833843","192.168.2.2","192.168.1.2","TCP","66","42496","5001  >  44590 [ACK] Seq=1 Ack=222993 Win=42496 Len=0 TSval=2037701250 TSecr=1373960311"
"180","1.858341","192.168.2.2","192.168.1.2","TCP","66","42496","5001  >  44590 [ACK] Seq=1 Ack=225889 Win=42496 Len=0 TSval=2037701275 TSecr=1373960335"
"182","1.882206","192.168.2.2","192.168.1.2","TCP","66","42496","5001  >  44590 [ACK] Seq=1 Ack=228785 Win=42496 Len=0 TSval=2037701299 TSecr=1373960360"
"184","1.906435","192.168.2.2","192.168.1.2","TCP","66","42496","5001  >  44590 [ACK] Seq=1 Ack=231681 Win=42496 Len=0 TSval=2037701323 TSecr=1373960397"
"186","1.930869","192.168.2.2","192.168.1.2","TCP","66","42496","5001  >  44590 [ACK] Seq=1 Ack=234577 Win=42496 Len=0 TSval=2037701347 TSecr=1373960397"
"188","1.954890","192.168.2.2","192.168.1.2","TCP","66","42496","5001  >  44590 [ACK] Seq=1 Ack=237473 Win=42496 Len=0 TSval=2037701371 TSecr=1373960420"
"190","1.991630","192.168.2.2","192.168.1.2","TCP","66","42496","5001  >  44590 [ACK] Seq=1 Ack=241817 Win=42496 Len=0 TSval=2037701408 TSecr=1373960444"
"193","2.015436","192.168.2.2","192.168.1.2","TCP","66","42496","5001  >  44590 [ACK] Seq=1 Ack=244713 Win=42496 Len=0 TSval=2037701432 TSecr=1373960492"
"196","2.039684","192.168.2.2","192.168.1.2","TCP","66","42496","5001  >  44590 [ACK] Seq=1 Ack=247609 Win=42496 Len=0 TSval=2037701456 TSecr=1373960517"
"198","2.064130","192.168.2.2","192.168.1.2","TCP","66","42496","5001  >  44590 [ACK] Seq=1 Ack=250505 Win=42496 Len=0 TSval=2037701481 TSecr=1373960541"
"200","2.088127","192.168.2.2","192.168.1.2","TCP","66","42496","5001  >  44590 [ACK] Seq=1 Ack=253401 Win=42496 Len=0 TSval=2037701505 TSecr=1373960577"
"202","2.112345","192.168.2.2","192.168.1.2","TCP","66","42496","5001  >  44590 [ACK] Seq=1 Ack=256297 Win=42496 Len=0 TSval=2037701529 TSecr=1373960577"
"204","2.136674","192.168.2.2","192.168.1.2","TCP","66","42496","5001  >  44590 [ACK] Seq=1 Ack=259193 Win=42496 Len=0 TSval=2037701553 TSecr=1373960601"
"207","2.173679","192.168.2.2","192.168.1.2","TCP","66","42496","5001  >  44590 [ACK] Seq=1 Ack=263537 Win=42496 Len=0 TSval=2037701590 TSecr=1373960625"
"210","2.198399","192.168.2.2","192.168.1.2","TCP","66","42496","5001  >  44590 [ACK] Seq=1 Ack=266433 Win=42496 Len=0 TSval=2037701615 TSecr=1373960674"
"212","2.222130","192.168.2.2","192.168.1.2","TCP","66","42496","5001  >  44590 [ACK] Seq=1 Ack=269329 Win=42496 Len=0 TSval=2037701639 TSecr=1373960698"
"214","2.246406","192.168.2.2","192.168.1.2","TCP","66","48128","5001  >  44590 [ACK] Seq=1 Ack=272225 Win=48128 Len=0 TSval=2037701663 TSecr=1373960722"
"216","2.270913","192.168.2.2","192.168.1.2","TCP","66","54272","5001  >  44590 [ACK] Seq=1 Ack=275121 Win=54272 Len=0 TSval=2037701687 TSecr=1373960759"
"218","2.295467","192.168.2.2","192.168.1.2","TCP","66","54784","5001  >  44590 [ACK] Seq=1 Ack=278017 Win=54784 Len=0 TSval=2037701712 TSecr=1373960759"
"220","2.319003","192.168.2.2","192.168.1.2","TCP","66","54784","5001  >  44590 [ACK] Seq=1 Ack=280913 Win=54784 Len=0 TSval=2037701735 TSecr=1373960784"
"223","2.343487","192.168.2.2","192.168.1.2","TCP","66","55296","5001  >  44590 [ACK] Seq=1 Ack=282361 Win=55296 Len=0 TSval=2037701760 TSecr=1373960808"
"225","2.356212","192.168.2.2","192.168.1.2","TCP","66","55296","5001  >  44590 [ACK] Seq=1 Ack=285257 Win=55296 Len=0 TSval=2037701773 TSecr=1373960832"
"228","2.379711","192.168.2.2","192.168.1.2","TCP","66","55296","5001  >  44590 [ACK] Seq=1 Ack=288153 Win=55296 Len=0 TSval=2037701796 TSecr=1373960857"
"230","2.403814","192.168.2.2","192.168.1.2","TCP","66","55296","5001  >  44590 [ACK] Seq=1 Ack=291049 Win=55296 Len=0 TSval=2037701820 TSecr=1373960881"
"232","2.428038","192.168.2.2","192.168.1.2","TCP","66","55296","5001  >  44590 [ACK] Seq=1 Ack=293945 Win=55296 Len=0 TSval=2037701844 TSecr=1373960905"
"234","2.452253","192.168.2.2","192.168.1.2","TCP","66","55296","5001  >  44590 [ACK] Seq=1 Ack=296841 Win=55296 Len=0 TSval=2037701869 TSecr=1373960905"
"236","2.488591","192.168.2.2","192.168.1.2","TCP","66","55296","5001  >  44590 [ACK] Seq=1 Ack=301185 Win=55296 Len=0 TSval=2037701905 TSecr=1373960929"
"238","2.512818","192.168.2.2","192.168.1.2","TCP","66","55296","5001  >  44590 [ACK] Seq=1 Ack=304081 Win=55296 Len=0 TSval=2037701929 TSecr=1373960965"
"240","2.537510","192.168.2.2","192.168.1.2","TCP","66","55296","5001  >  44590 [ACK] Seq=1 Ack=306977 Win=55296 Len=0 TSval=2037701954 TSecr=1373960989"
"242","2.561255","192.168.2.2","192.168.1.2","TCP","66","55296","5001  >  44590 [ACK] Seq=1 Ack=309873 Win=55296 Len=0 TSval=2037701978 TSecr=1373961013"
"244","2.585528","192.168.2.2","192.168.1.2","TCP","66","55296","5001  >  44590 [ACK] Seq=1 Ack=312769 Win=55296 Len=0 TSval=2037702002 TSecr=1373961038"
"246","2.609714","192.168.2.2","192.168.1.2","TCP","66","55296","5001  >  44590 [ACK] Seq=1 Ack=315665 Win=55296 Len=0 TSval=2037702026 TSecr=1373961074"
"248","2.634515","192.168.2.2","192.168.1.2","TCP","66","57344","5001  >  44590 [ACK] Seq=1 Ack=318561 Win=57344 Len=0 TSval=2037702051 TSecr=1373961098"
"250","2.659034","192.168.2.2","192.168.1.2","TCP","66","57344","5001  >  44590 [ACK] Seq=1 Ack=321457 Win=57344 Len=0 TSval=2037702075 TSecr=1373961123"
"252","2.682531","192.168.2.2","192.168.1.2","TCP","66","57344","5001  >  44590 [ACK] Seq=1 Ack=324353 Win=57344 Len=0 TSval=2037702099 TSecr=1373961147"
"254","2.707039","192.168.2.2","192.168.1.2","TCP","66","57344","5001  >  44590 [ACK] Seq=1 Ack=327249 Win=57344 Len=0 TSval=2037702123 TSecr=1373961171"
"256","2.730826","192.168.2.2","192.168.1.2","TCP","66","57344","5001  >  44590 [ACK] Seq=1 Ack=330145 Win=57344 Len=0 TSval=2037702147 TSecr=1373961195"
"258","2.755045","192.168.2.2","192.168.1.2","TCP","66","57344","5001  >  44590 [ACK] Seq=1 Ack=333041 Win=57344 Len=0 TSval=2037702171 TSecr=1373961220"
"260","2.779642","192.168.2.2","192.168.1.2","TCP","66","57344","5001  >  44590 [ACK] Seq=1 Ack=335937 Win=57344 Len=0 TSval=2037702196 TSecr=1373961244"
"262","2.803495","192.168.2.2","192.168.1.2","TCP","66","57344","5001  >  44590 [ACK] Seq=1 Ack=338833 Win=57344 Len=0 TSval=2037702220 TSecr=1373961268"
"264","2.828627","192.168.2.2","192.168.1.2","TCP","66","57344","5001  >  44590 [ACK] Seq=1 Ack=341729 Win=57344 Len=0 TSval=2037702245 TSecr=1373961292"
"267","2.852124","192.168.2.2","192.168.1.2","TCP","66","57344","5001  >  44590 [ACK] Seq=1 Ack=344625 Win=57344 Len=0 TSval=2037702268 TSecr=1373961316"
"269","2.876569","192.168.2.2","192.168.1.2","TCP","66","57344","5001  >  44590 [ACK] Seq=1 Ack=347521 Win=57344 Len=0 TSval=2037702293 TSecr=1373961340"
"271","2.901106","192.168.2.2","192.168.1.2","TCP","66","57344","5001  >  44590 [ACK] Seq=1 Ack=350417 Win=57344 Len=0 TSval=2037702317 TSecr=1373961365"
"273","2.924618","192.168.2.2","192.168.1.2","TCP","66","57344","5001  >  44590 [ACK] Seq=1 Ack=353313 Win=57344 Len=0 TSval=2037702341 TSecr=1373961389"
"275","2.949113","192.168.2.2","192.168.1.2","TCP","66","57344","5001  >  44590 [ACK] Seq=1 Ack=356209 Win=57344 Len=0 TSval=2037702365 TSecr=1373961414"
"277","2.973646","192.168.2.2","192.168.1.2","TCP","66","58368","5001  >  44590 [ACK] Seq=1 Ack=357657 Win=58368 Len=0 TSval=2037702390 TSecr=1373961414"
"279","2.985181","192.168.2.2","192.168.1.2","TCP","66","58368","5001  >  44590 [ACK] Seq=1 Ack=360553 Win=58368 Len=0 TSval=2037702401 TSecr=1373961437"
"281","3.009928","192.168.2.2","192.168.1.2","TCP","66","58368","5001  >  44590 [ACK] Seq=1 Ack=363449 Win=58368 Len=0 TSval=2037702426 TSecr=1373961462"
"284","3.034366","192.168.2.2","192.168.1.2","TCP","66","58368","5001  >  44590 [ACK] Seq=1 Ack=366345 Win=58368 Len=0 TSval=2037702450 TSecr=1373961486"
"286","3.057946","192.168.2.2","192.168.1.2","TCP","66","58368","5001  >  44590 [ACK] Seq=1 Ack=369241 Win=58368 Len=0 TSval=2037702474 TSecr=1373961510"
"288","3.082575","192.168.2.2","192.168.1.2","TCP","66","58368","5001  >  44590 [ACK] Seq=1 Ack=372137 Win=58368 Len=0 TSval=2037702499 TSecr=1373961534"
"290","3.106925","192.168.2.2","192.168.1.2","TCP","66","58368","5001  >  44590 [ACK] Seq=1 Ack=375033 Win=58368 Len=0 TSval=2037702523 TSecr=1373961559"
"292","3.130570","192.168.2.2","192.168.1.2","TCP","66","58368","5001  >  44590 [ACK] Seq=1 Ack=377929 Win=58368 Len=0 TSval=2037702547 TSecr=1373961570"
"294","3.155322","192.168.2.2","192.168.1.2","TCP","66","58368","5001  >  44590 [ACK] Seq=1 Ack=380825 Win=58368 Len=0 TSval=2037702571 TSecr=1373961595"
"297","3.179741","192.168.2.2","192.168.1.2","TCP","66","58368","5001  >  44590 [ACK] Seq=1 Ack=383721 Win=58368 Len=0 TSval=2037702596 TSecr=1373961619"
"299","3.216676","192.168.2.2","192.168.1.2","TCP","66","58368","5001  >  44590 [ACK] Seq=1 Ack=388065 Win=58368 Len=0 TSval=2037702633 TSecr=1373961643"
"302","3.240313","192.168.2.2","192.168.1.2","TCP","66","58368","5001  >  44590 [ACK] Seq=1 Ack=390961 Win=58368 Len=0 TSval=2037702656 TSecr=1373961692"
"304","3.264758","192.168.2.2","192.168.1.2","TCP","66","58368","5001  >  44590 [ACK] Seq=1 Ack=393857 Win=58368 Len=0 TSval=2037702681 TSecr=1373961716"
"306","3.289211","192.168.2.2","192.168.1.2","TCP","66","58368","5001  >  44590 [ACK] Seq=1 Ack=396753 Win=58368 Len=0 TSval=2037702705 TSecr=1373961740"
"308","3.312997","192.168.2.2","192.168.1.2","TCP","66","58368","5001  >  44590 [ACK] Seq=1 Ack=399649 Win=58368 Len=0 TSval=2037702729 TSecr=1373961765"
"310","3.337212","192.168.2.2","192.168.1.2","TCP","66","58368","5001  >  44590 [ACK] Seq=1 Ack=402545 Win=58368 Len=0 TSval=2037702753 TSecr=1373961802"
"312","3.361790","192.168.2.2","192.168.1.2","TCP","66","60416","5001  >  44590 [ACK] Seq=1 Ack=405441 Win=60416 Len=0 TSval=2037702778 TSecr=1373961802"
"314","3.385655","192.168.2.2","192.168.1.2","TCP","66","60416","5001  >  44590 [ACK] Seq=1 Ack=408337 Win=60416 Len=0 TSval=2037702802 TSecr=1373961825"
"316","3.409884","192.168.2.2","192.168.1.2","TCP","66","60416","5001  >  44590 [ACK] Seq=1 Ack=411233 Win=60416 Len=0 TSval=2037702826 TSecr=1373961850"
"318","3.434238","192.168.2.2","192.168.1.2","TCP","66","60416","5001  >  44590 [ACK] Seq=1 Ack=414129 Win=60416 Len=0 TSval=2037702850 TSecr=1373961874"
"320","3.458762","192.168.2.2","192.168.1.2","TCP","66","60416","5001  >  44590 [ACK] Seq=1 Ack=417025 Win=60416 Len=0 TSval=2037702875 TSecr=1373961898"
"322","3.482539","192.168.2.2","192.168.1.2","TCP","66","60416","5001  >  44590 [ACK] Seq=1 Ack=419921 Win=60416 Len=0 TSval=2037702898 TSecr=1373961922"
"324","3.506796","192.168.2.2","192.168.1.2","TCP","66","60416","5001  >  44590 [ACK] Seq=1 Ack=422817 Win=60416 Len=0 TSval=2037702923 TSecr=1373961947"
"326","3.530987","192.168.2.2","192.168.1.2","TCP","66","60416","5001  >  44590 [ACK] Seq=1 Ack=425713 Win=60416 Len=0 TSval=2037702947 TSecr=1373961971"
"328","3.555757","192.168.2.2","192.168.1.2","TCP","66","60416","5001  >  44590 [ACK] Seq=1 Ack=428609 Win=60416 Len=0 TSval=2037702972 TSecr=1373961995"
"330","3.580253","192.168.2.2","192.168.1.2","TCP","66","60416","5001  >  44590 [ACK] Seq=1 Ack=431505 Win=60416 Len=0 TSval=2037702996 TSecr=1373962019"
"332","3.603669","192.168.2.2","192.168.1.2","TCP","66","60416","5001  >  44590 [ACK] Seq=1 Ack=434401 Win=60416 Len=0 TSval=2037703019 TSecr=1373962044"
"334","3.628264","192.168.2.2","192.168.1.2","TCP","66","60416","5001  >  44590 [ACK] Seq=1 Ack=437297 Win=60416 Len=0 TSval=2037703044 TSecr=1373962068"
"336","3.652117","192.168.2.2","192.168.1.2","TCP","66","60416","5001  >  44590 [ACK] Seq=1 Ack=440193 Win=60416 Len=0 TSval=2037703068 TSecr=1373962092"
"338","3.676352","192.168.2.2","192.168.1.2","TCP","66","60416","5001  >  44590 [ACK] Seq=1 Ack=443089 Win=60416 Len=0 TSval=2037703092 TSecr=1373962116"
"340","3.700814","192.168.2.2","192.168.1.2","TCP","66","60416","5001  >  44590 [ACK] Seq=1 Ack=445985 Win=60416 Len=0 TSval=2037703117 TSecr=1373962141"
"342","3.724789","192.168.2.2","192.168.1.2","TCP","66","60416","5001  >  44590 [ACK] Seq=1 Ack=448881 Win=60416 Len=0 TSval=2037703140 TSecr=1373962165"
"344","3.749083","192.168.2.2","192.168.1.2","TCP","66","60416","5001  >  44590 [ACK] Seq=1 Ack=451777 Win=60416 Len=0 TSval=2037703165 TSecr=1373962189"
"346","3.773309","192.168.2.2","192.168.1.2","TCP","66","60416","5001  >  44590 [ACK] Seq=1 Ack=454673 Win=60416 Len=0 TSval=2037703189 TSecr=1373962213"
"348","3.797829","192.168.2.2","192.168.1.2","TCP","66","60416","5001  >  44590 [ACK] Seq=1 Ack=457569 Win=60416 Len=0 TSval=2037703213 TSecr=1373962237"
"350","3.821686","192.168.2.2","192.168.1.2","TCP","66","60416","5001  >  44590 [ACK] Seq=1 Ack=460465 Win=60416 Len=0 TSval=2037703237 TSecr=1373962261"
"352","3.845910","192.168.2.2","192.168.1.2","TCP","66","60416","5001  >  44590 [ACK] Seq=1 Ack=463361 Win=60416 Len=0 TSval=2037703262 TSecr=1373962286"
"354","3.870374","192.168.2.2","192.168.1.2","TCP","66","60416","5001  >  44590 [ACK] Seq=1 Ack=466257 Win=60416 Len=0 TSval=2037703286 TSecr=1373962310"
"356","3.894855","192.168.2.2","192.168.1.2","TCP","66","60416","5001  >  44590 [ACK] Seq=1 Ack=469153 Win=60416 Len=0 TSval=2037703310 TSecr=1373962334"
"358","3.918580","192.168.2.2","192.168.1.2","TCP","66","60416","5001  >  44590 [ACK] Seq=1 Ack=472049 Win=60416 Len=0 TSval=2037703334 TSecr=1373962358"
"360","3.942884","192.168.2.2","192.168.1.2","TCP","66","60416","5001  >  44590 [ACK] Seq=1 Ack=474945 Win=60416 Len=0 TSval=2037703358 TSecr=1373962383"
"362","3.967377","192.168.2.2","192.168.1.2","TCP","66","60416","5001  >  44590 [ACK] Seq=1 Ack=477841 Win=60416 Len=0 TSval=2037703383 TSecr=1373962407"
"364","3.991289","192.168.2.2","192.168.1.2","TCP","66","60416","5001  >  44590 [ACK] Seq=1 Ack=480737 Win=60416 Len=0 TSval=2037703407 TSecr=1373962431"
"366","4.015517","192.168.2.2","192.168.1.2","TCP","66","60416","5001  >  44590 [ACK] Seq=1 Ack=483633 Win=60416 Len=0 TSval=2037703431 TSecr=1373962455"
"370","4.039898","192.168.2.2","192.168.1.2","TCP","66","60416","5001  >  44590 [ACK] Seq=1 Ack=486529 Win=60416 Len=0 TSval=2037703455 TSecr=1373962480"
"372","4.063932","192.168.2.2","192.168.1.2","TCP","66","60416","5001  >  44590 [ACK] Seq=1 Ack=489425 Win=60416 Len=0 TSval=2037703479 TSecr=1373962503"
"374","4.088907","192.168.2.2","192.168.1.2","TCP","66","60416","5001  >  44590 [ACK] Seq=1 Ack=492321 Win=60416 Len=0 TSval=2037703504 TSecr=1373962528"
"376","4.112449","192.168.2.2","192.168.1.2","TCP","66","60416","5001  >  44590 [ACK] Seq=1 Ack=495217 Win=60416 Len=0 TSval=2037703528 TSecr=1373962552"
"378","4.136925","192.168.2.2","192.168.1.2","TCP","66","60416","5001  >  44590 [ACK] Seq=1 Ack=498113 Win=60416 Len=0 TSval=2037703552 TSecr=1373962576"
"380","4.160833","192.168.2.2","192.168.1.2","TCP","66","60416","5001  >  44590 [ACK] Seq=1 Ack=501009 Win=60416 Len=0 TSval=2037703576 TSecr=1373962600"
"382","4.185048","192.168.2.2","192.168.1.2","TCP","66","61440","5001  >  44590 [ACK] Seq=1 Ack=502457 Win=61440 Len=0 TSval=2037703601 TSecr=1373962606"
"385","4.197948","192.168.2.2","192.168.1.2","TCP","66","61440","5001  >  44590 [ACK] Seq=1 Ack=505353 Win=61440 Len=0 TSval=2037703613 TSecr=1373962625"
"387","4.222227","192.168.2.2","192.168.1.2","TCP","66","61440","5001  >  44590 [ACK] Seq=1 Ack=508249 Win=61440 Len=0 TSval=2037703638 TSecr=1373962649"
"389","4.246453","192.168.2.2","192.168.1.2","TCP","66","61440","5001  >  44590 [ACK] Seq=1 Ack=511145 Win=61440 Len=0 TSval=2037703662 TSecr=1373962673"
"391","4.271213","192.168.2.2","192.168.1.2","TCP","66","61440","5001  >  44590 [ACK] Seq=1 Ack=514041 Win=61440 Len=0 TSval=2037703687 TSecr=1373962697"
"393","4.294871","192.168.2.2","192.168.1.2","TCP","66","61440","5001  >  44590 [ACK] Seq=1 Ack=516937 Win=61440 Len=0 TSval=2037703710 TSecr=1373962722"
"395","4.319242","192.168.2.2","192.168.1.2","TCP","66","61440","5001  >  44590 [ACK] Seq=1 Ack=519833 Win=61440 Len=0 TSval=2037703735 TSecr=1373962746"
"397","4.355488","192.168.2.2","192.168.1.2","TCP","66","61440","5001  >  44590 [ACK] Seq=1 Ack=524177 Win=61440 Len=0 TSval=2037703771 TSecr=1373962770"
"399","4.380002","192.168.2.2","192.168.1.2","TCP","66","61440","5001  >  44590 [ACK] Seq=1 Ack=527073 Win=61440 Len=0 TSval=2037703795 TSecr=1373962807"
"401","4.403857","192.168.2.2","192.168.1.2","TCP","66","61440","5001  >  44590 [ACK] Seq=1 Ack=529969 Win=61440 Len=0 TSval=2037703819 TSecr=1373962831"
"403","4.428123","192.168.2.2","192.168.1.2","TCP","66","61440","5001  >  44590 [ACK] Seq=1 Ack=532865 Win=61440 Len=0 TSval=2037703843 TSecr=1373962856"
"405","4.452502","192.168.2.2","192.168.1.2","TCP","66","61440","5001  >  44590 [ACK] Seq=1 Ack=535761 Win=61440 Len=0 TSval=2037703868 TSecr=1373962879"
"407","4.476536","192.168.2.2","192.168.1.2","TCP","66","61440","5001  >  44590 [ACK] Seq=1 Ack=538657 Win=61440 Len=0 TSval=2037703892 TSecr=1373962904"
"409","4.500766","192.168.2.2","192.168.1.2","TCP","66","61440","5001  >  44590 [ACK] Seq=1 Ack=541553 Win=61440 Len=0 TSval=2037703916 TSecr=1373962940"
"412","4.525128","192.168.2.2","192.168.1.2","TCP","66","61440","5001  >  44590 [ACK] Seq=1 Ack=544449 Win=61440 Len=0 TSval=2037703940 TSecr=1373962964"
"414","4.549207","192.168.2.2","192.168.1.2","TCP","66","61440","5001  >  44590 [ACK] Seq=1 Ack=547345 Win=61440 Len=0 TSval=2037703964 TSecr=1373962988"
"416","4.574030","192.168.2.2","192.168.1.2","TCP","66","63488","5001  >  44590 [ACK] Seq=1 Ack=550241 Win=63488 Len=0 TSval=2037703989 TSecr=1373963013"
"418","4.597645","192.168.2.2","192.168.1.2","TCP","66","63488","5001  >  44590 [ACK] Seq=1 Ack=553137 Win=63488 Len=0 TSval=2037704013 TSecr=1373963037"
"420","4.621852","192.168.2.2","192.168.1.2","TCP","66","63488","5001  >  44590 [ACK] Seq=1 Ack=556033 Win=63488 Len=0 TSval=2037704037 TSecr=1373963061"
"422","4.646537","192.168.2.2","192.168.1.2","TCP","66","63488","5001  >  44590 [ACK] Seq=1 Ack=558929 Win=63488 Len=0 TSval=2037704062 TSecr=1373963085"
"424","4.670297","192.168.2.2","192.168.1.2","TCP","66","64000","5001  >  44590 [ACK] Seq=1 Ack=560377 Win=64000 Len=0 TSval=2037704086 TSecr=1373963109"
"426","4.682425","192.168.2.2","192.168.1.2","TCP","66","64000","5001  >  44590 [ACK] Seq=1 Ack=563273 Win=64000 Len=0 TSval=2037704098 TSecr=1373963109"
"428","4.707335","192.168.2.2","192.168.1.2","TCP","66","64000","5001  >  44590 [ACK] Seq=1 Ack=566169 Win=64000 Len=0 TSval=2037704123 TSecr=1373963134"
"430","4.730894","192.168.2.2","192.168.1.2","TCP","66","64000","5001  >  44590 [ACK] Seq=1 Ack=569065 Win=64000 Len=0 TSval=2037704146 TSecr=1373963159"
"432","4.755373","192.168.2.2","192.168.1.2","TCP","66","64000","5001  >  44590 [ACK] Seq=1 Ack=571961 Win=64000 Len=0 TSval=2037704171 TSecr=1373963182"
"434","4.779340","192.168.2.2","192.168.1.2","TCP","66","64000","5001  >  44590 [ACK] Seq=1 Ack=574857 Win=64000 Len=0 TSval=2037704195 TSecr=1373963206"
"436","4.803568","192.168.2.2","192.168.1.2","TCP","66","64000","5001  >  44590 [ACK] Seq=1 Ack=577753 Win=64000 Len=0 TSval=2037704219 TSecr=1373963231"
"438","4.839943","192.168.2.2","192.168.1.2","TCP","66","64000","5001  >  44590 [ACK] Seq=1 Ack=582097 Win=64000 Len=0 TSval=2037704255 TSecr=1373963255"
"441","4.864164","192.168.2.2","192.168.1.2","TCP","66","64000","5001  >  44590 [ACK] Seq=1 Ack=584993 Win=64000 Len=0 TSval=2037704279 TSecr=1373963292"
"443","4.888652","192.168.2.2","192.168.1.2","TCP","66","64000","5001  >  44590 [ACK] Seq=1 Ack=587889 Win=64000 Len=0 TSval=2037704304 TSecr=1373963315"
"445","4.924900","192.168.2.2","192.168.1.2","TCP","66","64000","5001  >  44590 [ACK] Seq=1 Ack=592233 Win=64000 Len=0 TSval=2037704340 TSecr=1373963340"
"447","4.949399","192.168.2.2","192.168.1.2","TCP","66","64000","5001  >  44590 [ACK] Seq=1 Ack=595129 Win=64000 Len=0 TSval=2037704364 TSecr=1373963388"
"449","4.973935","192.168.2.2","192.168.1.2","TCP","66","64000","5001  >  44590 [ACK] Seq=1 Ack=598025 Win=64000 Len=0 TSval=2037704389 TSecr=1373963424"
"451","4.997408","192.168.2.2","192.168.1.2","TCP","66","64000","5001  >  44590 [ACK] Seq=1 Ack=600921 Win=64000 Len=0 TSval=2037704412 TSecr=1373963424"
"454","5.021942","192.168.2.2","192.168.1.2","TCP","66","64000","5001  >  44590 [ACK] Seq=1 Ack=603817 Win=64000 Len=0 TSval=2037704437 TSecr=1373963448"
"457","5.045791","192.168.2.2","192.168.1.2","TCP","66","64000","5001  >  44590 [ACK] Seq=1 Ack=606713 Win=64000 Len=0 TSval=2037704461 TSecr=1373963473"
"459","5.070019","192.168.2.2","192.168.1.2","TCP","66","64000","5001  >  44590 [ACK] Seq=1 Ack=609609 Win=64000 Len=0 TSval=2037704485 TSecr=1373963509"
"461","5.094465","192.168.2.2","192.168.1.2","TCP","66","64000","5001  >  44590 [ACK] Seq=1 Ack=612505 Win=64000 Len=0 TSval=2037704509 TSecr=1373963534"
"465","5.118942","192.168.2.2","192.168.1.2","TCP","66","64000","5001  >  44590 [ACK] Seq=1 Ack=615401 Win=64000 Len=0 TSval=2037704534 TSecr=1373963558"
"467","5.142691","192.168.2.2","192.168.1.2","TCP","66","64000","5001  >  44590 [ACK] Seq=1 Ack=618297 Win=64000 Len=0 TSval=2037704558 TSecr=1373963582"
"469","5.179713","192.168.2.2","192.168.1.2","TCP","66","64000","5001  >  44590 [ACK] Seq=1 Ack=622641 Win=64000 Len=0 TSval=2037704595 TSecr=1373963582"
"473","5.204028","192.168.2.2","192.168.1.2","TCP","66","64000","5001  >  44590 [ACK] Seq=1 Ack=625537 Win=64000 Len=0 TSval=2037704619 TSecr=1373963630"
"475","5.228707","192.168.2.2","192.168.1.2","TCP","66","64000","5001  >  44590 [ACK] Seq=1 Ack=628433 Win=64000 Len=0 TSval=2037704644 TSecr=1373963654"
"477","5.252501","192.168.2.2","192.168.1.2","TCP","66","64000","5001  >  44590 [ACK] Seq=1 Ack=631329 Win=64000 Len=0 TSval=2037704667 TSecr=1373963679"
"479","5.277048","192.168.2.2","192.168.1.2","TCP","66","64000","5001  >  44590 [ACK] Seq=1 Ack=634225 Win=64000 Len=0 TSval=2037704692 TSecr=1373963703"
"481","5.301288","192.168.2.2","192.168.1.2","TCP","66","64000","5001  >  44590 [ACK] Seq=1 Ack=637121 Win=64000 Len=0 TSval=2037704716 TSecr=1373963727"
"483","5.325766","192.168.2.2","192.168.1.2","TCP","66","64000","5001  >  44590 [ACK] Seq=1 Ack=640017 Win=64000 Len=0 TSval=2037704741 TSecr=1373963764"
"485","5.350304","192.168.2.2","192.168.1.2","TCP","66","64000","5001  >  44590 [ACK] Seq=1 Ack=642913 Win=64000 Len=0 TSval=2037704765 TSecr=1373963764"
"487","5.373946","192.168.2.2","192.168.1.2","TCP","66","64000","5001  >  44590 [ACK] Seq=1 Ack=645809 Win=64000 Len=0 TSval=2037704789 TSecr=1373963788"
"489","5.398270","192.168.2.2","192.168.1.2","TCP","66","64000","5001  >  44590 [ACK] Seq=1 Ack=648705 Win=64000 Len=0 TSval=2037704813 TSecr=1373963813"
"491","5.422827","192.168.2.2","192.168.1.2","TCP","66","64000","5001  >  44590 [ACK] Seq=1 Ack=651601 Win=64000 Len=0 TSval=2037704838 TSecr=1373963836"
"493","5.446606","192.168.2.2","192.168.1.2","TCP","66","64000","5001  >  44590 [ACK] Seq=1 Ack=654497 Win=64000 Len=0 TSval=2037704861 TSecr=1373963861"
"495","5.471773","192.168.2.2","192.168.1.2","TCP","66","64000","5001  >  44590 [ACK] Seq=1 Ack=657393 Win=64000 Len=0 TSval=2037704887 TSecr=1373963885"
"497","5.495295","192.168.2.2","192.168.1.2","TCP","66","64000","5001  >  44590 [ACK] Seq=1 Ack=660289 Win=64000 Len=0 TSval=2037704910 TSecr=1373963910"
"499","5.519792","192.168.2.2","192.168.1.2","TCP","66","64000","5001  >  44590 [ACK] Seq=1 Ack=663185 Win=64000 Len=0 TSval=2037704935 TSecr=1373963934"
"501","5.544061","192.168.2.2","192.168.1.2","TCP","66","64000","5001  >  44590 [ACK] Seq=1 Ack=666081 Win=64000 Len=0 TSval=2037704959 TSecr=1373963958"
"503","5.568769","192.168.2.2","192.168.1.2","TCP","66","64000","5001  >  44590 [ACK] Seq=1 Ack=668977 Win=64000 Len=0 TSval=2037704984 TSecr=1373963982"
"505","5.593289","192.168.2.2","192.168.1.2","TCP","66","64000","5001  >  44590 [ACK] Seq=1 Ack=671873 Win=64000 Len=0 TSval=2037705008 TSecr=1373964007"
"507","5.616800","192.168.2.2","192.168.1.2","TCP","66","64000","5001  >  44590 [ACK] Seq=1 Ack=674769 Win=64000 Len=0 TSval=2037705032 TSecr=1373964030"
"510","5.641177","192.168.2.2","192.168.1.2","TCP","66","64000","5001  >  44590 [ACK] Seq=1 Ack=677665 Win=64000 Len=0 TSval=2037705056 TSecr=1373964056"
"512","5.665169","192.168.2.2","192.168.1.2","TCP","66","64000","5001  >  44590 [ACK] Seq=1 Ack=680561 Win=64000 Len=0 TSval=2037705080 TSecr=1373964079"
"514","5.689390","192.168.2.2","192.168.1.2","TCP","66","64000","5001  >  44590 [ACK] Seq=1 Ack=683457 Win=64000 Len=0 TSval=2037705104 TSecr=1373964104"
"516","5.713875","192.168.2.2","192.168.1.2","TCP","66","64000","5001  >  44590 [ACK] Seq=1 Ack=686353 Win=64000 Len=0 TSval=2037705129 TSecr=1373964128"
"518","5.738320","192.168.2.2","192.168.1.2","TCP","66","64000","5001  >  44590 [ACK] Seq=1 Ack=689249 Win=64000 Len=0 TSval=2037705153 TSecr=1373964153"
"520","5.762850","192.168.2.2","192.168.1.2","TCP","66","64000","5001  >  44590 [ACK] Seq=1 Ack=692145 Win=64000 Len=0 TSval=2037705178 TSecr=1373964177"
"522","5.786316","192.168.2.2","192.168.1.2","TCP","66","64000","5001  >  44590 [ACK] Seq=1 Ack=695041 Win=64000 Len=0 TSval=2037705201 TSecr=1373964201"
"524","5.813875","192.168.2.2","192.168.1.2","TCP","66","64000","5001  >  44590 [ACK] Seq=1 Ack=697937 Win=64000 Len=0 TSval=2037705229 TSecr=1373964225"
"526","5.835384","192.168.2.2","192.168.1.2","TCP","66","64000","5001  >  44590 [ACK] Seq=1 Ack=700833 Win=64000 Len=0 TSval=2037705250 TSecr=1373964249"
"528","5.858991","192.168.2.2","192.168.1.2","TCP","66","64000","5001  >  44590 [ACK] Seq=1 Ack=703729 Win=64000 Len=0 TSval=2037705274 TSecr=1373964273"
"531","5.883437","192.168.2.2","192.168.1.2","TCP","66","64000","5001  >  44590 [ACK] Seq=1 Ack=706625 Win=64000 Len=0 TSval=2037705298 TSecr=1373964298"
"533","5.907921","192.168.2.2","192.168.1.2","TCP","66","64000","5001  >  44590 [ACK] Seq=1 Ack=709521 Win=64000 Len=0 TSval=2037705323 TSecr=1373964322"
"535","5.932463","192.168.2.2","192.168.1.2","TCP","66","64000","5001  >  44590 [ACK] Seq=1 Ack=712417 Win=64000 Len=0 TSval=2037705347 TSecr=1373964347"
"537","5.955897","192.168.2.2","192.168.1.2","TCP","66","64000","5001  >  44590 [ACK] Seq=1 Ack=715313 Win=64000 Len=0 TSval=2037705370 TSecr=1373964370"
"539","5.980452","192.168.2.2","192.168.1.2","TCP","66","64000","5001  >  44590 [ACK] Seq=1 Ack=718209 Win=64000 Len=0 TSval=2037705395 TSecr=1373964398"
"541","6.004900","192.168.2.2","192.168.1.2","TCP","66","64000","5001  >  44590 [ACK] Seq=1 Ack=721105 Win=64000 Len=0 TSval=2037705419 TSecr=1373964419"
"544","6.028563","192.168.2.2","192.168.1.2","TCP","66","64000","5001  >  44590 [ACK] Seq=1 Ack=724001 Win=64000 Len=0 TSval=2037705443 TSecr=1373964443"
"546","6.052950","192.168.2.2","192.168.1.2","TCP","66","64000","5001  >  44590 [ACK] Seq=1 Ack=726897 Win=64000 Len=0 TSval=2037705467 TSecr=1373964467"
"548","6.077440","192.168.2.2","192.168.1.2","TCP","66","64000","5001  >  44590 [ACK] Seq=1 Ack=729793 Win=64000 Len=0 TSval=2037705492 TSecr=1373964492"
"550","6.101979","192.168.2.2","192.168.1.2","TCP","66","64000","5001  >  44590 [ACK] Seq=1 Ack=732689 Win=64000 Len=0 TSval=2037705516 TSecr=1373964516"
"552","6.125434","192.168.2.2","192.168.1.2","TCP","66","64000","5001  >  44590 [ACK] Seq=1 Ack=735585 Win=64000 Len=0 TSval=2037705540 TSecr=1373964540"
"554","6.149676","192.168.2.2","192.168.1.2","TCP","66","64000","5001  >  44590 [ACK] Seq=1 Ack=738481 Win=64000 Len=0 TSval=2037705564 TSecr=1373964564"
"556","6.174448","192.168.2.2","192.168.1.2","TCP","66","64000","5001  >  44590 [ACK] Seq=1 Ack=741377 Win=64000 Len=0 TSval=2037705589 TSecr=1373964589"
"559","6.198941","192.168.2.2","192.168.1.2","TCP","66","64000","5001  >  44590 [ACK] Seq=1 Ack=744273 Win=64000 Len=0 TSval=2037705613 TSecr=1373964612"
"561","6.223468","192.168.2.2","192.168.1.2","TCP","66","64000","5001  >  44590 [ACK] Seq=1 Ack=747169 Win=64000 Len=0 TSval=2037705638 TSecr=1373964637"
"563","6.247348","192.168.2.2","192.168.1.2","TCP","66","64000","5001  >  44590 [ACK] Seq=1 Ack=750065 Win=64000 Len=0 TSval=2037705662 TSecr=1373964661"
"565","6.271587","192.168.2.2","192.168.1.2","TCP","66","64000","5001  >  44590 [ACK] Seq=1 Ack=752961 Win=64000 Len=0 TSval=2037705686 TSecr=1373964686"
"567","6.296030","192.168.2.2","192.168.1.2","TCP","66","64000","5001  >  44590 [ACK] Seq=1 Ack=755857 Win=64000 Len=0 TSval=2037705710 TSecr=1373964709"
"569","6.320495","192.168.2.2","192.168.1.2","TCP","66","64000","5001  >  44590 [ACK] Seq=1 Ack=758753 Win=64000 Len=0 TSval=2037705735 TSecr=1373964733"
"571","6.344973","192.168.2.2","192.168.1.2","TCP","66","64000","5001  >  44590 [ACK] Seq=1 Ack=761649 Win=64000 Len=0 TSval=2037705759 TSecr=1373964758"
