"No.","Time","Source","Destination","Protocol","Length","Calculated window size","Info"
"4","0.000985","192.168.2.2","192.168.1.2","TCP","74","43440","5001  >  44492 [SYN, ACK] Seq=0 Ack=1 Win=43440 Len=0 MSS=1460 SACK_PERM=1 TSval=1707330421 TSecr=935599847 WS=512"
"7","0.001033","192.168.2.2","192.168.1.2","TCP","66","39936","5001  >  44492 [ACK] Seq=1 Ack=7241 Win=39936 Len=0 TSval=1707330421 TSecr=935599847"
"11","0.050102","192.168.2.2","192.168.1.2","TCP","66","39936","5001  >  44492 [ACK] Seq=1 Ack=14481 Win=39936 Len=0 TSval=1707330470 TSecr=935599847"
"13","0.112528","192.168.2.2","192.168.1.2","TCP","66","39936","5001  >  44492 [ACK] Seq=1 Ack=21721 Win=39936 Len=0 TSval=1707330533 TSecr=935599847"
"15","0.171008","192.168.2.2","192.168.1.2","TCP","66","42496","5001  >  44492 [ACK] Seq=1 Ack=23169 Win=42496 Len=0 TSval=1707330591 TSecr=935599863"
"16","0.183383","192.168.2.2","192.168.1.2","TCP","66","42496","5001  >  44492 [ACK] Seq=1 Ack=24617 Win=42496 Len=0 TSval=1707330604 TSecr=935599922"
"18","0.195246","192.168.2.2","192.168.1.2","TCP","66","42496","5001  >  44492 [ACK] Seq=1 Ack=26065 Win=42496 Len=0 TSval=1707330615 TSecr=935600010"
"20","0.207375","192.168.2.2","192.168.1.2","TCP","66","42496","5001  >  44492 [ACK] Seq=1 Ack=27513 Win=42496 Len=0 TSval=1707330628 TSecr=935600030"
"23","0.219601","192.168.2.2","192.168.1.2","TCP","66","42496","5001  >  44492 [ACK] Seq=1 Ack=28961 Win=42496 Len=0 TSval=1707330640 TSecr=935600042"
"25","0.232368","192.168.2.2","192.168.1.2","TCP","66","42496","5001  >  44492 [ACK] Seq=1 Ack=30409 Win=42496 Len=0 TSval=1707330653 TSecr=935600054"
"27","0.244124","192.168.2.2","192.168.1.2","TCP","66","42496","5001  >  44492 [ACK] Seq=1 Ack=31857 Win=42496 Len=0 TSval=1707330664 TSecr=935600054"
"29","0.255896","192.168.2.2","192.168.1.2","TCP","66","42496","5001  >  44492 [ACK] Seq=1 Ack=33305 Win=42496 Len=0 TSval=1707330676 TSecr=935600066"
"31","0.268186","192.168.2.2","192.168.1.2","TCP","66","42496","5001  >  44492 [ACK] Seq=1 Ack=34753 Win=42496 Len=0 TSval=1707330688 TSecr=935600079"
"33","0.280042","192.168.2.2","192.168.1.2","TCP","66","42496","5001  >  44492 [ACK] Seq=1 Ack=36201 Win=42496 Len=0 TSval=1707330700 TSecr=935600090"
"35","0.292150","192.168.2.2","192.168.1.2","TCP","66","41984","5001  >  44492 [ACK] Seq=1 Ack=39097 Win=41984 Len=0 TSval=1707330712 TSecr=935600102"
"37","0.316386","192.168.2.2","192.168.1.2","TCP","66","42496","5001  >  44492 [ACK] Seq=1 Ack=40545 Win=42496 Len=0 TSval=1707330737 TSecr=935600114"
"39","0.340748","192.168.2.2","192.168.1.2","TCP","66","42496","5001  >  44492 [ACK] Seq=1 Ack=43441 Win=42496 Len=0 TSval=1707330761 TSecr=935600126"
"41","0.353452","192.168.2.2","192.168.1.2","TCP","66","42496","5001  >  44492 [ACK] Seq=1 Ack=46337 Win=42496 Len=0 TSval=1707330774 TSecr=935600163"
"44","0.378074","192.168.2.2","192.168.1.2","TCP","66","42496","5001  >  44492 [ACK] Seq=1 Ack=49233 Win=42496 Len=0 TSval=1707330798 TSecr=935600187"
"46","0.401961","192.168.2.2","192.168.1.2","TCP","66","42496","5001  >  44492 [ACK] Seq=1 Ack=52129 Win=42496 Len=0 TSval=1707330822 TSecr=935600200"
"48","0.438770","192.168.2.2","192.168.1.2","TCP","66","42496","5001  >  44492 [ACK] Seq=1 Ack=56473 Win=42496 Len=0 TSval=1707330859 TSecr=935600200"
"50","0.463234","192.168.2.2","192.168.1.2","TCP","66","42496","5001  >  44492 [ACK] Seq=1 Ack=59369 Win=42496 Len=0 TSval=1707330883 TSecr=935600248"
"52","0.486776","192.168.2.2","192.168.1.2","TCP","66","42496","5001  >  44492 [ACK] Seq=1 Ack=62265 Win=42496 Len=0 TSval=1707330907 TSecr=935600285"
"55","0.511325","192.168.2.2","192.168.1.2","TCP","66","42496","5001  >  44492 [ACK] Seq=1 Ack=65161 Win=42496 Len=0 TSval=1707330931 TSecr=935600309"
"57","0.535784","192.168.2.2","192.168.1.2","TCP","66","42496","5001  >  44492 [ACK] Seq=1 Ack=68057 Win=42496 Len=0 TSval=1707330956 TSecr=935600333"
"59","0.572037","192.168.2.2","192.168.1.2","TCP","66","42496","5001  >  44492 [ACK] Seq=1 Ack=72401 Win=42496 Len=0 TSval=1707330992 TSecr=935600333"
"62","0.596517","192.168.2.2","192.168.1.2","TCP","66","42496","5001  >  44492 [ACK] Seq=1 Ack=75297 Win=42496 Len=0 TSval=1707331017 TSecr=935600382"
"64","0.620066","192.168.2.2","192.168.1.2","TCP","66","42496","5001  >  44492 [ACK] Seq=1 Ack=78193 Win=42496 Len=0 TSval=1707331040 TSecr=935600418"
"66","0.644544","192.168.2.2","192.168.1.2","TCP","66","42496","5001  >  44492 [ACK] Seq=1 Ack=81089 Win=42496 Len=0 TSval=1707331065 TSecr=935600418"
"68","0.668369","192.168.2.2","192.168.1.2","TCP","66","42496","5001  >  44492 [ACK] Seq=1 Ack=83985 Win=42496 Len=0 TSval=1707331088 TSecr=935600443"
"71","0.692690","192.168.2.2","192.168.1.2","TCP","66","42496","5001  >  44492 [ACK] Seq=1 Ack=86881 Win=42496 Len=0 TSval=1707331113 TSecr=935600466"
"73","0.716831","192.168.2.2","192.168.1.2","TCP","66","42496","5001  >  44492 [ACK] Seq=1 Ack=89777 Win=42496 Len=0 TSval=1707331137 TSecr=935600491"
"75","0.741723","192.168.2.2","192.168.1.2","TCP","66","42496","5001  >  44492 [ACK] Seq=1 Ack=92673 Win=42496 Len=0 TSval=1707331162 TSecr=935600514"
"77","0.765971","192.168.2.2","192.168.1.2","TCP","66","42496","5001  >  44492 [ACK] Seq=1 Ack=95569 Win=42496 Len=0 TSval=1707331186 TSecr=935600539"
"80","0.790197","192.168.2.2","192.168.1.2","TCP","66","42496","5001  >  44492 [ACK] Seq=1 Ack=98465 Win=42496 Len=0 TSval=1707331210 TSecr=935600563"
"83","0.814406","192.168.2.2","192.168.1.2","TCP","66","42496","5001  >  44492 [ACK] Seq=1 Ack=101361 Win=42496 Len=0 TSval=1707331234 TSecr=935600588"
"85","0.838640","192.168.2.2","192.168.1.2","TCP","66","42496","5001  >  44492 [ACK] Seq=1 Ack=104257 Win=42496 Len=0 TSval=1707331259 TSecr=935600612"
"87","0.863651","192.168.2.2","192.168.1.2","TCP","66","42496","5001  >  44492 [ACK] Seq=1 Ack=107153 Win=42496 Len=0 TSval=1707331284 TSecr=935600636"
"90","0.899842","192.168.2.2","192.168.1.2","TCP","66","42496","5001  >  44492 [ACK] Seq=1 Ack=111497 Win=42496 Len=0 TSval=1707331320 TSecr=935600636"
"92","0.923463","192.168.2.2","192.168.1.2","TCP","66","42496","5001  >  44492 [ACK] Seq=1 Ack=114393 Win=42496 Len=0 TSval=1707331343 TSecr=935600685"
"94","0.947642","192.168.2.2","192.168.1.2","TCP","66","42496","5001  >  44492 [ACK] Seq=1 Ack=117289 Win=42496 Len=0 TSval=1707331367 TSecr=935600710"
"97","0.972425","192.168.2.2","192.168.1.2","TCP","66","42496","5001  >  44492 [ACK] Seq=1 Ack=120185 Win=42496 Len=0 TSval=1707331392 TSecr=935600746"
"99","0.996083","192.168.2.2","192.168.1.2","TCP","66","42496","5001  >  44492 [ACK] Seq=1 Ack=123081 Win=42496 Len=0 TSval=1707331416 TSecr=935600769"
"102","1.020419","192.168.2.2","192.168.1.2","TCP","66","42496","5001  >  44492 [ACK] Seq=1 Ack=125977 Win=42496 Len=0 TSval=1707331440 TSecr=935600794"
"105","1.056635","192.168.2.2","192.168.1.2","TCP","66","42496","5001  >  44492 [ACK] Seq=1 Ack=130321 Win=42496 Len=0 TSval=1707331476 TSecr=935600810"
"108","1.080875","192.168.2.2","192.168.1.2","TCP","66","42496","5001  >  44492 [ACK] Seq=1 Ack=133217 Win=42496 Len=0 TSval=1707331501 TSecr=935600842"
"111","1.105871","192.168.2.2","192.168.1.2","TCP","66","42496","5001  >  44492 [ACK] Seq=1 Ack=136113 Win=42496 Len=0 TSval=1707331526 TSecr=935600866"
"113","1.130157","192.168.2.2","192.168.1.2","TCP","66","42496","5001  >  44492 [ACK] Seq=1 Ack=139009 Win=42496 Len=0 TSval=1707331550 TSecr=935600902"
"115","1.154677","192.168.2.2","192.168.1.2","TCP","66","42496","5001  >  44492 [ACK] Seq=1 Ack=141905 Win=42496 Len=0 TSval=1707331574 TSecr=935600902"
"117","1.178553","192.168.2.2","192.168.1.2","TCP","66","42496","5001  >  44492 [ACK] Seq=1 Ack=144801 Win=42496 Len=0 TSval=1707331598 TSecr=935600927"
"119","1.202785","192.168.2.2","192.168.1.2","TCP","66","42496","5001  >  44492 [ACK] Seq=1 Ack=147697 Win=42496 Len=0 TSval=1707331622 TSecr=935600952"
"121","1.227316","192.168.2.2","192.168.1.2","TCP","66","42496","5001  >  44492 [ACK] Seq=1 Ack=150593 Win=42496 Len=0 TSval=1707331647 TSecr=935600976"
"123","1.263599","192.168.2.2","192.168.1.2","TCP","66","42496","5001  >  44492 [ACK] Seq=1 Ack=154937 Win=42496 Len=0 TSval=1707331683 TSecr=935601000"
"126","1.287952","192.168.2.2","192.168.1.2","TCP","66","42496","5001  >  44492 [ACK] Seq=1 Ack=157833 Win=42496 Len=0 TSval=1707331708 TSecr=935601049"
"128","1.311791","192.168.2.2","192.168.1.2","TCP","66","42496","5001  >  44492 [ACK] Seq=1 Ack=160729 Win=42496 Len=0 TSval=1707331731 TSecr=935601073"
"130","1.336050","192.168.2.2","192.168.1.2","TCP","66","42496","5001  >  44492 [ACK] Seq=1 Ack=163625 Win=42496 Len=0 TSval=1707331756 TSecr=935601109"
"133","1.360226","192.168.2.2","192.168.1.2","TCP","66","42496","5001  >  44492 [ACK] Seq=1 Ack=166521 Win=42496 Len=0 TSval=1707331780 TSecr=935601109"
"135","1.384502","192.168.2.2","192.168.1.2","TCP","66","42496","5001  >  44492 [ACK] Seq=1 Ack=169417 Win=42496 Len=0 TSval=1707331804 TSecr=935601134"
"137","1.409025","192.168.2.2","192.168.1.2","TCP","66","42496","5001  >  44492 [ACK] Seq=1 Ack=172313 Win=42496 Len=0 TSval=1707331829 TSecr=935601157"
"139","1.445265","192.168.2.2","192.168.1.2","TCP","66","42496","5001  >  44492 [ACK] Seq=1 Ack=176657 Win=42496 Len=0 TSval=1707331865 TSecr=935601182"
"142","1.469756","192.168.2.2","192.168.1.2","TCP","66","42496","5001  >  44492 [ACK] Seq=1 Ack=179553 Win=42496 Len=0 TSval=1707331889 TSecr=935601206"
"145","1.493443","192.168.2.2","192.168.1.2","TCP","66","42496","5001  >  44492 [ACK] Seq=1 Ack=182449 Win=42496 Len=0 TSval=1707331913 TSecr=935601230"
"147","1.517869","192.168.2.2","192.168.1.2","TCP","66","42496","5001  >  44492 [ACK] Seq=1 Ack=185345 Win=42496 Len=0 TSval=1707331937 TSecr=935601255"
"149","1.542396","192.168.2.2","192.168.1.2","TCP","66","42496","5001  >  44492 [ACK] Seq=1 Ack=188241 Win=42496 Len=0 TSval=1707331962 TSecr=935601291"
"151","1.566830","192.168.2.2","192.168.1.2","TCP","66","42496","5001  >  44492 [ACK] Seq=1 Ack=191137 Win=42496 Len=0 TSval=1707331986 TSecr=935601315"
"153","1.603112","192.168.2.2","192.168.1.2","TCP","66","42496","5001  >  44492 [ACK] Seq=1 Ack=195481 Win=42496 Len=0 TSval=1707332023 TSecr=935601338"
"155","1.627580","192.168.2.2","192.168.1.2","TCP","66","42496","5001  >  44492 [ACK] Seq=1 Ack=198377 Win=42496 Len=0 TSval=1707332047 TSecr=935601363"
"157","1.651062","192.168.2.2","192.168.1.2","TCP","66","42496","5001  >  44492 [ACK] Seq=1 Ack=201273 Win=42496 Len=0 TSval=1707332071 TSecr=935601388"
"159","1.675615","192.168.2.2","192.168.1.2","TCP","66","42496","5001  >  44492 [ACK] Seq=1 Ack=204169 Win=42496 Len=0 TSval=1707332095 TSecr=935601412"
"162","1.699377","192.168.2.2","192.168.1.2","TCP","66","42496","5001  >  44492 [ACK] Seq=1 Ack=207065 Win=42496 Len=0 TSval=1707332119 TSecr=935601449"
"166","1.723598","192.168.2.2","192.168.1.2","TCP","66","42496","5001  >  44492 [ACK] Seq=1 Ack=209961 Win=42496 Len=0 TSval=1707332143 TSecr=935601473"
"168","1.748178","192.168.2.2","192.168.1.2","TCP","66","42496","5001  >  44492 [ACK] Seq=1 Ack=212857 Win=42496 Len=0 TSval=1707332168 TSecr=935601497"
"170","1.772679","192.168.2.2","192.168.1.2","TCP","66","42496","5001  >  44492 [ACK] Seq=1 Ack=215753 Win=42496 Len=0 TSval=1707332192 TSecr=935601521"
"172","1.809636","192.168.2.2","192.168.1.2","TCP","66","42496","5001  >  44492 [ACK] Seq=1 Ack=220097 Win=42496 Len=0 TSval=1707332229 TSecr=935601521"
"175","1.834401","192.168.2.2","192.168.1.2","TCP","66","42496","5001  >  44492 [ACK] Seq=1 Ack=222993 Win=42496 Len=0 TSval=1707332254 TSecr=935601569"
"177","1.858132","192.168.2.2","192.168.1.2","TCP","66","42496","5001  >  44492 [ACK] Seq=1 Ack=225889 Win=42496 Len=0 TSval=1707332278 TSecr=935601594"
"180","1.882386","192.168.2.2","192.168.1.2","TCP","66","42496","5001  >  44492 [ACK] Seq=1 Ack=228785 Win=42496 Len=0 TSval=1707332302 TSecr=935601618"
"182","1.906953","192.168.2.2","192.168.1.2","TCP","66","42496","5001  >  44492 [ACK] Seq=1 Ack=231681 Win=42496 Len=0 TSval=1707332326 TSecr=935601655"
"184","1.931364","192.168.2.2","192.168.1.2","TCP","66","42496","5001  >  44492 [ACK] Seq=1 Ack=234577 Win=42496 Len=0 TSval=1707332351 TSecr=935601655"
"186","1.955553","192.168.2.2","192.168.1.2","TCP","66","42496","5001  >  44492 [ACK] Seq=1 Ack=237473 Win=42496 Len=0 TSval=1707332375 TSecr=935601680"
"188","1.991321","192.168.2.2","192.168.1.2","TCP","66","42496","5001  >  44492 [ACK] Seq=1 Ack=241817 Win=42496 Len=0 TSval=1707332411 TSecr=935601704"
"192","2.016235","192.168.2.2","192.168.1.2","TCP","66","42496","5001  >  44492 [ACK] Seq=1 Ack=244713 Win=42496 Len=0 TSval=1707332436 TSecr=935601752"
"194","2.039788","192.168.2.2","192.168.1.2","TCP","66","42496","5001  >  44492 [ACK] Seq=1 Ack=247609 Win=42496 Len=0 TSval=1707332459 TSecr=935601777"
"196","2.064009","192.168.2.2","192.168.1.2","TCP","66","42496","5001  >  44492 [ACK] Seq=1 Ack=250505 Win=42496 Len=0 TSval=1707332483 TSecr=935601801"
"198","2.088235","192.168.2.2","192.168.1.2","TCP","66","42496","5001  >  44492 [ACK] Seq=1 Ack=253401 Win=42496 Len=0 TSval=1707332508 TSecr=935601837"
"200","2.112450","192.168.2.2","192.168.1.2","TCP","66","42496","5001  >  44492 [ACK] Seq=1 Ack=256297 Win=42496 Len=0 TSval=1707332532 TSecr=935601837"
"203","2.137432","192.168.2.2","192.168.1.2","TCP","66","42496","5001  >  44492 [ACK] Seq=1 Ack=259193 Win=42496 Len=0 TSval=1707332557 TSecr=935601862"
"205","2.173991","192.168.2.2","192.168.1.2","TCP","66","42496","5001  >  44492 [ACK] Seq=1 Ack=263537 Win=42496 Len=0 TSval=1707332593 TSecr=935601885"
"208","2.198030","192.168.2.2","192.168.1.2","TCP","66","42496","5001  >  44492 [ACK] Seq=1 Ack=266433 Win=42496 Len=0 TSval=1707332617 TSecr=935601934"
"210","2.222386","192.168.2.2","192.168.1.2","TCP","66","42496","5001  >  44492 [ACK] Seq=1 Ack=269329 Win=42496 Len=0 TSval=1707332642 TSecr=935601958"
"212","2.246482","192.168.2.2","192.168.1.2","TCP","66","48128","5001  >  44492 [ACK] Seq=1 Ack=272225 Win=48128 Len=0 TSval=1707332666 TSecr=935601983"
"214","2.270684","192.168.2.2","192.168.1.2","TCP","66","54272","5001  >  44492 [ACK] Seq=1 Ack=275121 Win=54272 Len=0 TSval=1707332690 TSecr=935602019"
"216","2.294896","192.168.2.2","192.168.1.2","TCP","66","54784","5001  >  44492 [ACK] Seq=1 Ack=278017 Win=54784 Len=0 TSval=1707332714 TSecr=935602019"
"218","2.320020","192.168.2.2","192.168.1.2","TCP","66","54784","5001  >  44492 [ACK] Seq=1 Ack=280913 Win=54784 Len=0 TSval=1707332739 TSecr=935602043"
"221","2.343323","192.168.2.2","192.168.1.2","TCP","66","55296","5001  >  44492 [ACK] Seq=1 Ack=282361 Win=55296 Len=0 TSval=1707332762 TSecr=935602068"
"223","2.356241","192.168.2.2","192.168.1.2","TCP","66","55296","5001  >  44492 [ACK] Seq=1 Ack=285257 Win=55296 Len=0 TSval=1707332775 TSecr=935602092"
"225","2.379756","192.168.2.2","192.168.1.2","TCP","66","55296","5001  >  44492 [ACK] Seq=1 Ack=288153 Win=55296 Len=0 TSval=1707332799 TSecr=935602116"
"227","2.404342","192.168.2.2","192.168.1.2","TCP","66","55296","5001  >  44492 [ACK] Seq=1 Ack=291049 Win=55296 Len=0 TSval=1707332823 TSecr=935602140"
"229","2.432019","192.168.2.2","192.168.1.2","TCP","66","55296","5001  >  44492 [ACK] Seq=1 Ack=293945 Win=55296 Len=0 TSval=1707332851 TSecr=935602165"
"231","2.452332","192.168.2.2","192.168.1.2","TCP","66","55296","5001  >  44492 [ACK] Seq=1 Ack=296841 Win=55296 Len=0 TSval=1707332871 TSecr=935602165"
"235","2.488738","192.168.2.2","192.168.1.2","TCP","66","55296","5001  >  44492 [ACK] Seq=1 Ack=301185 Win=55296 Len=0 TSval=1707332908 TSecr=935602189"
"238","2.513034","192.168.2.2","192.168.1.2","TCP","66","55296","5001  >  44492 [ACK] Seq=1 Ack=304081 Win=55296 Len=0 TSval=1707332932 TSecr=935602225"
"240","2.537126","192.168.2.2","192.168.1.2","TCP","66","55296","5001  >  44492 [ACK] Seq=1 Ack=306977 Win=55296 Len=0 TSval=1707332956 TSecr=935602249"
"242","2.561349","192.168.2.2","192.168.1.2","TCP","66","55296","5001  >  44492 [ACK] Seq=1 Ack=309873 Win=55296 Len=0 TSval=1707332980 TSecr=935602277"
"244","2.585564","192.168.2.2","192.168.1.2","TCP","66","55296","5001  >  44492 [ACK] Seq=1 Ack=312769 Win=55296 Len=0 TSval=1707333005 TSecr=935602297"
"246","2.610032","192.168.2.2","192.168.1.2","TCP","66","55296","5001  >  44492 [ACK] Seq=1 Ack=315665 Win=55296 Len=0 TSval=1707333029 TSecr=935602334"
"248","2.634021","192.168.2.2","192.168.1.2","TCP","66","58368","5001  >  44492 [ACK] Seq=1 Ack=317113 Win=58368 Len=0 TSval=1707333053 TSecr=935602345"
"250","2.646312","192.168.2.2","192.168.1.2","TCP","66","58368","5001  >  44492 [ACK] Seq=1 Ack=320009 Win=58368 Len=0 TSval=1707333065 TSecr=935602358"
"252","2.670419","192.168.2.2","192.168.1.2","TCP","66","58368","5001  >  44492 [ACK] Seq=1 Ack=322905 Win=58368 Len=0 TSval=1707333089 TSecr=935602382"
"254","2.694929","192.168.2.2","192.168.1.2","TCP","66","58368","5001  >  44492 [ACK] Seq=1 Ack=325801 Win=58368 Len=0 TSval=1707333114 TSecr=935602406"
"256","2.719552","192.168.2.2","192.168.1.2","TCP","66","58368","5001  >  44492 [ACK] Seq=1 Ack=328697 Win=58368 Len=0 TSval=1707333139 TSecr=935602431"
"258","2.743939","192.168.2.2","192.168.1.2","TCP","66","58368","5001  >  44492 [ACK] Seq=1 Ack=330145 Win=58368 Len=0 TSval=1707333163 TSecr=935602455"
"260","2.755895","192.168.2.2","192.168.1.2","TCP","66","58368","5001  >  44492 [ACK] Seq=1 Ack=333041 Win=58368 Len=0 TSval=1707333175 TSecr=935602479"
"262","2.780212","192.168.2.2","192.168.1.2","TCP","66","58368","5001  >  44492 [ACK] Seq=1 Ack=335937 Win=58368 Len=0 TSval=1707333199 TSecr=935602491"
"264","2.804361","192.168.2.2","192.168.1.2","TCP","66","58368","5001  >  44492 [ACK] Seq=1 Ack=338833 Win=58368 Len=0 TSval=1707333223 TSecr=935602515"
"266","2.828658","192.168.2.2","192.168.1.2","TCP","66","58368","5001  >  44492 [ACK] Seq=1 Ack=341729 Win=58368 Len=0 TSval=1707333248 TSecr=935602540"
"268","2.852800","192.168.2.2","192.168.1.2","TCP","66","58368","5001  >  44492 [ACK] Seq=1 Ack=344625 Win=58368 Len=0 TSval=1707333272 TSecr=935602565"
"271","2.889133","192.168.2.2","192.168.1.2","TCP","66","58368","5001  >  44492 [ACK] Seq=1 Ack=348969 Win=58368 Len=0 TSval=1707333308 TSecr=935602589"
"273","2.913486","192.168.2.2","192.168.1.2","TCP","66","58368","5001  >  44492 [ACK] Seq=1 Ack=351865 Win=58368 Len=0 TSval=1707333332 TSecr=935602625"
"275","2.937579","192.168.2.2","192.168.1.2","TCP","66","58368","5001  >  44492 [ACK] Seq=1 Ack=354761 Win=58368 Len=0 TSval=1707333356 TSecr=935602649"
"277","2.962518","192.168.2.2","192.168.1.2","TCP","66","58368","5001  >  44492 [ACK] Seq=1 Ack=357657 Win=58368 Len=0 TSval=1707333381 TSecr=935602674"
"279","2.986053","192.168.2.2","192.168.1.2","TCP","66","58368","5001  >  44492 [ACK] Seq=1 Ack=360553 Win=58368 Len=0 TSval=1707333405 TSecr=935602698"
"282","3.010476","192.168.2.2","192.168.1.2","TCP","66","58368","5001  >  44492 [ACK] Seq=1 Ack=363449 Win=58368 Len=0 TSval=1707333429 TSecr=935602734"
"285","3.035017","192.168.2.2","192.168.1.2","TCP","66","58368","5001  >  44492 [ACK] Seq=1 Ack=366345 Win=58368 Len=0 TSval=1707333454 TSecr=935602758"
"287","3.059545","192.168.2.2","192.168.1.2","TCP","66","58368","5001  >  44492 [ACK] Seq=1 Ack=369241 Win=58368 Len=0 TSval=1707333478 TSecr=935602782"
"289","3.083271","192.168.2.2","192.168.1.2","TCP","66","58368","5001  >  44492 [ACK] Seq=1 Ack=372137 Win=58368 Len=0 TSval=1707333502 TSecr=935602807"
"291","3.107539","192.168.2.2","192.168.1.2","TCP","66","58368","5001  >  44492 [ACK] Seq=1 Ack=375033 Win=58368 Len=0 TSval=1707333526 TSecr=935602831"
"293","3.131372","192.168.2.2","192.168.1.2","TCP","66","58368","5001  >  44492 [ACK] Seq=1 Ack=377929 Win=58368 Len=0 TSval=1707333550 TSecr=935602831"
"295","3.155614","192.168.2.2","192.168.1.2","TCP","66","58368","5001  >  44492 [ACK] Seq=1 Ack=380825 Win=58368 Len=0 TSval=1707333574 TSecr=935602855"
"298","3.180561","192.168.2.2","192.168.1.2","TCP","66","58368","5001  >  44492 [ACK] Seq=1 Ack=383721 Win=58368 Len=0 TSval=1707333599 TSecr=935602880"
"300","3.217192","192.168.2.2","192.168.1.2","TCP","66","58368","5001  >  44492 [ACK] Seq=1 Ack=388065 Win=58368 Len=0 TSval=1707333636 TSecr=935602904"
"303","3.241749","192.168.2.2","192.168.1.2","TCP","66","58368","5001  >  44492 [ACK] Seq=1 Ack=390961 Win=58368 Len=0 TSval=1707333660 TSecr=935602952"
"305","3.265769","192.168.2.2","192.168.1.2","TCP","66","58368","5001  >  44492 [ACK] Seq=1 Ack=393857 Win=58368 Len=0 TSval=1707333684 TSecr=935602976"
"307","3.290299","192.168.2.2","192.168.1.2","TCP","66","58368","5001  >  44492 [ACK] Seq=1 Ack=396753 Win=58368 Len=0 TSval=1707333709 TSecr=935603000"
"309","3.313852","192.168.2.2","192.168.1.2","TCP","66","58368","5001  >  44492 [ACK] Seq=1 Ack=399649 Win=58368 Len=0 TSval=1707333733 TSecr=935603025"
"311","3.338234","192.168.2.2","192.168.1.2","TCP","66","58368","5001  >  44492 [ACK] Seq=1 Ack=402545 Win=58368 Len=0 TSval=1707333757 TSecr=935603062"
"313","3.362828","192.168.2.2","192.168.1.2","TCP","66","58368","5001  >  44492 [ACK] Seq=1 Ack=405441 Win=58368 Len=0 TSval=1707333781 TSecr=935603062"
"315","3.386481","192.168.2.2","192.168.1.2","TCP","66","58368","5001  >  44492 [ACK] Seq=1 Ack=408337 Win=58368 Len=0 TSval=1707333805 TSecr=935603086"
"317","3.410862","192.168.2.2","192.168.1.2","TCP","66","58368","5001  >  44492 [ACK] Seq=1 Ack=411233 Win=58368 Len=0 TSval=1707333829 TSecr=935603110"
"319","3.435358","192.168.2.2","192.168.1.2","TCP","66","58368","5001  >  44492 [ACK] Seq=1 Ack=414129 Win=58368 Len=0 TSval=1707333854 TSecr=935603135"
"321","3.459179","192.168.2.2","192.168.1.2","TCP","66","58368","5001  >  44492 [ACK] Seq=1 Ack=417025 Win=58368 Len=0 TSval=1707333878 TSecr=935603159"
"323","3.483427","192.168.2.2","192.168.1.2","TCP","66","58368","5001  >  44492 [ACK] Seq=1 Ack=419921 Win=58368 Len=0 TSval=1707333902 TSecr=935603183"
"325","3.507853","192.168.2.2","192.168.1.2","TCP","66","58368","5001  >  44492 [ACK] Seq=1 Ack=422817 Win=58368 Len=0 TSval=1707333926 TSecr=935603208"
"327","3.531840","192.168.2.2","192.168.1.2","TCP","66","58368","5001  >  44492 [ACK] Seq=1 Ack=425713 Win=58368 Len=0 TSval=1707333950 TSecr=935603231"
"329","3.556064","192.168.2.2","192.168.1.2","TCP","66","58368","5001  >  44492 [ACK] Seq=1 Ack=428609 Win=58368 Len=0 TSval=1707333975 TSecr=935603256"
"331","3.580366","192.168.2.2","192.168.1.2","TCP","66","58368","5001  >  44492 [ACK] Seq=1 Ack=431505 Win=58368 Len=0 TSval=1707333999 TSecr=935603280"
"333","3.604539","192.168.2.2","192.168.1.2","TCP","66","58368","5001  >  44492 [ACK] Seq=1 Ack=434401 Win=58368 Len=0 TSval=1707334023 TSecr=935603304"
"335","3.628748","192.168.2.2","192.168.1.2","TCP","66","58368","5001  >  44492 [ACK] Seq=1 Ack=437297 Win=58368 Len=0 TSval=1707334047 TSecr=935603328"
"337","3.652954","192.168.2.2","192.168.1.2","TCP","66","58368","5001  >  44492 [ACK] Seq=1 Ack=440193 Win=58368 Len=0 TSval=1707334071 TSecr=935603352"
"339","3.677443","192.168.2.2","192.168.1.2","TCP","66","58368","5001  >  44492 [ACK] Seq=1 Ack=443089 Win=58368 Len=0 TSval=1707334096 TSecr=935603376"
"341","3.701874","192.168.2.2","192.168.1.2","TCP","66","58368","5001  >  44492 [ACK] Seq=1 Ack=445985 Win=58368 Len=0 TSval=1707334120 TSecr=935603401"
"343","3.726375","192.168.2.2","192.168.1.2","TCP","66","58368","5001  >  44492 [ACK] Seq=1 Ack=448881 Win=58368 Len=0 TSval=1707334145 TSecr=935603425"
"345","3.749986","192.168.2.2","192.168.1.2","TCP","66","58368","5001  >  44492 [ACK] Seq=1 Ack=451777 Win=58368 Len=0 TSval=1707334168 TSecr=935603449"
"347","3.774154","192.168.2.2","192.168.1.2","TCP","66","58368","5001  >  44492 [ACK] Seq=1 Ack=454673 Win=58368 Len=0 TSval=1707334193 TSecr=935603473"
"349","3.798522","192.168.2.2","192.168.1.2","TCP","66","58368","5001  >  44492 [ACK] Seq=1 Ack=457569 Win=58368 Len=0 TSval=1707334217 TSecr=935603497"
"351","3.823050","192.168.2.2","192.168.1.2","TCP","66","58368","5001  >  44492 [ACK] Seq=1 Ack=460465 Win=58368 Len=0 TSval=1707334241 TSecr=935603522"
"353","3.846765","192.168.2.2","192.168.1.2","TCP","66","58368","5001  >  44492 [ACK] Seq=1 Ack=463361 Win=58368 Len=0 TSval=1707334265 TSecr=935603546"
"355","3.871037","192.168.2.2","192.168.1.2","TCP","66","58368","5001  >  44492 [ACK] Seq=1 Ack=466257 Win=58368 Len=0 TSval=1707334289 TSecr=935603571"
"357","3.895504","192.168.2.2","192.168.1.2","TCP","66","58368","5001  >  44492 [ACK] Seq=1 Ack=469153 Win=58368 Len=0 TSval=1707334314 TSecr=935603594"
"359","3.919965","192.168.2.2","192.168.1.2","TCP","66","58368","5001  >  44492 [ACK] Seq=1 Ack=472049 Win=58368 Len=0 TSval=1707334338 TSecr=935603619"
"361","3.943703","192.168.2.2","192.168.1.2","TCP","66","58368","5001  >  44492 [ACK] Seq=1 Ack=474945 Win=58368 Len=0 TSval=1707334362 TSecr=935603643"
"363","3.968024","192.168.2.2","192.168.1.2","TCP","66","58368","5001  >  44492 [ACK] Seq=1 Ack=477841 Win=58368 Len=0 TSval=1707334386 TSecr=935603668"
"365","3.992070","192.168.2.2","192.168.1.2","TCP","66","58368","5001  >  44492 [ACK] Seq=1 Ack=480737 Win=58368 Len=0 TSval=1707334410 TSecr=935603691"
"369","4.016288","192.168.2.2","192.168.1.2","TCP","66","58368","5001  >  44492 [ACK] Seq=1 Ack=483633 Win=58368 Len=0 TSval=1707334435 TSecr=935603715"
"371","4.040554","192.168.2.2","192.168.1.2","TCP","66","58368","5001  >  44492 [ACK] Seq=1 Ack=486529 Win=58368 Len=0 TSval=1707334459 TSecr=935603740"
"373","4.065128","192.168.2.2","192.168.1.2","TCP","66","58368","5001  >  44492 [ACK] Seq=1 Ack=489425 Win=58368 Len=0 TSval=1707334483 TSecr=935603764"
"375","4.088963","192.168.2.2","192.168.1.2","TCP","66","58368","5001  >  44492 [ACK] Seq=1 Ack=492321 Win=58368 Len=0 TSval=1707334507 TSecr=935603788"
"377","4.114003","192.168.2.2","192.168.1.2","TCP","66","58368","5001  >  44492 [ACK] Seq=1 Ack=495217 Win=58368 Len=0 TSval=1707334532 TSecr=935603812"
"379","4.137526","192.168.2.2","192.168.1.2","TCP","66","58368","5001  >  44492 [ACK] Seq=1 Ack=498113 Win=58368 Len=0 TSval=1707334556 TSecr=935603836"
"382","4.174521","192.168.2.2","192.168.1.2","TCP","66","58368","5001  >  44492 [ACK] Seq=1 Ack=501009 Win=58368 Len=0 TSval=1707334593 TSecr=935603856"
"384","4.186735","192.168.2.2","192.168.1.2","TCP","66","58368","5001  >  44492 [ACK] Seq=1 Ack=503905 Win=58368 Len=0 TSval=1707334605 TSecr=935603885"
"386","4.211049","192.168.2.2","192.168.1.2","TCP","66","58368","5001  >  44492 [ACK] Seq=1 Ack=506801 Win=58368 Len=0 TSval=1707334629 TSecr=935603909"
"388","4.235570","192.168.2.2","192.168.1.2","TCP","66","58368","5001  >  44492 [ACK] Seq=1 Ack=509697 Win=58368 Len=0 TSval=1707334654 TSecr=935603933"
"390","4.259407","192.168.2.2","192.168.1.2","TCP","66","58368","5001  >  44492 [ACK] Seq=1 Ack=512593 Win=58368 Len=0 TSval=1707334678 TSecr=935603958"
"392","4.283588","192.168.2.2","192.168.1.2","TCP","66","58368","5001  >  44492 [ACK] Seq=1 Ack=515489 Win=58368 Len=0 TSval=1707334702 TSecr=935603982"
"394","4.308088","192.168.2.2","192.168.1.2","TCP","66","58368","5001  >  44492 [ACK] Seq=1 Ack=518385 Win=58368 Len=0 TSval=1707334726 TSecr=935604019"
"396","4.332621","192.168.2.2","192.168.1.2","TCP","66","58368","5001  >  44492 [ACK] Seq=1 Ack=521281 Win=58368 Len=0 TSval=1707334751 TSecr=935604031"
"398","4.356226","192.168.2.2","192.168.1.2","TCP","66","63488","5001  >  44492 [ACK] Seq=1 Ack=524177 Win=63488 Len=0 TSval=1707334774 TSecr=935604055"
"400","4.380514","192.168.2.2","192.168.1.2","TCP","66","63488","5001  >  44492 [ACK] Seq=1 Ack=527073 Win=63488 Len=0 TSval=1707334799 TSecr=935604080"
"402","4.404703","192.168.2.2","192.168.1.2","TCP","66","63488","5001  >  44492 [ACK] Seq=1 Ack=529969 Win=63488 Len=0 TSval=1707334823 TSecr=935604104"
"404","4.429131","192.168.2.2","192.168.1.2","TCP","66","63488","5001  >  44492 [ACK] Seq=1 Ack=532865 Win=63488 Len=0 TSval=1707334847 TSecr=935604128"
"406","4.453610","192.168.2.2","192.168.1.2","TCP","66","63488","5001  >  44492 [ACK] Seq=1 Ack=535761 Win=63488 Len=0 TSval=1707334872 TSecr=935604152"
"408","4.477344","192.168.2.2","192.168.1.2","TCP","66","63488","5001  >  44492 [ACK] Seq=1 Ack=538657 Win=63488 Len=0 TSval=1707334895 TSecr=935604177"
"410","4.501613","192.168.2.2","192.168.1.2","TCP","66","63488","5001  >  44492 [ACK] Seq=1 Ack=541553 Win=63488 Len=0 TSval=1707334920 TSecr=935604201"
"413","4.526136","192.168.2.2","192.168.1.2","TCP","66","63488","5001  >  44492 [ACK] Seq=1 Ack=544449 Win=63488 Len=0 TSval=1707334944 TSecr=935604225"
"415","4.550010","192.168.2.2","192.168.1.2","TCP","66","63488","5001  >  44492 [ACK] Seq=1 Ack=547345 Win=63488 Len=0 TSval=1707334968 TSecr=935604249"
"417","4.574277","192.168.2.2","192.168.1.2","TCP","66","63488","5001  >  44492 [ACK] Seq=1 Ack=550241 Win=63488 Len=0 TSval=1707334992 TSecr=935604273"
"419","4.598666","192.168.2.2","192.168.1.2","TCP","66","63488","5001  >  44492 [ACK] Seq=1 Ack=553137 Win=63488 Len=0 TSval=1707335017 TSecr=935604298"
"421","4.623138","192.168.2.2","192.168.1.2","TCP","66","63488","5001  >  44492 [ACK] Seq=1 Ack=556033 Win=63488 Len=0 TSval=1707335041 TSecr=935604322"
"423","4.647669","192.168.2.2","192.168.1.2","TCP","66","63488","5001  >  44492 [ACK] Seq=1 Ack=558929 Win=63488 Len=0 TSval=1707335066 TSecr=935604346"
"425","4.671188","192.168.2.2","192.168.1.2","TCP","66","64000","5001  >  44492 [ACK] Seq=1 Ack=560377 Win=64000 Len=0 TSval=1707335089 TSecr=935604360"
"427","4.683255","192.168.2.2","192.168.1.2","TCP","66","64000","5001  >  44492 [ACK] Seq=1 Ack=563273 Win=64000 Len=0 TSval=1707335101 TSecr=935604370"
"429","4.707502","192.168.2.2","192.168.1.2","TCP","66","64000","5001  >  44492 [ACK] Seq=1 Ack=566169 Win=64000 Len=0 TSval=1707335125 TSecr=935604394"
"431","4.731960","192.168.2.2","192.168.1.2","TCP","66","64000","5001  >  44492 [ACK] Seq=1 Ack=569065 Win=64000 Len=0 TSval=1707335150 TSecr=935604419"
"433","4.756485","192.168.2.2","192.168.1.2","TCP","66","64000","5001  >  44492 [ACK] Seq=1 Ack=571961 Win=64000 Len=0 TSval=1707335174 TSecr=935604443"
"435","4.780961","192.168.2.2","192.168.1.2","TCP","66","64000","5001  >  44492 [ACK] Seq=1 Ack=574857 Win=64000 Len=0 TSval=1707335199 TSecr=935604467"
"437","4.804516","192.168.2.2","192.168.1.2","TCP","66","64000","5001  >  44492 [ACK] Seq=1 Ack=577753 Win=64000 Len=0 TSval=1707335222 TSecr=935604492"
"439","4.840718","192.168.2.2","192.168.1.2","TCP","66","64000","5001  >  44492 [ACK] Seq=1 Ack=582097 Win=64000 Len=0 TSval=1707335259 TSecr=935604515"
"442","4.865253","192.168.2.2","192.168.1.2","TCP","66","64000","5001  >  44492 [ACK] Seq=1 Ack=584993 Win=64000 Len=0 TSval=1707335283 TSecr=935604552"
"444","4.889218","192.168.2.2","192.168.1.2","TCP","66","64000","5001  >  44492 [ACK] Seq=1 Ack=587889 Win=64000 Len=0 TSval=1707335307 TSecr=935604576"
"446","4.925511","192.168.2.2","192.168.1.2","TCP","66","64000","5001  >  44492 [ACK] Seq=1 Ack=592233 Win=64000 Len=0 TSval=1707335343 TSecr=935604600"
"448","4.950587","192.168.2.2","192.168.1.2","TCP","66","64000","5001  >  44492 [ACK] Seq=1 Ack=595129 Win=64000 Len=0 TSval=1707335368 TSecr=935604648"
"450","4.974034","192.168.2.2","192.168.1.2","TCP","66","64000","5001  >  44492 [ACK] Seq=1 Ack=598025 Win=64000 Len=0 TSval=1707335392 TSecr=935604685"
"452","4.998526","192.168.2.2","192.168.1.2","TCP","66","64000","5001  >  44492 [ACK] Seq=1 Ack=600921 Win=64000 Len=0 TSval=1707335416 TSecr=935604685"
"456","5.022429","192.168.2.2","192.168.1.2","TCP","66","64000","5001  >  44492 [ACK] Seq=1 Ack=603817 Win=64000 Len=0 TSval=1707335440 TSecr=935604709"
"458","5.046630","192.168.2.2","192.168.1.2","TCP","66","64000","5001  >  44492 [ACK] Seq=1 Ack=606713 Win=64000 Len=0 TSval=1707335464 TSecr=935604733"
"460","5.071079","192.168.2.2","192.168.1.2","TCP","66","64000","5001  >  44492 [ACK] Seq=1 Ack=609609 Win=64000 Len=0 TSval=1707335489 TSecr=935604769"
"462","5.095633","192.168.2.2","192.168.1.2","TCP","66","64000","5001  >  44492 [ACK] Seq=1 Ack=612505 Win=64000 Len=0 TSval=1707335513 TSecr=935604794"
"466","5.119303","192.168.2.2","192.168.1.2","TCP","66","64000","5001  >  44492 [ACK] Seq=1 Ack=615401 Win=64000 Len=0 TSval=1707335537 TSecr=935604818"
"468","5.143558","192.168.2.2","192.168.1.2","TCP","66","64000","5001  >  44492 [ACK] Seq=1 Ack=618297 Win=64000 Len=0 TSval=1707335561 TSecr=935604842"
"471","5.180627","192.168.2.2","192.168.1.2","TCP","66","64000","5001  >  44492 [ACK] Seq=1 Ack=622641 Win=64000 Len=0 TSval=1707335598 TSecr=935604842"
"474","5.207872","192.168.2.2","192.168.1.2","TCP","66","64000","5001  >  44492 [ACK] Seq=1 Ack=625537 Win=64000 Len=0 TSval=1707335626 TSecr=935604890"
"476","5.229111","192.168.2.2","192.168.1.2","TCP","66","64000","5001  >  44492 [ACK] Seq=1 Ack=628433 Win=64000 Len=0 TSval=1707335647 TSecr=935604915"
"478","5.253372","192.168.2.2","192.168.1.2","TCP","66","64000","5001  >  44492 [ACK] Seq=1 Ack=631329 Win=64000 Len=0 TSval=1707335671 TSecr=935604939"
"480","5.277864","192.168.2.2","192.168.1.2","TCP","66","64000","5001  >  44492 [ACK] Seq=1 Ack=634225 Win=64000 Len=0 TSval=1707335696 TSecr=935604963"
"482","5.302338","192.168.2.2","192.168.1.2","TCP","66","64000","5001  >  44492 [ACK] Seq=1 Ack=637121 Win=64000 Len=0 TSval=1707335720 TSecr=935604987"
"484","5.326334","192.168.2.2","192.168.1.2","TCP","66","64000","5001  >  44492 [ACK] Seq=1 Ack=640017 Win=64000 Len=0 TSval=1707335744 TSecr=935605024"
"486","5.351390","192.168.2.2","192.168.1.2","TCP","66","64000","5001  >  44492 [ACK] Seq=1 Ack=642913 Win=64000 Len=0 TSval=1707335769 TSecr=935605024"
"489","5.374867","192.168.2.2","192.168.1.2","TCP","66","64000","5001  >  44492 [ACK] Seq=1 Ack=645809 Win=64000 Len=0 TSval=1707335792 TSecr=935605052"
"491","5.398992","192.168.2.2","192.168.1.2","TCP","66","64000","5001  >  44492 [ACK] Seq=1 Ack=648705 Win=64000 Len=0 TSval=1707335817 TSecr=935605073"
"493","5.423222","192.168.2.2","192.168.1.2","TCP","66","64000","5001  >  44492 [ACK] Seq=1 Ack=651601 Win=64000 Len=0 TSval=1707335841 TSecr=935605097"
"495","5.447443","192.168.2.2","192.168.1.2","TCP","66","64000","5001  >  44492 [ACK] Seq=1 Ack=654497 Win=64000 Len=0 TSval=1707335865 TSecr=935605122"
"497","5.471671","192.168.2.2","192.168.1.2","TCP","66","64000","5001  >  44492 [ACK] Seq=1 Ack=657393 Win=64000 Len=0 TSval=1707335889 TSecr=935605146"
"499","5.496392","192.168.2.2","192.168.1.2","TCP","66","64000","5001  >  44492 [ACK] Seq=1 Ack=660289 Win=64000 Len=0 TSval=1707335914 TSecr=935605170"
"501","5.520113","192.168.2.2","192.168.1.2","TCP","66","64000","5001  >  44492 [ACK] Seq=1 Ack=663185 Win=64000 Len=0 TSval=1707335938 TSecr=935605195"
"503","5.544412","192.168.2.2","192.168.1.2","TCP","66","64000","5001  >  44492 [ACK] Seq=1 Ack=666081 Win=64000 Len=0 TSval=1707335962 TSecr=935605219"
"505","5.568928","192.168.2.2","192.168.1.2","TCP","66","64000","5001  >  44492 [ACK] Seq=1 Ack=668977 Win=64000 Len=0 TSval=1707335986 TSecr=935605243"
"507","5.592808","192.168.2.2","192.168.1.2","TCP","66","64000","5001  >  44492 [ACK] Seq=1 Ack=671873 Win=64000 Len=0 TSval=1707336010 TSecr=935605267"
"509","5.617048","192.168.2.2","192.168.1.2","TCP","66","64000","5001  >  44492 [ACK] Seq=1 Ack=674769 Win=64000 Len=0 TSval=1707336035 TSecr=935605291"
"511","5.641440","192.168.2.2","192.168.1.2","TCP","66","64000","5001  >  44492 [ACK] Seq=1 Ack=677665 Win=64000 Len=0 TSval=1707336059 TSecr=935605315"
"513","5.665918","192.168.2.2","192.168.1.2","TCP","66","64000","5001  >  44492 [ACK] Seq=1 Ack=680561 Win=64000 Len=0 TSval=1707336083 TSecr=935605340"
"515","5.690838","192.168.2.2","192.168.1.2","TCP","66","64000","5001  >  44492 [ACK] Seq=1 Ack=683457 Win=64000 Len=0 TSval=1707336108 TSecr=935605364"
"517","5.714059","192.168.2.2","192.168.1.2","TCP","66","64000","5001  >  44492 [ACK] Seq=1 Ack=686353 Win=64000 Len=0 TSval=1707336132 TSecr=935605388"
"519","5.738137","192.168.2.2","192.168.1.2","TCP","66","64000","5001  >  44492 [ACK] Seq=1 Ack=689249 Win=64000 Len=0 TSval=1707336156 TSecr=935605413"
"521","5.762375","192.168.2.2","192.168.1.2","TCP","66","64000","5001  >  44492 [ACK] Seq=1 Ack=692145 Win=64000 Len=0 TSval=1707336180 TSecr=935605436"
"523","5.786598","192.168.2.2","192.168.1.2","TCP","66","64000","5001  >  44492 [ACK] Seq=1 Ack=695041 Win=64000 Len=0 TSval=1707336204 TSecr=935605461"
"525","5.811372","192.168.2.2","192.168.1.2","TCP","66","64000","5001  >  44492 [ACK] Seq=1 Ack=697937 Win=64000 Len=0 TSval=1707336229 TSecr=935605485"
"527","5.835597","192.168.2.2","192.168.1.2","TCP","66","64000","5001  >  44492 [ACK] Seq=1 Ack=700833 Win=64000 Len=0 TSval=1707336253 TSecr=935605509"
"529","5.860057","192.168.2.2","192.168.1.2","TCP","66","64000","5001  >  44492 [ACK] Seq=1 Ack=703729 Win=64000 Len=0 TSval=1707336277 TSecr=935605534"
"531","5.884558","192.168.2.2","192.168.1.2","TCP","66","64000","5001  >  44492 [ACK] Seq=1 Ack=706625 Win=64000 Len=0 TSval=1707336302 TSecr=935605558"
"533","5.908285","192.168.2.2","192.168.1.2","TCP","66","64000","5001  >  44492 [ACK] Seq=1 Ack=709521 Win=64000 Len=0 TSval=1707336326 TSecr=935605582"
"535","5.932522","192.168.2.2","192.168.1.2","TCP","66","64000","5001  >  44492 [ACK] Seq=1 Ack=712417 Win=64000 Len=0 TSval=1707336350 TSecr=935605606"
"537","5.956718","192.168.2.2","192.168.1.2","TCP","66","64000","5001  >  44492 [ACK] Seq=1 Ack=715313 Win=64000 Len=0 TSval=1707336374 TSecr=935605630"
"539","5.981497","192.168.2.2","192.168.1.2","TCP","66","64000","5001  >  44492 [ACK] Seq=1 Ack=718209 Win=64000 Len=0 TSval=1707336399 TSecr=935605655"
"541","6.005177","192.168.2.2","192.168.1.2","TCP","66","64000","5001  >  44492 [ACK] Seq=1 Ack=721105 Win=64000 Len=0 TSval=1707336422 TSecr=935605679"
"544","6.029519","192.168.2.2","192.168.1.2","TCP","66","64000","5001  >  44492 [ACK] Seq=1 Ack=724001 Win=64000 Len=0 TSval=1707336447 TSecr=935605703"
"546","6.054027","192.168.2.2","192.168.1.2","TCP","66","64000","5001  >  44492 [ACK] Seq=1 Ack=726897 Win=64000 Len=0 TSval=1707336471 TSecr=935605728"
"548","6.078567","192.168.2.2","192.168.1.2","TCP","66","64000","5001  >  44492 [ACK] Seq=1 Ack=729793 Win=64000 Len=0 TSval=1707336496 TSecr=935605752"
"550","6.102100","192.168.2.2","192.168.1.2","TCP","66","64000","5001  >  44492 [ACK] Seq=1 Ack=732689 Win=64000 Len=0 TSval=1707336519 TSecr=935605776"
"552","6.126572","192.168.2.2","192.168.1.2","TCP","66","64000","5001  >  44492 [ACK] Seq=1 Ack=735585 Win=64000 Len=0 TSval=1707336544 TSecr=935605800"
"554","6.150523","192.168.2.2","192.168.1.2","TCP","66","64000","5001  >  44492 [ACK] Seq=1 Ack=738481 Win=64000 Len=0 TSval=1707336568 TSecr=935605825"
"556","6.174707","192.168.2.2","192.168.1.2","TCP","66","64000","5001  >  44492 [ACK] Seq=1 Ack=741377 Win=64000 Len=0 TSval=1707336592 TSecr=935605849"
"559","6.199696","192.168.2.2","192.168.1.2","TCP","66","69632","5001  >  44492 [ACK] Seq=1 Ack=744273 Win=69632 Len=0 TSval=1707336617 TSecr=935605873"
"561","6.224073","192.168.2.2","192.168.1.2","TCP","66","69632","5001  >  44492 [ACK] Seq=1 Ack=747169 Win=69632 Len=0 TSval=1707336641 TSecr=935605897"
"563","6.248175","192.168.2.2","192.168.1.2","TCP","66","69632","5001  >  44492 [ACK] Seq=1 Ack=750065 Win=69632 Len=0 TSval=1707336665 TSecr=935605922"
"565","6.272591","192.168.2.2","192.168.1.2","TCP","66","69632","5001  >  44492 [ACK] Seq=1 Ack=752961 Win=69632 Len=0 TSval=1707336690 TSecr=935605945"
"567","6.297081","192.168.2.2","192.168.1.2","TCP","66","69632","5001  >  44492 [ACK] Seq=1 Ack=755857 Win=69632 Len=0 TSval=1707336714 TSecr=935605970"
"569","6.320836","192.168.2.2","192.168.1.2","TCP","66","69632","5001  >  44492 [ACK] Seq=1 Ack=758753 Win=69632 Len=0 TSval=1707336738 TSecr=935605994"
"571","6.345101","192.168.2.2","192.168.1.2","TCP","66","69632","5001  >  44492 [ACK] Seq=1 Ack=761649 Win=69632 Len=0 TSval=1707336762 TSecr=935606018"
"573","6.369585","192.168.2.2","192.168.1.2","TCP","66","69632","5001  >  44492 [ACK] Seq=1 Ack=764545 Win=69632 Len=0 TSval=1707336787 TSecr=935606043"
"575","6.394116","192.168.2.2","192.168.1.2","TCP","66","69632","5001  >  44492 [ACK] Seq=1 Ack=767441 Win=69632 Len=0 TSval=1707336811 TSecr=935606067"
