"No.","Time","Source","Destination","Protocol","Length","Calculated window size","Info"
"4","0.004203","192.168.2.2","192.168.1.2","TCP","74","43440","5001  >  44580 [SYN, ACK] Seq=0 Ack=1 Win=43440 Len=0 MSS=1460 SACK_PERM=1 TSval=2037545666 TSecr=1373804835 WS=512"
"7","0.004253","192.168.2.2","192.168.1.2","TCP","66","39936","5001  >  44580 [ACK] Seq=1 Ack=7241 Win=39936 Len=0 TSval=2037545666 TSecr=1373804835"
"11","0.053643","192.168.2.2","192.168.1.2","TCP","66","39936","5001  >  44580 [ACK] Seq=1 Ack=14481 Win=39936 Len=0 TSval=2037545716 TSecr=1373804835"
"14","0.114425","192.168.2.2","192.168.1.2","TCP","66","39936","5001  >  44580 [ACK] Seq=1 Ack=21721 Win=39936 Len=0 TSval=2037545776 TSecr=1373804835"
"16","0.175117","192.168.2.2","192.168.1.2","TCP","66","42496","5001  >  44580 [ACK] Seq=1 Ack=23169 Win=42496 Len=0 TSval=2037545837 TSecr=1373804849"
"17","0.187821","192.168.2.2","192.168.1.2","TCP","66","42496","5001  >  44580 [ACK] Seq=1 Ack=24617 Win=42496 Len=0 TSval=2037545850 TSecr=1373804913"
"19","0.199585","192.168.2.2","192.168.1.2","TCP","66","42496","5001  >  44580 [ACK] Seq=1 Ack=26065 Win=42496 Len=0 TSval=2037545862 TSecr=1373804996"
"21","0.211370","192.168.2.2","192.168.1.2","TCP","66","42496","5001  >  44580 [ACK] Seq=1 Ack=27513 Win=42496 Len=0 TSval=2037545873 TSecr=1373805019"
"24","0.223425","192.168.2.2","192.168.1.2","TCP","66","42496","5001  >  44580 [ACK] Seq=1 Ack=28961 Win=42496 Len=0 TSval=2037545885 TSecr=1373805031"
"26","0.235843","192.168.2.2","192.168.1.2","TCP","66","42496","5001  >  44580 [ACK] Seq=1 Ack=30409 Win=42496 Len=0 TSval=2037545898 TSecr=1373805042"
"28","0.247663","192.168.2.2","192.168.1.2","TCP","66","42496","5001  >  44580 [ACK] Seq=1 Ack=31857 Win=42496 Len=0 TSval=2037545910 TSecr=1373805042"
"30","0.260336","192.168.2.2","192.168.1.2","TCP","66","42496","5001  >  44580 [ACK] Seq=1 Ack=33305 Win=42496 Len=0 TSval=2037545922 TSecr=1373805054"
"32","0.272112","192.168.2.2","192.168.1.2","TCP","66","42496","5001  >  44580 [ACK] Seq=1 Ack=34753 Win=42496 Len=0 TSval=2037545934 TSecr=1373805067"
"34","0.283987","192.168.2.2","192.168.1.2","TCP","66","42496","5001  >  44580 [ACK] Seq=1 Ack=36201 Win=42496 Len=0 TSval=2037545946 TSecr=1373805079"
"36","0.296087","192.168.2.2","192.168.1.2","TCP","66","41984","5001  >  44580 [ACK] Seq=1 Ack=39097 Win=41984 Len=0 TSval=2037545958 TSecr=1373805091"
"38","0.320320","192.168.2.2","192.168.1.2","TCP","66","42496","5001  >  44580 [ACK] Seq=1 Ack=40545 Win=42496 Len=0 TSval=2037545982 TSecr=1373805103"
"40","0.344638","192.168.2.2","192.168.1.2","TCP","66","42496","5001  >  44580 [ACK] Seq=1 Ack=43441 Win=42496 Len=0 TSval=2037546007 TSecr=1373805115"
"42","0.356676","192.168.2.2","192.168.1.2","TCP","66","42496","5001  >  44580 [ACK] Seq=1 Ack=46337 Win=42496 Len=0 TSval=2037546019 TSecr=1373805151"
"45","0.380974","192.168.2.2","192.168.1.2","TCP","66","42496","5001  >  44580 [ACK] Seq=1 Ack=49233 Win=42496 Len=0 TSval=2037546043 TSecr=1373805176"
"48","0.405442","192.168.2.2","192.168.1.2","TCP","66","42496","5001  >  44580 [ACK] Seq=1 Ack=52129 Win=42496 Len=0 TSval=2037546067 TSecr=1373805188"
"50","0.441751","192.168.2.2","192.168.1.2","TCP","66","42496","5001  >  44580 [ACK] Seq=1 Ack=56473 Win=42496 Len=0 TSval=2037546104 TSecr=1373805188"
"52","0.465693","192.168.2.2","192.168.1.2","TCP","66","42496","5001  >  44580 [ACK] Seq=1 Ack=59369 Win=42496 Len=0 TSval=2037546128 TSecr=1373805236"
"55","0.490711","192.168.2.2","192.168.1.2","TCP","66","42496","5001  >  44580 [ACK] Seq=1 Ack=62265 Win=42496 Len=0 TSval=2037546153 TSecr=1373805273"
"58","0.515192","192.168.2.2","192.168.1.2","TCP","66","42496","5001  >  44580 [ACK] Seq=1 Ack=65161 Win=42496 Len=0 TSval=2037546177 TSecr=1373805297"
"61","0.551412","192.168.2.2","192.168.1.2","TCP","66","42496","5001  >  44580 [ACK] Seq=1 Ack=69505 Win=42496 Len=0 TSval=2037546213 TSecr=1373805297"
"64","0.575385","192.168.2.2","192.168.1.2","TCP","66","42496","5001  >  44580 [ACK] Seq=1 Ack=72401 Win=42496 Len=0 TSval=2037546237 TSecr=1373805346"
"66","0.599629","192.168.2.2","192.168.1.2","TCP","66","42496","5001  >  44580 [ACK] Seq=1 Ack=75297 Win=42496 Len=0 TSval=2037546261 TSecr=1373805382"
"68","0.624044","192.168.2.2","192.168.1.2","TCP","66","42496","5001  >  44580 [ACK] Seq=1 Ack=78193 Win=42496 Len=0 TSval=2037546286 TSecr=1373805382"
"70","0.648500","192.168.2.2","192.168.1.2","TCP","66","42496","5001  >  44580 [ACK] Seq=1 Ack=81089 Win=42496 Len=0 TSval=2037546310 TSecr=1373805406"
"72","0.672277","192.168.2.2","192.168.1.2","TCP","66","42496","5001  >  44580 [ACK] Seq=1 Ack=83985 Win=42496 Len=0 TSval=2037546334 TSecr=1373805430"
"74","0.696514","192.168.2.2","192.168.1.2","TCP","66","42496","5001  >  44580 [ACK] Seq=1 Ack=86881 Win=42496 Len=0 TSval=2037546358 TSecr=1373805455"
"76","0.721007","192.168.2.2","192.168.1.2","TCP","66","42496","5001  >  44580 [ACK] Seq=1 Ack=89777 Win=42496 Len=0 TSval=2037546383 TSecr=1373805479"
"78","0.745533","192.168.2.2","192.168.1.2","TCP","66","42496","5001  >  44580 [ACK] Seq=1 Ack=92673 Win=42496 Len=0 TSval=2037546407 TSecr=1373805503"
"80","0.769175","192.168.2.2","192.168.1.2","TCP","66","42496","5001  >  44580 [ACK] Seq=1 Ack=95569 Win=42496 Len=0 TSval=2037546431 TSecr=1373805527"
"82","0.793559","192.168.2.2","192.168.1.2","TCP","66","42496","5001  >  44580 [ACK] Seq=1 Ack=98465 Win=42496 Len=0 TSval=2037546455 TSecr=1373805552"
"85","0.817614","192.168.2.2","192.168.1.2","TCP","66","42496","5001  >  44580 [ACK] Seq=1 Ack=101361 Win=42496 Len=0 TSval=2037546479 TSecr=1373805576"
"87","0.841849","192.168.2.2","192.168.1.2","TCP","66","42496","5001  >  44580 [ACK] Seq=1 Ack=104257 Win=42496 Len=0 TSval=2037546504 TSecr=1373805600"
"89","0.866059","192.168.2.2","192.168.1.2","TCP","66","42496","5001  >  44580 [ACK] Seq=1 Ack=107153 Win=42496 Len=0 TSval=2037546528 TSecr=1373805624"
"91","0.902447","192.168.2.2","192.168.1.2","TCP","66","42496","5001  >  44580 [ACK] Seq=1 Ack=111497 Win=42496 Len=0 TSval=2037546564 TSecr=1373805624"
"93","0.926826","192.168.2.2","192.168.1.2","TCP","66","42496","5001  >  44580 [ACK] Seq=1 Ack=114393 Win=42496 Len=0 TSval=2037546588 TSecr=1373805673"
"97","0.951380","192.168.2.2","192.168.1.2","TCP","66","42496","5001  >  44580 [ACK] Seq=1 Ack=117289 Win=42496 Len=0 TSval=2037546613 TSecr=1373805697"
"100","0.975074","192.168.2.2","192.168.1.2","TCP","66","42496","5001  >  44580 [ACK] Seq=1 Ack=120185 Win=42496 Len=0 TSval=2037546637 TSecr=1373805733"
"102","0.999376","192.168.2.2","192.168.1.2","TCP","66","42496","5001  >  44580 [ACK] Seq=1 Ack=123081 Win=42496 Len=0 TSval=2037546661 TSecr=1373805757"
"104","1.023515","192.168.2.2","192.168.1.2","TCP","66","42496","5001  >  44580 [ACK] Seq=1 Ack=125977 Win=42496 Len=0 TSval=2037546685 TSecr=1373805782"
"107","1.060114","192.168.2.2","192.168.1.2","TCP","66","42496","5001  >  44580 [ACK] Seq=1 Ack=130321 Win=42496 Len=0 TSval=2037546722 TSecr=1373805801"
"110","1.084118","192.168.2.2","192.168.1.2","TCP","66","42496","5001  >  44580 [ACK] Seq=1 Ack=133217 Win=42496 Len=0 TSval=2037546746 TSecr=1373805830"
"112","1.109113","192.168.2.2","192.168.1.2","TCP","66","42496","5001  >  44580 [ACK] Seq=1 Ack=136113 Win=42496 Len=0 TSval=2037546771 TSecr=1373805854"
"117","1.133308","192.168.2.2","192.168.1.2","TCP","66","42496","5001  >  44580 [ACK] Seq=1 Ack=139009 Win=42496 Len=0 TSval=2037546795 TSecr=1373805891"
"119","1.158106","192.168.2.2","192.168.1.2","TCP","66","42496","5001  >  44580 [ACK] Seq=1 Ack=141905 Win=42496 Len=0 TSval=2037546820 TSecr=1373805891"
"122","1.182603","192.168.2.2","192.168.1.2","TCP","66","42496","5001  >  44580 [ACK] Seq=1 Ack=144801 Win=42496 Len=0 TSval=2037546844 TSecr=1373805915"
"124","1.206132","192.168.2.2","192.168.1.2","TCP","66","42496","5001  >  44580 [ACK] Seq=1 Ack=147697 Win=42496 Len=0 TSval=2037546868 TSecr=1373805940"
"126","1.230659","192.168.2.2","192.168.1.2","TCP","66","42496","5001  >  44580 [ACK] Seq=1 Ack=150593 Win=42496 Len=0 TSval=2037546892 TSecr=1373805964"
"129","1.266875","192.168.2.2","192.168.1.2","TCP","66","42496","5001  >  44580 [ACK] Seq=1 Ack=154937 Win=42496 Len=0 TSval=2037546928 TSecr=1373805989"
"132","1.290789","192.168.2.2","192.168.1.2","TCP","66","42496","5001  >  44580 [ACK] Seq=1 Ack=157833 Win=42496 Len=0 TSval=2037546952 TSecr=1373806037"
"134","1.315006","192.168.2.2","192.168.1.2","TCP","66","42496","5001  >  44580 [ACK] Seq=1 Ack=160729 Win=42496 Len=0 TSval=2037546976 TSecr=1373806061"
"136","1.339415","192.168.2.2","192.168.1.2","TCP","66","42496","5001  >  44580 [ACK] Seq=1 Ack=163625 Win=42496 Len=0 TSval=2037547001 TSecr=1373806097"
"138","1.363917","192.168.2.2","192.168.1.2","TCP","66","42496","5001  >  44580 [ACK] Seq=1 Ack=166521 Win=42496 Len=0 TSval=2037547025 TSecr=1373806097"
"141","1.387758","192.168.2.2","192.168.1.2","TCP","66","42496","5001  >  44580 [ACK] Seq=1 Ack=169417 Win=42496 Len=0 TSval=2037547049 TSecr=1373806121"
"143","1.411933","192.168.2.2","192.168.1.2","TCP","66","42496","5001  >  44580 [ACK] Seq=1 Ack=172313 Win=42496 Len=0 TSval=2037547073 TSecr=1373806145"
"145","1.448223","192.168.2.2","192.168.1.2","TCP","66","42496","5001  >  44580 [ACK] Seq=1 Ack=176657 Win=42496 Len=0 TSval=2037547110 TSecr=1373806170"
"147","1.472737","192.168.2.2","192.168.1.2","TCP","66","42496","5001  >  44580 [ACK] Seq=1 Ack=179553 Win=42496 Len=0 TSval=2037547134 TSecr=1373806194"
"150","1.497250","192.168.2.2","192.168.1.2","TCP","66","42496","5001  >  44580 [ACK] Seq=1 Ack=182449 Win=42496 Len=0 TSval=2037547159 TSecr=1373806218"
"152","1.520902","192.168.2.2","192.168.1.2","TCP","66","42496","5001  >  44580 [ACK] Seq=1 Ack=185345 Win=42496 Len=0 TSval=2037547182 TSecr=1373806242"
"154","1.546388","192.168.2.2","192.168.1.2","TCP","66","42496","5001  >  44580 [ACK] Seq=1 Ack=188241 Win=42496 Len=0 TSval=2037547208 TSecr=1373806279"
"156","1.570695","192.168.2.2","192.168.1.2","TCP","66","42496","5001  >  44580 [ACK] Seq=1 Ack=191137 Win=42496 Len=0 TSval=2037547232 TSecr=1373806303"
"158","1.606988","192.168.2.2","192.168.1.2","TCP","66","42496","5001  >  44580 [ACK] Seq=1 Ack=195481 Win=42496 Len=0 TSval=2037547268 TSecr=1373806304"
"160","1.631483","192.168.2.2","192.168.1.2","TCP","66","42496","5001  >  44580 [ACK] Seq=1 Ack=198377 Win=42496 Len=0 TSval=2037547293 TSecr=1373806351"
"162","1.655972","192.168.2.2","192.168.1.2","TCP","66","42496","5001  >  44580 [ACK] Seq=1 Ack=201273 Win=42496 Len=0 TSval=2037547317 TSecr=1373806377"
"164","1.679637","192.168.2.2","192.168.1.2","TCP","66","42496","5001  >  44580 [ACK] Seq=1 Ack=204169 Win=42496 Len=0 TSval=2037547341 TSecr=1373806401"
"167","1.704006","192.168.2.2","192.168.1.2","TCP","66","42496","5001  >  44580 [ACK] Seq=1 Ack=207065 Win=42496 Len=0 TSval=2037547365 TSecr=1373806437"
"169","1.728072","192.168.2.2","192.168.1.2","TCP","66","42496","5001  >  44580 [ACK] Seq=1 Ack=209961 Win=42496 Len=0 TSval=2037547389 TSecr=1373806462"
"171","1.752312","192.168.2.2","192.168.1.2","TCP","66","42496","5001  >  44580 [ACK] Seq=1 Ack=212857 Win=42496 Len=0 TSval=2037547414 TSecr=1373806486"
"173","1.776554","192.168.2.2","192.168.1.2","TCP","66","42496","5001  >  44580 [ACK] Seq=1 Ack=215753 Win=42496 Len=0 TSval=2037547438 TSecr=1373806510"
"175","1.812861","192.168.2.2","192.168.1.2","TCP","66","42496","5001  >  44580 [ACK] Seq=1 Ack=220097 Win=42496 Len=0 TSval=2037547474 TSecr=1373806510"
"178","1.837278","192.168.2.2","192.168.1.2","TCP","66","42496","5001  >  44580 [ACK] Seq=1 Ack=222993 Win=42496 Len=0 TSval=2037547498 TSecr=1373806558"
"180","1.861775","192.168.2.2","192.168.1.2","TCP","66","42496","5001  >  44580 [ACK] Seq=1 Ack=225889 Win=42496 Len=0 TSval=2037547523 TSecr=1373806583"
"182","1.885555","192.168.2.2","192.168.1.2","TCP","66","42496","5001  >  44580 [ACK] Seq=1 Ack=228785 Win=42496 Len=0 TSval=2037547547 TSecr=1373806607"
"184","1.909765","192.168.2.2","192.168.1.2","TCP","66","42496","5001  >  44580 [ACK] Seq=1 Ack=231681 Win=42496 Len=0 TSval=2037547571 TSecr=1373806643"
"186","1.934280","192.168.2.2","192.168.1.2","TCP","66","42496","5001  >  44580 [ACK] Seq=1 Ack=234577 Win=42496 Len=0 TSval=2037547595 TSecr=1373806643"
"188","1.958778","192.168.2.2","192.168.1.2","TCP","66","42496","5001  >  44580 [ACK] Seq=1 Ack=237473 Win=42496 Len=0 TSval=2037547620 TSecr=1373806667"
"191","1.994552","192.168.2.2","192.168.1.2","TCP","66","42496","5001  >  44580 [ACK] Seq=1 Ack=241817 Win=42496 Len=0 TSval=2037547656 TSecr=1373806692"
"193","2.018787","192.168.2.2","192.168.1.2","TCP","66","42496","5001  >  44580 [ACK] Seq=1 Ack=244713 Win=42496 Len=0 TSval=2037547680 TSecr=1373806740"
"196","2.043083","192.168.2.2","192.168.1.2","TCP","66","42496","5001  >  44580 [ACK] Seq=1 Ack=247609 Win=42496 Len=0 TSval=2037547704 TSecr=1373806764"
"198","2.067585","192.168.2.2","192.168.1.2","TCP","66","42496","5001  >  44580 [ACK] Seq=1 Ack=250505 Win=42496 Len=0 TSval=2037547729 TSecr=1373806789"
"200","2.103848","192.168.2.2","192.168.1.2","TCP","66","42496","5001  >  44580 [ACK] Seq=1 Ack=254849 Win=42496 Len=0 TSval=2037547765 TSecr=1373806807"
"203","2.128399","192.168.2.2","192.168.1.2","TCP","66","48128","5001  >  44580 [ACK] Seq=1 Ack=257745 Win=48128 Len=0 TSval=2037547789 TSecr=1373806849"
"206","2.152761","192.168.2.2","192.168.1.2","TCP","66","54272","5001  >  44580 [ACK] Seq=1 Ack=260641 Win=54272 Len=0 TSval=2037547814 TSecr=1373806873"
"208","2.177350","192.168.2.2","192.168.1.2","TCP","66","54784","5001  >  44580 [ACK] Seq=1 Ack=263537 Win=54784 Len=0 TSval=2037547838 TSecr=1373806898"
"210","2.201220","192.168.2.2","192.168.1.2","TCP","66","54784","5001  >  44580 [ACK] Seq=1 Ack=266433 Win=54784 Len=0 TSval=2037547862 TSecr=1373806934"
"212","2.226336","192.168.2.2","192.168.1.2","TCP","66","54784","5001  >  44580 [ACK] Seq=1 Ack=269329 Win=54784 Len=0 TSval=2037547887 TSecr=1373806934"
"214","2.249918","192.168.2.2","192.168.1.2","TCP","66","54784","5001  >  44580 [ACK] Seq=1 Ack=272225 Win=54784 Len=0 TSval=2037547911 TSecr=1373806958"
"216","2.273895","192.168.2.2","192.168.1.2","TCP","66","54784","5001  >  44580 [ACK] Seq=1 Ack=275121 Win=54784 Len=0 TSval=2037547935 TSecr=1373806983"
"218","2.298166","192.168.2.2","192.168.1.2","TCP","66","54784","5001  >  44580 [ACK] Seq=1 Ack=278017 Win=54784 Len=0 TSval=2037547959 TSecr=1373807008"
"220","2.322379","192.168.2.2","192.168.1.2","TCP","66","54784","5001  >  44580 [ACK] Seq=1 Ack=280913 Win=54784 Len=0 TSval=2037547983 TSecr=1373807031"
"222","2.346564","192.168.2.2","192.168.1.2","TCP","66","55296","5001  >  44580 [ACK] Seq=1 Ack=282361 Win=55296 Len=0 TSval=2037548007 TSecr=1373807057"
"224","2.358697","192.168.2.2","192.168.1.2","TCP","66","55296","5001  >  44580 [ACK] Seq=1 Ack=285257 Win=55296 Len=0 TSval=2037548020 TSecr=1373807080"
"226","2.383140","192.168.2.2","192.168.1.2","TCP","66","55296","5001  >  44580 [ACK] Seq=1 Ack=288153 Win=55296 Len=0 TSval=2037548044 TSecr=1373807104"
"229","2.407157","192.168.2.2","192.168.1.2","TCP","66","55296","5001  >  44580 [ACK] Seq=1 Ack=291049 Win=55296 Len=0 TSval=2037548068 TSecr=1373807128"
"231","2.432173","192.168.2.2","192.168.1.2","TCP","66","55296","5001  >  44580 [ACK] Seq=1 Ack=293945 Win=55296 Len=0 TSval=2037548093 TSecr=1373807153"
"233","2.455700","192.168.2.2","192.168.1.2","TCP","66","55296","5001  >  44580 [ACK] Seq=1 Ack=296841 Win=55296 Len=0 TSval=2037548117 TSecr=1373807177"
"235","2.480216","192.168.2.2","192.168.1.2","TCP","66","55296","5001  >  44580 [ACK] Seq=1 Ack=299737 Win=55296 Len=0 TSval=2037548141 TSecr=1373807189"
"237","2.504664","192.168.2.2","192.168.1.2","TCP","66","57344","5001  >  44580 [ACK] Seq=1 Ack=302633 Win=57344 Len=0 TSval=2037548165 TSecr=1373807213"
"239","2.528261","192.168.2.2","192.168.1.2","TCP","66","58368","5001  >  44580 [ACK] Seq=1 Ack=304081 Win=58368 Len=0 TSval=2037548189 TSecr=1373807213"
"241","2.540384","192.168.2.2","192.168.1.2","TCP","66","58368","5001  >  44580 [ACK] Seq=1 Ack=306977 Win=58368 Len=0 TSval=2037548201 TSecr=1373807237"
"243","2.564588","192.168.2.2","192.168.1.2","TCP","66","58368","5001  >  44580 [ACK] Seq=1 Ack=309873 Win=58368 Len=0 TSval=2037548225 TSecr=1373807262"
"245","2.589067","192.168.2.2","192.168.1.2","TCP","66","58368","5001  >  44580 [ACK] Seq=1 Ack=312769 Win=58368 Len=0 TSval=2037548250 TSecr=1373807286"
"247","2.613746","192.168.2.2","192.168.1.2","TCP","66","58368","5001  >  44580 [ACK] Seq=1 Ack=315665 Win=58368 Len=0 TSval=2037548275 TSecr=1373807310"
"249","2.638026","192.168.2.2","192.168.1.2","TCP","66","58368","5001  >  44580 [ACK] Seq=1 Ack=318561 Win=58368 Len=0 TSval=2037548299 TSecr=1373807335"
"251","2.674352","192.168.2.2","192.168.1.2","TCP","66","58368","5001  >  44580 [ACK] Seq=1 Ack=322905 Win=58368 Len=0 TSval=2037548335 TSecr=1373807358"
"254","2.698716","192.168.2.2","192.168.1.2","TCP","66","58368","5001  >  44580 [ACK] Seq=1 Ack=325801 Win=58368 Len=0 TSval=2037548359 TSecr=1373807394"
"256","2.722801","192.168.2.2","192.168.1.2","TCP","66","58368","5001  >  44580 [ACK] Seq=1 Ack=328697 Win=58368 Len=0 TSval=2037548384 TSecr=1373807419"
"258","2.759097","192.168.2.2","192.168.1.2","TCP","66","58368","5001  >  44580 [ACK] Seq=1 Ack=333041 Win=58368 Len=0 TSval=2037548420 TSecr=1373807444"
"260","2.784093","192.168.2.2","192.168.1.2","TCP","66","58368","5001  >  44580 [ACK] Seq=1 Ack=335937 Win=58368 Len=0 TSval=2037548445 TSecr=1373807504"
"262","2.807588","192.168.2.2","192.168.1.2","TCP","66","58368","5001  >  44580 [ACK] Seq=1 Ack=338833 Win=58368 Len=0 TSval=2037548468 TSecr=1373807504"
"264","2.832091","192.168.2.2","192.168.1.2","TCP","66","58368","5001  >  44580 [ACK] Seq=1 Ack=341729 Win=58368 Len=0 TSval=2037548493 TSecr=1373807529"
"267","2.856015","192.168.2.2","192.168.1.2","TCP","66","58368","5001  >  44580 [ACK] Seq=1 Ack=344625 Win=58368 Len=0 TSval=2037548517 TSecr=1373807553"
"269","2.880231","192.168.2.2","192.168.1.2","TCP","66","58368","5001  >  44580 [ACK] Seq=1 Ack=347521 Win=58368 Len=0 TSval=2037548541 TSecr=1373807589"
"271","2.904546","192.168.2.2","192.168.1.2","TCP","66","58368","5001  >  44580 [ACK] Seq=1 Ack=350417 Win=58368 Len=0 TSval=2037548565 TSecr=1373807614"
"273","2.929069","192.168.2.2","192.168.1.2","TCP","66","58368","5001  >  44580 [ACK] Seq=1 Ack=353313 Win=58368 Len=0 TSval=2037548590 TSecr=1373807637"
"275","2.953534","192.168.2.2","192.168.1.2","TCP","66","58368","5001  >  44580 [ACK] Seq=1 Ack=356209 Win=58368 Len=0 TSval=2037548614 TSecr=1373807662"
"277","2.989241","192.168.2.2","192.168.1.2","TCP","66","58368","5001  >  44580 [ACK] Seq=1 Ack=360553 Win=58368 Len=0 TSval=2037548650 TSecr=1373807662"
"279","3.013489","192.168.2.2","192.168.1.2","TCP","66","58368","5001  >  44580 [ACK] Seq=1 Ack=363449 Win=58368 Len=0 TSval=2037548674 TSecr=1373807710"
"283","3.037845","192.168.2.2","192.168.1.2","TCP","66","58368","5001  >  44580 [ACK] Seq=1 Ack=366345 Win=58368 Len=0 TSval=2037548698 TSecr=1373807734"
"285","3.062342","192.168.2.2","192.168.1.2","TCP","66","58368","5001  >  44580 [ACK] Seq=1 Ack=369241 Win=58368 Len=0 TSval=2037548723 TSecr=1373807759"
"287","3.086820","192.168.2.2","192.168.1.2","TCP","66","58368","5001  >  44580 [ACK] Seq=1 Ack=372137 Win=58368 Len=0 TSval=2037548747 TSecr=1373807783"
"289","3.110357","192.168.2.2","192.168.1.2","TCP","66","58368","5001  >  44580 [ACK] Seq=1 Ack=375033 Win=58368 Len=0 TSval=2037548771 TSecr=1373807819"
"291","3.134883","192.168.2.2","192.168.1.2","TCP","66","58368","5001  >  44580 [ACK] Seq=1 Ack=377929 Win=58368 Len=0 TSval=2037548795 TSecr=1373807843"
"293","3.159346","192.168.2.2","192.168.1.2","TCP","66","58368","5001  >  44580 [ACK] Seq=1 Ack=380825 Win=58368 Len=0 TSval=2037548820 TSecr=1373807843"
"296","3.184044","192.168.2.2","192.168.1.2","TCP","66","58368","5001  >  44580 [ACK] Seq=1 Ack=383721 Win=58368 Len=0 TSval=2037548845 TSecr=1373807867"
"298","3.208357","192.168.2.2","192.168.1.2","TCP","66","58368","5001  >  44580 [ACK] Seq=1 Ack=386617 Win=58368 Len=0 TSval=2037548869 TSecr=1373807892"
"300","3.232865","192.168.2.2","192.168.1.2","TCP","66","58368","5001  >  44580 [ACK] Seq=1 Ack=389513 Win=58368 Len=0 TSval=2037548893 TSecr=1373807916"
"302","3.256494","192.168.2.2","192.168.1.2","TCP","66","58368","5001  >  44580 [ACK] Seq=1 Ack=392409 Win=58368 Len=0 TSval=2037548917 TSecr=1373807940"
"304","3.280739","192.168.2.2","192.168.1.2","TCP","66","58368","5001  >  44580 [ACK] Seq=1 Ack=395305 Win=58368 Len=0 TSval=2037548941 TSecr=1373807964"
"306","3.304964","192.168.2.2","192.168.1.2","TCP","66","58368","5001  >  44580 [ACK] Seq=1 Ack=398201 Win=58368 Len=0 TSval=2037548965 TSecr=1373807989"
"308","3.329170","192.168.2.2","192.168.1.2","TCP","66","58368","5001  >  44580 [ACK] Seq=1 Ack=401097 Win=58368 Len=0 TSval=2037548990 TSecr=1373808014"
"310","3.353393","192.168.2.2","192.168.1.2","TCP","66","58368","5001  >  44580 [ACK] Seq=1 Ack=403993 Win=58368 Len=0 TSval=2037549014 TSecr=1373808038"
"312","3.377899","192.168.2.2","192.168.1.2","TCP","66","58368","5001  >  44580 [ACK] Seq=1 Ack=406889 Win=58368 Len=0 TSval=2037549038 TSecr=1373808062"
"314","3.401830","192.168.2.2","192.168.1.2","TCP","66","58368","5001  >  44580 [ACK] Seq=1 Ack=409785 Win=58368 Len=0 TSval=2037549062 TSecr=1373808086"
"316","3.426092","192.168.2.2","192.168.1.2","TCP","66","58368","5001  >  44580 [ACK] Seq=1 Ack=412681 Win=58368 Len=0 TSval=2037549086 TSecr=1373808110"
"318","3.450432","192.168.2.2","192.168.1.2","TCP","66","58368","5001  >  44580 [ACK] Seq=1 Ack=415577 Win=58368 Len=0 TSval=2037549111 TSecr=1373808134"
"320","3.474945","192.168.2.2","192.168.1.2","TCP","66","58368","5001  >  44580 [ACK] Seq=1 Ack=418473 Win=58368 Len=0 TSval=2037549135 TSecr=1373808159"
"322","3.498718","192.168.2.2","192.168.1.2","TCP","66","58368","5001  >  44580 [ACK] Seq=1 Ack=421369 Win=58368 Len=0 TSval=2037549159 TSecr=1373808183"
"324","3.522977","192.168.2.2","192.168.1.2","TCP","66","58368","5001  >  44580 [ACK] Seq=1 Ack=424265 Win=58368 Len=0 TSval=2037549183 TSecr=1373808207"
"326","3.547168","192.168.2.2","192.168.1.2","TCP","66","58368","5001  >  44580 [ACK] Seq=1 Ack=427161 Win=58368 Len=0 TSval=2037549207 TSecr=1373808231"
"328","3.571398","192.168.2.2","192.168.1.2","TCP","66","58368","5001  >  44580 [ACK] Seq=1 Ack=430057 Win=58368 Len=0 TSval=2037549232 TSecr=1373808256"
"330","3.595639","192.168.2.2","192.168.1.2","TCP","66","58368","5001  >  44580 [ACK] Seq=1 Ack=432953 Win=58368 Len=0 TSval=2037549256 TSecr=1373808280"
"332","3.619987","192.168.2.2","192.168.1.2","TCP","66","58368","5001  >  44580 [ACK] Seq=1 Ack=435849 Win=58368 Len=0 TSval=2037549280 TSecr=1373808304"
"334","3.644542","192.168.2.2","192.168.1.2","TCP","66","58368","5001  >  44580 [ACK] Seq=1 Ack=438745 Win=58368 Len=0 TSval=2037549305 TSecr=1373808328"
"336","3.668985","192.168.2.2","192.168.1.2","TCP","66","58368","5001  >  44580 [ACK] Seq=1 Ack=441641 Win=58368 Len=0 TSval=2037549329 TSecr=1373808352"
"338","3.692537","192.168.2.2","192.168.1.2","TCP","66","58368","5001  >  44580 [ACK] Seq=1 Ack=444537 Win=58368 Len=0 TSval=2037549353 TSecr=1373808377"
"340","3.716744","192.168.2.2","192.168.1.2","TCP","66","58368","5001  >  44580 [ACK] Seq=1 Ack=447433 Win=58368 Len=0 TSval=2037549377 TSecr=1373808401"
"342","3.740985","192.168.2.2","192.168.1.2","TCP","66","58368","5001  >  44580 [ACK] Seq=1 Ack=450329 Win=58368 Len=0 TSval=2037549401 TSecr=1373808425"
"344","3.766097","192.168.2.2","192.168.1.2","TCP","66","58368","5001  >  44580 [ACK] Seq=1 Ack=453225 Win=58368 Len=0 TSval=2037549426 TSecr=1373808449"
"346","3.789441","192.168.2.2","192.168.1.2","TCP","66","58368","5001  >  44580 [ACK] Seq=1 Ack=456121 Win=58368 Len=0 TSval=2037549450 TSecr=1373808474"
"348","3.813643","192.168.2.2","192.168.1.2","TCP","66","58368","5001  >  44580 [ACK] Seq=1 Ack=459017 Win=58368 Len=0 TSval=2037549474 TSecr=1373808498"
"350","3.838529","192.168.2.2","192.168.1.2","TCP","66","58368","5001  >  44580 [ACK] Seq=1 Ack=461913 Win=58368 Len=0 TSval=2037549499 TSecr=1373808522"
"352","3.862126","192.168.2.2","192.168.1.2","TCP","66","58368","5001  >  44580 [ACK] Seq=1 Ack=464809 Win=58368 Len=0 TSval=2037549522 TSecr=1373808546"
"354","3.886553","192.168.2.2","192.168.1.2","TCP","66","58368","5001  >  44580 [ACK] Seq=1 Ack=467705 Win=58368 Len=0 TSval=2037549547 TSecr=1373808570"
"356","3.910530","192.168.2.2","192.168.1.2","TCP","66","58368","5001  >  44580 [ACK] Seq=1 Ack=470601 Win=58368 Len=0 TSval=2037549571 TSecr=1373808595"
"358","3.935582","192.168.2.2","192.168.1.2","TCP","66","58368","5001  >  44580 [ACK] Seq=1 Ack=473497 Win=58368 Len=0 TSval=2037549596 TSecr=1373808619"
"360","3.959050","192.168.2.2","192.168.1.2","TCP","66","58368","5001  >  44580 [ACK] Seq=1 Ack=476393 Win=58368 Len=0 TSval=2037549619 TSecr=1373808643"
"362","3.983529","192.168.2.2","192.168.1.2","TCP","66","58368","5001  >  44580 [ACK] Seq=1 Ack=479289 Win=58368 Len=0 TSval=2037549644 TSecr=1373808668"
"365","4.008037","192.168.2.2","192.168.1.2","TCP","66","58368","5001  >  44580 [ACK] Seq=1 Ack=482185 Win=58368 Len=0 TSval=2037549668 TSecr=1373808691"
"368","4.031623","192.168.2.2","192.168.1.2","TCP","66","58368","5001  >  44580 [ACK] Seq=1 Ack=485081 Win=58368 Len=0 TSval=2037549692 TSecr=1373808716"
"370","4.056111","192.168.2.2","192.168.1.2","TCP","66","58368","5001  >  44580 [ACK] Seq=1 Ack=487977 Win=58368 Len=0 TSval=2037549716 TSecr=1373808740"
"372","4.080097","192.168.2.2","192.168.1.2","TCP","66","63488","5001  >  44580 [ACK] Seq=1 Ack=490873 Win=63488 Len=0 TSval=2037549740 TSecr=1373808765"
"374","4.105066","192.168.2.2","192.168.1.2","TCP","66","63488","5001  >  44580 [ACK] Seq=1 Ack=493769 Win=63488 Len=0 TSval=2037549765 TSecr=1373808788"
"376","4.128636","192.168.2.2","192.168.1.2","TCP","66","63488","5001  >  44580 [ACK] Seq=1 Ack=496665 Win=63488 Len=0 TSval=2037549789 TSecr=1373808813"
"378","4.153165","192.168.2.2","192.168.1.2","TCP","66","64000","5001  >  44580 [ACK] Seq=1 Ack=498113 Win=64000 Len=0 TSval=2037549813 TSecr=1373808822"
"380","4.164887","192.168.2.2","192.168.1.2","TCP","66","64000","5001  >  44580 [ACK] Seq=1 Ack=501009 Win=64000 Len=0 TSval=2037549825 TSecr=1373808837"
"383","4.202121","192.168.2.2","192.168.1.2","TCP","66","64000","5001  >  44580 [ACK] Seq=1 Ack=505353 Win=64000 Len=0 TSval=2037549862 TSecr=1373808861"
"385","4.226672","192.168.2.2","192.168.1.2","TCP","66","64000","5001  >  44580 [ACK] Seq=1 Ack=508249 Win=64000 Len=0 TSval=2037549887 TSecr=1373808909"
"387","4.251114","192.168.2.2","192.168.1.2","TCP","66","64000","5001  >  44580 [ACK] Seq=1 Ack=511145 Win=64000 Len=0 TSval=2037549911 TSecr=1373808934"
"389","4.274687","192.168.2.2","192.168.1.2","TCP","66","64000","5001  >  44580 [ACK] Seq=1 Ack=514041 Win=64000 Len=0 TSval=2037549935 TSecr=1373808958"
"391","4.299191","192.168.2.2","192.168.1.2","TCP","66","64000","5001  >  44580 [ACK] Seq=1 Ack=516937 Win=64000 Len=0 TSval=2037549959 TSecr=1373808982"
"393","4.323634","192.168.2.2","192.168.1.2","TCP","66","64000","5001  >  44580 [ACK] Seq=1 Ack=519833 Win=64000 Len=0 TSval=2037549984 TSecr=1373808994"
"395","4.347377","192.168.2.2","192.168.1.2","TCP","66","64000","5001  >  44580 [ACK] Seq=1 Ack=522729 Win=64000 Len=0 TSval=2037550007 TSecr=1373809031"
"397","4.371683","192.168.2.2","192.168.1.2","TCP","66","64000","5001  >  44580 [ACK] Seq=1 Ack=525625 Win=64000 Len=0 TSval=2037550032 TSecr=1373809056"
"399","4.396181","192.168.2.2","192.168.1.2","TCP","66","64000","5001  >  44580 [ACK] Seq=1 Ack=528521 Win=64000 Len=0 TSval=2037550056 TSecr=1373809080"
"401","4.420672","192.168.2.2","192.168.1.2","TCP","66","64000","5001  >  44580 [ACK] Seq=1 Ack=531417 Win=64000 Len=0 TSval=2037550081 TSecr=1373809104"
"403","4.444237","192.168.2.2","192.168.1.2","TCP","66","64000","5001  >  44580 [ACK] Seq=1 Ack=534313 Win=64000 Len=0 TSval=2037550104 TSecr=1373809128"
"405","4.468689","192.168.2.2","192.168.1.2","TCP","66","64000","5001  >  44580 [ACK] Seq=1 Ack=537209 Win=64000 Len=0 TSval=2037550129 TSecr=1373809153"
"407","4.492691","192.168.2.2","192.168.1.2","TCP","66","64000","5001  >  44580 [ACK] Seq=1 Ack=540105 Win=64000 Len=0 TSval=2037550153 TSecr=1373809176"
"410","4.517715","192.168.2.2","192.168.1.2","TCP","66","64000","5001  >  44580 [ACK] Seq=1 Ack=543001 Win=64000 Len=0 TSval=2037550178 TSecr=1373809201"
"412","4.541226","192.168.2.2","192.168.1.2","TCP","66","64000","5001  >  44580 [ACK] Seq=1 Ack=545897 Win=64000 Len=0 TSval=2037550201 TSecr=1373809225"
"414","4.565739","192.168.2.2","192.168.1.2","TCP","66","64000","5001  >  44580 [ACK] Seq=1 Ack=548793 Win=64000 Len=0 TSval=2037550226 TSecr=1373809250"
"416","4.589597","192.168.2.2","192.168.1.2","TCP","66","64000","5001  >  44580 [ACK] Seq=1 Ack=551689 Win=64000 Len=0 TSval=2037550249 TSecr=1373809273"
"418","4.613815","192.168.2.2","192.168.1.2","TCP","66","64000","5001  >  44580 [ACK] Seq=1 Ack=554585 Win=64000 Len=0 TSval=2037550274 TSecr=1373809298"
"420","4.638046","192.168.2.2","192.168.1.2","TCP","66","64000","5001  >  44580 [ACK] Seq=1 Ack=557481 Win=64000 Len=0 TSval=2037550298 TSecr=1373809322"
"422","4.674354","192.168.2.2","192.168.1.2","TCP","66","64000","5001  >  44580 [ACK] Seq=1 Ack=560377 Win=64000 Len=0 TSval=2037550334 TSecr=1373809326"
"424","4.686490","192.168.2.2","192.168.1.2","TCP","66","64000","5001  >  44580 [ACK] Seq=1 Ack=563273 Win=64000 Len=0 TSval=2037550346 TSecr=1373809370"
"426","4.710748","192.168.2.2","192.168.1.2","TCP","66","64000","5001  >  44580 [ACK] Seq=1 Ack=566169 Win=64000 Len=0 TSval=2037550370 TSecr=1373809395"
"428","4.735337","192.168.2.2","192.168.1.2","TCP","66","64000","5001  >  44580 [ACK] Seq=1 Ack=569065 Win=64000 Len=0 TSval=2037550395 TSecr=1373809418"
"430","4.759786","192.168.2.2","192.168.1.2","TCP","66","64000","5001  >  44580 [ACK] Seq=1 Ack=571961 Win=64000 Len=0 TSval=2037550419 TSecr=1373809443"
"432","4.783375","192.168.2.2","192.168.1.2","TCP","66","64000","5001  >  44580 [ACK] Seq=1 Ack=574857 Win=64000 Len=0 TSval=2037550443 TSecr=1373809467"
"434","4.807816","192.168.2.2","192.168.1.2","TCP","66","64000","5001  >  44580 [ACK] Seq=1 Ack=577753 Win=64000 Len=0 TSval=2037550467 TSecr=1373809503"
"436","4.831824","192.168.2.2","192.168.1.2","TCP","66","64000","5001  >  44580 [ACK] Seq=1 Ack=580649 Win=64000 Len=0 TSval=2037550491 TSecr=1373809515"
"438","4.856069","192.168.2.2","192.168.1.2","TCP","66","64000","5001  >  44580 [ACK] Seq=1 Ack=583545 Win=64000 Len=0 TSval=2037550516 TSecr=1373809540"
"440","4.880365","192.168.2.2","192.168.1.2","TCP","66","64000","5001  >  44580 [ACK] Seq=1 Ack=586441 Win=64000 Len=0 TSval=2037550540 TSecr=1373809564"
"442","4.904518","192.168.2.2","192.168.1.2","TCP","66","64000","5001  >  44580 [ACK] Seq=1 Ack=589337 Win=64000 Len=0 TSval=2037550564 TSecr=1373809589"
"444","4.929336","192.168.2.2","192.168.1.2","TCP","66","64000","5001  >  44580 [ACK] Seq=1 Ack=592233 Win=64000 Len=0 TSval=2037550589 TSecr=1373809612"
"446","4.952968","192.168.2.2","192.168.1.2","TCP","66","64000","5001  >  44580 [ACK] Seq=1 Ack=595129 Win=64000 Len=0 TSval=2037550613 TSecr=1373809637"
"448","4.977175","192.168.2.2","192.168.1.2","TCP","66","64000","5001  >  44580 [ACK] Seq=1 Ack=598025 Win=64000 Len=0 TSval=2037550637 TSecr=1373809661"
"450","5.001889","192.168.2.2","192.168.1.2","TCP","66","64000","5001  >  44580 [ACK] Seq=1 Ack=600921 Win=64000 Len=0 TSval=2037550661 TSecr=1373809685"
"452","5.025624","192.168.2.2","192.168.1.2","TCP","66","64000","5001  >  44580 [ACK] Seq=1 Ack=603817 Win=64000 Len=0 TSval=2037550685 TSecr=1373809709"
"455","5.049849","192.168.2.2","192.168.1.2","TCP","66","64000","5001  >  44580 [ACK] Seq=1 Ack=606713 Win=64000 Len=0 TSval=2037550709 TSecr=1373809733"
"457","5.074083","192.168.2.2","192.168.1.2","TCP","66","64000","5001  >  44580 [ACK] Seq=1 Ack=609609 Win=64000 Len=0 TSval=2037550734 TSecr=1373809758"
"463","5.104192","192.168.2.2","192.168.1.2","TCP","66","64000","5001  >  44580 [ACK] Seq=1 Ack=612505 Win=64000 Len=0 TSval=2037550764 TSecr=1373809782"
"466","5.128945","192.168.2.2","192.168.1.2","TCP","66","64000","5001  >  44580 [ACK] Seq=1 Ack=615401 Win=64000 Len=0 TSval=2037550788 TSecr=1373809806"
"468","5.150346","192.168.2.2","192.168.1.2","TCP","66","64000","5001  >  44580 [ACK] Seq=1 Ack=618297 Win=64000 Len=0 TSval=2037550810 TSecr=1373809831"
"470","5.170958","192.168.2.2","192.168.1.2","TCP","66","64000","5001  >  44580 [ACK] Seq=1 Ack=621193 Win=64000 Len=0 TSval=2037550830 TSecr=1373809854"
"473","5.198054","192.168.2.2","192.168.1.2","TCP","66","64000","5001  >  44580 [ACK] Seq=1 Ack=624089 Win=64000 Len=0 TSval=2037550857 TSecr=1373809878"
"475","5.220177","192.168.2.2","192.168.1.2","TCP","66","64000","5001  >  44580 [ACK] Seq=1 Ack=626985 Win=64000 Len=0 TSval=2037550880 TSecr=1373809903"
"477","5.244846","192.168.2.2","192.168.1.2","TCP","66","64000","5001  >  44580 [ACK] Seq=1 Ack=629881 Win=64000 Len=0 TSval=2037550904 TSecr=1373809933"
"479","5.269332","192.168.2.2","192.168.1.2","TCP","66","64000","5001  >  44580 [ACK] Seq=1 Ack=632777 Win=64000 Len=0 TSval=2037550929 TSecr=1373809933"
"481","5.293180","192.168.2.2","192.168.1.2","TCP","66","64000","5001  >  44580 [ACK] Seq=1 Ack=635673 Win=64000 Len=0 TSval=2037550953 TSecr=1373809958"
"483","5.317427","192.168.2.2","192.168.1.2","TCP","66","64000","5001  >  44580 [ACK] Seq=1 Ack=638569 Win=64000 Len=0 TSval=2037550977 TSecr=1373809979"
"485","5.341883","192.168.2.2","192.168.1.2","TCP","66","64000","5001  >  44580 [ACK] Seq=1 Ack=641465 Win=64000 Len=0 TSval=2037551001 TSecr=1373809999"
"487","5.366438","192.168.2.2","192.168.1.2","TCP","66","64000","5001  >  44580 [ACK] Seq=1 Ack=644361 Win=64000 Len=0 TSval=2037551026 TSecr=1373810027"
"489","5.390108","192.168.2.2","192.168.1.2","TCP","66","64000","5001  >  44580 [ACK] Seq=1 Ack=647257 Win=64000 Len=0 TSval=2037551049 TSecr=1373810049"
"491","5.414445","192.168.2.2","192.168.1.2","TCP","66","64000","5001  >  44580 [ACK] Seq=1 Ack=650153 Win=64000 Len=0 TSval=2037551074 TSecr=1373810073"
"493","5.438932","192.168.2.2","192.168.1.2","TCP","66","64000","5001  >  44580 [ACK] Seq=1 Ack=653049 Win=64000 Len=0 TSval=2037551098 TSecr=1373810098"
"495","5.462762","192.168.2.2","192.168.1.2","TCP","66","64000","5001  >  44580 [ACK] Seq=1 Ack=655945 Win=64000 Len=0 TSval=2037551122 TSecr=1373810122"
"497","5.487017","192.168.2.2","192.168.1.2","TCP","66","64000","5001  >  44580 [ACK] Seq=1 Ack=658841 Win=64000 Len=0 TSval=2037551146 TSecr=1373810146"
"499","5.511502","192.168.2.2","192.168.1.2","TCP","66","64000","5001  >  44580 [ACK] Seq=1 Ack=661737 Win=64000 Len=0 TSval=2037551171 TSecr=1373810170"
"501","5.535957","192.168.2.2","192.168.1.2","TCP","66","64000","5001  >  44580 [ACK] Seq=1 Ack=664633 Win=64000 Len=0 TSval=2037551195 TSecr=1373810195"
"503","5.559658","192.168.2.2","192.168.1.2","TCP","66","64000","5001  >  44580 [ACK] Seq=1 Ack=667529 Win=64000 Len=0 TSval=2037551219 TSecr=1373810219"
"505","5.583985","192.168.2.2","192.168.1.2","TCP","66","64000","5001  >  44580 [ACK] Seq=1 Ack=670425 Win=64000 Len=0 TSval=2037551243 TSecr=1373810243"
"507","5.608134","192.168.2.2","192.168.1.2","TCP","66","64000","5001  >  44580 [ACK] Seq=1 Ack=673321 Win=64000 Len=0 TSval=2037551267 TSecr=1373810267"
"509","5.632371","192.168.2.2","192.168.1.2","TCP","66","64000","5001  >  44580 [ACK] Seq=1 Ack=676217 Win=64000 Len=0 TSval=2037551292 TSecr=1373810291"
"511","5.656576","192.168.2.2","192.168.1.2","TCP","66","64000","5001  >  44580 [ACK] Seq=1 Ack=679113 Win=64000 Len=0 TSval=2037551316 TSecr=1373810315"
"513","5.681004","192.168.2.2","192.168.1.2","TCP","66","64000","5001  >  44580 [ACK] Seq=1 Ack=682009 Win=64000 Len=0 TSval=2037551340 TSecr=1373810340"
"515","5.705514","192.168.2.2","192.168.1.2","TCP","66","64000","5001  >  44580 [ACK] Seq=1 Ack=684905 Win=64000 Len=0 TSval=2037551365 TSecr=1373810364"
"517","5.729252","192.168.2.2","192.168.1.2","TCP","66","64000","5001  >  44580 [ACK] Seq=1 Ack=687801 Win=64000 Len=0 TSval=2037551388 TSecr=1373810388"
"519","5.753536","192.168.2.2","192.168.1.2","TCP","66","64000","5001  >  44580 [ACK] Seq=1 Ack=690697 Win=64000 Len=0 TSval=2037551413 TSecr=1373810412"
"521","5.778235","192.168.2.2","192.168.1.2","TCP","66","64000","5001  >  44580 [ACK] Seq=1 Ack=693593 Win=64000 Len=0 TSval=2037551437 TSecr=1373810436"
"523","5.802497","192.168.2.2","192.168.1.2","TCP","66","64000","5001  >  44580 [ACK] Seq=1 Ack=696489 Win=64000 Len=0 TSval=2037551462 TSecr=1373810461"
"525","5.826703","192.168.2.2","192.168.1.2","TCP","66","64000","5001  >  44580 [ACK] Seq=1 Ack=699385 Win=64000 Len=0 TSval=2037551486 TSecr=1373810485"
"527","5.850927","192.168.2.2","192.168.1.2","TCP","66","64000","5001  >  44580 [ACK] Seq=1 Ack=702281 Win=64000 Len=0 TSval=2037551510 TSecr=1373810509"
"529","5.876032","192.168.2.2","192.168.1.2","TCP","66","64000","5001  >  44580 [ACK] Seq=1 Ack=705177 Win=64000 Len=0 TSval=2037551535 TSecr=1373810534"
"531","5.899585","192.168.2.2","192.168.1.2","TCP","66","64000","5001  >  44580 [ACK] Seq=1 Ack=708073 Win=64000 Len=0 TSval=2037551559 TSecr=1373810558"
"533","5.924074","192.168.2.2","192.168.1.2","TCP","66","64000","5001  >  44580 [ACK] Seq=1 Ack=710969 Win=64000 Len=0 TSval=2037551583 TSecr=1373810582"
"535","5.947814","192.168.2.2","192.168.1.2","TCP","66","64000","5001  >  44580 [ACK] Seq=1 Ack=713865 Win=64000 Len=0 TSval=2037551607 TSecr=1373810606"
"537","5.972177","192.168.2.2","192.168.1.2","TCP","66","64000","5001  >  44580 [ACK] Seq=1 Ack=716761 Win=64000 Len=0 TSval=2037551631 TSecr=1373810631"
"539","5.996693","192.168.2.2","192.168.1.2","TCP","66","64000","5001  >  44580 [ACK] Seq=1 Ack=719657 Win=64000 Len=0 TSval=2037551656 TSecr=1373810655"
"541","6.021091","192.168.2.2","192.168.1.2","TCP","66","64000","5001  >  44580 [ACK] Seq=1 Ack=722553 Win=64000 Len=0 TSval=2037551680 TSecr=1373810679"
"544","6.045593","192.168.2.2","192.168.1.2","TCP","66","64000","5001  >  44580 [ACK] Seq=1 Ack=725449 Win=64000 Len=0 TSval=2037551705 TSecr=1373810704"
"546","6.068938","192.168.2.2","192.168.1.2","TCP","66","64000","5001  >  44580 [ACK] Seq=1 Ack=728345 Win=64000 Len=0 TSval=2037551728 TSecr=1373810728"
"548","6.093155","192.168.2.2","192.168.1.2","TCP","66","64000","5001  >  44580 [ACK] Seq=1 Ack=731241 Win=64000 Len=0 TSval=2037551752 TSecr=1373810752"
"550","6.118131","192.168.2.2","192.168.1.2","TCP","66","64000","5001  >  44580 [ACK] Seq=1 Ack=734137 Win=64000 Len=0 TSval=2037551777 TSecr=1373810776"
"552","6.141606","192.168.2.2","192.168.1.2","TCP","66","69632","5001  >  44580 [ACK] Seq=1 Ack=737033 Win=69632 Len=0 TSval=2037551801 TSecr=1373810800"
"554","6.165803","192.168.2.2","192.168.1.2","TCP","66","69632","5001  >  44580 [ACK] Seq=1 Ack=739929 Win=69632 Len=0 TSval=2037551825 TSecr=1373810825"
"556","6.190876","192.168.2.2","192.168.1.2","TCP","66","69632","5001  >  44580 [ACK] Seq=1 Ack=742825 Win=69632 Len=0 TSval=2037551850 TSecr=1373810849"
"559","6.215046","192.168.2.2","192.168.1.2","TCP","66","69632","5001  >  44580 [ACK] Seq=1 Ack=745721 Win=69632 Len=0 TSval=2037551874 TSecr=1373810874"
"561","6.239632","192.168.2.2","192.168.1.2","TCP","66","69632","5001  >  44580 [ACK] Seq=1 Ack=748617 Win=69632 Len=0 TSval=2037551899 TSecr=1373810897"
"563","6.264140","192.168.2.2","192.168.1.2","TCP","66","69632","5001  >  44580 [ACK] Seq=1 Ack=751513 Win=69632 Len=0 TSval=2037551923 TSecr=1373810921"
"565","6.287717","192.168.2.2","192.168.1.2","TCP","66","69632","5001  >  44580 [ACK] Seq=1 Ack=754409 Win=69632 Len=0 TSval=2037551947 TSecr=1373810946"
"567","6.312151","192.168.2.2","192.168.1.2","TCP","66","69632","5001  >  44580 [ACK] Seq=1 Ack=757305 Win=69632 Len=0 TSval=2037551971 TSecr=1373810970"
"569","6.336654","192.168.2.2","192.168.1.2","TCP","66","69632","5001  >  44580 [ACK] Seq=1 Ack=760201 Win=69632 Len=0 TSval=2037551996 TSecr=1373810994"
