"No.","Time","Source","Destination","Protocol","Length","Calculated window size","Info"
"4","0.000384","192.168.2.2","192.168.1.2","TCP","74","43440","5001  >  44570 [SYN, ACK] Seq=0 Ack=1 Win=43440 Len=0 MSS=1460 SACK_PERM=1 TSval=2037468837 TSecr=1373728006 WS=512"
"7","0.000433","192.168.2.2","192.168.1.2","TCP","66","39936","5001  >  44570 [ACK] Seq=1 Ack=7241 Win=39936 Len=0 TSval=2037468837 TSecr=1373728006"
"11","0.050647","192.168.2.2","192.168.1.2","TCP","66","39936","5001  >  44570 [ACK] Seq=1 Ack=14481 Win=39936 Len=0 TSval=2037468887 TSecr=1373728006"
"13","0.110478","192.168.2.2","192.168.1.2","TCP","66","39936","5001  >  44570 [ACK] Seq=1 Ack=21721 Win=39936 Len=0 TSval=2037468947 TSecr=1373728006"
"15","0.171217","192.168.2.2","192.168.1.2","TCP","66","42496","5001  >  44570 [ACK] Seq=1 Ack=23169 Win=42496 Len=0 TSval=2037469008 TSecr=1373728019"
"16","0.182997","192.168.2.2","192.168.1.2","TCP","66","42496","5001  >  44570 [ACK] Seq=1 Ack=24617 Win=42496 Len=0 TSval=2037469020 TSecr=1373728083"
"18","0.195797","192.168.2.2","192.168.1.2","TCP","66","42496","5001  >  44570 [ACK] Seq=1 Ack=26065 Win=42496 Len=0 TSval=2037469032 TSecr=1373728167"
"20","0.208487","192.168.2.2","192.168.1.2","TCP","66","42496","5001  >  44570 [ACK] Seq=1 Ack=27513 Win=42496 Len=0 TSval=2037469045 TSecr=1373728189"
"23","0.220226","192.168.2.2","192.168.1.2","TCP","66","42496","5001  >  44570 [ACK] Seq=1 Ack=28961 Win=42496 Len=0 TSval=2037469057 TSecr=1373728201"
"25","0.232105","192.168.2.2","192.168.1.2","TCP","66","42496","5001  >  44570 [ACK] Seq=1 Ack=30409 Win=42496 Len=0 TSval=2037469069 TSecr=1373728214"
"27","0.244252","192.168.2.2","192.168.1.2","TCP","66","42496","5001  >  44570 [ACK] Seq=1 Ack=31857 Win=42496 Len=0 TSval=2037469081 TSecr=1373728214"
"29","0.256330","192.168.2.2","192.168.1.2","TCP","66","42496","5001  >  44570 [ACK] Seq=1 Ack=33305 Win=42496 Len=0 TSval=2037469093 TSecr=1373728226"
"31","0.269261","192.168.2.2","192.168.1.2","TCP","66","42496","5001  >  44570 [ACK] Seq=1 Ack=34753 Win=42496 Len=0 TSval=2037469106 TSecr=1373728238"
"33","0.281007","192.168.2.2","192.168.1.2","TCP","66","42496","5001  >  44570 [ACK] Seq=1 Ack=36201 Win=42496 Len=0 TSval=2037469117 TSecr=1373728250"
"35","0.292799","192.168.2.2","192.168.1.2","TCP","66","41984","5001  >  44570 [ACK] Seq=1 Ack=39097 Win=41984 Len=0 TSval=2037469129 TSecr=1373728262"
"37","0.317638","192.168.2.2","192.168.1.2","TCP","66","42496","5001  >  44570 [ACK] Seq=1 Ack=40545 Win=42496 Len=0 TSval=2037469154 TSecr=1373728275"
"39","0.341146","192.168.2.2","192.168.1.2","TCP","66","42496","5001  >  44570 [ACK] Seq=1 Ack=43441 Win=42496 Len=0 TSval=2037469178 TSecr=1373728287"
"41","0.353607","192.168.2.2","192.168.1.2","TCP","66","42496","5001  >  44570 [ACK] Seq=1 Ack=46337 Win=42496 Len=0 TSval=2037469190 TSecr=1373728323"
"44","0.378055","192.168.2.2","192.168.1.2","TCP","66","42496","5001  >  44570 [ACK] Seq=1 Ack=49233 Win=42496 Len=0 TSval=2037469214 TSecr=1373728347"
"46","0.401706","192.168.2.2","192.168.1.2","TCP","66","42496","5001  >  44570 [ACK] Seq=1 Ack=52129 Win=42496 Len=0 TSval=2037469238 TSecr=1373728359"
"48","0.438028","192.168.2.2","192.168.1.2","TCP","66","42496","5001  >  44570 [ACK] Seq=1 Ack=56473 Win=42496 Len=0 TSval=2037469274 TSecr=1373728359"
"50","0.462351","192.168.2.2","192.168.1.2","TCP","66","42496","5001  >  44570 [ACK] Seq=1 Ack=59369 Win=42496 Len=0 TSval=2037469299 TSecr=1373728407"
"52","0.486484","192.168.2.2","192.168.1.2","TCP","66","42496","5001  >  44570 [ACK] Seq=1 Ack=62265 Win=42496 Len=0 TSval=2037469323 TSecr=1373728443"
"54","0.510708","192.168.2.2","192.168.1.2","TCP","66","42496","5001  >  44570 [ACK] Seq=1 Ack=65161 Win=42496 Len=0 TSval=2037469347 TSecr=1373728468"
"57","0.534924","192.168.2.2","192.168.1.2","TCP","66","42496","5001  >  44570 [ACK] Seq=1 Ack=68057 Win=42496 Len=0 TSval=2037469371 TSecr=1373728492"
"59","0.559405","192.168.2.2","192.168.1.2","TCP","66","42496","5001  >  44570 [ACK] Seq=1 Ack=70953 Win=42496 Len=0 TSval=2037469396 TSecr=1373728516"
"61","0.583383","192.168.2.2","192.168.1.2","TCP","66","42496","5001  >  44570 [ACK] Seq=1 Ack=73849 Win=42496 Len=0 TSval=2037469420 TSecr=1373728516"
"63","0.608382","192.168.2.2","192.168.1.2","TCP","66","42496","5001  >  44570 [ACK] Seq=1 Ack=76745 Win=42496 Len=0 TSval=2037469445 TSecr=1373728540"
"65","0.631895","192.168.2.2","192.168.1.2","TCP","66","42496","5001  >  44570 [ACK] Seq=1 Ack=79641 Win=42496 Len=0 TSval=2037469468 TSecr=1373728565"
"67","0.656388","192.168.2.2","192.168.1.2","TCP","66","42496","5001  >  44570 [ACK] Seq=1 Ack=82537 Win=42496 Len=0 TSval=2037469493 TSecr=1373728589"
"69","0.680939","192.168.2.2","192.168.1.2","TCP","66","42496","5001  >  44570 [ACK] Seq=1 Ack=85433 Win=42496 Len=0 TSval=2037469517 TSecr=1373728614"
"72","0.716593","192.168.2.2","192.168.1.2","TCP","66","42496","5001  >  44570 [ACK] Seq=1 Ack=89777 Win=42496 Len=0 TSval=2037469553 TSecr=1373728637"
"76","0.740857","192.168.2.2","192.168.1.2","TCP","66","42496","5001  >  44570 [ACK] Seq=1 Ack=92673 Win=42496 Len=0 TSval=2037469577 TSecr=1373728686"
"79","0.765160","192.168.2.2","192.168.1.2","TCP","66","42496","5001  >  44570 [ACK] Seq=1 Ack=95569 Win=42496 Len=0 TSval=2037469601 TSecr=1373728722"
"81","0.789279","192.168.2.2","192.168.1.2","TCP","66","42496","5001  >  44570 [ACK] Seq=1 Ack=98465 Win=42496 Len=0 TSval=2037469625 TSecr=1373728722"
"83","0.814246","192.168.2.2","192.168.1.2","TCP","66","42496","5001  >  44570 [ACK] Seq=1 Ack=101361 Win=42496 Len=0 TSval=2037469650 TSecr=1373728746"
"85","0.849842","192.168.2.2","192.168.1.2","TCP","66","42496","5001  >  44570 [ACK] Seq=1 Ack=105705 Win=42496 Len=0 TSval=2037469686 TSecr=1373728746"
"87","0.874081","192.168.2.2","192.168.1.2","TCP","66","42496","5001  >  44570 [ACK] Seq=1 Ack=108601 Win=42496 Len=0 TSval=2037469710 TSecr=1373728795"
"90","0.898278","192.168.2.2","192.168.1.2","TCP","66","42496","5001  >  44570 [ACK] Seq=1 Ack=111497 Win=42496 Len=0 TSval=2037469734 TSecr=1373728819"
"92","0.922547","192.168.2.2","192.168.1.2","TCP","66","42496","5001  >  44570 [ACK] Seq=1 Ack=114393 Win=42496 Len=0 TSval=2037469759 TSecr=1373728855"
"94","0.947486","192.168.2.2","192.168.1.2","TCP","66","42496","5001  >  44570 [ACK] Seq=1 Ack=117289 Win=42496 Len=0 TSval=2037469784 TSecr=1373728879"
"97","0.970951","192.168.2.2","192.168.1.2","TCP","66","42496","5001  >  44570 [ACK] Seq=1 Ack=120185 Win=42496 Len=0 TSval=2037469807 TSecr=1373728903"
"100","0.995466","192.168.2.2","192.168.1.2","TCP","66","42496","5001  >  44570 [ACK] Seq=1 Ack=123081 Win=42496 Len=0 TSval=2037469832 TSecr=1373728928"
"102","1.020025","192.168.2.2","192.168.1.2","TCP","66","42496","5001  >  44570 [ACK] Seq=1 Ack=125977 Win=42496 Len=0 TSval=2037469856 TSecr=1373728953"
"105","1.056250","192.168.2.2","192.168.1.2","TCP","66","42496","5001  >  44570 [ACK] Seq=1 Ack=130321 Win=42496 Len=0 TSval=2037469892 TSecr=1373728970"
"108","1.080042","192.168.2.2","192.168.1.2","TCP","66","42496","5001  >  44570 [ACK] Seq=1 Ack=133217 Win=42496 Len=0 TSval=2037469916 TSecr=1373729001"
"110","1.104248","192.168.2.2","192.168.1.2","TCP","66","42496","5001  >  44570 [ACK] Seq=1 Ack=136113 Win=42496 Len=0 TSval=2037469940 TSecr=1373729025"
"113","1.129180","192.168.2.2","192.168.1.2","TCP","66","42496","5001  >  44570 [ACK] Seq=1 Ack=139009 Win=42496 Len=0 TSval=2037469965 TSecr=1373729061"
"115","1.153417","192.168.2.2","192.168.1.2","TCP","66","42496","5001  >  44570 [ACK] Seq=1 Ack=141905 Win=42496 Len=0 TSval=2037469989 TSecr=1373729061"
"117","1.177773","192.168.2.2","192.168.1.2","TCP","66","42496","5001  >  44570 [ACK] Seq=1 Ack=144801 Win=42496 Len=0 TSval=2037470014 TSecr=1373729085"
"119","1.202296","192.168.2.2","192.168.1.2","TCP","66","42496","5001  >  44570 [ACK] Seq=1 Ack=147697 Win=42496 Len=0 TSval=2037470038 TSecr=1373729109"
"121","1.226777","192.168.2.2","192.168.1.2","TCP","66","42496","5001  >  44570 [ACK] Seq=1 Ack=150593 Win=42496 Len=0 TSval=2037470063 TSecr=1373729134"
"123","1.262422","192.168.2.2","192.168.1.2","TCP","66","42496","5001  >  44570 [ACK] Seq=1 Ack=154937 Win=42496 Len=0 TSval=2037470098 TSecr=1373729158"
"126","1.287932","192.168.2.2","192.168.1.2","TCP","66","42496","5001  >  44570 [ACK] Seq=1 Ack=157833 Win=42496 Len=0 TSval=2037470124 TSecr=1373729207"
"128","1.313038","192.168.2.2","192.168.1.2","TCP","66","42496","5001  >  44570 [ACK] Seq=1 Ack=160729 Win=42496 Len=0 TSval=2037470149 TSecr=1373729232"
"130","1.336549","192.168.2.2","192.168.1.2","TCP","66","42496","5001  >  44570 [ACK] Seq=1 Ack=163625 Win=42496 Len=0 TSval=2037470172 TSecr=1373729267"
"132","1.361025","192.168.2.2","192.168.1.2","TCP","66","42496","5001  >  44570 [ACK] Seq=1 Ack=166521 Win=42496 Len=0 TSval=2037470197 TSecr=1373729267"
"135","1.384848","192.168.2.2","192.168.1.2","TCP","66","42496","5001  >  44570 [ACK] Seq=1 Ack=169417 Win=42496 Len=0 TSval=2037470221 TSecr=1373729293"
"137","1.409065","192.168.2.2","192.168.1.2","TCP","66","42496","5001  >  44570 [ACK] Seq=1 Ack=172313 Win=42496 Len=0 TSval=2037470245 TSecr=1373729318"
"139","1.445406","192.168.2.2","192.168.1.2","TCP","66","42496","5001  >  44570 [ACK] Seq=1 Ack=176657 Win=42496 Len=0 TSval=2037470281 TSecr=1373729342"
"141","1.469846","192.168.2.2","192.168.1.2","TCP","66","42496","5001  >  44570 [ACK] Seq=1 Ack=179553 Win=42496 Len=0 TSval=2037470306 TSecr=1373729366"
"144","1.493844","192.168.2.2","192.168.1.2","TCP","66","42496","5001  >  44570 [ACK] Seq=1 Ack=182449 Win=42496 Len=0 TSval=2037470330 TSecr=1373729390"
"146","1.518095","192.168.2.2","192.168.1.2","TCP","66","42496","5001  >  44570 [ACK] Seq=1 Ack=185345 Win=42496 Len=0 TSval=2037470354 TSecr=1373729414"
"149","1.542415","192.168.2.2","192.168.1.2","TCP","66","42496","5001  >  44570 [ACK] Seq=1 Ack=188241 Win=42496 Len=0 TSval=2037470378 TSecr=1373729450"
"151","1.566863","192.168.2.2","192.168.1.2","TCP","66","42496","5001  >  44570 [ACK] Seq=1 Ack=191137 Win=42496 Len=0 TSval=2037470403 TSecr=1373729475"
"153","1.603133","192.168.2.2","192.168.1.2","TCP","66","42496","5001  >  44570 [ACK] Seq=1 Ack=195481 Win=42496 Len=0 TSval=2037470439 TSecr=1373729479"
"155","1.627077","192.168.2.2","192.168.1.2","TCP","66","42496","5001  >  44570 [ACK] Seq=1 Ack=198377 Win=42496 Len=0 TSval=2037470463 TSecr=1373729523"
"157","1.651354","192.168.2.2","192.168.1.2","TCP","66","42496","5001  >  44570 [ACK] Seq=1 Ack=201273 Win=42496 Len=0 TSval=2037470487 TSecr=1373729547"
"159","1.675604","192.168.2.2","192.168.1.2","TCP","66","42496","5001  >  44570 [ACK] Seq=1 Ack=204169 Win=42496 Len=0 TSval=2037470511 TSecr=1373729572"
"162","1.700467","192.168.2.2","192.168.1.2","TCP","66","42496","5001  >  44570 [ACK] Seq=1 Ack=207065 Win=42496 Len=0 TSval=2037470536 TSecr=1373729608"
"164","1.724703","192.168.2.2","192.168.1.2","TCP","66","42496","5001  >  44570 [ACK] Seq=1 Ack=209961 Win=42496 Len=0 TSval=2037470560 TSecr=1373729632"
"168","1.749144","192.168.2.2","192.168.1.2","TCP","66","42496","5001  >  44570 [ACK] Seq=1 Ack=212857 Win=42496 Len=0 TSval=2037470585 TSecr=1373729656"
"170","1.773135","192.168.2.2","192.168.1.2","TCP","66","42496","5001  >  44570 [ACK] Seq=1 Ack=215753 Win=42496 Len=0 TSval=2037470609 TSecr=1373729680"
"172","1.809894","192.168.2.2","192.168.1.2","TCP","66","42496","5001  >  44570 [ACK] Seq=1 Ack=220097 Win=42496 Len=0 TSval=2037470646 TSecr=1373729680"
"175","1.834414","192.168.2.2","192.168.1.2","TCP","66","42496","5001  >  44570 [ACK] Seq=1 Ack=222993 Win=42496 Len=0 TSval=2037470670 TSecr=1373729729"
"177","1.857935","192.168.2.2","192.168.1.2","TCP","66","42496","5001  >  44570 [ACK] Seq=1 Ack=225889 Win=42496 Len=0 TSval=2037470694 TSecr=1373729754"
"179","1.882453","192.168.2.2","192.168.1.2","TCP","66","42496","5001  >  44570 [ACK] Seq=1 Ack=228785 Win=42496 Len=0 TSval=2037470718 TSecr=1373729778"
"181","1.906925","192.168.2.2","192.168.1.2","TCP","66","42496","5001  >  44570 [ACK] Seq=1 Ack=231681 Win=42496 Len=0 TSval=2037470743 TSecr=1373729815"
"183","1.930588","192.168.2.2","192.168.1.2","TCP","66","42496","5001  >  44570 [ACK] Seq=1 Ack=234577 Win=42496 Len=0 TSval=2037470766 TSecr=1373729815"
"185","1.954855","192.168.2.2","192.168.1.2","TCP","66","42496","5001  >  44570 [ACK] Seq=1 Ack=237473 Win=42496 Len=0 TSval=2037470790 TSecr=1373729839"
"188","1.991202","192.168.2.2","192.168.1.2","TCP","66","42496","5001  >  44570 [ACK] Seq=1 Ack=241817 Win=42496 Len=0 TSval=2037470827 TSecr=1373729863"
"190","2.015689","192.168.2.2","192.168.1.2","TCP","66","42496","5001  >  44570 [ACK] Seq=1 Ack=244713 Win=42496 Len=0 TSval=2037470851 TSecr=1373729912"
"195","2.040209","192.168.2.2","192.168.1.2","TCP","66","42496","5001  >  44570 [ACK] Seq=1 Ack=247609 Win=42496 Len=0 TSval=2037470876 TSecr=1373729935"
"197","2.064727","192.168.2.2","192.168.1.2","TCP","66","42496","5001  >  44570 [ACK] Seq=1 Ack=250505 Win=42496 Len=0 TSval=2037470900 TSecr=1373729960"
"199","2.100172","192.168.2.2","192.168.1.2","TCP","66","42496","5001  >  44570 [ACK] Seq=1 Ack=254849 Win=42496 Len=0 TSval=2037470936 TSecr=1373729982"
"202","2.124477","192.168.2.2","192.168.1.2","TCP","66","48128","5001  >  44570 [ACK] Seq=1 Ack=257745 Win=48128 Len=0 TSval=2037470960 TSecr=1373730020"
"205","2.149358","192.168.2.2","192.168.1.2","TCP","66","54272","5001  >  44570 [ACK] Seq=1 Ack=260641 Win=54272 Len=0 TSval=2037470985 TSecr=1373730045"
"207","2.173615","192.168.2.2","192.168.1.2","TCP","66","54784","5001  >  44570 [ACK] Seq=1 Ack=263537 Win=54784 Len=0 TSval=2037471009 TSecr=1373730069"
"209","2.197983","192.168.2.2","192.168.1.2","TCP","66","54784","5001  >  44570 [ACK] Seq=1 Ack=266433 Win=54784 Len=0 TSval=2037471033 TSecr=1373730105"
"211","2.222055","192.168.2.2","192.168.1.2","TCP","66","54784","5001  >  44570 [ACK] Seq=1 Ack=269329 Win=54784 Len=0 TSval=2037471058 TSecr=1373730105"
"213","2.246984","192.168.2.2","192.168.1.2","TCP","66","54784","5001  >  44570 [ACK] Seq=1 Ack=272225 Win=54784 Len=0 TSval=2037471082 TSecr=1373730129"
"215","2.270492","192.168.2.2","192.168.1.2","TCP","66","54784","5001  >  44570 [ACK] Seq=1 Ack=275121 Win=54784 Len=0 TSval=2037471106 TSecr=1373730154"
"217","2.295025","192.168.2.2","192.168.1.2","TCP","66","54784","5001  >  44570 [ACK] Seq=1 Ack=278017 Win=54784 Len=0 TSval=2037471130 TSecr=1373730178"
"219","2.319516","192.168.2.2","192.168.1.2","TCP","66","54784","5001  >  44570 [ACK] Seq=1 Ack=280913 Win=54784 Len=0 TSval=2037471155 TSecr=1373730203"
"221","2.343164","192.168.2.2","192.168.1.2","TCP","66","55296","5001  >  44570 [ACK] Seq=1 Ack=282361 Win=55296 Len=0 TSval=2037471179 TSecr=1373730227"
"223","2.355787","192.168.2.2","192.168.1.2","TCP","66","55296","5001  >  44570 [ACK] Seq=1 Ack=285257 Win=55296 Len=0 TSval=2037471191 TSecr=1373730252"
"225","2.379526","192.168.2.2","192.168.1.2","TCP","66","55296","5001  >  44570 [ACK] Seq=1 Ack=288153 Win=55296 Len=0 TSval=2037471215 TSecr=1373730275"
"228","2.403835","192.168.2.2","192.168.1.2","TCP","66","55296","5001  >  44570 [ACK] Seq=1 Ack=291049 Win=55296 Len=0 TSval=2037471239 TSecr=1373730300"
"230","2.428300","192.168.2.2","192.168.1.2","TCP","66","55296","5001  >  44570 [ACK] Seq=1 Ack=293945 Win=55296 Len=0 TSval=2037471264 TSecr=1373730324"
"232","2.452204","192.168.2.2","192.168.1.2","TCP","66","55296","5001  >  44570 [ACK] Seq=1 Ack=296841 Win=55296 Len=0 TSval=2037471288 TSecr=1373730348"
"234","2.476431","192.168.2.2","192.168.1.2","TCP","66","55296","5001  >  44570 [ACK] Seq=1 Ack=299737 Win=55296 Len=0 TSval=2037471312 TSecr=1373730360"
"237","2.500802","192.168.2.2","192.168.1.2","TCP","66","57344","5001  >  44570 [ACK] Seq=1 Ack=302633 Win=57344 Len=0 TSval=2037471336 TSecr=1373730384"
"239","2.525339","192.168.2.2","192.168.1.2","TCP","66","58368","5001  >  44570 [ACK] Seq=1 Ack=304081 Win=58368 Len=0 TSval=2037471361 TSecr=1373730384"
"241","2.537129","192.168.2.2","192.168.1.2","TCP","66","58368","5001  >  44570 [ACK] Seq=1 Ack=306977 Win=58368 Len=0 TSval=2037471372 TSecr=1373730408"
"243","2.561707","192.168.2.2","192.168.1.2","TCP","66","58368","5001  >  44570 [ACK] Seq=1 Ack=309873 Win=58368 Len=0 TSval=2037471397 TSecr=1373730433"
"245","2.585422","192.168.2.2","192.168.1.2","TCP","66","58368","5001  >  44570 [ACK] Seq=1 Ack=312769 Win=58368 Len=0 TSval=2037471421 TSecr=1373730457"
"247","2.609724","192.168.2.2","192.168.1.2","TCP","66","58368","5001  >  44570 [ACK] Seq=1 Ack=315665 Win=58368 Len=0 TSval=2037471445 TSecr=1373730481"
"249","2.634115","192.168.2.2","192.168.1.2","TCP","66","58368","5001  >  44570 [ACK] Seq=1 Ack=318561 Win=58368 Len=0 TSval=2037471469 TSecr=1373730505"
"251","2.670352","192.168.2.2","192.168.1.2","TCP","66","58368","5001  >  44570 [ACK] Seq=1 Ack=322905 Win=58368 Len=0 TSval=2037471506 TSecr=1373730530"
"254","2.694439","192.168.2.2","192.168.1.2","TCP","66","58368","5001  >  44570 [ACK] Seq=1 Ack=325801 Win=58368 Len=0 TSval=2037471530 TSecr=1373730566"
"256","2.718673","192.168.2.2","192.168.1.2","TCP","66","58368","5001  >  44570 [ACK] Seq=1 Ack=328697 Win=58368 Len=0 TSval=2037471554 TSecr=1373730590"
"258","2.755683","192.168.2.2","192.168.1.2","TCP","66","58368","5001  >  44570 [ACK] Seq=1 Ack=333041 Win=58368 Len=0 TSval=2037471591 TSecr=1373730614"
"260","2.779240","192.168.2.2","192.168.1.2","TCP","66","58368","5001  >  44570 [ACK] Seq=1 Ack=335937 Win=58368 Len=0 TSval=2037471614 TSecr=1373730675"
"262","2.803667","192.168.2.2","192.168.1.2","TCP","66","58368","5001  >  44570 [ACK] Seq=1 Ack=338833 Win=58368 Len=0 TSval=2037471639 TSecr=1373730675"
"264","2.827660","192.168.2.2","192.168.1.2","TCP","66","58368","5001  >  44570 [ACK] Seq=1 Ack=341729 Win=58368 Len=0 TSval=2037471663 TSecr=1373730699"
"267","2.851901","192.168.2.2","192.168.1.2","TCP","66","58368","5001  >  44570 [ACK] Seq=1 Ack=344625 Win=58368 Len=0 TSval=2037471687 TSecr=1373730723"
"269","2.876200","192.168.2.2","192.168.1.2","TCP","66","58368","5001  >  44570 [ACK] Seq=1 Ack=347521 Win=58368 Len=0 TSval=2037471711 TSecr=1373730760"
"271","2.900337","192.168.2.2","192.168.1.2","TCP","66","58368","5001  >  44570 [ACK] Seq=1 Ack=350417 Win=58368 Len=0 TSval=2037471735 TSecr=1373730784"
"273","2.925196","192.168.2.2","192.168.1.2","TCP","66","58368","5001  >  44570 [ACK] Seq=1 Ack=353313 Win=58368 Len=0 TSval=2037471760 TSecr=1373730808"
"275","2.949699","192.168.2.2","192.168.1.2","TCP","66","58368","5001  >  44570 [ACK] Seq=1 Ack=356209 Win=58368 Len=0 TSval=2037471785 TSecr=1373730832"
"277","2.985119","192.168.2.2","192.168.1.2","TCP","66","58368","5001  >  44570 [ACK] Seq=1 Ack=360553 Win=58368 Len=0 TSval=2037471820 TSecr=1373730832"
"281","3.009502","192.168.2.2","192.168.1.2","TCP","66","58368","5001  >  44570 [ACK] Seq=1 Ack=363449 Win=58368 Len=0 TSval=2037471845 TSecr=1373730880"
"284","3.033970","192.168.2.2","192.168.1.2","TCP","66","58368","5001  >  44570 [ACK] Seq=1 Ack=366345 Win=58368 Len=0 TSval=2037471869 TSecr=1373730905"
"286","3.058483","192.168.2.2","192.168.1.2","TCP","66","58368","5001  >  44570 [ACK] Seq=1 Ack=369241 Win=58368 Len=0 TSval=2037471894 TSecr=1373730929"
"289","3.082016","192.168.2.2","192.168.1.2","TCP","66","58368","5001  >  44570 [ACK] Seq=1 Ack=372137 Win=58368 Len=0 TSval=2037471917 TSecr=1373730954"
"291","3.106285","192.168.2.2","192.168.1.2","TCP","66","58368","5001  >  44570 [ACK] Seq=1 Ack=375033 Win=58368 Len=0 TSval=2037471941 TSecr=1373730989"
"293","3.142755","192.168.2.2","192.168.1.2","TCP","66","58368","5001  >  44570 [ACK] Seq=1 Ack=379377 Win=58368 Len=0 TSval=2037471978 TSecr=1373730990"
"296","3.167563","192.168.2.2","192.168.1.2","TCP","66","58368","5001  >  44570 [ACK] Seq=1 Ack=382273 Win=58368 Len=0 TSval=2037472003 TSecr=1373731038"
"298","3.191824","192.168.2.2","192.168.1.2","TCP","66","58368","5001  >  44570 [ACK] Seq=1 Ack=385169 Win=58368 Len=0 TSval=2037472027 TSecr=1373731063"
"300","3.228137","192.168.2.2","192.168.1.2","TCP","66","58368","5001  >  44570 [ACK] Seq=1 Ack=389513 Win=58368 Len=0 TSval=2037472063 TSecr=1373731063"
"303","3.252380","192.168.2.2","192.168.1.2","TCP","66","58368","5001  >  44570 [ACK] Seq=1 Ack=392409 Win=58368 Len=0 TSval=2037472087 TSecr=1373731110"
"305","3.277038","192.168.2.2","192.168.1.2","TCP","66","58368","5001  >  44570 [ACK] Seq=1 Ack=395305 Win=58368 Len=0 TSval=2037472112 TSecr=1373731147"
"307","3.301542","192.168.2.2","192.168.1.2","TCP","66","58368","5001  >  44570 [ACK] Seq=1 Ack=398201 Win=58368 Len=0 TSval=2037472136 TSecr=1373731172"
"309","3.325018","192.168.2.2","192.168.1.2","TCP","66","60416","5001  >  44570 [ACK] Seq=1 Ack=401097 Win=60416 Len=0 TSval=2037472160 TSecr=1373731196"
"311","3.349538","192.168.2.2","192.168.1.2","TCP","66","60416","5001  >  44570 [ACK] Seq=1 Ack=403993 Win=60416 Len=0 TSval=2037472184 TSecr=1373731232"
"313","3.374046","192.168.2.2","192.168.1.2","TCP","66","60416","5001  >  44570 [ACK] Seq=1 Ack=406889 Win=60416 Len=0 TSval=2037472209 TSecr=1373731232"
"315","3.397711","192.168.2.2","192.168.1.2","TCP","66","60416","5001  >  44570 [ACK] Seq=1 Ack=409785 Win=60416 Len=0 TSval=2037472233 TSecr=1373731256"
"317","3.422031","192.168.2.2","192.168.1.2","TCP","66","60416","5001  >  44570 [ACK] Seq=1 Ack=412681 Win=60416 Len=0 TSval=2037472257 TSecr=1373731281"
"319","3.446186","192.168.2.2","192.168.1.2","TCP","66","60416","5001  >  44570 [ACK] Seq=1 Ack=415577 Win=60416 Len=0 TSval=2037472281 TSecr=1373731306"
"321","3.471151","192.168.2.2","192.168.1.2","TCP","66","60416","5001  >  44570 [ACK] Seq=1 Ack=418473 Win=60416 Len=0 TSval=2037472306 TSecr=1373731329"
"323","3.494586","192.168.2.2","192.168.1.2","TCP","66","60416","5001  >  44570 [ACK] Seq=1 Ack=421369 Win=60416 Len=0 TSval=2037472329 TSecr=1373731354"
"325","3.519137","192.168.2.2","192.168.1.2","TCP","66","60416","5001  >  44570 [ACK] Seq=1 Ack=424265 Win=60416 Len=0 TSval=2037472354 TSecr=1373731378"
"327","3.543589","192.168.2.2","192.168.1.2","TCP","66","60416","5001  >  44570 [ACK] Seq=1 Ack=427161 Win=60416 Len=0 TSval=2037472378 TSecr=1373731402"
"329","3.567279","192.168.2.2","192.168.1.2","TCP","66","60416","5001  >  44570 [ACK] Seq=1 Ack=430057 Win=60416 Len=0 TSval=2037472402 TSecr=1373731426"
"331","3.591584","192.168.2.2","192.168.1.2","TCP","66","60416","5001  >  44570 [ACK] Seq=1 Ack=432953 Win=60416 Len=0 TSval=2037472426 TSecr=1373731450"
"333","3.615710","192.168.2.2","192.168.1.2","TCP","66","60416","5001  >  44570 [ACK] Seq=1 Ack=435849 Win=60416 Len=0 TSval=2037472450 TSecr=1373731475"
"335","3.639950","192.168.2.2","192.168.1.2","TCP","66","60416","5001  >  44570 [ACK] Seq=1 Ack=438745 Win=60416 Len=0 TSval=2037472475 TSecr=1373731499"
"337","3.664186","192.168.2.2","192.168.1.2","TCP","66","60416","5001  >  44570 [ACK] Seq=1 Ack=441641 Win=60416 Len=0 TSval=2037472499 TSecr=1373731523"
"339","3.688625","192.168.2.2","192.168.1.2","TCP","66","60416","5001  >  44570 [ACK] Seq=1 Ack=444537 Win=60416 Len=0 TSval=2037472523 TSecr=1373731548"
"341","3.713140","192.168.2.2","192.168.1.2","TCP","66","60416","5001  >  44570 [ACK] Seq=1 Ack=447433 Win=60416 Len=0 TSval=2037472548 TSecr=1373731571"
"343","3.736839","192.168.2.2","192.168.1.2","TCP","66","60416","5001  >  44570 [ACK] Seq=1 Ack=450329 Win=60416 Len=0 TSval=2037472572 TSecr=1373731595"
"345","3.761152","192.168.2.2","192.168.1.2","TCP","66","60416","5001  >  44570 [ACK] Seq=1 Ack=453225 Win=60416 Len=0 TSval=2037472596 TSecr=1373731620"
"347","3.787196","192.168.2.2","192.168.1.2","TCP","66","60416","5001  >  44570 [ACK] Seq=1 Ack=456121 Win=60416 Len=0 TSval=2037472622 TSecr=1373731644"
"349","3.809513","192.168.2.2","192.168.1.2","TCP","66","60416","5001  >  44570 [ACK] Seq=1 Ack=459017 Win=60416 Len=0 TSval=2037472644 TSecr=1373731668"
"351","3.833727","192.168.2.2","192.168.1.2","TCP","66","60416","5001  >  44570 [ACK] Seq=1 Ack=461913 Win=60416 Len=0 TSval=2037472668 TSecr=1373731693"
"353","3.858201","192.168.2.2","192.168.1.2","TCP","66","60416","5001  >  44570 [ACK] Seq=1 Ack=464809 Win=60416 Len=0 TSval=2037472693 TSecr=1373731717"
"355","3.882683","192.168.2.2","192.168.1.2","TCP","66","60416","5001  >  44570 [ACK] Seq=1 Ack=467705 Win=60416 Len=0 TSval=2037472717 TSecr=1373731741"
"357","3.906440","192.168.2.2","192.168.1.2","TCP","66","60416","5001  >  44570 [ACK] Seq=1 Ack=470601 Win=60416 Len=0 TSval=2037472741 TSecr=1373731765"
"359","3.930704","192.168.2.2","192.168.1.2","TCP","66","60416","5001  >  44570 [ACK] Seq=1 Ack=473497 Win=60416 Len=0 TSval=2037472765 TSecr=1373731791"
"361","3.955242","192.168.2.2","192.168.1.2","TCP","66","60416","5001  >  44570 [ACK] Seq=1 Ack=476393 Win=60416 Len=0 TSval=2037472790 TSecr=1373731813"
"363","3.979070","192.168.2.2","192.168.1.2","TCP","66","60416","5001  >  44570 [ACK] Seq=1 Ack=479289 Win=60416 Len=0 TSval=2037472814 TSecr=1373731838"
"366","4.003290","192.168.2.2","192.168.1.2","TCP","66","60416","5001  >  44570 [ACK] Seq=1 Ack=482185 Win=60416 Len=0 TSval=2037472838 TSecr=1373731862"
"368","4.027770","192.168.2.2","192.168.1.2","TCP","66","60416","5001  >  44570 [ACK] Seq=1 Ack=485081 Win=60416 Len=0 TSval=2037472862 TSecr=1373731887"
"371","4.052223","192.168.2.2","192.168.1.2","TCP","66","60416","5001  >  44570 [ACK] Seq=1 Ack=487977 Win=60416 Len=0 TSval=2037472887 TSecr=1373731910"
"373","4.075964","192.168.2.2","192.168.1.2","TCP","66","63488","5001  >  44570 [ACK] Seq=1 Ack=490873 Win=63488 Len=0 TSval=2037472911 TSecr=1373731935"
"375","4.100263","192.168.2.2","192.168.1.2","TCP","66","63488","5001  >  44570 [ACK] Seq=1 Ack=493769 Win=63488 Len=0 TSval=2037472935 TSecr=1373731959"
"377","4.124754","192.168.2.2","192.168.1.2","TCP","66","63488","5001  >  44570 [ACK] Seq=1 Ack=496665 Win=63488 Len=0 TSval=2037472959 TSecr=1373731983"
"379","4.149245","192.168.2.2","192.168.1.2","TCP","66","64000","5001  >  44570 [ACK] Seq=1 Ack=498113 Win=64000 Len=0 TSval=2037472984 TSecr=1373731997"
"381","4.161029","192.168.2.2","192.168.1.2","TCP","66","64000","5001  >  44570 [ACK] Seq=1 Ack=501009 Win=64000 Len=0 TSval=2037472996 TSecr=1373732007"
"384","4.197871","192.168.2.2","192.168.1.2","TCP","66","64000","5001  >  44570 [ACK] Seq=1 Ack=505353 Win=64000 Len=0 TSval=2037473032 TSecr=1373732031"
"386","4.222133","192.168.2.2","192.168.1.2","TCP","66","64000","5001  >  44570 [ACK] Seq=1 Ack=508249 Win=64000 Len=0 TSval=2037473057 TSecr=1373732080"
"388","4.246339","192.168.2.2","192.168.1.2","TCP","66","64000","5001  >  44570 [ACK] Seq=1 Ack=511145 Win=64000 Len=0 TSval=2037473081 TSecr=1373732104"
"390","4.270790","192.168.2.2","192.168.1.2","TCP","66","64000","5001  >  44570 [ACK] Seq=1 Ack=514041 Win=64000 Len=0 TSval=2037473105 TSecr=1373732129"
"392","4.295320","192.168.2.2","192.168.1.2","TCP","66","64000","5001  >  44570 [ACK] Seq=1 Ack=516937 Win=64000 Len=0 TSval=2037473130 TSecr=1373732153"
"394","4.319007","192.168.2.2","192.168.1.2","TCP","66","64000","5001  >  44570 [ACK] Seq=1 Ack=519833 Win=64000 Len=0 TSval=2037473153 TSecr=1373732165"
"396","4.343317","192.168.2.2","192.168.1.2","TCP","66","64000","5001  >  44570 [ACK] Seq=1 Ack=522729 Win=64000 Len=0 TSval=2037473178 TSecr=1373732201"
"398","4.367851","192.168.2.2","192.168.1.2","TCP","66","64000","5001  >  44570 [ACK] Seq=1 Ack=525625 Win=64000 Len=0 TSval=2037473202 TSecr=1373732226"
"400","4.391683","192.168.2.2","192.168.1.2","TCP","66","64000","5001  >  44570 [ACK] Seq=1 Ack=528521 Win=64000 Len=0 TSval=2037473226 TSecr=1373732250"
"402","4.415932","192.168.2.2","192.168.1.2","TCP","66","64000","5001  >  44570 [ACK] Seq=1 Ack=531417 Win=64000 Len=0 TSval=2037473250 TSecr=1373732274"
"404","4.440402","192.168.2.2","192.168.1.2","TCP","66","64000","5001  >  44570 [ACK] Seq=1 Ack=534313 Win=64000 Len=0 TSval=2037473275 TSecr=1373732299"
"406","4.464848","192.168.2.2","192.168.1.2","TCP","66","64000","5001  >  44570 [ACK] Seq=1 Ack=537209 Win=64000 Len=0 TSval=2037473299 TSecr=1373732323"
"408","4.488585","192.168.2.2","192.168.1.2","TCP","66","64000","5001  >  44570 [ACK] Seq=1 Ack=540105 Win=64000 Len=0 TSval=2037473323 TSecr=1373732347"
"411","4.512856","192.168.2.2","192.168.1.2","TCP","66","64000","5001  >  44570 [ACK] Seq=1 Ack=543001 Win=64000 Len=0 TSval=2037473347 TSecr=1373732371"
"413","4.537372","192.168.2.2","192.168.1.2","TCP","66","64000","5001  >  44570 [ACK] Seq=1 Ack=545897 Win=64000 Len=0 TSval=2037473372 TSecr=1373732395"
"415","4.561904","192.168.2.2","192.168.1.2","TCP","66","64000","5001  >  44570 [ACK] Seq=1 Ack=548793 Win=64000 Len=0 TSval=2037473396 TSecr=1373732419"
"417","4.585481","192.168.2.2","192.168.1.2","TCP","66","64000","5001  >  44570 [ACK] Seq=1 Ack=551689 Win=64000 Len=0 TSval=2037473420 TSecr=1373732444"
"419","4.609677","192.168.2.2","192.168.1.2","TCP","66","64000","5001  >  44570 [ACK] Seq=1 Ack=554585 Win=64000 Len=0 TSval=2037473444 TSecr=1373732468"
"421","4.634392","192.168.2.2","192.168.1.2","TCP","66","64000","5001  >  44570 [ACK] Seq=1 Ack=557481 Win=64000 Len=0 TSval=2037473469 TSecr=1373732492"
"423","4.670625","192.168.2.2","192.168.1.2","TCP","66","64000","5001  >  44570 [ACK] Seq=1 Ack=560377 Win=64000 Len=0 TSval=2037473505 TSecr=1373732502"
"425","4.682383","192.168.2.2","192.168.1.2","TCP","66","64000","5001  >  44570 [ACK] Seq=1 Ack=563273 Win=64000 Len=0 TSval=2037473517 TSecr=1373732541"
"427","4.706904","192.168.2.2","192.168.1.2","TCP","66","64000","5001  >  44570 [ACK] Seq=1 Ack=566169 Win=64000 Len=0 TSval=2037473541 TSecr=1373732565"
"429","4.731427","192.168.2.2","192.168.1.2","TCP","66","64000","5001  >  44570 [ACK] Seq=1 Ack=569065 Win=64000 Len=0 TSval=2037473566 TSecr=1373732589"
"431","4.755101","192.168.2.2","192.168.1.2","TCP","66","64000","5001  >  44570 [ACK] Seq=1 Ack=571961 Win=64000 Len=0 TSval=2037473589 TSecr=1373732613"
"433","4.779452","192.168.2.2","192.168.1.2","TCP","66","64000","5001  >  44570 [ACK] Seq=1 Ack=574857 Win=64000 Len=0 TSval=2037473614 TSecr=1373732638"
"435","4.803928","192.168.2.2","192.168.1.2","TCP","66","64000","5001  >  44570 [ACK] Seq=1 Ack=577753 Win=64000 Len=0 TSval=2037473638 TSecr=1373732674"
"437","4.828463","192.168.2.2","192.168.1.2","TCP","66","64000","5001  >  44570 [ACK] Seq=1 Ack=580649 Win=64000 Len=0 TSval=2037473663 TSecr=1373732686"
"439","4.851982","192.168.2.2","192.168.1.2","TCP","66","64000","5001  >  44570 [ACK] Seq=1 Ack=583545 Win=64000 Len=0 TSval=2037473686 TSecr=1373732710"
"441","4.876465","192.168.2.2","192.168.1.2","TCP","66","64000","5001  >  44570 [ACK] Seq=1 Ack=586441 Win=64000 Len=0 TSval=2037473711 TSecr=1373732735"
"443","4.900955","192.168.2.2","192.168.1.2","TCP","66","64000","5001  >  44570 [ACK] Seq=1 Ack=589337 Win=64000 Len=0 TSval=2037473735 TSecr=1373732758"
"445","4.924652","192.168.2.2","192.168.1.2","TCP","66","64000","5001  >  44570 [ACK] Seq=1 Ack=592233 Win=64000 Len=0 TSval=2037473759 TSecr=1373732783"
"447","4.949034","192.168.2.2","192.168.1.2","TCP","66","64000","5001  >  44570 [ACK] Seq=1 Ack=595129 Win=64000 Len=0 TSval=2037473783 TSecr=1373732807"
"449","4.973502","192.168.2.2","192.168.1.2","TCP","66","64000","5001  >  44570 [ACK] Seq=1 Ack=598025 Win=64000 Len=0 TSval=2037473808 TSecr=1373732832"
"451","4.997286","192.168.2.2","192.168.1.2","TCP","66","64000","5001  >  44570 [ACK] Seq=1 Ack=600921 Win=64000 Len=0 TSval=2037473831 TSecr=1373732855"
"454","5.021522","192.168.2.2","192.168.1.2","TCP","66","64000","5001  >  44570 [ACK] Seq=1 Ack=603817 Win=64000 Len=0 TSval=2037473856 TSecr=1373732880"
"457","5.046020","192.168.2.2","192.168.1.2","TCP","66","64000","5001  >  44570 [ACK] Seq=1 Ack=606713 Win=64000 Len=0 TSval=2037473880 TSecr=1373732904"
"459","5.070486","192.168.2.2","192.168.1.2","TCP","66","64000","5001  >  44570 [ACK] Seq=1 Ack=609609 Win=64000 Len=0 TSval=2037473905 TSecr=1373732928"
"462","5.094189","192.168.2.2","192.168.1.2","TCP","66","64000","5001  >  44570 [ACK] Seq=1 Ack=612505 Win=64000 Len=0 TSval=2037473928 TSecr=1373732952"
"464","5.118434","192.168.2.2","192.168.1.2","TCP","66","64000","5001  >  44570 [ACK] Seq=1 Ack=615401 Win=64000 Len=0 TSval=2037473952 TSecr=1373732977"
"466","5.143067","192.168.2.2","192.168.1.2","TCP","66","64000","5001  >  44570 [ACK] Seq=1 Ack=618297 Win=64000 Len=0 TSval=2037473977 TSecr=1373733000"
"470","5.178959","192.168.2.2","192.168.1.2","TCP","66","64000","5001  >  44570 [ACK] Seq=1 Ack=622641 Win=64000 Len=0 TSval=2037474013 TSecr=1373733005"
"473","5.216522","192.168.2.2","192.168.1.2","TCP","66","64000","5001  >  44570 [ACK] Seq=1 Ack=626985 Win=64000 Len=0 TSval=2037474051 TSecr=1373733049"
"476","5.241045","192.168.2.2","192.168.1.2","TCP","66","64000","5001  >  44570 [ACK] Seq=1 Ack=629881 Win=64000 Len=0 TSval=2037474075 TSecr=1373733074"
"478","5.264572","192.168.2.2","192.168.1.2","TCP","66","64000","5001  >  44570 [ACK] Seq=1 Ack=632777 Win=64000 Len=0 TSval=2037474099 TSecr=1373733097"
"480","5.289045","192.168.2.2","192.168.1.2","TCP","66","64000","5001  >  44570 [ACK] Seq=1 Ack=635673 Win=64000 Len=0 TSval=2037474123 TSecr=1373733122"
"482","5.312984","192.168.2.2","192.168.1.2","TCP","66","64000","5001  >  44570 [ACK] Seq=1 Ack=638569 Win=64000 Len=0 TSval=2037474147 TSecr=1373733146"
"484","5.338093","192.168.2.2","192.168.1.2","TCP","66","64000","5001  >  44570 [ACK] Seq=1 Ack=641465 Win=64000 Len=0 TSval=2037474172 TSecr=1373733182"
"486","5.362316","192.168.2.2","192.168.1.2","TCP","66","64000","5001  >  44570 [ACK] Seq=1 Ack=644361 Win=64000 Len=0 TSval=2037474196 TSecr=1373733220"
"488","5.387117","192.168.2.2","192.168.1.2","TCP","66","64000","5001  >  44570 [ACK] Seq=1 Ack=647257 Win=64000 Len=0 TSval=2037474221 TSecr=1373733220"
"490","5.410817","192.168.2.2","192.168.1.2","TCP","66","64000","5001  >  44570 [ACK] Seq=1 Ack=650153 Win=64000 Len=0 TSval=2037474245 TSecr=1373733244"
"492","5.435097","192.168.2.2","192.168.1.2","TCP","66","64000","5001  >  44570 [ACK] Seq=1 Ack=653049 Win=64000 Len=0 TSval=2037474269 TSecr=1373733268"
"494","5.459228","192.168.2.2","192.168.1.2","TCP","66","64000","5001  >  44570 [ACK] Seq=1 Ack=655945 Win=64000 Len=0 TSval=2037474293 TSecr=1373733292"
"496","5.483457","192.168.2.2","192.168.1.2","TCP","66","64000","5001  >  44570 [ACK] Seq=1 Ack=658841 Win=64000 Len=0 TSval=2037474317 TSecr=1373733316"
"498","5.507675","192.168.2.2","192.168.1.2","TCP","66","64000","5001  >  44570 [ACK] Seq=1 Ack=661737 Win=64000 Len=0 TSval=2037474342 TSecr=1373733341"
"500","5.531892","192.168.2.2","192.168.1.2","TCP","66","64000","5001  >  44570 [ACK] Seq=1 Ack=664633 Win=64000 Len=0 TSval=2037474366 TSecr=1373733365"
"502","5.556117","192.168.2.2","192.168.1.2","TCP","66","64000","5001  >  44570 [ACK] Seq=1 Ack=667529 Win=64000 Len=0 TSval=2037474390 TSecr=1373733390"
"504","5.581196","192.168.2.2","192.168.1.2","TCP","66","64000","5001  >  44570 [ACK] Seq=1 Ack=670425 Win=64000 Len=0 TSval=2037474415 TSecr=1373733414"
"506","5.604587","192.168.2.2","192.168.1.2","TCP","66","64000","5001  >  44570 [ACK] Seq=1 Ack=673321 Win=64000 Len=0 TSval=2037474438 TSecr=1373733438"
"508","5.628848","192.168.2.2","192.168.1.2","TCP","66","64000","5001  >  44570 [ACK] Seq=1 Ack=676217 Win=64000 Len=0 TSval=2037474463 TSecr=1373733462"
"510","5.653672","192.168.2.2","192.168.1.2","TCP","66","64000","5001  >  44570 [ACK] Seq=1 Ack=679113 Win=64000 Len=0 TSval=2037474487 TSecr=1373733486"
"513","5.677223","192.168.2.2","192.168.1.2","TCP","66","64000","5001  >  44570 [ACK] Seq=1 Ack=682009 Win=64000 Len=0 TSval=2037474511 TSecr=1373733511"
"515","5.701458","192.168.2.2","192.168.1.2","TCP","66","64000","5001  >  44570 [ACK] Seq=1 Ack=684905 Win=64000 Len=0 TSval=2037474535 TSecr=1373733535"
"517","5.726223","192.168.2.2","192.168.1.2","TCP","66","64000","5001  >  44570 [ACK] Seq=1 Ack=687801 Win=64000 Len=0 TSval=2037474560 TSecr=1373733559"
"519","5.750646","192.168.2.2","192.168.1.2","TCP","66","64000","5001  >  44570 [ACK] Seq=1 Ack=690697 Win=64000 Len=0 TSval=2037474584 TSecr=1373733584"
"521","5.774201","192.168.2.2","192.168.1.2","TCP","66","64000","5001  >  44570 [ACK] Seq=1 Ack=693593 Win=64000 Len=0 TSval=2037474608 TSecr=1373733607"
"523","5.798757","192.168.2.2","192.168.1.2","TCP","66","64000","5001  >  44570 [ACK] Seq=1 Ack=696489 Win=64000 Len=0 TSval=2037474632 TSecr=1373733632"
"525","5.822594","192.168.2.2","192.168.1.2","TCP","66","64000","5001  >  44570 [ACK] Seq=1 Ack=699385 Win=64000 Len=0 TSval=2037474656 TSecr=1373733657"
"527","5.846819","192.168.2.2","192.168.1.2","TCP","66","64000","5001  >  44570 [ACK] Seq=1 Ack=702281 Win=64000 Len=0 TSval=2037474680 TSecr=1373733680"
"529","5.871214","192.168.2.2","192.168.1.2","TCP","66","64000","5001  >  44570 [ACK] Seq=1 Ack=705177 Win=64000 Len=0 TSval=2037474705 TSecr=1373733704"
"531","5.895256","192.168.2.2","192.168.1.2","TCP","66","64000","5001  >  44570 [ACK] Seq=1 Ack=708073 Win=64000 Len=0 TSval=2037474729 TSecr=1373733729"
"533","5.920214","192.168.2.2","192.168.1.2","TCP","66","64000","5001  >  44570 [ACK] Seq=1 Ack=710969 Win=64000 Len=0 TSval=2037474754 TSecr=1373733753"
"536","5.943735","192.168.2.2","192.168.1.2","TCP","66","64000","5001  >  44570 [ACK] Seq=1 Ack=713865 Win=64000 Len=0 TSval=2037474777 TSecr=1373733777"
"538","5.968214","192.168.2.2","192.168.1.2","TCP","66","64000","5001  >  44570 [ACK] Seq=1 Ack=716761 Win=64000 Len=0 TSval=2037474802 TSecr=1373733802"
"540","5.992745","192.168.2.2","192.168.1.2","TCP","66","64000","5001  >  44570 [ACK] Seq=1 Ack=719657 Win=64000 Len=0 TSval=2037474826 TSecr=1373733825"
"542","6.016367","192.168.2.2","192.168.1.2","TCP","66","64000","5001  >  44570 [ACK] Seq=1 Ack=722553 Win=64000 Len=0 TSval=2037474850 TSecr=1373733850"
"545","6.040745","192.168.2.2","192.168.1.2","TCP","66","64000","5001  >  44570 [ACK] Seq=1 Ack=725449 Win=64000 Len=0 TSval=2037474874 TSecr=1373733874"
"547","6.065266","192.168.2.2","192.168.1.2","TCP","66","64000","5001  >  44570 [ACK] Seq=1 Ack=728345 Win=64000 Len=0 TSval=2037474899 TSecr=1373733898"
"549","6.089782","192.168.2.2","192.168.1.2","TCP","66","64000","5001  >  44570 [ACK] Seq=1 Ack=731241 Win=64000 Len=0 TSval=2037474923 TSecr=1373733923"
"551","6.113289","192.168.2.2","192.168.1.2","TCP","66","64000","5001  >  44570 [ACK] Seq=1 Ack=734137 Win=64000 Len=0 TSval=2037474947 TSecr=1373733946"
"553","6.137800","192.168.2.2","192.168.1.2","TCP","66","64000","5001  >  44570 [ACK] Seq=1 Ack=737033 Win=64000 Len=0 TSval=2037474971 TSecr=1373733971"
"555","6.162284","192.168.2.2","192.168.1.2","TCP","66","64000","5001  >  44570 [ACK] Seq=1 Ack=739929 Win=64000 Len=0 TSval=2037474996 TSecr=1373733995"
"557","6.185931","192.168.2.2","192.168.1.2","TCP","66","64000","5001  >  44570 [ACK] Seq=1 Ack=742825 Win=64000 Len=0 TSval=2037475019 TSecr=1373734019"
"560","6.210919","192.168.2.2","192.168.1.2","TCP","66","64000","5001  >  44570 [ACK] Seq=1 Ack=745721 Win=64000 Len=0 TSval=2037475044 TSecr=1373734043"
"562","6.235840","192.168.2.2","192.168.1.2","TCP","66","64000","5001  >  44570 [ACK] Seq=1 Ack=748617 Win=64000 Len=0 TSval=2037475069 TSecr=1373734068"
"564","6.259416","192.168.2.2","192.168.1.2","TCP","66","64000","5001  >  44570 [ACK] Seq=1 Ack=751513 Win=64000 Len=0 TSval=2037475093 TSecr=1373734092"
"566","6.283628","192.168.2.2","192.168.1.2","TCP","66","64000","5001  >  44570 [ACK] Seq=1 Ack=754409 Win=64000 Len=0 TSval=2037475117 TSecr=1373734116"
"568","6.307825","192.168.2.2","192.168.1.2","TCP","66","69632","5001  >  44570 [ACK] Seq=1 Ack=757305 Win=69632 Len=0 TSval=2037475141 TSecr=1373734140"
"570","6.332059","192.168.2.2","192.168.1.2","TCP","66","69632","5001  >  44570 [ACK] Seq=1 Ack=760201 Win=69632 Len=0 TSval=2037475165 TSecr=1373734165"
"572","6.356337","192.168.2.2","192.168.1.2","TCP","66","69632","5001  >  44570 [ACK] Seq=1 Ack=763097 Win=69632 Len=0 TSval=2037475190 TSecr=1373734188"
"574","6.380798","192.168.2.2","192.168.1.2","TCP","66","69632","5001  >  44570 [ACK] Seq=1 Ack=765993 Win=69632 Len=0 TSval=2037475214 TSecr=1373734213"
